[I 2025-06-12 04:04:48,420] Trial 4 finished with value: 0.3736149584487535 and parameters: {'hidden_dim': 198, 'latent_dim': 39, 'beta': 1.8000467839667915, 'gamma': 1.701120127259362, 'dropout_rate': 0.15987408471213316, 'lr': 0.007087015894940972, 'scheduler_patience': 4, 'class_weight': 1.7977976631047612, 'activation': 'LeakyReLU', 'classification_multiplier': 8312.517288706484}. Best is trial 0 with value: 0.4577562326869806.
/home/ubuntu/frb-analysis/.frb-analysis/lib/python3.12/site-packages/sklearn/metrics/_classification.py:1565: UndefinedMetricWarning: Precision is ill-defined and being set to 0.0 in labels with no predicted samples. Use `zero_division` parameter to control this behavior.
  _warn_prf(average, modifier, f"{metric.capitalize()} is", len(result))
/home/ubuntu/frb-analysis/.frb-analysis/lib/python3.12/site-packages/sklearn/metrics/_classification.py:1565: UndefinedMetricWarning: Precision is ill-defined and being set to 0.0 in labels with no predicted samples. Use `zero_division` parameter to control this behavior.
  _warn_prf(average, modifier, f"{metric.capitalize()} is", len(result))
/home/ubuntu/frb-analysis/.frb-analysis/lib/python3.12/site-packages/sklearn/metrics/_classification.py:1565: UndefinedMetricWarning: Precision is ill-defined and being set to 0.0 in labels with no predicted samples. Use `zero_division` parameter to control this behavior.
  _warn_prf(average, modifier, f"{metric.capitalize()} is", len(result))
/home/ubuntu/frb-analysis/.frb-analysis/lib/python3.12/site-packages/sklearn/metrics/_classification.py:1565: UndefinedMetricWarning: Precision is ill-defined and being set to 0.0 in labels with no predicted samples. Use `zero_division` parameter to control this behavior.
  _warn_prf(average, modifier, f"{metric.capitalize()} is", len(result))
/home/ubuntu/frb-analysis/.frb-analysis/lib/python3.12/site-packages/sklearn/metrics/_classification.py:1565: UndefinedMetricWarning: Precision is ill-defined and being set to 0.0 in labels with no predicted samples. Use `zero_division` parameter to control this behavior.
  _warn_prf(average, modifier, f"{metric.capitalize()} is", len(result))
/home/ubuntu/frb-analysis/.frb-analysis/lib/python3.12/site-packages/sklearn/metrics/_classification.py:1565: UndefinedMetricWarning: Precision is ill-defined and being set to 0.0 in labels with no predicted samples. Use `zero_division` parameter to control this behavior.
  _warn_prf(average, modifier, f"{metric.capitalize()} is", len(result))
/home/ubuntu/frb-analysis/.frb-analysis/lib/python3.12/site-packages/sklearn/metrics/_classification.py:1565: UndefinedMetricWarning: Precision is ill-defined and being set to 0.0 in labels with no predicted samples. Use `zero_division` parameter to control this behavior.
  _warn_prf(average, modifier, f"{metric.capitalize()} is", len(result))
/home/ubuntu/frb-analysis/.frb-analysis/lib/python3.12/site-packages/sklearn/metrics/_classification.py:1565: UndefinedMetricWarning: Precision is ill-defined and being set to 0.0 in labels with no predicted samples. Use `zero_division` parameter to control this behavior.
  _warn_prf(average, modifier, f"{metric.capitalize()} is", len(result))
/home/ubuntu/frb-analysis/.frb-analysis/lib/python3.12/site-packages/sklearn/metrics/_classification.py:1565: UndefinedMetricWarning: Precision is ill-defined and being set to 0.0 in labels with no predicted samples. Use `zero_division` parameter to control this behavior.
  _warn_prf(average, modifier, f"{metric.capitalize()} is", len(result))
0.0865650969529086
Trial 1: hidden_dim=1735, latent_dim=37, beta=1.3016535795702617, gamma=0.32166664253122623, dropout_rate=0.44393640720377714, lr=0.008438191444556459, scheduler_patience=2, class_weight=0.639740594538863, activation=SELU, classification_multiplier=13266.813393681039

=== Fold 1/5 ===
Validation Accuracy: 0.4276
Classification Report:
               precision    recall  f1-score   support

Non-Repeater       0.13      1.00      0.23       149
    Repeater       1.00      0.37      0.54      1584

    accuracy                           0.43      1733
   macro avg       0.57      0.69      0.39      1733
weighted avg       0.93      0.43      0.52      1733

Confusion Matrix:
 [[149   0]
 [992 592]]

=== Fold 2/5 ===
Validation Accuracy: 0.4916
Classification Report:
               precision    recall  f1-score   support

Non-Repeater       0.14      0.99      0.25       150
    Repeater       1.00      0.44      0.61      1583

    accuracy                           0.49      1733
   macro avg       0.57      0.72      0.43      1733
weighted avg       0.92      0.49      0.58      1733

Confusion Matrix:
 [[149   1]
 [880 703]]

=== Fold 3/5 ===
Validation Accuracy: 0.4183
Classification Report:
               precision    recall  f1-score   support

Non-Repeater       0.13      0.99      0.23       150
    Repeater       1.00      0.36      0.53      1583

    accuracy                           0.42      1733
   macro avg       0.56      0.68      0.38      1733
weighted avg       0.92      0.42      0.51      1733

Confusion Matrix:
 [[ 148    2]
 [1006  577]]

=== Fold 4/5 ===
Validation Accuracy: 0.2943
Classification Report:
               precision    recall  f1-score   support

Non-Repeater       0.11      0.99      0.20       150
    Repeater       1.00      0.23      0.37      1583

    accuracy                           0.29      1733
   macro avg       0.55      0.61      0.28      1733
weighted avg       0.92      0.29      0.36      1733

Confusion Matrix:
 [[ 149    1]
 [1222  361]]

=== Fold 5/5 ===
Validation Accuracy: 0.5855
Classification Report:
               precision    recall  f1-score   support

Non-Repeater       0.17      0.99      0.29       149
    Repeater       1.00      0.55      0.71      1583

    accuracy                           0.59      1732
   macro avg       0.58      0.77      0.50      1732
weighted avg       0.93      0.59      0.67      1732

Confusion Matrix:
 [[147   2]
 [716 867]]


=== Summary ===
Total False Positives: 6
Total False Negatives: 4816
Total True Positives: 3100
Total True Negatives: 742

Confusion Matrix (with duplicates):
              Non-Repeater  Repeater
Non-Repeater         742.0       6.0
Repeater            4816.0    3100.0
accuracy_score
0.44344413665743304
Trial 1: hidden_dim=452, latent_dim=18, beta=1.0383324742329447, gamma=0.2361153704867974, dropout_rate=0.1131868986944248, lr=0.0008612682072617264, scheduler_patience=4, class_weight=0.9945413498384007, activation=GELU, classification_multiplier=10986.600771801252

=== Fold 1/5 ===
Validation Accuracy: 0.3785
Classification Report:
               precision    recall  f1-score   support

Non-Repeater       0.12      1.00      0.22       149
    Repeater       1.00      0.32      0.48      1584

    accuracy                           0.38      1733
   macro avg       0.56      0.66      0.35      1733
weighted avg       0.92      0.38      0.46      1733

Confusion Matrix:
 [[ 149    0]
 [1077  507]]

=== Fold 2/5 ===
Validation Accuracy: 0.5257
Classification Report:
               precision    recall  f1-score   support

Non-Repeater       0.15      1.00      0.27       150
    Repeater       1.00      0.48      0.65      1583

    accuracy                           0.53      1733
   macro avg       0.58      0.74      0.46      1733
weighted avg       0.93      0.53      0.62      1733

Confusion Matrix:
 [[150   0]
 [822 761]]

=== Fold 3/5 ===
Validation Accuracy: 0.3930
Classification Report:
               precision    recall  f1-score   support

Non-Repeater       0.12      1.00      0.22       150
    Repeater       1.00      0.34      0.50      1583

    accuracy                           0.39      1733
   macro avg       0.56      0.67      0.36      1733
weighted avg       0.92      0.39      0.48      1733

Confusion Matrix:
 [[ 150    0]
 [1052  531]]

=== Fold 4/5 ===
Validation Accuracy: 0.1691
Classification Report:
               precision    recall  f1-score   support

Non-Repeater       0.09      0.99      0.17       150
    Repeater       0.99      0.09      0.17      1583

    accuracy                           0.17      1733
   macro avg       0.54      0.54      0.17      1733
weighted avg       0.92      0.17      0.17      1733

Confusion Matrix:
 [[ 149    1]
 [1439  144]]

=== Fold 5/5 ===
Validation Accuracy: 0.4018
Classification Report:
               precision    recall  f1-score   support

Non-Repeater       0.13      1.00      0.22       149
    Repeater       1.00      0.35      0.51      1583

    accuracy                           0.40      1732
   macro avg       0.56      0.67      0.37      1732
weighted avg       0.92      0.40      0.49      1732

Confusion Matrix:
 [[ 149    0]
 [1036  547]]


=== Summary ===
Total False Positives: 1
Total False Negatives: 5426
Total True Positives: 2490
Total True Negatives: 747

Confusion Matrix (with duplicates):
              Non-Repeater  Repeater
Non-Repeater         747.0       1.0
Repeater            5426.0    2490.0
accuracy_score
0.3736149584487535
Trial 1: hidden_dim=198, latent_dim=39, beta=1.8000467839667915, gamma=1.701120127259362, dropout_rate=0.15987408471213316, lr=0.007087015894940972, scheduler_patience=4, class_weight=1.7977976631047612, activation=LeakyReLU, classification_multiplier=8312.517288706484

=== Fold 1/5 ===
Validation Accuracy: 0.0860
Classification Report:
               precision    recall  f1-score   support

Non-Repeater       0.09      1.00      0.16       149
    Repeater       0.00      0.00      0.00      1584

    accuracy                           0.09      1733
   macro avg       0.04      0.50      0.08      1733
weighted avg       0.01      0.09      0.01      1733

Confusion Matrix:
 [[ 149    0]
 [1584    0]]

=== Fold 2/5 ===
Validation Accuracy: 0.0866
Classification Report:
               precision    recall  f1-score   support

Non-Repeater       0.09      1.00      0.16       150
    Repeater       0.00      0.00      0.00      1583

    accuracy                           0.09      1733
   macro avg       0.04      0.50      0.08      1733
weighted avg       0.01      0.09      0.01      1733

Confusion Matrix:
 [[ 150    0]
 [1583    0]]

=== Fold 3/5 ===
Validation Accuracy: 0.0900
Classification Report:
               precision    recall  f1-score   support

Non-Repeater       0.09      1.00      0.16       150
    Repeater       1.00      0.00      0.01      1583

    accuracy                           0.09      1733
   macro avg       0.54      0.50      0.08      1733
weighted avg       0.92      0.09      0.02      1733

Confusion Matrix:
 [[ 150    0]
 [1577    6]]

=== Fold 4/5 ===
Validation Accuracy: 0.2545
Classification Report:
               precision    recall  f1-score   support

Non-Repeater       0.10      1.00      0.19       150
    Repeater       1.00      0.18      0.31      1583

    accuracy                           0.25      1733
   macro avg       0.55      0.59      0.25      1733
weighted avg       0.92      0.25      0.30      1733

Confusion Matrix:
 [[ 150    0]
 [1292  291]]

=== Fold 5/5 ===
Validation Accuracy: 0.0860
Classification Report:
               precision    recall  f1-score   support

Non-Repeater       0.09      1.00      0.16       149
    Repeater       0.00      0.00      0.00      1583

    accuracy                           0.09      1732
   macro avg       0.04      0.50      0.08      1732
weighted avg       0.01      0.09      0.01      1732

Confusion Matrix:
 [[ 149    0]
 [1583    0]]


=== Summary ===
Total False Positives: 0
Total False Negatives: 7619
Total True Positives: 297
Total True Negatives: 748
[I 2025-06-12 04:11:52,296] Trial 5 finished with value: 0.1206140350877193 and parameters: {'hidden_dim': 1786, 'latent_dim': 16, 'beta': 0.9467773005531392, 'gamma': 0.25237552441151545, 'dropout_rate': 0.3626927526364896, 'lr': 0.0028474007452730047, 'scheduler_patience': 6, 'class_weight': 2.18913119354497, 'activation': 'ELU', 'classification_multiplier': 11234.091335753572}. Best is trial 0 with value: 0.4577562326869806.
/home/ubuntu/frb-analysis/.frb-analysis/lib/python3.12/site-packages/sklearn/metrics/_classification.py:1565: UndefinedMetricWarning: Precision is ill-defined and being set to 0.0 in labels with no predicted samples. Use `zero_division` parameter to control this behavior.
  _warn_prf(average, modifier, f"{metric.capitalize()} is", len(result))
/home/ubuntu/frb-analysis/.frb-analysis/lib/python3.12/site-packages/sklearn/metrics/_classification.py:1565: UndefinedMetricWarning: Precision is ill-defined and being set to 0.0 in labels with no predicted samples. Use `zero_division` parameter to control this behavior.
  _warn_prf(average, modifier, f"{metric.capitalize()} is", len(result))
/home/ubuntu/frb-analysis/.frb-analysis/lib/python3.12/site-packages/sklearn/metrics/_classification.py:1565: UndefinedMetricWarning: Precision is ill-defined and being set to 0.0 in labels with no predicted samples. Use `zero_division` parameter to control this behavior.
  _warn_prf(average, modifier, f"{metric.capitalize()} is", len(result))
/home/ubuntu/frb-analysis/.frb-analysis/lib/python3.12/site-packages/sklearn/metrics/_classification.py:1565: UndefinedMetricWarning: Precision is ill-defined and being set to 0.0 in labels with no predicted samples. Use `zero_division` parameter to control this behavior.
  _warn_prf(average, modifier, f"{metric.capitalize()} is", len(result))
/home/ubuntu/frb-analysis/.frb-analysis/lib/python3.12/site-packages/sklearn/metrics/_classification.py:1565: UndefinedMetricWarning: Precision is ill-defined and being set to 0.0 in labels with no predicted samples. Use `zero_division` parameter to control this behavior.
  _warn_prf(average, modifier, f"{metric.capitalize()} is", len(result))
/home/ubuntu/frb-analysis/.frb-analysis/lib/python3.12/site-packages/sklearn/metrics/_classification.py:1565: UndefinedMetricWarning: Precision is ill-defined and being set to 0.0 in labels with no predicted samples. Use `zero_division` parameter to control this behavior.
  _warn_prf(average, modifier, f"{metric.capitalize()} is", len(result))
/home/ubuntu/frb-analysis/.frb-analysis/lib/python3.12/site-packages/sklearn/metrics/_classification.py:1565: UndefinedMetricWarning: Precision is ill-defined and being set to 0.0 in labels with no predicted samples. Use `zero_division` parameter to control this behavior.
  _warn_prf(average, modifier, f"{metric.capitalize()} is", len(result))
/home/ubuntu/frb-analysis/.frb-analysis/lib/python3.12/site-packages/sklearn/metrics/_classification.py:1565: UndefinedMetricWarning: Precision is ill-defined and being set to 0.0 in labels with no predicted samples. Use `zero_division` parameter to control this behavior.
  _warn_prf(average, modifier, f"{metric.capitalize()} is", len(result))
/home/ubuntu/frb-analysis/.frb-analysis/lib/python3.12/site-packages/sklearn/metrics/_classification.py:1565: UndefinedMetricWarning: Precision is ill-defined and being set to 0.0 in labels with no predicted samples. Use `zero_division` parameter to control this behavior.
  _warn_prf(average, modifier, f"{metric.capitalize()} is", len(result))
/home/ubuntu/frb-analysis/.frb-analysis/lib/python3.12/site-packages/sklearn/metrics/_classification.py:1565: UndefinedMetricWarning: Precision is ill-defined and being set to 0.0 in labels with no predicted samples. Use `zero_division` parameter to control this behavior.
  _warn_prf(average, modifier, f"{metric.capitalize()} is", len(result))
/home/ubuntu/frb-analysis/.frb-analysis/lib/python3.12/site-packages/sklearn/metrics/_classification.py:1565: UndefinedMetricWarning: Precision is ill-defined and being set to 0.0 in labels with no predicted samples. Use `zero_division` parameter to control this behavior.
  _warn_prf(average, modifier, f"{metric.capitalize()} is", len(result))
/home/ubuntu/frb-analysis/.frb-analysis/lib/python3.12/site-packages/sklearn/metrics/_classification.py:1565: UndefinedMetricWarning: Precision is ill-defined and being set to 0.0 in labels with no predicted samples. Use `zero_division` parameter to control this behavior.
  _warn_prf(average, modifier, f"{metric.capitalize()} is", len(result))
[I 2025-06-12 04:17:21,336] Trial 6 finished with value: 0.08898891966759002 and parameters: {'hidden_dim': 324, 'latent_dim': 37, 'beta': 0.3020924668221476, 'gamma': 1.5459022192092853, 'dropout_rate': 0.40462950464473324, 'lr': 0.006739504536532631, 'scheduler_patience': 3, 'class_weight': 0.7937976345258315, 'activation': 'ELU', 'classification_multiplier': 9561.306530344955}. Best is trial 0 with value: 0.4577562326869806.
