[I 2025-06-12 07:16:26,846] Trial 36 finished with value: 0.685595567867036 and parameters: {'hidden_dim': 1126, 'latent_dim': 24, 'beta': 0.6755468970089402, 'gamma': 1.1315193119938858, 'dropout_rate': 0.10033939632799085, 'lr': 0.0006196316848413038, 'scheduler_patience': 7, 'class_weight': 1.656694709664797, 'activation': 'LeakyReLU', 'classification_multiplier': 5005.315015829209}. Best is trial 22 with value: 0.7070637119113573.
              precision    recall  f1-score   support

Non-Repeater       0.11      1.00      0.20       149
    Repeater       1.00      0.24      0.39      1583

    accuracy                           0.30      1732
   macro avg       0.56      0.62      0.29      1732
weighted avg       0.92      0.30      0.37      1732

Confusion Matrix:
 [[ 149    0]
 [1204  379]]


=== Summary ===
Total False Positives: 1
Total False Negatives: 6755
Total True Positives: 1161
Total True Negatives: 747

Confusion Matrix (with duplicates):
              Non-Repeater  Repeater
Non-Repeater         747.0       1.0
Repeater            6755.0    1161.0
accuracy_score
0.22022160664819945
Trial 1: hidden_dim=913, latent_dim=21, beta=1.380675831037491, gamma=0.14385348980960722, dropout_rate=0.16873585161956056, lr=0.002575353870884277, scheduler_patience=7, class_weight=1.4175589093818153, activation=SELU, classification_multiplier=9153.28651990452

=== Fold 1/5 ===
Validation Accuracy: 0.6128
Classification Report:
               precision    recall  f1-score   support

Non-Repeater       0.18      0.99      0.31       149
    Repeater       1.00      0.58      0.73      1584

    accuracy                           0.61      1733
   macro avg       0.59      0.79      0.52      1733
weighted avg       0.93      0.61      0.69      1733

Confusion Matrix:
 [[148   1]
 [670 914]]

=== Fold 2/5 ===
Validation Accuracy: 0.3451
Classification Report:
               precision    recall  f1-score   support

Non-Repeater       0.12      1.00      0.21       150
    Repeater       1.00      0.28      0.44      1583

    accuracy                           0.35      1733
   macro avg       0.56      0.64      0.33      1733
weighted avg       0.92      0.35      0.42      1733

Confusion Matrix:
 [[ 150    0]
 [1135  448]]

=== Fold 3/5 ===
Validation Accuracy: 0.5574
Classification Report:
               precision    recall  f1-score   support

Non-Repeater       0.16      0.99      0.28       150
    Repeater       1.00      0.52      0.68      1583

    accuracy                           0.56      1733
   macro avg       0.58      0.75      0.48      1733
weighted avg       0.93      0.56      0.65      1733

Confusion Matrix:
 [[149   1]
 [766 817]]

=== Fold 4/5 ===
Validation Accuracy: 0.6469
Classification Report:
               precision    recall  f1-score   support

Non-Repeater       0.20      0.99      0.33       150
    Repeater       1.00      0.61      0.76      1583

    accuracy                           0.65      1733
   macro avg       0.60      0.80      0.54      1733
weighted avg       0.93      0.65      0.72      1733

Confusion Matrix:
 [[149   1]
 [611 972]]

=== Fold 5/5 ===
Validation Accuracy: 0.6622
Classification Report:
               precision    recall  f1-score   support

Non-Repeater       0.20      0.99      0.33       149
    Repeater       1.00      0.63      0.77      1583

    accuracy                           0.66      1732
   macro avg       0.60      0.81      0.55      1732
weighted avg       0.93      0.66      0.74      1732

Confusion Matrix:
 [[ 147    2]
 [ 583 1000]]


=== Summary ===
Total False Positives: 5
Total False Negatives: 3765
Total True Positives: 4151
Total True Negatives: 743

Confusion Matrix (with duplicates):
              Non-Repeater  Repeater
Non-Repeater         743.0       5.0
Repeater            3765.0    4151.0
accuracy_score
0.5648661126500462
Trial 1: hidden_dim=1323, latent_dim=34, beta=1.3986776152775888, gamma=0.6346533283101324, dropout_rate=0.1957147658596943, lr=0.0012562622073313944, scheduler_patience=6, class_weight=1.0065588417502367, activation=ReLU, classification_multiplier=8461.437763728354

=== Fold 1/5 ===
Validation Accuracy: 0.7040
Classification Report:
               precision    recall  f1-score   support

Non-Repeater       0.23      1.00      0.37       149
    Repeater       1.00      0.68      0.81      1584

    accuracy                           0.70      1733
   macro avg       0.61      0.84      0.59      1733
weighted avg       0.93      0.70      0.77      1733

Confusion Matrix:
 [[ 149    0]
 [ 513 1071]]

=== Fold 2/5 ===
Validation Accuracy: 0.6278
Classification Report:
               precision    recall  f1-score   support

Non-Repeater       0.19      0.99      0.32       150
    Repeater       1.00      0.59      0.74      1583

    accuracy                           0.63      1733
   macro avg       0.59      0.79      0.53      1733
weighted avg       0.93      0.63      0.71      1733

Confusion Matrix:
 [[149   1]
 [644 939]]

=== Fold 3/5 ===
Validation Accuracy: 0.6590
Classification Report:
               precision    recall  f1-score   support

Non-Repeater       0.20      0.99      0.34       150
    Repeater       1.00      0.63      0.77      1583

    accuracy                           0.66      1733
   macro avg       0.60      0.81      0.55      1733
weighted avg       0.93      0.66      0.73      1733

Confusion Matrix:
 [[149   1]
 [590 993]]

=== Fold 4/5 ===
Validation Accuracy: 0.6503
Classification Report:
               precision    recall  f1-score   support

Non-Repeater       0.20      0.99      0.33       150
    Repeater       1.00      0.62      0.76      1583

    accuracy                           0.65      1733
   macro avg       0.60      0.81      0.55      1733
weighted avg       0.93      0.65      0.73      1733

Confusion Matrix:
 [[149   1]
 [605 978]]

=== Fold 5/5 ===
Validation Accuracy: 0.7870
Classification Report:
               precision    recall  f1-score   support

Non-Repeater       0.29      0.98      0.44       149
    Repeater       1.00      0.77      0.87      1583

    accuracy                           0.79      1732
   macro avg       0.64      0.87      0.66      1732
weighted avg       0.94      0.79      0.83      1732

Confusion Matrix:
 [[ 146    3]
 [ 366 1217]]


=== Summary ===
Total False Positives: 6
Total False Negatives: 2718
Total True Positives: 5198
Total True Negatives: 742

Confusion Matrix (with duplicates):
              Non-Repeater  Repeater
Non-Repeater         742.0       6.0
Repeater            2718.0    5198.0
accuracy_score
0.685595567867036
Trial 1: hidden_dim=1126, latent_dim=24, beta=0.6755468970089402, gamma=1.1315193119938858, dropout_rate=0.10033939632799085, lr=0.0006196316848413038, scheduler_patience=7, class_weight=1.656694709664797, activation=LeakyReLU, classification_multiplier=5005.315015829209

=== Fold 1/5 ===
Validation Accuracy: 0.6422
Classification Report:
               precision    recall  f1-score   support

Non-Repeater       0.19      1.00      0.32       149
    Repeater       1.00      0.61      0.76      1584

    accuracy                           0.64      1733
   macro avg       0.60      0.80      0.54      1733
weighted avg       0.93      0.64      0.72      1733

Confusion Matrix:
 [[149   0]
 [620 964]]

=== Fold 2/5 ===
Validation Accuracy: 0.4662
Classification Report:
               precision    recall  f1-score   support

Non-Repeater       0.14      0.99      0.24       150
    Repeater       1.00      0.42      0.59      1583

    accuracy                           0.47      1733
   macro avg       0.57      0.70      0.42      1733
weighted avg       0.92      0.47      0.56      1733

Confusion Matrix:
 [[149   1]
 [924 659]]

=== Fold 3/5 ===
Validation Accuracy: 0.6994
Classification Report:
               precision    recall  f1-score   support

Non-Repeater       0.22      0.99      0.36       150
    Repeater       1.00      0.67      0.80      1583

    accuracy                           0.70      1733
   macro avg       0.61      0.83      0.58      1733
weighted avg       0.93      0.70      0.77      1733

Confusion Matrix:
 [[ 148    2]
 [ 519 1064]]

=== Fold 4/5 ===
Validation Accuracy: 0.6134
Classification Report:
 [I 2025-06-12 07:21:59,697] Trial 37 finished with value: 0.6244228993536473 and parameters: {'hidden_dim': 716, 'latent_dim': 20, 'beta': 0.6546824143338492, 'gamma': 1.137537412158196, 'dropout_rate': 0.10876442929381663, 'lr': 0.001488455063823827, 'scheduler_patience': 5, 'class_weight': 2.1069249735793543, 'activation': 'LeakyReLU', 'classification_multiplier': 5055.671087314847}. Best is trial 22 with value: 0.7070637119113573.
[I 2025-06-12 07:27:29,711] Trial 38 finished with value: 0.6008771929824561 and parameters: {'hidden_dim': 260, 'latent_dim': 24, 'beta': 0.5174513441090361, 'gamma': 0.7253277985641279, 'dropout_rate': 0.12666856700130463, 'lr': 0.0006988114569559331, 'scheduler_patience': 6, 'class_weight': 1.8732343239064217, 'activation': 'LeakyReLU', 'classification_multiplier': 5866.44225424396}. Best is trial 22 with value: 0.7070637119113573.
[I 2025-06-12 07:33:00,235] Trial 39 finished with value: 0.2646583564173592 and parameters: {'hidden_dim': 354, 'latent_dim': 18, 'beta': 0.9863823249895576, 'gamma': 0.38724048916393555, 'dropout_rate': 0.14532348754260088, 'lr': 0.008069825668482664, 'scheduler_patience': 7, 'class_weight': 0.872133328738152, 'activation': 'LeakyReLU', 'classification_multiplier': 9831.024798928798}. Best is trial 22 with value: 0.7070637119113573.
              precision    recall  f1-score   support

Non-Repeater       0.18      0.99      0.31       150
    Repeater       1.00      0.58      0.73      1583

    accuracy                           0.61      1733
   macro avg       0.59      0.78      0.52      1733
weighted avg       0.93      0.61      0.70      1733

Confusion Matrix:
 [[148   2]
 [668 915]]

=== Fold 5/5 ===
Validation Accuracy: 0.7009
Classification Report:
               precision    recall  f1-score   support

Non-Repeater       0.22      0.99      0.36       149
    Repeater       1.00      0.67      0.80      1583

    accuracy                           0.70      1732
   macro avg       0.61      0.83      0.58      1732
weighted avg       0.93      0.70      0.77      1732

Confusion Matrix:
 [[ 147    2]
 [ 516 1067]]


=== Summary ===
Total False Positives: 7
Total False Negatives: 3247
Total True Positives: 4669
Total True Negatives: 741

Confusion Matrix (with duplicates):
              Non-Repeater  Repeater
Non-Repeater         741.0       7.0
Repeater            3247.0    4669.0
accuracy_score
0.6244228993536473
Trial 1: hidden_dim=716, latent_dim=20, beta=0.6546824143338492, gamma=1.137537412158196, dropout_rate=0.10876442929381663, lr=0.001488455063823827, scheduler_patience=5, class_weight=2.1069249735793543, activation=LeakyReLU, classification_multiplier=5055.671087314847

=== Fold 1/5 ===
Validation Accuracy: 0.5886
Classification Report:
               precision    recall  f1-score   support

Non-Repeater       0.17      1.00      0.29       149
    Repeater       1.00      0.55      0.71      1584

    accuracy                           0.59      1733
   macro avg       0.59      0.77      0.50      1733
weighted avg       0.93      0.59      0.67      1733

Confusion Matrix:
 [[149   0]
 [713 871]]

=== Fold 2/5 ===
Validation Accuracy: 0.5915
Classification Report:
               precision    recall  f1-score   support

Non-Repeater       0.17      0.99      0.30       150
    Repeater       1.00      0.55      0.71      1583

    accuracy                           0.59      1733
   macro avg       0.59      0.77      0.50      1733
weighted avg       0.93      0.59      0.68      1733

Confusion Matrix:
 [[149   1]
 [707 876]]

=== Fold 3/5 ===
Validation Accuracy: 0.5822
Classification Report:
               precision    recall  f1-score   support

Non-Repeater       0.17      0.99      0.29       150
    Repeater       1.00      0.54      0.70      1583

    accuracy                           0.58      1733
   macro avg       0.58      0.77      0.50      1733
weighted avg       0.93      0.58      0.67      1733

Confusion Matrix:
 [[149   1]
 [723 860]]

=== Fold 4/5 ===
Validation Accuracy: 0.5563
Classification Report:
               precision    recall  f1-score   support

Non-Repeater       0.16      0.99      0.28       150
    Repeater       1.00      0.51      0.68      1583

    accuracy                           0.56      1733
   macro avg       0.58      0.75      0.48      1733
weighted avg       0.93      0.56      0.64      1733

Confusion Matrix:
 [[149   1]
 [768 815]]

=== Fold 5/5 ===
Validation Accuracy: 0.6859
Classification Report:
               precision    recall  f1-score   support

Non-Repeater       0.21      0.99      0.35       149
    Repeater       1.00      0.66      0.79      1583

    accuracy                           0.69      1732
   macro avg       0.61      0.82      0.57      1732
weighted avg       0.93      0.69      0.75      1732

Confusion Matrix:
 [[ 147    2]
 [ 542 1041]]


=== Summary ===
Total False Positives: 5
Total False Negatives: 3453
Total True Positives: 4463
Total True Negatives: 743

Confusion Matrix (with duplicates):
              Non-Repeater  Repeater
Non-Repeater         743.0       5.0
Repeater            3453.0    4463.0
accuracy_score
0.6008771929824561
Trial 1: hidden_dim=260, latent_dim=24, beta=0.5174513441090361, gamma=0.7253277985641279, dropout_rate=0.12666856700130463, lr=0.0006988114569559331, scheduler_patience=6, class_weight=1.8732343239064217, activation=LeakyReLU, classification_multiplier=5866.44225424396

=== Fold 1/5 ===
Validation Accuracy: 0.2579
Classification Report:
               precision    recall  f1-score   support

Non-Repeater       0.10      0.99      0.19       149
    Repeater       1.00      0.19      0.32      1584

    accuracy                           0.26      1733
   macro avg       0.55      0.59      0.25      1733
weighted avg       0.92      0.26      0.31      1733

Confusion Matrix:
 [[ 148    1]
 [1285  299]]

=== Fold 2/5 ===
Validation Accuracy: 0.4328
Classification Report:
               precision    recall  f1-score   support

Non-Repeater       0.13      1.00      0.23       150
    Repeater       1.00      0.38      0.55      1583

    accuracy                           0.43      1733
   macro avg       0.57      0.69      0.39      1733
weighted avg       0.92      0.43      0.52      1733

Confusion Matrix:
 [[150   0]
 [983 600]]

=== Fold 3/5 ===
Validation Accuracy: 0.1016
Classification Report:
               precision    recall  f1-score   support

Non-Repeater       0.09      1.00      0.16       150
    Repeater       1.00      0.02      0.03      1583

    accuracy                           0.10      1733
   macro avg       0.54      0.51      0.10      1733
weighted avg       0.92      0.10      0.04      1733

Confusion Matrix:
 [[ 150    0]
 [1557   26]]

=== Fold 4/5 ===
Validation Accuracy: 0.3174
Classification Report:
               precision    recall  f1-score   support

Non-Repeater       0.11      0.99      0.20       150
    Repeater       1.00      0.25      0.40      1583

    accuracy                           0.32      1733
   macro avg       0.55      0.62      0.30      1733
weighted avg       0.92      0.32      0.39      1733

Confusion Matrix:
 [[ 149    1]
 [1182  401]]

=== Fold 5/5 ===
Validation Accuracy: 0.2136
Classification Report:
               precision    recall  f1-score   support

Non-Repeater       0.10      1.00      0.18       149
    Repeater       1.00      0.14      0.25      1583

    accuracy                           0.21      1732
   macro avg       0.55      0.57      0.21      1732
weighted avg       0.92      0.21      0.24      1732

Confusion Matrix:
 [[ 149    0]
 [1362  221]]


=== Summary ===
Total False Positives: 2
Total False Negatives: 6369
Total True Positives: 1547
Total True Negatives: 746

Confusion Matrix (with duplicates):
              Non-Repeater  Repeater
Non-Repeater         746.0       2.0
Repeater            6369.0    1547.0
accuracy_score
0.2646583564173592
Trial 1: hidden_dim=354, latent_dim=18, beta=0.9863823249895576, gamma=0.38724048916393555, dropout_rate=0.14532348754260088, lr=0.008069825668482664, scheduler_patience=7, class_weight=0.872133328738152, activation=LeakyReLU, classification_multiplier=9831.024798928798

=== Fold 1/5 ===
Validation Accuracy: 0.2424
Classification Report:
               precision    recall  f1-score   support

Non-Repeater       0.10      1.00      0.18       149
    Repeater       1.00      0.17      0.29      1584

    accuracy                           0.24      1733
   macro avg       0.55      0.59      0.24      1733
weighted avg       0.92      0.24      0.28      1733

Confusion Matrix:
 [[ 149    0]
 [1313  271]]

=== Fold 2/5 ===
Validation Accuracy: 0.3410
Classification Report:
               precision    recall  f1-score   support

Non-Repeater       0.12      1.00      0.21       150
    Repeater       1.00      0.28      0.44      1583

    accuracy                           0.34      1733
   macro avg       0.56      0.64      0.32      1733
weighted avg       0.92      0.34      0.42      1733

Confusion Matrix:
 [[ 150    0]
 [1142  441]]

=== Fold 3/5 ===
Validation Accuracy: 0.3364
Classification Report:
 [I 2025-06-12 07:38:38,461] Trial 40 finished with value: 0.29074330563250234 and parameters: {'hidden_dim': 873, 'latent_dim': 15, 'beta': 0.8672967731427044, 'gamma': 0.9512140665996467, 'dropout_rate': 0.15742681780969847, 'lr': 0.002676934784266159, 'scheduler_patience': 6, 'class_weight': 0.5190671352035798, 'activation': 'ELU', 'classification_multiplier': 6701.8153182106}. Best is trial 22 with value: 0.7070637119113573.
[I 2025-06-12 07:44:33,958] Trial 41 finished with value: 0.5708679593721145 and parameters: {'hidden_dim': 1088, 'latent_dim': 26, 'beta': 1.237654055400459, 'gamma': 0.5669325045739697, 'dropout_rate': 0.11929170826692817, 'lr': 0.0007087722931391801, 'scheduler_patience': 7, 'class_weight': 1.603750854327173, 'activation': 'LeakyReLU', 'classification_multiplier': 7791.412588772779}. Best is trial 22 with value: 0.7070637119113573.
