[I 2025-06-12 13:37:16,809] Trial 99 finished with value: 0.659972299168975 and parameters: {'hidden_dim': 1550, 'latent_dim': 32, 'beta': 0.8774108431333854, 'gamma': 0.3463711318710072, 'dropout_rate': 0.18016930913185347, 'lr': 0.0015622014621697652, 'scheduler_patience': 7, 'class_weight': 1.9737102382852973, 'activation': 'ReLU', 'classification_multiplier': 6587.568779188404}. Best is trial 72 with value: 0.7479224376731302.

Confusion Matrix (with duplicates):
              Non-Repeater  Repeater
Non-Repeater         742.0       6.0
Repeater            3250.0    4666.0
accuracy_score
0.6241920590951062
Trial 1: hidden_dim=1355, latent_dim=36, beta=1.018797796197837, gamma=0.445982762539079, dropout_rate=0.16175159351095225, lr=0.0012159392992142591, scheduler_patience=7, class_weight=1.7439653725084894, activation=ReLU, classification_multiplier=6792.96335406335

=== Fold 1/5 ===
Validation Accuracy: 0.6319
Classification Report:
               precision    recall  f1-score   support

Non-Repeater       0.19      0.98      0.31       149
    Repeater       1.00      0.60      0.75      1584

    accuracy                           0.63      1733
   macro avg       0.59      0.79      0.53      1733
weighted avg       0.93      0.63      0.71      1733

Confusion Matrix:
 [[146   3]
 [635 949]]

=== Fold 2/5 ===
Validation Accuracy: 0.4830
Classification Report:
               precision    recall  f1-score   support

Non-Repeater       0.14      1.00      0.25       150
    Repeater       1.00      0.43      0.61      1583

    accuracy                           0.48      1733
   macro avg       0.57      0.72      0.43      1733
weighted avg       0.93      0.48      0.57      1733

Confusion Matrix:
 [[150   0]
 [896 687]]

=== Fold 3/5 ===
Validation Accuracy: 0.6070
Classification Report:
               precision    recall  f1-score   support

Non-Repeater       0.18      0.99      0.30       150
    Repeater       1.00      0.57      0.73      1583

    accuracy                           0.61      1733
   macro avg       0.59      0.78      0.52      1733
weighted avg       0.93      0.61      0.69      1733

Confusion Matrix:
 [[149   1]
 [680 903]]

=== Fold 4/5 ===
Validation Accuracy: 0.6936
Classification Report:
               precision    recall  f1-score   support

Non-Repeater       0.22      0.97      0.35       150
    Repeater       1.00      0.67      0.80      1583

    accuracy                           0.69      1733
   macro avg       0.61      0.82      0.58      1733
weighted avg       0.93      0.69      0.76      1733

Confusion Matrix:
 [[ 146    4]
 [ 527 1056]]

=== Fold 5/5 ===
Validation Accuracy: 0.7177
Classification Report:
               precision    recall  f1-score   support

Non-Repeater       0.23      0.99      0.38       149
    Repeater       1.00      0.69      0.82      1583

    accuracy                           0.72      1732
   macro avg       0.62      0.84      0.60      1732
weighted avg       0.93      0.72      0.78      1732

Confusion Matrix:
 [[ 148    1]
 [ 488 1095]]


=== Summary ===
Total False Positives: 9
Total False Negatives: 3226
Total True Positives: 4690
Total True Negatives: 739

Confusion Matrix (with duplicates):
              Non-Repeater  Repeater
Non-Repeater         739.0       9.0
Repeater            3226.0    4690.0
accuracy_score
0.6266158818097877
Trial 1: hidden_dim=1440, latent_dim=33, beta=0.9213278898220622, gamma=0.5350670221012713, dropout_rate=0.14718430032946184, lr=0.0021012640553297003, scheduler_patience=7, class_weight=2.160235888654759, activation=ReLU, classification_multiplier=6341.583945804083

=== Fold 1/5 ===
Validation Accuracy: 0.5447
Classification Report:
               precision    recall  f1-score   support

Non-Repeater       0.16      0.99      0.27       149
    Repeater       1.00      0.50      0.67      1584

    accuracy                           0.54      1733
   macro avg       0.58      0.75      0.47      1733
weighted avg       0.93      0.54      0.63      1733

Confusion Matrix:
 [[148   1]
 [788 796]]

=== Fold 2/5 ===
Validation Accuracy: 0.6688
Classification Report:
               precision    recall  f1-score   support

Non-Repeater       0.21      0.99      0.34       150
    Repeater       1.00      0.64      0.78      1583

    accuracy                           0.67      1733
   macro avg       0.60      0.81      0.56      1733
weighted avg       0.93      0.67      0.74      1733

Confusion Matrix:
 [[ 148    2]
 [ 572 1011]]

=== Fold 3/5 ===
Validation Accuracy: 0.6555
Classification Report:
               precision    recall  f1-score   support

Non-Repeater       0.20      0.99      0.33       150
    Repeater       1.00      0.62      0.77      1583

    accuracy                           0.66      1733
   macro avg       0.60      0.81      0.55      1733
weighted avg       0.93      0.66      0.73      1733

Confusion Matrix:
 [[148   2]
 [595 988]]

=== Fold 4/5 ===
Validation Accuracy: 0.6919
Classification Report:
               precision    recall  f1-score   support

Non-Repeater       0.22      0.99      0.36       150
    Repeater       1.00      0.66      0.80      1583

    accuracy                           0.69      1733
   macro avg       0.61      0.83      0.58      1733
weighted avg       0.93      0.69      0.76      1733

Confusion Matrix:
 [[ 148    2]
 [ 532 1051]]

=== Fold 5/5 ===
Validation Accuracy: 0.7390
Classification Report:
               precision    recall  f1-score   support

Non-Repeater       0.25      0.98      0.39       149
    Repeater       1.00      0.72      0.83      1583

    accuracy                           0.74      1732
   macro avg       0.62      0.85      0.61      1732
weighted avg       0.93      0.74      0.80      1732

Confusion Matrix:
 [[ 146    3]
 [ 449 1134]]


=== Summary ===
Total False Positives: 10
Total False Negatives: 2936
Total True Positives: 4980
Total True Negatives: 738

Confusion Matrix (with duplicates):
              Non-Repeater  Repeater
Non-Repeater         738.0      10.0
Repeater            2936.0    4980.0
accuracy_score
0.659972299168975
Trial 1: hidden_dim=1550, latent_dim=32, beta=0.8774108431333854, gamma=0.3463711318710072, dropout_rate=0.18016930913185347, lr=0.0015622014621697652, scheduler_patience=7, class_weight=1.9737102382852973, activation=ReLU, classification_multiplier=6587.568779188404

=== Fold 1/5 ===
Validation Accuracy: 0.6861
Classification Report:
               precision    recall  f1-score   support

Non-Repeater       0.21      0.99      0.35       149
    Repeater       1.00      0.66      0.79      1584

    accuracy                           0.69      1733
   macro avg       0.61      0.83      0.57      1733
weighted avg       0.93      0.69      0.75      1733

Confusion Matrix:
 [[ 148    1]
 [ 543 1041]]

=== Fold 2/5 ===
Validation Accuracy: 0.6128
Classification Report:
               precision    recall  f1-score   support

Non-Repeater       0.18      0.99      0.31       150
    Repeater       1.00      0.58      0.73      1583

    accuracy                           0.61      1733
   macro avg       0.59      0.79      0.52      1733
weighted avg       0.93      0.61      0.69      1733

Confusion Matrix:
 [[149   1]
 [670 913]]

=== Fold 3/5 ===
Validation Accuracy: 0.6220
Classification Report:
               precision    recall  f1-score   support

Non-Repeater       0.19      0.99      0.31       150
    Repeater       1.00      0.59      0.74      1583

    accuracy                           0.62      1733
   macro avg       0.59      0.79      0.53      1733
weighted avg       0.93      0.62      0.70      1733

Confusion Matrix:
 [[149   1]
 [654 929]]

=== Fold 4/5 ===
Validation Accuracy: 0.5967
Classification Report:
               precision    recall  f1-score   support

Non-Repeater       0.18      1.00      0.30       150
    Repeater       1.00      0.56      0.72      1583

    accuracy                           0.60      1733
   macro avg       0.59      0.78      0.51      1733
weighted avg       0.93      0.60      0.68      1733

Confusion Matrix:
 [[150   0]
 [699 884]]

=== Fold 5/5 ===
Validation Accuracy: 0.6472
Classification Report:
               precision    recall  f1-score   support

Non-Repeater       0.20      0.99      0.33       149
    Repeater       1.00      0.61      0.76      1583

    accuracy                           0.65      1732
   macro avg       0.60      0.80      0.54      1732
weighted avg       0.93      0.65      0.72      1732

Confusion Matrix:
 [I 2025-06-12 13:43:32,357] Trial 100 finished with value: 0.6329639889196675 and parameters: {'hidden_dim': 1296, 'latent_dim': 36, 'beta': 1.0786072620522622, 'gamma': 0.6022982436416338, 'dropout_rate': 0.13724689253258932, 'lr': 0.0010143269067074984, 'scheduler_patience': 7, 'class_weight': 1.7815220570108043, 'activation': 'ReLU', 'classification_multiplier': 7483.86856850589}. Best is trial 72 with value: 0.7479224376731302.
[I 2025-06-12 13:49:32,413] Trial 101 finished with value: 0.7068328716528163 and parameters: {'hidden_dim': 1143, 'latent_dim': 31, 'beta': 0.6865461876779763, 'gamma': 1.0851182468763547, 'dropout_rate': 0.16238174868889238, 'lr': 0.0005583803740909252, 'scheduler_patience': 7, 'class_weight': 1.6963067545051123, 'activation': 'ReLU', 'classification_multiplier': 5748.338812598748}. Best is trial 72 with value: 0.7479224376731302.
[I 2025-06-12 13:55:36,914] Trial 102 finished with value: 0.6653970452446907 and parameters: {'hidden_dim': 1200, 'latent_dim': 30, 'beta': 0.7785335965238731, 'gamma': 1.0871131503719995, 'dropout_rate': 0.16426472991657376, 'lr': 0.0003048559267187544, 'scheduler_patience': 7, 'class_weight': 1.5164078977892979, 'activation': 'ReLU', 'classification_multiplier': 6990.634230693612}. Best is trial 72 with value: 0.7479224376731302.
[[148   1]
 [610 973]]


=== Summary ===
Total False Positives: 4
Total False Negatives: 3176
Total True Positives: 4740
Total True Negatives: 744

Confusion Matrix (with duplicates):
              Non-Repeater  Repeater
Non-Repeater         744.0       4.0
Repeater            3176.0    4740.0
accuracy_score
0.6329639889196675
Trial 1: hidden_dim=1296, latent_dim=36, beta=1.0786072620522622, gamma=0.6022982436416338, dropout_rate=0.13724689253258932, lr=0.0010143269067074984, scheduler_patience=7, class_weight=1.7815220570108043, activation=ReLU, classification_multiplier=7483.86856850589

=== Fold 1/5 ===
Validation Accuracy: 0.6896
Classification Report:
               precision    recall  f1-score   support

Non-Repeater       0.22      0.99      0.35       149
    Repeater       1.00      0.66      0.80      1584

    accuracy                           0.69      1733
   macro avg       0.61      0.83      0.58      1733
weighted avg       0.93      0.69      0.76      1733

Confusion Matrix:
 [[ 148    1]
 [ 537 1047]]

=== Fold 2/5 ===
Validation Accuracy: 0.6999
Classification Report:
               precision    recall  f1-score   support

Non-Repeater       0.22      0.99      0.36       150
    Repeater       1.00      0.67      0.80      1583

    accuracy                           0.70      1733
   macro avg       0.61      0.83      0.58      1733
weighted avg       0.93      0.70      0.77      1733

Confusion Matrix:
 [[ 149    1]
 [ 519 1064]]

=== Fold 3/5 ===
Validation Accuracy: 0.6422
Classification Report:
               precision    recall  f1-score   support

Non-Repeater       0.19      0.99      0.32       150
    Repeater       1.00      0.61      0.76      1583

    accuracy                           0.64      1733
   macro avg       0.60      0.80      0.54      1733
weighted avg       0.93      0.64      0.72      1733

Confusion Matrix:
 [[149   1]
 [619 964]]

=== Fold 4/5 ===
Validation Accuracy: 0.6665
Classification Report:
               precision    recall  f1-score   support

Non-Repeater       0.21      0.99      0.34       150
    Repeater       1.00      0.64      0.78      1583

    accuracy                           0.67      1733
   macro avg       0.60      0.81      0.56      1733
weighted avg       0.93      0.67      0.74      1733

Confusion Matrix:
 [[ 149    1]
 [ 577 1006]]

=== Fold 5/5 ===
Validation Accuracy: 0.8360
Classification Report:
               precision    recall  f1-score   support

Non-Repeater       0.34      0.97      0.51       149
    Repeater       1.00      0.82      0.90      1583

    accuracy                           0.84      1732
   macro avg       0.67      0.90      0.70      1732
weighted avg       0.94      0.84      0.87      1732

Confusion Matrix:
 [[ 145    4]
 [ 280 1303]]


=== Summary ===
Total False Positives: 8
Total False Negatives: 2532
Total True Positives: 5384
Total True Negatives: 740

Confusion Matrix (with duplicates):
              Non-Repeater  Repeater
Non-Repeater         740.0       8.0
Repeater            2532.0    5384.0
accuracy_score
0.7068328716528163
Trial 1: hidden_dim=1143, latent_dim=31, beta=0.6865461876779763, gamma=1.0851182468763547, dropout_rate=0.16238174868889238, lr=0.0005583803740909252, scheduler_patience=7, class_weight=1.6963067545051123, activation=ReLU, classification_multiplier=5748.338812598748

=== Fold 1/5 ===
Validation Accuracy: 0.6601
Classification Report:
               precision    recall  f1-score   support

Non-Repeater       0.20      1.00      0.34       149
    Repeater       1.00      0.63      0.77      1584

    accuracy                           0.66      1733
   macro avg       0.60      0.81      0.55      1733
weighted avg       0.93      0.66      0.73      1733

Confusion Matrix:
 [[149   0]
 [589 995]]

=== Fold 2/5 ===
Validation Accuracy: 0.6053
Classification Report:
               precision    recall  f1-score   support

Non-Repeater       0.18      0.99      0.30       150
    Repeater       1.00      0.57      0.72      1583

    accuracy                           0.61      1733
   macro avg       0.59      0.78      0.51      1733
weighted avg       0.93      0.61      0.69      1733

Confusion Matrix:
 [[149   1]
 [683 900]]

=== Fold 3/5 ===
Validation Accuracy: 0.6445
Classification Report:
               precision    recall  f1-score   support

Non-Repeater       0.19      0.99      0.32       150
    Repeater       1.00      0.61      0.76      1583

    accuracy                           0.64      1733
   macro avg       0.60      0.80      0.54      1733
weighted avg       0.93      0.64      0.72      1733

Confusion Matrix:
 [[148   2]
 [614 969]]

=== Fold 4/5 ===
Validation Accuracy: 0.6774
Classification Report:
               precision    recall  f1-score   support

Non-Repeater       0.21      0.99      0.35       150
    Repeater       1.00      0.65      0.79      1583

    accuracy                           0.68      1733
   macro avg       0.60      0.82      0.57      1733
weighted avg       0.93      0.68      0.75      1733

Confusion Matrix:
 [[ 148    2]
 [ 557 1026]]

=== Fold 5/5 ===
Validation Accuracy: 0.7396
Classification Report:
               precision    recall  f1-score   support

Non-Repeater       0.25      0.98      0.39       149
    Repeater       1.00      0.72      0.83      1583

    accuracy                           0.74      1732
   macro avg       0.62      0.85      0.61      1732
weighted avg       0.93      0.74      0.80      1732

Confusion Matrix:
 [[ 146    3]
 [ 448 1135]]


=== Summary ===
Total False Positives: 8
Total False Negatives: 2891
Total True Positives: 5025
Total True Negatives: 740

Confusion Matrix (with duplicates):
              Non-Repeater  Repeater
Non-Repeater         740.0       8.0
Repeater            2891.0    5025.0
accuracy_score
0.6653970452446907
Trial 1: hidden_dim=1200, latent_dim=30, beta=0.7785335965238731, gamma=1.0871131503719995, dropout_rate=0.16426472991657376, lr=0.0003048559267187544, scheduler_patience=7, class_weight=1.5164078977892979, activation=ReLU, classification_multiplier=6990.634230693612

=== Fold 1/5 ===
Validation Accuracy: 0.6890
Classification Report:
               precision    recall  f1-score   support

Non-Repeater       0.22      0.99      0.35       149
    Repeater       1.00      0.66      0.80      1584

    accuracy                           0.69      1733
   macro avg       0.61      0.83      0.57      1733
weighted avg       0.93      0.69      0.76      1733

Confusion Matrix:
 [[ 148    1]
 [ 538 1046]]

=== Fold 2/5 ===
Validation Accuracy: 0.7513
Classification Report:
               precision    recall  f1-score   support

Non-Repeater       0.26      0.99      0.41       150
    Repeater       1.00      0.73      0.84      1583

    accuracy                           0.75      1733
   macro avg       0.63      0.86      0.63      1733
weighted avg       0.93      0.75      0.80      1733

Confusion Matrix:
 [[ 149    1]
 [ 430 1153]]

=== Fold 3/5 ===
Validation Accuracy: 0.6255
Classification Report:
               precision    recall  f1-score   support

Non-Repeater       0.19      0.99      0.31       150
    Repeater       1.00      0.59      0.74      1583

    accuracy                           0.63      1733
   macro avg       0.59      0.79      0.53      1733
weighted avg       0.93      0.63      0.71      1733

Confusion Matrix:
 [[149   1]
 [648 935]]

=== Fold 4/5 ===
Validation Accuracy: 0.6959
Classification Report:
               precision    recall  f1-score   support

Non-Repeater       0.22      0.99      0.36       150
    Repeater       1.00      0.67      0.80      1583

    accuracy                           0.70      1733
   macro avg       0.61      0.83      0.58      1733
weighted avg       0.93      0.70      0.76      1733

Confusion Matrix:
 [[ 148    2]
 [ 525 1058]]

=== Fold 5/5 ===
Validation Accuracy: 0.7615
Classification Report:
 [I 2025-06-12 14:01:25,587] Trial 103 finished with value: 0.7046398891966759 and parameters: {'hidden_dim': 991, 'latent_dim': 34, 'beta': 0.9392613939289775, 'gamma': 0.40847177412894176, 'dropout_rate': 0.18655944380726033, 'lr': 0.0006717941878400522, 'scheduler_patience': 7, 'class_weight': 1.7074244786470407, 'activation': 'ReLU', 'classification_multiplier': 5702.306848912782}. Best is trial 72 with value: 0.7479224376731302.
[I 2025-06-12 14:07:15,497] Trial 104 finished with value: 0.6926361957525392 and parameters: {'hidden_dim': 999, 'latent_dim': 34, 'beta': 0.9811104083339566, 'gamma': 0.41013723105185806, 'dropout_rate': 0.22329946258281488, 'lr': 0.0006952459281743577, 'scheduler_patience': 7, 'class_weight': 1.9103709650942613, 'activation': 'ReLU', 'classification_multiplier': 7662.310291710132}. Best is trial 72 with value: 0.7479224376731302.
