[I 2025-06-13 10:10:05,686] Trial 294 finished with value: 0.7833564173591875 and parameters: {'hidden_dim': 1301, 'latent_dim': 34, 'beta': 1.539791351058559, 'gamma': 0.10107299056181578, 'dropout_rate': 0.106830824418239, 'lr': 0.0005367071942921849, 'scheduler_patience': 7, 'class_weight': 2.800083279405245, 'activation': 'ReLU', 'classification_multiplier': 14244.004674358557}. Best is trial 194 with value: 0.8103647276084949.
              precision    recall  f1-score   support

Non-Repeater       0.26      0.97      0.41       149
    Repeater       1.00      0.74      0.85      1584

    accuracy                           0.76      1733
   macro avg       0.63      0.86      0.63      1733
weighted avg       0.93      0.76      0.81      1733

Confusion Matrix:
 [[ 145    4]
 [ 406 1178]]

=== Fold 2/5 ===
Validation Accuracy: 0.6244
Classification Report:
               precision    recall  f1-score   support

Non-Repeater       0.19      0.99      0.31       150
    Repeater       1.00      0.59      0.74      1583

    accuracy                           0.62      1733
   macro avg       0.59      0.79      0.53      1733
weighted avg       0.93      0.62      0.70      1733

Confusion Matrix:
 [[149   1]
 [650 933]]

=== Fold 3/5 ===
Validation Accuracy: 0.7496
Classification Report:
               precision    recall  f1-score   support

Non-Repeater       0.26      0.99      0.41       150
    Repeater       1.00      0.73      0.84      1583

    accuracy                           0.75      1733
   macro avg       0.63      0.86      0.62      1733
weighted avg       0.93      0.75      0.80      1733

Confusion Matrix:
 [[ 149    1]
 [ 433 1150]]

=== Fold 4/5 ===
Validation Accuracy: 0.7086
Classification Report:
               precision    recall  f1-score   support

Non-Repeater       0.23      0.99      0.37       150
    Repeater       1.00      0.68      0.81      1583

    accuracy                           0.71      1733
   macro avg       0.61      0.83      0.59      1733
weighted avg       0.93      0.71      0.77      1733

Confusion Matrix:
 [[ 148    2]
 [ 503 1080]]

=== Fold 5/5 ===
Validation Accuracy: 0.7800
Classification Report:
               precision    recall  f1-score   support

Non-Repeater       0.28      0.97      0.43       149
    Repeater       1.00      0.76      0.86      1583

    accuracy                           0.78      1732
   macro avg       0.64      0.86      0.65      1732
weighted avg       0.93      0.78      0.83      1732

Confusion Matrix:
 [[ 144    5]
 [ 376 1207]]


=== Summary ===
Total False Positives: 13
Total False Negatives: 2368
Total True Positives: 5548
Total True Negatives: 735

Confusion Matrix (with duplicates):
              Non-Repeater  Repeater
Non-Repeater         735.0      13.0
Repeater            2368.0    5548.0
accuracy_score
0.7251846722068329
Trial 1: hidden_dim=1618, latent_dim=30, beta=1.4567558032088874, gamma=0.2341566893760718, dropout_rate=0.1403303438340181, lr=0.0007762046885168906, scheduler_patience=7, class_weight=2.942557498192352, activation=ReLU, classification_multiplier=14995.66243952324

=== Fold 1/5 ===
Validation Accuracy: 0.8107
Classification Report:
               precision    recall  f1-score   support

Non-Repeater       0.31      0.95      0.46       149
    Repeater       0.99      0.80      0.89      1584

    accuracy                           0.81      1733
   macro avg       0.65      0.88      0.67      1733
weighted avg       0.94      0.81      0.85      1733

Confusion Matrix:
 [[ 142    7]
 [ 321 1263]]

=== Fold 2/5 ===
Validation Accuracy: 0.7680
Classification Report:
               precision    recall  f1-score   support

Non-Repeater       0.27      0.99      0.42       150
    Repeater       1.00      0.75      0.85      1583

    accuracy                           0.77      1733
   macro avg       0.63      0.87      0.64      1733
weighted avg       0.94      0.77      0.82      1733

Confusion Matrix:
 [[ 148    2]
 [ 400 1183]]

=== Fold 3/5 ===
Validation Accuracy: 0.7473
Classification Report:
               precision    recall  f1-score   support

Non-Repeater       0.25      0.99      0.40       150
    Repeater       1.00      0.72      0.84      1583

    accuracy                           0.75      1733
   macro avg       0.63      0.86      0.62      1733
weighted avg       0.93      0.75      0.80      1733

Confusion Matrix:
 [[ 149    1]
 [ 437 1146]]

=== Fold 4/5 ===
Validation Accuracy: 0.7698
Classification Report:
               precision    recall  f1-score   support

Non-Repeater       0.27      0.98      0.42       150
    Repeater       1.00      0.75      0.86      1583

    accuracy                           0.77      1733
   macro avg       0.63      0.86      0.64      1733
weighted avg       0.93      0.77      0.82      1733

Confusion Matrix:
 [[ 147    3]
 [ 396 1187]]

=== Fold 5/5 ===
Validation Accuracy: 0.8210
Classification Report:
               precision    recall  f1-score   support

Non-Repeater       0.32      0.98      0.49       149
    Repeater       1.00      0.81      0.89      1583

    accuracy                           0.82      1732
   macro avg       0.66      0.89      0.69      1732
weighted avg       0.94      0.82      0.86      1732

Confusion Matrix:
 [[ 146    3]
 [ 307 1276]]


=== Summary ===
Total False Positives: 16
Total False Negatives: 1861
Total True Positives: 6055
Total True Negatives: 732

Confusion Matrix (with duplicates):
              Non-Repeater  Repeater
Non-Repeater         732.0      16.0
Repeater            1861.0    6055.0
accuracy_score
0.7833564173591875
Trial 1: hidden_dim=1301, latent_dim=34, beta=1.539791351058559, gamma=0.10107299056181578, dropout_rate=0.106830824418239, lr=0.0005367071942921849, scheduler_patience=7, class_weight=2.800083279405245, activation=ReLU, classification_multiplier=14244.004674358557

=== Fold 1/5 ===
Validation Accuracy: 0.6936
Classification Report:
               precision    recall  f1-score   support

Non-Repeater       0.22      0.99      0.36       149
    Repeater       1.00      0.67      0.80      1584

    accuracy                           0.69      1733
   macro avg       0.61      0.83      0.58      1733
weighted avg       0.93      0.69      0.76      1733

Confusion Matrix:
 [[ 147    2]
 [ 529 1055]]

=== Fold 2/5 ===
Validation Accuracy: 0.3029
Classification Report:
               precision    recall  f1-score   support

Non-Repeater       0.11      1.00      0.20       150
    Repeater       1.00      0.24      0.38      1583

    accuracy                           0.30      1733
   macro avg       0.56      0.62      0.29      1733
weighted avg       0.92      0.30      0.37      1733

Confusion Matrix:
 [[ 150    0]
 [1208  375]]

=== Fold 3/5 ===
Validation Accuracy: 0.6601
Classification Report:
               precision    recall  f1-score   support

Non-Repeater       0.20      0.99      0.33       150
    Repeater       1.00      0.63      0.77      1583

    accuracy                           0.66      1733
   macro avg       0.60      0.81      0.55      1733
weighted avg       0.93      0.66      0.73      1733

Confusion Matrix:
 [[148   2]
 [587 996]]

=== Fold 4/5 ===
Validation Accuracy: 0.6538
Classification Report:
               precision    recall  f1-score   support

Non-Repeater       0.20      0.99      0.33       150
    Repeater       1.00      0.62      0.77      1583

    accuracy                           0.65      1733
   macro avg       0.60      0.80      0.55      1733
weighted avg       0.93      0.65      0.73      1733

Confusion Matrix:
 [[148   2]
 [598 985]]

=== Fold 5/5 ===
Validation Accuracy: 0.7471
Classification Report:
               precision    recall  f1-score   support

Non-Repeater       0.25      0.98      0.40       149
    Repeater       1.00      0.73      0.84      1583

    accuracy                           0.75      1732
   macro avg       0.62      0.85      0.62      1732
weighted avg       0.93      0.75      0.80      1732

Confusion Matrix:
 [[ 146    3]
 [ 435 1148]]


=== Summary ===
Total False Positives: 9
Total False Negatives: 3357
Total True Positives: 4559
Total True Negatives: 739

Confusion Matrix (with duplicates):
              Non-Repeater  Repeater
Non-Repeater         739.0       9.0
Repeater            3357.0    4559.0
accuracy_score
0.6114958448753463
[I 2025-06-13 10:16:33,569] Trial 295 finished with value: 0.6114958448753463 and parameters: {'hidden_dim': 1422, 'latent_dim': 34, 'beta': 1.5400799040919075, 'gamma': 0.10630462706427223, 'dropout_rate': 0.10793826962186032, 'lr': 0.0010037678538557036, 'scheduler_patience': 7, 'class_weight': 2.8297054914326667, 'activation': 'LeakyReLU', 'classification_multiplier': 14252.918581312031}. Best is trial 194 with value: 0.8103647276084949.
[I 2025-06-13 10:23:16,416] Trial 296 finished with value: 0.6574330563250231 and parameters: {'hidden_dim': 1534, 'latent_dim': 35, 'beta': 1.5999847495228336, 'gamma': 0.1254353530610708, 'dropout_rate': 0.10652352298539765, 'lr': 0.0005435943619026796, 'scheduler_patience': 3, 'class_weight': 2.895662066588315, 'activation': 'ReLU', 'classification_multiplier': 14079.367875166483}. Best is trial 194 with value: 0.8103647276084949.
[I 2025-06-13 10:29:22,397] Trial 297 finished with value: 0.7189519852262235 and parameters: {'hidden_dim': 1171, 'latent_dim': 34, 'beta': 1.533427118323403, 'gamma': 0.17896802226471986, 'dropout_rate': 0.3461017423624554, 'lr': 0.0007044547580783786, 'scheduler_patience': 7, 'class_weight': 2.949623262441902, 'activation': 'ReLU', 'classification_multiplier': 13830.868503439497}. Best is trial 194 with value: 0.8103647276084949.
Trial 1: hidden_dim=1422, latent_dim=34, beta=1.5400799040919075, gamma=0.10630462706427223, dropout_rate=0.10793826962186032, lr=0.0010037678538557036, scheduler_patience=7, class_weight=2.8297054914326667, activation=LeakyReLU, classification_multiplier=14252.918581312031

=== Fold 1/5 ===
Validation Accuracy: 0.7086
Classification Report:
               precision    recall  f1-score   support

Non-Repeater       0.23      0.99      0.37       149
    Repeater       1.00      0.68      0.81      1584

    accuracy                           0.71      1733
   macro avg       0.61      0.83      0.59      1733
weighted avg       0.93      0.71      0.77      1733

Confusion Matrix:
 [[ 147    2]
 [ 503 1081]]

=== Fold 2/5 ===
Validation Accuracy: 0.6370
Classification Report:
               precision    recall  f1-score   support

Non-Repeater       0.19      0.99      0.32       150
    Repeater       1.00      0.60      0.75      1583

    accuracy                           0.64      1733
   macro avg       0.60      0.80      0.54      1733
weighted avg       0.93      0.64      0.71      1733

Confusion Matrix:
 [[149   1]
 [628 955]]

=== Fold 3/5 ===
Validation Accuracy: 0.6376
Classification Report:
               precision    recall  f1-score   support

Non-Repeater       0.19      0.99      0.32       150
    Repeater       1.00      0.60      0.75      1583

    accuracy                           0.64      1733
   macro avg       0.59      0.80      0.54      1733
weighted avg       0.93      0.64      0.72      1733

Confusion Matrix:
 [[148   2]
 [626 957]]

=== Fold 4/5 ===
Validation Accuracy: 0.5793
Classification Report:
               precision    recall  f1-score   support

Non-Repeater       0.17      0.99      0.29       150
    Repeater       1.00      0.54      0.70      1583

    accuracy                           0.58      1733
   macro avg       0.58      0.77      0.50      1733
weighted avg       0.93      0.58      0.67      1733

Confusion Matrix:
 [[149   1]
 [728 855]]

=== Fold 5/5 ===
Validation Accuracy: 0.7246
Classification Report:
               precision    recall  f1-score   support

Non-Repeater       0.24      0.99      0.38       149
    Repeater       1.00      0.70      0.82      1583

    accuracy                           0.72      1732
   macro avg       0.62      0.84      0.60      1732
weighted avg       0.93      0.72      0.78      1732

Confusion Matrix:
 [[ 147    2]
 [ 475 1108]]


=== Summary ===
Total False Positives: 8
Total False Negatives: 2960
Total True Positives: 4956
Total True Negatives: 740

Confusion Matrix (with duplicates):
              Non-Repeater  Repeater
Non-Repeater         740.0       8.0
Repeater            2960.0    4956.0
accuracy_score
0.6574330563250231
Trial 1: hidden_dim=1534, latent_dim=35, beta=1.5999847495228336, gamma=0.1254353530610708, dropout_rate=0.10652352298539765, lr=0.0005435943619026796, scheduler_patience=3, class_weight=2.895662066588315, activation=ReLU, classification_multiplier=14079.367875166483

=== Fold 1/5 ===
Validation Accuracy: 0.6763
Classification Report:
               precision    recall  f1-score   support

Non-Repeater       0.21      0.99      0.35       149
    Repeater       1.00      0.65      0.78      1584

    accuracy                           0.68      1733
   macro avg       0.60      0.82      0.57      1733
weighted avg       0.93      0.68      0.75      1733

Confusion Matrix:
 [[ 148    1]
 [ 560 1024]]

=== Fold 2/5 ===
Validation Accuracy: 0.6803
Classification Report:
               precision    recall  f1-score   support

Non-Repeater       0.21      0.99      0.35       150
    Repeater       1.00      0.65      0.79      1583

    accuracy                           0.68      1733
   macro avg       0.61      0.82      0.57      1733
weighted avg       0.93      0.68      0.75      1733

Confusion Matrix:
 [[ 149    1]
 [ 553 1030]]

=== Fold 3/5 ===
Validation Accuracy: 0.7363
Classification Report:
               precision    recall  f1-score   support

Non-Repeater       0.25      0.99      0.39       150
    Repeater       1.00      0.71      0.83      1583

    accuracy                           0.74      1733
   macro avg       0.62      0.85      0.61      1733
weighted avg       0.93      0.74      0.79      1733

Confusion Matrix:
 [[ 149    1]
 [ 456 1127]]

=== Fold 4/5 ===
Validation Accuracy: 0.7369
Classification Report:
               precision    recall  f1-score   support

Non-Repeater       0.25      0.99      0.39       150
    Repeater       1.00      0.71      0.83      1583

    accuracy                           0.74      1733
   macro avg       0.62      0.85      0.61      1733
weighted avg       0.93      0.74      0.79      1733

Confusion Matrix:
 [[ 148    2]
 [ 454 1129]]

=== Fold 5/5 ===
Validation Accuracy: 0.7650
Classification Report:
               precision    recall  f1-score   support

Non-Repeater       0.26      0.97      0.42       149
    Repeater       1.00      0.75      0.85      1583

    accuracy                           0.77      1732
   macro avg       0.63      0.86      0.63      1732
weighted avg       0.93      0.77      0.82      1732

Confusion Matrix:
 [[ 145    4]
 [ 403 1180]]


=== Summary ===
Total False Positives: 9
Total False Negatives: 2426
Total True Positives: 5490
Total True Negatives: 739

Confusion Matrix (with duplicates):
              Non-Repeater  Repeater
Non-Repeater         739.0       9.0
Repeater            2426.0    5490.0
accuracy_score
0.7189519852262235
Trial 1: hidden_dim=1171, latent_dim=34, beta=1.533427118323403, gamma=0.17896802226471986, dropout_rate=0.3461017423624554, lr=0.0007044547580783786, scheduler_patience=7, class_weight=2.949623262441902, activation=ReLU, classification_multiplier=13830.868503439497

=== Fold 1/5 ===
Validation Accuracy: 0.7865
Classification Report:
               precision    recall  f1-score   support

Non-Repeater       0.29      0.99      0.44       149
    Repeater       1.00      0.77      0.87      1584

    accuracy                           0.79      1733
   macro avg       0.64      0.88      0.66      1733
weighted avg       0.94      0.79      0.83      1733

Confusion Matrix:
 [[ 147    2]
 [ 368 1216]]

=== Fold 2/5 ===
Validation Accuracy: 0.7426
Classification Report:
               precision    recall  f1-score   support

Non-Repeater       0.25      0.99      0.40       150
    Repeater       1.00      0.72      0.84      1583

    accuracy                           0.74      1733
   macro avg       0.62      0.86      0.62      1733
weighted avg       0.93      0.74      0.80      1733

Confusion Matrix:
 [[ 149    1]
 [ 445 1138]]

=== Fold 3/5 ===
Validation Accuracy: 0.7530
Classification Report:
               precision    recall  f1-score   support

Non-Repeater       0.26      0.99      0.41       150
    Repeater       1.00      0.73      0.84      1583

    accuracy                           0.75      1733
   macro avg       0.63      0.86      0.63      1733
weighted avg       0.93      0.75      0.81      1733

Confusion Matrix:
 [[ 148    2]
 [ 426 1157]]

=== Fold 4/5 ===
Validation Accuracy: 0.7640
Classification Report:
               precision    recall  f1-score   support

Non-Repeater       0.27      0.99      0.42       150
    Repeater       1.00      0.74      0.85      1583

    accuracy                           0.76      1733
   macro avg       0.63      0.86      0.64      1733
weighted avg       0.93      0.76      0.81      1733

Confusion Matrix:
 [[ 148    2]
 [ 407 1176]]

=== Fold 5/5 ===
Validation Accuracy: 0.7771
Classification Report:
               precision    recall  f1-score   support

Non-Repeater       0.28      0.98      0.43       149
    Repeater       1.00      0.76      0.86      1583

    accuracy                           0.78      1732
   macro avg       0.64      0.87      0.65      1732
weighted avg       0.94      0.78      0.82      1732

Confusion Matrix:
 [[ 146    3]
 [ 383 1200]]


=== Summary ===
Total False Positives: 10
Total False Negatives: 2029
Total True Positives: 5887
Total True Negatives: 738
[I 2025-06-13 10:35:48,342] Trial 298 finished with value: 0.7646583564173592 and parameters: {'hidden_dim': 1373, 'latent_dim': 33, 'beta': 1.583686889092263, 'gamma': 0.21670020070863627, 'dropout_rate': 0.11514440619569238, 'lr': 0.0005691992234640083, 'scheduler_patience': 7, 'class_weight': 2.8102820035278415, 'activation': 'ReLU', 'classification_multiplier': 14377.343063415747}. Best is trial 194 with value: 0.8103647276084949.
[I 2025-06-13 10:42:02,955] Trial 299 finished with value: 0.7493074792243767 and parameters: {'hidden_dim': 1244, 'latent_dim': 33, 'beta': 1.7709531410413768, 'gamma': 0.12564485165322542, 'dropout_rate': 0.11675955518802773, 'lr': 0.000249153041421201, 'scheduler_patience': 7, 'class_weight': 2.699371838940312, 'activation': 'ReLU', 'classification_multiplier': 14056.027717878245}. Best is trial 194 with value: 0.8103647276084949.
