[I 2025-06-12 08:19:51,947] Trial 47 finished with value: 0.6439289012003694 and parameters: {'hidden_dim': 751, 'latent_dim': 37, 'beta': 0.7294358828661582, 'gamma': 1.3171977798586048, 'dropout_rate': 0.1828992029264099, 'lr': 0.0019626750678506583, 'scheduler_patience': 6, 'class_weight': 1.6825031389050469, 'activation': 'ReLU', 'classification_multiplier': 6196.32844423951}. Best is trial 22 with value: 0.7070637119113573.
              precision    recall  f1-score   support

Non-Repeater       0.17      1.00      0.30       149
    Repeater       1.00      0.55      0.71      1584

    accuracy                           0.59      1733
   macro avg       0.59      0.78      0.51      1733
weighted avg       0.93      0.59      0.68      1733

Confusion Matrix:
 [[149   0]
 [705 879]]

=== Fold 2/5 ===
Validation Accuracy: 0.5309
Classification Report:
               precision    recall  f1-score   support

Non-Repeater       0.16      0.99      0.27       150
    Repeater       1.00      0.49      0.65      1583

    accuracy                           0.53      1733
   macro avg       0.58      0.74      0.46      1733
weighted avg       0.93      0.53      0.62      1733

Confusion Matrix:
 [[149   1]
 [812 771]]

=== Fold 3/5 ===
Validation Accuracy: 0.4472
Classification Report:
               precision    recall  f1-score   support

Non-Repeater       0.13      0.99      0.24       150
    Repeater       1.00      0.40      0.57      1583

    accuracy                           0.45      1733
   macro avg       0.57      0.69      0.40      1733
weighted avg       0.92      0.45      0.54      1733

Confusion Matrix:
 [[149   1]
 [957 626]]

=== Fold 4/5 ===
Validation Accuracy: 0.5355
Classification Report:
               precision    recall  f1-score   support

Non-Repeater       0.16      0.99      0.27       150
    Repeater       1.00      0.49      0.66      1583

    accuracy                           0.54      1733
   macro avg       0.58      0.74      0.46      1733
weighted avg       0.93      0.54      0.63      1733

Confusion Matrix:
 [[149   1]
 [804 779]]

=== Fold 5/5 ===
Validation Accuracy: 0.5964
Classification Report:
               precision    recall  f1-score   support

Non-Repeater       0.17      0.98      0.29       149
    Repeater       1.00      0.56      0.72      1583

    accuracy                           0.60      1732
   macro avg       0.59      0.77      0.51      1732
weighted avg       0.93      0.60      0.68      1732

Confusion Matrix:
 [[146   3]
 [696 887]]


=== Summary ===
Total False Positives: 6
Total False Negatives: 3974
Total True Positives: 3942
Total True Negatives: 742

Confusion Matrix (with duplicates):
              Non-Repeater  Repeater
Non-Repeater         742.0       6.0
Repeater            3974.0    3942.0
accuracy_score
0.5406278855032317
Trial 1: hidden_dim=1149, latent_dim=10, beta=1.201328947471761, gamma=0.7247849869183505, dropout_rate=0.1339908707512696, lr=0.00018038158019048818, scheduler_patience=6, class_weight=1.5448644391128896, activation=GELU, classification_multiplier=8319.100914250865

=== Fold 1/5 ===
Validation Accuracy: 0.5707
Classification Report:
               precision    recall  f1-score   support

Non-Repeater       0.16      0.97      0.28       149
    Repeater       1.00      0.53      0.69      1584

    accuracy                           0.57      1733
   macro avg       0.58      0.75      0.49      1733
weighted avg       0.92      0.57      0.66      1733

Confusion Matrix:
 [[145   4]
 [740 844]]

=== Fold 2/5 ===
Validation Accuracy: 0.6688
Classification Report:
               precision    recall  f1-score   support

Non-Repeater       0.21      0.99      0.34       150
    Repeater       1.00      0.64      0.78      1583

    accuracy                           0.67      1733
   macro avg       0.60      0.82      0.56      1733
weighted avg       0.93      0.67      0.74      1733

Confusion Matrix:
 [[ 149    1]
 [ 573 1010]]

=== Fold 3/5 ===
Validation Accuracy: 0.5851
Classification Report:
               precision    recall  f1-score   support

Non-Repeater       0.17      0.99      0.29       150
    Repeater       1.00      0.55      0.71      1583

    accuracy                           0.59      1733
   macro avg       0.59      0.77      0.50      1733
weighted avg       0.93      0.59      0.67      1733

Confusion Matrix:
 [[149   1]
 [718 865]]

=== Fold 4/5 ===
Validation Accuracy: 0.6388
Classification Report:
               precision    recall  f1-score   support

Non-Repeater       0.19      0.99      0.32       150
    Repeater       1.00      0.61      0.75      1583

    accuracy                           0.64      1733
   macro avg       0.59      0.80      0.54      1733
weighted avg       0.93      0.64      0.72      1733

Confusion Matrix:
 [[148   2]
 [624 959]]

=== Fold 5/5 ===
Validation Accuracy: 0.7564
Classification Report:
               precision    recall  f1-score   support

Non-Repeater       0.26      0.97      0.41       149
    Repeater       1.00      0.74      0.85      1583

    accuracy                           0.76      1732
   macro avg       0.63      0.85      0.63      1732
weighted avg       0.93      0.76      0.81      1732

Confusion Matrix:
 [[ 145    4]
 [ 418 1165]]


=== Summary ===
Total False Positives: 12
Total False Negatives: 3073
Total True Positives: 4843
Total True Negatives: 736

Confusion Matrix (with duplicates):
              Non-Repeater  Repeater
Non-Repeater         736.0      12.0
Repeater            3073.0    4843.0
accuracy_score
0.6439289012003694
Trial 1: hidden_dim=751, latent_dim=37, beta=0.7294358828661582, gamma=1.3171977798586048, dropout_rate=0.1828992029264099, lr=0.0019626750678506583, scheduler_patience=6, class_weight=1.6825031389050469, activation=ReLU, classification_multiplier=6196.32844423951

=== Fold 1/5 ===
Validation Accuracy: 0.2481
Classification Report:
               precision    recall  f1-score   support

Non-Repeater       0.10      1.00      0.19       149
    Repeater       1.00      0.18      0.30      1584

    accuracy                           0.25      1733
   macro avg       0.55      0.59      0.24      1733
weighted avg       0.92      0.25      0.29      1733

Confusion Matrix:
 [[ 149    0]
 [1303  281]]

=== Fold 2/5 ===
Validation Accuracy: 0.3612
Classification Report:
               precision    recall  f1-score   support

Non-Repeater       0.12      1.00      0.21       150
    Repeater       1.00      0.30      0.46      1583

    accuracy                           0.36      1733
   macro avg       0.56      0.65      0.34      1733
weighted avg       0.92      0.36      0.44      1733

Confusion Matrix:
 [[ 150    0]
 [1107  476]]

=== Fold 3/5 ===
Validation Accuracy: 0.3203
Classification Report:
               precision    recall  f1-score   support

Non-Repeater       0.11      1.00      0.20       150
    Repeater       1.00      0.26      0.41      1583

    accuracy                           0.32      1733
   macro avg       0.56      0.63      0.31      1733
weighted avg       0.92      0.32      0.39      1733

Confusion Matrix:
 [[ 150    0]
 [1178  405]]

=== Fold 4/5 ===
Validation Accuracy: 0.4230
Classification Report:
               precision    recall  f1-score   support

Non-Repeater       0.13      1.00      0.23       150
    Repeater       1.00      0.37      0.54      1583

    accuracy                           0.42      1733
   macro avg       0.57      0.68      0.38      1733
weighted avg       0.92      0.42      0.51      1733

Confusion Matrix:
 [[ 150    0]
 [1000  583]]

=== Fold 5/5 ===
Validation Accuracy: 0.2945
Classification Report:
               precision    recall  f1-score   support

Non-Repeater       0.11      1.00      0.20       149
    Repeater       1.00      0.23      0.37      1583

    accuracy                           0.29      1732
   macro avg       0.55      0.61      0.28      1732
weighted avg       0.92      0.29      0.36      1732

Confusion Matrix:
 [[ 149    0]
 [1222  361]]


=== Summary ===
Total False Positives: 0
Total False Negatives: 5810
Total True Positives: 2106
Total True Negatives: 748

Confusion Matrix (with duplicates):
              Non-Repeater  Repeater
Non-Repeater         748.0       0.0
Repeater            5810.0    2106.0
accuracy_score
0.32940904893813483
[I 2025-06-12 08:27:02,970] Trial 48 finished with value: 0.32940904893813483 and parameters: {'hidden_dim': 1805, 'latent_dim': 19, 'beta': 0.5350286510235245, 'gamma': 1.1389942373347854, 'dropout_rate': 0.3573847180182896, 'lr': 0.001023989184236578, 'scheduler_patience': 7, 'class_weight': 1.0593372574166489, 'activation': 'SELU', 'classification_multiplier': 7426.639808044374}. Best is trial 22 with value: 0.7070637119113573.
[I 2025-06-12 08:32:29,363] Trial 49 finished with value: 0.5475530932594644 and parameters: {'hidden_dim': 133, 'latent_dim': 25, 'beta': 1.3445007916424812, 'gamma': 0.24779626886200234, 'dropout_rate': 0.14293082388984601, 'lr': 0.0030233283727883246, 'scheduler_patience': 5, 'class_weight': 1.3775486290251353, 'activation': 'ReLU', 'classification_multiplier': 5438.0902570891285}. Best is trial 22 with value: 0.7070637119113573.
[I 2025-06-12 08:38:37,867] Trial 50 finished with value: 0.47379963065558633 and parameters: {'hidden_dim': 1236, 'latent_dim': 32, 'beta': 0.9212107846060831, 'gamma': 1.6714632968598178, 'dropout_rate': 0.19445041792955892, 'lr': 0.00047147858135016744, 'scheduler_patience': 7, 'class_weight': 1.835377810054983, 'activation': 'ELU', 'classification_multiplier': 8872.101510423388}. Best is trial 22 with value: 0.7070637119113573.
Trial 1: hidden_dim=1805, latent_dim=19, beta=0.5350286510235245, gamma=1.1389942373347854, dropout_rate=0.3573847180182896, lr=0.001023989184236578, scheduler_patience=7, class_weight=1.0593372574166489, activation=SELU, classification_multiplier=7426.639808044374

=== Fold 1/5 ===
Validation Accuracy: 0.5332
Classification Report:
               precision    recall  f1-score   support

Non-Repeater       0.16      1.00      0.27       149
    Repeater       1.00      0.49      0.66      1584

    accuracy                           0.53      1733
   macro avg       0.58      0.74      0.46      1733
weighted avg       0.93      0.53      0.62      1733

Confusion Matrix:
 [[149   0]
 [809 775]]

=== Fold 2/5 ===
Validation Accuracy: 0.6111
Classification Report:
               precision    recall  f1-score   support

Non-Repeater       0.18      0.99      0.31       150
    Repeater       1.00      0.57      0.73      1583

    accuracy                           0.61      1733
   macro avg       0.59      0.78      0.52      1733
weighted avg       0.93      0.61      0.69      1733

Confusion Matrix:
 [[149   1]
 [673 910]]

=== Fold 3/5 ===
Validation Accuracy: 0.5424
Classification Report:
               precision    recall  f1-score   support

Non-Repeater       0.16      0.99      0.27       150
    Repeater       1.00      0.50      0.67      1583

    accuracy                           0.54      1733
   macro avg       0.58      0.75      0.47      1733
weighted avg       0.93      0.54      0.63      1733

Confusion Matrix:
 [[149   1]
 [792 791]]

=== Fold 4/5 ===
Validation Accuracy: 0.5713
Classification Report:
               precision    recall  f1-score   support

Non-Repeater       0.17      0.99      0.29       150
    Repeater       1.00      0.53      0.69      1583

    accuracy                           0.57      1733
   macro avg       0.58      0.76      0.49      1733
weighted avg       0.93      0.57      0.66      1733

Confusion Matrix:
 [[149   1]
 [742 841]]

=== Fold 5/5 ===
Validation Accuracy: 0.4798
Classification Report:
               precision    recall  f1-score   support

Non-Repeater       0.14      0.99      0.25       149
    Repeater       1.00      0.43      0.60      1583

    accuracy                           0.48      1732
   macro avg       0.57      0.71      0.42      1732
weighted avg       0.92      0.48      0.57      1732

Confusion Matrix:
 [[148   1]
 [900 683]]


=== Summary ===
Total False Positives: 4
Total False Negatives: 3916
Total True Positives: 4000
Total True Negatives: 744

Confusion Matrix (with duplicates):
              Non-Repeater  Repeater
Non-Repeater         744.0       4.0
Repeater            3916.0    4000.0
accuracy_score
0.5475530932594644
Trial 1: hidden_dim=133, latent_dim=25, beta=1.3445007916424812, gamma=0.24779626886200234, dropout_rate=0.14293082388984601, lr=0.0030233283727883246, scheduler_patience=5, class_weight=1.3775486290251353, activation=ReLU, classification_multiplier=5438.0902570891285

=== Fold 1/5 ===
Validation Accuracy: 0.4259
Classification Report:
               precision    recall  f1-score   support

Non-Repeater       0.13      1.00      0.23       149
    Repeater       1.00      0.37      0.54      1584

    accuracy                           0.43      1733
   macro avg       0.57      0.69      0.39      1733
weighted avg       0.93      0.43      0.52      1733

Confusion Matrix:
 [[149   0]
 [995 589]]

=== Fold 2/5 ===
Validation Accuracy: 0.4374
Classification Report:
               precision    recall  f1-score   support

Non-Repeater       0.13      1.00      0.24       150
    Repeater       1.00      0.38      0.55      1583

    accuracy                           0.44      1733
   macro avg       0.57      0.69      0.40      1733
weighted avg       0.92      0.44      0.53      1733

Confusion Matrix:
 [[150   0]
 [975 608]]

=== Fold 3/5 ===
Validation Accuracy: 0.3935
Classification Report:
               precision    recall  f1-score   support

Non-Repeater       0.12      1.00      0.22       150
    Repeater       1.00      0.34      0.50      1583

    accuracy                           0.39      1733
   macro avg       0.56      0.67      0.36      1733
weighted avg       0.92      0.39      0.48      1733

Confusion Matrix:
 [[ 150    0]
 [1051  532]]

=== Fold 4/5 ===
Validation Accuracy: 0.4795
Classification Report:
               precision    recall  f1-score   support

Non-Repeater       0.14      0.99      0.25       150
    Repeater       1.00      0.43      0.60      1583

    accuracy                           0.48      1733
   macro avg       0.57      0.71      0.43      1733
weighted avg       0.92      0.48      0.57      1733

Confusion Matrix:
 [[149   1]
 [901 682]]

=== Fold 5/5 ===
Validation Accuracy: 0.6328
Classification Report:
               precision    recall  f1-score   support

Non-Repeater       0.19      0.99      0.32       149
    Repeater       1.00      0.60      0.75      1583

    accuracy                           0.63      1732
   macro avg       0.59      0.79      0.53      1732
weighted avg       0.93      0.63      0.71      1732

Confusion Matrix:
 [[147   2]
 [634 949]]


=== Summary ===
Total False Positives: 3
Total False Negatives: 4556
Total True Positives: 3360
Total True Negatives: 745

Confusion Matrix (with duplicates):
              Non-Repeater  Repeater
Non-Repeater         745.0       3.0
Repeater            4556.0    3360.0
accuracy_score
0.47379963065558633
Trial 1: hidden_dim=1236, latent_dim=32, beta=0.9212107846060831, gamma=1.6714632968598178, dropout_rate=0.19445041792955892, lr=0.00047147858135016744, scheduler_patience=7, class_weight=1.835377810054983, activation=ELU, classification_multiplier=8872.101510423388

=== Fold 1/5 ===
Validation Accuracy: 0.6601
Classification Report:
               precision    recall  f1-score   support

Non-Repeater       0.20      0.99      0.33       149
    Repeater       1.00      0.63      0.77      1584

    accuracy                           0.66      1733
   macro avg       0.60      0.81      0.55      1733
weighted avg       0.93      0.66      0.73      1733

Confusion Matrix:
 [[148   1]
 [588 996]]

=== Fold 2/5 ===
Validation Accuracy: 0.6595
Classification Report:
               precision    recall  f1-score   support

Non-Repeater       0.20      0.99      0.34       150
    Repeater       1.00      0.63      0.77      1583

    accuracy                           0.66      1733
   macro avg       0.60      0.81      0.55      1733
weighted avg       0.93      0.66      0.73      1733

Confusion Matrix:
 [[149   1]
 [589 994]]

=== Fold 3/5 ===
Validation Accuracy: 0.6532
Classification Report:
               precision    recall  f1-score   support

Non-Repeater       0.20      0.99      0.33       150
    Repeater       1.00      0.62      0.77      1583

    accuracy                           0.65      1733
   macro avg       0.60      0.81      0.55      1733
weighted avg       0.93      0.65      0.73      1733

Confusion Matrix:
 [[149   1]
 [600 983]]

=== Fold 4/5 ===
Validation Accuracy: 0.5793
Classification Report:
               precision    recall  f1-score   support

Non-Repeater       0.17      0.99      0.29       150
    Repeater       1.00      0.54      0.70      1583

    accuracy                           0.58      1733
   macro avg       0.58      0.76      0.50      1733
weighted avg       0.93      0.58      0.67      1733

Confusion Matrix:
 [[148   2]
 [727 856]]

=== Fold 5/5 ===
Validation Accuracy: 0.6790
Classification Report:
               precision    recall  f1-score   support

Non-Repeater       0.21      0.98      0.34       149
    Repeater       1.00      0.65      0.79      1583

    accuracy                           0.68      1732
   macro avg       0.60      0.82      0.57      1732
weighted avg       0.93      0.68      0.75      1732

Confusion Matrix:
 [[ 146    3]
 [ 553 1030]]


=== Summary ===
Total False Positives: 8
Total False Negatives: 3057
Total True Positives: 4859
Total True Negatives: 740

Confusion Matrix (with duplicates):
[I 2025-06-12 08:44:39,677] Trial 51 finished with value: 0.6462373037857803 and parameters: {'hidden_dim': 1156, 'latent_dim': 27, 'beta': 1.690147826047832, 'gamma': 1.8172053126232277, 'dropout_rate': 0.272812573236661, 'lr': 0.0005430191459810267, 'scheduler_patience': 6, 'class_weight': 2.396880415483235, 'activation': 'ReLU', 'classification_multiplier': 14169.722673838067}. Best is trial 22 with value: 0.7070637119113573.
[I 2025-06-12 08:50:32,122] Trial 52 finished with value: 0.5161588180978762 and parameters: {'hidden_dim': 1018, 'latent_dim': 30, 'beta': 1.8072566913865673, 'gamma': 1.6412375966929467, 'dropout_rate': 0.3369052188130296, 'lr': 0.0014850530088400837, 'scheduler_patience': 6, 'class_weight': 0.6433761121544104, 'activation': 'ReLU', 'classification_multiplier': 11345.68267161218}. Best is trial 22 with value: 0.7070637119113573.
