[I 2025-06-13 07:41:21,148] Trial 271 finished with value: 0.3380655586334257 and parameters: {'hidden_dim': 1292, 'latent_dim': 33, 'beta': 1.5979993244024528, 'gamma': 0.25954359709711894, 'dropout_rate': 0.14269333599035525, 'lr': 0.00046208994712015585, 'scheduler_patience': 7, 'class_weight': 0.4360244827787818, 'activation': 'ELU', 'classification_multiplier': 14371.111174989528}. Best is trial 194 with value: 0.8103647276084949.
              precision    recall  f1-score   support

Non-Repeater       0.22      0.96      0.36       149
    Repeater       0.99      0.68      0.81      1584

    accuracy                           0.71      1733
   macro avg       0.61      0.82      0.58      1733
weighted avg       0.93      0.71      0.77      1733

Confusion Matrix:
 [[ 143    6]
 [ 505 1079]]

=== Fold 2/5 ===
Validation Accuracy: 0.6705
Classification Report:
               precision    recall  f1-score   support

Non-Repeater       0.21      0.99      0.34       150
    Repeater       1.00      0.64      0.78      1583

    accuracy                           0.67      1733
   macro avg       0.60      0.82      0.56      1733
weighted avg       0.93      0.67      0.74      1733

Confusion Matrix:
 [[ 149    1]
 [ 570 1013]]

=== Fold 3/5 ===
Validation Accuracy: 0.6780
Classification Report:
               precision    recall  f1-score   support

Non-Repeater       0.21      0.99      0.35       150
    Repeater       1.00      0.65      0.79      1583

    accuracy                           0.68      1733
   macro avg       0.61      0.82      0.57      1733
weighted avg       0.93      0.68      0.75      1733

Confusion Matrix:
 [[ 149    1]
 [ 557 1026]]

=== Fold 4/5 ===
Validation Accuracy: 0.7836
Classification Report:
               precision    recall  f1-score   support

Non-Repeater       0.28      0.98      0.44       150
    Repeater       1.00      0.77      0.87      1583

    accuracy                           0.78      1733
   macro avg       0.64      0.87      0.65      1733
weighted avg       0.94      0.78      0.83      1733

Confusion Matrix:
 [[ 147    3]
 [ 372 1211]]

=== Fold 5/5 ===
Validation Accuracy: 0.7656
Classification Report:
               precision    recall  f1-score   support

Non-Repeater       0.27      0.97      0.42       149
    Repeater       1.00      0.75      0.85      1583

    accuracy                           0.77      1732
   macro avg       0.63      0.86      0.63      1732
weighted avg       0.93      0.77      0.82      1732

Confusion Matrix:
 [[ 145    4]
 [ 402 1181]]


=== Summary ===
Total False Positives: 15
Total False Negatives: 2406
Total True Positives: 5510
Total True Negatives: 733

Confusion Matrix (with duplicates):
              Non-Repeater  Repeater
Non-Repeater         733.0      15.0
Repeater            2406.0    5510.0
accuracy_score
0.7205678670360111
Trial 1: hidden_dim=1243, latent_dim=32, beta=1.5335440311598816, gamma=0.1908542386215564, dropout_rate=0.12319664969119809, lr=0.0003665237143702748, scheduler_patience=7, class_weight=2.6736727741630975, activation=ReLU, classification_multiplier=14768.062077627164

=== Fold 1/5 ===
Validation Accuracy: 0.5626
Classification Report:
               precision    recall  f1-score   support

Non-Repeater       0.16      1.00      0.28       149
    Repeater       1.00      0.52      0.69      1584

    accuracy                           0.56      1733
   macro avg       0.58      0.76      0.48      1733
weighted avg       0.93      0.56      0.65      1733

Confusion Matrix:
 [[149   0]
 [758 826]]

=== Fold 2/5 ===
Validation Accuracy: 0.3462
Classification Report:
               precision    recall  f1-score   support

Non-Repeater       0.12      1.00      0.21       150
    Repeater       1.00      0.28      0.44      1583

    accuracy                           0.35      1733
   macro avg       0.56      0.64      0.33      1733
weighted avg       0.92      0.35      0.42      1733

Confusion Matrix:
 [[ 150    0]
 [1133  450]]

=== Fold 3/5 ===
Validation Accuracy: 0.3537
Classification Report:
               precision    recall  f1-score   support

Non-Repeater       0.12      1.00      0.21       150
    Repeater       1.00      0.29      0.45      1583

    accuracy                           0.35      1733
   macro avg       0.56      0.65      0.33      1733
weighted avg       0.92      0.35      0.43      1733

Confusion Matrix:
 [[ 150    0]
 [1120  463]]

=== Fold 4/5 ===
Validation Accuracy: 0.1246
Classification Report:
               precision    recall  f1-score   support

Non-Repeater       0.09      1.00      0.17       150
    Repeater       1.00      0.04      0.08      1583

    accuracy                           0.12      1733
   macro avg       0.54      0.52      0.12      1733
weighted avg       0.92      0.12      0.09      1733

Confusion Matrix:
 [[ 150    0]
 [1517   66]]

=== Fold 5/5 ===
Validation Accuracy: 0.3031
Classification Report:
               precision    recall  f1-score   support

Non-Repeater       0.11      1.00      0.20       149
    Repeater       1.00      0.24      0.38      1583

    accuracy                           0.30      1732
   macro avg       0.55      0.62      0.29      1732
weighted avg       0.92      0.30      0.37      1732

Confusion Matrix:
 [[ 149    0]
 [1207  376]]


=== Summary ===
Total False Positives: 0
Total False Negatives: 5735
Total True Positives: 2181
Total True Negatives: 748

Confusion Matrix (with duplicates):
              Non-Repeater  Repeater
Non-Repeater         748.0       0.0
Repeater            5735.0    2181.0
accuracy_score
0.3380655586334257
Trial 1: hidden_dim=1292, latent_dim=33, beta=1.5979993244024528, gamma=0.25954359709711894, dropout_rate=0.14269333599035525, lr=0.00046208994712015585, scheduler_patience=7, class_weight=0.4360244827787818, activation=ELU, classification_multiplier=14371.111174989528

=== Fold 1/5 ===
Validation Accuracy: 0.6861
Classification Report:
               precision    recall  f1-score   support

Non-Repeater       0.21      0.99      0.35       149
    Repeater       1.00      0.66      0.79      1584

    accuracy                           0.69      1733
   macro avg       0.61      0.83      0.57      1733
weighted avg       0.93      0.69      0.75      1733

Confusion Matrix:
 [[ 148    1]
 [ 543 1041]]

=== Fold 2/5 ===
Validation Accuracy: 0.7628
Classification Report:
               precision    recall  f1-score   support

Non-Repeater       0.27      0.99      0.42       150
    Repeater       1.00      0.74      0.85      1583

    accuracy                           0.76      1733
   macro avg       0.63      0.87      0.64      1733
weighted avg       0.94      0.76      0.81      1733

Confusion Matrix:
 [[ 149    1]
 [ 410 1173]]

=== Fold 3/5 ===
Validation Accuracy: 0.7571
Classification Report:
               precision    recall  f1-score   support

Non-Repeater       0.26      0.99      0.41       150
    Repeater       1.00      0.73      0.85      1583

    accuracy                           0.76      1733
   macro avg       0.63      0.86      0.63      1733
weighted avg       0.94      0.76      0.81      1733

Confusion Matrix:
 [[ 149    1]
 [ 420 1163]]

=== Fold 4/5 ===
Validation Accuracy: 0.7998
Classification Report:
               precision    recall  f1-score   support

Non-Repeater       0.30      0.97      0.46       150
    Repeater       1.00      0.78      0.88      1583

    accuracy                           0.80      1733
   macro avg       0.65      0.88      0.67      1733
weighted avg       0.94      0.80      0.84      1733

Confusion Matrix:
 [[ 146    4]
 [ 343 1240]]

=== Fold 5/5 ===
Validation Accuracy: 0.7766
Classification Report:
               precision    recall  f1-score   support

Non-Repeater       0.27      0.97      0.43       149
    Repeater       1.00      0.76      0.86      1583

    accuracy                           0.78      1732
   macro avg       0.64      0.87      0.64      1732
weighted avg       0.93      0.78      0.82      1732

Confusion Matrix:
 [[ 145    4]
 [ 383 1200]]


=== Summary ===
Total False Positives: 11
Total False Negatives: 2099
Total True Positives: 5817
Total True Negatives: 737

Confusion Matrix (with duplicates):
              Non-Repeater  Repeater
Non-Repeater         737.0      11.0
Repeater            2099.0    5817.0
accuracy_score
0.7564635272391506
[I 2025-06-13 07:47:57,842] Trial 272 finished with value: 0.7564635272391506 and parameters: {'hidden_dim': 1488, 'latent_dim': 32, 'beta': 1.4323568266337003, 'gamma': 0.17157482633614723, 'dropout_rate': 0.13781592827319597, 'lr': 0.0002744861268447766, 'scheduler_patience': 7, 'class_weight': 2.8702532445611975, 'activation': 'ReLU', 'classification_multiplier': 14118.894236027778}. Best is trial 194 with value: 0.8103647276084949.
[I 2025-06-13 07:54:44,524] Trial 273 finished with value: 0.6986380424746076 and parameters: {'hidden_dim': 1551, 'latent_dim': 34, 'beta': 1.4986409168071064, 'gamma': 0.2218683002843151, 'dropout_rate': 0.12119259596629547, 'lr': 0.0006055763718290551, 'scheduler_patience': 7, 'class_weight': 2.7853500190630527, 'activation': 'ReLU', 'classification_multiplier': 14801.375573857138}. Best is trial 194 with value: 0.8103647276084949.
[I 2025-06-13 08:00:52,349] Trial 274 finished with value: 0.7337257617728532 and parameters: {'hidden_dim': 1203, 'latent_dim': 28, 'beta': 1.3747329304606286, 'gamma': 0.15506374377926824, 'dropout_rate': 0.1308897543915996, 'lr': 0.00027163607880851946, 'scheduler_patience': 7, 'class_weight': 2.7300936170364567, 'activation': 'ReLU', 'classification_multiplier': 14497.167817835829}. Best is trial 194 with value: 0.8103647276084949.
Trial 1: hidden_dim=1488, latent_dim=32, beta=1.4323568266337003, gamma=0.17157482633614723, dropout_rate=0.13781592827319597, lr=0.0002744861268447766, scheduler_patience=7, class_weight=2.8702532445611975, activation=ReLU, classification_multiplier=14118.894236027778

=== Fold 1/5 ===
Validation Accuracy: 0.7132
Classification Report:
               precision    recall  f1-score   support

Non-Repeater       0.23      0.99      0.37       149
    Repeater       1.00      0.69      0.81      1584

    accuracy                           0.71      1733
   macro avg       0.61      0.84      0.59      1733
weighted avg       0.93      0.71      0.78      1733

Confusion Matrix:
 [[ 148    1]
 [ 496 1088]]

=== Fold 2/5 ===
Validation Accuracy: 0.6342
Classification Report:
               precision    recall  f1-score   support

Non-Repeater       0.19      0.99      0.32       150
    Repeater       1.00      0.60      0.75      1583

    accuracy                           0.63      1733
   macro avg       0.59      0.80      0.53      1733
weighted avg       0.93      0.63      0.71      1733

Confusion Matrix:
 [[149   1]
 [633 950]]

=== Fold 3/5 ===
Validation Accuracy: 0.7496
Classification Report:
               precision    recall  f1-score   support

Non-Repeater       0.26      0.99      0.41       150
    Repeater       1.00      0.73      0.84      1583

    accuracy                           0.75      1733
   macro avg       0.63      0.86      0.62      1733
weighted avg       0.93      0.75      0.80      1733

Confusion Matrix:
 [[ 149    1]
 [ 433 1150]]

=== Fold 4/5 ===
Validation Accuracy: 0.5516
Classification Report:
               precision    recall  f1-score   support

Non-Repeater       0.16      0.99      0.28       150
    Repeater       1.00      0.51      0.68      1583

    accuracy                           0.55      1733
   macro avg       0.58      0.75      0.48      1733
weighted avg       0.93      0.55      0.64      1733

Confusion Matrix:
 [[149   1]
 [776 807]]

=== Fold 5/5 ===
Validation Accuracy: 0.8447
Classification Report:
               precision    recall  f1-score   support

Non-Repeater       0.35      0.96      0.52       149
    Repeater       1.00      0.83      0.91      1583

    accuracy                           0.84      1732
   macro avg       0.67      0.90      0.71      1732
weighted avg       0.94      0.84      0.87      1732

Confusion Matrix:
 [[ 143    6]
 [ 263 1320]]


=== Summary ===
Total False Positives: 10
Total False Negatives: 2601
Total True Positives: 5315
Total True Negatives: 738

Confusion Matrix (with duplicates):
              Non-Repeater  Repeater
Non-Repeater         738.0      10.0
Repeater            2601.0    5315.0
accuracy_score
0.6986380424746076
Trial 1: hidden_dim=1551, latent_dim=34, beta=1.4986409168071064, gamma=0.2218683002843151, dropout_rate=0.12119259596629547, lr=0.0006055763718290551, scheduler_patience=7, class_weight=2.7853500190630527, activation=ReLU, classification_multiplier=14801.375573857138

=== Fold 1/5 ===
Validation Accuracy: 0.7461
Classification Report:
               precision    recall  f1-score   support

Non-Repeater       0.25      0.99      0.40       149
    Repeater       1.00      0.72      0.84      1584

    accuracy                           0.75      1733
   macro avg       0.63      0.86      0.62      1733
weighted avg       0.93      0.75      0.80      1733

Confusion Matrix:
 [[ 148    1]
 [ 439 1145]]

=== Fold 2/5 ===
Validation Accuracy: 0.7796
Classification Report:
               precision    recall  f1-score   support

Non-Repeater       0.28      0.99      0.44       150
    Repeater       1.00      0.76      0.86      1583

    accuracy                           0.78      1733
   macro avg       0.64      0.88      0.65      1733
weighted avg       0.94      0.78      0.83      1733

Confusion Matrix:
 [[ 149    1]
 [ 381 1202]]

=== Fold 3/5 ===
Validation Accuracy: 0.6826
Classification Report:
               precision    recall  f1-score   support

Non-Repeater       0.21      0.99      0.35       150
    Repeater       1.00      0.65      0.79      1583

    accuracy                           0.68      1733
   macro avg       0.61      0.82      0.57      1733
weighted avg       0.93      0.68      0.75      1733

Confusion Matrix:
 [[ 149    1]
 [ 549 1034]]

=== Fold 4/5 ===
Validation Accuracy: 0.6884
Classification Report:
               precision    recall  f1-score   support

Non-Repeater       0.22      0.99      0.35       150
    Repeater       1.00      0.66      0.79      1583

    accuracy                           0.69      1733
   macro avg       0.61      0.82      0.57      1733
weighted avg       0.93      0.69      0.76      1733

Confusion Matrix:
 [[ 148    2]
 [ 538 1045]]

=== Fold 5/5 ===
Validation Accuracy: 0.7719
Classification Report:
               precision    recall  f1-score   support

Non-Repeater       0.27      0.97      0.42       149
    Repeater       1.00      0.75      0.86      1583

    accuracy                           0.77      1732
   macro avg       0.63      0.86      0.64      1732
weighted avg       0.93      0.77      0.82      1732

Confusion Matrix:
 [[ 145    4]
 [ 391 1192]]


=== Summary ===
Total False Positives: 9
Total False Negatives: 2298
Total True Positives: 5618
Total True Negatives: 739

Confusion Matrix (with duplicates):
              Non-Repeater  Repeater
Non-Repeater         739.0       9.0
Repeater            2298.0    5618.0
accuracy_score
0.7337257617728532
Trial 1: hidden_dim=1203, latent_dim=28, beta=1.3747329304606286, gamma=0.15506374377926824, dropout_rate=0.1308897543915996, lr=0.00027163607880851946, scheduler_patience=7, class_weight=2.7300936170364567, activation=ReLU, classification_multiplier=14497.167817835829

=== Fold 1/5 ===
Validation Accuracy: 0.7392
Classification Report:
               precision    recall  f1-score   support

Non-Repeater       0.25      0.99      0.40       149
    Repeater       1.00      0.72      0.83      1584

    accuracy                           0.74      1733
   macro avg       0.62      0.85      0.61      1733
weighted avg       0.93      0.74      0.80      1733

Confusion Matrix:
 [[ 148    1]
 [ 451 1133]]

=== Fold 2/5 ===
Validation Accuracy: 0.7409
Classification Report:
               precision    recall  f1-score   support

Non-Repeater       0.25      0.99      0.40       150
    Repeater       1.00      0.72      0.83      1583

    accuracy                           0.74      1733
   macro avg       0.62      0.86      0.62      1733
weighted avg       0.93      0.74      0.80      1733

Confusion Matrix:
 [[ 149    1]
 [ 448 1135]]

=== Fold 3/5 ===
Validation Accuracy: 0.7623
Classification Report:
               precision    recall  f1-score   support

Non-Repeater       0.27      0.99      0.42       150
    Repeater       1.00      0.74      0.85      1583

    accuracy                           0.76      1733
   macro avg       0.63      0.87      0.64      1733
weighted avg       0.94      0.76      0.81      1733

Confusion Matrix:
 [[ 149    1]
 [ 411 1172]]

=== Fold 4/5 ===
Validation Accuracy: 0.7161
Classification Report:
               precision    recall  f1-score   support

Non-Repeater       0.23      0.97      0.37       150
    Repeater       1.00      0.69      0.82      1583

    accuracy                           0.72      1733
   macro avg       0.61      0.83      0.59      1733
weighted avg       0.93      0.72      0.78      1733

Confusion Matrix:
 [[ 146    4]
 [ 488 1095]]

=== Fold 5/5 ===
Validation Accuracy: 0.8037
Classification Report:
               precision    recall  f1-score   support

Non-Repeater       0.30      0.97      0.46       149
    Repeater       1.00      0.79      0.88      1583

    accuracy                           0.80      1732
   macro avg       0.65      0.88      0.67      1732
weighted avg       0.94      0.80      0.84      1732

Confusion Matrix:
 [[ 145    4]
 [ 336 1247]]


=== Summary ===
Total False Positives: 11
Total False Negatives: 2134
Total True Positives: 5782
Total True Negatives: 737
[I 2025-06-13 08:07:13,815] Trial 275 finished with value: 0.7524238227146814 and parameters: {'hidden_dim': 1342, 'latent_dim': 32, 'beta': 1.4195904537191357, 'gamma': 0.19598363126520352, 'dropout_rate': 0.11468391876783543, 'lr': 0.0005211976116700367, 'scheduler_patience': 7, 'class_weight': 2.8545421568779408, 'activation': 'ReLU', 'classification_multiplier': 14645.105022724978}. Best is trial 194 with value: 0.8103647276084949.
[I 2025-06-13 08:13:27,237] Trial 276 finished with value: 0.7206832871652816 and parameters: {'hidden_dim': 1254, 'latent_dim': 30, 'beta': 1.4692259902035367, 'gamma': 0.131427703358807, 'dropout_rate': 0.15875986238340653, 'lr': 0.0008172687928654015, 'scheduler_patience': 7, 'class_weight': 2.498238697540778, 'activation': 'ReLU', 'classification_multiplier': 14853.487422276563}. Best is trial 194 with value: 0.8103647276084949.
