[I 2025-06-13 06:31:15,733] Trial 260 finished with value: 0.32871652816251157 and parameters: {'hidden_dim': 1390, 'latent_dim': 31, 'beta': 1.5110033042378876, 'gamma': 0.20232593839046803, 'dropout_rate': 0.12907112472621626, 'lr': 0.0005856408401588379, 'scheduler_patience': 7, 'class_weight': 2.6308402982879437, 'activation': 'SELU', 'classification_multiplier': 14813.436867337734}. Best is trial 194 with value: 0.8103647276084949.
              precision    recall  f1-score   support

Non-Repeater       0.24      0.97      0.39       149
    Repeater       1.00      0.71      0.83      1583

    accuracy                           0.74      1732
   macro avg       0.62      0.84      0.61      1732
weighted avg       0.93      0.74      0.79      1732

Confusion Matrix:
 [[ 145    4]
 [ 453 1130]]


=== Summary ===
Total False Positives: 8
Total False Negatives: 2635
Total True Positives: 5281
Total True Negatives: 740

Confusion Matrix (with duplicates):
              Non-Repeater  Repeater
Non-Repeater         740.0       8.0
Repeater            2635.0    5281.0
accuracy_score
0.6949445983379502
Trial 1: hidden_dim=1517, latent_dim=32, beta=1.514840451068254, gamma=1.48697309648283, dropout_rate=0.13465192734527745, lr=0.000918162003722159, scheduler_patience=4, class_weight=2.6808826844470364, activation=ReLU, classification_multiplier=14337.178997492465

=== Fold 1/5 ===
Validation Accuracy: 0.6728
Classification Report:
               precision    recall  f1-score   support

Non-Repeater       0.21      0.99      0.34       149
    Repeater       1.00      0.64      0.78      1584

    accuracy                           0.67      1733
   macro avg       0.60      0.82      0.56      1733
weighted avg       0.93      0.67      0.74      1733

Confusion Matrix:
 [[ 148    1]
 [ 566 1018]]

=== Fold 2/5 ===
Validation Accuracy: 0.6919
Classification Report:
               precision    recall  f1-score   support

Non-Repeater       0.22      0.99      0.36       150
    Repeater       1.00      0.66      0.80      1583

    accuracy                           0.69      1733
   macro avg       0.61      0.83      0.58      1733
weighted avg       0.93      0.69      0.76      1733

Confusion Matrix:
 [[ 149    1]
 [ 533 1050]]

=== Fold 3/5 ===
Validation Accuracy: 0.6272
Classification Report:
               precision    recall  f1-score   support

Non-Repeater       0.19      0.99      0.32       150
    Repeater       1.00      0.59      0.74      1583

    accuracy                           0.63      1733
   macro avg       0.59      0.79      0.53      1733
weighted avg       0.93      0.63      0.71      1733

Confusion Matrix:
 [[149   1]
 [645 938]]

=== Fold 4/5 ===
Validation Accuracy: 0.6474
Classification Report:
               precision    recall  f1-score   support

Non-Repeater       0.20      0.99      0.33       150
    Repeater       1.00      0.62      0.76      1583

    accuracy                           0.65      1733
   macro avg       0.60      0.80      0.54      1733
weighted avg       0.93      0.65      0.72      1733

Confusion Matrix:
 [[148   2]
 [609 974]]

=== Fold 5/5 ===
Validation Accuracy: 0.7615
Classification Report:
               precision    recall  f1-score   support

Non-Repeater       0.26      0.98      0.41       149
    Repeater       1.00      0.74      0.85      1583

    accuracy                           0.76      1732
   macro avg       0.63      0.86      0.63      1732
weighted avg       0.93      0.76      0.81      1732

Confusion Matrix:
 [[ 146    3]
 [ 410 1173]]


=== Summary ===
Total False Positives: 8
Total False Negatives: 2763
Total True Positives: 5153
Total True Negatives: 740

Confusion Matrix (with duplicates):
              Non-Repeater  Repeater
Non-Repeater         740.0       8.0
Repeater            2763.0    5153.0
accuracy_score
0.6801708217913204
Trial 1: hidden_dim=1450, latent_dim=29, beta=1.582427596080658, gamma=0.1464858921424991, dropout_rate=0.15550877200845667, lr=0.0006491357897452046, scheduler_patience=7, class_weight=2.869862866647603, activation=ReLU, classification_multiplier=14623.21977086095

=== Fold 1/5 ===
Validation Accuracy: 0.4028
Classification Report:
               precision    recall  f1-score   support

Non-Repeater       0.13      1.00      0.22       149
    Repeater       1.00      0.35      0.51      1584

    accuracy                           0.40      1733
   macro avg       0.56      0.67      0.37      1733
weighted avg       0.92      0.40      0.49      1733

Confusion Matrix:
 [[ 149    0]
 [1035  549]]

=== Fold 2/5 ===
Validation Accuracy: 0.3543
Classification Report:
               precision    recall  f1-score   support

Non-Repeater       0.12      1.00      0.21       150
    Repeater       1.00      0.29      0.45      1583

    accuracy                           0.35      1733
   macro avg       0.56      0.65      0.33      1733
weighted avg       0.92      0.35      0.43      1733

Confusion Matrix:
 [[ 150    0]
 [1119  464]]

=== Fold 3/5 ===
Validation Accuracy: 0.3791
Classification Report:
               precision    recall  f1-score   support

Non-Repeater       0.12      1.00      0.22       150
    Repeater       1.00      0.32      0.49      1583

    accuracy                           0.38      1733
   macro avg       0.56      0.66      0.35      1733
weighted avg       0.92      0.38      0.46      1733

Confusion Matrix:
 [[ 150    0]
 [1076  507]]

=== Fold 4/5 ===
Validation Accuracy: 0.2389
Classification Report:
               precision    recall  f1-score   support

Non-Repeater       0.10      1.00      0.19       150
    Repeater       1.00      0.17      0.29      1583

    accuracy                           0.24      1733
   macro avg       0.55      0.58      0.24      1733
weighted avg       0.92      0.24      0.28      1733

Confusion Matrix:
 [[ 150    0]
 [1319  264]]

=== Fold 5/5 ===
Validation Accuracy: 0.2685
Classification Report:
               precision    recall  f1-score   support

Non-Repeater       0.11      1.00      0.19       149
    Repeater       1.00      0.20      0.33      1583

    accuracy                           0.27      1732
   macro avg       0.55      0.60      0.26      1732
weighted avg       0.92      0.27      0.32      1732

Confusion Matrix:
 [[ 149    0]
 [1267  316]]


=== Summary ===
Total False Positives: 0
Total False Negatives: 5816
Total True Positives: 2100
Total True Negatives: 748

Confusion Matrix (with duplicates):
              Non-Repeater  Repeater
Non-Repeater         748.0       0.0
Repeater            5816.0    2100.0
accuracy_score
0.32871652816251157
Trial 1: hidden_dim=1390, latent_dim=31, beta=1.5110033042378876, gamma=0.20232593839046803, dropout_rate=0.12907112472621626, lr=0.0005856408401588379, scheduler_patience=7, class_weight=2.6308402982879437, activation=SELU, classification_multiplier=14813.436867337734

=== Fold 1/5 ===
Validation Accuracy: 0.6538
Classification Report:
               precision    recall  f1-score   support

Non-Repeater       0.20      0.99      0.33       149
    Repeater       1.00      0.62      0.77      1584

    accuracy                           0.65      1733
   macro avg       0.60      0.80      0.55      1733
weighted avg       0.93      0.65      0.73      1733

Confusion Matrix:
 [[147   2]
 [598 986]]

=== Fold 2/5 ===
Validation Accuracy: 0.7778
Classification Report:
               precision    recall  f1-score   support

Non-Repeater       0.28      0.99      0.43       150
    Repeater       1.00      0.76      0.86      1583

    accuracy                           0.78      1733
   macro avg       0.64      0.87      0.65      1733
weighted avg       0.94      0.78      0.82      1733

Confusion Matrix:
 [[ 148    2]
 [ 383 1200]]

=== Fold 3/5 ===
Validation Accuracy: 0.7484
Classification Report:
               precision    recall  f1-score   support

Non-Repeater       0.25      0.99      0.40       150
    Repeater       1.00      0.73      0.84      1583

    accuracy                           0.75      1733
   macro avg       0.63      0.86      0.62      1733
weighted avg       0.93      0.75      0.80      1733

Confusion Matrix:
 [[ 148    2]
 [ 434 1149]]

=== Fold 4/5 ===
Validation Accuracy: 0.5436
Classification Report:
 [I 2025-06-13 06:37:44,319] Trial 261 finished with value: 0.701061865189289 and parameters: {'hidden_dim': 1424, 'latent_dim': 33, 'beta': 1.4776714440867913, 'gamma': 0.14950850716617853, 'dropout_rate': 0.14565876105549402, 'lr': 0.0009507779746731483, 'scheduler_patience': 7, 'class_weight': 2.8161861988046635, 'activation': 'ReLU', 'classification_multiplier': 14532.525200811839}. Best is trial 194 with value: 0.8103647276084949.
[I 2025-06-13 06:44:09,572] Trial 262 finished with value: 0.7697368421052632 and parameters: {'hidden_dim': 1369, 'latent_dim': 32, 'beta': 1.3142163287116897, 'gamma': 0.2564494834992105, 'dropout_rate': 0.12335211078897289, 'lr': 0.000442434954001879, 'scheduler_patience': 7, 'class_weight': 2.7609326284003717, 'activation': 'ReLU', 'classification_multiplier': 14984.916877597945}. Best is trial 194 with value: 0.8103647276084949.
[I 2025-06-13 06:50:45,444] Trial 263 finished with value: 0.6486611265004617 and parameters: {'hidden_dim': 1449, 'latent_dim': 34, 'beta': 1.3107107192255922, 'gamma': 0.17478500002456612, 'dropout_rate': 0.4953630070921252, 'lr': 0.0003828369575559885, 'scheduler_patience': 7, 'class_weight': 2.7361437158148365, 'activation': 'ReLU', 'classification_multiplier': 14988.351005314575}. Best is trial 194 with value: 0.8103647276084949.
              precision    recall  f1-score   support

Non-Repeater       0.16      0.99      0.27       150
    Repeater       1.00      0.50      0.67      1583

    accuracy                           0.54      1733
   macro avg       0.58      0.74      0.47      1733
weighted avg       0.92      0.54      0.63      1733

Confusion Matrix:
 [[148   2]
 [789 794]]

=== Fold 5/5 ===
Validation Accuracy: 0.7818
Classification Report:
               precision    recall  f1-score   support

Non-Repeater       0.28      0.97      0.43       149
    Repeater       1.00      0.76      0.86      1583

    accuracy                           0.78      1732
   macro avg       0.64      0.87      0.65      1732
weighted avg       0.93      0.78      0.83      1732

Confusion Matrix:
 [[ 145    4]
 [ 374 1209]]


=== Summary ===
Total False Positives: 12
Total False Negatives: 2578
Total True Positives: 5338
Total True Negatives: 736

Confusion Matrix (with duplicates):
              Non-Repeater  Repeater
Non-Repeater         736.0      12.0
Repeater            2578.0    5338.0
accuracy_score
0.701061865189289
Trial 1: hidden_dim=1424, latent_dim=33, beta=1.4776714440867913, gamma=0.14950850716617853, dropout_rate=0.14565876105549402, lr=0.0009507779746731483, scheduler_patience=7, class_weight=2.8161861988046635, activation=ReLU, classification_multiplier=14532.525200811839

=== Fold 1/5 ===
Validation Accuracy: 0.7790
Classification Report:
               precision    recall  f1-score   support

Non-Repeater       0.28      0.99      0.44       149
    Repeater       1.00      0.76      0.86      1584

    accuracy                           0.78      1733
   macro avg       0.64      0.88      0.65      1733
weighted avg       0.94      0.78      0.83      1733

Confusion Matrix:
 [[ 148    1]
 [ 382 1202]]

=== Fold 2/5 ===
Validation Accuracy: 0.7409
Classification Report:
               precision    recall  f1-score   support

Non-Repeater       0.25      0.99      0.40       150
    Repeater       1.00      0.72      0.83      1583

    accuracy                           0.74      1733
   macro avg       0.62      0.86      0.62      1733
weighted avg       0.93      0.74      0.80      1733

Confusion Matrix:
 [[ 149    1]
 [ 448 1135]]

=== Fold 3/5 ===
Validation Accuracy: 0.7548
Classification Report:
               precision    recall  f1-score   support

Non-Repeater       0.26      0.99      0.41       150
    Repeater       1.00      0.73      0.85      1583

    accuracy                           0.75      1733
   macro avg       0.63      0.86      0.63      1733
weighted avg       0.93      0.75      0.81      1733

Confusion Matrix:
 [[ 148    2]
 [ 423 1160]]

=== Fold 4/5 ===
Validation Accuracy: 0.7005
Classification Report:
               precision    recall  f1-score   support

Non-Repeater       0.22      0.99      0.36       150
    Repeater       1.00      0.67      0.80      1583

    accuracy                           0.70      1733
   macro avg       0.61      0.83      0.58      1733
weighted avg       0.93      0.70      0.77      1733

Confusion Matrix:
 [[ 148    2]
 [ 517 1066]]

=== Fold 5/5 ===
Validation Accuracy: 0.8736
Classification Report:
               precision    recall  f1-score   support

Non-Repeater       0.40      0.97      0.57       149
    Repeater       1.00      0.86      0.93      1583

    accuracy                           0.87      1732
   macro avg       0.70      0.92      0.75      1732
weighted avg       0.95      0.87      0.90      1732

Confusion Matrix:
 [[ 145    4]
 [ 215 1368]]


=== Summary ===
Total False Positives: 10
Total False Negatives: 1985
Total True Positives: 5931
Total True Negatives: 738

Confusion Matrix (with duplicates):
              Non-Repeater  Repeater
Non-Repeater         738.0      10.0
Repeater            1985.0    5931.0
accuracy_score
0.7697368421052632
Trial 1: hidden_dim=1369, latent_dim=32, beta=1.3142163287116897, gamma=0.2564494834992105, dropout_rate=0.12335211078897289, lr=0.000442434954001879, scheduler_patience=7, class_weight=2.7609326284003717, activation=ReLU, classification_multiplier=14984.916877597945

=== Fold 1/5 ===
Validation Accuracy: 0.6896
Classification Report:
               precision    recall  f1-score   support

Non-Repeater       0.22      0.99      0.35       149
    Repeater       1.00      0.66      0.80      1584

    accuracy                           0.69      1733
   macro avg       0.61      0.83      0.58      1733
weighted avg       0.93      0.69      0.76      1733

Confusion Matrix:
 [[ 148    1]
 [ 537 1047]]

=== Fold 2/5 ===
Validation Accuracy: 0.6295
Classification Report:
               precision    recall  f1-score   support

Non-Repeater       0.19      0.99      0.32       150
    Repeater       1.00      0.60      0.75      1583

    accuracy                           0.63      1733
   macro avg       0.59      0.79      0.53      1733
weighted avg       0.93      0.63      0.71      1733

Confusion Matrix:
 [[149   1]
 [641 942]]

=== Fold 3/5 ===
Validation Accuracy: 0.6647
Classification Report:
               precision    recall  f1-score   support

Non-Repeater       0.20      0.99      0.34       150
    Repeater       1.00      0.63      0.78      1583

    accuracy                           0.66      1733
   macro avg       0.60      0.81      0.56      1733
weighted avg       0.93      0.66      0.74      1733

Confusion Matrix:
 [[ 149    1]
 [ 580 1003]]

=== Fold 4/5 ===
Validation Accuracy: 0.5909
Classification Report:
               precision    recall  f1-score   support

Non-Repeater       0.17      0.99      0.30       150
    Repeater       1.00      0.55      0.71      1583

    accuracy                           0.59      1733
   macro avg       0.59      0.77      0.50      1733
weighted avg       0.93      0.59      0.68      1733

Confusion Matrix:
 [[149   1]
 [708 875]]

=== Fold 5/5 ===
Validation Accuracy: 0.6686
Classification Report:
               precision    recall  f1-score   support

Non-Repeater       0.20      0.99      0.34       149
    Repeater       1.00      0.64      0.78      1583

    accuracy                           0.67      1732
   macro avg       0.60      0.81      0.56      1732
weighted avg       0.93      0.67      0.74      1732

Confusion Matrix:
 [[ 147    2]
 [ 572 1011]]


=== Summary ===
Total False Positives: 6
Total False Negatives: 3038
Total True Positives: 4878
Total True Negatives: 742

Confusion Matrix (with duplicates):
              Non-Repeater  Repeater
Non-Repeater         742.0       6.0
Repeater            3038.0    4878.0
accuracy_score
0.6486611265004617
Trial 1: hidden_dim=1449, latent_dim=34, beta=1.3107107192255922, gamma=0.17478500002456612, dropout_rate=0.4953630070921252, lr=0.0003828369575559885, scheduler_patience=7, class_weight=2.7361437158148365, activation=ReLU, classification_multiplier=14988.351005314575

=== Fold 1/5 ===
Validation Accuracy: 0.0877
Classification Report:
               precision    recall  f1-score   support

Non-Repeater       0.09      1.00      0.16       149
    Repeater       1.00      0.00      0.00      1584

    accuracy                           0.09      1733
   macro avg       0.54      0.50      0.08      1733
weighted avg       0.92      0.09      0.02      1733

Confusion Matrix:
 [[ 149    0]
 [1581    3]]

=== Fold 2/5 ===
Validation Accuracy: 0.1021
Classification Report:
               precision    recall  f1-score   support

Non-Repeater       0.09      1.00      0.16       150
    Repeater       1.00      0.02      0.03      1583

    accuracy                           0.10      1733
   macro avg       0.54      0.51      0.10      1733
weighted avg       0.92      0.10      0.04      1733

Confusion Matrix:
 [[ 150    0]
 [1556   27]]

=== Fold 3/5 ===
Validation Accuracy: 0.0877
Classification Report:
 [I 2025-06-13 06:57:30,504] Trial 264 finished with value: 0.10549399815327794 and parameters: {'hidden_dim': 1527, 'latent_dim': 32, 'beta': 1.3569426337906436, 'gamma': 0.13393792141645944, 'dropout_rate': 0.4474808787335618, 'lr': 0.004232017850990821, 'scheduler_patience': 7, 'class_weight': 2.756380996800777, 'activation': 'ReLU', 'classification_multiplier': 14715.15926597531}. Best is trial 194 with value: 0.8103647276084949.
[I 2025-06-13 07:03:47,079] Trial 265 finished with value: 0.7660433979686058 and parameters: {'hidden_dim': 1286, 'latent_dim': 33, 'beta': 1.4296784865173284, 'gamma': 0.28828902262617057, 'dropout_rate': 0.13917519790376562, 'lr': 0.0002613636109691764, 'scheduler_patience': 7, 'class_weight': 2.659484267558293, 'activation': 'ReLU', 'classification_multiplier': 14153.238380347299}. Best is trial 194 with value: 0.8103647276084949.
