[I 2025-06-13 08:59:10,157] Trial 283 finished with value: 0.7505771006463527 and parameters: {'hidden_dim': 1327, 'latent_dim': 32, 'beta': 1.4904609234062194, 'gamma': 0.15922560119570375, 'dropout_rate': 0.13954551521752773, 'lr': 0.0004916651474369902, 'scheduler_patience': 7, 'class_weight': 2.7929058870710914, 'activation': 'ReLU', 'classification_multiplier': 14979.33382071372}. Best is trial 194 with value: 0.8103647276084949.
              precision    recall  f1-score   support

Non-Repeater       0.25      0.97      0.40       149
    Repeater       1.00      0.73      0.84      1583

    accuracy                           0.75      1732
   macro avg       0.62      0.85      0.62      1732
weighted avg       0.93      0.75      0.80      1732

Confusion Matrix:
 [[ 144    5]
 [ 427 1156]]


=== Summary ===
Total False Positives: 11
Total False Negatives: 2182
Total True Positives: 5734
Total True Negatives: 737

Confusion Matrix (with duplicates):
              Non-Repeater  Repeater
Non-Repeater         737.0      11.0
Repeater            2182.0    5734.0
accuracy_score
0.7468836565096952
Trial 1: hidden_dim=1452, latent_dim=34, beta=1.8957486463649982, gamma=0.17423053271603103, dropout_rate=0.1261223716934433, lr=0.00010389158657831413, scheduler_patience=7, class_weight=2.957166302555914, activation=ReLU, classification_multiplier=14495.031547719183

=== Fold 1/5 ===
Validation Accuracy: 0.6930
Classification Report:
               precision    recall  f1-score   support

Non-Repeater       0.22      0.99      0.36       149
    Repeater       1.00      0.66      0.80      1584

    accuracy                           0.69      1733
   macro avg       0.61      0.83      0.58      1733
weighted avg       0.93      0.69      0.76      1733

Confusion Matrix:
 [[ 148    1]
 [ 531 1053]]

=== Fold 2/5 ===
Validation Accuracy: 0.5972
Classification Report:
               precision    recall  f1-score   support

Non-Repeater       0.18      0.99      0.30       150
    Repeater       1.00      0.56      0.72      1583

    accuracy                           0.60      1733
   macro avg       0.59      0.78      0.51      1733
weighted avg       0.93      0.60      0.68      1733

Confusion Matrix:
 [[149   1]
 [697 886]]

=== Fold 3/5 ===
Validation Accuracy: 0.1385
Classification Report:
               precision    recall  f1-score   support

Non-Repeater       0.09      1.00      0.17       150
    Repeater       1.00      0.06      0.11      1583

    accuracy                           0.14      1733
   macro avg       0.55      0.53      0.14      1733
weighted avg       0.92      0.14      0.11      1733

Confusion Matrix:
 [[ 150    0]
 [1493   90]]

=== Fold 4/5 ===
Validation Accuracy: 0.6751
Classification Report:
               precision    recall  f1-score   support

Non-Repeater       0.21      0.99      0.35       150
    Repeater       1.00      0.64      0.78      1583

    accuracy                           0.68      1733
   macro avg       0.60      0.82      0.56      1733
weighted avg       0.93      0.68      0.75      1733

Confusion Matrix:
 [[ 149    1]
 [ 562 1021]]

=== Fold 5/5 ===
Validation Accuracy: 0.6726
Classification Report:
               precision    recall  f1-score   support

Non-Repeater       0.21      0.99      0.34       149
    Repeater       1.00      0.64      0.78      1583

    accuracy                           0.67      1732
   macro avg       0.60      0.82      0.56      1732
weighted avg       0.93      0.67      0.74      1732

Confusion Matrix:
 [[ 148    1]
 [ 566 1017]]


=== Summary ===
Total False Positives: 4
Total False Negatives: 3849
Total True Positives: 4067
Total True Negatives: 744

Confusion Matrix (with duplicates):
              Non-Repeater  Repeater
Non-Repeater         744.0       4.0
Repeater            3849.0    4067.0
accuracy_score
0.555286241920591
Trial 1: hidden_dim=1429, latent_dim=33, beta=1.5326422128790187, gamma=0.2001420736986234, dropout_rate=0.1088848155682323, lr=0.0011551182879296462, scheduler_patience=7, class_weight=0.8274501547204975, activation=ReLU, classification_multiplier=14682.558931804033

=== Fold 1/5 ===
Validation Accuracy: 0.7161
Classification Report:
               precision    recall  f1-score   support

Non-Repeater       0.23      0.99      0.38       149
    Repeater       1.00      0.69      0.82      1584

    accuracy                           0.72      1733
   macro avg       0.62      0.84      0.60      1733
weighted avg       0.93      0.72      0.78      1733

Confusion Matrix:
 [[ 148    1]
 [ 491 1093]]

=== Fold 2/5 ===
Validation Accuracy: 0.7877
Classification Report:
               precision    recall  f1-score   support

Non-Repeater       0.29      0.99      0.45       150
    Repeater       1.00      0.77      0.87      1583

    accuracy                           0.79      1733
   macro avg       0.64      0.88      0.66      1733
weighted avg       0.94      0.79      0.83      1733

Confusion Matrix:
 [[ 149    1]
 [ 367 1216]]

=== Fold 3/5 ===
Validation Accuracy: 0.7594
Classification Report:
               precision    recall  f1-score   support

Non-Repeater       0.26      0.99      0.42       150
    Repeater       1.00      0.74      0.85      1583

    accuracy                           0.76      1733
   macro avg       0.63      0.86      0.63      1733
weighted avg       0.93      0.76      0.81      1733

Confusion Matrix:
 [[ 148    2]
 [ 415 1168]]

=== Fold 4/5 ===
Validation Accuracy: 0.7248
Classification Report:
               precision    recall  f1-score   support

Non-Repeater       0.24      0.98      0.38       150
    Repeater       1.00      0.70      0.82      1583

    accuracy                           0.72      1733
   macro avg       0.62      0.84      0.60      1733
weighted avg       0.93      0.72      0.78      1733

Confusion Matrix:
 [[ 147    3]
 [ 474 1109]]

=== Fold 5/5 ===
Validation Accuracy: 0.7650
Classification Report:
               precision    recall  f1-score   support

Non-Repeater       0.26      0.97      0.42       149
    Repeater       1.00      0.75      0.85      1583

    accuracy                           0.77      1732
   macro avg       0.63      0.86      0.63      1732
weighted avg       0.93      0.77      0.82      1732

Confusion Matrix:
 [[ 145    4]
 [ 403 1180]]


=== Summary ===
Total False Positives: 11
Total False Negatives: 2150
Total True Positives: 5766
Total True Negatives: 737

Confusion Matrix (with duplicates):
              Non-Repeater  Repeater
Non-Repeater         737.0      11.0
Repeater            2150.0    5766.0
accuracy_score
0.7505771006463527
Trial 1: hidden_dim=1327, latent_dim=32, beta=1.4904609234062194, gamma=0.15922560119570375, dropout_rate=0.13954551521752773, lr=0.0004916651474369902, scheduler_patience=7, class_weight=2.7929058870710914, activation=ReLU, classification_multiplier=14979.33382071372

=== Fold 1/5 ===
Validation Accuracy: 0.6872
Classification Report:
               precision    recall  f1-score   support

Non-Repeater       0.22      1.00      0.35       149
    Repeater       1.00      0.66      0.79      1584

    accuracy                           0.69      1733
   macro avg       0.61      0.83      0.57      1733
weighted avg       0.93      0.69      0.76      1733

Confusion Matrix:
 [[ 149    0]
 [ 542 1042]]

=== Fold 2/5 ===
Validation Accuracy: 0.7703
Classification Report:
               precision    recall  f1-score   support

Non-Repeater       0.27      0.99      0.43       150
    Repeater       1.00      0.75      0.86      1583

    accuracy                           0.77      1733
   macro avg       0.64      0.87      0.64      1733
weighted avg       0.94      0.77      0.82      1733

Confusion Matrix:
 [[ 149    1]
 [ 397 1186]]

=== Fold 3/5 ===
Validation Accuracy: 0.4443
Classification Report:
               precision    recall  f1-score   support

Non-Repeater       0.13      1.00      0.24       150
    Repeater       1.00      0.39      0.56      1583

    accuracy                           0.44      1733
   macro avg       0.57      0.70      0.40      1733
weighted avg       0.93      0.44      0.53      1733

Confusion Matrix:
 [[150   0]
 [963 620]]

=== Fold 4/5 ===
Validation Accuracy: 0.7755
Classification Report:
 [I 2025-06-13 09:05:22,542] Trial 284 finished with value: 0.7292243767313019 and parameters: {'hidden_dim': 1246, 'latent_dim': 33, 'beta': 1.612757547682204, 'gamma': 0.24447655290861894, 'dropout_rate': 0.11809758399345709, 'lr': 0.0007877719923404157, 'scheduler_patience': 7, 'class_weight': 2.884242459947502, 'activation': 'ReLU', 'classification_multiplier': 14181.13142776295}. Best is trial 194 with value: 0.8103647276084949.
[I 2025-06-13 09:11:40,581] Trial 285 finished with value: 0.7000230840258541 and parameters: {'hidden_dim': 1281, 'latent_dim': 30, 'beta': 1.40210277340318, 'gamma': 1.3637471646112669, 'dropout_rate': 0.1346846515640696, 'lr': 0.00024598275700188615, 'scheduler_patience': 7, 'class_weight': 2.7407400515778155, 'activation': 'ReLU', 'classification_multiplier': 14478.502359261493}. Best is trial 194 with value: 0.8103647276084949.
[I 2025-06-13 09:18:17,432] Trial 286 finished with value: 0.7334949215143121 and parameters: {'hidden_dim': 1490, 'latent_dim': 31, 'beta': 1.5633872911904538, 'gamma': 0.1392851215628231, 'dropout_rate': 0.14632305774504434, 'lr': 0.0005731628715284216, 'scheduler_patience': 7, 'class_weight': 2.8290212355035, 'activation': 'ReLU', 'classification_multiplier': 13736.497819326147}. Best is trial 194 with value: 0.8103647276084949.
              precision    recall  f1-score   support

Non-Repeater       0.27      0.97      0.43       150
    Repeater       1.00      0.76      0.86      1583

    accuracy                           0.78      1733
   macro avg       0.63      0.86      0.64      1733
weighted avg       0.93      0.78      0.82      1733

Confusion Matrix:
 [[ 145    5]
 [ 384 1199]]

=== Fold 5/5 ===
Validation Accuracy: 0.9688
Classification Report:
               precision    recall  f1-score   support

Non-Repeater       0.76      0.94      0.84       149
    Repeater       0.99      0.97      0.98      1583

    accuracy                           0.97      1732
   macro avg       0.88      0.96      0.91      1732
weighted avg       0.97      0.97      0.97      1732

Confusion Matrix:
 [[ 140    9]
 [  45 1538]]


=== Summary ===
Total False Positives: 15
Total False Negatives: 2331
Total True Positives: 5585
Total True Negatives: 733

Confusion Matrix (with duplicates):
              Non-Repeater  Repeater
Non-Repeater         733.0      15.0
Repeater            2331.0    5585.0
accuracy_score
0.7292243767313019
Trial 1: hidden_dim=1246, latent_dim=33, beta=1.612757547682204, gamma=0.24447655290861894, dropout_rate=0.11809758399345709, lr=0.0007877719923404157, scheduler_patience=7, class_weight=2.884242459947502, activation=ReLU, classification_multiplier=14181.13142776295

=== Fold 1/5 ===
Validation Accuracy: 0.6826
Classification Report:
               precision    recall  f1-score   support

Non-Repeater       0.21      0.99      0.35       149
    Repeater       1.00      0.65      0.79      1584

    accuracy                           0.68      1733
   macro avg       0.61      0.82      0.57      1733
weighted avg       0.93      0.68      0.75      1733

Confusion Matrix:
 [[ 148    1]
 [ 549 1035]]

=== Fold 2/5 ===
Validation Accuracy: 0.6751
Classification Report:
               precision    recall  f1-score   support

Non-Repeater       0.21      0.99      0.35       150
    Repeater       1.00      0.64      0.78      1583

    accuracy                           0.68      1733
   macro avg       0.60      0.82      0.56      1733
weighted avg       0.93      0.68      0.75      1733

Confusion Matrix:
 [[ 149    1]
 [ 562 1021]]

=== Fold 3/5 ===
Validation Accuracy: 0.7178
Classification Report:
               precision    recall  f1-score   support

Non-Repeater       0.23      0.99      0.38       150
    Repeater       1.00      0.69      0.82      1583

    accuracy                           0.72      1733
   macro avg       0.62      0.84      0.60      1733
weighted avg       0.93      0.72      0.78      1733

Confusion Matrix:
 [[ 149    1]
 [ 488 1095]]

=== Fold 4/5 ===
Validation Accuracy: 0.6746
Classification Report:
               precision    recall  f1-score   support

Non-Repeater       0.21      0.99      0.34       150
    Repeater       1.00      0.64      0.78      1583

    accuracy                           0.67      1733
   macro avg       0.60      0.82      0.56      1733
weighted avg       0.93      0.67      0.75      1733

Confusion Matrix:
 [[ 148    2]
 [ 562 1021]]

=== Fold 5/5 ===
Validation Accuracy: 0.7500
Classification Report:
               precision    recall  f1-score   support

Non-Repeater       0.25      0.97      0.40       149
    Repeater       1.00      0.73      0.84      1583

    accuracy                           0.75      1732
   macro avg       0.62      0.85      0.62      1732
weighted avg       0.93      0.75      0.80      1732

Confusion Matrix:
 [[ 144    5]
 [ 428 1155]]


=== Summary ===
Total False Positives: 10
Total False Negatives: 2589
Total True Positives: 5327
Total True Negatives: 738

Confusion Matrix (with duplicates):
              Non-Repeater  Repeater
Non-Repeater         738.0      10.0
Repeater            2589.0    5327.0
accuracy_score
0.7000230840258541
Trial 1: hidden_dim=1281, latent_dim=30, beta=1.40210277340318, gamma=1.3637471646112669, dropout_rate=0.1346846515640696, lr=0.00024598275700188615, scheduler_patience=7, class_weight=2.7407400515778155, activation=ReLU, classification_multiplier=14478.502359261493

=== Fold 1/5 ===
Validation Accuracy: 0.7230
Classification Report:
               precision    recall  f1-score   support

Non-Repeater       0.24      0.99      0.38       149
    Repeater       1.00      0.70      0.82      1584

    accuracy                           0.72      1733
   macro avg       0.62      0.84      0.60      1733
weighted avg       0.93      0.72      0.78      1733

Confusion Matrix:
 [[ 147    2]
 [ 478 1106]]

=== Fold 2/5 ===
Validation Accuracy: 0.7669
Classification Report:
               precision    recall  f1-score   support

Non-Repeater       0.27      0.99      0.42       150
    Repeater       1.00      0.75      0.85      1583

    accuracy                           0.77      1733
   macro avg       0.63      0.87      0.64      1733
weighted avg       0.94      0.77      0.82      1733

Confusion Matrix:
 [[ 149    1]
 [ 403 1180]]

=== Fold 3/5 ===
Validation Accuracy: 0.6872
Classification Report:
               precision    recall  f1-score   support

Non-Repeater       0.22      0.99      0.35       150
    Repeater       1.00      0.66      0.79      1583

    accuracy                           0.69      1733
   macro avg       0.61      0.82      0.57      1733
weighted avg       0.93      0.69      0.76      1733

Confusion Matrix:
 [[ 148    2]
 [ 540 1043]]

=== Fold 4/5 ===
Validation Accuracy: 0.7155
Classification Report:
               precision    recall  f1-score   support

Non-Repeater       0.23      0.97      0.37       150
    Repeater       1.00      0.69      0.82      1583

    accuracy                           0.72      1733
   macro avg       0.61      0.83      0.59      1733
weighted avg       0.93      0.72      0.78      1733

Confusion Matrix:
 [[ 145    5]
 [ 488 1095]]

=== Fold 5/5 ===
Validation Accuracy: 0.7748
Classification Report:
               precision    recall  f1-score   support

Non-Repeater       0.27      0.97      0.43       149
    Repeater       1.00      0.76      0.86      1583

    accuracy                           0.77      1732
   macro avg       0.63      0.86      0.64      1732
weighted avg       0.93      0.77      0.82      1732

Confusion Matrix:
 [[ 145    4]
 [ 386 1197]]


=== Summary ===
Total False Positives: 14
Total False Negatives: 2295
Total True Positives: 5621
Total True Negatives: 734

Confusion Matrix (with duplicates):
              Non-Repeater  Repeater
Non-Repeater         734.0      14.0
Repeater            2295.0    5621.0
accuracy_score
0.7334949215143121
Trial 1: hidden_dim=1490, latent_dim=31, beta=1.5633872911904538, gamma=0.1392851215628231, dropout_rate=0.14632305774504434, lr=0.0005731628715284216, scheduler_patience=7, class_weight=2.8290212355035, activation=ReLU, classification_multiplier=13736.497819326147

=== Fold 1/5 ===
Validation Accuracy: 0.4484
Classification Report:
               precision    recall  f1-score   support

Non-Repeater       0.13      1.00      0.24       149
    Repeater       1.00      0.40      0.57      1584

    accuracy                           0.45      1733
   macro avg       0.57      0.70      0.40      1733
weighted avg       0.93      0.45      0.54      1733

Confusion Matrix:
 [[149   0]
 [956 628]]

=== Fold 2/5 ===
Validation Accuracy: 0.2729
Classification Report:
               precision    recall  f1-score   support

Non-Repeater       0.11      1.00      0.19       150
    Repeater       1.00      0.20      0.34      1583

    accuracy                           0.27      1733
   macro avg       0.55      0.60      0.27      1733
weighted avg       0.92      0.27      0.33      1733

Confusion Matrix:
 [[ 150    0]
 [1260  323]]

=== Fold 3/5 ===
Validation Accuracy: 0.3353
Classification Report:
 [I 2025-06-13 09:24:24,151] Trial 287 finished with value: 0.3419898430286242 and parameters: {'hidden_dim': 1196, 'latent_dim': 32, 'beta': 1.4494084928318598, 'gamma': 0.20540108815056635, 'dropout_rate': 0.1256735336041828, 'lr': 0.00040693450932178203, 'scheduler_patience': 7, 'class_weight': 2.9950367297432012, 'activation': 'SELU', 'classification_multiplier': 14348.48453341512}. Best is trial 194 with value: 0.8103647276084949.
/home/ubuntu/frb-analysis/.frb-analysis/lib/python3.12/site-packages/sklearn/metrics/_classification.py:1565: UndefinedMetricWarning: Precision is ill-defined and being set to 0.0 in labels with no predicted samples. Use `zero_division` parameter to control this behavior.
  _warn_prf(average, modifier, f"{metric.capitalize()} is", len(result))
/home/ubuntu/frb-analysis/.frb-analysis/lib/python3.12/site-packages/sklearn/metrics/_classification.py:1565: UndefinedMetricWarning: Precision is ill-defined and being set to 0.0 in labels with no predicted samples. Use `zero_division` parameter to control this behavior.
  _warn_prf(average, modifier, f"{metric.capitalize()} is", len(result))
/home/ubuntu/frb-analysis/.frb-analysis/lib/python3.12/site-packages/sklearn/metrics/_classification.py:1565: UndefinedMetricWarning: Precision is ill-defined and being set to 0.0 in labels with no predicted samples. Use `zero_division` parameter to control this behavior.
  _warn_prf(average, modifier, f"{metric.capitalize()} is", len(result))
/home/ubuntu/frb-analysis/.frb-analysis/lib/python3.12/site-packages/sklearn/metrics/_classification.py:1565: UndefinedMetricWarning: Precision is ill-defined and being set to 0.0 in labels with no predicted samples. Use `zero_division` parameter to control this behavior.
  _warn_prf(average, modifier, f"{metric.capitalize()} is", len(result))
/home/ubuntu/frb-analysis/.frb-analysis/lib/python3.12/site-packages/sklearn/metrics/_classification.py:1565: UndefinedMetricWarning: Precision is ill-defined and being set to 0.0 in labels with no predicted samples. Use `zero_division` parameter to control this behavior.
  _warn_prf(average, modifier, f"{metric.capitalize()} is", len(result))
/home/ubuntu/frb-analysis/.frb-analysis/lib/python3.12/site-packages/sklearn/metrics/_classification.py:1565: UndefinedMetricWarning: Precision is ill-defined and being set to 0.0 in labels with no predicted samples. Use `zero_division` parameter to control this behavior.
  _warn_prf(average, modifier, f"{metric.capitalize()} is", len(result))
[I 2025-06-13 09:31:11,548] Trial 288 finished with value: 0.14069713758079408 and parameters: {'hidden_dim': 1564, 'latent_dim': 34, 'beta': 1.5044301050501987, 'gamma': 0.1846350642324235, 'dropout_rate': 0.11243237327111504, 'lr': 0.007552915679118533, 'scheduler_patience': 7, 'class_weight': 2.62090214614502, 'activation': 'ReLU', 'classification_multiplier': 14738.916692895336}. Best is trial 194 with value: 0.8103647276084949.
