[I 2025-06-12 11:15:04,228] Trial 76 finished with value: 0.17647737765466298 and parameters: {'hidden_dim': 1434, 'latent_dim': 35, 'beta': 1.4287476855855572, 'gamma': 0.28939637952161545, 'dropout_rate': 0.13443684490262345, 'lr': 0.0023316300306305926, 'scheduler_patience': 5, 'class_weight': 1.2776705633514625, 'activation': 'ELU', 'classification_multiplier': 6863.8710416313625}. Best is trial 72 with value: 0.7479224376731302.

Confusion Matrix (with duplicates):
              Non-Repeater  Repeater
Non-Repeater         741.0       7.0
Repeater            3560.0    4356.0
accuracy_score
0.5882963988919667
Trial 1: hidden_dim=1398, latent_dim=31, beta=1.3065088288601312, gamma=0.189183562897245, dropout_rate=0.15321807048419714, lr=0.0014245914796825675, scheduler_patience=6, class_weight=2.3100108311016454, activation=ReLU, classification_multiplier=6022.14779525775

=== Fold 1/5 ===
Validation Accuracy: 0.6722
Classification Report:
               precision    recall  f1-score   support

Non-Repeater       0.21      0.99      0.34       149
    Repeater       1.00      0.64      0.78      1584

    accuracy                           0.67      1733
   macro avg       0.60      0.82      0.56      1733
weighted avg       0.93      0.67      0.74      1733

Confusion Matrix:
 [[ 148    1]
 [ 567 1017]]

=== Fold 2/5 ===
Validation Accuracy: 0.6734
Classification Report:
               precision    recall  f1-score   support

Non-Repeater       0.21      0.99      0.34       150
    Repeater       1.00      0.64      0.78      1583

    accuracy                           0.67      1733
   macro avg       0.60      0.82      0.56      1733
weighted avg       0.93      0.67      0.74      1733

Confusion Matrix:
 [[ 149    1]
 [ 565 1018]]

=== Fold 3/5 ===
Validation Accuracy: 0.6549
Classification Report:
               precision    recall  f1-score   support

Non-Repeater       0.20      0.99      0.33       150
    Repeater       1.00      0.62      0.77      1583

    accuracy                           0.65      1733
   macro avg       0.60      0.81      0.55      1733
weighted avg       0.93      0.65      0.73      1733

Confusion Matrix:
 [[149   1]
 [597 986]]

=== Fold 4/5 ===
Validation Accuracy: 0.6047
Classification Report:
               precision    recall  f1-score   support

Non-Repeater       0.18      0.99      0.30       150
    Repeater       1.00      0.57      0.72      1583

    accuracy                           0.60      1733
   macro avg       0.59      0.78      0.51      1733
weighted avg       0.93      0.60      0.69      1733

Confusion Matrix:
 [[149   1]
 [684 899]]

=== Fold 5/5 ===
Validation Accuracy: 0.5774
Classification Report:
               precision    recall  f1-score   support

Non-Repeater       0.17      0.99      0.29       149
    Repeater       1.00      0.54      0.70      1583

    accuracy                           0.58      1732
   macro avg       0.58      0.77      0.49      1732
weighted avg       0.93      0.58      0.66      1732

Confusion Matrix:
 [[148   1]
 [731 852]]


=== Summary ===
Total False Positives: 5
Total False Negatives: 3144
Total True Positives: 4772
Total True Negatives: 743

Confusion Matrix (with duplicates):
              Non-Repeater  Repeater
Non-Repeater         743.0       5.0
Repeater            3144.0    4772.0
accuracy_score
0.6365420129270545
Trial 1: hidden_dim=1683, latent_dim=26, beta=1.515870849740673, gamma=0.21670346483537423, dropout_rate=0.12391171993690953, lr=0.000813615220621297, scheduler_patience=6, class_weight=1.1674887140326138, activation=ReLU, classification_multiplier=5313.0822426253835

=== Fold 1/5 ===
Validation Accuracy: 0.1108
Classification Report:
               precision    recall  f1-score   support

Non-Repeater       0.09      1.00      0.16       149
    Repeater       1.00      0.03      0.05      1584

    accuracy                           0.11      1733
   macro avg       0.54      0.51      0.11      1733
weighted avg       0.92      0.11      0.06      1733

Confusion Matrix:
 [[ 149    0]
 [1541   43]]

=== Fold 2/5 ===
Validation Accuracy: 0.2481
Classification Report:
               precision    recall  f1-score   support

Non-Repeater       0.10      1.00      0.19       150
    Repeater       1.00      0.18      0.30      1583

    accuracy                           0.25      1733
   macro avg       0.55      0.59      0.24      1733
weighted avg       0.92      0.25      0.29      1733

Confusion Matrix:
 [[ 150    0]
 [1303  280]]

=== Fold 3/5 ===
Validation Accuracy: 0.2349
Classification Report:
               precision    recall  f1-score   support

Non-Repeater       0.10      1.00      0.18       150
    Repeater       1.00      0.16      0.28      1583

    accuracy                           0.23      1733
   macro avg       0.55      0.58      0.23      1733
weighted avg       0.92      0.23      0.27      1733

Confusion Matrix:
 [[ 150    0]
 [1326  257]]

=== Fold 4/5 ===
Validation Accuracy: 0.2008
Classification Report:
               precision    recall  f1-score   support

Non-Repeater       0.10      0.99      0.18       150
    Repeater       0.99      0.13      0.22      1583

    accuracy                           0.20      1733
   macro avg       0.54      0.56      0.20      1733
weighted avg       0.91      0.20      0.22      1733

Confusion Matrix:
 [[ 148    2]
 [1383  200]]

=== Fold 5/5 ===
Validation Accuracy: 0.0878
Classification Report:
               precision    recall  f1-score   support

Non-Repeater       0.09      1.00      0.16       149
    Repeater       1.00      0.00      0.00      1583

    accuracy                           0.09      1732
   macro avg       0.54      0.50      0.08      1732
weighted avg       0.92      0.09      0.02      1732

Confusion Matrix:
 [[ 149    0]
 [1580    3]]


=== Summary ===
Total False Positives: 2
Total False Negatives: 7133
Total True Positives: 783
Total True Negatives: 746

Confusion Matrix (with duplicates):
              Non-Repeater  Repeater
Non-Repeater         746.0       2.0
Repeater            7133.0     783.0
accuracy_score
0.17647737765466298
Trial 1: hidden_dim=1434, latent_dim=35, beta=1.4287476855855572, gamma=0.28939637952161545, dropout_rate=0.13443684490262345, lr=0.0023316300306305926, scheduler_patience=5, class_weight=1.2776705633514625, activation=ELU, classification_multiplier=6863.8710416313625

=== Fold 1/5 ===
Validation Accuracy: 0.6769
Classification Report:
               precision    recall  f1-score   support

Non-Repeater       0.21      0.99      0.35       149
    Repeater       1.00      0.65      0.79      1584

    accuracy                           0.68      1733
   macro avg       0.60      0.82      0.57      1733
weighted avg       0.93      0.68      0.75      1733

Confusion Matrix:
 [[ 148    1]
 [ 559 1025]]

=== Fold 2/5 ===
Validation Accuracy: 0.6740
Classification Report:
               precision    recall  f1-score   support

Non-Repeater       0.21      0.99      0.35       150
    Repeater       1.00      0.64      0.78      1583

    accuracy                           0.67      1733
   macro avg       0.60      0.82      0.56      1733
weighted avg       0.93      0.67      0.75      1733

Confusion Matrix:
 [[ 149    1]
 [ 564 1019]]

=== Fold 3/5 ===
Validation Accuracy: 0.7490
Classification Report:
               precision    recall  f1-score   support

Non-Repeater       0.26      0.99      0.41       150
    Repeater       1.00      0.73      0.84      1583

    accuracy                           0.75      1733
   macro avg       0.63      0.86      0.62      1733
weighted avg       0.93      0.75      0.80      1733

Confusion Matrix:
 [[ 149    1]
 [ 434 1149]]

=== Fold 4/5 ===
Validation Accuracy: 0.6803
Classification Report:
               precision    recall  f1-score   support

Non-Repeater       0.21      0.99      0.35       150
    Repeater       1.00      0.65      0.79      1583

    accuracy                           0.68      1733
   macro avg       0.61      0.82      0.57      1733
weighted avg       0.93      0.68      0.75      1733

Confusion Matrix:
 [[ 149    1]
 [ 553 1030]]

=== Fold 5/5 ===
Validation Accuracy: 0.2431
Classification Report:
               precision    recall  f1-score   support

Non-Repeater       0.10      1.00      0.19       149
    Repeater       1.00      0.17      0.29      1583

    accuracy                           0.24      1732
   macro avg       0.55      0.59      0.24      1732
weighted avg       0.92      0.24      0.28      1732

[I 2025-06-12 11:21:45,289] Trial 77 finished with value: 0.6046860572483841 and parameters: {'hidden_dim': 1505, 'latent_dim': 28, 'beta': 1.3090512292167595, 'gamma': 0.35805770438308904, 'dropout_rate': 0.10700026515588883, 'lr': 0.001644937184331678, 'scheduler_patience': 6, 'class_weight': 2.6308232034260204, 'activation': 'ReLU', 'classification_multiplier': 5684.730416938024}. Best is trial 72 with value: 0.7479224376731302.
[I 2025-06-12 11:27:21,038] Trial 78 finished with value: 0.47149122807017546 and parameters: {'hidden_dim': 834, 'latent_dim': 21, 'beta': 1.6196790518669488, 'gamma': 0.17975686427338908, 'dropout_rate': 0.1518437230258127, 'lr': 0.0012164321011216856, 'scheduler_patience': 6, 'class_weight': 1.7549343418614263, 'activation': 'LeakyReLU', 'classification_multiplier': 6056.045366234794}. Best is trial 72 with value: 0.7479224376731302.
[I 2025-06-12 11:33:30,516] Trial 79 finished with value: 0.671398891966759 and parameters: {'hidden_dim': 1268, 'latent_dim': 23, 'beta': 1.1464000643469014, 'gamma': 0.2910751143235641, 'dropout_rate': 0.1642841421683372, 'lr': 0.0005706289317999791, 'scheduler_patience': 6, 'class_weight': 2.717381524842609, 'activation': 'GELU', 'classification_multiplier': 5074.1698305152095}. Best is trial 72 with value: 0.7479224376731302.
Confusion Matrix:
 [[ 149    0]
 [1311  272]]


=== Summary ===
Total False Positives: 4
Total False Negatives: 3421
Total True Positives: 4495
Total True Negatives: 744

Confusion Matrix (with duplicates):
              Non-Repeater  Repeater
Non-Repeater         744.0       4.0
Repeater            3421.0    4495.0
accuracy_score
0.6046860572483841
Trial 1: hidden_dim=1505, latent_dim=28, beta=1.3090512292167595, gamma=0.35805770438308904, dropout_rate=0.10700026515588883, lr=0.001644937184331678, scheduler_patience=6, class_weight=2.6308232034260204, activation=ReLU, classification_multiplier=5684.730416938024

=== Fold 1/5 ===
Validation Accuracy: 0.5995
Classification Report:
               precision    recall  f1-score   support

Non-Repeater       0.18      1.00      0.30       149
    Repeater       1.00      0.56      0.72      1584

    accuracy                           0.60      1733
   macro avg       0.59      0.78      0.51      1733
weighted avg       0.93      0.60      0.68      1733

Confusion Matrix:
 [[149   0]
 [694 890]]

=== Fold 2/5 ===
Validation Accuracy: 0.2574
Classification Report:
               precision    recall  f1-score   support

Non-Repeater       0.10      1.00      0.19       150
    Repeater       1.00      0.19      0.32      1583

    accuracy                           0.26      1733
   macro avg       0.55      0.59      0.25      1733
weighted avg       0.92      0.26      0.30      1733

Confusion Matrix:
 [[ 150    0]
 [1287  296]]

=== Fold 3/5 ===
Validation Accuracy: 0.3122
Classification Report:
               precision    recall  f1-score   support

Non-Repeater       0.11      1.00      0.20       150
    Repeater       1.00      0.25      0.40      1583

    accuracy                           0.31      1733
   macro avg       0.56      0.62      0.30      1733
weighted avg       0.92      0.31      0.38      1733

Confusion Matrix:
 [[ 150    0]
 [1192  391]]

=== Fold 4/5 ===
Validation Accuracy: 0.4945
Classification Report:
               precision    recall  f1-score   support

Non-Repeater       0.15      0.99      0.25       150
    Repeater       1.00      0.45      0.62      1583

    accuracy                           0.49      1733
   macro avg       0.57      0.72      0.44      1733
weighted avg       0.92      0.49      0.59      1733

Confusion Matrix:
 [[149   1]
 [875 708]]

=== Fold 5/5 ===
Validation Accuracy: 0.6940
Classification Report:
               precision    recall  f1-score   support

Non-Repeater       0.22      0.99      0.36       149
    Repeater       1.00      0.67      0.80      1583

    accuracy                           0.69      1732
   macro avg       0.61      0.83      0.58      1732
weighted avg       0.93      0.69      0.76      1732

Confusion Matrix:
 [[ 148    1]
 [ 529 1054]]


=== Summary ===
Total False Positives: 2
Total False Negatives: 4577
Total True Positives: 3339
Total True Negatives: 746

Confusion Matrix (with duplicates):
              Non-Repeater  Repeater
Non-Repeater         746.0       2.0
Repeater            4577.0    3339.0
accuracy_score
0.47149122807017546
Trial 1: hidden_dim=834, latent_dim=21, beta=1.6196790518669488, gamma=0.17975686427338908, dropout_rate=0.1518437230258127, lr=0.0012164321011216856, scheduler_patience=6, class_weight=1.7549343418614263, activation=LeakyReLU, classification_multiplier=6056.045366234794

=== Fold 1/5 ===
Validation Accuracy: 0.6376
Classification Report:
               precision    recall  f1-score   support

Non-Repeater       0.19      0.99      0.32       149
    Repeater       1.00      0.60      0.75      1584

    accuracy                           0.64      1733
   macro avg       0.59      0.80      0.54      1733
weighted avg       0.93      0.64      0.72      1733

Confusion Matrix:
 [[148   1]
 [627 957]]

=== Fold 2/5 ===
Validation Accuracy: 0.6607
Classification Report:
               precision    recall  f1-score   support

Non-Repeater       0.20      0.99      0.34       150
    Repeater       1.00      0.63      0.77      1583

    accuracy                           0.66      1733
   macro avg       0.60      0.81      0.55      1733
weighted avg       0.93      0.66      0.73      1733

Confusion Matrix:
 [[149   1]
 [587 996]]

=== Fold 3/5 ===
Validation Accuracy: 0.7046
Classification Report:
               precision    recall  f1-score   support

Non-Repeater       0.23      0.99      0.37       150
    Repeater       1.00      0.68      0.81      1583

    accuracy                           0.70      1733
   macro avg       0.61      0.84      0.59      1733
weighted avg       0.93      0.70      0.77      1733

Confusion Matrix:
 [[ 149    1]
 [ 511 1072]]

=== Fold 4/5 ===
Validation Accuracy: 0.6353
Classification Report:
               precision    recall  f1-score   support

Non-Repeater       0.19      0.99      0.32       150
    Repeater       1.00      0.60      0.75      1583

    accuracy                           0.64      1733
   macro avg       0.59      0.79      0.53      1733
weighted avg       0.93      0.64      0.71      1733

Confusion Matrix:
 [[148   2]
 [630 953]]

=== Fold 5/5 ===
Validation Accuracy: 0.7188
Classification Report:
               precision    recall  f1-score   support

Non-Repeater       0.23      0.98      0.37       149
    Repeater       1.00      0.69      0.82      1583

    accuracy                           0.72      1732
   macro avg       0.61      0.84      0.60      1732
weighted avg       0.93      0.72      0.78      1732

Confusion Matrix:
 [[ 146    3]
 [ 484 1099]]


=== Summary ===
Total False Positives: 8
Total False Negatives: 2839
Total True Positives: 5077
Total True Negatives: 740

Confusion Matrix (with duplicates):
              Non-Repeater  Repeater
Non-Repeater         740.0       8.0
Repeater            2839.0    5077.0
accuracy_score
0.671398891966759
Trial 1: hidden_dim=1268, latent_dim=23, beta=1.1464000643469014, gamma=0.2910751143235641, dropout_rate=0.1642841421683372, lr=0.0005706289317999791, scheduler_patience=6, class_weight=2.717381524842609, activation=GELU, classification_multiplier=5074.1698305152095

=== Fold 1/5 ===
Validation Accuracy: 0.5113
Classification Report:
               precision    recall  f1-score   support

Non-Repeater       0.15      1.00      0.26       149
    Repeater       1.00      0.47      0.64      1584

    accuracy                           0.51      1733
   macro avg       0.57      0.73      0.45      1733
weighted avg       0.93      0.51      0.60      1733

Confusion Matrix:
 [[149   0]
 [847 737]]

=== Fold 2/5 ===
Validation Accuracy: 0.6388
Classification Report:
               precision    recall  f1-score   support

Non-Repeater       0.19      0.99      0.32       150
    Repeater       1.00      0.61      0.75      1583

    accuracy                           0.64      1733
   macro avg       0.60      0.80      0.54      1733
weighted avg       0.93      0.64      0.72      1733

Confusion Matrix:
 [[149   1]
 [625 958]]

=== Fold 3/5 ===
Validation Accuracy: 0.4414
Classification Report:
               precision    recall  f1-score   support

Non-Repeater       0.13      0.99      0.24       150
    Repeater       1.00      0.39      0.56      1583

    accuracy                           0.44      1733
   macro avg       0.57      0.69      0.40      1733
weighted avg       0.92      0.44      0.53      1733

Confusion Matrix:
 [[149   1]
 [967 616]]

=== Fold 4/5 ===
Validation Accuracy: 0.3243
Classification Report:
               precision    recall  f1-score   support

Non-Repeater       0.11      1.00      0.20       150
    Repeater       1.00      0.26      0.41      1583

    accuracy                           0.32      1733
   macro avg       0.56      0.63      0.31      1733
weighted avg       0.92      0.32      0.39      1733

Confusion Matrix:
 [[ 150    0]
 [1171  412]]

=== Fold 5/5 ===
Validation Accuracy: 0.3585
Classification Report:
 [I 2025-06-12 11:38:59,885] Trial 80 finished with value: 0.454870729455217 and parameters: {'hidden_dim': 417, 'latent_dim': 10, 'beta': 1.2177067253423133, 'gamma': 0.1021847788788382, 'dropout_rate': 0.11013921661678544, 'lr': 0.002870155789457772, 'scheduler_patience': 2, 'class_weight': 1.5654812922324397, 'activation': 'ReLU', 'classification_multiplier': 6850.062867330895}. Best is trial 72 with value: 0.7479224376731302.
[I 2025-06-12 11:45:06,307] Trial 81 finished with value: 0.6782086795937211 and parameters: {'hidden_dim': 1204, 'latent_dim': 31, 'beta': 1.5115509449314473, 'gamma': 0.6039784216355587, 'dropout_rate': 0.17719227278116487, 'lr': 0.00037424623825507545, 'scheduler_patience': 7, 'class_weight': 1.3296018841491886, 'activation': 'ReLU', 'classification_multiplier': 14020.054672226295}. Best is trial 72 with value: 0.7479224376731302.
