[I 2025-06-13 01:35:28,023] Trial 214 finished with value: 0.7562326869806094 and parameters: {'hidden_dim': 1453, 'latent_dim': 33, 'beta': 1.7352968401348654, 'gamma': 0.2236526655587043, 'dropout_rate': 0.11149750317458364, 'lr': 0.0006502297130369888, 'scheduler_patience': 7, 'class_weight': 2.943213904343553, 'activation': 'ReLU', 'classification_multiplier': 14751.95628179365}. Best is trial 194 with value: 0.8103647276084949.
              precision    recall  f1-score   support

Non-Repeater       0.27      0.97      0.42       149
    Repeater       1.00      0.76      0.86      1583

    accuracy                           0.77      1732
   macro avg       0.63      0.86      0.64      1732
weighted avg       0.93      0.77      0.82      1732

Confusion Matrix:
 [[ 144    5]
 [ 387 1196]]


=== Summary ===
Total False Positives: 11
Total False Negatives: 2445
Total True Positives: 5471
Total True Negatives: 737

Confusion Matrix (with duplicates):
              Non-Repeater  Repeater
Non-Repeater         737.0      11.0
Repeater            2445.0    5471.0
accuracy_score
0.716528162511542
Trial 1: hidden_dim=1387, latent_dim=32, beta=1.5246676532743284, gamma=0.15817394178356806, dropout_rate=0.13159392220291327, lr=0.000625399240495162, scheduler_patience=7, class_weight=2.8912969130065846, activation=ReLU, classification_multiplier=14992.747350296624

=== Fold 1/5 ===
Validation Accuracy: 0.7028
Classification Report:
               precision    recall  f1-score   support

Non-Repeater       0.22      0.99      0.36       149
    Repeater       1.00      0.68      0.81      1584

    accuracy                           0.70      1733
   macro avg       0.61      0.83      0.59      1733
weighted avg       0.93      0.70      0.77      1733

Confusion Matrix:
 [[ 148    1]
 [ 514 1070]]

=== Fold 2/5 ===
Validation Accuracy: 0.7167
Classification Report:
               precision    recall  f1-score   support

Non-Repeater       0.23      0.99      0.38       150
    Repeater       1.00      0.69      0.82      1583

    accuracy                           0.72      1733
   macro avg       0.62      0.84      0.60      1733
weighted avg       0.93      0.72      0.78      1733

Confusion Matrix:
 [[ 149    1]
 [ 490 1093]]

=== Fold 3/5 ===
Validation Accuracy: 0.6780
Classification Report:
               precision    recall  f1-score   support

Non-Repeater       0.21      0.99      0.35       150
    Repeater       1.00      0.65      0.79      1583

    accuracy                           0.68      1733
   macro avg       0.61      0.82      0.57      1733
weighted avg       0.93      0.68      0.75      1733

Confusion Matrix:
 [[ 149    1]
 [ 557 1026]]

=== Fold 4/5 ===
Validation Accuracy: 0.7005
Classification Report:
               precision    recall  f1-score   support

Non-Repeater       0.22      0.99      0.36       150
    Repeater       1.00      0.67      0.80      1583

    accuracy                           0.70      1733
   macro avg       0.61      0.83      0.58      1733
weighted avg       0.93      0.70      0.77      1733

Confusion Matrix:
 [[ 148    2]
 [ 517 1066]]

=== Fold 5/5 ===
Validation Accuracy: 0.8897
Classification Report:
               precision    recall  f1-score   support

Non-Repeater       0.44      0.97      0.60       149
    Repeater       1.00      0.88      0.94      1583

    accuracy                           0.89      1732
   macro avg       0.72      0.92      0.77      1732
weighted avg       0.95      0.89      0.91      1732

Confusion Matrix:
 [[ 144    5]
 [ 186 1397]]


=== Summary ===
Total False Positives: 10
Total False Negatives: 2264
Total True Positives: 5652
Total True Negatives: 738

Confusion Matrix (with duplicates):
              Non-Repeater  Repeater
Non-Repeater         738.0      10.0
Repeater            2264.0    5652.0
accuracy_score
0.7375346260387812
Trial 1: hidden_dim=1510, latent_dim=31, beta=1.6634636300025027, gamma=0.1428574713503375, dropout_rate=0.12224471197562244, lr=0.00041986340010909904, scheduler_patience=7, class_weight=2.744646287220819, activation=ReLU, classification_multiplier=14570.654742642588

=== Fold 1/5 ===
Validation Accuracy: 0.6988
Classification Report:
               precision    recall  f1-score   support

Non-Repeater       0.22      0.99      0.36       149
    Repeater       1.00      0.67      0.80      1584

    accuracy                           0.70      1733
   macro avg       0.61      0.83      0.58      1733
weighted avg       0.93      0.70      0.76      1733

Confusion Matrix:
 [[ 147    2]
 [ 520 1064]]

=== Fold 2/5 ===
Validation Accuracy: 0.7651
Classification Report:
               precision    recall  f1-score   support

Non-Repeater       0.27      0.99      0.42       150
    Repeater       1.00      0.74      0.85      1583

    accuracy                           0.77      1733
   macro avg       0.63      0.87      0.64      1733
weighted avg       0.94      0.77      0.82      1733

Confusion Matrix:
 [[ 149    1]
 [ 406 1177]]

=== Fold 3/5 ===
Validation Accuracy: 0.7819
Classification Report:
               precision    recall  f1-score   support

Non-Repeater       0.28      0.99      0.44       150
    Repeater       1.00      0.76      0.86      1583

    accuracy                           0.78      1733
   macro avg       0.64      0.87      0.65      1733
weighted avg       0.94      0.78      0.83      1733

Confusion Matrix:
 [[ 148    2]
 [ 376 1207]]

=== Fold 4/5 ===
Validation Accuracy: 0.6803
Classification Report:
               precision    recall  f1-score   support

Non-Repeater       0.21      0.99      0.35       150
    Repeater       1.00      0.65      0.79      1583

    accuracy                           0.68      1733
   macro avg       0.60      0.82      0.57      1733
weighted avg       0.93      0.68      0.75      1733

Confusion Matrix:
 [[ 148    2]
 [ 552 1031]]

=== Fold 5/5 ===
Validation Accuracy: 0.8551
Classification Report:
               precision    recall  f1-score   support

Non-Repeater       0.37      0.97      0.54       149
    Repeater       1.00      0.84      0.91      1583

    accuracy                           0.86      1732
   macro avg       0.68      0.91      0.73      1732
weighted avg       0.94      0.86      0.88      1732

Confusion Matrix:
 [[ 145    4]
 [ 247 1336]]


=== Summary ===
Total False Positives: 11
Total False Negatives: 2101
Total True Positives: 5815
Total True Negatives: 737

Confusion Matrix (with duplicates):
              Non-Repeater  Repeater
Non-Repeater         737.0      11.0
Repeater            2101.0    5815.0
accuracy_score
0.7562326869806094
Trial 1: hidden_dim=1453, latent_dim=33, beta=1.7352968401348654, gamma=0.2236526655587043, dropout_rate=0.11149750317458364, lr=0.0006502297130369888, scheduler_patience=7, class_weight=2.943213904343553, activation=ReLU, classification_multiplier=14751.95628179365

=== Fold 1/5 ===
Validation Accuracy: 0.7057
Classification Report:
               precision    recall  f1-score   support

Non-Repeater       0.22      0.99      0.37       149
    Repeater       1.00      0.68      0.81      1584

    accuracy                           0.71      1733
   macro avg       0.61      0.83      0.59      1733
weighted avg       0.93      0.71      0.77      1733

Confusion Matrix:
 [[ 147    2]
 [ 508 1076]]

=== Fold 2/5 ===
Validation Accuracy: 0.8044
Classification Report:
               precision    recall  f1-score   support

Non-Repeater       0.30      0.97      0.46       150
    Repeater       1.00      0.79      0.88      1583

    accuracy                           0.80      1733
   macro avg       0.65      0.88      0.67      1733
weighted avg       0.94      0.80      0.84      1733

Confusion Matrix:
 [[ 146    4]
 [ 335 1248]]

=== Fold 3/5 ===
Validation Accuracy: 0.7467
Classification Report:
               precision    recall  f1-score   support

Non-Repeater       0.25      0.99      0.40       150
    Repeater       1.00      0.72      0.84      1583

    accuracy                           0.75      1733
   macro avg       0.63      0.86      0.62      1733
weighted avg       0.93      0.75      0.80      1733

Confusion Matrix:
 [[ 149    1]
 [ 438 1145]]

=== Fold 4/5 ===
Validation Accuracy: 0.6653
Classification Report:
 [I 2025-06-13 01:41:50,326] Trial 215 finished with value: 0.7442289935364728 and parameters: {'hidden_dim': 1351, 'latent_dim': 30, 'beta': 1.4787361635817222, 'gamma': 0.18461497422424608, 'dropout_rate': 0.13944165200156156, 'lr': 0.0008348116563564718, 'scheduler_patience': 7, 'class_weight': 2.8061094460740432, 'activation': 'ReLU', 'classification_multiplier': 13264.417846243927}. Best is trial 194 with value: 0.8103647276084949.
[I 2025-06-13 01:48:16,763] Trial 216 finished with value: 0.7011772853185596 and parameters: {'hidden_dim': 1418, 'latent_dim': 32, 'beta': 1.365797178457686, 'gamma': 0.26266020205452456, 'dropout_rate': 0.14808182559839894, 'lr': 0.0003093216128884628, 'scheduler_patience': 7, 'class_weight': 2.9298321696741554, 'activation': 'ReLU', 'classification_multiplier': 13476.81196033073}. Best is trial 194 with value: 0.8103647276084949.
[I 2025-06-13 01:54:56,865] Trial 217 finished with value: 0.7518467220683287 and parameters: {'hidden_dim': 1542, 'latent_dim': 34, 'beta': 1.592265378951061, 'gamma': 0.13239838537576354, 'dropout_rate': 0.12446524261172486, 'lr': 0.000515839129971111, 'scheduler_patience': 7, 'class_weight': 2.7371363756922915, 'activation': 'ReLU', 'classification_multiplier': 14822.213592984568}. Best is trial 194 with value: 0.8103647276084949.
              precision    recall  f1-score   support

Non-Repeater       0.20      0.99      0.34       150
    Repeater       1.00      0.63      0.78      1583

    accuracy                           0.67      1733
   macro avg       0.60      0.81      0.56      1733
weighted avg       0.93      0.67      0.74      1733

Confusion Matrix:
 [[ 148    2]
 [ 578 1005]]

=== Fold 5/5 ===
Validation Accuracy: 0.7991
Classification Report:
               precision    recall  f1-score   support

Non-Repeater       0.30      0.97      0.45       149
    Repeater       1.00      0.78      0.88      1583

    accuracy                           0.80      1732
   macro avg       0.65      0.88      0.67      1732
weighted avg       0.94      0.80      0.84      1732

Confusion Matrix:
 [[ 145    4]
 [ 344 1239]]


=== Summary ===
Total False Positives: 13
Total False Negatives: 2203
Total True Positives: 5713
Total True Negatives: 735

Confusion Matrix (with duplicates):
              Non-Repeater  Repeater
Non-Repeater         735.0      13.0
Repeater            2203.0    5713.0
accuracy_score
0.7442289935364728
Trial 1: hidden_dim=1351, latent_dim=30, beta=1.4787361635817222, gamma=0.18461497422424608, dropout_rate=0.13944165200156156, lr=0.0008348116563564718, scheduler_patience=7, class_weight=2.8061094460740432, activation=ReLU, classification_multiplier=13264.417846243927

=== Fold 1/5 ===
Validation Accuracy: 0.7311
Classification Report:
               precision    recall  f1-score   support

Non-Repeater       0.24      1.00      0.39       149
    Repeater       1.00      0.71      0.83      1584

    accuracy                           0.73      1733
   macro avg       0.62      0.85      0.61      1733
weighted avg       0.93      0.73      0.79      1733

Confusion Matrix:
 [[ 149    0]
 [ 466 1118]]

=== Fold 2/5 ===
Validation Accuracy: 0.6451
Classification Report:
               precision    recall  f1-score   support

Non-Repeater       0.20      0.99      0.33       150
    Repeater       1.00      0.61      0.76      1583

    accuracy                           0.65      1733
   macro avg       0.60      0.80      0.54      1733
weighted avg       0.93      0.65      0.72      1733

Confusion Matrix:
 [[149   1]
 [614 969]]

=== Fold 3/5 ===
Validation Accuracy: 0.6855
Classification Report:
               precision    recall  f1-score   support

Non-Repeater       0.22      0.99      0.35       150
    Repeater       1.00      0.66      0.79      1583

    accuracy                           0.69      1733
   macro avg       0.61      0.82      0.57      1733
weighted avg       0.93      0.69      0.75      1733

Confusion Matrix:
 [[ 149    1]
 [ 544 1039]]

=== Fold 4/5 ===
Validation Accuracy: 0.6769
Classification Report:
               precision    recall  f1-score   support

Non-Repeater       0.21      0.98      0.34       150
    Repeater       1.00      0.65      0.79      1583

    accuracy                           0.68      1733
   macro avg       0.60      0.81      0.56      1733
weighted avg       0.93      0.68      0.75      1733

Confusion Matrix:
 [[ 147    3]
 [ 557 1026]]

=== Fold 5/5 ===
Validation Accuracy: 0.7673
Classification Report:
               precision    recall  f1-score   support

Non-Repeater       0.27      0.97      0.42       149
    Repeater       1.00      0.75      0.85      1583

    accuracy                           0.77      1732
   macro avg       0.63      0.86      0.64      1732
weighted avg       0.93      0.77      0.82      1732

Confusion Matrix:
 [[ 145    4]
 [ 399 1184]]


=== Summary ===
Total False Positives: 9
Total False Negatives: 2580
Total True Positives: 5336
Total True Negatives: 739

Confusion Matrix (with duplicates):
              Non-Repeater  Repeater
Non-Repeater         739.0       9.0
Repeater            2580.0    5336.0
accuracy_score
0.7011772853185596
Trial 1: hidden_dim=1418, latent_dim=32, beta=1.365797178457686, gamma=0.26266020205452456, dropout_rate=0.14808182559839894, lr=0.0003093216128884628, scheduler_patience=7, class_weight=2.9298321696741554, activation=ReLU, classification_multiplier=13476.81196033073

=== Fold 1/5 ===
Validation Accuracy: 0.7196
Classification Report:
               precision    recall  f1-score   support

Non-Repeater       0.23      0.99      0.38       149
    Repeater       1.00      0.69      0.82      1584

    accuracy                           0.72      1733
   macro avg       0.62      0.84      0.60      1733
weighted avg       0.93      0.72      0.78      1733

Confusion Matrix:
 [[ 147    2]
 [ 484 1100]]

=== Fold 2/5 ===
Validation Accuracy: 0.7542
Classification Report:
               precision    recall  f1-score   support

Non-Repeater       0.26      0.99      0.41       150
    Repeater       1.00      0.73      0.84      1583

    accuracy                           0.75      1733
   macro avg       0.63      0.86      0.63      1733
weighted avg       0.94      0.75      0.81      1733

Confusion Matrix:
 [[ 149    1]
 [ 425 1158]]

=== Fold 3/5 ===
Validation Accuracy: 0.7692
Classification Report:
               precision    recall  f1-score   support

Non-Repeater       0.27      0.98      0.42       150
    Repeater       1.00      0.75      0.86      1583

    accuracy                           0.77      1733
   macro avg       0.63      0.86      0.64      1733
weighted avg       0.93      0.77      0.82      1733

Confusion Matrix:
 [[ 147    3]
 [ 397 1186]]

=== Fold 4/5 ===
Validation Accuracy: 0.7432
Classification Report:
               precision    recall  f1-score   support

Non-Repeater       0.25      0.99      0.40       150
    Repeater       1.00      0.72      0.84      1583

    accuracy                           0.74      1733
   macro avg       0.62      0.85      0.62      1733
weighted avg       0.93      0.74      0.80      1733

Confusion Matrix:
 [[ 148    2]
 [ 443 1140]]

=== Fold 5/5 ===
Validation Accuracy: 0.7731
Classification Report:
               precision    recall  f1-score   support

Non-Repeater       0.27      0.97      0.42       149
    Repeater       1.00      0.75      0.86      1583

    accuracy                           0.77      1732
   macro avg       0.63      0.86      0.64      1732
weighted avg       0.93      0.77      0.82      1732

Confusion Matrix:
 [[ 145    4]
 [ 389 1194]]


=== Summary ===
Total False Positives: 12
Total False Negatives: 2138
Total True Positives: 5778
Total True Negatives: 736

Confusion Matrix (with duplicates):
              Non-Repeater  Repeater
Non-Repeater         736.0      12.0
Repeater            2138.0    5778.0
accuracy_score
0.7518467220683287
Trial 1: hidden_dim=1542, latent_dim=34, beta=1.592265378951061, gamma=0.13239838537576354, dropout_rate=0.12446524261172486, lr=0.000515839129971111, scheduler_patience=7, class_weight=2.7371363756922915, activation=ReLU, classification_multiplier=14822.213592984568

=== Fold 1/5 ===
Validation Accuracy: 0.7790
Classification Report:
               precision    recall  f1-score   support

Non-Repeater       0.28      0.99      0.44       149
    Repeater       1.00      0.76      0.86      1584

    accuracy                           0.78      1733
   macro avg       0.64      0.88      0.65      1733
weighted avg       0.94      0.78      0.83      1733

Confusion Matrix:
 [[ 148    1]
 [ 382 1202]]

=== Fold 2/5 ===
Validation Accuracy: 0.7248
Classification Report:
               precision    recall  f1-score   support

Non-Repeater       0.24      0.99      0.38       150
    Repeater       1.00      0.70      0.82      1583

    accuracy                           0.72      1733
   macro avg       0.62      0.85      0.60      1733
weighted avg       0.93      0.72      0.78      1733

Confusion Matrix:
 [[ 149    1]
 [ 476 1107]]

=== Fold 3/5 ===
Validation Accuracy: 0.7600
Classification Report:
 [I 2025-06-13 02:01:14,745] Trial 218 finished with value: 0.7624653739612188 and parameters: {'hidden_dim': 1319, 'latent_dim': 31, 'beta': 1.2241971301876406, 'gamma': 0.18500527627553032, 'dropout_rate': 0.11774524313096475, 'lr': 0.0003539332624551014, 'scheduler_patience': 7, 'class_weight': 2.843018990624252, 'activation': 'ReLU', 'classification_multiplier': 13926.573465705314}. Best is trial 194 with value: 0.8103647276084949.
[I 2025-06-13 02:07:33,568] Trial 219 finished with value: 0.7488457987072945 and parameters: {'hidden_dim': 1317, 'latent_dim': 31, 'beta': 1.2031447248334217, 'gamma': 0.21496710718618028, 'dropout_rate': 0.11684400186814459, 'lr': 0.00010358651724532531, 'scheduler_patience': 7, 'class_weight': 2.8707301965471053, 'activation': 'ReLU', 'classification_multiplier': 13875.503073315685}. Best is trial 194 with value: 0.8103647276084949.
/home/ubuntu/frb-analysis/.frb-analysis/lib/python3.12/site-packages/sklearn/metrics/_classification.py:1565: UndefinedMetricWarning: Precision is ill-defined and being set to 0.0 in labels with no predicted samples. Use `zero_division` parameter to control this behavior.
  _warn_prf(average, modifier, f"{metric.capitalize()} is", len(result))
/home/ubuntu/frb-analysis/.frb-analysis/lib/python3.12/site-packages/sklearn/metrics/_classification.py:1565: UndefinedMetricWarning: Precision is ill-defined and being set to 0.0 in labels with no predicted samples. Use `zero_division` parameter to control this behavior.
  _warn_prf(average, modifier, f"{metric.capitalize()} is", len(result))
/home/ubuntu/frb-analysis/.frb-analysis/lib/python3.12/site-packages/sklearn/metrics/_classification.py:1565: UndefinedMetricWarning: Precision is ill-defined and being set to 0.0 in labels with no predicted samples. Use `zero_division` parameter to control this behavior.
  _warn_prf(average, modifier, f"{metric.capitalize()} is", len(result))
/home/ubuntu/frb-analysis/.frb-analysis/lib/python3.12/site-packages/sklearn/metrics/_classification.py:1565: UndefinedMetricWarning: Precision is ill-defined and being set to 0.0 in labels with no predicted samples. Use `zero_division` parameter to control this behavior.
  _warn_prf(average, modifier, f"{metric.capitalize()} is", len(result))
/home/ubuntu/frb-analysis/.frb-analysis/lib/python3.12/site-packages/sklearn/metrics/_classification.py:1565: UndefinedMetricWarning: Precision is ill-defined and being set to 0.0 in labels with no predicted samples. Use `zero_division` parameter to control this behavior.
  _warn_prf(average, modifier, f"{metric.capitalize()} is", len(result))
/home/ubuntu/frb-analysis/.frb-analysis/lib/python3.12/site-packages/sklearn/metrics/_classification.py:1565: UndefinedMetricWarning: Precision is ill-defined and being set to 0.0 in labels with no predicted samples. Use `zero_division` parameter to control this behavior.
  _warn_prf(average, modifier, f"{metric.capitalize()} is", len(result))
/home/ubuntu/frb-analysis/.frb-analysis/lib/python3.12/site-packages/sklearn/metrics/_classification.py:1565: UndefinedMetricWarning: Precision is ill-defined and being set to 0.0 in labels with no predicted samples. Use `zero_division` parameter to control this behavior.
  _warn_prf(average, modifier, f"{metric.capitalize()} is", len(result))
/home/ubuntu/frb-analysis/.frb-analysis/lib/python3.12/site-packages/sklearn/metrics/_classification.py:1565: UndefinedMetricWarning: Precision is ill-defined and being set to 0.0 in labels with no predicted samples. Use `zero_division` parameter to control this behavior.
  _warn_prf(average, modifier, f"{metric.capitalize()} is", len(result))
/home/ubuntu/frb-analysis/.frb-analysis/lib/python3.12/site-packages/sklearn/metrics/_classification.py:1565: UndefinedMetricWarning: Precision is ill-defined and being set to 0.0 in labels with no predicted samples. Use `zero_division` parameter to control this behavior.
  _warn_prf(average, modifier, f"{metric.capitalize()} is", len(result))
