[I 2025-06-12 20:34:57,336] Trial 168 finished with value: 0.6917128347183749 and parameters: {'hidden_dim': 1326, 'latent_dim': 31, 'beta': 1.3753635243229576, 'gamma': 0.22217427709452844, 'dropout_rate': 0.1100973502841404, 'lr': 0.00014637064240631193, 'scheduler_patience': 7, 'class_weight': 2.867944803632933, 'activation': 'GELU', 'classification_multiplier': 12456.59255475196}. Best is trial 142 with value: 0.7733148661126501.
Confusion Matrix:
 [[ 143    6]
 [ 391 1192]]


=== Summary ===
Total False Positives: 10
Total False Negatives: 2184
Total True Positives: 5732
Total True Negatives: 738

Confusion Matrix (with duplicates):
              Non-Repeater  Repeater
Non-Repeater         738.0      10.0
Repeater            2184.0    5732.0
accuracy_score
0.7467682363804248
Trial 1: hidden_dim=1345, latent_dim=31, beta=1.369407235641231, gamma=0.17385445225681465, dropout_rate=0.10731441203643052, lr=0.00016318417027166913, scheduler_patience=7, class_weight=2.897120100319916, activation=ReLU, classification_multiplier=12905.308141170122

=== Fold 1/5 ===
Validation Accuracy: 0.7640
Classification Report:
               precision    recall  f1-score   support

Non-Repeater       0.27      0.99      0.42       149
    Repeater       1.00      0.74      0.85      1584

    accuracy                           0.76      1733
   macro avg       0.63      0.87      0.64      1733
weighted avg       0.94      0.76      0.81      1733

Confusion Matrix:
 [[ 148    1]
 [ 408 1176]]

=== Fold 2/5 ===
Validation Accuracy: 0.8938
Classification Report:
               precision    recall  f1-score   support

Non-Repeater       0.44      0.88      0.59       150
    Repeater       0.99      0.90      0.94      1583

    accuracy                           0.89      1733
   macro avg       0.72      0.89      0.76      1733
weighted avg       0.94      0.89      0.91      1733

Confusion Matrix:
 [[ 132   18]
 [ 166 1417]]

=== Fold 3/5 ===
Validation Accuracy: 0.5828
Classification Report:
               precision    recall  f1-score   support

Non-Repeater       0.17      0.99      0.29       150
    Repeater       1.00      0.54      0.70      1583

    accuracy                           0.58      1733
   macro avg       0.58      0.77      0.50      1733
weighted avg       0.93      0.58      0.67      1733

Confusion Matrix:
 [[149   1]
 [722 861]]

=== Fold 4/5 ===
Validation Accuracy: 0.6867
Classification Report:
               precision    recall  f1-score   support

Non-Repeater       0.21      0.99      0.35       150
    Repeater       1.00      0.66      0.79      1583

    accuracy                           0.69      1733
   macro avg       0.61      0.82      0.57      1733
weighted avg       0.93      0.69      0.76      1733

Confusion Matrix:
 [[ 148    2]
 [ 541 1042]]

=== Fold 5/5 ===
Validation Accuracy: 0.7200
Classification Report:
               precision    recall  f1-score   support

Non-Repeater       0.23      0.97      0.37       149
    Repeater       1.00      0.70      0.82      1583

    accuracy                           0.72      1732
   macro avg       0.61      0.83      0.60      1732
weighted avg       0.93      0.72      0.78      1732

Confusion Matrix:
 [[ 144    5]
 [ 480 1103]]


=== Summary ===
Total False Positives: 27
Total False Negatives: 2317
Total True Positives: 5599
Total True Negatives: 721

Confusion Matrix (with duplicates):
              Non-Repeater  Repeater
Non-Repeater         721.0      27.0
Repeater            2317.0    5599.0
accuracy_score
0.7294552169898431
Trial 1: hidden_dim=1371, latent_dim=30, beta=1.4375594398136073, gamma=0.1849900901426995, dropout_rate=0.1019820757459343, lr=0.0006516581891983116, scheduler_patience=7, class_weight=2.8983041767190882, activation=ReLU, classification_multiplier=12896.730298642873

=== Fold 1/5 ===
Validation Accuracy: 0.6890
Classification Report:
               precision    recall  f1-score   support

Non-Repeater       0.22      0.99      0.35       149
    Repeater       1.00      0.66      0.80      1584

    accuracy                           0.69      1733
   macro avg       0.61      0.83      0.57      1733
weighted avg       0.93      0.69      0.76      1733

Confusion Matrix:
 [[ 148    1]
 [ 538 1046]]

=== Fold 2/5 ===
Validation Accuracy: 0.6509
Classification Report:
               precision    recall  f1-score   support

Non-Repeater       0.20      0.99      0.33       150
    Repeater       1.00      0.62      0.76      1583

    accuracy                           0.65      1733
   macro avg       0.60      0.81      0.55      1733
weighted avg       0.93      0.65      0.73      1733

Confusion Matrix:
 [[149   1]
 [604 979]]

=== Fold 3/5 ===
Validation Accuracy: 0.7092
Classification Report:
               precision    recall  f1-score   support

Non-Repeater       0.23      0.99      0.37       150
    Repeater       1.00      0.68      0.81      1583

    accuracy                           0.71      1733
   macro avg       0.61      0.84      0.59      1733
weighted avg       0.93      0.71      0.77      1733

Confusion Matrix:
 [[ 149    1]
 [ 503 1080]]

=== Fold 4/5 ===
Validation Accuracy: 0.6624
Classification Report:
               precision    recall  f1-score   support

Non-Repeater       0.20      0.99      0.34       150
    Repeater       1.00      0.63      0.77      1583

    accuracy                           0.66      1733
   macro avg       0.60      0.81      0.55      1733
weighted avg       0.93      0.66      0.74      1733

Confusion Matrix:
 [[ 148    2]
 [ 583 1000]]

=== Fold 5/5 ===
Validation Accuracy: 0.7471
Classification Report:
               precision    recall  f1-score   support

Non-Repeater       0.25      0.97      0.40       149
    Repeater       1.00      0.73      0.84      1583

    accuracy                           0.75      1732
   macro avg       0.62      0.85      0.62      1732
weighted avg       0.93      0.75      0.80      1732

Confusion Matrix:
 [[ 145    4]
 [ 434 1149]]


=== Summary ===
Total False Positives: 9
Total False Negatives: 2662
Total True Positives: 5254
Total True Negatives: 739

Confusion Matrix (with duplicates):
              Non-Repeater  Repeater
Non-Repeater         739.0       9.0
Repeater            2662.0    5254.0
accuracy_score
0.6917128347183749
Trial 1: hidden_dim=1326, latent_dim=31, beta=1.3753635243229576, gamma=0.22217427709452844, dropout_rate=0.1100973502841404, lr=0.00014637064240631193, scheduler_patience=7, class_weight=2.867944803632933, activation=GELU, classification_multiplier=12456.59255475196

=== Fold 1/5 ===
Validation Accuracy: 0.7721
Classification Report:
               precision    recall  f1-score   support

Non-Repeater       0.27      0.98      0.43       149
    Repeater       1.00      0.75      0.86      1584

    accuracy                           0.77      1733
   macro avg       0.63      0.87      0.64      1733
weighted avg       0.94      0.77      0.82      1733

Confusion Matrix:
 [[ 146    3]
 [ 392 1192]]

=== Fold 2/5 ===
Validation Accuracy: 0.7496
Classification Report:
               precision    recall  f1-score   support

Non-Repeater       0.26      0.99      0.41       150
    Repeater       1.00      0.73      0.84      1583

    accuracy                           0.75      1733
   macro avg       0.63      0.86      0.62      1733
weighted avg       0.93      0.75      0.80      1733

Confusion Matrix:
 [[ 149    1]
 [ 433 1150]]

=== Fold 3/5 ===
Validation Accuracy: 0.7323
Classification Report:
               precision    recall  f1-score   support

Non-Repeater       0.24      0.99      0.39       150
    Repeater       1.00      0.71      0.83      1583

    accuracy                           0.73      1733
   macro avg       0.62      0.85      0.61      1733
weighted avg       0.93      0.73      0.79      1733

Confusion Matrix:
 [[ 149    1]
 [ 463 1120]]

=== Fold 4/5 ===
Validation Accuracy: 0.7698
Classification Report:
               precision    recall  f1-score   support

Non-Repeater       0.27      0.97      0.42       150
    Repeater       1.00      0.75      0.86      1583

    accuracy                           0.77      1733
   macro avg       0.63      0.86      0.64      1733
weighted avg       0.93      0.77      0.82      1733

Confusion Matrix:
 [[ 146    4]
 [ 395 1188]]

=== Fold 5/5 ===
Validation Accuracy: 0.8562
Classification Report:
 [I 2025-06-12 20:41:19,121] Trial 169 finished with value: 0.7759695290858726 and parameters: {'hidden_dim': 1345, 'latent_dim': 30, 'beta': 1.3510922365778995, 'gamma': 0.16542521624458312, 'dropout_rate': 0.12022916565295791, 'lr': 0.00013324117734897373, 'scheduler_patience': 7, 'class_weight': 2.930539793599179, 'activation': 'ReLU', 'classification_multiplier': 13413.496153245127}. Best is trial 169 with value: 0.7759695290858726.
[I 2025-06-12 20:47:45,184] Trial 170 finished with value: 0.7833564173591875 and parameters: {'hidden_dim': 1406, 'latent_dim': 30, 'beta': 1.3285363430850425, 'gamma': 0.10430136857716947, 'dropout_rate': 0.11826394720402336, 'lr': 0.0005141828228678734, 'scheduler_patience': 7, 'class_weight': 2.7824696619920775, 'activation': 'ReLU', 'classification_multiplier': 14873.7074780217}. Best is trial 170 with value: 0.7833564173591875.
[I 2025-06-12 20:54:02,827] Trial 171 finished with value: 0.7276084949215144 and parameters: {'hidden_dim': 1300, 'latent_dim': 30, 'beta': 1.335780938676651, 'gamma': 0.11162390226703792, 'dropout_rate': 0.11757596424727233, 'lr': 0.00011108272616296478, 'scheduler_patience': 7, 'class_weight': 2.7733801041884205, 'activation': 'ReLU', 'classification_multiplier': 13372.735355637176}. Best is trial 170 with value: 0.7833564173591875.
              precision    recall  f1-score   support

Non-Repeater       0.37      0.97      0.54       149
    Repeater       1.00      0.85      0.91      1583

    accuracy                           0.86      1732
   macro avg       0.68      0.91      0.73      1732
weighted avg       0.94      0.86      0.88      1732

Confusion Matrix:
 [[ 145    4]
 [ 245 1338]]


=== Summary ===
Total False Positives: 13
Total False Negatives: 1928
Total True Positives: 5988
Total True Negatives: 735

Confusion Matrix (with duplicates):
              Non-Repeater  Repeater
Non-Repeater         735.0      13.0
Repeater            1928.0    5988.0
accuracy_score
0.7759695290858726
Trial 1: hidden_dim=1345, latent_dim=30, beta=1.3510922365778995, gamma=0.16542521624458312, dropout_rate=0.12022916565295791, lr=0.00013324117734897373, scheduler_patience=7, class_weight=2.930539793599179, activation=ReLU, classification_multiplier=13413.496153245127

=== Fold 1/5 ===
Validation Accuracy: 0.7190
Classification Report:
               precision    recall  f1-score   support

Non-Repeater       0.23      0.99      0.38       149
    Repeater       1.00      0.69      0.82      1584

    accuracy                           0.72      1733
   macro avg       0.62      0.84      0.60      1733
weighted avg       0.93      0.72      0.78      1733

Confusion Matrix:
 [[ 148    1]
 [ 486 1098]]

=== Fold 2/5 ===
Validation Accuracy: 0.7778
Classification Report:
               precision    recall  f1-score   support

Non-Repeater       0.28      0.99      0.44       150
    Repeater       1.00      0.76      0.86      1583

    accuracy                           0.78      1733
   macro avg       0.64      0.88      0.65      1733
weighted avg       0.94      0.78      0.82      1733

Confusion Matrix:
 [[ 149    1]
 [ 384 1199]]

=== Fold 3/5 ===
Validation Accuracy: 0.8511
Classification Report:
               precision    recall  f1-score   support

Non-Repeater       0.37      0.99      0.54       150
    Repeater       1.00      0.84      0.91      1583

    accuracy                           0.85      1733
   macro avg       0.68      0.92      0.72      1733
weighted avg       0.94      0.85      0.88      1733

Confusion Matrix:
 [[ 149    1]
 [ 257 1326]]

=== Fold 4/5 ===
Validation Accuracy: 0.7715
Classification Report:
               precision    recall  f1-score   support

Non-Repeater       0.27      0.98      0.43       150
    Repeater       1.00      0.75      0.86      1583

    accuracy                           0.77      1733
   macro avg       0.63      0.87      0.64      1733
weighted avg       0.93      0.77      0.82      1733

Confusion Matrix:
 [[ 147    3]
 [ 393 1190]]

=== Fold 5/5 ===
Validation Accuracy: 0.7973
Classification Report:
               precision    recall  f1-score   support

Non-Repeater       0.29      0.97      0.45       149
    Repeater       1.00      0.78      0.88      1583

    accuracy                           0.80      1732
   macro avg       0.64      0.87      0.66      1732
weighted avg       0.94      0.80      0.84      1732

Confusion Matrix:
 [[ 144    5]
 [ 346 1237]]


=== Summary ===
Total False Positives: 11
Total False Negatives: 1866
Total True Positives: 6050
Total True Negatives: 737

Confusion Matrix (with duplicates):
              Non-Repeater  Repeater
Non-Repeater         737.0      11.0
Repeater            1866.0    6050.0
accuracy_score
0.7833564173591875
Trial 1: hidden_dim=1406, latent_dim=30, beta=1.3285363430850425, gamma=0.10430136857716947, dropout_rate=0.11826394720402336, lr=0.0005141828228678734, scheduler_patience=7, class_weight=2.7824696619920775, activation=ReLU, classification_multiplier=14873.7074780217

=== Fold 1/5 ===
Validation Accuracy: 0.7069
Classification Report:
               precision    recall  f1-score   support

Non-Repeater       0.23      1.00      0.37       149
    Repeater       1.00      0.68      0.81      1584

    accuracy                           0.71      1733
   macro avg       0.61      0.84      0.59      1733
weighted avg       0.93      0.71      0.77      1733

Confusion Matrix:
 [[ 149    0]
 [ 508 1076]]

=== Fold 2/5 ===
Validation Accuracy: 0.7450
Classification Report:
               precision    recall  f1-score   support

Non-Repeater       0.25      0.99      0.40       150
    Repeater       1.00      0.72      0.84      1583

    accuracy                           0.74      1733
   macro avg       0.63      0.86      0.62      1733
weighted avg       0.93      0.74      0.80      1733

Confusion Matrix:
 [[ 149    1]
 [ 441 1142]]

=== Fold 3/5 ===
Validation Accuracy: 0.6659
Classification Report:
               precision    recall  f1-score   support

Non-Repeater       0.20      0.99      0.34       150
    Repeater       1.00      0.63      0.78      1583

    accuracy                           0.67      1733
   macro avg       0.60      0.81      0.56      1733
weighted avg       0.93      0.67      0.74      1733

Confusion Matrix:
 [[ 149    1]
 [ 578 1005]]

=== Fold 4/5 ===
Validation Accuracy: 0.7530
Classification Report:
               precision    recall  f1-score   support

Non-Repeater       0.26      0.99      0.41       150
    Repeater       1.00      0.73      0.84      1583

    accuracy                           0.75      1733
   macro avg       0.63      0.86      0.63      1733
weighted avg       0.94      0.75      0.81      1733

Confusion Matrix:
 [[ 149    1]
 [ 427 1156]]

=== Fold 5/5 ===
Validation Accuracy: 0.7673
Classification Report:
               precision    recall  f1-score   support

Non-Repeater       0.27      0.97      0.42       149
    Repeater       1.00      0.75      0.85      1583

    accuracy                           0.77      1732
   macro avg       0.63      0.86      0.64      1732
weighted avg       0.93      0.77      0.82      1732

Confusion Matrix:
 [[ 144    5]
 [ 398 1185]]


=== Summary ===
Total False Positives: 8
Total False Negatives: 2352
Total True Positives: 5564
Total True Negatives: 740

Confusion Matrix (with duplicates):
              Non-Repeater  Repeater
Non-Repeater         740.0       8.0
Repeater            2352.0    5564.0
accuracy_score
0.7276084949215144
Trial 1: hidden_dim=1300, latent_dim=30, beta=1.335780938676651, gamma=0.11162390226703792, dropout_rate=0.11757596424727233, lr=0.00011108272616296478, scheduler_patience=7, class_weight=2.7733801041884205, activation=ReLU, classification_multiplier=13372.735355637176

=== Fold 1/5 ===
Validation Accuracy: 0.7859
Classification Report:
               precision    recall  f1-score   support

Non-Repeater       0.29      0.99      0.44       149
    Repeater       1.00      0.77      0.87      1584

    accuracy                           0.79      1733
   macro avg       0.64      0.88      0.66      1733
weighted avg       0.94      0.79      0.83      1733

Confusion Matrix:
 [[ 148    1]
 [ 370 1214]]

=== Fold 2/5 ===
Validation Accuracy: 0.7605
Classification Report:
               precision    recall  f1-score   support

Non-Repeater       0.26      0.99      0.42       150
    Repeater       1.00      0.74      0.85      1583

    accuracy                           0.76      1733
   macro avg       0.63      0.87      0.63      1733
weighted avg       0.94      0.76      0.81      1733

Confusion Matrix:
 [[ 149    1]
 [ 414 1169]]

=== Fold 3/5 ===
Validation Accuracy: 0.8229
Classification Report:
               precision    recall  f1-score   support

Non-Repeater       0.32      0.95      0.48       150
    Repeater       0.99      0.81      0.89      1583

    accuracy                           0.82      1733
   macro avg       0.66      0.88      0.69      1733
weighted avg       0.94      0.82      0.86      1733

Confusion Matrix:
 [[ 143    7]
 [ 300 1283]]

=== Fold 4/5 ===
Validation Accuracy: 0.7634
Classification Report:
 [I 2025-06-12 21:00:31,055] Trial 172 finished with value: 0.7810480147737765 and parameters: {'hidden_dim': 1401, 'latent_dim': 33, 'beta': 1.3220751311252672, 'gamma': 0.10035866812556606, 'dropout_rate': 0.1219897551563827, 'lr': 0.0005065336819036549, 'scheduler_patience': 7, 'class_weight': 2.935084167043366, 'activation': 'ReLU', 'classification_multiplier': 13123.101452721618}. Best is trial 170 with value: 0.7833564173591875.
[I 2025-06-12 21:07:09,913] Trial 173 finished with value: 0.8084025854108957 and parameters: {'hidden_dim': 1473, 'latent_dim': 33, 'beta': 1.394252917768903, 'gamma': 0.24026031818187482, 'dropout_rate': 0.13465066745146861, 'lr': 0.0005270481778622848, 'scheduler_patience': 7, 'class_weight': 2.9336633137958046, 'activation': 'ReLU', 'classification_multiplier': 14843.424408714656}. Best is trial 173 with value: 0.8084025854108957.
