[I 2025-06-12 09:32:37,435] Trial 59 finished with value: 0.5137349953831948 and parameters: {'hidden_dim': 644, 'latent_dim': 33, 'beta': 1.1120542513316285, 'gamma': 0.9267544245449524, 'dropout_rate': 0.23156191622161404, 'lr': 0.003989135695265442, 'scheduler_patience': 7, 'class_weight': 1.2512253900816812, 'activation': 'ReLU', 'classification_multiplier': 13347.654524996362}. Best is trial 22 with value: 0.7070637119113573.
              precision    recall  f1-score   support

Non-Repeater       0.12      1.00      0.21       149
    Repeater       1.00      0.28      0.44      1583

    accuracy                           0.34      1732
   macro avg       0.56      0.64      0.32      1732
weighted avg       0.92      0.34      0.42      1732

Confusion Matrix:
 [[ 149    0]
 [1138  445]]


=== Summary ===
Total False Positives: 2
Total False Negatives: 5601
Total True Positives: 2315
Total True Negatives: 746

Confusion Matrix (with duplicates):
              Non-Repeater  Repeater
Non-Repeater         746.0       2.0
Repeater            5601.0    2315.0
accuracy_score
0.35330101569713757
Trial 1: hidden_dim=1560, latent_dim=22, beta=1.827024767401523, gamma=0.553568312846068, dropout_rate=0.206996213163356, lr=0.002437250921689319, scheduler_patience=6, class_weight=1.9446989519198694, activation=GELU, classification_multiplier=8109.806134350672

=== Fold 1/5 ===
Validation Accuracy: 0.3364
Classification Report:
               precision    recall  f1-score   support

Non-Repeater       0.11      1.00      0.21       149
    Repeater       1.00      0.27      0.43      1584

    accuracy                           0.34      1733
   macro avg       0.56      0.64      0.32      1733
weighted avg       0.92      0.34      0.41      1733

Confusion Matrix:
 [[ 149    0]
 [1150  434]]

=== Fold 2/5 ===
Validation Accuracy: 0.4426
Classification Report:
               precision    recall  f1-score   support

Non-Repeater       0.13      0.99      0.24       150
    Repeater       1.00      0.39      0.56      1583

    accuracy                           0.44      1733
   macro avg       0.57      0.69      0.40      1733
weighted avg       0.92      0.44      0.53      1733

Confusion Matrix:
 [[149   1]
 [965 618]]

=== Fold 3/5 ===
Validation Accuracy: 0.4651
Classification Report:
               precision    recall  f1-score   support

Non-Repeater       0.14      1.00      0.24       150
    Repeater       1.00      0.41      0.59      1583

    accuracy                           0.47      1733
   macro avg       0.57      0.71      0.42      1733
weighted avg       0.93      0.47      0.56      1733

Confusion Matrix:
 [[150   0]
 [927 656]]

=== Fold 4/5 ===
Validation Accuracy: 0.3480
Classification Report:
               precision    recall  f1-score   support

Non-Repeater       0.12      1.00      0.21       150
    Repeater       1.00      0.29      0.44      1583

    accuracy                           0.35      1733
   macro avg       0.56      0.64      0.33      1733
weighted avg       0.92      0.35      0.42      1733

Confusion Matrix:
 [[ 150    0]
 [1130  453]]

=== Fold 5/5 ===
Validation Accuracy: 0.4486
Classification Report:
               precision    recall  f1-score   support

Non-Repeater       0.13      1.00      0.24       149
    Repeater       1.00      0.40      0.57      1583

    accuracy                           0.45      1732
   macro avg       0.57      0.70      0.40      1732
weighted avg       0.93      0.45      0.54      1732

Confusion Matrix:
 [[149   0]
 [955 628]]


=== Summary ===
Total False Positives: 1
Total False Negatives: 5127
Total True Positives: 2789
Total True Negatives: 747

Confusion Matrix (with duplicates):
              Non-Repeater  Repeater
Non-Repeater         747.0       1.0
Repeater            5127.0    2789.0
accuracy_score
0.40812557710064634
Trial 1: hidden_dim=881, latent_dim=30, beta=0.6557608212587428, gamma=1.901907235046619, dropout_rate=0.26063722544458007, lr=0.0017725566305421274, scheduler_patience=3, class_weight=2.1805714386820956, activation=LeakyReLU, classification_multiplier=10830.302658257937

=== Fold 1/5 ===
Validation Accuracy: 0.5089
Classification Report:
               precision    recall  f1-score   support

Non-Repeater       0.15      0.99      0.26       149
    Repeater       1.00      0.46      0.63      1584

    accuracy                           0.51      1733
   macro avg       0.57      0.73      0.45      1733
weighted avg       0.92      0.51      0.60      1733

Confusion Matrix:
 [[147   2]
 [849 735]]

=== Fold 2/5 ===
Validation Accuracy: 0.4697
Classification Report:
               precision    recall  f1-score   support

Non-Repeater       0.14      1.00      0.25       150
    Repeater       1.00      0.42      0.59      1583

    accuracy                           0.47      1733
   macro avg       0.57      0.71      0.42      1733
weighted avg       0.93      0.47      0.56      1733

Confusion Matrix:
 [[150   0]
 [919 664]]

=== Fold 3/5 ===
Validation Accuracy: 0.6203
Classification Report:
               precision    recall  f1-score   support

Non-Repeater       0.18      0.99      0.31       150
    Repeater       1.00      0.58      0.74      1583

    accuracy                           0.62      1733
   macro avg       0.59      0.79      0.52      1733
weighted avg       0.93      0.62      0.70      1733

Confusion Matrix:
 [[149   1]
 [657 926]]

=== Fold 4/5 ===
Validation Accuracy: 0.5811
Classification Report:
               precision    recall  f1-score   support

Non-Repeater       0.17      0.99      0.29       150
    Repeater       1.00      0.54      0.70      1583

    accuracy                           0.58      1733
   macro avg       0.58      0.77      0.50      1733
weighted avg       0.93      0.58      0.67      1733

Confusion Matrix:
 [[149   1]
 [725 858]]

=== Fold 5/5 ===
Validation Accuracy: 0.3886
Classification Report:
               precision    recall  f1-score   support

Non-Repeater       0.12      1.00      0.22       149
    Repeater       1.00      0.33      0.50      1583

    accuracy                           0.39      1732
   macro avg       0.56      0.67      0.36      1732
weighted avg       0.92      0.39      0.47      1732

Confusion Matrix:
 [[ 149    0]
 [1059  524]]


=== Summary ===
Total False Positives: 4
Total False Negatives: 4209
Total True Positives: 3707
Total True Negatives: 744

Confusion Matrix (with duplicates):
              Non-Repeater  Repeater
Non-Repeater         744.0       4.0
Repeater            4209.0    3707.0
accuracy_score
0.5137349953831948
Trial 1: hidden_dim=644, latent_dim=33, beta=1.1120542513316285, gamma=0.9267544245449524, dropout_rate=0.23156191622161404, lr=0.003989135695265442, scheduler_patience=7, class_weight=1.2512253900816812, activation=ReLU, classification_multiplier=13347.654524996362

=== Fold 1/5 ===
Validation Accuracy: 0.4784
Classification Report:
               precision    recall  f1-score   support

Non-Repeater       0.14      0.99      0.25       149
    Repeater       1.00      0.43      0.60      1584

    accuracy                           0.48      1733
   macro avg       0.57      0.71      0.42      1733
weighted avg       0.92      0.48      0.57      1733

Confusion Matrix:
 [[148   1]
 [903 681]]

=== Fold 2/5 ===
Validation Accuracy: 0.5568
Classification Report:
               precision    recall  f1-score   support

Non-Repeater       0.16      0.99      0.28       150
    Repeater       1.00      0.52      0.68      1583

    accuracy                           0.56      1733
   macro avg       0.58      0.75      0.48      1733
weighted avg       0.93      0.56      0.65      1733

Confusion Matrix:
 [[149   1]
 [767 816]]

=== Fold 3/5 ===
Validation Accuracy: 0.4657
Classification Report:
               precision    recall  f1-score   support

Non-Repeater       0.14      0.99      0.24       150
    Repeater       1.00      0.42      0.59      1583

    accuracy                           0.47      1733
   macro avg       0.57      0.70      0.42      1733
weighted avg       0.92      0.47      0.56      1733

Confusion Matrix:
 [[149   1]
 [925 658]]

=== Fold 4/5 ===
Validation Accuracy: 0.4945
Classification Report:
 [I 2025-06-12 09:38:39,510] Trial 60 finished with value: 0.5231994459833795 and parameters: {'hidden_dim': 1124, 'latent_dim': 29, 'beta': 1.6818825929379044, 'gamma': 0.8852449712146137, 'dropout_rate': 0.4840431560624271, 'lr': 0.0008487027219983082, 'scheduler_patience': 5, 'class_weight': 2.462136731657797, 'activation': 'ReLU', 'classification_multiplier': 12040.453710733667}. Best is trial 22 with value: 0.7070637119113573.
[I 2025-06-12 09:44:38,525] Trial 61 finished with value: 0.666089566020314 and parameters: {'hidden_dim': 1102, 'latent_dim': 20, 'beta': 1.3536067811183488, 'gamma': 0.4438935832325612, 'dropout_rate': 0.1747158055278324, 'lr': 0.00019454840474633924, 'scheduler_patience': 6, 'class_weight': 2.0633597143009865, 'activation': 'ReLU', 'classification_multiplier': 5247.038816128508}. Best is trial 22 with value: 0.7070637119113573.
[I 2025-06-12 09:50:29,497] Trial 62 finished with value: 0.6896352723915051 and parameters: {'hidden_dim': 1025, 'latent_dim': 16, 'beta': 1.4741642191199655, 'gamma': 0.49983352220601374, 'dropout_rate': 0.18794705553159008, 'lr': 0.0010334613837113481, 'scheduler_patience': 6, 'class_weight': 2.0188653190535244, 'activation': 'ReLU', 'classification_multiplier': 5025.889324213962}. Best is trial 22 with value: 0.7070637119113573.
              precision    recall  f1-score   support

Non-Repeater       0.15      1.00      0.26       150
    Repeater       1.00      0.45      0.62      1583

    accuracy                           0.49      1733
   macro avg       0.57      0.72      0.44      1733
weighted avg       0.93      0.49      0.59      1733

Confusion Matrix:
 [[150   0]
 [876 707]]

=== Fold 5/5 ===
Validation Accuracy: 0.6207
Classification Report:
               precision    recall  f1-score   support

Non-Repeater       0.18      0.99      0.31       149
    Repeater       1.00      0.59      0.74      1583

    accuracy                           0.62      1732
   macro avg       0.59      0.79      0.52      1732
weighted avg       0.93      0.62      0.70      1732

Confusion Matrix:
 [[148   1]
 [656 927]]


=== Summary ===
Total False Positives: 4
Total False Negatives: 4127
Total True Positives: 3789
Total True Negatives: 744

Confusion Matrix (with duplicates):
              Non-Repeater  Repeater
Non-Repeater         744.0       4.0
Repeater            4127.0    3789.0
accuracy_score
0.5231994459833795
Trial 1: hidden_dim=1124, latent_dim=29, beta=1.6818825929379044, gamma=0.8852449712146137, dropout_rate=0.4840431560624271, lr=0.0008487027219983082, scheduler_patience=5, class_weight=2.462136731657797, activation=ReLU, classification_multiplier=12040.453710733667

=== Fold 1/5 ===
Validation Accuracy: 0.6544
Classification Report:
               precision    recall  f1-score   support

Non-Repeater       0.20      0.99      0.33       149
    Repeater       1.00      0.62      0.77      1584

    accuracy                           0.65      1733
   macro avg       0.60      0.81      0.55      1733
weighted avg       0.93      0.65      0.73      1733

Confusion Matrix:
 [[148   1]
 [598 986]]

=== Fold 2/5 ===
Validation Accuracy: 0.6497
Classification Report:
               precision    recall  f1-score   support

Non-Repeater       0.20      0.99      0.33       150
    Repeater       1.00      0.62      0.76      1583

    accuracy                           0.65      1733
   macro avg       0.60      0.81      0.55      1733
weighted avg       0.93      0.65      0.73      1733

Confusion Matrix:
 [[149   1]
 [606 977]]

=== Fold 3/5 ===
Validation Accuracy: 0.6399
Classification Report:
               precision    recall  f1-score   support

Non-Repeater       0.19      0.99      0.32       150
    Repeater       1.00      0.61      0.75      1583

    accuracy                           0.64      1733
   macro avg       0.60      0.80      0.54      1733
weighted avg       0.93      0.64      0.72      1733

Confusion Matrix:
 [[148   2]
 [622 961]]

=== Fold 4/5 ===
Validation Accuracy: 0.6492
Classification Report:
               precision    recall  f1-score   support

Non-Repeater       0.20      0.99      0.33       150
    Repeater       1.00      0.62      0.76      1583

    accuracy                           0.65      1733
   macro avg       0.60      0.80      0.55      1733
weighted avg       0.93      0.65      0.72      1733

Confusion Matrix:
 [[149   1]
 [607 976]]

=== Fold 5/5 ===
Validation Accuracy: 0.7373
Classification Report:
               precision    recall  f1-score   support

Non-Repeater       0.24      0.98      0.39       149
    Repeater       1.00      0.71      0.83      1583

    accuracy                           0.74      1732
   macro avg       0.62      0.85      0.61      1732
weighted avg       0.93      0.74      0.79      1732

Confusion Matrix:
 [[ 146    3]
 [ 452 1131]]


=== Summary ===
Total False Positives: 8
Total False Negatives: 2885
Total True Positives: 5031
Total True Negatives: 740

Confusion Matrix (with duplicates):
              Non-Repeater  Repeater
Non-Repeater         740.0       8.0
Repeater            2885.0    5031.0
accuracy_score
0.666089566020314
Trial 1: hidden_dim=1102, latent_dim=20, beta=1.3536067811183488, gamma=0.4438935832325612, dropout_rate=0.1747158055278324, lr=0.00019454840474633924, scheduler_patience=6, class_weight=2.0633597143009865, activation=ReLU, classification_multiplier=5247.038816128508

=== Fold 1/5 ===
Validation Accuracy: 0.6751
Classification Report:
               precision    recall  f1-score   support

Non-Repeater       0.21      1.00      0.35       149
    Repeater       1.00      0.64      0.78      1584

    accuracy                           0.68      1733
   macro avg       0.60      0.82      0.56      1733
weighted avg       0.93      0.68      0.75      1733

Confusion Matrix:
 [[ 149    0]
 [ 563 1021]]

=== Fold 2/5 ===
Validation Accuracy: 0.6717
Classification Report:
               precision    recall  f1-score   support

Non-Repeater       0.21      0.99      0.34       150
    Repeater       1.00      0.64      0.78      1583

    accuracy                           0.67      1733
   macro avg       0.60      0.82      0.56      1733
weighted avg       0.93      0.67      0.74      1733

Confusion Matrix:
 [[ 149    1]
 [ 568 1015]]

=== Fold 3/5 ===
Validation Accuracy: 0.7248
Classification Report:
               precision    recall  f1-score   support

Non-Repeater       0.24      0.99      0.38       150
    Repeater       1.00      0.70      0.82      1583

    accuracy                           0.72      1733
   macro avg       0.62      0.84      0.60      1733
weighted avg       0.93      0.72      0.78      1733

Confusion Matrix:
 [[ 148    2]
 [ 475 1108]]

=== Fold 4/5 ===
Validation Accuracy: 0.6659
Classification Report:
               precision    recall  f1-score   support

Non-Repeater       0.20      0.99      0.34       150
    Repeater       1.00      0.64      0.78      1583

    accuracy                           0.67      1733
   macro avg       0.60      0.81      0.56      1733
weighted avg       0.93      0.67      0.74      1733

Confusion Matrix:
 [[ 148    2]
 [ 577 1006]]

=== Fold 5/5 ===
Validation Accuracy: 0.7107
Classification Report:
               precision    recall  f1-score   support

Non-Repeater       0.23      0.98      0.37       149
    Repeater       1.00      0.69      0.81      1583

    accuracy                           0.71      1732
   macro avg       0.61      0.83      0.59      1732
weighted avg       0.93      0.71      0.77      1732

Confusion Matrix:
 [[ 146    3]
 [ 498 1085]]


=== Summary ===
Total False Positives: 8
Total False Negatives: 2681
Total True Positives: 5235
Total True Negatives: 740

Confusion Matrix (with duplicates):
              Non-Repeater  Repeater
Non-Repeater         740.0       8.0
Repeater            2681.0    5235.0
accuracy_score
0.6896352723915051
Trial 1: hidden_dim=1025, latent_dim=16, beta=1.4741642191199655, gamma=0.49983352220601374, dropout_rate=0.18794705553159008, lr=0.0010334613837113481, scheduler_patience=6, class_weight=2.0188653190535244, activation=ReLU, classification_multiplier=5025.889324213962

=== Fold 1/5 ===
Validation Accuracy: 0.6786
Classification Report:
               precision    recall  f1-score   support

Non-Repeater       0.21      0.99      0.35       149
    Repeater       1.00      0.65      0.79      1584

    accuracy                           0.68      1733
   macro avg       0.60      0.82      0.57      1733
weighted avg       0.93      0.68      0.75      1733

Confusion Matrix:
 [[ 148    1]
 [ 556 1028]]

=== Fold 2/5 ===
Validation Accuracy: 0.8413
Classification Report:
               precision    recall  f1-score   support

Non-Repeater       0.35      0.97      0.51       150
    Repeater       1.00      0.83      0.91      1583

    accuracy                           0.84      1733
   macro avg       0.67      0.90      0.71      1733
weighted avg       0.94      0.84      0.87      1733

Confusion Matrix:
 [[ 146    4]
 [ 271 1312]]

=== Fold 3/5 ===
Validation Accuracy: 0.6492
Classification Report:
 [I 2025-06-12 09:56:20,128] Trial 63 finished with value: 0.7299168975069252 and parameters: {'hidden_dim': 1009, 'latent_dim': 11, 'beta': 1.008452094950722, 'gamma': 0.3292376356968917, 'dropout_rate': 0.15229708908033537, 'lr': 0.001128065720947974, 'scheduler_patience': 6, 'class_weight': 1.5704806618971032, 'activation': 'ReLU', 'classification_multiplier': 5744.958553062104}. Best is trial 63 with value: 0.7299168975069252.
[I 2025-06-12 10:01:57,584] Trial 64 finished with value: 0.655932594644506 and parameters: {'hidden_dim': 792, 'latent_dim': 12, 'beta': 0.9931434497623146, 'gamma': 0.31357045684191603, 'dropout_rate': 0.1412180885203951, 'lr': 0.0010452700806898672, 'scheduler_patience': 7, 'class_weight': 1.5776938406829646, 'activation': 'ReLU', 'classification_multiplier': 6215.778226982829}. Best is trial 63 with value: 0.7299168975069252.
