[I 2025-06-13 09:37:39,169] Trial 289 finished with value: 0.707409972299169 and parameters: {'hidden_dim': 1410, 'latent_dim': 29, 'beta': 1.6683569264773241, 'gamma': 0.29954199717680363, 'dropout_rate': 0.3155326628136148, 'lr': 0.0006210207724481492, 'scheduler_patience': 7, 'class_weight': 2.90997517326741, 'activation': 'ReLU', 'classification_multiplier': 13937.99548651055}. Best is trial 194 with value: 0.8103647276084949.
              precision    recall  f1-score   support

Non-Repeater       0.11      0.99      0.21       150
    Repeater       1.00      0.27      0.43      1583

    accuracy                           0.34      1733
   macro avg       0.56      0.63      0.32      1733
weighted avg       0.92      0.34      0.41      1733

Confusion Matrix:
 [[ 149    1]
 [1151  432]]

=== Fold 4/5 ===
Validation Accuracy: 0.3912
Classification Report:
               precision    recall  f1-score   support

Non-Repeater       0.12      0.98      0.22       150
    Repeater       0.99      0.34      0.50      1583

    accuracy                           0.39      1733
   macro avg       0.56      0.66      0.36      1733
weighted avg       0.92      0.39      0.48      1733

Confusion Matrix:
 [[ 147    3]
 [1052  531]]

=== Fold 5/5 ===
Validation Accuracy: 0.2621
Classification Report:
               precision    recall  f1-score   support

Non-Repeater       0.10      1.00      0.19       149
    Repeater       1.00      0.19      0.32      1583

    accuracy                           0.26      1732
   macro avg       0.55      0.60      0.26      1732
weighted avg       0.92      0.26      0.31      1732

Confusion Matrix:
 [[ 149    0]
 [1278  305]]


=== Summary ===
Total False Positives: 4
Total False Negatives: 5697
Total True Positives: 2219
Total True Negatives: 744

Confusion Matrix (with duplicates):
              Non-Repeater  Repeater
Non-Repeater         744.0       4.0
Repeater            5697.0    2219.0
accuracy_score
0.3419898430286242
Trial 1: hidden_dim=1196, latent_dim=32, beta=1.4494084928318598, gamma=0.20540108815056635, dropout_rate=0.1256735336041828, lr=0.00040693450932178203, scheduler_patience=7, class_weight=2.9950367297432012, activation=SELU, classification_multiplier=14348.48453341512

=== Fold 1/5 ===
Validation Accuracy: 0.2060
Classification Report:
               precision    recall  f1-score   support

Non-Repeater       0.10      1.00      0.18       149
    Repeater       1.00      0.13      0.23      1584

    accuracy                           0.21      1733
   macro avg       0.55      0.57      0.21      1733
weighted avg       0.92      0.21      0.23      1733

Confusion Matrix:
 [[ 149    0]
 [1376  208]]

=== Fold 2/5 ===
Validation Accuracy: 0.0866
Classification Report:
               precision    recall  f1-score   support

Non-Repeater       0.09      1.00      0.16       150
    Repeater       0.00      0.00      0.00      1583

    accuracy                           0.09      1733
   macro avg       0.04      0.50      0.08      1733
weighted avg       0.01      0.09      0.01      1733

Confusion Matrix:
 [[ 150    0]
 [1583    0]]

=== Fold 3/5 ===
Validation Accuracy: 0.2320
Classification Report:
               precision    recall  f1-score   support

Non-Repeater       0.10      1.00      0.18       150
    Repeater       1.00      0.16      0.27      1583

    accuracy                           0.23      1733
   macro avg       0.55      0.58      0.23      1733
weighted avg       0.92      0.23      0.27      1733

Confusion Matrix:
 [[ 150    0]
 [1331  252]]

=== Fold 4/5 ===
Validation Accuracy: 0.0929
Classification Report:
               precision    recall  f1-score   support

Non-Repeater       0.09      1.00      0.16       150
    Repeater       1.00      0.01      0.01      1583

    accuracy                           0.09      1733
   macro avg       0.54      0.50      0.09      1733
weighted avg       0.92      0.09      0.03      1733

Confusion Matrix:
 [[ 150    0]
 [1572   11]]

=== Fold 5/5 ===
Validation Accuracy: 0.0860
Classification Report:
               precision    recall  f1-score   support

Non-Repeater       0.09      1.00      0.16       149
    Repeater       0.00      0.00      0.00      1583

    accuracy                           0.09      1732
   macro avg       0.04      0.50      0.08      1732
weighted avg       0.01      0.09      0.01      1732

Confusion Matrix:
 [[ 149    0]
 [1583    0]]


=== Summary ===
Total False Positives: 0
Total False Negatives: 7445
Total True Positives: 471
Total True Negatives: 748

Confusion Matrix (with duplicates):
              Non-Repeater  Repeater
Non-Repeater         748.0       0.0
Repeater            7445.0     471.0
accuracy_score
0.14069713758079408
Trial 1: hidden_dim=1564, latent_dim=34, beta=1.5044301050501987, gamma=0.1846350642324235, dropout_rate=0.11243237327111504, lr=0.007552915679118533, scheduler_patience=7, class_weight=2.62090214614502, activation=ReLU, classification_multiplier=14738.916692895336

=== Fold 1/5 ===
Validation Accuracy: 0.6942
Classification Report:
               precision    recall  f1-score   support

Non-Repeater       0.22      0.99      0.36       149
    Repeater       1.00      0.67      0.80      1584

    accuracy                           0.69      1733
   macro avg       0.61      0.83      0.58      1733
weighted avg       0.93      0.69      0.76      1733

Confusion Matrix:
 [[ 148    1]
 [ 529 1055]]

=== Fold 2/5 ===
Validation Accuracy: 0.6838
Classification Report:
               precision    recall  f1-score   support

Non-Repeater       0.21      0.99      0.35       150
    Repeater       1.00      0.65      0.79      1583

    accuracy                           0.68      1733
   macro avg       0.61      0.82      0.57      1733
weighted avg       0.93      0.68      0.75      1733

Confusion Matrix:
 [[ 149    1]
 [ 547 1036]]

=== Fold 3/5 ===
Validation Accuracy: 0.7450
Classification Report:
               precision    recall  f1-score   support

Non-Repeater       0.25      0.99      0.40       150
    Repeater       1.00      0.72      0.84      1583

    accuracy                           0.74      1733
   macro avg       0.63      0.86      0.62      1733
weighted avg       0.93      0.74      0.80      1733

Confusion Matrix:
 [[ 149    1]
 [ 441 1142]]

=== Fold 4/5 ===
Validation Accuracy: 0.6642
Classification Report:
               precision    recall  f1-score   support

Non-Repeater       0.20      0.99      0.34       150
    Repeater       1.00      0.63      0.77      1583

    accuracy                           0.66      1733
   macro avg       0.60      0.81      0.56      1733
weighted avg       0.93      0.66      0.74      1733

Confusion Matrix:
 [[ 149    1]
 [ 581 1002]]

=== Fold 5/5 ===
Validation Accuracy: 0.7500
Classification Report:
               precision    recall  f1-score   support

Non-Repeater       0.25      0.98      0.40       149
    Repeater       1.00      0.73      0.84      1583

    accuracy                           0.75      1732
   macro avg       0.63      0.85      0.62      1732
weighted avg       0.93      0.75      0.80      1732

Confusion Matrix:
 [[ 146    3]
 [ 430 1153]]


=== Summary ===
Total False Positives: 7
Total False Negatives: 2528
Total True Positives: 5388
Total True Negatives: 741

Confusion Matrix (with duplicates):
              Non-Repeater  Repeater
Non-Repeater         741.0       7.0
Repeater            2528.0    5388.0
accuracy_score
0.707409972299169
Trial 1: hidden_dim=1410, latent_dim=29, beta=1.6683569264773241, gamma=0.29954199717680363, dropout_rate=0.3155326628136148, lr=0.0006210207724481492, scheduler_patience=7, class_weight=2.90997517326741, activation=ReLU, classification_multiplier=13937.99548651055

=== Fold 1/5 ===
Validation Accuracy: 0.7819
Classification Report:
               precision    recall  f1-score   support

Non-Repeater       0.28      0.98      0.44       149
    Repeater       1.00      0.76      0.86      1584

    accuracy                           0.78      1733
   macro avg       0.64      0.87      0.65      1733
weighted avg       0.94      0.78      0.83      1733

Confusion Matrix:
 [[ 146    3]
 [ 375 1209]]

=== Fold 2/5 ===
Validation Accuracy: 0.8078
Classification Report:
 [I 2025-06-13 09:44:01,075] Trial 290 finished with value: 0.7246075715604802 and parameters: {'hidden_dim': 1335, 'latent_dim': 31, 'beta': 1.407884270899808, 'gamma': 1.9342142303041048, 'dropout_rate': 0.15829408050220545, 'lr': 0.0009248199928220484, 'scheduler_patience': 7, 'class_weight': 2.757468555323865, 'activation': 'ReLU', 'classification_multiplier': 14783.433530509665}. Best is trial 194 with value: 0.8103647276084949.
[I 2025-06-13 09:50:23,235] Trial 291 finished with value: 0.7132963988919667 and parameters: {'hidden_dim': 1360, 'latent_dim': 33, 'beta': 1.3451317574572232, 'gamma': 0.13320586257632078, 'dropout_rate': 0.1305593632561639, 'lr': 0.000103548117751713, 'scheduler_patience': 7, 'class_weight': 2.857256444534341, 'activation': 'ReLU', 'classification_multiplier': 13604.316050356885}. Best is trial 194 with value: 0.8103647276084949.
[I 2025-06-13 09:56:58,533] Trial 292 finished with value: 0.7644275161588181 and parameters: {'hidden_dim': 1454, 'latent_dim': 32, 'beta': 1.303454126406526, 'gamma': 0.16253999028462374, 'dropout_rate': 0.12121600601620322, 'lr': 0.0003480628167035315, 'scheduler_patience': 7, 'class_weight': 2.690713549070354, 'activation': 'ReLU', 'classification_multiplier': 14608.267268827864}. Best is trial 194 with value: 0.8103647276084949.
              precision    recall  f1-score   support

Non-Repeater       0.31      0.97      0.47       150
    Repeater       1.00      0.79      0.88      1583

    accuracy                           0.81      1733
   macro avg       0.65      0.88      0.67      1733
weighted avg       0.94      0.81      0.85      1733

Confusion Matrix:
 [[ 146    4]
 [ 329 1254]]

=== Fold 3/5 ===
Validation Accuracy: 0.6342
Classification Report:
               precision    recall  f1-score   support

Non-Repeater       0.19      0.99      0.32       150
    Repeater       1.00      0.60      0.75      1583

    accuracy                           0.63      1733
   macro avg       0.59      0.79      0.53      1733
weighted avg       0.93      0.63      0.71      1733

Confusion Matrix:
 [[148   2]
 [632 951]]

=== Fold 4/5 ===
Validation Accuracy: 0.6394
Classification Report:
               precision    recall  f1-score   support

Non-Repeater       0.19      0.99      0.32       150
    Repeater       1.00      0.61      0.75      1583

    accuracy                           0.64      1733
   macro avg       0.59      0.80      0.54      1733
weighted avg       0.93      0.64      0.72      1733

Confusion Matrix:
 [[148   2]
 [623 960]]

=== Fold 5/5 ===
Validation Accuracy: 0.7598
Classification Report:
               precision    recall  f1-score   support

Non-Repeater       0.26      0.97      0.41       149
    Repeater       1.00      0.74      0.85      1583

    accuracy                           0.76      1732
   macro avg       0.63      0.86      0.63      1732
weighted avg       0.93      0.76      0.81      1732

Confusion Matrix:
 [[ 145    4]
 [ 412 1171]]


=== Summary ===
Total False Positives: 15
Total False Negatives: 2371
Total True Positives: 5545
Total True Negatives: 733

Confusion Matrix (with duplicates):
              Non-Repeater  Repeater
Non-Repeater         733.0      15.0
Repeater            2371.0    5545.0
accuracy_score
0.7246075715604802
Trial 1: hidden_dim=1335, latent_dim=31, beta=1.407884270899808, gamma=1.9342142303041048, dropout_rate=0.15829408050220545, lr=0.0009248199928220484, scheduler_patience=7, class_weight=2.757468555323865, activation=ReLU, classification_multiplier=14783.433530509665

=== Fold 1/5 ===
Validation Accuracy: 0.7086
Classification Report:
               precision    recall  f1-score   support

Non-Repeater       0.23      1.00      0.37       149
    Repeater       1.00      0.68      0.81      1584

    accuracy                           0.71      1733
   macro avg       0.61      0.84      0.59      1733
weighted avg       0.93      0.71      0.77      1733

Confusion Matrix:
 [[ 149    0]
 [ 505 1079]]

=== Fold 2/5 ===
Validation Accuracy: 0.7444
Classification Report:
               precision    recall  f1-score   support

Non-Repeater       0.25      0.99      0.40       150
    Repeater       1.00      0.72      0.84      1583

    accuracy                           0.74      1733
   macro avg       0.63      0.86      0.62      1733
weighted avg       0.93      0.74      0.80      1733

Confusion Matrix:
 [[ 149    1]
 [ 442 1141]]

=== Fold 3/5 ===
Validation Accuracy: 0.6780
Classification Report:
               precision    recall  f1-score   support

Non-Repeater       0.21      0.99      0.35       150
    Repeater       1.00      0.65      0.79      1583

    accuracy                           0.68      1733
   macro avg       0.60      0.82      0.57      1733
weighted avg       0.93      0.68      0.75      1733

Confusion Matrix:
 [[ 148    2]
 [ 556 1027]]

=== Fold 4/5 ===
Validation Accuracy: 0.6676
Classification Report:
               precision    recall  f1-score   support

Non-Repeater       0.21      0.99      0.34       150
    Repeater       1.00      0.64      0.78      1583

    accuracy                           0.67      1733
   macro avg       0.60      0.82      0.56      1733
weighted avg       0.93      0.67      0.74      1733

Confusion Matrix:
 [[ 149    1]
 [ 575 1008]]

=== Fold 5/5 ===
Validation Accuracy: 0.7679
Classification Report:
               precision    recall  f1-score   support

Non-Repeater       0.27      0.97      0.42       149
    Repeater       1.00      0.75      0.85      1583

    accuracy                           0.77      1732
   macro avg       0.63      0.86      0.64      1732
weighted avg       0.93      0.77      0.82      1732

Confusion Matrix:
 [[ 145    4]
 [ 398 1185]]


=== Summary ===
Total False Positives: 8
Total False Negatives: 2476
Total True Positives: 5440
Total True Negatives: 740

Confusion Matrix (with duplicates):
              Non-Repeater  Repeater
Non-Repeater         740.0       8.0
Repeater            2476.0    5440.0
accuracy_score
0.7132963988919667
Trial 1: hidden_dim=1360, latent_dim=33, beta=1.3451317574572232, gamma=0.13320586257632078, dropout_rate=0.1305593632561639, lr=0.000103548117751713, scheduler_patience=7, class_weight=2.857256444534341, activation=ReLU, classification_multiplier=13604.316050356885

=== Fold 1/5 ===
Validation Accuracy: 0.7715
Classification Report:
               precision    recall  f1-score   support

Non-Repeater       0.27      0.99      0.43       149
    Repeater       1.00      0.75      0.86      1584

    accuracy                           0.77      1733
   macro avg       0.64      0.87      0.64      1733
weighted avg       0.94      0.77      0.82      1733

Confusion Matrix:
 [[ 148    1]
 [ 395 1189]]

=== Fold 2/5 ===
Validation Accuracy: 0.7738
Classification Report:
               precision    recall  f1-score   support

Non-Repeater       0.28      0.99      0.43       150
    Repeater       1.00      0.75      0.86      1583

    accuracy                           0.77      1733
   macro avg       0.64      0.87      0.64      1733
weighted avg       0.94      0.77      0.82      1733

Confusion Matrix:
 [[ 148    2]
 [ 390 1193]]

=== Fold 3/5 ===
Validation Accuracy: 0.7392
Classification Report:
               precision    recall  f1-score   support

Non-Repeater       0.25      0.99      0.40       150
    Repeater       1.00      0.72      0.83      1583

    accuracy                           0.74      1733
   macro avg       0.62      0.85      0.62      1733
weighted avg       0.93      0.74      0.80      1733

Confusion Matrix:
 [[ 149    1]
 [ 451 1132]]

=== Fold 4/5 ===
Validation Accuracy: 0.6844
Classification Report:
               precision    recall  f1-score   support

Non-Repeater       0.21      0.98      0.35       150
    Repeater       1.00      0.66      0.79      1583

    accuracy                           0.68      1733
   macro avg       0.60      0.82      0.57      1733
weighted avg       0.93      0.68      0.75      1733

Confusion Matrix:
 [[ 147    3]
 [ 544 1039]]

=== Fold 5/5 ===
Validation Accuracy: 0.8533
Classification Report:
               precision    recall  f1-score   support

Non-Repeater       0.37      0.97      0.53       149
    Repeater       1.00      0.84      0.91      1583

    accuracy                           0.85      1732
   macro avg       0.68      0.90      0.72      1732
weighted avg       0.94      0.85      0.88      1732

Confusion Matrix:
 [[ 144    5]
 [ 249 1334]]


=== Summary ===
Total False Positives: 12
Total False Negatives: 2029
Total True Positives: 5887
Total True Negatives: 736

Confusion Matrix (with duplicates):
              Non-Repeater  Repeater
Non-Repeater         736.0      12.0
Repeater            2029.0    5887.0
accuracy_score
0.7644275161588181
Trial 1: hidden_dim=1454, latent_dim=32, beta=1.303454126406526, gamma=0.16253999028462374, dropout_rate=0.12121600601620322, lr=0.0003480628167035315, scheduler_patience=7, class_weight=2.690713549070354, activation=ReLU, classification_multiplier=14608.267268827864

=== Fold 1/5 ===
Validation Accuracy: 0.7634
Classification Report:
 [I 2025-06-13 10:03:47,441] Trial 293 finished with value: 0.7251846722068329 and parameters: {'hidden_dim': 1618, 'latent_dim': 30, 'beta': 1.4567558032088874, 'gamma': 0.2341566893760718, 'dropout_rate': 0.1403303438340181, 'lr': 0.0007762046885168906, 'scheduler_patience': 7, 'class_weight': 2.942557498192352, 'activation': 'ReLU', 'classification_multiplier': 14995.66243952324}. Best is trial 194 with value: 0.8103647276084949.
