nohup: ignoring input
[I 2025-06-12 03:33:42,868] A new study created in memory with name: no-name-88bf89f4-0292-4021-96f9-a9162162ba7b
[I 2025-06-12 03:41:26,761] Trial 0 finished with value: 0.4577562326869806 and parameters: {'hidden_dim': 2018, 'latent_dim': 18, 'beta': 1.4930907093519619, 'gamma': 1.77487547524147, 'dropout_rate': 0.194626415752703, 'lr': 0.003174787176497178, 'scheduler_patience': 3, 'class_weight': 2.4878995772305936, 'activation': 'ReLU', 'classification_multiplier': 14582.481642200562}. Best is trial 0 with value: 0.4577562326869806.
/home/ubuntu/frb-analysis/.frb-analysis/lib/python3.12/site-packages/sklearn/metrics/_classification.py:1565: UndefinedMetricWarning: Precision is ill-defined and being set to 0.0 in labels with no predicted samples. Use `zero_division` parameter to control this behavior.
  _warn_prf(average, modifier, f"{metric.capitalize()} is", len(result))
/home/ubuntu/frb-analysis/.frb-analysis/lib/python3.12/site-packages/sklearn/metrics/_classification.py:1565: UndefinedMetricWarning: Precision is ill-defined and being set to 0.0 in labels with no predicted samples. Use `zero_division` parameter to control this behavior.
  _warn_prf(average, modifier, f"{metric.capitalize()} is", len(result))
/home/ubuntu/frb-analysis/.frb-analysis/lib/python3.12/site-packages/sklearn/metrics/_classification.py:1565: UndefinedMetricWarning: Precision is ill-defined and being set to 0.0 in labels with no predicted samples. Use `zero_division` parameter to control this behavior.
  _warn_prf(average, modifier, f"{metric.capitalize()} is", len(result))
/home/ubuntu/frb-analysis/.frb-analysis/lib/python3.12/site-packages/sklearn/metrics/_classification.py:1565: UndefinedMetricWarning: Precision is ill-defined and being set to 0.0 in labels with no predicted samples. Use `zero_division` parameter to control this behavior.
  _warn_prf(average, modifier, f"{metric.capitalize()} is", len(result))
/home/ubuntu/frb-analysis/.frb-analysis/lib/python3.12/site-packages/sklearn/metrics/_classification.py:1565: UndefinedMetricWarning: Precision is ill-defined and being set to 0.0 in labels with no predicted samples. Use `zero_division` parameter to control this behavior.
  _warn_prf(average, modifier, f"{metric.capitalize()} is", len(result))
/home/ubuntu/frb-analysis/.frb-analysis/lib/python3.12/site-packages/sklearn/metrics/_classification.py:1565: UndefinedMetricWarning: Precision is ill-defined and being set to 0.0 in labels with no predicted samples. Use `zero_division` parameter to control this behavior.
  _warn_prf(average, modifier, f"{metric.capitalize()} is", len(result))
[I 2025-06-12 03:46:55,261] Trial 1 finished with value: 0.1193444136657433 and parameters: {'hidden_dim': 600, 'latent_dim': 13, 'beta': 0.24231785716326218, 'gamma': 0.23566550610431358, 'dropout_rate': 0.35733920898549876, 'lr': 0.00679469695939387, 'scheduler_patience': 4, 'class_weight': 1.0044718520255012, 'activation': 'ReLU', 'classification_multiplier': 13601.576291558733}. Best is trial 0 with value: 0.4577562326869806.
/home/ubuntu/frb-analysis/.frb-analysis/lib/python3.12/site-packages/sklearn/metrics/_classification.py:1565: UndefinedMetricWarning: Precision is ill-defined and being set to 0.0 in labels with no predicted samples. Use `zero_division` parameter to control this behavior.
  _warn_prf(average, modifier, f"{metric.capitalize()} is", len(result))
/home/ubuntu/frb-analysis/.frb-analysis/lib/python3.12/site-packages/sklearn/metrics/_classification.py:1565: UndefinedMetricWarning: Precision is ill-defined and being set to 0.0 in labels with no predicted samples. Use `zero_division` parameter to control this behavior.
  _warn_prf(average, modifier, f"{metric.capitalize()} is", len(result))
/home/ubuntu/frb-analysis/.frb-analysis/lib/python3.12/site-packages/sklearn/metrics/_classification.py:1565: UndefinedMetricWarning: Precision is ill-defined and being set to 0.0 in labels with no predicted samples. Use `zero_division` parameter to control this behavior.
  _warn_prf(average, modifier, f"{metric.capitalize()} is", len(result))
/home/ubuntu/frb-analysis/.frb-analysis/lib/python3.12/site-packages/sklearn/metrics/_classification.py:1565: UndefinedMetricWarning: Precision is ill-defined and being set to 0.0 in labels with no predicted samples. Use `zero_division` parameter to control this behavior.
  _warn_prf(average, modifier, f"{metric.capitalize()} is", len(result))
/home/ubuntu/frb-analysis/.frb-analysis/lib/python3.12/site-packages/sklearn/metrics/_classification.py:1565: UndefinedMetricWarning: Precision is ill-defined and being set to 0.0 in labels with no predicted samples. Use `zero_division` parameter to control this behavior.
  _warn_prf(average, modifier, f"{metric.capitalize()} is", len(result))
/home/ubuntu/frb-analysis/.frb-analysis/lib/python3.12/site-packages/sklearn/metrics/_classification.py:1565: UndefinedMetricWarning: Precision is ill-defined and being set to 0.0 in labels with no predicted samples. Use `zero_division` parameter to control this behavior.
  _warn_prf(average, modifier, f"{metric.capitalize()} is", len(result))
/home/ubuntu/frb-analysis/.frb-analysis/lib/python3.12/site-packages/sklearn/metrics/_classification.py:1565: UndefinedMetricWarning: Precision is ill-defined and being set to 0.0 in labels with no predicted samples. Use `zero_division` parameter to control this behavior.
  _warn_prf(average, modifier, f"{metric.capitalize()} is", len(result))
/home/ubuntu/frb-analysis/.frb-analysis/lib/python3.12/site-packages/sklearn/metrics/_classification.py:1565: UndefinedMetricWarning: Precision is ill-defined and being set to 0.0 in labels with no predicted samples. Use `zero_division` parameter to control this behavior.
  _warn_prf(average, modifier, f"{metric.capitalize()} is", len(result))
/home/ubuntu/frb-analysis/.frb-analysis/lib/python3.12/site-packages/sklearn/metrics/_classification.py:1565: UndefinedMetricWarning: Precision is ill-defined and being set to 0.0 in labels with no predicted samples. Use `zero_division` parameter to control this behavior.
  _warn_prf(average, modifier, f"{metric.capitalize()} is", len(result))
/home/ubuntu/frb-analysis/.frb-analysis/lib/python3.12/site-packages/sklearn/metrics/_classification.py:1565: UndefinedMetricWarning: Precision is ill-defined and being set to 0.0 in labels with no predicted samples. Use `zero_division` parameter to control this behavior.
  _warn_prf(average, modifier, f"{metric.capitalize()} is", len(result))
/home/ubuntu/frb-analysis/.frb-analysis/lib/python3.12/site-packages/sklearn/metrics/_classification.py:1565: UndefinedMetricWarning: Precision is ill-defined and being set to 0.0 in labels with no predicted samples. Use `zero_division` parameter to control this behavior.
  _warn_prf(average, modifier, f"{metric.capitalize()} is", len(result))
/home/ubuntu/frb-analysis/.frb-analysis/lib/python3.12/site-packages/sklearn/metrics/_classification.py:1565: UndefinedMetricWarning: Precision is ill-defined and being set to 0.0 in labels with no predicted samples. Use `zero_division` parameter to control this behavior.
  _warn_prf(average, modifier, f"{metric.capitalize()} is", len(result))
443
Number of NaN values in 'Repeater' column before processing: 443
Number of NaN values in 'Repeater' column after processing: 0

=== Fold 1/5 ===
Validation Accuracy: 0.1321
Classification Report:
               precision    recall  f1-score   support

Non-Repeater       0.09      1.00      0.17       149
    Repeater       1.00      0.05      0.10      1584

    accuracy                           0.13      1733
   macro avg       0.55      0.53      0.13      1733
weighted avg       0.92      0.13      0.10      1733

Confusion Matrix:
 [[ 149    0]
 [1504   80]]

=== Fold 2/5 ===
Validation Accuracy: 0.6111
Classification Report:
               precision    recall  f1-score   support

Non-Repeater       0.18      0.99      0.31       150
    Repeater       1.00      0.57      0.73      1583

    accuracy                           0.61      1733
   macro avg       0.59      0.78      0.52      1733
weighted avg       0.93      0.61      0.69      1733

Confusion Matrix:
 [[149   1]
 [673 910]]

=== Fold 3/5 ===
Validation Accuracy: 0.6070
Classification Report:
               precision    recall  f1-score   support

Non-Repeater       0.18      0.99      0.30       150
    Repeater       1.00      0.57      0.73      1583

    accuracy                           0.61      1733
   macro avg       0.59      0.78      0.52      1733
weighted avg       0.93      0.61      0.69      1733

Confusion Matrix:
 [[149   1]
 [680 903]]

=== Fold 4/5 ===
Validation Accuracy: 0.5597
Classification Report:
               precision    recall  f1-score   support

Non-Repeater       0.16      1.00      0.28       150
    Repeater       1.00      0.52      0.68      1583

    accuracy                           0.56      1733
   macro avg       0.58      0.76      0.48      1733
weighted avg       0.93      0.56      0.65      1733

Confusion Matrix:
 [[150   0]
 [763 820]]

=== Fold 5/5 ===
Validation Accuracy: 0.3788
Classification Report:
               precision    recall  f1-score   support

Non-Repeater       0.12      1.00      0.22       149
    Repeater       1.00      0.32      0.49      1583

    accuracy                           0.38      1732
   macro avg       0.56      0.66      0.35      1732
weighted avg       0.92      0.38      0.46      1732

Confusion Matrix:
 [[ 149    0]
 [1076  507]]


=== Summary ===
Total False Positives: 2
Total False Negatives: 4696
Total True Positives: 3220
Total True Negatives: 746

Confusion Matrix (with duplicates):
              Non-Repeater  Repeater
Non-Repeater         746.0       2.0
Repeater            4696.0    3220.0
accuracy_score
0.4577562326869806
Trial 1: hidden_dim=2018, latent_dim=18, beta=1.4930907093519619, gamma=1.77487547524147, dropout_rate=0.194626415752703, lr=0.003174787176497178, scheduler_patience=3, class_weight=2.4878995772305936, activation=ReLU, classification_multiplier=14582.481642200562

=== Fold 1/5 ===
Validation Accuracy: 0.1235
Classification Report:
               precision    recall  f1-score   support

Non-Repeater       0.09      1.00      0.16       149
    Repeater       1.00      0.04      0.08      1584

    accuracy                           0.12      1733
   macro avg       0.54      0.52      0.12      1733
weighted avg       0.92      0.12      0.09      1733

Confusion Matrix:
 [[ 149    0]
 [1519   65]]

=== Fold 2/5 ===
Validation Accuracy: 0.2123
Classification Report:
               precision    recall  f1-score   support

Non-Repeater       0.10      1.00      0.18       150
    Repeater       1.00      0.14      0.24      1583

    accuracy                           0.21      1733
   macro avg       0.55      0.57      0.21      1733
weighted avg       0.92      0.21      0.24      1733

Confusion Matrix:
 [[ 150    0]
 [1365  218]]

=== Fold 3/5 ===
Validation Accuracy: 0.0883
Classification Report:
               precision    recall  f1-score   support

Non-Repeater       0.09      1.00      0.16       150
    Repeater       1.00      0.00      0.00      1583

    accuracy                           0.09      1733
   macro avg       0.54      0.50      0.08      1733
weighted avg       0.92      0.09      0.02      1733

Confusion Matrix:
 [[ 150    0]
 [1580    3]]

=== Fold 4/5 ===
Validation Accuracy: 0.0866
Classification Report:
               precision    recall  f1-score   support

Non-Repeater       0.09      1.00      0.16       150
    Repeater       0.00      0.00      0.00      1583

    accuracy                           0.09      1733
   macro avg       0.04      0.50      0.08      1733
weighted avg       0.01      0.09      0.01      1733

Confusion Matrix:
 [[ 150    0]
 [1583    0]]

=== Fold 5/5 ===
Validation Accuracy: 0.0860
Classification Report:
               precision    recall  f1-score   support

Non-Repeater       0.09      1.00      0.16       149
    Repeater       0.00      0.00      0.00      1583

    accuracy                           0.09      1732
   macro avg       0.04      0.50      0.08      1732
weighted avg       0.01      0.09      0.01      1732

Confusion Matrix:
 [[ 149    0]
 [1583    0]]


=== Summary ===
Total False Positives: 0
Total False Negatives: 7630
Total True Positives: 286
Total True Negatives: 748

Confusion Matrix (with duplicates):
              Non-Repeater  Repeater
Non-Repeater         748.0       0.0
Repeater            7630.0     286.0
accuracy_score
0.1193444136657433
Trial 1: hidden_dim=600, latent_dim=13, beta=0.24231785716326218, gamma=0.23566550610431358, dropout_rate=0.35733920898549876, lr=0.00679469695939387, scheduler_patience=4, class_weight=1.0044718520255012, activation=ReLU, classification_multiplier=13601.576291558733

=== Fold 1/5 ===
Validation Accuracy: 0.0860
Classification Report:
               precision    recall  f1-score   support

Non-Repeater       0.09      1.00      0.16       149
    Repeater       0.00      0.00      0.00      1584

    accuracy                           0.09      1733
   macro avg       0.04      0.50      0.08      1733
weighted avg       0.01      0.09      0.01      1733

Confusion Matrix:
 [[ 149    0]
 [1584    0]]

=== Fold 2/5 ===
Validation Accuracy: 0.0877
Classification Report:
               precision    recall  f1-score   support

Non-Repeater       0.09      1.00      0.16       150
    Repeater       1.00      0.00      0.00      1583

    accuracy                           0.09      1733
   macro avg       0.54      0.50      0.08      1733
weighted avg       0.92      0.09      0.02      1733

Confusion Matrix:
 [[ 150    0]
 [1581    2]]

=== Fold 3/5 ===
Validation Accuracy: 0.0866
Classification Report:
               precision    recall  f1-score   support

Non-Repeater       0.09      1.00      0.16       150
    Repeater       0.00      0.00      0.00      1583

    accuracy                           0.09      1733
   macro avg       0.04      0.50      0.08      1733
weighted avg       0.01      0.09      0.01      1733

Confusion Matrix:
 [[ 150    0]
 [1583    0]]

=== Fold 4/5 ===
Validation Accuracy: 0.0866
Classification Report:
               precision    recall  f1-score   support

Non-Repeater       0.09      1.00      0.16       150
    Repeater       0.00      0.00      0.00      1583

    accuracy                           0.09      1733
   macro avg       0.04      0.50      0.08      1733
weighted avg       0.01      0.09      0.01      1733

Confusion Matrix:
 [[ 150    0]
 [1583    0]]

=== Fold 5/5 ===
Validation Accuracy: 0.0860
Classification Report:
               precision    recall  f1-score   support

Non-Repeater       0.09      1.00      0.16       149
    Repeater       0.00      0.00      0.00      1583

    accuracy                           0.09      1732
   macro avg       0.04      0.50      0.08      1732
weighted avg       0.01      0.09      0.01      1732

Confusion Matrix:
 [[ 149    0]
 [1583    0]]


=== Summary ===
Total False Positives: 0
Total False Negatives: 7914
Total True Positives: 2
Total True Negatives: 748

Confusion Matrix (with duplicates):
              Non-Repeater  Repeater
Non-Repeater         748.0       0.0
Repeater            7914.0       2.0
accuracy_score
[I 2025-06-12 03:53:56,283] Trial 2 finished with value: 0.0865650969529086 and parameters: {'hidden_dim': 1735, 'latent_dim': 37, 'beta': 1.3016535795702617, 'gamma': 0.32166664253122623, 'dropout_rate': 0.44393640720377714, 'lr': 0.008438191444556459, 'scheduler_patience': 2, 'class_weight': 0.639740594538863, 'activation': 'SELU', 'classification_multiplier': 13266.813393681039}. Best is trial 0 with value: 0.4577562326869806.
[I 2025-06-12 03:59:21,768] Trial 3 finished with value: 0.44344413665743304 and parameters: {'hidden_dim': 452, 'latent_dim': 18, 'beta': 1.0383324742329447, 'gamma': 0.2361153704867974, 'dropout_rate': 0.1131868986944248, 'lr': 0.0008612682072617264, 'scheduler_patience': 4, 'class_weight': 0.9945413498384007, 'activation': 'GELU', 'classification_multiplier': 10986.600771801252}. Best is trial 0 with value: 0.4577562326869806.
