[I 2025-06-12 06:39:35,279] Trial 30 finished with value: 0.3843490304709141 and parameters: {'hidden_dim': 812, 'latent_dim': 15, 'beta': 0.4682311801407075, 'gamma': 1.0064098967358885, 'dropout_rate': 0.21626113987357432, 'lr': 0.005638535820075225, 'scheduler_patience': 3, 'class_weight': 2.220591439479588, 'activation': 'ReLU', 'classification_multiplier': 7130.892055817953}. Best is trial 22 with value: 0.7070637119113573.
              Non-Repeater  Repeater
Non-Repeater         739.0       9.0
Repeater            2529.0    5387.0
accuracy_score
0.7070637119113573
Trial 1: hidden_dim=715, latent_dim=28, beta=0.7865828986763219, gamma=0.8269023039771609, dropout_rate=0.12645516893660896, lr=0.001125397807660103, scheduler_patience=7, class_weight=1.7572532805034375, activation=ReLU, classification_multiplier=6587.3465925069895

=== Fold 1/5 ===
Validation Accuracy: 0.4934
Classification Report:
               precision    recall  f1-score   support

Non-Repeater       0.14      0.99      0.25       149
    Repeater       1.00      0.45      0.62      1584

    accuracy                           0.49      1733
   macro avg       0.57      0.72      0.43      1733
weighted avg       0.93      0.49      0.59      1733

Confusion Matrix:
 [[148   1]
 [877 707]]

=== Fold 2/5 ===
Validation Accuracy: 0.5118
Classification Report:
               precision    recall  f1-score   support

Non-Repeater       0.15      1.00      0.26       150
    Repeater       1.00      0.47      0.64      1583

    accuracy                           0.51      1733
   macro avg       0.58      0.73      0.45      1733
weighted avg       0.93      0.51      0.60      1733

Confusion Matrix:
 [[150   0]
 [846 737]]

=== Fold 3/5 ===
Validation Accuracy: 0.5701
Classification Report:
               precision    recall  f1-score   support

Non-Repeater       0.17      0.99      0.29       150
    Repeater       1.00      0.53      0.69      1583

    accuracy                           0.57      1733
   macro avg       0.58      0.76      0.49      1733
weighted avg       0.93      0.57      0.66      1733

Confusion Matrix:
 [[149   1]
 [744 839]]

=== Fold 4/5 ===
Validation Accuracy: 0.2349
Classification Report:
               precision    recall  f1-score   support

Non-Repeater       0.10      1.00      0.18       150
    Repeater       1.00      0.16      0.28      1583

    accuracy                           0.23      1733
   macro avg       0.55      0.58      0.23      1733
weighted avg       0.92      0.23      0.27      1733

Confusion Matrix:
 [[ 150    0]
 [1326  257]]

=== Fold 5/5 ===
Validation Accuracy: 0.4290
Classification Report:
               precision    recall  f1-score   support

Non-Repeater       0.13      1.00      0.23       149
    Repeater       1.00      0.38      0.55      1583

    accuracy                           0.43      1732
   macro avg       0.57      0.69      0.39      1732
weighted avg       0.93      0.43      0.52      1732

Confusion Matrix:
 [[149   0]
 [989 594]]


=== Summary ===
Total False Positives: 2
Total False Negatives: 4782
Total True Positives: 3134
Total True Negatives: 746

Confusion Matrix (with duplicates):
              Non-Repeater  Repeater
Non-Repeater         746.0       2.0
Repeater            4782.0    3134.0
accuracy_score
0.44783010156971376
Trial 1: hidden_dim=621, latent_dim=34, beta=0.6693452736351571, gamma=0.6503390096750715, dropout_rate=0.12847672033031668, lr=0.003449070697376837, scheduler_patience=2, class_weight=1.7552093309668138, activation=ReLU, classification_multiplier=6445.550405764963

=== Fold 1/5 ===
Validation Accuracy: 0.5130
Classification Report:
               precision    recall  f1-score   support

Non-Repeater       0.15      1.00      0.26       149
    Repeater       1.00      0.47      0.64      1584

    accuracy                           0.51      1733
   macro avg       0.58      0.73      0.45      1733
weighted avg       0.93      0.51      0.60      1733

Confusion Matrix:
 [[149   0]
 [844 740]]

=== Fold 2/5 ===
Validation Accuracy: 0.5239
Classification Report:
               precision    recall  f1-score   support

Non-Repeater       0.15      1.00      0.27       150
    Repeater       1.00      0.48      0.65      1583

    accuracy                           0.52      1733
   macro avg       0.58      0.74      0.46      1733
weighted avg       0.93      0.52      0.61      1733

Confusion Matrix:
 [[150   0]
 [825 758]]

=== Fold 3/5 ===
Validation Accuracy: 0.1269
Classification Report:
               precision    recall  f1-score   support

Non-Repeater       0.09      1.00      0.17       150
    Repeater       1.00      0.04      0.08      1583

    accuracy                           0.13      1733
   macro avg       0.55      0.52      0.13      1733
weighted avg       0.92      0.13      0.09      1733

Confusion Matrix:
 [[ 150    0]
 [1513   70]]

=== Fold 4/5 ===
Validation Accuracy: 0.3907
Classification Report:
               precision    recall  f1-score   support

Non-Repeater       0.12      1.00      0.22       150
    Repeater       1.00      0.33      0.50      1583

    accuracy                           0.39      1733
   macro avg       0.56      0.67      0.36      1733
weighted avg       0.92      0.39      0.48      1733

Confusion Matrix:
 [[ 150    0]
 [1056  527]]

=== Fold 5/5 ===
Validation Accuracy: 0.3672
Classification Report:
               precision    recall  f1-score   support

Non-Repeater       0.12      1.00      0.21       149
    Repeater       1.00      0.31      0.47      1583

    accuracy                           0.37      1732
   macro avg       0.56      0.65      0.34      1732
weighted avg       0.92      0.37      0.45      1732

Confusion Matrix:
 [[ 149    0]
 [1096  487]]


=== Summary ===
Total False Positives: 0
Total False Negatives: 5334
Total True Positives: 2582
Total True Negatives: 748

Confusion Matrix (with duplicates):
              Non-Repeater  Repeater
Non-Repeater         748.0       0.0
Repeater            5334.0    2582.0
accuracy_score
0.3843490304709141
Trial 1: hidden_dim=812, latent_dim=15, beta=0.4682311801407075, gamma=1.0064098967358885, dropout_rate=0.21626113987357432, lr=0.005638535820075225, scheduler_patience=3, class_weight=2.220591439479588, activation=ReLU, classification_multiplier=7130.892055817953

=== Fold 1/5 ===
Validation Accuracy: 0.7057
Classification Report:
               precision    recall  f1-score   support

Non-Repeater       0.22      0.99      0.37       149
    Repeater       1.00      0.68      0.81      1584

    accuracy                           0.71      1733
   macro avg       0.61      0.83      0.59      1733
weighted avg       0.93      0.71      0.77      1733

Confusion Matrix:
 [[ 147    2]
 [ 508 1076]]

=== Fold 2/5 ===
Validation Accuracy: 0.6070
Classification Report:
               precision    recall  f1-score   support

Non-Repeater       0.18      0.99      0.30       150
    Repeater       1.00      0.57      0.73      1583

    accuracy                           0.61      1733
   macro avg       0.59      0.78      0.52      1733
weighted avg       0.93      0.61      0.69      1733

Confusion Matrix:
 [[149   1]
 [680 903]]

=== Fold 3/5 ===
Validation Accuracy: 0.6180
Classification Report:
               precision    recall  f1-score   support

Non-Repeater       0.18      1.00      0.31       150
    Repeater       1.00      0.58      0.74      1583

    accuracy                           0.62      1733
   macro avg       0.59      0.79      0.52      1733
weighted avg       0.93      0.62      0.70      1733

Confusion Matrix:
 [[150   0]
 [662 921]]

=== Fold 4/5 ===
Validation Accuracy: 0.6601
Classification Report:
               precision    recall  f1-score   support

Non-Repeater       0.20      0.99      0.33       150
    Repeater       1.00      0.63      0.77      1583

    accuracy                           0.66      1733
   macro avg       0.60      0.81      0.55      1733
weighted avg       0.93      0.66      0.73      1733

Confusion Matrix:
 [[148   2]
 [587 996]]

=== Fold 5/5 ===
Validation Accuracy: 0.7396
Classification Report:
               precision    recall  f1-score   support

Non-Repeater       0.25      0.98      0.39       149
    Repeater       1.00      0.72      0.83      1583

    accuracy                           0.74      1732
   macro avg       0.62      0.85      0.61      1732
weighted avg       0.93      0.74      0.80      1732

Confusion Matrix:
 [[ 146    3]
 [ 448 1135]]


=== Summary ===
[I 2025-06-12 06:45:09,796] Trial 31 finished with value: 0.666089566020314 and parameters: {'hidden_dim': 710, 'latent_dim': 28, 'beta': 0.8532482231113326, 'gamma': 0.8400643345057778, 'dropout_rate': 0.18498068903587342, 'lr': 0.0009754954539071868, 'scheduler_patience': 7, 'class_weight': 1.469573014389956, 'activation': 'ReLU', 'classification_multiplier': 8041.7166374487415}. Best is trial 22 with value: 0.7070637119113573.
[I 2025-06-12 06:50:41,094] Trial 32 finished with value: 0.6348107109879964 and parameters: {'hidden_dim': 496, 'latent_dim': 30, 'beta': 1.1579778789971915, 'gamma': 0.8141145356498848, 'dropout_rate': 0.13496758285876273, 'lr': 0.002076387471683849, 'scheduler_patience': 7, 'class_weight': 1.1390431790503786, 'activation': 'ReLU', 'classification_multiplier': 5846.218665822634}. Best is trial 22 with value: 0.7070637119113573.
[I 2025-06-12 06:58:26,515] Trial 33 finished with value: 0.66101108033241 and parameters: {'hidden_dim': 2027, 'latent_dim': 26, 'beta': 1.0583113613534891, 'gamma': 0.4222805984283831, 'dropout_rate': 0.11036729962781466, 'lr': 0.0007884169591802109, 'scheduler_patience': 6, 'class_weight': 1.7491594596413205, 'activation': 'ReLU', 'classification_multiplier': 7012.745247467542}. Best is trial 22 with value: 0.7070637119113573.
/home/ubuntu/frb-analysis/.frb-analysis/lib/python3.12/site-packages/sklearn/metrics/_classification.py:1565: UndefinedMetricWarning: Precision is ill-defined and being set to 0.0 in labels with no predicted samples. Use `zero_division` parameter to control this behavior.
  _warn_prf(average, modifier, f"{metric.capitalize()} is", len(result))
/home/ubuntu/frb-analysis/.frb-analysis/lib/python3.12/site-packages/sklearn/metrics/_classification.py:1565: UndefinedMetricWarning: Precision is ill-defined and being set to 0.0 in labels with no predicted samples. Use `zero_division` parameter to control this behavior.
  _warn_prf(average, modifier, f"{metric.capitalize()} is", len(result))
/home/ubuntu/frb-analysis/.frb-analysis/lib/python3.12/site-packages/sklearn/metrics/_classification.py:1565: UndefinedMetricWarning: Precision is ill-defined and being set to 0.0 in labels with no predicted samples. Use `zero_division` parameter to control this behavior.
  _warn_prf(average, modifier, f"{metric.capitalize()} is", len(result))
Total False Positives: 8
Total False Negatives: 2885
Total True Positives: 5031
Total True Negatives: 740

Confusion Matrix (with duplicates):
              Non-Repeater  Repeater
Non-Repeater         740.0       8.0
Repeater            2885.0    5031.0
accuracy_score
0.666089566020314
Trial 1: hidden_dim=710, latent_dim=28, beta=0.8532482231113326, gamma=0.8400643345057778, dropout_rate=0.18498068903587342, lr=0.0009754954539071868, scheduler_patience=7, class_weight=1.469573014389956, activation=ReLU, classification_multiplier=8041.7166374487415

=== Fold 1/5 ===
Validation Accuracy: 0.6919
Classification Report:
               precision    recall  f1-score   support

Non-Repeater       0.22      0.99      0.36       149
    Repeater       1.00      0.66      0.80      1584

    accuracy                           0.69      1733
   macro avg       0.61      0.83      0.58      1733
weighted avg       0.93      0.69      0.76      1733

Confusion Matrix:
 [[ 148    1]
 [ 533 1051]]

=== Fold 2/5 ===
Validation Accuracy: 0.6763
Classification Report:
               precision    recall  f1-score   support

Non-Repeater       0.21      0.99      0.35       150
    Repeater       1.00      0.65      0.78      1583

    accuracy                           0.68      1733
   macro avg       0.60      0.82      0.57      1733
weighted avg       0.93      0.68      0.75      1733

Confusion Matrix:
 [[ 149    1]
 [ 560 1023]]

=== Fold 3/5 ===
Validation Accuracy: 0.4686
Classification Report:
               precision    recall  f1-score   support

Non-Repeater       0.14      1.00      0.25       150
    Repeater       1.00      0.42      0.59      1583

    accuracy                           0.47      1733
   macro avg       0.57      0.71      0.42      1733
weighted avg       0.93      0.47      0.56      1733

Confusion Matrix:
 [[150   0]
 [921 662]]

=== Fold 4/5 ===
Validation Accuracy: 0.6255
Classification Report:
               precision    recall  f1-score   support

Non-Repeater       0.18      0.97      0.31       150
    Repeater       1.00      0.59      0.74      1583

    accuracy                           0.63      1733
   macro avg       0.59      0.78      0.53      1733
weighted avg       0.93      0.63      0.71      1733

Confusion Matrix:
 [[146   4]
 [645 938]]

=== Fold 5/5 ===
Validation Accuracy: 0.7119
Classification Report:
               precision    recall  f1-score   support

Non-Repeater       0.23      0.98      0.37       149
    Repeater       1.00      0.69      0.81      1583

    accuracy                           0.71      1732
   macro avg       0.61      0.83      0.59      1732
weighted avg       0.93      0.71      0.78      1732

Confusion Matrix:
 [[ 146    3]
 [ 496 1087]]


=== Summary ===
Total False Positives: 9
Total False Negatives: 3155
Total True Positives: 4761
Total True Negatives: 739

Confusion Matrix (with duplicates):
              Non-Repeater  Repeater
Non-Repeater         739.0       9.0
Repeater            3155.0    4761.0
accuracy_score
0.6348107109879964
Trial 1: hidden_dim=496, latent_dim=30, beta=1.1579778789971915, gamma=0.8141145356498848, dropout_rate=0.13496758285876273, lr=0.002076387471683849, scheduler_patience=7, class_weight=1.1390431790503786, activation=ReLU, classification_multiplier=5846.218665822634

=== Fold 1/5 ===
Validation Accuracy: 0.5770
Classification Report:
               precision    recall  f1-score   support

Non-Repeater       0.17      0.99      0.29       149
    Repeater       1.00      0.54      0.70      1584

    accuracy                           0.58      1733
   macro avg       0.58      0.77      0.49      1733
weighted avg       0.93      0.58      0.66      1733

Confusion Matrix:
 [[148   1]
 [732 852]]

=== Fold 2/5 ===
Validation Accuracy: 0.6751
Classification Report:
               precision    recall  f1-score   support

Non-Repeater       0.21      0.99      0.35       150
    Repeater       1.00      0.64      0.78      1583

    accuracy                           0.68      1733
   macro avg       0.60      0.82      0.56      1733
weighted avg       0.93      0.68      0.75      1733

Confusion Matrix:
 [[ 149    1]
 [ 562 1021]]

=== Fold 3/5 ===
Validation Accuracy: 0.6786
Classification Report:
               precision    recall  f1-score   support

Non-Repeater       0.21      0.99      0.35       150
    Repeater       1.00      0.65      0.79      1583

    accuracy                           0.68      1733
   macro avg       0.61      0.82      0.57      1733
weighted avg       0.93      0.68      0.75      1733

Confusion Matrix:
 [[ 149    1]
 [ 556 1027]]

=== Fold 4/5 ===
Validation Accuracy: 0.6249
Classification Report:
               precision    recall  f1-score   support

Non-Repeater       0.19      0.99      0.31       150
    Repeater       1.00      0.59      0.74      1583

    accuracy                           0.62      1733
   macro avg       0.59      0.79      0.53      1733
weighted avg       0.93      0.62      0.70      1733

Confusion Matrix:
 [[148   2]
 [648 935]]

=== Fold 5/5 ===
Validation Accuracy: 0.7494
Classification Report:
               precision    recall  f1-score   support

Non-Repeater       0.25      0.98      0.40       149
    Repeater       1.00      0.73      0.84      1583

    accuracy                           0.75      1732
   macro avg       0.63      0.85      0.62      1732
weighted avg       0.93      0.75      0.80      1732

Confusion Matrix:
 [[ 146    3]
 [ 431 1152]]


=== Summary ===
Total False Positives: 8
Total False Negatives: 2929
Total True Positives: 4987
Total True Negatives: 740

Confusion Matrix (with duplicates):
              Non-Repeater  Repeater
Non-Repeater         740.0       8.0
Repeater            2929.0    4987.0
accuracy_score
0.66101108033241
Trial 1: hidden_dim=2027, latent_dim=26, beta=1.0583113613534891, gamma=0.4222805984283831, dropout_rate=0.11036729962781466, lr=0.0007884169591802109, scheduler_patience=6, class_weight=1.7491594596413205, activation=ReLU, classification_multiplier=7012.745247467542

=== Fold 1/5 ===
Validation Accuracy: 0.2118
Classification Report:
               precision    recall  f1-score   support

Non-Repeater       0.10      1.00      0.18       149
    Repeater       1.00      0.14      0.24      1584

    accuracy                           0.21      1733
   macro avg       0.55      0.57      0.21      1733
weighted avg       0.92      0.21      0.24      1733

Confusion Matrix:
 [[ 149    0]
 [1366  218]]

=== Fold 2/5 ===
Validation Accuracy: 0.1910
Classification Report:
               precision    recall  f1-score   support

Non-Repeater       0.10      1.00      0.18       150
    Repeater       1.00      0.11      0.21      1583

    accuracy                           0.19      1733
   macro avg       0.55      0.56      0.19      1733
weighted avg       0.92      0.19      0.20      1733

Confusion Matrix:
 [[ 150    0]
 [1402  181]]

=== Fold 3/5 ===
Validation Accuracy: 0.0866
Classification Report:
               precision    recall  f1-score   support

Non-Repeater       0.09      1.00      0.16       150
    Repeater       0.00      0.00      0.00      1583

    accuracy                           0.09      1733
   macro avg       0.04      0.50      0.08      1733
weighted avg       0.01      0.09      0.01      1733

Confusion Matrix:
 [[ 150    0]
 [1583    0]]

=== Fold 4/5 ===
Validation Accuracy: 0.3070
Classification Report:
               precision    recall  f1-score   support

Non-Repeater       0.11      0.99      0.20       150
    Repeater       1.00      0.24      0.39      1583

    accuracy                           0.31      1733
   macro avg       0.55      0.62      0.29      1733
weighted avg       0.92      0.31      0.37      1733

Confusion Matrix:
 [[ 149    1]
 [1200  383]]

=== Fold 5/5 ===
Validation Accuracy: 0.3048
Classification Report:
 [I 2025-06-12 07:04:07,473] Trial 34 finished with value: 0.22022160664819945 and parameters: {'hidden_dim': 913, 'latent_dim': 21, 'beta': 1.380675831037491, 'gamma': 0.14385348980960722, 'dropout_rate': 0.16873585161956056, 'lr': 0.002575353870884277, 'scheduler_patience': 7, 'class_weight': 1.4175589093818153, 'activation': 'SELU', 'classification_multiplier': 9153.28651990452}. Best is trial 22 with value: 0.7070637119113573.
[I 2025-06-12 07:10:27,334] Trial 35 finished with value: 0.5648661126500462 and parameters: {'hidden_dim': 1323, 'latent_dim': 34, 'beta': 1.3986776152775888, 'gamma': 0.6346533283101324, 'dropout_rate': 0.1957147658596943, 'lr': 0.0012562622073313944, 'scheduler_patience': 6, 'class_weight': 1.0065588417502367, 'activation': 'ReLU', 'classification_multiplier': 8461.437763728354}. Best is trial 22 with value: 0.7070637119113573.
