[I 2025-06-12 16:28:30,462] Trial 128 finished with value: 0.694713758079409 and parameters: {'hidden_dim': 1031, 'latent_dim': 36, 'beta': 0.8878188436410402, 'gamma': 0.26576343204109376, 'dropout_rate': 0.1914120814032496, 'lr': 0.0005850705893245728, 'scheduler_patience': 7, 'class_weight': 2.1646641883452835, 'activation': 'ReLU', 'classification_multiplier': 10941.89375868141}. Best is trial 72 with value: 0.7479224376731302.
/home/ubuntu/frb-analysis/.frb-analysis/lib/python3.12/site-packages/sklearn/metrics/_classification.py:1565: UndefinedMetricWarning: Precision is ill-defined and being set to 0.0 in labels with no predicted samples. Use `zero_division` parameter to control this behavior.
  _warn_prf(average, modifier, f"{metric.capitalize()} is", len(result))
/home/ubuntu/frb-analysis/.frb-analysis/lib/python3.12/site-packages/sklearn/metrics/_classification.py:1565: UndefinedMetricWarning: Precision is ill-defined and being set to 0.0 in labels with no predicted samples. Use `zero_division` parameter to control this behavior.
  _warn_prf(average, modifier, f"{metric.capitalize()} is", len(result))
/home/ubuntu/frb-analysis/.frb-analysis/lib/python3.12/site-packages/sklearn/metrics/_classification.py:1565: UndefinedMetricWarning: Precision is ill-defined and being set to 0.0 in labels with no predicted samples. Use `zero_division` parameter to control this behavior.
  _warn_prf(average, modifier, f"{metric.capitalize()} is", len(result))
              precision    recall  f1-score   support

Non-Repeater       0.26      0.98      0.41       149
    Repeater       1.00      0.74      0.85      1583

    accuracy                           0.76      1732
   macro avg       0.63      0.86      0.63      1732
weighted avg       0.93      0.76      0.81      1732

Confusion Matrix:
 [[ 146    3]
 [ 419 1164]]


=== Summary ===
Total False Positives: 7
Total False Negatives: 2560
Total True Positives: 5356
Total True Negatives: 741

Confusion Matrix (with duplicates):
              Non-Repeater  Repeater
Non-Repeater         741.0       7.0
Repeater            2560.0    5356.0
accuracy_score
0.7037165281625115
Trial 1: hidden_dim=1097, latent_dim=35, beta=1.1252998662035791, gamma=0.34336195593396257, dropout_rate=0.20575536442018058, lr=0.0005123662527314926, scheduler_patience=7, class_weight=2.1459855189392574, activation=ReLU, classification_multiplier=11513.79508106042

=== Fold 1/5 ===
Validation Accuracy: 0.5626
Classification Report:
               precision    recall  f1-score   support

Non-Repeater       0.16      1.00      0.28       149
    Repeater       1.00      0.52      0.69      1584

    accuracy                           0.56      1733
   macro avg       0.58      0.76      0.48      1733
weighted avg       0.93      0.56      0.65      1733

Confusion Matrix:
 [[149   0]
 [758 826]]

=== Fold 2/5 ===
Validation Accuracy: 0.5020
Classification Report:
               precision    recall  f1-score   support

Non-Repeater       0.15      0.99      0.26       150
    Repeater       1.00      0.46      0.63      1583

    accuracy                           0.50      1733
   macro avg       0.57      0.72      0.44      1733
weighted avg       0.92      0.50      0.59      1733

Confusion Matrix:
 [[149   1]
 [862 721]]

=== Fold 3/5 ===
Validation Accuracy: 0.5113
Classification Report:
               precision    recall  f1-score   support

Non-Repeater       0.15      0.99      0.26       150
    Repeater       1.00      0.47      0.64      1583

    accuracy                           0.51      1733
   macro avg       0.57      0.73      0.45      1733
weighted avg       0.93      0.51      0.60      1733

Confusion Matrix:
 [[149   1]
 [846 737]]

=== Fold 4/5 ===
Validation Accuracy: 0.3710
Classification Report:
               precision    recall  f1-score   support

Non-Repeater       0.12      0.99      0.21       150
    Repeater       1.00      0.31      0.48      1583

    accuracy                           0.37      1733
   macro avg       0.56      0.65      0.35      1733
weighted avg       0.92      0.37      0.45      1733

Confusion Matrix:
 [[ 149    1]
 [1089  494]]

=== Fold 5/5 ===
Validation Accuracy: 0.4804
Classification Report:
               precision    recall  f1-score   support

Non-Repeater       0.14      1.00      0.25       149
    Repeater       1.00      0.43      0.60      1583

    accuracy                           0.48      1732
   macro avg       0.57      0.72      0.43      1732
weighted avg       0.93      0.48      0.57      1732

Confusion Matrix:
 [[149   0]
 [900 683]]


=== Summary ===
Total False Positives: 3
Total False Negatives: 4455
Total True Positives: 3461
Total True Negatives: 745

Confusion Matrix (with duplicates):
              Non-Repeater  Repeater
Non-Repeater         745.0       3.0
Repeater            4455.0    3461.0
accuracy_score
0.48545706371191133
Trial 1: hidden_dim=1087, latent_dim=35, beta=1.1243746118226934, gamma=0.3039361358571765, dropout_rate=0.20743327939858314, lr=0.00013590288293319192, scheduler_patience=7, class_weight=2.230601090820643, activation=ELU, classification_multiplier=11604.833997374453

=== Fold 1/5 ===
Validation Accuracy: 0.7040
Classification Report:
               precision    recall  f1-score   support

Non-Repeater       0.23      1.00      0.37       149
    Repeater       1.00      0.68      0.81      1584

    accuracy                           0.70      1733
   macro avg       0.61      0.84      0.59      1733
weighted avg       0.93      0.70      0.77      1733

Confusion Matrix:
 [[ 149    0]
 [ 513 1071]]

=== Fold 2/5 ===
Validation Accuracy: 0.6746
Classification Report:
               precision    recall  f1-score   support

Non-Repeater       0.21      0.99      0.35       150
    Repeater       1.00      0.64      0.78      1583

    accuracy                           0.67      1733
   macro avg       0.60      0.82      0.56      1733
weighted avg       0.93      0.67      0.75      1733

Confusion Matrix:
 [[ 149    1]
 [ 563 1020]]

=== Fold 3/5 ===
Validation Accuracy: 0.6849
Classification Report:
               precision    recall  f1-score   support

Non-Repeater       0.21      0.99      0.35       150
    Repeater       1.00      0.66      0.79      1583

    accuracy                           0.68      1733
   macro avg       0.61      0.82      0.57      1733
weighted avg       0.93      0.68      0.75      1733

Confusion Matrix:
 [[ 149    1]
 [ 545 1038]]

=== Fold 4/5 ===
Validation Accuracy: 0.6549
Classification Report:
               precision    recall  f1-score   support

Non-Repeater       0.20      0.98      0.33       150
    Repeater       1.00      0.62      0.77      1583

    accuracy                           0.65      1733
   macro avg       0.60      0.80      0.55      1733
weighted avg       0.93      0.65      0.73      1733

Confusion Matrix:
 [[147   3]
 [595 988]]

=== Fold 5/5 ===
Validation Accuracy: 0.7552
Classification Report:
               precision    recall  f1-score   support

Non-Repeater       0.26      0.98      0.41       149
    Repeater       1.00      0.73      0.85      1583

    accuracy                           0.76      1732
   macro avg       0.63      0.86      0.63      1732
weighted avg       0.93      0.76      0.81      1732

Confusion Matrix:
 [[ 146    3]
 [ 421 1162]]


=== Summary ===
Total False Positives: 8
Total False Negatives: 2637
Total True Positives: 5279
Total True Negatives: 740

Confusion Matrix (with duplicates):
              Non-Repeater  Repeater
Non-Repeater         740.0       8.0
Repeater            2637.0    5279.0
accuracy_score
0.694713758079409
Trial 1: hidden_dim=1031, latent_dim=36, beta=0.8878188436410402, gamma=0.26576343204109376, dropout_rate=0.1914120814032496, lr=0.0005850705893245728, scheduler_patience=7, class_weight=2.1646641883452835, activation=ReLU, classification_multiplier=10941.89375868141

=== Fold 1/5 ===
Validation Accuracy: 0.5257
Classification Report:
               precision    recall  f1-score   support

Non-Repeater       0.15      0.99      0.26       149
    Repeater       1.00      0.48      0.65      1584

    accuracy                           0.53      1733
   macro avg       0.58      0.74      0.46      1733
weighted avg       0.93      0.53      0.62      1733

Confusion Matrix:
 [[148   1]
 [821 763]]

=== Fold 2/5 ===
Validation Accuracy: 0.2660
Classification Report:
               precision    recall  f1-score   support

Non-Repeater       0.11      1.00      0.19       150
    Repeater       1.00      0.20      0.33      1583

    accuracy                           0.27      1733
   macro avg       0.55      0.60      0.26      1733
weighted avg       0.92      0.27      0.32      1733

Confusion Matrix:
 [[ 150    0]
 [1272  311]]

=== Fold 3/5 ===
Validation Accuracy: 0.2839
Classification Report:
               precision    recall  f1-score   support

Non-Repeater       0.11      1.00      0.19       150
    Repeater       1.00      0.22      0.36      1583

    accuracy                           0.28      1733
   macro avg       0.55      0.61      0.28      1733
weighted avg       0.92      0.28      0.34      1733

Confusion Matrix:
 [[ 150    0]
 [1241  342]]

=== Fold 4/5 ===
Validation Accuracy: 0.0866
Classification Report:
 [I 2025-06-12 16:34:10,906] Trial 129 finished with value: 0.3015927977839335 and parameters: {'hidden_dim': 856, 'latent_dim': 35, 'beta': 0.6962437335161205, 'gamma': 0.22571885465290306, 'dropout_rate': 0.4217437857092173, 'lr': 0.006102284655342795, 'scheduler_patience': 7, 'class_weight': 2.052038039435372, 'activation': 'ReLU', 'classification_multiplier': 10318.194933611167}. Best is trial 72 with value: 0.7479224376731302.
[I 2025-06-12 16:39:51,994] Trial 130 finished with value: 0.6049168975069252 and parameters: {'hidden_dim': 921, 'latent_dim': 36, 'beta': 0.960301915331948, 'gamma': 1.2928282482562379, 'dropout_rate': 0.18562868986514702, 'lr': 0.0008358523139163911, 'scheduler_patience': 7, 'class_weight': 1.979609887416557, 'activation': 'GELU', 'classification_multiplier': 10490.129407759856}. Best is trial 72 with value: 0.7479224376731302.
[I 2025-06-12 16:45:52,575] Trial 131 finished with value: 0.7153739612188366 and parameters: {'hidden_dim': 1127, 'latent_dim': 39, 'beta': 1.081819302480202, 'gamma': 0.3283572550025639, 'dropout_rate': 0.2436594323821184, 'lr': 0.0004783571404239224, 'scheduler_patience': 7, 'class_weight': 2.100383180792425, 'activation': 'ReLU', 'classification_multiplier': 10725.397066349906}. Best is trial 72 with value: 0.7479224376731302.
              precision    recall  f1-score   support

Non-Repeater       0.09      1.00      0.16       150
    Repeater       0.00      0.00      0.00      1583

    accuracy                           0.09      1733
   macro avg       0.04      0.50      0.08      1733
weighted avg       0.01      0.09      0.01      1733

Confusion Matrix:
 [[ 150    0]
 [1583    0]]

=== Fold 5/5 ===
Validation Accuracy: 0.3458
Classification Report:
               precision    recall  f1-score   support

Non-Repeater       0.12      1.00      0.21       149
    Repeater       1.00      0.28      0.44      1583

    accuracy                           0.35      1732
   macro avg       0.56      0.64      0.33      1732
weighted avg       0.92      0.35      0.42      1732

Confusion Matrix:
 [[ 149    0]
 [1133  450]]


=== Summary ===
Total False Positives: 1
Total False Negatives: 6050
Total True Positives: 1866
Total True Negatives: 747

Confusion Matrix (with duplicates):
              Non-Repeater  Repeater
Non-Repeater         747.0       1.0
Repeater            6050.0    1866.0
accuracy_score
0.3015927977839335
Trial 1: hidden_dim=856, latent_dim=35, beta=0.6962437335161205, gamma=0.22571885465290306, dropout_rate=0.4217437857092173, lr=0.006102284655342795, scheduler_patience=7, class_weight=2.052038039435372, activation=ReLU, classification_multiplier=10318.194933611167

=== Fold 1/5 ===
Validation Accuracy: 0.5828
Classification Report:
               precision    recall  f1-score   support

Non-Repeater       0.17      1.00      0.29       149
    Repeater       1.00      0.54      0.70      1584

    accuracy                           0.58      1733
   macro avg       0.59      0.77      0.50      1733
weighted avg       0.93      0.58      0.67      1733

Confusion Matrix:
 [[149   0]
 [723 861]]

=== Fold 2/5 ===
Validation Accuracy: 0.6036
Classification Report:
               precision    recall  f1-score   support

Non-Repeater       0.18      0.99      0.30       150
    Repeater       1.00      0.57      0.72      1583

    accuracy                           0.60      1733
   macro avg       0.59      0.78      0.51      1733
weighted avg       0.93      0.60      0.69      1733

Confusion Matrix:
 [[149   1]
 [686 897]]

=== Fold 3/5 ===
Validation Accuracy: 0.6405
Classification Report:
               precision    recall  f1-score   support

Non-Repeater       0.19      0.99      0.32       150
    Repeater       1.00      0.61      0.76      1583

    accuracy                           0.64      1733
   macro avg       0.60      0.80      0.54      1733
weighted avg       0.93      0.64      0.72      1733

Confusion Matrix:
 [[148   2]
 [621 962]]

=== Fold 4/5 ===
Validation Accuracy: 0.5915
Classification Report:
               precision    recall  f1-score   support

Non-Repeater       0.17      0.99      0.29       150
    Repeater       1.00      0.55      0.71      1583

    accuracy                           0.59      1733
   macro avg       0.59      0.77      0.50      1733
weighted avg       0.93      0.59      0.68      1733

Confusion Matrix:
 [[148   2]
 [706 877]]

=== Fold 5/5 ===
Validation Accuracy: 0.6062
Classification Report:
               precision    recall  f1-score   support

Non-Repeater       0.18      0.99      0.30       149
    Repeater       1.00      0.57      0.73      1583

    accuracy                           0.61      1732
   macro avg       0.59      0.78      0.51      1732
weighted avg       0.93      0.61      0.69      1732

Confusion Matrix:
 [[147   2]
 [680 903]]


=== Summary ===
Total False Positives: 7
Total False Negatives: 3416
Total True Positives: 4500
Total True Negatives: 741

Confusion Matrix (with duplicates):
              Non-Repeater  Repeater
Non-Repeater         741.0       7.0
Repeater            3416.0    4500.0
accuracy_score
0.6049168975069252
Trial 1: hidden_dim=921, latent_dim=36, beta=0.960301915331948, gamma=1.2928282482562379, dropout_rate=0.18562868986514702, lr=0.0008358523139163911, scheduler_patience=7, class_weight=1.979609887416557, activation=GELU, classification_multiplier=10490.129407759856

=== Fold 1/5 ===
Validation Accuracy: 0.7046
Classification Report:
               precision    recall  f1-score   support

Non-Repeater       0.22      0.99      0.37       149
    Repeater       1.00      0.68      0.81      1584

    accuracy                           0.70      1733
   macro avg       0.61      0.84      0.59      1733
weighted avg       0.93      0.70      0.77      1733

Confusion Matrix:
 [[ 148    1]
 [ 511 1073]]

=== Fold 2/5 ===
Validation Accuracy: 0.7374
Classification Report:
               precision    recall  f1-score   support

Non-Repeater       0.25      0.99      0.40       150
    Repeater       1.00      0.71      0.83      1583

    accuracy                           0.74      1733
   macro avg       0.62      0.85      0.61      1733
weighted avg       0.93      0.74      0.79      1733

Confusion Matrix:
 [[ 149    1]
 [ 454 1129]]

=== Fold 3/5 ===
Validation Accuracy: 0.7282
Classification Report:
               precision    recall  f1-score   support

Non-Repeater       0.24      0.99      0.39       150
    Repeater       1.00      0.70      0.83      1583

    accuracy                           0.73      1733
   macro avg       0.62      0.85      0.61      1733
weighted avg       0.93      0.73      0.79      1733

Confusion Matrix:
 [[ 149    1]
 [ 470 1113]]

=== Fold 4/5 ===
Validation Accuracy: 0.6728
Classification Report:
               precision    recall  f1-score   support

Non-Repeater       0.21      0.98      0.34       150
    Repeater       1.00      0.64      0.78      1583

    accuracy                           0.67      1733
   macro avg       0.60      0.81      0.56      1733
weighted avg       0.93      0.67      0.74      1733

Confusion Matrix:
 [[ 147    3]
 [ 564 1019]]

=== Fold 5/5 ===
Validation Accuracy: 0.7338
Classification Report:
               precision    recall  f1-score   support

Non-Repeater       0.24      0.97      0.39       149
    Repeater       1.00      0.71      0.83      1583

    accuracy                           0.73      1732
   macro avg       0.62      0.84      0.61      1732
weighted avg       0.93      0.73      0.79      1732

Confusion Matrix:
 [[ 145    4]
 [ 457 1126]]


=== Summary ===
Total False Positives: 10
Total False Negatives: 2456
Total True Positives: 5460
Total True Negatives: 738

Confusion Matrix (with duplicates):
              Non-Repeater  Repeater
Non-Repeater         738.0      10.0
Repeater            2456.0    5460.0
accuracy_score
0.7153739612188366
Trial 1: hidden_dim=1127, latent_dim=39, beta=1.081819302480202, gamma=0.3283572550025639, dropout_rate=0.2436594323821184, lr=0.0004783571404239224, scheduler_patience=7, class_weight=2.100383180792425, activation=ReLU, classification_multiplier=10725.397066349906

=== Fold 1/5 ===
Validation Accuracy: 0.7005
Classification Report:
               precision    recall  f1-score   support

Non-Repeater       0.22      0.99      0.36       149
    Repeater       1.00      0.67      0.80      1584

    accuracy                           0.70      1733
   macro avg       0.61      0.83      0.58      1733
weighted avg       0.93      0.70      0.77      1733

Confusion Matrix:
 [[ 148    1]
 [ 518 1066]]

=== Fold 2/5 ===
Validation Accuracy: 0.6746
Classification Report:
               precision    recall  f1-score   support

Non-Repeater       0.21      0.99      0.35       150
    Repeater       1.00      0.64      0.78      1583

    accuracy                           0.67      1733
   macro avg       0.60      0.82      0.56      1733
weighted avg       0.93      0.67      0.75      1733

Confusion Matrix:
 [[ 149    1]
 [ 563 1020]]

=== Fold 3/5 ===
Validation Accuracy: 0.6434
Classification Report:
 [I 2025-06-12 16:51:58,455] Trial 132 finished with value: 0.6918282548476454 and parameters: {'hidden_dim': 1198, 'latent_dim': 37, 'beta': 1.0240887671248768, 'gamma': 0.35535810520772193, 'dropout_rate': 0.24586141432275976, 'lr': 0.0004332468134883199, 'scheduler_patience': 7, 'class_weight': 2.2729372398323564, 'activation': 'ReLU', 'classification_multiplier': 10683.405888721623}. Best is trial 72 with value: 0.7479224376731302.
[I 2025-06-12 16:57:59,125] Trial 133 finished with value: 0.6910203139427517 and parameters: {'hidden_dim': 1113, 'latent_dim': 38, 'beta': 1.061463357622354, 'gamma': 0.32753226527859397, 'dropout_rate': 0.21963617688379516, 'lr': 0.0005463536068554023, 'scheduler_patience': 7, 'class_weight': 2.136422371331808, 'activation': 'ReLU', 'classification_multiplier': 12135.658765850825}. Best is trial 72 with value: 0.7479224376731302.
