[I 2025-06-12 05:34:51,801] Trial 19 finished with value: 0.6824792243767313 and parameters: {'hidden_dim': 1102, 'latent_dim': 29, 'beta': 1.2634176804764068, 'gamma': 0.8537463600697488, 'dropout_rate': 0.17853691701908436, 'lr': 0.00024333234965062727, 'scheduler_patience': 7, 'class_weight': 1.5289690154583548, 'activation': 'ReLU', 'classification_multiplier': 7802.663610947382}. Best is trial 19 with value: 0.6824792243767313.
              precision    recall  f1-score   support

Non-Repeater       0.19      0.99      0.32       150
    Repeater       1.00      0.61      0.75      1583

    accuracy                           0.64      1733
   macro avg       0.60      0.80      0.54      1733
weighted avg       0.93      0.64      0.72      1733

Confusion Matrix:
 [[149   1]
 [624 959]]

=== Fold 4/5 ===
Validation Accuracy: 0.5868
Classification Report:
               precision    recall  f1-score   support

Non-Repeater       0.17      1.00      0.30       150
    Repeater       1.00      0.55      0.71      1583

    accuracy                           0.59      1733
   macro avg       0.59      0.77      0.50      1733
weighted avg       0.93      0.59      0.67      1733

Confusion Matrix:
 [[150   0]
 [716 867]]

=== Fold 5/5 ===
Validation Accuracy: 0.5196
Classification Report:
               precision    recall  f1-score   support

Non-Repeater       0.15      0.99      0.26       149
    Repeater       1.00      0.48      0.64      1583

    accuracy                           0.52      1732
   macro avg       0.57      0.73      0.45      1732
weighted avg       0.93      0.52      0.61      1732

Confusion Matrix:
 [[148   1]
 [831 752]]


=== Summary ===
Total False Positives: 3
Total False Negatives: 4062
Total True Positives: 3854
Total True Negatives: 745

Confusion Matrix (with duplicates):
              Non-Repeater  Repeater
Non-Repeater         745.0       3.0
Repeater            4062.0    3854.0
accuracy_score
0.5308171745152355
Trial 1: hidden_dim=972, latent_dim=32, beta=1.9345640969102658, gamma=1.1921970135066653, dropout_rate=0.2401425237370916, lr=0.0017702597554071046, scheduler_patience=5, class_weight=2.633809865427379, activation=LeakyReLU, classification_multiplier=10465.02401693986

=== Fold 1/5 ===
Validation Accuracy: 0.4841
Classification Report:
               precision    recall  f1-score   support

Non-Repeater       0.14      0.99      0.25       149
    Repeater       1.00      0.44      0.61      1584

    accuracy                           0.48      1733
   macro avg       0.57      0.71      0.43      1733
weighted avg       0.92      0.48      0.58      1733

Confusion Matrix:
 [[148   1]
 [893 691]]

=== Fold 2/5 ===
Validation Accuracy: 0.2493
Classification Report:
               precision    recall  f1-score   support

Non-Repeater       0.10      1.00      0.19       150
    Repeater       1.00      0.18      0.30      1583

    accuracy                           0.25      1733
   macro avg       0.55      0.59      0.24      1733
weighted avg       0.92      0.25      0.29      1733

Confusion Matrix:
 [[ 150    0]
 [1301  282]]

=== Fold 3/5 ===
Validation Accuracy: 0.2672
Classification Report:
               precision    recall  f1-score   support

Non-Repeater       0.11      1.00      0.19       150
    Repeater       1.00      0.20      0.33      1583

    accuracy                           0.27      1733
   macro avg       0.55      0.60      0.26      1733
weighted avg       0.92      0.27      0.32      1733

Confusion Matrix:
 [[ 150    0]
 [1270  313]]

=== Fold 4/5 ===
Validation Accuracy: 0.0866
Classification Report:
               precision    recall  f1-score   support

Non-Repeater       0.09      1.00      0.16       150
    Repeater       0.00      0.00      0.00      1583

    accuracy                           0.09      1733
   macro avg       0.04      0.50      0.08      1733
weighted avg       0.01      0.09      0.01      1733

Confusion Matrix:
 [[ 150    0]
 [1583    0]]

=== Fold 5/5 ===
Validation Accuracy: 0.2304
Classification Report:
               precision    recall  f1-score   support

Non-Repeater       0.10      1.00      0.18       149
    Repeater       1.00      0.16      0.27      1583

    accuracy                           0.23      1732
   macro avg       0.55      0.58      0.23      1732
weighted avg       0.92      0.23      0.27      1732

Confusion Matrix:
 [[ 149    0]
 [1333  250]]


=== Summary ===
Total False Positives: 1
Total False Negatives: 6380
Total True Positives: 1536
Total True Negatives: 747

Confusion Matrix (with duplicates):
              Non-Repeater  Repeater
Non-Repeater         747.0       1.0
Repeater            6380.0    1536.0
accuracy_score
0.26350415512465375
Trial 1: hidden_dim=1499, latent_dim=22, beta=1.5707234533920302, gamma=1.4551293339931974, dropout_rate=0.3019077152295214, lr=0.004376780782353772, scheduler_patience=5, class_weight=1.98941167486388, activation=ReLU, classification_multiplier=12629.263908060379

=== Fold 1/5 ===
Validation Accuracy: 0.6717
Classification Report:
               precision    recall  f1-score   support

Non-Repeater       0.21      0.99      0.34       149
    Repeater       1.00      0.64      0.78      1584

    accuracy                           0.67      1733
   macro avg       0.60      0.82      0.56      1733
weighted avg       0.93      0.67      0.74      1733

Confusion Matrix:
 [[ 148    1]
 [ 568 1016]]

=== Fold 2/5 ===
Validation Accuracy: 0.6901
Classification Report:
               precision    recall  f1-score   support

Non-Repeater       0.22      0.99      0.36       150
    Repeater       1.00      0.66      0.80      1583

    accuracy                           0.69      1733
   macro avg       0.61      0.83      0.58      1733
weighted avg       0.93      0.69      0.76      1733

Confusion Matrix:
 [[ 149    1]
 [ 536 1047]]

=== Fold 3/5 ===
Validation Accuracy: 0.6561
Classification Report:
               precision    recall  f1-score   support

Non-Repeater       0.20      0.99      0.33       150
    Repeater       1.00      0.62      0.77      1583

    accuracy                           0.66      1733
   macro avg       0.60      0.81      0.55      1733
weighted avg       0.93      0.66      0.73      1733

Confusion Matrix:
 [[149   1]
 [595 988]]

=== Fold 4/5 ===
Validation Accuracy: 0.6607
Classification Report:
               precision    recall  f1-score   support

Non-Repeater       0.20      0.99      0.34       150
    Repeater       1.00      0.63      0.77      1583

    accuracy                           0.66      1733
   macro avg       0.60      0.81      0.55      1733
weighted avg       0.93      0.66      0.73      1733

Confusion Matrix:
 [[149   1]
 [587 996]]

=== Fold 5/5 ===
Validation Accuracy: 0.7338
Classification Report:
               precision    recall  f1-score   support

Non-Repeater       0.24      0.98      0.39       149
    Repeater       1.00      0.71      0.83      1583

    accuracy                           0.73      1732
   macro avg       0.62      0.85      0.61      1732
weighted avg       0.93      0.73      0.79      1732

Confusion Matrix:
 [[ 146    3]
 [ 458 1125]]


=== Summary ===
Total False Positives: 7
Total False Negatives: 2744
Total True Positives: 5172
Total True Negatives: 741

Confusion Matrix (with duplicates):
              Non-Repeater  Repeater
Non-Repeater         741.0       7.0
Repeater            2744.0    5172.0
accuracy_score
0.6824792243767313
Trial 1: hidden_dim=1102, latent_dim=29, beta=1.2634176804764068, gamma=0.8537463600697488, dropout_rate=0.17853691701908436, lr=0.00024333234965062727, scheduler_patience=7, class_weight=1.5289690154583548, activation=ReLU, classification_multiplier=7802.663610947382

=== Fold 1/5 ===
Validation Accuracy: 0.6959
Classification Report:
               precision    recall  f1-score   support

Non-Repeater       0.22      1.00      0.36       149
    Repeater       1.00      0.67      0.80      1584

    accuracy                           0.70      1733
   macro avg       0.61      0.83      0.58      1733
weighted avg       0.93      0.70      0.76      1733

Confusion Matrix:
 [[ 149    0]
 [ 527 1057]]

=== Fold 2/5 ===
Validation Accuracy: 0.6538
Classification Report:
 [I 2025-06-12 05:40:28,663] Trial 20 finished with value: 0.6913665743305633 and parameters: {'hidden_dim': 786, 'latent_dim': 22, 'beta': 1.2587939732859783, 'gamma': 0.6124748769122608, 'dropout_rate': 0.1712492736605557, 'lr': 0.0006142024643387791, 'scheduler_patience': 5, 'class_weight': 1.5292298762019694, 'activation': 'ReLU', 'classification_multiplier': 7878.789818490984}. Best is trial 20 with value: 0.6913665743305633.
[I 2025-06-12 05:46:03,335] Trial 21 finished with value: 0.5994921514312096 and parameters: {'hidden_dim': 724, 'latent_dim': 23, 'beta': 1.260105404036243, 'gamma': 0.6324119666004231, 'dropout_rate': 0.17253655200337512, 'lr': 0.000139601974281448, 'scheduler_patience': 5, 'class_weight': 1.4855852500485236, 'activation': 'ReLU', 'classification_multiplier': 7509.021930406641}. Best is trial 20 with value: 0.6913665743305633.
[I 2025-06-12 05:52:02,609] Trial 22 finished with value: 0.7070637119113573 and parameters: {'hidden_dim': 1121, 'latent_dim': 28, 'beta': 1.178215070203787, 'gamma': 0.5312313915074114, 'dropout_rate': 0.14280540414621717, 'lr': 0.0009099719724779192, 'scheduler_patience': 6, 'class_weight': 1.6349501382694371, 'activation': 'ReLU', 'classification_multiplier': 7194.004304934275}. Best is trial 22 with value: 0.7070637119113573.
              precision    recall  f1-score   support

Non-Repeater       0.20      0.99      0.33       150
    Repeater       1.00      0.62      0.77      1583

    accuracy                           0.65      1733
   macro avg       0.60      0.81      0.55      1733
weighted avg       0.93      0.65      0.73      1733

Confusion Matrix:
 [[149   1]
 [599 984]]

=== Fold 3/5 ===
Validation Accuracy: 0.6567
Classification Report:
               precision    recall  f1-score   support

Non-Repeater       0.20      0.99      0.33       150
    Repeater       1.00      0.63      0.77      1583

    accuracy                           0.66      1733
   macro avg       0.60      0.81      0.55      1733
weighted avg       0.93      0.66      0.73      1733

Confusion Matrix:
 [[148   2]
 [593 990]]

=== Fold 4/5 ===
Validation Accuracy: 0.6636
Classification Report:
               precision    recall  f1-score   support

Non-Repeater       0.20      0.99      0.34       150
    Repeater       1.00      0.63      0.77      1583

    accuracy                           0.66      1733
   macro avg       0.60      0.81      0.56      1733
weighted avg       0.93      0.66      0.74      1733

Confusion Matrix:
 [[ 148    2]
 [ 581 1002]]

=== Fold 5/5 ===
Validation Accuracy: 0.7870
Classification Report:
               precision    recall  f1-score   support

Non-Repeater       0.29      0.99      0.45       149
    Repeater       1.00      0.77      0.87      1583

    accuracy                           0.79      1732
   macro avg       0.64      0.88      0.66      1732
weighted avg       0.94      0.79      0.83      1732

Confusion Matrix:
 [[ 148    1]
 [ 368 1215]]


=== Summary ===
Total False Positives: 6
Total False Negatives: 2668
Total True Positives: 5248
Total True Negatives: 742

Confusion Matrix (with duplicates):
              Non-Repeater  Repeater
Non-Repeater         742.0       6.0
Repeater            2668.0    5248.0
accuracy_score
0.6913665743305633
Trial 1: hidden_dim=786, latent_dim=22, beta=1.2587939732859783, gamma=0.6124748769122608, dropout_rate=0.1712492736605557, lr=0.0006142024643387791, scheduler_patience=5, class_weight=1.5292298762019694, activation=ReLU, classification_multiplier=7878.789818490984

=== Fold 1/5 ===
Validation Accuracy: 0.6722
Classification Report:
               precision    recall  f1-score   support

Non-Repeater       0.21      1.00      0.34       149
    Repeater       1.00      0.64      0.78      1584

    accuracy                           0.67      1733
   macro avg       0.60      0.82      0.56      1733
weighted avg       0.93      0.67      0.74      1733

Confusion Matrix:
 [[ 149    0]
 [ 568 1016]]

=== Fold 2/5 ===
Validation Accuracy: 0.4432
Classification Report:
               precision    recall  f1-score   support

Non-Repeater       0.13      1.00      0.24       150
    Repeater       1.00      0.39      0.56      1583

    accuracy                           0.44      1733
   macro avg       0.57      0.70      0.40      1733
weighted avg       0.93      0.44      0.53      1733

Confusion Matrix:
 [[150   0]
 [965 618]]

=== Fold 3/5 ===
Validation Accuracy: 0.6203
Classification Report:
               precision    recall  f1-score   support

Non-Repeater       0.18      0.99      0.31       150
    Repeater       1.00      0.58      0.74      1583

    accuracy                           0.62      1733
   macro avg       0.59      0.79      0.52      1733
weighted avg       0.93      0.62      0.70      1733

Confusion Matrix:
 [[149   1]
 [657 926]]

=== Fold 4/5 ===
Validation Accuracy: 0.5661
Classification Report:
               precision    recall  f1-score   support

Non-Repeater       0.17      0.99      0.28       150
    Repeater       1.00      0.53      0.69      1583

    accuracy                           0.57      1733
   macro avg       0.58      0.76      0.49      1733
weighted avg       0.93      0.57      0.65      1733

Confusion Matrix:
 [[149   1]
 [751 832]]

=== Fold 5/5 ===
Validation Accuracy: 0.6957
Classification Report:
               precision    recall  f1-score   support

Non-Repeater       0.22      0.98      0.36       149
    Repeater       1.00      0.67      0.80      1583

    accuracy                           0.70      1732
   macro avg       0.61      0.82      0.58      1732
weighted avg       0.93      0.70      0.76      1732

Confusion Matrix:
 [[ 146    3]
 [ 524 1059]]


=== Summary ===
Total False Positives: 5
Total False Negatives: 3465
Total True Positives: 4451
Total True Negatives: 743

Confusion Matrix (with duplicates):
              Non-Repeater  Repeater
Non-Repeater         743.0       5.0
Repeater            3465.0    4451.0
accuracy_score
0.5994921514312096
Trial 1: hidden_dim=724, latent_dim=23, beta=1.260105404036243, gamma=0.6324119666004231, dropout_rate=0.17253655200337512, lr=0.000139601974281448, scheduler_patience=5, class_weight=1.4855852500485236, activation=ReLU, classification_multiplier=7509.021930406641

=== Fold 1/5 ===
Validation Accuracy: 0.6942
Classification Report:
               precision    recall  f1-score   support

Non-Repeater       0.22      0.98      0.36       149
    Repeater       1.00      0.67      0.80      1584

    accuracy                           0.69      1733
   macro avg       0.61      0.82      0.58      1733
weighted avg       0.93      0.69      0.76      1733

Confusion Matrix:
 [[ 146    3]
 [ 527 1057]]

=== Fold 2/5 ===
Validation Accuracy: 0.6445
Classification Report:
               precision    recall  f1-score   support

Non-Repeater       0.20      0.99      0.33       150
    Repeater       1.00      0.61      0.76      1583

    accuracy                           0.64      1733
   macro avg       0.60      0.80      0.54      1733
weighted avg       0.93      0.64      0.72      1733

Confusion Matrix:
 [[149   1]
 [615 968]]

=== Fold 3/5 ===
Validation Accuracy: 0.6688
Classification Report:
               precision    recall  f1-score   support

Non-Repeater       0.21      0.99      0.34       150
    Repeater       1.00      0.64      0.78      1583

    accuracy                           0.67      1733
   macro avg       0.60      0.81      0.56      1733
weighted avg       0.93      0.67      0.74      1733

Confusion Matrix:
 [[ 148    2]
 [ 572 1011]]

=== Fold 4/5 ===
Validation Accuracy: 0.6884
Classification Report:
               precision    recall  f1-score   support

Non-Repeater       0.22      0.99      0.35       150
    Repeater       1.00      0.66      0.79      1583

    accuracy                           0.69      1733
   macro avg       0.61      0.82      0.57      1733
weighted avg       0.93      0.69      0.76      1733

Confusion Matrix:
 [[ 148    2]
 [ 538 1045]]

=== Fold 5/5 ===
Validation Accuracy: 0.8395
Classification Report:
               precision    recall  f1-score   support

Non-Repeater       0.35      0.97      0.51       149
    Repeater       1.00      0.83      0.90      1583

    accuracy                           0.84      1732
   macro avg       0.67      0.90      0.71      1732
weighted avg       0.94      0.84      0.87      1732

Confusion Matrix:
 [[ 144    5]
 [ 273 1310]]


=== Summary ===
Total False Positives: 13
Total False Negatives: 2525
Total True Positives: 5391
Total True Negatives: 735

Confusion Matrix (with duplicates):
              Non-Repeater  Repeater
Non-Repeater         735.0      13.0
Repeater            2525.0    5391.0
accuracy_score
0.7070637119113573
Trial 1: hidden_dim=1121, latent_dim=28, beta=1.178215070203787, gamma=0.5312313915074114, dropout_rate=0.14280540414621717, lr=0.0009099719724779192, scheduler_patience=6, class_weight=1.6349501382694371, activation=ReLU, classification_multiplier=7194.004304934275

=== Fold 1/5 ===
Validation Accuracy: 0.6884
Classification Report:
 [I 2025-06-12 05:57:40,385] Trial 23 finished with value: 0.6573176361957526 and parameters: {'hidden_dim': 829, 'latent_dim': 22, 'beta': 1.1730832446986734, 'gamma': 0.5465320963138502, 'dropout_rate': 0.10285624659085604, 'lr': 0.0011706014551475298, 'scheduler_patience': 5, 'class_weight': 1.618047672534418, 'activation': 'ReLU', 'classification_multiplier': 7263.7186593502265}. Best is trial 22 with value: 0.7070637119113573.
