[I 2025-06-12 07:50:38,076] Trial 42 finished with value: 0.5457063711911357 and parameters: {'hidden_dim': 1181, 'latent_dim': 29, 'beta': 0.7437455235786891, 'gamma': 0.9005804262055624, 'dropout_rate': 0.15938764031363237, 'lr': 0.0013712080492525491, 'scheduler_patience': 7, 'class_weight': 1.7260185316901613, 'activation': 'GELU', 'classification_multiplier': 5422.409065220819}. Best is trial 22 with value: 0.7070637119113573.
              precision    recall  f1-score   support

Non-Repeater       0.12      1.00      0.21       150
    Repeater       1.00      0.27      0.43      1583

    accuracy                           0.34      1733
   macro avg       0.56      0.64      0.32      1733
weighted avg       0.92      0.34      0.41      1733

Confusion Matrix:
 [[ 150    0]
 [1150  433]]

=== Fold 4/5 ===
Validation Accuracy: 0.3122
Classification Report:
               precision    recall  f1-score   support

Non-Repeater       0.11      1.00      0.20       150
    Repeater       1.00      0.25      0.40      1583

    accuracy                           0.31      1733
   macro avg       0.56      0.62      0.30      1733
weighted avg       0.92      0.31      0.38      1733

Confusion Matrix:
 [[ 150    0]
 [1192  391]]

=== Fold 5/5 ===
Validation Accuracy: 0.2217
Classification Report:
               precision    recall  f1-score   support

Non-Repeater       0.10      1.00      0.18       149
    Repeater       1.00      0.15      0.26      1583

    accuracy                           0.22      1732
   macro avg       0.55      0.57      0.22      1732
weighted avg       0.92      0.22      0.25      1732

Confusion Matrix:
 [[ 149    0]
 [1348  235]]


=== Summary ===
Total False Positives: 0
Total False Negatives: 6145
Total True Positives: 1771
Total True Negatives: 748

Confusion Matrix (with duplicates):
              Non-Repeater  Repeater
Non-Repeater         748.0       0.0
Repeater            6145.0    1771.0
accuracy_score
0.29074330563250234
Trial 1: hidden_dim=873, latent_dim=15, beta=0.8672967731427044, gamma=0.9512140665996467, dropout_rate=0.15742681780969847, lr=0.002676934784266159, scheduler_patience=6, class_weight=0.5190671352035798, activation=ELU, classification_multiplier=6701.8153182106

=== Fold 1/5 ===
Validation Accuracy: 0.3641
Classification Report:
               precision    recall  f1-score   support

Non-Repeater       0.12      0.99      0.21       149
    Repeater       1.00      0.30      0.47      1584

    accuracy                           0.36      1733
   macro avg       0.56      0.65      0.34      1733
weighted avg       0.92      0.36      0.45      1733

Confusion Matrix:
 [[ 148    1]
 [1101  483]]

=== Fold 2/5 ===
Validation Accuracy: 0.4974
Classification Report:
               precision    recall  f1-score   support

Non-Repeater       0.15      0.99      0.25       150
    Repeater       1.00      0.45      0.62      1583

    accuracy                           0.50      1733
   macro avg       0.57      0.72      0.44      1733
weighted avg       0.92      0.50      0.59      1733

Confusion Matrix:
 [[149   1]
 [870 713]]

=== Fold 3/5 ===
Validation Accuracy: 0.7190
Classification Report:
               precision    recall  f1-score   support

Non-Repeater       0.23      0.99      0.38       150
    Repeater       1.00      0.69      0.82      1583

    accuracy                           0.72      1733
   macro avg       0.62      0.84      0.60      1733
weighted avg       0.93      0.72      0.78      1733

Confusion Matrix:
 [[ 149    1]
 [ 486 1097]]

=== Fold 4/5 ===
Validation Accuracy: 0.6792
Classification Report:
               precision    recall  f1-score   support

Non-Repeater       0.21      0.99      0.35       150
    Repeater       1.00      0.65      0.79      1583

    accuracy                           0.68      1733
   macro avg       0.61      0.82      0.57      1733
weighted avg       0.93      0.68      0.75      1733

Confusion Matrix:
 [[ 149    1]
 [ 555 1028]]

=== Fold 5/5 ===
Validation Accuracy: 0.5947
Classification Report:
               precision    recall  f1-score   support

Non-Repeater       0.17      0.99      0.30       149
    Repeater       1.00      0.56      0.72      1583

    accuracy                           0.59      1732
   macro avg       0.59      0.77      0.51      1732
weighted avg       0.93      0.59      0.68      1732

Confusion Matrix:
 [[147   2]
 [700 883]]


=== Summary ===
Total False Positives: 6
Total False Negatives: 3712
Total True Positives: 4204
Total True Negatives: 742

Confusion Matrix (with duplicates):
              Non-Repeater  Repeater
Non-Repeater         742.0       6.0
Repeater            3712.0    4204.0
accuracy_score
0.5708679593721145
Trial 1: hidden_dim=1088, latent_dim=26, beta=1.237654055400459, gamma=0.5669325045739697, dropout_rate=0.11929170826692817, lr=0.0007087722931391801, scheduler_patience=7, class_weight=1.603750854327173, activation=LeakyReLU, classification_multiplier=7791.412588772779

=== Fold 1/5 ===
Validation Accuracy: 0.6220
Classification Report:
               precision    recall  f1-score   support

Non-Repeater       0.18      0.99      0.31       149
    Repeater       1.00      0.59      0.74      1584

    accuracy                           0.62      1733
   macro avg       0.59      0.79      0.52      1733
weighted avg       0.93      0.62      0.70      1733

Confusion Matrix:
 [[147   2]
 [653 931]]

=== Fold 2/5 ===
Validation Accuracy: 0.3970
Classification Report:
               precision    recall  f1-score   support

Non-Repeater       0.12      0.99      0.22       150
    Repeater       1.00      0.34      0.51      1583

    accuracy                           0.40      1733
   macro avg       0.56      0.67      0.36      1733
weighted avg       0.92      0.40      0.48      1733

Confusion Matrix:
 [[ 149    1]
 [1044  539]]

=== Fold 3/5 ===
Validation Accuracy: 0.6226
Classification Report:
               precision    recall  f1-score   support

Non-Repeater       0.19      0.99      0.31       150
    Repeater       1.00      0.59      0.74      1583

    accuracy                           0.62      1733
   macro avg       0.59      0.79      0.53      1733
weighted avg       0.93      0.62      0.70      1733

Confusion Matrix:
 [[149   1]
 [653 930]]

=== Fold 4/5 ===
Validation Accuracy: 0.5672
Classification Report:
               precision    recall  f1-score   support

Non-Repeater       0.17      0.99      0.28       150
    Repeater       1.00      0.53      0.69      1583

    accuracy                           0.57      1733
   macro avg       0.58      0.76      0.49      1733
weighted avg       0.93      0.57      0.65      1733

Confusion Matrix:
 [[149   1]
 [749 834]]

=== Fold 5/5 ===
Validation Accuracy: 0.5196
Classification Report:
               precision    recall  f1-score   support

Non-Repeater       0.15      1.00      0.26       149
    Repeater       1.00      0.47      0.64      1583

    accuracy                           0.52      1732
   macro avg       0.58      0.74      0.45      1732
weighted avg       0.93      0.52      0.61      1732

Confusion Matrix:
 [[149   0]
 [832 751]]


=== Summary ===
Total False Positives: 5
Total False Negatives: 3931
Total True Positives: 3985
Total True Negatives: 743

Confusion Matrix (with duplicates):
              Non-Repeater  Repeater
Non-Repeater         743.0       5.0
Repeater            3931.0    3985.0
accuracy_score
0.5457063711911357
Trial 1: hidden_dim=1181, latent_dim=29, beta=0.7437455235786891, gamma=0.9005804262055624, dropout_rate=0.15938764031363237, lr=0.0013712080492525491, scheduler_patience=7, class_weight=1.7260185316901613, activation=GELU, classification_multiplier=5422.409065220819

=== Fold 1/5 ===
Validation Accuracy: 0.4062
Classification Report:
               precision    recall  f1-score   support

Non-Repeater       0.13      0.99      0.22       149
    Repeater       1.00      0.35      0.52      1584

    accuracy                           0.41      1733
   macro avg       0.56      0.67      0.37      1733
weighted avg       0.92      0.41      0.49      1733

Confusion Matrix:
 [[ 147    2]
 [1027  557]]

=== Fold 2/5 ===
Validation Accuracy: 0.2095
Classification Report:
 [I 2025-06-12 07:57:01,642] Trial 43 finished with value: 0.2842797783933518 and parameters: {'hidden_dim': 1372, 'latent_dim': 39, 'beta': 0.9448898795235865, 'gamma': 0.7485374707961163, 'dropout_rate': 0.10083711539826701, 'lr': 0.001741022818569614, 'scheduler_patience': 7, 'class_weight': 1.1531116935491597, 'activation': 'ELU', 'classification_multiplier': 6015.298610952891}. Best is trial 22 with value: 0.7070637119113573.
[I 2025-06-12 08:02:33,061] Trial 44 finished with value: 0.5594413665743305 and parameters: {'hidden_dim': 559, 'latent_dim': 24, 'beta': 1.0722242708862981, 'gamma': 1.0643578849579214, 'dropout_rate': 0.3952540165538584, 'lr': 0.0005547667433825306, 'scheduler_patience': 7, 'class_weight': 1.3488516462283953, 'activation': 'ReLU', 'classification_multiplier': 6867.627865250943}. Best is trial 22 with value: 0.7070637119113573.
[I 2025-06-12 08:08:19,605] Trial 45 finished with value: 0.13469529085872575 and parameters: {'hidden_dim': 983, 'latent_dim': 27, 'beta': 0.33051964906201453, 'gamma': 1.2317985801972564, 'dropout_rate': 0.21898947318069661, 'lr': 0.0060664046626123045, 'scheduler_patience': 4, 'class_weight': 1.9057054433065608, 'activation': 'LeakyReLU', 'classification_multiplier': 9444.451825020511}. Best is trial 22 with value: 0.7070637119113573.
              precision    recall  f1-score   support

Non-Repeater       0.10      1.00      0.18       150
    Repeater       1.00      0.13      0.24      1583

    accuracy                           0.21      1733
   macro avg       0.55      0.57      0.21      1733
weighted avg       0.92      0.21      0.23      1733

Confusion Matrix:
 [[ 150    0]
 [1370  213]]

=== Fold 3/5 ===
Validation Accuracy: 0.3572
Classification Report:
               precision    recall  f1-score   support

Non-Repeater       0.12      1.00      0.21       150
    Repeater       1.00      0.30      0.46      1583

    accuracy                           0.36      1733
   macro avg       0.56      0.65      0.33      1733
weighted avg       0.92      0.36      0.44      1733

Confusion Matrix:
 [[ 150    0]
 [1114  469]]

=== Fold 4/5 ===
Validation Accuracy: 0.2343
Classification Report:
               precision    recall  f1-score   support

Non-Repeater       0.10      0.99      0.18       150
    Repeater       1.00      0.16      0.28      1583

    accuracy                           0.23      1733
   macro avg       0.55      0.58      0.23      1733
weighted avg       0.92      0.23      0.27      1733

Confusion Matrix:
 [[ 149    1]
 [1326  257]]

=== Fold 5/5 ===
Validation Accuracy: 0.2142
Classification Report:
               precision    recall  f1-score   support

Non-Repeater       0.10      1.00      0.18       149
    Repeater       1.00      0.14      0.25      1583

    accuracy                           0.21      1732
   macro avg       0.55      0.57      0.21      1732
weighted avg       0.92      0.21      0.24      1732

Confusion Matrix:
 [[ 149    0]
 [1361  222]]


=== Summary ===
Total False Positives: 3
Total False Negatives: 6198
Total True Positives: 1718
Total True Negatives: 745

Confusion Matrix (with duplicates):
              Non-Repeater  Repeater
Non-Repeater         745.0       3.0
Repeater            6198.0    1718.0
accuracy_score
0.2842797783933518
Trial 1: hidden_dim=1372, latent_dim=39, beta=0.9448898795235865, gamma=0.7485374707961163, dropout_rate=0.10083711539826701, lr=0.001741022818569614, scheduler_patience=7, class_weight=1.1531116935491597, activation=ELU, classification_multiplier=6015.298610952891

=== Fold 1/5 ===
Validation Accuracy: 0.5470
Classification Report:
               precision    recall  f1-score   support

Non-Repeater       0.16      1.00      0.28       149
    Repeater       1.00      0.50      0.67      1584

    accuracy                           0.55      1733
   macro avg       0.58      0.75      0.47      1733
weighted avg       0.93      0.55      0.64      1733

Confusion Matrix:
 [[149   0]
 [785 799]]

=== Fold 2/5 ===
Validation Accuracy: 0.5632
Classification Report:
               precision    recall  f1-score   support

Non-Repeater       0.16      0.99      0.28       150
    Repeater       1.00      0.52      0.69      1583

    accuracy                           0.56      1733
   macro avg       0.58      0.76      0.48      1733
weighted avg       0.93      0.56      0.65      1733

Confusion Matrix:
 [[149   1]
 [756 827]]

=== Fold 3/5 ===
Validation Accuracy: 0.5741
Classification Report:
               precision    recall  f1-score   support

Non-Repeater       0.17      0.99      0.29       150
    Repeater       1.00      0.53      0.70      1583

    accuracy                           0.57      1733
   macro avg       0.58      0.76      0.49      1733
weighted avg       0.93      0.57      0.66      1733

Confusion Matrix:
 [[149   1]
 [737 846]]

=== Fold 4/5 ===
Validation Accuracy: 0.4818
Classification Report:
               precision    recall  f1-score   support

Non-Repeater       0.14      0.99      0.25       150
    Repeater       1.00      0.43      0.60      1583

    accuracy                           0.48      1733
   macro avg       0.57      0.71      0.43      1733
weighted avg       0.92      0.48      0.57      1733

Confusion Matrix:
 [[149   1]
 [897 686]]

=== Fold 5/5 ===
Validation Accuracy: 0.6311
Classification Report:
               precision    recall  f1-score   support

Non-Repeater       0.19      0.99      0.32       149
    Repeater       1.00      0.60      0.75      1583

    accuracy                           0.63      1732
   macro avg       0.59      0.80      0.53      1732
weighted avg       0.93      0.63      0.71      1732

Confusion Matrix:
 [[148   1]
 [638 945]]


=== Summary ===
Total False Positives: 4
Total False Negatives: 3813
Total True Positives: 4103
Total True Negatives: 744

Confusion Matrix (with duplicates):
              Non-Repeater  Repeater
Non-Repeater         744.0       4.0
Repeater            3813.0    4103.0
accuracy_score
0.5594413665743305
Trial 1: hidden_dim=559, latent_dim=24, beta=1.0722242708862981, gamma=1.0643578849579214, dropout_rate=0.3952540165538584, lr=0.0005547667433825306, scheduler_patience=7, class_weight=1.3488516462283953, activation=ReLU, classification_multiplier=6867.627865250943

=== Fold 1/5 ===
Validation Accuracy: 0.1910
Classification Report:
               precision    recall  f1-score   support

Non-Repeater       0.10      0.99      0.17       149
    Repeater       0.99      0.12      0.21      1584

    accuracy                           0.19      1733
   macro avg       0.55      0.55      0.19      1733
weighted avg       0.92      0.19      0.20      1733

Confusion Matrix:
 [[ 148    1]
 [1401  183]]

=== Fold 2/5 ===
Validation Accuracy: 0.1039
Classification Report:
               precision    recall  f1-score   support

Non-Repeater       0.09      1.00      0.16       150
    Repeater       1.00      0.02      0.04      1583

    accuracy                           0.10      1733
   macro avg       0.54      0.51      0.10      1733
weighted avg       0.92      0.10      0.05      1733

Confusion Matrix:
 [[ 150    0]
 [1553   30]]

=== Fold 3/5 ===
Validation Accuracy: 0.1454
Classification Report:
               precision    recall  f1-score   support

Non-Repeater       0.09      1.00      0.17       150
    Repeater       1.00      0.06      0.12      1583

    accuracy                           0.15      1733
   macro avg       0.55      0.53      0.14      1733
weighted avg       0.92      0.15      0.13      1733

Confusion Matrix:
 [[ 150    0]
 [1481  102]]

=== Fold 4/5 ===
Validation Accuracy: 0.1281
Classification Report:
               precision    recall  f1-score   support

Non-Repeater       0.09      1.00      0.17       150
    Repeater       1.00      0.05      0.09      1583

    accuracy                           0.13      1733
   macro avg       0.55      0.52      0.13      1733
weighted avg       0.92      0.13      0.09      1733

Confusion Matrix:
 [[ 150    0]
 [1511   72]]

=== Fold 5/5 ===
Validation Accuracy: 0.1051
Classification Report:
               precision    recall  f1-score   support

Non-Repeater       0.09      1.00      0.16       149
    Repeater       1.00      0.02      0.04      1583

    accuracy                           0.11      1732
   macro avg       0.54      0.51      0.10      1732
weighted avg       0.92      0.11      0.05      1732

Confusion Matrix:
 [[ 149    0]
 [1550   33]]


=== Summary ===
Total False Positives: 1
Total False Negatives: 7496
Total True Positives: 420
Total True Negatives: 747

Confusion Matrix (with duplicates):
              Non-Repeater  Repeater
Non-Repeater         747.0       1.0
Repeater            7496.0     420.0
accuracy_score
0.13469529085872575
Trial 1: hidden_dim=983, latent_dim=27, beta=0.33051964906201453, gamma=1.2317985801972564, dropout_rate=0.21898947318069661, lr=0.0060664046626123045, scheduler_patience=4, class_weight=1.9057054433065608, activation=LeakyReLU, classification_multiplier=9444.451825020511

=== Fold 1/5 ===
Validation Accuracy: 0.5932
Classification Report:
 [I 2025-06-12 08:14:18,089] Trial 46 finished with value: 0.5406278855032317 and parameters: {'hidden_dim': 1149, 'latent_dim': 10, 'beta': 1.201328947471761, 'gamma': 0.7247849869183505, 'dropout_rate': 0.1339908707512696, 'lr': 0.00018038158019048818, 'scheduler_patience': 6, 'class_weight': 1.5448644391128896, 'activation': 'GELU', 'classification_multiplier': 8319.100914250865}. Best is trial 22 with value: 0.7070637119113573.
