[I 2025-06-12 06:04:09,520] Trial 24 finished with value: 0.5816020313942751 and parameters: {'hidden_dim': 1434, 'latent_dim': 35, 'beta': 0.8157463555615223, 'gamma': 0.833455368749376, 'dropout_rate': 0.15152351293583816, 'lr': 0.0009646754147050875, 'scheduler_patience': 6, 'class_weight': 1.287868112149432, 'activation': 'LeakyReLU', 'classification_multiplier': 7787.086820216526}. Best is trial 22 with value: 0.7070637119113573.
              precision    recall  f1-score   support

Non-Repeater       0.22      0.99      0.35       149
    Repeater       1.00      0.66      0.79      1584

    accuracy                           0.69      1733
   macro avg       0.61      0.83      0.57      1733
weighted avg       0.93      0.69      0.76      1733

Confusion Matrix:
 [[ 148    1]
 [ 539 1045]]

=== Fold 2/5 ===
Validation Accuracy: 0.5736
Classification Report:
               precision    recall  f1-score   support

Non-Repeater       0.17      0.99      0.29       150
    Repeater       1.00      0.53      0.70      1583

    accuracy                           0.57      1733
   macro avg       0.58      0.76      0.49      1733
weighted avg       0.93      0.57      0.66      1733

Confusion Matrix:
 [[149   1]
 [738 845]]

=== Fold 3/5 ===
Validation Accuracy: 0.6665
Classification Report:
               precision    recall  f1-score   support

Non-Repeater       0.20      0.99      0.34       150
    Repeater       1.00      0.64      0.78      1583

    accuracy                           0.67      1733
   macro avg       0.60      0.81      0.56      1733
weighted avg       0.93      0.67      0.74      1733

Confusion Matrix:
 [[ 148    2]
 [ 576 1007]]

=== Fold 4/5 ===
Validation Accuracy: 0.6145
Classification Report:
               precision    recall  f1-score   support

Non-Repeater       0.18      0.98      0.31       150
    Repeater       1.00      0.58      0.73      1583

    accuracy                           0.61      1733
   macro avg       0.59      0.78      0.52      1733
weighted avg       0.93      0.61      0.70      1733

Confusion Matrix:
 [[147   3]
 [665 918]]

=== Fold 5/5 ===
Validation Accuracy: 0.7436
Classification Report:
               precision    recall  f1-score   support

Non-Repeater       0.25      0.99      0.40       149
    Repeater       1.00      0.72      0.84      1583

    accuracy                           0.74      1732
   macro avg       0.62      0.85      0.62      1732
weighted avg       0.93      0.74      0.80      1732

Confusion Matrix:
 [[ 147    2]
 [ 442 1141]]


=== Summary ===
Total False Positives: 9
Total False Negatives: 2960
Total True Positives: 4956
Total True Negatives: 739

Confusion Matrix (with duplicates):
              Non-Repeater  Repeater
Non-Repeater         739.0       9.0
Repeater            2960.0    4956.0
accuracy_score
0.6573176361957526
Trial 1: hidden_dim=829, latent_dim=22, beta=1.1730832446986734, gamma=0.5465320963138502, dropout_rate=0.10285624659085604, lr=0.0011706014551475298, scheduler_patience=5, class_weight=1.618047672534418, activation=ReLU, classification_multiplier=7263.7186593502265

=== Fold 1/5 ===
Validation Accuracy: 0.6676
Classification Report:
               precision    recall  f1-score   support

Non-Repeater       0.20      0.99      0.34       149
    Repeater       1.00      0.64      0.78      1584

    accuracy                           0.67      1733
   macro avg       0.60      0.82      0.56      1733
weighted avg       0.93      0.67      0.74      1733

Confusion Matrix:
 [[ 148    1]
 [ 575 1009]]

=== Fold 2/5 ===
Validation Accuracy: 0.5995
Classification Report:
               precision    recall  f1-score   support

Non-Repeater       0.18      0.99      0.30       150
    Repeater       1.00      0.56      0.72      1583

    accuracy                           0.60      1733
   macro avg       0.59      0.78      0.51      1733
weighted avg       0.93      0.60      0.68      1733

Confusion Matrix:
 [[149   1]
 [693 890]]

=== Fold 3/5 ===
Validation Accuracy: 0.5516
Classification Report:
               precision    recall  f1-score   support

Non-Repeater       0.16      0.99      0.28       150
    Repeater       1.00      0.51      0.68      1583

    accuracy                           0.55      1733
   macro avg       0.58      0.75      0.48      1733
weighted avg       0.93      0.55      0.64      1733

Confusion Matrix:
 [[148   2]
 [775 808]]

=== Fold 4/5 ===
Validation Accuracy: 0.3589
Classification Report:
               precision    recall  f1-score   support

Non-Repeater       0.12      1.00      0.21       150
    Repeater       1.00      0.30      0.46      1583

    accuracy                           0.36      1733
   macro avg       0.56      0.65      0.34      1733
weighted avg       0.92      0.36      0.44      1733

Confusion Matrix:
 [[ 150    0]
 [1111  472]]

=== Fold 5/5 ===
Validation Accuracy: 0.7304
Classification Report:
               precision    recall  f1-score   support

Non-Repeater       0.24      0.99      0.39       149
    Repeater       1.00      0.71      0.83      1583

    accuracy                           0.73      1732
   macro avg       0.62      0.85      0.61      1732
weighted avg       0.93      0.73      0.79      1732

Confusion Matrix:
 [[ 147    2]
 [ 465 1118]]


=== Summary ===
Total False Positives: 6
Total False Negatives: 3619
Total True Positives: 4297
Total True Negatives: 742

Confusion Matrix (with duplicates):
              Non-Repeater  Repeater
Non-Repeater         742.0       6.0
Repeater            3619.0    4297.0
accuracy_score
0.5816020313942751
Trial 1: hidden_dim=1434, latent_dim=35, beta=0.8157463555615223, gamma=0.833455368749376, dropout_rate=0.15152351293583816, lr=0.0009646754147050875, scheduler_patience=6, class_weight=1.287868112149432, activation=LeakyReLU, classification_multiplier=7787.086820216526

=== Fold 1/5 ===
Validation Accuracy: 0.1437
Classification Report:
               precision    recall  f1-score   support

Non-Repeater       0.09      1.00      0.17       149
    Repeater       1.00      0.06      0.12      1584

    accuracy                           0.14      1733
   macro avg       0.55      0.53      0.14      1733
weighted avg       0.92      0.14      0.12      1733

Confusion Matrix:
 [[ 149    0]
 [1484  100]]

=== Fold 2/5 ===
Validation Accuracy: 0.3081
Classification Report:
               precision    recall  f1-score   support

Non-Repeater       0.11      1.00      0.20       150
    Repeater       1.00      0.24      0.39      1583

    accuracy                           0.31      1733
   macro avg       0.56      0.62      0.30      1733
weighted avg       0.92      0.31      0.37      1733

Confusion Matrix:
 [[ 150    0]
 [1199  384]]

=== Fold 3/5 ===
Validation Accuracy: 0.1160
Classification Report:
               precision    recall  f1-score   support

Non-Repeater       0.09      1.00      0.16       150
    Repeater       1.00      0.03      0.06      1583

    accuracy                           0.12      1733
   macro avg       0.54      0.52      0.11      1733
weighted avg       0.92      0.12      0.07      1733

Confusion Matrix:
 [[ 150    0]
 [1532   51]]

=== Fold 4/5 ===
Validation Accuracy: 0.0900
Classification Report:
               precision    recall  f1-score   support

Non-Repeater       0.09      1.00      0.16       150
    Repeater       1.00      0.00      0.01      1583

    accuracy                           0.09      1733
   macro avg       0.54      0.50      0.08      1733
weighted avg       0.92      0.09      0.02      1733

Confusion Matrix:
 [[ 150    0]
 [1577    6]]

=== Fold 5/5 ===
Validation Accuracy: 0.2448
Classification Report:
               precision    recall  f1-score   support

Non-Repeater       0.10      1.00      0.19       149
    Repeater       1.00      0.17      0.30      1583

    accuracy                           0.24      1732
   macro avg       0.55      0.59      0.24      1732
weighted avg       0.92      0.24      0.29      1732

Confusion Matrix:
 [[ 149    0]
 [1308  275]]


=== Summary ===
Total False Positives: 0
Total False Negatives: 7100
Total True Positives: 816
Total True Negatives: 748

Confusion Matrix (with duplicates):
              Non-Repeater  Repeater
Non-Repeater         748.0       0.0
Repeater            7100.0     816.0
accuracy_score
0.18051708217913204
[I 2025-06-12 06:10:03,216] Trial 25 finished with value: 0.18051708217913204 and parameters: {'hidden_dim': 1056, 'latent_dim': 29, 'beta': 1.1183637560300346, 'gamma': 0.487239829820753, 'dropout_rate': 0.20528988340389423, 'lr': 0.0020842152376817184, 'scheduler_patience': 7, 'class_weight': 1.6289520750892976, 'activation': 'SELU', 'classification_multiplier': 6439.963384200037}. Best is trial 22 with value: 0.7070637119113573.
[I 2025-06-12 06:16:53,189] Trial 26 finished with value: 0.426477377654663 and parameters: {'hidden_dim': 1622, 'latent_dim': 25, 'beta': 0.967389503489516, 'gamma': 1.067450154133087, 'dropout_rate': 0.14656253514967194, 'lr': 0.003362565130989207, 'scheduler_patience': 5, 'class_weight': 1.2257314854750192, 'activation': 'ReLU', 'classification_multiplier': 8703.576425236653}. Best is trial 22 with value: 0.7070637119113573.
[I 2025-06-12 06:22:50,932] Trial 27 finished with value: 0.670129270544783 and parameters: {'hidden_dim': 1106, 'latent_dim': 20, 'beta': 1.3802977531294927, 'gamma': 0.47110696960725634, 'dropout_rate': 0.1780607180555403, 'lr': 0.0001703396928117916, 'scheduler_patience': 6, 'class_weight': 2.0409616050078676, 'activation': 'ReLU', 'classification_multiplier': 5179.270614997642}. Best is trial 22 with value: 0.7070637119113573.
Trial 1: hidden_dim=1056, latent_dim=29, beta=1.1183637560300346, gamma=0.487239829820753, dropout_rate=0.20528988340389423, lr=0.0020842152376817184, scheduler_patience=7, class_weight=1.6289520750892976, activation=SELU, classification_multiplier=6439.963384200037

=== Fold 1/5 ===
Validation Accuracy: 0.4282
Classification Report:
               precision    recall  f1-score   support

Non-Repeater       0.13      0.99      0.23       149
    Repeater       1.00      0.38      0.55      1584

    accuracy                           0.43      1733
   macro avg       0.56      0.68      0.39      1733
weighted avg       0.92      0.43      0.52      1733

Confusion Matrix:
 [[148   1]
 [990 594]]

=== Fold 2/5 ===
Validation Accuracy: 0.3918
Classification Report:
               precision    recall  f1-score   support

Non-Repeater       0.12      1.00      0.22       150
    Repeater       1.00      0.33      0.50      1583

    accuracy                           0.39      1733
   macro avg       0.56      0.67      0.36      1733
weighted avg       0.92      0.39      0.48      1733

Confusion Matrix:
 [[ 150    0]
 [1054  529]]

=== Fold 3/5 ===
Validation Accuracy: 0.6180
Classification Report:
               precision    recall  f1-score   support

Non-Repeater       0.18      0.99      0.31       150
    Repeater       1.00      0.58      0.74      1583

    accuracy                           0.62      1733
   macro avg       0.59      0.79      0.52      1733
weighted avg       0.93      0.62      0.70      1733

Confusion Matrix:
 [[149   1]
 [661 922]]

=== Fold 4/5 ===
Validation Accuracy: 0.1875
Classification Report:
               precision    recall  f1-score   support

Non-Repeater       0.10      1.00      0.18       150
    Repeater       1.00      0.11      0.20      1583

    accuracy                           0.19      1733
   macro avg       0.55      0.56      0.19      1733
weighted avg       0.92      0.19      0.20      1733

Confusion Matrix:
 [[ 150    0]
 [1408  175]]

=== Fold 5/5 ===
Validation Accuracy: 0.5069
Classification Report:
               precision    recall  f1-score   support

Non-Repeater       0.15      1.00      0.26       149
    Repeater       1.00      0.46      0.63      1583

    accuracy                           0.51      1732
   macro avg       0.57      0.73      0.44      1732
weighted avg       0.93      0.51      0.60      1732

Confusion Matrix:
 [[149   0]
 [854 729]]


=== Summary ===
Total False Positives: 2
Total False Negatives: 4967
Total True Positives: 2949
Total True Negatives: 746

Confusion Matrix (with duplicates):
              Non-Repeater  Repeater
Non-Repeater         746.0       2.0
Repeater            4967.0    2949.0
accuracy_score
0.426477377654663
Trial 1: hidden_dim=1622, latent_dim=25, beta=0.967389503489516, gamma=1.067450154133087, dropout_rate=0.14656253514967194, lr=0.003362565130989207, scheduler_patience=5, class_weight=1.2257314854750192, activation=ReLU, classification_multiplier=8703.576425236653

=== Fold 1/5 ===
Validation Accuracy: 0.6890
Classification Report:
               precision    recall  f1-score   support

Non-Repeater       0.22      1.00      0.36       149
    Repeater       1.00      0.66      0.79      1584

    accuracy                           0.69      1733
   macro avg       0.61      0.83      0.58      1733
weighted avg       0.93      0.69      0.76      1733

Confusion Matrix:
 [[ 149    0]
 [ 539 1045]]

=== Fold 2/5 ===
Validation Accuracy: 0.6590
Classification Report:
               precision    recall  f1-score   support

Non-Repeater       0.20      0.99      0.34       150
    Repeater       1.00      0.63      0.77      1583

    accuracy                           0.66      1733
   macro avg       0.60      0.81      0.55      1733
weighted avg       0.93      0.66      0.73      1733

Confusion Matrix:
 [[149   1]
 [590 993]]

=== Fold 3/5 ===
Validation Accuracy: 0.6515
Classification Report:
               precision    recall  f1-score   support

Non-Repeater       0.20      0.99      0.33       150
    Repeater       1.00      0.62      0.76      1583

    accuracy                           0.65      1733
   macro avg       0.60      0.81      0.55      1733
weighted avg       0.93      0.65      0.73      1733

Confusion Matrix:
 [[149   1]
 [603 980]]

=== Fold 4/5 ===
Validation Accuracy: 0.6336
Classification Report:
               precision    recall  f1-score   support

Non-Repeater       0.19      0.99      0.32       150
    Repeater       1.00      0.60      0.75      1583

    accuracy                           0.63      1733
   macro avg       0.59      0.79      0.53      1733
weighted avg       0.93      0.63      0.71      1733

Confusion Matrix:
 [[148   2]
 [633 950]]

=== Fold 5/5 ===
Validation Accuracy: 0.7177
Classification Report:
               precision    recall  f1-score   support

Non-Repeater       0.23      0.99      0.38       149
    Repeater       1.00      0.69      0.82      1583

    accuracy                           0.72      1732
   macro avg       0.62      0.84      0.60      1732
weighted avg       0.93      0.72      0.78      1732

Confusion Matrix:
 [[ 147    2]
 [ 487 1096]]


=== Summary ===
Total False Positives: 6
Total False Negatives: 2852
Total True Positives: 5064
Total True Negatives: 742

Confusion Matrix (with duplicates):
              Non-Repeater  Repeater
Non-Repeater         742.0       6.0
Repeater            2852.0    5064.0
accuracy_score
0.670129270544783
Trial 1: hidden_dim=1106, latent_dim=20, beta=1.3802977531294927, gamma=0.47110696960725634, dropout_rate=0.1780607180555403, lr=0.0001703396928117916, scheduler_patience=6, class_weight=2.0409616050078676, activation=ReLU, classification_multiplier=5179.270614997642

=== Fold 1/5 ===
Validation Accuracy: 0.6849
Classification Report:
               precision    recall  f1-score   support

Non-Repeater       0.21      0.99      0.35       149
    Repeater       1.00      0.66      0.79      1584

    accuracy                           0.68      1733
   macro avg       0.61      0.82      0.57      1733
weighted avg       0.93      0.68      0.75      1733

Confusion Matrix:
 [[ 148    1]
 [ 545 1039]]

=== Fold 2/5 ===
Validation Accuracy: 0.7374
Classification Report:
               precision    recall  f1-score   support

Non-Repeater       0.25      0.99      0.39       150
    Repeater       1.00      0.71      0.83      1583

    accuracy                           0.74      1733
   macro avg       0.62      0.85      0.61      1733
weighted avg       0.93      0.74      0.79      1733

Confusion Matrix:
 [[ 148    2]
 [ 453 1130]]

=== Fold 3/5 ===
Validation Accuracy: 0.6757
Classification Report:
               precision    recall  f1-score   support

Non-Repeater       0.21      0.99      0.35       150
    Repeater       1.00      0.65      0.78      1583

    accuracy                           0.68      1733
   macro avg       0.60      0.82      0.57      1733
weighted avg       0.93      0.68      0.75      1733

Confusion Matrix:
 [[ 149    1]
 [ 561 1022]]

=== Fold 4/5 ===
Validation Accuracy: 0.6953
Classification Report:
               precision    recall  f1-score   support

Non-Repeater       0.22      0.99      0.36       150
    Repeater       1.00      0.67      0.80      1583

    accuracy                           0.70      1733
   macro avg       0.61      0.83      0.58      1733
weighted avg       0.93      0.70      0.76      1733

Confusion Matrix:
 [[ 148    2]
 [ 526 1057]]

=== Fold 5/5 ===
Validation Accuracy: 0.7419
Classification Report:
               precision    recall  f1-score   support

Non-Repeater       0.25      0.98      0.40       149
    Repeater       1.00      0.72      0.84      1583

    accuracy                           0.74      1732
   macro avg       0.62      0.85      0.62      1732
weighted avg       0.93      0.74      0.80      1732

Confusion Matrix:
 [[ 146    3]
 [ 444 1139]]


=== Summary ===
Total False Positives: 9
Total False Negatives: 2529
Total True Positives: 5387
Total True Negatives: 739

Confusion Matrix (with duplicates):
[I 2025-06-12 06:28:25,611] Trial 28 finished with value: 0.7070637119113573 and parameters: {'hidden_dim': 715, 'latent_dim': 28, 'beta': 0.7865828986763219, 'gamma': 0.8269023039771609, 'dropout_rate': 0.12645516893660896, 'lr': 0.001125397807660103, 'scheduler_patience': 7, 'class_weight': 1.7572532805034375, 'activation': 'ReLU', 'classification_multiplier': 6587.3465925069895}. Best is trial 22 with value: 0.7070637119113573.
[I 2025-06-12 06:33:57,477] Trial 29 finished with value: 0.44783010156971376 and parameters: {'hidden_dim': 621, 'latent_dim': 34, 'beta': 0.6693452736351571, 'gamma': 0.6503390096750715, 'dropout_rate': 0.12847672033031668, 'lr': 0.003449070697376837, 'scheduler_patience': 2, 'class_weight': 1.7552093309668138, 'activation': 'ReLU', 'classification_multiplier': 6445.550405764963}. Best is trial 22 with value: 0.7070637119113573.
