[I 2025-06-13 11:27:55,797] Trial 306 finished with value: 0.7060249307479224 and parameters: {'hidden_dim': 1229, 'latent_dim': 31, 'beta': 1.6439356214703638, 'gamma': 0.13362431824928214, 'dropout_rate': 0.11575402592922215, 'lr': 0.00040973232993916117, 'scheduler_patience': 7, 'class_weight': 2.7367338451702214, 'activation': 'GELU', 'classification_multiplier': 14045.938099471721}. Best is trial 194 with value: 0.8103647276084949.
              precision    recall  f1-score   support

Non-Repeater       0.26      0.98      0.41       149
    Repeater       1.00      0.73      0.85      1583

    accuracy                           0.76      1732
   macro avg       0.63      0.86      0.63      1732
weighted avg       0.93      0.76      0.81      1732

Confusion Matrix:
 [[ 146    3]
 [ 420 1163]]


=== Summary ===
Total False Positives: 7
Total False Negatives: 2419
Total True Positives: 5497
Total True Negatives: 741

Confusion Matrix (with duplicates):
              Non-Repeater  Repeater
Non-Repeater         741.0       7.0
Repeater            2419.0    5497.0
accuracy_score
0.7199907663896583
Trial 1: hidden_dim=1382, latent_dim=34, beta=1.3679818706586087, gamma=0.22096174050655285, dropout_rate=0.12934159058229655, lr=0.00010246074551871666, scheduler_patience=7, class_weight=2.9127335001597965, activation=ReLU, classification_multiplier=13435.925009998315

=== Fold 1/5 ===
Validation Accuracy: 0.6809
Classification Report:
               precision    recall  f1-score   support

Non-Repeater       0.21      0.98      0.35       149
    Repeater       1.00      0.65      0.79      1584

    accuracy                           0.68      1733
   macro avg       0.60      0.82      0.57      1733
weighted avg       0.93      0.68      0.75      1733

Confusion Matrix:
 [[ 146    3]
 [ 550 1034]]

=== Fold 2/5 ===
Validation Accuracy: 0.7328
Classification Report:
               precision    recall  f1-score   support

Non-Repeater       0.24      0.99      0.39       150
    Repeater       1.00      0.71      0.83      1583

    accuracy                           0.73      1733
   macro avg       0.62      0.85      0.61      1733
weighted avg       0.93      0.73      0.79      1733

Confusion Matrix:
 [[ 149    1]
 [ 462 1121]]

=== Fold 3/5 ===
Validation Accuracy: 0.6647
Classification Report:
               precision    recall  f1-score   support

Non-Repeater       0.20      0.99      0.34       150
    Repeater       1.00      0.63      0.78      1583

    accuracy                           0.66      1733
   macro avg       0.60      0.81      0.56      1733
weighted avg       0.93      0.66      0.74      1733

Confusion Matrix:
 [[ 148    2]
 [ 579 1004]]

=== Fold 4/5 ===
Validation Accuracy: 0.6942
Classification Report:
               precision    recall  f1-score   support

Non-Repeater       0.22      0.99      0.36       150
    Repeater       1.00      0.67      0.80      1583

    accuracy                           0.69      1733
   macro avg       0.61      0.83      0.58      1733
weighted avg       0.93      0.69      0.76      1733

Confusion Matrix:
 [[ 148    2]
 [ 528 1055]]

=== Fold 5/5 ===
Validation Accuracy: 0.8834
Classification Report:
               precision    recall  f1-score   support

Non-Repeater       0.41      0.77      0.53       149
    Repeater       0.98      0.89      0.93      1583

    accuracy                           0.88      1732
   macro avg       0.69      0.83      0.73      1732
weighted avg       0.93      0.88      0.90      1732

Confusion Matrix:
 [[ 114   35]
 [ 167 1416]]


=== Summary ===
Total False Positives: 43
Total False Negatives: 2286
Total True Positives: 5630
Total True Negatives: 705

Confusion Matrix (with duplicates):
              Non-Repeater  Repeater
Non-Repeater         705.0      43.0
Repeater            2286.0    5630.0
accuracy_score
0.7311865189289012
Trial 1: hidden_dim=1984, latent_dim=33, beta=1.4339585936926598, gamma=0.19545485078104358, dropout_rate=0.1498112961169315, lr=0.0006857046331024327, scheduler_patience=7, class_weight=2.645056337021863, activation=ReLU, classification_multiplier=14600.564166936447

=== Fold 1/5 ===
Validation Accuracy: 0.7651
Classification Report:
               precision    recall  f1-score   support

Non-Repeater       0.27      1.00      0.42       149
    Repeater       1.00      0.74      0.85      1584

    accuracy                           0.77      1733
   macro avg       0.63      0.87      0.64      1733
weighted avg       0.94      0.77      0.82      1733

Confusion Matrix:
 [[ 149    0]
 [ 407 1177]]

=== Fold 2/5 ===
Validation Accuracy: 0.7092
Classification Report:
               precision    recall  f1-score   support

Non-Repeater       0.23      0.99      0.37       150
    Repeater       1.00      0.68      0.81      1583

    accuracy                           0.71      1733
   macro avg       0.61      0.84      0.59      1733
weighted avg       0.93      0.71      0.77      1733

Confusion Matrix:
 [[ 149    1]
 [ 503 1080]]

=== Fold 3/5 ===
Validation Accuracy: 0.6763
Classification Report:
               precision    recall  f1-score   support

Non-Repeater       0.21      0.99      0.35       150
    Repeater       1.00      0.65      0.78      1583

    accuracy                           0.68      1733
   macro avg       0.60      0.82      0.57      1733
weighted avg       0.93      0.68      0.75      1733

Confusion Matrix:
 [[ 149    1]
 [ 560 1023]]

=== Fold 4/5 ===
Validation Accuracy: 0.6353
Classification Report:
               precision    recall  f1-score   support

Non-Repeater       0.19      0.98      0.32       150
    Repeater       1.00      0.60      0.75      1583

    accuracy                           0.64      1733
   macro avg       0.59      0.79      0.53      1733
weighted avg       0.93      0.64      0.71      1733

Confusion Matrix:
 [[147   3]
 [629 954]]

=== Fold 5/5 ===
Validation Accuracy: 0.7442
Classification Report:
               precision    recall  f1-score   support

Non-Repeater       0.25      0.98      0.40       149
    Repeater       1.00      0.72      0.84      1583

    accuracy                           0.74      1732
   macro avg       0.62      0.85      0.62      1732
weighted avg       0.93      0.74      0.80      1732

Confusion Matrix:
 [[ 146    3]
 [ 440 1143]]


=== Summary ===
Total False Positives: 8
Total False Negatives: 2539
Total True Positives: 5377
Total True Negatives: 740

Confusion Matrix (with duplicates):
              Non-Repeater  Repeater
Non-Repeater         740.0       8.0
Repeater            2539.0    5377.0
accuracy_score
0.7060249307479224
Trial 1: hidden_dim=1229, latent_dim=31, beta=1.6439356214703638, gamma=0.13362431824928214, dropout_rate=0.11575402592922215, lr=0.00040973232993916117, scheduler_patience=7, class_weight=2.7367338451702214, activation=GELU, classification_multiplier=14045.938099471721

=== Fold 1/5 ===
Validation Accuracy: 0.7484
Classification Report:
               precision    recall  f1-score   support

Non-Repeater       0.25      0.99      0.40       149
    Repeater       1.00      0.73      0.84      1584

    accuracy                           0.75      1733
   macro avg       0.63      0.86      0.62      1733
weighted avg       0.94      0.75      0.80      1733

Confusion Matrix:
 [[ 148    1]
 [ 435 1149]]

=== Fold 2/5 ===
Validation Accuracy: 0.5638
Classification Report:
               precision    recall  f1-score   support

Non-Repeater       0.16      0.99      0.28       150
    Repeater       1.00      0.52      0.69      1583

    accuracy                           0.56      1733
   macro avg       0.58      0.76      0.48      1733
weighted avg       0.93      0.56      0.65      1733

Confusion Matrix:
 [[149   1]
 [755 828]]

=== Fold 3/5 ===
Validation Accuracy: 0.6907
Classification Report:
               precision    recall  f1-score   support

Non-Repeater       0.22      0.99      0.36       150
    Repeater       1.00      0.66      0.80      1583

    accuracy                           0.69      1733
   macro avg       0.61      0.83      0.58      1733
weighted avg       0.93      0.69      0.76      1733

Confusion Matrix:
 [[ 149    1]
 [ 535 1048]]

=== Fold 4/5 ===
Validation Accuracy: 0.7773
Classification Report:
 [I 2025-06-13 11:34:33,637] Trial 307 finished with value: 0.7009464450600185 and parameters: {'hidden_dim': 1465, 'latent_dim': 30, 'beta': 1.5523479219831235, 'gamma': 0.10314690130931478, 'dropout_rate': 0.13697605365219634, 'lr': 0.0010847144361654031, 'scheduler_patience': 7, 'class_weight': 2.8314629141328678, 'activation': 'ReLU', 'classification_multiplier': 14825.235758903147}. Best is trial 194 with value: 0.8103647276084949.
[I 2025-06-13 11:41:15,152] Trial 308 finished with value: 0.7248384118190212 and parameters: {'hidden_dim': 1518, 'latent_dim': 32, 'beta': 1.3387540458502332, 'gamma': 0.30713535947539355, 'dropout_rate': 0.12327846897278934, 'lr': 0.0003172342726770127, 'scheduler_patience': 4, 'class_weight': 2.9444582433355038, 'activation': 'ReLU', 'classification_multiplier': 14998.241402515452}. Best is trial 194 with value: 0.8103647276084949.
[I 2025-06-13 11:47:43,611] Trial 309 finished with value: 0.7801246537396122 and parameters: {'hidden_dim': 1407, 'latent_dim': 31, 'beta': 1.3903618808229234, 'gamma': 0.16108941422322398, 'dropout_rate': 0.14449538714092278, 'lr': 0.0006223729991512681, 'scheduler_patience': 7, 'class_weight': 2.8634679304046537, 'activation': 'ReLU', 'classification_multiplier': 14223.253805351986}. Best is trial 194 with value: 0.8103647276084949.
/home/ubuntu/frb-analysis/.frb-analysis/lib/python3.12/site-packages/sklearn/metrics/_classification.py:1565: UndefinedMetricWarning: Precision is ill-defined and being set to 0.0 in labels with no predicted samples. Use `zero_division` parameter to control this behavior.
  _warn_prf(average, modifier, f"{metric.capitalize()} is", len(result))
/home/ubuntu/frb-analysis/.frb-analysis/lib/python3.12/site-packages/sklearn/metrics/_classification.py:1565: UndefinedMetricWarning: Precision is ill-defined and being set to 0.0 in labels with no predicted samples. Use `zero_division` parameter to control this behavior.
  _warn_prf(average, modifier, f"{metric.capitalize()} is", len(result))
/home/ubuntu/frb-analysis/.frb-analysis/lib/python3.12/site-packages/sklearn/metrics/_classification.py:1565: UndefinedMetricWarning: Precision is ill-defined and being set to 0.0 in labels with no predicted samples. Use `zero_division` parameter to control this behavior.
  _warn_prf(average, modifier, f"{metric.capitalize()} is", len(result))
              precision    recall  f1-score   support

Non-Repeater       0.28      0.97      0.43       150
    Repeater       1.00      0.76      0.86      1583

    accuracy                           0.78      1733
   macro avg       0.64      0.87      0.65      1733
weighted avg       0.93      0.78      0.82      1733

Confusion Matrix:
 [[ 146    4]
 [ 382 1201]]

=== Fold 5/5 ===
Validation Accuracy: 0.7246
Classification Report:
               precision    recall  f1-score   support

Non-Repeater       0.24      0.99      0.38       149
    Repeater       1.00      0.70      0.82      1583

    accuracy                           0.72      1732
   macro avg       0.62      0.84      0.60      1732
weighted avg       0.93      0.72      0.78      1732

Confusion Matrix:
 [[ 147    2]
 [ 475 1108]]


=== Summary ===
Total False Positives: 9
Total False Negatives: 2582
Total True Positives: 5334
Total True Negatives: 739

Confusion Matrix (with duplicates):
              Non-Repeater  Repeater
Non-Repeater         739.0       9.0
Repeater            2582.0    5334.0
accuracy_score
0.7009464450600185
Trial 1: hidden_dim=1465, latent_dim=30, beta=1.5523479219831235, gamma=0.10314690130931478, dropout_rate=0.13697605365219634, lr=0.0010847144361654031, scheduler_patience=7, class_weight=2.8314629141328678, activation=ReLU, classification_multiplier=14825.235758903147

=== Fold 1/5 ===
Validation Accuracy: 0.6053
Classification Report:
               precision    recall  f1-score   support

Non-Repeater       0.18      0.99      0.30       149
    Repeater       1.00      0.57      0.73      1584

    accuracy                           0.61      1733
   macro avg       0.59      0.78      0.51      1733
weighted avg       0.93      0.61      0.69      1733

Confusion Matrix:
 [[147   2]
 [682 902]]

=== Fold 2/5 ===
Validation Accuracy: 0.7565
Classification Report:
               precision    recall  f1-score   support

Non-Repeater       0.26      0.99      0.41       150
    Repeater       1.00      0.73      0.85      1583

    accuracy                           0.76      1733
   macro avg       0.63      0.86      0.63      1733
weighted avg       0.94      0.76      0.81      1733

Confusion Matrix:
 [[ 149    1]
 [ 421 1162]]

=== Fold 3/5 ===
Validation Accuracy: 0.7340
Classification Report:
               precision    recall  f1-score   support

Non-Repeater       0.24      0.99      0.39       150
    Repeater       1.00      0.71      0.83      1583

    accuracy                           0.73      1733
   macro avg       0.62      0.85      0.61      1733
weighted avg       0.93      0.73      0.79      1733

Confusion Matrix:
 [[ 149    1]
 [ 460 1123]]

=== Fold 4/5 ===
Validation Accuracy: 0.7571
Classification Report:
               precision    recall  f1-score   support

Non-Repeater       0.26      0.99      0.41       150
    Repeater       1.00      0.74      0.85      1583

    accuracy                           0.76      1733
   macro avg       0.63      0.86      0.63      1733
weighted avg       0.93      0.76      0.81      1733

Confusion Matrix:
 [[ 148    2]
 [ 419 1164]]

=== Fold 5/5 ===
Validation Accuracy: 0.7714
Classification Report:
               precision    recall  f1-score   support

Non-Repeater       0.27      0.98      0.42       149
    Repeater       1.00      0.75      0.86      1583

    accuracy                           0.77      1732
   macro avg       0.63      0.87      0.64      1732
weighted avg       0.93      0.77      0.82      1732

Confusion Matrix:
 [[ 146    3]
 [ 393 1190]]


=== Summary ===
Total False Positives: 9
Total False Negatives: 2375
Total True Positives: 5541
Total True Negatives: 739

Confusion Matrix (with duplicates):
              Non-Repeater  Repeater
Non-Repeater         739.0       9.0
Repeater            2375.0    5541.0
accuracy_score
0.7248384118190212
Trial 1: hidden_dim=1518, latent_dim=32, beta=1.3387540458502332, gamma=0.30713535947539355, dropout_rate=0.12327846897278934, lr=0.0003172342726770127, scheduler_patience=4, class_weight=2.9444582433355038, activation=ReLU, classification_multiplier=14998.241402515452

=== Fold 1/5 ===
Validation Accuracy: 0.7796
Classification Report:
               precision    recall  f1-score   support

Non-Repeater       0.28      0.99      0.44       149
    Repeater       1.00      0.76      0.86      1584

    accuracy                           0.78      1733
   macro avg       0.64      0.88      0.65      1733
weighted avg       0.94      0.78      0.83      1733

Confusion Matrix:
 [[ 148    1]
 [ 381 1203]]

=== Fold 2/5 ===
Validation Accuracy: 0.8823
Classification Report:
               precision    recall  f1-score   support

Non-Repeater       0.42      0.93      0.58       150
    Repeater       0.99      0.88      0.93      1583

    accuracy                           0.88      1733
   macro avg       0.71      0.91      0.76      1733
weighted avg       0.94      0.88      0.90      1733

Confusion Matrix:
 [[ 140   10]
 [ 194 1389]]

=== Fold 3/5 ===
Validation Accuracy: 0.7426
Classification Report:
               precision    recall  f1-score   support

Non-Repeater       0.25      0.99      0.40       150
    Repeater       1.00      0.72      0.84      1583

    accuracy                           0.74      1733
   macro avg       0.62      0.86      0.62      1733
weighted avg       0.93      0.74      0.80      1733

Confusion Matrix:
 [[ 149    1]
 [ 445 1138]]

=== Fold 4/5 ===
Validation Accuracy: 0.7421
Classification Report:
               precision    recall  f1-score   support

Non-Repeater       0.25      0.97      0.40       150
    Repeater       1.00      0.72      0.84      1583

    accuracy                           0.74      1733
   macro avg       0.62      0.85      0.62      1733
weighted avg       0.93      0.74      0.80      1733

Confusion Matrix:
 [[ 146    4]
 [ 443 1140]]

=== Fold 5/5 ===
Validation Accuracy: 0.7540
Classification Report:
               precision    recall  f1-score   support

Non-Repeater       0.26      0.97      0.41       149
    Repeater       1.00      0.73      0.84      1583

    accuracy                           0.75      1732
   macro avg       0.63      0.85      0.63      1732
weighted avg       0.93      0.75      0.81      1732

Confusion Matrix:
 [[ 145    4]
 [ 422 1161]]


=== Summary ===
Total False Positives: 20
Total False Negatives: 1885
Total True Positives: 6031
Total True Negatives: 728

Confusion Matrix (with duplicates):
              Non-Repeater  Repeater
Non-Repeater         728.0      20.0
Repeater            1885.0    6031.0
accuracy_score
0.7801246537396122
Trial 1: hidden_dim=1407, latent_dim=31, beta=1.3903618808229234, gamma=0.16108941422322398, dropout_rate=0.14449538714092278, lr=0.0006223729991512681, scheduler_patience=7, class_weight=2.8634679304046537, activation=ReLU, classification_multiplier=14223.253805351986

=== Fold 1/5 ===
Validation Accuracy: 0.4818
Classification Report:
               precision    recall  f1-score   support

Non-Repeater       0.14      0.98      0.25       149
    Repeater       1.00      0.43      0.61      1584

    accuracy                           0.48      1733
   macro avg       0.57      0.71      0.43      1733
weighted avg       0.92      0.48      0.57      1733

Confusion Matrix:
 [[146   3]
 [895 689]]

=== Fold 2/5 ===
Validation Accuracy: 0.0866
Classification Report:
               precision    recall  f1-score   support

Non-Repeater       0.09      1.00      0.16       150
    Repeater       0.00      0.00      0.00      1583

    accuracy                           0.09      1733
   macro avg       0.04      0.50      0.08      1733
weighted avg       0.01      0.09      0.01      1733

Confusion Matrix:
 [[ 150    0]
 [1583    0]]

=== Fold 3/5 ===
Validation Accuracy: 0.7421
Classification Report:
 [I 2025-06-13 11:54:12,005] Trial 310 finished with value: 0.5670590951061866 and parameters: {'hidden_dim': 1409, 'latent_dim': 29, 'beta': 1.392286673426062, 'gamma': 0.24963174021439238, 'dropout_rate': 0.15238127374769497, 'lr': 0.005642837822827017, 'scheduler_patience': 7, 'class_weight': 2.8637664850174067, 'activation': 'ReLU', 'classification_multiplier': 14238.971351182236}. Best is trial 194 with value: 0.8103647276084949.
[I 2025-06-13 12:00:37,646] Trial 311 finished with value: 0.7508079409048938 and parameters: {'hidden_dim': 1377, 'latent_dim': 31, 'beta': 1.4497352033049244, 'gamma': 0.17194128871328276, 'dropout_rate': 0.14301724442430447, 'lr': 0.0009256998422021426, 'scheduler_patience': 7, 'class_weight': 2.903906844529279, 'activation': 'ReLU', 'classification_multiplier': 14508.73036666139}. Best is trial 194 with value: 0.8103647276084949.
