[I 2025-06-13 12:40:39,125] Trial 317 finished with value: 0.7394967682363804 and parameters: {'hidden_dim': 1542, 'latent_dim': 31, 'beta': 1.5678323853126628, 'gamma': 0.15336573223689212, 'dropout_rate': 0.1072648478823159, 'lr': 0.0005190689090198572, 'scheduler_patience': 7, 'class_weight': 2.9960276290167895, 'activation': 'ReLU', 'classification_multiplier': 11770.703751877481}. Best is trial 194 with value: 0.8103647276084949.
              precision    recall  f1-score   support

Non-Repeater       0.23      0.99      0.37       149
    Repeater       1.00      0.68      0.81      1584

    accuracy                           0.71      1733
   macro avg       0.61      0.84      0.59      1733
weighted avg       0.93      0.71      0.77      1733

Confusion Matrix:
 [[ 148    1]
 [ 509 1075]]

=== Fold 2/5 ===
Validation Accuracy: 0.6676
Classification Report:
               precision    recall  f1-score   support

Non-Repeater       0.21      0.99      0.34       150
    Repeater       1.00      0.64      0.78      1583

    accuracy                           0.67      1733
   macro avg       0.60      0.82      0.56      1733
weighted avg       0.93      0.67      0.74      1733

Confusion Matrix:
 [[ 149    1]
 [ 575 1008]]

=== Fold 3/5 ===
Validation Accuracy: 0.7230
Classification Report:
               precision    recall  f1-score   support

Non-Repeater       0.24      0.99      0.38       150
    Repeater       1.00      0.70      0.82      1583

    accuracy                           0.72      1733
   macro avg       0.62      0.85      0.60      1733
weighted avg       0.93      0.72      0.78      1733

Confusion Matrix:
 [[ 149    1]
 [ 479 1104]]

=== Fold 4/5 ===
Validation Accuracy: 0.7126
Classification Report:
               precision    recall  f1-score   support

Non-Repeater       0.23      0.99      0.37       150
    Repeater       1.00      0.69      0.81      1583

    accuracy                           0.71      1733
   macro avg       0.61      0.84      0.59      1733
weighted avg       0.93      0.71      0.78      1733

Confusion Matrix:
 [[ 148    2]
 [ 496 1087]]

=== Fold 5/5 ===
Validation Accuracy: 0.7945
Classification Report:
               precision    recall  f1-score   support

Non-Repeater       0.29      0.97      0.45       149
    Repeater       1.00      0.78      0.87      1583

    accuracy                           0.79      1732
   macro avg       0.64      0.87      0.66      1732
weighted avg       0.94      0.79      0.84      1732

Confusion Matrix:
 [[ 144    5]
 [ 351 1232]]


=== Summary ===
Total False Positives: 10
Total False Negatives: 2410
Total True Positives: 5506
Total True Negatives: 738

Confusion Matrix (with duplicates):
              Non-Repeater  Repeater
Non-Repeater         738.0      10.0
Repeater            2410.0    5506.0
accuracy_score
0.7206832871652816
Trial 1: hidden_dim=1483, latent_dim=33, beta=1.3792530549273045, gamma=0.20128573439395817, dropout_rate=0.13445757273462, lr=0.0007218202607265444, scheduler_patience=7, class_weight=2.7738420554696934, activation=ReLU, classification_multiplier=14317.883767286932

=== Fold 1/5 ===
Validation Accuracy: 0.7040
Classification Report:
               precision    recall  f1-score   support

Non-Repeater       0.22      0.99      0.37       149
    Repeater       1.00      0.68      0.81      1584

    accuracy                           0.70      1733
   macro avg       0.61      0.84      0.59      1733
weighted avg       0.93      0.70      0.77      1733

Confusion Matrix:
 [[ 148    1]
 [ 512 1072]]

=== Fold 2/5 ===
Validation Accuracy: 0.6994
Classification Report:
               precision    recall  f1-score   support

Non-Repeater       0.22      0.99      0.36       150
    Repeater       1.00      0.67      0.80      1583

    accuracy                           0.70      1733
   macro avg       0.61      0.83      0.58      1733
weighted avg       0.93      0.70      0.77      1733

Confusion Matrix:
 [[ 149    1]
 [ 520 1063]]

=== Fold 3/5 ===
Validation Accuracy: 0.6388
Classification Report:
               precision    recall  f1-score   support

Non-Repeater       0.19      0.99      0.32       150
    Repeater       1.00      0.61      0.75      1583

    accuracy                           0.64      1733
   macro avg       0.60      0.80      0.54      1733
weighted avg       0.93      0.64      0.72      1733

Confusion Matrix:
 [[149   1]
 [625 958]]

=== Fold 4/5 ===
Validation Accuracy: 0.7836
Classification Report:
               precision    recall  f1-score   support

Non-Repeater       0.28      0.97      0.44       150
    Repeater       1.00      0.77      0.87      1583

    accuracy                           0.78      1733
   macro avg       0.64      0.87      0.65      1733
weighted avg       0.93      0.78      0.83      1733

Confusion Matrix:
 [[ 145    5]
 [ 370 1213]]

=== Fold 5/5 ===
Validation Accuracy: 0.8718
Classification Report:
               precision    recall  f1-score   support

Non-Repeater       0.40      0.97      0.57       149
    Repeater       1.00      0.86      0.92      1583

    accuracy                           0.87      1732
   macro avg       0.70      0.92      0.75      1732
weighted avg       0.95      0.87      0.89      1732

Confusion Matrix:
 [[ 145    4]
 [ 218 1365]]


=== Summary ===
Total False Positives: 12
Total False Negatives: 2245
Total True Positives: 5671
Total True Negatives: 736

Confusion Matrix (with duplicates):
              Non-Repeater  Repeater
Non-Repeater         736.0      12.0
Repeater            2245.0    5671.0
accuracy_score
0.7394967682363804
Trial 1: hidden_dim=1542, latent_dim=31, beta=1.5678323853126628, gamma=0.15336573223689212, dropout_rate=0.1072648478823159, lr=0.0005190689090198572, scheduler_patience=7, class_weight=2.9960276290167895, activation=ReLU, classification_multiplier=11770.703751877481

=== Fold 1/5 ===
Validation Accuracy: 0.6428
Classification Report:
               precision    recall  f1-score   support

Non-Repeater       0.19      0.99      0.32       149
    Repeater       1.00      0.61      0.76      1584

    accuracy                           0.64      1733
   macro avg       0.60      0.80      0.54      1733
weighted avg       0.93      0.64      0.72      1733

Confusion Matrix:
 [[147   2]
 [617 967]]

=== Fold 2/5 ===
Validation Accuracy: 0.7726
Classification Report:
               precision    recall  f1-score   support

Non-Repeater       0.27      0.99      0.43       150
    Repeater       1.00      0.75      0.86      1583

    accuracy                           0.77      1733
   macro avg       0.64      0.87      0.64      1733
weighted avg       0.94      0.77      0.82      1733

Confusion Matrix:
 [[ 149    1]
 [ 393 1190]]

=== Fold 3/5 ===
Validation Accuracy: 0.5782
Classification Report:
               precision    recall  f1-score   support

Non-Repeater       0.17      0.99      0.29       150
    Repeater       1.00      0.54      0.70      1583

    accuracy                           0.58      1733
   macro avg       0.58      0.77      0.49      1733
weighted avg       0.93      0.58      0.66      1733

Confusion Matrix:
 [[149   1]
 [730 853]]

=== Fold 4/5 ===
Validation Accuracy: 0.6307
Classification Report:
               precision    recall  f1-score   support

Non-Repeater       0.19      0.99      0.32       150
    Repeater       1.00      0.60      0.75      1583

    accuracy                           0.63      1733
   macro avg       0.59      0.79      0.53      1733
weighted avg       0.93      0.63      0.71      1733

Confusion Matrix:
 [[148   2]
 [638 945]]

=== Fold 5/5 ===
Validation Accuracy: 0.8632
Classification Report:
               precision    recall  f1-score   support

Non-Repeater       0.33      0.56      0.41       149
    Repeater       0.96      0.89      0.92      1583

    accuracy                           0.86      1732
   macro avg       0.64      0.73      0.67      1732
weighted avg       0.90      0.86      0.88      1732

Confusion Matrix:
 [[  84   65]
 [ 172 1411]]


=== Summary ===
Total False Positives: 71
Total False Negatives: 2550
Total True Positives: 5366
Total True Negatives: 677

Confusion Matrix (with duplicates):
              Non-Repeater  Repeater
Non-Repeater         677.0      71.0
Repeater            2550.0    5366.0
accuracy_score
0.6974838411819021
[I 2025-06-13 12:47:15,885] Trial 318 finished with value: 0.6974838411819021 and parameters: {'hidden_dim': 1459, 'latent_dim': 7, 'beta': 1.3146264385404238, 'gamma': 1.7008788702973687, 'dropout_rate': 0.14803612830065627, 'lr': 0.0010959013141227415, 'scheduler_patience': 7, 'class_weight': 2.856218367366006, 'activation': 'ReLU', 'classification_multiplier': 13055.506628421675}. Best is trial 194 with value: 0.8103647276084949.
[I 2025-06-13 12:53:45,171] Trial 319 finished with value: 0.7138734995383195 and parameters: {'hidden_dim': 1432, 'latent_dim': 31, 'beta': 1.4603236548150338, 'gamma': 0.1996647938775746, 'dropout_rate': 0.13026531620864754, 'lr': 0.0008143244907010765, 'scheduler_patience': 7, 'class_weight': 2.936503427967165, 'activation': 'ReLU', 'classification_multiplier': 13865.010286378198}. Best is trial 194 with value: 0.8103647276084949.
[I 2025-06-13 13:00:13,425] Trial 320 finished with value: 0.6409279778393352 and parameters: {'hidden_dim': 1403, 'latent_dim': 28, 'beta': 1.4274345306378058, 'gamma': 0.12548210387261968, 'dropout_rate': 0.11471940484877718, 'lr': 0.000584528790410876, 'scheduler_patience': 7, 'class_weight': 0.6728466113462888, 'activation': 'ReLU', 'classification_multiplier': 14766.940942260135}. Best is trial 194 with value: 0.8103647276084949.
Trial 1: hidden_dim=1459, latent_dim=7, beta=1.3146264385404238, gamma=1.7008788702973687, dropout_rate=0.14803612830065627, lr=0.0010959013141227415, scheduler_patience=7, class_weight=2.856218367366006, activation=ReLU, classification_multiplier=13055.506628421675

=== Fold 1/5 ===
Validation Accuracy: 0.6924
Classification Report:
               precision    recall  f1-score   support

Non-Repeater       0.22      0.99      0.36       149
    Repeater       1.00      0.66      0.80      1584

    accuracy                           0.69      1733
   macro avg       0.61      0.83      0.58      1733
weighted avg       0.93      0.69      0.76      1733

Confusion Matrix:
 [[ 148    1]
 [ 532 1052]]

=== Fold 2/5 ===
Validation Accuracy: 0.6751
Classification Report:
               precision    recall  f1-score   support

Non-Repeater       0.21      0.99      0.35       150
    Repeater       1.00      0.64      0.78      1583

    accuracy                           0.68      1733
   macro avg       0.60      0.82      0.56      1733
weighted avg       0.93      0.68      0.75      1733

Confusion Matrix:
 [[ 149    1]
 [ 562 1021]]

=== Fold 3/5 ===
Validation Accuracy: 0.7525
Classification Report:
               precision    recall  f1-score   support

Non-Repeater       0.26      0.99      0.41       150
    Repeater       1.00      0.73      0.84      1583

    accuracy                           0.75      1733
   macro avg       0.63      0.86      0.63      1733
weighted avg       0.94      0.75      0.81      1733

Confusion Matrix:
 [[ 149    1]
 [ 428 1155]]

=== Fold 4/5 ===
Validation Accuracy: 0.6976
Classification Report:
               precision    recall  f1-score   support

Non-Repeater       0.22      0.99      0.36       150
    Repeater       1.00      0.67      0.80      1583

    accuracy                           0.70      1733
   macro avg       0.61      0.83      0.58      1733
weighted avg       0.93      0.70      0.76      1733

Confusion Matrix:
 [[ 148    2]
 [ 522 1061]]

=== Fold 5/5 ===
Validation Accuracy: 0.7517
Classification Report:
               precision    recall  f1-score   support

Non-Repeater       0.25      0.97      0.40       149
    Repeater       1.00      0.73      0.84      1583

    accuracy                           0.75      1732
   macro avg       0.63      0.85      0.62      1732
weighted avg       0.93      0.75      0.81      1732

Confusion Matrix:
 [[ 145    4]
 [ 426 1157]]


=== Summary ===
Total False Positives: 9
Total False Negatives: 2470
Total True Positives: 5446
Total True Negatives: 739

Confusion Matrix (with duplicates):
              Non-Repeater  Repeater
Non-Repeater         739.0       9.0
Repeater            2470.0    5446.0
accuracy_score
0.7138734995383195
Trial 1: hidden_dim=1432, latent_dim=31, beta=1.4603236548150338, gamma=0.1996647938775746, dropout_rate=0.13026531620864754, lr=0.0008143244907010765, scheduler_patience=7, class_weight=2.936503427967165, activation=ReLU, classification_multiplier=13865.010286378198

=== Fold 1/5 ===
Validation Accuracy: 0.7132
Classification Report:
               precision    recall  f1-score   support

Non-Repeater       0.23      0.99      0.37       149
    Repeater       1.00      0.69      0.81      1584

    accuracy                           0.71      1733
   macro avg       0.61      0.84      0.59      1733
weighted avg       0.93      0.71      0.78      1733

Confusion Matrix:
 [[ 148    1]
 [ 496 1088]]

=== Fold 2/5 ===
Validation Accuracy: 0.5909
Classification Report:
               precision    recall  f1-score   support

Non-Repeater       0.17      1.00      0.30       150
    Repeater       1.00      0.55      0.71      1583

    accuracy                           0.59      1733
   macro avg       0.59      0.78      0.50      1733
weighted avg       0.93      0.59      0.68      1733

Confusion Matrix:
 [[150   0]
 [709 874]]

=== Fold 3/5 ===
Validation Accuracy: 0.6319
Classification Report:
               precision    recall  f1-score   support

Non-Repeater       0.19      0.99      0.32       150
    Repeater       1.00      0.60      0.75      1583

    accuracy                           0.63      1733
   macro avg       0.59      0.79      0.53      1733
weighted avg       0.93      0.63      0.71      1733

Confusion Matrix:
 [[148   2]
 [636 947]]

=== Fold 4/5 ===
Validation Accuracy: 0.5493
Classification Report:
               precision    recall  f1-score   support

Non-Repeater       0.16      0.99      0.28       150
    Repeater       1.00      0.51      0.67      1583

    accuracy                           0.55      1733
   macro avg       0.58      0.75      0.47      1733
weighted avg       0.93      0.55      0.64      1733

Confusion Matrix:
 [[149   1]
 [780 803]]

=== Fold 5/5 ===
Validation Accuracy: 0.7194
Classification Report:
               precision    recall  f1-score   support

Non-Repeater       0.23      0.98      0.38       149
    Repeater       1.00      0.69      0.82      1583

    accuracy                           0.72      1732
   macro avg       0.61      0.84      0.60      1732
weighted avg       0.93      0.72      0.78      1732

Confusion Matrix:
 [[ 146    3]
 [ 483 1100]]


=== Summary ===
Total False Positives: 7
Total False Negatives: 3104
Total True Positives: 4812
Total True Negatives: 741

Confusion Matrix (with duplicates):
              Non-Repeater  Repeater
Non-Repeater         741.0       7.0
Repeater            3104.0    4812.0
accuracy_score
0.6409279778393352
Trial 1: hidden_dim=1403, latent_dim=28, beta=1.4274345306378058, gamma=0.12548210387261968, dropout_rate=0.11471940484877718, lr=0.000584528790410876, scheduler_patience=7, class_weight=0.6728466113462888, activation=ReLU, classification_multiplier=14766.940942260135

=== Fold 1/5 ===
Validation Accuracy: 0.6936
Classification Report:
               precision    recall  f1-score   support

Non-Repeater       0.22      1.00      0.36       149
    Repeater       1.00      0.66      0.80      1584

    accuracy                           0.69      1733
   macro avg       0.61      0.83      0.58      1733
weighted avg       0.93      0.69      0.76      1733

Confusion Matrix:
 [[ 149    0]
 [ 531 1053]]

=== Fold 2/5 ===
Validation Accuracy: 0.7582
Classification Report:
               precision    recall  f1-score   support

Non-Repeater       0.26      0.99      0.41       150
    Repeater       1.00      0.74      0.85      1583

    accuracy                           0.76      1733
   macro avg       0.63      0.86      0.63      1733
weighted avg       0.93      0.76      0.81      1733

Confusion Matrix:
 [[ 148    2]
 [ 417 1166]]

=== Fold 3/5 ===
Validation Accuracy: 0.4559
Classification Report:
               precision    recall  f1-score   support

Non-Repeater       0.14      0.99      0.24       150
    Repeater       1.00      0.40      0.58      1583

    accuracy                           0.46      1733
   macro avg       0.57      0.70      0.41      1733
weighted avg       0.92      0.46      0.55      1733

Confusion Matrix:
 [[149   1]
 [942 641]]

=== Fold 4/5 ===
Validation Accuracy: 0.6630
Classification Report:
               precision    recall  f1-score   support

Non-Repeater       0.20      0.99      0.34       150
    Repeater       1.00      0.63      0.77      1583

    accuracy                           0.66      1733
   macro avg       0.60      0.81      0.56      1733
weighted avg       0.93      0.66      0.74      1733

Confusion Matrix:
 [[ 148    2]
 [ 582 1001]]

=== Fold 5/5 ===
Validation Accuracy: 0.6986
Classification Report:
               precision    recall  f1-score   support

Non-Repeater       0.22      0.99      0.36       149
    Repeater       1.00      0.67      0.80      1583

    accuracy                           0.70      1732
   macro avg       0.61      0.83      0.58      1732
weighted avg       0.93      0.70      0.76      1732

Confusion Matrix:
 [[ 147    2]
 [ 520 1063]]


=== Summary ===
Total False Positives: 7
Total False Negatives: 2992
Total True Positives: 4924
Total True Negatives: 741
[I 2025-06-13 13:06:49,644] Trial 321 finished with value: 0.6538550323176362 and parameters: {'hidden_dim': 1473, 'latent_dim': 33, 'beta': 1.6075666916532882, 'gamma': 0.23583091203059742, 'dropout_rate': 0.1363972403978102, 'lr': 0.0005173346056610423, 'scheduler_patience': 7, 'class_weight': 2.8395661050668584, 'activation': 'LeakyReLU', 'classification_multiplier': 14593.314081431967}. Best is trial 194 with value: 0.8103647276084949.
[I 2025-06-13 13:13:13,833] Trial 322 finished with value: 0.769506001846722 and parameters: {'hidden_dim': 1359, 'latent_dim': 32, 'beta': 1.3557614446638238, 'gamma': 0.16357722744433573, 'dropout_rate': 0.12391326172907705, 'lr': 0.0007136710278513427, 'scheduler_patience': 7, 'class_weight': 2.7519279918434174, 'activation': 'ReLU', 'classification_multiplier': 14170.398648164932}. Best is trial 194 with value: 0.8103647276084949.
