[I 2025-06-12 23:45:19,067] Trial 197 finished with value: 0.730724838411819 and parameters: {'hidden_dim': 1547, 'latent_dim': 33, 'beta': 1.629710551459782, 'gamma': 0.15226566845065187, 'dropout_rate': 0.112650783406906, 'lr': 0.0005698694156961881, 'scheduler_patience': 7, 'class_weight': 2.6724806305348383, 'activation': 'ReLU', 'classification_multiplier': 13891.694988547262}. Best is trial 194 with value: 0.8103647276084949.
              precision    recall  f1-score   support

Non-Repeater       0.24      0.99      0.39       150
    Repeater       1.00      0.71      0.83      1583

    accuracy                           0.73      1733
   macro avg       0.62      0.85      0.61      1733
weighted avg       0.93      0.73      0.79      1733

Confusion Matrix:
 [[ 148    2]
 [ 464 1119]]

=== Fold 4/5 ===
Validation Accuracy: 0.6907
Classification Report:
               precision    recall  f1-score   support

Non-Repeater       0.22      0.98      0.35       150
    Repeater       1.00      0.66      0.80      1583

    accuracy                           0.69      1733
   macro avg       0.61      0.82      0.58      1733
weighted avg       0.93      0.69      0.76      1733

Confusion Matrix:
 [[ 147    3]
 [ 533 1050]]

=== Fold 5/5 ===
Validation Accuracy: 0.7742
Classification Report:
               precision    recall  f1-score   support

Non-Repeater       0.27      0.97      0.43       149
    Repeater       1.00      0.76      0.86      1583

    accuracy                           0.77      1732
   macro avg       0.63      0.86      0.64      1732
weighted avg       0.93      0.77      0.82      1732

Confusion Matrix:
 [[ 145    4]
 [ 387 1196]]


=== Summary ===
Total False Positives: 17
Total False Negatives: 2141
Total True Positives: 5775
Total True Negatives: 731

Confusion Matrix (with duplicates):
              Non-Repeater  Repeater
Non-Repeater         731.0      17.0
Repeater            2141.0    5775.0
accuracy_score
0.7509233610341643
Trial 1: hidden_dim=1400, latent_dim=29, beta=1.7389906077829262, gamma=0.10103630475482075, dropout_rate=0.13763132605921968, lr=0.0008571378121308146, scheduler_patience=7, class_weight=2.83360184506973, activation=ReLU, classification_multiplier=13363.843235453649

=== Fold 1/5 ===
Validation Accuracy: 0.6936
Classification Report:
               precision    recall  f1-score   support

Non-Repeater       0.22      0.99      0.36       149
    Repeater       1.00      0.67      0.80      1584

    accuracy                           0.69      1733
   macro avg       0.61      0.83      0.58      1733
weighted avg       0.93      0.69      0.76      1733

Confusion Matrix:
 [[ 147    2]
 [ 529 1055]]

=== Fold 2/5 ===
Validation Accuracy: 0.8523
Classification Report:
               precision    recall  f1-score   support

Non-Repeater       0.37      0.97      0.53       150
    Repeater       1.00      0.84      0.91      1583

    accuracy                           0.85      1733
   macro avg       0.68      0.90      0.72      1733
weighted avg       0.94      0.85      0.88      1733

Confusion Matrix:
 [[ 145    5]
 [ 251 1332]]

=== Fold 3/5 ===
Validation Accuracy: 0.7432
Classification Report:
               precision    recall  f1-score   support

Non-Repeater       0.25      0.99      0.40       150
    Repeater       1.00      0.72      0.84      1583

    accuracy                           0.74      1733
   macro avg       0.63      0.86      0.62      1733
weighted avg       0.93      0.74      0.80      1733

Confusion Matrix:
 [[ 149    1]
 [ 444 1139]]

=== Fold 4/5 ===
Validation Accuracy: 0.6953
Classification Report:
               precision    recall  f1-score   support

Non-Repeater       0.22      0.99      0.36       150
    Repeater       1.00      0.67      0.80      1583

    accuracy                           0.70      1733
   macro avg       0.61      0.83      0.58      1733
weighted avg       0.93      0.70      0.76      1733

Confusion Matrix:
 [[ 148    2]
 [ 526 1057]]

=== Fold 5/5 ===
Validation Accuracy: 0.7633
Classification Report:
               precision    recall  f1-score   support

Non-Repeater       0.26      0.97      0.41       149
    Repeater       1.00      0.74      0.85      1583

    accuracy                           0.76      1732
   macro avg       0.63      0.86      0.63      1732
weighted avg       0.93      0.76      0.81      1732

Confusion Matrix:
 [[ 145    4]
 [ 406 1177]]


=== Summary ===
Total False Positives: 14
Total False Negatives: 2156
Total True Positives: 5760
Total True Negatives: 734

Confusion Matrix (with duplicates):
              Non-Repeater  Repeater
Non-Repeater         734.0      14.0
Repeater            2156.0    5760.0
accuracy_score
0.7495383194829178
Trial 1: hidden_dim=1441, latent_dim=30, beta=1.3295842307283559, gamma=0.10006797001858238, dropout_rate=0.12971069842576072, lr=0.0007099109888556801, scheduler_patience=7, class_weight=2.8036310387980063, activation=ReLU, classification_multiplier=13188.923242539231

=== Fold 1/5 ===
Validation Accuracy: 0.6815
Classification Report:
               precision    recall  f1-score   support

Non-Repeater       0.21      0.99      0.35       149
    Repeater       1.00      0.65      0.79      1584

    accuracy                           0.68      1733
   macro avg       0.61      0.82      0.57      1733
weighted avg       0.93      0.68      0.75      1733

Confusion Matrix:
 [[ 148    1]
 [ 551 1033]]

=== Fold 2/5 ===
Validation Accuracy: 0.7115
Classification Report:
               precision    recall  f1-score   support

Non-Repeater       0.23      0.99      0.37       150
    Repeater       1.00      0.68      0.81      1583

    accuracy                           0.71      1733
   macro avg       0.61      0.84      0.59      1733
weighted avg       0.93      0.71      0.77      1733

Confusion Matrix:
 [[ 149    1]
 [ 499 1084]]

=== Fold 3/5 ===
Validation Accuracy: 0.6088
Classification Report:
               precision    recall  f1-score   support

Non-Repeater       0.18      0.99      0.31       150
    Repeater       1.00      0.57      0.73      1583

    accuracy                           0.61      1733
   macro avg       0.59      0.78      0.52      1733
weighted avg       0.93      0.61      0.69      1733

Confusion Matrix:
 [[149   1]
 [677 906]]

=== Fold 4/5 ===
Validation Accuracy: 0.7790
Classification Report:
               precision    recall  f1-score   support

Non-Repeater       0.28      0.96      0.43       150
    Repeater       1.00      0.76      0.86      1583

    accuracy                           0.78      1733
   macro avg       0.64      0.86      0.65      1733
weighted avg       0.93      0.78      0.83      1733

Confusion Matrix:
 [[ 144    6]
 [ 377 1206]]

=== Fold 5/5 ===
Validation Accuracy: 0.8730
Classification Report:
               precision    recall  f1-score   support

Non-Repeater       0.40      0.98      0.57       149
    Repeater       1.00      0.86      0.93      1583

    accuracy                           0.87      1732
   macro avg       0.70      0.92      0.75      1732
weighted avg       0.95      0.87      0.89      1732

Confusion Matrix:
 [[ 146    3]
 [ 217 1366]]


=== Summary ===
Total False Positives: 12
Total False Negatives: 2321
Total True Positives: 5595
Total True Negatives: 736

Confusion Matrix (with duplicates):
              Non-Repeater  Repeater
Non-Repeater         736.0      12.0
Repeater            2321.0    5595.0
accuracy_score
0.730724838411819
Trial 1: hidden_dim=1547, latent_dim=33, beta=1.629710551459782, gamma=0.15226566845065187, dropout_rate=0.112650783406906, lr=0.0005698694156961881, scheduler_patience=7, class_weight=2.6724806305348383, activation=ReLU, classification_multiplier=13891.694988547262

=== Fold 1/5 ===
Validation Accuracy: 0.3883
Classification Report:
               precision    recall  f1-score   support

Non-Repeater       0.12      1.00      0.22       149
    Repeater       1.00      0.33      0.50      1584

    accuracy                           0.39      1733
   macro avg       0.56      0.67      0.36      1733
weighted avg       0.92      0.39      0.47      1733

Confusion Matrix:
 [[ 149    0]
 [1060  524]]

=== Fold 2/5 ===
Validation Accuracy: 0.2920
Classification Report:
 [I 2025-06-12 23:51:53,224] Trial 198 finished with value: 0.3898891966759003 and parameters: {'hidden_dim': 1474, 'latent_dim': 29, 'beta': 1.6919538506912333, 'gamma': 0.14078866189206796, 'dropout_rate': 0.14113263671379545, 'lr': 0.0009891867058151704, 'scheduler_patience': 7, 'class_weight': 2.6013136317027317, 'activation': 'ELU', 'classification_multiplier': 14447.154556723726}. Best is trial 194 with value: 0.8103647276084949.
[I 2025-06-12 23:58:18,073] Trial 199 finished with value: 0.7638504155124654 and parameters: {'hidden_dim': 1369, 'latent_dim': 31, 'beta': 1.2256317098325262, 'gamma': 0.24454647683897857, 'dropout_rate': 0.10075173073831924, 'lr': 0.0007196784218899449, 'scheduler_patience': 7, 'class_weight': 2.9201977385982745, 'activation': 'ReLU', 'classification_multiplier': 13212.64980688082}. Best is trial 194 with value: 0.8103647276084949.
[I 2025-06-13 00:04:40,743] Trial 200 finished with value: 0.7424976915974146 and parameters: {'hidden_dim': 1365, 'latent_dim': 31, 'beta': 1.2306829166636164, 'gamma': 0.2461933342237723, 'dropout_rate': 0.10290250331072935, 'lr': 0.0008430030990852035, 'scheduler_patience': 7, 'class_weight': 2.9374930156363708, 'activation': 'ReLU', 'classification_multiplier': 13380.066495341178}. Best is trial 194 with value: 0.8103647276084949.
              precision    recall  f1-score   support

Non-Repeater       0.11      1.00      0.20       150
    Repeater       1.00      0.22      0.37      1583

    accuracy                           0.29      1733
   macro avg       0.55      0.61      0.28      1733
weighted avg       0.92      0.29      0.35      1733

Confusion Matrix:
 [[ 150    0]
 [1227  356]]

=== Fold 3/5 ===
Validation Accuracy: 0.5967
Classification Report:
               precision    recall  f1-score   support

Non-Repeater       0.18      0.99      0.30       150
    Repeater       1.00      0.56      0.72      1583

    accuracy                           0.60      1733
   macro avg       0.59      0.78      0.51      1733
weighted avg       0.93      0.60      0.68      1733

Confusion Matrix:
 [[149   1]
 [698 885]]

=== Fold 4/5 ===
Validation Accuracy: 0.3231
Classification Report:
               precision    recall  f1-score   support

Non-Repeater       0.11      1.00      0.20       150
    Repeater       1.00      0.26      0.41      1583

    accuracy                           0.32      1733
   macro avg       0.56      0.63      0.31      1733
weighted avg       0.92      0.32      0.39      1733

Confusion Matrix:
 [[ 150    0]
 [1173  410]]

=== Fold 5/5 ===
Validation Accuracy: 0.3493
Classification Report:
               precision    recall  f1-score   support

Non-Repeater       0.12      1.00      0.21       149
    Repeater       1.00      0.29      0.45      1583

    accuracy                           0.35      1732
   macro avg       0.56      0.64      0.33      1732
weighted avg       0.92      0.35      0.43      1732

Confusion Matrix:
 [[ 149    0]
 [1127  456]]


=== Summary ===
Total False Positives: 1
Total False Negatives: 5285
Total True Positives: 2631
Total True Negatives: 747

Confusion Matrix (with duplicates):
              Non-Repeater  Repeater
Non-Repeater         747.0       1.0
Repeater            5285.0    2631.0
accuracy_score
0.3898891966759003
Trial 1: hidden_dim=1474, latent_dim=29, beta=1.6919538506912333, gamma=0.14078866189206796, dropout_rate=0.14113263671379545, lr=0.0009891867058151704, scheduler_patience=7, class_weight=2.6013136317027317, activation=ELU, classification_multiplier=14447.154556723726

=== Fold 1/5 ===
Validation Accuracy: 0.9054
Classification Report:
               precision    recall  f1-score   support

Non-Repeater       0.48      0.98      0.64       149
    Repeater       1.00      0.90      0.95      1584

    accuracy                           0.91      1733
   macro avg       0.74      0.94      0.79      1733
weighted avg       0.95      0.91      0.92      1733

Confusion Matrix:
 [[ 146    3]
 [ 161 1423]]

=== Fold 2/5 ===
Validation Accuracy: 0.7069
Classification Report:
               precision    recall  f1-score   support

Non-Repeater       0.23      0.99      0.37       150
    Repeater       1.00      0.68      0.81      1583

    accuracy                           0.71      1733
   macro avg       0.61      0.84      0.59      1733
weighted avg       0.93      0.71      0.77      1733

Confusion Matrix:
 [[ 149    1]
 [ 507 1076]]

=== Fold 3/5 ===
Validation Accuracy: 0.7421
Classification Report:
               precision    recall  f1-score   support

Non-Repeater       0.25      0.99      0.40       150
    Repeater       1.00      0.72      0.84      1583

    accuracy                           0.74      1733
   macro avg       0.62      0.86      0.62      1733
weighted avg       0.93      0.74      0.80      1733

Confusion Matrix:
 [[ 149    1]
 [ 446 1137]]

=== Fold 4/5 ===
Validation Accuracy: 0.6976
Classification Report:
               precision    recall  f1-score   support

Non-Repeater       0.22      0.98      0.36       150
    Repeater       1.00      0.67      0.80      1583

    accuracy                           0.70      1733
   macro avg       0.61      0.83      0.58      1733
weighted avg       0.93      0.70      0.76      1733

Confusion Matrix:
 [[ 147    3]
 [ 521 1062]]

=== Fold 5/5 ===
Validation Accuracy: 0.7673
Classification Report:
               precision    recall  f1-score   support

Non-Repeater       0.27      0.97      0.42       149
    Repeater       1.00      0.75      0.85      1583

    accuracy                           0.77      1732
   macro avg       0.63      0.86      0.64      1732
weighted avg       0.93      0.77      0.82      1732

Confusion Matrix:
 [[ 145    4]
 [ 399 1184]]


=== Summary ===
Total False Positives: 12
Total False Negatives: 2034
Total True Positives: 5882
Total True Negatives: 736

Confusion Matrix (with duplicates):
              Non-Repeater  Repeater
Non-Repeater         736.0      12.0
Repeater            2034.0    5882.0
accuracy_score
0.7638504155124654
Trial 1: hidden_dim=1369, latent_dim=31, beta=1.2256317098325262, gamma=0.24454647683897857, dropout_rate=0.10075173073831924, lr=0.0007196784218899449, scheduler_patience=7, class_weight=2.9201977385982745, activation=ReLU, classification_multiplier=13212.64980688082

=== Fold 1/5 ===
Validation Accuracy: 0.7023
Classification Report:
               precision    recall  f1-score   support

Non-Repeater       0.22      0.99      0.36       149
    Repeater       1.00      0.67      0.81      1584

    accuracy                           0.70      1733
   macro avg       0.61      0.83      0.59      1733
weighted avg       0.93      0.70      0.77      1733

Confusion Matrix:
 [[ 148    1]
 [ 515 1069]]

=== Fold 2/5 ===
Validation Accuracy: 0.7848
Classification Report:
               precision    recall  f1-score   support

Non-Repeater       0.29      0.99      0.44       150
    Repeater       1.00      0.77      0.87      1583

    accuracy                           0.78      1733
   macro avg       0.64      0.88      0.66      1733
weighted avg       0.94      0.78      0.83      1733

Confusion Matrix:
 [[ 149    1]
 [ 372 1211]]

=== Fold 3/5 ===
Validation Accuracy: 0.7178
Classification Report:
               precision    recall  f1-score   support

Non-Repeater       0.23      0.99      0.38       150
    Repeater       1.00      0.69      0.82      1583

    accuracy                           0.72      1733
   macro avg       0.62      0.84      0.60      1733
weighted avg       0.93      0.72      0.78      1733

Confusion Matrix:
 [[ 149    1]
 [ 488 1095]]

=== Fold 4/5 ===
Validation Accuracy: 0.7063
Classification Report:
               precision    recall  f1-score   support

Non-Repeater       0.22      0.97      0.36       150
    Repeater       1.00      0.68      0.81      1583

    accuracy                           0.71      1733
   macro avg       0.61      0.83      0.59      1733
weighted avg       0.93      0.71      0.77      1733

Confusion Matrix:
 [[ 146    4]
 [ 505 1078]]

=== Fold 5/5 ===
Validation Accuracy: 0.8014
Classification Report:
               precision    recall  f1-score   support

Non-Repeater       0.30      0.97      0.46       149
    Repeater       1.00      0.79      0.88      1583

    accuracy                           0.80      1732
   macro avg       0.65      0.88      0.67      1732
weighted avg       0.94      0.80      0.84      1732

Confusion Matrix:
 [[ 145    4]
 [ 340 1243]]


=== Summary ===
Total False Positives: 11
Total False Negatives: 2220
Total True Positives: 5696
Total True Negatives: 737

Confusion Matrix (with duplicates):
              Non-Repeater  Repeater
Non-Repeater         737.0      11.0
Repeater            2220.0    5696.0
accuracy_score
0.7424976915974146
Trial 1: hidden_dim=1365, latent_dim=31, beta=1.2306829166636164, gamma=0.2461933342237723, dropout_rate=0.10290250331072935, lr=0.0008430030990852035, scheduler_patience=7, class_weight=2.9374930156363708, activation=ReLU, classification_multiplier=13380.066495341178

=== Fold 1/5 ===
Validation Accuracy: 0.7530
Classification Report:
 [I 2025-06-13 00:11:08,135] Trial 201 finished with value: 0.7405355493998154 and parameters: {'hidden_dim': 1403, 'latent_dim': 30, 'beta': 1.3322382752390345, 'gamma': 0.19133413329740215, 'dropout_rate': 0.11392135509274803, 'lr': 0.0006237534383706304, 'scheduler_patience': 7, 'class_weight': 2.8308357973051796, 'activation': 'ReLU', 'classification_multiplier': 13273.058393865482}. Best is trial 194 with value: 0.8103647276084949.
