[I 2025-06-12 15:52:30,168] Trial 122 finished with value: 0.7136426592797784 and parameters: {'hidden_dim': 1073, 'latent_dim': 36, 'beta': 1.0421141096649706, 'gamma': 0.3298257418029908, 'dropout_rate': 0.21702748369188946, 'lr': 0.0009493254907504327, 'scheduler_patience': 7, 'class_weight': 1.9580641806448689, 'activation': 'ReLU', 'classification_multiplier': 9799.88989694045}. Best is trial 72 with value: 0.7479224376731302.
              Non-Repeater  Repeater
Non-Repeater         739.0       9.0
Repeater            2686.0    5230.0
accuracy_score
0.6889427516158818
Trial 1: hidden_dim=967, latent_dim=40, beta=0.9294158843809756, gamma=0.3789820598891252, dropout_rate=0.3203660074650845, lr=0.0014103429954294244, scheduler_patience=7, class_weight=1.7543294670234502, activation=ReLU, classification_multiplier=9386.64999430409

=== Fold 1/5 ===
Validation Accuracy: 0.6884
Classification Report:
               precision    recall  f1-score   support

Non-Repeater       0.21      0.99      0.35       149
    Repeater       1.00      0.66      0.79      1584

    accuracy                           0.69      1733
   macro avg       0.61      0.82      0.57      1733
weighted avg       0.93      0.69      0.76      1733

Confusion Matrix:
 [[ 147    2]
 [ 538 1046]]

=== Fold 2/5 ===
Validation Accuracy: 0.6088
Classification Report:
               precision    recall  f1-score   support

Non-Repeater       0.18      0.99      0.31       150
    Repeater       1.00      0.57      0.73      1583

    accuracy                           0.61      1733
   macro avg       0.59      0.78      0.52      1733
weighted avg       0.93      0.61      0.69      1733

Confusion Matrix:
 [[149   1]
 [677 906]]

=== Fold 3/5 ===
Validation Accuracy: 0.7559
Classification Report:
               precision    recall  f1-score   support

Non-Repeater       0.26      0.99      0.41       150
    Repeater       1.00      0.73      0.85      1583

    accuracy                           0.76      1733
   macro avg       0.63      0.86      0.63      1733
weighted avg       0.94      0.76      0.81      1733

Confusion Matrix:
 [[ 149    1]
 [ 422 1161]]

=== Fold 4/5 ===
Validation Accuracy: 0.6653
Classification Report:
               precision    recall  f1-score   support

Non-Repeater       0.20      0.99      0.34       150
    Repeater       1.00      0.63      0.78      1583

    accuracy                           0.67      1733
   macro avg       0.60      0.81      0.56      1733
weighted avg       0.93      0.67      0.74      1733

Confusion Matrix:
 [[ 149    1]
 [ 579 1004]]

=== Fold 5/5 ===
Validation Accuracy: 0.7662
Classification Report:
               precision    recall  f1-score   support

Non-Repeater       0.27      0.97      0.42       149
    Repeater       1.00      0.75      0.85      1583

    accuracy                           0.77      1732
   macro avg       0.63      0.86      0.64      1732
weighted avg       0.93      0.77      0.82      1732

Confusion Matrix:
 [[ 145    4]
 [ 401 1182]]


=== Summary ===
Total False Positives: 9
Total False Negatives: 2617
Total True Positives: 5299
Total True Negatives: 739

Confusion Matrix (with duplicates):
              Non-Repeater  Repeater
Non-Repeater         739.0       9.0
Repeater            2617.0    5299.0
accuracy_score
0.6969067405355494
Trial 1: hidden_dim=1006, latent_dim=34, beta=0.9889637660743156, gamma=0.402341608150587, dropout_rate=0.2229939432303366, lr=0.0008800277618816869, scheduler_patience=7, class_weight=1.9246734735262185, activation=ReLU, classification_multiplier=8731.57070810682

=== Fold 1/5 ===
Validation Accuracy: 0.7623
Classification Report:
               precision    recall  f1-score   support

Non-Repeater       0.26      0.94      0.40       149
    Repeater       0.99      0.75      0.85      1584

    accuracy                           0.76      1733
   macro avg       0.63      0.84      0.63      1733
weighted avg       0.93      0.76      0.81      1733

Confusion Matrix:
 [[ 140    9]
 [ 403 1181]]

=== Fold 2/5 ===
Validation Accuracy: 0.6976
Classification Report:
               precision    recall  f1-score   support

Non-Repeater       0.22      0.99      0.36       150
    Repeater       1.00      0.67      0.80      1583

    accuracy                           0.70      1733
   macro avg       0.61      0.83      0.58      1733
weighted avg       0.93      0.70      0.76      1733

Confusion Matrix:
 [[ 149    1]
 [ 523 1060]]

=== Fold 3/5 ===
Validation Accuracy: 0.6665
Classification Report:
               precision    recall  f1-score   support

Non-Repeater       0.21      0.99      0.34       150
    Repeater       1.00      0.64      0.78      1583

    accuracy                           0.67      1733
   macro avg       0.60      0.81      0.56      1733
weighted avg       0.93      0.67      0.74      1733

Confusion Matrix:
 [[ 149    1]
 [ 577 1006]]

=== Fold 4/5 ===
Validation Accuracy: 0.6844
Classification Report:
               precision    recall  f1-score   support

Non-Repeater       0.21      0.99      0.35       150
    Repeater       1.00      0.66      0.79      1583

    accuracy                           0.68      1733
   macro avg       0.61      0.82      0.57      1733
weighted avg       0.93      0.68      0.75      1733

Confusion Matrix:
 [[ 148    2]
 [ 545 1038]]

=== Fold 5/5 ===
Validation Accuracy: 0.7575
Classification Report:
               precision    recall  f1-score   support

Non-Repeater       0.26      0.98      0.41       149
    Repeater       1.00      0.74      0.85      1583

    accuracy                           0.76      1732
   macro avg       0.63      0.86      0.63      1732
weighted avg       0.93      0.76      0.81      1732

Confusion Matrix:
 [[ 146    3]
 [ 417 1166]]


=== Summary ===
Total False Positives: 16
Total False Negatives: 2465
Total True Positives: 5451
Total True Negatives: 732

Confusion Matrix (with duplicates):
              Non-Repeater  Repeater
Non-Repeater         732.0      16.0
Repeater            2465.0    5451.0
accuracy_score
0.7136426592797784
Trial 1: hidden_dim=1073, latent_dim=36, beta=1.0421141096649706, gamma=0.3298257418029908, dropout_rate=0.21702748369188946, lr=0.0009493254907504327, scheduler_patience=7, class_weight=1.9580641806448689, activation=ReLU, classification_multiplier=9799.88989694045

=== Fold 1/5 ===
Validation Accuracy: 0.1241
Classification Report:
               precision    recall  f1-score   support

Non-Repeater       0.09      0.99      0.16       149
    Repeater       0.99      0.04      0.08      1584

    accuracy                           0.12      1733
   macro avg       0.54      0.52      0.12      1733
weighted avg       0.91      0.12      0.09      1733

Confusion Matrix:
 [[ 148    1]
 [1517   67]]

=== Fold 2/5 ===
Validation Accuracy: 0.4559
Classification Report:
               precision    recall  f1-score   support

Non-Repeater       0.14      0.99      0.24       150
    Repeater       1.00      0.40      0.58      1583

    accuracy                           0.46      1733
   macro avg       0.57      0.70      0.41      1733
weighted avg       0.92      0.46      0.55      1733

Confusion Matrix:
 [[149   1]
 [942 641]]

=== Fold 3/5 ===
Validation Accuracy: 0.1760
Classification Report:
               precision    recall  f1-score   support

Non-Repeater       0.10      1.00      0.17       150
    Repeater       1.00      0.10      0.18      1583

    accuracy                           0.18      1733
   macro avg       0.55      0.55      0.18      1733
weighted avg       0.92      0.18      0.18      1733

Confusion Matrix:
 [[ 150    0]
 [1428  155]]

=== Fold 4/5 ===
Validation Accuracy: 0.6417
Classification Report:
               precision    recall  f1-score   support

Non-Repeater       0.19      1.00      0.33       150
    Repeater       1.00      0.61      0.76      1583

    accuracy                           0.64      1733
   macro avg       0.60      0.80      0.54      1733
weighted avg       0.93      0.64      0.72      1733

Confusion Matrix:
 [[150   0]
 [621 962]]

=== Fold 5/5 ===
Validation Accuracy: 0.0889
Classification Report:
               precision    recall  f1-score   support

Non-Repeater       0.09      1.00      0.16       149
    Repeater       1.00      0.00      0.01      1583

    accuracy                           0.09      1732
   macro avg       0.54      0.50      0.08      1732
weighted avg       0.92      0.09      0.02      1732

Confusion Matrix:
 [[ 149    0]
 [1578    5]]

[I 2025-06-12 15:58:26,984] Trial 123 finished with value: 0.29732225300092335 and parameters: {'hidden_dim': 1066, 'latent_dim': 37, 'beta': 1.0420329247195057, 'gamma': 0.2857098984584004, 'dropout_rate': 0.19665544309905786, 'lr': 0.004608495911495063, 'scheduler_patience': 7, 'class_weight': 2.370173020019912, 'activation': 'ReLU', 'classification_multiplier': 10119.175777245298}. Best is trial 72 with value: 0.7479224376731302.
[I 2025-06-12 16:04:45,527] Trial 124 finished with value: 0.6910203139427517 and parameters: {'hidden_dim': 1309, 'latent_dim': 38, 'beta': 1.1538430386684433, 'gamma': 0.2378773374958833, 'dropout_rate': 0.21417291119792634, 'lr': 0.001208537484687761, 'scheduler_patience': 7, 'class_weight': 1.8336860434579394, 'activation': 'ReLU', 'classification_multiplier': 9873.675415092239}. Best is trial 72 with value: 0.7479224376731302.
[I 2025-06-12 16:10:43,461] Trial 125 finished with value: 0.7137580794090489 and parameters: {'hidden_dim': 1094, 'latent_dim': 36, 'beta': 0.954920837087039, 'gamma': 0.33286702651846084, 'dropout_rate': 0.18128885945575887, 'lr': 0.0004895011456770634, 'scheduler_patience': 7, 'class_weight': 2.0527946238170234, 'activation': 'ReLU', 'classification_multiplier': 10854.154368760594}. Best is trial 72 with value: 0.7479224376731302.

=== Summary ===
Total False Positives: 2
Total False Negatives: 6086
Total True Positives: 1830
Total True Negatives: 746

Confusion Matrix (with duplicates):
              Non-Repeater  Repeater
Non-Repeater         746.0       2.0
Repeater            6086.0    1830.0
accuracy_score
0.29732225300092335
Trial 1: hidden_dim=1066, latent_dim=37, beta=1.0420329247195057, gamma=0.2857098984584004, dropout_rate=0.19665544309905786, lr=0.004608495911495063, scheduler_patience=7, class_weight=2.370173020019912, activation=ReLU, classification_multiplier=10119.175777245298

=== Fold 1/5 ===
Validation Accuracy: 0.6919
Classification Report:
               precision    recall  f1-score   support

Non-Repeater       0.22      0.99      0.36       149
    Repeater       1.00      0.66      0.80      1584

    accuracy                           0.69      1733
   macro avg       0.61      0.83      0.58      1733
weighted avg       0.93      0.69      0.76      1733

Confusion Matrix:
 [[ 148    1]
 [ 533 1051]]

=== Fold 2/5 ===
Validation Accuracy: 0.6613
Classification Report:
               precision    recall  f1-score   support

Non-Repeater       0.20      0.99      0.34       150
    Repeater       1.00      0.63      0.77      1583

    accuracy                           0.66      1733
   macro avg       0.60      0.81      0.55      1733
weighted avg       0.93      0.66      0.73      1733

Confusion Matrix:
 [[149   1]
 [586 997]]

=== Fold 3/5 ===
Validation Accuracy: 0.6815
Classification Report:
               precision    recall  f1-score   support

Non-Repeater       0.21      0.98      0.35       150
    Repeater       1.00      0.65      0.79      1583

    accuracy                           0.68      1733
   macro avg       0.60      0.82      0.57      1733
weighted avg       0.93      0.68      0.75      1733

Confusion Matrix:
 [[ 147    3]
 [ 549 1034]]

=== Fold 4/5 ===
Validation Accuracy: 0.6867
Classification Report:
               precision    recall  f1-score   support

Non-Repeater       0.22      0.99      0.35       150
    Repeater       1.00      0.66      0.79      1583

    accuracy                           0.69      1733
   macro avg       0.61      0.83      0.57      1733
weighted avg       0.93      0.69      0.76      1733

Confusion Matrix:
 [[ 149    1]
 [ 542 1041]]

=== Fold 5/5 ===
Validation Accuracy: 0.7338
Classification Report:
               precision    recall  f1-score   support

Non-Repeater       0.24      0.98      0.39       149
    Repeater       1.00      0.71      0.83      1583

    accuracy                           0.73      1732
   macro avg       0.62      0.85      0.61      1732
weighted avg       0.93      0.73      0.79      1732

Confusion Matrix:
 [[ 146    3]
 [ 458 1125]]


=== Summary ===
Total False Positives: 9
Total False Negatives: 2668
Total True Positives: 5248
Total True Negatives: 739

Confusion Matrix (with duplicates):
              Non-Repeater  Repeater
Non-Repeater         739.0       9.0
Repeater            2668.0    5248.0
accuracy_score
0.6910203139427517
Trial 1: hidden_dim=1309, latent_dim=38, beta=1.1538430386684433, gamma=0.2378773374958833, dropout_rate=0.21417291119792634, lr=0.001208537484687761, scheduler_patience=7, class_weight=1.8336860434579394, activation=ReLU, classification_multiplier=9873.675415092239

=== Fold 1/5 ===
Validation Accuracy: 0.7928
Classification Report:
               precision    recall  f1-score   support

Non-Repeater       0.29      0.98      0.45       149
    Repeater       1.00      0.78      0.87      1584

    accuracy                           0.79      1733
   macro avg       0.64      0.88      0.66      1733
weighted avg       0.94      0.79      0.84      1733

Confusion Matrix:
 [[ 146    3]
 [ 356 1228]]

=== Fold 2/5 ===
Validation Accuracy: 0.6746
Classification Report:
               precision    recall  f1-score   support

Non-Repeater       0.21      0.99      0.34       150
    Repeater       1.00      0.64      0.78      1583

    accuracy                           0.67      1733
   macro avg       0.60      0.82      0.56      1733
weighted avg       0.93      0.67      0.75      1733

Confusion Matrix:
 [[ 148    2]
 [ 562 1021]]

=== Fold 3/5 ===
Validation Accuracy: 0.6769
Classification Report:
               precision    recall  f1-score   support

Non-Repeater       0.21      0.99      0.35       150
    Repeater       1.00      0.65      0.79      1583

    accuracy                           0.68      1733
   macro avg       0.60      0.82      0.57      1733
weighted avg       0.93      0.68      0.75      1733

Confusion Matrix:
 [[ 149    1]
 [ 559 1024]]

=== Fold 4/5 ===
Validation Accuracy: 0.6642
Classification Report:
               precision    recall  f1-score   support

Non-Repeater       0.20      0.99      0.34       150
    Repeater       1.00      0.63      0.78      1583

    accuracy                           0.66      1733
   macro avg       0.60      0.81      0.56      1733
weighted avg       0.93      0.66      0.74      1733

Confusion Matrix:
 [[ 148    2]
 [ 580 1003]]

=== Fold 5/5 ===
Validation Accuracy: 0.7604
Classification Report:
               precision    recall  f1-score   support

Non-Repeater       0.26      0.97      0.41       149
    Repeater       1.00      0.74      0.85      1583

    accuracy                           0.76      1732
   macro avg       0.63      0.86      0.63      1732
weighted avg       0.93      0.76      0.81      1732

Confusion Matrix:
 [[ 145    4]
 [ 411 1172]]


=== Summary ===
Total False Positives: 12
Total False Negatives: 2468
Total True Positives: 5448
Total True Negatives: 736

Confusion Matrix (with duplicates):
              Non-Repeater  Repeater
Non-Repeater         736.0      12.0
Repeater            2468.0    5448.0
accuracy_score
0.7137580794090489
Trial 1: hidden_dim=1094, latent_dim=36, beta=0.954920837087039, gamma=0.33286702651846084, dropout_rate=0.18128885945575887, lr=0.0004895011456770634, scheduler_patience=7, class_weight=2.0527946238170234, activation=ReLU, classification_multiplier=10854.154368760594

=== Fold 1/5 ===
Validation Accuracy: 0.7161
Classification Report:
               precision    recall  f1-score   support

Non-Repeater       0.23      1.00      0.38       149
    Repeater       1.00      0.69      0.82      1584

    accuracy                           0.72      1733
   macro avg       0.62      0.84      0.60      1733
weighted avg       0.93      0.72      0.78      1733

Confusion Matrix:
 [[ 149    0]
 [ 492 1092]]

=== Fold 2/5 ===
Validation Accuracy: 0.6803
Classification Report:
               precision    recall  f1-score   support

Non-Repeater       0.21      0.99      0.35       150
    Repeater       1.00      0.65      0.79      1583

    accuracy                           0.68      1733
   macro avg       0.61      0.82      0.57      1733
weighted avg       0.93      0.68      0.75      1733

Confusion Matrix:
 [[ 149    1]
 [ 553 1030]]

=== Fold 3/5 ===
Validation Accuracy: 0.6728
Classification Report:
               precision    recall  f1-score   support

Non-Repeater       0.21      0.99      0.34       150
    Repeater       1.00      0.64      0.78      1583

    accuracy                           0.67      1733
   macro avg       0.60      0.82      0.56      1733
weighted avg       0.93      0.67      0.74      1733

Confusion Matrix:
 [[ 149    1]
 [ 566 1017]]

=== Fold 4/5 ===
Validation Accuracy: 0.6930
Classification Report:
               precision    recall  f1-score   support

Non-Repeater       0.22      0.99      0.36       150
    Repeater       1.00      0.67      0.80      1583

    accuracy                           0.69      1733
   macro avg       0.61      0.83      0.58      1733
weighted avg       0.93      0.69      0.76      1733

Confusion Matrix:
 [[ 148    2]
 [ 530 1053]]

=== Fold 5/5 ===
Validation Accuracy: 0.7564
Classification Report:
 [I 2025-06-12 16:16:41,808] Trial 126 finished with value: 0.7037165281625115 and parameters: {'hidden_dim': 1097, 'latent_dim': 35, 'beta': 1.1252998662035791, 'gamma': 0.34336195593396257, 'dropout_rate': 0.20575536442018058, 'lr': 0.0005123662527314926, 'scheduler_patience': 7, 'class_weight': 2.1459855189392574, 'activation': 'ReLU', 'classification_multiplier': 11513.79508106042}. Best is trial 72 with value: 0.7479224376731302.
[I 2025-06-12 16:22:37,714] Trial 127 finished with value: 0.48545706371191133 and parameters: {'hidden_dim': 1087, 'latent_dim': 35, 'beta': 1.1243746118226934, 'gamma': 0.3039361358571765, 'dropout_rate': 0.20743327939858314, 'lr': 0.00013590288293319192, 'scheduler_patience': 7, 'class_weight': 2.230601090820643, 'activation': 'ELU', 'classification_multiplier': 11604.833997374453}. Best is trial 72 with value: 0.7479224376731302.
