[I 2025-06-12 12:59:14,793] Trial 93 finished with value: 0.6666666666666666 and parameters: {'hidden_dim': 1260, 'latent_dim': 29, 'beta': 0.8325161453280174, 'gamma': 0.9870993152153787, 'dropout_rate': 0.1720534026032501, 'lr': 0.00040126270836489424, 'scheduler_patience': 7, 'class_weight': 1.6102469601674838, 'activation': 'ReLU', 'classification_multiplier': 7081.946268489516}. Best is trial 72 with value: 0.7479224376731302.
              precision    recall  f1-score   support

Non-Repeater       0.22      1.00      0.36       149
    Repeater       1.00      0.66      0.80      1584

    accuracy                           0.69      1733
   macro avg       0.61      0.83      0.58      1733
weighted avg       0.93      0.69      0.76      1733

Confusion Matrix:
 [[ 149    0]
 [ 534 1050]]

=== Fold 2/5 ===
Validation Accuracy: 0.6872
Classification Report:
               precision    recall  f1-score   support

Non-Repeater       0.22      0.99      0.35       150
    Repeater       1.00      0.66      0.79      1583

    accuracy                           0.69      1733
   macro avg       0.61      0.83      0.57      1733
weighted avg       0.93      0.69      0.76      1733

Confusion Matrix:
 [[ 149    1]
 [ 541 1042]]

=== Fold 3/5 ===
Validation Accuracy: 0.6503
Classification Report:
               precision    recall  f1-score   support

Non-Repeater       0.20      0.99      0.33       150
    Repeater       1.00      0.62      0.76      1583

    accuracy                           0.65      1733
   macro avg       0.60      0.80      0.55      1733
weighted avg       0.93      0.65      0.73      1733

Confusion Matrix:
 [[148   2]
 [604 979]]

=== Fold 4/5 ===
Validation Accuracy: 0.6763
Classification Report:
               precision    recall  f1-score   support

Non-Repeater       0.21      0.99      0.35       150
    Repeater       1.00      0.65      0.78      1583

    accuracy                           0.68      1733
   macro avg       0.60      0.82      0.57      1733
weighted avg       0.93      0.68      0.75      1733

Confusion Matrix:
 [[ 149    1]
 [ 560 1023]]

=== Fold 5/5 ===
Validation Accuracy: 0.7402
Classification Report:
               precision    recall  f1-score   support

Non-Repeater       0.25      0.98      0.39       149
    Repeater       1.00      0.72      0.83      1583

    accuracy                           0.74      1732
   macro avg       0.62      0.85      0.61      1732
weighted avg       0.93      0.74      0.80      1732

Confusion Matrix:
 [[ 146    3]
 [ 447 1136]]


=== Summary ===
Total False Positives: 7
Total False Negatives: 2686
Total True Positives: 5230
Total True Negatives: 741

Confusion Matrix (with duplicates):
              Non-Repeater  Repeater
Non-Repeater         741.0       7.0
Repeater            2686.0    5230.0
accuracy_score
0.689173591874423
Trial 1: hidden_dim=1371, latent_dim=31, beta=0.8093205110482926, gamma=0.9867846449227476, dropout_rate=0.17281415530211353, lr=0.0004009102471615694, scheduler_patience=7, class_weight=1.6039721768561845, activation=ReLU, classification_multiplier=7078.404474544341

=== Fold 1/5 ===
Validation Accuracy: 0.6815
Classification Report:
               precision    recall  f1-score   support

Non-Repeater       0.21      0.99      0.35       149
    Repeater       1.00      0.65      0.79      1584

    accuracy                           0.68      1733
   macro avg       0.61      0.82      0.57      1733
weighted avg       0.93      0.68      0.75      1733

Confusion Matrix:
 [[ 148    1]
 [ 551 1033]]

=== Fold 2/5 ===
Validation Accuracy: 0.6809
Classification Report:
               precision    recall  f1-score   support

Non-Repeater       0.21      0.99      0.35       150
    Repeater       1.00      0.65      0.79      1583

    accuracy                           0.68      1733
   macro avg       0.61      0.82      0.57      1733
weighted avg       0.93      0.68      0.75      1733

Confusion Matrix:
 [[ 149    1]
 [ 552 1031]]

=== Fold 3/5 ===
Validation Accuracy: 0.6313
Classification Report:
               precision    recall  f1-score   support

Non-Repeater       0.19      0.99      0.32       150
    Repeater       1.00      0.60      0.75      1583

    accuracy                           0.63      1733
   macro avg       0.59      0.80      0.53      1733
weighted avg       0.93      0.63      0.71      1733

Confusion Matrix:
 [[149   1]
 [638 945]]

=== Fold 4/5 ===
Validation Accuracy: 0.6347
Classification Report:
               precision    recall  f1-score   support

Non-Repeater       0.19      0.99      0.32       150
    Repeater       1.00      0.60      0.75      1583

    accuracy                           0.63      1733
   macro avg       0.59      0.79      0.53      1733
weighted avg       0.93      0.63      0.71      1733

Confusion Matrix:
 [[148   2]
 [631 952]]

=== Fold 5/5 ===
Validation Accuracy: 0.7050
Classification Report:
               precision    recall  f1-score   support

Non-Repeater       0.22      0.97      0.36       149
    Repeater       1.00      0.68      0.81      1583

    accuracy                           0.70      1732
   macro avg       0.61      0.83      0.59      1732
weighted avg       0.93      0.70      0.77      1732

Confusion Matrix:
 [[ 145    4]
 [ 507 1076]]


=== Summary ===
Total False Positives: 9
Total False Negatives: 2879
Total True Positives: 5037
Total True Negatives: 739

Confusion Matrix (with duplicates):
              Non-Repeater  Repeater
Non-Repeater         739.0       9.0
Repeater            2879.0    5037.0
accuracy_score
0.6666666666666666
Trial 1: hidden_dim=1260, latent_dim=29, beta=0.8325161453280174, gamma=0.9870993152153787, dropout_rate=0.1720534026032501, lr=0.00040126270836489424, scheduler_patience=7, class_weight=1.6102469601674838, activation=ReLU, classification_multiplier=7081.946268489516

=== Fold 1/5 ===
Validation Accuracy: 0.5193
Classification Report:
               precision    recall  f1-score   support

Non-Repeater       0.15      0.99      0.26       149
    Repeater       1.00      0.47      0.64      1584

    accuracy                           0.52      1733
   macro avg       0.57      0.73      0.45      1733
weighted avg       0.93      0.52      0.61      1733

Confusion Matrix:
 [[148   1]
 [832 752]]

=== Fold 2/5 ===
Validation Accuracy: 0.7028
Classification Report:
               precision    recall  f1-score   support

Non-Repeater       0.22      0.99      0.37       150
    Repeater       1.00      0.68      0.81      1583

    accuracy                           0.70      1733
   macro avg       0.61      0.83      0.59      1733
weighted avg       0.93      0.70      0.77      1733

Confusion Matrix:
 [[ 149    1]
 [ 514 1069]]

=== Fold 3/5 ===
Validation Accuracy: 0.7323
Classification Report:
               precision    recall  f1-score   support

Non-Repeater       0.24      0.99      0.39       150
    Repeater       1.00      0.71      0.83      1583

    accuracy                           0.73      1733
   macro avg       0.62      0.85      0.61      1733
weighted avg       0.93      0.73      0.79      1733

Confusion Matrix:
 [[ 148    2]
 [ 462 1121]]

=== Fold 4/5 ===
Validation Accuracy: 0.6642
Classification Report:
               precision    recall  f1-score   support

Non-Repeater       0.20      0.99      0.34       150
    Repeater       1.00      0.63      0.78      1583

    accuracy                           0.66      1733
   macro avg       0.60      0.81      0.56      1733
weighted avg       0.93      0.66      0.74      1733

Confusion Matrix:
 [[ 148    2]
 [ 580 1003]]

=== Fold 5/5 ===
Validation Accuracy: 0.7350
Classification Report:
               precision    recall  f1-score   support

Non-Repeater       0.24      0.97      0.39       149
    Repeater       1.00      0.71      0.83      1583

    accuracy                           0.73      1732
   macro avg       0.62      0.84      0.61      1732
weighted avg       0.93      0.73      0.79      1732

Confusion Matrix:
 [[ 145    4]
 [ 455 1128]]


=== Summary ===
Total False Positives: 10
Total False Negatives: 2843
Total True Positives: 5073
Total True Negatives: 738

Confusion Matrix (with duplicates):
              Non-Repeater  Repeater
Non-Repeater         738.0      10.0
Repeater            2843.0    5073.0
accuracy_score
0.6707063711911357
[I 2025-06-12 13:05:12,191] Trial 94 finished with value: 0.6707063711911357 and parameters: {'hidden_dim': 1103, 'latent_dim': 26, 'beta': 0.6080266838774274, 'gamma': 0.8114143885347506, 'dropout_rate': 0.1979648318671019, 'lr': 0.0006591947813753846, 'scheduler_patience': 7, 'class_weight': 1.850245667738191, 'activation': 'ReLU', 'classification_multiplier': 7990.513764940266}. Best is trial 72 with value: 0.7479224376731302.
[I 2025-06-12 13:11:28,086] Trial 95 finished with value: 0.7108725761772853 and parameters: {'hidden_dim': 1301, 'latent_dim': 30, 'beta': 0.8964906110231992, 'gamma': 0.4435163980794485, 'dropout_rate': 0.14709502628135998, 'lr': 0.0003501826871301862, 'scheduler_patience': 7, 'class_weight': 1.7429329421882294, 'activation': 'ReLU', 'classification_multiplier': 6739.25400563391}. Best is trial 72 with value: 0.7479224376731302.
[I 2025-06-12 13:17:44,321] Trial 96 finished with value: 0.6986380424746076 and parameters: {'hidden_dim': 1306, 'latent_dim': 33, 'beta': 0.9220194763664795, 'gamma': 0.4630339360443776, 'dropout_rate': 0.16408569108232485, 'lr': 0.0011003270416779052, 'scheduler_patience': 7, 'class_weight': 1.7981886016647106, 'activation': 'ReLU', 'classification_multiplier': 6806.595992357133}. Best is trial 72 with value: 0.7479224376731302.
Trial 1: hidden_dim=1103, latent_dim=26, beta=0.6080266838774274, gamma=0.8114143885347506, dropout_rate=0.1979648318671019, lr=0.0006591947813753846, scheduler_patience=7, class_weight=1.850245667738191, activation=ReLU, classification_multiplier=7990.513764940266

=== Fold 1/5 ===
Validation Accuracy: 0.7092
Classification Report:
               precision    recall  f1-score   support

Non-Repeater       0.23      0.99      0.37       149
    Repeater       1.00      0.68      0.81      1584

    accuracy                           0.71      1733
   macro avg       0.61      0.84      0.59      1733
weighted avg       0.93      0.71      0.77      1733

Confusion Matrix:
 [[ 148    1]
 [ 503 1081]]

=== Fold 2/5 ===
Validation Accuracy: 0.6809
Classification Report:
               precision    recall  f1-score   support

Non-Repeater       0.21      0.99      0.35       150
    Repeater       1.00      0.65      0.79      1583

    accuracy                           0.68      1733
   macro avg       0.61      0.82      0.57      1733
weighted avg       0.93      0.68      0.75      1733

Confusion Matrix:
 [[ 149    1]
 [ 552 1031]]

=== Fold 3/5 ===
Validation Accuracy: 0.7415
Classification Report:
               precision    recall  f1-score   support

Non-Repeater       0.25      0.99      0.40       150
    Repeater       1.00      0.72      0.84      1583

    accuracy                           0.74      1733
   macro avg       0.62      0.86      0.62      1733
weighted avg       0.93      0.74      0.80      1733

Confusion Matrix:
 [[ 149    1]
 [ 447 1136]]

=== Fold 4/5 ===
Validation Accuracy: 0.6722
Classification Report:
               precision    recall  f1-score   support

Non-Repeater       0.21      0.99      0.34       150
    Repeater       1.00      0.64      0.78      1583

    accuracy                           0.67      1733
   macro avg       0.60      0.81      0.56      1733
weighted avg       0.93      0.67      0.74      1733

Confusion Matrix:
 [[ 148    2]
 [ 566 1017]]

=== Fold 5/5 ===
Validation Accuracy: 0.7506
Classification Report:
               precision    recall  f1-score   support

Non-Repeater       0.25      0.98      0.40       149
    Repeater       1.00      0.73      0.84      1583

    accuracy                           0.75      1732
   macro avg       0.63      0.85      0.62      1732
weighted avg       0.93      0.75      0.80      1732

Confusion Matrix:
 [[ 146    3]
 [ 429 1154]]


=== Summary ===
Total False Positives: 8
Total False Negatives: 2497
Total True Positives: 5419
Total True Negatives: 740

Confusion Matrix (with duplicates):
              Non-Repeater  Repeater
Non-Repeater         740.0       8.0
Repeater            2497.0    5419.0
accuracy_score
0.7108725761772853
Trial 1: hidden_dim=1301, latent_dim=30, beta=0.8964906110231992, gamma=0.4435163980794485, dropout_rate=0.14709502628135998, lr=0.0003501826871301862, scheduler_patience=7, class_weight=1.7429329421882294, activation=ReLU, classification_multiplier=6739.25400563391

=== Fold 1/5 ===
Validation Accuracy: 0.7415
Classification Report:
               precision    recall  f1-score   support

Non-Repeater       0.25      0.97      0.39       149
    Repeater       1.00      0.72      0.84      1584

    accuracy                           0.74      1733
   macro avg       0.62      0.84      0.61      1733
weighted avg       0.93      0.74      0.80      1733

Confusion Matrix:
 [[ 144    5]
 [ 443 1141]]

=== Fold 2/5 ===
Validation Accuracy: 0.5436
Classification Report:
               precision    recall  f1-score   support

Non-Repeater       0.16      0.99      0.27       150
    Repeater       1.00      0.50      0.67      1583

    accuracy                           0.54      1733
   macro avg       0.58      0.75      0.47      1733
weighted avg       0.93      0.54      0.63      1733

Confusion Matrix:
 [[149   1]
 [790 793]]

=== Fold 3/5 ===
Validation Accuracy: 0.7178
Classification Report:
               precision    recall  f1-score   support

Non-Repeater       0.23      0.99      0.38       150
    Repeater       1.00      0.69      0.82      1583

    accuracy                           0.72      1733
   macro avg       0.62      0.84      0.60      1733
weighted avg       0.93      0.72      0.78      1733

Confusion Matrix:
 [[ 149    1]
 [ 488 1095]]

=== Fold 4/5 ===
Validation Accuracy: 0.6705
Classification Report:
               precision    recall  f1-score   support

Non-Repeater       0.21      0.99      0.34       150
    Repeater       1.00      0.64      0.78      1583

    accuracy                           0.67      1733
   macro avg       0.60      0.81      0.56      1733
weighted avg       0.93      0.67      0.74      1733

Confusion Matrix:
 [[ 148    2]
 [ 569 1014]]

=== Fold 5/5 ===
Validation Accuracy: 0.8199
Classification Report:
               precision    recall  f1-score   support

Non-Repeater       0.32      0.97      0.48       149
    Repeater       1.00      0.81      0.89      1583

    accuracy                           0.82      1732
   macro avg       0.66      0.89      0.69      1732
weighted avg       0.94      0.82      0.86      1732

Confusion Matrix:
 [[ 144    5]
 [ 307 1276]]


=== Summary ===
Total False Positives: 14
Total False Negatives: 2597
Total True Positives: 5319
Total True Negatives: 734

Confusion Matrix (with duplicates):
              Non-Repeater  Repeater
Non-Repeater         734.0      14.0
Repeater            2597.0    5319.0
accuracy_score
0.6986380424746076
Trial 1: hidden_dim=1306, latent_dim=33, beta=0.9220194763664795, gamma=0.4630339360443776, dropout_rate=0.16408569108232485, lr=0.0011003270416779052, scheduler_patience=7, class_weight=1.7981886016647106, activation=ReLU, classification_multiplier=6806.595992357133

=== Fold 1/5 ===
Validation Accuracy: 0.6492
Classification Report:
               precision    recall  f1-score   support

Non-Repeater       0.20      0.99      0.33       149
    Repeater       1.00      0.62      0.76      1584

    accuracy                           0.65      1733
   macro avg       0.60      0.80      0.54      1733
weighted avg       0.93      0.65      0.73      1733

Confusion Matrix:
 [[147   2]
 [606 978]]

=== Fold 2/5 ===
Validation Accuracy: 0.6821
Classification Report:
               precision    recall  f1-score   support

Non-Repeater       0.21      0.99      0.35       150
    Repeater       1.00      0.65      0.79      1583

    accuracy                           0.68      1733
   macro avg       0.61      0.82      0.57      1733
weighted avg       0.93      0.68      0.75      1733

Confusion Matrix:
 [[ 149    1]
 [ 550 1033]]

=== Fold 3/5 ===
Validation Accuracy: 0.5874
Classification Report:
               precision    recall  f1-score   support

Non-Repeater       0.17      0.99      0.29       150
    Repeater       1.00      0.55      0.71      1583

    accuracy                           0.59      1733
   macro avg       0.59      0.77      0.50      1733
weighted avg       0.93      0.59      0.67      1733

Confusion Matrix:
 [[149   1]
 [714 869]]

=== Fold 4/5 ===
Validation Accuracy: 0.6971
Classification Report:
               precision    recall  f1-score   support

Non-Repeater       0.22      0.99      0.36       150
    Repeater       1.00      0.67      0.80      1583

    accuracy                           0.70      1733
   macro avg       0.61      0.83      0.58      1733
weighted avg       0.93      0.70      0.76      1733

Confusion Matrix:
 [[ 149    1]
 [ 524 1059]]

=== Fold 5/5 ===
Validation Accuracy: 0.5052
Classification Report:
               precision    recall  f1-score   support

Non-Repeater       0.15      0.99      0.26       149
    Repeater       1.00      0.46      0.63      1583

    accuracy                           0.51      1732
   macro avg       0.57      0.73      0.44      1732
weighted avg       0.93      0.51      0.60      1732

Confusion Matrix:
 [[148   1]
 [856 727]]


=== Summary ===
Total False Positives: 6
Total False Negatives: 3250
Total True Positives: 4666
Total True Negatives: 742
[I 2025-06-12 13:24:05,159] Trial 97 finished with value: 0.6241920590951062 and parameters: {'hidden_dim': 1355, 'latent_dim': 36, 'beta': 1.018797796197837, 'gamma': 0.445982762539079, 'dropout_rate': 0.16175159351095225, 'lr': 0.0012159392992142591, 'scheduler_patience': 7, 'class_weight': 1.7439653725084894, 'activation': 'ReLU', 'classification_multiplier': 6792.96335406335}. Best is trial 72 with value: 0.7479224376731302.
[I 2025-06-12 13:30:33,862] Trial 98 finished with value: 0.6266158818097877 and parameters: {'hidden_dim': 1440, 'latent_dim': 33, 'beta': 0.9213278898220622, 'gamma': 0.5350670221012713, 'dropout_rate': 0.14718430032946184, 'lr': 0.0021012640553297003, 'scheduler_patience': 7, 'class_weight': 2.160235888654759, 'activation': 'ReLU', 'classification_multiplier': 6341.583945804083}. Best is trial 72 with value: 0.7479224376731302.
