[I 2025-06-12 08:56:17,501] Trial 53 finished with value: 0.6248845798707294 and parameters: {'hidden_dim': 941, 'latent_dim': 28, 'beta': 1.5791739943951617, 'gamma': 1.5649869711493511, 'dropout_rate': 0.2428616272584163, 'lr': 0.00045392669795697363, 'scheduler_patience': 4, 'class_weight': 2.878499101063543, 'activation': 'ReLU', 'classification_multiplier': 7846.8165795014265}. Best is trial 22 with value: 0.7070637119113573.
              Non-Repeater  Repeater
Non-Repeater         740.0       8.0
Repeater            3057.0    4859.0
accuracy_score
0.6462373037857803
Trial 1: hidden_dim=1156, latent_dim=27, beta=1.690147826047832, gamma=1.8172053126232277, dropout_rate=0.272812573236661, lr=0.0005430191459810267, scheduler_patience=6, class_weight=2.396880415483235, activation=ReLU, classification_multiplier=14169.722673838067

=== Fold 1/5 ===
Validation Accuracy: 0.5713
Classification Report:
               precision    recall  f1-score   support

Non-Repeater       0.16      0.98      0.28       149
    Repeater       1.00      0.53      0.69      1584

    accuracy                           0.57      1733
   macro avg       0.58      0.76      0.49      1733
weighted avg       0.92      0.57      0.66      1733

Confusion Matrix:
 [[146   3]
 [740 844]]

=== Fold 2/5 ===
Validation Accuracy: 0.5568
Classification Report:
               precision    recall  f1-score   support

Non-Repeater       0.16      1.00      0.28       150
    Repeater       1.00      0.51      0.68      1583

    accuracy                           0.56      1733
   macro avg       0.58      0.76      0.48      1733
weighted avg       0.93      0.56      0.65      1733

Confusion Matrix:
 [[150   0]
 [768 815]]

=== Fold 3/5 ===
Validation Accuracy: 0.5828
Classification Report:
               precision    recall  f1-score   support

Non-Repeater       0.17      0.99      0.29       150
    Repeater       1.00      0.54      0.70      1583

    accuracy                           0.58      1733
   macro avg       0.58      0.77      0.50      1733
weighted avg       0.93      0.58      0.67      1733

Confusion Matrix:
 [[149   1]
 [722 861]]

=== Fold 4/5 ===
Validation Accuracy: 0.5730
Classification Report:
               precision    recall  f1-score   support

Non-Repeater       0.17      0.99      0.29       150
    Repeater       1.00      0.53      0.70      1583

    accuracy                           0.57      1733
   macro avg       0.58      0.76      0.49      1733
weighted avg       0.93      0.57      0.66      1733

Confusion Matrix:
 [[149   1]
 [739 844]]

=== Fold 5/5 ===
Validation Accuracy: 0.2968
Classification Report:
               precision    recall  f1-score   support

Non-Repeater       0.11      1.00      0.20       149
    Repeater       1.00      0.23      0.37      1583

    accuracy                           0.30      1732
   macro avg       0.55      0.62      0.29      1732
weighted avg       0.92      0.30      0.36      1732

Confusion Matrix:
 [[ 149    0]
 [1218  365]]


=== Summary ===
Total False Positives: 5
Total False Negatives: 4187
Total True Positives: 3729
Total True Negatives: 743

Confusion Matrix (with duplicates):
              Non-Repeater  Repeater
Non-Repeater         743.0       5.0
Repeater            4187.0    3729.0
accuracy_score
0.5161588180978762
Trial 1: hidden_dim=1018, latent_dim=30, beta=1.8072566913865673, gamma=1.6412375966929467, dropout_rate=0.3369052188130296, lr=0.0014850530088400837, scheduler_patience=6, class_weight=0.6433761121544104, activation=ReLU, classification_multiplier=11345.68267161218

=== Fold 1/5 ===
Validation Accuracy: 0.6538
Classification Report:
               precision    recall  f1-score   support

Non-Repeater       0.20      0.99      0.33       149
    Repeater       1.00      0.62      0.77      1584

    accuracy                           0.65      1733
   macro avg       0.60      0.81      0.55      1733
weighted avg       0.93      0.65      0.73      1733

Confusion Matrix:
 [[148   1]
 [599 985]]

=== Fold 2/5 ===
Validation Accuracy: 0.5909
Classification Report:
               precision    recall  f1-score   support

Non-Repeater       0.17      0.99      0.30       150
    Repeater       1.00      0.55      0.71      1583

    accuracy                           0.59      1733
   macro avg       0.59      0.77      0.50      1733
weighted avg       0.93      0.59      0.68      1733

Confusion Matrix:
 [[149   1]
 [708 875]]

=== Fold 3/5 ===
Validation Accuracy: 0.6111
Classification Report:
               precision    recall  f1-score   support

Non-Repeater       0.18      0.99      0.31       150
    Repeater       1.00      0.58      0.73      1583

    accuracy                           0.61      1733
   macro avg       0.59      0.78      0.52      1733
weighted avg       0.93      0.61      0.69      1733

Confusion Matrix:
 [[148   2]
 [672 911]]

=== Fold 4/5 ===
Validation Accuracy: 0.5793
Classification Report:
               precision    recall  f1-score   support

Non-Repeater       0.17      0.99      0.29       150
    Repeater       1.00      0.54      0.70      1583

    accuracy                           0.58      1733
   macro avg       0.58      0.76      0.50      1733
weighted avg       0.93      0.58      0.67      1733

Confusion Matrix:
 [[148   2]
 [727 856]]

=== Fold 5/5 ===
Validation Accuracy: 0.6894
Classification Report:
               precision    recall  f1-score   support

Non-Repeater       0.22      0.99      0.35       149
    Repeater       1.00      0.66      0.80      1583

    accuracy                           0.69      1732
   macro avg       0.61      0.82      0.57      1732
weighted avg       0.93      0.69      0.76      1732

Confusion Matrix:
 [[ 147    2]
 [ 536 1047]]


=== Summary ===
Total False Positives: 8
Total False Negatives: 3242
Total True Positives: 4674
Total True Negatives: 740

Confusion Matrix (with duplicates):
              Non-Repeater  Repeater
Non-Repeater         740.0       8.0
Repeater            3242.0    4674.0
accuracy_score
0.6248845798707294
Trial 1: hidden_dim=941, latent_dim=28, beta=1.5791739943951617, gamma=1.5649869711493511, dropout_rate=0.2428616272584163, lr=0.00045392669795697363, scheduler_patience=4, class_weight=2.878499101063543, activation=ReLU, classification_multiplier=7846.8165795014265

=== Fold 1/5 ===
Validation Accuracy: 0.5972
Classification Report:
               precision    recall  f1-score   support

Non-Repeater       0.17      0.99      0.30       149
    Repeater       1.00      0.56      0.72      1584

    accuracy                           0.60      1733
   macro avg       0.59      0.77      0.51      1733
weighted avg       0.93      0.60      0.68      1733

Confusion Matrix:
 [[147   2]
 [696 888]]

=== Fold 2/5 ===
Validation Accuracy: 0.5043
Classification Report:
               precision    recall  f1-score   support

Non-Repeater       0.15      0.99      0.26       150
    Repeater       1.00      0.46      0.63      1583

    accuracy                           0.50      1733
   macro avg       0.57      0.73      0.44      1733
weighted avg       0.92      0.50      0.60      1733

Confusion Matrix:
 [[149   1]
 [858 725]]

=== Fold 3/5 ===
Validation Accuracy: 0.4212
Classification Report:
               precision    recall  f1-score   support

Non-Repeater       0.13      1.00      0.23       150
    Repeater       1.00      0.37      0.54      1583

    accuracy                           0.42      1733
   macro avg       0.57      0.68      0.38      1733
weighted avg       0.92      0.42      0.51      1733

Confusion Matrix:
 [[ 150    0]
 [1003  580]]

=== Fold 4/5 ===
Validation Accuracy: 0.6734
Classification Report:
               precision    recall  f1-score   support

Non-Repeater       0.21      0.99      0.34       150
    Repeater       1.00      0.64      0.78      1583

    accuracy                           0.67      1733
   macro avg       0.60      0.82      0.56      1733
weighted avg       0.93      0.67      0.74      1733

Confusion Matrix:
 [[ 148    2]
 [ 564 1019]]

=== Fold 5/5 ===
Validation Accuracy: 0.6091
Classification Report:
               precision    recall  f1-score   support

Non-Repeater       0.18      0.99      0.30       149
    Repeater       1.00      0.57      0.73      1583

    accuracy                           0.61      1732
   macro avg       0.59      0.78      0.52      1732
weighted avg       0.93      0.61      0.69      1732

Confusion Matrix:
 [[148   1]
 [676 907]]


=== Summary ===
[I 2025-06-12 09:02:37,279] Trial 54 finished with value: 0.5610572483841182 and parameters: {'hidden_dim': 1331, 'latent_dim': 23, 'beta': 1.4607191330230458, 'gamma': 0.38236821739642457, 'dropout_rate': 0.16692921450842152, 'lr': 0.0022591650644284205, 'scheduler_patience': 6, 'class_weight': 1.4985301140894423, 'activation': 'ReLU', 'classification_multiplier': 7455.15126634895}. Best is trial 22 with value: 0.7070637119113573.
[I 2025-06-12 09:08:33,626] Trial 55 finished with value: 0.5996075715604802 and parameters: {'hidden_dim': 1060, 'latent_dim': 27, 'beta': 1.274221413457074, 'gamma': 0.7825683244507298, 'dropout_rate': 0.11962773448297348, 'lr': 0.001194825439652704, 'scheduler_patience': 5, 'class_weight': 0.25068575398837467, 'activation': 'ReLU', 'classification_multiplier': 6640.4927521483}. Best is trial 22 with value: 0.7070637119113573.
[I 2025-06-12 09:14:42,749] Trial 56 finished with value: 0.6562788550323176 and parameters: {'hidden_dim': 1215, 'latent_dim': 25, 'beta': 1.9856711220599115, 'gamma': 0.6780563971645598, 'dropout_rate': 0.2934964111563552, 'lr': 0.00017423887021387755, 'scheduler_patience': 7, 'class_weight': 2.7899179478253613, 'activation': 'ReLU', 'classification_multiplier': 10351.093807438872}. Best is trial 22 with value: 0.7070637119113573.
Total False Positives: 6
Total False Negatives: 3797
Total True Positives: 4119
Total True Negatives: 742

Confusion Matrix (with duplicates):
              Non-Repeater  Repeater
Non-Repeater         742.0       6.0
Repeater            3797.0    4119.0
accuracy_score
0.5610572483841182
Trial 1: hidden_dim=1331, latent_dim=23, beta=1.4607191330230458, gamma=0.38236821739642457, dropout_rate=0.16692921450842152, lr=0.0022591650644284205, scheduler_patience=6, class_weight=1.4985301140894423, activation=ReLU, classification_multiplier=7455.15126634895

=== Fold 1/5 ===
Validation Accuracy: 0.6342
Classification Report:
               precision    recall  f1-score   support

Non-Repeater       0.19      0.98      0.32       149
    Repeater       1.00      0.60      0.75      1584

    accuracy                           0.63      1733
   macro avg       0.59      0.79      0.53      1733
weighted avg       0.93      0.63      0.71      1733

Confusion Matrix:
 [[146   3]
 [631 953]]

=== Fold 2/5 ===
Validation Accuracy: 0.5263
Classification Report:
               precision    recall  f1-score   support

Non-Repeater       0.15      1.00      0.27       150
    Repeater       1.00      0.48      0.65      1583

    accuracy                           0.53      1733
   macro avg       0.58      0.74      0.46      1733
weighted avg       0.93      0.53      0.62      1733

Confusion Matrix:
 [[150   0]
 [821 762]]

=== Fold 3/5 ===
Validation Accuracy: 0.5903
Classification Report:
               precision    recall  f1-score   support

Non-Repeater       0.17      0.99      0.30       150
    Repeater       1.00      0.55      0.71      1583

    accuracy                           0.59      1733
   macro avg       0.59      0.77      0.50      1733
weighted avg       0.93      0.59      0.68      1733

Confusion Matrix:
 [[149   1]
 [709 874]]

=== Fold 4/5 ===
Validation Accuracy: 0.5649
Classification Report:
               precision    recall  f1-score   support

Non-Repeater       0.17      1.00      0.28       150
    Repeater       1.00      0.52      0.69      1583

    accuracy                           0.56      1733
   macro avg       0.58      0.76      0.49      1733
weighted avg       0.93      0.56      0.65      1733

Confusion Matrix:
 [[150   0]
 [754 829]]

=== Fold 5/5 ===
Validation Accuracy: 0.6824
Classification Report:
               precision    recall  f1-score   support

Non-Repeater       0.21      0.99      0.35       149
    Repeater       1.00      0.65      0.79      1583

    accuracy                           0.68      1732
   macro avg       0.61      0.82      0.57      1732
weighted avg       0.93      0.68      0.75      1732

Confusion Matrix:
 [[ 148    1]
 [ 549 1034]]


=== Summary ===
Total False Positives: 5
Total False Negatives: 3464
Total True Positives: 4452
Total True Negatives: 743

Confusion Matrix (with duplicates):
              Non-Repeater  Repeater
Non-Repeater         743.0       5.0
Repeater            3464.0    4452.0
accuracy_score
0.5996075715604802
Trial 1: hidden_dim=1060, latent_dim=27, beta=1.274221413457074, gamma=0.7825683244507298, dropout_rate=0.11962773448297348, lr=0.001194825439652704, scheduler_patience=5, class_weight=0.25068575398837467, activation=ReLU, classification_multiplier=6640.4927521483

=== Fold 1/5 ===
Validation Accuracy: 0.6780
Classification Report:
               precision    recall  f1-score   support

Non-Repeater       0.21      1.00      0.35       149
    Repeater       1.00      0.65      0.79      1584

    accuracy                           0.68      1733
   macro avg       0.61      0.82      0.57      1733
weighted avg       0.93      0.68      0.75      1733

Confusion Matrix:
 [[ 149    0]
 [ 558 1026]]

=== Fold 2/5 ===
Validation Accuracy: 0.6769
Classification Report:
               precision    recall  f1-score   support

Non-Repeater       0.21      0.99      0.35       150
    Repeater       1.00      0.65      0.79      1583

    accuracy                           0.68      1733
   macro avg       0.60      0.82      0.57      1733
weighted avg       0.93      0.68      0.75      1733

Confusion Matrix:
 [[ 149    1]
 [ 559 1024]]

=== Fold 3/5 ===
Validation Accuracy: 0.6249
Classification Report:
               precision    recall  f1-score   support

Non-Repeater       0.19      0.99      0.31       150
    Repeater       1.00      0.59      0.74      1583

    accuracy                           0.62      1733
   macro avg       0.59      0.79      0.53      1733
weighted avg       0.93      0.62      0.70      1733

Confusion Matrix:
 [[149   1]
 [649 934]]

=== Fold 4/5 ===
Validation Accuracy: 0.5724
Classification Report:
               precision    recall  f1-score   support

Non-Repeater       0.17      0.99      0.29       150
    Repeater       1.00      0.53      0.69      1583

    accuracy                           0.57      1733
   macro avg       0.58      0.76      0.49      1733
weighted avg       0.93      0.57      0.66      1733

Confusion Matrix:
 [[149   1]
 [740 843]]

=== Fold 5/5 ===
Validation Accuracy: 0.7292
Classification Report:
               precision    recall  f1-score   support

Non-Repeater       0.24      0.97      0.38       149
    Repeater       1.00      0.71      0.83      1583

    accuracy                           0.73      1732
   macro avg       0.62      0.84      0.60      1732
weighted avg       0.93      0.73      0.79      1732

Confusion Matrix:
 [[ 145    4]
 [ 465 1118]]


=== Summary ===
Total False Positives: 7
Total False Negatives: 2971
Total True Positives: 4945
Total True Negatives: 741

Confusion Matrix (with duplicates):
              Non-Repeater  Repeater
Non-Repeater         741.0       7.0
Repeater            2971.0    4945.0
accuracy_score
0.6562788550323176
Trial 1: hidden_dim=1215, latent_dim=25, beta=1.9856711220599115, gamma=0.6780563971645598, dropout_rate=0.2934964111563552, lr=0.00017423887021387755, scheduler_patience=7, class_weight=2.7899179478253613, activation=ReLU, classification_multiplier=10351.093807438872

=== Fold 1/5 ===
Validation Accuracy: 0.4328
Classification Report:
               precision    recall  f1-score   support

Non-Repeater       0.13      0.99      0.23       149
    Repeater       1.00      0.38      0.55      1584

    accuracy                           0.43      1733
   macro avg       0.56      0.69      0.39      1733
weighted avg       0.92      0.43      0.52      1733

Confusion Matrix:
 [[148   1]
 [982 602]]

=== Fold 2/5 ===
Validation Accuracy: 0.4639
Classification Report:
               precision    recall  f1-score   support

Non-Repeater       0.14      0.99      0.24       150
    Repeater       1.00      0.41      0.59      1583

    accuracy                           0.46      1733
   macro avg       0.57      0.70      0.41      1733
weighted avg       0.92      0.46      0.56      1733

Confusion Matrix:
 [[149   1]
 [928 655]]

=== Fold 3/5 ===
Validation Accuracy: 0.3122
Classification Report:
               precision    recall  f1-score   support

Non-Repeater       0.11      1.00      0.20       150
    Repeater       1.00      0.25      0.40      1583

    accuracy                           0.31      1733
   macro avg       0.56      0.62      0.30      1733
weighted avg       0.92      0.31      0.38      1733

Confusion Matrix:
 [[ 150    0]
 [1192  391]]

=== Fold 4/5 ===
Validation Accuracy: 0.2147
Classification Report:
               precision    recall  f1-score   support

Non-Repeater       0.10      1.00      0.18       150
    Repeater       1.00      0.14      0.25      1583

    accuracy                           0.21      1733
   macro avg       0.55      0.57      0.21      1733
weighted avg       0.92      0.21      0.24      1733

Confusion Matrix:
 [[ 150    0]
 [1361  222]]

=== Fold 5/5 ===
Validation Accuracy: 0.3430
Classification Report:
 [I 2025-06-12 09:21:23,055] Trial 57 finished with value: 0.35330101569713757 and parameters: {'hidden_dim': 1560, 'latent_dim': 22, 'beta': 1.827024767401523, 'gamma': 0.553568312846068, 'dropout_rate': 0.206996213163356, 'lr': 0.002437250921689319, 'scheduler_patience': 6, 'class_weight': 1.9446989519198694, 'activation': 'GELU', 'classification_multiplier': 8109.806134350672}. Best is trial 22 with value: 0.7070637119113573.
[I 2025-06-12 09:27:04,075] Trial 58 finished with value: 0.40812557710064634 and parameters: {'hidden_dim': 881, 'latent_dim': 30, 'beta': 0.6557608212587428, 'gamma': 1.901907235046619, 'dropout_rate': 0.26063722544458007, 'lr': 0.0017725566305421274, 'scheduler_patience': 3, 'class_weight': 2.1805714386820956, 'activation': 'LeakyReLU', 'classification_multiplier': 10830.302658257937}. Best is trial 22 with value: 0.7070637119113573.
