[I 2025-06-13 13:19:35,014] Trial 323 finished with value: 0.7015235457063712 and parameters: {'hidden_dim': 1356, 'latent_dim': 34, 'beta': 1.3594353018347733, 'gamma': 0.10042136330034493, 'dropout_rate': 0.12264990574424599, 'lr': 0.0012917196841217469, 'scheduler_patience': 7, 'class_weight': 2.6660853716653286, 'activation': 'ReLU', 'classification_multiplier': 14207.838008083665}. Best is trial 194 with value: 0.8103647276084949.

Confusion Matrix (with duplicates):
              Non-Repeater  Repeater
Non-Repeater         741.0       7.0
Repeater            2992.0    4924.0
accuracy_score
0.6538550323176362
Trial 1: hidden_dim=1473, latent_dim=33, beta=1.6075666916532882, gamma=0.23583091203059742, dropout_rate=0.1363972403978102, lr=0.0005173346056610423, scheduler_patience=7, class_weight=2.8395661050668584, activation=LeakyReLU, classification_multiplier=14593.314081431967

=== Fold 1/5 ===
Validation Accuracy: 0.6751
Classification Report:
               precision    recall  f1-score   support

Non-Repeater       0.21      0.99      0.34       149
    Repeater       1.00      0.65      0.78      1584

    accuracy                           0.68      1733
   macro avg       0.60      0.82      0.56      1733
weighted avg       0.93      0.68      0.75      1733

Confusion Matrix:
 [[ 148    1]
 [ 562 1022]]

=== Fold 2/5 ===
Validation Accuracy: 0.8788
Classification Report:
               precision    recall  f1-score   support

Non-Repeater       0.41      0.97      0.58       150
    Repeater       1.00      0.87      0.93      1583

    accuracy                           0.88      1733
   macro avg       0.71      0.92      0.76      1733
weighted avg       0.95      0.88      0.90      1733

Confusion Matrix:
 [[ 146    4]
 [ 206 1377]]

=== Fold 3/5 ===
Validation Accuracy: 0.7819
Classification Report:
               precision    recall  f1-score   support

Non-Repeater       0.28      0.95      0.43       150
    Repeater       0.99      0.77      0.87      1583

    accuracy                           0.78      1733
   macro avg       0.64      0.86      0.65      1733
weighted avg       0.93      0.78      0.83      1733

Confusion Matrix:
 [[ 143    7]
 [ 371 1212]]

=== Fold 4/5 ===
Validation Accuracy: 0.7380
Classification Report:
               precision    recall  f1-score   support

Non-Repeater       0.25      0.99      0.39       150
    Repeater       1.00      0.71      0.83      1583

    accuracy                           0.74      1733
   macro avg       0.62      0.85      0.61      1733
weighted avg       0.93      0.74      0.79      1733

Confusion Matrix:
 [[ 148    2]
 [ 452 1131]]

=== Fold 5/5 ===
Validation Accuracy: 0.7737
Classification Report:
               precision    recall  f1-score   support

Non-Repeater       0.27      0.97      0.43       149
    Repeater       1.00      0.75      0.86      1583

    accuracy                           0.77      1732
   macro avg       0.63      0.86      0.64      1732
weighted avg       0.93      0.77      0.82      1732

Confusion Matrix:
 [[ 145    4]
 [ 388 1195]]


=== Summary ===
Total False Positives: 18
Total False Negatives: 1979
Total True Positives: 5937
Total True Negatives: 730

Confusion Matrix (with duplicates):
              Non-Repeater  Repeater
Non-Repeater         730.0      18.0
Repeater            1979.0    5937.0
accuracy_score
0.769506001846722
Trial 1: hidden_dim=1359, latent_dim=32, beta=1.3557614446638238, gamma=0.16357722744433573, dropout_rate=0.12391326172907705, lr=0.0007136710278513427, scheduler_patience=7, class_weight=2.7519279918434174, activation=ReLU, classification_multiplier=14170.398648164932

=== Fold 1/5 ===
Validation Accuracy: 0.6861
Classification Report:
               precision    recall  f1-score   support

Non-Repeater       0.21      0.99      0.35       149
    Repeater       1.00      0.66      0.79      1584

    accuracy                           0.69      1733
   macro avg       0.61      0.83      0.57      1733
weighted avg       0.93      0.69      0.75      1733

Confusion Matrix:
 [[ 148    1]
 [ 543 1041]]

=== Fold 2/5 ===
Validation Accuracy: 0.5338
Classification Report:
               precision    recall  f1-score   support

Non-Repeater       0.16      1.00      0.27       150
    Repeater       1.00      0.49      0.66      1583

    accuracy                           0.53      1733
   macro avg       0.58      0.74      0.46      1733
weighted avg       0.93      0.53      0.62      1733

Confusion Matrix:
 [[150   0]
 [808 775]]

=== Fold 3/5 ===
Validation Accuracy: 0.7548
Classification Report:
               precision    recall  f1-score   support

Non-Repeater       0.26      0.97      0.41       150
    Repeater       1.00      0.73      0.85      1583

    accuracy                           0.75      1733
   macro avg       0.63      0.85      0.63      1733
weighted avg       0.93      0.75      0.81      1733

Confusion Matrix:
 [[ 146    4]
 [ 421 1162]]

=== Fold 4/5 ===
Validation Accuracy: 0.6572
Classification Report:
               precision    recall  f1-score   support

Non-Repeater       0.20      0.99      0.33       150
    Repeater       1.00      0.63      0.77      1583

    accuracy                           0.66      1733
   macro avg       0.60      0.81      0.55      1733
weighted avg       0.93      0.66      0.73      1733

Confusion Matrix:
 [[149   1]
 [593 990]]

=== Fold 5/5 ===
Validation Accuracy: 0.8759
Classification Report:
               precision    recall  f1-score   support

Non-Repeater       0.39      0.81      0.53       149
    Repeater       0.98      0.88      0.93      1583

    accuracy                           0.88      1732
   macro avg       0.69      0.85      0.73      1732
weighted avg       0.93      0.88      0.89      1732

Confusion Matrix:
 [[ 121   28]
 [ 187 1396]]


=== Summary ===
Total False Positives: 34
Total False Negatives: 2552
Total True Positives: 5364
Total True Negatives: 714

Confusion Matrix (with duplicates):
              Non-Repeater  Repeater
Non-Repeater         714.0      34.0
Repeater            2552.0    5364.0
accuracy_score
0.7015235457063712
Trial 1: hidden_dim=1356, latent_dim=34, beta=1.3594353018347733, gamma=0.10042136330034493, dropout_rate=0.12264990574424599, lr=0.0012917196841217469, scheduler_patience=7, class_weight=2.6660853716653286, activation=ReLU, classification_multiplier=14207.838008083665

=== Fold 1/5 ===
Validation Accuracy: 0.6901
Classification Report:
               precision    recall  f1-score   support

Non-Repeater       0.22      0.99      0.36       149
    Repeater       1.00      0.66      0.80      1584

    accuracy                           0.69      1733
   macro avg       0.61      0.83      0.58      1733
weighted avg       0.93      0.69      0.76      1733

Confusion Matrix:
 [[ 148    1]
 [ 536 1048]]

=== Fold 2/5 ===
Validation Accuracy: 0.5788
Classification Report:
               precision    recall  f1-score   support

Non-Repeater       0.17      1.00      0.29       150
    Repeater       1.00      0.54      0.70      1583

    accuracy                           0.58      1733
   macro avg       0.59      0.77      0.50      1733
weighted avg       0.93      0.58      0.66      1733

Confusion Matrix:
 [[150   0]
 [730 853]]

=== Fold 3/5 ===
Validation Accuracy: 0.7536
Classification Report:
               precision    recall  f1-score   support

Non-Repeater       0.26      0.99      0.41       150
    Repeater       1.00      0.73      0.84      1583

    accuracy                           0.75      1733
   macro avg       0.63      0.86      0.63      1733
weighted avg       0.93      0.75      0.81      1733

Confusion Matrix:
 [[ 148    2]
 [ 425 1158]]

=== Fold 4/5 ===
Validation Accuracy: 0.7565
Classification Report:
               precision    recall  f1-score   support

Non-Repeater       0.26      0.99      0.41       150
    Repeater       1.00      0.73      0.85      1583

    accuracy                           0.76      1733
   macro avg       0.63      0.86      0.63      1733
weighted avg       0.93      0.76      0.81      1733

Confusion Matrix:
 [[ 148    2]
 [ 420 1163]]

=== Fold 5/5 ===
Validation Accuracy: 0.8909
Classification Report:
 [I 2025-06-13 13:26:02,721] Trial 324 finished with value: 0.7339566020313942 and parameters: {'hidden_dim': 1389, 'latent_dim': 31, 'beta': 1.2594133983857239, 'gamma': 0.10008280676815096, 'dropout_rate': 0.10724078906911191, 'lr': 0.0008635073770518125, 'scheduler_patience': 7, 'class_weight': 2.7391329017507076, 'activation': 'ReLU', 'classification_multiplier': 14336.133116724437}. Best is trial 194 with value: 0.8103647276084949.
[I 2025-06-13 13:32:22,674] Trial 325 finished with value: 0.5393582640812558 and parameters: {'hidden_dim': 1334, 'latent_dim': 32, 'beta': 0.26674598386064463, 'gamma': 0.27141956612460294, 'dropout_rate': 0.1270044495888384, 'lr': 0.0007578238370080232, 'scheduler_patience': 7, 'class_weight': 2.789309328878207, 'activation': 'ELU', 'classification_multiplier': 14808.777931588169}. Best is trial 194 with value: 0.8103647276084949.
[I 2025-06-13 13:38:40,551] Trial 326 finished with value: 0.7741228070175439 and parameters: {'hidden_dim': 1294, 'latent_dim': 35, 'beta': 1.342311723458656, 'gamma': 0.15400172024830935, 'dropout_rate': 0.11670256641564991, 'lr': 0.00045369008546467486, 'scheduler_patience': 7, 'class_weight': 2.716512330263941, 'activation': 'ReLU', 'classification_multiplier': 12658.783668212445}. Best is trial 194 with value: 0.8103647276084949.
              precision    recall  f1-score   support

Non-Repeater       0.44      0.96      0.60       149
    Repeater       1.00      0.88      0.94      1583

    accuracy                           0.89      1732
   macro avg       0.72      0.92      0.77      1732
weighted avg       0.95      0.89      0.91      1732

Confusion Matrix:
 [[ 143    6]
 [ 183 1400]]


=== Summary ===
Total False Positives: 11
Total False Negatives: 2294
Total True Positives: 5622
Total True Negatives: 737

Confusion Matrix (with duplicates):
              Non-Repeater  Repeater
Non-Repeater         737.0      11.0
Repeater            2294.0    5622.0
accuracy_score
0.7339566020313942
Trial 1: hidden_dim=1389, latent_dim=31, beta=1.2594133983857239, gamma=0.10008280676815096, dropout_rate=0.10724078906911191, lr=0.0008635073770518125, scheduler_patience=7, class_weight=2.7391329017507076, activation=ReLU, classification_multiplier=14336.133116724437

=== Fold 1/5 ===
Validation Accuracy: 0.4737
Classification Report:
               precision    recall  f1-score   support

Non-Repeater       0.14      1.00      0.25       149
    Repeater       1.00      0.42      0.60      1584

    accuracy                           0.47      1733
   macro avg       0.57      0.71      0.42      1733
weighted avg       0.93      0.47      0.57      1733

Confusion Matrix:
 [[149   0]
 [912 672]]

=== Fold 2/5 ===
Validation Accuracy: 0.4622
Classification Report:
               precision    recall  f1-score   support

Non-Repeater       0.14      0.99      0.24       150
    Repeater       1.00      0.41      0.58      1583

    accuracy                           0.46      1733
   macro avg       0.57      0.70      0.41      1733
weighted avg       0.92      0.46      0.55      1733

Confusion Matrix:
 [[149   1]
 [931 652]]

=== Fold 3/5 ===
Validation Accuracy: 0.5915
Classification Report:
               precision    recall  f1-score   support

Non-Repeater       0.17      0.99      0.30       150
    Repeater       1.00      0.55      0.71      1583

    accuracy                           0.59      1733
   macro avg       0.59      0.77      0.50      1733
weighted avg       0.93      0.59      0.68      1733

Confusion Matrix:
 [[149   1]
 [707 876]]

=== Fold 4/5 ===
Validation Accuracy: 0.4876
Classification Report:
               precision    recall  f1-score   support

Non-Repeater       0.14      0.97      0.25       150
    Repeater       0.99      0.44      0.61      1583

    accuracy                           0.49      1733
   macro avg       0.57      0.71      0.43      1733
weighted avg       0.92      0.49      0.58      1733

Confusion Matrix:
 [[146   4]
 [884 699]]

=== Fold 5/5 ===
Validation Accuracy: 0.6819
Classification Report:
               precision    recall  f1-score   support

Non-Repeater       0.21      0.98      0.35       149
    Repeater       1.00      0.65      0.79      1583

    accuracy                           0.68      1732
   macro avg       0.60      0.82      0.57      1732
weighted avg       0.93      0.68      0.75      1732

Confusion Matrix:
 [[ 146    3]
 [ 548 1035]]


=== Summary ===
Total False Positives: 9
Total False Negatives: 3982
Total True Positives: 3934
Total True Negatives: 739

Confusion Matrix (with duplicates):
              Non-Repeater  Repeater
Non-Repeater         739.0       9.0
Repeater            3982.0    3934.0
accuracy_score
0.5393582640812558
Trial 1: hidden_dim=1334, latent_dim=32, beta=0.26674598386064463, gamma=0.27141956612460294, dropout_rate=0.1270044495888384, lr=0.0007578238370080232, scheduler_patience=7, class_weight=2.789309328878207, activation=ELU, classification_multiplier=14808.777931588169

=== Fold 1/5 ===
Validation Accuracy: 0.7023
Classification Report:
               precision    recall  f1-score   support

Non-Repeater       0.22      0.99      0.36       149
    Repeater       1.00      0.68      0.81      1584

    accuracy                           0.70      1733
   macro avg       0.61      0.83      0.58      1733
weighted avg       0.93      0.70      0.77      1733

Confusion Matrix:
 [[ 147    2]
 [ 514 1070]]

=== Fold 2/5 ===
Validation Accuracy: 0.8379
Classification Report:
               precision    recall  f1-score   support

Non-Repeater       0.35      0.99      0.51       150
    Repeater       1.00      0.82      0.90      1583

    accuracy                           0.84      1733
   macro avg       0.67      0.91      0.71      1733
weighted avg       0.94      0.84      0.87      1733

Confusion Matrix:
 [[ 149    1]
 [ 280 1303]]

=== Fold 3/5 ===
Validation Accuracy: 0.7703
Classification Report:
               precision    recall  f1-score   support

Non-Repeater       0.27      0.99      0.43       150
    Repeater       1.00      0.75      0.86      1583

    accuracy                           0.77      1733
   macro avg       0.64      0.87      0.64      1733
weighted avg       0.94      0.77      0.82      1733

Confusion Matrix:
 [[ 149    1]
 [ 397 1186]]

=== Fold 4/5 ===
Validation Accuracy: 0.6982
Classification Report:
               precision    recall  f1-score   support

Non-Repeater       0.22      0.99      0.36       150
    Repeater       1.00      0.67      0.80      1583

    accuracy                           0.70      1733
   macro avg       0.61      0.83      0.58      1733
weighted avg       0.93      0.70      0.76      1733

Confusion Matrix:
 [[ 148    2]
 [ 521 1062]]

=== Fold 5/5 ===
Validation Accuracy: 0.8620
Classification Report:
               precision    recall  f1-score   support

Non-Repeater       0.38      0.97      0.55       149
    Repeater       1.00      0.85      0.92      1583

    accuracy                           0.86      1732
   macro avg       0.69      0.91      0.73      1732
weighted avg       0.94      0.86      0.89      1732

Confusion Matrix:
 [[ 145    4]
 [ 235 1348]]


=== Summary ===
Total False Positives: 10
Total False Negatives: 1947
Total True Positives: 5969
Total True Negatives: 738

Confusion Matrix (with duplicates):
              Non-Repeater  Repeater
Non-Repeater         738.0      10.0
Repeater            1947.0    5969.0
accuracy_score
0.7741228070175439
Trial 1: hidden_dim=1294, latent_dim=35, beta=1.342311723458656, gamma=0.15400172024830935, dropout_rate=0.11670256641564991, lr=0.00045369008546467486, scheduler_patience=7, class_weight=2.716512330263941, activation=ReLU, classification_multiplier=12658.783668212445

=== Fold 1/5 ===
Validation Accuracy: 0.7680
Classification Report:
               precision    recall  f1-score   support

Non-Repeater       0.27      0.99      0.42       149
    Repeater       1.00      0.75      0.85      1584

    accuracy                           0.77      1733
   macro avg       0.63      0.87      0.64      1733
weighted avg       0.94      0.77      0.82      1733

Confusion Matrix:
 [[ 148    1]
 [ 401 1183]]

=== Fold 2/5 ===
Validation Accuracy: 0.7374
Classification Report:
               precision    recall  f1-score   support

Non-Repeater       0.25      0.99      0.40       150
    Repeater       1.00      0.71      0.83      1583

    accuracy                           0.74      1733
   macro avg       0.62      0.85      0.61      1733
weighted avg       0.93      0.74      0.79      1733

Confusion Matrix:
 [[ 149    1]
 [ 454 1129]]

=== Fold 3/5 ===
Validation Accuracy: 0.7386
Classification Report:
               precision    recall  f1-score   support

Non-Repeater       0.25      0.99      0.40       150
    Repeater       1.00      0.72      0.83      1583

    accuracy                           0.74      1733
   macro avg       0.62      0.85      0.61      1733
weighted avg       0.93      0.74      0.80      1733

Confusion Matrix:
 [[ 148    2]
 [ 451 1132]]

=== Fold 4/5 ===
Validation Accuracy: 0.7807
Classification Report:
 [I 2025-06-13 13:45:11,691] Trial 327 finished with value: 0.7542705447830101 and parameters: {'hidden_dim': 1415, 'latent_dim': 31, 'beta': 1.3055332506661885, 'gamma': 0.1523744724372827, 'dropout_rate': 0.11441605687879448, 'lr': 0.0009969039321924506, 'scheduler_patience': 7, 'class_weight': 2.729333612390072, 'activation': 'ReLU', 'classification_multiplier': 13035.910097349737}. Best is trial 194 with value: 0.8103647276084949.
[I 2025-06-13 13:51:34,079] Trial 328 finished with value: 0.7651200369344414 and parameters: {'hidden_dim': 1364, 'latent_dim': 35, 'beta': 1.3374349356793827, 'gamma': 0.18536866320826004, 'dropout_rate': 0.1188595396585104, 'lr': 0.00043096482090811854, 'scheduler_patience': 7, 'class_weight': 2.8010824816072963, 'activation': 'ReLU', 'classification_multiplier': 12574.790760650125}. Best is trial 194 with value: 0.8103647276084949.
