[I 2025-06-12 17:03:46,917] Trial 134 finished with value: 0.6439289012003694 and parameters: {'hidden_dim': 971, 'latent_dim': 40, 'beta': 1.1763706808690233, 'gamma': 0.38232941180730745, 'dropout_rate': 0.20140312516540454, 'lr': 0.00010879941780801185, 'scheduler_patience': 7, 'class_weight': 2.067775923380028, 'activation': 'ReLU', 'classification_multiplier': 11494.69998939143}. Best is trial 72 with value: 0.7479224376731302.
              precision    recall  f1-score   support

Non-Repeater       0.19      0.99      0.32       150
    Repeater       1.00      0.61      0.76      1583

    accuracy                           0.64      1733
   macro avg       0.60      0.80      0.54      1733
weighted avg       0.93      0.64      0.72      1733

Confusion Matrix:
 [[148   2]
 [616 967]]

=== Fold 4/5 ===
Validation Accuracy: 0.6515
Classification Report:
               precision    recall  f1-score   support

Non-Repeater       0.20      0.99      0.33       150
    Repeater       1.00      0.62      0.76      1583

    accuracy                           0.65      1733
   macro avg       0.60      0.80      0.55      1733
weighted avg       0.93      0.65      0.73      1733

Confusion Matrix:
 [[148   2]
 [602 981]]

=== Fold 5/5 ===
Validation Accuracy: 0.7893
Classification Report:
               precision    recall  f1-score   support

Non-Repeater       0.29      0.97      0.44       149
    Repeater       1.00      0.77      0.87      1583

    accuracy                           0.79      1732
   macro avg       0.64      0.87      0.66      1732
weighted avg       0.93      0.79      0.83      1732

Confusion Matrix:
 [[ 144    5]
 [ 360 1223]]


=== Summary ===
Total False Positives: 11
Total False Negatives: 2659
Total True Positives: 5257
Total True Negatives: 737

Confusion Matrix (with duplicates):
              Non-Repeater  Repeater
Non-Repeater         737.0      11.0
Repeater            2659.0    5257.0
accuracy_score
0.6918282548476454
Trial 1: hidden_dim=1198, latent_dim=37, beta=1.0240887671248768, gamma=0.35535810520772193, dropout_rate=0.24586141432275976, lr=0.0004332468134883199, scheduler_patience=7, class_weight=2.2729372398323564, activation=ReLU, classification_multiplier=10683.405888721623

=== Fold 1/5 ===
Validation Accuracy: 0.6855
Classification Report:
               precision    recall  f1-score   support

Non-Repeater       0.21      0.99      0.35       149
    Repeater       1.00      0.66      0.79      1584

    accuracy                           0.69      1733
   macro avg       0.61      0.82      0.57      1733
weighted avg       0.93      0.69      0.75      1733

Confusion Matrix:
 [[ 148    1]
 [ 544 1040]]

=== Fold 2/5 ===
Validation Accuracy: 0.7017
Classification Report:
               precision    recall  f1-score   support

Non-Repeater       0.22      0.99      0.37       150
    Repeater       1.00      0.67      0.80      1583

    accuracy                           0.70      1733
   macro avg       0.61      0.83      0.59      1733
weighted avg       0.93      0.70      0.77      1733

Confusion Matrix:
 [[ 149    1]
 [ 516 1067]]

=== Fold 3/5 ===
Validation Accuracy: 0.6763
Classification Report:
               precision    recall  f1-score   support

Non-Repeater       0.21      0.99      0.35       150
    Repeater       1.00      0.65      0.78      1583

    accuracy                           0.68      1733
   macro avg       0.60      0.82      0.57      1733
weighted avg       0.93      0.68      0.75      1733

Confusion Matrix:
 [[ 149    1]
 [ 560 1023]]

=== Fold 4/5 ===
Validation Accuracy: 0.6486
Classification Report:
               precision    recall  f1-score   support

Non-Repeater       0.20      0.99      0.33       150
    Repeater       1.00      0.62      0.76      1583

    accuracy                           0.65      1733
   macro avg       0.60      0.80      0.54      1733
weighted avg       0.93      0.65      0.72      1733

Confusion Matrix:
 [[148   2]
 [607 976]]

=== Fold 5/5 ===
Validation Accuracy: 0.7431
Classification Report:
               precision    recall  f1-score   support

Non-Repeater       0.25      0.98      0.40       149
    Repeater       1.00      0.72      0.84      1583

    accuracy                           0.74      1732
   macro avg       0.62      0.85      0.62      1732
weighted avg       0.93      0.74      0.80      1732

Confusion Matrix:
 [[ 146    3]
 [ 442 1141]]


=== Summary ===
Total False Positives: 8
Total False Negatives: 2669
Total True Positives: 5247
Total True Negatives: 740

Confusion Matrix (with duplicates):
              Non-Repeater  Repeater
Non-Repeater         740.0       8.0
Repeater            2669.0    5247.0
accuracy_score
0.6910203139427517
Trial 1: hidden_dim=1113, latent_dim=38, beta=1.061463357622354, gamma=0.32753226527859397, dropout_rate=0.21963617688379516, lr=0.0005463536068554023, scheduler_patience=7, class_weight=2.136422371331808, activation=ReLU, classification_multiplier=12135.658765850825

=== Fold 1/5 ===
Validation Accuracy: 0.6751
Classification Report:
               precision    recall  f1-score   support

Non-Repeater       0.21      1.00      0.35       149
    Repeater       1.00      0.64      0.78      1584

    accuracy                           0.68      1733
   macro avg       0.60      0.82      0.56      1733
weighted avg       0.93      0.68      0.75      1733

Confusion Matrix:
 [[ 149    0]
 [ 563 1021]]

=== Fold 2/5 ===
Validation Accuracy: 0.5943
Classification Report:
               precision    recall  f1-score   support

Non-Repeater       0.18      0.99      0.30       150
    Repeater       1.00      0.56      0.71      1583

    accuracy                           0.59      1733
   macro avg       0.59      0.77      0.51      1733
weighted avg       0.93      0.59      0.68      1733

Confusion Matrix:
 [[149   1]
 [702 881]]

=== Fold 3/5 ===
Validation Accuracy: 0.6301
Classification Report:
               precision    recall  f1-score   support

Non-Repeater       0.19      0.99      0.32       150
    Repeater       1.00      0.60      0.75      1583

    accuracy                           0.63      1733
   macro avg       0.59      0.79      0.53      1733
weighted avg       0.93      0.63      0.71      1733

Confusion Matrix:
 [[149   1]
 [640 943]]

=== Fold 4/5 ===
Validation Accuracy: 0.6215
Classification Report:
               precision    recall  f1-score   support

Non-Repeater       0.19      0.99      0.31       150
    Repeater       1.00      0.59      0.74      1583

    accuracy                           0.62      1733
   macro avg       0.59      0.79      0.53      1733
weighted avg       0.93      0.62      0.70      1733

Confusion Matrix:
 [[149   1]
 [655 928]]

=== Fold 5/5 ===
Validation Accuracy: 0.6986
Classification Report:
               precision    recall  f1-score   support

Non-Repeater       0.22      0.99      0.36       149
    Repeater       1.00      0.67      0.80      1583

    accuracy                           0.70      1732
   macro avg       0.61      0.83      0.58      1732
weighted avg       0.93      0.70      0.76      1732

Confusion Matrix:
 [[ 147    2]
 [ 520 1063]]


=== Summary ===
Total False Positives: 5
Total False Negatives: 3080
Total True Positives: 4836
Total True Negatives: 743

Confusion Matrix (with duplicates):
              Non-Repeater  Repeater
Non-Repeater         743.0       5.0
Repeater            3080.0    4836.0
accuracy_score
0.6439289012003694
Trial 1: hidden_dim=971, latent_dim=40, beta=1.1763706808690233, gamma=0.38232941180730745, dropout_rate=0.20140312516540454, lr=0.00010879941780801185, scheduler_patience=7, class_weight=2.067775923380028, activation=ReLU, classification_multiplier=11494.69998939143

=== Fold 1/5 ===
Validation Accuracy: 0.6774
Classification Report:
               precision    recall  f1-score   support

Non-Repeater       0.21      0.99      0.35       149
    Repeater       1.00      0.65      0.79      1584

    accuracy                           0.68      1733
   macro avg       0.60      0.82      0.57      1733
weighted avg       0.93      0.68      0.75      1733

Confusion Matrix:
 [[ 148    1]
 [ 558 1026]]

=== Fold 2/5 ===
Validation Accuracy: 0.6699
Classification Report:
 [I 2025-06-12 17:09:41,454] Trial 135 finished with value: 0.6869806094182825 and parameters: {'hidden_dim': 1043, 'latent_dim': 37, 'beta': 0.8473697460270041, 'gamma': 0.4316281189963057, 'dropout_rate': 0.18066047860957316, 'lr': 0.0008002864198826806, 'scheduler_patience': 7, 'class_weight': 2.357920521889498, 'activation': 'ReLU', 'classification_multiplier': 11254.301175319384}. Best is trial 72 with value: 0.7479224376731302.
[I 2025-06-12 17:15:39,280] Trial 136 finished with value: 0.6935595567867036 and parameters: {'hidden_dim': 1098, 'latent_dim': 39, 'beta': 0.9940465625358922, 'gamma': 0.49883288024651734, 'dropout_rate': 0.21329894059426444, 'lr': 0.00037430156921049423, 'scheduler_patience': 7, 'class_weight': 2.4684822958310555, 'activation': 'ReLU', 'classification_multiplier': 12755.144199549213}. Best is trial 72 with value: 0.7479224376731302.
[I 2025-06-12 17:21:50,940] Trial 137 finished with value: 0.7225300092336103 and parameters: {'hidden_dim': 1236, 'latent_dim': 35, 'beta': 1.2286559286653818, 'gamma': 0.1302834373736056, 'dropout_rate': 0.23784674585674442, 'lr': 0.0008958952735205378, 'scheduler_patience': 7, 'class_weight': 1.9492677066039692, 'activation': 'ReLU', 'classification_multiplier': 14413.876033444261}. Best is trial 72 with value: 0.7479224376731302.
              precision    recall  f1-score   support

Non-Repeater       0.21      0.99      0.34       150
    Repeater       1.00      0.64      0.78      1583

    accuracy                           0.67      1733
   macro avg       0.60      0.82      0.56      1733
weighted avg       0.93      0.67      0.74      1733

Confusion Matrix:
 [[ 149    1]
 [ 571 1012]]

=== Fold 3/5 ===
Validation Accuracy: 0.7132
Classification Report:
               precision    recall  f1-score   support

Non-Repeater       0.23      0.99      0.37       150
    Repeater       1.00      0.69      0.81      1583

    accuracy                           0.71      1733
   macro avg       0.62      0.84      0.59      1733
weighted avg       0.93      0.71      0.78      1733

Confusion Matrix:
 [[ 149    1]
 [ 496 1087]]

=== Fold 4/5 ===
Validation Accuracy: 0.6746
Classification Report:
               precision    recall  f1-score   support

Non-Repeater       0.21      0.99      0.34       150
    Repeater       1.00      0.64      0.78      1583

    accuracy                           0.67      1733
   macro avg       0.60      0.82      0.56      1733
weighted avg       0.93      0.67      0.75      1733

Confusion Matrix:
 [[ 148    2]
 [ 562 1021]]

=== Fold 5/5 ===
Validation Accuracy: 0.6998
Classification Report:
               precision    recall  f1-score   support

Non-Repeater       0.22      0.99      0.36       149
    Repeater       1.00      0.67      0.80      1583

    accuracy                           0.70      1732
   macro avg       0.61      0.83      0.58      1732
weighted avg       0.93      0.70      0.77      1732

Confusion Matrix:
 [[ 147    2]
 [ 518 1065]]


=== Summary ===
Total False Positives: 7
Total False Negatives: 2705
Total True Positives: 5211
Total True Negatives: 741

Confusion Matrix (with duplicates):
              Non-Repeater  Repeater
Non-Repeater         741.0       7.0
Repeater            2705.0    5211.0
accuracy_score
0.6869806094182825
Trial 1: hidden_dim=1043, latent_dim=37, beta=0.8473697460270041, gamma=0.4316281189963057, dropout_rate=0.18066047860957316, lr=0.0008002864198826806, scheduler_patience=7, class_weight=2.357920521889498, activation=ReLU, classification_multiplier=11254.301175319384

=== Fold 1/5 ===
Validation Accuracy: 0.6884
Classification Report:
               precision    recall  f1-score   support

Non-Repeater       0.22      0.99      0.35       149
    Repeater       1.00      0.66      0.79      1584

    accuracy                           0.69      1733
   macro avg       0.61      0.83      0.57      1733
weighted avg       0.93      0.69      0.76      1733

Confusion Matrix:
 [[ 148    1]
 [ 539 1045]]

=== Fold 2/5 ===
Validation Accuracy: 0.7369
Classification Report:
               precision    recall  f1-score   support

Non-Repeater       0.25      0.99      0.39       150
    Repeater       1.00      0.71      0.83      1583

    accuracy                           0.74      1733
   macro avg       0.62      0.85      0.61      1733
weighted avg       0.93      0.74      0.79      1733

Confusion Matrix:
 [[ 148    2]
 [ 454 1129]]

=== Fold 3/5 ===
Validation Accuracy: 0.6699
Classification Report:
               precision    recall  f1-score   support

Non-Repeater       0.21      0.99      0.34       150
    Repeater       1.00      0.64      0.78      1583

    accuracy                           0.67      1733
   macro avg       0.60      0.82      0.56      1733
weighted avg       0.93      0.67      0.74      1733

Confusion Matrix:
 [[ 149    1]
 [ 571 1012]]

=== Fold 4/5 ===
Validation Accuracy: 0.6549
Classification Report:
               precision    recall  f1-score   support

Non-Repeater       0.20      0.99      0.33       150
    Repeater       1.00      0.62      0.77      1583

    accuracy                           0.65      1733
   macro avg       0.60      0.81      0.55      1733
weighted avg       0.93      0.65      0.73      1733

Confusion Matrix:
 [[149   1]
 [597 986]]

=== Fold 5/5 ===
Validation Accuracy: 0.7177
Classification Report:
               precision    recall  f1-score   support

Non-Repeater       0.23      0.97      0.37       149
    Repeater       1.00      0.69      0.82      1583

    accuracy                           0.72      1732
   macro avg       0.61      0.83      0.60      1732
weighted avg       0.93      0.72      0.78      1732

Confusion Matrix:
 [[ 145    4]
 [ 485 1098]]


=== Summary ===
Total False Positives: 9
Total False Negatives: 2646
Total True Positives: 5270
Total True Negatives: 739

Confusion Matrix (with duplicates):
              Non-Repeater  Repeater
Non-Repeater         739.0       9.0
Repeater            2646.0    5270.0
accuracy_score
0.6935595567867036
Trial 1: hidden_dim=1098, latent_dim=39, beta=0.9940465625358922, gamma=0.49883288024651734, dropout_rate=0.21329894059426444, lr=0.00037430156921049423, scheduler_patience=7, class_weight=2.4684822958310555, activation=ReLU, classification_multiplier=12755.144199549213

=== Fold 1/5 ===
Validation Accuracy: 0.7023
Classification Report:
               precision    recall  f1-score   support

Non-Repeater       0.22      0.99      0.36       149
    Repeater       1.00      0.67      0.81      1584

    accuracy                           0.70      1733
   macro avg       0.61      0.83      0.59      1733
weighted avg       0.93      0.70      0.77      1733

Confusion Matrix:
 [[ 148    1]
 [ 515 1069]]

=== Fold 2/5 ===
Validation Accuracy: 0.6907
Classification Report:
               precision    recall  f1-score   support

Non-Repeater       0.22      0.99      0.36       150
    Repeater       1.00      0.66      0.80      1583

    accuracy                           0.69      1733
   macro avg       0.61      0.83      0.58      1733
weighted avg       0.93      0.69      0.76      1733

Confusion Matrix:
 [[ 149    1]
 [ 535 1048]]

=== Fold 3/5 ===
Validation Accuracy: 0.8632
Classification Report:
               precision    recall  f1-score   support

Non-Repeater       0.38      0.94      0.54       150
    Repeater       0.99      0.86      0.92      1583

    accuracy                           0.86      1733
   macro avg       0.69      0.90      0.73      1733
weighted avg       0.94      0.86      0.89      1733

Confusion Matrix:
 [[ 141    9]
 [ 228 1355]]

=== Fold 4/5 ===
Validation Accuracy: 0.6520
Classification Report:
               precision    recall  f1-score   support

Non-Repeater       0.20      0.99      0.33       150
    Repeater       1.00      0.62      0.76      1583

    accuracy                           0.65      1733
   macro avg       0.60      0.81      0.55      1733
weighted avg       0.93      0.65      0.73      1733

Confusion Matrix:
 [[149   1]
 [602 981]]

=== Fold 5/5 ===
Validation Accuracy: 0.7044
Classification Report:
               precision    recall  f1-score   support

Non-Repeater       0.22      0.99      0.37       149
    Repeater       1.00      0.68      0.81      1583

    accuracy                           0.70      1732
   macro avg       0.61      0.84      0.59      1732
weighted avg       0.93      0.70      0.77      1732

Confusion Matrix:
 [[ 148    1]
 [ 511 1072]]


=== Summary ===
Total False Positives: 13
Total False Negatives: 2391
Total True Positives: 5525
Total True Negatives: 735

Confusion Matrix (with duplicates):
              Non-Repeater  Repeater
Non-Repeater         735.0      13.0
Repeater            2391.0    5525.0
accuracy_score
0.7225300092336103
Trial 1: hidden_dim=1236, latent_dim=35, beta=1.2286559286653818, gamma=0.1302834373736056, dropout_rate=0.23784674585674442, lr=0.0008958952735205378, scheduler_patience=7, class_weight=1.9492677066039692, activation=ReLU, classification_multiplier=14413.876033444261

=== Fold 1/5 ===
Validation Accuracy: 0.3635
Classification Report:
 [I 2025-06-12 17:27:58,152] Trial 138 finished with value: 0.24722991689750692 and parameters: {'hidden_dim': 1232, 'latent_dim': 35, 'beta': 1.2267244843560876, 'gamma': 0.14573859807854114, 'dropout_rate': 0.23948017039984523, 'lr': 0.0009637867793446599, 'scheduler_patience': 7, 'class_weight': 2.0085104273261454, 'activation': 'SELU', 'classification_multiplier': 14497.481186571931}. Best is trial 72 with value: 0.7479224376731302.
