[I 2025-06-12 14:13:04,464] Trial 105 finished with value: 0.7030240073868883 and parameters: {'hidden_dim': 1001, 'latent_dim': 40, 'beta': 0.9565011363499586, 'gamma': 0.41159839439686735, 'dropout_rate': 0.22638131527581493, 'lr': 0.0007120387451436453, 'scheduler_patience': 7, 'class_weight': 2.1075235652278734, 'activation': 'ReLU', 'classification_multiplier': 7662.369834126859}. Best is trial 72 with value: 0.7479224376731302.
              precision    recall  f1-score   support

Non-Repeater       0.26      0.98      0.41       149
    Repeater       1.00      0.74      0.85      1583

    accuracy                           0.76      1732
   macro avg       0.63      0.86      0.63      1732
weighted avg       0.93      0.76      0.81      1732

Confusion Matrix:
 [[ 146    3]
 [ 410 1173]]


=== Summary ===
Total False Positives: 8
Total False Negatives: 2551
Total True Positives: 5365
Total True Negatives: 740

Confusion Matrix (with duplicates):
              Non-Repeater  Repeater
Non-Repeater         740.0       8.0
Repeater            2551.0    5365.0
accuracy_score
0.7046398891966759
Trial 1: hidden_dim=991, latent_dim=34, beta=0.9392613939289775, gamma=0.40847177412894176, dropout_rate=0.18655944380726033, lr=0.0006717941878400522, scheduler_patience=7, class_weight=1.7074244786470407, activation=ReLU, classification_multiplier=5702.306848912782

=== Fold 1/5 ===
Validation Accuracy: 0.7017
Classification Report:
               precision    recall  f1-score   support

Non-Repeater       0.22      0.99      0.36       149
    Repeater       1.00      0.67      0.81      1584

    accuracy                           0.70      1733
   macro avg       0.61      0.83      0.58      1733
weighted avg       0.93      0.70      0.77      1733

Confusion Matrix:
 [[ 148    1]
 [ 516 1068]]

=== Fold 2/5 ===
Validation Accuracy: 0.6769
Classification Report:
               precision    recall  f1-score   support

Non-Repeater       0.21      0.99      0.35       150
    Repeater       1.00      0.65      0.79      1583

    accuracy                           0.68      1733
   macro avg       0.60      0.82      0.57      1733
weighted avg       0.93      0.68      0.75      1733

Confusion Matrix:
 [[ 149    1]
 [ 559 1024]]

=== Fold 3/5 ===
Validation Accuracy: 0.6682
Classification Report:
               precision    recall  f1-score   support

Non-Repeater       0.21      0.99      0.34       150
    Repeater       1.00      0.64      0.78      1583

    accuracy                           0.67      1733
   macro avg       0.60      0.82      0.56      1733
weighted avg       0.93      0.67      0.74      1733

Confusion Matrix:
 [[ 149    1]
 [ 574 1009]]

=== Fold 4/5 ===
Validation Accuracy: 0.6694
Classification Report:
               precision    recall  f1-score   support

Non-Repeater       0.21      0.99      0.34       150
    Repeater       1.00      0.64      0.78      1583

    accuracy                           0.67      1733
   macro avg       0.60      0.82      0.56      1733
weighted avg       0.93      0.67      0.74      1733

Confusion Matrix:
 [[ 149    1]
 [ 572 1011]]

=== Fold 5/5 ===
Validation Accuracy: 0.7471
Classification Report:
               precision    recall  f1-score   support

Non-Repeater       0.25      0.98      0.40       149
    Repeater       1.00      0.73      0.84      1583

    accuracy                           0.75      1732
   macro avg       0.62      0.85      0.62      1732
weighted avg       0.93      0.75      0.80      1732

Confusion Matrix:
 [[ 146    3]
 [ 435 1148]]


=== Summary ===
Total False Positives: 7
Total False Negatives: 2656
Total True Positives: 5260
Total True Negatives: 741

Confusion Matrix (with duplicates):
              Non-Repeater  Repeater
Non-Repeater         741.0       7.0
Repeater            2656.0    5260.0
accuracy_score
0.6926361957525392
Trial 1: hidden_dim=999, latent_dim=34, beta=0.9811104083339566, gamma=0.41013723105185806, dropout_rate=0.22329946258281488, lr=0.0006952459281743577, scheduler_patience=7, class_weight=1.9103709650942613, activation=ReLU, classification_multiplier=7662.310291710132

=== Fold 1/5 ===
Validation Accuracy: 0.6942
Classification Report:
               precision    recall  f1-score   support

Non-Repeater       0.22      0.99      0.36       149
    Repeater       1.00      0.67      0.80      1584

    accuracy                           0.69      1733
   macro avg       0.61      0.83      0.58      1733
weighted avg       0.93      0.69      0.76      1733

Confusion Matrix:
 [[ 148    1]
 [ 529 1055]]

=== Fold 2/5 ===
Validation Accuracy: 0.6855
Classification Report:
               precision    recall  f1-score   support

Non-Repeater       0.22      0.99      0.35       150
    Repeater       1.00      0.66      0.79      1583

    accuracy                           0.69      1733
   macro avg       0.61      0.82      0.57      1733
weighted avg       0.93      0.69      0.75      1733

Confusion Matrix:
 [[ 149    1]
 [ 544 1039]]

=== Fold 3/5 ===
Validation Accuracy: 0.6734
Classification Report:
               precision    recall  f1-score   support

Non-Repeater       0.21      0.99      0.34       150
    Repeater       1.00      0.64      0.78      1583

    accuracy                           0.67      1733
   macro avg       0.60      0.82      0.56      1733
weighted avg       0.93      0.67      0.74      1733

Confusion Matrix:
 [[ 149    1]
 [ 565 1018]]

=== Fold 4/5 ===
Validation Accuracy: 0.6901
Classification Report:
               precision    recall  f1-score   support

Non-Repeater       0.22      0.99      0.36       150
    Repeater       1.00      0.66      0.80      1583

    accuracy                           0.69      1733
   macro avg       0.61      0.83      0.58      1733
weighted avg       0.93      0.69      0.76      1733

Confusion Matrix:
 [[ 149    1]
 [ 536 1047]]

=== Fold 5/5 ===
Validation Accuracy: 0.7719
Classification Report:
               precision    recall  f1-score   support

Non-Repeater       0.27      0.97      0.42       149
    Repeater       1.00      0.75      0.86      1583

    accuracy                           0.77      1732
   macro avg       0.63      0.86      0.64      1732
weighted avg       0.93      0.77      0.82      1732

Confusion Matrix:
 [[ 144    5]
 [ 390 1193]]


=== Summary ===
Total False Positives: 9
Total False Negatives: 2564
Total True Positives: 5352
Total True Negatives: 739

Confusion Matrix (with duplicates):
              Non-Repeater  Repeater
Non-Repeater         739.0       9.0
Repeater            2564.0    5352.0
accuracy_score
0.7030240073868883
Trial 1: hidden_dim=1001, latent_dim=40, beta=0.9565011363499586, gamma=0.41159839439686735, dropout_rate=0.22638131527581493, lr=0.0007120387451436453, scheduler_patience=7, class_weight=2.1075235652278734, activation=ReLU, classification_multiplier=7662.369834126859

=== Fold 1/5 ===
Validation Accuracy: 0.6896
Classification Report:
               precision    recall  f1-score   support

Non-Repeater       0.22      0.99      0.35       149
    Repeater       1.00      0.66      0.80      1584

    accuracy                           0.69      1733
   macro avg       0.61      0.83      0.58      1733
weighted avg       0.93      0.69      0.76      1733

Confusion Matrix:
 [[ 148    1]
 [ 537 1047]]

=== Fold 2/5 ===
Validation Accuracy: 0.6255
Classification Report:
               precision    recall  f1-score   support

Non-Repeater       0.19      0.99      0.31       150
    Repeater       1.00      0.59      0.74      1583

    accuracy                           0.63      1733
   macro avg       0.59      0.79      0.53      1733
weighted avg       0.93      0.63      0.71      1733

Confusion Matrix:
 [[149   1]
 [648 935]]

=== Fold 3/5 ===
Validation Accuracy: 0.6763
Classification Report:
               precision    recall  f1-score   support

Non-Repeater       0.21      0.99      0.35       150
    Repeater       1.00      0.65      0.78      1583

    accuracy                           0.68      1733
   macro avg       0.60      0.82      0.57      1733
weighted avg       0.93      0.68      0.75      1733

Confusion Matrix:
 [[ 149    1]
 [ 560 1023]]

=== Fold 4/5 ===
Validation Accuracy: 0.6740
Classification Report:
 [I 2025-06-12 14:18:47,350] Trial 106 finished with value: 0.6829409048938134 and parameters: {'hidden_dim': 906, 'latent_dim': 34, 'beta': 0.9487370428599655, 'gamma': 0.4043029412699331, 'dropout_rate': 0.22598149338584225, 'lr': 0.000656466272377521, 'scheduler_patience': 7, 'class_weight': 2.104372472697825, 'activation': 'ReLU', 'classification_multiplier': 7670.745453149581}. Best is trial 72 with value: 0.7479224376731302.
[I 2025-06-12 14:24:22,984] Trial 107 finished with value: 0.6394275161588181 and parameters: {'hidden_dim': 840, 'latent_dim': 40, 'beta': 1.0027414300706607, 'gamma': 0.45414525808097794, 'dropout_rate': 0.20496380846092144, 'lr': 0.0013636623645531896, 'scheduler_patience': 7, 'class_weight': 1.8955867085061235, 'activation': 'GELU', 'classification_multiplier': 8129.926046953578}. Best is trial 72 with value: 0.7479224376731302.
[I 2025-06-12 14:30:12,908] Trial 108 finished with value: 0.6617036011080333 and parameters: {'hidden_dim': 1000, 'latent_dim': 35, 'beta': 0.9078671067677403, 'gamma': 0.4220861729894028, 'dropout_rate': 0.21367530830173465, 'lr': 0.0008464552563048745, 'scheduler_patience': 7, 'class_weight': 2.250630950167031, 'activation': 'ReLU', 'classification_multiplier': 7609.670150422432}. Best is trial 72 with value: 0.7479224376731302.
              precision    recall  f1-score   support

Non-Repeater       0.21      0.99      0.34       150
    Repeater       1.00      0.64      0.78      1583

    accuracy                           0.67      1733
   macro avg       0.60      0.82      0.56      1733
weighted avg       0.93      0.67      0.75      1733

Confusion Matrix:
 [[ 148    2]
 [ 563 1020]]

=== Fold 5/5 ===
Validation Accuracy: 0.7494
Classification Report:
               precision    recall  f1-score   support

Non-Repeater       0.25      0.98      0.40       149
    Repeater       1.00      0.73      0.84      1583

    accuracy                           0.75      1732
   macro avg       0.63      0.85      0.62      1732
weighted avg       0.93      0.75      0.80      1732

Confusion Matrix:
 [[ 146    3]
 [ 431 1152]]


=== Summary ===
Total False Positives: 8
Total False Negatives: 2739
Total True Positives: 5177
Total True Negatives: 740

Confusion Matrix (with duplicates):
              Non-Repeater  Repeater
Non-Repeater         740.0       8.0
Repeater            2739.0    5177.0
accuracy_score
0.6829409048938134
Trial 1: hidden_dim=906, latent_dim=34, beta=0.9487370428599655, gamma=0.4043029412699331, dropout_rate=0.22598149338584225, lr=0.000656466272377521, scheduler_patience=7, class_weight=2.104372472697825, activation=ReLU, classification_multiplier=7670.745453149581

=== Fold 1/5 ===
Validation Accuracy: 0.6619
Classification Report:
               precision    recall  f1-score   support

Non-Repeater       0.20      0.99      0.34       149
    Repeater       1.00      0.63      0.77      1584

    accuracy                           0.66      1733
   macro avg       0.60      0.81      0.55      1733
weighted avg       0.93      0.66      0.74      1733

Confusion Matrix:
 [[148   1]
 [585 999]]

=== Fold 2/5 ===
Validation Accuracy: 0.5401
Classification Report:
               precision    recall  f1-score   support

Non-Repeater       0.16      0.99      0.27       150
    Repeater       1.00      0.50      0.66      1583

    accuracy                           0.54      1733
   macro avg       0.58      0.75      0.47      1733
weighted avg       0.93      0.54      0.63      1733

Confusion Matrix:
 [[149   1]
 [796 787]]

=== Fold 3/5 ===
Validation Accuracy: 0.6544
Classification Report:
               precision    recall  f1-score   support

Non-Repeater       0.20      0.99      0.33       150
    Repeater       1.00      0.62      0.77      1583

    accuracy                           0.65      1733
   macro avg       0.60      0.81      0.55      1733
weighted avg       0.93      0.65      0.73      1733

Confusion Matrix:
 [[149   1]
 [598 985]]

=== Fold 4/5 ===
Validation Accuracy: 0.6203
Classification Report:
               precision    recall  f1-score   support

Non-Repeater       0.18      0.99      0.31       150
    Repeater       1.00      0.59      0.74      1583

    accuracy                           0.62      1733
   macro avg       0.59      0.79      0.52      1733
weighted avg       0.93      0.62      0.70      1733

Confusion Matrix:
 [[148   2]
 [656 927]]

=== Fold 5/5 ===
Validation Accuracy: 0.7206
Classification Report:
               precision    recall  f1-score   support

Non-Repeater       0.23      0.99      0.38       149
    Repeater       1.00      0.70      0.82      1583

    accuracy                           0.72      1732
   macro avg       0.62      0.84      0.60      1732
weighted avg       0.93      0.72      0.78      1732

Confusion Matrix:
 [[ 147    2]
 [ 482 1101]]


=== Summary ===
Total False Positives: 7
Total False Negatives: 3117
Total True Positives: 4799
Total True Negatives: 741

Confusion Matrix (with duplicates):
              Non-Repeater  Repeater
Non-Repeater         741.0       7.0
Repeater            3117.0    4799.0
accuracy_score
0.6394275161588181
Trial 1: hidden_dim=840, latent_dim=40, beta=1.0027414300706607, gamma=0.45414525808097794, dropout_rate=0.20496380846092144, lr=0.0013636623645531896, scheduler_patience=7, class_weight=1.8955867085061235, activation=GELU, classification_multiplier=8129.926046953578

=== Fold 1/5 ===
Validation Accuracy: 0.7063
Classification Report:
               precision    recall  f1-score   support

Non-Repeater       0.23      1.00      0.37       149
    Repeater       1.00      0.68      0.81      1584

    accuracy                           0.71      1733
   macro avg       0.61      0.84      0.59      1733
weighted avg       0.93      0.71      0.77      1733

Confusion Matrix:
 [[ 149    0]
 [ 509 1075]]

=== Fold 2/5 ===
Validation Accuracy: 0.7340
Classification Report:
               precision    recall  f1-score   support

Non-Repeater       0.24      0.99      0.39       150
    Repeater       1.00      0.71      0.83      1583

    accuracy                           0.73      1733
   macro avg       0.62      0.85      0.61      1733
weighted avg       0.93      0.73      0.79      1733

Confusion Matrix:
 [[ 149    1]
 [ 460 1123]]

=== Fold 3/5 ===
Validation Accuracy: 0.6520
Classification Report:
               precision    recall  f1-score   support

Non-Repeater       0.20      0.99      0.33       150
    Repeater       1.00      0.62      0.76      1583

    accuracy                           0.65      1733
   macro avg       0.60      0.81      0.55      1733
weighted avg       0.93      0.65      0.73      1733

Confusion Matrix:
 [[149   1]
 [602 981]]

=== Fold 4/5 ===
Validation Accuracy: 0.4634
Classification Report:
               precision    recall  f1-score   support

Non-Repeater       0.14      1.00      0.24       150
    Repeater       1.00      0.41      0.58      1583

    accuracy                           0.46      1733
   macro avg       0.57      0.71      0.41      1733
weighted avg       0.93      0.46      0.55      1733

Confusion Matrix:
 [[150   0]
 [930 653]]

=== Fold 5/5 ===
Validation Accuracy: 0.7529
Classification Report:
               precision    recall  f1-score   support

Non-Repeater       0.26      0.98      0.41       149
    Repeater       1.00      0.73      0.84      1583

    accuracy                           0.75      1732
   macro avg       0.63      0.86      0.62      1732
weighted avg       0.93      0.75      0.81      1732

Confusion Matrix:
 [[ 146    3]
 [ 425 1158]]


=== Summary ===
Total False Positives: 5
Total False Negatives: 2926
Total True Positives: 4990
Total True Negatives: 743

Confusion Matrix (with duplicates):
              Non-Repeater  Repeater
Non-Repeater         743.0       5.0
Repeater            2926.0    4990.0
accuracy_score
0.6617036011080333
Trial 1: hidden_dim=1000, latent_dim=35, beta=0.9078671067677403, gamma=0.4220861729894028, dropout_rate=0.21367530830173465, lr=0.0008464552563048745, scheduler_patience=7, class_weight=2.250630950167031, activation=ReLU, classification_multiplier=7609.670150422432

=== Fold 1/5 ===
Validation Accuracy: 0.6780
Classification Report:
               precision    recall  f1-score   support

Non-Repeater       0.21      1.00      0.35       149
    Repeater       1.00      0.65      0.79      1584

    accuracy                           0.68      1733
   macro avg       0.61      0.82      0.57      1733
weighted avg       0.93      0.68      0.75      1733

Confusion Matrix:
 [[ 149    0]
 [ 558 1026]]

=== Fold 2/5 ===
Validation Accuracy: 0.7582
Classification Report:
               precision    recall  f1-score   support

Non-Repeater       0.26      0.99      0.42       150
    Repeater       1.00      0.74      0.85      1583

    accuracy                           0.76      1733
   macro avg       0.63      0.86      0.63      1733
weighted avg       0.94      0.76      0.81      1733

Confusion Matrix:
 [[ 149    1]
 [ 418 1165]]

=== Fold 3/5 ===
Validation Accuracy: 0.7703
Classification Report:
 [I 2025-06-12 14:36:15,777] Trial 109 finished with value: 0.6987534626038782 and parameters: {'hidden_dim': 1147, 'latent_dim': 39, 'beta': 1.0924038955088833, 'gamma': 0.33459824501804997, 'dropout_rate': 0.23254392991258663, 'lr': 0.001186794160293727, 'scheduler_patience': 7, 'class_weight': 1.6985188524317743, 'activation': 'ReLU', 'classification_multiplier': 9220.286668798555}. Best is trial 72 with value: 0.7479224376731302.
[I 2025-06-12 14:42:17,110] Trial 110 finished with value: 0.6292705447830101 and parameters: {'hidden_dim': 1142, 'latent_dim': 38, 'beta': 0.9652606386376195, 'gamma': 0.3648668348337055, 'dropout_rate': 0.2519605050791292, 'lr': 0.0016351182178615704, 'scheduler_patience': 7, 'class_weight': 1.7087230477161646, 'activation': 'ReLU', 'classification_multiplier': 10105.494921346399}. Best is trial 72 with value: 0.7479224376731302.
