[I 2025-06-12 15:17:19,270] Trial 116 finished with value: 0.31659741458910434 and parameters: {'hidden_dim': 945, 'latent_dim': 38, 'beta': 1.0984308561368672, 'gamma': 0.23791270205062373, 'dropout_rate': 0.18739701391521257, 'lr': 0.0014831148482875472, 'scheduler_patience': 7, 'class_weight': 2.0995868971416347, 'activation': 'SELU', 'classification_multiplier': 8872.205433581476}. Best is trial 72 with value: 0.7479224376731302.
              precision    recall  f1-score   support

Non-Repeater       0.14      1.00      0.24       149
    Repeater       1.00      0.40      0.57      1584

    accuracy                           0.45      1733
   macro avg       0.57      0.70      0.41      1733
weighted avg       0.93      0.45      0.54      1733

Confusion Matrix:
 [[149   0]
 [950 634]]

=== Fold 2/5 ===
Validation Accuracy: 0.6197
Classification Report:
               precision    recall  f1-score   support

Non-Repeater       0.18      0.99      0.31       150
    Repeater       1.00      0.58      0.74      1583

    accuracy                           0.62      1733
   macro avg       0.59      0.79      0.52      1733
weighted avg       0.93      0.62      0.70      1733

Confusion Matrix:
 [[149   1]
 [658 925]]

=== Fold 3/5 ===
Validation Accuracy: 0.7334
Classification Report:
               precision    recall  f1-score   support

Non-Repeater       0.24      0.98      0.39       150
    Repeater       1.00      0.71      0.83      1583

    accuracy                           0.73      1733
   macro avg       0.62      0.85      0.61      1733
weighted avg       0.93      0.73      0.79      1733

Confusion Matrix:
 [[ 147    3]
 [ 459 1124]]

=== Fold 4/5 ===
Validation Accuracy: 0.2562
Classification Report:
               precision    recall  f1-score   support

Non-Repeater       0.10      0.99      0.19       150
    Repeater       1.00      0.19      0.31      1583

    accuracy                           0.26      1733
   macro avg       0.55      0.59      0.25      1733
weighted avg       0.92      0.26      0.30      1733

Confusion Matrix:
 [[ 149    1]
 [1288  295]]

=== Fold 5/5 ===
Validation Accuracy: 0.7090
Classification Report:
               precision    recall  f1-score   support

Non-Repeater       0.23      0.99      0.37       149
    Repeater       1.00      0.68      0.81      1583

    accuracy                           0.71      1732
   macro avg       0.61      0.83      0.59      1732
weighted avg       0.93      0.71      0.77      1732

Confusion Matrix:
 [[ 147    2]
 [ 502 1081]]


=== Summary ===
Total False Positives: 7
Total False Negatives: 3857
Total True Positives: 4059
Total True Negatives: 741

Confusion Matrix (with duplicates):
              Non-Repeater  Repeater
Non-Repeater         741.0       7.0
Repeater            3857.0    4059.0
accuracy_score
0.554016620498615
Trial 1: hidden_dim=1228, latent_dim=38, beta=1.0267980416405869, gamma=0.2801835134851167, dropout_rate=0.2712982735211846, lr=0.001986033690156978, scheduler_patience=7, class_weight=2.5374781407933313, activation=ReLU, classification_multiplier=9142.500003861529

=== Fold 1/5 ===
Validation Accuracy: 0.3087
Classification Report:
               precision    recall  f1-score   support

Non-Repeater       0.11      1.00      0.20       149
    Repeater       1.00      0.24      0.39      1584

    accuracy                           0.31      1733
   macro avg       0.56      0.62      0.30      1733
weighted avg       0.92      0.31      0.38      1733

Confusion Matrix:
 [[ 149    0]
 [1198  386]]

=== Fold 2/5 ===
Validation Accuracy: 0.2822
Classification Report:
               precision    recall  f1-score   support

Non-Repeater       0.11      1.00      0.19       150
    Repeater       1.00      0.21      0.35      1583

    accuracy                           0.28      1733
   macro avg       0.55      0.61      0.27      1733
weighted avg       0.92      0.28      0.34      1733

Confusion Matrix:
 [[ 150    0]
 [1244  339]]

=== Fold 3/5 ===
Validation Accuracy: 0.2250
Classification Report:
               precision    recall  f1-score   support

Non-Repeater       0.10      1.00      0.18       150
    Repeater       1.00      0.15      0.26      1583

    accuracy                           0.23      1733
   macro avg       0.55      0.58      0.22      1733
weighted avg       0.92      0.23      0.26      1733

Confusion Matrix:
 [[ 150    0]
 [1343  240]]

=== Fold 4/5 ===
Validation Accuracy: 0.3531
Classification Report:
               precision    recall  f1-score   support

Non-Repeater       0.12      0.99      0.21       150
    Repeater       1.00      0.29      0.45      1583

    accuracy                           0.35      1733
   macro avg       0.56      0.64      0.33      1733
weighted avg       0.92      0.35      0.43      1733

Confusion Matrix:
 [[ 149    1]
 [1120  463]]

=== Fold 5/5 ===
Validation Accuracy: 0.4140
Classification Report:
               precision    recall  f1-score   support

Non-Repeater       0.13      1.00      0.23       149
    Repeater       1.00      0.36      0.53      1583

    accuracy                           0.41      1732
   macro avg       0.56      0.68      0.38      1732
weighted avg       0.92      0.41      0.50      1732

Confusion Matrix:
 [[ 149    0]
 [1015  568]]


=== Summary ===
Total False Positives: 1
Total False Negatives: 5920
Total True Positives: 1996
Total True Negatives: 747

Confusion Matrix (with duplicates):
              Non-Repeater  Repeater
Non-Repeater         747.0       1.0
Repeater            5920.0    1996.0
accuracy_score
0.31659741458910434
Trial 1: hidden_dim=945, latent_dim=38, beta=1.0984308561368672, gamma=0.23791270205062373, dropout_rate=0.18739701391521257, lr=0.0014831148482875472, scheduler_patience=7, class_weight=2.0995868971416347, activation=SELU, classification_multiplier=8872.205433581476

=== Fold 1/5 ===
Validation Accuracy: 0.6209
Classification Report:
               precision    recall  f1-score   support

Non-Repeater       0.18      0.98      0.31       149
    Repeater       1.00      0.59      0.74      1584

    accuracy                           0.62      1733
   macro avg       0.59      0.78      0.52      1733
weighted avg       0.93      0.62      0.70      1733

Confusion Matrix:
 [[146   3]
 [654 930]]

=== Fold 2/5 ===
Validation Accuracy: 0.5557
Classification Report:
               precision    recall  f1-score   support

Non-Repeater       0.16      0.99      0.28       150
    Repeater       1.00      0.51      0.68      1583

    accuracy                           0.56      1733
   macro avg       0.58      0.75      0.48      1733
weighted avg       0.93      0.56      0.64      1733

Confusion Matrix:
 [[149   1]
 [769 814]]

=== Fold 3/5 ===
Validation Accuracy: 0.5990
Classification Report:
               precision    recall  f1-score   support

Non-Repeater       0.18      0.99      0.30       150
    Repeater       1.00      0.56      0.72      1583

    accuracy                           0.60      1733
   macro avg       0.59      0.78      0.51      1733
weighted avg       0.93      0.60      0.68      1733

Confusion Matrix:
 [[149   1]
 [694 889]]

=== Fold 4/5 ===
Validation Accuracy: 0.6734
Classification Report:
               precision    recall  f1-score   support

Non-Repeater       0.21      0.98      0.34       150
    Repeater       1.00      0.64      0.78      1583

    accuracy                           0.67      1733
   macro avg       0.60      0.81      0.56      1733
weighted avg       0.93      0.67      0.74      1733

Confusion Matrix:
 [[ 147    3]
 [ 563 1020]]

=== Fold 5/5 ===
Validation Accuracy: 0.7488
Classification Report:
               precision    recall  f1-score   support

Non-Repeater       0.25      0.98      0.40       149
    Repeater       1.00      0.73      0.84      1583

    accuracy                           0.75      1732
   macro avg       0.62      0.85      0.62      1732
weighted avg       0.93      0.75      0.80      1732

Confusion Matrix:
 [[ 146    3]
 [ 432 1151]]


=== Summary ===
Total False Positives: 11
Total False Negatives: 3112
Total True Positives: 4804
Total True Negatives: 737

Confusion Matrix (with duplicates):
              Non-Repeater  Repeater
Non-Repeater         737.0      11.0
Repeater            3112.0    4804.0
accuracy_score
0.6395429362880887
[I 2025-06-12 15:23:19,949] Trial 117 finished with value: 0.6395429362880887 and parameters: {'hidden_dim': 1118, 'latent_dim': 37, 'beta': 1.0555571380243842, 'gamma': 0.3164546237565278, 'dropout_rate': 0.20323056006730483, 'lr': 0.0017478275725603335, 'scheduler_patience': 7, 'class_weight': 1.8258026382059054, 'activation': 'ReLU', 'classification_multiplier': 9181.71904558393}. Best is trial 72 with value: 0.7479224376731302.
[I 2025-06-12 15:29:01,239] Trial 118 finished with value: 0.6668975069252078 and parameters: {'hidden_dim': 886, 'latent_dim': 36, 'beta': 1.18885232345227, 'gamma': 1.2055369544028125, 'dropout_rate': 0.23559242212151818, 'lr': 0.0009749750301134604, 'scheduler_patience': 7, 'class_weight': 1.6851501625333587, 'activation': 'ReLU', 'classification_multiplier': 9677.546050842437}. Best is trial 72 with value: 0.7479224376731302.
[I 2025-06-12 15:34:56,728] Trial 119 finished with value: 0.6659741458910434 and parameters: {'hidden_dim': 1046, 'latent_dim': 39, 'beta': 0.8645927803504028, 'gamma': 0.13863240448084463, 'dropout_rate': 0.2810980426275501, 'lr': 0.0012272595713887363, 'scheduler_patience': 7, 'class_weight': 1.9929288760995427, 'activation': 'ReLU', 'classification_multiplier': 9203.520049625624}. Best is trial 72 with value: 0.7479224376731302.
Trial 1: hidden_dim=1118, latent_dim=37, beta=1.0555571380243842, gamma=0.3164546237565278, dropout_rate=0.20323056006730483, lr=0.0017478275725603335, scheduler_patience=7, class_weight=1.8258026382059054, activation=ReLU, classification_multiplier=9181.71904558393

=== Fold 1/5 ===
Validation Accuracy: 0.6861
Classification Report:
               precision    recall  f1-score   support

Non-Repeater       0.22      1.00      0.35       149
    Repeater       1.00      0.66      0.79      1584

    accuracy                           0.69      1733
   macro avg       0.61      0.83      0.57      1733
weighted avg       0.93      0.69      0.75      1733

Confusion Matrix:
 [[ 149    0]
 [ 544 1040]]

=== Fold 2/5 ===
Validation Accuracy: 0.6526
Classification Report:
               precision    recall  f1-score   support

Non-Repeater       0.20      0.99      0.33       150
    Repeater       1.00      0.62      0.77      1583

    accuracy                           0.65      1733
   macro avg       0.60      0.81      0.55      1733
weighted avg       0.93      0.65      0.73      1733

Confusion Matrix:
 [[149   1]
 [601 982]]

=== Fold 3/5 ===
Validation Accuracy: 0.6197
Classification Report:
               precision    recall  f1-score   support

Non-Repeater       0.18      0.99      0.31       150
    Repeater       1.00      0.58      0.74      1583

    accuracy                           0.62      1733
   macro avg       0.59      0.79      0.52      1733
weighted avg       0.93      0.62      0.70      1733

Confusion Matrix:
 [[149   1]
 [658 925]]

=== Fold 4/5 ===
Validation Accuracy: 0.6647
Classification Report:
               precision    recall  f1-score   support

Non-Repeater       0.20      0.98      0.34       150
    Repeater       1.00      0.63      0.78      1583

    accuracy                           0.66      1733
   macro avg       0.60      0.81      0.56      1733
weighted avg       0.93      0.66      0.74      1733

Confusion Matrix:
 [[ 147    3]
 [ 578 1005]]

=== Fold 5/5 ===
Validation Accuracy: 0.7113
Classification Report:
               precision    recall  f1-score   support

Non-Repeater       0.23      0.98      0.37       149
    Repeater       1.00      0.69      0.81      1583

    accuracy                           0.71      1732
   macro avg       0.61      0.83      0.59      1732
weighted avg       0.93      0.71      0.77      1732

Confusion Matrix:
 [[ 146    3]
 [ 497 1086]]


=== Summary ===
Total False Positives: 8
Total False Negatives: 2878
Total True Positives: 5038
Total True Negatives: 740

Confusion Matrix (with duplicates):
              Non-Repeater  Repeater
Non-Repeater         740.0       8.0
Repeater            2878.0    5038.0
accuracy_score
0.6668975069252078
Trial 1: hidden_dim=886, latent_dim=36, beta=1.18885232345227, gamma=1.2055369544028125, dropout_rate=0.23559242212151818, lr=0.0009749750301134604, scheduler_patience=7, class_weight=1.6851501625333587, activation=ReLU, classification_multiplier=9677.546050842437

=== Fold 1/5 ===
Validation Accuracy: 0.6526
Classification Report:
               precision    recall  f1-score   support

Non-Repeater       0.20      0.99      0.33       149
    Repeater       1.00      0.62      0.77      1584

    accuracy                           0.65      1733
   macro avg       0.60      0.80      0.55      1733
weighted avg       0.93      0.65      0.73      1733

Confusion Matrix:
 [[147   2]
 [600 984]]

=== Fold 2/5 ===
Validation Accuracy: 0.5868
Classification Report:
               precision    recall  f1-score   support

Non-Repeater       0.17      0.99      0.29       150
    Repeater       1.00      0.55      0.71      1583

    accuracy                           0.59      1733
   macro avg       0.59      0.77      0.50      1733
weighted avg       0.93      0.59      0.67      1733

Confusion Matrix:
 [[149   1]
 [715 868]]

=== Fold 3/5 ===
Validation Accuracy: 0.7213
Classification Report:
               precision    recall  f1-score   support

Non-Repeater       0.24      0.99      0.38       150
    Repeater       1.00      0.70      0.82      1583

    accuracy                           0.72      1733
   macro avg       0.62      0.84      0.60      1733
weighted avg       0.93      0.72      0.78      1733

Confusion Matrix:
 [[ 149    1]
 [ 482 1101]]

=== Fold 4/5 ===
Validation Accuracy: 0.6290
Classification Report:
               precision    recall  f1-score   support

Non-Repeater       0.19      1.00      0.32       150
    Repeater       1.00      0.59      0.75      1583

    accuracy                           0.63      1733
   macro avg       0.59      0.80      0.53      1733
weighted avg       0.93      0.63      0.71      1733

Confusion Matrix:
 [[150   0]
 [643 940]]

=== Fold 5/5 ===
Validation Accuracy: 0.7402
Classification Report:
               precision    recall  f1-score   support

Non-Repeater       0.25      0.99      0.40       149
    Repeater       1.00      0.72      0.83      1583

    accuracy                           0.74      1732
   macro avg       0.62      0.85      0.61      1732
weighted avg       0.93      0.74      0.80      1732

Confusion Matrix:
 [[ 147    2]
 [ 448 1135]]


=== Summary ===
Total False Positives: 6
Total False Negatives: 2888
Total True Positives: 5028
Total True Negatives: 742

Confusion Matrix (with duplicates):
              Non-Repeater  Repeater
Non-Repeater         742.0       6.0
Repeater            2888.0    5028.0
accuracy_score
0.6659741458910434
Trial 1: hidden_dim=1046, latent_dim=39, beta=0.8645927803504028, gamma=0.13863240448084463, dropout_rate=0.2810980426275501, lr=0.0012272595713887363, scheduler_patience=7, class_weight=1.9929288760995427, activation=ReLU, classification_multiplier=9203.520049625624

=== Fold 1/5 ===
Validation Accuracy: 0.6607
Classification Report:
               precision    recall  f1-score   support

Non-Repeater       0.20      0.99      0.33       149
    Repeater       1.00      0.63      0.77      1584

    accuracy                           0.66      1733
   macro avg       0.60      0.81      0.55      1733
weighted avg       0.93      0.66      0.73      1733

Confusion Matrix:
 [[148   1]
 [587 997]]

=== Fold 2/5 ===
Validation Accuracy: 0.6440
Classification Report:
               precision    recall  f1-score   support

Non-Repeater       0.20      1.00      0.33       150
    Repeater       1.00      0.61      0.76      1583

    accuracy                           0.64      1733
   macro avg       0.60      0.81      0.54      1733
weighted avg       0.93      0.64      0.72      1733

Confusion Matrix:
 [[150   0]
 [617 966]]

=== Fold 3/5 ===
Validation Accuracy: 0.6486
Classification Report:
               precision    recall  f1-score   support

Non-Repeater       0.20      0.99      0.33       150
    Repeater       1.00      0.62      0.76      1583

    accuracy                           0.65      1733
   macro avg       0.60      0.80      0.54      1733
weighted avg       0.93      0.65      0.72      1733

Confusion Matrix:
 [[148   2]
 [607 976]]

=== Fold 4/5 ===
Validation Accuracy: 0.6705
Classification Report:
               precision    recall  f1-score   support

Non-Repeater       0.21      0.99      0.34       150
    Repeater       1.00      0.64      0.78      1583

    accuracy                           0.67      1733
   macro avg       0.60      0.81      0.56      1733
weighted avg       0.93      0.67      0.74      1733

Confusion Matrix:
 [[ 148    2]
 [ 569 1014]]

=== Fold 5/5 ===
Validation Accuracy: 0.8210
Classification Report:
               precision    recall  f1-score   support

Non-Repeater       0.32      0.97      0.48       149
    Repeater       1.00      0.81      0.89      1583

    accuracy                           0.82      1732
   macro avg       0.66      0.89      0.69      1732
weighted avg       0.94      0.82      0.86      1732

Confusion Matrix:
 [[ 145    4]
 [ 306 1277]]


=== Summary ===
Total False Positives: 9
Total False Negatives: 2686
Total True Positives: 5230
Total True Negatives: 739

Confusion Matrix (with duplicates):
[I 2025-06-12 15:40:44,437] Trial 120 finished with value: 0.6889427516158818 and parameters: {'hidden_dim': 967, 'latent_dim': 40, 'beta': 0.9294158843809756, 'gamma': 0.3789820598891252, 'dropout_rate': 0.3203660074650845, 'lr': 0.0014103429954294244, 'scheduler_patience': 7, 'class_weight': 1.7543294670234502, 'activation': 'ReLU', 'classification_multiplier': 9386.64999430409}. Best is trial 72 with value: 0.7479224376731302.
[I 2025-06-12 15:46:34,120] Trial 121 finished with value: 0.6969067405355494 and parameters: {'hidden_dim': 1006, 'latent_dim': 34, 'beta': 0.9889637660743156, 'gamma': 0.402341608150587, 'dropout_rate': 0.2229939432303366, 'lr': 0.0008800277618816869, 'scheduler_patience': 7, 'class_weight': 1.9246734735262185, 'activation': 'ReLU', 'classification_multiplier': 8731.57070810682}. Best is trial 72 with value: 0.7479224376731302.
