[I 2025-06-13 15:46:26,347] Trial 346 finished with value: 0.7414589104339797 and parameters: {'hidden_dim': 1486, 'latent_dim': 27, 'beta': 1.5111406914231928, 'gamma': 0.18116701138166064, 'dropout_rate': 0.11569530984983033, 'lr': 0.0010388155186016731, 'scheduler_patience': 7, 'class_weight': 2.7841359588754573, 'activation': 'ReLU', 'classification_multiplier': 14992.503773285154}. Best is trial 194 with value: 0.8103647276084949.
              precision    recall  f1-score   support

Non-Repeater       0.27      0.98      0.42       149
    Repeater       1.00      0.75      0.86      1583

    accuracy                           0.77      1732
   macro avg       0.63      0.86      0.64      1732
weighted avg       0.93      0.77      0.82      1732

Confusion Matrix:
 [[ 146    3]
 [ 396 1187]]


=== Summary ===
Total False Positives: 6
Total False Negatives: 2672
Total True Positives: 5244
Total True Negatives: 742

Confusion Matrix (with duplicates):
              Non-Repeater  Repeater
Non-Repeater         742.0       6.0
Repeater            2672.0    5244.0
accuracy_score
0.6909048938134811
Trial 1: hidden_dim=1543, latent_dim=31, beta=1.5236217036042805, gamma=0.22914048856169741, dropout_rate=0.12811917139415605, lr=0.0007808516434701077, scheduler_patience=7, class_weight=2.8266239277014713, activation=ReLU, classification_multiplier=14002.294205828199

=== Fold 1/5 ===
Validation Accuracy: 0.6746
Classification Report:
               precision    recall  f1-score   support

Non-Repeater       0.21      0.98      0.34       149
    Repeater       1.00      0.65      0.78      1584

    accuracy                           0.67      1733
   macro avg       0.60      0.81      0.56      1733
weighted avg       0.93      0.67      0.75      1733

Confusion Matrix:
 [[ 146    3]
 [ 561 1023]]

=== Fold 2/5 ===
Validation Accuracy: 0.7467
Classification Report:
               precision    recall  f1-score   support

Non-Repeater       0.25      1.00      0.41       150
    Repeater       1.00      0.72      0.84      1583

    accuracy                           0.75      1733
   macro avg       0.63      0.86      0.62      1733
weighted avg       0.94      0.75      0.80      1733

Confusion Matrix:
 [[ 150    0]
 [ 439 1144]]

=== Fold 3/5 ===
Validation Accuracy: 0.7750
Classification Report:
               precision    recall  f1-score   support

Non-Repeater       0.27      0.95      0.42       150
    Repeater       0.99      0.76      0.86      1583

    accuracy                           0.77      1733
   macro avg       0.63      0.85      0.64      1733
weighted avg       0.93      0.77      0.82      1733

Confusion Matrix:
 [[ 142    8]
 [ 382 1201]]

=== Fold 4/5 ===
Validation Accuracy: 0.6636
Classification Report:
               precision    recall  f1-score   support

Non-Repeater       0.20      0.99      0.34       150
    Repeater       1.00      0.63      0.77      1583

    accuracy                           0.66      1733
   macro avg       0.60      0.81      0.56      1733
weighted avg       0.93      0.66      0.74      1733

Confusion Matrix:
 [[ 148    2]
 [ 581 1002]]

=== Fold 5/5 ===
Validation Accuracy: 0.7766
Classification Report:
               precision    recall  f1-score   support

Non-Repeater       0.27      0.97      0.43       149
    Repeater       1.00      0.76      0.86      1583

    accuracy                           0.78      1732
   macro avg       0.64      0.87      0.64      1732
weighted avg       0.93      0.78      0.82      1732

Confusion Matrix:
 [[ 145    4]
 [ 383 1200]]


=== Summary ===
Total False Positives: 17
Total False Negatives: 2346
Total True Positives: 5570
Total True Negatives: 731

Confusion Matrix (with duplicates):
              Non-Repeater  Repeater
Non-Repeater         731.0      17.0
Repeater            2346.0    5570.0
accuracy_score
0.7272622345337026
Trial 1: hidden_dim=1518, latent_dim=29, beta=1.4622472769112613, gamma=0.14070990344901968, dropout_rate=0.14075749133156984, lr=0.0005323417302508475, scheduler_patience=5, class_weight=2.8913178612941244, activation=ReLU, classification_multiplier=14267.566687779317

=== Fold 1/5 ===
Validation Accuracy: 0.8794
Classification Report:
               precision    recall  f1-score   support

Non-Repeater       0.41      0.98      0.58       149
    Repeater       1.00      0.87      0.93      1584

    accuracy                           0.88      1733
   macro avg       0.71      0.92      0.76      1733
weighted avg       0.95      0.88      0.90      1733

Confusion Matrix:
 [[ 146    3]
 [ 206 1378]]

=== Fold 2/5 ===
Validation Accuracy: 0.5568
Classification Report:
               precision    recall  f1-score   support

Non-Repeater       0.16      0.99      0.28       150
    Repeater       1.00      0.52      0.68      1583

    accuracy                           0.56      1733
   macro avg       0.58      0.75      0.48      1733
weighted avg       0.93      0.56      0.65      1733

Confusion Matrix:
 [[149   1]
 [767 816]]

=== Fold 3/5 ===
Validation Accuracy: 0.6797
Classification Report:
               precision    recall  f1-score   support

Non-Repeater       0.21      0.99      0.35       150
    Repeater       1.00      0.65      0.79      1583

    accuracy                           0.68      1733
   macro avg       0.61      0.82      0.57      1733
weighted avg       0.93      0.68      0.75      1733

Confusion Matrix:
 [[ 149    1]
 [ 554 1029]]

=== Fold 4/5 ===
Validation Accuracy: 0.8257
Classification Report:
               precision    recall  f1-score   support

Non-Repeater       0.33      0.95      0.49       150
    Repeater       0.99      0.81      0.90      1583

    accuracy                           0.83      1733
   macro avg       0.66      0.88      0.69      1733
weighted avg       0.94      0.83      0.86      1733

Confusion Matrix:
 [[ 143    7]
 [ 295 1288]]

=== Fold 5/5 ===
Validation Accuracy: 0.7656
Classification Report:
               precision    recall  f1-score   support

Non-Repeater       0.27      0.97      0.42       149
    Repeater       1.00      0.75      0.85      1583

    accuracy                           0.77      1732
   macro avg       0.63      0.86      0.63      1732
weighted avg       0.93      0.77      0.82      1732

Confusion Matrix:
 [[ 145    4]
 [ 402 1181]]


=== Summary ===
Total False Positives: 16
Total False Negatives: 2224
Total True Positives: 5692
Total True Negatives: 732

Confusion Matrix (with duplicates):
              Non-Repeater  Repeater
Non-Repeater         732.0      16.0
Repeater            2224.0    5692.0
accuracy_score
0.7414589104339797
Trial 1: hidden_dim=1486, latent_dim=27, beta=1.5111406914231928, gamma=0.18116701138166064, dropout_rate=0.11569530984983033, lr=0.0010388155186016731, scheduler_patience=7, class_weight=2.7841359588754573, activation=ReLU, classification_multiplier=14992.503773285154

=== Fold 1/5 ===
Validation Accuracy: 0.6746
Classification Report:
               precision    recall  f1-score   support

Non-Repeater       0.21      0.99      0.34       149
    Repeater       1.00      0.64      0.78      1584

    accuracy                           0.67      1733
   macro avg       0.60      0.82      0.56      1733
weighted avg       0.93      0.67      0.75      1733

Confusion Matrix:
 [[ 148    1]
 [ 563 1021]]

=== Fold 2/5 ===
Validation Accuracy: 0.6751
Classification Report:
               precision    recall  f1-score   support

Non-Repeater       0.21      0.99      0.35       150
    Repeater       1.00      0.64      0.78      1583

    accuracy                           0.68      1733
   macro avg       0.60      0.82      0.56      1733
weighted avg       0.93      0.68      0.75      1733

Confusion Matrix:
 [[ 149    1]
 [ 562 1021]]

=== Fold 3/5 ===
Validation Accuracy: 0.6682
Classification Report:
               precision    recall  f1-score   support

Non-Repeater       0.21      0.99      0.34       150
    Repeater       1.00      0.64      0.78      1583

    accuracy                           0.67      1733
   macro avg       0.60      0.82      0.56      1733
weighted avg       0.93      0.67      0.74      1733

Confusion Matrix:
 [[ 149    1]
 [ 574 1009]]

=== Fold 4/5 ===
Validation Accuracy: 0.6157
Classification Report:
 [I 2025-06-13 15:52:59,430] Trial 347 finished with value: 0.676708217913204 and parameters: {'hidden_dim': 1445, 'latent_dim': 31, 'beta': 1.4228347267582093, 'gamma': 0.2537461604186726, 'dropout_rate': 0.40611813660853513, 'lr': 0.0004730497731768344, 'scheduler_patience': 7, 'class_weight': 2.955083247145365, 'activation': 'ReLU', 'classification_multiplier': 14436.028251934062}. Best is trial 194 with value: 0.8103647276084949.
/home/ubuntu/frb-analysis/.frb-analysis/lib/python3.12/site-packages/sklearn/metrics/_classification.py:1565: UndefinedMetricWarning: Precision is ill-defined and being set to 0.0 in labels with no predicted samples. Use `zero_division` parameter to control this behavior.
  _warn_prf(average, modifier, f"{metric.capitalize()} is", len(result))
/home/ubuntu/frb-analysis/.frb-analysis/lib/python3.12/site-packages/sklearn/metrics/_classification.py:1565: UndefinedMetricWarning: Precision is ill-defined and being set to 0.0 in labels with no predicted samples. Use `zero_division` parameter to control this behavior.
  _warn_prf(average, modifier, f"{metric.capitalize()} is", len(result))
/home/ubuntu/frb-analysis/.frb-analysis/lib/python3.12/site-packages/sklearn/metrics/_classification.py:1565: UndefinedMetricWarning: Precision is ill-defined and being set to 0.0 in labels with no predicted samples. Use `zero_division` parameter to control this behavior.
  _warn_prf(average, modifier, f"{metric.capitalize()} is", len(result))
/home/ubuntu/frb-analysis/.frb-analysis/lib/python3.12/site-packages/sklearn/metrics/_classification.py:1565: UndefinedMetricWarning: Precision is ill-defined and being set to 0.0 in labels with no predicted samples. Use `zero_division` parameter to control this behavior.
  _warn_prf(average, modifier, f"{metric.capitalize()} is", len(result))
/home/ubuntu/frb-analysis/.frb-analysis/lib/python3.12/site-packages/sklearn/metrics/_classification.py:1565: UndefinedMetricWarning: Precision is ill-defined and being set to 0.0 in labels with no predicted samples. Use `zero_division` parameter to control this behavior.
  _warn_prf(average, modifier, f"{metric.capitalize()} is", len(result))
/home/ubuntu/frb-analysis/.frb-analysis/lib/python3.12/site-packages/sklearn/metrics/_classification.py:1565: UndefinedMetricWarning: Precision is ill-defined and being set to 0.0 in labels with no predicted samples. Use `zero_division` parameter to control this behavior.
  _warn_prf(average, modifier, f"{metric.capitalize()} is", len(result))
/home/ubuntu/frb-analysis/.frb-analysis/lib/python3.12/site-packages/sklearn/metrics/_classification.py:1565: UndefinedMetricWarning: Precision is ill-defined and being set to 0.0 in labels with no predicted samples. Use `zero_division` parameter to control this behavior.
  _warn_prf(average, modifier, f"{metric.capitalize()} is", len(result))
/home/ubuntu/frb-analysis/.frb-analysis/lib/python3.12/site-packages/sklearn/metrics/_classification.py:1565: UndefinedMetricWarning: Precision is ill-defined and being set to 0.0 in labels with no predicted samples. Use `zero_division` parameter to control this behavior.
  _warn_prf(average, modifier, f"{metric.capitalize()} is", len(result))
/home/ubuntu/frb-analysis/.frb-analysis/lib/python3.12/site-packages/sklearn/metrics/_classification.py:1565: UndefinedMetricWarning: Precision is ill-defined and being set to 0.0 in labels with no predicted samples. Use `zero_division` parameter to control this behavior.
  _warn_prf(average, modifier, f"{metric.capitalize()} is", len(result))
/home/ubuntu/frb-analysis/.frb-analysis/lib/python3.12/site-packages/sklearn/metrics/_classification.py:1565: UndefinedMetricWarning: Precision is ill-defined and being set to 0.0 in labels with no predicted samples. Use `zero_division` parameter to control this behavior.
  _warn_prf(average, modifier, f"{metric.capitalize()} is", len(result))
/home/ubuntu/frb-analysis/.frb-analysis/lib/python3.12/site-packages/sklearn/metrics/_classification.py:1565: UndefinedMetricWarning: Precision is ill-defined and being set to 0.0 in labels with no predicted samples. Use `zero_division` parameter to control this behavior.
  _warn_prf(average, modifier, f"{metric.capitalize()} is", len(result))
/home/ubuntu/frb-analysis/.frb-analysis/lib/python3.12/site-packages/sklearn/metrics/_classification.py:1565: UndefinedMetricWarning: Precision is ill-defined and being set to 0.0 in labels with no predicted samples. Use `zero_division` parameter to control this behavior.
  _warn_prf(average, modifier, f"{metric.capitalize()} is", len(result))
[I 2025-06-13 15:59:29,324] Trial 348 finished with value: 0.08644967682363804 and parameters: {'hidden_dim': 1417, 'latent_dim': 31, 'beta': 1.4619783836011928, 'gamma': 0.14868149317026216, 'dropout_rate': 0.1310347987065144, 'lr': 0.009803592281160942, 'scheduler_patience': 7, 'class_weight': 2.8925651852137064, 'activation': 'ReLU', 'classification_multiplier': 14218.58101944269}. Best is trial 194 with value: 0.8103647276084949.
[I 2025-06-13 16:06:08,798] Trial 349 finished with value: 0.7070637119113573 and parameters: {'hidden_dim': 1510, 'latent_dim': 30, 'beta': 1.3963967291316604, 'gamma': 0.19927791660245697, 'dropout_rate': 0.10599170262121196, 'lr': 0.0007652721187669238, 'scheduler_patience': 7, 'class_weight': 2.8073587890766434, 'activation': 'ReLU', 'classification_multiplier': 14720.172297481744}. Best is trial 194 with value: 0.8103647276084949.
              precision    recall  f1-score   support

Non-Repeater       0.18      0.99      0.31       150
    Repeater       1.00      0.58      0.73      1583

    accuracy                           0.62      1733
   macro avg       0.59      0.79      0.52      1733
weighted avg       0.93      0.62      0.70      1733

Confusion Matrix:
 [[149   1]
 [665 918]]

=== Fold 5/5 ===
Validation Accuracy: 0.7500
Classification Report:
               precision    recall  f1-score   support

Non-Repeater       0.25      0.97      0.40       149
    Repeater       1.00      0.73      0.84      1583

    accuracy                           0.75      1732
   macro avg       0.62      0.85      0.62      1732
weighted avg       0.93      0.75      0.80      1732

Confusion Matrix:
 [[ 145    4]
 [ 429 1154]]


=== Summary ===
Total False Positives: 8
Total False Negatives: 2793
Total True Positives: 5123
Total True Negatives: 740

Confusion Matrix (with duplicates):
              Non-Repeater  Repeater
Non-Repeater         740.0       8.0
Repeater            2793.0    5123.0
accuracy_score
0.676708217913204
Trial 1: hidden_dim=1445, latent_dim=31, beta=1.4228347267582093, gamma=0.2537461604186726, dropout_rate=0.40611813660853513, lr=0.0004730497731768344, scheduler_patience=7, class_weight=2.955083247145365, activation=ReLU, classification_multiplier=14436.028251934062

=== Fold 1/5 ===
Validation Accuracy: 0.0860
Classification Report:
               precision    recall  f1-score   support

Non-Repeater       0.09      1.00      0.16       149
    Repeater       0.00      0.00      0.00      1584

    accuracy                           0.09      1733
   macro avg       0.04      0.50      0.08      1733
weighted avg       0.01      0.09      0.01      1733

Confusion Matrix:
 [[ 149    0]
 [1584    0]]

=== Fold 2/5 ===
Validation Accuracy: 0.0871
Classification Report:
               precision    recall  f1-score   support

Non-Repeater       0.09      1.00      0.16       150
    Repeater       1.00      0.00      0.00      1583

    accuracy                           0.09      1733
   macro avg       0.54      0.50      0.08      1733
weighted avg       0.92      0.09      0.01      1733

Confusion Matrix:
 [[ 150    0]
 [1582    1]]

=== Fold 3/5 ===
Validation Accuracy: 0.0866
Classification Report:
               precision    recall  f1-score   support

Non-Repeater       0.09      1.00      0.16       150
    Repeater       0.00      0.00      0.00      1583

    accuracy                           0.09      1733
   macro avg       0.04      0.50      0.08      1733
weighted avg       0.01      0.09      0.01      1733

Confusion Matrix:
 [[ 150    0]
 [1583    0]]

=== Fold 4/5 ===
Validation Accuracy: 0.0866
Classification Report:
               precision    recall  f1-score   support

Non-Repeater       0.09      1.00      0.16       150
    Repeater       0.00      0.00      0.00      1583

    accuracy                           0.09      1733
   macro avg       0.04      0.50      0.08      1733
weighted avg       0.01      0.09      0.01      1733

Confusion Matrix:
 [[ 150    0]
 [1583    0]]

=== Fold 5/5 ===
Validation Accuracy: 0.0860
Classification Report:
               precision    recall  f1-score   support

Non-Repeater       0.09      1.00      0.16       149
    Repeater       0.00      0.00      0.00      1583

    accuracy                           0.09      1732
   macro avg       0.04      0.50      0.08      1732
weighted avg       0.01      0.09      0.01      1732

Confusion Matrix:
 [[ 149    0]
 [1583    0]]


=== Summary ===
Total False Positives: 0
Total False Negatives: 7915
Total True Positives: 1
Total True Negatives: 748

Confusion Matrix (with duplicates):
              Non-Repeater  Repeater
Non-Repeater         748.0       0.0
Repeater            7915.0       1.0
accuracy_score
0.08644967682363804
Trial 1: hidden_dim=1417, latent_dim=31, beta=1.4619783836011928, gamma=0.14868149317026216, dropout_rate=0.1310347987065144, lr=0.009803592281160942, scheduler_patience=7, class_weight=2.8925651852137064, activation=ReLU, classification_multiplier=14218.58101944269

=== Fold 1/5 ===
Validation Accuracy: 0.8817
Classification Report:
               precision    recall  f1-score   support

Non-Repeater       0.42      0.97      0.59       149
    Repeater       1.00      0.87      0.93      1584

    accuracy                           0.88      1733
   macro avg       0.71      0.92      0.76      1733
weighted avg       0.95      0.88      0.90      1733

Confusion Matrix:
 [[ 145    4]
 [ 201 1383]]

=== Fold 2/5 ===
Validation Accuracy: 0.4414
Classification Report:
               precision    recall  f1-score   support

Non-Repeater       0.13      0.99      0.24       150
    Repeater       1.00      0.39      0.56      1583

    accuracy                           0.44      1733
   macro avg       0.57      0.69      0.40      1733
weighted avg       0.92      0.44      0.53      1733

Confusion Matrix:
 [[149   1]
 [967 616]]

=== Fold 3/5 ===
Validation Accuracy: 0.6942
Classification Report:
               precision    recall  f1-score   support

Non-Repeater       0.22      0.97      0.36       150
    Repeater       1.00      0.67      0.80      1583

    accuracy                           0.69      1733
   macro avg       0.61      0.82      0.58      1733
weighted avg       0.93      0.69      0.76      1733

Confusion Matrix:
 [[ 146    4]
 [ 526 1057]]

=== Fold 4/5 ===
Validation Accuracy: 0.7784
Classification Report:
               precision    recall  f1-score   support

Non-Repeater       0.28      0.99      0.44       150
    Repeater       1.00      0.76      0.86      1583

    accuracy                           0.78      1733
   macro avg       0.64      0.87      0.65      1733
weighted avg       0.94      0.78      0.83      1733

Confusion Matrix:
 [[ 148    2]
 [ 382 1201]]

=== Fold 5/5 ===
Validation Accuracy: 0.7396
Classification Report:
               precision    recall  f1-score   support

Non-Repeater       0.25      0.98      0.39       149
    Repeater       1.00      0.72      0.83      1583

    accuracy                           0.74      1732
   macro avg       0.62      0.85      0.61      1732
weighted avg       0.93      0.74      0.80      1732

Confusion Matrix:
 [[ 146    3]
 [ 448 1135]]


=== Summary ===
Total False Positives: 14
Total False Negatives: 2524
Total True Positives: 5392
Total True Negatives: 734

Confusion Matrix (with duplicates):
              Non-Repeater  Repeater
Non-Repeater         734.0      14.0
Repeater            2524.0    5392.0
accuracy_score
0.7070637119113573
Trial 1: hidden_dim=1510, latent_dim=30, beta=1.3963967291316604, gamma=0.19927791660245697, dropout_rate=0.10599170262121196, lr=0.0007652721187669238, scheduler_patience=7, class_weight=2.8073587890766434, activation=ReLU, classification_multiplier=14720.172297481744
