[I 2025-06-12 11:51:24,129] Trial 82 finished with value: 0.666089566020314 and parameters: {'hidden_dim': 1332, 'latent_dim': 29, 'beta': 0.5960681178944391, 'gamma': 0.41315036796119986, 'dropout_rate': 0.19424038576797248, 'lr': 0.0009017419082122487, 'scheduler_patience': 7, 'class_weight': 1.4280288084233657, 'activation': 'ReLU', 'classification_multiplier': 7375.270308322102}. Best is trial 72 with value: 0.7479224376731302.
              precision    recall  f1-score   support

Non-Repeater       0.12      1.00      0.21       149
    Repeater       1.00      0.30      0.46      1583

    accuracy                           0.36      1732
   macro avg       0.56      0.65      0.34      1732
weighted avg       0.92      0.36      0.44      1732

Confusion Matrix:
 [[ 149    0]
 [1111  472]]


=== Summary ===
Total False Positives: 2
Total False Negatives: 4721
Total True Positives: 3195
Total True Negatives: 746

Confusion Matrix (with duplicates):
              Non-Repeater  Repeater
Non-Repeater         746.0       2.0
Repeater            4721.0    3195.0
accuracy_score
0.454870729455217
Trial 1: hidden_dim=417, latent_dim=10, beta=1.2177067253423133, gamma=0.1021847788788382, dropout_rate=0.11013921661678544, lr=0.002870155789457772, scheduler_patience=2, class_weight=1.5654812922324397, activation=ReLU, classification_multiplier=6850.062867330895

=== Fold 1/5 ===
Validation Accuracy: 0.6855
Classification Report:
               precision    recall  f1-score   support

Non-Repeater       0.21      0.99      0.35       149
    Repeater       1.00      0.66      0.79      1584

    accuracy                           0.69      1733
   macro avg       0.61      0.82      0.57      1733
weighted avg       0.93      0.69      0.75      1733

Confusion Matrix:
 [[ 148    1]
 [ 544 1040]]

=== Fold 2/5 ===
Validation Accuracy: 0.6578
Classification Report:
               precision    recall  f1-score   support

Non-Repeater       0.20      0.99      0.33       150
    Repeater       1.00      0.63      0.77      1583

    accuracy                           0.66      1733
   macro avg       0.60      0.81      0.55      1733
weighted avg       0.93      0.66      0.73      1733

Confusion Matrix:
 [[149   1]
 [592 991]]

=== Fold 3/5 ===
Validation Accuracy: 0.6544
Classification Report:
               precision    recall  f1-score   support

Non-Repeater       0.20      0.99      0.33       150
    Repeater       1.00      0.62      0.77      1583

    accuracy                           0.65      1733
   macro avg       0.60      0.81      0.55      1733
weighted avg       0.93      0.65      0.73      1733

Confusion Matrix:
 [[149   1]
 [598 985]]

=== Fold 4/5 ===
Validation Accuracy: 0.6497
Classification Report:
               precision    recall  f1-score   support

Non-Repeater       0.20      0.99      0.33       150
    Repeater       1.00      0.62      0.76      1583

    accuracy                           0.65      1733
   macro avg       0.60      0.81      0.55      1733
weighted avg       0.93      0.65      0.73      1733

Confusion Matrix:
 [[149   1]
 [606 977]]

=== Fold 5/5 ===
Validation Accuracy: 0.7436
Classification Report:
               precision    recall  f1-score   support

Non-Repeater       0.25      0.99      0.40       149
    Repeater       1.00      0.72      0.84      1583

    accuracy                           0.74      1732
   macro avg       0.62      0.85      0.62      1732
weighted avg       0.93      0.74      0.80      1732

Confusion Matrix:
 [[ 147    2]
 [ 442 1141]]


=== Summary ===
Total False Positives: 6
Total False Negatives: 2782
Total True Positives: 5134
Total True Negatives: 742

Confusion Matrix (with duplicates):
              Non-Repeater  Repeater
Non-Repeater         742.0       6.0
Repeater            2782.0    5134.0
accuracy_score
0.6782086795937211
Trial 1: hidden_dim=1204, latent_dim=31, beta=1.5115509449314473, gamma=0.6039784216355587, dropout_rate=0.17719227278116487, lr=0.00037424623825507545, scheduler_patience=7, class_weight=1.3296018841491886, activation=ReLU, classification_multiplier=14020.054672226295

=== Fold 1/5 ===
Validation Accuracy: 0.6797
Classification Report:
               precision    recall  f1-score   support

Non-Repeater       0.21      0.99      0.35       149
    Repeater       1.00      0.65      0.79      1584

    accuracy                           0.68      1733
   macro avg       0.60      0.82      0.57      1733
weighted avg       0.93      0.68      0.75      1733

Confusion Matrix:
 [[ 147    2]
 [ 553 1031]]

=== Fold 2/5 ===
Validation Accuracy: 0.6319
Classification Report:
               precision    recall  f1-score   support

Non-Repeater       0.19      0.99      0.32       150
    Repeater       1.00      0.60      0.75      1583

    accuracy                           0.63      1733
   macro avg       0.59      0.80      0.53      1733
weighted avg       0.93      0.63      0.71      1733

Confusion Matrix:
 [[149   1]
 [637 946]]

=== Fold 3/5 ===
Validation Accuracy: 0.6671
Classification Report:
               precision    recall  f1-score   support

Non-Repeater       0.21      0.99      0.34       150
    Repeater       1.00      0.64      0.78      1583

    accuracy                           0.67      1733
   macro avg       0.60      0.81      0.56      1733
weighted avg       0.93      0.67      0.74      1733

Confusion Matrix:
 [[ 149    1]
 [ 576 1007]]

=== Fold 4/5 ===
Validation Accuracy: 0.6503
Classification Report:
               precision    recall  f1-score   support

Non-Repeater       0.20      0.99      0.33       150
    Repeater       1.00      0.62      0.76      1583

    accuracy                           0.65      1733
   macro avg       0.60      0.80      0.55      1733
weighted avg       0.93      0.65      0.73      1733

Confusion Matrix:
 [[148   2]
 [604 979]]

=== Fold 5/5 ===
Validation Accuracy: 0.7015
Classification Report:
               precision    recall  f1-score   support

Non-Repeater       0.22      0.99      0.36       149
    Repeater       1.00      0.67      0.80      1583

    accuracy                           0.70      1732
   macro avg       0.61      0.83      0.58      1732
weighted avg       0.93      0.70      0.77      1732

Confusion Matrix:
 [[ 148    1]
 [ 516 1067]]


=== Summary ===
Total False Positives: 7
Total False Negatives: 2886
Total True Positives: 5030
Total True Negatives: 741

Confusion Matrix (with duplicates):
              Non-Repeater  Repeater
Non-Repeater         741.0       7.0
Repeater            2886.0    5030.0
accuracy_score
0.666089566020314
Trial 1: hidden_dim=1332, latent_dim=29, beta=0.5960681178944391, gamma=0.41315036796119986, dropout_rate=0.19424038576797248, lr=0.0009017419082122487, scheduler_patience=7, class_weight=1.4280288084233657, activation=ReLU, classification_multiplier=7375.270308322102

=== Fold 1/5 ===
Validation Accuracy: 0.6919
Classification Report:
               precision    recall  f1-score   support

Non-Repeater       0.22      0.99      0.36       149
    Repeater       1.00      0.66      0.80      1584

    accuracy                           0.69      1733
   macro avg       0.61      0.83      0.58      1733
weighted avg       0.93      0.69      0.76      1733

Confusion Matrix:
 [[ 148    1]
 [ 533 1051]]

=== Fold 2/5 ===
Validation Accuracy: 0.6838
Classification Report:
               precision    recall  f1-score   support

Non-Repeater       0.21      0.99      0.35       150
    Repeater       1.00      0.65      0.79      1583

    accuracy                           0.68      1733
   macro avg       0.61      0.82      0.57      1733
weighted avg       0.93      0.68      0.75      1733

Confusion Matrix:
 [[ 149    1]
 [ 547 1036]]

=== Fold 3/5 ===
Validation Accuracy: 0.5782
Classification Report:
               precision    recall  f1-score   support

Non-Repeater       0.17      0.99      0.29       150
    Repeater       1.00      0.54      0.70      1583

    accuracy                           0.58      1733
   macro avg       0.58      0.77      0.49      1733
weighted avg       0.93      0.58      0.66      1733

Confusion Matrix:
 [[149   1]
 [730 853]]

=== Fold 4/5 ===
Validation Accuracy: 0.6561
Classification Report:
 [I 2025-06-12 11:58:05,208] Trial 83 finished with value: 0.6674746075715605 and parameters: {'hidden_dim': 1501, 'latent_dim': 25, 'beta': 1.2491671050564397, 'gamma': 0.2489383211272147, 'dropout_rate': 0.18654698594705432, 'lr': 0.0006755324774982854, 'scheduler_patience': 6, 'class_weight': 1.5213590516467466, 'activation': 'ReLU', 'classification_multiplier': 8557.426703065747}. Best is trial 72 with value: 0.7479224376731302.
/home/ubuntu/frb-analysis/.frb-analysis/lib/python3.12/site-packages/sklearn/metrics/_classification.py:1565: UndefinedMetricWarning: Precision is ill-defined and being set to 0.0 in labels with no predicted samples. Use `zero_division` parameter to control this behavior.
  _warn_prf(average, modifier, f"{metric.capitalize()} is", len(result))
/home/ubuntu/frb-analysis/.frb-analysis/lib/python3.12/site-packages/sklearn/metrics/_classification.py:1565: UndefinedMetricWarning: Precision is ill-defined and being set to 0.0 in labels with no predicted samples. Use `zero_division` parameter to control this behavior.
  _warn_prf(average, modifier, f"{metric.capitalize()} is", len(result))
/home/ubuntu/frb-analysis/.frb-analysis/lib/python3.12/site-packages/sklearn/metrics/_classification.py:1565: UndefinedMetricWarning: Precision is ill-defined and being set to 0.0 in labels with no predicted samples. Use `zero_division` parameter to control this behavior.
  _warn_prf(average, modifier, f"{metric.capitalize()} is", len(result))
/home/ubuntu/frb-analysis/.frb-analysis/lib/python3.12/site-packages/sklearn/metrics/_classification.py:1565: UndefinedMetricWarning: Precision is ill-defined and being set to 0.0 in labels with no predicted samples. Use `zero_division` parameter to control this behavior.
  _warn_prf(average, modifier, f"{metric.capitalize()} is", len(result))
/home/ubuntu/frb-analysis/.frb-analysis/lib/python3.12/site-packages/sklearn/metrics/_classification.py:1565: UndefinedMetricWarning: Precision is ill-defined and being set to 0.0 in labels with no predicted samples. Use `zero_division` parameter to control this behavior.
  _warn_prf(average, modifier, f"{metric.capitalize()} is", len(result))
/home/ubuntu/frb-analysis/.frb-analysis/lib/python3.12/site-packages/sklearn/metrics/_classification.py:1565: UndefinedMetricWarning: Precision is ill-defined and being set to 0.0 in labels with no predicted samples. Use `zero_division` parameter to control this behavior.
  _warn_prf(average, modifier, f"{metric.capitalize()} is", len(result))
/home/ubuntu/frb-analysis/.frb-analysis/lib/python3.12/site-packages/sklearn/metrics/_classification.py:1565: UndefinedMetricWarning: Precision is ill-defined and being set to 0.0 in labels with no predicted samples. Use `zero_division` parameter to control this behavior.
  _warn_prf(average, modifier, f"{metric.capitalize()} is", len(result))
/home/ubuntu/frb-analysis/.frb-analysis/lib/python3.12/site-packages/sklearn/metrics/_classification.py:1565: UndefinedMetricWarning: Precision is ill-defined and being set to 0.0 in labels with no predicted samples. Use `zero_division` parameter to control this behavior.
  _warn_prf(average, modifier, f"{metric.capitalize()} is", len(result))
/home/ubuntu/frb-analysis/.frb-analysis/lib/python3.12/site-packages/sklearn/metrics/_classification.py:1565: UndefinedMetricWarning: Precision is ill-defined and being set to 0.0 in labels with no predicted samples. Use `zero_division` parameter to control this behavior.
  _warn_prf(average, modifier, f"{metric.capitalize()} is", len(result))
[I 2025-06-12 12:03:52,381] Trial 84 finished with value: 0.27331486611265005 and parameters: {'hidden_dim': 974, 'latent_dim': 28, 'beta': 1.407735377570373, 'gamma': 0.5038805635176585, 'dropout_rate': 0.12335018739796641, 'lr': 0.007365166885689372, 'scheduler_patience': 7, 'class_weight': 1.6651515486255986, 'activation': 'ReLU', 'classification_multiplier': 7667.8423140756395}. Best is trial 72 with value: 0.7479224376731302.
[I 2025-06-12 12:09:24,608] Trial 85 finished with value: 0.20267774699907665 and parameters: {'hidden_dim': 771, 'latent_dim': 33, 'beta': 1.342250418962427, 'gamma': 1.1372848268529867, 'dropout_rate': 0.13987473961488864, 'lr': 0.001046442256719741, 'scheduler_patience': 4, 'class_weight': 1.0631017533382603, 'activation': 'SELU', 'classification_multiplier': 5473.743828024175}. Best is trial 72 with value: 0.7479224376731302.
              precision    recall  f1-score   support

Non-Repeater       0.20      0.99      0.33       150
    Repeater       1.00      0.62      0.77      1583

    accuracy                           0.66      1733
   macro avg       0.60      0.81      0.55      1733
weighted avg       0.93      0.66      0.73      1733

Confusion Matrix:
 [[149   1]
 [595 988]]

=== Fold 5/5 ===
Validation Accuracy: 0.7275
Classification Report:
               precision    recall  f1-score   support

Non-Repeater       0.24      0.98      0.38       149
    Repeater       1.00      0.70      0.83      1583

    accuracy                           0.73      1732
   macro avg       0.62      0.84      0.60      1732
weighted avg       0.93      0.73      0.79      1732

Confusion Matrix:
 [[ 146    3]
 [ 469 1114]]


=== Summary ===
Total False Positives: 7
Total False Negatives: 2874
Total True Positives: 5042
Total True Negatives: 741

Confusion Matrix (with duplicates):
              Non-Repeater  Repeater
Non-Repeater         741.0       7.0
Repeater            2874.0    5042.0
accuracy_score
0.6674746075715605
Trial 1: hidden_dim=1501, latent_dim=25, beta=1.2491671050564397, gamma=0.2489383211272147, dropout_rate=0.18654698594705432, lr=0.0006755324774982854, scheduler_patience=6, class_weight=1.5213590516467466, activation=ReLU, classification_multiplier=8557.426703065747

=== Fold 1/5 ===
Validation Accuracy: 0.0860
Classification Report:
               precision    recall  f1-score   support

Non-Repeater       0.09      1.00      0.16       149
    Repeater       0.00      0.00      0.00      1584

    accuracy                           0.09      1733
   macro avg       0.04      0.50      0.08      1733
weighted avg       0.01      0.09      0.01      1733

Confusion Matrix:
 [[ 149    0]
 [1584    0]]

=== Fold 2/5 ===
Validation Accuracy: 0.0866
Classification Report:
               precision    recall  f1-score   support

Non-Repeater       0.09      1.00      0.16       150
    Repeater       0.00      0.00      0.00      1583

    accuracy                           0.09      1733
   macro avg       0.04      0.50      0.08      1733
weighted avg       0.01      0.09      0.01      1733

Confusion Matrix:
 [[ 150    0]
 [1583    0]]

=== Fold 3/5 ===
Validation Accuracy: 0.5747
Classification Report:
               precision    recall  f1-score   support

Non-Repeater       0.17      0.99      0.29       150
    Repeater       1.00      0.54      0.70      1583

    accuracy                           0.57      1733
   macro avg       0.58      0.76      0.49      1733
weighted avg       0.93      0.57      0.66      1733

Confusion Matrix:
 [[148   2]
 [735 848]]

=== Fold 4/5 ===
Validation Accuracy: 0.5332
Classification Report:
               precision    recall  f1-score   support

Non-Repeater       0.15      0.99      0.27       150
    Repeater       1.00      0.49      0.66      1583

    accuracy                           0.53      1733
   macro avg       0.58      0.74      0.46      1733
weighted avg       0.92      0.53      0.62      1733

Confusion Matrix:
 [[148   2]
 [807 776]]

=== Fold 5/5 ===
Validation Accuracy: 0.0860
Classification Report:
               precision    recall  f1-score   support

Non-Repeater       0.09      1.00      0.16       149
    Repeater       0.00      0.00      0.00      1583

    accuracy                           0.09      1732
   macro avg       0.04      0.50      0.08      1732
weighted avg       0.01      0.09      0.01      1732

Confusion Matrix:
 [[ 149    0]
 [1583    0]]


=== Summary ===
Total False Positives: 4
Total False Negatives: 6292
Total True Positives: 1624
Total True Negatives: 744

Confusion Matrix (with duplicates):
              Non-Repeater  Repeater
Non-Repeater         744.0       4.0
Repeater            6292.0    1624.0
accuracy_score
0.27331486611265005
Trial 1: hidden_dim=974, latent_dim=28, beta=1.407735377570373, gamma=0.5038805635176585, dropout_rate=0.12335018739796641, lr=0.007365166885689372, scheduler_patience=7, class_weight=1.6651515486255986, activation=ReLU, classification_multiplier=7667.8423140756395

=== Fold 1/5 ===
Validation Accuracy: 0.2683
Classification Report:
               precision    recall  f1-score   support

Non-Repeater       0.11      1.00      0.19       149
    Repeater       1.00      0.20      0.33      1584

    accuracy                           0.27      1733
   macro avg       0.55      0.60      0.26      1733
weighted avg       0.92      0.27      0.32      1733

Confusion Matrix:
 [[ 149    0]
 [1268  316]]

=== Fold 2/5 ===
Validation Accuracy: 0.1708
Classification Report:
               precision    recall  f1-score   support

Non-Repeater       0.09      1.00      0.17       150
    Repeater       1.00      0.09      0.17      1583

    accuracy                           0.17      1733
   macro avg       0.55      0.55      0.17      1733
weighted avg       0.92      0.17      0.17      1733

Confusion Matrix:
 [[ 150    0]
 [1437  146]]

=== Fold 3/5 ===
Validation Accuracy: 0.1235
Classification Report:
               precision    recall  f1-score   support

Non-Repeater       0.09      1.00      0.16       150
    Repeater       1.00      0.04      0.08      1583

    accuracy                           0.12      1733
   macro avg       0.54      0.52      0.12      1733
weighted avg       0.92      0.12      0.09      1733

Confusion Matrix:
 [[ 150    0]
 [1519   64]]

=== Fold 4/5 ===
Validation Accuracy: 0.2152
Classification Report:
               precision    recall  f1-score   support

Non-Repeater       0.10      1.00      0.18       150
    Repeater       1.00      0.14      0.25      1583

    accuracy                           0.22      1733
   macro avg       0.55      0.57      0.21      1733
weighted avg       0.92      0.22      0.24      1733

Confusion Matrix:
 [[ 150    0]
 [1360  223]]

=== Fold 5/5 ===
Validation Accuracy: 0.2356
Classification Report:
               precision    recall  f1-score   support

Non-Repeater       0.10      1.00      0.18       149
    Repeater       1.00      0.16      0.28      1583

    accuracy                           0.24      1732
   macro avg       0.55      0.58      0.23      1732
weighted avg       0.92      0.24      0.27      1732

Confusion Matrix:
 [[ 149    0]
 [1324  259]]


=== Summary ===
Total False Positives: 0
Total False Negatives: 6908
Total True Positives: 1008
Total True Negatives: 748

Confusion Matrix (with duplicates):
              Non-Repeater  Repeater
Non-Repeater         748.0       0.0
Repeater            6908.0    1008.0
accuracy_score
0.20267774699907665
Trial 1: hidden_dim=771, latent_dim=33, beta=1.342250418962427, gamma=1.1372848268529867, dropout_rate=0.13987473961488864, lr=0.001046442256719741, scheduler_patience=4, class_weight=1.0631017533382603, activation=SELU, classification_multiplier=5473.743828024175

=== Fold 1/5 ===
Validation Accuracy: 0.6826
Classification Report:
               precision    recall  f1-score   support

Non-Repeater       0.21      0.99      0.35       149
    Repeater       1.00      0.65      0.79      1584

    accuracy                           0.68      1733
   macro avg       0.61      0.82      0.57      1733
weighted avg       0.93      0.68      0.75      1733

Confusion Matrix:
 [[ 148    1]
 [ 549 1035]]

=== Fold 2/5 ===
Validation Accuracy: 0.6947
Classification Report:
               precision    recall  f1-score   support

Non-Repeater       0.22      0.99      0.36       150
    Repeater       1.00      0.67      0.80      1583

    accuracy                           0.69      1733
   macro avg       0.61      0.83      0.58      1733
weighted avg       0.93      0.69      0.76      1733

Confusion Matrix:
 [[ 149    1]
 [ 528 1055]]

=== Fold 3/5 ===
Validation Accuracy: 0.6520
Classification Report:
 [I 2025-06-12 12:15:20,409] Trial 86 finished with value: 0.6869806094182825 and parameters: {'hidden_dim': 1071, 'latent_dim': 30, 'beta': 0.7274024351252736, 'gamma': 0.17234560752913866, 'dropout_rate': 0.15115919886203988, 'lr': 0.0003212791161263791, 'scheduler_patience': 6, 'class_weight': 1.5854865235449147, 'activation': 'ReLU', 'classification_multiplier': 5900.140399416191}. Best is trial 72 with value: 0.7479224376731302.
[I 2025-06-12 12:22:49,162] Trial 87 finished with value: 0.38377192982456143 and parameters: {'hidden_dim': 1929, 'latent_dim': 30, 'beta': 0.41543347214266624, 'gamma': 0.15505221886724008, 'dropout_rate': 0.15362997704657455, 'lr': 0.0018481420612018891, 'scheduler_patience': 5, 'class_weight': 2.035375229126775, 'activation': 'ReLU', 'classification_multiplier': 5833.565231552195}. Best is trial 72 with value: 0.7479224376731302.
