[I 2025-06-12 05:09:58,185] Trial 15 finished with value: 0.5593259464450601 and parameters: {'hidden_dim': 920, 'latent_dim': 32, 'beta': 1.6860539572750497, 'gamma': 1.374693747388085, 'dropout_rate': 0.29429584417264915, 'lr': 0.004813134378651271, 'scheduler_patience': 7, 'class_weight': 1.8990059862577047, 'activation': 'ReLU', 'classification_multiplier': 13082.621247868588}. Best is trial 12 with value: 0.6759002770083102.
/home/ubuntu/frb-analysis/.frb-analysis/lib/python3.12/site-packages/sklearn/metrics/_classification.py:1565: UndefinedMetricWarning: Precision is ill-defined and being set to 0.0 in labels with no predicted samples. Use `zero_division` parameter to control this behavior.
  _warn_prf(average, modifier, f"{metric.capitalize()} is", len(result))
/home/ubuntu/frb-analysis/.frb-analysis/lib/python3.12/site-packages/sklearn/metrics/_classification.py:1565: UndefinedMetricWarning: Precision is ill-defined and being set to 0.0 in labels with no predicted samples. Use `zero_division` parameter to control this behavior.
  _warn_prf(average, modifier, f"{metric.capitalize()} is", len(result))
/home/ubuntu/frb-analysis/.frb-analysis/lib/python3.12/site-packages/sklearn/metrics/_classification.py:1565: UndefinedMetricWarning: Precision is ill-defined and being set to 0.0 in labels with no predicted samples. Use `zero_division` parameter to control this behavior.
  _warn_prf(average, modifier, f"{metric.capitalize()} is", len(result))
/home/ubuntu/frb-analysis/.frb-analysis/lib/python3.12/site-packages/sklearn/metrics/_classification.py:1565: UndefinedMetricWarning: Precision is ill-defined and being set to 0.0 in labels with no predicted samples. Use `zero_division` parameter to control this behavior.
  _warn_prf(average, modifier, f"{metric.capitalize()} is", len(result))
/home/ubuntu/frb-analysis/.frb-analysis/lib/python3.12/site-packages/sklearn/metrics/_classification.py:1565: UndefinedMetricWarning: Precision is ill-defined and being set to 0.0 in labels with no predicted samples. Use `zero_division` parameter to control this behavior.
  _warn_prf(average, modifier, f"{metric.capitalize()} is", len(result))
/home/ubuntu/frb-analysis/.frb-analysis/lib/python3.12/site-packages/sklearn/metrics/_classification.py:1565: UndefinedMetricWarning: Precision is ill-defined and being set to 0.0 in labels with no predicted samples. Use `zero_division` parameter to control this behavior.
  _warn_prf(average, modifier, f"{metric.capitalize()} is", len(result))
/home/ubuntu/frb-analysis/.frb-analysis/lib/python3.12/site-packages/sklearn/metrics/_classification.py:1565: UndefinedMetricWarning: Precision is ill-defined and being set to 0.0 in labels with no predicted samples. Use `zero_division` parameter to control this behavior.
  _warn_prf(average, modifier, f"{metric.capitalize()} is", len(result))
/home/ubuntu/frb-analysis/.frb-analysis/lib/python3.12/site-packages/sklearn/metrics/_classification.py:1565: UndefinedMetricWarning: Precision is ill-defined and being set to 0.0 in labels with no predicted samples. Use `zero_division` parameter to control this behavior.
  _warn_prf(average, modifier, f"{metric.capitalize()} is", len(result))
/home/ubuntu/frb-analysis/.frb-analysis/lib/python3.12/site-packages/sklearn/metrics/_classification.py:1565: UndefinedMetricWarning: Precision is ill-defined and being set to 0.0 in labels with no predicted samples. Use `zero_division` parameter to control this behavior.
  _warn_prf(average, modifier, f"{metric.capitalize()} is", len(result))
/home/ubuntu/frb-analysis/.frb-analysis/lib/python3.12/site-packages/sklearn/metrics/_classification.py:1565: UndefinedMetricWarning: Precision is ill-defined and being set to 0.0 in labels with no predicted samples. Use `zero_division` parameter to control this behavior.
  _warn_prf(average, modifier, f"{metric.capitalize()} is", len(result))
/home/ubuntu/frb-analysis/.frb-analysis/lib/python3.12/site-packages/sklearn/metrics/_classification.py:1565: UndefinedMetricWarning: Precision is ill-defined and being set to 0.0 in labels with no predicted samples. Use `zero_division` parameter to control this behavior.
  _warn_prf(average, modifier, f"{metric.capitalize()} is", len(result))
/home/ubuntu/frb-analysis/.frb-analysis/lib/python3.12/site-packages/sklearn/metrics/_classification.py:1565: UndefinedMetricWarning: Precision is ill-defined and being set to 0.0 in labels with no predicted samples. Use `zero_division` parameter to control this behavior.
  _warn_prf(average, modifier, f"{metric.capitalize()} is", len(result))
/home/ubuntu/frb-analysis/.frb-analysis/lib/python3.12/site-packages/sklearn/metrics/_classification.py:1565: UndefinedMetricWarning: Precision is ill-defined and being set to 0.0 in labels with no predicted samples. Use `zero_division` parameter to control this behavior.
  _warn_prf(average, modifier, f"{metric.capitalize()} is", len(result))
/home/ubuntu/frb-analysis/.frb-analysis/lib/python3.12/site-packages/sklearn/metrics/_classification.py:1565: UndefinedMetricWarning: Precision is ill-defined and being set to 0.0 in labels with no predicted samples. Use `zero_division` parameter to control this behavior.
  _warn_prf(average, modifier, f"{metric.capitalize()} is", len(result))
/home/ubuntu/frb-analysis/.frb-analysis/lib/python3.12/site-packages/sklearn/metrics/_classification.py:1565: UndefinedMetricWarning: Precision is ill-defined and being set to 0.0 in labels with no predicted samples. Use `zero_division` parameter to control this behavior.
  _warn_prf(average, modifier, f"{metric.capitalize()} is", len(result))
[I 2025-06-12 05:16:25,182] Trial 16 finished with value: 0.08633425669436749 and parameters: {'hidden_dim': 1438, 'latent_dim': 31, 'beta': 1.3021159671490579, 'gamma': 0.9421597094684069, 'dropout_rate': 0.4895060375777839, 'lr': 0.00999142058629995, 'scheduler_patience': 7, 'class_weight': 2.5665678094066062, 'activation': 'SELU', 'classification_multiplier': 11980.795160204343}. Best is trial 12 with value: 0.6759002770083102.
              precision    recall  f1-score   support

Non-Repeater       0.19      0.99      0.32       150
    Repeater       1.00      0.60      0.75      1583

    accuracy                           0.64      1733
   macro avg       0.59      0.79      0.53      1733
weighted avg       0.93      0.64      0.71      1733

Confusion Matrix:
 [[148   2]
 [630 953]]

=== Fold 5/5 ===
Validation Accuracy: 0.7165
Classification Report:
               precision    recall  f1-score   support

Non-Repeater       0.23      0.99      0.38       149
    Repeater       1.00      0.69      0.82      1583

    accuracy                           0.72      1732
   macro avg       0.62      0.84      0.60      1732
weighted avg       0.93      0.72      0.78      1732

Confusion Matrix:
 [[ 148    1]
 [ 490 1093]]


=== Summary ===
Total False Positives: 6
Total False Negatives: 2937
Total True Positives: 4979
Total True Negatives: 742

Confusion Matrix (with duplicates):
              Non-Repeater  Repeater
Non-Repeater         742.0       6.0
Repeater            2937.0    4979.0
accuracy_score
0.6603185595567868
Trial 1: hidden_dim=1013, latent_dim=31, beta=1.559182989935458, gamma=1.4336190689412405, dropout_rate=0.24636249052800172, lr=0.002216001306794945, scheduler_patience=7, class_weight=2.6219499673994537, activation=ReLU, classification_multiplier=12616.878807530336

=== Fold 1/5 ===
Validation Accuracy: 0.5095
Classification Report:
               precision    recall  f1-score   support

Non-Repeater       0.15      0.99      0.26       149
    Repeater       1.00      0.46      0.63      1584

    accuracy                           0.51      1733
   macro avg       0.57      0.73      0.45      1733
weighted avg       0.92      0.51      0.60      1733

Confusion Matrix:
 [[147   2]
 [848 736]]

=== Fold 2/5 ===
Validation Accuracy: 0.5557
Classification Report:
               precision    recall  f1-score   support

Non-Repeater       0.16      1.00      0.28       150
    Repeater       1.00      0.51      0.68      1583

    accuracy                           0.56      1733
   macro avg       0.58      0.76      0.48      1733
weighted avg       0.93      0.56      0.64      1733

Confusion Matrix:
 [[150   0]
 [770 813]]

=== Fold 3/5 ===
Validation Accuracy: 0.6244
Classification Report:
               precision    recall  f1-score   support

Non-Repeater       0.19      1.00      0.32       150
    Repeater       1.00      0.59      0.74      1583

    accuracy                           0.62      1733
   macro avg       0.59      0.79      0.53      1733
weighted avg       0.93      0.62      0.70      1733

Confusion Matrix:
 [[150   0]
 [651 932]]

=== Fold 4/5 ===
Validation Accuracy: 0.5280
Classification Report:
               precision    recall  f1-score   support

Non-Repeater       0.15      1.00      0.27       150
    Repeater       1.00      0.48      0.65      1583

    accuracy                           0.53      1733
   macro avg       0.58      0.74      0.46      1733
weighted avg       0.93      0.53      0.62      1733

Confusion Matrix:
 [[150   0]
 [818 765]]

=== Fold 5/5 ===
Validation Accuracy: 0.5791
Classification Report:
               precision    recall  f1-score   support

Non-Repeater       0.17      1.00      0.29       149
    Repeater       1.00      0.54      0.70      1583

    accuracy                           0.58      1732
   macro avg       0.58      0.77      0.50      1732
weighted avg       0.93      0.58      0.67      1732

Confusion Matrix:
 [[149   0]
 [729 854]]


=== Summary ===
Total False Positives: 2
Total False Negatives: 3816
Total True Positives: 4100
Total True Negatives: 746

Confusion Matrix (with duplicates):
              Non-Repeater  Repeater
Non-Repeater         746.0       2.0
Repeater            3816.0    4100.0
accuracy_score
0.5593259464450601
Trial 1: hidden_dim=920, latent_dim=32, beta=1.6860539572750497, gamma=1.374693747388085, dropout_rate=0.29429584417264915, lr=0.004813134378651271, scheduler_patience=7, class_weight=1.8990059862577047, activation=ReLU, classification_multiplier=13082.621247868588

=== Fold 1/5 ===
Validation Accuracy: 0.0860
Classification Report:
               precision    recall  f1-score   support

Non-Repeater       0.09      1.00      0.16       149
    Repeater       0.00      0.00      0.00      1584

    accuracy                           0.09      1733
   macro avg       0.04      0.50      0.08      1733
weighted avg       0.01      0.09      0.01      1733

Confusion Matrix:
 [[ 149    0]
 [1584    0]]

=== Fold 2/5 ===
Validation Accuracy: 0.0866
Classification Report:
               precision    recall  f1-score   support

Non-Repeater       0.09      1.00      0.16       150
    Repeater       0.00      0.00      0.00      1583

    accuracy                           0.09      1733
   macro avg       0.04      0.50      0.08      1733
weighted avg       0.01      0.09      0.01      1733

Confusion Matrix:
 [[ 150    0]
 [1583    0]]

=== Fold 3/5 ===
Validation Accuracy: 0.0866
Classification Report:
               precision    recall  f1-score   support

Non-Repeater       0.09      1.00      0.16       150
    Repeater       0.00      0.00      0.00      1583

    accuracy                           0.09      1733
   macro avg       0.04      0.50      0.08      1733
weighted avg       0.01      0.09      0.01      1733

Confusion Matrix:
 [[ 150    0]
 [1583    0]]

=== Fold 4/5 ===
Validation Accuracy: 0.0866
Classification Report:
               precision    recall  f1-score   support

Non-Repeater       0.09      1.00      0.16       150
    Repeater       0.00      0.00      0.00      1583

    accuracy                           0.09      1733
   macro avg       0.04      0.50      0.08      1733
weighted avg       0.01      0.09      0.01      1733

Confusion Matrix:
 [[ 150    0]
 [1583    0]]

=== Fold 5/5 ===
Validation Accuracy: 0.0860
Classification Report:
               precision    recall  f1-score   support

Non-Repeater       0.09      1.00      0.16       149
    Repeater       0.00      0.00      0.00      1583

    accuracy                           0.09      1732
   macro avg       0.04      0.50      0.08      1732
weighted avg       0.01      0.09      0.01      1732

Confusion Matrix:
 [[ 149    0]
 [1583    0]]


=== Summary ===
Total False Positives: 0
Total False Negatives: 7916
Total True Positives: 0
Total True Negatives: 748

Confusion Matrix (with duplicates):
              Non-Repeater  Repeater
Non-Repeater         748.0       0.0
Repeater            7916.0       0.0
accuracy_score
0.08633425669436749
Trial 1: hidden_dim=1438, latent_dim=31, beta=1.3021159671490579, gamma=0.9421597094684069, dropout_rate=0.4895060375777839, lr=0.00999142058629995, scheduler_patience=7, class_weight=2.5665678094066062, activation=SELU, classification_multiplier=11980.795160204343

=== Fold 1/5 ===
Validation Accuracy: 0.5338
Classification Report:
               precision    recall  f1-score   support

Non-Repeater       0.15      0.99      0.27       149
    Repeater       1.00      0.49      0.66      1584

    accuracy                           0.53      1733
   macro avg       0.58      0.74      0.46      1733
weighted avg       0.93      0.53      0.62      1733

Confusion Matrix:
 [[148   1]
 [807 777]]

=== Fold 2/5 ===
Validation Accuracy: 0.3745
Classification Report:
               precision    recall  f1-score   support

Non-Repeater       0.12      1.00      0.22       150
    Repeater       1.00      0.32      0.48      1583

    accuracy                           0.37      1733
   macro avg       0.56      0.66      0.35      1733
weighted avg       0.92      0.37      0.46      1733

Confusion Matrix:
 [[ 150    0]
 [1084  499]]

=== Fold 3/5 ===
Validation Accuracy: 0.6394
Classification Report:
 [I 2025-06-12 05:22:11,980] Trial 17 finished with value: 0.5308171745152355 and parameters: {'hidden_dim': 972, 'latent_dim': 32, 'beta': 1.9345640969102658, 'gamma': 1.1921970135066653, 'dropout_rate': 0.2401425237370916, 'lr': 0.0017702597554071046, 'scheduler_patience': 5, 'class_weight': 2.633809865427379, 'activation': 'LeakyReLU', 'classification_multiplier': 10465.02401693986}. Best is trial 12 with value: 0.6759002770083102.
/home/ubuntu/frb-analysis/.frb-analysis/lib/python3.12/site-packages/sklearn/metrics/_classification.py:1565: UndefinedMetricWarning: Precision is ill-defined and being set to 0.0 in labels with no predicted samples. Use `zero_division` parameter to control this behavior.
  _warn_prf(average, modifier, f"{metric.capitalize()} is", len(result))
/home/ubuntu/frb-analysis/.frb-analysis/lib/python3.12/site-packages/sklearn/metrics/_classification.py:1565: UndefinedMetricWarning: Precision is ill-defined and being set to 0.0 in labels with no predicted samples. Use `zero_division` parameter to control this behavior.
  _warn_prf(average, modifier, f"{metric.capitalize()} is", len(result))
/home/ubuntu/frb-analysis/.frb-analysis/lib/python3.12/site-packages/sklearn/metrics/_classification.py:1565: UndefinedMetricWarning: Precision is ill-defined and being set to 0.0 in labels with no predicted samples. Use `zero_division` parameter to control this behavior.
  _warn_prf(average, modifier, f"{metric.capitalize()} is", len(result))
[I 2025-06-12 05:28:53,220] Trial 18 finished with value: 0.26350415512465375 and parameters: {'hidden_dim': 1499, 'latent_dim': 22, 'beta': 1.5707234533920302, 'gamma': 1.4551293339931974, 'dropout_rate': 0.3019077152295214, 'lr': 0.004376780782353772, 'scheduler_patience': 5, 'class_weight': 1.98941167486388, 'activation': 'ReLU', 'classification_multiplier': 12629.263908060379}. Best is trial 12 with value: 0.6759002770083102.
