[I 2025-06-13 02:14:05,531] Trial 220 finished with value: 0.18397968605724838 and parameters: {'hidden_dim': 1353, 'latent_dim': 29, 'beta': 1.3140510681794912, 'gamma': 0.1853051508398568, 'dropout_rate': 0.1077818286901203, 'lr': 0.009327170356605593, 'scheduler_patience': 7, 'class_weight': 2.9501137002029654, 'activation': 'ReLU', 'classification_multiplier': 14385.771226264293}. Best is trial 194 with value: 0.8103647276084949.
              precision    recall  f1-score   support

Non-Repeater       0.26      0.99      0.42       150
    Repeater       1.00      0.74      0.85      1583

    accuracy                           0.76      1733
   macro avg       0.63      0.86      0.63      1733
weighted avg       0.93      0.76      0.81      1733

Confusion Matrix:
 [[ 148    2]
 [ 414 1169]]

=== Fold 4/5 ===
Validation Accuracy: 0.7767
Classification Report:
               precision    recall  f1-score   support

Non-Repeater       0.28      0.97      0.43       150
    Repeater       1.00      0.76      0.86      1583

    accuracy                           0.78      1733
   macro avg       0.64      0.87      0.65      1733
weighted avg       0.93      0.78      0.82      1733

Confusion Matrix:
 [[ 146    4]
 [ 383 1200]]

=== Fold 5/5 ===
Validation Accuracy: 0.7719
Classification Report:
               precision    recall  f1-score   support

Non-Repeater       0.27      0.97      0.42       149
    Repeater       1.00      0.75      0.86      1583

    accuracy                           0.77      1732
   macro avg       0.63      0.86      0.64      1732
weighted avg       0.93      0.77      0.82      1732

Confusion Matrix:
 [[ 145    4]
 [ 391 1192]]


=== Summary ===
Total False Positives: 12
Total False Negatives: 2046
Total True Positives: 5870
Total True Negatives: 736

Confusion Matrix (with duplicates):
              Non-Repeater  Repeater
Non-Repeater         736.0      12.0
Repeater            2046.0    5870.0
accuracy_score
0.7624653739612188
Trial 1: hidden_dim=1319, latent_dim=31, beta=1.2241971301876406, gamma=0.18500527627553032, dropout_rate=0.11774524313096475, lr=0.0003539332624551014, scheduler_patience=7, class_weight=2.843018990624252, activation=ReLU, classification_multiplier=13926.573465705314

=== Fold 1/5 ===
Validation Accuracy: 0.7894
Classification Report:
               precision    recall  f1-score   support

Non-Repeater       0.29      0.99      0.45       149
    Repeater       1.00      0.77      0.87      1584

    accuracy                           0.79      1733
   macro avg       0.64      0.88      0.66      1733
weighted avg       0.94      0.79      0.83      1733

Confusion Matrix:
 [[ 148    1]
 [ 364 1220]]

=== Fold 2/5 ===
Validation Accuracy: 0.7848
Classification Report:
               precision    recall  f1-score   support

Non-Repeater       0.29      0.99      0.44       150
    Repeater       1.00      0.77      0.87      1583

    accuracy                           0.78      1733
   macro avg       0.64      0.88      0.66      1733
weighted avg       0.94      0.78      0.83      1733

Confusion Matrix:
 [[ 149    1]
 [ 372 1211]]

=== Fold 3/5 ===
Validation Accuracy: 0.7386
Classification Report:
               precision    recall  f1-score   support

Non-Repeater       0.25      0.99      0.40       150
    Repeater       1.00      0.72      0.83      1583

    accuracy                           0.74      1733
   macro avg       0.62      0.85      0.61      1733
weighted avg       0.93      0.74      0.80      1733

Confusion Matrix:
 [[ 148    2]
 [ 451 1132]]

=== Fold 4/5 ===
Validation Accuracy: 0.6682
Classification Report:
               precision    recall  f1-score   support

Non-Repeater       0.20      0.98      0.34       150
    Repeater       1.00      0.64      0.78      1583

    accuracy                           0.67      1733
   macro avg       0.60      0.81      0.56      1733
weighted avg       0.93      0.67      0.74      1733

Confusion Matrix:
 [[ 147    3]
 [ 572 1011]]

=== Fold 5/5 ===
Validation Accuracy: 0.7633
Classification Report:
               precision    recall  f1-score   support

Non-Repeater       0.26      0.99      0.42       149
    Repeater       1.00      0.74      0.85      1583

    accuracy                           0.76      1732
   macro avg       0.63      0.86      0.63      1732
weighted avg       0.94      0.76      0.81      1732

Confusion Matrix:
 [[ 147    2]
 [ 408 1175]]


=== Summary ===
Total False Positives: 9
Total False Negatives: 2167
Total True Positives: 5749
Total True Negatives: 739

Confusion Matrix (with duplicates):
              Non-Repeater  Repeater
Non-Repeater         739.0       9.0
Repeater            2167.0    5749.0
accuracy_score
0.7488457987072945
Trial 1: hidden_dim=1317, latent_dim=31, beta=1.2031447248334217, gamma=0.21496710718618028, dropout_rate=0.11684400186814459, lr=0.00010358651724532531, scheduler_patience=7, class_weight=2.8707301965471053, activation=ReLU, classification_multiplier=13875.503073315685

=== Fold 1/5 ===
Validation Accuracy: 0.2297
Classification Report:
               precision    recall  f1-score   support

Non-Repeater       0.10      1.00      0.18       149
    Repeater       1.00      0.16      0.27      1584

    accuracy                           0.23      1733
   macro avg       0.55      0.58      0.23      1733
weighted avg       0.92      0.23      0.26      1733

Confusion Matrix:
 [[ 149    0]
 [1335  249]]

=== Fold 2/5 ===
Validation Accuracy: 0.0866
Classification Report:
               precision    recall  f1-score   support

Non-Repeater       0.09      1.00      0.16       150
    Repeater       0.00      0.00      0.00      1583

    accuracy                           0.09      1733
   macro avg       0.04      0.50      0.08      1733
weighted avg       0.01      0.09      0.01      1733

Confusion Matrix:
 [[ 150    0]
 [1583    0]]

=== Fold 3/5 ===
Validation Accuracy: 0.0866
Classification Report:
               precision    recall  f1-score   support

Non-Repeater       0.09      1.00      0.16       150
    Repeater       0.00      0.00      0.00      1583

    accuracy                           0.09      1733
   macro avg       0.04      0.50      0.08      1733
weighted avg       0.01      0.09      0.01      1733

Confusion Matrix:
 [[ 150    0]
 [1583    0]]

=== Fold 4/5 ===
Validation Accuracy: 0.4310
Classification Report:
               precision    recall  f1-score   support

Non-Repeater       0.13      1.00      0.23       150
    Repeater       1.00      0.38      0.55      1583

    accuracy                           0.43      1733
   macro avg       0.57      0.69      0.39      1733
weighted avg       0.92      0.43      0.52      1733

Confusion Matrix:
 [[150   0]
 [986 597]]

=== Fold 5/5 ===
Validation Accuracy: 0.0860
Classification Report:
               precision    recall  f1-score   support

Non-Repeater       0.09      1.00      0.16       149
    Repeater       0.00      0.00      0.00      1583

    accuracy                           0.09      1732
   macro avg       0.04      0.50      0.08      1732
weighted avg       0.01      0.09      0.01      1732

Confusion Matrix:
 [[ 149    0]
 [1583    0]]


=== Summary ===
Total False Positives: 0
Total False Negatives: 7070
Total True Positives: 846
Total True Negatives: 748

Confusion Matrix (with duplicates):
              Non-Repeater  Repeater
Non-Repeater         748.0       0.0
Repeater            7070.0     846.0
accuracy_score
0.18397968605724838
Trial 1: hidden_dim=1353, latent_dim=29, beta=1.3140510681794912, gamma=0.1853051508398568, dropout_rate=0.1077818286901203, lr=0.009327170356605593, scheduler_patience=7, class_weight=2.9501137002029654, activation=ReLU, classification_multiplier=14385.771226264293

=== Fold 1/5 ===
Validation Accuracy: 0.7905
Classification Report:
               precision    recall  f1-score   support

Non-Repeater       0.29      0.98      0.45       149
    Repeater       1.00      0.77      0.87      1584

    accuracy                           0.79      1733
   macro avg       0.64      0.88      0.66      1733
weighted avg       0.94      0.79      0.83      1733

Confusion Matrix:
 [[ 146    3]
 [ 360 1224]]

=== Fold 2/5 ===
Validation Accuracy: 0.6965
Classification Report:
 [I 2025-06-13 02:20:34,124] Trial 221 finished with value: 0.7351108033240997 and parameters: {'hidden_dim': 1399, 'latent_dim': 32, 'beta': 1.236268815360791, 'gamma': 0.1027071308389883, 'dropout_rate': 0.13089994609435807, 'lr': 0.000369751170525897, 'scheduler_patience': 7, 'class_weight': 2.823154345629375, 'activation': 'ReLU', 'classification_multiplier': 14181.306940327515}. Best is trial 194 with value: 0.8103647276084949.
[I 2025-06-13 02:27:11,787] Trial 222 finished with value: 0.7741228070175439 and parameters: {'hidden_dim': 1455, 'latent_dim': 33, 'beta': 1.3839931826102527, 'gamma': 0.14760872094994776, 'dropout_rate': 0.12011976736389503, 'lr': 0.0006971228764150171, 'scheduler_patience': 7, 'class_weight': 2.6648929383123465, 'activation': 'ReLU', 'classification_multiplier': 13178.712631224887}. Best is trial 194 with value: 0.8103647276084949.
[I 2025-06-13 02:33:48,970] Trial 223 finished with value: 0.711449676823638 and parameters: {'hidden_dim': 1482, 'latent_dim': 31, 'beta': 1.3543461619021921, 'gamma': 0.15812674269449928, 'dropout_rate': 0.11878373788220226, 'lr': 0.0008020494315428377, 'scheduler_patience': 7, 'class_weight': 2.661598945182568, 'activation': 'ReLU', 'classification_multiplier': 13051.276185721232}. Best is trial 194 with value: 0.8103647276084949.
              precision    recall  f1-score   support

Non-Repeater       0.22      0.99      0.36       150
    Repeater       1.00      0.67      0.80      1583

    accuracy                           0.70      1733
   macro avg       0.61      0.83      0.58      1733
weighted avg       0.93      0.70      0.76      1733

Confusion Matrix:
 [[ 149    1]
 [ 525 1058]]

=== Fold 3/5 ===
Validation Accuracy: 0.7178
Classification Report:
               precision    recall  f1-score   support

Non-Repeater       0.23      0.99      0.38       150
    Repeater       1.00      0.69      0.82      1583

    accuracy                           0.72      1733
   macro avg       0.62      0.84      0.60      1733
weighted avg       0.93      0.72      0.78      1733

Confusion Matrix:
 [[ 149    1]
 [ 488 1095]]

=== Fold 4/5 ===
Validation Accuracy: 0.7034
Classification Report:
               precision    recall  f1-score   support

Non-Repeater       0.22      0.99      0.37       150
    Repeater       1.00      0.68      0.81      1583

    accuracy                           0.70      1733
   macro avg       0.61      0.83      0.59      1733
weighted avg       0.93      0.70      0.77      1733

Confusion Matrix:
 [[ 148    2]
 [ 512 1071]]

=== Fold 5/5 ===
Validation Accuracy: 0.7673
Classification Report:
               precision    recall  f1-score   support

Non-Repeater       0.27      0.97      0.42       149
    Repeater       1.00      0.75      0.85      1583

    accuracy                           0.77      1732
   macro avg       0.63      0.86      0.64      1732
weighted avg       0.93      0.77      0.82      1732

Confusion Matrix:
 [[ 145    4]
 [ 399 1184]]


=== Summary ===
Total False Positives: 11
Total False Negatives: 2284
Total True Positives: 5632
Total True Negatives: 737

Confusion Matrix (with duplicates):
              Non-Repeater  Repeater
Non-Repeater         737.0      11.0
Repeater            2284.0    5632.0
accuracy_score
0.7351108033240997
Trial 1: hidden_dim=1399, latent_dim=32, beta=1.236268815360791, gamma=0.1027071308389883, dropout_rate=0.13089994609435807, lr=0.000369751170525897, scheduler_patience=7, class_weight=2.823154345629375, activation=ReLU, classification_multiplier=14181.306940327515

=== Fold 1/5 ===
Validation Accuracy: 0.8194
Classification Report:
               precision    recall  f1-score   support

Non-Repeater       0.31      0.93      0.47       149
    Repeater       0.99      0.81      0.89      1584

    accuracy                           0.82      1733
   macro avg       0.65      0.87      0.68      1733
weighted avg       0.93      0.82      0.85      1733

Confusion Matrix:
 [[ 139   10]
 [ 303 1281]]

=== Fold 2/5 ===
Validation Accuracy: 0.7594
Classification Report:
               precision    recall  f1-score   support

Non-Repeater       0.26      0.99      0.42       150
    Repeater       1.00      0.74      0.85      1583

    accuracy                           0.76      1733
   macro avg       0.63      0.87      0.63      1733
weighted avg       0.94      0.76      0.81      1733

Confusion Matrix:
 [[ 149    1]
 [ 416 1167]]

=== Fold 3/5 ===
Validation Accuracy: 0.7571
Classification Report:
               precision    recall  f1-score   support

Non-Repeater       0.26      0.99      0.41       150
    Repeater       1.00      0.74      0.85      1583

    accuracy                           0.76      1733
   macro avg       0.63      0.86      0.63      1733
weighted avg       0.93      0.76      0.81      1733

Confusion Matrix:
 [[ 148    2]
 [ 419 1164]]

=== Fold 4/5 ===
Validation Accuracy: 0.7663
Classification Report:
               precision    recall  f1-score   support

Non-Repeater       0.27      0.97      0.42       150
    Repeater       1.00      0.75      0.85      1583

    accuracy                           0.77      1733
   macro avg       0.63      0.86      0.64      1733
weighted avg       0.93      0.77      0.82      1733

Confusion Matrix:
 [[ 146    4]
 [ 401 1182]]

=== Fold 5/5 ===
Validation Accuracy: 0.7685
Classification Report:
               precision    recall  f1-score   support

Non-Repeater       0.27      0.97      0.42       149
    Repeater       1.00      0.75      0.86      1583

    accuracy                           0.77      1732
   macro avg       0.63      0.86      0.64      1732
weighted avg       0.93      0.77      0.82      1732

Confusion Matrix:
 [[ 145    4]
 [ 397 1186]]


=== Summary ===
Total False Positives: 21
Total False Negatives: 1936
Total True Positives: 5980
Total True Negatives: 727

Confusion Matrix (with duplicates):
              Non-Repeater  Repeater
Non-Repeater         727.0      21.0
Repeater            1936.0    5980.0
accuracy_score
0.7741228070175439
Trial 1: hidden_dim=1455, latent_dim=33, beta=1.3839931826102527, gamma=0.14760872094994776, dropout_rate=0.12011976736389503, lr=0.0006971228764150171, scheduler_patience=7, class_weight=2.6648929383123465, activation=ReLU, classification_multiplier=13178.712631224887

=== Fold 1/5 ===
Validation Accuracy: 0.6872
Classification Report:
               precision    recall  f1-score   support

Non-Repeater       0.21      0.98      0.35       149
    Repeater       1.00      0.66      0.79      1584

    accuracy                           0.69      1733
   macro avg       0.61      0.82      0.57      1733
weighted avg       0.93      0.69      0.76      1733

Confusion Matrix:
 [[ 146    3]
 [ 539 1045]]

=== Fold 2/5 ===
Validation Accuracy: 0.7726
Classification Report:
               precision    recall  f1-score   support

Non-Repeater       0.27      0.99      0.43       150
    Repeater       1.00      0.75      0.86      1583

    accuracy                           0.77      1733
   macro avg       0.64      0.87      0.64      1733
weighted avg       0.94      0.77      0.82      1733

Confusion Matrix:
 [[ 148    2]
 [ 392 1191]]

=== Fold 3/5 ===
Validation Accuracy: 0.7519
Classification Report:
               precision    recall  f1-score   support

Non-Repeater       0.26      0.99      0.41       150
    Repeater       1.00      0.73      0.84      1583

    accuracy                           0.75      1733
   macro avg       0.63      0.86      0.63      1733
weighted avg       0.93      0.75      0.81      1733

Confusion Matrix:
 [[ 148    2]
 [ 428 1155]]

=== Fold 4/5 ===
Validation Accuracy: 0.6186
Classification Report:
               precision    recall  f1-score   support

Non-Repeater       0.18      0.99      0.31       150
    Repeater       1.00      0.58      0.74      1583

    accuracy                           0.62      1733
   macro avg       0.59      0.79      0.52      1733
weighted avg       0.93      0.62      0.70      1733

Confusion Matrix:
 [[148   2]
 [659 924]]

=== Fold 5/5 ===
Validation Accuracy: 0.7269
Classification Report:
               precision    recall  f1-score   support

Non-Repeater       0.24      0.99      0.38       149
    Repeater       1.00      0.70      0.82      1583

    accuracy                           0.73      1732
   macro avg       0.62      0.85      0.60      1732
weighted avg       0.93      0.73      0.79      1732

Confusion Matrix:
 [[ 148    1]
 [ 472 1111]]


=== Summary ===
Total False Positives: 10
Total False Negatives: 2490
Total True Positives: 5426
Total True Negatives: 738

Confusion Matrix (with duplicates):
              Non-Repeater  Repeater
Non-Repeater         738.0      10.0
Repeater            2490.0    5426.0
accuracy_score
0.711449676823638
Trial 1: hidden_dim=1482, latent_dim=31, beta=1.3543461619021921, gamma=0.15812674269449928, dropout_rate=0.11878373788220226, lr=0.0008020494315428377, scheduler_patience=7, class_weight=2.661598945182568, activation=ReLU, classification_multiplier=13051.276185721232

=== Fold 1/5 ===
Validation Accuracy: 0.7853
Classification Report:
 [I 2025-06-13 02:40:06,553] Trial 224 finished with value: 0.75 and parameters: {'hidden_dim': 1304, 'latent_dim': 30, 'beta': 1.3109871182372757, 'gamma': 0.16620483715973167, 'dropout_rate': 0.12481309971178361, 'lr': 0.0006166877631963648, 'scheduler_patience': 7, 'class_weight': 2.7340262791622214, 'activation': 'ReLU', 'classification_multiplier': 13245.679986772466}. Best is trial 194 with value: 0.8103647276084949.
