[I 2025-06-13 05:51:57,675] Trial 254 finished with value: 0.7295706371191135 and parameters: {'hidden_dim': 1488, 'latent_dim': 30, 'beta': 1.467805947161416, 'gamma': 0.13135616393076655, 'dropout_rate': 0.1337176565052997, 'lr': 0.0007741562756008976, 'scheduler_patience': 7, 'class_weight': 2.936440774442189, 'activation': 'ReLU', 'classification_multiplier': 14465.318466078836}. Best is trial 194 with value: 0.8103647276084949.

Confusion Matrix (with duplicates):
              Non-Repeater  Repeater
Non-Repeater         718.0      30.0
Repeater            1909.0    6007.0
accuracy_score
0.7762003693444137
Trial 1: hidden_dim=1453, latent_dim=29, beta=1.4128365266029739, gamma=0.14587358800270173, dropout_rate=0.1324369353379867, lr=0.0008578365054147043, scheduler_patience=7, class_weight=2.91594361345952, activation=ReLU, classification_multiplier=14993.611406121661

=== Fold 1/5 ===
Validation Accuracy: 0.7802
Classification Report:
               precision    recall  f1-score   support

Non-Repeater       0.28      0.96      0.43       149
    Repeater       1.00      0.76      0.86      1584

    accuracy                           0.78      1733
   macro avg       0.64      0.86      0.65      1733
weighted avg       0.93      0.78      0.83      1733

Confusion Matrix:
 [[ 143    6]
 [ 375 1209]]

=== Fold 2/5 ===
Validation Accuracy: 0.4830
Classification Report:
               precision    recall  f1-score   support

Non-Repeater       0.14      0.99      0.25       150
    Repeater       1.00      0.43      0.61      1583

    accuracy                           0.48      1733
   macro avg       0.57      0.71      0.43      1733
weighted avg       0.92      0.48      0.57      1733

Confusion Matrix:
 [[149   1]
 [895 688]]

=== Fold 3/5 ===
Validation Accuracy: 0.7294
Classification Report:
               precision    recall  f1-score   support

Non-Repeater       0.24      0.99      0.39       150
    Repeater       1.00      0.70      0.83      1583

    accuracy                           0.73      1733
   macro avg       0.62      0.85      0.61      1733
weighted avg       0.93      0.73      0.79      1733

Confusion Matrix:
 [[ 149    1]
 [ 468 1115]]

=== Fold 4/5 ===
Validation Accuracy: 0.6711
Classification Report:
               precision    recall  f1-score   support

Non-Repeater       0.20      0.97      0.34       150
    Repeater       1.00      0.64      0.78      1583

    accuracy                           0.67      1733
   macro avg       0.60      0.80      0.56      1733
weighted avg       0.93      0.67      0.74      1733

Confusion Matrix:
 [[ 145    5]
 [ 565 1018]]

=== Fold 5/5 ===
Validation Accuracy: 0.7465
Classification Report:
               precision    recall  f1-score   support

Non-Repeater       0.25      0.97      0.40       149
    Repeater       1.00      0.73      0.84      1583

    accuracy                           0.75      1732
   macro avg       0.62      0.85      0.62      1732
weighted avg       0.93      0.75      0.80      1732

Confusion Matrix:
 [[ 145    4]
 [ 435 1148]]


=== Summary ===
Total False Positives: 17
Total False Negatives: 2738
Total True Positives: 5178
Total True Negatives: 731

Confusion Matrix (with duplicates):
              Non-Repeater  Repeater
Non-Repeater         731.0      17.0
Repeater            2738.0    5178.0
accuracy_score
0.6820175438596491
Trial 1: hidden_dim=1449, latent_dim=29, beta=1.424867791978224, gamma=0.13138256588280015, dropout_rate=0.14719828761830783, lr=0.0008353654320978577, scheduler_patience=7, class_weight=2.923086073156573, activation=GELU, classification_multiplier=14922.731022437927

=== Fold 1/5 ===
Validation Accuracy: 0.7028
Classification Report:
               precision    recall  f1-score   support

Non-Repeater       0.22      0.99      0.36       149
    Repeater       1.00      0.68      0.81      1584

    accuracy                           0.70      1733
   macro avg       0.61      0.83      0.59      1733
weighted avg       0.93      0.70      0.77      1733

Confusion Matrix:
 [[ 148    1]
 [ 514 1070]]

=== Fold 2/5 ===
Validation Accuracy: 0.8759
Classification Report:
               precision    recall  f1-score   support

Non-Repeater       0.41      0.97      0.58       150
    Repeater       1.00      0.87      0.93      1583

    accuracy                           0.88      1733
   macro avg       0.70      0.92      0.75      1733
weighted avg       0.95      0.88      0.90      1733

Confusion Matrix:
 [[ 146    4]
 [ 211 1372]]

=== Fold 3/5 ===
Validation Accuracy: 0.7351
Classification Report:
               precision    recall  f1-score   support

Non-Repeater       0.25      0.99      0.39       150
    Repeater       1.00      0.71      0.83      1583

    accuracy                           0.74      1733
   macro avg       0.62      0.85      0.61      1733
weighted avg       0.93      0.74      0.79      1733

Confusion Matrix:
 [[ 149    1]
 [ 458 1125]]

=== Fold 4/5 ===
Validation Accuracy: 0.5482
Classification Report:
               precision    recall  f1-score   support

Non-Repeater       0.16      1.00      0.28       150
    Repeater       1.00      0.51      0.67      1583

    accuracy                           0.55      1733
   macro avg       0.58      0.75      0.47      1733
weighted avg       0.93      0.55      0.64      1733

Confusion Matrix:
 [[150   0]
 [783 800]]

=== Fold 5/5 ===
Validation Accuracy: 0.7858
Classification Report:
               precision    recall  f1-score   support

Non-Repeater       0.28      0.97      0.44       149
    Repeater       1.00      0.77      0.87      1583

    accuracy                           0.79      1732
   macro avg       0.64      0.87      0.65      1732
weighted avg       0.93      0.79      0.83      1732

Confusion Matrix:
 [[ 144    5]
 [ 366 1217]]


=== Summary ===
Total False Positives: 11
Total False Negatives: 2332
Total True Positives: 5584
Total True Negatives: 737

Confusion Matrix (with duplicates):
              Non-Repeater  Repeater
Non-Repeater         737.0      11.0
Repeater            2332.0    5584.0
accuracy_score
0.7295706371191135
Trial 1: hidden_dim=1488, latent_dim=30, beta=1.467805947161416, gamma=0.13135616393076655, dropout_rate=0.1337176565052997, lr=0.0007741562756008976, scheduler_patience=7, class_weight=2.936440774442189, activation=ReLU, classification_multiplier=14465.318466078836

=== Fold 1/5 ===
Validation Accuracy: 0.7680
Classification Report:
               precision    recall  f1-score   support

Non-Repeater       0.27      0.98      0.42       149
    Repeater       1.00      0.75      0.85      1584

    accuracy                           0.77      1733
   macro avg       0.63      0.86      0.64      1733
weighted avg       0.93      0.77      0.82      1733

Confusion Matrix:
 [[ 146    3]
 [ 399 1185]]

=== Fold 2/5 ===
Validation Accuracy: 0.8229
Classification Report:
               precision    recall  f1-score   support

Non-Repeater       0.33      0.99      0.49       150
    Repeater       1.00      0.81      0.89      1583

    accuracy                           0.82      1733
   macro avg       0.66      0.90      0.69      1733
weighted avg       0.94      0.82      0.86      1733

Confusion Matrix:
 [[ 148    2]
 [ 305 1278]]

=== Fold 3/5 ===
Validation Accuracy: 0.7680
Classification Report:
               precision    recall  f1-score   support

Non-Repeater       0.27      0.99      0.42       150
    Repeater       1.00      0.75      0.85      1583

    accuracy                           0.77      1733
   macro avg       0.63      0.87      0.64      1733
weighted avg       0.94      0.77      0.82      1733

Confusion Matrix:
 [[ 148    2]
 [ 400 1183]]

=== Fold 4/5 ===
Validation Accuracy: 0.7069
Classification Report:
               precision    recall  f1-score   support

Non-Repeater       0.22      0.97      0.36       150
    Repeater       1.00      0.68      0.81      1583

    accuracy                           0.71      1733
   macro avg       0.61      0.83      0.59      1733
weighted avg       0.93      0.71      0.77      1733

Confusion Matrix:
 [[ 146    4]
 [ 504 1079]]

=== Fold 5/5 ===
Validation Accuracy: 0.7777
Classification Report:
               precision    recall  f1-score   support

Non-Repeater       0.28      0.97      0.43       149
    Repeater       1.00      0.76      0.86      1583

    accuracy                           0.78      1732
   macro avg       0.64      0.87      0.65      1732
weighted avg       0.93      0.78      0.82      1732

[I 2025-06-13 05:58:28,676] Trial 255 finished with value: 0.7686980609418282 and parameters: {'hidden_dim': 1421, 'latent_dim': 31, 'beta': 1.521735536355748, 'gamma': 0.16670851109594798, 'dropout_rate': 0.1287779347212004, 'lr': 0.000985418106345186, 'scheduler_patience': 7, 'class_weight': 2.7920154954393275, 'activation': 'ReLU', 'classification_multiplier': 14728.949844506034}. Best is trial 194 with value: 0.8103647276084949.
[I 2025-06-13 06:04:55,969] Trial 256 finished with value: 0.683056325023084 and parameters: {'hidden_dim': 1416, 'latent_dim': 33, 'beta': 1.5553947935677048, 'gamma': 0.10118763195760723, 'dropout_rate': 0.14103774907991062, 'lr': 0.0010710012910760762, 'scheduler_patience': 7, 'class_weight': 2.778792307537145, 'activation': 'ReLU', 'classification_multiplier': 14717.149860713676}. Best is trial 194 with value: 0.8103647276084949.
[I 2025-06-13 06:11:33,030] Trial 257 finished with value: 0.547668513388735 and parameters: {'hidden_dim': 1474, 'latent_dim': 30, 'beta': 1.649183471337587, 'gamma': 0.22435797054727197, 'dropout_rate': 0.12659721644006366, 'lr': 0.0032654898233810178, 'scheduler_patience': 7, 'class_weight': 2.785699810289669, 'activation': 'ReLU', 'classification_multiplier': 14962.81730637621}. Best is trial 194 with value: 0.8103647276084949.
Confusion Matrix:
 [[ 145    4]
 [ 381 1202]]


=== Summary ===
Total False Positives: 15
Total False Negatives: 1989
Total True Positives: 5927
Total True Negatives: 733

Confusion Matrix (with duplicates):
              Non-Repeater  Repeater
Non-Repeater         733.0      15.0
Repeater            1989.0    5927.0
accuracy_score
0.7686980609418282
Trial 1: hidden_dim=1421, latent_dim=31, beta=1.521735536355748, gamma=0.16670851109594798, dropout_rate=0.1287779347212004, lr=0.000985418106345186, scheduler_patience=7, class_weight=2.7920154954393275, activation=ReLU, classification_multiplier=14728.949844506034

=== Fold 1/5 ===
Validation Accuracy: 0.5061
Classification Report:
               precision    recall  f1-score   support

Non-Repeater       0.15      0.99      0.26       149
    Repeater       1.00      0.46      0.63      1584

    accuracy                           0.51      1733
   macro avg       0.57      0.72      0.44      1733
weighted avg       0.92      0.51      0.60      1733

Confusion Matrix:
 [[147   2]
 [854 730]]

=== Fold 2/5 ===
Validation Accuracy: 0.7588
Classification Report:
               precision    recall  f1-score   support

Non-Repeater       0.26      0.99      0.42       150
    Repeater       1.00      0.74      0.85      1583

    accuracy                           0.76      1733
   macro avg       0.63      0.86      0.63      1733
weighted avg       0.94      0.76      0.81      1733

Confusion Matrix:
 [[ 149    1]
 [ 417 1166]]

=== Fold 3/5 ===
Validation Accuracy: 0.7576
Classification Report:
               precision    recall  f1-score   support

Non-Repeater       0.26      0.99      0.42       150
    Repeater       1.00      0.74      0.85      1583

    accuracy                           0.76      1733
   macro avg       0.63      0.86      0.63      1733
weighted avg       0.94      0.76      0.81      1733

Confusion Matrix:
 [[ 149    1]
 [ 419 1164]]

=== Fold 4/5 ===
Validation Accuracy: 0.6249
Classification Report:
               precision    recall  f1-score   support

Non-Repeater       0.19      0.99      0.31       150
    Repeater       1.00      0.59      0.74      1583

    accuracy                           0.62      1733
   macro avg       0.59      0.79      0.53      1733
weighted avg       0.93      0.62      0.70      1733

Confusion Matrix:
 [[149   1]
 [649 934]]

=== Fold 5/5 ===
Validation Accuracy: 0.7679
Classification Report:
               precision    recall  f1-score   support

Non-Repeater       0.27      0.98      0.42       149
    Repeater       1.00      0.75      0.85      1583

    accuracy                           0.77      1732
   macro avg       0.63      0.86      0.64      1732
weighted avg       0.93      0.77      0.82      1732

Confusion Matrix:
 [[ 146    3]
 [ 399 1184]]


=== Summary ===
Total False Positives: 8
Total False Negatives: 2738
Total True Positives: 5178
Total True Negatives: 740

Confusion Matrix (with duplicates):
              Non-Repeater  Repeater
Non-Repeater         740.0       8.0
Repeater            2738.0    5178.0
accuracy_score
0.683056325023084
Trial 1: hidden_dim=1416, latent_dim=33, beta=1.5553947935677048, gamma=0.10118763195760723, dropout_rate=0.14103774907991062, lr=0.0010710012910760762, scheduler_patience=7, class_weight=2.778792307537145, activation=ReLU, classification_multiplier=14717.149860713676

=== Fold 1/5 ===
Validation Accuracy: 0.3797
Classification Report:
               precision    recall  f1-score   support

Non-Repeater       0.12      0.99      0.22       149
    Repeater       1.00      0.32      0.49      1584

    accuracy                           0.38      1733
   macro avg       0.56      0.66      0.35      1733
weighted avg       0.92      0.38      0.46      1733

Confusion Matrix:
 [[ 148    1]
 [1074  510]]

=== Fold 2/5 ===
Validation Accuracy: 0.4818
Classification Report:
               precision    recall  f1-score   support

Non-Repeater       0.14      1.00      0.25       150
    Repeater       1.00      0.43      0.60      1583

    accuracy                           0.48      1733
   macro avg       0.57      0.72      0.43      1733
weighted avg       0.93      0.48      0.57      1733

Confusion Matrix:
 [[150   0]
 [898 685]]

=== Fold 3/5 ===
Validation Accuracy: 0.4339
Classification Report:
               precision    recall  f1-score   support

Non-Repeater       0.13      1.00      0.23       150
    Repeater       1.00      0.38      0.55      1583

    accuracy                           0.43      1733
   macro avg       0.57      0.69      0.39      1733
weighted avg       0.92      0.43      0.52      1733

Confusion Matrix:
 [[150   0]
 [981 602]]

=== Fold 4/5 ===
Validation Accuracy: 0.6780
Classification Report:
               precision    recall  f1-score   support

Non-Repeater       0.21      0.98      0.35       150
    Repeater       1.00      0.65      0.79      1583

    accuracy                           0.68      1733
   macro avg       0.60      0.81      0.57      1733
weighted avg       0.93      0.68      0.75      1733

Confusion Matrix:
 [[ 147    3]
 [ 555 1028]]

=== Fold 5/5 ===
Validation Accuracy: 0.7650
Classification Report:
               precision    recall  f1-score   support

Non-Repeater       0.27      0.99      0.42       149
    Repeater       1.00      0.74      0.85      1583

    accuracy                           0.77      1732
   macro avg       0.63      0.87      0.64      1732
weighted avg       0.94      0.77      0.82      1732

Confusion Matrix:
 [[ 147    2]
 [ 405 1178]]


=== Summary ===
Total False Positives: 6
Total False Negatives: 3913
Total True Positives: 4003
Total True Negatives: 742

Confusion Matrix (with duplicates):
              Non-Repeater  Repeater
Non-Repeater         742.0       6.0
Repeater            3913.0    4003.0
accuracy_score
0.547668513388735
Trial 1: hidden_dim=1474, latent_dim=30, beta=1.649183471337587, gamma=0.22435797054727197, dropout_rate=0.12659721644006366, lr=0.0032654898233810178, scheduler_patience=7, class_weight=2.785699810289669, activation=ReLU, classification_multiplier=14962.81730637621

=== Fold 1/5 ===
Validation Accuracy: 0.6930
Classification Report:
               precision    recall  f1-score   support

Non-Repeater       0.22      1.00      0.36       149
    Repeater       1.00      0.66      0.80      1584

    accuracy                           0.69      1733
   macro avg       0.61      0.83      0.58      1733
weighted avg       0.93      0.69      0.76      1733

Confusion Matrix:
 [[ 149    0]
 [ 532 1052]]

=== Fold 2/5 ===
Validation Accuracy: 0.6595
Classification Report:
               precision    recall  f1-score   support

Non-Repeater       0.20      0.99      0.34       150
    Repeater       1.00      0.63      0.77      1583

    accuracy                           0.66      1733
   macro avg       0.60      0.81      0.55      1733
weighted avg       0.93      0.66      0.73      1733

Confusion Matrix:
 [[149   1]
 [589 994]]

=== Fold 3/5 ===
Validation Accuracy: 0.7132
Classification Report:
               precision    recall  f1-score   support

Non-Repeater       0.23      0.99      0.37       150
    Repeater       1.00      0.69      0.81      1583

    accuracy                           0.71      1733
   macro avg       0.62      0.84      0.59      1733
weighted avg       0.93      0.71      0.78      1733

Confusion Matrix:
 [[ 149    1]
 [ 496 1087]]

=== Fold 4/5 ===
Validation Accuracy: 0.6728
Classification Report:
               precision    recall  f1-score   support

Non-Repeater       0.21      0.99      0.34       150
    Repeater       1.00      0.64      0.78      1583

    accuracy                           0.67      1733
   macro avg       0.60      0.81      0.56      1733
weighted avg       0.93      0.67      0.74      1733

Confusion Matrix:
 [[ 148    2]
 [ 565 1018]]

=== Fold 5/5 ===
Validation Accuracy: 0.7361
Classification Report:
 [I 2025-06-13 06:18:17,855] Trial 258 finished with value: 0.6949445983379502 and parameters: {'hidden_dim': 1517, 'latent_dim': 32, 'beta': 1.514840451068254, 'gamma': 1.48697309648283, 'dropout_rate': 0.13465192734527745, 'lr': 0.000918162003722159, 'scheduler_patience': 4, 'class_weight': 2.6808826844470364, 'activation': 'ReLU', 'classification_multiplier': 14337.178997492465}. Best is trial 194 with value: 0.8103647276084949.
[I 2025-06-13 06:24:51,877] Trial 259 finished with value: 0.6801708217913204 and parameters: {'hidden_dim': 1450, 'latent_dim': 29, 'beta': 1.582427596080658, 'gamma': 0.1464858921424991, 'dropout_rate': 0.15550877200845667, 'lr': 0.0006491357897452046, 'scheduler_patience': 7, 'class_weight': 2.869862866647603, 'activation': 'ReLU', 'classification_multiplier': 14623.21977086095}. Best is trial 194 with value: 0.8103647276084949.
