[I 2025-06-13 05:12:44,716] Trial 248 finished with value: 0.7197599261311173 and parameters: {'hidden_dim': 1447, 'latent_dim': 32, 'beta': 1.4286225793156166, 'gamma': 0.1000541706363303, 'dropout_rate': 0.13290508176982332, 'lr': 0.0005477524394259781, 'scheduler_patience': 7, 'class_weight': 2.905136162217826, 'activation': 'ReLU', 'classification_multiplier': 14981.12178512066}. Best is trial 194 with value: 0.8103647276084949.
              precision    recall  f1-score   support

Non-Repeater       0.22      0.99      0.36       149
    Repeater       1.00      0.68      0.81      1584

    accuracy                           0.70      1733
   macro avg       0.61      0.83      0.59      1733
weighted avg       0.93      0.70      0.77      1733

Confusion Matrix:
 [[ 147    2]
 [ 511 1073]]

=== Fold 2/5 ===
Validation Accuracy: 0.8748
Classification Report:
               precision    recall  f1-score   support

Non-Repeater       0.40      0.95      0.57       150
    Repeater       0.99      0.87      0.93      1583

    accuracy                           0.87      1733
   macro avg       0.70      0.91      0.75      1733
weighted avg       0.94      0.87      0.90      1733

Confusion Matrix:
 [[ 142    8]
 [ 209 1374]]

=== Fold 3/5 ===
Validation Accuracy: 0.7525
Classification Report:
               precision    recall  f1-score   support

Non-Repeater       0.26      0.99      0.41       150
    Repeater       1.00      0.73      0.84      1583

    accuracy                           0.75      1733
   macro avg       0.63      0.86      0.63      1733
weighted avg       0.93      0.75      0.81      1733

Confusion Matrix:
 [[ 148    2]
 [ 427 1156]]

=== Fold 4/5 ===
Validation Accuracy: 0.6780
Classification Report:
               precision    recall  f1-score   support

Non-Repeater       0.21      0.99      0.35       150
    Repeater       1.00      0.65      0.79      1583

    accuracy                           0.68      1733
   macro avg       0.60      0.82      0.57      1733
weighted avg       0.93      0.68      0.75      1733

Confusion Matrix:
 [[ 148    2]
 [ 556 1027]]

=== Fold 5/5 ===
Validation Accuracy: 0.7927
Classification Report:
               precision    recall  f1-score   support

Non-Repeater       0.29      0.97      0.45       149
    Repeater       1.00      0.78      0.87      1583

    accuracy                           0.79      1732
   macro avg       0.64      0.87      0.66      1732
weighted avg       0.94      0.79      0.84      1732

Confusion Matrix:
 [[ 145    4]
 [ 355 1228]]


=== Summary ===
Total False Positives: 18
Total False Negatives: 2058
Total True Positives: 5858
Total True Negatives: 730

Confusion Matrix (with duplicates):
              Non-Repeater  Repeater
Non-Repeater         730.0      18.0
Repeater            2058.0    5858.0
accuracy_score
0.760387811634349
Trial 1: hidden_dim=1319, latent_dim=30, beta=1.545585070519968, gamma=0.24953270607316635, dropout_rate=0.12050384474204184, lr=0.000945187090348445, scheduler_patience=7, class_weight=2.9890290276638942, activation=ReLU, classification_multiplier=14811.952982162402

=== Fold 1/5 ===
Validation Accuracy: 0.7178
Classification Report:
               precision    recall  f1-score   support

Non-Repeater       0.23      0.99      0.38       149
    Repeater       1.00      0.69      0.82      1584

    accuracy                           0.72      1733
   macro avg       0.62      0.84      0.60      1733
weighted avg       0.93      0.72      0.78      1733

Confusion Matrix:
 [[ 147    2]
 [ 487 1097]]

=== Fold 2/5 ===
Validation Accuracy: 0.7646
Classification Report:
               precision    recall  f1-score   support

Non-Repeater       0.27      0.99      0.42       150
    Repeater       1.00      0.74      0.85      1583

    accuracy                           0.76      1733
   macro avg       0.63      0.87      0.64      1733
weighted avg       0.94      0.76      0.81      1733

Confusion Matrix:
 [[ 148    2]
 [ 406 1177]]

=== Fold 3/5 ===
Validation Accuracy: 0.7507
Classification Report:
               precision    recall  f1-score   support

Non-Repeater       0.26      0.99      0.41       150
    Repeater       1.00      0.73      0.84      1583

    accuracy                           0.75      1733
   macro avg       0.63      0.86      0.62      1733
weighted avg       0.93      0.75      0.80      1733

Confusion Matrix:
 [[ 148    2]
 [ 430 1153]]

=== Fold 4/5 ===
Validation Accuracy: 0.6024
Classification Report:
               precision    recall  f1-score   support

Non-Repeater       0.18      0.99      0.30       150
    Repeater       1.00      0.57      0.72      1583

    accuracy                           0.60      1733
   macro avg       0.59      0.78      0.51      1733
weighted avg       0.93      0.60      0.69      1733

Confusion Matrix:
 [[149   1]
 [688 895]]

=== Fold 5/5 ===
Validation Accuracy: 0.7633
Classification Report:
               precision    recall  f1-score   support

Non-Repeater       0.26      0.97      0.41       149
    Repeater       1.00      0.74      0.85      1583

    accuracy                           0.76      1732
   macro avg       0.63      0.86      0.63      1732
weighted avg       0.93      0.76      0.81      1732

Confusion Matrix:
 [[ 145    4]
 [ 406 1177]]


=== Summary ===
Total False Positives: 11
Total False Negatives: 2417
Total True Positives: 5499
Total True Negatives: 737

Confusion Matrix (with duplicates):
              Non-Repeater  Repeater
Non-Repeater         737.0      11.0
Repeater            2417.0    5499.0
accuracy_score
0.7197599261311173
Trial 1: hidden_dim=1447, latent_dim=32, beta=1.4286225793156166, gamma=0.1000541706363303, dropout_rate=0.13290508176982332, lr=0.0005477524394259781, scheduler_patience=7, class_weight=2.905136162217826, activation=ReLU, classification_multiplier=14981.12178512066

=== Fold 1/5 ===
Validation Accuracy: 0.6757
Classification Report:
               precision    recall  f1-score   support

Non-Repeater       0.21      0.99      0.34       149
    Repeater       1.00      0.65      0.78      1584

    accuracy                           0.68      1733
   macro avg       0.60      0.82      0.56      1733
weighted avg       0.93      0.68      0.75      1733

Confusion Matrix:
 [[ 148    1]
 [ 561 1023]]

=== Fold 2/5 ===
Validation Accuracy: 0.7709
Classification Report:
               precision    recall  f1-score   support

Non-Repeater       0.27      0.99      0.43       150
    Repeater       1.00      0.75      0.86      1583

    accuracy                           0.77      1733
   macro avg       0.64      0.87      0.64      1733
weighted avg       0.94      0.77      0.82      1733

Confusion Matrix:
 [[ 148    2]
 [ 395 1188]]

=== Fold 3/5 ===
Validation Accuracy: 0.6474
Classification Report:
               precision    recall  f1-score   support

Non-Repeater       0.20      0.99      0.33       150
    Repeater       1.00      0.61      0.76      1583

    accuracy                           0.65      1733
   macro avg       0.60      0.80      0.54      1733
weighted avg       0.93      0.65      0.72      1733

Confusion Matrix:
 [[149   1]
 [610 973]]

=== Fold 4/5 ===
Validation Accuracy: 0.7403
Classification Report:
               precision    recall  f1-score   support

Non-Repeater       0.25      0.99      0.40       150
    Repeater       1.00      0.72      0.83      1583

    accuracy                           0.74      1733
   macro avg       0.62      0.85      0.62      1733
weighted avg       0.93      0.74      0.80      1733

Confusion Matrix:
 [[ 148    2]
 [ 448 1135]]

=== Fold 5/5 ===
Validation Accuracy: 0.7783
Classification Report:
               precision    recall  f1-score   support

Non-Repeater       0.28      0.97      0.43       149
    Repeater       1.00      0.76      0.86      1583

    accuracy                           0.78      1732
   macro avg       0.64      0.87      0.65      1732
weighted avg       0.93      0.78      0.83      1732

Confusion Matrix:
 [[ 145    4]
 [ 380 1203]]


=== Summary ===
Total False Positives: 10
Total False Negatives: 2394
Total True Positives: 5522
Total True Negatives: 738

Confusion Matrix (with duplicates):
              Non-Repeater  Repeater
Non-Repeater         738.0      10.0
Repeater            2394.0    5522.0
accuracy_score
0.7225300092336103
[I 2025-06-13 05:19:12,456] Trial 249 finished with value: 0.7225300092336103 and parameters: {'hidden_dim': 1389, 'latent_dim': 31, 'beta': 1.4455584899694947, 'gamma': 0.22564591092218086, 'dropout_rate': 0.14078077854417637, 'lr': 0.0007122006802106273, 'scheduler_patience': 7, 'class_weight': 2.9967914199203936, 'activation': 'ReLU', 'classification_multiplier': 14493.31806539538}. Best is trial 194 with value: 0.8103647276084949.
[I 2025-06-13 05:25:23,618] Trial 250 finished with value: 0.5775623268698061 and parameters: {'hidden_dim': 1229, 'latent_dim': 33, 'beta': 1.3907396072138958, 'gamma': 0.1640095521516829, 'dropout_rate': 0.1248467782706462, 'lr': 0.0005472707370468937, 'scheduler_patience': 7, 'class_weight': 0.05535767285380855, 'activation': 'ReLU', 'classification_multiplier': 14750.593824203255}. Best is trial 194 with value: 0.8103647276084949.
[I 2025-06-13 05:32:10,325] Trial 251 finished with value: 0.733264081255771 and parameters: {'hidden_dim': 1574, 'latent_dim': 32, 'beta': 1.3617705098877386, 'gamma': 0.28033926793182123, 'dropout_rate': 0.11277176880033689, 'lr': 0.0010838608664635802, 'scheduler_patience': 7, 'class_weight': 2.852550338499387, 'activation': 'ReLU', 'classification_multiplier': 14671.929665461363}. Best is trial 194 with value: 0.8103647276084949.
Trial 1: hidden_dim=1389, latent_dim=31, beta=1.4455584899694947, gamma=0.22564591092218086, dropout_rate=0.14078077854417637, lr=0.0007122006802106273, scheduler_patience=7, class_weight=2.9967914199203936, activation=ReLU, classification_multiplier=14493.31806539538

=== Fold 1/5 ===
Validation Accuracy: 0.5874
Classification Report:
               precision    recall  f1-score   support

Non-Repeater       0.17      0.99      0.29       149
    Repeater       1.00      0.55      0.71      1584

    accuracy                           0.59      1733
   macro avg       0.58      0.77      0.50      1733
weighted avg       0.93      0.59      0.67      1733

Confusion Matrix:
 [[147   2]
 [713 871]]

=== Fold 2/5 ===
Validation Accuracy: 0.6059
Classification Report:
               precision    recall  f1-score   support

Non-Repeater       0.18      1.00      0.31       150
    Repeater       1.00      0.57      0.72      1583

    accuracy                           0.61      1733
   macro avg       0.59      0.78      0.52      1733
weighted avg       0.93      0.61      0.69      1733

Confusion Matrix:
 [[150   0]
 [683 900]]

=== Fold 3/5 ===
Validation Accuracy: 0.6232
Classification Report:
               precision    recall  f1-score   support

Non-Repeater       0.19      1.00      0.31       150
    Repeater       1.00      0.59      0.74      1583

    accuracy                           0.62      1733
   macro avg       0.59      0.79      0.53      1733
weighted avg       0.93      0.62      0.70      1733

Confusion Matrix:
 [[150   0]
 [653 930]]

=== Fold 4/5 ===
Validation Accuracy: 0.5534
Classification Report:
               precision    recall  f1-score   support

Non-Repeater       0.16      0.99      0.28       150
    Repeater       1.00      0.51      0.68      1583

    accuracy                           0.55      1733
   macro avg       0.58      0.75      0.48      1733
weighted avg       0.93      0.55      0.64      1733

Confusion Matrix:
 [[148   2]
 [772 811]]

=== Fold 5/5 ===
Validation Accuracy: 0.5179
Classification Report:
               precision    recall  f1-score   support

Non-Repeater       0.15      1.00      0.26       149
    Repeater       1.00      0.47      0.64      1583

    accuracy                           0.52      1732
   macro avg       0.58      0.74      0.45      1732
weighted avg       0.93      0.52      0.61      1732

Confusion Matrix:
 [[149   0]
 [835 748]]


=== Summary ===
Total False Positives: 4
Total False Negatives: 3656
Total True Positives: 4260
Total True Negatives: 744

Confusion Matrix (with duplicates):
              Non-Repeater  Repeater
Non-Repeater         744.0       4.0
Repeater            3656.0    4260.0
accuracy_score
0.5775623268698061
Trial 1: hidden_dim=1229, latent_dim=33, beta=1.3907396072138958, gamma=0.1640095521516829, dropout_rate=0.1248467782706462, lr=0.0005472707370468937, scheduler_patience=7, class_weight=0.05535767285380855, activation=ReLU, classification_multiplier=14750.593824203255

=== Fold 1/5 ===
Validation Accuracy: 0.7600
Classification Report:
               precision    recall  f1-score   support

Non-Repeater       0.26      0.97      0.41       149
    Repeater       1.00      0.74      0.85      1584

    accuracy                           0.76      1733
   macro avg       0.63      0.86      0.63      1733
weighted avg       0.93      0.76      0.81      1733

Confusion Matrix:
 [[ 145    4]
 [ 412 1172]]

=== Fold 2/5 ===
Validation Accuracy: 0.7178
Classification Report:
               precision    recall  f1-score   support

Non-Repeater       0.23      0.99      0.38       150
    Repeater       1.00      0.69      0.82      1583

    accuracy                           0.72      1733
   macro avg       0.62      0.84      0.60      1733
weighted avg       0.93      0.72      0.78      1733

Confusion Matrix:
 [[ 149    1]
 [ 488 1095]]

=== Fold 3/5 ===
Validation Accuracy: 0.7190
Classification Report:
               precision    recall  f1-score   support

Non-Repeater       0.23      0.99      0.38       150
    Repeater       1.00      0.69      0.82      1583

    accuracy                           0.72      1733
   macro avg       0.62      0.84      0.60      1733
weighted avg       0.93      0.72      0.78      1733

Confusion Matrix:
 [[ 149    1]
 [ 486 1097]]

=== Fold 4/5 ===
Validation Accuracy: 0.7138
Classification Report:
               precision    recall  f1-score   support

Non-Repeater       0.23      0.98      0.37       150
    Repeater       1.00      0.69      0.81      1583

    accuracy                           0.71      1733
   macro avg       0.61      0.83      0.59      1733
weighted avg       0.93      0.71      0.78      1733

Confusion Matrix:
 [[ 147    3]
 [ 493 1090]]

=== Fold 5/5 ===
Validation Accuracy: 0.7558
Classification Report:
               precision    recall  f1-score   support

Non-Repeater       0.26      0.98      0.41       149
    Repeater       1.00      0.73      0.85      1583

    accuracy                           0.76      1732
   macro avg       0.63      0.86      0.63      1732
weighted avg       0.93      0.76      0.81      1732

Confusion Matrix:
 [[ 146    3]
 [ 420 1163]]


=== Summary ===
Total False Positives: 12
Total False Negatives: 2299
Total True Positives: 5617
Total True Negatives: 736

Confusion Matrix (with duplicates):
              Non-Repeater  Repeater
Non-Repeater         736.0      12.0
Repeater            2299.0    5617.0
accuracy_score
0.733264081255771
Trial 1: hidden_dim=1574, latent_dim=32, beta=1.3617705098877386, gamma=0.28033926793182123, dropout_rate=0.11277176880033689, lr=0.0010838608664635802, scheduler_patience=7, class_weight=2.852550338499387, activation=ReLU, classification_multiplier=14671.929665461363

=== Fold 1/5 ===
Validation Accuracy: 0.8673
Classification Report:
               precision    recall  f1-score   support

Non-Repeater       0.39      0.91      0.54       149
    Repeater       0.99      0.86      0.92      1584

    accuracy                           0.87      1733
   macro avg       0.69      0.89      0.73      1733
weighted avg       0.94      0.87      0.89      1733

Confusion Matrix:
 [[ 136   13]
 [ 217 1367]]

=== Fold 2/5 ===
Validation Accuracy: 0.7542
Classification Report:
               precision    recall  f1-score   support

Non-Repeater       0.26      0.99      0.41       150
    Repeater       1.00      0.73      0.84      1583

    accuracy                           0.75      1733
   macro avg       0.63      0.86      0.63      1733
weighted avg       0.93      0.75      0.81      1733

Confusion Matrix:
 [[ 148    2]
 [ 424 1159]]

=== Fold 3/5 ===
Validation Accuracy: 0.7248
Classification Report:
               precision    recall  f1-score   support

Non-Repeater       0.24      0.99      0.38       150
    Repeater       1.00      0.70      0.82      1583

    accuracy                           0.72      1733
   macro avg       0.62      0.85      0.60      1733
weighted avg       0.93      0.72      0.78      1733

Confusion Matrix:
 [[ 149    1]
 [ 476 1107]]

=== Fold 4/5 ===
Validation Accuracy: 0.6567
Classification Report:
               precision    recall  f1-score   support

Non-Repeater       0.20      0.99      0.33       150
    Repeater       1.00      0.62      0.77      1583

    accuracy                           0.66      1733
   macro avg       0.60      0.81      0.55      1733
weighted avg       0.93      0.66      0.73      1733

Confusion Matrix:
 [[149   1]
 [594 989]]

=== Fold 5/5 ===
Validation Accuracy: 0.8782
Classification Report:
               precision    recall  f1-score   support

Non-Repeater       0.41      0.91      0.56       149
    Repeater       0.99      0.87      0.93      1583

    accuracy                           0.88      1732
   macro avg       0.70      0.89      0.75      1732
weighted avg       0.94      0.88      0.90      1732

Confusion Matrix:
 [[ 136   13]
 [ 198 1385]]


=== Summary ===
Total False Positives: 30
Total False Negatives: 1909
Total True Positives: 6007
Total True Negatives: 718
[I 2025-06-13 05:38:47,750] Trial 252 finished with value: 0.7762003693444137 and parameters: {'hidden_dim': 1453, 'latent_dim': 29, 'beta': 1.4128365266029739, 'gamma': 0.14587358800270173, 'dropout_rate': 0.1324369353379867, 'lr': 0.0008578365054147043, 'scheduler_patience': 7, 'class_weight': 2.91594361345952, 'activation': 'ReLU', 'classification_multiplier': 14993.611406121661}. Best is trial 194 with value: 0.8103647276084949.
[I 2025-06-13 05:45:21,161] Trial 253 finished with value: 0.6820175438596491 and parameters: {'hidden_dim': 1449, 'latent_dim': 29, 'beta': 1.424867791978224, 'gamma': 0.13138256588280015, 'dropout_rate': 0.14719828761830783, 'lr': 0.0008353654320978577, 'scheduler_patience': 7, 'class_weight': 2.923086073156573, 'activation': 'GELU', 'classification_multiplier': 14922.731022437927}. Best is trial 194 with value: 0.8103647276084949.
