[I 2025-06-12 21:13:47,212] Trial 174 finished with value: 0.7593490304709142 and parameters: {'hidden_dim': 1478, 'latent_dim': 34, 'beta': 1.4920328906170615, 'gamma': 0.10398940592553682, 'dropout_rate': 0.13637567418029523, 'lr': 0.0005104667831237484, 'scheduler_patience': 7, 'class_weight': 2.9346316795689136, 'activation': 'ReLU', 'classification_multiplier': 14905.34013413844}. Best is trial 173 with value: 0.8084025854108957.
              precision    recall  f1-score   support

Non-Repeater       0.27      0.98      0.42       150
    Repeater       1.00      0.74      0.85      1583

    accuracy                           0.76      1733
   macro avg       0.63      0.86      0.63      1733
weighted avg       0.93      0.76      0.81      1733

Confusion Matrix:
 [[ 147    3]
 [ 407 1176]]

=== Fold 5/5 ===
Validation Accuracy: 0.7725
Classification Report:
               precision    recall  f1-score   support

Non-Repeater       0.27      0.97      0.42       149
    Repeater       1.00      0.75      0.86      1583

    accuracy                           0.77      1732
   macro avg       0.63      0.86      0.64      1732
weighted avg       0.93      0.77      0.82      1732

Confusion Matrix:
 [[ 145    4]
 [ 390 1193]]


=== Summary ===
Total False Positives: 16
Total False Negatives: 1881
Total True Positives: 6035
Total True Negatives: 732

Confusion Matrix (with duplicates):
              Non-Repeater  Repeater
Non-Repeater         732.0      16.0
Repeater            1881.0    6035.0
accuracy_score
0.7810480147737765
Trial 1: hidden_dim=1401, latent_dim=33, beta=1.3220751311252672, gamma=0.10035866812556606, dropout_rate=0.1219897551563827, lr=0.0005065336819036549, scheduler_patience=7, class_weight=2.935084167043366, activation=ReLU, classification_multiplier=13123.101452721618

=== Fold 1/5 ===
Validation Accuracy: 0.7542
Classification Report:
               precision    recall  f1-score   support

Non-Repeater       0.26      0.99      0.41       149
    Repeater       1.00      0.73      0.84      1584

    accuracy                           0.75      1733
   macro avg       0.63      0.86      0.63      1733
weighted avg       0.94      0.75      0.81      1733

Confusion Matrix:
 [[ 148    1]
 [ 425 1159]]

=== Fold 2/5 ===
Validation Accuracy: 0.8540
Classification Report:
               precision    recall  f1-score   support

Non-Repeater       0.37      0.99      0.54       150
    Repeater       1.00      0.84      0.91      1583

    accuracy                           0.85      1733
   macro avg       0.68      0.91      0.73      1733
weighted avg       0.94      0.85      0.88      1733

Confusion Matrix:
 [[ 148    2]
 [ 251 1332]]

=== Fold 3/5 ===
Validation Accuracy: 0.7796
Classification Report:
               precision    recall  f1-score   support

Non-Repeater       0.28      0.99      0.44       150
    Repeater       1.00      0.76      0.86      1583

    accuracy                           0.78      1733
   macro avg       0.64      0.88      0.65      1733
weighted avg       0.94      0.78      0.83      1733

Confusion Matrix:
 [[ 149    1]
 [ 381 1202]]

=== Fold 4/5 ===
Validation Accuracy: 0.7807
Classification Report:
               precision    recall  f1-score   support

Non-Repeater       0.28      0.99      0.44       150
    Repeater       1.00      0.76      0.86      1583

    accuracy                           0.78      1733
   macro avg       0.64      0.87      0.65      1733
weighted avg       0.94      0.78      0.83      1733

Confusion Matrix:
 [[ 148    2]
 [ 378 1205]]

=== Fold 5/5 ===
Validation Accuracy: 0.8736
Classification Report:
               precision    recall  f1-score   support

Non-Repeater       0.40      0.97      0.57       149
    Repeater       1.00      0.86      0.93      1583

    accuracy                           0.87      1732
   macro avg       0.70      0.92      0.75      1732
weighted avg       0.95      0.87      0.90      1732

Confusion Matrix:
 [[ 144    5]
 [ 214 1369]]


=== Summary ===
Total False Positives: 11
Total False Negatives: 1649
Total True Positives: 6267
Total True Negatives: 737

Confusion Matrix (with duplicates):
              Non-Repeater  Repeater
Non-Repeater         737.0      11.0
Repeater            1649.0    6267.0
accuracy_score
0.8084025854108957
Trial 1: hidden_dim=1473, latent_dim=33, beta=1.394252917768903, gamma=0.24026031818187482, dropout_rate=0.13465066745146861, lr=0.0005270481778622848, scheduler_patience=7, class_weight=2.9336633137958046, activation=ReLU, classification_multiplier=14843.424408714656

=== Fold 1/5 ===
Validation Accuracy: 0.7051
Classification Report:
               precision    recall  f1-score   support

Non-Repeater       0.22      0.99      0.37       149
    Repeater       1.00      0.68      0.81      1584

    accuracy                           0.71      1733
   macro avg       0.61      0.84      0.59      1733
weighted avg       0.93      0.71      0.77      1733

Confusion Matrix:
 [[ 148    1]
 [ 510 1074]]

=== Fold 2/5 ===
Validation Accuracy: 0.7744
Classification Report:
               precision    recall  f1-score   support

Non-Repeater       0.28      0.99      0.43       150
    Repeater       1.00      0.75      0.86      1583

    accuracy                           0.77      1733
   macro avg       0.64      0.87      0.65      1733
weighted avg       0.94      0.77      0.82      1733

Confusion Matrix:
 [[ 148    2]
 [ 389 1194]]

=== Fold 3/5 ===
Validation Accuracy: 0.7536
Classification Report:
               precision    recall  f1-score   support

Non-Repeater       0.26      0.98      0.41       150
    Repeater       1.00      0.73      0.84      1583

    accuracy                           0.75      1733
   macro avg       0.63      0.86      0.63      1733
weighted avg       0.93      0.75      0.81      1733

Confusion Matrix:
 [[ 147    3]
 [ 424 1159]]

=== Fold 4/5 ===
Validation Accuracy: 0.7830
Classification Report:
               precision    recall  f1-score   support

Non-Repeater       0.28      0.97      0.44       150
    Repeater       1.00      0.77      0.87      1583

    accuracy                           0.78      1733
   macro avg       0.64      0.87      0.65      1733
weighted avg       0.93      0.78      0.83      1733

Confusion Matrix:
 [[ 146    4]
 [ 372 1211]]

=== Fold 5/5 ===
Validation Accuracy: 0.7806
Classification Report:
               precision    recall  f1-score   support

Non-Repeater       0.28      0.97      0.43       149
    Repeater       1.00      0.76      0.86      1583

    accuracy                           0.78      1732
   macro avg       0.64      0.87      0.65      1732
weighted avg       0.93      0.78      0.83      1732

Confusion Matrix:
 [[ 145    4]
 [ 376 1207]]


=== Summary ===
Total False Positives: 14
Total False Negatives: 2071
Total True Positives: 5845
Total True Negatives: 734

Confusion Matrix (with duplicates):
              Non-Repeater  Repeater
Non-Repeater         734.0      14.0
Repeater            2071.0    5845.0
accuracy_score
0.7593490304709142
Trial 1: hidden_dim=1478, latent_dim=34, beta=1.4920328906170615, gamma=0.10398940592553682, dropout_rate=0.13637567418029523, lr=0.0005104667831237484, scheduler_patience=7, class_weight=2.9346316795689136, activation=ReLU, classification_multiplier=14905.34013413844

=== Fold 1/5 ===
Validation Accuracy: 0.7184
Classification Report:
               precision    recall  f1-score   support

Non-Repeater       0.23      0.99      0.38       149
    Repeater       1.00      0.69      0.82      1584

    accuracy                           0.72      1733
   macro avg       0.62      0.84      0.60      1733
weighted avg       0.93      0.72      0.78      1733

Confusion Matrix:
 [[ 148    1]
 [ 487 1097]]

=== Fold 2/5 ===
Validation Accuracy: 0.6238
Classification Report:
               precision    recall  f1-score   support

Non-Repeater       0.19      0.99      0.31       150
    Repeater       1.00      0.59      0.74      1583

    accuracy                           0.62      1733
   macro avg       0.59      0.79      0.53      1733
weighted avg       0.93      0.62      0.70      1733

Confusion Matrix:
 [[149   1]
 [651 932]]

=== Fold 3/5 ===
Validation Accuracy: 0.7669
Classification Report:
 [I 2025-06-12 21:20:14,222] Trial 175 finished with value: 0.7310710987996306 and parameters: {'hidden_dim': 1416, 'latent_dim': 34, 'beta': 1.4137864292107531, 'gamma': 0.1026114313687145, 'dropout_rate': 0.1376975118922889, 'lr': 0.0004556574501331384, 'scheduler_patience': 7, 'class_weight': 2.9465623569466506, 'activation': 'ReLU', 'classification_multiplier': 14966.306020486107}. Best is trial 173 with value: 0.8084025854108957.
[I 2025-06-12 21:26:49,209] Trial 176 finished with value: 0.7669667590027701 and parameters: {'hidden_dim': 1474, 'latent_dim': 34, 'beta': 1.5371412529318034, 'gamma': 0.1721771866903008, 'dropout_rate': 0.11546678377445732, 'lr': 0.0005575257291180207, 'scheduler_patience': 7, 'class_weight': 2.845749764702324, 'activation': 'ReLU', 'classification_multiplier': 14609.62409585946}. Best is trial 173 with value: 0.8084025854108957.
[I 2025-06-12 21:33:30,072] Trial 177 finished with value: 0.7523084025854109 and parameters: {'hidden_dim': 1483, 'latent_dim': 33, 'beta': 1.5180501555425543, 'gamma': 0.16389204434624052, 'dropout_rate': 0.11609504269050888, 'lr': 0.0005898246759260915, 'scheduler_patience': 7, 'class_weight': 2.8405049094602095, 'activation': 'ReLU', 'classification_multiplier': 14801.733836550215}. Best is trial 173 with value: 0.8084025854108957.
              precision    recall  f1-score   support

Non-Repeater       0.27      0.99      0.42       150
    Repeater       1.00      0.75      0.85      1583

    accuracy                           0.77      1733
   macro avg       0.63      0.87      0.64      1733
weighted avg       0.94      0.77      0.82      1733

Confusion Matrix:
 [[ 149    1]
 [ 403 1180]]

=== Fold 4/5 ===
Validation Accuracy: 0.6803
Classification Report:
               precision    recall  f1-score   support

Non-Repeater       0.21      0.99      0.35       150
    Repeater       1.00      0.65      0.79      1583

    accuracy                           0.68      1733
   macro avg       0.60      0.82      0.57      1733
weighted avg       0.93      0.68      0.75      1733

Confusion Matrix:
 [[ 148    2]
 [ 552 1031]]

=== Fold 5/5 ===
Validation Accuracy: 0.8661
Classification Report:
               precision    recall  f1-score   support

Non-Repeater       0.39      0.97      0.56       149
    Repeater       1.00      0.86      0.92      1583

    accuracy                           0.87      1732
   macro avg       0.69      0.91      0.74      1732
weighted avg       0.94      0.87      0.89      1732

Confusion Matrix:
 [[ 145    4]
 [ 228 1355]]


=== Summary ===
Total False Positives: 9
Total False Negatives: 2321
Total True Positives: 5595
Total True Negatives: 739

Confusion Matrix (with duplicates):
              Non-Repeater  Repeater
Non-Repeater         739.0       9.0
Repeater            2321.0    5595.0
accuracy_score
0.7310710987996306
Trial 1: hidden_dim=1416, latent_dim=34, beta=1.4137864292107531, gamma=0.1026114313687145, dropout_rate=0.1376975118922889, lr=0.0004556574501331384, scheduler_patience=7, class_weight=2.9465623569466506, activation=ReLU, classification_multiplier=14966.306020486107

=== Fold 1/5 ===
Validation Accuracy: 0.7819
Classification Report:
               precision    recall  f1-score   support

Non-Repeater       0.28      0.97      0.43       149
    Repeater       1.00      0.76      0.86      1584

    accuracy                           0.78      1733
   macro avg       0.64      0.87      0.65      1733
weighted avg       0.94      0.78      0.83      1733

Confusion Matrix:
 [[ 145    4]
 [ 374 1210]]

=== Fold 2/5 ===
Validation Accuracy: 0.7761
Classification Report:
               precision    recall  f1-score   support

Non-Repeater       0.28      0.99      0.43       150
    Repeater       1.00      0.76      0.86      1583

    accuracy                           0.78      1733
   macro avg       0.64      0.87      0.65      1733
weighted avg       0.94      0.78      0.82      1733

Confusion Matrix:
 [[ 149    1]
 [ 387 1196]]

=== Fold 3/5 ===
Validation Accuracy: 0.7692
Classification Report:
               precision    recall  f1-score   support

Non-Repeater       0.27      0.99      0.43       150
    Repeater       1.00      0.75      0.86      1583

    accuracy                           0.77      1733
   macro avg       0.64      0.87      0.64      1733
weighted avg       0.94      0.77      0.82      1733

Confusion Matrix:
 [[ 149    1]
 [ 399 1184]]

=== Fold 4/5 ===
Validation Accuracy: 0.7426
Classification Report:
               precision    recall  f1-score   support

Non-Repeater       0.25      0.99      0.40       150
    Repeater       1.00      0.72      0.84      1583

    accuracy                           0.74      1733
   macro avg       0.62      0.85      0.62      1733
weighted avg       0.93      0.74      0.80      1733

Confusion Matrix:
 [[ 148    2]
 [ 444 1139]]

=== Fold 5/5 ===
Validation Accuracy: 0.7650
Classification Report:
               precision    recall  f1-score   support

Non-Repeater       0.27      0.98      0.42       149
    Repeater       1.00      0.74      0.85      1583

    accuracy                           0.77      1732
   macro avg       0.63      0.86      0.64      1732
weighted avg       0.93      0.77      0.82      1732

Confusion Matrix:
 [[ 146    3]
 [ 404 1179]]


=== Summary ===
Total False Positives: 11
Total False Negatives: 2008
Total True Positives: 5908
Total True Negatives: 737

Confusion Matrix (with duplicates):
              Non-Repeater  Repeater
Non-Repeater         737.0      11.0
Repeater            2008.0    5908.0
accuracy_score
0.7669667590027701
Trial 1: hidden_dim=1474, latent_dim=34, beta=1.5371412529318034, gamma=0.1721771866903008, dropout_rate=0.11546678377445732, lr=0.0005575257291180207, scheduler_patience=7, class_weight=2.845749764702324, activation=ReLU, classification_multiplier=14609.62409585946

=== Fold 1/5 ===
Validation Accuracy: 0.7115
Classification Report:
               precision    recall  f1-score   support

Non-Repeater       0.23      0.99      0.37       149
    Repeater       1.00      0.68      0.81      1584

    accuracy                           0.71      1733
   macro avg       0.61      0.84      0.59      1733
weighted avg       0.93      0.71      0.77      1733

Confusion Matrix:
 [[ 148    1]
 [ 499 1085]]

=== Fold 2/5 ===
Validation Accuracy: 0.7819
Classification Report:
               precision    recall  f1-score   support

Non-Repeater       0.28      0.99      0.44       150
    Repeater       1.00      0.76      0.86      1583

    accuracy                           0.78      1733
   macro avg       0.64      0.87      0.65      1733
weighted avg       0.94      0.78      0.83      1733

Confusion Matrix:
 [[ 148    2]
 [ 376 1207]]

=== Fold 3/5 ===
Validation Accuracy: 0.7299
Classification Report:
               precision    recall  f1-score   support

Non-Repeater       0.24      0.99      0.39       150
    Repeater       1.00      0.70      0.83      1583

    accuracy                           0.73      1733
   macro avg       0.62      0.85      0.61      1733
weighted avg       0.93      0.73      0.79      1733

Confusion Matrix:
 [[ 149    1]
 [ 467 1116]]

=== Fold 4/5 ===
Validation Accuracy: 0.7496
Classification Report:
               precision    recall  f1-score   support

Non-Repeater       0.26      0.99      0.41       150
    Repeater       1.00      0.73      0.84      1583

    accuracy                           0.75      1733
   macro avg       0.63      0.86      0.62      1733
weighted avg       0.93      0.75      0.80      1733

Confusion Matrix:
 [[ 148    2]
 [ 432 1151]]

=== Fold 5/5 ===
Validation Accuracy: 0.7887
Classification Report:
               precision    recall  f1-score   support

Non-Repeater       0.29      0.97      0.44       149
    Repeater       1.00      0.77      0.87      1583

    accuracy                           0.79      1732
   macro avg       0.64      0.87      0.66      1732
weighted avg       0.93      0.79      0.83      1732

Confusion Matrix:
 [[ 144    5]
 [ 361 1222]]


=== Summary ===
Total False Positives: 11
Total False Negatives: 2135
Total True Positives: 5781
Total True Negatives: 737

Confusion Matrix (with duplicates):
              Non-Repeater  Repeater
Non-Repeater         737.0      11.0
Repeater            2135.0    5781.0
accuracy_score
0.7523084025854109
Trial 1: hidden_dim=1483, latent_dim=33, beta=1.5180501555425543, gamma=0.16389204434624052, dropout_rate=0.11609504269050888, lr=0.0005898246759260915, scheduler_patience=7, class_weight=2.8405049094602095, activation=ReLU, classification_multiplier=14801.733836550215

=== Fold 1/5 ===
Validation Accuracy: 0.6786
Classification Report:
               precision    recall  f1-score   support

Non-Repeater       0.21      0.99      0.35       149
    Repeater       1.00      0.65      0.79      1584

    accuracy                           0.68      1733
   macro avg       0.60      0.82      0.57      1733
weighted avg       0.93      0.68      0.75      1733

Confusion Matrix:
 [[ 147    2]
 [ 555 1029]]

=== Fold 2/5 ===
Validation Accuracy: 0.7074
Classification Report:
 [I 2025-06-12 21:40:08,145] Trial 178 finished with value: 0.7083333333333334 and parameters: {'hidden_dim': 1475, 'latent_dim': 34, 'beta': 1.542808907564262, 'gamma': 0.16252789423922273, 'dropout_rate': 0.1345029816101193, 'lr': 0.0006866403147877263, 'scheduler_patience': 7, 'class_weight': 2.8394397895384422, 'activation': 'ReLU', 'classification_multiplier': 14726.139772869572}. Best is trial 173 with value: 0.8084025854108957.
[I 2025-06-12 21:46:54,339] Trial 179 finished with value: 0.6918282548476454 and parameters: {'hidden_dim': 1584, 'latent_dim': 34, 'beta': 1.4815382155994827, 'gamma': 0.1070325749836988, 'dropout_rate': 0.10042556758092001, 'lr': 0.000517658335335098, 'scheduler_patience': 2, 'class_weight': 2.8260255407288946, 'activation': 'ReLU', 'classification_multiplier': 14812.19186672539}. Best is trial 173 with value: 0.8084025854108957.
