[I 2025-06-12 12:28:45,999] Trial 88 finished with value: 0.5686749769159741 and parameters: {'hidden_dim': 1066, 'latent_dim': 32, 'beta': 0.7619458096950227, 'gamma': 0.2675430288958903, 'dropout_rate': 0.10088583333516776, 'lr': 0.0013220880661173082, 'scheduler_patience': 6, 'class_weight': 1.8942332512768791, 'activation': 'ReLU', 'classification_multiplier': 6312.60958283266}. Best is trial 72 with value: 0.7479224376731302.
              precision    recall  f1-score   support

Non-Repeater       0.20      0.99      0.33       150
    Repeater       1.00      0.62      0.77      1583

    accuracy                           0.65      1733
   macro avg       0.60      0.80      0.55      1733
weighted avg       0.93      0.65      0.73      1733

Confusion Matrix:
 [[148   2]
 [601 982]]

=== Fold 4/5 ===
Validation Accuracy: 0.6659
Classification Report:
               precision    recall  f1-score   support

Non-Repeater       0.20      0.99      0.34       150
    Repeater       1.00      0.64      0.78      1583

    accuracy                           0.67      1733
   macro avg       0.60      0.81      0.56      1733
weighted avg       0.93      0.67      0.74      1733

Confusion Matrix:
 [[ 148    2]
 [ 577 1006]]

=== Fold 5/5 ===
Validation Accuracy: 0.7396
Classification Report:
               precision    recall  f1-score   support

Non-Repeater       0.25      0.98      0.39       149
    Repeater       1.00      0.72      0.83      1583

    accuracy                           0.74      1732
   macro avg       0.62      0.85      0.61      1732
weighted avg       0.93      0.74      0.80      1732

Confusion Matrix:
 [[ 146    3]
 [ 448 1135]]


=== Summary ===
Total False Positives: 9
Total False Negatives: 2703
Total True Positives: 5213
Total True Negatives: 739

Confusion Matrix (with duplicates):
              Non-Repeater  Repeater
Non-Repeater         739.0       9.0
Repeater            2703.0    5213.0
accuracy_score
0.6869806094182825
Trial 1: hidden_dim=1071, latent_dim=30, beta=0.7274024351252736, gamma=0.17234560752913866, dropout_rate=0.15115919886203988, lr=0.0003212791161263791, scheduler_patience=6, class_weight=1.5854865235449147, activation=ReLU, classification_multiplier=5900.140399416191

=== Fold 1/5 ===
Validation Accuracy: 0.4570
Classification Report:
               precision    recall  f1-score   support

Non-Repeater       0.14      0.99      0.24       149
    Repeater       1.00      0.41      0.58      1584

    accuracy                           0.46      1733
   macro avg       0.57      0.70      0.41      1733
weighted avg       0.92      0.46      0.55      1733

Confusion Matrix:
 [[148   1]
 [940 644]]

=== Fold 2/5 ===
Validation Accuracy: 0.4928
Classification Report:
               precision    recall  f1-score   support

Non-Repeater       0.15      1.00      0.25       150
    Repeater       1.00      0.44      0.62      1583

    accuracy                           0.49      1733
   macro avg       0.57      0.72      0.44      1733
weighted avg       0.93      0.49      0.58      1733

Confusion Matrix:
 [[150   0]
 [879 704]]

=== Fold 3/5 ===
Validation Accuracy: 0.3889
Classification Report:
               precision    recall  f1-score   support

Non-Repeater       0.12      1.00      0.22       150
    Repeater       1.00      0.33      0.50      1583

    accuracy                           0.39      1733
   macro avg       0.56      0.67      0.36      1733
weighted avg       0.92      0.39      0.47      1733

Confusion Matrix:
 [[ 150    0]
 [1059  524]]

=== Fold 4/5 ===
Validation Accuracy: 0.2314
Classification Report:
               precision    recall  f1-score   support

Non-Repeater       0.10      1.00      0.18       150
    Repeater       1.00      0.16      0.27      1583

    accuracy                           0.23      1733
   macro avg       0.55      0.58      0.23      1733
weighted avg       0.92      0.23      0.27      1733

Confusion Matrix:
 [[ 150    0]
 [1332  251]]

=== Fold 5/5 ===
Validation Accuracy: 0.3487
Classification Report:
               precision    recall  f1-score   support

Non-Repeater       0.12      1.00      0.21       149
    Repeater       1.00      0.29      0.45      1583

    accuracy                           0.35      1732
   macro avg       0.56      0.64      0.33      1732
weighted avg       0.92      0.35      0.43      1732

Confusion Matrix:
 [[ 149    0]
 [1128  455]]


=== Summary ===
Total False Positives: 1
Total False Negatives: 5338
Total True Positives: 2578
Total True Negatives: 747

Confusion Matrix (with duplicates):
              Non-Repeater  Repeater
Non-Repeater         747.0       1.0
Repeater            5338.0    2578.0
accuracy_score
0.38377192982456143
Trial 1: hidden_dim=1929, latent_dim=30, beta=0.41543347214266624, gamma=0.15505221886724008, dropout_rate=0.15362997704657455, lr=0.0018481420612018891, scheduler_patience=5, class_weight=2.035375229126775, activation=ReLU, classification_multiplier=5833.565231552195

=== Fold 1/5 ===
Validation Accuracy: 0.5943
Classification Report:
               precision    recall  f1-score   support

Non-Repeater       0.17      0.99      0.30       149
    Repeater       1.00      0.56      0.72      1584

    accuracy                           0.59      1733
   macro avg       0.59      0.78      0.51      1733
weighted avg       0.93      0.59      0.68      1733

Confusion Matrix:
 [[148   1]
 [702 882]]

=== Fold 2/5 ===
Validation Accuracy: 0.2620
Classification Report:
               precision    recall  f1-score   support

Non-Repeater       0.10      1.00      0.19       150
    Repeater       1.00      0.19      0.32      1583

    accuracy                           0.26      1733
   macro avg       0.55      0.60      0.26      1733
weighted avg       0.92      0.26      0.31      1733

Confusion Matrix:
 [[ 150    0]
 [1279  304]]

=== Fold 3/5 ===
Validation Accuracy: 0.7305
Classification Report:
               precision    recall  f1-score   support

Non-Repeater       0.24      0.99      0.39       150
    Repeater       1.00      0.71      0.83      1583

    accuracy                           0.73      1733
   macro avg       0.62      0.85      0.61      1733
weighted avg       0.93      0.73      0.79      1733

Confusion Matrix:
 [[ 148    2]
 [ 465 1118]]

=== Fold 4/5 ===
Validation Accuracy: 0.5141
Classification Report:
               precision    recall  f1-score   support

Non-Repeater       0.15      1.00      0.26       150
    Repeater       1.00      0.47      0.64      1583

    accuracy                           0.51      1733
   macro avg       0.58      0.73      0.45      1733
weighted avg       0.93      0.51      0.61      1733

Confusion Matrix:
 [[150   0]
 [842 741]]

=== Fold 5/5 ===
Validation Accuracy: 0.7425
Classification Report:
               precision    recall  f1-score   support

Non-Repeater       0.25      0.98      0.40       149
    Repeater       1.00      0.72      0.84      1583

    accuracy                           0.74      1732
   macro avg       0.62      0.85      0.62      1732
weighted avg       0.93      0.74      0.80      1732

Confusion Matrix:
 [[ 146    3]
 [ 443 1140]]


=== Summary ===
Total False Positives: 6
Total False Negatives: 3731
Total True Positives: 4185
Total True Negatives: 742

Confusion Matrix (with duplicates):
              Non-Repeater  Repeater
Non-Repeater         742.0       6.0
Repeater            3731.0    4185.0
accuracy_score
0.5686749769159741
Trial 1: hidden_dim=1066, latent_dim=32, beta=0.7619458096950227, gamma=0.2675430288958903, dropout_rate=0.10088583333516776, lr=0.0013220880661173082, scheduler_patience=6, class_weight=1.8942332512768791, activation=ReLU, classification_multiplier=6312.60958283266

=== Fold 1/5 ===
Validation Accuracy: 0.6624
Classification Report:
               precision    recall  f1-score   support

Non-Repeater       0.20      1.00      0.34       149
    Repeater       1.00      0.63      0.77      1584

    accuracy                           0.66      1733
   macro avg       0.60      0.82      0.56      1733
weighted avg       0.93      0.66      0.74      1733

Confusion Matrix:
 [[149   0]
 [585 999]]

=== Fold 2/5 ===
Validation Accuracy: 0.5782
Classification Report:
 [I 2025-06-12 12:34:29,653] Trial 89 finished with value: 0.6320406278855032 and parameters: {'hidden_dim': 926, 'latent_dim': 27, 'beta': 0.7119039488292824, 'gamma': 0.20883250510078102, 'dropout_rate': 0.1147294394808292, 'lr': 0.00011756578004800755, 'scheduler_patience': 6, 'class_weight': 1.718005504666163, 'activation': 'LeakyReLU', 'classification_multiplier': 6593.1624911075505}. Best is trial 72 with value: 0.7479224376731302.
/home/ubuntu/frb-analysis/.frb-analysis/lib/python3.12/site-packages/sklearn/metrics/_classification.py:1565: UndefinedMetricWarning: Precision is ill-defined and being set to 0.0 in labels with no predicted samples. Use `zero_division` parameter to control this behavior.
  _warn_prf(average, modifier, f"{metric.capitalize()} is", len(result))
/home/ubuntu/frb-analysis/.frb-analysis/lib/python3.12/site-packages/sklearn/metrics/_classification.py:1565: UndefinedMetricWarning: Precision is ill-defined and being set to 0.0 in labels with no predicted samples. Use `zero_division` parameter to control this behavior.
  _warn_prf(average, modifier, f"{metric.capitalize()} is", len(result))
/home/ubuntu/frb-analysis/.frb-analysis/lib/python3.12/site-packages/sklearn/metrics/_classification.py:1565: UndefinedMetricWarning: Precision is ill-defined and being set to 0.0 in labels with no predicted samples. Use `zero_division` parameter to control this behavior.
  _warn_prf(average, modifier, f"{metric.capitalize()} is", len(result))
/home/ubuntu/frb-analysis/.frb-analysis/lib/python3.12/site-packages/sklearn/metrics/_classification.py:1565: UndefinedMetricWarning: Precision is ill-defined and being set to 0.0 in labels with no predicted samples. Use `zero_division` parameter to control this behavior.
  _warn_prf(average, modifier, f"{metric.capitalize()} is", len(result))
/home/ubuntu/frb-analysis/.frb-analysis/lib/python3.12/site-packages/sklearn/metrics/_classification.py:1565: UndefinedMetricWarning: Precision is ill-defined and being set to 0.0 in labels with no predicted samples. Use `zero_division` parameter to control this behavior.
  _warn_prf(average, modifier, f"{metric.capitalize()} is", len(result))
/home/ubuntu/frb-analysis/.frb-analysis/lib/python3.12/site-packages/sklearn/metrics/_classification.py:1565: UndefinedMetricWarning: Precision is ill-defined and being set to 0.0 in labels with no predicted samples. Use `zero_division` parameter to control this behavior.
  _warn_prf(average, modifier, f"{metric.capitalize()} is", len(result))
/home/ubuntu/frb-analysis/.frb-analysis/lib/python3.12/site-packages/sklearn/metrics/_classification.py:1565: UndefinedMetricWarning: Precision is ill-defined and being set to 0.0 in labels with no predicted samples. Use `zero_division` parameter to control this behavior.
  _warn_prf(average, modifier, f"{metric.capitalize()} is", len(result))
/home/ubuntu/frb-analysis/.frb-analysis/lib/python3.12/site-packages/sklearn/metrics/_classification.py:1565: UndefinedMetricWarning: Precision is ill-defined and being set to 0.0 in labels with no predicted samples. Use `zero_division` parameter to control this behavior.
  _warn_prf(average, modifier, f"{metric.capitalize()} is", len(result))
/home/ubuntu/frb-analysis/.frb-analysis/lib/python3.12/site-packages/sklearn/metrics/_classification.py:1565: UndefinedMetricWarning: Precision is ill-defined and being set to 0.0 in labels with no predicted samples. Use `zero_division` parameter to control this behavior.
  _warn_prf(average, modifier, f"{metric.capitalize()} is", len(result))
[I 2025-06-12 12:40:29,236] Trial 90 finished with value: 0.11553554939981532 and parameters: {'hidden_dim': 1170, 'latent_dim': 18, 'beta': 0.5453764786774923, 'gamma': 0.319934002644533, 'dropout_rate': 0.12952393287989503, 'lr': 0.005304352674096957, 'scheduler_patience': 6, 'class_weight': 1.3804242604950512, 'activation': 'ELU', 'classification_multiplier': 5291.742471522423}. Best is trial 72 with value: 0.7479224376731302.
[I 2025-06-12 12:46:39,484] Trial 91 finished with value: 0.6852493074792244 and parameters: {'hidden_dim': 1266, 'latent_dim': 29, 'beta': 0.8354465030434983, 'gamma': 0.8533959654666932, 'dropout_rate': 0.17242621717373835, 'lr': 0.00036225720551889893, 'scheduler_patience': 7, 'class_weight': 1.6177849248136262, 'activation': 'ReLU', 'classification_multiplier': 7228.570279728941}. Best is trial 72 with value: 0.7479224376731302.
              precision    recall  f1-score   support

Non-Repeater       0.17      0.99      0.29       150
    Repeater       1.00      0.54      0.70      1583

    accuracy                           0.58      1733
   macro avg       0.58      0.77      0.49      1733
weighted avg       0.93      0.58      0.66      1733

Confusion Matrix:
 [[149   1]
 [730 853]]

=== Fold 3/5 ===
Validation Accuracy: 0.6342
Classification Report:
               precision    recall  f1-score   support

Non-Repeater       0.19      0.99      0.32       150
    Repeater       1.00      0.60      0.75      1583

    accuracy                           0.63      1733
   macro avg       0.59      0.80      0.53      1733
weighted avg       0.93      0.63      0.71      1733

Confusion Matrix:
 [[149   1]
 [633 950]]

=== Fold 4/5 ===
Validation Accuracy: 0.5401
Classification Report:
               precision    recall  f1-score   support

Non-Repeater       0.16      0.99      0.27       150
    Repeater       1.00      0.50      0.66      1583

    accuracy                           0.54      1733
   macro avg       0.58      0.75      0.47      1733
weighted avg       0.93      0.54      0.63      1733

Confusion Matrix:
 [[149   1]
 [796 787]]

=== Fold 5/5 ===
Validation Accuracy: 0.7454
Classification Report:
               precision    recall  f1-score   support

Non-Repeater       0.25      0.99      0.40       149
    Repeater       1.00      0.72      0.84      1583

    accuracy                           0.75      1732
   macro avg       0.62      0.85      0.62      1732
weighted avg       0.93      0.75      0.80      1732

Confusion Matrix:
 [[ 147    2]
 [ 439 1144]]


=== Summary ===
Total False Positives: 5
Total False Negatives: 3183
Total True Positives: 4733
Total True Negatives: 743

Confusion Matrix (with duplicates):
              Non-Repeater  Repeater
Non-Repeater         743.0       5.0
Repeater            3183.0    4733.0
accuracy_score
0.6320406278855032
Trial 1: hidden_dim=926, latent_dim=27, beta=0.7119039488292824, gamma=0.20883250510078102, dropout_rate=0.1147294394808292, lr=0.00011756578004800755, scheduler_patience=6, class_weight=1.718005504666163, activation=LeakyReLU, classification_multiplier=6593.1624911075505

=== Fold 1/5 ===
Validation Accuracy: 0.0860
Classification Report:
               precision    recall  f1-score   support

Non-Repeater       0.09      1.00      0.16       149
    Repeater       0.00      0.00      0.00      1584

    accuracy                           0.09      1733
   macro avg       0.04      0.50      0.08      1733
weighted avg       0.01      0.09      0.01      1733

Confusion Matrix:
 [[ 149    0]
 [1584    0]]

=== Fold 2/5 ===
Validation Accuracy: 0.2320
Classification Report:
               precision    recall  f1-score   support

Non-Repeater       0.10      1.00      0.18       150
    Repeater       1.00      0.16      0.27      1583

    accuracy                           0.23      1733
   macro avg       0.55      0.58      0.23      1733
weighted avg       0.92      0.23      0.27      1733

Confusion Matrix:
 [[ 150    0]
 [1331  252]]

=== Fold 3/5 ===
Validation Accuracy: 0.0866
Classification Report:
               precision    recall  f1-score   support

Non-Repeater       0.09      1.00      0.16       150
    Repeater       0.00      0.00      0.00      1583

    accuracy                           0.09      1733
   macro avg       0.04      0.50      0.08      1733
weighted avg       0.01      0.09      0.01      1733

Confusion Matrix:
 [[ 150    0]
 [1583    0]]

=== Fold 4/5 ===
Validation Accuracy: 0.0866
Classification Report:
               precision    recall  f1-score   support

Non-Repeater       0.09      1.00      0.16       150
    Repeater       0.00      0.00      0.00      1583

    accuracy                           0.09      1733
   macro avg       0.04      0.50      0.08      1733
weighted avg       0.01      0.09      0.01      1733

Confusion Matrix:
 [[ 150    0]
 [1583    0]]

=== Fold 5/5 ===
Validation Accuracy: 0.0866
Classification Report:
               precision    recall  f1-score   support

Non-Repeater       0.09      1.00      0.16       149
    Repeater       1.00      0.00      0.00      1583

    accuracy                           0.09      1732
   macro avg       0.54      0.50      0.08      1732
weighted avg       0.92      0.09      0.01      1732

Confusion Matrix:
 [[ 149    0]
 [1582    1]]


=== Summary ===
Total False Positives: 0
Total False Negatives: 7663
Total True Positives: 253
Total True Negatives: 748

Confusion Matrix (with duplicates):
              Non-Repeater  Repeater
Non-Repeater         748.0       0.0
Repeater            7663.0     253.0
accuracy_score
0.11553554939981532
Trial 1: hidden_dim=1170, latent_dim=18, beta=0.5453764786774923, gamma=0.319934002644533, dropout_rate=0.12952393287989503, lr=0.005304352674096957, scheduler_patience=6, class_weight=1.3804242604950512, activation=ELU, classification_multiplier=5291.742471522423

=== Fold 1/5 ===
Validation Accuracy: 0.6803
Classification Report:
               precision    recall  f1-score   support

Non-Repeater       0.21      0.99      0.35       149
    Repeater       1.00      0.65      0.79      1584

    accuracy                           0.68      1733
   macro avg       0.61      0.82      0.57      1733
weighted avg       0.93      0.68      0.75      1733

Confusion Matrix:
 [[ 148    1]
 [ 553 1031]]

=== Fold 2/5 ===
Validation Accuracy: 0.6578
Classification Report:
               precision    recall  f1-score   support

Non-Repeater       0.20      0.99      0.33       150
    Repeater       1.00      0.63      0.77      1583

    accuracy                           0.66      1733
   macro avg       0.60      0.81      0.55      1733
weighted avg       0.93      0.66      0.73      1733

Confusion Matrix:
 [[149   1]
 [592 991]]

=== Fold 3/5 ===
Validation Accuracy: 0.7074
Classification Report:
               precision    recall  f1-score   support

Non-Repeater       0.23      0.99      0.37       150
    Repeater       1.00      0.68      0.81      1583

    accuracy                           0.71      1733
   macro avg       0.61      0.83      0.59      1733
weighted avg       0.93      0.71      0.77      1733

Confusion Matrix:
 [[ 148    2]
 [ 505 1078]]

=== Fold 4/5 ===
Validation Accuracy: 0.6376
Classification Report:
               precision    recall  f1-score   support

Non-Repeater       0.19      0.99      0.32       150
    Repeater       1.00      0.60      0.75      1583

    accuracy                           0.64      1733
   macro avg       0.60      0.80      0.54      1733
weighted avg       0.93      0.64      0.72      1733

Confusion Matrix:
 [[149   1]
 [627 956]]

=== Fold 5/5 ===
Validation Accuracy: 0.7431
Classification Report:
               precision    recall  f1-score   support

Non-Repeater       0.25      0.97      0.39       149
    Repeater       1.00      0.72      0.84      1583

    accuracy                           0.74      1732
   macro avg       0.62      0.85      0.62      1732
weighted avg       0.93      0.74      0.80      1732

Confusion Matrix:
 [[ 145    4]
 [ 441 1142]]


=== Summary ===
Total False Positives: 9
Total False Negatives: 2718
Total True Positives: 5198
Total True Negatives: 739

Confusion Matrix (with duplicates):
              Non-Repeater  Repeater
Non-Repeater         739.0       9.0
Repeater            2718.0    5198.0
accuracy_score
0.6852493074792244
Trial 1: hidden_dim=1266, latent_dim=29, beta=0.8354465030434983, gamma=0.8533959654666932, dropout_rate=0.17242621717373835, lr=0.00036225720551889893, scheduler_patience=7, class_weight=1.6177849248136262, activation=ReLU, classification_multiplier=7228.570279728941

=== Fold 1/5 ===
Validation Accuracy: 0.6919
Classification Report:
 [I 2025-06-12 12:53:03,787] Trial 92 finished with value: 0.689173591874423 and parameters: {'hidden_dim': 1371, 'latent_dim': 31, 'beta': 0.8093205110482926, 'gamma': 0.9867846449227476, 'dropout_rate': 0.17281415530211353, 'lr': 0.0004009102471615694, 'scheduler_patience': 7, 'class_weight': 1.6039721768561845, 'activation': 'ReLU', 'classification_multiplier': 7078.404474544341}. Best is trial 72 with value: 0.7479224376731302.
