[I 2025-06-13 08:19:54,335] Trial 277 finished with value: 0.748730378578024 and parameters: {'hidden_dim': 1387, 'latent_dim': 33, 'beta': 1.3637894742082064, 'gamma': 0.25823105486238207, 'dropout_rate': 0.12886651056560774, 'lr': 0.0003033865361137844, 'scheduler_patience': 7, 'class_weight': 2.686756063961683, 'activation': 'ReLU', 'classification_multiplier': 14230.255305976742}. Best is trial 194 with value: 0.8103647276084949.

Confusion Matrix (with duplicates):
              Non-Repeater  Repeater
Non-Repeater         737.0      11.0
Repeater            2134.0    5782.0
accuracy_score
0.7524238227146814
Trial 1: hidden_dim=1342, latent_dim=32, beta=1.4195904537191357, gamma=0.19598363126520352, dropout_rate=0.11468391876783543, lr=0.0005211976116700367, scheduler_patience=7, class_weight=2.8545421568779408, activation=ReLU, classification_multiplier=14645.105022724978

=== Fold 1/5 ===
Validation Accuracy: 0.7732
Classification Report:
               precision    recall  f1-score   support

Non-Repeater       0.27      0.98      0.43       149
    Repeater       1.00      0.75      0.86      1584

    accuracy                           0.77      1733
   macro avg       0.63      0.87      0.64      1733
weighted avg       0.94      0.77      0.82      1733

Confusion Matrix:
 [[ 146    3]
 [ 390 1194]]

=== Fold 2/5 ===
Validation Accuracy: 0.6561
Classification Report:
               precision    recall  f1-score   support

Non-Repeater       0.20      0.99      0.33       150
    Repeater       1.00      0.62      0.77      1583

    accuracy                           0.66      1733
   macro avg       0.60      0.81      0.55      1733
weighted avg       0.93      0.66      0.73      1733

Confusion Matrix:
 [[149   1]
 [595 988]]

=== Fold 3/5 ===
Validation Accuracy: 0.7530
Classification Report:
               precision    recall  f1-score   support

Non-Repeater       0.26      0.99      0.41       150
    Repeater       1.00      0.73      0.84      1583

    accuracy                           0.75      1733
   macro avg       0.63      0.86      0.63      1733
weighted avg       0.93      0.75      0.81      1733

Confusion Matrix:
 [[ 148    2]
 [ 426 1157]]

=== Fold 4/5 ===
Validation Accuracy: 0.6520
Classification Report:
               precision    recall  f1-score   support

Non-Repeater       0.20      0.99      0.33       150
    Repeater       1.00      0.62      0.77      1583

    accuracy                           0.65      1733
   macro avg       0.60      0.80      0.55      1733
weighted avg       0.93      0.65      0.73      1733

Confusion Matrix:
 [[148   2]
 [601 982]]

=== Fold 5/5 ===
Validation Accuracy: 0.7691
Classification Report:
               precision    recall  f1-score   support

Non-Repeater       0.27      0.97      0.42       149
    Repeater       1.00      0.75      0.86      1583

    accuracy                           0.77      1732
   macro avg       0.63      0.86      0.64      1732
weighted avg       0.93      0.77      0.82      1732

Confusion Matrix:
 [[ 145    4]
 [ 396 1187]]


=== Summary ===
Total False Positives: 12
Total False Negatives: 2408
Total True Positives: 5508
Total True Negatives: 736

Confusion Matrix (with duplicates):
              Non-Repeater  Repeater
Non-Repeater         736.0      12.0
Repeater            2408.0    5508.0
accuracy_score
0.7206832871652816
Trial 1: hidden_dim=1254, latent_dim=30, beta=1.4692259902035367, gamma=0.131427703358807, dropout_rate=0.15875986238340653, lr=0.0008172687928654015, scheduler_patience=7, class_weight=2.498238697540778, activation=ReLU, classification_multiplier=14853.487422276563

=== Fold 1/5 ===
Validation Accuracy: 0.7190
Classification Report:
               precision    recall  f1-score   support

Non-Repeater       0.23      0.99      0.38       149
    Repeater       1.00      0.69      0.82      1584

    accuracy                           0.72      1733
   macro avg       0.62      0.84      0.60      1733
weighted avg       0.93      0.72      0.78      1733

Confusion Matrix:
 [[ 147    2]
 [ 485 1099]]

=== Fold 2/5 ===
Validation Accuracy: 0.7501
Classification Report:
               precision    recall  f1-score   support

Non-Repeater       0.26      0.99      0.41       150
    Repeater       1.00      0.73      0.84      1583

    accuracy                           0.75      1733
   macro avg       0.63      0.86      0.62      1733
weighted avg       0.93      0.75      0.80      1733

Confusion Matrix:
 [[ 149    1]
 [ 432 1151]]

=== Fold 3/5 ===
Validation Accuracy: 0.6890
Classification Report:
               precision    recall  f1-score   support

Non-Repeater       0.22      0.99      0.36       150
    Repeater       1.00      0.66      0.79      1583

    accuracy                           0.69      1733
   macro avg       0.61      0.83      0.58      1733
weighted avg       0.93      0.69      0.76      1733

Confusion Matrix:
 [[ 149    1]
 [ 538 1045]]

=== Fold 4/5 ===
Validation Accuracy: 0.7605
Classification Report:
               precision    recall  f1-score   support

Non-Repeater       0.26      0.97      0.41       150
    Repeater       1.00      0.74      0.85      1583

    accuracy                           0.76      1733
   macro avg       0.63      0.86      0.63      1733
weighted avg       0.93      0.76      0.81      1733

Confusion Matrix:
 [[ 146    4]
 [ 411 1172]]

=== Fold 5/5 ===
Validation Accuracy: 0.8251
Classification Report:
               precision    recall  f1-score   support

Non-Repeater       0.33      0.97      0.49       149
    Repeater       1.00      0.81      0.89      1583

    accuracy                           0.83      1732
   macro avg       0.66      0.89      0.69      1732
weighted avg       0.94      0.83      0.86      1732

Confusion Matrix:
 [[ 145    4]
 [ 299 1284]]


=== Summary ===
Total False Positives: 12
Total False Negatives: 2165
Total True Positives: 5751
Total True Negatives: 736

Confusion Matrix (with duplicates):
              Non-Repeater  Repeater
Non-Repeater         736.0      12.0
Repeater            2165.0    5751.0
accuracy_score
0.748730378578024
Trial 1: hidden_dim=1387, latent_dim=33, beta=1.3637894742082064, gamma=0.25823105486238207, dropout_rate=0.12886651056560774, lr=0.0003033865361137844, scheduler_patience=7, class_weight=2.686756063961683, activation=ReLU, classification_multiplier=14230.255305976742

=== Fold 1/5 ===
Validation Accuracy: 0.7161
Classification Report:
               precision    recall  f1-score   support

Non-Repeater       0.23      1.00      0.38       149
    Repeater       1.00      0.69      0.82      1584

    accuracy                           0.72      1733
   macro avg       0.62      0.84      0.60      1733
weighted avg       0.93      0.72      0.78      1733

Confusion Matrix:
 [[ 149    0]
 [ 492 1092]]

=== Fold 2/5 ===
Validation Accuracy: 0.6999
Classification Report:
               precision    recall  f1-score   support

Non-Repeater       0.22      0.99      0.36       150
    Repeater       1.00      0.67      0.80      1583

    accuracy                           0.70      1733
   macro avg       0.61      0.83      0.58      1733
weighted avg       0.93      0.70      0.77      1733

Confusion Matrix:
 [[ 149    1]
 [ 519 1064]]

=== Fold 3/5 ===
Validation Accuracy: 0.7744
Classification Report:
               precision    recall  f1-score   support

Non-Repeater       0.28      0.99      0.43       150
    Repeater       1.00      0.75      0.86      1583

    accuracy                           0.77      1733
   macro avg       0.64      0.87      0.65      1733
weighted avg       0.94      0.77      0.82      1733

Confusion Matrix:
 [[ 148    2]
 [ 389 1194]]

=== Fold 4/5 ===
Validation Accuracy: 0.7778
Classification Report:
               precision    recall  f1-score   support

Non-Repeater       0.28      0.99      0.43       150
    Repeater       1.00      0.76      0.86      1583

    accuracy                           0.78      1733
   macro avg       0.64      0.87      0.65      1733
weighted avg       0.94      0.78      0.82      1733

Confusion Matrix:
 [[ 148    2]
 [ 383 1200]]

=== Fold 5/5 ===
Validation Accuracy: 0.8568
Classification Report:
               precision    recall  f1-score   support

Non-Repeater       0.37      0.97      0.54       149
    Repeater       1.00      0.85      0.92      1583

    accuracy                           0.86      1732
   macro avg       0.68      0.91      0.73      1732
weighted avg       0.94      0.86      0.88      1732

[I 2025-06-13 08:26:31,291] Trial 278 finished with value: 0.7650046168051708 and parameters: {'hidden_dim': 1465, 'latent_dim': 32, 'beta': 1.5624094810974327, 'gamma': 0.1677115943182318, 'dropout_rate': 0.14823849486681256, 'lr': 0.0005769101768012375, 'scheduler_patience': 7, 'class_weight': 2.9055408075144893, 'activation': 'ReLU', 'classification_multiplier': 13780.18037583412}. Best is trial 194 with value: 0.8103647276084949.
/home/ubuntu/frb-analysis/.frb-analysis/lib/python3.12/site-packages/sklearn/metrics/_classification.py:1565: UndefinedMetricWarning: Precision is ill-defined and being set to 0.0 in labels with no predicted samples. Use `zero_division` parameter to control this behavior.
  _warn_prf(average, modifier, f"{metric.capitalize()} is", len(result))
/home/ubuntu/frb-analysis/.frb-analysis/lib/python3.12/site-packages/sklearn/metrics/_classification.py:1565: UndefinedMetricWarning: Precision is ill-defined and being set to 0.0 in labels with no predicted samples. Use `zero_division` parameter to control this behavior.
  _warn_prf(average, modifier, f"{metric.capitalize()} is", len(result))
/home/ubuntu/frb-analysis/.frb-analysis/lib/python3.12/site-packages/sklearn/metrics/_classification.py:1565: UndefinedMetricWarning: Precision is ill-defined and being set to 0.0 in labels with no predicted samples. Use `zero_division` parameter to control this behavior.
  _warn_prf(average, modifier, f"{metric.capitalize()} is", len(result))
[I 2025-06-13 08:33:04,349] Trial 279 finished with value: 0.20787165281625117 and parameters: {'hidden_dim': 1472, 'latent_dim': 32, 'beta': 1.5679783810813648, 'gamma': 0.22334009621313333, 'dropout_rate': 0.14871841159488905, 'lr': 0.0050737332520216305, 'scheduler_patience': 7, 'class_weight': 2.93008377389899, 'activation': 'GELU', 'classification_multiplier': 13786.338731592483}. Best is trial 194 with value: 0.8103647276084949.
[I 2025-06-13 08:39:43,548] Trial 280 finished with value: 0.7138734995383195 and parameters: {'hidden_dim': 1512, 'latent_dim': 35, 'beta': 1.6290158880951888, 'gamma': 0.2877289841870854, 'dropout_rate': 0.1195519523541905, 'lr': 0.00040547458282598486, 'scheduler_patience': 3, 'class_weight': 2.8865877297697167, 'activation': 'ReLU', 'classification_multiplier': 13953.069802868093}. Best is trial 194 with value: 0.8103647276084949.
Confusion Matrix:
 [[ 144    5]
 [ 243 1340]]


=== Summary ===
Total False Positives: 10
Total False Negatives: 2026
Total True Positives: 5890
Total True Negatives: 738

Confusion Matrix (with duplicates):
              Non-Repeater  Repeater
Non-Repeater         738.0      10.0
Repeater            2026.0    5890.0
accuracy_score
0.7650046168051708
Trial 1: hidden_dim=1465, latent_dim=32, beta=1.5624094810974327, gamma=0.1677115943182318, dropout_rate=0.14823849486681256, lr=0.0005769101768012375, scheduler_patience=7, class_weight=2.9055408075144893, activation=ReLU, classification_multiplier=13780.18037583412

=== Fold 1/5 ===
Validation Accuracy: 0.0871
Classification Report:
               precision    recall  f1-score   support

Non-Repeater       0.09      1.00      0.16       149
    Repeater       1.00      0.00      0.00      1584

    accuracy                           0.09      1733
   macro avg       0.54      0.50      0.08      1733
weighted avg       0.92      0.09      0.02      1733

Confusion Matrix:
 [[ 149    0]
 [1582    2]]

=== Fold 2/5 ===
Validation Accuracy: 0.0866
Classification Report:
               precision    recall  f1-score   support

Non-Repeater       0.09      1.00      0.16       150
    Repeater       0.00      0.00      0.00      1583

    accuracy                           0.09      1733
   macro avg       0.04      0.50      0.08      1733
weighted avg       0.01      0.09      0.01      1733

Confusion Matrix:
 [[ 150    0]
 [1583    0]]

=== Fold 3/5 ===
Validation Accuracy: 0.5516
Classification Report:
               precision    recall  f1-score   support

Non-Repeater       0.16      0.99      0.28       150
    Repeater       1.00      0.51      0.68      1583

    accuracy                           0.55      1733
   macro avg       0.58      0.75      0.48      1733
weighted avg       0.93      0.55      0.64      1733

Confusion Matrix:
 [[149   1]
 [776 807]]

=== Fold 4/5 ===
Validation Accuracy: 0.2250
Classification Report:
               precision    recall  f1-score   support

Non-Repeater       0.10      1.00      0.18       150
    Repeater       1.00      0.15      0.26      1583

    accuracy                           0.23      1733
   macro avg       0.55      0.58      0.22      1733
weighted avg       0.92      0.23      0.26      1733

Confusion Matrix:
 [[ 150    0]
 [1343  240]]

=== Fold 5/5 ===
Validation Accuracy: 0.0889
Classification Report:
               precision    recall  f1-score   support

Non-Repeater       0.09      1.00      0.16       149
    Repeater       1.00      0.00      0.01      1583

    accuracy                           0.09      1732
   macro avg       0.54      0.50      0.08      1732
weighted avg       0.92      0.09      0.02      1732

Confusion Matrix:
 [[ 149    0]
 [1578    5]]


=== Summary ===
Total False Positives: 1
Total False Negatives: 6862
Total True Positives: 1054
Total True Negatives: 747

Confusion Matrix (with duplicates):
              Non-Repeater  Repeater
Non-Repeater         747.0       1.0
Repeater            6862.0    1054.0
accuracy_score
0.20787165281625117
Trial 1: hidden_dim=1472, latent_dim=32, beta=1.5679783810813648, gamma=0.22334009621313333, dropout_rate=0.14871841159488905, lr=0.0050737332520216305, scheduler_patience=7, class_weight=2.93008377389899, activation=GELU, classification_multiplier=13786.338731592483

=== Fold 1/5 ===
Validation Accuracy: 0.6705
Classification Report:
               precision    recall  f1-score   support

Non-Repeater       0.21      1.00      0.34       149
    Repeater       1.00      0.64      0.78      1584

    accuracy                           0.67      1733
   macro avg       0.60      0.82      0.56      1733
weighted avg       0.93      0.67      0.74      1733

Confusion Matrix:
 [[ 149    0]
 [ 571 1013]]

=== Fold 2/5 ===
Validation Accuracy: 0.7478
Classification Report:
               precision    recall  f1-score   support

Non-Repeater       0.25      0.99      0.41       150
    Repeater       1.00      0.72      0.84      1583

    accuracy                           0.75      1733
   macro avg       0.63      0.86      0.62      1733
weighted avg       0.93      0.75      0.80      1733

Confusion Matrix:
 [[ 149    1]
 [ 436 1147]]

=== Fold 3/5 ===
Validation Accuracy: 0.7063
Classification Report:
               precision    recall  f1-score   support

Non-Repeater       0.23      0.99      0.37       150
    Repeater       1.00      0.68      0.81      1583

    accuracy                           0.71      1733
   macro avg       0.61      0.84      0.59      1733
weighted avg       0.93      0.71      0.77      1733

Confusion Matrix:
 [[ 149    1]
 [ 508 1075]]

=== Fold 4/5 ===
Validation Accuracy: 0.7461
Classification Report:
               precision    recall  f1-score   support

Non-Repeater       0.25      0.97      0.40       150
    Repeater       1.00      0.72      0.84      1583

    accuracy                           0.75      1733
   macro avg       0.62      0.85      0.62      1733
weighted avg       0.93      0.75      0.80      1733

Confusion Matrix:
 [[ 146    4]
 [ 436 1147]]

=== Fold 5/5 ===
Validation Accuracy: 0.6986
Classification Report:
               precision    recall  f1-score   support

Non-Repeater       0.22      0.97      0.36       149
    Repeater       1.00      0.67      0.80      1583

    accuracy                           0.70      1732
   macro avg       0.61      0.82      0.58      1732
weighted avg       0.93      0.70      0.76      1732

Confusion Matrix:
 [[ 145    4]
 [ 518 1065]]


=== Summary ===
Total False Positives: 10
Total False Negatives: 2469
Total True Positives: 5447
Total True Negatives: 738

Confusion Matrix (with duplicates):
              Non-Repeater  Repeater
Non-Repeater         738.0      10.0
Repeater            2469.0    5447.0
accuracy_score
0.7138734995383195
Trial 1: hidden_dim=1512, latent_dim=35, beta=1.6290158880951888, gamma=0.2877289841870854, dropout_rate=0.1195519523541905, lr=0.00040547458282598486, scheduler_patience=3, class_weight=2.8865877297697167, activation=ReLU, classification_multiplier=13953.069802868093

=== Fold 1/5 ===
Validation Accuracy: 0.7588
Classification Report:
               precision    recall  f1-score   support

Non-Repeater       0.26      0.99      0.41       149
    Repeater       1.00      0.74      0.85      1584

    accuracy                           0.76      1733
   macro avg       0.63      0.86      0.63      1733
weighted avg       0.93      0.76      0.81      1733

Confusion Matrix:
 [[ 147    2]
 [ 416 1168]]

=== Fold 2/5 ===
Validation Accuracy: 0.7426
Classification Report:
               precision    recall  f1-score   support

Non-Repeater       0.25      0.99      0.40       150
    Repeater       1.00      0.72      0.84      1583

    accuracy                           0.74      1733
   macro avg       0.62      0.86      0.62      1733
weighted avg       0.93      0.74      0.80      1733

Confusion Matrix:
 [[ 149    1]
 [ 445 1138]]

=== Fold 3/5 ===
Validation Accuracy: 0.7311
Classification Report:
               precision    recall  f1-score   support

Non-Repeater       0.24      0.99      0.39       150
    Repeater       1.00      0.71      0.83      1583

    accuracy                           0.73      1733
   macro avg       0.62      0.85      0.61      1733
weighted avg       0.93      0.73      0.79      1733

Confusion Matrix:
 [[ 149    1]
 [ 465 1118]]

=== Fold 4/5 ===
Validation Accuracy: 0.7513
Classification Report:
               precision    recall  f1-score   support

Non-Repeater       0.26      0.99      0.41       150
    Repeater       1.00      0.73      0.84      1583

    accuracy                           0.75      1733
   macro avg       0.63      0.86      0.62      1733
weighted avg       0.93      0.75      0.80      1733

Confusion Matrix:
 [[ 148    2]
 [ 429 1154]]

=== Fold 5/5 ===
Validation Accuracy: 0.7506
Classification Report:
 [I 2025-06-13 08:46:18,091] Trial 281 finished with value: 0.7468836565096952 and parameters: {'hidden_dim': 1452, 'latent_dim': 34, 'beta': 1.8957486463649982, 'gamma': 0.17423053271603103, 'dropout_rate': 0.1261223716934433, 'lr': 0.00010389158657831413, 'scheduler_patience': 7, 'class_weight': 2.957166302555914, 'activation': 'ReLU', 'classification_multiplier': 14495.031547719183}. Best is trial 194 with value: 0.8103647276084949.
[I 2025-06-13 08:52:49,609] Trial 282 finished with value: 0.555286241920591 and parameters: {'hidden_dim': 1429, 'latent_dim': 33, 'beta': 1.5326422128790187, 'gamma': 0.2001420736986234, 'dropout_rate': 0.1088848155682323, 'lr': 0.0011551182879296462, 'scheduler_patience': 7, 'class_weight': 0.8274501547204975, 'activation': 'ReLU', 'classification_multiplier': 14682.558931804033}. Best is trial 194 with value: 0.8103647276084949.
