[I 2025-06-12 18:10:36,954] Trial 145 finished with value: 0.740881809787627 and parameters: {'hidden_dim': 1230, 'latent_dim': 32, 'beta': 1.2941643982243716, 'gamma': 0.13238047800775515, 'dropout_rate': 0.1328402323847411, 'lr': 0.0002673485267435748, 'scheduler_patience': 7, 'class_weight': 2.9985188287565316, 'activation': 'ReLU', 'classification_multiplier': 13747.44533705162}. Best is trial 142 with value: 0.7733148661126501.

Confusion Matrix (with duplicates):
              Non-Repeater  Repeater
Non-Repeater         739.0       9.0
Repeater            2598.0    5318.0
accuracy_score
0.6990997229916898
Trial 1: hidden_dim=1172, latent_dim=33, beta=1.1904986240810271, gamma=0.1011549789671663, dropout_rate=0.14166361056749682, lr=0.00010380652917033007, scheduler_patience=7, class_weight=2.8347223567500155, activation=ReLU, classification_multiplier=13952.821390645717

=== Fold 1/5 ===
Validation Accuracy: 0.7830
Classification Report:
               precision    recall  f1-score   support

Non-Repeater       0.28      0.98      0.44       149
    Repeater       1.00      0.76      0.87      1584

    accuracy                           0.78      1733
   macro avg       0.64      0.87      0.65      1733
weighted avg       0.94      0.78      0.83      1733

Confusion Matrix:
 [[ 146    3]
 [ 373 1211]]

=== Fold 2/5 ===
Validation Accuracy: 0.7721
Classification Report:
               precision    recall  f1-score   support

Non-Repeater       0.27      0.99      0.43       150
    Repeater       1.00      0.75      0.86      1583

    accuracy                           0.77      1733
   macro avg       0.64      0.87      0.64      1733
weighted avg       0.94      0.77      0.82      1733

Confusion Matrix:
 [[ 149    1]
 [ 394 1189]]

=== Fold 3/5 ===
Validation Accuracy: 0.6855
Classification Report:
               precision    recall  f1-score   support

Non-Repeater       0.22      0.99      0.35       150
    Repeater       1.00      0.66      0.79      1583

    accuracy                           0.69      1733
   macro avg       0.61      0.82      0.57      1733
weighted avg       0.93      0.69      0.75      1733

Confusion Matrix:
 [[ 149    1]
 [ 544 1039]]

=== Fold 4/5 ===
Validation Accuracy: 0.7819
Classification Report:
               precision    recall  f1-score   support

Non-Repeater       0.28      0.98      0.44       150
    Repeater       1.00      0.76      0.86      1583

    accuracy                           0.78      1733
   macro avg       0.64      0.87      0.65      1733
weighted avg       0.94      0.78      0.83      1733

Confusion Matrix:
 [[ 147    3]
 [ 375 1208]]

=== Fold 5/5 ===
Validation Accuracy: 0.7783
Classification Report:
               precision    recall  f1-score   support

Non-Repeater       0.28      0.97      0.43       149
    Repeater       1.00      0.76      0.86      1583

    accuracy                           0.78      1732
   macro avg       0.64      0.87      0.65      1732
weighted avg       0.93      0.78      0.83      1732

Confusion Matrix:
 [[ 145    4]
 [ 380 1203]]


=== Summary ===
Total False Positives: 12
Total False Negatives: 2066
Total True Positives: 5850
Total True Negatives: 736

Confusion Matrix (with duplicates):
              Non-Repeater  Repeater
Non-Repeater         736.0      12.0
Repeater            2066.0    5850.0
accuracy_score
0.760156971375808
Trial 1: hidden_dim=1200, latent_dim=32, beta=1.2704225755979388, gamma=0.1369689903768177, dropout_rate=0.1251565142492654, lr=0.0002456017554530426, scheduler_patience=7, class_weight=2.765414363664294, activation=ReLU, classification_multiplier=13493.008212947183

=== Fold 1/5 ===
Validation Accuracy: 0.6901
Classification Report:
               precision    recall  f1-score   support

Non-Repeater       0.21      0.98      0.35       149
    Repeater       1.00      0.66      0.80      1584

    accuracy                           0.69      1733
   macro avg       0.61      0.82      0.57      1733
weighted avg       0.93      0.69      0.76      1733

Confusion Matrix:
 [[ 146    3]
 [ 534 1050]]

=== Fold 2/5 ===
Validation Accuracy: 0.7819
Classification Report:
               precision    recall  f1-score   support

Non-Repeater       0.28      0.99      0.44       150
    Repeater       1.00      0.76      0.86      1583

    accuracy                           0.78      1733
   macro avg       0.64      0.88      0.65      1733
weighted avg       0.94      0.78      0.83      1733

Confusion Matrix:
 [[ 149    1]
 [ 377 1206]]

=== Fold 3/5 ===
Validation Accuracy: 0.7519
Classification Report:
               precision    recall  f1-score   support

Non-Repeater       0.26      0.99      0.41       150
    Repeater       1.00      0.73      0.84      1583

    accuracy                           0.75      1733
   macro avg       0.63      0.86      0.63      1733
weighted avg       0.93      0.75      0.81      1733

Confusion Matrix:
 [[ 149    1]
 [ 429 1154]]

=== Fold 4/5 ===
Validation Accuracy: 0.7098
Classification Report:
               precision    recall  f1-score   support

Non-Repeater       0.23      0.99      0.37       150
    Repeater       1.00      0.68      0.81      1583

    accuracy                           0.71      1733
   macro avg       0.61      0.84      0.59      1733
weighted avg       0.93      0.71      0.77      1733

Confusion Matrix:
 [[ 148    2]
 [ 501 1082]]

=== Fold 5/5 ===
Validation Accuracy: 0.7708
Classification Report:
               precision    recall  f1-score   support

Non-Repeater       0.27      0.97      0.42       149
    Repeater       1.00      0.75      0.86      1583

    accuracy                           0.77      1732
   macro avg       0.63      0.86      0.64      1732
weighted avg       0.93      0.77      0.82      1732

Confusion Matrix:
 [[ 145    4]
 [ 393 1190]]


=== Summary ===
Total False Positives: 11
Total False Negatives: 2234
Total True Positives: 5682
Total True Negatives: 737

Confusion Matrix (with duplicates):
              Non-Repeater  Repeater
Non-Repeater         737.0      11.0
Repeater            2234.0    5682.0
accuracy_score
0.740881809787627
Trial 1: hidden_dim=1230, latent_dim=32, beta=1.2941643982243716, gamma=0.13238047800775515, dropout_rate=0.1328402323847411, lr=0.0002673485267435748, scheduler_patience=7, class_weight=2.9985188287565316, activation=ReLU, classification_multiplier=13747.44533705162

=== Fold 1/5 ===
Validation Accuracy: 0.7046
Classification Report:
               precision    recall  f1-score   support

Non-Repeater       0.22      0.99      0.37       149
    Repeater       1.00      0.68      0.81      1584

    accuracy                           0.70      1733
   macro avg       0.61      0.84      0.59      1733
weighted avg       0.93      0.70      0.77      1733

Confusion Matrix:
 [[ 148    1]
 [ 511 1073]]

=== Fold 2/5 ===
Validation Accuracy: 0.6809
Classification Report:
               precision    recall  f1-score   support

Non-Repeater       0.21      0.99      0.35       150
    Repeater       1.00      0.65      0.79      1583

    accuracy                           0.68      1733
   macro avg       0.61      0.82      0.57      1733
weighted avg       0.93      0.68      0.75      1733

Confusion Matrix:
 [[ 149    1]
 [ 552 1031]]

=== Fold 3/5 ===
Validation Accuracy: 0.7501
Classification Report:
               precision    recall  f1-score   support

Non-Repeater       0.26      0.99      0.41       150
    Repeater       1.00      0.73      0.84      1583

    accuracy                           0.75      1733
   macro avg       0.63      0.86      0.62      1733
weighted avg       0.93      0.75      0.80      1733

Confusion Matrix:
 [[ 149    1]
 [ 432 1151]]

=== Fold 4/5 ===
Validation Accuracy: 0.7086
Classification Report:
               precision    recall  f1-score   support

Non-Repeater       0.23      0.99      0.37       150
    Repeater       1.00      0.68      0.81      1583

    accuracy                           0.71      1733
   macro avg       0.61      0.83      0.59      1733
weighted avg       0.93      0.71      0.77      1733

Confusion Matrix:
 [[ 148    2]
 [ 503 1080]]

=== Fold 5/5 ===
Validation Accuracy: 0.7829
Classification Report:
 [I 2025-06-12 18:16:49,751] Trial 146 finished with value: 0.725415512465374 and parameters: {'hidden_dim': 1262, 'latent_dim': 32, 'beta': 1.2869246689719807, 'gamma': 0.13580768785169187, 'dropout_rate': 0.128872602878441, 'lr': 0.00023517060062191227, 'scheduler_patience': 7, 'class_weight': 2.711093322523807, 'activation': 'ReLU', 'classification_multiplier': 13395.753137307369}. Best is trial 142 with value: 0.7733148661126501.
[I 2025-06-12 18:23:03,044] Trial 147 finished with value: 0.7393813481071099 and parameters: {'hidden_dim': 1261, 'latent_dim': 32, 'beta': 1.2739182718519495, 'gamma': 0.13308424232007324, 'dropout_rate': 0.12896022021543954, 'lr': 0.0003251142424064447, 'scheduler_patience': 7, 'class_weight': 2.713468565863576, 'activation': 'ReLU', 'classification_multiplier': 13662.698024613655}. Best is trial 142 with value: 0.7733148661126501.
[I 2025-06-12 18:29:14,836] Trial 148 finished with value: 0.7379963065558633 and parameters: {'hidden_dim': 1268, 'latent_dim': 32, 'beta': 1.2773779731417858, 'gamma': 0.13899129937767749, 'dropout_rate': 0.12953214447349953, 'lr': 0.000271404870143176, 'scheduler_patience': 7, 'class_weight': 2.6655363766364593, 'activation': 'ReLU', 'classification_multiplier': 13663.346341406223}. Best is trial 142 with value: 0.7733148661126501.
              precision    recall  f1-score   support

Non-Repeater       0.28      0.97      0.44       149
    Repeater       1.00      0.77      0.87      1583

    accuracy                           0.78      1732
   macro avg       0.64      0.87      0.65      1732
weighted avg       0.94      0.78      0.83      1732

Confusion Matrix:
 [[ 145    4]
 [ 372 1211]]


=== Summary ===
Total False Positives: 9
Total False Negatives: 2370
Total True Positives: 5546
Total True Negatives: 739

Confusion Matrix (with duplicates):
              Non-Repeater  Repeater
Non-Repeater         739.0       9.0
Repeater            2370.0    5546.0
accuracy_score
0.725415512465374
Trial 1: hidden_dim=1262, latent_dim=32, beta=1.2869246689719807, gamma=0.13580768785169187, dropout_rate=0.128872602878441, lr=0.00023517060062191227, scheduler_patience=7, class_weight=2.711093322523807, activation=ReLU, classification_multiplier=13395.753137307369

=== Fold 1/5 ===
Validation Accuracy: 0.7034
Classification Report:
               precision    recall  f1-score   support

Non-Repeater       0.22      0.99      0.37       149
    Repeater       1.00      0.68      0.81      1584

    accuracy                           0.70      1733
   macro avg       0.61      0.83      0.59      1733
weighted avg       0.93      0.70      0.77      1733

Confusion Matrix:
 [[ 148    1]
 [ 513 1071]]

=== Fold 2/5 ===
Validation Accuracy: 0.7888
Classification Report:
               precision    recall  f1-score   support

Non-Repeater       0.29      0.99      0.45       150
    Repeater       1.00      0.77      0.87      1583

    accuracy                           0.79      1733
   macro avg       0.64      0.88      0.66      1733
weighted avg       0.94      0.79      0.83      1733

Confusion Matrix:
 [[ 149    1]
 [ 365 1218]]

=== Fold 3/5 ===
Validation Accuracy: 0.6705
Classification Report:
               precision    recall  f1-score   support

Non-Repeater       0.21      0.99      0.34       150
    Repeater       1.00      0.64      0.78      1583

    accuracy                           0.67      1733
   macro avg       0.60      0.81      0.56      1733
weighted avg       0.93      0.67      0.74      1733

Confusion Matrix:
 [[ 148    2]
 [ 569 1014]]

=== Fold 4/5 ===
Validation Accuracy: 0.7548
Classification Report:
               precision    recall  f1-score   support

Non-Repeater       0.26      0.97      0.41       150
    Repeater       1.00      0.73      0.85      1583

    accuracy                           0.75      1733
   macro avg       0.63      0.85      0.63      1733
weighted avg       0.93      0.75      0.81      1733

Confusion Matrix:
 [[ 146    4]
 [ 421 1162]]

=== Fold 5/5 ===
Validation Accuracy: 0.7794
Classification Report:
               precision    recall  f1-score   support

Non-Repeater       0.28      0.98      0.43       149
    Repeater       1.00      0.76      0.86      1583

    accuracy                           0.78      1732
   macro avg       0.64      0.87      0.65      1732
weighted avg       0.94      0.78      0.83      1732

Confusion Matrix:
 [[ 146    3]
 [ 379 1204]]


=== Summary ===
Total False Positives: 11
Total False Negatives: 2247
Total True Positives: 5669
Total True Negatives: 737

Confusion Matrix (with duplicates):
              Non-Repeater  Repeater
Non-Repeater         737.0      11.0
Repeater            2247.0    5669.0
accuracy_score
0.7393813481071099
Trial 1: hidden_dim=1261, latent_dim=32, beta=1.2739182718519495, gamma=0.13308424232007324, dropout_rate=0.12896022021543954, lr=0.0003251142424064447, scheduler_patience=7, class_weight=2.713468565863576, activation=ReLU, classification_multiplier=13662.698024613655

=== Fold 1/5 ===
Validation Accuracy: 0.7040
Classification Report:
               precision    recall  f1-score   support

Non-Repeater       0.23      1.00      0.37       149
    Repeater       1.00      0.68      0.81      1584

    accuracy                           0.70      1733
   macro avg       0.61      0.84      0.59      1733
weighted avg       0.93      0.70      0.77      1733

Confusion Matrix:
 [[ 149    0]
 [ 513 1071]]

=== Fold 2/5 ===
Validation Accuracy: 0.7484
Classification Report:
               precision    recall  f1-score   support

Non-Repeater       0.26      0.99      0.41       150
    Repeater       1.00      0.73      0.84      1583

    accuracy                           0.75      1733
   macro avg       0.63      0.86      0.62      1733
weighted avg       0.93      0.75      0.80      1733

Confusion Matrix:
 [[ 149    1]
 [ 435 1148]]

=== Fold 3/5 ===
Validation Accuracy: 0.7473
Classification Report:
               precision    recall  f1-score   support

Non-Repeater       0.25      0.99      0.40       150
    Repeater       1.00      0.72      0.84      1583

    accuracy                           0.75      1733
   macro avg       0.63      0.86      0.62      1733
weighted avg       0.93      0.75      0.80      1733

Confusion Matrix:
 [[ 149    1]
 [ 437 1146]]

=== Fold 4/5 ===
Validation Accuracy: 0.7121
Classification Report:
               precision    recall  f1-score   support

Non-Repeater       0.23      0.97      0.37       150
    Repeater       1.00      0.69      0.81      1583

    accuracy                           0.71      1733
   macro avg       0.61      0.83      0.59      1733
weighted avg       0.93      0.71      0.77      1733

Confusion Matrix:
 [[ 145    5]
 [ 494 1089]]

=== Fold 5/5 ===
Validation Accuracy: 0.7783
Classification Report:
               precision    recall  f1-score   support

Non-Repeater       0.28      0.97      0.43       149
    Repeater       1.00      0.76      0.86      1583

    accuracy                           0.78      1732
   macro avg       0.64      0.86      0.65      1732
weighted avg       0.93      0.78      0.83      1732

Confusion Matrix:
 [[ 144    5]
 [ 379 1204]]


=== Summary ===
Total False Positives: 12
Total False Negatives: 2258
Total True Positives: 5658
Total True Negatives: 736

Confusion Matrix (with duplicates):
              Non-Repeater  Repeater
Non-Repeater         736.0      12.0
Repeater            2258.0    5658.0
accuracy_score
0.7379963065558633
Trial 1: hidden_dim=1268, latent_dim=32, beta=1.2773779731417858, gamma=0.13899129937767749, dropout_rate=0.12953214447349953, lr=0.000271404870143176, scheduler_patience=7, class_weight=2.6655363766364593, activation=ReLU, classification_multiplier=13663.346341406223

=== Fold 1/5 ===
Validation Accuracy: 0.7611
Classification Report:
               precision    recall  f1-score   support

Non-Repeater       0.26      0.99      0.42       149
    Repeater       1.00      0.74      0.85      1584

    accuracy                           0.76      1733
   macro avg       0.63      0.86      0.63      1733
weighted avg       0.94      0.76      0.81      1733

Confusion Matrix:
 [[ 147    2]
 [ 412 1172]]

=== Fold 2/5 ===
Validation Accuracy: 0.7594
Classification Report:
               precision    recall  f1-score   support

Non-Repeater       0.26      0.99      0.42       150
    Repeater       1.00      0.74      0.85      1583

    accuracy                           0.76      1733
   macro avg       0.63      0.87      0.63      1733
weighted avg       0.94      0.76      0.81      1733

Confusion Matrix:
 [[ 149    1]
 [ 416 1167]]

=== Fold 3/5 ===
Validation Accuracy: 0.7328
Classification Report:
               precision    recall  f1-score   support

Non-Repeater       0.24      0.99      0.39       150
    Repeater       1.00      0.71      0.83      1583

    accuracy                           0.73      1733
   macro avg       0.62      0.85      0.61      1733
weighted avg       0.93      0.73      0.79      1733

Confusion Matrix:
 [[ 149    1]
 [ 462 1121]]

=== Fold 4/5 ===
Validation Accuracy: 0.7813
Classification Report:
 [I 2025-06-12 18:35:26,053] Trial 149 finished with value: 0.7693905817174516 and parameters: {'hidden_dim': 1236, 'latent_dim': 33, 'beta': 1.2758098806388534, 'gamma': 0.14271156926363923, 'dropout_rate': 0.1266703247843578, 'lr': 0.00026259531877428113, 'scheduler_patience': 7, 'class_weight': 2.712602755867619, 'activation': 'ReLU', 'classification_multiplier': 13628.47913323474}. Best is trial 142 with value: 0.7733148661126501.
[I 2025-06-12 18:41:37,107] Trial 150 finished with value: 0.747460757156048 and parameters: {'hidden_dim': 1252, 'latent_dim': 32, 'beta': 1.28109686038569, 'gamma': 0.14050076646389706, 'dropout_rate': 0.12399418638089743, 'lr': 0.0002609950579253001, 'scheduler_patience': 7, 'class_weight': 2.7211271481411394, 'activation': 'ReLU', 'classification_multiplier': 13566.337883496311}. Best is trial 142 with value: 0.7733148661126501.
