[I 2025-06-12 18:47:47,049] Trial 151 finished with value: 0.7661588180978762 and parameters: {'hidden_dim': 1239, 'latent_dim': 32, 'beta': 1.2683453215009122, 'gamma': 0.13424446455181285, 'dropout_rate': 0.12234247562751818, 'lr': 0.00028278237345053973, 'scheduler_patience': 7, 'class_weight': 2.718176321469933, 'activation': 'ReLU', 'classification_multiplier': 13592.382482030862}. Best is trial 142 with value: 0.7733148661126501.
              precision    recall  f1-score   support

Non-Repeater       0.28      0.97      0.44       150
    Repeater       1.00      0.76      0.86      1583

    accuracy                           0.78      1733
   macro avg       0.64      0.87      0.65      1733
weighted avg       0.93      0.78      0.83      1733

Confusion Matrix:
 [[ 146    4]
 [ 375 1208]]

=== Fold 5/5 ===
Validation Accuracy: 0.8124
Classification Report:
               precision    recall  f1-score   support

Non-Repeater       0.31      0.97      0.47       149
    Repeater       1.00      0.80      0.89      1583

    accuracy                           0.81      1732
   macro avg       0.65      0.89      0.68      1732
weighted avg       0.94      0.81      0.85      1732

Confusion Matrix:
 [[ 145    4]
 [ 321 1262]]


=== Summary ===
Total False Positives: 12
Total False Negatives: 1986
Total True Positives: 5930
Total True Negatives: 736

Confusion Matrix (with duplicates):
              Non-Repeater  Repeater
Non-Repeater         736.0      12.0
Repeater            1986.0    5930.0
accuracy_score
0.7693905817174516
Trial 1: hidden_dim=1236, latent_dim=33, beta=1.2758098806388534, gamma=0.14271156926363923, dropout_rate=0.1266703247843578, lr=0.00026259531877428113, scheduler_patience=7, class_weight=2.712602755867619, activation=ReLU, classification_multiplier=13628.47913323474

=== Fold 1/5 ===
Validation Accuracy: 0.7138
Classification Report:
               precision    recall  f1-score   support

Non-Repeater       0.23      0.99      0.37       149
    Repeater       1.00      0.69      0.81      1584

    accuracy                           0.71      1733
   macro avg       0.61      0.84      0.59      1733
weighted avg       0.93      0.71      0.78      1733

Confusion Matrix:
 [[ 148    1]
 [ 495 1089]]

=== Fold 2/5 ===
Validation Accuracy: 0.7796
Classification Report:
               precision    recall  f1-score   support

Non-Repeater       0.28      0.99      0.44       150
    Repeater       1.00      0.76      0.86      1583

    accuracy                           0.78      1733
   macro avg       0.64      0.88      0.65      1733
weighted avg       0.94      0.78      0.83      1733

Confusion Matrix:
 [[ 149    1]
 [ 381 1202]]

=== Fold 3/5 ===
Validation Accuracy: 0.7432
Classification Report:
               precision    recall  f1-score   support

Non-Repeater       0.25      0.99      0.40       150
    Repeater       1.00      0.72      0.84      1583

    accuracy                           0.74      1733
   macro avg       0.62      0.85      0.62      1733
weighted avg       0.93      0.74      0.80      1733

Confusion Matrix:
 [[ 148    2]
 [ 443 1140]]

=== Fold 4/5 ===
Validation Accuracy: 0.6982
Classification Report:
               precision    recall  f1-score   support

Non-Repeater       0.22      0.98      0.36       150
    Repeater       1.00      0.67      0.80      1583

    accuracy                           0.70      1733
   macro avg       0.61      0.83      0.58      1733
weighted avg       0.93      0.70      0.76      1733

Confusion Matrix:
 [[ 147    3]
 [ 520 1063]]

=== Fold 5/5 ===
Validation Accuracy: 0.8025
Classification Report:
               precision    recall  f1-score   support

Non-Repeater       0.30      0.97      0.46       149
    Repeater       1.00      0.79      0.88      1583

    accuracy                           0.80      1732
   macro avg       0.65      0.88      0.67      1732
weighted avg       0.94      0.80      0.84      1732

Confusion Matrix:
 [[ 144    5]
 [ 337 1246]]


=== Summary ===
Total False Positives: 12
Total False Negatives: 2176
Total True Positives: 5740
Total True Negatives: 736

Confusion Matrix (with duplicates):
              Non-Repeater  Repeater
Non-Repeater         736.0      12.0
Repeater            2176.0    5740.0
accuracy_score
0.747460757156048
Trial 1: hidden_dim=1252, latent_dim=32, beta=1.28109686038569, gamma=0.14050076646389706, dropout_rate=0.12399418638089743, lr=0.0002609950579253001, scheduler_patience=7, class_weight=2.7211271481411394, activation=ReLU, classification_multiplier=13566.337883496311

=== Fold 1/5 ===
Validation Accuracy: 0.7853
Classification Report:
               precision    recall  f1-score   support

Non-Repeater       0.29      0.99      0.44       149
    Repeater       1.00      0.77      0.87      1584

    accuracy                           0.79      1733
   macro avg       0.64      0.88      0.66      1733
weighted avg       0.94      0.79      0.83      1733

Confusion Matrix:
 [[ 148    1]
 [ 371 1213]]

=== Fold 2/5 ===
Validation Accuracy: 0.7461
Classification Report:
               precision    recall  f1-score   support

Non-Repeater       0.25      0.99      0.40       150
    Repeater       1.00      0.72      0.84      1583

    accuracy                           0.75      1733
   macro avg       0.63      0.86      0.62      1733
weighted avg       0.93      0.75      0.80      1733

Confusion Matrix:
 [[ 149    1]
 [ 439 1144]]

=== Fold 3/5 ===
Validation Accuracy: 0.7386
Classification Report:
               precision    recall  f1-score   support

Non-Repeater       0.25      0.98      0.39       150
    Repeater       1.00      0.72      0.83      1583

    accuracy                           0.74      1733
   macro avg       0.62      0.85      0.61      1733
weighted avg       0.93      0.74      0.80      1733

Confusion Matrix:
 [[ 147    3]
 [ 450 1133]]

=== Fold 4/5 ===
Validation Accuracy: 0.6982
Classification Report:
               precision    recall  f1-score   support

Non-Repeater       0.22      0.99      0.36       150
    Repeater       1.00      0.67      0.80      1583

    accuracy                           0.70      1733
   macro avg       0.61      0.83      0.58      1733
weighted avg       0.93      0.70      0.76      1733

Confusion Matrix:
 [[ 148    2]
 [ 521 1062]]

=== Fold 5/5 ===
Validation Accuracy: 0.8626
Classification Report:
               precision    recall  f1-score   support

Non-Repeater       0.38      0.97      0.55       149
    Repeater       1.00      0.85      0.92      1583

    accuracy                           0.86      1732
   macro avg       0.69      0.91      0.73      1732
weighted avg       0.94      0.86      0.89      1732

Confusion Matrix:
 [[ 145    4]
 [ 234 1349]]


=== Summary ===
Total False Positives: 11
Total False Negatives: 2015
Total True Positives: 5901
Total True Negatives: 737

Confusion Matrix (with duplicates):
              Non-Repeater  Repeater
Non-Repeater         737.0      11.0
Repeater            2015.0    5901.0
accuracy_score
0.7661588180978762
Trial 1: hidden_dim=1239, latent_dim=32, beta=1.2683453215009122, gamma=0.13424446455181285, dropout_rate=0.12234247562751818, lr=0.00028278237345053973, scheduler_patience=7, class_weight=2.718176321469933, activation=ReLU, classification_multiplier=13592.382482030862

=== Fold 1/5 ===
Validation Accuracy: 0.7761
Classification Report:
               precision    recall  f1-score   support

Non-Repeater       0.28      0.99      0.43       149
    Repeater       1.00      0.76      0.86      1584

    accuracy                           0.78      1733
   macro avg       0.64      0.87      0.65      1733
weighted avg       0.94      0.78      0.82      1733

Confusion Matrix:
 [[ 148    1]
 [ 387 1197]]

=== Fold 2/5 ===
Validation Accuracy: 0.7663
Classification Report:
               precision    recall  f1-score   support

Non-Repeater       0.27      0.99      0.42       150
    Repeater       1.00      0.74      0.85      1583

    accuracy                           0.77      1733
   macro avg       0.63      0.87      0.64      1733
weighted avg       0.94      0.77      0.82      1733

Confusion Matrix:
 [[ 149    1]
 [ 404 1179]]

=== Fold 3/5 ===
Validation Accuracy: 0.7294
Classification Report:
 [I 2025-06-12 18:53:57,853] Trial 152 finished with value: 0.7646583564173592 and parameters: {'hidden_dim': 1254, 'latent_dim': 32, 'beta': 1.2748353328430946, 'gamma': 0.1376891943643199, 'dropout_rate': 0.12427306584107956, 'lr': 0.00023116638665886992, 'scheduler_patience': 7, 'class_weight': 2.711369673946748, 'activation': 'ReLU', 'classification_multiplier': 13615.053791392036}. Best is trial 142 with value: 0.7733148661126501.
[I 2025-06-12 19:00:06,829] Trial 153 finished with value: 0.7524238227146814 and parameters: {'hidden_dim': 1234, 'latent_dim': 32, 'beta': 1.2776199014775778, 'gamma': 0.1318893467874418, 'dropout_rate': 0.12145904227273754, 'lr': 0.0002603548485118001, 'scheduler_patience': 7, 'class_weight': 2.7491327356567274, 'activation': 'ReLU', 'classification_multiplier': 13629.000023264349}. Best is trial 142 with value: 0.7733148661126501.
[I 2025-06-12 19:06:21,522] Trial 154 finished with value: 0.7611957525392429 and parameters: {'hidden_dim': 1271, 'latent_dim': 32, 'beta': 1.2822348756639907, 'gamma': 0.18847213997010093, 'dropout_rate': 0.11682122610481693, 'lr': 0.00028570445030636534, 'scheduler_patience': 7, 'class_weight': 2.7209850185586912, 'activation': 'ReLU', 'classification_multiplier': 13631.642947380378}. Best is trial 142 with value: 0.7733148661126501.
              precision    recall  f1-score   support

Non-Repeater       0.24      0.99      0.39       150
    Repeater       1.00      0.70      0.83      1583

    accuracy                           0.73      1733
   macro avg       0.62      0.85      0.61      1733
weighted avg       0.93      0.73      0.79      1733

Confusion Matrix:
 [[ 148    2]
 [ 467 1116]]

=== Fold 4/5 ===
Validation Accuracy: 0.7842
Classification Report:
               precision    recall  f1-score   support

Non-Repeater       0.28      0.97      0.44       150
    Repeater       1.00      0.77      0.87      1583

    accuracy                           0.78      1733
   macro avg       0.64      0.87      0.65      1733
weighted avg       0.93      0.78      0.83      1733

Confusion Matrix:
 [[ 145    5]
 [ 369 1214]]

=== Fold 5/5 ===
Validation Accuracy: 0.7673
Classification Report:
               precision    recall  f1-score   support

Non-Repeater       0.27      0.97      0.42       149
    Repeater       1.00      0.75      0.85      1583

    accuracy                           0.77      1732
   macro avg       0.63      0.86      0.64      1732
weighted avg       0.93      0.77      0.82      1732

Confusion Matrix:
 [[ 145    4]
 [ 399 1184]]


=== Summary ===
Total False Positives: 13
Total False Negatives: 2026
Total True Positives: 5890
Total True Negatives: 735

Confusion Matrix (with duplicates):
              Non-Repeater  Repeater
Non-Repeater         735.0      13.0
Repeater            2026.0    5890.0
accuracy_score
0.7646583564173592
Trial 1: hidden_dim=1254, latent_dim=32, beta=1.2748353328430946, gamma=0.1376891943643199, dropout_rate=0.12427306584107956, lr=0.00023116638665886992, scheduler_patience=7, class_weight=2.711369673946748, activation=ReLU, classification_multiplier=13615.053791392036

=== Fold 1/5 ===
Validation Accuracy: 0.7611
Classification Report:
               precision    recall  f1-score   support

Non-Repeater       0.26      0.99      0.42       149
    Repeater       1.00      0.74      0.85      1584

    accuracy                           0.76      1733
   macro avg       0.63      0.86      0.63      1733
weighted avg       0.94      0.76      0.81      1733

Confusion Matrix:
 [[ 147    2]
 [ 412 1172]]

=== Fold 2/5 ===
Validation Accuracy: 0.8003
Classification Report:
               precision    recall  f1-score   support

Non-Repeater       0.30      0.99      0.46       150
    Repeater       1.00      0.78      0.88      1583

    accuracy                           0.80      1733
   macro avg       0.65      0.88      0.67      1733
weighted avg       0.94      0.80      0.84      1733

Confusion Matrix:
 [[ 148    2]
 [ 344 1239]]

=== Fold 3/5 ===
Validation Accuracy: 0.6578
Classification Report:
               precision    recall  f1-score   support

Non-Repeater       0.20      0.99      0.33       150
    Repeater       1.00      0.63      0.77      1583

    accuracy                           0.66      1733
   macro avg       0.60      0.81      0.55      1733
weighted avg       0.93      0.66      0.73      1733

Confusion Matrix:
 [[149   1]
 [592 991]]

=== Fold 4/5 ===
Validation Accuracy: 0.7669
Classification Report:
               precision    recall  f1-score   support

Non-Repeater       0.27      0.99      0.42       150
    Repeater       1.00      0.75      0.85      1583

    accuracy                           0.77      1733
   macro avg       0.63      0.87      0.64      1733
weighted avg       0.94      0.77      0.82      1733

Confusion Matrix:
 [[ 148    2]
 [ 402 1181]]

=== Fold 5/5 ===
Validation Accuracy: 0.7760
Classification Report:
               precision    recall  f1-score   support

Non-Repeater       0.27      0.97      0.43       149
    Repeater       1.00      0.76      0.86      1583

    accuracy                           0.78      1732
   macro avg       0.63      0.86      0.64      1732
weighted avg       0.93      0.78      0.82      1732

Confusion Matrix:
 [[ 144    5]
 [ 383 1200]]


=== Summary ===
Total False Positives: 12
Total False Negatives: 2133
Total True Positives: 5783
Total True Negatives: 736

Confusion Matrix (with duplicates):
              Non-Repeater  Repeater
Non-Repeater         736.0      12.0
Repeater            2133.0    5783.0
accuracy_score
0.7524238227146814
Trial 1: hidden_dim=1234, latent_dim=32, beta=1.2776199014775778, gamma=0.1318893467874418, dropout_rate=0.12145904227273754, lr=0.0002603548485118001, scheduler_patience=7, class_weight=2.7491327356567274, activation=ReLU, classification_multiplier=13629.000023264349

=== Fold 1/5 ===
Validation Accuracy: 0.7086
Classification Report:
               precision    recall  f1-score   support

Non-Repeater       0.23      0.99      0.37       149
    Repeater       1.00      0.68      0.81      1584

    accuracy                           0.71      1733
   macro avg       0.61      0.84      0.59      1733
weighted avg       0.93      0.71      0.77      1733

Confusion Matrix:
 [[ 148    1]
 [ 504 1080]]

=== Fold 2/5 ===
Validation Accuracy: 0.7669
Classification Report:
               precision    recall  f1-score   support

Non-Repeater       0.27      0.99      0.42       150
    Repeater       1.00      0.75      0.85      1583

    accuracy                           0.77      1733
   macro avg       0.63      0.87      0.64      1733
weighted avg       0.94      0.77      0.82      1733

Confusion Matrix:
 [[ 149    1]
 [ 403 1180]]

=== Fold 3/5 ===
Validation Accuracy: 0.7571
Classification Report:
               precision    recall  f1-score   support

Non-Repeater       0.26      0.98      0.41       150
    Repeater       1.00      0.74      0.85      1583

    accuracy                           0.76      1733
   macro avg       0.63      0.86      0.63      1733
weighted avg       0.93      0.76      0.81      1733

Confusion Matrix:
 [[ 147    3]
 [ 418 1165]]

=== Fold 4/5 ===
Validation Accuracy: 0.6982
Classification Report:
               precision    recall  f1-score   support

Non-Repeater       0.22      0.99      0.36       150
    Repeater       1.00      0.67      0.80      1583

    accuracy                           0.70      1733
   macro avg       0.61      0.83      0.58      1733
weighted avg       0.93      0.70      0.76      1733

Confusion Matrix:
 [[ 148    2]
 [ 521 1062]]

=== Fold 5/5 ===
Validation Accuracy: 0.8753
Classification Report:
               precision    recall  f1-score   support

Non-Repeater       0.41      0.96      0.57       149
    Repeater       1.00      0.87      0.93      1583

    accuracy                           0.88      1732
   macro avg       0.70      0.91      0.75      1732
weighted avg       0.94      0.88      0.90      1732

Confusion Matrix:
 [[ 143    6]
 [ 210 1373]]


=== Summary ===
Total False Positives: 13
Total False Negatives: 2056
Total True Positives: 5860
Total True Negatives: 735

Confusion Matrix (with duplicates):
              Non-Repeater  Repeater
Non-Repeater         735.0      13.0
Repeater            2056.0    5860.0
accuracy_score
0.7611957525392429
Trial 1: hidden_dim=1271, latent_dim=32, beta=1.2822348756639907, gamma=0.18847213997010093, dropout_rate=0.11682122610481693, lr=0.00028570445030636534, scheduler_patience=7, class_weight=2.7209850185586912, activation=ReLU, classification_multiplier=13631.642947380378

=== Fold 1/5 ===
Validation Accuracy: 0.7098
Classification Report:
               precision    recall  f1-score   support

Non-Repeater       0.23      0.99      0.37       149
    Repeater       1.00      0.68      0.81      1584

    accuracy                           0.71      1733
   macro avg       0.61      0.84      0.59      1733
weighted avg       0.93      0.71      0.77      1733

Confusion Matrix:
 [[ 148    1]
 [ 502 1082]]

=== Fold 2/5 ===
Validation Accuracy: 0.7034
Classification Report:
 [I 2025-06-12 19:12:32,196] Trial 155 finished with value: 0.7511542012927055 and parameters: {'hidden_dim': 1266, 'latent_dim': 33, 'beta': 1.358427779588129, 'gamma': 0.18012750889137796, 'dropout_rate': 0.11817444345582745, 'lr': 0.00030001131236820534, 'scheduler_patience': 7, 'class_weight': 2.9348765103667276, 'activation': 'ReLU', 'classification_multiplier': 13738.803261522733}. Best is trial 142 with value: 0.7733148661126501.
[I 2025-06-12 19:18:51,973] Trial 156 finished with value: 0.528393351800554 and parameters: {'hidden_dim': 1345, 'latent_dim': 32, 'beta': 1.3651737522889602, 'gamma': 0.18392582318505282, 'dropout_rate': 0.11669606540146361, 'lr': 0.00010829680706272207, 'scheduler_patience': 7, 'class_weight': 2.950890836919471, 'activation': 'ELU', 'classification_multiplier': 13762.760759678968}. Best is trial 142 with value: 0.7733148661126501.
