[I 2025-06-13 07:10:02,666] Trial 266 finished with value: 0.7123730378578024 and parameters: {'hidden_dim': 1282, 'latent_dim': 35, 'beta': 1.4327190885641796, 'gamma': 0.28035720406070075, 'dropout_rate': 0.13928899919294022, 'lr': 0.00011568456426828063, 'scheduler_patience': 7, 'class_weight': 2.5453296933824934, 'activation': 'ReLU', 'classification_multiplier': 14294.642311972673}. Best is trial 194 with value: 0.8103647276084949.
              precision    recall  f1-score   support

Non-Repeater       0.09      1.00      0.16       150
    Repeater       1.00      0.00      0.00      1583

    accuracy                           0.09      1733
   macro avg       0.54      0.50      0.08      1733
weighted avg       0.92      0.09      0.02      1733

Confusion Matrix:
 [[ 150    0]
 [1581    2]]

=== Fold 4/5 ===
Validation Accuracy: 0.1252
Classification Report:
               precision    recall  f1-score   support

Non-Repeater       0.09      1.00      0.17       150
    Repeater       1.00      0.04      0.08      1583

    accuracy                           0.13      1733
   macro avg       0.55      0.52      0.12      1733
weighted avg       0.92      0.13      0.09      1733

Confusion Matrix:
 [[ 150    0]
 [1516   67]]

=== Fold 5/5 ===
Validation Accuracy: 0.1247
Classification Report:
               precision    recall  f1-score   support

Non-Repeater       0.09      1.00      0.16       149
    Repeater       1.00      0.04      0.08      1583

    accuracy                           0.12      1732
   macro avg       0.54      0.52      0.12      1732
weighted avg       0.92      0.12      0.09      1732

Confusion Matrix:
 [[ 149    0]
 [1516   67]]


=== Summary ===
Total False Positives: 0
Total False Negatives: 7750
Total True Positives: 166
Total True Negatives: 748

Confusion Matrix (with duplicates):
              Non-Repeater  Repeater
Non-Repeater         748.0       0.0
Repeater            7750.0     166.0
accuracy_score
0.10549399815327794
Trial 1: hidden_dim=1527, latent_dim=32, beta=1.3569426337906436, gamma=0.13393792141645944, dropout_rate=0.4474808787335618, lr=0.004232017850990821, scheduler_patience=7, class_weight=2.756380996800777, activation=ReLU, classification_multiplier=14715.15926597531

=== Fold 1/5 ===
Validation Accuracy: 0.7305
Classification Report:
               precision    recall  f1-score   support

Non-Repeater       0.24      0.99      0.39       149
    Repeater       1.00      0.71      0.83      1584

    accuracy                           0.73      1733
   macro avg       0.62      0.85      0.61      1733
weighted avg       0.93      0.73      0.79      1733

Confusion Matrix:
 [[ 148    1]
 [ 466 1118]]

=== Fold 2/5 ===
Validation Accuracy: 0.7663
Classification Report:
               precision    recall  f1-score   support

Non-Repeater       0.27      0.99      0.42       150
    Repeater       1.00      0.74      0.85      1583

    accuracy                           0.77      1733
   macro avg       0.63      0.87      0.64      1733
weighted avg       0.94      0.77      0.82      1733

Confusion Matrix:
 [[ 149    1]
 [ 404 1179]]

=== Fold 3/5 ===
Validation Accuracy: 0.7842
Classification Report:
               precision    recall  f1-score   support

Non-Repeater       0.28      0.99      0.44       150
    Repeater       1.00      0.77      0.87      1583

    accuracy                           0.78      1733
   macro avg       0.64      0.88      0.65      1733
weighted avg       0.94      0.78      0.83      1733

Confusion Matrix:
 [[ 148    2]
 [ 372 1211]]

=== Fold 4/5 ===
Validation Accuracy: 0.6959
Classification Report:
               precision    recall  f1-score   support

Non-Repeater       0.22      0.99      0.36       150
    Repeater       1.00      0.67      0.80      1583

    accuracy                           0.70      1733
   macro avg       0.61      0.83      0.58      1733
weighted avg       0.93      0.70      0.76      1733

Confusion Matrix:
 [[ 148    2]
 [ 525 1058]]

=== Fold 5/5 ===
Validation Accuracy: 0.8533
Classification Report:
               precision    recall  f1-score   support

Non-Repeater       0.37      0.97      0.53       149
    Repeater       1.00      0.84      0.91      1583

    accuracy                           0.85      1732
   macro avg       0.68      0.91      0.72      1732
weighted avg       0.94      0.85      0.88      1732

Confusion Matrix:
 [[ 145    4]
 [ 250 1333]]


=== Summary ===
Total False Positives: 10
Total False Negatives: 2017
Total True Positives: 5899
Total True Negatives: 738

Confusion Matrix (with duplicates):
              Non-Repeater  Repeater
Non-Repeater         738.0      10.0
Repeater            2017.0    5899.0
accuracy_score
0.7660433979686058
Trial 1: hidden_dim=1286, latent_dim=33, beta=1.4296784865173284, gamma=0.28828902262617057, dropout_rate=0.13917519790376562, lr=0.0002613636109691764, scheduler_patience=7, class_weight=2.659484267558293, activation=ReLU, classification_multiplier=14153.238380347299

=== Fold 1/5 ===
Validation Accuracy: 0.6936
Classification Report:
               precision    recall  f1-score   support

Non-Repeater       0.22      1.00      0.36       149
    Repeater       1.00      0.66      0.80      1584

    accuracy                           0.69      1733
   macro avg       0.61      0.83      0.58      1733
weighted avg       0.93      0.69      0.76      1733

Confusion Matrix:
 [[ 149    0]
 [ 531 1053]]

=== Fold 2/5 ===
Validation Accuracy: 0.7519
Classification Report:
               precision    recall  f1-score   support

Non-Repeater       0.26      0.99      0.41       150
    Repeater       1.00      0.73      0.84      1583

    accuracy                           0.75      1733
   macro avg       0.63      0.86      0.63      1733
weighted avg       0.93      0.75      0.81      1733

Confusion Matrix:
 [[ 149    1]
 [ 429 1154]]

=== Fold 3/5 ===
Validation Accuracy: 0.6671
Classification Report:
               precision    recall  f1-score   support

Non-Repeater       0.20      0.99      0.34       150
    Repeater       1.00      0.64      0.78      1583

    accuracy                           0.67      1733
   macro avg       0.60      0.81      0.56      1733
weighted avg       0.93      0.67      0.74      1733

Confusion Matrix:
 [[ 148    2]
 [ 575 1008]]

=== Fold 4/5 ===
Validation Accuracy: 0.6947
Classification Report:
               precision    recall  f1-score   support

Non-Repeater       0.22      0.98      0.36       150
    Repeater       1.00      0.67      0.80      1583

    accuracy                           0.69      1733
   macro avg       0.61      0.82      0.58      1733
weighted avg       0.93      0.69      0.76      1733

Confusion Matrix:
 [[ 147    3]
 [ 526 1057]]

=== Fold 5/5 ===
Validation Accuracy: 0.7546
Classification Report:
               precision    recall  f1-score   support

Non-Repeater       0.26      0.99      0.41       149
    Repeater       1.00      0.73      0.85      1583

    accuracy                           0.75      1732
   macro avg       0.63      0.86      0.63      1732
weighted avg       0.93      0.75      0.81      1732

Confusion Matrix:
 [[ 147    2]
 [ 423 1160]]


=== Summary ===
Total False Positives: 8
Total False Negatives: 2484
Total True Positives: 5432
Total True Negatives: 740

Confusion Matrix (with duplicates):
              Non-Repeater  Repeater
Non-Repeater         740.0       8.0
Repeater            2484.0    5432.0
accuracy_score
0.7123730378578024
Trial 1: hidden_dim=1282, latent_dim=35, beta=1.4327190885641796, gamma=0.28035720406070075, dropout_rate=0.13928899919294022, lr=0.00011568456426828063, scheduler_patience=7, class_weight=2.5453296933824934, activation=ReLU, classification_multiplier=14294.642311972673

=== Fold 1/5 ===
Validation Accuracy: 0.7501
Classification Report:
               precision    recall  f1-score   support

Non-Repeater       0.26      1.00      0.41       149
    Repeater       1.00      0.73      0.84      1584

    accuracy                           0.75      1733
   macro avg       0.63      0.86      0.62      1733
weighted avg       0.94      0.75      0.80      1733

Confusion Matrix:
 [[ 149    0]
 [ 433 1151]]

=== Fold 2/5 ===
Validation Accuracy: 0.7490
Classification Report:
 [I 2025-06-13 07:16:11,374] Trial 267 finished with value: 0.6864035087719298 and parameters: {'hidden_dim': 1215, 'latent_dim': 33, 'beta': 1.7247719864712732, 'gamma': 0.2500070812076757, 'dropout_rate': 0.1225726818516989, 'lr': 0.00028246344602607046, 'scheduler_patience': 7, 'class_weight': 2.6478142773601445, 'activation': 'LeakyReLU', 'classification_multiplier': 14136.03999338582}. Best is trial 194 with value: 0.8103647276084949.
[I 2025-06-13 07:22:30,218] Trial 268 finished with value: 0.6990997229916898 and parameters: {'hidden_dim': 1297, 'latent_dim': 34, 'beta': 1.4612030262110134, 'gamma': 0.303756209144336, 'dropout_rate': 0.15081881638548927, 'lr': 0.00046268912361330553, 'scheduler_patience': 7, 'class_weight': 2.7265272336233672, 'activation': 'ReLU', 'classification_multiplier': 14573.047470646055}. Best is trial 194 with value: 0.8103647276084949.
[I 2025-06-13 07:28:51,947] Trial 269 finished with value: 0.7205678670360111 and parameters: {'hidden_dim': 1356, 'latent_dim': 33, 'beta': 1.3976846856518788, 'gamma': 0.21238680263056978, 'dropout_rate': 0.1332904225999263, 'lr': 0.00010011608118777956, 'scheduler_patience': 7, 'class_weight': 2.6028626023487877, 'activation': 'ReLU', 'classification_multiplier': 14992.796699702318}. Best is trial 194 with value: 0.8103647276084949.
              precision    recall  f1-score   support

Non-Repeater       0.25      0.99      0.40       150
    Repeater       1.00      0.73      0.84      1583

    accuracy                           0.75      1733
   macro avg       0.63      0.86      0.62      1733
weighted avg       0.93      0.75      0.80      1733

Confusion Matrix:
 [[ 148    2]
 [ 433 1150]]

=== Fold 3/5 ===
Validation Accuracy: 0.4674
Classification Report:
               precision    recall  f1-score   support

Non-Repeater       0.14      1.00      0.25       150
    Repeater       1.00      0.42      0.59      1583

    accuracy                           0.47      1733
   macro avg       0.57      0.71      0.42      1733
weighted avg       0.93      0.47      0.56      1733

Confusion Matrix:
 [[150   0]
 [923 660]]

=== Fold 4/5 ===
Validation Accuracy: 0.7392
Classification Report:
               precision    recall  f1-score   support

Non-Repeater       0.25      0.97      0.39       150
    Repeater       1.00      0.72      0.83      1583

    accuracy                           0.74      1733
   macro avg       0.62      0.85      0.61      1733
weighted avg       0.93      0.74      0.80      1733

Confusion Matrix:
 [[ 146    4]
 [ 448 1135]]

=== Fold 5/5 ===
Validation Accuracy: 0.7263
Classification Report:
               precision    recall  f1-score   support

Non-Repeater       0.24      0.97      0.38       149
    Repeater       1.00      0.70      0.82      1583

    accuracy                           0.73      1732
   macro avg       0.62      0.84      0.60      1732
weighted avg       0.93      0.73      0.79      1732

Confusion Matrix:
 [[ 145    4]
 [ 470 1113]]


=== Summary ===
Total False Positives: 10
Total False Negatives: 2707
Total True Positives: 5209
Total True Negatives: 738

Confusion Matrix (with duplicates):
              Non-Repeater  Repeater
Non-Repeater         738.0      10.0
Repeater            2707.0    5209.0
accuracy_score
0.6864035087719298
Trial 1: hidden_dim=1215, latent_dim=33, beta=1.7247719864712732, gamma=0.2500070812076757, dropout_rate=0.1225726818516989, lr=0.00028246344602607046, scheduler_patience=7, class_weight=2.6478142773601445, activation=LeakyReLU, classification_multiplier=14136.03999338582

=== Fold 1/5 ===
Validation Accuracy: 0.6855
Classification Report:
               precision    recall  f1-score   support

Non-Repeater       0.21      0.99      0.35       149
    Repeater       1.00      0.66      0.79      1584

    accuracy                           0.69      1733
   macro avg       0.61      0.82      0.57      1733
weighted avg       0.93      0.69      0.75      1733

Confusion Matrix:
 [[ 148    1]
 [ 544 1040]]

=== Fold 2/5 ===
Validation Accuracy: 0.6896
Classification Report:
               precision    recall  f1-score   support

Non-Repeater       0.22      0.99      0.36       150
    Repeater       1.00      0.66      0.80      1583

    accuracy                           0.69      1733
   macro avg       0.61      0.83      0.58      1733
weighted avg       0.93      0.69      0.76      1733

Confusion Matrix:
 [[ 149    1]
 [ 537 1046]]

=== Fold 3/5 ===
Validation Accuracy: 0.7513
Classification Report:
               precision    recall  f1-score   support

Non-Repeater       0.26      0.99      0.41       150
    Repeater       1.00      0.73      0.84      1583

    accuracy                           0.75      1733
   macro avg       0.63      0.86      0.63      1733
weighted avg       0.93      0.75      0.80      1733

Confusion Matrix:
 [[ 149    1]
 [ 430 1153]]

=== Fold 4/5 ===
Validation Accuracy: 0.6722
Classification Report:
               precision    recall  f1-score   support

Non-Repeater       0.21      0.99      0.34       150
    Repeater       1.00      0.64      0.78      1583

    accuracy                           0.67      1733
   macro avg       0.60      0.81      0.56      1733
weighted avg       0.93      0.67      0.74      1733

Confusion Matrix:
 [[ 148    2]
 [ 566 1017]]

=== Fold 5/5 ===
Validation Accuracy: 0.6969
Classification Report:
               precision    recall  f1-score   support

Non-Repeater       0.22      0.98      0.36       149
    Repeater       1.00      0.67      0.80      1583

    accuracy                           0.70      1732
   macro avg       0.61      0.83      0.58      1732
weighted avg       0.93      0.70      0.76      1732

Confusion Matrix:
 [[ 146    3]
 [ 522 1061]]


=== Summary ===
Total False Positives: 8
Total False Negatives: 2599
Total True Positives: 5317
Total True Negatives: 740

Confusion Matrix (with duplicates):
              Non-Repeater  Repeater
Non-Repeater         740.0       8.0
Repeater            2599.0    5317.0
accuracy_score
0.6990997229916898
Trial 1: hidden_dim=1297, latent_dim=34, beta=1.4612030262110134, gamma=0.303756209144336, dropout_rate=0.15081881638548927, lr=0.00046268912361330553, scheduler_patience=7, class_weight=2.7265272336233672, activation=ReLU, classification_multiplier=14573.047470646055

=== Fold 1/5 ===
Validation Accuracy: 0.7542
Classification Report:
               precision    recall  f1-score   support

Non-Repeater       0.26      1.00      0.41       149
    Repeater       1.00      0.73      0.84      1584

    accuracy                           0.75      1733
   macro avg       0.63      0.87      0.63      1733
weighted avg       0.94      0.75      0.81      1733

Confusion Matrix:
 [[ 149    0]
 [ 426 1158]]

=== Fold 2/5 ===
Validation Accuracy: 0.6872
Classification Report:
               precision    recall  f1-score   support

Non-Repeater       0.22      0.99      0.35       150
    Repeater       1.00      0.66      0.79      1583

    accuracy                           0.69      1733
   macro avg       0.61      0.83      0.57      1733
weighted avg       0.93      0.69      0.76      1733

Confusion Matrix:
 [[ 149    1]
 [ 541 1042]]

=== Fold 3/5 ===
Validation Accuracy: 0.7138
Classification Report:
               precision    recall  f1-score   support

Non-Repeater       0.23      0.99      0.38       150
    Repeater       1.00      0.69      0.81      1583

    accuracy                           0.71      1733
   macro avg       0.62      0.84      0.59      1733
weighted avg       0.93      0.71      0.78      1733

Confusion Matrix:
 [[ 149    1]
 [ 495 1088]]

=== Fold 4/5 ===
Validation Accuracy: 0.6809
Classification Report:
               precision    recall  f1-score   support

Non-Repeater       0.21      0.99      0.35       150
    Repeater       1.00      0.65      0.79      1583

    accuracy                           0.68      1733
   macro avg       0.60      0.82      0.57      1733
weighted avg       0.93      0.68      0.75      1733

Confusion Matrix:
 [[ 148    2]
 [ 551 1032]]

=== Fold 5/5 ===
Validation Accuracy: 0.7667
Classification Report:
               precision    recall  f1-score   support

Non-Repeater       0.27      0.99      0.42       149
    Repeater       1.00      0.75      0.85      1583

    accuracy                           0.77      1732
   macro avg       0.63      0.87      0.64      1732
weighted avg       0.94      0.77      0.82      1732

Confusion Matrix:
 [[ 147    2]
 [ 402 1181]]


=== Summary ===
Total False Positives: 6
Total False Negatives: 2415
Total True Positives: 5501
Total True Negatives: 742

Confusion Matrix (with duplicates):
              Non-Repeater  Repeater
Non-Repeater         742.0       6.0
Repeater            2415.0    5501.0
accuracy_score
0.7205678670360111
Trial 1: hidden_dim=1356, latent_dim=33, beta=1.3976846856518788, gamma=0.21238680263056978, dropout_rate=0.1332904225999263, lr=0.00010011608118777956, scheduler_patience=7, class_weight=2.6028626023487877, activation=ReLU, classification_multiplier=14992.796699702318

=== Fold 1/5 ===
Validation Accuracy: 0.7051
Classification Report:
 [I 2025-06-13 07:35:04,390] Trial 270 finished with value: 0.7205678670360111 and parameters: {'hidden_dim': 1243, 'latent_dim': 32, 'beta': 1.5335440311598816, 'gamma': 0.1908542386215564, 'dropout_rate': 0.12319664969119809, 'lr': 0.0003665237143702748, 'scheduler_patience': 7, 'class_weight': 2.6736727741630975, 'activation': 'ReLU', 'classification_multiplier': 14768.062077627164}. Best is trial 194 with value: 0.8103647276084949.
