[I 2025-06-12 10:36:33,689] Trial 70 finished with value: 0.5687903970452447 and parameters: {'hidden_dim': 538, 'latent_dim': 16, 'beta': 0.10844147504785229, 'gamma': 0.6845351799106374, 'dropout_rate': 0.21091973248512685, 'lr': 0.000767570294896802, 'scheduler_patience': 5, 'class_weight': 1.8227685230796875, 'activation': 'ReLU', 'classification_multiplier': 7093.30366169291}. Best is trial 63 with value: 0.7299168975069252.
              precision    recall  f1-score   support

Non-Repeater       0.09      1.00      0.16       149
    Repeater       0.00      0.00      0.00      1584

    accuracy                           0.09      1733
   macro avg       0.04      0.50      0.08      1733
weighted avg       0.01      0.09      0.01      1733

Confusion Matrix:
 [[ 149    0]
 [1584    0]]

=== Fold 2/5 ===
Validation Accuracy: 0.0866
Classification Report:
               precision    recall  f1-score   support

Non-Repeater       0.09      1.00      0.16       150
    Repeater       0.00      0.00      0.00      1583

    accuracy                           0.09      1733
   macro avg       0.04      0.50      0.08      1733
weighted avg       0.01      0.09      0.01      1733

Confusion Matrix:
 [[ 150    0]
 [1583    0]]

=== Fold 3/5 ===
Validation Accuracy: 0.0866
Classification Report:
               precision    recall  f1-score   support

Non-Repeater       0.09      1.00      0.16       150
    Repeater       0.00      0.00      0.00      1583

    accuracy                           0.09      1733
   macro avg       0.04      0.50      0.08      1733
weighted avg       0.01      0.09      0.01      1733

Confusion Matrix:
 [[ 150    0]
 [1583    0]]

=== Fold 4/5 ===
Validation Accuracy: 0.0866
Classification Report:
               precision    recall  f1-score   support

Non-Repeater       0.09      1.00      0.16       150
    Repeater       0.00      0.00      0.00      1583

    accuracy                           0.09      1733
   macro avg       0.04      0.50      0.08      1733
weighted avg       0.01      0.09      0.01      1733

Confusion Matrix:
 [[ 150    0]
 [1583    0]]

=== Fold 5/5 ===
Validation Accuracy: 0.0860
Classification Report:
               precision    recall  f1-score   support

Non-Repeater       0.09      1.00      0.16       149
    Repeater       0.00      0.00      0.00      1583

    accuracy                           0.09      1732
   macro avg       0.04      0.50      0.08      1732
weighted avg       0.01      0.09      0.01      1732

Confusion Matrix:
 [[ 149    0]
 [1583    0]]


=== Summary ===
Total False Positives: 0
Total False Negatives: 7916
Total True Positives: 0
Total True Negatives: 748

Confusion Matrix (with duplicates):
              Non-Repeater  Repeater
Non-Repeater         748.0       0.0
Repeater            7916.0       0.0
accuracy_score
0.08633425669436749
Trial 1: hidden_dim=957, latent_dim=8, beta=1.1164369354964623, gamma=0.37003153399786015, dropout_rate=0.16670858871325075, lr=0.009205538892253442, scheduler_patience=7, class_weight=1.6453047491086017, activation=LeakyReLU, classification_multiplier=5636.825163471569

=== Fold 1/5 ===
Validation Accuracy: 0.5482
Classification Report:
               precision    recall  f1-score   support

Non-Repeater       0.16      1.00      0.28       149
    Repeater       1.00      0.51      0.67      1584

    accuracy                           0.55      1733
   macro avg       0.58      0.75      0.47      1733
weighted avg       0.93      0.55      0.64      1733

Confusion Matrix:
 [[149   0]
 [783 801]]

=== Fold 2/5 ===
Validation Accuracy: 0.5926
Classification Report:
               precision    recall  f1-score   support

Non-Repeater       0.17      0.99      0.30       150
    Repeater       1.00      0.55      0.71      1583

    accuracy                           0.59      1733
   macro avg       0.59      0.77      0.51      1733
weighted avg       0.93      0.59      0.68      1733

Confusion Matrix:
 [[149   1]
 [705 878]]

=== Fold 3/5 ===
Validation Accuracy: 0.6520
Classification Report:
               precision    recall  f1-score   support

Non-Repeater       0.20      0.99      0.33       150
    Repeater       1.00      0.62      0.76      1583

    accuracy                           0.65      1733
   macro avg       0.60      0.81      0.55      1733
weighted avg       0.93      0.65      0.73      1733

Confusion Matrix:
 [[149   1]
 [602 981]]

=== Fold 4/5 ===
Validation Accuracy: 0.4668
Classification Report:
               precision    recall  f1-score   support

Non-Repeater       0.14      0.99      0.24       150
    Repeater       1.00      0.42      0.59      1583

    accuracy                           0.47      1733
   macro avg       0.57      0.71      0.42      1733
weighted avg       0.92      0.47      0.56      1733

Confusion Matrix:
 [[149   1]
 [923 660]]

=== Fold 5/5 ===
Validation Accuracy: 0.5843
Classification Report:
               precision    recall  f1-score   support

Non-Repeater       0.17      0.99      0.29       149
    Repeater       1.00      0.55      0.71      1583

    accuracy                           0.58      1732
   macro avg       0.58      0.77      0.50      1732
weighted avg       0.93      0.58      0.67      1732

Confusion Matrix:
 [[148   1]
 [719 864]]


=== Summary ===
Total False Positives: 4
Total False Negatives: 3732
Total True Positives: 4184
Total True Negatives: 744

Confusion Matrix (with duplicates):
              Non-Repeater  Repeater
Non-Repeater         744.0       4.0
Repeater            3732.0    4184.0
accuracy_score
0.5687903970452447
Trial 1: hidden_dim=538, latent_dim=16, beta=0.10844147504785229, gamma=0.6845351799106374, dropout_rate=0.21091973248512685, lr=0.000767570294896802, scheduler_patience=5, class_weight=1.8227685230796875, activation=ReLU, classification_multiplier=7093.30366169291

=== Fold 1/5 ===
Validation Accuracy: 0.6220
Classification Report:
               precision    recall  f1-score   support

Non-Repeater       0.19      1.00      0.31       149
    Repeater       1.00      0.59      0.74      1584

    accuracy                           0.62      1733
   macro avg       0.59      0.79      0.53      1733
weighted avg       0.93      0.62      0.70      1733

Confusion Matrix:
 [[149   0]
 [655 929]]

=== Fold 2/5 ===
Validation Accuracy: 0.6947
Classification Report:
               precision    recall  f1-score   support

Non-Repeater       0.22      0.99      0.36       150
    Repeater       1.00      0.67      0.80      1583

    accuracy                           0.69      1733
   macro avg       0.61      0.83      0.58      1733
weighted avg       0.93      0.69      0.76      1733

Confusion Matrix:
 [[ 149    1]
 [ 528 1055]]

=== Fold 3/5 ===
Validation Accuracy: 0.6544
Classification Report:
               precision    recall  f1-score   support

Non-Repeater       0.20      0.99      0.33       150
    Repeater       1.00      0.62      0.77      1583

    accuracy                           0.65      1733
   macro avg       0.60      0.80      0.55      1733
weighted avg       0.93      0.65      0.73      1733

Confusion Matrix:
 [[148   2]
 [597 986]]

=== Fold 4/5 ===
Validation Accuracy: 0.6578
Classification Report:
               precision    recall  f1-score   support

Non-Repeater       0.20      0.99      0.33       150
    Repeater       1.00      0.63      0.77      1583

    accuracy                           0.66      1733
   macro avg       0.60      0.81      0.55      1733
weighted avg       0.93      0.66      0.73      1733

Confusion Matrix:
 [[149   1]
 [592 991]]

=== Fold 5/5 ===
Validation Accuracy: 0.7234
Classification Report:
               precision    recall  f1-score   support

Non-Repeater       0.23      0.98      0.38       149
    Repeater       1.00      0.70      0.82      1583

    accuracy                           0.72      1732
   macro avg       0.62      0.84      0.60      1732
weighted avg       0.93      0.72      0.78      1732

Confusion Matrix:
 [[ 146    3]
 [ 476 1107]]


=== Summary ===
Total False Positives: 7
Total False Negatives: 2848
Total True Positives: 5068
Total True Negatives: 741

Confusion Matrix (with duplicates):
              Non-Repeater  Repeater
Non-Repeater         741.0       7.0
Repeater            2848.0    5068.0
accuracy_score
0.6704755309325946
[I 2025-06-12 10:42:25,142] Trial 71 finished with value: 0.6704755309325946 and parameters: {'hidden_dim': 1037, 'latent_dim': 14, 'beta': 1.0335295843275987, 'gamma': 0.5215122221419481, 'dropout_rate': 0.14346135689135836, 'lr': 0.0004432471546902629, 'scheduler_patience': 6, 'class_weight': 1.4187942473705133, 'activation': 'ReLU', 'classification_multiplier': 6517.869610043849}. Best is trial 63 with value: 0.7299168975069252.
[I 2025-06-12 10:48:50,649] Trial 72 finished with value: 0.7479224376731302 and parameters: {'hidden_dim': 1385, 'latent_dim': 28, 'beta': 1.3236048975787098, 'gamma': 0.18291398306852447, 'dropout_rate': 0.1534769678280398, 'lr': 0.0007026778049272093, 'scheduler_patience': 6, 'class_weight': 2.7100273483582775, 'activation': 'ReLU', 'classification_multiplier': 14031.437763289825}. Best is trial 72 with value: 0.7479224376731302.
[I 2025-06-12 10:55:13,634] Trial 73 finished with value: 0.6831717451523546 and parameters: {'hidden_dim': 1388, 'latent_dim': 31, 'beta': 1.3146272303504567, 'gamma': 0.1939715847177422, 'dropout_rate': 0.15351108967444066, 'lr': 0.0008654755437057996, 'scheduler_patience': 6, 'class_weight': 1.3033219808831937, 'activation': 'ReLU', 'classification_multiplier': 6036.771493751267}. Best is trial 72 with value: 0.7479224376731302.
Trial 1: hidden_dim=1037, latent_dim=14, beta=1.0335295843275987, gamma=0.5215122221419481, dropout_rate=0.14346135689135836, lr=0.0004432471546902629, scheduler_patience=6, class_weight=1.4187942473705133, activation=ReLU, classification_multiplier=6517.869610043849

=== Fold 1/5 ===
Validation Accuracy: 0.7767
Classification Report:
               precision    recall  f1-score   support

Non-Repeater       0.27      0.96      0.42       149
    Repeater       1.00      0.76      0.86      1584

    accuracy                           0.78      1733
   macro avg       0.63      0.86      0.64      1733
weighted avg       0.93      0.78      0.82      1733

Confusion Matrix:
 [[ 143    6]
 [ 381 1203]]

=== Fold 2/5 ===
Validation Accuracy: 0.7640
Classification Report:
               precision    recall  f1-score   support

Non-Repeater       0.27      0.99      0.42       150
    Repeater       1.00      0.74      0.85      1583

    accuracy                           0.76      1733
   macro avg       0.63      0.87      0.64      1733
weighted avg       0.94      0.76      0.81      1733

Confusion Matrix:
 [[ 149    1]
 [ 408 1175]]

=== Fold 3/5 ===
Validation Accuracy: 0.6976
Classification Report:
               precision    recall  f1-score   support

Non-Repeater       0.22      0.99      0.36       150
    Repeater       1.00      0.67      0.80      1583

    accuracy                           0.70      1733
   macro avg       0.61      0.83      0.58      1733
weighted avg       0.93      0.70      0.76      1733

Confusion Matrix:
 [[ 149    1]
 [ 523 1060]]

=== Fold 4/5 ===
Validation Accuracy: 0.7426
Classification Report:
               precision    recall  f1-score   support

Non-Repeater       0.25      0.99      0.40       150
    Repeater       1.00      0.72      0.84      1583

    accuracy                           0.74      1733
   macro avg       0.62      0.85      0.62      1733
weighted avg       0.93      0.74      0.80      1733

Confusion Matrix:
 [[ 148    2]
 [ 444 1139]]

=== Fold 5/5 ===
Validation Accuracy: 0.7587
Classification Report:
               precision    recall  f1-score   support

Non-Repeater       0.26      0.97      0.41       149
    Repeater       1.00      0.74      0.85      1583

    accuracy                           0.76      1732
   macro avg       0.63      0.86      0.63      1732
weighted avg       0.93      0.76      0.81      1732

Confusion Matrix:
 [[ 145    4]
 [ 414 1169]]


=== Summary ===
Total False Positives: 14
Total False Negatives: 2170
Total True Positives: 5746
Total True Negatives: 734

Confusion Matrix (with duplicates):
              Non-Repeater  Repeater
Non-Repeater         734.0      14.0
Repeater            2170.0    5746.0
accuracy_score
0.7479224376731302
Trial 1: hidden_dim=1385, latent_dim=28, beta=1.3236048975787098, gamma=0.18291398306852447, dropout_rate=0.1534769678280398, lr=0.0007026778049272093, scheduler_patience=6, class_weight=2.7100273483582775, activation=ReLU, classification_multiplier=14031.437763289825

=== Fold 1/5 ===
Validation Accuracy: 0.6624
Classification Report:
               precision    recall  f1-score   support

Non-Repeater       0.20      0.99      0.33       149
    Repeater       1.00      0.63      0.77      1584

    accuracy                           0.66      1733
   macro avg       0.60      0.81      0.55      1733
weighted avg       0.93      0.66      0.74      1733

Confusion Matrix:
 [[ 147    2]
 [ 583 1001]]

=== Fold 2/5 ===
Validation Accuracy: 0.5949
Classification Report:
               precision    recall  f1-score   support

Non-Repeater       0.18      0.99      0.30       150
    Repeater       1.00      0.56      0.72      1583

    accuracy                           0.59      1733
   macro avg       0.59      0.78      0.51      1733
weighted avg       0.93      0.59      0.68      1733

Confusion Matrix:
 [[149   1]
 [701 882]]

=== Fold 3/5 ===
Validation Accuracy: 0.7265
Classification Report:
               precision    recall  f1-score   support

Non-Repeater       0.24      0.99      0.38       150
    Repeater       1.00      0.70      0.82      1583

    accuracy                           0.73      1733
   macro avg       0.62      0.84      0.60      1733
weighted avg       0.93      0.73      0.79      1733

Confusion Matrix:
 [[ 148    2]
 [ 472 1111]]

=== Fold 4/5 ===
Validation Accuracy: 0.6647
Classification Report:
               precision    recall  f1-score   support

Non-Repeater       0.20      0.99      0.34       150
    Repeater       1.00      0.63      0.78      1583

    accuracy                           0.66      1733
   macro avg       0.60      0.81      0.56      1733
weighted avg       0.93      0.66      0.74      1733

Confusion Matrix:
 [[ 149    1]
 [ 580 1003]]

=== Fold 5/5 ===
Validation Accuracy: 0.7673
Classification Report:
               precision    recall  f1-score   support

Non-Repeater       0.27      0.97      0.42       149
    Repeater       1.00      0.75      0.85      1583

    accuracy                           0.77      1732
   macro avg       0.63      0.86      0.64      1732
weighted avg       0.93      0.77      0.82      1732

Confusion Matrix:
 [[ 145    4]
 [ 399 1184]]


=== Summary ===
Total False Positives: 10
Total False Negatives: 2735
Total True Positives: 5181
Total True Negatives: 738

Confusion Matrix (with duplicates):
              Non-Repeater  Repeater
Non-Repeater         738.0      10.0
Repeater            2735.0    5181.0
accuracy_score
0.6831717451523546
Trial 1: hidden_dim=1388, latent_dim=31, beta=1.3146272303504567, gamma=0.1939715847177422, dropout_rate=0.15351108967444066, lr=0.0008654755437057996, scheduler_patience=6, class_weight=1.3033219808831937, activation=ReLU, classification_multiplier=6036.771493751267

=== Fold 1/5 ===
Validation Accuracy: 0.4183
Classification Report:
               precision    recall  f1-score   support

Non-Repeater       0.13      0.99      0.23       149
    Repeater       1.00      0.36      0.53      1584

    accuracy                           0.42      1733
   macro avg       0.56      0.68      0.38      1733
weighted avg       0.92      0.42      0.51      1733

Confusion Matrix:
 [[ 148    1]
 [1007  577]]

=== Fold 2/5 ===
Validation Accuracy: 0.6370
Classification Report:
               precision    recall  f1-score   support

Non-Repeater       0.19      0.99      0.32       150
    Repeater       1.00      0.60      0.75      1583

    accuracy                           0.64      1733
   macro avg       0.60      0.80      0.54      1733
weighted avg       0.93      0.64      0.71      1733

Confusion Matrix:
 [[149   1]
 [628 955]]

=== Fold 3/5 ===
Validation Accuracy: 0.5291
Classification Report:
               precision    recall  f1-score   support

Non-Repeater       0.16      1.00      0.27       150
    Repeater       1.00      0.48      0.65      1583

    accuracy                           0.53      1733
   macro avg       0.58      0.74      0.46      1733
weighted avg       0.93      0.53      0.62      1733

Confusion Matrix:
 [[150   0]
 [816 767]]

=== Fold 4/5 ===
Validation Accuracy: 0.6503
Classification Report:
               precision    recall  f1-score   support

Non-Repeater       0.20      0.99      0.33       150
    Repeater       1.00      0.62      0.76      1583

    accuracy                           0.65      1733
   macro avg       0.60      0.80      0.55      1733
weighted avg       0.93      0.65      0.73      1733

Confusion Matrix:
 [[148   2]
 [604 979]]

=== Fold 5/5 ===
Validation Accuracy: 0.7067
Classification Report:
               precision    recall  f1-score   support

Non-Repeater       0.22      0.98      0.36       149
    Repeater       1.00      0.68      0.81      1583

    accuracy                           0.71      1732
   macro avg       0.61      0.83      0.59      1732
weighted avg       0.93      0.71      0.77      1732

Confusion Matrix:
 [[ 146    3]
 [ 505 1078]]


=== Summary ===
Total False Positives: 7
Total False Negatives: 3560
Total True Positives: 4356
Total True Negatives: 741
[I 2025-06-12 11:01:38,609] Trial 74 finished with value: 0.5882963988919667 and parameters: {'hidden_dim': 1398, 'latent_dim': 31, 'beta': 1.3065088288601312, 'gamma': 0.189183562897245, 'dropout_rate': 0.15321807048419714, 'lr': 0.0014245914796825675, 'scheduler_patience': 6, 'class_weight': 2.3100108311016454, 'activation': 'ReLU', 'classification_multiplier': 6022.14779525775}. Best is trial 72 with value: 0.7479224376731302.
[I 2025-06-12 11:08:36,035] Trial 75 finished with value: 0.6365420129270545 and parameters: {'hidden_dim': 1683, 'latent_dim': 26, 'beta': 1.515870849740673, 'gamma': 0.21670346483537423, 'dropout_rate': 0.12391171993690953, 'lr': 0.000813615220621297, 'scheduler_patience': 6, 'class_weight': 1.1674887140326138, 'activation': 'ReLU', 'classification_multiplier': 5313.0822426253835}. Best is trial 72 with value: 0.7479224376731302.
