[I 2025-06-13 04:40:44,535] Trial 243 finished with value: 0.7584256694367497 and parameters: {'hidden_dim': 1337, 'latent_dim': 33, 'beta': 1.4600313827193612, 'gamma': 0.1386888831633522, 'dropout_rate': 0.10923314136438414, 'lr': 0.0005217283186923341, 'scheduler_patience': 7, 'class_weight': 2.696209947921484, 'activation': 'ReLU', 'classification_multiplier': 13209.817396972243}. Best is trial 194 with value: 0.8103647276084949.
              precision    recall  f1-score   support

Non-Repeater       0.26      0.99      0.41       150
    Repeater       1.00      0.73      0.85      1583

    accuracy                           0.76      1733
   macro avg       0.63      0.86      0.63      1733
weighted avg       0.94      0.76      0.81      1733

Confusion Matrix:
 [[ 149    1]
 [ 421 1162]]

=== Fold 4/5 ===
Validation Accuracy: 0.7219
Classification Report:
               precision    recall  f1-score   support

Non-Repeater       0.24      0.99      0.38       150
    Repeater       1.00      0.70      0.82      1583

    accuracy                           0.72      1733
   macro avg       0.62      0.84      0.60      1733
weighted avg       0.93      0.72      0.78      1733

Confusion Matrix:
 [[ 148    2]
 [ 480 1103]]

=== Fold 5/5 ===
Validation Accuracy: 0.7546
Classification Report:
               precision    recall  f1-score   support

Non-Repeater       0.26      0.98      0.41       149
    Repeater       1.00      0.73      0.85      1583

    accuracy                           0.75      1732
   macro avg       0.63      0.86      0.63      1732
weighted avg       0.93      0.75      0.81      1732

Confusion Matrix:
 [[ 146    3]
 [ 422 1161]]


=== Summary ===
Total False Positives: 8
Total False Negatives: 2093
Total True Positives: 5823
Total True Negatives: 740

Confusion Matrix (with duplicates):
              Non-Repeater  Repeater
Non-Repeater         740.0       8.0
Repeater            2093.0    5823.0
accuracy_score
0.7575023084025854
Trial 1: hidden_dim=1282, latent_dim=31, beta=1.3246063111616786, gamma=0.2076360600012237, dropout_rate=0.11857226735387437, lr=0.0003535539392104114, scheduler_patience=7, class_weight=2.73098502595578, activation=ReLU, classification_multiplier=14914.8900383533

=== Fold 1/5 ===
Validation Accuracy: 0.7813
Classification Report:
               precision    recall  f1-score   support

Non-Repeater       0.28      0.97      0.43       149
    Repeater       1.00      0.76      0.86      1584

    accuracy                           0.78      1733
   macro avg       0.64      0.87      0.65      1733
weighted avg       0.93      0.78      0.83      1733

Confusion Matrix:
 [[ 145    4]
 [ 375 1209]]

=== Fold 2/5 ===
Validation Accuracy: 0.6971
Classification Report:
               precision    recall  f1-score   support

Non-Repeater       0.22      0.99      0.36       150
    Repeater       1.00      0.67      0.80      1583

    accuracy                           0.70      1733
   macro avg       0.61      0.83      0.58      1733
weighted avg       0.93      0.70      0.76      1733

Confusion Matrix:
 [[ 149    1]
 [ 524 1059]]

=== Fold 3/5 ===
Validation Accuracy: 0.7559
Classification Report:
               precision    recall  f1-score   support

Non-Repeater       0.26      0.99      0.41       150
    Repeater       1.00      0.73      0.85      1583

    accuracy                           0.76      1733
   macro avg       0.63      0.86      0.63      1733
weighted avg       0.94      0.76      0.81      1733

Confusion Matrix:
 [[ 149    1]
 [ 422 1161]]

=== Fold 4/5 ===
Validation Accuracy: 0.6861
Classification Report:
               precision    recall  f1-score   support

Non-Repeater       0.21      0.98      0.35       150
    Repeater       1.00      0.66      0.79      1583

    accuracy                           0.69      1733
   macro avg       0.61      0.82      0.57      1733
weighted avg       0.93      0.69      0.75      1733

Confusion Matrix:
 [[ 147    3]
 [ 541 1042]]

=== Fold 5/5 ===
Validation Accuracy: 0.8158
Classification Report:
               precision    recall  f1-score   support

Non-Repeater       0.32      0.97      0.48       149
    Repeater       1.00      0.80      0.89      1583

    accuracy                           0.82      1732
   macro avg       0.66      0.89      0.68      1732
weighted avg       0.94      0.82      0.85      1732

Confusion Matrix:
 [[ 145    4]
 [ 315 1268]]


=== Summary ===
Total False Positives: 13
Total False Negatives: 2177
Total True Positives: 5739
Total True Negatives: 735

Confusion Matrix (with duplicates):
              Non-Repeater  Repeater
Non-Repeater         735.0      13.0
Repeater            2177.0    5739.0
accuracy_score
0.747229916897507
Trial 1: hidden_dim=1304, latent_dim=30, beta=1.3078608017940476, gamma=0.1792711262226838, dropout_rate=0.13282830678523436, lr=0.00033572796189117025, scheduler_patience=7, class_weight=2.774775387958492, activation=ReLU, classification_multiplier=14040.053412541449

=== Fold 1/5 ===
Validation Accuracy: 0.7934
Classification Report:
               precision    recall  f1-score   support

Non-Repeater       0.29      0.98      0.45       149
    Repeater       1.00      0.78      0.87      1584

    accuracy                           0.79      1733
   macro avg       0.64      0.88      0.66      1733
weighted avg       0.94      0.79      0.84      1733

Confusion Matrix:
 [[ 146    3]
 [ 355 1229]]

=== Fold 2/5 ===
Validation Accuracy: 0.7138
Classification Report:
               precision    recall  f1-score   support

Non-Repeater       0.23      0.99      0.38       150
    Repeater       1.00      0.69      0.81      1583

    accuracy                           0.71      1733
   macro avg       0.62      0.84      0.59      1733
weighted avg       0.93      0.71      0.78      1733

Confusion Matrix:
 [[ 149    1]
 [ 495 1088]]

=== Fold 3/5 ===
Validation Accuracy: 0.6330
Classification Report:
               precision    recall  f1-score   support

Non-Repeater       0.19      0.99      0.32       150
    Repeater       1.00      0.60      0.75      1583

    accuracy                           0.63      1733
   macro avg       0.59      0.80      0.53      1733
weighted avg       0.93      0.63      0.71      1733

Confusion Matrix:
 [[149   1]
 [635 948]]

=== Fold 4/5 ===
Validation Accuracy: 0.7726
Classification Report:
               precision    recall  f1-score   support

Non-Repeater       0.27      0.97      0.42       150
    Repeater       1.00      0.75      0.86      1583

    accuracy                           0.77      1733
   macro avg       0.63      0.86      0.64      1733
weighted avg       0.93      0.77      0.82      1733

Confusion Matrix:
 [[ 145    5]
 [ 389 1194]]

=== Fold 5/5 ===
Validation Accuracy: 0.8793
Classification Report:
               precision    recall  f1-score   support

Non-Repeater       0.41      0.97      0.58       149
    Repeater       1.00      0.87      0.93      1583

    accuracy                           0.88      1732
   macro avg       0.71      0.92      0.75      1732
weighted avg       0.95      0.88      0.90      1732

Confusion Matrix:
 [[ 144    5]
 [ 204 1379]]


=== Summary ===
Total False Positives: 15
Total False Negatives: 2078
Total True Positives: 5838
Total True Negatives: 733

Confusion Matrix (with duplicates):
              Non-Repeater  Repeater
Non-Repeater         733.0      15.0
Repeater            2078.0    5838.0
accuracy_score
0.7584256694367497
Trial 1: hidden_dim=1337, latent_dim=33, beta=1.4600313827193612, gamma=0.1386888831633522, dropout_rate=0.10923314136438414, lr=0.0005217283186923341, scheduler_patience=7, class_weight=2.696209947921484, activation=ReLU, classification_multiplier=13209.817396972243

=== Fold 1/5 ===
Validation Accuracy: 0.7409
Classification Report:
               precision    recall  f1-score   support

Non-Repeater       0.25      0.99      0.40       149
    Repeater       1.00      0.72      0.83      1584

    accuracy                           0.74      1733
   macro avg       0.62      0.86      0.62      1733
weighted avg       0.93      0.74      0.80      1733

Confusion Matrix:
 [[ 148    1]
 [ 448 1136]]

=== Fold 2/5 ===
Validation Accuracy: 0.7865
Classification Report:
 [I 2025-06-13 04:47:11,651] Trial 244 finished with value: 0.7523084025854109 and parameters: {'hidden_dim': 1408, 'latent_dim': 31, 'beta': 1.3866314017564987, 'gamma': 0.21084033755669507, 'dropout_rate': 0.10113028537698451, 'lr': 0.00030214969775021143, 'scheduler_patience': 7, 'class_weight': 2.8206176289365166, 'activation': 'ReLU', 'classification_multiplier': 13543.467925409406}. Best is trial 194 with value: 0.8103647276084949.
[I 2025-06-13 04:53:34,167] Trial 245 finished with value: 0.5 and parameters: {'hidden_dim': 1364, 'latent_dim': 33, 'beta': 1.3496456968615038, 'gamma': 0.13696507666292476, 'dropout_rate': 0.12881720031783495, 'lr': 0.00010289086592195563, 'scheduler_patience': 7, 'class_weight': 2.955877902114374, 'activation': 'ELU', 'classification_multiplier': 12932.840188535978}. Best is trial 194 with value: 0.8103647276084949.
[I 2025-06-13 04:59:50,650] Trial 246 finished with value: 0.7757386888273314 and parameters: {'hidden_dim': 1298, 'latent_dim': 32, 'beta': 1.4260757184169177, 'gamma': 0.25955198028941334, 'dropout_rate': 0.11977014058340471, 'lr': 0.0005543346788395836, 'scheduler_patience': 7, 'class_weight': 2.996484983520801, 'activation': 'ReLU', 'classification_multiplier': 14995.60693464473}. Best is trial 194 with value: 0.8103647276084949.
              precision    recall  f1-score   support

Non-Repeater       0.29      0.99      0.45       150
    Repeater       1.00      0.77      0.87      1583

    accuracy                           0.79      1733
   macro avg       0.64      0.88      0.66      1733
weighted avg       0.94      0.79      0.83      1733

Confusion Matrix:
 [[ 149    1]
 [ 369 1214]]

=== Fold 3/5 ===
Validation Accuracy: 0.6855
Classification Report:
               precision    recall  f1-score   support

Non-Repeater       0.22      0.99      0.35       150
    Repeater       1.00      0.66      0.79      1583

    accuracy                           0.69      1733
   macro avg       0.61      0.82      0.57      1733
weighted avg       0.93      0.69      0.75      1733

Confusion Matrix:
 [[ 149    1]
 [ 544 1039]]

=== Fold 4/5 ===
Validation Accuracy: 0.6803
Classification Report:
               precision    recall  f1-score   support

Non-Repeater       0.21      0.99      0.35       150
    Repeater       1.00      0.65      0.79      1583

    accuracy                           0.68      1733
   macro avg       0.61      0.82      0.57      1733
weighted avg       0.93      0.68      0.75      1733

Confusion Matrix:
 [[ 149    1]
 [ 553 1030]]

=== Fold 5/5 ===
Validation Accuracy: 0.8684
Classification Report:
               precision    recall  f1-score   support

Non-Repeater       0.39      0.97      0.56       149
    Repeater       1.00      0.86      0.92      1583

    accuracy                           0.87      1732
   macro avg       0.70      0.92      0.74      1732
weighted avg       0.95      0.87      0.89      1732

Confusion Matrix:
 [[ 145    4]
 [ 224 1359]]


=== Summary ===
Total False Positives: 8
Total False Negatives: 2138
Total True Positives: 5778
Total True Negatives: 740

Confusion Matrix (with duplicates):
              Non-Repeater  Repeater
Non-Repeater         740.0       8.0
Repeater            2138.0    5778.0
accuracy_score
0.7523084025854109
Trial 1: hidden_dim=1408, latent_dim=31, beta=1.3866314017564987, gamma=0.21084033755669507, dropout_rate=0.10113028537698451, lr=0.00030214969775021143, scheduler_patience=7, class_weight=2.8206176289365166, activation=ReLU, classification_multiplier=13543.467925409406

=== Fold 1/5 ===
Validation Accuracy: 0.5089
Classification Report:
               precision    recall  f1-score   support

Non-Repeater       0.15      1.00      0.26       149
    Repeater       1.00      0.46      0.63      1584

    accuracy                           0.51      1733
   macro avg       0.57      0.73      0.45      1733
weighted avg       0.93      0.51      0.60      1733

Confusion Matrix:
 [[149   0]
 [851 733]]

=== Fold 2/5 ===
Validation Accuracy: 0.4120
Classification Report:
               precision    recall  f1-score   support

Non-Repeater       0.13      1.00      0.23       150
    Repeater       1.00      0.36      0.53      1583

    accuracy                           0.41      1733
   macro avg       0.56      0.68      0.38      1733
weighted avg       0.92      0.41      0.50      1733

Confusion Matrix:
 [[ 150    0]
 [1019  564]]

=== Fold 3/5 ===
Validation Accuracy: 0.5470
Classification Report:
               precision    recall  f1-score   support

Non-Repeater       0.16      0.99      0.28       150
    Repeater       1.00      0.50      0.67      1583

    accuracy                           0.55      1733
   macro avg       0.58      0.75      0.47      1733
weighted avg       0.93      0.55      0.64      1733

Confusion Matrix:
 [[149   1]
 [784 799]]

=== Fold 4/5 ===
Validation Accuracy: 0.4108
Classification Report:
               precision    recall  f1-score   support

Non-Repeater       0.13      0.98      0.22       150
    Repeater       0.99      0.36      0.53      1583

    accuracy                           0.41      1733
   macro avg       0.56      0.67      0.37      1733
weighted avg       0.92      0.41      0.50      1733

Confusion Matrix:
 [[ 147    3]
 [1018  565]]

=== Fold 5/5 ===
Validation Accuracy: 0.6212
Classification Report:
               precision    recall  f1-score   support

Non-Repeater       0.18      0.99      0.31       149
    Repeater       1.00      0.59      0.74      1583

    accuracy                           0.62      1732
   macro avg       0.59      0.79      0.52      1732
weighted avg       0.93      0.62      0.70      1732

Confusion Matrix:
 [[147   2]
 [654 929]]


=== Summary ===
Total False Positives: 6
Total False Negatives: 4326
Total True Positives: 3590
Total True Negatives: 742

Confusion Matrix (with duplicates):
              Non-Repeater  Repeater
Non-Repeater         742.0       6.0
Repeater            4326.0    3590.0
accuracy_score
0.5
Trial 1: hidden_dim=1364, latent_dim=33, beta=1.3496456968615038, gamma=0.13696507666292476, dropout_rate=0.12881720031783495, lr=0.00010289086592195563, scheduler_patience=7, class_weight=2.955877902114374, activation=ELU, classification_multiplier=12932.840188535978

=== Fold 1/5 ===
Validation Accuracy: 0.7484
Classification Report:
               precision    recall  f1-score   support

Non-Repeater       0.25      0.99      0.40       149
    Repeater       1.00      0.73      0.84      1584

    accuracy                           0.75      1733
   macro avg       0.63      0.86      0.62      1733
weighted avg       0.94      0.75      0.80      1733

Confusion Matrix:
 [[ 148    1]
 [ 435 1149]]

=== Fold 2/5 ===
Validation Accuracy: 0.7773
Classification Report:
               precision    recall  f1-score   support

Non-Repeater       0.28      0.99      0.43       150
    Repeater       1.00      0.76      0.86      1583

    accuracy                           0.78      1733
   macro avg       0.64      0.87      0.65      1733
weighted avg       0.94      0.78      0.82      1733

Confusion Matrix:
 [[ 148    2]
 [ 384 1199]]

=== Fold 3/5 ===
Validation Accuracy: 0.7669
Classification Report:
               precision    recall  f1-score   support

Non-Repeater       0.27      0.99      0.42       150
    Repeater       1.00      0.75      0.85      1583

    accuracy                           0.77      1733
   macro avg       0.63      0.87      0.64      1733
weighted avg       0.94      0.77      0.82      1733

Confusion Matrix:
 [[ 148    2]
 [ 402 1181]]

=== Fold 4/5 ===
Validation Accuracy: 0.6924
Classification Report:
               precision    recall  f1-score   support

Non-Repeater       0.22      0.97      0.35       150
    Repeater       1.00      0.67      0.80      1583

    accuracy                           0.69      1733
   macro avg       0.61      0.82      0.58      1733
weighted avg       0.93      0.69      0.76      1733

Confusion Matrix:
 [[ 145    5]
 [ 528 1055]]

=== Fold 5/5 ===
Validation Accuracy: 0.8938
Classification Report:
               precision    recall  f1-score   support

Non-Repeater       0.45      0.98      0.61       149
    Repeater       1.00      0.89      0.94      1583

    accuracy                           0.89      1732
   macro avg       0.72      0.93      0.78      1732
weighted avg       0.95      0.89      0.91      1732

Confusion Matrix:
 [[ 146    3]
 [ 181 1402]]


=== Summary ===
Total False Positives: 13
Total False Negatives: 1930
Total True Positives: 5986
Total True Negatives: 735

Confusion Matrix (with duplicates):
              Non-Repeater  Repeater
Non-Repeater         735.0      13.0
Repeater            1930.0    5986.0
accuracy_score
0.7757386888273314
Trial 1: hidden_dim=1298, latent_dim=32, beta=1.4260757184169177, gamma=0.25955198028941334, dropout_rate=0.11977014058340471, lr=0.0005543346788395836, scheduler_patience=7, class_weight=2.996484983520801, activation=ReLU, classification_multiplier=14995.60693464473

=== Fold 1/5 ===
Validation Accuracy: 0.7040
Classification Report:
 [I 2025-06-13 05:06:10,336] Trial 247 finished with value: 0.760387811634349 and parameters: {'hidden_dim': 1319, 'latent_dim': 30, 'beta': 1.545585070519968, 'gamma': 0.24953270607316635, 'dropout_rate': 0.12050384474204184, 'lr': 0.000945187090348445, 'scheduler_patience': 7, 'class_weight': 2.9890290276638942, 'activation': 'ReLU', 'classification_multiplier': 14811.952982162402}. Best is trial 194 with value: 0.8103647276084949.
