[I 2025-06-13 14:35:38,915] Trial 335 finished with value: 0.7248384118190212 and parameters: {'hidden_dim': 1329, 'latent_dim': 30, 'beta': 1.308638237711919, 'gamma': 0.17691100196420895, 'dropout_rate': 0.12059852594573045, 'lr': 0.00061475549520335, 'scheduler_patience': 7, 'class_weight': 2.730264183338895, 'activation': 'GELU', 'classification_multiplier': 14807.45737347259}. Best is trial 194 with value: 0.8103647276084949.
              precision    recall  f1-score   support

Non-Repeater       0.26      0.99      0.41       150
    Repeater       1.00      0.73      0.84      1583

    accuracy                           0.75      1733
   macro avg       0.63      0.86      0.63      1733
weighted avg       0.93      0.75      0.80      1733

Confusion Matrix:
 [[ 149    1]
 [ 430 1153]]

=== Fold 3/5 ===
Validation Accuracy: 0.7115
Classification Report:
               precision    recall  f1-score   support

Non-Repeater       0.23      0.99      0.37       150
    Repeater       1.00      0.68      0.81      1583

    accuracy                           0.71      1733
   macro avg       0.61      0.84      0.59      1733
weighted avg       0.93      0.71      0.77      1733

Confusion Matrix:
 [[ 149    1]
 [ 499 1084]]

=== Fold 4/5 ===
Validation Accuracy: 0.6942
Classification Report:
               precision    recall  f1-score   support

Non-Repeater       0.22      0.98      0.36       150
    Repeater       1.00      0.67      0.80      1583

    accuracy                           0.69      1733
   macro avg       0.61      0.82      0.58      1733
weighted avg       0.93      0.69      0.76      1733

Confusion Matrix:
 [[ 147    3]
 [ 527 1056]]

=== Fold 5/5 ===
Validation Accuracy: 0.8285
Classification Report:
               precision    recall  f1-score   support

Non-Repeater       0.33      0.97      0.49       149
    Repeater       1.00      0.81      0.90      1583

    accuracy                           0.83      1732
   macro avg       0.66      0.89      0.70      1732
weighted avg       0.94      0.83      0.86      1732

Confusion Matrix:
 [[ 145    4]
 [ 293 1290]]


=== Summary ===
Total False Positives: 10
Total False Negatives: 2283
Total True Positives: 5633
Total True Negatives: 738

Confusion Matrix (with duplicates):
              Non-Repeater  Repeater
Non-Repeater         738.0      10.0
Repeater            2283.0    5633.0
accuracy_score
0.7353416435826408
Trial 1: hidden_dim=1392, latent_dim=32, beta=1.337540579467403, gamma=0.22664862788268453, dropout_rate=0.10804153161474422, lr=0.0008615301342674785, scheduler_patience=7, class_weight=2.997703354877465, activation=ReLU, classification_multiplier=14983.702986829128

=== Fold 1/5 ===
Validation Accuracy: 0.7877
Classification Report:
               precision    recall  f1-score   support

Non-Repeater       0.29      0.99      0.45       149
    Repeater       1.00      0.77      0.87      1584

    accuracy                           0.79      1733
   macro avg       0.64      0.88      0.66      1733
weighted avg       0.94      0.79      0.83      1733

Confusion Matrix:
 [[ 148    1]
 [ 367 1217]]

=== Fold 2/5 ===
Validation Accuracy: 0.6428
Classification Report:
               precision    recall  f1-score   support

Non-Repeater       0.19      0.99      0.32       150
    Repeater       1.00      0.61      0.76      1583

    accuracy                           0.64      1733
   macro avg       0.60      0.80      0.54      1733
weighted avg       0.93      0.64      0.72      1733

Confusion Matrix:
 [[149   1]
 [618 965]]

=== Fold 3/5 ===
Validation Accuracy: 0.6388
Classification Report:
               precision    recall  f1-score   support

Non-Repeater       0.19      0.99      0.32       150
    Repeater       1.00      0.61      0.75      1583

    accuracy                           0.64      1733
   macro avg       0.59      0.80      0.54      1733
weighted avg       0.93      0.64      0.72      1733

Confusion Matrix:
 [[148   2]
 [624 959]]

=== Fold 4/5 ===
Validation Accuracy: 0.7046
Classification Report:
               precision    recall  f1-score   support

Non-Repeater       0.22      0.98      0.36       150
    Repeater       1.00      0.68      0.81      1583

    accuracy                           0.70      1733
   macro avg       0.61      0.83      0.59      1733
weighted avg       0.93      0.70      0.77      1733

Confusion Matrix:
 [[ 147    3]
 [ 509 1074]]

=== Fold 5/5 ===
Validation Accuracy: 0.7592
Classification Report:
               precision    recall  f1-score   support

Non-Repeater       0.26      0.99      0.41       149
    Repeater       1.00      0.74      0.85      1583

    accuracy                           0.76      1732
   macro avg       0.63      0.86      0.63      1732
weighted avg       0.93      0.76      0.81      1732

Confusion Matrix:
 [[ 147    2]
 [ 415 1168]]


=== Summary ===
Total False Positives: 9
Total False Negatives: 2533
Total True Positives: 5383
Total True Negatives: 739

Confusion Matrix (with duplicates):
              Non-Repeater  Repeater
Non-Repeater         739.0       9.0
Repeater            2533.0    5383.0
accuracy_score
0.7066020313942751
Trial 1: hidden_dim=283, latent_dim=34, beta=1.3838564086454272, gamma=0.13479302128014178, dropout_rate=0.12999797155235993, lr=0.0003847734689576424, scheduler_patience=7, class_weight=2.8212809576388125, activation=ReLU, classification_multiplier=12727.01340443089

=== Fold 1/5 ===
Validation Accuracy: 0.8777
Classification Report:
               precision    recall  f1-score   support

Non-Repeater       0.41      0.97      0.58       149
    Repeater       1.00      0.87      0.93      1584

    accuracy                           0.88      1733
   macro avg       0.70      0.92      0.75      1733
weighted avg       0.95      0.88      0.90      1733

Confusion Matrix:
 [[ 144    5]
 [ 207 1377]]

=== Fold 2/5 ===
Validation Accuracy: 0.7392
Classification Report:
               precision    recall  f1-score   support

Non-Repeater       0.25      0.99      0.40       150
    Repeater       1.00      0.72      0.83      1583

    accuracy                           0.74      1733
   macro avg       0.62      0.85      0.62      1733
weighted avg       0.93      0.74      0.80      1733

Confusion Matrix:
 [[ 149    1]
 [ 451 1132]]

=== Fold 3/5 ===
Validation Accuracy: 0.6561
Classification Report:
               precision    recall  f1-score   support

Non-Repeater       0.20      0.99      0.33       150
    Repeater       1.00      0.62      0.77      1583

    accuracy                           0.66      1733
   macro avg       0.60      0.81      0.55      1733
weighted avg       0.93      0.66      0.73      1733

Confusion Matrix:
 [[149   1]
 [595 988]]

=== Fold 4/5 ===
Validation Accuracy: 0.6763
Classification Report:
               precision    recall  f1-score   support

Non-Repeater       0.21      0.99      0.35       150
    Repeater       1.00      0.65      0.78      1583

    accuracy                           0.68      1733
   macro avg       0.60      0.82      0.57      1733
weighted avg       0.93      0.68      0.75      1733

Confusion Matrix:
 [[ 148    2]
 [ 559 1024]]

=== Fold 5/5 ===
Validation Accuracy: 0.6749
Classification Report:
               precision    recall  f1-score   support

Non-Repeater       0.21      0.99      0.34       149
    Repeater       1.00      0.65      0.78      1583

    accuracy                           0.67      1732
   macro avg       0.60      0.82      0.56      1732
weighted avg       0.93      0.67      0.75      1732

Confusion Matrix:
 [[ 147    2]
 [ 561 1022]]


=== Summary ===
Total False Positives: 11
Total False Negatives: 2373
Total True Positives: 5543
Total True Negatives: 737

Confusion Matrix (with duplicates):
              Non-Repeater  Repeater
Non-Repeater         737.0      11.0
Repeater            2373.0    5543.0
accuracy_score
0.7248384118190212
Trial 1: hidden_dim=1329, latent_dim=30, beta=1.308638237711919, gamma=0.17691100196420895, dropout_rate=0.12059852594573045, lr=0.00061475549520335, scheduler_patience=7, class_weight=2.730264183338895, activation=GELU, classification_multiplier=14807.45737347259

=== Fold 1/5 ===
Validation Accuracy: 0.6388
Classification Report:
 [I 2025-06-13 14:41:08,277] Trial 336 finished with value: 0.43317174515235457 and parameters: {'hidden_dim': 142, 'latent_dim': 33, 'beta': 1.4123166981403088, 'gamma': 0.20957889426506832, 'dropout_rate': 0.11257820962173673, 'lr': 0.0002320564255985523, 'scheduler_patience': 7, 'class_weight': 2.6158134024391217, 'activation': 'ReLU', 'classification_multiplier': 14600.372512671327}. Best is trial 194 with value: 0.8103647276084949.
[I 2025-06-13 14:47:11,658] Trial 337 finished with value: 0.7463065558633426 and parameters: {'hidden_dim': 1150, 'latent_dim': 31, 'beta': 1.3507182131706694, 'gamma': 0.14209174662863416, 'dropout_rate': 0.1006594651369982, 'lr': 0.0004454529947819533, 'scheduler_patience': 7, 'class_weight': 2.9255446138491203, 'activation': 'ReLU', 'classification_multiplier': 14439.716222318071}. Best is trial 194 with value: 0.8103647276084949.
              precision    recall  f1-score   support

Non-Repeater       0.19      1.00      0.32       149
    Repeater       1.00      0.60      0.75      1584

    accuracy                           0.64      1733
   macro avg       0.60      0.80      0.54      1733
weighted avg       0.93      0.64      0.72      1733

Confusion Matrix:
 [[149   0]
 [626 958]]

=== Fold 2/5 ===
Validation Accuracy: 0.0877
Classification Report:
               precision    recall  f1-score   support

Non-Repeater       0.09      1.00      0.16       150
    Repeater       1.00      0.00      0.00      1583

    accuracy                           0.09      1733
   macro avg       0.54      0.50      0.08      1733
weighted avg       0.92      0.09      0.02      1733

Confusion Matrix:
 [[ 150    0]
 [1581    2]]

=== Fold 3/5 ===
Validation Accuracy: 0.6301
Classification Report:
               precision    recall  f1-score   support

Non-Repeater       0.19      0.99      0.32       150
    Repeater       1.00      0.60      0.75      1583

    accuracy                           0.63      1733
   macro avg       0.59      0.79      0.53      1733
weighted avg       0.93      0.63      0.71      1733

Confusion Matrix:
 [[149   1]
 [640 943]]

=== Fold 4/5 ===
Validation Accuracy: 0.0900
Classification Report:
               precision    recall  f1-score   support

Non-Repeater       0.09      1.00      0.16       150
    Repeater       1.00      0.00      0.01      1583

    accuracy                           0.09      1733
   macro avg       0.54      0.50      0.08      1733
weighted avg       0.92      0.09      0.02      1733

Confusion Matrix:
 [[ 150    0]
 [1577    6]]

=== Fold 5/5 ===
Validation Accuracy: 0.7194
Classification Report:
               precision    recall  f1-score   support

Non-Repeater       0.23      0.99      0.38       149
    Repeater       1.00      0.69      0.82      1583

    accuracy                           0.72      1732
   macro avg       0.62      0.84      0.60      1732
weighted avg       0.93      0.72      0.78      1732

Confusion Matrix:
 [[ 147    2]
 [ 484 1099]]


=== Summary ===
Total False Positives: 3
Total False Negatives: 4908
Total True Positives: 3008
Total True Negatives: 745

Confusion Matrix (with duplicates):
              Non-Repeater  Repeater
Non-Repeater         745.0       3.0
Repeater            4908.0    3008.0
accuracy_score
0.43317174515235457
Trial 1: hidden_dim=142, latent_dim=33, beta=1.4123166981403088, gamma=0.20957889426506832, dropout_rate=0.11257820962173673, lr=0.0002320564255985523, scheduler_patience=7, class_weight=2.6158134024391217, activation=ReLU, classification_multiplier=14600.372512671327

=== Fold 1/5 ===
Validation Accuracy: 0.7525
Classification Report:
               precision    recall  f1-score   support

Non-Repeater       0.26      0.99      0.41       149
    Repeater       1.00      0.73      0.84      1584

    accuracy                           0.75      1733
   macro avg       0.63      0.86      0.63      1733
weighted avg       0.93      0.75      0.81      1733

Confusion Matrix:
 [[ 147    2]
 [ 427 1157]]

=== Fold 2/5 ===
Validation Accuracy: 0.7276
Classification Report:
               precision    recall  f1-score   support

Non-Repeater       0.24      0.99      0.39       150
    Repeater       1.00      0.70      0.83      1583

    accuracy                           0.73      1733
   macro avg       0.62      0.84      0.61      1733
weighted avg       0.93      0.73      0.79      1733

Confusion Matrix:
 [[ 148    2]
 [ 470 1113]]

=== Fold 3/5 ===
Validation Accuracy: 0.7894
Classification Report:
               precision    recall  f1-score   support

Non-Repeater       0.29      0.99      0.45       150
    Repeater       1.00      0.77      0.87      1583

    accuracy                           0.79      1733
   macro avg       0.64      0.88      0.66      1733
weighted avg       0.94      0.79      0.83      1733

Confusion Matrix:
 [[ 149    1]
 [ 364 1219]]

=== Fold 4/5 ===
Validation Accuracy: 0.7138
Classification Report:
               precision    recall  f1-score   support

Non-Repeater       0.23      0.98      0.37       150
    Repeater       1.00      0.69      0.81      1583

    accuracy                           0.71      1733
   macro avg       0.61      0.83      0.59      1733
weighted avg       0.93      0.71      0.78      1733

Confusion Matrix:
 [[ 147    3]
 [ 493 1090]]

=== Fold 5/5 ===
Validation Accuracy: 0.7483
Classification Report:
               precision    recall  f1-score   support

Non-Repeater       0.25      0.98      0.40       149
    Repeater       1.00      0.73      0.84      1583

    accuracy                           0.75      1732
   macro avg       0.62      0.85      0.62      1732
weighted avg       0.93      0.75      0.80      1732

Confusion Matrix:
 [[ 146    3]
 [ 433 1150]]


=== Summary ===
Total False Positives: 11
Total False Negatives: 2187
Total True Positives: 5729
Total True Negatives: 737

Confusion Matrix (with duplicates):
              Non-Repeater  Repeater
Non-Repeater         737.0      11.0
Repeater            2187.0    5729.0
accuracy_score
0.7463065558633426
Trial 1: hidden_dim=1150, latent_dim=31, beta=1.3507182131706694, gamma=0.14209174662863416, dropout_rate=0.1006594651369982, lr=0.0004454529947819533, scheduler_patience=7, class_weight=2.9255446138491203, activation=ReLU, classification_multiplier=14439.716222318071

=== Fold 1/5 ===
Validation Accuracy: 0.6584
Classification Report:
               precision    recall  f1-score   support

Non-Repeater       0.20      0.99      0.33       149
    Repeater       1.00      0.63      0.77      1584

    accuracy                           0.66      1733
   macro avg       0.60      0.81      0.55      1733
weighted avg       0.93      0.66      0.73      1733

Confusion Matrix:
 [[148   1]
 [591 993]]

=== Fold 2/5 ===
Validation Accuracy: 0.5620
Classification Report:
               precision    recall  f1-score   support

Non-Repeater       0.16      0.99      0.28       150
    Repeater       1.00      0.52      0.68      1583

    accuracy                           0.56      1733
   macro avg       0.58      0.76      0.48      1733
weighted avg       0.93      0.56      0.65      1733

Confusion Matrix:
 [[149   1]
 [758 825]]

=== Fold 3/5 ===
Validation Accuracy: 0.6307
Classification Report:
               precision    recall  f1-score   support

Non-Repeater       0.19      0.99      0.32       150
    Repeater       1.00      0.60      0.75      1583

    accuracy                           0.63      1733
   macro avg       0.59      0.79      0.53      1733
weighted avg       0.93      0.63      0.71      1733

Confusion Matrix:
 [[149   1]
 [639 944]]

=== Fold 4/5 ===
Validation Accuracy: 0.4720
Classification Report:
               precision    recall  f1-score   support

Non-Repeater       0.14      1.00      0.25       150
    Repeater       1.00      0.42      0.59      1583

    accuracy                           0.47      1733
   macro avg       0.57      0.71      0.42      1733
weighted avg       0.93      0.47      0.56      1733

Confusion Matrix:
 [[150   0]
 [915 668]]

=== Fold 5/5 ===
Validation Accuracy: 0.7731
Classification Report:
               precision    recall  f1-score   support

Non-Repeater       0.27      0.97      0.42       149
    Repeater       1.00      0.75      0.86      1583

    accuracy                           0.77      1732
   macro avg       0.63      0.86      0.64      1732
weighted avg       0.93      0.77      0.82      1732

Confusion Matrix:
 [[ 145    4]
 [ 389 1194]]


=== Summary ===
Total False Positives: 7
Total False Negatives: 3292
Total True Positives: 4624
Total True Negatives: 741

Confusion Matrix (with duplicates):
              Non-Repeater  Repeater
Non-Repeater         741.0       7.0
Repeater            3292.0    4624.0
accuracy_score
0.6192289935364728
[I 2025-06-13 14:53:43,997] Trial 338 finished with value: 0.6192289935364728 and parameters: {'hidden_dim': 1441, 'latent_dim': 29, 'beta': 1.1944513357116073, 'gamma': 0.10038074771347033, 'dropout_rate': 0.4672546717028362, 'lr': 0.0009285171660950651, 'scheduler_patience': 7, 'class_weight': 2.772114085290908, 'activation': 'ReLU', 'classification_multiplier': 13265.34740090227}. Best is trial 194 with value: 0.8103647276084949.
[I 2025-06-13 15:00:01,145] Trial 339 finished with value: 0.42393813481071096 and parameters: {'hidden_dim': 1306, 'latent_dim': 32, 'beta': 1.3992006420855256, 'gamma': 0.16667273601504612, 'dropout_rate': 0.1303716792660509, 'lr': 0.002717689778955429, 'scheduler_patience': 7, 'class_weight': 2.8482724217709072, 'activation': 'ReLU', 'classification_multiplier': 14809.927535213277}. Best is trial 194 with value: 0.8103647276084949.
