[I 2025-06-13 04:02:34,996] Trial 237 finished with value: 0.7429593721144968 and parameters: {'hidden_dim': 1394, 'latent_dim': 30, 'beta': 1.4519692251962293, 'gamma': 0.18392905643958427, 'dropout_rate': 0.14072000663563128, 'lr': 0.00010047169140855468, 'scheduler_patience': 7, 'class_weight': 2.9113273837491107, 'activation': 'ReLU', 'classification_multiplier': 14583.187733091207}. Best is trial 194 with value: 0.8103647276084949.
              precision    recall  f1-score   support

Non-Repeater       0.46      0.95      0.62       149
    Repeater       1.00      0.90      0.94      1583

    accuracy                           0.90      1732
   macro avg       0.73      0.92      0.78      1732
weighted avg       0.95      0.90      0.91      1732

Confusion Matrix:
 [[ 142    7]
 [ 166 1417]]


=== Summary ===
Total False Positives: 15
Total False Negatives: 2209
Total True Positives: 5707
Total True Negatives: 733

Confusion Matrix (with duplicates):
              Non-Repeater  Repeater
Non-Repeater         733.0      15.0
Repeater            2209.0    5707.0
accuracy_score
0.7433056325023084
Trial 1: hidden_dim=1363, latent_dim=29, beta=1.4261811849002919, gamma=0.23072957186785947, dropout_rate=0.1557739601459986, lr=0.0006948835852248449, scheduler_patience=7, class_weight=2.836752765789322, activation=ReLU, classification_multiplier=14708.949811535284

=== Fold 1/5 ===
Validation Accuracy: 0.7363
Classification Report:
               precision    recall  f1-score   support

Non-Repeater       0.25      1.00      0.39       149
    Repeater       1.00      0.71      0.83      1584

    accuracy                           0.74      1733
   macro avg       0.62      0.86      0.61      1733
weighted avg       0.94      0.74      0.79      1733

Confusion Matrix:
 [[ 149    0]
 [ 457 1127]]

=== Fold 2/5 ===
Validation Accuracy: 0.7444
Classification Report:
               precision    recall  f1-score   support

Non-Repeater       0.25      0.99      0.40       150
    Repeater       1.00      0.72      0.84      1583

    accuracy                           0.74      1733
   macro avg       0.62      0.85      0.62      1733
weighted avg       0.93      0.74      0.80      1733

Confusion Matrix:
 [[ 148    2]
 [ 441 1142]]

=== Fold 3/5 ===
Validation Accuracy: 0.7155
Classification Report:
               precision    recall  f1-score   support

Non-Repeater       0.23      0.99      0.38       150
    Repeater       1.00      0.69      0.82      1583

    accuracy                           0.72      1733
   macro avg       0.62      0.84      0.60      1733
weighted avg       0.93      0.72      0.78      1733

Confusion Matrix:
 [[ 149    1]
 [ 492 1091]]

=== Fold 4/5 ===
Validation Accuracy: 0.6711
Classification Report:
               precision    recall  f1-score   support

Non-Repeater       0.21      0.99      0.34       150
    Repeater       1.00      0.64      0.78      1583

    accuracy                           0.67      1733
   macro avg       0.60      0.81      0.56      1733
weighted avg       0.93      0.67      0.74      1733

Confusion Matrix:
 [[ 148    2]
 [ 568 1015]]

=== Fold 5/5 ===
Validation Accuracy: 0.7379
Classification Report:
               precision    recall  f1-score   support

Non-Repeater       0.24      0.97      0.39       149
    Repeater       1.00      0.72      0.83      1583

    accuracy                           0.74      1732
   macro avg       0.62      0.84      0.61      1732
weighted avg       0.93      0.74      0.79      1732

Confusion Matrix:
 [[ 145    4]
 [ 450 1133]]


=== Summary ===
Total False Positives: 9
Total False Negatives: 2408
Total True Positives: 5508
Total True Negatives: 739

Confusion Matrix (with duplicates):
              Non-Repeater  Repeater
Non-Repeater         739.0       9.0
Repeater            2408.0    5508.0
accuracy_score
0.7210295475530932
Trial 1: hidden_dim=1330, latent_dim=30, beta=1.394987572275356, gamma=0.23226166423464858, dropout_rate=0.1460845553831097, lr=0.0005083849746105228, scheduler_patience=7, class_weight=2.858828996384896, activation=LeakyReLU, classification_multiplier=14387.42937110039

=== Fold 1/5 ===
Validation Accuracy: 0.7594
Classification Report:
               precision    recall  f1-score   support

Non-Repeater       0.26      0.99      0.42       149
    Repeater       1.00      0.74      0.85      1584

    accuracy                           0.76      1733
   macro avg       0.63      0.87      0.63      1733
weighted avg       0.94      0.76      0.81      1733

Confusion Matrix:
 [[ 148    1]
 [ 416 1168]]

=== Fold 2/5 ===
Validation Accuracy: 0.7426
Classification Report:
               precision    recall  f1-score   support

Non-Repeater       0.25      0.99      0.40       150
    Repeater       1.00      0.72      0.84      1583

    accuracy                           0.74      1733
   macro avg       0.62      0.86      0.62      1733
weighted avg       0.93      0.74      0.80      1733

Confusion Matrix:
 [[ 149    1]
 [ 445 1138]]

=== Fold 3/5 ===
Validation Accuracy: 0.7253
Classification Report:
               precision    recall  f1-score   support

Non-Repeater       0.24      0.99      0.38       150
    Repeater       1.00      0.70      0.82      1583

    accuracy                           0.73      1733
   macro avg       0.62      0.84      0.60      1733
weighted avg       0.93      0.73      0.79      1733

Confusion Matrix:
 [[ 148    2]
 [ 474 1109]]

=== Fold 4/5 ===
Validation Accuracy: 0.7334
Classification Report:
               precision    recall  f1-score   support

Non-Repeater       0.24      0.99      0.39       150
    Repeater       1.00      0.71      0.83      1583

    accuracy                           0.73      1733
   macro avg       0.62      0.85      0.61      1733
weighted avg       0.93      0.73      0.79      1733

Confusion Matrix:
 [[ 148    2]
 [ 460 1123]]

=== Fold 5/5 ===
Validation Accuracy: 0.7540
Classification Report:
               precision    recall  f1-score   support

Non-Repeater       0.26      0.98      0.41       149
    Repeater       1.00      0.73      0.84      1583

    accuracy                           0.75      1732
   macro avg       0.63      0.86      0.63      1732
weighted avg       0.93      0.75      0.81      1732

Confusion Matrix:
 [[ 146    3]
 [ 423 1160]]


=== Summary ===
Total False Positives: 9
Total False Negatives: 2218
Total True Positives: 5698
Total True Negatives: 739

Confusion Matrix (with duplicates):
              Non-Repeater  Repeater
Non-Repeater         739.0       9.0
Repeater            2218.0    5698.0
accuracy_score
0.7429593721144968
Trial 1: hidden_dim=1394, latent_dim=30, beta=1.4519692251962293, gamma=0.18392905643958427, dropout_rate=0.14072000663563128, lr=0.00010047169140855468, scheduler_patience=7, class_weight=2.9113273837491107, activation=ReLU, classification_multiplier=14583.187733091207

=== Fold 1/5 ===
Validation Accuracy: 0.6965
Classification Report:
               precision    recall  f1-score   support

Non-Repeater       0.22      0.99      0.36       149
    Repeater       1.00      0.67      0.80      1584

    accuracy                           0.70      1733
   macro avg       0.61      0.83      0.58      1733
weighted avg       0.93      0.70      0.76      1733

Confusion Matrix:
 [[ 148    1]
 [ 525 1059]]

=== Fold 2/5 ===
Validation Accuracy: 0.7328
Classification Report:
               precision    recall  f1-score   support

Non-Repeater       0.24      0.99      0.39       150
    Repeater       1.00      0.71      0.83      1583

    accuracy                           0.73      1733
   macro avg       0.62      0.85      0.61      1733
weighted avg       0.93      0.73      0.79      1733

Confusion Matrix:
 [[ 149    1]
 [ 462 1121]]

=== Fold 3/5 ===
Validation Accuracy: 0.7138
Classification Report:
               precision    recall  f1-score   support

Non-Repeater       0.23      0.99      0.37       150
    Repeater       1.00      0.69      0.81      1583

    accuracy                           0.71      1733
   macro avg       0.61      0.84      0.59      1733
weighted avg       0.93      0.71      0.78      1733

Confusion Matrix:
 [[ 148    2]
 [ 494 1089]]

=== Fold 4/5 ===
Validation Accuracy: 0.6082
Classification Report:
 [I 2025-06-13 04:08:55,345] Trial 238 finished with value: 0.7042936288088643 and parameters: {'hidden_dim': 1332, 'latent_dim': 31, 'beta': 1.4033923753985964, 'gamma': 0.2800360192010447, 'dropout_rate': 0.1348004723614234, 'lr': 0.0008027355642787616, 'scheduler_patience': 7, 'class_weight': 2.79986900518021, 'activation': 'ReLU', 'classification_multiplier': 14730.614638473677}. Best is trial 194 with value: 0.8103647276084949.
[I 2025-06-13 04:15:21,620] Trial 239 finished with value: 0.733264081255771 and parameters: {'hidden_dim': 1369, 'latent_dim': 28, 'beta': 1.34502235946727, 'gamma': 0.13982282253859063, 'dropout_rate': 0.1523229488226375, 'lr': 0.00044074150639850194, 'scheduler_patience': 7, 'class_weight': 2.8619026904667892, 'activation': 'ReLU', 'classification_multiplier': 14289.621664617745}. Best is trial 194 with value: 0.8103647276084949.
[I 2025-06-13 04:21:50,145] Trial 240 finished with value: 0.7256463527239151 and parameters: {'hidden_dim': 1414, 'latent_dim': 29, 'beta': 1.3944899606261845, 'gamma': 0.1730371025834808, 'dropout_rate': 0.1434016563954041, 'lr': 0.0006796222253442989, 'scheduler_patience': 7, 'class_weight': 2.9015380614528294, 'activation': 'ReLU', 'classification_multiplier': 14570.074999904577}. Best is trial 194 with value: 0.8103647276084949.
              precision    recall  f1-score   support

Non-Repeater       0.18      0.99      0.31       150
    Repeater       1.00      0.57      0.73      1583

    accuracy                           0.61      1733
   macro avg       0.59      0.78      0.52      1733
weighted avg       0.93      0.61      0.69      1733

Confusion Matrix:
 [[149   1]
 [678 905]]

=== Fold 5/5 ===
Validation Accuracy: 0.7702
Classification Report:
               precision    recall  f1-score   support

Non-Repeater       0.27      0.97      0.42       149
    Repeater       1.00      0.75      0.86      1583

    accuracy                           0.77      1732
   macro avg       0.63      0.86      0.64      1732
weighted avg       0.93      0.77      0.82      1732

Confusion Matrix:
 [[ 145    4]
 [ 394 1189]]


=== Summary ===
Total False Positives: 9
Total False Negatives: 2553
Total True Positives: 5363
Total True Negatives: 739

Confusion Matrix (with duplicates):
              Non-Repeater  Repeater
Non-Repeater         739.0       9.0
Repeater            2553.0    5363.0
accuracy_score
0.7042936288088643
Trial 1: hidden_dim=1332, latent_dim=31, beta=1.4033923753985964, gamma=0.2800360192010447, dropout_rate=0.1348004723614234, lr=0.0008027355642787616, scheduler_patience=7, class_weight=2.79986900518021, activation=ReLU, classification_multiplier=14730.614638473677

=== Fold 1/5 ===
Validation Accuracy: 0.6919
Classification Report:
               precision    recall  f1-score   support

Non-Repeater       0.22      0.99      0.36       149
    Repeater       1.00      0.66      0.80      1584

    accuracy                           0.69      1733
   macro avg       0.61      0.83      0.58      1733
weighted avg       0.93      0.69      0.76      1733

Confusion Matrix:
 [[ 147    2]
 [ 532 1052]]

=== Fold 2/5 ===
Validation Accuracy: 0.7680
Classification Report:
               precision    recall  f1-score   support

Non-Repeater       0.27      0.99      0.43       150
    Repeater       1.00      0.75      0.85      1583

    accuracy                           0.77      1733
   macro avg       0.64      0.87      0.64      1733
weighted avg       0.94      0.77      0.82      1733

Confusion Matrix:
 [[ 149    1]
 [ 401 1182]]

=== Fold 3/5 ===
Validation Accuracy: 0.7565
Classification Report:
               precision    recall  f1-score   support

Non-Repeater       0.26      0.99      0.41       150
    Repeater       1.00      0.73      0.85      1583

    accuracy                           0.76      1733
   macro avg       0.63      0.86      0.63      1733
weighted avg       0.94      0.76      0.81      1733

Confusion Matrix:
 [[ 149    1]
 [ 421 1162]]

=== Fold 4/5 ===
Validation Accuracy: 0.6792
Classification Report:
               precision    recall  f1-score   support

Non-Repeater       0.21      0.98      0.35       150
    Repeater       1.00      0.65      0.79      1583

    accuracy                           0.68      1733
   macro avg       0.60      0.82      0.57      1733
weighted avg       0.93      0.68      0.75      1733

Confusion Matrix:
 [[ 147    3]
 [ 553 1030]]

=== Fold 5/5 ===
Validation Accuracy: 0.7708
Classification Report:
               precision    recall  f1-score   support

Non-Repeater       0.27      0.97      0.42       149
    Repeater       1.00      0.75      0.86      1583

    accuracy                           0.77      1732
   macro avg       0.63      0.86      0.64      1732
weighted avg       0.93      0.77      0.82      1732

Confusion Matrix:
 [[ 145    4]
 [ 393 1190]]


=== Summary ===
Total False Positives: 11
Total False Negatives: 2300
Total True Positives: 5616
Total True Negatives: 737

Confusion Matrix (with duplicates):
              Non-Repeater  Repeater
Non-Repeater         737.0      11.0
Repeater            2300.0    5616.0
accuracy_score
0.733264081255771
Trial 1: hidden_dim=1369, latent_dim=28, beta=1.34502235946727, gamma=0.13982282253859063, dropout_rate=0.1523229488226375, lr=0.00044074150639850194, scheduler_patience=7, class_weight=2.8619026904667892, activation=ReLU, classification_multiplier=14289.621664617745

=== Fold 1/5 ===
Validation Accuracy: 0.7848
Classification Report:
               precision    recall  f1-score   support

Non-Repeater       0.28      0.97      0.44       149
    Repeater       1.00      0.77      0.87      1584

    accuracy                           0.78      1733
   macro avg       0.64      0.87      0.65      1733
weighted avg       0.94      0.78      0.83      1733

Confusion Matrix:
 [[ 145    4]
 [ 369 1215]]

=== Fold 2/5 ===
Validation Accuracy: 0.6959
Classification Report:
               precision    recall  f1-score   support

Non-Repeater       0.22      0.99      0.36       150
    Repeater       1.00      0.67      0.80      1583

    accuracy                           0.70      1733
   macro avg       0.61      0.83      0.58      1733
weighted avg       0.93      0.70      0.76      1733

Confusion Matrix:
 [[ 149    1]
 [ 526 1057]]

=== Fold 3/5 ===
Validation Accuracy: 0.6220
Classification Report:
               precision    recall  f1-score   support

Non-Repeater       0.19      0.99      0.31       150
    Repeater       1.00      0.59      0.74      1583

    accuracy                           0.62      1733
   macro avg       0.59      0.79      0.53      1733
weighted avg       0.93      0.62      0.70      1733

Confusion Matrix:
 [[149   1]
 [654 929]]

=== Fold 4/5 ===
Validation Accuracy: 0.7576
Classification Report:
               precision    recall  f1-score   support

Non-Repeater       0.26      0.98      0.41       150
    Repeater       1.00      0.74      0.85      1583

    accuracy                           0.76      1733
   macro avg       0.63      0.86      0.63      1733
weighted avg       0.93      0.76      0.81      1733

Confusion Matrix:
 [[ 147    3]
 [ 417 1166]]

=== Fold 5/5 ===
Validation Accuracy: 0.7679
Classification Report:
               precision    recall  f1-score   support

Non-Repeater       0.27      0.97      0.42       149
    Repeater       1.00      0.75      0.85      1583

    accuracy                           0.77      1732
   macro avg       0.63      0.86      0.64      1732
weighted avg       0.93      0.77      0.82      1732

Confusion Matrix:
 [[ 145    4]
 [ 398 1185]]


=== Summary ===
Total False Positives: 13
Total False Negatives: 2364
Total True Positives: 5552
Total True Negatives: 735

Confusion Matrix (with duplicates):
              Non-Repeater  Repeater
Non-Repeater         735.0      13.0
Repeater            2364.0    5552.0
accuracy_score
0.7256463527239151
Trial 1: hidden_dim=1414, latent_dim=29, beta=1.3944899606261845, gamma=0.1730371025834808, dropout_rate=0.1434016563954041, lr=0.0006796222253442989, scheduler_patience=7, class_weight=2.9015380614528294, activation=ReLU, classification_multiplier=14570.074999904577

=== Fold 1/5 ===
Validation Accuracy: 0.7121
Classification Report:
               precision    recall  f1-score   support

Non-Repeater       0.23      0.99      0.37       149
    Repeater       1.00      0.69      0.81      1584

    accuracy                           0.71      1733
   macro avg       0.61      0.84      0.59      1733
weighted avg       0.93      0.71      0.78      1733

Confusion Matrix:
 [[ 148    1]
 [ 498 1086]]

=== Fold 2/5 ===
Validation Accuracy: 0.8425
Classification Report:
               precision    recall  f1-score   support

Non-Repeater       0.35      0.99      0.52       150
    Repeater       1.00      0.83      0.91      1583

    accuracy                           0.84      1733
   macro avg       0.68      0.91      0.71      1733
weighted avg       0.94      0.84      0.87      1733

Confusion Matrix:
 [[ 149    1]
 [ 272 1311]]

=== Fold 3/5 ===
Validation Accuracy: 0.7565
Classification Report:
 [I 2025-06-13 04:28:05,181] Trial 241 finished with value: 0.7575023084025854 and parameters: {'hidden_dim': 1282, 'latent_dim': 31, 'beta': 1.3246063111616786, 'gamma': 0.2076360600012237, 'dropout_rate': 0.11857226735387437, 'lr': 0.0003535539392104114, 'scheduler_patience': 7, 'class_weight': 2.73098502595578, 'activation': 'ReLU', 'classification_multiplier': 14914.8900383533}. Best is trial 194 with value: 0.8103647276084949.
[I 2025-06-13 04:34:22,387] Trial 242 finished with value: 0.747229916897507 and parameters: {'hidden_dim': 1304, 'latent_dim': 30, 'beta': 1.3078608017940476, 'gamma': 0.1792711262226838, 'dropout_rate': 0.13282830678523436, 'lr': 0.00033572796189117025, 'scheduler_patience': 7, 'class_weight': 2.774775387958492, 'activation': 'ReLU', 'classification_multiplier': 14040.053412541449}. Best is trial 194 with value: 0.8103647276084949.
