[I 2025-06-12 10:07:49,133] Trial 65 finished with value: 0.5590951061865189 and parameters: {'hidden_dim': 1015, 'latent_dim': 5, 'beta': 1.455453185640414, 'gamma': 0.5796352612344097, 'dropout_rate': 0.15750142867481795, 'lr': 0.0016112776198740054, 'scheduler_patience': 6, 'class_weight': 1.6872815879350116, 'activation': 'ReLU', 'classification_multiplier': 5803.214756758723}. Best is trial 63 with value: 0.7299168975069252.
              precision    recall  f1-score   support

Non-Repeater       0.20      0.99      0.33       150
    Repeater       1.00      0.62      0.76      1583

    accuracy                           0.65      1733
   macro avg       0.60      0.80      0.55      1733
weighted avg       0.93      0.65      0.72      1733

Confusion Matrix:
 [[149   1]
 [607 976]]

=== Fold 4/5 ===
Validation Accuracy: 0.6342
Classification Report:
               precision    recall  f1-score   support

Non-Repeater       0.19      0.99      0.32       150
    Repeater       1.00      0.60      0.75      1583

    accuracy                           0.63      1733
   macro avg       0.59      0.79      0.53      1733
weighted avg       0.93      0.63      0.71      1733

Confusion Matrix:
 [[148   2]
 [632 951]]

=== Fold 5/5 ===
Validation Accuracy: 0.8464
Classification Report:
               precision    recall  f1-score   support

Non-Repeater       0.36      0.97      0.52       149
    Repeater       1.00      0.84      0.91      1583

    accuracy                           0.85      1732
   macro avg       0.68      0.90      0.71      1732
weighted avg       0.94      0.85      0.88      1732

Confusion Matrix:
 [[ 144    5]
 [ 261 1322]]


=== Summary ===
Total False Positives: 13
Total False Negatives: 2327
Total True Positives: 5589
Total True Negatives: 735

Confusion Matrix (with duplicates):
              Non-Repeater  Repeater
Non-Repeater         735.0      13.0
Repeater            2327.0    5589.0
accuracy_score
0.7299168975069252
Trial 1: hidden_dim=1009, latent_dim=11, beta=1.008452094950722, gamma=0.3292376356968917, dropout_rate=0.15229708908033537, lr=0.001128065720947974, scheduler_patience=6, class_weight=1.5704806618971032, activation=ReLU, classification_multiplier=5744.958553062104

=== Fold 1/5 ===
Validation Accuracy: 0.6336
Classification Report:
               precision    recall  f1-score   support

Non-Repeater       0.19      0.99      0.32       149
    Repeater       1.00      0.60      0.75      1584

    accuracy                           0.63      1733
   macro avg       0.59      0.80      0.53      1733
weighted avg       0.93      0.63      0.71      1733

Confusion Matrix:
 [[148   1]
 [634 950]]

=== Fold 2/5 ===
Validation Accuracy: 0.6422
Classification Report:
               precision    recall  f1-score   support

Non-Repeater       0.19      0.99      0.32       150
    Repeater       1.00      0.61      0.76      1583

    accuracy                           0.64      1733
   macro avg       0.60      0.80      0.54      1733
weighted avg       0.93      0.64      0.72      1733

Confusion Matrix:
 [[149   1]
 [619 964]]

=== Fold 3/5 ===
Validation Accuracy: 0.6595
Classification Report:
               precision    recall  f1-score   support

Non-Repeater       0.20      0.99      0.34       150
    Repeater       1.00      0.63      0.77      1583

    accuracy                           0.66      1733
   macro avg       0.60      0.81      0.55      1733
weighted avg       0.93      0.66      0.73      1733

Confusion Matrix:
 [[149   1]
 [589 994]]

=== Fold 4/5 ===
Validation Accuracy: 0.6624
Classification Report:
               precision    recall  f1-score   support

Non-Repeater       0.20      0.99      0.34       150
    Repeater       1.00      0.63      0.77      1583

    accuracy                           0.66      1733
   macro avg       0.60      0.81      0.55      1733
weighted avg       0.93      0.66      0.74      1733

Confusion Matrix:
 [[ 148    2]
 [ 583 1000]]

=== Fold 5/5 ===
Validation Accuracy: 0.6819
Classification Report:
               precision    recall  f1-score   support

Non-Repeater       0.21      0.98      0.35       149
    Repeater       1.00      0.65      0.79      1583

    accuracy                           0.68      1732
   macro avg       0.60      0.82      0.57      1732
weighted avg       0.93      0.68      0.75      1732

Confusion Matrix:
 [[ 146    3]
 [ 548 1035]]


=== Summary ===
Total False Positives: 8
Total False Negatives: 2973
Total True Positives: 4943
Total True Negatives: 740

Confusion Matrix (with duplicates):
              Non-Repeater  Repeater
Non-Repeater         740.0       8.0
Repeater            2973.0    4943.0
accuracy_score
0.655932594644506
Trial 1: hidden_dim=792, latent_dim=12, beta=0.9931434497623146, gamma=0.31357045684191603, dropout_rate=0.1412180885203951, lr=0.0010452700806898672, scheduler_patience=7, class_weight=1.5776938406829646, activation=ReLU, classification_multiplier=6215.778226982829

=== Fold 1/5 ===
Validation Accuracy: 0.7882
Classification Report:
               precision    recall  f1-score   support

Non-Repeater       0.28      0.94      0.43       149
    Repeater       0.99      0.77      0.87      1584

    accuracy                           0.79      1733
   macro avg       0.64      0.86      0.65      1733
weighted avg       0.93      0.79      0.83      1733

Confusion Matrix:
 [[ 140    9]
 [ 358 1226]]

=== Fold 2/5 ===
Validation Accuracy: 0.5863
Classification Report:
               precision    recall  f1-score   support

Non-Repeater       0.17      0.99      0.29       150
    Repeater       1.00      0.55      0.71      1583

    accuracy                           0.59      1733
   macro avg       0.59      0.77      0.50      1733
weighted avg       0.93      0.59      0.67      1733

Confusion Matrix:
 [[149   1]
 [716 867]]

=== Fold 3/5 ===
Validation Accuracy: 0.6538
Classification Report:
               precision    recall  f1-score   support

Non-Repeater       0.20      0.99      0.33       150
    Repeater       1.00      0.62      0.77      1583

    accuracy                           0.65      1733
   macro avg       0.60      0.81      0.55      1733
weighted avg       0.93      0.65      0.73      1733

Confusion Matrix:
 [[149   1]
 [599 984]]

=== Fold 4/5 ===
Validation Accuracy: 0.3883
Classification Report:
               precision    recall  f1-score   support

Non-Repeater       0.12      1.00      0.22       150
    Repeater       1.00      0.33      0.50      1583

    accuracy                           0.39      1733
   macro avg       0.56      0.67      0.36      1733
weighted avg       0.92      0.39      0.47      1733

Confusion Matrix:
 [[ 150    0]
 [1060  523]]

=== Fold 5/5 ===
Validation Accuracy: 0.3788
Classification Report:
               precision    recall  f1-score   support

Non-Repeater       0.12      1.00      0.22       149
    Repeater       1.00      0.32      0.49      1583

    accuracy                           0.38      1732
   macro avg       0.56      0.66      0.35      1732
weighted avg       0.92      0.38      0.46      1732

Confusion Matrix:
 [[ 149    0]
 [1076  507]]


=== Summary ===
Total False Positives: 11
Total False Negatives: 3809
Total True Positives: 4107
Total True Negatives: 737

Confusion Matrix (with duplicates):
              Non-Repeater  Repeater
Non-Repeater         737.0      11.0
Repeater            3809.0    4107.0
accuracy_score
0.5590951061865189
Trial 1: hidden_dim=1015, latent_dim=5, beta=1.455453185640414, gamma=0.5796352612344097, dropout_rate=0.15750142867481795, lr=0.0016112776198740054, scheduler_patience=6, class_weight=1.6872815879350116, activation=ReLU, classification_multiplier=5803.214756758723

=== Fold 1/5 ===
Validation Accuracy: 0.2493
Classification Report:
               precision    recall  f1-score   support

Non-Repeater       0.10      1.00      0.19       149
    Repeater       1.00      0.18      0.30      1584

    accuracy                           0.25      1733
   macro avg       0.55      0.59      0.24      1733
weighted avg       0.92      0.25      0.29      1733

Confusion Matrix:
 [[ 149    0]
 [1301  283]]

=== Fold 2/5 ===
Validation Accuracy: 0.3480
Classification Report:
 [I 2025-06-12 10:13:27,106] Trial 66 finished with value: 0.2865881809787627 and parameters: {'hidden_dim': 872, 'latent_dim': 8, 'beta': 1.2045400721723933, 'gamma': 0.48036488925239956, 'dropout_rate': 0.11665042256202508, 'lr': 0.001081703970263146, 'scheduler_patience': 5, 'class_weight': 1.802365588095424, 'activation': 'SELU', 'classification_multiplier': 5550.032816031893}. Best is trial 63 with value: 0.7299168975069252.
[I 2025-06-12 10:19:42,951] Trial 67 finished with value: 0.5143120960295475 and parameters: {'hidden_dim': 1289, 'latent_dim': 12, 'beta': 0.8897300494126432, 'gamma': 0.10278011840916501, 'dropout_rate': 0.18865300655814782, 'lr': 0.001920673752317958, 'scheduler_patience': 7, 'class_weight': 1.4735206482256784, 'activation': 'ReLU', 'classification_multiplier': 5022.44939052459}. Best is trial 63 with value: 0.7299168975069252.
