[I 2025-06-13 03:24:26,070] Trial 231 finished with value: 0.7645429362880887 and parameters: {'hidden_dim': 1301, 'latent_dim': 32, 'beta': 1.4064007671127654, 'gamma': 0.14785199655415104, 'dropout_rate': 0.13321368788278365, 'lr': 0.0003423564678737981, 'scheduler_patience': 7, 'class_weight': 2.770239772634766, 'activation': 'ReLU', 'classification_multiplier': 14740.011468422372}. Best is trial 194 with value: 0.8103647276084949.

Confusion Matrix (with duplicates):
              Non-Repeater  Repeater
Non-Repeater         740.0       8.0
Repeater            2299.0    5617.0
accuracy_score
0.7337257617728532
Trial 1: hidden_dim=1224, latent_dim=31, beta=1.3358373152383978, gamma=0.2656457784172247, dropout_rate=0.1268829424432717, lr=0.00023622872636900043, scheduler_patience=7, class_weight=2.690272588749101, activation=ReLU, classification_multiplier=14129.337098268321

=== Fold 1/5 ===
Validation Accuracy: 0.2914
Classification Report:
               precision    recall  f1-score   support

Non-Repeater       0.11      0.99      0.19       149
    Repeater       1.00      0.23      0.37      1584

    accuracy                           0.29      1733
   macro avg       0.55      0.61      0.28      1733
weighted avg       0.92      0.29      0.35      1733

Confusion Matrix:
 [[ 148    1]
 [1227  357]]

=== Fold 2/5 ===
Validation Accuracy: 0.1091
Classification Report:
               precision    recall  f1-score   support

Non-Repeater       0.09      1.00      0.16       150
    Repeater       1.00      0.02      0.05      1583

    accuracy                           0.11      1733
   macro avg       0.54      0.51      0.11      1733
weighted avg       0.92      0.11      0.06      1733

Confusion Matrix:
 [[ 150    0]
 [1544   39]]

=== Fold 3/5 ===
Validation Accuracy: 0.6203
Classification Report:
               precision    recall  f1-score   support

Non-Repeater       0.18      0.99      0.31       150
    Repeater       1.00      0.58      0.74      1583

    accuracy                           0.62      1733
   macro avg       0.59      0.79      0.52      1733
weighted avg       0.93      0.62      0.70      1733

Confusion Matrix:
 [[149   1]
 [657 926]]

=== Fold 4/5 ===
Validation Accuracy: 0.2649
Classification Report:
               precision    recall  f1-score   support

Non-Repeater       0.11      1.00      0.19       150
    Repeater       1.00      0.20      0.33      1583

    accuracy                           0.26      1733
   macro avg       0.55      0.60      0.26      1733
weighted avg       0.92      0.26      0.31      1733

Confusion Matrix:
 [[ 150    0]
 [1274  309]]

=== Fold 5/5 ===
Validation Accuracy: 0.0860
Classification Report:
               precision    recall  f1-score   support

Non-Repeater       0.09      1.00      0.16       149
    Repeater       0.00      0.00      0.00      1583

    accuracy                           0.09      1732
   macro avg       0.04      0.50      0.08      1732
weighted avg       0.01      0.09      0.01      1732

Confusion Matrix:
 [[ 149    0]
 [1583    0]]


=== Summary ===
Total False Positives: 2
Total False Negatives: 6285
Total True Positives: 1631
Total True Negatives: 746

Confusion Matrix (with duplicates):
              Non-Repeater  Repeater
Non-Repeater         746.0       2.0
Repeater            6285.0    1631.0
accuracy_score
0.27435364727608497
Trial 1: hidden_dim=1197, latent_dim=32, beta=1.2530945747704936, gamma=0.18633169027061666, dropout_rate=0.11417383022803966, lr=0.006708298369030294, scheduler_patience=7, class_weight=2.618776532053549, activation=ReLU, classification_multiplier=13953.020055185008

=== Fold 1/5 ===
Validation Accuracy: 0.7773
Classification Report:
               precision    recall  f1-score   support

Non-Repeater       0.28      0.98      0.43       149
    Repeater       1.00      0.76      0.86      1584

    accuracy                           0.78      1733
   macro avg       0.64      0.87      0.65      1733
weighted avg       0.94      0.78      0.82      1733

Confusion Matrix:
 [[ 146    3]
 [ 383 1201]]

=== Fold 2/5 ===
Validation Accuracy: 0.7917
Classification Report:
               precision    recall  f1-score   support

Non-Repeater       0.29      0.99      0.45       150
    Repeater       1.00      0.77      0.87      1583

    accuracy                           0.79      1733
   macro avg       0.65      0.88      0.66      1733
weighted avg       0.94      0.79      0.84      1733

Confusion Matrix:
 [[ 149    1]
 [ 360 1223]]

=== Fold 3/5 ===
Validation Accuracy: 0.6509
Classification Report:
               precision    recall  f1-score   support

Non-Repeater       0.20      0.99      0.33       150
    Repeater       1.00      0.62      0.76      1583

    accuracy                           0.65      1733
   macro avg       0.60      0.81      0.55      1733
weighted avg       0.93      0.65      0.73      1733

Confusion Matrix:
 [[149   1]
 [604 979]]

=== Fold 4/5 ===
Validation Accuracy: 0.7501
Classification Report:
               precision    recall  f1-score   support

Non-Repeater       0.25      0.98      0.40       150
    Repeater       1.00      0.73      0.84      1583

    accuracy                           0.75      1733
   macro avg       0.63      0.85      0.62      1733
weighted avg       0.93      0.75      0.80      1733

Confusion Matrix:
 [[ 147    3]
 [ 430 1153]]

=== Fold 5/5 ===
Validation Accuracy: 0.8528
Classification Report:
               precision    recall  f1-score   support

Non-Repeater       0.37      0.97      0.53       149
    Repeater       1.00      0.84      0.91      1583

    accuracy                           0.85      1732
   macro avg       0.68      0.91      0.72      1732
weighted avg       0.94      0.85      0.88      1732

Confusion Matrix:
 [[ 145    4]
 [ 251 1332]]


=== Summary ===
Total False Positives: 12
Total False Negatives: 2028
Total True Positives: 5888
Total True Negatives: 736

Confusion Matrix (with duplicates):
              Non-Repeater  Repeater
Non-Repeater         736.0      12.0
Repeater            2028.0    5888.0
accuracy_score
0.7645429362880887
Trial 1: hidden_dim=1301, latent_dim=32, beta=1.4064007671127654, gamma=0.14785199655415104, dropout_rate=0.13321368788278365, lr=0.0003423564678737981, scheduler_patience=7, class_weight=2.770239772634766, activation=ReLU, classification_multiplier=14740.011468422372

=== Fold 1/5 ===
Validation Accuracy: 0.7074
Classification Report:
               precision    recall  f1-score   support

Non-Repeater       0.23      0.99      0.37       149
    Repeater       1.00      0.68      0.81      1584

    accuracy                           0.71      1733
   macro avg       0.61      0.84      0.59      1733
weighted avg       0.93      0.71      0.77      1733

Confusion Matrix:
 [[ 148    1]
 [ 506 1078]]

=== Fold 2/5 ===
Validation Accuracy: 0.7542
Classification Report:
               precision    recall  f1-score   support

Non-Repeater       0.26      0.99      0.41       150
    Repeater       1.00      0.73      0.84      1583

    accuracy                           0.75      1733
   macro avg       0.63      0.86      0.63      1733
weighted avg       0.94      0.75      0.81      1733

Confusion Matrix:
 [[ 149    1]
 [ 425 1158]]

=== Fold 3/5 ===
Validation Accuracy: 0.7513
Classification Report:
               precision    recall  f1-score   support

Non-Repeater       0.26      0.98      0.41       150
    Repeater       1.00      0.73      0.84      1583

    accuracy                           0.75      1733
   macro avg       0.63      0.85      0.62      1733
weighted avg       0.93      0.75      0.80      1733

Confusion Matrix:
 [[ 147    3]
 [ 428 1155]]

=== Fold 4/5 ===
Validation Accuracy: 0.7051
Classification Report:
               precision    recall  f1-score   support

Non-Repeater       0.23      0.99      0.37       150
    Repeater       1.00      0.68      0.81      1583

    accuracy                           0.71      1733
   macro avg       0.61      0.83      0.59      1733
weighted avg       0.93      0.71      0.77      1733

Confusion Matrix:
 [[ 148    2]
 [ 509 1074]]

=== Fold 5/5 ===
Validation Accuracy: 0.7685
Classification Report:
               precision    recall  f1-score   support

Non-Repeater       0.27      0.97      0.42       149
    Repeater       1.00      0.75      0.86      1583

    accuracy                           0.77      1732
   macro avg       0.63      0.86      0.64      1732
weighted avg       0.93      0.77      0.82      1732

[I 2025-06-13 03:30:44,126] Trial 232 finished with value: 0.73730378578024 and parameters: {'hidden_dim': 1300, 'latent_dim': 32, 'beta': 1.3756816464624069, 'gamma': 0.15121912787251374, 'dropout_rate': 0.12673764870370588, 'lr': 0.00033505497969214614, 'scheduler_patience': 7, 'class_weight': 2.764450208434565, 'activation': 'ReLU', 'classification_multiplier': 13740.554688987924}. Best is trial 194 with value: 0.8103647276084949.
[I 2025-06-13 03:37:04,308] Trial 233 finished with value: 0.7647737765466297 and parameters: {'hidden_dim': 1326, 'latent_dim': 30, 'beta': 1.4187149573900826, 'gamma': 0.2182728382850957, 'dropout_rate': 0.1426150744667685, 'lr': 0.00033271593277045373, 'scheduler_patience': 7, 'class_weight': 2.8447061318809186, 'activation': 'ReLU', 'classification_multiplier': 14659.96080844942}. Best is trial 194 with value: 0.8103647276084949.
[I 2025-06-13 03:43:27,412] Trial 234 finished with value: 0.775623268698061 and parameters: {'hidden_dim': 1351, 'latent_dim': 30, 'beta': 1.3952210706947015, 'gamma': 0.2154725464827263, 'dropout_rate': 0.14282618131638491, 'lr': 0.0005050916204384932, 'scheduler_patience': 7, 'class_weight': 2.8454247629253953, 'activation': 'ReLU', 'classification_multiplier': 14662.018794464586}. Best is trial 194 with value: 0.8103647276084949.
Confusion Matrix:
 [[ 145    4]
 [ 397 1186]]


=== Summary ===
Total False Positives: 11
Total False Negatives: 2265
Total True Positives: 5651
Total True Negatives: 737

Confusion Matrix (with duplicates):
              Non-Repeater  Repeater
Non-Repeater         737.0      11.0
Repeater            2265.0    5651.0
accuracy_score
0.73730378578024
Trial 1: hidden_dim=1300, latent_dim=32, beta=1.3756816464624069, gamma=0.15121912787251374, dropout_rate=0.12673764870370588, lr=0.00033505497969214614, scheduler_patience=7, class_weight=2.764450208434565, activation=ReLU, classification_multiplier=13740.554688987924

=== Fold 1/5 ===
Validation Accuracy: 0.7069
Classification Report:
               precision    recall  f1-score   support

Non-Repeater       0.23      0.99      0.37       149
    Repeater       1.00      0.68      0.81      1584

    accuracy                           0.71      1733
   macro avg       0.61      0.84      0.59      1733
weighted avg       0.93      0.71      0.77      1733

Confusion Matrix:
 [[ 148    1]
 [ 507 1077]]

=== Fold 2/5 ===
Validation Accuracy: 0.7813
Classification Report:
               precision    recall  f1-score   support

Non-Repeater       0.28      0.99      0.44       150
    Repeater       1.00      0.76      0.86      1583

    accuracy                           0.78      1733
   macro avg       0.64      0.87      0.65      1733
weighted avg       0.94      0.78      0.83      1733

Confusion Matrix:
 [[ 148    2]
 [ 377 1206]]

=== Fold 3/5 ===
Validation Accuracy: 0.7940
Classification Report:
               precision    recall  f1-score   support

Non-Repeater       0.29      0.98      0.45       150
    Repeater       1.00      0.78      0.87      1583

    accuracy                           0.79      1733
   macro avg       0.65      0.88      0.66      1733
weighted avg       0.94      0.79      0.84      1733

Confusion Matrix:
 [[ 147    3]
 [ 354 1229]]

=== Fold 4/5 ===
Validation Accuracy: 0.6884
Classification Report:
               precision    recall  f1-score   support

Non-Repeater       0.22      0.99      0.35       150
    Repeater       1.00      0.66      0.79      1583

    accuracy                           0.69      1733
   macro avg       0.61      0.82      0.57      1733
weighted avg       0.93      0.69      0.76      1733

Confusion Matrix:
 [[ 148    2]
 [ 538 1045]]

=== Fold 5/5 ===
Validation Accuracy: 0.8533
Classification Report:
               precision    recall  f1-score   support

Non-Repeater       0.37      0.97      0.53       149
    Repeater       1.00      0.84      0.91      1583

    accuracy                           0.85      1732
   macro avg       0.68      0.90      0.72      1732
weighted avg       0.94      0.85      0.88      1732

Confusion Matrix:
 [[ 144    5]
 [ 249 1334]]


=== Summary ===
Total False Positives: 13
Total False Negatives: 2025
Total True Positives: 5891
Total True Negatives: 735

Confusion Matrix (with duplicates):
              Non-Repeater  Repeater
Non-Repeater         735.0      13.0
Repeater            2025.0    5891.0
accuracy_score
0.7647737765466297
Trial 1: hidden_dim=1326, latent_dim=30, beta=1.4187149573900826, gamma=0.2182728382850957, dropout_rate=0.1426150744667685, lr=0.00033271593277045373, scheduler_patience=7, class_weight=2.8447061318809186, activation=ReLU, classification_multiplier=14659.96080844942

=== Fold 1/5 ===
Validation Accuracy: 0.7992
Classification Report:
               precision    recall  f1-score   support

Non-Repeater       0.30      0.99      0.46       149
    Repeater       1.00      0.78      0.88      1584

    accuracy                           0.80      1733
   macro avg       0.65      0.88      0.67      1733
weighted avg       0.94      0.80      0.84      1733

Confusion Matrix:
 [[ 147    2]
 [ 346 1238]]

=== Fold 2/5 ===
Validation Accuracy: 0.7755
Classification Report:
               precision    recall  f1-score   support

Non-Repeater       0.28      0.99      0.43       150
    Repeater       1.00      0.75      0.86      1583

    accuracy                           0.78      1733
   macro avg       0.64      0.87      0.65      1733
weighted avg       0.94      0.78      0.82      1733

Confusion Matrix:
 [[ 149    1]
 [ 388 1195]]

=== Fold 3/5 ===
Validation Accuracy: 0.6890
Classification Report:
               precision    recall  f1-score   support

Non-Repeater       0.22      0.99      0.35       150
    Repeater       1.00      0.66      0.80      1583

    accuracy                           0.69      1733
   macro avg       0.61      0.82      0.57      1733
weighted avg       0.93      0.69      0.76      1733

Confusion Matrix:
 [[ 148    2]
 [ 537 1046]]

=== Fold 4/5 ===
Validation Accuracy: 0.7582
Classification Report:
               precision    recall  f1-score   support

Non-Repeater       0.26      0.97      0.41       150
    Repeater       1.00      0.74      0.85      1583

    accuracy                           0.76      1733
   macro avg       0.63      0.86      0.63      1733
weighted avg       0.93      0.76      0.81      1733

Confusion Matrix:
 [[ 146    4]
 [ 415 1168]]

=== Fold 5/5 ===
Validation Accuracy: 0.8562
Classification Report:
               precision    recall  f1-score   support

Non-Repeater       0.37      0.97      0.54       149
    Repeater       1.00      0.85      0.91      1583

    accuracy                           0.86      1732
   macro avg       0.68      0.91      0.73      1732
weighted avg       0.94      0.86      0.88      1732

Confusion Matrix:
 [[ 145    4]
 [ 245 1338]]


=== Summary ===
Total False Positives: 13
Total False Negatives: 1931
Total True Positives: 5985
Total True Negatives: 735

Confusion Matrix (with duplicates):
              Non-Repeater  Repeater
Non-Repeater         735.0      13.0
Repeater            1931.0    5985.0
accuracy_score
0.775623268698061
Trial 1: hidden_dim=1351, latent_dim=30, beta=1.3952210706947015, gamma=0.2154725464827263, dropout_rate=0.14282618131638491, lr=0.0005050916204384932, scheduler_patience=7, class_weight=2.8454247629253953, activation=ReLU, classification_multiplier=14662.018794464586

=== Fold 1/5 ===
Validation Accuracy: 0.6607
Classification Report:
               precision    recall  f1-score   support

Non-Repeater       0.20      0.99      0.33       149
    Repeater       1.00      0.63      0.77      1584

    accuracy                           0.66      1733
   macro avg       0.60      0.81      0.55      1733
weighted avg       0.93      0.66      0.73      1733

Confusion Matrix:
 [[148   1]
 [587 997]]

=== Fold 2/5 ===
Validation Accuracy: 0.6682
Classification Report:
               precision    recall  f1-score   support

Non-Repeater       0.21      0.99      0.34       150
    Repeater       1.00      0.64      0.78      1583

    accuracy                           0.67      1733
   macro avg       0.60      0.82      0.56      1733
weighted avg       0.93      0.67      0.74      1733

Confusion Matrix:
 [[ 149    1]
 [ 574 1009]]

=== Fold 3/5 ===
Validation Accuracy: 0.7253
Classification Report:
               precision    recall  f1-score   support

Non-Repeater       0.24      0.99      0.39       150
    Repeater       1.00      0.70      0.82      1583

    accuracy                           0.73      1733
   macro avg       0.62      0.85      0.60      1733
weighted avg       0.93      0.73      0.79      1733

Confusion Matrix:
 [[ 149    1]
 [ 475 1108]]

=== Fold 4/5 ===
Validation Accuracy: 0.7623
Classification Report:
               precision    recall  f1-score   support

Non-Repeater       0.26      0.97      0.41       150
    Repeater       1.00      0.74      0.85      1583

    accuracy                           0.76      1733
   macro avg       0.63      0.85      0.63      1733
weighted avg       0.93      0.76      0.81      1733

Confusion Matrix:
 [[ 145    5]
 [ 407 1176]]

=== Fold 5/5 ===
Validation Accuracy: 0.9001
Classification Report:
 [I 2025-06-13 03:49:51,093] Trial 235 finished with value: 0.7433056325023084 and parameters: {'hidden_dim': 1363, 'latent_dim': 29, 'beta': 1.4261811849002919, 'gamma': 0.23072957186785947, 'dropout_rate': 0.1557739601459986, 'lr': 0.0006948835852248449, 'scheduler_patience': 7, 'class_weight': 2.836752765789322, 'activation': 'ReLU', 'classification_multiplier': 14708.949811535284}. Best is trial 194 with value: 0.8103647276084949.
[I 2025-06-13 03:56:08,720] Trial 236 finished with value: 0.7210295475530932 and parameters: {'hidden_dim': 1330, 'latent_dim': 30, 'beta': 1.394987572275356, 'gamma': 0.23226166423464858, 'dropout_rate': 0.1460845553831097, 'lr': 0.0005083849746105228, 'scheduler_patience': 7, 'class_weight': 2.858828996384896, 'activation': 'LeakyReLU', 'classification_multiplier': 14387.42937110039}. Best is trial 194 with value: 0.8103647276084949.
