[I 2025-06-12 04:39:55,941] Trial 10 finished with value: 0.08633425669436749 and parameters: {'hidden_dim': 1234, 'latent_dim': 5, 'beta': 0.5944485131186411, 'gamma': 1.261727363677858, 'dropout_rate': 0.2617017761980054, 'lr': 0.0037840456576254677, 'scheduler_patience': 7, 'class_weight': 0.20503031764985336, 'activation': 'GELU', 'classification_multiplier': 6427.510717163972}. Best is trial 8 with value: 0.6408125577100646.
[[ 145    4]
 [ 442 1141]]


=== Summary ===
Total False Positives: 10
Total False Negatives: 3102
Total True Positives: 4814
Total True Negatives: 738

Confusion Matrix (with duplicates):
              Non-Repeater  Repeater
Non-Repeater         738.0      10.0
Repeater            3102.0    4814.0
accuracy_score
0.6408125577100646
Trial 1: hidden_dim=616, latent_dim=18, beta=0.16183003097611912, gamma=1.8513168915475995, dropout_rate=0.13109725059093186, lr=0.0015805269822011287, scheduler_patience=6, class_weight=2.8996998970892265, activation=GELU, classification_multiplier=11928.619525344111

=== Fold 1/5 ===
Validation Accuracy: 0.3618
Classification Report:
               precision    recall  f1-score   support

Non-Repeater       0.12      1.00      0.21       149
    Repeater       1.00      0.30      0.46      1584

    accuracy                           0.36      1733
   macro avg       0.56      0.65      0.34      1733
weighted avg       0.92      0.36      0.44      1733

Confusion Matrix:
 [[ 149    0]
 [1106  478]]

=== Fold 2/5 ===
Validation Accuracy: 0.3883
Classification Report:
               precision    recall  f1-score   support

Non-Repeater       0.12      1.00      0.22       150
    Repeater       1.00      0.33      0.50      1583

    accuracy                           0.39      1733
   macro avg       0.56      0.67      0.36      1733
weighted avg       0.92      0.39      0.47      1733

Confusion Matrix:
 [[ 150    0]
 [1060  523]]

=== Fold 3/5 ===
Validation Accuracy: 0.3681
Classification Report:
               precision    recall  f1-score   support

Non-Repeater       0.12      1.00      0.22       150
    Repeater       1.00      0.31      0.47      1583

    accuracy                           0.37      1733
   macro avg       0.56      0.65      0.34      1733
weighted avg       0.92      0.37      0.45      1733

Confusion Matrix:
 [[ 150    0]
 [1095  488]]

=== Fold 4/5 ===
Validation Accuracy: 0.2926
Classification Report:
               precision    recall  f1-score   support

Non-Repeater       0.11      0.99      0.20       150
    Repeater       1.00      0.23      0.37      1583

    accuracy                           0.29      1733
   macro avg       0.55      0.61      0.28      1733
weighted avg       0.92      0.29      0.35      1733

Confusion Matrix:
 [[ 149    1]
 [1225  358]]

=== Fold 5/5 ===
Validation Accuracy: 0.2506
Classification Report:
               precision    recall  f1-score   support

Non-Repeater       0.10      1.00      0.19       149
    Repeater       1.00      0.18      0.31      1583

    accuracy                           0.25      1732
   macro avg       0.55      0.59      0.25      1732
weighted avg       0.92      0.25      0.29      1732

Confusion Matrix:
 [[ 149    0]
 [1298  285]]


=== Summary ===
Total False Positives: 1
Total False Negatives: 5784
Total True Positives: 2132
Total True Negatives: 747

Confusion Matrix (with duplicates):
              Non-Repeater  Repeater
Non-Repeater         747.0       1.0
Repeater            5784.0    2132.0
accuracy_score
0.33229455216989845
Trial 1: hidden_dim=459, latent_dim=10, beta=0.7910468573559705, gamma=0.3125268387188753, dropout_rate=0.32413235031406185, lr=0.005054154887945127, scheduler_patience=4, class_weight=2.9893550713721995, activation=ELU, classification_multiplier=8963.224744486728

=== Fold 1/5 ===
Validation Accuracy: 0.0860
Classification Report:
               precision    recall  f1-score   support

Non-Repeater       0.09      1.00      0.16       149
    Repeater       0.00      0.00      0.00      1584

    accuracy                           0.09      1733
   macro avg       0.04      0.50      0.08      1733
weighted avg       0.01      0.09      0.01      1733

Confusion Matrix:
 [[ 149    0]
 [1584    0]]

=== Fold 2/5 ===
Validation Accuracy: 0.0866
Classification Report:
               precision    recall  f1-score   support

Non-Repeater       0.09      1.00      0.16       150
    Repeater       0.00      0.00      0.00      1583

    accuracy                           0.09      1733
   macro avg       0.04      0.50      0.08      1733
weighted avg       0.01      0.09      0.01      1733

Confusion Matrix:
 [[ 150    0]
 [1583    0]]

=== Fold 3/5 ===
Validation Accuracy: 0.0866
Classification Report:
               precision    recall  f1-score   support

Non-Repeater       0.09      1.00      0.16       150
    Repeater       0.00      0.00      0.00      1583

    accuracy                           0.09      1733
   macro avg       0.04      0.50      0.08      1733
weighted avg       0.01      0.09      0.01      1733

Confusion Matrix:
 [[ 150    0]
 [1583    0]]

=== Fold 4/5 ===
Validation Accuracy: 0.0866
Classification Report:
               precision    recall  f1-score   support

Non-Repeater       0.09      1.00      0.16       150
    Repeater       0.00      0.00      0.00      1583

    accuracy                           0.09      1733
   macro avg       0.04      0.50      0.08      1733
weighted avg       0.01      0.09      0.01      1733

Confusion Matrix:
 [[ 150    0]
 [1583    0]]

=== Fold 5/5 ===
Validation Accuracy: 0.0860
Classification Report:
               precision    recall  f1-score   support

Non-Repeater       0.09      1.00      0.16       149
    Repeater       0.00      0.00      0.00      1583

    accuracy                           0.09      1732
   macro avg       0.04      0.50      0.08      1732
weighted avg       0.01      0.09      0.01      1732

Confusion Matrix:
 [[ 149    0]
 [1583    0]]


=== Summary ===
Total False Positives: 0
Total False Negatives: 7916
Total True Positives: 0
Total True Negatives: 748

Confusion Matrix (with duplicates):
              Non-Repeater  Repeater
Non-Repeater         748.0       0.0
Repeater            7916.0       0.0
accuracy_score
0.08633425669436749
Trial 1: hidden_dim=1234, latent_dim=5, beta=0.5944485131186411, gamma=1.261727363677858, dropout_rate=0.2617017761980054, lr=0.0037840456576254677, scheduler_patience=7, class_weight=0.20503031764985336, activation=GELU, classification_multiplier=6427.510717163972

=== Fold 1/5 ===
Validation Accuracy: 0.6261
Classification Report:
               precision    recall  f1-score   support

Non-Repeater       0.18      0.98      0.31       149
    Repeater       1.00      0.59      0.74      1584

    accuracy                           0.63      1733
   macro avg       0.59      0.79      0.53      1733
weighted avg       0.93      0.63      0.71      1733

Confusion Matrix:
 [[146   3]
 [645 939]]

=== Fold 2/5 ===
Validation Accuracy: 0.5972
Classification Report:
               precision    recall  f1-score   support

Non-Repeater       0.18      0.99      0.30       150
    Repeater       1.00      0.56      0.72      1583

    accuracy                           0.60      1733
   macro avg       0.59      0.77      0.51      1733
weighted avg       0.93      0.60      0.68      1733

Confusion Matrix:
 [[148   2]
 [696 887]]

=== Fold 3/5 ===
Validation Accuracy: 0.6422
Classification Report:
               precision    recall  f1-score   support

Non-Repeater       0.19      0.99      0.32       150
    Repeater       1.00      0.61      0.76      1583

    accuracy                           0.64      1733
   macro avg       0.60      0.80      0.54      1733
weighted avg       0.93      0.64      0.72      1733

Confusion Matrix:
 [[149   1]
 [619 964]]

=== Fold 4/5 ===
Validation Accuracy: 0.6774
Classification Report:
               precision    recall  f1-score   support

Non-Repeater       0.21      0.99      0.35       150
    Repeater       1.00      0.65      0.79      1583

    accuracy                           0.68      1733
   macro avg       0.60      0.82      0.57      1733
weighted avg       0.93      0.68      0.75      1733

Confusion Matrix:
 [[ 149    1]
 [ 558 1025]]

=== Fold 5/5 ===
Validation Accuracy: 0.7073
Classification Report:
 [I 2025-06-12 04:46:11,135] Trial 11 finished with value: 0.6500461680517082 and parameters: {'hidden_dim': 1286, 'latent_dim': 24, 'beta': 1.4931150087739244, 'gamma': 1.9897678554919398, 'dropout_rate': 0.22869683259983714, 'lr': 0.0026416802544788486, 'scheduler_patience': 6, 'class_weight': 2.9742827039732487, 'activation': 'ReLU', 'classification_multiplier': 14712.626380875165}. Best is trial 11 with value: 0.6500461680517082.
[I 2025-06-12 04:52:13,680] Trial 12 finished with value: 0.6759002770083102 and parameters: {'hidden_dim': 1162, 'latent_dim': 27, 'beta': 1.8323478754439901, 'gamma': 1.977818247013261, 'dropout_rate': 0.2601635010919888, 'lr': 0.0004696073081040205, 'scheduler_patience': 6, 'class_weight': 2.9420116624344637, 'activation': 'ReLU', 'classification_multiplier': 12544.993165883709}. Best is trial 12 with value: 0.6759002770083102.
[I 2025-06-12 04:58:23,879] Trial 13 finished with value: 0.5691366574330563 and parameters: {'hidden_dim': 1238, 'latent_dim': 28, 'beta': 1.9411102021731959, 'gamma': 1.9924091595290503, 'dropout_rate': 0.26791859392538786, 'lr': 0.0002572743218690011, 'scheduler_patience': 6, 'class_weight': 2.3055259339274725, 'activation': 'ReLU', 'classification_multiplier': 14890.503198362447}. Best is trial 12 with value: 0.6759002770083102.
              precision    recall  f1-score   support

Non-Repeater       0.23      0.99      0.37       149
    Repeater       1.00      0.68      0.81      1583

    accuracy                           0.71      1732
   macro avg       0.61      0.84      0.59      1732
weighted avg       0.93      0.71      0.77      1732

Confusion Matrix:
 [[ 148    1]
 [ 506 1077]]


=== Summary ===
Total False Positives: 8
Total False Negatives: 3024
Total True Positives: 4892
Total True Negatives: 740

Confusion Matrix (with duplicates):
              Non-Repeater  Repeater
Non-Repeater         740.0       8.0
Repeater            3024.0    4892.0
accuracy_score
0.6500461680517082
Trial 1: hidden_dim=1286, latent_dim=24, beta=1.4931150087739244, gamma=1.9897678554919398, dropout_rate=0.22869683259983714, lr=0.0026416802544788486, scheduler_patience=6, class_weight=2.9742827039732487, activation=ReLU, classification_multiplier=14712.626380875165

=== Fold 1/5 ===
Validation Accuracy: 0.6832
Classification Report:
               precision    recall  f1-score   support

Non-Repeater       0.21      1.00      0.35       149
    Repeater       1.00      0.65      0.79      1584

    accuracy                           0.68      1733
   macro avg       0.61      0.83      0.57      1733
weighted avg       0.93      0.68      0.75      1733

Confusion Matrix:
 [[ 149    0]
 [ 549 1035]]

=== Fold 2/5 ===
Validation Accuracy: 0.6174
Classification Report:
               precision    recall  f1-score   support

Non-Repeater       0.18      0.99      0.31       150
    Repeater       1.00      0.58      0.74      1583

    accuracy                           0.62      1733
   macro avg       0.59      0.79      0.52      1733
weighted avg       0.93      0.62      0.70      1733

Confusion Matrix:
 [[149   1]
 [662 921]]

=== Fold 3/5 ===
Validation Accuracy: 0.7190
Classification Report:
               precision    recall  f1-score   support

Non-Repeater       0.23      0.99      0.38       150
    Repeater       1.00      0.69      0.82      1583

    accuracy                           0.72      1733
   macro avg       0.62      0.84      0.60      1733
weighted avg       0.93      0.72      0.78      1733

Confusion Matrix:
 [[ 149    1]
 [ 486 1097]]

=== Fold 4/5 ===
Validation Accuracy: 0.6013
Classification Report:
               precision    recall  f1-score   support

Non-Repeater       0.18      0.99      0.30       150
    Repeater       1.00      0.56      0.72      1583

    accuracy                           0.60      1733
   macro avg       0.59      0.78      0.51      1733
weighted avg       0.93      0.60      0.68      1733

Confusion Matrix:
 [[148   2]
 [689 894]]

=== Fold 5/5 ===
Validation Accuracy: 0.7587
Classification Report:
               precision    recall  f1-score   support

Non-Repeater       0.26      0.97      0.41       149
    Repeater       1.00      0.74      0.85      1583

    accuracy                           0.76      1732
   macro avg       0.63      0.86      0.63      1732
weighted avg       0.93      0.76      0.81      1732

Confusion Matrix:
 [[ 145    4]
 [ 414 1169]]


=== Summary ===
Total False Positives: 8
Total False Negatives: 2800
Total True Positives: 5116
Total True Negatives: 740

Confusion Matrix (with duplicates):
              Non-Repeater  Repeater
Non-Repeater         740.0       8.0
Repeater            2800.0    5116.0
accuracy_score
0.6759002770083102
Trial 1: hidden_dim=1162, latent_dim=27, beta=1.8323478754439901, gamma=1.977818247013261, dropout_rate=0.2601635010919888, lr=0.0004696073081040205, scheduler_patience=6, class_weight=2.9420116624344637, activation=ReLU, classification_multiplier=12544.993165883709

=== Fold 1/5 ===
Validation Accuracy: 0.6036
Classification Report:
               precision    recall  f1-score   support

Non-Repeater       0.18      1.00      0.30       149
    Repeater       1.00      0.57      0.72      1584

    accuracy                           0.60      1733
   macro avg       0.59      0.78      0.51      1733
weighted avg       0.93      0.60      0.69      1733

Confusion Matrix:
 [[149   0]
 [687 897]]

=== Fold 2/5 ===
Validation Accuracy: 0.5384
Classification Report:
               precision    recall  f1-score   support

Non-Repeater       0.16      0.99      0.27       150
    Repeater       1.00      0.50      0.66      1583

    accuracy                           0.54      1733
   macro avg       0.58      0.74      0.47      1733
weighted avg       0.93      0.54      0.63      1733

Confusion Matrix:
 [[149   1]
 [799 784]]

=== Fold 3/5 ===
Validation Accuracy: 0.5309
Classification Report:
               precision    recall  f1-score   support

Non-Repeater       0.16      0.99      0.27       150
    Repeater       1.00      0.49      0.65      1583

    accuracy                           0.53      1733
   macro avg       0.58      0.74      0.46      1733
weighted avg       0.93      0.53      0.62      1733

Confusion Matrix:
 [[149   1]
 [812 771]]

=== Fold 4/5 ===
Validation Accuracy: 0.5880
Classification Report:
               precision    recall  f1-score   support

Non-Repeater       0.17      0.99      0.29       150
    Repeater       1.00      0.55      0.71      1583

    accuracy                           0.59      1733
   macro avg       0.59      0.77      0.50      1733
weighted avg       0.93      0.59      0.67      1733

Confusion Matrix:
 [[149   1]
 [713 870]]

=== Fold 5/5 ===
Validation Accuracy: 0.5849
Classification Report:
               precision    recall  f1-score   support

Non-Repeater       0.17      0.98      0.29       149
    Repeater       1.00      0.55      0.71      1583

    accuracy                           0.58      1732
   macro avg       0.58      0.76      0.50      1732
weighted avg       0.93      0.58      0.67      1732

Confusion Matrix:
 [[146   3]
 [716 867]]


=== Summary ===
Total False Positives: 6
Total False Negatives: 3727
Total True Positives: 4189
Total True Negatives: 742

Confusion Matrix (with duplicates):
              Non-Repeater  Repeater
Non-Repeater         742.0       6.0
Repeater            3727.0    4189.0
accuracy_score
0.5691366574330563
Trial 1: hidden_dim=1238, latent_dim=28, beta=1.9411102021731959, gamma=1.9924091595290503, dropout_rate=0.26791859392538786, lr=0.0002572743218690011, scheduler_patience=6, class_weight=2.3055259339274725, activation=ReLU, classification_multiplier=14890.503198362447

=== Fold 1/5 ===
Validation Accuracy: 0.6601
Classification Report:
               precision    recall  f1-score   support

Non-Repeater       0.20      0.99      0.33       149
    Repeater       1.00      0.63      0.77      1584

    accuracy                           0.66      1733
   macro avg       0.60      0.81      0.55      1733
weighted avg       0.93      0.66      0.73      1733

Confusion Matrix:
 [[148   1]
 [588 996]]

=== Fold 2/5 ===
Validation Accuracy: 0.6734
Classification Report:
               precision    recall  f1-score   support

Non-Repeater       0.21      0.99      0.34       150
    Repeater       1.00      0.64      0.78      1583

    accuracy                           0.67      1733
   macro avg       0.60      0.82      0.56      1733
weighted avg       0.93      0.67      0.74      1733

Confusion Matrix:
 [[ 149    1]
 [ 565 1018]]

=== Fold 3/5 ===
Validation Accuracy: 0.6163
Classification Report:
               precision    recall  f1-score   support

Non-Repeater       0.18      0.99      0.31       150
    Repeater       1.00      0.58      0.73      1583

    accuracy                           0.62      1733
   macro avg       0.59      0.79      0.52      1733
weighted avg       0.93      0.62      0.70      1733

Confusion Matrix:
 [[149   1]
 [664 919]]

=== Fold 4/5 ===
Validation Accuracy: 0.6353
Classification Report:
 [I 2025-06-12 05:04:14,521] Trial 14 finished with value: 0.6603185595567868 and parameters: {'hidden_dim': 1013, 'latent_dim': 31, 'beta': 1.559182989935458, 'gamma': 1.4336190689412405, 'dropout_rate': 0.24636249052800172, 'lr': 0.002216001306794945, 'scheduler_patience': 7, 'class_weight': 2.6219499673994537, 'activation': 'ReLU', 'classification_multiplier': 12616.878807530336}. Best is trial 12 with value: 0.6759002770083102.
