[I 2025-06-12 23:06:19,818] Trial 191 finished with value: 0.7393813481071099 and parameters: {'hidden_dim': 1487, 'latent_dim': 32, 'beta': 1.4875695142772125, 'gamma': 0.15738782293916498, 'dropout_rate': 0.11985927000614212, 'lr': 0.00044502233088232853, 'scheduler_patience': 7, 'class_weight': 2.7765195983204007, 'activation': 'ReLU', 'classification_multiplier': 14976.824821105522}. Best is trial 173 with value: 0.8084025854108957.
              precision    recall  f1-score   support

Non-Repeater       0.23      0.98      0.37       149
    Repeater       1.00      0.69      0.81      1583

    accuracy                           0.71      1732
   macro avg       0.61      0.83      0.59      1732
weighted avg       0.93      0.71      0.78      1732

Confusion Matrix:
 [[ 146    3]
 [ 493 1090]]


=== Summary ===
Total False Positives: 6
Total False Negatives: 3362
Total True Positives: 4554
Total True Negatives: 742

Confusion Matrix (with duplicates):
              Non-Repeater  Repeater
Non-Repeater         742.0       6.0
Repeater            3362.0    4554.0
accuracy_score
0.6112650046168052
Trial 1: hidden_dim=1648, latent_dim=33, beta=1.4543582275070928, gamma=0.10155473236646662, dropout_rate=0.1373589713985159, lr=0.0007998536099318958, scheduler_patience=7, class_weight=2.8722045953602637, activation=LeakyReLU, classification_multiplier=12528.88692058453

=== Fold 1/5 ===
Validation Accuracy: 0.6751
Classification Report:
               precision    recall  f1-score   support

Non-Repeater       0.21      0.99      0.34       149
    Repeater       1.00      0.65      0.78      1584

    accuracy                           0.68      1733
   macro avg       0.60      0.82      0.56      1733
weighted avg       0.93      0.68      0.75      1733

Confusion Matrix:
 [[ 148    1]
 [ 562 1022]]

=== Fold 2/5 ===
Validation Accuracy: 0.6469
Classification Report:
               precision    recall  f1-score   support

Non-Repeater       0.20      0.99      0.33       150
    Repeater       1.00      0.61      0.76      1583

    accuracy                           0.65      1733
   macro avg       0.60      0.80      0.54      1733
weighted avg       0.93      0.65      0.72      1733

Confusion Matrix:
 [[149   1]
 [611 972]]

=== Fold 3/5 ===
Validation Accuracy: 0.6590
Classification Report:
               precision    recall  f1-score   support

Non-Repeater       0.20      0.99      0.34       150
    Repeater       1.00      0.63      0.77      1583

    accuracy                           0.66      1733
   macro avg       0.60      0.81      0.55      1733
weighted avg       0.93      0.66      0.73      1733

Confusion Matrix:
 [[149   1]
 [590 993]]

=== Fold 4/5 ===
Validation Accuracy: 0.6694
Classification Report:
               precision    recall  f1-score   support

Non-Repeater       0.21      0.98      0.34       150
    Repeater       1.00      0.64      0.78      1583

    accuracy                           0.67      1733
   macro avg       0.60      0.81      0.56      1733
weighted avg       0.93      0.67      0.74      1733

Confusion Matrix:
 [[ 147    3]
 [ 570 1013]]

=== Fold 5/5 ===
Validation Accuracy: 0.8643
Classification Report:
               precision    recall  f1-score   support

Non-Repeater       0.39      0.97      0.55       149
    Repeater       1.00      0.85      0.92      1583

    accuracy                           0.86      1732
   macro avg       0.69      0.91      0.74      1732
weighted avg       0.94      0.86      0.89      1732

Confusion Matrix:
 [[ 144    5]
 [ 230 1353]]


=== Summary ===
Total False Positives: 11
Total False Negatives: 2563
Total True Positives: 5353
Total True Negatives: 737

Confusion Matrix (with duplicates):
              Non-Repeater  Repeater
Non-Repeater         737.0      11.0
Repeater            2563.0    5353.0
accuracy_score
0.7029085872576177
Trial 1: hidden_dim=1437, latent_dim=34, beta=1.5779498409457962, gamma=0.21188308647544635, dropout_rate=0.10743182628781625, lr=0.0004664523659155559, scheduler_patience=3, class_weight=2.657895956449127, activation=ReLU, classification_multiplier=12799.975252153028

=== Fold 1/5 ===
Validation Accuracy: 0.7132
Classification Report:
               precision    recall  f1-score   support

Non-Repeater       0.23      0.99      0.37       149
    Repeater       1.00      0.69      0.81      1584

    accuracy                           0.71      1733
   macro avg       0.61      0.84      0.59      1733
weighted avg       0.93      0.71      0.78      1733

Confusion Matrix:
 [[ 147    2]
 [ 495 1089]]

=== Fold 2/5 ===
Validation Accuracy: 0.7513
Classification Report:
               precision    recall  f1-score   support

Non-Repeater       0.26      0.99      0.41       150
    Repeater       1.00      0.73      0.84      1583

    accuracy                           0.75      1733
   macro avg       0.63      0.86      0.63      1733
weighted avg       0.93      0.75      0.80      1733

Confusion Matrix:
 [[ 149    1]
 [ 430 1153]]

=== Fold 3/5 ===
Validation Accuracy: 0.7553
Classification Report:
               precision    recall  f1-score   support

Non-Repeater       0.26      0.99      0.41       150
    Repeater       1.00      0.73      0.85      1583

    accuracy                           0.76      1733
   macro avg       0.63      0.86      0.63      1733
weighted avg       0.94      0.76      0.81      1733

Confusion Matrix:
 [[ 149    1]
 [ 423 1160]]

=== Fold 4/5 ===
Validation Accuracy: 0.6919
Classification Report:
               precision    recall  f1-score   support

Non-Repeater       0.22      0.98      0.36       150
    Repeater       1.00      0.66      0.80      1583

    accuracy                           0.69      1733
   macro avg       0.61      0.82      0.58      1733
weighted avg       0.93      0.69      0.76      1733

Confusion Matrix:
 [[ 147    3]
 [ 531 1052]]

=== Fold 5/5 ===
Validation Accuracy: 0.7852
Classification Report:
               precision    recall  f1-score   support

Non-Repeater       0.28      0.97      0.44       149
    Repeater       1.00      0.77      0.87      1583

    accuracy                           0.79      1732
   macro avg       0.64      0.87      0.65      1732
weighted avg       0.94      0.79      0.83      1732

Confusion Matrix:
 [[ 145    4]
 [ 368 1215]]


=== Summary ===
Total False Positives: 11
Total False Negatives: 2247
Total True Positives: 5669
Total True Negatives: 737

Confusion Matrix (with duplicates):
              Non-Repeater  Repeater
Non-Repeater         737.0      11.0
Repeater            2247.0    5669.0
accuracy_score
0.7393813481071099
Trial 1: hidden_dim=1487, latent_dim=32, beta=1.4875695142772125, gamma=0.15738782293916498, dropout_rate=0.11985927000614212, lr=0.00044502233088232853, scheduler_patience=7, class_weight=2.7765195983204007, activation=ReLU, classification_multiplier=14976.824821105522

=== Fold 1/5 ===
Validation Accuracy: 0.6844
Classification Report:
               precision    recall  f1-score   support

Non-Repeater       0.21      0.99      0.35       149
    Repeater       1.00      0.66      0.79      1584

    accuracy                           0.68      1733
   macro avg       0.61      0.82      0.57      1733
weighted avg       0.93      0.68      0.75      1733

Confusion Matrix:
 [[ 148    1]
 [ 546 1038]]

=== Fold 2/5 ===
Validation Accuracy: 0.7692
Classification Report:
               precision    recall  f1-score   support

Non-Repeater       0.27      0.99      0.43       150
    Repeater       1.00      0.75      0.86      1583

    accuracy                           0.77      1733
   macro avg       0.63      0.87      0.64      1733
weighted avg       0.94      0.77      0.82      1733

Confusion Matrix:
 [[ 148    2]
 [ 398 1185]]

=== Fold 3/5 ===
Validation Accuracy: 0.8938
Classification Report:
               precision    recall  f1-score   support

Non-Repeater       0.44      0.89      0.59       150
    Repeater       0.99      0.89      0.94      1583

    accuracy                           0.89      1733
   macro avg       0.72      0.89      0.77      1733
weighted avg       0.94      0.89      0.91      1733

Confusion Matrix:
 [[ 134   16]
 [ 168 1415]]

=== Fold 4/5 ===
Validation Accuracy: 0.7005
Classification Report:
 [I 2025-06-12 23:12:46,468] Trial 192 finished with value: 0.7639658356417359 and parameters: {'hidden_dim': 1403, 'latent_dim': 31, 'beta': 1.3209261275365058, 'gamma': 0.10141089867754285, 'dropout_rate': 0.13011983002389935, 'lr': 0.0007116555070043982, 'scheduler_patience': 7, 'class_weight': 2.8162116319080606, 'activation': 'ReLU', 'classification_multiplier': 13330.413870176997}. Best is trial 173 with value: 0.8084025854108957.
[I 2025-06-12 23:19:12,950] Trial 193 finished with value: 0.7644275161588181 and parameters: {'hidden_dim': 1393, 'latent_dim': 31, 'beta': 1.3286501333836662, 'gamma': 0.1020005903386435, 'dropout_rate': 0.13809867335802445, 'lr': 0.0006561115773641214, 'scheduler_patience': 7, 'class_weight': 2.818675696715635, 'activation': 'ReLU', 'classification_multiplier': 13342.811135531269}. Best is trial 173 with value: 0.8084025854108957.
[I 2025-06-12 23:25:38,811] Trial 194 finished with value: 0.8103647276084949 and parameters: {'hidden_dim': 1394, 'latent_dim': 30, 'beta': 1.6708799549669873, 'gamma': 0.10712137840125721, 'dropout_rate': 0.13410777173833485, 'lr': 0.0007823595009243365, 'scheduler_patience': 7, 'class_weight': 2.8173112753568104, 'activation': 'ReLU', 'classification_multiplier': 13272.090842999432}. Best is trial 194 with value: 0.8103647276084949.
              precision    recall  f1-score   support

Non-Repeater       0.22      0.99      0.36       150
    Repeater       1.00      0.67      0.80      1583

    accuracy                           0.70      1733
   macro avg       0.61      0.83      0.58      1733
weighted avg       0.93      0.70      0.77      1733

Confusion Matrix:
 [[ 148    2]
 [ 517 1066]]

=== Fold 5/5 ===
Validation Accuracy: 0.7719
Classification Report:
               precision    recall  f1-score   support

Non-Repeater       0.27      0.97      0.42       149
    Repeater       1.00      0.75      0.86      1583

    accuracy                           0.77      1732
   macro avg       0.63      0.86      0.64      1732
weighted avg       0.93      0.77      0.82      1732

Confusion Matrix:
 [[ 145    4]
 [ 391 1192]]


=== Summary ===
Total False Positives: 25
Total False Negatives: 2020
Total True Positives: 5896
Total True Negatives: 723

Confusion Matrix (with duplicates):
              Non-Repeater  Repeater
Non-Repeater         723.0      25.0
Repeater            2020.0    5896.0
accuracy_score
0.7639658356417359
Trial 1: hidden_dim=1403, latent_dim=31, beta=1.3209261275365058, gamma=0.10141089867754285, dropout_rate=0.13011983002389935, lr=0.0007116555070043982, scheduler_patience=7, class_weight=2.8162116319080606, activation=ReLU, classification_multiplier=13330.413870176997

=== Fold 1/5 ===
Validation Accuracy: 0.8771
Classification Report:
               precision    recall  f1-score   support

Non-Repeater       0.40      0.89      0.56       149
    Repeater       0.99      0.88      0.93      1584

    accuracy                           0.88      1733
   macro avg       0.70      0.88      0.74      1733
weighted avg       0.94      0.88      0.90      1733

Confusion Matrix:
 [[ 133   16]
 [ 197 1387]]

=== Fold 2/5 ===
Validation Accuracy: 0.7173
Classification Report:
               precision    recall  f1-score   support

Non-Repeater       0.23      0.99      0.38       150
    Repeater       1.00      0.69      0.82      1583

    accuracy                           0.72      1733
   macro avg       0.62      0.84      0.60      1733
weighted avg       0.93      0.72      0.78      1733

Confusion Matrix:
 [[ 149    1]
 [ 489 1094]]

=== Fold 3/5 ===
Validation Accuracy: 0.6665
Classification Report:
               precision    recall  f1-score   support

Non-Repeater       0.21      0.99      0.34       150
    Repeater       1.00      0.64      0.78      1583

    accuracy                           0.67      1733
   macro avg       0.60      0.81      0.56      1733
weighted avg       0.93      0.67      0.74      1733

Confusion Matrix:
 [[ 149    1]
 [ 577 1006]]

=== Fold 4/5 ===
Validation Accuracy: 0.7830
Classification Report:
               precision    recall  f1-score   support

Non-Repeater       0.28      0.99      0.44       150
    Repeater       1.00      0.76      0.87      1583

    accuracy                           0.78      1733
   macro avg       0.64      0.88      0.65      1733
weighted avg       0.94      0.78      0.83      1733

Confusion Matrix:
 [[ 148    2]
 [ 374 1209]]

=== Fold 5/5 ===
Validation Accuracy: 0.7783
Classification Report:
               precision    recall  f1-score   support

Non-Repeater       0.28      0.97      0.43       149
    Repeater       1.00      0.76      0.86      1583

    accuracy                           0.78      1732
   macro avg       0.64      0.87      0.65      1732
weighted avg       0.93      0.78      0.83      1732

Confusion Matrix:
 [[ 145    4]
 [ 380 1203]]


=== Summary ===
Total False Positives: 24
Total False Negatives: 2017
Total True Positives: 5899
Total True Negatives: 724

Confusion Matrix (with duplicates):
              Non-Repeater  Repeater
Non-Repeater         724.0      24.0
Repeater            2017.0    5899.0
accuracy_score
0.7644275161588181
Trial 1: hidden_dim=1393, latent_dim=31, beta=1.3286501333836662, gamma=0.1020005903386435, dropout_rate=0.13809867335802445, lr=0.0006561115773641214, scheduler_patience=7, class_weight=2.818675696715635, activation=ReLU, classification_multiplier=13342.811135531269

=== Fold 1/5 ===
Validation Accuracy: 0.8788
Classification Report:
               precision    recall  f1-score   support

Non-Repeater       0.41      0.96      0.58       149
    Repeater       1.00      0.87      0.93      1584

    accuracy                           0.88      1733
   macro avg       0.70      0.92      0.75      1733
weighted avg       0.95      0.88      0.90      1733

Confusion Matrix:
 [[ 143    6]
 [ 204 1380]]

=== Fold 2/5 ===
Validation Accuracy: 0.7819
Classification Report:
               precision    recall  f1-score   support

Non-Repeater       0.28      0.99      0.44       150
    Repeater       1.00      0.76      0.86      1583

    accuracy                           0.78      1733
   macro avg       0.64      0.88      0.65      1733
weighted avg       0.94      0.78      0.83      1733

Confusion Matrix:
 [[ 149    1]
 [ 377 1206]]

=== Fold 3/5 ===
Validation Accuracy: 0.8621
Classification Report:
               precision    recall  f1-score   support

Non-Repeater       0.38      0.98      0.55       150
    Repeater       1.00      0.85      0.92      1583

    accuracy                           0.86      1733
   macro avg       0.69      0.92      0.74      1733
weighted avg       0.94      0.86      0.89      1733

Confusion Matrix:
 [[ 147    3]
 [ 236 1347]]

=== Fold 4/5 ===
Validation Accuracy: 0.6353
Classification Report:
               precision    recall  f1-score   support

Non-Repeater       0.19      0.99      0.32       150
    Repeater       1.00      0.60      0.75      1583

    accuracy                           0.64      1733
   macro avg       0.59      0.80      0.54      1733
weighted avg       0.93      0.64      0.71      1733

Confusion Matrix:
 [[149   1]
 [631 952]]

=== Fold 5/5 ===
Validation Accuracy: 0.8938
Classification Report:
               precision    recall  f1-score   support

Non-Repeater       0.45      0.95      0.61       149
    Repeater       1.00      0.89      0.94      1583

    accuracy                           0.89      1732
   macro avg       0.72      0.92      0.77      1732
weighted avg       0.95      0.89      0.91      1732

Confusion Matrix:
 [[ 142    7]
 [ 177 1406]]


=== Summary ===
Total False Positives: 18
Total False Negatives: 1625
Total True Positives: 6291
Total True Negatives: 730

Confusion Matrix (with duplicates):
              Non-Repeater  Repeater
Non-Repeater         730.0      18.0
Repeater            1625.0    6291.0
accuracy_score
0.8103647276084949
Trial 1: hidden_dim=1394, latent_dim=30, beta=1.6708799549669873, gamma=0.10712137840125721, dropout_rate=0.13410777173833485, lr=0.0007823595009243365, scheduler_patience=7, class_weight=2.8173112753568104, activation=ReLU, classification_multiplier=13272.090842999432

=== Fold 1/5 ===
Validation Accuracy: 0.8690
Classification Report:
               precision    recall  f1-score   support

Non-Repeater       0.39      0.95      0.56       149
    Repeater       0.99      0.86      0.92      1584

    accuracy                           0.87      1733
   macro avg       0.69      0.91      0.74      1733
weighted avg       0.94      0.87      0.89      1733

Confusion Matrix:
 [[ 142    7]
 [ 220 1364]]

=== Fold 2/5 ===
Validation Accuracy: 0.6896
Classification Report:
               precision    recall  f1-score   support

Non-Repeater       0.22      0.99      0.36       150
    Repeater       1.00      0.66      0.80      1583

    accuracy                           0.69      1733
   macro avg       0.61      0.83      0.58      1733
weighted avg       0.93      0.69      0.76      1733

Confusion Matrix:
 [[ 149    1]
 [ 537 1046]]

=== Fold 3/5 ===
Validation Accuracy: 0.7311
Classification Report:
 [I 2025-06-12 23:32:04,182] Trial 195 finished with value: 0.7509233610341643 and parameters: {'hidden_dim': 1400, 'latent_dim': 29, 'beta': 1.7389906077829262, 'gamma': 0.10103630475482075, 'dropout_rate': 0.13763132605921968, 'lr': 0.0008571378121308146, 'scheduler_patience': 7, 'class_weight': 2.83360184506973, 'activation': 'ReLU', 'classification_multiplier': 13363.843235453649}. Best is trial 194 with value: 0.8103647276084949.
[I 2025-06-12 23:38:35,742] Trial 196 finished with value: 0.7495383194829178 and parameters: {'hidden_dim': 1441, 'latent_dim': 30, 'beta': 1.3295842307283559, 'gamma': 0.10006797001858238, 'dropout_rate': 0.12971069842576072, 'lr': 0.0007099109888556801, 'scheduler_patience': 7, 'class_weight': 2.8036310387980063, 'activation': 'ReLU', 'classification_multiplier': 13188.923242539231}. Best is trial 194 with value: 0.8103647276084949.
