[I 2025-06-12 10:25:17,580] Trial 68 finished with value: 0.6711680517082179 and parameters: {'hidden_dim': 675, 'latent_dim': 17, 'beta': 0.7922247682586989, 'gamma': 1.0181213970962906, 'dropout_rate': 0.13162949640073643, 'lr': 0.0013195782288263126, 'scheduler_patience': 6, 'class_weight': 1.9584523457934044, 'activation': 'ReLU', 'classification_multiplier': 6297.629046462917}. Best is trial 63 with value: 0.7299168975069252.
/home/ubuntu/frb-analysis/.frb-analysis/lib/python3.12/site-packages/sklearn/metrics/_classification.py:1565: UndefinedMetricWarning: Precision is ill-defined and being set to 0.0 in labels with no predicted samples. Use `zero_division` parameter to control this behavior.
  _warn_prf(average, modifier, f"{metric.capitalize()} is", len(result))
/home/ubuntu/frb-analysis/.frb-analysis/lib/python3.12/site-packages/sklearn/metrics/_classification.py:1565: UndefinedMetricWarning: Precision is ill-defined and being set to 0.0 in labels with no predicted samples. Use `zero_division` parameter to control this behavior.
  _warn_prf(average, modifier, f"{metric.capitalize()} is", len(result))
/home/ubuntu/frb-analysis/.frb-analysis/lib/python3.12/site-packages/sklearn/metrics/_classification.py:1565: UndefinedMetricWarning: Precision is ill-defined and being set to 0.0 in labels with no predicted samples. Use `zero_division` parameter to control this behavior.
  _warn_prf(average, modifier, f"{metric.capitalize()} is", len(result))
              precision    recall  f1-score   support

Non-Repeater       0.12      0.99      0.21       150
    Repeater       1.00      0.29      0.45      1583

    accuracy                           0.35      1733
   macro avg       0.56      0.64      0.33      1733
weighted avg       0.92      0.35      0.43      1733

Confusion Matrix:
 [[ 149    1]
 [1129  454]]

=== Fold 3/5 ===
Validation Accuracy: 0.3549
Classification Report:
               precision    recall  f1-score   support

Non-Repeater       0.12      0.99      0.21       150
    Repeater       1.00      0.29      0.45      1583

    accuracy                           0.35      1733
   macro avg       0.56      0.64      0.33      1733
weighted avg       0.92      0.35      0.43      1733

Confusion Matrix:
 [[ 149    1]
 [1117  466]]

=== Fold 4/5 ===
Validation Accuracy: 0.2198
Classification Report:
               precision    recall  f1-score   support

Non-Repeater       0.10      0.99      0.18       150
    Repeater       0.99      0.15      0.26      1583

    accuracy                           0.22      1733
   macro avg       0.55      0.57      0.22      1733
weighted avg       0.91      0.22      0.25      1733

Confusion Matrix:
 [[ 148    2]
 [1350  233]]

=== Fold 5/5 ===
Validation Accuracy: 0.2610
Classification Report:
               precision    recall  f1-score   support

Non-Repeater       0.10      1.00      0.19       149
    Repeater       1.00      0.19      0.32      1583

    accuracy                           0.26      1732
   macro avg       0.55      0.60      0.26      1732
weighted avg       0.92      0.26      0.31      1732

Confusion Matrix:
 [[ 149    0]
 [1280  303]]


=== Summary ===
Total False Positives: 4
Total False Negatives: 6177
Total True Positives: 1739
Total True Negatives: 744

Confusion Matrix (with duplicates):
              Non-Repeater  Repeater
Non-Repeater         744.0       4.0
Repeater            6177.0    1739.0
accuracy_score
0.2865881809787627
Trial 1: hidden_dim=872, latent_dim=8, beta=1.2045400721723933, gamma=0.48036488925239956, dropout_rate=0.11665042256202508, lr=0.001081703970263146, scheduler_patience=5, class_weight=1.802365588095424, activation=SELU, classification_multiplier=5550.032816031893

=== Fold 1/5 ===
Validation Accuracy: 0.6515
Classification Report:
               precision    recall  f1-score   support

Non-Repeater       0.20      0.99      0.33       149
    Repeater       1.00      0.62      0.76      1584

    accuracy                           0.65      1733
   macro avg       0.60      0.81      0.55      1733
weighted avg       0.93      0.65      0.73      1733

Confusion Matrix:
 [[148   1]
 [603 981]]

=== Fold 2/5 ===
Validation Accuracy: 0.2816
Classification Report:
               precision    recall  f1-score   support

Non-Repeater       0.11      1.00      0.19       150
    Repeater       1.00      0.21      0.35      1583

    accuracy                           0.28      1733
   macro avg       0.55      0.61      0.27      1733
weighted avg       0.92      0.28      0.34      1733

Confusion Matrix:
 [[ 150    0]
 [1245  338]]

=== Fold 3/5 ===
Validation Accuracy: 0.4120
Classification Report:
               precision    recall  f1-score   support

Non-Repeater       0.13      1.00      0.23       150
    Repeater       1.00      0.36      0.53      1583

    accuracy                           0.41      1733
   macro avg       0.56      0.68      0.38      1733
weighted avg       0.92      0.41      0.50      1733

Confusion Matrix:
 [[ 150    0]
 [1019  564]]

=== Fold 4/5 ===
Validation Accuracy: 0.4795
Classification Report:
               precision    recall  f1-score   support

Non-Repeater       0.14      0.99      0.25       150
    Repeater       1.00      0.43      0.60      1583

    accuracy                           0.48      1733
   macro avg       0.57      0.71      0.42      1733
weighted avg       0.92      0.48      0.57      1733

Confusion Matrix:
 [[148   2]
 [900 683]]

=== Fold 5/5 ===
Validation Accuracy: 0.7471
Classification Report:
               precision    recall  f1-score   support

Non-Repeater       0.25      0.99      0.40       149
    Repeater       1.00      0.72      0.84      1583

    accuracy                           0.75      1732
   macro avg       0.63      0.86      0.62      1732
weighted avg       0.93      0.75      0.80      1732

Confusion Matrix:
 [[ 148    1]
 [ 437 1146]]


=== Summary ===
Total False Positives: 4
Total False Negatives: 4204
Total True Positives: 3712
Total True Negatives: 744

Confusion Matrix (with duplicates):
              Non-Repeater  Repeater
Non-Repeater         744.0       4.0
Repeater            4204.0    3712.0
accuracy_score
0.5143120960295475
Trial 1: hidden_dim=1289, latent_dim=12, beta=0.8897300494126432, gamma=0.10278011840916501, dropout_rate=0.18865300655814782, lr=0.001920673752317958, scheduler_patience=7, class_weight=1.4735206482256784, activation=ReLU, classification_multiplier=5022.44939052459

=== Fold 1/5 ===
Validation Accuracy: 0.4709
Classification Report:
               precision    recall  f1-score   support

Non-Repeater       0.14      0.99      0.24       149
    Repeater       1.00      0.42      0.59      1584

    accuracy                           0.47      1733
   macro avg       0.57      0.71      0.42      1733
weighted avg       0.92      0.47      0.56      1733

Confusion Matrix:
 [[148   1]
 [916 668]]

=== Fold 2/5 ===
Validation Accuracy: 0.6994
Classification Report:
               precision    recall  f1-score   support

Non-Repeater       0.22      0.99      0.36       150
    Repeater       1.00      0.67      0.80      1583

    accuracy                           0.70      1733
   macro avg       0.61      0.83      0.58      1733
weighted avg       0.93      0.70      0.77      1733

Confusion Matrix:
 [[ 149    1]
 [ 520 1063]]

=== Fold 3/5 ===
Validation Accuracy: 0.6734
Classification Report:
               precision    recall  f1-score   support

Non-Repeater       0.21      0.99      0.34       150
    Repeater       1.00      0.64      0.78      1583

    accuracy                           0.67      1733
   macro avg       0.60      0.82      0.56      1733
weighted avg       0.93      0.67      0.74      1733

Confusion Matrix:
 [[ 149    1]
 [ 565 1018]]

=== Fold 4/5 ===
Validation Accuracy: 0.6676
Classification Report:
               precision    recall  f1-score   support

Non-Repeater       0.20      0.97      0.34       150
    Repeater       1.00      0.64      0.78      1583

    accuracy                           0.67      1733
   macro avg       0.60      0.81      0.56      1733
weighted avg       0.93      0.67      0.74      1733

Confusion Matrix:
 [[ 146    4]
 [ 572 1011]]

=== Fold 5/5 ===
Validation Accuracy: 0.8447
Classification Report:
               precision    recall  f1-score   support

Non-Repeater       0.35      0.97      0.52       149
    Repeater       1.00      0.83      0.91      1583

    accuracy                           0.84      1732
   macro avg       0.67      0.90      0.71      1732
weighted avg       0.94      0.84      0.87      1732

Confusion Matrix:
 [[ 144    5]
 [ 264 1319]]


=== Summary ===
Total False Positives: 12
Total False Negatives: 2837
Total True Positives: 5079
Total True Negatives: 736

Confusion Matrix (with duplicates):
              Non-Repeater  Repeater
Non-Repeater         736.0      12.0
Repeater            2837.0    5079.0
accuracy_score
0.6711680517082179
Trial 1: hidden_dim=675, latent_dim=17, beta=0.7922247682586989, gamma=1.0181213970962906, dropout_rate=0.13162949640073643, lr=0.0013195782288263126, scheduler_patience=6, class_weight=1.9584523457934044, activation=ReLU, classification_multiplier=6297.629046462917

=== Fold 1/5 ===
Validation Accuracy: 0.0860
Classification Report:
 /home/ubuntu/frb-analysis/.frb-analysis/lib/python3.12/site-packages/sklearn/metrics/_classification.py:1565: UndefinedMetricWarning: Precision is ill-defined and being set to 0.0 in labels with no predicted samples. Use `zero_division` parameter to control this behavior.
  _warn_prf(average, modifier, f"{metric.capitalize()} is", len(result))
/home/ubuntu/frb-analysis/.frb-analysis/lib/python3.12/site-packages/sklearn/metrics/_classification.py:1565: UndefinedMetricWarning: Precision is ill-defined and being set to 0.0 in labels with no predicted samples. Use `zero_division` parameter to control this behavior.
  _warn_prf(average, modifier, f"{metric.capitalize()} is", len(result))
/home/ubuntu/frb-analysis/.frb-analysis/lib/python3.12/site-packages/sklearn/metrics/_classification.py:1565: UndefinedMetricWarning: Precision is ill-defined and being set to 0.0 in labels with no predicted samples. Use `zero_division` parameter to control this behavior.
  _warn_prf(average, modifier, f"{metric.capitalize()} is", len(result))
/home/ubuntu/frb-analysis/.frb-analysis/lib/python3.12/site-packages/sklearn/metrics/_classification.py:1565: UndefinedMetricWarning: Precision is ill-defined and being set to 0.0 in labels with no predicted samples. Use `zero_division` parameter to control this behavior.
  _warn_prf(average, modifier, f"{metric.capitalize()} is", len(result))
/home/ubuntu/frb-analysis/.frb-analysis/lib/python3.12/site-packages/sklearn/metrics/_classification.py:1565: UndefinedMetricWarning: Precision is ill-defined and being set to 0.0 in labels with no predicted samples. Use `zero_division` parameter to control this behavior.
  _warn_prf(average, modifier, f"{metric.capitalize()} is", len(result))
/home/ubuntu/frb-analysis/.frb-analysis/lib/python3.12/site-packages/sklearn/metrics/_classification.py:1565: UndefinedMetricWarning: Precision is ill-defined and being set to 0.0 in labels with no predicted samples. Use `zero_division` parameter to control this behavior.
  _warn_prf(average, modifier, f"{metric.capitalize()} is", len(result))
/home/ubuntu/frb-analysis/.frb-analysis/lib/python3.12/site-packages/sklearn/metrics/_classification.py:1565: UndefinedMetricWarning: Precision is ill-defined and being set to 0.0 in labels with no predicted samples. Use `zero_division` parameter to control this behavior.
  _warn_prf(average, modifier, f"{metric.capitalize()} is", len(result))
/home/ubuntu/frb-analysis/.frb-analysis/lib/python3.12/site-packages/sklearn/metrics/_classification.py:1565: UndefinedMetricWarning: Precision is ill-defined and being set to 0.0 in labels with no predicted samples. Use `zero_division` parameter to control this behavior.
  _warn_prf(average, modifier, f"{metric.capitalize()} is", len(result))
/home/ubuntu/frb-analysis/.frb-analysis/lib/python3.12/site-packages/sklearn/metrics/_classification.py:1565: UndefinedMetricWarning: Precision is ill-defined and being set to 0.0 in labels with no predicted samples. Use `zero_division` parameter to control this behavior.
  _warn_prf(average, modifier, f"{metric.capitalize()} is", len(result))
/home/ubuntu/frb-analysis/.frb-analysis/lib/python3.12/site-packages/sklearn/metrics/_classification.py:1565: UndefinedMetricWarning: Precision is ill-defined and being set to 0.0 in labels with no predicted samples. Use `zero_division` parameter to control this behavior.
  _warn_prf(average, modifier, f"{metric.capitalize()} is", len(result))
/home/ubuntu/frb-analysis/.frb-analysis/lib/python3.12/site-packages/sklearn/metrics/_classification.py:1565: UndefinedMetricWarning: Precision is ill-defined and being set to 0.0 in labels with no predicted samples. Use `zero_division` parameter to control this behavior.
  _warn_prf(average, modifier, f"{metric.capitalize()} is", len(result))
/home/ubuntu/frb-analysis/.frb-analysis/lib/python3.12/site-packages/sklearn/metrics/_classification.py:1565: UndefinedMetricWarning: Precision is ill-defined and being set to 0.0 in labels with no predicted samples. Use `zero_division` parameter to control this behavior.
  _warn_prf(average, modifier, f"{metric.capitalize()} is", len(result))
[I 2025-06-12 10:31:02,347] Trial 69 finished with value: 0.08633425669436749 and parameters: {'hidden_dim': 957, 'latent_dim': 8, 'beta': 1.1164369354964623, 'gamma': 0.37003153399786015, 'dropout_rate': 0.16670858871325075, 'lr': 0.009205538892253442, 'scheduler_patience': 7, 'class_weight': 1.6453047491086017, 'activation': 'LeakyReLU', 'classification_multiplier': 5636.825163471569}. Best is trial 63 with value: 0.7299168975069252.
