[I 2025-06-12 21:53:36,838] Trial 180 finished with value: 0.3945060018467221 and parameters: {'hidden_dim': 1533, 'latent_dim': 33, 'beta': 1.5387376588781403, 'gamma': 0.2513563935523055, 'dropout_rate': 0.11200813489484285, 'lr': 0.0007233172156716318, 'scheduler_patience': 7, 'class_weight': 2.876311304798064, 'activation': 'SELU', 'classification_multiplier': 13168.308822076015}. Best is trial 173 with value: 0.8084025854108957.
              precision    recall  f1-score   support

Non-Repeater       0.23      0.99      0.37       150
    Repeater       1.00      0.68      0.81      1583

    accuracy                           0.71      1733
   macro avg       0.61      0.84      0.59      1733
weighted avg       0.93      0.71      0.77      1733

Confusion Matrix:
 [[ 149    1]
 [ 506 1077]]

=== Fold 3/5 ===
Validation Accuracy: 0.6930
Classification Report:
               precision    recall  f1-score   support

Non-Repeater       0.22      0.99      0.36       150
    Repeater       1.00      0.66      0.80      1583

    accuracy                           0.69      1733
   macro avg       0.61      0.83      0.58      1733
weighted avg       0.93      0.69      0.76      1733

Confusion Matrix:
 [[ 149    1]
 [ 531 1052]]

=== Fold 4/5 ===
Validation Accuracy: 0.6930
Classification Report:
               precision    recall  f1-score   support

Non-Repeater       0.22      0.98      0.36       150
    Repeater       1.00      0.67      0.80      1583

    accuracy                           0.69      1733
   macro avg       0.61      0.82      0.58      1733
weighted avg       0.93      0.69      0.76      1733

Confusion Matrix:
 [[ 147    3]
 [ 529 1054]]

=== Fold 5/5 ===
Validation Accuracy: 0.7696
Classification Report:
               precision    recall  f1-score   support

Non-Repeater       0.27      0.98      0.42       149
    Repeater       1.00      0.75      0.86      1583

    accuracy                           0.77      1732
   macro avg       0.63      0.86      0.64      1732
weighted avg       0.93      0.77      0.82      1732

Confusion Matrix:
 [[ 146    3]
 [ 396 1187]]


=== Summary ===
Total False Positives: 10
Total False Negatives: 2517
Total True Positives: 5399
Total True Negatives: 738

Confusion Matrix (with duplicates):
              Non-Repeater  Repeater
Non-Repeater         738.0      10.0
Repeater            2517.0    5399.0
accuracy_score
0.7083333333333334
Trial 1: hidden_dim=1475, latent_dim=34, beta=1.542808907564262, gamma=0.16252789423922273, dropout_rate=0.1345029816101193, lr=0.0006866403147877263, scheduler_patience=7, class_weight=2.8394397895384422, activation=ReLU, classification_multiplier=14726.139772869572

=== Fold 1/5 ===
Validation Accuracy: 0.6913
Classification Report:
               precision    recall  f1-score   support

Non-Repeater       0.22      0.99      0.36       149
    Repeater       1.00      0.66      0.80      1584

    accuracy                           0.69      1733
   macro avg       0.61      0.83      0.58      1733
weighted avg       0.93      0.69      0.76      1733

Confusion Matrix:
 [[ 148    1]
 [ 534 1050]]

=== Fold 2/5 ===
Validation Accuracy: 0.6705
Classification Report:
               precision    recall  f1-score   support

Non-Repeater       0.21      0.99      0.34       150
    Repeater       1.00      0.64      0.78      1583

    accuracy                           0.67      1733
   macro avg       0.60      0.82      0.56      1733
weighted avg       0.93      0.67      0.74      1733

Confusion Matrix:
 [[ 149    1]
 [ 570 1013]]

=== Fold 3/5 ===
Validation Accuracy: 0.7167
Classification Report:
               precision    recall  f1-score   support

Non-Repeater       0.23      0.99      0.38       150
    Repeater       1.00      0.69      0.82      1583

    accuracy                           0.72      1733
   macro avg       0.62      0.84      0.60      1733
weighted avg       0.93      0.72      0.78      1733

Confusion Matrix:
 [[ 148    2]
 [ 489 1094]]

=== Fold 4/5 ===
Validation Accuracy: 0.6295
Classification Report:
               precision    recall  f1-score   support

Non-Repeater       0.19      0.99      0.32       150
    Repeater       1.00      0.60      0.75      1583

    accuracy                           0.63      1733
   macro avg       0.59      0.79      0.53      1733
weighted avg       0.93      0.63      0.71      1733

Confusion Matrix:
 [[148   2]
 [640 943]]

=== Fold 5/5 ===
Validation Accuracy: 0.7512
Classification Report:
               precision    recall  f1-score   support

Non-Repeater       0.26      0.99      0.41       149
    Repeater       1.00      0.73      0.84      1583

    accuracy                           0.75      1732
   macro avg       0.63      0.86      0.62      1732
weighted avg       0.93      0.75      0.81      1732

Confusion Matrix:
 [[ 147    2]
 [ 429 1154]]


=== Summary ===
Total False Positives: 8
Total False Negatives: 2662
Total True Positives: 5254
Total True Negatives: 740

Confusion Matrix (with duplicates):
              Non-Repeater  Repeater
Non-Repeater         740.0       8.0
Repeater            2662.0    5254.0
accuracy_score
0.6918282548476454
Trial 1: hidden_dim=1584, latent_dim=34, beta=1.4815382155994827, gamma=0.1070325749836988, dropout_rate=0.10042556758092001, lr=0.000517658335335098, scheduler_patience=2, class_weight=2.8260255407288946, activation=ReLU, classification_multiplier=14812.19186672539

=== Fold 1/5 ===
Validation Accuracy: 0.2677
Classification Report:
               precision    recall  f1-score   support

Non-Repeater       0.11      1.00      0.19       149
    Repeater       1.00      0.20      0.33      1584

    accuracy                           0.27      1733
   macro avg       0.55      0.60      0.26      1733
weighted avg       0.92      0.27      0.32      1733

Confusion Matrix:
 [[ 149    0]
 [1269  315]]

=== Fold 2/5 ===
Validation Accuracy: 0.4126
Classification Report:
               precision    recall  f1-score   support

Non-Repeater       0.13      0.99      0.23       150
    Repeater       1.00      0.36      0.53      1583

    accuracy                           0.41      1733
   macro avg       0.56      0.68      0.38      1733
weighted avg       0.92      0.41      0.50      1733

Confusion Matrix:
 [[ 149    1]
 [1017  566]]

=== Fold 3/5 ===
Validation Accuracy: 0.2602
Classification Report:
               precision    recall  f1-score   support

Non-Repeater       0.10      0.99      0.19       150
    Repeater       1.00      0.19      0.32      1583

    accuracy                           0.26      1733
   macro avg       0.55      0.59      0.25      1733
weighted avg       0.92      0.26      0.31      1733

Confusion Matrix:
 [[ 149    1]
 [1281  302]]

=== Fold 4/5 ===
Validation Accuracy: 0.4535
Classification Report:
               precision    recall  f1-score   support

Non-Repeater       0.13      0.98      0.24       150
    Repeater       1.00      0.40      0.57      1583

    accuracy                           0.45      1733
   macro avg       0.57      0.69      0.41      1733
weighted avg       0.92      0.45      0.55      1733

Confusion Matrix:
 [[147   3]
 [944 639]]

=== Fold 5/5 ===
Validation Accuracy: 0.5785
Classification Report:
               precision    recall  f1-score   support

Non-Repeater       0.17      0.99      0.29       149
    Repeater       1.00      0.54      0.70      1583

    accuracy                           0.58      1732
   macro avg       0.58      0.77      0.49      1732
weighted avg       0.93      0.58      0.67      1732

Confusion Matrix:
 [[148   1]
 [729 854]]


=== Summary ===
Total False Positives: 6
Total False Negatives: 5240
Total True Positives: 2676
Total True Negatives: 742

Confusion Matrix (with duplicates):
              Non-Repeater  Repeater
Non-Repeater         742.0       6.0
Repeater            5240.0    2676.0
accuracy_score
0.3945060018467221
Trial 1: hidden_dim=1533, latent_dim=33, beta=1.5387376588781403, gamma=0.2513563935523055, dropout_rate=0.11200813489484285, lr=0.0007233172156716318, scheduler_patience=7, class_weight=2.876311304798064, activation=SELU, classification_multiplier=13168.308822076015

=== Fold 1/5 ===
Validation Accuracy: 0.7871
Classification Report:
 [I 2025-06-12 22:00:10,535] Trial 181 finished with value: 0.7864727608494921 and parameters: {'hidden_dim': 1445, 'latent_dim': 33, 'beta': 1.4542122917254225, 'gamma': 0.16269633267220712, 'dropout_rate': 0.11808872391909266, 'lr': 0.0005255314658682742, 'scheduler_patience': 7, 'class_weight': 2.923146850398641, 'activation': 'ReLU', 'classification_multiplier': 14630.664144110886}. Best is trial 173 with value: 0.8084025854108957.
[I 2025-06-12 22:06:49,491] Trial 182 finished with value: 0.7662742382271468 and parameters: {'hidden_dim': 1477, 'latent_dim': 32, 'beta': 1.5937761679155593, 'gamma': 0.15717090999970146, 'dropout_rate': 0.1181004263429041, 'lr': 0.0005189259760582234, 'scheduler_patience': 7, 'class_weight': 2.776450957328964, 'activation': 'ReLU', 'classification_multiplier': 14598.920529950854}. Best is trial 173 with value: 0.8084025854108957.
              precision    recall  f1-score   support

Non-Repeater       0.29      0.98      0.44       149
    Repeater       1.00      0.77      0.87      1584

    accuracy                           0.79      1733
   macro avg       0.64      0.87      0.66      1733
weighted avg       0.94      0.79      0.83      1733

Confusion Matrix:
 [[ 146    3]
 [ 366 1218]]

=== Fold 2/5 ===
Validation Accuracy: 0.7842
Classification Report:
               precision    recall  f1-score   support

Non-Repeater       0.28      0.99      0.44       150
    Repeater       1.00      0.77      0.87      1583

    accuracy                           0.78      1733
   macro avg       0.64      0.88      0.65      1733
weighted avg       0.94      0.78      0.83      1733

Confusion Matrix:
 [[ 148    2]
 [ 372 1211]]

=== Fold 3/5 ===
Validation Accuracy: 0.8038
Classification Report:
               precision    recall  f1-score   support

Non-Repeater       0.30      0.97      0.46       150
    Repeater       1.00      0.79      0.88      1583

    accuracy                           0.80      1733
   macro avg       0.65      0.88      0.67      1733
weighted avg       0.94      0.80      0.84      1733

Confusion Matrix:
 [[ 145    5]
 [ 335 1248]]

=== Fold 4/5 ===
Validation Accuracy: 0.7784
Classification Report:
               precision    recall  f1-score   support

Non-Repeater       0.28      0.97      0.43       150
    Repeater       1.00      0.76      0.86      1583

    accuracy                           0.78      1733
   macro avg       0.64      0.86      0.65      1733
weighted avg       0.93      0.78      0.83      1733

Confusion Matrix:
 [[ 145    5]
 [ 379 1204]]

=== Fold 5/5 ===
Validation Accuracy: 0.7789
Classification Report:
               precision    recall  f1-score   support

Non-Repeater       0.28      0.97      0.43       149
    Repeater       1.00      0.76      0.86      1583

    accuracy                           0.78      1732
   macro avg       0.64      0.87      0.65      1732
weighted avg       0.93      0.78      0.83      1732

Confusion Matrix:
 [[ 145    4]
 [ 379 1204]]


=== Summary ===
Total False Positives: 19
Total False Negatives: 1831
Total True Positives: 6085
Total True Negatives: 729

Confusion Matrix (with duplicates):
              Non-Repeater  Repeater
Non-Repeater         729.0      19.0
Repeater            1831.0    6085.0
accuracy_score
0.7864727608494921
Trial 1: hidden_dim=1445, latent_dim=33, beta=1.4542122917254225, gamma=0.16269633267220712, dropout_rate=0.11808872391909266, lr=0.0005255314658682742, scheduler_patience=7, class_weight=2.923146850398641, activation=ReLU, classification_multiplier=14630.664144110886

=== Fold 1/5 ===
Validation Accuracy: 0.7340
Classification Report:
               precision    recall  f1-score   support

Non-Repeater       0.24      1.00      0.39       149
    Repeater       1.00      0.71      0.83      1584

    accuracy                           0.73      1733
   macro avg       0.62      0.85      0.61      1733
weighted avg       0.94      0.73      0.79      1733

Confusion Matrix:
 [[ 149    0]
 [ 461 1123]]

=== Fold 2/5 ===
Validation Accuracy: 0.8529
Classification Report:
               precision    recall  f1-score   support

Non-Repeater       0.37      0.99      0.54       150
    Repeater       1.00      0.84      0.91      1583

    accuracy                           0.85      1733
   macro avg       0.68      0.91      0.72      1733
weighted avg       0.94      0.85      0.88      1733

Confusion Matrix:
 [[ 148    2]
 [ 253 1330]]

=== Fold 3/5 ===
Validation Accuracy: 0.7507
Classification Report:
               precision    recall  f1-score   support

Non-Repeater       0.26      0.98      0.40       150
    Repeater       1.00      0.73      0.84      1583

    accuracy                           0.75      1733
   macro avg       0.63      0.85      0.62      1733
weighted avg       0.93      0.75      0.80      1733

Confusion Matrix:
 [[ 147    3]
 [ 429 1154]]

=== Fold 4/5 ===
Validation Accuracy: 0.7184
Classification Report:
               precision    recall  f1-score   support

Non-Repeater       0.23      0.99      0.38       150
    Repeater       1.00      0.69      0.82      1583

    accuracy                           0.72      1733
   macro avg       0.62      0.84      0.60      1733
weighted avg       0.93      0.72      0.78      1733

Confusion Matrix:
 [[ 148    2]
 [ 486 1097]]

=== Fold 5/5 ===
Validation Accuracy: 0.7754
Classification Report:
               precision    recall  f1-score   support

Non-Repeater       0.27      0.97      0.43       149
    Repeater       1.00      0.76      0.86      1583

    accuracy                           0.78      1732
   macro avg       0.64      0.86      0.64      1732
weighted avg       0.93      0.78      0.82      1732

Confusion Matrix:
 [[ 145    4]
 [ 385 1198]]


=== Summary ===
Total False Positives: 11
Total False Negatives: 2014
Total True Positives: 5902
Total True Negatives: 737

Confusion Matrix (with duplicates):
              Non-Repeater  Repeater
Non-Repeater         737.0      11.0
Repeater            2014.0    5902.0
accuracy_score
0.7662742382271468
Trial 1: hidden_dim=1477, latent_dim=32, beta=1.5937761679155593, gamma=0.15717090999970146, dropout_rate=0.1181004263429041, lr=0.0005189259760582234, scheduler_patience=7, class_weight=2.776450957328964, activation=ReLU, classification_multiplier=14598.920529950854

=== Fold 1/5 ===
Validation Accuracy: 0.7132
Classification Report:
               precision    recall  f1-score   support

Non-Repeater       0.23      0.99      0.37       149
    Repeater       1.00      0.69      0.81      1584

    accuracy                           0.71      1733
   macro avg       0.61      0.84      0.59      1733
weighted avg       0.93      0.71      0.78      1733

Confusion Matrix:
 [[ 147    2]
 [ 495 1089]]

=== Fold 2/5 ===
Validation Accuracy: 0.7842
Classification Report:
               precision    recall  f1-score   support

Non-Repeater       0.29      0.99      0.44       150
    Repeater       1.00      0.76      0.87      1583

    accuracy                           0.78      1733
   macro avg       0.64      0.88      0.65      1733
weighted avg       0.94      0.78      0.83      1733

Confusion Matrix:
 [[ 149    1]
 [ 373 1210]]

=== Fold 3/5 ===
Validation Accuracy: 0.6549
Classification Report:
               precision    recall  f1-score   support

Non-Repeater       0.20      0.99      0.33       150
    Repeater       1.00      0.62      0.77      1583

    accuracy                           0.65      1733
   macro avg       0.60      0.81      0.55      1733
weighted avg       0.93      0.65      0.73      1733

Confusion Matrix:
 [[149   1]
 [597 986]]

=== Fold 4/5 ===
Validation Accuracy: 0.7121
Classification Report:
               precision    recall  f1-score   support

Non-Repeater       0.23      0.99      0.37       150
    Repeater       1.00      0.69      0.81      1583

    accuracy                           0.71      1733
   macro avg       0.61      0.84      0.59      1733
weighted avg       0.93      0.71      0.78      1733

Confusion Matrix:
 [[ 148    2]
 [ 497 1086]]

=== Fold 5/5 ===
Validation Accuracy: 0.8747
Classification Report:
               precision    recall  f1-score   support

Non-Repeater       0.40      0.96      0.57       149
    Repeater       1.00      0.87      0.93      1583

    accuracy                           0.87      1732
   macro avg       0.70      0.91      0.75      1732
weighted avg       0.94      0.87      0.90      1732

Confusion Matrix:
 [[ 143    6]
 [ 211 1372]]


=== Summary ===
Total False Positives: 12
Total False Negatives: 2173
Total True Positives: 5743
Total True Negatives: 736

Confusion Matrix (with duplicates):
              Non-Repeater  Repeater
Non-Repeater         736.0      12.0
Repeater            2173.0    5743.0
accuracy_score
0.7478070175438597
[I 2025-06-12 22:13:32,393] Trial 183 finished with value: 0.7478070175438597 and parameters: {'hidden_dim': 1515, 'latent_dim': 32, 'beta': 1.6015149244604807, 'gamma': 0.24216497593873273, 'dropout_rate': 0.12482415886853698, 'lr': 0.0005142617885543447, 'scheduler_patience': 7, 'class_weight': 2.9172702226536615, 'activation': 'ReLU', 'classification_multiplier': 14296.166233876793}. Best is trial 173 with value: 0.8084025854108957.
[I 2025-06-12 22:20:19,545] Trial 184 finished with value: 0.33229455216989845 and parameters: {'hidden_dim': 1600, 'latent_dim': 31, 'beta': 1.4639801987628043, 'gamma': 0.1536472591689731, 'dropout_rate': 0.13458006186761215, 'lr': 0.0037852153206232764, 'scheduler_patience': 7, 'class_weight': 2.637100455919155, 'activation': 'ReLU', 'classification_multiplier': 14615.690543145949}. Best is trial 173 with value: 0.8084025854108957.
