[I 2025-06-13 12:07:10,601] Trial 312 finished with value: 0.6821329639889196 and parameters: {'hidden_dim': 1439, 'latent_dim': 30, 'beta': 1.4963658464324128, 'gamma': 1.6032014072014094, 'dropout_rate': 0.16503104987295128, 'lr': 0.000791716133370878, 'scheduler_patience': 7, 'class_weight': 2.7899376612495077, 'activation': 'ReLU', 'classification_multiplier': 14156.152729819378}. Best is trial 194 with value: 0.8103647276084949.
              precision    recall  f1-score   support

Non-Repeater       0.25      0.99      0.40       150
    Repeater       1.00      0.72      0.84      1583

    accuracy                           0.74      1733
   macro avg       0.62      0.86      0.62      1733
weighted avg       0.93      0.74      0.80      1733

Confusion Matrix:
 [[ 149    1]
 [ 446 1137]]

=== Fold 4/5 ===
Validation Accuracy: 0.7484
Classification Report:
               precision    recall  f1-score   support

Non-Repeater       0.25      0.97      0.40       150
    Repeater       1.00      0.73      0.84      1583

    accuracy                           0.75      1733
   macro avg       0.62      0.85      0.62      1733
weighted avg       0.93      0.75      0.80      1733

Confusion Matrix:
 [[ 145    5]
 [ 431 1152]]

=== Fold 5/5 ===
Validation Accuracy: 0.7766
Classification Report:
               precision    recall  f1-score   support

Non-Repeater       0.27      0.97      0.43       149
    Repeater       1.00      0.76      0.86      1583

    accuracy                           0.78      1732
   macro avg       0.64      0.87      0.64      1732
weighted avg       0.93      0.78      0.82      1732

Confusion Matrix:
 [[ 145    4]
 [ 383 1200]]


=== Summary ===
Total False Positives: 13
Total False Negatives: 3738
Total True Positives: 4178
Total True Negatives: 735

Confusion Matrix (with duplicates):
              Non-Repeater  Repeater
Non-Repeater         735.0      13.0
Repeater            3738.0    4178.0
accuracy_score
0.5670590951061866
Trial 1: hidden_dim=1409, latent_dim=29, beta=1.392286673426062, gamma=0.24963174021439238, dropout_rate=0.15238127374769497, lr=0.005642837822827017, scheduler_patience=7, class_weight=2.8637664850174067, activation=ReLU, classification_multiplier=14238.971351182236

=== Fold 1/5 ===
Validation Accuracy: 0.7744
Classification Report:
               precision    recall  f1-score   support

Non-Repeater       0.28      1.00      0.43       149
    Repeater       1.00      0.75      0.86      1584

    accuracy                           0.77      1733
   macro avg       0.64      0.88      0.65      1733
weighted avg       0.94      0.77      0.82      1733

Confusion Matrix:
 [[ 149    0]
 [ 391 1193]]

=== Fold 2/5 ===
Validation Accuracy: 0.6953
Classification Report:
               precision    recall  f1-score   support

Non-Repeater       0.22      0.99      0.36       150
    Repeater       1.00      0.67      0.80      1583

    accuracy                           0.70      1733
   macro avg       0.61      0.83      0.58      1733
weighted avg       0.93      0.70      0.76      1733

Confusion Matrix:
 [[ 149    1]
 [ 527 1056]]

=== Fold 3/5 ===
Validation Accuracy: 0.7438
Classification Report:
               precision    recall  f1-score   support

Non-Repeater       0.25      0.99      0.40       150
    Repeater       1.00      0.72      0.84      1583

    accuracy                           0.74      1733
   macro avg       0.62      0.85      0.62      1733
weighted avg       0.93      0.74      0.80      1733

Confusion Matrix:
 [[ 148    2]
 [ 442 1141]]

=== Fold 4/5 ===
Validation Accuracy: 0.7576
Classification Report:
               precision    recall  f1-score   support

Non-Repeater       0.26      0.98      0.41       150
    Repeater       1.00      0.74      0.85      1583

    accuracy                           0.76      1733
   macro avg       0.63      0.86      0.63      1733
weighted avg       0.93      0.76      0.81      1733

Confusion Matrix:
 [[ 147    3]
 [ 417 1166]]

=== Fold 5/5 ===
Validation Accuracy: 0.7829
Classification Report:
               precision    recall  f1-score   support

Non-Repeater       0.28      0.98      0.44       149
    Repeater       1.00      0.76      0.87      1583

    accuracy                           0.78      1732
   macro avg       0.64      0.87      0.65      1732
weighted avg       0.94      0.78      0.83      1732

Confusion Matrix:
 [[ 146    3]
 [ 373 1210]]


=== Summary ===
Total False Positives: 9
Total False Negatives: 2150
Total True Positives: 5766
Total True Negatives: 739

Confusion Matrix (with duplicates):
              Non-Repeater  Repeater
Non-Repeater         739.0       9.0
Repeater            2150.0    5766.0
accuracy_score
0.7508079409048938
Trial 1: hidden_dim=1377, latent_dim=31, beta=1.4497352033049244, gamma=0.17194128871328276, dropout_rate=0.14301724442430447, lr=0.0009256998422021426, scheduler_patience=7, class_weight=2.903906844529279, activation=ReLU, classification_multiplier=14508.73036666139

=== Fold 1/5 ===
Validation Accuracy: 0.7207
Classification Report:
               precision    recall  f1-score   support

Non-Repeater       0.23      0.98      0.38       149
    Repeater       1.00      0.70      0.82      1584

    accuracy                           0.72      1733
   macro avg       0.62      0.84      0.60      1733
weighted avg       0.93      0.72      0.78      1733

Confusion Matrix:
 [[ 146    3]
 [ 481 1103]]

=== Fold 2/5 ===
Validation Accuracy: 0.7513
Classification Report:
               precision    recall  f1-score   support

Non-Repeater       0.26      0.99      0.41       150
    Repeater       1.00      0.73      0.84      1583

    accuracy                           0.75      1733
   macro avg       0.63      0.86      0.63      1733
weighted avg       0.93      0.75      0.80      1733

Confusion Matrix:
 [[ 149    1]
 [ 430 1153]]

=== Fold 3/5 ===
Validation Accuracy: 0.7005
Classification Report:
               precision    recall  f1-score   support

Non-Repeater       0.22      0.99      0.36       150
    Repeater       1.00      0.67      0.80      1583

    accuracy                           0.70      1733
   macro avg       0.61      0.83      0.58      1733
weighted avg       0.93      0.70      0.77      1733

Confusion Matrix:
 [[ 149    1]
 [ 518 1065]]

=== Fold 4/5 ===
Validation Accuracy: 0.6220
Classification Report:
               precision    recall  f1-score   support

Non-Repeater       0.18      0.99      0.31       150
    Repeater       1.00      0.59      0.74      1583

    accuracy                           0.62      1733
   macro avg       0.59      0.79      0.53      1733
weighted avg       0.93      0.62      0.70      1733

Confusion Matrix:
 [[148   2]
 [653 930]]

=== Fold 5/5 ===
Validation Accuracy: 0.6161
Classification Report:
               precision    recall  f1-score   support

Non-Repeater       0.18      0.99      0.31       149
    Repeater       1.00      0.58      0.73      1583

    accuracy                           0.62      1732
   macro avg       0.59      0.78      0.52      1732
weighted avg       0.93      0.62      0.70      1732

Confusion Matrix:
 [[147   2]
 [663 920]]


=== Summary ===
Total False Positives: 9
Total False Negatives: 2745
Total True Positives: 5171
Total True Negatives: 739

Confusion Matrix (with duplicates):
              Non-Repeater  Repeater
Non-Repeater         739.0       9.0
Repeater            2745.0    5171.0
accuracy_score
0.6821329639889196
Trial 1: hidden_dim=1439, latent_dim=30, beta=1.4963658464324128, gamma=1.6032014072014094, dropout_rate=0.16503104987295128, lr=0.000791716133370878, scheduler_patience=7, class_weight=2.7899376612495077, activation=ReLU, classification_multiplier=14156.152729819378

=== Fold 1/5 ===
Validation Accuracy: 0.7842
Classification Report:
               precision    recall  f1-score   support

Non-Repeater       0.28      0.97      0.44       149
    Repeater       1.00      0.77      0.87      1584

    accuracy                           0.78      1733
   macro avg       0.64      0.87      0.65      1733
weighted avg       0.94      0.78      0.83      1733

Confusion Matrix:
 [[ 145    4]
 [ 370 1214]]

=== Fold 2/5 ===
Validation Accuracy: 0.7917
Classification Report:
 [I 2025-06-13 12:13:48,931] Trial 313 finished with value: 0.797668513388735 and parameters: {'hidden_dim': 1490, 'latent_dim': 31, 'beta': 1.3796851997035025, 'gamma': 0.21071281331573383, 'dropout_rate': 0.1455431054674687, 'lr': 0.0006072487261600786, 'scheduler_patience': 7, 'class_weight': 2.8540044100066257, 'activation': 'ReLU', 'classification_multiplier': 14396.844513478898}. Best is trial 194 with value: 0.8103647276084949.
[I 2025-06-13 12:20:27,869] Trial 314 finished with value: 0.35468605724838415 and parameters: {'hidden_dim': 1499, 'latent_dim': 34, 'beta': 1.3774563171090828, 'gamma': 0.16508288515272032, 'dropout_rate': 0.15581413249590678, 'lr': 0.0006328112846927164, 'scheduler_patience': 7, 'class_weight': 2.951944316019413, 'activation': 'SELU', 'classification_multiplier': 14422.287881628974}. Best is trial 194 with value: 0.8103647276084949.
[I 2025-06-13 12:27:17,519] Trial 315 finished with value: 0.6925207756232687 and parameters: {'hidden_dim': 1579, 'latent_dim': 32, 'beta': 1.337055747452276, 'gamma': 0.27057180001142894, 'dropout_rate': 0.37724350016842145, 'lr': 0.0009602953386777181, 'scheduler_patience': 7, 'class_weight': 2.892903658078548, 'activation': 'ReLU', 'classification_multiplier': 13996.310022328393}. Best is trial 194 with value: 0.8103647276084949.
              precision    recall  f1-score   support

Non-Repeater       0.29      0.99      0.45       150
    Repeater       1.00      0.77      0.87      1583

    accuracy                           0.79      1733
   macro avg       0.65      0.88      0.66      1733
weighted avg       0.94      0.79      0.84      1733

Confusion Matrix:
 [[ 149    1]
 [ 360 1223]]

=== Fold 3/5 ===
Validation Accuracy: 0.7617
Classification Report:
               precision    recall  f1-score   support

Non-Repeater       0.27      0.99      0.42       150
    Repeater       1.00      0.74      0.85      1583

    accuracy                           0.76      1733
   macro avg       0.63      0.87      0.63      1733
weighted avg       0.94      0.76      0.81      1733

Confusion Matrix:
 [[ 149    1]
 [ 412 1171]]

=== Fold 4/5 ===
Validation Accuracy: 0.7755
Classification Report:
               precision    recall  f1-score   support

Non-Repeater       0.27      0.97      0.43       150
    Repeater       1.00      0.76      0.86      1583

    accuracy                           0.78      1733
   macro avg       0.63      0.86      0.64      1733
weighted avg       0.93      0.78      0.82      1733

Confusion Matrix:
 [[ 145    5]
 [ 384 1199]]

=== Fold 5/5 ===
Validation Accuracy: 0.8753
Classification Report:
               precision    recall  f1-score   support

Non-Repeater       0.41      0.96      0.57       149
    Repeater       1.00      0.87      0.93      1583

    accuracy                           0.88      1732
   macro avg       0.70      0.91      0.75      1732
weighted avg       0.94      0.88      0.90      1732

Confusion Matrix:
 [[ 143    6]
 [ 210 1373]]


=== Summary ===
Total False Positives: 17
Total False Negatives: 1736
Total True Positives: 6180
Total True Negatives: 731

Confusion Matrix (with duplicates):
              Non-Repeater  Repeater
Non-Repeater         731.0      17.0
Repeater            1736.0    6180.0
accuracy_score
0.797668513388735
Trial 1: hidden_dim=1490, latent_dim=31, beta=1.3796851997035025, gamma=0.21071281331573383, dropout_rate=0.1455431054674687, lr=0.0006072487261600786, scheduler_patience=7, class_weight=2.8540044100066257, activation=ReLU, classification_multiplier=14396.844513478898

=== Fold 1/5 ===
Validation Accuracy: 0.3889
Classification Report:
               precision    recall  f1-score   support

Non-Repeater       0.12      0.99      0.22       149
    Repeater       1.00      0.33      0.50      1584

    accuracy                           0.39      1733
   macro avg       0.56      0.66      0.36      1733
weighted avg       0.92      0.39      0.47      1733

Confusion Matrix:
 [[ 148    1]
 [1058  526]]

=== Fold 2/5 ===
Validation Accuracy: 0.2914
Classification Report:
               precision    recall  f1-score   support

Non-Repeater       0.11      1.00      0.20       150
    Repeater       1.00      0.22      0.37      1583

    accuracy                           0.29      1733
   macro avg       0.55      0.61      0.28      1733
weighted avg       0.92      0.29      0.35      1733

Confusion Matrix:
 [[ 150    0]
 [1228  355]]

=== Fold 3/5 ===
Validation Accuracy: 0.3203
Classification Report:
               precision    recall  f1-score   support

Non-Repeater       0.11      1.00      0.20       150
    Repeater       1.00      0.26      0.41      1583

    accuracy                           0.32      1733
   macro avg       0.56      0.63      0.31      1733
weighted avg       0.92      0.32      0.39      1733

Confusion Matrix:
 [[ 150    0]
 [1178  405]]

=== Fold 4/5 ===
Validation Accuracy: 0.3531
Classification Report:
               precision    recall  f1-score   support

Non-Repeater       0.12      0.98      0.21       150
    Repeater       0.99      0.29      0.45      1583

    accuracy                           0.35      1733
   macro avg       0.55      0.64      0.33      1733
weighted avg       0.92      0.35      0.43      1733

Confusion Matrix:
 [[ 147    3]
 [1118  465]]

=== Fold 5/5 ===
Validation Accuracy: 0.4197
Classification Report:
               precision    recall  f1-score   support

Non-Repeater       0.13      1.00      0.23       149
    Repeater       1.00      0.37      0.53      1583

    accuracy                           0.42      1732
   macro avg       0.56      0.68      0.38      1732
weighted avg       0.93      0.42      0.51      1732

Confusion Matrix:
 [[ 149    0]
 [1005  578]]


=== Summary ===
Total False Positives: 4
Total False Negatives: 5587
Total True Positives: 2329
Total True Negatives: 744

Confusion Matrix (with duplicates):
              Non-Repeater  Repeater
Non-Repeater         744.0       4.0
Repeater            5587.0    2329.0
accuracy_score
0.35468605724838415
Trial 1: hidden_dim=1499, latent_dim=34, beta=1.3774563171090828, gamma=0.16508288515272032, dropout_rate=0.15581413249590678, lr=0.0006328112846927164, scheduler_patience=7, class_weight=2.951944316019413, activation=SELU, classification_multiplier=14422.287881628974

=== Fold 1/5 ===
Validation Accuracy: 0.5984
Classification Report:
               precision    recall  f1-score   support

Non-Repeater       0.18      0.99      0.30       149
    Repeater       1.00      0.56      0.72      1584

    accuracy                           0.60      1733
   macro avg       0.59      0.78      0.51      1733
weighted avg       0.93      0.60      0.68      1733

Confusion Matrix:
 [[148   1]
 [695 889]]

=== Fold 2/5 ===
Validation Accuracy: 0.6503
Classification Report:
               precision    recall  f1-score   support

Non-Repeater       0.20      0.99      0.33       150
    Repeater       1.00      0.62      0.76      1583

    accuracy                           0.65      1733
   macro avg       0.60      0.80      0.55      1733
weighted avg       0.93      0.65      0.73      1733

Confusion Matrix:
 [[148   2]
 [604 979]]

=== Fold 3/5 ===
Validation Accuracy: 0.7403
Classification Report:
               precision    recall  f1-score   support

Non-Repeater       0.25      0.99      0.40       150
    Repeater       1.00      0.72      0.83      1583

    accuracy                           0.74      1733
   macro avg       0.62      0.85      0.62      1733
weighted avg       0.93      0.74      0.80      1733

Confusion Matrix:
 [[ 149    1]
 [ 449 1134]]

=== Fold 4/5 ===
Validation Accuracy: 0.7467
Classification Report:
               precision    recall  f1-score   support

Non-Repeater       0.25      0.99      0.40       150
    Repeater       1.00      0.72      0.84      1583

    accuracy                           0.75      1733
   macro avg       0.63      0.86      0.62      1733
weighted avg       0.93      0.75      0.80      1733

Confusion Matrix:
 [[ 148    2]
 [ 437 1146]]

=== Fold 5/5 ===
Validation Accuracy: 0.7269
Classification Report:
               precision    recall  f1-score   support

Non-Repeater       0.24      0.99      0.38       149
    Repeater       1.00      0.70      0.82      1583

    accuracy                           0.73      1732
   macro avg       0.62      0.84      0.60      1732
weighted avg       0.93      0.73      0.79      1732

Confusion Matrix:
 [[ 147    2]
 [ 471 1112]]


=== Summary ===
Total False Positives: 8
Total False Negatives: 2656
Total True Positives: 5260
Total True Negatives: 740

Confusion Matrix (with duplicates):
              Non-Repeater  Repeater
Non-Repeater         740.0       8.0
Repeater            2656.0    5260.0
accuracy_score
0.6925207756232687
Trial 1: hidden_dim=1579, latent_dim=32, beta=1.337055747452276, gamma=0.27057180001142894, dropout_rate=0.37724350016842145, lr=0.0009602953386777181, scheduler_patience=7, class_weight=2.892903658078548, activation=ReLU, classification_multiplier=13996.310022328393

=== Fold 1/5 ===
Validation Accuracy: 0.7057
Classification Report:
 [I 2025-06-13 12:33:58,032] Trial 316 finished with value: 0.7206832871652816 and parameters: {'hidden_dim': 1483, 'latent_dim': 33, 'beta': 1.3792530549273045, 'gamma': 0.20128573439395817, 'dropout_rate': 0.13445757273462, 'lr': 0.0007218202607265444, 'scheduler_patience': 7, 'class_weight': 2.7738420554696934, 'activation': 'ReLU', 'classification_multiplier': 14317.883767286932}. Best is trial 194 with value: 0.8103647276084949.
