[I 2025-06-13 00:17:28,699] Trial 202 finished with value: 0.7414589104339797 and parameters: {'hidden_dim': 1356, 'latent_dim': 31, 'beta': 1.385049888485786, 'gamma': 0.1003718015136504, 'dropout_rate': 0.12784611862332115, 'lr': 0.000425991990190329, 'scheduler_patience': 7, 'class_weight': 2.9139951845522285, 'activation': 'ReLU', 'classification_multiplier': 13084.282170159813}. Best is trial 194 with value: 0.8103647276084949.
              precision    recall  f1-score   support

Non-Repeater       0.26      0.99      0.41       149
    Repeater       1.00      0.73      0.84      1584

    accuracy                           0.75      1733
   macro avg       0.63      0.86      0.63      1733
weighted avg       0.93      0.75      0.81      1733

Confusion Matrix:
 [[ 147    2]
 [ 426 1158]]

=== Fold 2/5 ===
Validation Accuracy: 0.6792
Classification Report:
               precision    recall  f1-score   support

Non-Repeater       0.21      0.99      0.35       150
    Repeater       1.00      0.65      0.79      1583

    accuracy                           0.68      1733
   macro avg       0.61      0.82      0.57      1733
weighted avg       0.93      0.68      0.75      1733

Confusion Matrix:
 [[ 149    1]
 [ 555 1028]]

=== Fold 3/5 ===
Validation Accuracy: 0.7600
Classification Report:
               precision    recall  f1-score   support

Non-Repeater       0.26      0.99      0.42       150
    Repeater       1.00      0.74      0.85      1583

    accuracy                           0.76      1733
   macro avg       0.63      0.86      0.63      1733
weighted avg       0.93      0.76      0.81      1733

Confusion Matrix:
 [[ 148    2]
 [ 414 1169]]

=== Fold 4/5 ===
Validation Accuracy: 0.6607
Classification Report:
               precision    recall  f1-score   support

Non-Repeater       0.20      0.99      0.34       150
    Repeater       1.00      0.63      0.77      1583

    accuracy                           0.66      1733
   macro avg       0.60      0.81      0.55      1733
weighted avg       0.93      0.66      0.73      1733

Confusion Matrix:
 [[149   1]
 [587 996]]

=== Fold 5/5 ===
Validation Accuracy: 0.8499
Classification Report:
               precision    recall  f1-score   support

Non-Repeater       0.36      0.97      0.53       149
    Repeater       1.00      0.84      0.91      1583

    accuracy                           0.85      1732
   macro avg       0.68      0.91      0.72      1732
weighted avg       0.94      0.85      0.88      1732

Confusion Matrix:
 [[ 145    4]
 [ 256 1327]]


=== Summary ===
Total False Positives: 10
Total False Negatives: 2238
Total True Positives: 5678
Total True Negatives: 738

Confusion Matrix (with duplicates):
              Non-Repeater  Repeater
Non-Repeater         738.0      10.0
Repeater            2238.0    5678.0
accuracy_score
0.7405355493998154
Trial 1: hidden_dim=1403, latent_dim=30, beta=1.3322382752390345, gamma=0.19133413329740215, dropout_rate=0.11392135509274803, lr=0.0006237534383706304, scheduler_patience=7, class_weight=2.8308357973051796, activation=ReLU, classification_multiplier=13273.058393865482

=== Fold 1/5 ===
Validation Accuracy: 0.7040
Classification Report:
               precision    recall  f1-score   support

Non-Repeater       0.22      0.99      0.37       149
    Repeater       1.00      0.68      0.81      1584

    accuracy                           0.70      1733
   macro avg       0.61      0.84      0.59      1733
weighted avg       0.93      0.70      0.77      1733

Confusion Matrix:
 [[ 148    1]
 [ 512 1072]]

=== Fold 2/5 ===
Validation Accuracy: 0.7640
Classification Report:
               precision    recall  f1-score   support

Non-Repeater       0.27      0.99      0.42       150
    Repeater       1.00      0.74      0.85      1583

    accuracy                           0.76      1733
   macro avg       0.63      0.86      0.64      1733
weighted avg       0.93      0.76      0.81      1733

Confusion Matrix:
 [[ 148    2]
 [ 407 1176]]

=== Fold 3/5 ===
Validation Accuracy: 0.7467
Classification Report:
               precision    recall  f1-score   support

Non-Repeater       0.25      0.97      0.40       150
    Repeater       1.00      0.73      0.84      1583

    accuracy                           0.75      1733
   macro avg       0.62      0.85      0.62      1733
weighted avg       0.93      0.75      0.80      1733

Confusion Matrix:
 [[ 146    4]
 [ 435 1148]]

=== Fold 4/5 ===
Validation Accuracy: 0.7080
Classification Report:
               precision    recall  f1-score   support

Non-Repeater       0.23      0.98      0.37       150
    Repeater       1.00      0.68      0.81      1583

    accuracy                           0.71      1733
   macro avg       0.61      0.83      0.59      1733
weighted avg       0.93      0.71      0.77      1733

Confusion Matrix:
 [[ 147    3]
 [ 503 1080]]

=== Fold 5/5 ===
Validation Accuracy: 0.7846
Classification Report:
               precision    recall  f1-score   support

Non-Repeater       0.28      0.98      0.44       149
    Repeater       1.00      0.77      0.87      1583

    accuracy                           0.78      1732
   macro avg       0.64      0.87      0.65      1732
weighted avg       0.94      0.78      0.83      1732

Confusion Matrix:
 [[ 146    3]
 [ 370 1213]]


=== Summary ===
Total False Positives: 13
Total False Negatives: 2227
Total True Positives: 5689
Total True Negatives: 735

Confusion Matrix (with duplicates):
              Non-Repeater  Repeater
Non-Repeater         735.0      13.0
Repeater            2227.0    5689.0
accuracy_score
0.7414589104339797
Trial 1: hidden_dim=1356, latent_dim=31, beta=1.385049888485786, gamma=0.1003718015136504, dropout_rate=0.12784611862332115, lr=0.000425991990190329, scheduler_patience=7, class_weight=2.9139951845522285, activation=ReLU, classification_multiplier=13084.282170159813

=== Fold 1/5 ===
Validation Accuracy: 0.8996
Classification Report:
               precision    recall  f1-score   support

Non-Repeater       0.46      0.95      0.62       149
    Repeater       0.99      0.90      0.94      1584

    accuracy                           0.90      1733
   macro avg       0.73      0.92      0.78      1733
weighted avg       0.95      0.90      0.91      1733

Confusion Matrix:
 [[ 141    8]
 [ 166 1418]]

=== Fold 2/5 ===
Validation Accuracy: 0.6520
Classification Report:
               precision    recall  f1-score   support

Non-Repeater       0.20      0.99      0.33       150
    Repeater       1.00      0.62      0.76      1583

    accuracy                           0.65      1733
   macro avg       0.60      0.81      0.55      1733
weighted avg       0.93      0.65      0.73      1733

Confusion Matrix:
 [[149   1]
 [602 981]]

=== Fold 3/5 ===
Validation Accuracy: 0.7496
Classification Report:
               precision    recall  f1-score   support

Non-Repeater       0.26      0.99      0.41       150
    Repeater       1.00      0.73      0.84      1583

    accuracy                           0.75      1733
   macro avg       0.63      0.86      0.62      1733
weighted avg       0.93      0.75      0.80      1733

Confusion Matrix:
 [[ 149    1]
 [ 433 1150]]

=== Fold 4/5 ===
Validation Accuracy: 0.7051
Classification Report:
               precision    recall  f1-score   support

Non-Repeater       0.23      0.99      0.37       150
    Repeater       1.00      0.68      0.81      1583

    accuracy                           0.71      1733
   macro avg       0.61      0.83      0.59      1733
weighted avg       0.93      0.71      0.77      1733

Confusion Matrix:
 [[ 148    2]
 [ 509 1074]]

=== Fold 5/5 ===
Validation Accuracy: 0.7506
Classification Report:
               precision    recall  f1-score   support

Non-Repeater       0.25      0.97      0.40       149
    Repeater       1.00      0.73      0.84      1583

    accuracy                           0.75      1732
   macro avg       0.62      0.85      0.62      1732
weighted avg       0.93      0.75      0.80      1732

Confusion Matrix:
 [[ 144    5]
 [ 427 1156]]


=== Summary ===
Total False Positives: 17
Total False Negatives: 2137
Total True Positives: 5779
Total True Negatives: 731

Confusion Matrix (with duplicates):
              Non-Repeater  Repeater
Non-Repeater         731.0      17.0
Repeater            2137.0    5779.0
accuracy_score
0.7513850415512465
[I 2025-06-13 00:24:05,836] Trial 203 finished with value: 0.7513850415512465 and parameters: {'hidden_dim': 1512, 'latent_dim': 33, 'beta': 1.499835386756236, 'gamma': 0.1529199867440999, 'dropout_rate': 0.11952595714303979, 'lr': 0.0006985388532747816, 'scheduler_patience': 7, 'class_weight': 2.7856905795426306, 'activation': 'ReLU', 'classification_multiplier': 12323.363455124867}. Best is trial 194 with value: 0.8103647276084949.
/home/ubuntu/frb-analysis/.frb-analysis/lib/python3.12/site-packages/sklearn/metrics/_classification.py:1565: UndefinedMetricWarning: Precision is ill-defined and being set to 0.0 in labels with no predicted samples. Use `zero_division` parameter to control this behavior.
  _warn_prf(average, modifier, f"{metric.capitalize()} is", len(result))
/home/ubuntu/frb-analysis/.frb-analysis/lib/python3.12/site-packages/sklearn/metrics/_classification.py:1565: UndefinedMetricWarning: Precision is ill-defined and being set to 0.0 in labels with no predicted samples. Use `zero_division` parameter to control this behavior.
  _warn_prf(average, modifier, f"{metric.capitalize()} is", len(result))
/home/ubuntu/frb-analysis/.frb-analysis/lib/python3.12/site-packages/sklearn/metrics/_classification.py:1565: UndefinedMetricWarning: Precision is ill-defined and being set to 0.0 in labels with no predicted samples. Use `zero_division` parameter to control this behavior.
  _warn_prf(average, modifier, f"{metric.capitalize()} is", len(result))
/home/ubuntu/frb-analysis/.frb-analysis/lib/python3.12/site-packages/sklearn/metrics/_classification.py:1565: UndefinedMetricWarning: Precision is ill-defined and being set to 0.0 in labels with no predicted samples. Use `zero_division` parameter to control this behavior.
  _warn_prf(average, modifier, f"{metric.capitalize()} is", len(result))
/home/ubuntu/frb-analysis/.frb-analysis/lib/python3.12/site-packages/sklearn/metrics/_classification.py:1565: UndefinedMetricWarning: Precision is ill-defined and being set to 0.0 in labels with no predicted samples. Use `zero_division` parameter to control this behavior.
  _warn_prf(average, modifier, f"{metric.capitalize()} is", len(result))
/home/ubuntu/frb-analysis/.frb-analysis/lib/python3.12/site-packages/sklearn/metrics/_classification.py:1565: UndefinedMetricWarning: Precision is ill-defined and being set to 0.0 in labels with no predicted samples. Use `zero_division` parameter to control this behavior.
  _warn_prf(average, modifier, f"{metric.capitalize()} is", len(result))
[I 2025-06-13 00:30:33,635] Trial 204 finished with value: 0.18617266851338873 and parameters: {'hidden_dim': 1420, 'latent_dim': 32, 'beta': 1.321313770587961, 'gamma': 0.14342916908724695, 'dropout_rate': 0.10713899619745684, 'lr': 0.008430104844605279, 'scheduler_patience': 7, 'class_weight': 2.951660783164633, 'activation': 'ReLU', 'classification_multiplier': 12731.120672493453}. Best is trial 194 with value: 0.8103647276084949.
[I 2025-06-13 00:37:08,861] Trial 205 finished with value: 0.7556555863342567 and parameters: {'hidden_dim': 1462, 'latent_dim': 31, 'beta': 1.5631019299564686, 'gamma': 0.19896434304851135, 'dropout_rate': 0.13210094684871515, 'lr': 0.0004257951080297572, 'scheduler_patience': 7, 'class_weight': 2.869821235571118, 'activation': 'ReLU', 'classification_multiplier': 14665.768957055016}. Best is trial 194 with value: 0.8103647276084949.
Trial 1: hidden_dim=1512, latent_dim=33, beta=1.499835386756236, gamma=0.1529199867440999, dropout_rate=0.11952595714303979, lr=0.0006985388532747816, scheduler_patience=7, class_weight=2.7856905795426306, activation=ReLU, classification_multiplier=12323.363455124867

=== Fold 1/5 ===
Validation Accuracy: 0.0860
Classification Report:
               precision    recall  f1-score   support

Non-Repeater       0.09      1.00      0.16       149
    Repeater       0.00      0.00      0.00      1584

    accuracy                           0.09      1733
   macro avg       0.04      0.50      0.08      1733
weighted avg       0.01      0.09      0.01      1733

Confusion Matrix:
 [[ 149    0]
 [1584    0]]

=== Fold 2/5 ===
Validation Accuracy: 0.2631
Classification Report:
               precision    recall  f1-score   support

Non-Repeater       0.11      1.00      0.19       150
    Repeater       1.00      0.19      0.32      1583

    accuracy                           0.26      1733
   macro avg       0.55      0.60      0.26      1733
weighted avg       0.92      0.26      0.31      1733

Confusion Matrix:
 [[ 150    0]
 [1277  306]]

=== Fold 3/5 ===
Validation Accuracy: 0.0866
Classification Report:
               precision    recall  f1-score   support

Non-Repeater       0.09      1.00      0.16       150
    Repeater       0.00      0.00      0.00      1583

    accuracy                           0.09      1733
   macro avg       0.04      0.50      0.08      1733
weighted avg       0.01      0.09      0.01      1733

Confusion Matrix:
 [[ 150    0]
 [1583    0]]

=== Fold 4/5 ===
Validation Accuracy: 0.2712
Classification Report:
               precision    recall  f1-score   support

Non-Repeater       0.11      1.00      0.19       150
    Repeater       1.00      0.20      0.34      1583

    accuracy                           0.27      1733
   macro avg       0.55      0.60      0.26      1733
weighted avg       0.92      0.27      0.32      1733

Confusion Matrix:
 [[ 150    0]
 [1263  320]]

=== Fold 5/5 ===
Validation Accuracy: 0.2240
Classification Report:
               precision    recall  f1-score   support

Non-Repeater       0.10      1.00      0.18       149
    Repeater       1.00      0.15      0.26      1583

    accuracy                           0.22      1732
   macro avg       0.55      0.58      0.22      1732
weighted avg       0.92      0.22      0.26      1732

Confusion Matrix:
 [[ 149    0]
 [1344  239]]


=== Summary ===
Total False Positives: 0
Total False Negatives: 7051
Total True Positives: 865
Total True Negatives: 748

Confusion Matrix (with duplicates):
              Non-Repeater  Repeater
Non-Repeater         748.0       0.0
Repeater            7051.0     865.0
accuracy_score
0.18617266851338873
Trial 1: hidden_dim=1420, latent_dim=32, beta=1.321313770587961, gamma=0.14342916908724695, dropout_rate=0.10713899619745684, lr=0.008430104844605279, scheduler_patience=7, class_weight=2.951660783164633, activation=ReLU, classification_multiplier=12731.120672493453

=== Fold 1/5 ===
Validation Accuracy: 0.7126
Classification Report:
               precision    recall  f1-score   support

Non-Repeater       0.23      0.99      0.37       149
    Repeater       1.00      0.69      0.81      1584

    accuracy                           0.71      1733
   macro avg       0.61      0.84      0.59      1733
weighted avg       0.93      0.71      0.78      1733

Confusion Matrix:
 [[ 148    1]
 [ 497 1087]]

=== Fold 2/5 ===
Validation Accuracy: 0.7553
Classification Report:
               precision    recall  f1-score   support

Non-Repeater       0.26      0.99      0.41       150
    Repeater       1.00      0.73      0.85      1583

    accuracy                           0.76      1733
   macro avg       0.63      0.86      0.63      1733
weighted avg       0.94      0.76      0.81      1733

Confusion Matrix:
 [[ 149    1]
 [ 423 1160]]

=== Fold 3/5 ===
Validation Accuracy: 0.7582
Classification Report:
               precision    recall  f1-score   support

Non-Repeater       0.26      0.99      0.42       150
    Repeater       1.00      0.74      0.85      1583

    accuracy                           0.76      1733
   macro avg       0.63      0.86      0.63      1733
weighted avg       0.94      0.76      0.81      1733

Confusion Matrix:
 [[ 149    1]
 [ 418 1165]]

=== Fold 4/5 ===
Validation Accuracy: 0.6826
Classification Report:
               precision    recall  f1-score   support

Non-Repeater       0.21      0.99      0.35       150
    Repeater       1.00      0.65      0.79      1583

    accuracy                           0.68      1733
   macro avg       0.61      0.82      0.57      1733
weighted avg       0.93      0.68      0.75      1733

Confusion Matrix:
 [[ 148    2]
 [ 548 1035]]

=== Fold 5/5 ===
Validation Accuracy: 0.8695
Classification Report:
               precision    recall  f1-score   support

Non-Repeater       0.40      0.97      0.56       149
    Repeater       1.00      0.86      0.92      1583

    accuracy                           0.87      1732
   macro avg       0.70      0.92      0.74      1732
weighted avg       0.95      0.87      0.89      1732

Confusion Matrix:
 [[ 145    4]
 [ 222 1361]]


=== Summary ===
Total False Positives: 9
Total False Negatives: 2108
Total True Positives: 5808
Total True Negatives: 739

Confusion Matrix (with duplicates):
              Non-Repeater  Repeater
Non-Repeater         739.0       9.0
Repeater            2108.0    5808.0
accuracy_score
0.7556555863342567
Trial 1: hidden_dim=1462, latent_dim=31, beta=1.5631019299564686, gamma=0.19896434304851135, dropout_rate=0.13210094684871515, lr=0.0004257951080297572, scheduler_patience=7, class_weight=2.869821235571118, activation=ReLU, classification_multiplier=14665.768957055016

=== Fold 1/5 ===
Validation Accuracy: 0.6174
Classification Report:
               precision    recall  f1-score   support

Non-Repeater       0.18      0.99      0.31       149
    Repeater       1.00      0.58      0.74      1584

    accuracy                           0.62      1733
   macro avg       0.59      0.79      0.52      1733
weighted avg       0.93      0.62      0.70      1733

Confusion Matrix:
 [[148   1]
 [662 922]]

=== Fold 2/5 ===
Validation Accuracy: 0.4916
Classification Report:
               precision    recall  f1-score   support

Non-Repeater       0.15      1.00      0.25       150
    Repeater       1.00      0.44      0.61      1583

    accuracy                           0.49      1733
   macro avg       0.57      0.72      0.43      1733
weighted avg       0.93      0.49      0.58      1733

Confusion Matrix:
 [[150   0]
 [881 702]]

=== Fold 3/5 ===
Validation Accuracy: 0.7669
Classification Report:
               precision    recall  f1-score   support

Non-Repeater       0.27      0.99      0.42       150
    Repeater       1.00      0.75      0.85      1583

    accuracy                           0.77      1733
   macro avg       0.63      0.87      0.64      1733
weighted avg       0.94      0.77      0.82      1733

Confusion Matrix:
 [[ 148    2]
 [ 402 1181]]

=== Fold 4/5 ===
Validation Accuracy: 0.7755
Classification Report:
               precision    recall  f1-score   support

Non-Repeater       0.28      0.98      0.43       150
    Repeater       1.00      0.76      0.86      1583

    accuracy                           0.78      1733
   macro avg       0.64      0.87      0.65      1733
weighted avg       0.94      0.78      0.82      1733

Confusion Matrix:
 [[ 147    3]
 [ 386 1197]]

=== Fold 5/5 ===
Validation Accuracy: 0.8609
Classification Report:
               precision    recall  f1-score   support

Non-Repeater       0.38      0.97      0.54       149
    Repeater       1.00      0.85      0.92      1583

    accuracy                           0.86      1732
   macro avg       0.69      0.91      0.73      1732
weighted avg       0.94      0.86      0.89      1732

Confusion Matrix:
 [[ 144    5]
 [ 236 1347]]


=== Summary ===
Total False Positives: 11
Total False Negatives: 2567
Total True Positives: 5349
Total True Negatives: 737
[I 2025-06-13 00:43:33,324] Trial 206 finished with value: 0.7024469067405356 and parameters: {'hidden_dim': 1384, 'latent_dim': 34, 'beta': 1.3616767920578052, 'gamma': 0.24547160603425427, 'dropout_rate': 0.1001639335167148, 'lr': 0.0008287789425568224, 'scheduler_patience': 7, 'class_weight': 2.765243048496788, 'activation': 'ReLU', 'classification_multiplier': 13962.616269935475}. Best is trial 194 with value: 0.8103647276084949.
[I 2025-06-13 00:49:52,644] Trial 207 finished with value: 0.7446906740535549 and parameters: {'hidden_dim': 1336, 'latent_dim': 33, 'beta': 1.2368263241304671, 'gamma': 0.17022621096118, 'dropout_rate': 0.14006963462138255, 'lr': 0.0005869123947414656, 'scheduler_patience': 7, 'class_weight': 2.6752467114284384, 'activation': 'ReLU', 'classification_multiplier': 14148.093230448707}. Best is trial 194 with value: 0.8103647276084949.
