[I 2025-06-12 19:25:18,699] Trial 157 finished with value: 0.7285318559556787 and parameters: {'hidden_dim': 1414, 'latent_dim': 32, 'beta': 1.3371472306945553, 'gamma': 0.17053366916306542, 'dropout_rate': 0.10962612857991975, 'lr': 0.0002917024678534526, 'scheduler_patience': 7, 'class_weight': 2.7117687768481047, 'activation': 'ReLU', 'classification_multiplier': 13165.402360197399}. Best is trial 142 with value: 0.7733148661126501.
              precision    recall  f1-score   support

Non-Repeater       0.23      0.99      0.37       150
    Repeater       1.00      0.68      0.81      1583

    accuracy                           0.70      1733
   macro avg       0.61      0.83      0.59      1733
weighted avg       0.93      0.70      0.77      1733

Confusion Matrix:
 [[ 149    1]
 [ 513 1070]]

=== Fold 3/5 ===
Validation Accuracy: 0.7484
Classification Report:
               precision    recall  f1-score   support

Non-Repeater       0.25      0.99      0.40       150
    Repeater       1.00      0.73      0.84      1583

    accuracy                           0.75      1733
   macro avg       0.63      0.86      0.62      1733
weighted avg       0.93      0.75      0.80      1733

Confusion Matrix:
 [[ 148    2]
 [ 434 1149]]

=== Fold 4/5 ===
Validation Accuracy: 0.7686
Classification Report:
               precision    recall  f1-score   support

Non-Repeater       0.27      0.99      0.42       150
    Repeater       1.00      0.75      0.86      1583

    accuracy                           0.77      1733
   macro avg       0.63      0.87      0.64      1733
weighted avg       0.94      0.77      0.82      1733

Confusion Matrix:
 [[ 148    2]
 [ 399 1184]]

=== Fold 5/5 ===
Validation Accuracy: 0.8256
Classification Report:
               precision    recall  f1-score   support

Non-Repeater       0.33      0.97      0.49       149
    Repeater       1.00      0.81      0.89      1583

    accuracy                           0.83      1732
   macro avg       0.66      0.89      0.69      1732
weighted avg       0.94      0.83      0.86      1732

Confusion Matrix:
 [[ 145    4]
 [ 298 1285]]


=== Summary ===
Total False Positives: 10
Total False Negatives: 2146
Total True Positives: 5770
Total True Negatives: 738

Confusion Matrix (with duplicates):
              Non-Repeater  Repeater
Non-Repeater         738.0      10.0
Repeater            2146.0    5770.0
accuracy_score
0.7511542012927055
Trial 1: hidden_dim=1266, latent_dim=33, beta=1.358427779588129, gamma=0.18012750889137796, dropout_rate=0.11817444345582745, lr=0.00030001131236820534, scheduler_patience=7, class_weight=2.9348765103667276, activation=ReLU, classification_multiplier=13738.803261522733

=== Fold 1/5 ===
Validation Accuracy: 0.5540
Classification Report:
               precision    recall  f1-score   support

Non-Repeater       0.16      1.00      0.28       149
    Repeater       1.00      0.51      0.68      1584

    accuracy                           0.55      1733
   macro avg       0.58      0.76      0.48      1733
weighted avg       0.93      0.55      0.64      1733

Confusion Matrix:
 [[149   0]
 [773 811]]

=== Fold 2/5 ===
Validation Accuracy: 0.5020
Classification Report:
               precision    recall  f1-score   support

Non-Repeater       0.15      0.99      0.26       150
    Repeater       1.00      0.46      0.63      1583

    accuracy                           0.50      1733
   macro avg       0.57      0.72      0.44      1733
weighted avg       0.92      0.50      0.59      1733

Confusion Matrix:
 [[149   1]
 [862 721]]

=== Fold 3/5 ===
Validation Accuracy: 0.5026
Classification Report:
               precision    recall  f1-score   support

Non-Repeater       0.15      0.99      0.26       150
    Repeater       1.00      0.46      0.63      1583

    accuracy                           0.50      1733
   macro avg       0.57      0.72      0.44      1733
weighted avg       0.92      0.50      0.59      1733

Confusion Matrix:
 [[149   1]
 [861 722]]

=== Fold 4/5 ===
Validation Accuracy: 0.4218
Classification Report:
               precision    recall  f1-score   support

Non-Repeater       0.13      0.98      0.23       150
    Repeater       0.99      0.37      0.54      1583

    accuracy                           0.42      1733
   macro avg       0.56      0.67      0.38      1733
weighted avg       0.92      0.42      0.51      1733

Confusion Matrix:
 [[147   3]
 [999 584]]

=== Fold 5/5 ===
Validation Accuracy: 0.6617
Classification Report:
               precision    recall  f1-score   support

Non-Repeater       0.20      0.99      0.34       149
    Repeater       1.00      0.63      0.77      1583

    accuracy                           0.66      1732
   macro avg       0.60      0.81      0.55      1732
weighted avg       0.93      0.66      0.74      1732

Confusion Matrix:
 [[148   1]
 [585 998]]


=== Summary ===
Total False Positives: 6
Total False Negatives: 4080
Total True Positives: 3836
Total True Negatives: 742

Confusion Matrix (with duplicates):
              Non-Repeater  Repeater
Non-Repeater         742.0       6.0
Repeater            4080.0    3836.0
accuracy_score
0.528393351800554
Trial 1: hidden_dim=1345, latent_dim=32, beta=1.3651737522889602, gamma=0.18392582318505282, dropout_rate=0.11669606540146361, lr=0.00010829680706272207, scheduler_patience=7, class_weight=2.950890836919471, activation=ELU, classification_multiplier=13762.760759678968

=== Fold 1/5 ===
Validation Accuracy: 0.7149
Classification Report:
               precision    recall  f1-score   support

Non-Repeater       0.23      0.99      0.37       149
    Repeater       1.00      0.69      0.82      1584

    accuracy                           0.71      1733
   macro avg       0.61      0.84      0.60      1733
weighted avg       0.93      0.71      0.78      1733

Confusion Matrix:
 [[ 148    1]
 [ 493 1091]]

=== Fold 2/5 ===
Validation Accuracy: 0.7744
Classification Report:
               precision    recall  f1-score   support

Non-Repeater       0.28      0.99      0.43       150
    Repeater       1.00      0.75      0.86      1583

    accuracy                           0.77      1733
   macro avg       0.64      0.87      0.65      1733
weighted avg       0.94      0.77      0.82      1733

Confusion Matrix:
 [[ 149    1]
 [ 390 1193]]

=== Fold 3/5 ===
Validation Accuracy: 0.6988
Classification Report:
               precision    recall  f1-score   support

Non-Repeater       0.22      0.99      0.36       150
    Repeater       1.00      0.67      0.80      1583

    accuracy                           0.70      1733
   macro avg       0.61      0.83      0.58      1733
weighted avg       0.93      0.70      0.76      1733

Confusion Matrix:
 [[ 149    1]
 [ 521 1062]]

=== Fold 4/5 ===
Validation Accuracy: 0.7051
Classification Report:
               precision    recall  f1-score   support

Non-Repeater       0.22      0.98      0.37       150
    Repeater       1.00      0.68      0.81      1583

    accuracy                           0.71      1733
   macro avg       0.61      0.83      0.59      1733
weighted avg       0.93      0.71      0.77      1733

Confusion Matrix:
 [[ 147    3]
 [ 508 1075]]

=== Fold 5/5 ===
Validation Accuracy: 0.7494
Classification Report:
               precision    recall  f1-score   support

Non-Repeater       0.25      0.99      0.40       149
    Repeater       1.00      0.73      0.84      1583

    accuracy                           0.75      1732
   macro avg       0.63      0.86      0.62      1732
weighted avg       0.93      0.75      0.80      1732

Confusion Matrix:
 [[ 147    2]
 [ 432 1151]]


=== Summary ===
Total False Positives: 8
Total False Negatives: 2344
Total True Positives: 5572
Total True Negatives: 740

Confusion Matrix (with duplicates):
              Non-Repeater  Repeater
Non-Repeater         740.0       8.0
Repeater            2344.0    5572.0
accuracy_score
0.7285318559556787
Trial 1: hidden_dim=1414, latent_dim=32, beta=1.3371472306945553, gamma=0.17053366916306542, dropout_rate=0.10962612857991975, lr=0.0002917024678534526, scheduler_patience=7, class_weight=2.7117687768481047, activation=ReLU, classification_multiplier=13165.402360197399

=== Fold 1/5 ===
Validation Accuracy: 0.8061
Classification Report:
 [I 2025-06-12 19:31:31,968] Trial 158 finished with value: 0.7349953831948292 and parameters: {'hidden_dim': 1265, 'latent_dim': 33, 'beta': 1.285495514966562, 'gamma': 0.21181774888058805, 'dropout_rate': 0.12126283380084822, 'lr': 0.00026108092729671523, 'scheduler_patience': 7, 'class_weight': 2.781566773733995, 'activation': 'ReLU', 'classification_multiplier': 13611.870737916644}. Best is trial 142 with value: 0.7733148661126501.
[I 2025-06-12 19:37:43,831] Trial 159 finished with value: 0.7490766389658357 and parameters: {'hidden_dim': 1264, 'latent_dim': 31, 'beta': 1.2771938285421627, 'gamma': 0.20189512944414884, 'dropout_rate': 0.12401206794703348, 'lr': 0.00033632989294936285, 'scheduler_patience': 7, 'class_weight': 2.9893979352181628, 'activation': 'ReLU', 'classification_multiplier': 13506.208145575245}. Best is trial 142 with value: 0.7733148661126501.
              precision    recall  f1-score   support

Non-Repeater       0.31      0.99      0.47       149
    Repeater       1.00      0.79      0.88      1584

    accuracy                           0.81      1733
   macro avg       0.65      0.89      0.67      1733
weighted avg       0.94      0.81      0.85      1733

Confusion Matrix:
 [[ 147    2]
 [ 334 1250]]

=== Fold 2/5 ===
Validation Accuracy: 0.6572
Classification Report:
               precision    recall  f1-score   support

Non-Repeater       0.20      0.99      0.33       150
    Repeater       1.00      0.63      0.77      1583

    accuracy                           0.66      1733
   macro avg       0.60      0.81      0.55      1733
weighted avg       0.93      0.66      0.73      1733

Confusion Matrix:
 [[149   1]
 [593 990]]

=== Fold 3/5 ===
Validation Accuracy: 0.7415
Classification Report:
               precision    recall  f1-score   support

Non-Repeater       0.25      0.99      0.40       150
    Repeater       1.00      0.72      0.84      1583

    accuracy                           0.74      1733
   macro avg       0.62      0.86      0.62      1733
weighted avg       0.93      0.74      0.80      1733

Confusion Matrix:
 [[ 149    1]
 [ 447 1136]]

=== Fold 4/5 ===
Validation Accuracy: 0.7040
Classification Report:
               precision    recall  f1-score   support

Non-Repeater       0.22      0.97      0.36       150
    Repeater       1.00      0.68      0.81      1583

    accuracy                           0.70      1733
   macro avg       0.61      0.83      0.58      1733
weighted avg       0.93      0.70      0.77      1733

Confusion Matrix:
 [[ 146    4]
 [ 509 1074]]

=== Fold 5/5 ===
Validation Accuracy: 0.7662
Classification Report:
               precision    recall  f1-score   support

Non-Repeater       0.27      0.97      0.42       149
    Repeater       1.00      0.75      0.85      1583

    accuracy                           0.77      1732
   macro avg       0.63      0.86      0.64      1732
weighted avg       0.93      0.77      0.82      1732

Confusion Matrix:
 [[ 145    4]
 [ 401 1182]]


=== Summary ===
Total False Positives: 12
Total False Negatives: 2284
Total True Positives: 5632
Total True Negatives: 736

Confusion Matrix (with duplicates):
              Non-Repeater  Repeater
Non-Repeater         736.0      12.0
Repeater            2284.0    5632.0
accuracy_score
0.7349953831948292
Trial 1: hidden_dim=1265, latent_dim=33, beta=1.285495514966562, gamma=0.21181774888058805, dropout_rate=0.12126283380084822, lr=0.00026108092729671523, scheduler_patience=7, class_weight=2.781566773733995, activation=ReLU, classification_multiplier=13611.870737916644

=== Fold 1/5 ===
Validation Accuracy: 0.7080
Classification Report:
               precision    recall  f1-score   support

Non-Repeater       0.23      0.99      0.37       149
    Repeater       1.00      0.68      0.81      1584

    accuracy                           0.71      1733
   macro avg       0.61      0.84      0.59      1733
weighted avg       0.93      0.71      0.77      1733

Confusion Matrix:
 [[ 148    1]
 [ 505 1079]]

=== Fold 2/5 ===
Validation Accuracy: 0.8350
Classification Report:
               precision    recall  f1-score   support

Non-Repeater       0.34      0.97      0.51       150
    Repeater       1.00      0.82      0.90      1583

    accuracy                           0.83      1733
   macro avg       0.67      0.90      0.70      1733
weighted avg       0.94      0.83      0.87      1733

Confusion Matrix:
 [[ 146    4]
 [ 282 1301]]

=== Fold 3/5 ===
Validation Accuracy: 0.7421
Classification Report:
               precision    recall  f1-score   support

Non-Repeater       0.25      0.99      0.40       150
    Repeater       1.00      0.72      0.84      1583

    accuracy                           0.74      1733
   macro avg       0.62      0.85      0.62      1733
weighted avg       0.93      0.74      0.80      1733

Confusion Matrix:
 [[ 148    2]
 [ 445 1138]]

=== Fold 4/5 ===
Validation Accuracy: 0.6976
Classification Report:
               precision    recall  f1-score   support

Non-Repeater       0.22      0.99      0.36       150
    Repeater       1.00      0.67      0.80      1583

    accuracy                           0.70      1733
   macro avg       0.61      0.83      0.58      1733
weighted avg       0.93      0.70      0.76      1733

Confusion Matrix:
 [[ 148    2]
 [ 522 1061]]

=== Fold 5/5 ===
Validation Accuracy: 0.7627
Classification Report:
               precision    recall  f1-score   support

Non-Repeater       0.26      0.98      0.42       149
    Repeater       1.00      0.74      0.85      1583

    accuracy                           0.76      1732
   macro avg       0.63      0.86      0.63      1732
weighted avg       0.93      0.76      0.81      1732

Confusion Matrix:
 [[ 146    3]
 [ 408 1175]]


=== Summary ===
Total False Positives: 12
Total False Negatives: 2162
Total True Positives: 5754
Total True Negatives: 736

Confusion Matrix (with duplicates):
              Non-Repeater  Repeater
Non-Repeater         736.0      12.0
Repeater            2162.0    5754.0
accuracy_score
0.7490766389658357
Trial 1: hidden_dim=1264, latent_dim=31, beta=1.2771938285421627, gamma=0.20189512944414884, dropout_rate=0.12401206794703348, lr=0.00033632989294936285, scheduler_patience=7, class_weight=2.9893979352181628, activation=ReLU, classification_multiplier=13506.208145575245

=== Fold 1/5 ===
Validation Accuracy: 0.7323
Classification Report:
               precision    recall  f1-score   support

Non-Repeater       0.24      0.99      0.39       149
    Repeater       1.00      0.71      0.83      1584

    accuracy                           0.73      1733
   macro avg       0.62      0.85      0.61      1733
weighted avg       0.93      0.73      0.79      1733

Confusion Matrix:
 [[ 148    1]
 [ 463 1121]]

=== Fold 2/5 ===
Validation Accuracy: 0.7144
Classification Report:
               precision    recall  f1-score   support

Non-Repeater       0.23      0.99      0.38       150
    Repeater       1.00      0.69      0.81      1583

    accuracy                           0.71      1733
   macro avg       0.62      0.84      0.60      1733
weighted avg       0.93      0.71      0.78      1733

Confusion Matrix:
 [[ 149    1]
 [ 494 1089]]

=== Fold 3/5 ===
Validation Accuracy: 0.7242
Classification Report:
               precision    recall  f1-score   support

Non-Repeater       0.24      0.99      0.38       150
    Repeater       1.00      0.70      0.82      1583

    accuracy                           0.72      1733
   macro avg       0.62      0.84      0.60      1733
weighted avg       0.93      0.72      0.78      1733

Confusion Matrix:
 [[ 148    2]
 [ 476 1107]]

=== Fold 4/5 ===
Validation Accuracy: 0.7103
Classification Report:
               precision    recall  f1-score   support

Non-Repeater       0.23      0.99      0.37       150
    Repeater       1.00      0.68      0.81      1583

    accuracy                           0.71      1733
   macro avg       0.61      0.84      0.59      1733
weighted avg       0.93      0.71      0.77      1733

Confusion Matrix:
 [[ 148    2]
 [ 500 1083]]

=== Fold 5/5 ===
Validation Accuracy: 0.7818
Classification Report:
               precision    recall  f1-score   support

Non-Repeater       0.28      0.98      0.44       149
    Repeater       1.00      0.76      0.86      1583

    accuracy                           0.78      1732
   macro avg       0.64      0.87      0.65      1732
weighted avg       0.94      0.78      0.83      1732

Confusion Matrix:
 [[ 146    3]
 [ 375 1208]]


=== Summary ===
Total False Positives: 9
Total False Negatives: 2308
Total True Positives: 5608
Total True Negatives: 739

Confusion Matrix (with duplicates):
              Non-Repeater  Repeater
Non-Repeater         739.0       9.0
Repeater            2308.0    5608.0
accuracy_score
0.7325715604801477
[I 2025-06-12 19:43:55,616] Trial 160 finished with value: 0.7325715604801477 and parameters: {'hidden_dim': 1270, 'latent_dim': 31, 'beta': 1.276240897475484, 'gamma': 0.20903859653694626, 'dropout_rate': 0.12330331759314654, 'lr': 0.0003265301319897846, 'scheduler_patience': 7, 'class_weight': 2.5869196916745567, 'activation': 'ReLU', 'classification_multiplier': 13585.734892314254}. Best is trial 142 with value: 0.7733148661126501.
[I 2025-06-12 19:50:07,285] Trial 161 finished with value: 0.7528855032317636 and parameters: {'hidden_dim': 1272, 'latent_dim': 31, 'beta': 1.271812680644501, 'gamma': 0.21034177588369385, 'dropout_rate': 0.1226553528193593, 'lr': 0.00011320051210818893, 'scheduler_patience': 7, 'class_weight': 2.8858274407590363, 'activation': 'ReLU', 'classification_multiplier': 13581.376756853797}. Best is trial 142 with value: 0.7733148661126501.
