[I 2025-06-12 04:22:56,505] Trial 7 finished with value: 0.44575253924284397 and parameters: {'hidden_dim': 810, 'latent_dim': 26, 'beta': 0.3878851311691419, 'gamma': 0.7372121137956433, 'dropout_rate': 0.2008644881028262, 'lr': 0.0015149543961569705, 'scheduler_patience': 4, 'class_weight': 1.329258248939823, 'activation': 'GELU', 'classification_multiplier': 5637.172499200599}. Best is trial 0 with value: 0.4577562326869806.

Confusion Matrix (with duplicates):
              Non-Repeater  Repeater
Non-Repeater         748.0       0.0
Repeater            7619.0     297.0
accuracy_score
0.1206140350877193
Trial 1: hidden_dim=1786, latent_dim=16, beta=0.9467773005531392, gamma=0.25237552441151545, dropout_rate=0.3626927526364896, lr=0.0028474007452730047, scheduler_patience=6, class_weight=2.18913119354497, activation=ELU, classification_multiplier=11234.091335753572

=== Fold 1/5 ===
Validation Accuracy: 0.0860
Classification Report:
               precision    recall  f1-score   support

Non-Repeater       0.09      1.00      0.16       149
    Repeater       0.00      0.00      0.00      1584

    accuracy                           0.09      1733
   macro avg       0.04      0.50      0.08      1733
weighted avg       0.01      0.09      0.01      1733

Confusion Matrix:
 [[ 149    0]
 [1584    0]]

=== Fold 2/5 ===
Validation Accuracy: 0.0866
Classification Report:
               precision    recall  f1-score   support

Non-Repeater       0.09      1.00      0.16       150
    Repeater       0.00      0.00      0.00      1583

    accuracy                           0.09      1733
   macro avg       0.04      0.50      0.08      1733
weighted avg       0.01      0.09      0.01      1733

Confusion Matrix:
 [[ 150    0]
 [1583    0]]

=== Fold 3/5 ===
Validation Accuracy: 0.0998
Classification Report:
               precision    recall  f1-score   support

Non-Repeater       0.09      1.00      0.16       150
    Repeater       1.00      0.01      0.03      1583

    accuracy                           0.10      1733
   macro avg       0.54      0.51      0.09      1733
weighted avg       0.92      0.10      0.04      1733

Confusion Matrix:
 [[ 150    0]
 [1560   23]]

=== Fold 4/5 ===
Validation Accuracy: 0.0866
Classification Report:
               precision    recall  f1-score   support

Non-Repeater       0.09      1.00      0.16       150
    Repeater       0.00      0.00      0.00      1583

    accuracy                           0.09      1733
   macro avg       0.04      0.50      0.08      1733
weighted avg       0.01      0.09      0.01      1733

Confusion Matrix:
 [[ 150    0]
 [1583    0]]

=== Fold 5/5 ===
Validation Accuracy: 0.0860
Classification Report:
               precision    recall  f1-score   support

Non-Repeater       0.09      1.00      0.16       149
    Repeater       0.00      0.00      0.00      1583

    accuracy                           0.09      1732
   macro avg       0.04      0.50      0.08      1732
weighted avg       0.01      0.09      0.01      1732

Confusion Matrix:
 [[ 149    0]
 [1583    0]]


=== Summary ===
Total False Positives: 0
Total False Negatives: 7893
Total True Positives: 23
Total True Negatives: 748

Confusion Matrix (with duplicates):
              Non-Repeater  Repeater
Non-Repeater         748.0       0.0
Repeater            7893.0      23.0
accuracy_score
0.08898891966759002
Trial 1: hidden_dim=324, latent_dim=37, beta=0.3020924668221476, gamma=1.5459022192092853, dropout_rate=0.40462950464473324, lr=0.006739504536532631, scheduler_patience=3, class_weight=0.7937976345258315, activation=ELU, classification_multiplier=9561.306530344955

=== Fold 1/5 ===
Validation Accuracy: 0.4622
Classification Report:
               precision    recall  f1-score   support

Non-Repeater       0.14      0.99      0.24       149
    Repeater       1.00      0.41      0.58      1584

    accuracy                           0.46      1733
   macro avg       0.57      0.70      0.41      1733
weighted avg       0.92      0.46      0.55      1733

Confusion Matrix:
 [[148   1]
 [931 653]]

=== Fold 2/5 ===
Validation Accuracy: 0.2972
Classification Report:
               precision    recall  f1-score   support

Non-Repeater       0.11      1.00      0.20       150
    Repeater       1.00      0.23      0.37      1583

    accuracy                           0.30      1733
   macro avg       0.55      0.62      0.29      1733
weighted avg       0.92      0.30      0.36      1733

Confusion Matrix:
 [[ 150    0]
 [1218  365]]

=== Fold 3/5 ===
Validation Accuracy: 0.3560
Classification Report:
               precision    recall  f1-score   support

Non-Repeater       0.12      1.00      0.21       150
    Repeater       1.00      0.30      0.46      1583

    accuracy                           0.36      1733
   macro avg       0.56      0.65      0.33      1733
weighted avg       0.92      0.36      0.43      1733

Confusion Matrix:
 [[ 150    0]
 [1116  467]]

=== Fold 4/5 ===
Validation Accuracy: 0.5147
Classification Report:
               precision    recall  f1-score   support

Non-Repeater       0.15      1.00      0.26       150
    Repeater       1.00      0.47      0.64      1583

    accuracy                           0.51      1733
   macro avg       0.58      0.73      0.45      1733
weighted avg       0.93      0.51      0.61      1733

Confusion Matrix:
 [[150   0]
 [841 742]]

=== Fold 5/5 ===
Validation Accuracy: 0.5987
Classification Report:
               precision    recall  f1-score   support

Non-Repeater       0.18      1.00      0.30       149
    Repeater       1.00      0.56      0.72      1583

    accuracy                           0.60      1732
   macro avg       0.59      0.78      0.51      1732
weighted avg       0.93      0.60      0.68      1732

Confusion Matrix:
 [[149   0]
 [695 888]]


=== Summary ===
Total False Positives: 1
Total False Negatives: 4801
Total True Positives: 3115
Total True Negatives: 747

Confusion Matrix (with duplicates):
              Non-Repeater  Repeater
Non-Repeater         747.0       1.0
Repeater            4801.0    3115.0
accuracy_score
0.44575253924284397
Trial 1: hidden_dim=810, latent_dim=26, beta=0.3878851311691419, gamma=0.7372121137956433, dropout_rate=0.2008644881028262, lr=0.0015149543961569705, scheduler_patience=4, class_weight=1.329258248939823, activation=GELU, classification_multiplier=5637.172499200599

=== Fold 1/5 ===
Validation Accuracy: 0.5609
Classification Report:
               precision    recall  f1-score   support

Non-Repeater       0.16      0.99      0.28       149
    Repeater       1.00      0.52      0.68      1584

    accuracy                           0.56      1733
   macro avg       0.58      0.76      0.48      1733
weighted avg       0.93      0.56      0.65      1733

Confusion Matrix:
 [[148   1]
 [760 824]]

=== Fold 2/5 ===
Validation Accuracy: 0.7057
Classification Report:
               precision    recall  f1-score   support

Non-Repeater       0.23      0.99      0.37       150
    Repeater       1.00      0.68      0.81      1583

    accuracy                           0.71      1733
   macro avg       0.61      0.83      0.59      1733
weighted avg       0.93      0.71      0.77      1733

Confusion Matrix:
 [[ 148    2]
 [ 508 1075]]

=== Fold 3/5 ===
Validation Accuracy: 0.6070
Classification Report:
               precision    recall  f1-score   support

Non-Repeater       0.18      0.99      0.30       150
    Repeater       1.00      0.57      0.73      1583

    accuracy                           0.61      1733
   macro avg       0.59      0.78      0.52      1733
weighted avg       0.93      0.61      0.69      1733

Confusion Matrix:
 [[149   1]
 [680 903]]

=== Fold 4/5 ===
Validation Accuracy: 0.5880
Classification Report:
               precision    recall  f1-score   support

Non-Repeater       0.17      0.99      0.29       150
    Repeater       1.00      0.55      0.71      1583

    accuracy                           0.59      1733
   macro avg       0.58      0.77      0.50      1733
weighted avg       0.93      0.59      0.67      1733

Confusion Matrix:
 [[148   2]
 [712 871]]

=== Fold 5/5 ===
Validation Accuracy: 0.7425
Classification Report:
               precision    recall  f1-score   support

Non-Repeater       0.25      0.97      0.39       149
    Repeater       1.00      0.72      0.84      1583

    accuracy                           0.74      1732
   macro avg       0.62      0.85      0.62      1732
weighted avg       0.93      0.74      0.80      1732

Confusion Matrix:
 [I 2025-06-12 04:28:23,529] Trial 8 finished with value: 0.6408125577100646 and parameters: {'hidden_dim': 616, 'latent_dim': 18, 'beta': 0.16183003097611912, 'gamma': 1.8513168915475995, 'dropout_rate': 0.13109725059093186, 'lr': 0.0015805269822011287, 'scheduler_patience': 6, 'class_weight': 2.8996998970892265, 'activation': 'GELU', 'classification_multiplier': 11928.619525344111}. Best is trial 8 with value: 0.6408125577100646.
[I 2025-06-12 04:33:51,505] Trial 9 finished with value: 0.33229455216989845 and parameters: {'hidden_dim': 459, 'latent_dim': 10, 'beta': 0.7910468573559705, 'gamma': 0.3125268387188753, 'dropout_rate': 0.32413235031406185, 'lr': 0.005054154887945127, 'scheduler_patience': 4, 'class_weight': 2.9893550713721995, 'activation': 'ELU', 'classification_multiplier': 8963.224744486728}. Best is trial 8 with value: 0.6408125577100646.
/home/ubuntu/frb-analysis/.frb-analysis/lib/python3.12/site-packages/sklearn/metrics/_classification.py:1565: UndefinedMetricWarning: Precision is ill-defined and being set to 0.0 in labels with no predicted samples. Use `zero_division` parameter to control this behavior.
  _warn_prf(average, modifier, f"{metric.capitalize()} is", len(result))
/home/ubuntu/frb-analysis/.frb-analysis/lib/python3.12/site-packages/sklearn/metrics/_classification.py:1565: UndefinedMetricWarning: Precision is ill-defined and being set to 0.0 in labels with no predicted samples. Use `zero_division` parameter to control this behavior.
  _warn_prf(average, modifier, f"{metric.capitalize()} is", len(result))
/home/ubuntu/frb-analysis/.frb-analysis/lib/python3.12/site-packages/sklearn/metrics/_classification.py:1565: UndefinedMetricWarning: Precision is ill-defined and being set to 0.0 in labels with no predicted samples. Use `zero_division` parameter to control this behavior.
  _warn_prf(average, modifier, f"{metric.capitalize()} is", len(result))
/home/ubuntu/frb-analysis/.frb-analysis/lib/python3.12/site-packages/sklearn/metrics/_classification.py:1565: UndefinedMetricWarning: Precision is ill-defined and being set to 0.0 in labels with no predicted samples. Use `zero_division` parameter to control this behavior.
  _warn_prf(average, modifier, f"{metric.capitalize()} is", len(result))
/home/ubuntu/frb-analysis/.frb-analysis/lib/python3.12/site-packages/sklearn/metrics/_classification.py:1565: UndefinedMetricWarning: Precision is ill-defined and being set to 0.0 in labels with no predicted samples. Use `zero_division` parameter to control this behavior.
  _warn_prf(average, modifier, f"{metric.capitalize()} is", len(result))
/home/ubuntu/frb-analysis/.frb-analysis/lib/python3.12/site-packages/sklearn/metrics/_classification.py:1565: UndefinedMetricWarning: Precision is ill-defined and being set to 0.0 in labels with no predicted samples. Use `zero_division` parameter to control this behavior.
  _warn_prf(average, modifier, f"{metric.capitalize()} is", len(result))
/home/ubuntu/frb-analysis/.frb-analysis/lib/python3.12/site-packages/sklearn/metrics/_classification.py:1565: UndefinedMetricWarning: Precision is ill-defined and being set to 0.0 in labels with no predicted samples. Use `zero_division` parameter to control this behavior.
  _warn_prf(average, modifier, f"{metric.capitalize()} is", len(result))
/home/ubuntu/frb-analysis/.frb-analysis/lib/python3.12/site-packages/sklearn/metrics/_classification.py:1565: UndefinedMetricWarning: Precision is ill-defined and being set to 0.0 in labels with no predicted samples. Use `zero_division` parameter to control this behavior.
  _warn_prf(average, modifier, f"{metric.capitalize()} is", len(result))
/home/ubuntu/frb-analysis/.frb-analysis/lib/python3.12/site-packages/sklearn/metrics/_classification.py:1565: UndefinedMetricWarning: Precision is ill-defined and being set to 0.0 in labels with no predicted samples. Use `zero_division` parameter to control this behavior.
  _warn_prf(average, modifier, f"{metric.capitalize()} is", len(result))
/home/ubuntu/frb-analysis/.frb-analysis/lib/python3.12/site-packages/sklearn/metrics/_classification.py:1565: UndefinedMetricWarning: Precision is ill-defined and being set to 0.0 in labels with no predicted samples. Use `zero_division` parameter to control this behavior.
  _warn_prf(average, modifier, f"{metric.capitalize()} is", len(result))
/home/ubuntu/frb-analysis/.frb-analysis/lib/python3.12/site-packages/sklearn/metrics/_classification.py:1565: UndefinedMetricWarning: Precision is ill-defined and being set to 0.0 in labels with no predicted samples. Use `zero_division` parameter to control this behavior.
  _warn_prf(average, modifier, f"{metric.capitalize()} is", len(result))
/home/ubuntu/frb-analysis/.frb-analysis/lib/python3.12/site-packages/sklearn/metrics/_classification.py:1565: UndefinedMetricWarning: Precision is ill-defined and being set to 0.0 in labels with no predicted samples. Use `zero_division` parameter to control this behavior.
  _warn_prf(average, modifier, f"{metric.capitalize()} is", len(result))
/home/ubuntu/frb-analysis/.frb-analysis/lib/python3.12/site-packages/sklearn/metrics/_classification.py:1565: UndefinedMetricWarning: Precision is ill-defined and being set to 0.0 in labels with no predicted samples. Use `zero_division` parameter to control this behavior.
  _warn_prf(average, modifier, f"{metric.capitalize()} is", len(result))
/home/ubuntu/frb-analysis/.frb-analysis/lib/python3.12/site-packages/sklearn/metrics/_classification.py:1565: UndefinedMetricWarning: Precision is ill-defined and being set to 0.0 in labels with no predicted samples. Use `zero_division` parameter to control this behavior.
  _warn_prf(average, modifier, f"{metric.capitalize()} is", len(result))
/home/ubuntu/frb-analysis/.frb-analysis/lib/python3.12/site-packages/sklearn/metrics/_classification.py:1565: UndefinedMetricWarning: Precision is ill-defined and being set to 0.0 in labels with no predicted samples. Use `zero_division` parameter to control this behavior.
  _warn_prf(average, modifier, f"{metric.capitalize()} is", len(result))
