[I 2025-06-12 14:48:20,388] Trial 111 finished with value: 0.6909048938134811 and parameters: {'hidden_dim': 1163, 'latent_dim': 40, 'beta': 1.0718129506080198, 'gamma': 0.4749221274638287, 'dropout_rate': 0.23061653621148587, 'lr': 0.0006200178435136173, 'scheduler_patience': 7, 'class_weight': 1.7970819499617972, 'activation': 'ReLU', 'classification_multiplier': 8494.048239983467}. Best is trial 72 with value: 0.7479224376731302.
              precision    recall  f1-score   support

Non-Repeater       0.27      0.97      0.42       150
    Repeater       1.00      0.75      0.86      1583

    accuracy                           0.77      1733
   macro avg       0.63      0.86      0.64      1733
weighted avg       0.93      0.77      0.82      1733

Confusion Matrix:
 [[ 146    4]
 [ 394 1189]]

=== Fold 4/5 ===
Validation Accuracy: 0.5516
Classification Report:
               precision    recall  f1-score   support

Non-Repeater       0.16      1.00      0.28       150
    Repeater       1.00      0.51      0.67      1583

    accuracy                           0.55      1733
   macro avg       0.58      0.75      0.48      1733
weighted avg       0.93      0.55      0.64      1733

Confusion Matrix:
 [[150   0]
 [777 806]]

=== Fold 5/5 ===
Validation Accuracy: 0.7356
Classification Report:
               precision    recall  f1-score   support

Non-Repeater       0.24      0.99      0.39       149
    Repeater       1.00      0.71      0.83      1583

    accuracy                           0.74      1732
   macro avg       0.62      0.85      0.61      1732
weighted avg       0.93      0.74      0.79      1732

Confusion Matrix:
 [[ 148    1]
 [ 457 1126]]


=== Summary ===
Total False Positives: 6
Total False Negatives: 2604
Total True Positives: 5312
Total True Negatives: 742

Confusion Matrix (with duplicates):
              Non-Repeater  Repeater
Non-Repeater         742.0       6.0
Repeater            2604.0    5312.0
accuracy_score
0.6987534626038782
Trial 1: hidden_dim=1147, latent_dim=39, beta=1.0924038955088833, gamma=0.33459824501804997, dropout_rate=0.23254392991258663, lr=0.001186794160293727, scheduler_patience=7, class_weight=1.6985188524317743, activation=ReLU, classification_multiplier=9220.286668798555

=== Fold 1/5 ===
Validation Accuracy: 0.6705
Classification Report:
               precision    recall  f1-score   support

Non-Repeater       0.20      0.98      0.34       149
    Repeater       1.00      0.64      0.78      1584

    accuracy                           0.67      1733
   macro avg       0.60      0.81      0.56      1733
weighted avg       0.93      0.67      0.74      1733

Confusion Matrix:
 [[ 146    3]
 [ 568 1016]]

=== Fold 2/5 ===
Validation Accuracy: 0.5263
Classification Report:
               precision    recall  f1-score   support

Non-Repeater       0.15      1.00      0.27       150
    Repeater       1.00      0.48      0.65      1583

    accuracy                           0.53      1733
   macro avg       0.58      0.74      0.46      1733
weighted avg       0.93      0.53      0.62      1733

Confusion Matrix:
 [[150   0]
 [821 762]]

=== Fold 3/5 ===
Validation Accuracy: 0.5949
Classification Report:
               precision    recall  f1-score   support

Non-Repeater       0.18      0.99      0.30       150
    Repeater       1.00      0.56      0.72      1583

    accuracy                           0.59      1733
   macro avg       0.59      0.78      0.51      1733
weighted avg       0.93      0.59      0.68      1733

Confusion Matrix:
 [[149   1]
 [701 882]]

=== Fold 4/5 ===
Validation Accuracy: 0.6457
Classification Report:
               precision    recall  f1-score   support

Non-Repeater       0.20      0.99      0.33       150
    Repeater       1.00      0.61      0.76      1583

    accuracy                           0.65      1733
   macro avg       0.60      0.80      0.54      1733
weighted avg       0.93      0.65      0.72      1733

Confusion Matrix:
 [[149   1]
 [613 970]]

=== Fold 5/5 ===
Validation Accuracy: 0.7090
Classification Report:
               precision    recall  f1-score   support

Non-Repeater       0.23      0.99      0.37       149
    Repeater       1.00      0.68      0.81      1583

    accuracy                           0.71      1732
   macro avg       0.61      0.84      0.59      1732
weighted avg       0.93      0.71      0.77      1732

Confusion Matrix:
 [[ 148    1]
 [ 503 1080]]


=== Summary ===
Total False Positives: 6
Total False Negatives: 3206
Total True Positives: 4710
Total True Negatives: 742

Confusion Matrix (with duplicates):
              Non-Repeater  Repeater
Non-Repeater         742.0       6.0
Repeater            3206.0    4710.0
accuracy_score
0.6292705447830101
Trial 1: hidden_dim=1142, latent_dim=38, beta=0.9652606386376195, gamma=0.3648668348337055, dropout_rate=0.2519605050791292, lr=0.0016351182178615704, scheduler_patience=7, class_weight=1.7087230477161646, activation=ReLU, classification_multiplier=10105.494921346399

=== Fold 1/5 ===
Validation Accuracy: 0.6757
Classification Report:
               precision    recall  f1-score   support

Non-Repeater       0.21      0.99      0.34       149
    Repeater       1.00      0.65      0.78      1584

    accuracy                           0.68      1733
   macro avg       0.60      0.82      0.56      1733
weighted avg       0.93      0.68      0.75      1733

Confusion Matrix:
 [[ 148    1]
 [ 561 1023]]

=== Fold 2/5 ===
Validation Accuracy: 0.6803
Classification Report:
               precision    recall  f1-score   support

Non-Repeater       0.21      0.99      0.35       150
    Repeater       1.00      0.65      0.79      1583

    accuracy                           0.68      1733
   macro avg       0.61      0.82      0.57      1733
weighted avg       0.93      0.68      0.75      1733

Confusion Matrix:
 [[ 149    1]
 [ 553 1030]]

=== Fold 3/5 ===
Validation Accuracy: 0.6694
Classification Report:
               precision    recall  f1-score   support

Non-Repeater       0.21      0.99      0.34       150
    Repeater       1.00      0.64      0.78      1583

    accuracy                           0.67      1733
   macro avg       0.60      0.82      0.56      1733
weighted avg       0.93      0.67      0.74      1733

Confusion Matrix:
 [[ 149    1]
 [ 572 1011]]

=== Fold 4/5 ===
Validation Accuracy: 0.6757
Classification Report:
               precision    recall  f1-score   support

Non-Repeater       0.21      0.99      0.34       150
    Repeater       1.00      0.65      0.78      1583

    accuracy                           0.68      1733
   macro avg       0.60      0.82      0.56      1733
weighted avg       0.93      0.68      0.75      1733

Confusion Matrix:
 [[ 148    2]
 [ 560 1023]]

=== Fold 5/5 ===
Validation Accuracy: 0.7535
Classification Report:
               precision    recall  f1-score   support

Non-Repeater       0.26      0.98      0.41       149
    Repeater       1.00      0.73      0.84      1583

    accuracy                           0.75      1732
   macro avg       0.63      0.86      0.63      1732
weighted avg       0.93      0.75      0.81      1732

Confusion Matrix:
 [[ 146    3]
 [ 424 1159]]


=== Summary ===
Total False Positives: 8
Total False Negatives: 2670
Total True Positives: 5246
Total True Negatives: 740

Confusion Matrix (with duplicates):
              Non-Repeater  Repeater
Non-Repeater         740.0       8.0
Repeater            2670.0    5246.0
accuracy_score
0.6909048938134811
Trial 1: hidden_dim=1163, latent_dim=40, beta=1.0718129506080198, gamma=0.4749221274638287, dropout_rate=0.23061653621148587, lr=0.0006200178435136173, scheduler_patience=7, class_weight=1.7970819499617972, activation=ReLU, classification_multiplier=8494.048239983467

=== Fold 1/5 ===
Validation Accuracy: 0.6757
Classification Report:
               precision    recall  f1-score   support

Non-Repeater       0.21      0.99      0.34       149
    Repeater       1.00      0.65      0.78      1584

    accuracy                           0.68      1733
   macro avg       0.60      0.82      0.56      1733
weighted avg       0.93      0.68      0.75      1733

Confusion Matrix:
 [[ 148    1]
 [ 561 1023]]

=== Fold 2/5 ===
Validation Accuracy: 0.6480
Classification Report:
 [I 2025-06-12 14:53:52,216] Trial 112 finished with value: 0.6845567867036011 and parameters: {'hidden_dim': 677, 'latent_dim': 39, 'beta': 1.1499464620359767, 'gamma': 0.34238654419129533, 'dropout_rate': 0.2512326330460181, 'lr': 0.0011501764084542506, 'scheduler_patience': 7, 'class_weight': 1.870767189974305, 'activation': 'ReLU', 'classification_multiplier': 7953.467801090719}. Best is trial 72 with value: 0.7479224376731302.
[I 2025-06-12 14:59:39,111] Trial 113 finished with value: 0.708679593721145 and parameters: {'hidden_dim': 960, 'latent_dim': 37, 'beta': 1.0461146696454318, 'gamma': 0.28468107228158457, 'dropout_rate': 0.20140425401207976, 'lr': 0.0014617844493323147, 'scheduler_patience': 7, 'class_weight': 1.933433068744109, 'activation': 'ReLU', 'classification_multiplier': 9199.48996385888}. Best is trial 72 with value: 0.7479224376731302.
[I 2025-06-12 15:05:25,980] Trial 114 finished with value: 0.7015235457063712 and parameters: {'hidden_dim': 962, 'latent_dim': 38, 'beta': 1.0488828859076507, 'gamma': 0.27984028928039306, 'dropout_rate': 0.22211057089149114, 'lr': 0.0014504356631150097, 'scheduler_patience': 7, 'class_weight': 1.959208968193026, 'activation': 'ReLU', 'classification_multiplier': 8947.317663413944}. Best is trial 72 with value: 0.7479224376731302.
              precision    recall  f1-score   support

Non-Repeater       0.20      0.99      0.33       150
    Repeater       1.00      0.62      0.76      1583

    accuracy                           0.65      1733
   macro avg       0.60      0.80      0.54      1733
weighted avg       0.93      0.65      0.72      1733

Confusion Matrix:
 [[149   1]
 [609 974]]

=== Fold 3/5 ===
Validation Accuracy: 0.6036
Classification Report:
               precision    recall  f1-score   support

Non-Repeater       0.18      0.99      0.30       150
    Repeater       1.00      0.57      0.72      1583

    accuracy                           0.60      1733
   macro avg       0.59      0.78      0.51      1733
weighted avg       0.93      0.60      0.69      1733

Confusion Matrix:
 [[149   1]
 [686 897]]

=== Fold 4/5 ===
Validation Accuracy: 0.6688
Classification Report:
               precision    recall  f1-score   support

Non-Repeater       0.20      0.98      0.34       150
    Repeater       1.00      0.64      0.78      1583

    accuracy                           0.67      1733
   macro avg       0.60      0.81      0.56      1733
weighted avg       0.93      0.67      0.74      1733

Confusion Matrix:
 [[ 147    3]
 [ 571 1012]]

=== Fold 5/5 ===
Validation Accuracy: 0.8268
Classification Report:
               precision    recall  f1-score   support

Non-Repeater       0.33      0.97      0.49       149
    Repeater       1.00      0.81      0.90      1583

    accuracy                           0.83      1732
   macro avg       0.66      0.89      0.69      1732
weighted avg       0.94      0.83      0.86      1732

Confusion Matrix:
 [[ 145    4]
 [ 296 1287]]


=== Summary ===
Total False Positives: 10
Total False Negatives: 2723
Total True Positives: 5193
Total True Negatives: 738

Confusion Matrix (with duplicates):
              Non-Repeater  Repeater
Non-Repeater         738.0      10.0
Repeater            2723.0    5193.0
accuracy_score
0.6845567867036011
Trial 1: hidden_dim=677, latent_dim=39, beta=1.1499464620359767, gamma=0.34238654419129533, dropout_rate=0.2512326330460181, lr=0.0011501764084542506, scheduler_patience=7, class_weight=1.870767189974305, activation=ReLU, classification_multiplier=7953.467801090719

=== Fold 1/5 ===
Validation Accuracy: 0.7778
Classification Report:
               precision    recall  f1-score   support

Non-Repeater       0.27      0.97      0.43       149
    Repeater       1.00      0.76      0.86      1584

    accuracy                           0.78      1733
   macro avg       0.64      0.86      0.65      1733
weighted avg       0.93      0.78      0.82      1733

Confusion Matrix:
 [[ 144    5]
 [ 380 1204]]

=== Fold 2/5 ===
Validation Accuracy: 0.6544
Classification Report:
               precision    recall  f1-score   support

Non-Repeater       0.20      1.00      0.33       150
    Repeater       1.00      0.62      0.77      1583

    accuracy                           0.65      1733
   macro avg       0.60      0.81      0.55      1733
weighted avg       0.93      0.65      0.73      1733

Confusion Matrix:
 [[150   0]
 [599 984]]

=== Fold 3/5 ===
Validation Accuracy: 0.7109
Classification Report:
               precision    recall  f1-score   support

Non-Repeater       0.23      0.99      0.37       150
    Repeater       1.00      0.68      0.81      1583

    accuracy                           0.71      1733
   macro avg       0.61      0.84      0.59      1733
weighted avg       0.93      0.71      0.77      1733

Confusion Matrix:
 [[ 148    2]
 [ 499 1084]]

=== Fold 4/5 ===
Validation Accuracy: 0.6924
Classification Report:
               precision    recall  f1-score   support

Non-Repeater       0.22      0.98      0.36       150
    Repeater       1.00      0.67      0.80      1583

    accuracy                           0.69      1733
   macro avg       0.61      0.82      0.58      1733
weighted avg       0.93      0.69      0.76      1733

Confusion Matrix:
 [[ 147    3]
 [ 530 1053]]

=== Fold 5/5 ===
Validation Accuracy: 0.7079
Classification Report:
               precision    recall  f1-score   support

Non-Repeater       0.23      0.99      0.37       149
    Repeater       1.00      0.68      0.81      1583

    accuracy                           0.71      1732
   macro avg       0.61      0.83      0.59      1732
weighted avg       0.93      0.71      0.77      1732

Confusion Matrix:
 [[ 147    2]
 [ 504 1079]]


=== Summary ===
Total False Positives: 12
Total False Negatives: 2512
Total True Positives: 5404
Total True Negatives: 736

Confusion Matrix (with duplicates):
              Non-Repeater  Repeater
Non-Repeater         736.0      12.0
Repeater            2512.0    5404.0
accuracy_score
0.708679593721145
Trial 1: hidden_dim=960, latent_dim=37, beta=1.0461146696454318, gamma=0.28468107228158457, dropout_rate=0.20140425401207976, lr=0.0014617844493323147, scheduler_patience=7, class_weight=1.933433068744109, activation=ReLU, classification_multiplier=9199.48996385888

=== Fold 1/5 ===
Validation Accuracy: 0.7825
Classification Report:
               precision    recall  f1-score   support

Non-Repeater       0.27      0.93      0.42       149
    Repeater       0.99      0.77      0.87      1584

    accuracy                           0.78      1733
   macro avg       0.63      0.85      0.65      1733
weighted avg       0.93      0.78      0.83      1733

Confusion Matrix:
 [[ 139   10]
 [ 367 1217]]

=== Fold 2/5 ===
Validation Accuracy: 0.6549
Classification Report:
               precision    recall  f1-score   support

Non-Repeater       0.20      0.99      0.33       150
    Repeater       1.00      0.62      0.77      1583

    accuracy                           0.65      1733
   macro avg       0.60      0.81      0.55      1733
weighted avg       0.93      0.65      0.73      1733

Confusion Matrix:
 [[149   1]
 [597 986]]

=== Fold 3/5 ===
Validation Accuracy: 0.6786
Classification Report:
               precision    recall  f1-score   support

Non-Repeater       0.21      0.99      0.35       150
    Repeater       1.00      0.65      0.79      1583

    accuracy                           0.68      1733
   macro avg       0.61      0.82      0.57      1733
weighted avg       0.93      0.68      0.75      1733

Confusion Matrix:
 [[ 149    1]
 [ 556 1027]]

=== Fold 4/5 ===
Validation Accuracy: 0.6388
Classification Report:
               precision    recall  f1-score   support

Non-Repeater       0.19      0.99      0.32       150
    Repeater       1.00      0.61      0.75      1583

    accuracy                           0.64      1733
   macro avg       0.59      0.80      0.54      1733
weighted avg       0.93      0.64      0.72      1733

Confusion Matrix:
 [[148   2]
 [624 959]]

=== Fold 5/5 ===
Validation Accuracy: 0.7529
Classification Report:
               precision    recall  f1-score   support

Non-Repeater       0.26      0.98      0.41       149
    Repeater       1.00      0.73      0.84      1583

    accuracy                           0.75      1732
   macro avg       0.63      0.86      0.62      1732
weighted avg       0.93      0.75      0.81      1732

Confusion Matrix:
 [[ 146    3]
 [ 425 1158]]


=== Summary ===
Total False Positives: 17
Total False Negatives: 2569
Total True Positives: 5347
Total True Negatives: 731

Confusion Matrix (with duplicates):
              Non-Repeater  Repeater
Non-Repeater         731.0      17.0
Repeater            2569.0    5347.0
accuracy_score
0.7015235457063712
Trial 1: hidden_dim=962, latent_dim=38, beta=1.0488828859076507, gamma=0.27984028928039306, dropout_rate=0.22211057089149114, lr=0.0014504356631150097, scheduler_patience=7, class_weight=1.959208968193026, activation=ReLU, classification_multiplier=8947.317663413944

=== Fold 1/5 ===
Validation Accuracy: 0.4518
Classification Report:
 [I 2025-06-12 15:11:36,570] Trial 115 finished with value: 0.554016620498615 and parameters: {'hidden_dim': 1228, 'latent_dim': 38, 'beta': 1.0267980416405869, 'gamma': 0.2801835134851167, 'dropout_rate': 0.2712982735211846, 'lr': 0.001986033690156978, 'scheduler_patience': 7, 'class_weight': 2.5374781407933313, 'activation': 'ReLU', 'classification_multiplier': 9142.500003861529}. Best is trial 72 with value: 0.7479224376731302.
