[I 2025-06-12 22:26:54,374] Trial 185 finished with value: 0.7476915974145891 and parameters: {'hidden_dim': 1449, 'latent_dim': 32, 'beta': 1.4003034369689866, 'gamma': 0.20097732905137394, 'dropout_rate': 0.1080586044889233, 'lr': 0.0005036339801871939, 'scheduler_patience': 7, 'class_weight': 2.7702127534694156, 'activation': 'ReLU', 'classification_multiplier': 13100.881565383152}. Best is trial 173 with value: 0.8084025854108957.
Trial 1: hidden_dim=1515, latent_dim=32, beta=1.6015149244604807, gamma=0.24216497593873273, dropout_rate=0.12482415886853698, lr=0.0005142617885543447, scheduler_patience=7, class_weight=2.9172702226536615, activation=ReLU, classification_multiplier=14296.166233876793

=== Fold 1/5 ===
Validation Accuracy: 0.2302
Classification Report:
               precision    recall  f1-score   support

Non-Repeater       0.10      1.00      0.18       149
    Repeater       1.00      0.16      0.27      1584

    accuracy                           0.23      1733
   macro avg       0.55      0.58      0.23      1733
weighted avg       0.92      0.23      0.26      1733

Confusion Matrix:
 [[ 149    0]
 [1334  250]]

=== Fold 2/5 ===
Validation Accuracy: 0.2787
Classification Report:
               precision    recall  f1-score   support

Non-Repeater       0.11      1.00      0.19       150
    Repeater       1.00      0.21      0.35      1583

    accuracy                           0.28      1733
   macro avg       0.55      0.61      0.27      1733
weighted avg       0.92      0.28      0.33      1733

Confusion Matrix:
 [[ 150    0]
 [1250  333]]

=== Fold 3/5 ===
Validation Accuracy: 0.2216
Classification Report:
               precision    recall  f1-score   support

Non-Repeater       0.10      1.00      0.18       150
    Repeater       1.00      0.15      0.26      1583

    accuracy                           0.22      1733
   macro avg       0.55      0.57      0.22      1733
weighted avg       0.92      0.22      0.25      1733

Confusion Matrix:
 [[ 150    0]
 [1349  234]]

=== Fold 4/5 ===
Validation Accuracy: 0.5707
Classification Report:
               precision    recall  f1-score   support

Non-Repeater       0.17      0.99      0.28       150
    Repeater       1.00      0.53      0.69      1583

    accuracy                           0.57      1733
   macro avg       0.58      0.76      0.49      1733
weighted avg       0.93      0.57      0.66      1733

Confusion Matrix:
 [[148   2]
 [742 841]]

=== Fold 5/5 ===
Validation Accuracy: 0.3603
Classification Report:
               precision    recall  f1-score   support

Non-Repeater       0.12      1.00      0.21       149
    Repeater       1.00      0.30      0.46      1583

    accuracy                           0.36      1732
   macro avg       0.56      0.65      0.34      1732
weighted avg       0.92      0.36      0.44      1732

Confusion Matrix:
 [[ 149    0]
 [1108  475]]


=== Summary ===
Total False Positives: 2
Total False Negatives: 5783
Total True Positives: 2133
Total True Negatives: 746

Confusion Matrix (with duplicates):
              Non-Repeater  Repeater
Non-Repeater         746.0       2.0
Repeater            5783.0    2133.0
accuracy_score
0.33229455216989845
Trial 1: hidden_dim=1600, latent_dim=31, beta=1.4639801987628043, gamma=0.1536472591689731, dropout_rate=0.13458006186761215, lr=0.0037852153206232764, scheduler_patience=7, class_weight=2.637100455919155, activation=ReLU, classification_multiplier=14615.690543145949

=== Fold 1/5 ===
Validation Accuracy: 0.6982
Classification Report:
               precision    recall  f1-score   support

Non-Repeater       0.22      0.99      0.36       149
    Repeater       1.00      0.67      0.80      1584

    accuracy                           0.70      1733
   macro avg       0.61      0.83      0.58      1733
weighted avg       0.93      0.70      0.76      1733

Confusion Matrix:
 [[ 148    1]
 [ 522 1062]]

=== Fold 2/5 ===
Validation Accuracy: 0.7848
Classification Report:
               precision    recall  f1-score   support

Non-Repeater       0.29      0.99      0.44       150
    Repeater       1.00      0.77      0.87      1583

    accuracy                           0.78      1733
   macro avg       0.64      0.88      0.65      1733
weighted avg       0.94      0.78      0.83      1733

Confusion Matrix:
 [[ 148    2]
 [ 371 1212]]

=== Fold 3/5 ===
Validation Accuracy: 0.7259
Classification Report:
               precision    recall  f1-score   support

Non-Repeater       0.24      0.99      0.39       150
    Repeater       1.00      0.70      0.82      1583

    accuracy                           0.73      1733
   macro avg       0.62      0.85      0.60      1733
weighted avg       0.93      0.73      0.79      1733

Confusion Matrix:
 [[ 149    1]
 [ 474 1109]]

=== Fold 4/5 ===
Validation Accuracy: 0.6896
Classification Report:
               precision    recall  f1-score   support

Non-Repeater       0.22      0.99      0.35       150
    Repeater       1.00      0.66      0.80      1583

    accuracy                           0.69      1733
   macro avg       0.61      0.82      0.58      1733
weighted avg       0.93      0.69      0.76      1733

Confusion Matrix:
 [[ 148    2]
 [ 536 1047]]

=== Fold 5/5 ===
Validation Accuracy: 0.8401
Classification Report:
               precision    recall  f1-score   support

Non-Repeater       0.34      0.95      0.51       149
    Repeater       0.99      0.83      0.90      1583

    accuracy                           0.84      1732
   macro avg       0.67      0.89      0.71      1732
weighted avg       0.94      0.84      0.87      1732

Confusion Matrix:
 [[ 142    7]
 [ 270 1313]]


=== Summary ===
Total False Positives: 13
Total False Negatives: 2173
Total True Positives: 5743
Total True Negatives: 735

Confusion Matrix (with duplicates):
              Non-Repeater  Repeater
Non-Repeater         735.0      13.0
Repeater            2173.0    5743.0
accuracy_score
0.7476915974145891
Trial 1: hidden_dim=1449, latent_dim=32, beta=1.4003034369689866, gamma=0.20097732905137394, dropout_rate=0.1080586044889233, lr=0.0005036339801871939, scheduler_patience=7, class_weight=2.7702127534694156, activation=ReLU, classification_multiplier=13100.881565383152

=== Fold 1/5 ===
Validation Accuracy: 0.7640
Classification Report:
               precision    recall  f1-score   support

Non-Repeater       0.26      0.98      0.42       149
    Repeater       1.00      0.74      0.85      1584

    accuracy                           0.76      1733
   macro avg       0.63      0.86      0.63      1733
weighted avg       0.93      0.76      0.81      1733

Confusion Matrix:
 [[ 146    3]
 [ 406 1178]]

=== Fold 2/5 ===
Validation Accuracy: 0.7173
Classification Report:
               precision    recall  f1-score   support

Non-Repeater       0.23      0.99      0.38       150
    Repeater       1.00      0.69      0.82      1583

    accuracy                           0.72      1733
   macro avg       0.62      0.84      0.60      1733
weighted avg       0.93      0.72      0.78      1733

Confusion Matrix:
 [[ 149    1]
 [ 489 1094]]

=== Fold 3/5 ===
Validation Accuracy: 0.6688
Classification Report:
               precision    recall  f1-score   support

Non-Repeater       0.21      0.99      0.34       150
    Repeater       1.00      0.64      0.78      1583

    accuracy                           0.67      1733
   macro avg       0.60      0.82      0.56      1733
weighted avg       0.93      0.67      0.74      1733

Confusion Matrix:
 [[ 149    1]
 [ 573 1010]]

=== Fold 4/5 ===
Validation Accuracy: 0.6688
Classification Report:
               precision    recall  f1-score   support

Non-Repeater       0.21      0.99      0.34       150
    Repeater       1.00      0.64      0.78      1583

    accuracy                           0.67      1733
   macro avg       0.60      0.82      0.56      1733
weighted avg       0.93      0.67      0.74      1733

Confusion Matrix:
 [[ 149    1]
 [ 573 1010]]

=== Fold 5/5 ===
Validation Accuracy: 0.7361
Classification Report:
               precision    recall  f1-score   support

Non-Repeater       0.24      0.98      0.39       149
    Repeater       1.00      0.71      0.83      1583

    accuracy                           0.74      1732
   macro avg       0.62      0.85      0.61      1732
weighted avg       0.93      0.74      0.79      1732

Confusion Matrix:
 [[ 146    3]
 [ 454 1129]]


=== Summary ===
Total False Positives: 9
Total False Negatives: 2495
Total True Positives: 5421
Total True Negatives: 739
[I 2025-06-12 22:33:19,816] Trial 186 finished with value: 0.7109879963065558 and parameters: {'hidden_dim': 1404, 'latent_dim': 30, 'beta': 1.4399432484259074, 'gamma': 0.10859651743593889, 'dropout_rate': 0.11646448910848478, 'lr': 0.00010000796493817477, 'scheduler_patience': 7, 'class_weight': 2.539429090308848, 'activation': 'ReLU', 'classification_multiplier': 14583.573037007138}. Best is trial 173 with value: 0.8084025854108957.
[I 2025-06-12 22:39:45,820] Trial 187 finished with value: 0.7451523545706371 and parameters: {'hidden_dim': 1375, 'latent_dim': 34, 'beta': 1.6319763869750192, 'gamma': 0.16709385921440092, 'dropout_rate': 0.12744025461011807, 'lr': 0.0007250155393181838, 'scheduler_patience': 7, 'class_weight': 2.9258627010003027, 'activation': 'ReLU', 'classification_multiplier': 14219.375255415882}. Best is trial 173 with value: 0.8084025854108957.
[I 2025-06-12 22:46:17,410] Trial 188 finished with value: 0.7593490304709142 and parameters: {'hidden_dim': 1433, 'latent_dim': 33, 'beta': 1.4934236207053324, 'gamma': 0.10117698256785057, 'dropout_rate': 0.13561746269827787, 'lr': 0.00047939408138902807, 'scheduler_patience': 7, 'class_weight': 2.8102573412305207, 'activation': 'ReLU', 'classification_multiplier': 12440.296264366865}. Best is trial 173 with value: 0.8084025854108957.

Confusion Matrix (with duplicates):
              Non-Repeater  Repeater
Non-Repeater         739.0       9.0
Repeater            2495.0    5421.0
accuracy_score
0.7109879963065558
Trial 1: hidden_dim=1404, latent_dim=30, beta=1.4399432484259074, gamma=0.10859651743593889, dropout_rate=0.11646448910848478, lr=0.00010000796493817477, scheduler_patience=7, class_weight=2.539429090308848, activation=ReLU, classification_multiplier=14583.573037007138

=== Fold 1/5 ===
Validation Accuracy: 0.6821
Classification Report:
               precision    recall  f1-score   support

Non-Repeater       0.21      0.99      0.35       149
    Repeater       1.00      0.65      0.79      1584

    accuracy                           0.68      1733
   macro avg       0.61      0.82      0.57      1733
weighted avg       0.93      0.68      0.75      1733

Confusion Matrix:
 [[ 148    1]
 [ 550 1034]]

=== Fold 2/5 ===
Validation Accuracy: 0.8355
Classification Report:
               precision    recall  f1-score   support

Non-Repeater       0.34      0.99      0.51       150
    Repeater       1.00      0.82      0.90      1583

    accuracy                           0.84      1733
   macro avg       0.67      0.90      0.71      1733
weighted avg       0.94      0.84      0.87      1733

Confusion Matrix:
 [[ 148    2]
 [ 283 1300]]

=== Fold 3/5 ===
Validation Accuracy: 0.6734
Classification Report:
               precision    recall  f1-score   support

Non-Repeater       0.21      0.99      0.34       150
    Repeater       1.00      0.64      0.78      1583

    accuracy                           0.67      1733
   macro avg       0.60      0.82      0.56      1733
weighted avg       0.93      0.67      0.74      1733

Confusion Matrix:
 [[ 148    2]
 [ 564 1019]]

=== Fold 4/5 ===
Validation Accuracy: 0.7675
Classification Report:
               precision    recall  f1-score   support

Non-Repeater       0.27      0.99      0.42       150
    Repeater       1.00      0.75      0.85      1583

    accuracy                           0.77      1733
   macro avg       0.63      0.87      0.64      1733
weighted avg       0.94      0.77      0.82      1733

Confusion Matrix:
 [[ 148    2]
 [ 401 1182]]

=== Fold 5/5 ===
Validation Accuracy: 0.7673
Classification Report:
               precision    recall  f1-score   support

Non-Repeater       0.27      0.97      0.42       149
    Repeater       1.00      0.75      0.85      1583

    accuracy                           0.77      1732
   macro avg       0.63      0.86      0.64      1732
weighted avg       0.93      0.77      0.82      1732

Confusion Matrix:
 [[ 145    4]
 [ 399 1184]]


=== Summary ===
Total False Positives: 11
Total False Negatives: 2197
Total True Positives: 5719
Total True Negatives: 737

Confusion Matrix (with duplicates):
              Non-Repeater  Repeater
Non-Repeater         737.0      11.0
Repeater            2197.0    5719.0
accuracy_score
0.7451523545706371
Trial 1: hidden_dim=1375, latent_dim=34, beta=1.6319763869750192, gamma=0.16709385921440092, dropout_rate=0.12744025461011807, lr=0.0007250155393181838, scheduler_patience=7, class_weight=2.9258627010003027, activation=ReLU, classification_multiplier=14219.375255415882

=== Fold 1/5 ===
Validation Accuracy: 0.7299
Classification Report:
               precision    recall  f1-score   support

Non-Repeater       0.24      1.00      0.39       149
    Repeater       1.00      0.70      0.83      1584

    accuracy                           0.73      1733
   macro avg       0.62      0.85      0.61      1733
weighted avg       0.93      0.73      0.79      1733

Confusion Matrix:
 [[ 149    0]
 [ 468 1116]]

=== Fold 2/5 ===
Validation Accuracy: 0.7963
Classification Report:
               precision    recall  f1-score   support

Non-Repeater       0.30      0.99      0.46       150
    Repeater       1.00      0.78      0.87      1583

    accuracy                           0.80      1733
   macro avg       0.65      0.88      0.67      1733
weighted avg       0.94      0.80      0.84      1733

Confusion Matrix:
 [[ 148    2]
 [ 351 1232]]

=== Fold 3/5 ===
Validation Accuracy: 0.7374
Classification Report:
               precision    recall  f1-score   support

Non-Repeater       0.25      0.99      0.40       150
    Repeater       1.00      0.71      0.83      1583

    accuracy                           0.74      1733
   macro avg       0.62      0.85      0.61      1733
weighted avg       0.93      0.74      0.79      1733

Confusion Matrix:
 [[ 149    1]
 [ 454 1129]]

=== Fold 4/5 ===
Validation Accuracy: 0.7565
Classification Report:
               precision    recall  f1-score   support

Non-Repeater       0.26      0.98      0.41       150
    Repeater       1.00      0.74      0.85      1583

    accuracy                           0.76      1733
   macro avg       0.63      0.86      0.63      1733
weighted avg       0.93      0.76      0.81      1733

Confusion Matrix:
 [[ 147    3]
 [ 419 1164]]

=== Fold 5/5 ===
Validation Accuracy: 0.7766
Classification Report:
               precision    recall  f1-score   support

Non-Repeater       0.27      0.97      0.43       149
    Repeater       1.00      0.76      0.86      1583

    accuracy                           0.78      1732
   macro avg       0.64      0.87      0.64      1732
weighted avg       0.93      0.78      0.82      1732

Confusion Matrix:
 [[ 145    4]
 [ 383 1200]]


=== Summary ===
Total False Positives: 10
Total False Negatives: 2075
Total True Positives: 5841
Total True Negatives: 738

Confusion Matrix (with duplicates):
              Non-Repeater  Repeater
Non-Repeater         738.0      10.0
Repeater            2075.0    5841.0
accuracy_score
0.7593490304709142
Trial 1: hidden_dim=1433, latent_dim=33, beta=1.4934236207053324, gamma=0.10117698256785057, dropout_rate=0.13561746269827787, lr=0.00047939408138902807, scheduler_patience=7, class_weight=2.8102573412305207, activation=ReLU, classification_multiplier=12440.296264366865

=== Fold 1/5 ===
Validation Accuracy: 0.6088
Classification Report:
               precision    recall  f1-score   support

Non-Repeater       0.18      1.00      0.31       149
    Repeater       1.00      0.57      0.73      1584

    accuracy                           0.61      1733
   macro avg       0.59      0.79      0.52      1733
weighted avg       0.93      0.61      0.69      1733

Confusion Matrix:
 [[149   0]
 [678 906]]

=== Fold 2/5 ===
Validation Accuracy: 0.6769
Classification Report:
               precision    recall  f1-score   support

Non-Repeater       0.21      0.99      0.35       150
    Repeater       1.00      0.65      0.79      1583

    accuracy                           0.68      1733
   macro avg       0.60      0.82      0.57      1733
weighted avg       0.93      0.68      0.75      1733

Confusion Matrix:
 [[ 149    1]
 [ 559 1024]]

=== Fold 3/5 ===
Validation Accuracy: 0.6140
Classification Report:
               precision    recall  f1-score   support

Non-Repeater       0.18      0.99      0.31       150
    Repeater       1.00      0.58      0.73      1583

    accuracy                           0.61      1733
   macro avg       0.59      0.79      0.52      1733
weighted avg       0.93      0.61      0.70      1733

Confusion Matrix:
 [[149   1]
 [668 915]]

=== Fold 4/5 ===
Validation Accuracy: 0.4432
Classification Report:
               precision    recall  f1-score   support

Non-Repeater       0.13      0.99      0.24       150
    Repeater       1.00      0.39      0.56      1583

    accuracy                           0.44      1733
   macro avg       0.57      0.69      0.40      1733
weighted avg       0.92      0.44      0.53      1733

Confusion Matrix:
 [[149   1]
 [964 619]]

=== Fold 5/5 ===
Validation Accuracy: 0.7136
Classification Report:
 [I 2025-06-12 22:53:08,717] Trial 189 finished with value: 0.6112650046168052 and parameters: {'hidden_dim': 1648, 'latent_dim': 33, 'beta': 1.4543582275070928, 'gamma': 0.10155473236646662, 'dropout_rate': 0.1373589713985159, 'lr': 0.0007998536099318958, 'scheduler_patience': 7, 'class_weight': 2.8722045953602637, 'activation': 'LeakyReLU', 'classification_multiplier': 12528.88692058453}. Best is trial 173 with value: 0.8084025854108957.
[I 2025-06-12 22:59:40,668] Trial 190 finished with value: 0.7029085872576177 and parameters: {'hidden_dim': 1437, 'latent_dim': 34, 'beta': 1.5779498409457962, 'gamma': 0.21188308647544635, 'dropout_rate': 0.10743182628781625, 'lr': 0.0004664523659155559, 'scheduler_patience': 3, 'class_weight': 2.657895956449127, 'activation': 'ReLU', 'classification_multiplier': 12799.975252153028}. Best is trial 173 with value: 0.8084025854108957.
