[I 2025-06-13 00:56:20,649] Trial 208 finished with value: 0.7277239150507848 and parameters: {'hidden_dim': 1430, 'latent_dim': 30, 'beta': 1.4101882916069561, 'gamma': 0.13518931369430676, 'dropout_rate': 0.11544542982043118, 'lr': 0.0010299217498370612, 'scheduler_patience': 7, 'class_weight': 2.9990089603315693, 'activation': 'ReLU', 'classification_multiplier': 12993.657115201133}. Best is trial 194 with value: 0.8103647276084949.

Confusion Matrix (with duplicates):
              Non-Repeater  Repeater
Non-Repeater         737.0      11.0
Repeater            2567.0    5349.0
accuracy_score
0.7024469067405356
Trial 1: hidden_dim=1384, latent_dim=34, beta=1.3616767920578052, gamma=0.24547160603425427, dropout_rate=0.1001639335167148, lr=0.0008287789425568224, scheduler_patience=7, class_weight=2.765243048496788, activation=ReLU, classification_multiplier=13962.616269935475

=== Fold 1/5 ===
Validation Accuracy: 0.6924
Classification Report:
               precision    recall  f1-score   support

Non-Repeater       0.22      0.99      0.36       149
    Repeater       1.00      0.66      0.80      1584

    accuracy                           0.69      1733
   macro avg       0.61      0.83      0.58      1733
weighted avg       0.93      0.69      0.76      1733

Confusion Matrix:
 [[ 148    1]
 [ 532 1052]]

=== Fold 2/5 ===
Validation Accuracy: 0.7582
Classification Report:
               precision    recall  f1-score   support

Non-Repeater       0.26      0.99      0.42       150
    Repeater       1.00      0.74      0.85      1583

    accuracy                           0.76      1733
   macro avg       0.63      0.86      0.63      1733
weighted avg       0.94      0.76      0.81      1733

Confusion Matrix:
 [[ 149    1]
 [ 418 1165]]

=== Fold 3/5 ===
Validation Accuracy: 0.7467
Classification Report:
               precision    recall  f1-score   support

Non-Repeater       0.25      0.99      0.40       150
    Repeater       1.00      0.72      0.84      1583

    accuracy                           0.75      1733
   macro avg       0.63      0.86      0.62      1733
weighted avg       0.93      0.75      0.80      1733

Confusion Matrix:
 [[ 149    1]
 [ 438 1145]]

=== Fold 4/5 ===
Validation Accuracy: 0.7744
Classification Report:
               precision    recall  f1-score   support

Non-Repeater       0.27      0.97      0.43       150
    Repeater       1.00      0.76      0.86      1583

    accuracy                           0.77      1733
   macro avg       0.64      0.86      0.64      1733
weighted avg       0.93      0.77      0.82      1733

Confusion Matrix:
 [[ 146    4]
 [ 387 1196]]

=== Fold 5/5 ===
Validation Accuracy: 0.7517
Classification Report:
               precision    recall  f1-score   support

Non-Repeater       0.25      0.97      0.40       149
    Repeater       1.00      0.73      0.84      1583

    accuracy                           0.75      1732
   macro avg       0.63      0.85      0.62      1732
weighted avg       0.93      0.75      0.81      1732

Confusion Matrix:
 [[ 145    4]
 [ 426 1157]]


=== Summary ===
Total False Positives: 11
Total False Negatives: 2201
Total True Positives: 5715
Total True Negatives: 737

Confusion Matrix (with duplicates):
              Non-Repeater  Repeater
Non-Repeater         737.0      11.0
Repeater            2201.0    5715.0
accuracy_score
0.7446906740535549
Trial 1: hidden_dim=1336, latent_dim=33, beta=1.2368263241304671, gamma=0.17022621096118, dropout_rate=0.14006963462138255, lr=0.0005869123947414656, scheduler_patience=7, class_weight=2.6752467114284384, activation=ReLU, classification_multiplier=14148.093230448707

=== Fold 1/5 ===
Validation Accuracy: 0.8875
Classification Report:
               precision    recall  f1-score   support

Non-Repeater       0.43      0.88      0.57       149
    Repeater       0.99      0.89      0.94      1584

    accuracy                           0.89      1733
   macro avg       0.71      0.88      0.75      1733
weighted avg       0.94      0.89      0.90      1733

Confusion Matrix:
 [[ 131   18]
 [ 177 1407]]

=== Fold 2/5 ===
Validation Accuracy: 0.7525
Classification Report:
               precision    recall  f1-score   support

Non-Repeater       0.26      0.99      0.41       150
    Repeater       1.00      0.73      0.84      1583

    accuracy                           0.75      1733
   macro avg       0.63      0.86      0.63      1733
weighted avg       0.94      0.75      0.81      1733

Confusion Matrix:
 [[ 149    1]
 [ 428 1155]]

=== Fold 3/5 ===
Validation Accuracy: 0.6013
Classification Report:
               precision    recall  f1-score   support

Non-Repeater       0.18      0.99      0.30       150
    Repeater       1.00      0.56      0.72      1583

    accuracy                           0.60      1733
   macro avg       0.59      0.78      0.51      1733
weighted avg       0.93      0.60      0.68      1733

Confusion Matrix:
 [[149   1]
 [690 893]]

=== Fold 4/5 ===
Validation Accuracy: 0.6370
Classification Report:
               precision    recall  f1-score   support

Non-Repeater       0.19      0.99      0.32       150
    Repeater       1.00      0.60      0.75      1583

    accuracy                           0.64      1733
   macro avg       0.59      0.80      0.54      1733
weighted avg       0.93      0.64      0.72      1733

Confusion Matrix:
 [[148   2]
 [627 956]]

=== Fold 5/5 ===
Validation Accuracy: 0.7604
Classification Report:
               precision    recall  f1-score   support

Non-Repeater       0.26      0.97      0.41       149
    Repeater       1.00      0.74      0.85      1583

    accuracy                           0.76      1732
   macro avg       0.63      0.86      0.63      1732
weighted avg       0.93      0.76      0.81      1732

Confusion Matrix:
 [[ 145    4]
 [ 411 1172]]


=== Summary ===
Total False Positives: 26
Total False Negatives: 2333
Total True Positives: 5583
Total True Negatives: 722

Confusion Matrix (with duplicates):
              Non-Repeater  Repeater
Non-Repeater         722.0      26.0
Repeater            2333.0    5583.0
accuracy_score
0.7277239150507848
Trial 1: hidden_dim=1430, latent_dim=30, beta=1.4101882916069561, gamma=0.13518931369430676, dropout_rate=0.11544542982043118, lr=0.0010299217498370612, scheduler_patience=7, class_weight=2.9990089603315693, activation=ReLU, classification_multiplier=12993.657115201133

=== Fold 1/5 ===
Validation Accuracy: 0.5245
Classification Report:
               precision    recall  f1-score   support

Non-Repeater       0.15      0.99      0.26       149
    Repeater       1.00      0.48      0.65      1584

    accuracy                           0.52      1733
   macro avg       0.58      0.74      0.46      1733
weighted avg       0.93      0.52      0.62      1733

Confusion Matrix:
 [[148   1]
 [823 761]]

=== Fold 2/5 ===
Validation Accuracy: 0.6168
Classification Report:
               precision    recall  f1-score   support

Non-Repeater       0.18      0.99      0.31       150
    Repeater       1.00      0.58      0.73      1583

    accuracy                           0.62      1733
   macro avg       0.59      0.79      0.52      1733
weighted avg       0.93      0.62      0.70      1733

Confusion Matrix:
 [[149   1]
 [663 920]]

=== Fold 3/5 ===
Validation Accuracy: 0.6457
Classification Report:
               precision    recall  f1-score   support

Non-Repeater       0.20      0.99      0.33       150
    Repeater       1.00      0.61      0.76      1583

    accuracy                           0.65      1733
   macro avg       0.60      0.80      0.54      1733
weighted avg       0.93      0.65      0.72      1733

Confusion Matrix:
 [[149   1]
 [613 970]]

=== Fold 4/5 ===
Validation Accuracy: 0.6394
Classification Report:
               precision    recall  f1-score   support

Non-Repeater       0.19      0.99      0.32       150
    Repeater       1.00      0.61      0.75      1583

    accuracy                           0.64      1733
   macro avg       0.59      0.80      0.54      1733
weighted avg       0.93      0.64      0.72      1733

Confusion Matrix:
 [[148   2]
 [623 960]]

=== Fold 5/5 ===
Validation Accuracy: 0.7385
Classification Report:
               precision    recall  f1-score   support

Non-Repeater       0.24      0.97      0.39       149
    Repeater       1.00      0.72      0.83      1583

    accuracy                           0.74      1732
   macro avg       0.62      0.84      0.61      1732
weighted avg       0.93      0.74      0.80      1732

[I 2025-06-13 01:02:53,027] Trial 209 finished with value: 0.6329639889196675 and parameters: {'hidden_dim': 1480, 'latent_dim': 32, 'beta': 1.3154824322850147, 'gamma': 0.10039050605712442, 'dropout_rate': 0.36927030243884107, 'lr': 0.00044991993861884623, 'scheduler_patience': 7, 'class_weight': 2.8717260553727444, 'activation': 'GELU', 'classification_multiplier': 13394.178618346774}. Best is trial 194 with value: 0.8103647276084949.
[I 2025-06-13 01:09:10,418] Trial 210 finished with value: 0.7546168051708217 and parameters: {'hidden_dim': 1308, 'latent_dim': 31, 'beta': 1.4319636962952331, 'gamma': 0.2009369128023416, 'dropout_rate': 0.12576194526584003, 'lr': 0.00038116207248870633, 'scheduler_patience': 7, 'class_weight': 2.8198105557565816, 'activation': 'ReLU', 'classification_multiplier': 14394.947328467828}. Best is trial 194 with value: 0.8103647276084949.
[I 2025-06-13 01:15:47,230] Trial 211 finished with value: 0.7780470914127424 and parameters: {'hidden_dim': 1468, 'latent_dim': 31, 'beta': 1.5357232754192691, 'gamma': 0.18992083881821345, 'dropout_rate': 0.13283225969750334, 'lr': 0.00042050124308716156, 'scheduler_patience': 7, 'class_weight': 2.8914000982206476, 'activation': 'ReLU', 'classification_multiplier': 14677.892848420948}. Best is trial 194 with value: 0.8103647276084949.
Confusion Matrix:
 [[ 145    4]
 [ 449 1134]]


=== Summary ===
Total False Positives: 9
Total False Negatives: 3171
Total True Positives: 4745
Total True Negatives: 739

Confusion Matrix (with duplicates):
              Non-Repeater  Repeater
Non-Repeater         739.0       9.0
Repeater            3171.0    4745.0
accuracy_score
0.6329639889196675
Trial 1: hidden_dim=1480, latent_dim=32, beta=1.3154824322850147, gamma=0.10039050605712442, dropout_rate=0.36927030243884107, lr=0.00044991993861884623, scheduler_patience=7, class_weight=2.8717260553727444, activation=GELU, classification_multiplier=13394.178618346774

=== Fold 1/5 ===
Validation Accuracy: 0.8044
Classification Report:
               precision    recall  f1-score   support

Non-Repeater       0.30      0.98      0.46       149
    Repeater       1.00      0.79      0.88      1584

    accuracy                           0.80      1733
   macro avg       0.65      0.88      0.67      1733
weighted avg       0.94      0.80      0.84      1733

Confusion Matrix:
 [[ 146    3]
 [ 336 1248]]

=== Fold 2/5 ===
Validation Accuracy: 0.7617
Classification Report:
               precision    recall  f1-score   support

Non-Repeater       0.27      0.99      0.42       150
    Repeater       1.00      0.74      0.85      1583

    accuracy                           0.76      1733
   macro avg       0.63      0.87      0.63      1733
weighted avg       0.94      0.76      0.81      1733

Confusion Matrix:
 [[ 149    1]
 [ 412 1171]]

=== Fold 3/5 ===
Validation Accuracy: 0.6630
Classification Report:
               precision    recall  f1-score   support

Non-Repeater       0.20      0.99      0.34       150
    Repeater       1.00      0.63      0.77      1583

    accuracy                           0.66      1733
   macro avg       0.60      0.81      0.56      1733
weighted avg       0.93      0.66      0.74      1733

Confusion Matrix:
 [[ 149    1]
 [ 583 1000]]

=== Fold 4/5 ===
Validation Accuracy: 0.6861
Classification Report:
               precision    recall  f1-score   support

Non-Repeater       0.21      0.98      0.35       150
    Repeater       1.00      0.66      0.79      1583

    accuracy                           0.69      1733
   macro avg       0.61      0.82      0.57      1733
weighted avg       0.93      0.69      0.75      1733

Confusion Matrix:
 [[ 147    3]
 [ 541 1042]]

=== Fold 5/5 ===
Validation Accuracy: 0.8580
Classification Report:
               precision    recall  f1-score   support

Non-Repeater       0.37      0.97      0.54       149
    Repeater       1.00      0.85      0.92      1583

    accuracy                           0.86      1732
   macro avg       0.69      0.91      0.73      1732
weighted avg       0.94      0.86      0.88      1732

Confusion Matrix:
 [[ 144    5]
 [ 241 1342]]


=== Summary ===
Total False Positives: 13
Total False Negatives: 2113
Total True Positives: 5803
Total True Negatives: 735

Confusion Matrix (with duplicates):
              Non-Repeater  Repeater
Non-Repeater         735.0      13.0
Repeater            2113.0    5803.0
accuracy_score
0.7546168051708217
Trial 1: hidden_dim=1308, latent_dim=31, beta=1.4319636962952331, gamma=0.2009369128023416, dropout_rate=0.12576194526584003, lr=0.00038116207248870633, scheduler_patience=7, class_weight=2.8198105557565816, activation=ReLU, classification_multiplier=14394.947328467828

=== Fold 1/5 ===
Validation Accuracy: 0.7865
Classification Report:
               precision    recall  f1-score   support

Non-Repeater       0.28      0.97      0.44       149
    Repeater       1.00      0.77      0.87      1584

    accuracy                           0.79      1733
   macro avg       0.64      0.87      0.65      1733
weighted avg       0.93      0.79      0.83      1733

Confusion Matrix:
 [[ 144    5]
 [ 365 1219]]

=== Fold 2/5 ===
Validation Accuracy: 0.7807
Classification Report:
               precision    recall  f1-score   support

Non-Repeater       0.28      0.99      0.44       150
    Repeater       1.00      0.76      0.86      1583

    accuracy                           0.78      1733
   macro avg       0.64      0.88      0.65      1733
weighted avg       0.94      0.78      0.83      1733

Confusion Matrix:
 [[ 149    1]
 [ 379 1204]]

=== Fold 3/5 ===
Validation Accuracy: 0.7461
Classification Report:
               precision    recall  f1-score   support

Non-Repeater       0.25      0.99      0.40       150
    Repeater       1.00      0.72      0.84      1583

    accuracy                           0.75      1733
   macro avg       0.63      0.86      0.62      1733
weighted avg       0.93      0.75      0.80      1733

Confusion Matrix:
 [[ 149    1]
 [ 439 1144]]

=== Fold 4/5 ===
Validation Accuracy: 0.7011
Classification Report:
               precision    recall  f1-score   support

Non-Repeater       0.22      0.99      0.36       150
    Repeater       1.00      0.67      0.80      1583

    accuracy                           0.70      1733
   macro avg       0.61      0.83      0.58      1733
weighted avg       0.93      0.70      0.77      1733

Confusion Matrix:
 [[ 148    2]
 [ 516 1067]]

=== Fold 5/5 ===
Validation Accuracy: 0.8759
Classification Report:
               precision    recall  f1-score   support

Non-Repeater       0.41      0.97      0.57       149
    Repeater       1.00      0.87      0.93      1583

    accuracy                           0.88      1732
   macro avg       0.70      0.92      0.75      1732
weighted avg       0.95      0.88      0.90      1732

Confusion Matrix:
 [[ 145    4]
 [ 211 1372]]


=== Summary ===
Total False Positives: 13
Total False Negatives: 1910
Total True Positives: 6006
Total True Negatives: 735

Confusion Matrix (with duplicates):
              Non-Repeater  Repeater
Non-Repeater         735.0      13.0
Repeater            1910.0    6006.0
accuracy_score
0.7780470914127424
Trial 1: hidden_dim=1468, latent_dim=31, beta=1.5357232754192691, gamma=0.18992083881821345, dropout_rate=0.13283225969750334, lr=0.00042050124308716156, scheduler_patience=7, class_weight=2.8914000982206476, activation=ReLU, classification_multiplier=14677.892848420948

=== Fold 1/5 ===
Validation Accuracy: 0.6619
Classification Report:
               precision    recall  f1-score   support

Non-Repeater       0.20      0.99      0.34       149
    Repeater       1.00      0.63      0.77      1584

    accuracy                           0.66      1733
   macro avg       0.60      0.81      0.55      1733
weighted avg       0.93      0.66      0.74      1733

Confusion Matrix:
 [[148   1]
 [585 999]]

=== Fold 2/5 ===
Validation Accuracy: 0.6959
Classification Report:
               precision    recall  f1-score   support

Non-Repeater       0.22      0.99      0.36       150
    Repeater       1.00      0.67      0.80      1583

    accuracy                           0.70      1733
   macro avg       0.61      0.83      0.58      1733
weighted avg       0.93      0.70      0.76      1733

Confusion Matrix:
 [[ 149    1]
 [ 526 1057]]

=== Fold 3/5 ===
Validation Accuracy: 0.7732
Classification Report:
               precision    recall  f1-score   support

Non-Repeater       0.27      0.99      0.43       150
    Repeater       1.00      0.75      0.86      1583

    accuracy                           0.77      1733
   macro avg       0.64      0.87      0.64      1733
weighted avg       0.94      0.77      0.82      1733

Confusion Matrix:
 [[ 148    2]
 [ 391 1192]]

=== Fold 4/5 ===
Validation Accuracy: 0.6780
Classification Report:
               precision    recall  f1-score   support

Non-Repeater       0.21      0.99      0.35       150
    Repeater       1.00      0.65      0.79      1583

    accuracy                           0.68      1733
   macro avg       0.60      0.82      0.57      1733
weighted avg       0.93      0.68      0.75      1733

Confusion Matrix:
 [[ 148    2]
 [ 556 1027]]

=== Fold 5/5 ===
Validation Accuracy: 0.7737
Classification Report:
 [I 2025-06-13 01:22:13,400] Trial 212 finished with value: 0.716528162511542 and parameters: {'hidden_dim': 1387, 'latent_dim': 32, 'beta': 1.5246676532743284, 'gamma': 0.15817394178356806, 'dropout_rate': 0.13159392220291327, 'lr': 0.000625399240495162, 'scheduler_patience': 7, 'class_weight': 2.8912969130065846, 'activation': 'ReLU', 'classification_multiplier': 14992.747350296624}. Best is trial 194 with value: 0.8103647276084949.
[I 2025-06-13 01:28:52,749] Trial 213 finished with value: 0.7375346260387812 and parameters: {'hidden_dim': 1510, 'latent_dim': 31, 'beta': 1.6634636300025027, 'gamma': 0.1428574713503375, 'dropout_rate': 0.12224471197562244, 'lr': 0.00041986340010909904, 'scheduler_patience': 7, 'class_weight': 2.744646287220819, 'activation': 'ReLU', 'classification_multiplier': 14570.654742642588}. Best is trial 194 with value: 0.8103647276084949.
