[I 2025-06-13 10:48:40,444] Trial 300 finished with value: 0.4347876269621422 and parameters: {'hidden_dim': 1484, 'latent_dim': 31, 'beta': 1.4763352865099253, 'gamma': 0.10135251004783881, 'dropout_rate': 0.12545622142650256, 'lr': 0.001250851340333679, 'scheduler_patience': 7, 'class_weight': 2.876812900935065, 'activation': 'ELU', 'classification_multiplier': 13541.417967203744}. Best is trial 194 with value: 0.8103647276084949.

Confusion Matrix (with duplicates):
              Non-Repeater  Repeater
Non-Repeater         738.0      10.0
Repeater            2029.0    5887.0
accuracy_score
0.7646583564173592
Trial 1: hidden_dim=1373, latent_dim=33, beta=1.583686889092263, gamma=0.21670020070863627, dropout_rate=0.11514440619569238, lr=0.0005691992234640083, scheduler_patience=7, class_weight=2.8102820035278415, activation=ReLU, classification_multiplier=14377.343063415747

=== Fold 1/5 ===
Validation Accuracy: 0.7698
Classification Report:
               precision    recall  f1-score   support

Non-Repeater       0.27      0.99      0.43       149
    Repeater       1.00      0.75      0.86      1584

    accuracy                           0.77      1733
   macro avg       0.64      0.87      0.64      1733
weighted avg       0.94      0.77      0.82      1733

Confusion Matrix:
 [[ 148    1]
 [ 398 1186]]

=== Fold 2/5 ===
Validation Accuracy: 0.7703
Classification Report:
               precision    recall  f1-score   support

Non-Repeater       0.27      0.99      0.43       150
    Repeater       1.00      0.75      0.86      1583

    accuracy                           0.77      1733
   macro avg       0.64      0.87      0.64      1733
weighted avg       0.94      0.77      0.82      1733

Confusion Matrix:
 [[ 148    2]
 [ 396 1187]]

=== Fold 3/5 ===
Validation Accuracy: 0.7432
Classification Report:
               precision    recall  f1-score   support

Non-Repeater       0.25      0.99      0.40       150
    Repeater       1.00      0.72      0.84      1583

    accuracy                           0.74      1733
   macro avg       0.63      0.86      0.62      1733
weighted avg       0.93      0.74      0.80      1733

Confusion Matrix:
 [[ 149    1]
 [ 444 1139]]

=== Fold 4/5 ===
Validation Accuracy: 0.6878
Classification Report:
               precision    recall  f1-score   support

Non-Repeater       0.22      0.99      0.35       150
    Repeater       1.00      0.66      0.79      1583

    accuracy                           0.69      1733
   macro avg       0.61      0.82      0.57      1733
weighted avg       0.93      0.69      0.76      1733

Confusion Matrix:
 [[ 148    2]
 [ 539 1044]]

=== Fold 5/5 ===
Validation Accuracy: 0.7754
Classification Report:
               precision    recall  f1-score   support

Non-Repeater       0.27      0.97      0.43       149
    Repeater       1.00      0.76      0.86      1583

    accuracy                           0.78      1732
   macro avg       0.64      0.86      0.64      1732
weighted avg       0.93      0.78      0.82      1732

Confusion Matrix:
 [[ 145    4]
 [ 385 1198]]


=== Summary ===
Total False Positives: 10
Total False Negatives: 2162
Total True Positives: 5754
Total True Negatives: 738

Confusion Matrix (with duplicates):
              Non-Repeater  Repeater
Non-Repeater         738.0      10.0
Repeater            2162.0    5754.0
accuracy_score
0.7493074792243767
Trial 1: hidden_dim=1244, latent_dim=33, beta=1.7709531410413768, gamma=0.12564485165322542, dropout_rate=0.11675955518802773, lr=0.000249153041421201, scheduler_patience=7, class_weight=2.699371838940312, activation=ReLU, classification_multiplier=14056.027717878245

=== Fold 1/5 ===
Validation Accuracy: 0.5822
Classification Report:
               precision    recall  f1-score   support

Non-Repeater       0.17      0.99      0.29       149
    Repeater       1.00      0.54      0.70      1584

    accuracy                           0.58      1733
   macro avg       0.58      0.77      0.50      1733
weighted avg       0.93      0.58      0.67      1733

Confusion Matrix:
 [[147   2]
 [722 862]]

=== Fold 2/5 ===
Validation Accuracy: 0.3808
Classification Report:
               precision    recall  f1-score   support

Non-Repeater       0.12      0.99      0.22       150
    Repeater       1.00      0.32      0.49      1583

    accuracy                           0.38      1733
   macro avg       0.56      0.66      0.35      1733
weighted avg       0.92      0.38      0.46      1733

Confusion Matrix:
 [[ 149    1]
 [1072  511]]

=== Fold 3/5 ===
Validation Accuracy: 0.4345
Classification Report:
               precision    recall  f1-score   support

Non-Repeater       0.13      0.99      0.23       150
    Repeater       1.00      0.38      0.55      1583

    accuracy                           0.43      1733
   macro avg       0.57      0.69      0.39      1733
weighted avg       0.92      0.43      0.52      1733

Confusion Matrix:
 [[149   1]
 [979 604]]

=== Fold 4/5 ===
Validation Accuracy: 0.2366
Classification Report:
               precision    recall  f1-score   support

Non-Repeater       0.10      1.00      0.18       150
    Repeater       1.00      0.16      0.28      1583

    accuracy                           0.24      1733
   macro avg       0.55      0.58      0.23      1733
weighted avg       0.92      0.24      0.27      1733

Confusion Matrix:
 [[ 150    0]
 [1323  260]]

=== Fold 5/5 ===
Validation Accuracy: 0.5398
Classification Report:
               precision    recall  f1-score   support

Non-Repeater       0.16      0.99      0.27       149
    Repeater       1.00      0.50      0.66      1583

    accuracy                           0.54      1732
   macro avg       0.58      0.75      0.47      1732
weighted avg       0.93      0.54      0.63      1732

Confusion Matrix:
 [[148   1]
 [796 787]]


=== Summary ===
Total False Positives: 5
Total False Negatives: 4892
Total True Positives: 3024
Total True Negatives: 743

Confusion Matrix (with duplicates):
              Non-Repeater  Repeater
Non-Repeater         743.0       5.0
Repeater            4892.0    3024.0
accuracy_score
0.4347876269621422
Trial 1: hidden_dim=1484, latent_dim=31, beta=1.4763352865099253, gamma=0.10135251004783881, dropout_rate=0.12545622142650256, lr=0.001250851340333679, scheduler_patience=7, class_weight=2.876812900935065, activation=ELU, classification_multiplier=13541.417967203744

=== Fold 1/5 ===
Validation Accuracy: 0.6959
Classification Report:
               precision    recall  f1-score   support

Non-Repeater       0.22      0.99      0.36       149
    Repeater       1.00      0.67      0.80      1584

    accuracy                           0.70      1733
   macro avg       0.61      0.83      0.58      1733
weighted avg       0.93      0.70      0.76      1733

Confusion Matrix:
 [[ 148    1]
 [ 526 1058]]

=== Fold 2/5 ===
Validation Accuracy: 0.7848
Classification Report:
               precision    recall  f1-score   support

Non-Repeater       0.29      0.99      0.44       150
    Repeater       1.00      0.77      0.87      1583

    accuracy                           0.78      1733
   macro avg       0.64      0.88      0.65      1733
weighted avg       0.94      0.78      0.83      1733

Confusion Matrix:
 [[ 148    2]
 [ 371 1212]]

=== Fold 3/5 ===
Validation Accuracy: 0.6878
Classification Report:
               precision    recall  f1-score   support

Non-Repeater       0.22      0.99      0.35       150
    Repeater       1.00      0.66      0.79      1583

    accuracy                           0.69      1733
   macro avg       0.61      0.82      0.57      1733
weighted avg       0.93      0.69      0.76      1733

Confusion Matrix:
 [[ 148    2]
 [ 539 1044]]

=== Fold 4/5 ===
Validation Accuracy: 0.7871
Classification Report:
               precision    recall  f1-score   support

Non-Repeater       0.28      0.95      0.43       150
    Repeater       0.99      0.77      0.87      1583

    accuracy                           0.79      1733
   macro avg       0.64      0.86      0.65      1733
weighted avg       0.93      0.79      0.83      1733

Confusion Matrix:
 [[ 142    8]
 [ 361 1222]]

=== Fold 5/5 ===
Validation Accuracy: 0.7933
Classification Report:
               precision    recall  f1-score   support

Non-Repeater       0.29      0.97      0.45       149
    Repeater       1.00      0.78      0.87      1583

    accuracy                           0.79      1732
   macro avg       0.64      0.87      0.66      1732
weighted avg       0.94      0.79      0.84      1732

[I 2025-06-13 10:54:57,474] Trial 301 finished with value: 0.7497691597414589 and parameters: {'hidden_dim': 1296, 'latent_dim': 35, 'beta': 1.2934215063323833, 'gamma': 0.25996402374855176, 'dropout_rate': 0.10009317657579443, 'lr': 0.0008454321559193452, 'scheduler_patience': 7, 'class_weight': 2.9988584696469442, 'activation': 'ReLU', 'classification_multiplier': 14507.493363297199}. Best is trial 194 with value: 0.8103647276084949.
[I 2025-06-13 11:01:26,656] Trial 302 finished with value: 0.7228762696214219 and parameters: {'hidden_dim': 1434, 'latent_dim': 32, 'beta': 1.5071183343296024, 'gamma': 0.17723628125798108, 'dropout_rate': 0.11059751380773, 'lr': 0.00048076095977980245, 'scheduler_patience': 7, 'class_weight': 2.793358206784972, 'activation': 'ReLU', 'classification_multiplier': 14319.309652947819}. Best is trial 194 with value: 0.8103647276084949.
[I 2025-06-13 11:07:47,454] Trial 303 finished with value: 0.29247460757156046 and parameters: {'hidden_dim': 1329, 'latent_dim': 29, 'beta': 1.7061812747380691, 'gamma': 0.15748066091119983, 'dropout_rate': 0.1205393310985682, 'lr': 0.0035127842703142663, 'scheduler_patience': 7, 'class_weight': 2.5733845396179476, 'activation': 'ReLU', 'classification_multiplier': 13738.75505642235}. Best is trial 194 with value: 0.8103647276084949.
Confusion Matrix:
 [[ 144    5]
 [ 353 1230]]


=== Summary ===
Total False Positives: 18
Total False Negatives: 2150
Total True Positives: 5766
Total True Negatives: 730

Confusion Matrix (with duplicates):
              Non-Repeater  Repeater
Non-Repeater         730.0      18.0
Repeater            2150.0    5766.0
accuracy_score
0.7497691597414589
Trial 1: hidden_dim=1296, latent_dim=35, beta=1.2934215063323833, gamma=0.25996402374855176, dropout_rate=0.10009317657579443, lr=0.0008454321559193452, scheduler_patience=7, class_weight=2.9988584696469442, activation=ReLU, classification_multiplier=14507.493363297199

=== Fold 1/5 ===
Validation Accuracy: 0.7144
Classification Report:
               precision    recall  f1-score   support

Non-Repeater       0.23      0.99      0.37       149
    Repeater       1.00      0.69      0.81      1584

    accuracy                           0.71      1733
   macro avg       0.61      0.84      0.59      1733
weighted avg       0.93      0.71      0.78      1733

Confusion Matrix:
 [[ 148    1]
 [ 494 1090]]

=== Fold 2/5 ===
Validation Accuracy: 0.6607
Classification Report:
               precision    recall  f1-score   support

Non-Repeater       0.20      0.99      0.34       150
    Repeater       1.00      0.63      0.77      1583

    accuracy                           0.66      1733
   macro avg       0.60      0.81      0.55      1733
weighted avg       0.93      0.66      0.73      1733

Confusion Matrix:
 [[149   1]
 [587 996]]

=== Fold 3/5 ===
Validation Accuracy: 0.7184
Classification Report:
               precision    recall  f1-score   support

Non-Repeater       0.23      0.99      0.38       150
    Repeater       1.00      0.69      0.82      1583

    accuracy                           0.72      1733
   macro avg       0.62      0.84      0.60      1733
weighted avg       0.93      0.72      0.78      1733

Confusion Matrix:
 [[ 149    1]
 [ 487 1096]]

=== Fold 4/5 ===
Validation Accuracy: 0.6919
Classification Report:
               precision    recall  f1-score   support

Non-Repeater       0.22      0.99      0.36       150
    Repeater       1.00      0.66      0.80      1583

    accuracy                           0.69      1733
   macro avg       0.61      0.83      0.58      1733
weighted avg       0.93      0.69      0.76      1733

Confusion Matrix:
 [[ 148    2]
 [ 532 1051]]

=== Fold 5/5 ===
Validation Accuracy: 0.8291
Classification Report:
               precision    recall  f1-score   support

Non-Repeater       0.33      0.97      0.49       149
    Repeater       1.00      0.82      0.90      1583

    accuracy                           0.83      1732
   macro avg       0.66      0.89      0.70      1732
weighted avg       0.94      0.83      0.86      1732

Confusion Matrix:
 [[ 144    5]
 [ 291 1292]]


=== Summary ===
Total False Positives: 10
Total False Negatives: 2391
Total True Positives: 5525
Total True Negatives: 738

Confusion Matrix (with duplicates):
              Non-Repeater  Repeater
Non-Repeater         738.0      10.0
Repeater            2391.0    5525.0
accuracy_score
0.7228762696214219
Trial 1: hidden_dim=1434, latent_dim=32, beta=1.5071183343296024, gamma=0.17723628125798108, dropout_rate=0.11059751380773, lr=0.00048076095977980245, scheduler_patience=7, class_weight=2.793358206784972, activation=ReLU, classification_multiplier=14319.309652947819

=== Fold 1/5 ===
Validation Accuracy: 0.1027
Classification Report:
               precision    recall  f1-score   support

Non-Repeater       0.09      1.00      0.16       149
    Repeater       1.00      0.02      0.04      1584

    accuracy                           0.10      1733
   macro avg       0.54      0.51      0.10      1733
weighted avg       0.92      0.10      0.05      1733

Confusion Matrix:
 [[ 149    0]
 [1555   29]]

=== Fold 2/5 ===
Validation Accuracy: 0.6111
Classification Report:
               precision    recall  f1-score   support

Non-Repeater       0.18      0.99      0.31       150
    Repeater       1.00      0.58      0.73      1583

    accuracy                           0.61      1733
   macro avg       0.59      0.78      0.52      1733
weighted avg       0.93      0.61      0.69      1733

Confusion Matrix:
 [[148   2]
 [672 911]]

=== Fold 3/5 ===
Validation Accuracy: 0.2666
Classification Report:
               precision    recall  f1-score   support

Non-Repeater       0.11      1.00      0.19       150
    Repeater       1.00      0.20      0.33      1583

    accuracy                           0.27      1733
   macro avg       0.55      0.60      0.26      1733
weighted avg       0.92      0.27      0.32      1733

Confusion Matrix:
 [[ 150    0]
 [1271  312]]

=== Fold 4/5 ===
Validation Accuracy: 0.2389
Classification Report:
               precision    recall  f1-score   support

Non-Repeater       0.10      1.00      0.19       150
    Repeater       1.00      0.17      0.29      1583

    accuracy                           0.24      1733
   macro avg       0.55      0.58      0.24      1733
weighted avg       0.92      0.24      0.28      1733

Confusion Matrix:
 [[ 150    0]
 [1319  264]]

=== Fold 5/5 ===
Validation Accuracy: 0.2431
Classification Report:
               precision    recall  f1-score   support

Non-Repeater       0.10      1.00      0.19       149
    Repeater       1.00      0.17      0.29      1583

    accuracy                           0.24      1732
   macro avg       0.55      0.59      0.24      1732
weighted avg       0.92      0.24      0.28      1732

Confusion Matrix:
 [[ 149    0]
 [1311  272]]


=== Summary ===
Total False Positives: 2
Total False Negatives: 6128
Total True Positives: 1788
Total True Negatives: 746

Confusion Matrix (with duplicates):
              Non-Repeater  Repeater
Non-Repeater         746.0       2.0
Repeater            6128.0    1788.0
accuracy_score
0.29247460757156046
Trial 1: hidden_dim=1329, latent_dim=29, beta=1.7061812747380691, gamma=0.15748066091119983, dropout_rate=0.1205393310985682, lr=0.0035127842703142663, scheduler_patience=7, class_weight=2.5733845396179476, activation=ReLU, classification_multiplier=13738.75505642235

=== Fold 1/5 ===
Validation Accuracy: 0.7640
Classification Report:
               precision    recall  f1-score   support

Non-Repeater       0.27      1.00      0.42       149
    Repeater       1.00      0.74      0.85      1584

    accuracy                           0.76      1733
   macro avg       0.63      0.87      0.64      1733
weighted avg       0.94      0.76      0.81      1733

Confusion Matrix:
 [[ 149    0]
 [ 409 1175]]

=== Fold 2/5 ===
Validation Accuracy: 0.7611
Classification Report:
               precision    recall  f1-score   support

Non-Repeater       0.27      0.99      0.42       150
    Repeater       1.00      0.74      0.85      1583

    accuracy                           0.76      1733
   macro avg       0.63      0.87      0.63      1733
weighted avg       0.94      0.76      0.81      1733

Confusion Matrix:
 [[ 149    1]
 [ 413 1170]]

=== Fold 3/5 ===
Validation Accuracy: 0.6405
Classification Report:
               precision    recall  f1-score   support

Non-Repeater       0.19      0.99      0.32       150
    Repeater       1.00      0.61      0.76      1583

    accuracy                           0.64      1733
   macro avg       0.60      0.80      0.54      1733
weighted avg       0.93      0.64      0.72      1733

Confusion Matrix:
 [[149   1]
 [622 961]]

=== Fold 4/5 ===
Validation Accuracy: 0.6786
Classification Report:
               precision    recall  f1-score   support

Non-Repeater       0.21      0.99      0.35       150
    Repeater       1.00      0.65      0.79      1583

    accuracy                           0.68      1733
   macro avg       0.60      0.82      0.57      1733
weighted avg       0.93      0.68      0.75      1733

Confusion Matrix:
 [[ 148    2]
 [ 555 1028]]

=== Fold 5/5 ===
Validation Accuracy: 0.7558
Classification Report:
 [I 2025-06-13 11:14:12,116] Trial 304 finished with value: 0.7199907663896583 and parameters: {'hidden_dim': 1382, 'latent_dim': 34, 'beta': 1.3679818706586087, 'gamma': 0.22096174050655285, 'dropout_rate': 0.12934159058229655, 'lr': 0.00010246074551871666, 'scheduler_patience': 7, 'class_weight': 2.9127335001597965, 'activation': 'ReLU', 'classification_multiplier': 13435.925009998315}. Best is trial 194 with value: 0.8103647276084949.
[I 2025-06-13 11:21:46,322] Trial 305 finished with value: 0.7311865189289012 and parameters: {'hidden_dim': 1984, 'latent_dim': 33, 'beta': 1.4339585936926598, 'gamma': 0.19545485078104358, 'dropout_rate': 0.1498112961169315, 'lr': 0.0006857046331024327, 'scheduler_patience': 7, 'class_weight': 2.645056337021863, 'activation': 'ReLU', 'classification_multiplier': 14600.564166936447}. Best is trial 194 with value: 0.8103647276084949.
