[I 2025-06-12 17:34:01,907] Trial 139 finished with value: 0.7475761772853186 and parameters: {'hidden_dim': 1167, 'latent_dim': 33, 'beta': 1.2804064128780046, 'gamma': 0.22233132550679063, 'dropout_rate': 0.14694695454948742, 'lr': 0.00028583433243703103, 'scheduler_patience': 7, 'class_weight': 2.719512304691687, 'activation': 'ReLU', 'classification_multiplier': 11118.438381409933}. Best is trial 72 with value: 0.7479224376731302.
              precision    recall  f1-score   support

Non-Repeater       0.12      1.00      0.21       149
    Repeater       1.00      0.30      0.47      1584

    accuracy                           0.36      1733
   macro avg       0.56      0.65      0.34      1733
weighted avg       0.92      0.36      0.44      1733

Confusion Matrix:
 [[ 149    0]
 [1103  481]]

=== Fold 2/5 ===
Validation Accuracy: 0.1696
Classification Report:
               precision    recall  f1-score   support

Non-Repeater       0.09      1.00      0.17       150
    Repeater       1.00      0.09      0.17      1583

    accuracy                           0.17      1733
   macro avg       0.55      0.55      0.17      1733
weighted avg       0.92      0.17      0.17      1733

Confusion Matrix:
 [[ 150    0]
 [1439  144]]

=== Fold 3/5 ===
Validation Accuracy: 0.2487
Classification Report:
               precision    recall  f1-score   support

Non-Repeater       0.10      1.00      0.19       150
    Repeater       1.00      0.18      0.30      1583

    accuracy                           0.25      1733
   macro avg       0.55      0.59      0.24      1733
weighted avg       0.92      0.25      0.29      1733

Confusion Matrix:
 [[ 150    0]
 [1302  281]]

=== Fold 4/5 ===
Validation Accuracy: 0.2522
Classification Report:
               precision    recall  f1-score   support

Non-Repeater       0.10      1.00      0.19       150
    Repeater       1.00      0.18      0.31      1583

    accuracy                           0.25      1733
   macro avg       0.55      0.59      0.25      1733
weighted avg       0.92      0.25      0.30      1733

Confusion Matrix:
 [[ 150    0]
 [1296  287]]

=== Fold 5/5 ===
Validation Accuracy: 0.2021
Classification Report:
               precision    recall  f1-score   support

Non-Repeater       0.10      1.00      0.18       149
    Repeater       1.00      0.13      0.23      1583

    accuracy                           0.20      1732
   macro avg       0.55      0.56      0.20      1732
weighted avg       0.92      0.20      0.22      1732

Confusion Matrix:
 [[ 149    0]
 [1382  201]]


=== Summary ===
Total False Positives: 0
Total False Negatives: 6522
Total True Positives: 1394
Total True Negatives: 748

Confusion Matrix (with duplicates):
              Non-Repeater  Repeater
Non-Repeater         748.0       0.0
Repeater            6522.0    1394.0
accuracy_score
0.24722991689750692
Trial 1: hidden_dim=1232, latent_dim=35, beta=1.2267244843560876, gamma=0.14573859807854114, dropout_rate=0.23948017039984523, lr=0.0009637867793446599, scheduler_patience=7, class_weight=2.0085104273261454, activation=SELU, classification_multiplier=14497.481186571931

=== Fold 1/5 ===
Validation Accuracy: 0.7034
Classification Report:
               precision    recall  f1-score   support

Non-Repeater       0.22      1.00      0.37       149
    Repeater       1.00      0.68      0.81      1584

    accuracy                           0.70      1733
   macro avg       0.61      0.84      0.59      1733
weighted avg       0.93      0.70      0.77      1733

Confusion Matrix:
 [[ 149    0]
 [ 514 1070]]

=== Fold 2/5 ===
Validation Accuracy: 0.7525
Classification Report:
               precision    recall  f1-score   support

Non-Repeater       0.26      0.99      0.41       150
    Repeater       1.00      0.73      0.84      1583

    accuracy                           0.75      1733
   macro avg       0.63      0.86      0.63      1733
weighted avg       0.93      0.75      0.81      1733

Confusion Matrix:
 [[ 148    2]
 [ 427 1156]]

=== Fold 3/5 ===
Validation Accuracy: 0.7496
Classification Report:
               precision    recall  f1-score   support

Non-Repeater       0.26      0.99      0.41       150
    Repeater       1.00      0.73      0.84      1583

    accuracy                           0.75      1733
   macro avg       0.63      0.86      0.62      1733
weighted avg       0.93      0.75      0.80      1733

Confusion Matrix:
 [[ 149    1]
 [ 433 1150]]

=== Fold 4/5 ===
Validation Accuracy: 0.7594
Classification Report:
               precision    recall  f1-score   support

Non-Repeater       0.26      0.99      0.42       150
    Repeater       1.00      0.74      0.85      1583

    accuracy                           0.76      1733
   macro avg       0.63      0.86      0.63      1733
weighted avg       0.93      0.76      0.81      1733

Confusion Matrix:
 [[ 148    2]
 [ 415 1168]]

=== Fold 5/5 ===
Validation Accuracy: 0.7731
Classification Report:
               precision    recall  f1-score   support

Non-Repeater       0.27      0.97      0.42       149
    Repeater       1.00      0.75      0.86      1583

    accuracy                           0.77      1732
   macro avg       0.63      0.86      0.64      1732
weighted avg       0.93      0.77      0.82      1732

Confusion Matrix:
 [[ 145    4]
 [ 389 1194]]


=== Summary ===
Total False Positives: 9
Total False Negatives: 2178
Total True Positives: 5738
Total True Negatives: 739

Confusion Matrix (with duplicates):
              Non-Repeater  Repeater
Non-Repeater         739.0       9.0
Repeater            2178.0    5738.0
accuracy_score
0.7475761772853186
Trial 1: hidden_dim=1167, latent_dim=33, beta=1.2804064128780046, gamma=0.22233132550679063, dropout_rate=0.14694695454948742, lr=0.00028583433243703103, scheduler_patience=7, class_weight=2.719512304691687, activation=ReLU, classification_multiplier=11118.438381409933

=== Fold 1/5 ===
Validation Accuracy: 0.7092
Classification Report:
               precision    recall  f1-score   support

Non-Repeater       0.23      1.00      0.37       149
    Repeater       1.00      0.68      0.81      1584

    accuracy                           0.71      1733
   macro avg       0.61      0.84      0.59      1733
weighted avg       0.93      0.71      0.77      1733

Confusion Matrix:
 [[ 149    0]
 [ 504 1080]]

=== Fold 2/5 ===
Validation Accuracy: 0.7640
Classification Report:
               precision    recall  f1-score   support

Non-Repeater       0.27      0.99      0.42       150
    Repeater       1.00      0.74      0.85      1583

    accuracy                           0.76      1733
   macro avg       0.63      0.87      0.64      1733
weighted avg       0.94      0.76      0.81      1733

Confusion Matrix:
 [[ 149    1]
 [ 408 1175]]

=== Fold 3/5 ===
Validation Accuracy: 0.7132
Classification Report:
               precision    recall  f1-score   support

Non-Repeater       0.23      0.99      0.37       150
    Repeater       1.00      0.69      0.81      1583

    accuracy                           0.71      1733
   macro avg       0.62      0.84      0.59      1733
weighted avg       0.93      0.71      0.78      1733

Confusion Matrix:
 [[ 149    1]
 [ 496 1087]]

=== Fold 4/5 ===
Validation Accuracy: 0.6826
Classification Report:
               precision    recall  f1-score   support

Non-Repeater       0.21      0.98      0.35       150
    Repeater       1.00      0.65      0.79      1583

    accuracy                           0.68      1733
   macro avg       0.60      0.82      0.57      1733
weighted avg       0.93      0.68      0.75      1733

Confusion Matrix:
 [[ 147    3]
 [ 547 1036]]

=== Fold 5/5 ===
Validation Accuracy: 0.7587
Classification Report:
               precision    recall  f1-score   support

Non-Repeater       0.26      0.99      0.41       149
    Repeater       1.00      0.74      0.85      1583

    accuracy                           0.76      1732
   macro avg       0.63      0.86      0.63      1732
weighted avg       0.93      0.76      0.81      1732

Confusion Matrix:
 [[ 147    2]
 [ 416 1167]]


=== Summary ===
Total False Positives: 7
Total False Negatives: 2371
Total True Positives: 5545
Total True Negatives: 741

Confusion Matrix (with duplicates):
              Non-Repeater  Repeater
Non-Repeater         741.0       7.0
Repeater            2371.0    5545.0
accuracy_score
0.7255309325946445
[I 2025-06-12 17:40:07,434] Trial 140 finished with value: 0.7255309325946445 and parameters: {'hidden_dim': 1187, 'latent_dim': 33, 'beta': 1.1296019112804012, 'gamma': 0.1209035752053338, 'dropout_rate': 0.1455544847885248, 'lr': 0.00028030563556618183, 'scheduler_patience': 7, 'class_weight': 1.8848958010152792, 'activation': 'ReLU', 'classification_multiplier': 14074.743255446407}. Best is trial 72 with value: 0.7479224376731302.
[I 2025-06-12 17:46:11,761] Trial 141 finished with value: 0.7294552169898431 and parameters: {'hidden_dim': 1169, 'latent_dim': 33, 'beta': 1.1227422300948933, 'gamma': 0.13162826075811115, 'dropout_rate': 0.1452133549013102, 'lr': 0.0002255493286418555, 'scheduler_patience': 7, 'class_weight': 2.798572345978994, 'activation': 'ReLU', 'classification_multiplier': 13811.143863126772}. Best is trial 72 with value: 0.7479224376731302.
[I 2025-06-12 17:52:19,071] Trial 142 finished with value: 0.7733148661126501 and parameters: {'hidden_dim': 1188, 'latent_dim': 32, 'beta': 1.2772057319083712, 'gamma': 0.10245891017273004, 'dropout_rate': 0.14358965666983697, 'lr': 0.00031035155974390384, 'scheduler_patience': 7, 'class_weight': 2.7265342268099895, 'activation': 'ReLU', 'classification_multiplier': 13907.269038843966}. Best is trial 142 with value: 0.7733148661126501.
Trial 1: hidden_dim=1187, latent_dim=33, beta=1.1296019112804012, gamma=0.1209035752053338, dropout_rate=0.1455544847885248, lr=0.00028030563556618183, scheduler_patience=7, class_weight=1.8848958010152792, activation=ReLU, classification_multiplier=14074.743255446407

=== Fold 1/5 ===
Validation Accuracy: 0.6797
Classification Report:
               precision    recall  f1-score   support

Non-Repeater       0.21      0.99      0.35       149
    Repeater       1.00      0.65      0.79      1584

    accuracy                           0.68      1733
   macro avg       0.60      0.82      0.57      1733
weighted avg       0.93      0.68      0.75      1733

Confusion Matrix:
 [[ 148    1]
 [ 554 1030]]

=== Fold 2/5 ===
Validation Accuracy: 0.7138
Classification Report:
               precision    recall  f1-score   support

Non-Repeater       0.23      0.99      0.38       150
    Repeater       1.00      0.69      0.81      1583

    accuracy                           0.71      1733
   macro avg       0.62      0.84      0.59      1733
weighted avg       0.93      0.71      0.78      1733

Confusion Matrix:
 [[ 149    1]
 [ 495 1088]]

=== Fold 3/5 ===
Validation Accuracy: 0.7357
Classification Report:
               precision    recall  f1-score   support

Non-Repeater       0.25      0.99      0.39       150
    Repeater       1.00      0.71      0.83      1583

    accuracy                           0.74      1733
   macro avg       0.62      0.85      0.61      1733
weighted avg       0.93      0.74      0.79      1733

Confusion Matrix:
 [[ 149    1]
 [ 457 1126]]

=== Fold 4/5 ===
Validation Accuracy: 0.7473
Classification Report:
               precision    recall  f1-score   support

Non-Repeater       0.25      0.97      0.40       150
    Repeater       1.00      0.73      0.84      1583

    accuracy                           0.75      1733
   macro avg       0.62      0.85      0.62      1733
weighted avg       0.93      0.75      0.80      1733

Confusion Matrix:
 [[ 145    5]
 [ 433 1150]]

=== Fold 5/5 ===
Validation Accuracy: 0.7708
Classification Report:
               precision    recall  f1-score   support

Non-Repeater       0.27      0.98      0.42       149
    Repeater       1.00      0.75      0.86      1583

    accuracy                           0.77      1732
   macro avg       0.63      0.87      0.64      1732
weighted avg       0.93      0.77      0.82      1732

Confusion Matrix:
 [[ 146    3]
 [ 394 1189]]


=== Summary ===
Total False Positives: 11
Total False Negatives: 2333
Total True Positives: 5583
Total True Negatives: 737

Confusion Matrix (with duplicates):
              Non-Repeater  Repeater
Non-Repeater         737.0      11.0
Repeater            2333.0    5583.0
accuracy_score
0.7294552169898431
Trial 1: hidden_dim=1169, latent_dim=33, beta=1.1227422300948933, gamma=0.13162826075811115, dropout_rate=0.1452133549013102, lr=0.0002255493286418555, scheduler_patience=7, class_weight=2.798572345978994, activation=ReLU, classification_multiplier=13811.143863126772

=== Fold 1/5 ===
Validation Accuracy: 0.8102
Classification Report:
               precision    recall  f1-score   support

Non-Repeater       0.31      0.98      0.47       149
    Repeater       1.00      0.79      0.88      1584

    accuracy                           0.81      1733
   macro avg       0.65      0.89      0.68      1733
weighted avg       0.94      0.81      0.85      1733

Confusion Matrix:
 [[ 146    3]
 [ 326 1258]]

=== Fold 2/5 ===
Validation Accuracy: 0.7830
Classification Report:
               precision    recall  f1-score   support

Non-Repeater       0.28      0.99      0.44       150
    Repeater       1.00      0.76      0.87      1583

    accuracy                           0.78      1733
   macro avg       0.64      0.88      0.65      1733
weighted avg       0.94      0.78      0.83      1733

Confusion Matrix:
 [[ 149    1]
 [ 375 1208]]

=== Fold 3/5 ===
Validation Accuracy: 0.7426
Classification Report:
               precision    recall  f1-score   support

Non-Repeater       0.25      0.99      0.40       150
    Repeater       1.00      0.72      0.84      1583

    accuracy                           0.74      1733
   macro avg       0.62      0.86      0.62      1733
weighted avg       0.93      0.74      0.80      1733

Confusion Matrix:
 [[ 149    1]
 [ 445 1138]]

=== Fold 4/5 ===
Validation Accuracy: 0.7784
Classification Report:
               precision    recall  f1-score   support

Non-Repeater       0.28      0.99      0.44       150
    Repeater       1.00      0.76      0.86      1583

    accuracy                           0.78      1733
   macro avg       0.64      0.87      0.65      1733
weighted avg       0.94      0.78      0.83      1733

Confusion Matrix:
 [[ 148    2]
 [ 382 1201]]

=== Fold 5/5 ===
Validation Accuracy: 0.7523
Classification Report:
               precision    recall  f1-score   support

Non-Repeater       0.26      0.98      0.40       149
    Repeater       1.00      0.73      0.84      1583

    accuracy                           0.75      1732
   macro avg       0.63      0.86      0.62      1732
weighted avg       0.93      0.75      0.81      1732

Confusion Matrix:
 [[ 146    3]
 [ 426 1157]]


=== Summary ===
Total False Positives: 10
Total False Negatives: 1954
Total True Positives: 5962
Total True Negatives: 738

Confusion Matrix (with duplicates):
              Non-Repeater  Repeater
Non-Repeater         738.0      10.0
Repeater            1954.0    5962.0
accuracy_score
0.7733148661126501
Trial 1: hidden_dim=1188, latent_dim=32, beta=1.2772057319083712, gamma=0.10245891017273004, dropout_rate=0.14358965666983697, lr=0.00031035155974390384, scheduler_patience=7, class_weight=2.7265342268099895, activation=ReLU, classification_multiplier=13907.269038843966

=== Fold 1/5 ===
Validation Accuracy: 0.7040
Classification Report:
               precision    recall  f1-score   support

Non-Repeater       0.22      0.99      0.37       149
    Repeater       1.00      0.68      0.81      1584

    accuracy                           0.70      1733
   macro avg       0.61      0.84      0.59      1733
weighted avg       0.93      0.70      0.77      1733

Confusion Matrix:
 [[ 148    1]
 [ 512 1072]]

=== Fold 2/5 ===
Validation Accuracy: 0.6740
Classification Report:
               precision    recall  f1-score   support

Non-Repeater       0.21      0.99      0.35       150
    Repeater       1.00      0.64      0.78      1583

    accuracy                           0.67      1733
   macro avg       0.60      0.82      0.56      1733
weighted avg       0.93      0.67      0.75      1733

Confusion Matrix:
 [[ 149    1]
 [ 564 1019]]

=== Fold 3/5 ===
Validation Accuracy: 0.6619
Classification Report:
               precision    recall  f1-score   support

Non-Repeater       0.20      0.99      0.34       150
    Repeater       1.00      0.63      0.77      1583

    accuracy                           0.66      1733
   macro avg       0.60      0.81      0.56      1733
weighted avg       0.93      0.66      0.74      1733

Confusion Matrix:
 [[149   1]
 [585 998]]

=== Fold 4/5 ===
Validation Accuracy: 0.7207
Classification Report:
               precision    recall  f1-score   support

Non-Repeater       0.23      0.99      0.38       150
    Repeater       1.00      0.70      0.82      1583

    accuracy                           0.72      1733
   macro avg       0.62      0.84      0.60      1733
weighted avg       0.93      0.72      0.78      1733

Confusion Matrix:
 [[ 148    2]
 [ 482 1101]]

=== Fold 5/5 ===
Validation Accuracy: 0.7350
Classification Report:
               precision    recall  f1-score   support

Non-Repeater       0.24      0.97      0.39       149
    Repeater       1.00      0.71      0.83      1583

    accuracy                           0.73      1732
   macro avg       0.62      0.84      0.61      1732
weighted avg       0.93      0.73      0.79      1732

Confusion Matrix:
 [[ 145    4]
 [ 455 1128]]


=== Summary ===
Total False Positives: 9
Total False Negatives: 2598
Total True Positives: 5318
Total True Negatives: 739
[I 2025-06-12 17:58:21,737] Trial 143 finished with value: 0.6990997229916898 and parameters: {'hidden_dim': 1172, 'latent_dim': 33, 'beta': 1.1904986240810271, 'gamma': 0.1011549789671663, 'dropout_rate': 0.14166361056749682, 'lr': 0.00010380652917033007, 'scheduler_patience': 7, 'class_weight': 2.8347223567500155, 'activation': 'ReLU', 'classification_multiplier': 13952.821390645717}. Best is trial 142 with value: 0.7733148661126501.
[I 2025-06-12 18:04:27,683] Trial 144 finished with value: 0.760156971375808 and parameters: {'hidden_dim': 1200, 'latent_dim': 32, 'beta': 1.2704225755979388, 'gamma': 0.1369689903768177, 'dropout_rate': 0.1251565142492654, 'lr': 0.0002456017554530426, 'scheduler_patience': 7, 'class_weight': 2.765414363664294, 'activation': 'ReLU', 'classification_multiplier': 13493.008212947183}. Best is trial 142 with value: 0.7733148661126501.
