[I 2025-06-13 15:06:09,925] Trial 340 finished with value: 0.7453831948291783 and parameters: {'hidden_dim': 1210, 'latent_dim': 34, 'beta': 1.482392761763857, 'gamma': 0.22098495380123817, 'dropout_rate': 0.12165102446627647, 'lr': 0.0006443023608567122, 'scheduler_patience': 7, 'class_weight': 2.9491329985794583, 'activation': 'ReLU', 'classification_multiplier': 13434.554940620214}. Best is trial 194 with value: 0.8103647276084949.
Trial 1: hidden_dim=1441, latent_dim=29, beta=1.1944513357116073, gamma=0.10038074771347033, dropout_rate=0.4672546717028362, lr=0.0009285171660950651, scheduler_patience=7, class_weight=2.772114085290908, activation=ReLU, classification_multiplier=13265.34740090227

=== Fold 1/5 ===
Validation Accuracy: 0.6042
Classification Report:
               precision    recall  f1-score   support

Non-Repeater       0.18      0.99      0.30       149
    Repeater       1.00      0.57      0.72      1584

    accuracy                           0.60      1733
   macro avg       0.59      0.78      0.51      1733
weighted avg       0.93      0.60      0.69      1733

Confusion Matrix:
 [[147   2]
 [684 900]]

=== Fold 2/5 ===
Validation Accuracy: 0.2268
Classification Report:
               precision    recall  f1-score   support

Non-Repeater       0.10      1.00      0.18       150
    Repeater       1.00      0.15      0.27      1583

    accuracy                           0.23      1733
   macro avg       0.55      0.58      0.22      1733
weighted avg       0.92      0.23      0.26      1733

Confusion Matrix:
 [[ 150    0]
 [1340  243]]

=== Fold 3/5 ===
Validation Accuracy: 0.3572
Classification Report:
               precision    recall  f1-score   support

Non-Repeater       0.12      1.00      0.21       150
    Repeater       1.00      0.30      0.46      1583

    accuracy                           0.36      1733
   macro avg       0.56      0.65      0.33      1733
weighted avg       0.92      0.36      0.44      1733

Confusion Matrix:
 [[ 150    0]
 [1114  469]]

=== Fold 4/5 ===
Validation Accuracy: 0.6890
Classification Report:
               precision    recall  f1-score   support

Non-Repeater       0.22      0.99      0.35       150
    Repeater       1.00      0.66      0.80      1583

    accuracy                           0.69      1733
   macro avg       0.61      0.82      0.57      1733
weighted avg       0.93      0.69      0.76      1733

Confusion Matrix:
 [[ 148    2]
 [ 537 1046]]

=== Fold 5/5 ===
Validation Accuracy: 0.2425
Classification Report:
               precision    recall  f1-score   support

Non-Repeater       0.10      1.00      0.19       149
    Repeater       1.00      0.17      0.29      1583

    accuracy                           0.24      1732
   macro avg       0.55      0.59      0.24      1732
weighted avg       0.92      0.24      0.28      1732

Confusion Matrix:
 [[ 149    0]
 [1312  271]]


=== Summary ===
Total False Positives: 4
Total False Negatives: 4987
Total True Positives: 2929
Total True Negatives: 744

Confusion Matrix (with duplicates):
              Non-Repeater  Repeater
Non-Repeater         744.0       4.0
Repeater            4987.0    2929.0
accuracy_score
0.42393813481071096
Trial 1: hidden_dim=1306, latent_dim=32, beta=1.3992006420855256, gamma=0.16667273601504612, dropout_rate=0.1303716792660509, lr=0.002717689778955429, scheduler_patience=7, class_weight=2.8482724217709072, activation=ReLU, classification_multiplier=14809.927535213277

=== Fold 1/5 ===
Validation Accuracy: 0.6971
Classification Report:
               precision    recall  f1-score   support

Non-Repeater       0.22      0.99      0.36       149
    Repeater       1.00      0.67      0.80      1584

    accuracy                           0.70      1733
   macro avg       0.61      0.83      0.58      1733
weighted avg       0.93      0.70      0.76      1733

Confusion Matrix:
 [[ 148    1]
 [ 524 1060]]

=== Fold 2/5 ===
Validation Accuracy: 0.6982
Classification Report:
               precision    recall  f1-score   support

Non-Repeater       0.22      0.99      0.36       150
    Repeater       1.00      0.67      0.80      1583

    accuracy                           0.70      1733
   macro avg       0.61      0.83      0.58      1733
weighted avg       0.93      0.70      0.76      1733

Confusion Matrix:
 [[ 149    1]
 [ 522 1061]]

=== Fold 3/5 ===
Validation Accuracy: 0.7386
Classification Report:
               precision    recall  f1-score   support

Non-Repeater       0.25      0.99      0.40       150
    Repeater       1.00      0.72      0.83      1583

    accuracy                           0.74      1733
   macro avg       0.62      0.85      0.61      1733
weighted avg       0.93      0.74      0.80      1733

Confusion Matrix:
 [[ 148    2]
 [ 451 1132]]

=== Fold 4/5 ===
Validation Accuracy: 0.7773
Classification Report:
               precision    recall  f1-score   support

Non-Repeater       0.28      0.97      0.43       150
    Repeater       1.00      0.76      0.86      1583

    accuracy                           0.78      1733
   macro avg       0.64      0.87      0.65      1733
weighted avg       0.93      0.78      0.82      1733

Confusion Matrix:
 [[ 146    4]
 [ 382 1201]]

=== Fold 5/5 ===
Validation Accuracy: 0.8158
Classification Report:
               precision    recall  f1-score   support

Non-Repeater       0.31      0.96      0.47       149
    Repeater       1.00      0.80      0.89      1583

    accuracy                           0.82      1732
   macro avg       0.65      0.88      0.68      1732
weighted avg       0.94      0.82      0.85      1732

Confusion Matrix:
 [[ 143    6]
 [ 313 1270]]


=== Summary ===
Total False Positives: 14
Total False Negatives: 2192
Total True Positives: 5724
Total True Negatives: 734

Confusion Matrix (with duplicates):
              Non-Repeater  Repeater
Non-Repeater         734.0      14.0
Repeater            2192.0    5724.0
accuracy_score
0.7453831948291783
Trial 1: hidden_dim=1210, latent_dim=34, beta=1.482392761763857, gamma=0.22098495380123817, dropout_rate=0.12165102446627647, lr=0.0006443023608567122, scheduler_patience=7, class_weight=2.9491329985794583, activation=ReLU, classification_multiplier=13434.554940620214

=== Fold 1/5 ===
Validation Accuracy: 0.6613
Classification Report:
               precision    recall  f1-score   support

Non-Repeater       0.20      0.99      0.34       149
    Repeater       1.00      0.63      0.77      1584

    accuracy                           0.66      1733
   macro avg       0.60      0.81      0.55      1733
weighted avg       0.93      0.66      0.74      1733

Confusion Matrix:
 [[148   1]
 [586 998]]

=== Fold 2/5 ===
Validation Accuracy: 0.6405
Classification Report:
               precision    recall  f1-score   support

Non-Repeater       0.19      0.99      0.32       150
    Repeater       1.00      0.61      0.76      1583

    accuracy                           0.64      1733
   macro avg       0.60      0.80      0.54      1733
weighted avg       0.93      0.64      0.72      1733

Confusion Matrix:
 [[149   1]
 [622 961]]

=== Fold 3/5 ===
Validation Accuracy: 0.6699
Classification Report:
               precision    recall  f1-score   support

Non-Repeater       0.21      0.99      0.34       150
    Repeater       1.00      0.64      0.78      1583

    accuracy                           0.67      1733
   macro avg       0.60      0.81      0.56      1733
weighted avg       0.93      0.67      0.74      1733

Confusion Matrix:
 [[ 148    2]
 [ 570 1013]]

=== Fold 4/5 ===
Validation Accuracy: 0.5470
Classification Report:
               precision    recall  f1-score   support

Non-Repeater       0.16      0.99      0.28       150
    Repeater       1.00      0.50      0.67      1583

    accuracy                           0.55      1733
   macro avg       0.58      0.75      0.47      1733
weighted avg       0.93      0.55      0.64      1733

Confusion Matrix:
 [[149   1]
 [784 799]]

=== Fold 5/5 ===
Validation Accuracy: 0.7390
Classification Report:
               precision    recall  f1-score   support

Non-Repeater       0.25      0.98      0.39       149
    Repeater       1.00      0.72      0.83      1583

    accuracy                           0.74      1732
   macro avg       0.62      0.85      0.61      1732
weighted avg       0.93      0.74      0.80      1732

Confusion Matrix:
 [[ 146    3]
 [ 449 1134]]


=== Summary ===
Total False Positives: 8
Total False Negatives: 3011
Total True Positives: 4905
Total True Negatives: 740
[I 2025-06-13 15:12:32,868] Trial 341 finished with value: 0.6515466297322253 and parameters: {'hidden_dim': 1374, 'latent_dim': 30, 'beta': 1.2790877224784434, 'gamma': 0.10030887263192355, 'dropout_rate': 0.13474833125249938, 'lr': 0.00026608153322368584, 'scheduler_patience': 2, 'class_weight': 2.8727063222617155, 'activation': 'ReLU', 'classification_multiplier': 14458.417407413091}. Best is trial 194 with value: 0.8103647276084949.
/home/ubuntu/frb-analysis/.frb-analysis/lib/python3.12/site-packages/sklearn/metrics/_classification.py:1565: UndefinedMetricWarning: Precision is ill-defined and being set to 0.0 in labels with no predicted samples. Use `zero_division` parameter to control this behavior.
  _warn_prf(average, modifier, f"{metric.capitalize()} is", len(result))
/home/ubuntu/frb-analysis/.frb-analysis/lib/python3.12/site-packages/sklearn/metrics/_classification.py:1565: UndefinedMetricWarning: Precision is ill-defined and being set to 0.0 in labels with no predicted samples. Use `zero_division` parameter to control this behavior.
  _warn_prf(average, modifier, f"{metric.capitalize()} is", len(result))
/home/ubuntu/frb-analysis/.frb-analysis/lib/python3.12/site-packages/sklearn/metrics/_classification.py:1565: UndefinedMetricWarning: Precision is ill-defined and being set to 0.0 in labels with no predicted samples. Use `zero_division` parameter to control this behavior.
  _warn_prf(average, modifier, f"{metric.capitalize()} is", len(result))
[I 2025-06-13 15:19:47,578] Trial 342 finished with value: 0.22691597414589104 and parameters: {'hidden_dim': 1834, 'latent_dim': 33, 'beta': 1.346986999378697, 'gamma': 0.18397131898257046, 'dropout_rate': 0.11180756941260879, 'lr': 0.001241744342189033, 'scheduler_patience': 7, 'class_weight': 2.7078169948448765, 'activation': 'SELU', 'classification_multiplier': 14702.46786499324}. Best is trial 194 with value: 0.8103647276084949.
[I 2025-06-13 15:26:23,359] Trial 343 finished with value: 0.7712373037857803 and parameters: {'hidden_dim': 1488, 'latent_dim': 31, 'beta': 1.5164181661637837, 'gamma': 0.14232717690254817, 'dropout_rate': 0.12412988113881142, 'lr': 0.0004436734763552198, 'scheduler_patience': 7, 'class_weight': 2.7949347037325283, 'activation': 'ReLU', 'classification_multiplier': 14115.901554473296}. Best is trial 194 with value: 0.8103647276084949.

Confusion Matrix (with duplicates):
              Non-Repeater  Repeater
Non-Repeater         740.0       8.0
Repeater            3011.0    4905.0
accuracy_score
0.6515466297322253
Trial 1: hidden_dim=1374, latent_dim=30, beta=1.2790877224784434, gamma=0.10030887263192355, dropout_rate=0.13474833125249938, lr=0.00026608153322368584, scheduler_patience=2, class_weight=2.8727063222617155, activation=ReLU, classification_multiplier=14458.417407413091

=== Fold 1/5 ===
Validation Accuracy: 0.2504
Classification Report:
               precision    recall  f1-score   support

Non-Repeater       0.10      1.00      0.19       149
    Repeater       1.00      0.18      0.30      1584

    accuracy                           0.25      1733
   macro avg       0.55      0.59      0.25      1733
weighted avg       0.92      0.25      0.29      1733

Confusion Matrix:
 [[ 149    0]
 [1299  285]]

=== Fold 2/5 ===
Validation Accuracy: 0.2412
Classification Report:
               precision    recall  f1-score   support

Non-Repeater       0.10      1.00      0.19       150
    Repeater       1.00      0.17      0.29      1583

    accuracy                           0.24      1733
   macro avg       0.55      0.58      0.24      1733
weighted avg       0.92      0.24      0.28      1733

Confusion Matrix:
 [[ 150    0]
 [1315  268]]

=== Fold 3/5 ===
Validation Accuracy: 0.2343
Classification Report:
               precision    recall  f1-score   support

Non-Repeater       0.10      1.00      0.18       150
    Repeater       1.00      0.16      0.28      1583

    accuracy                           0.23      1733
   macro avg       0.55      0.58      0.23      1733
weighted avg       0.92      0.23      0.27      1733

Confusion Matrix:
 [[ 150    0]
 [1327  256]]

=== Fold 4/5 ===
Validation Accuracy: 0.0866
Classification Report:
               precision    recall  f1-score   support

Non-Repeater       0.09      1.00      0.16       150
    Repeater       0.00      0.00      0.00      1583

    accuracy                           0.09      1733
   macro avg       0.04      0.50      0.08      1733
weighted avg       0.01      0.09      0.01      1733

Confusion Matrix:
 [[ 150    0]
 [1583    0]]

=== Fold 5/5 ===
Validation Accuracy: 0.3222
Classification Report:
               precision    recall  f1-score   support

Non-Repeater       0.11      0.99      0.20       149
    Repeater       1.00      0.26      0.41      1583

    accuracy                           0.32      1732
   macro avg       0.55      0.63      0.31      1732
weighted avg       0.92      0.32      0.39      1732

Confusion Matrix:
 [[ 148    1]
 [1173  410]]


=== Summary ===
Total False Positives: 1
Total False Negatives: 6697
Total True Positives: 1219
Total True Negatives: 747

Confusion Matrix (with duplicates):
              Non-Repeater  Repeater
Non-Repeater         747.0       1.0
Repeater            6697.0    1219.0
accuracy_score
0.22691597414589104
Trial 1: hidden_dim=1834, latent_dim=33, beta=1.346986999378697, gamma=0.18397131898257046, dropout_rate=0.11180756941260879, lr=0.001241744342189033, scheduler_patience=7, class_weight=2.7078169948448765, activation=SELU, classification_multiplier=14702.46786499324

=== Fold 1/5 ===
Validation Accuracy: 0.8275
Classification Report:
               precision    recall  f1-score   support

Non-Repeater       0.33      0.97      0.49       149
    Repeater       1.00      0.81      0.90      1584

    accuracy                           0.83      1733
   macro avg       0.66      0.89      0.69      1733
weighted avg       0.94      0.83      0.86      1733

Confusion Matrix:
 [[ 144    5]
 [ 294 1290]]

=== Fold 2/5 ===
Validation Accuracy: 0.7040
Classification Report:
               precision    recall  f1-score   support

Non-Repeater       0.23      0.99      0.37       150
    Repeater       1.00      0.68      0.81      1583

    accuracy                           0.70      1733
   macro avg       0.61      0.83      0.59      1733
weighted avg       0.93      0.70      0.77      1733

Confusion Matrix:
 [[ 149    1]
 [ 512 1071]]

=== Fold 3/5 ===
Validation Accuracy: 0.7017
Classification Report:
               precision    recall  f1-score   support

Non-Repeater       0.22      0.99      0.36       150
    Repeater       1.00      0.67      0.81      1583

    accuracy                           0.70      1733
   macro avg       0.61      0.83      0.58      1733
weighted avg       0.93      0.70      0.77      1733

Confusion Matrix:
 [[ 148    2]
 [ 515 1068]]

=== Fold 4/5 ===
Validation Accuracy: 0.7421
Classification Report:
               precision    recall  f1-score   support

Non-Repeater       0.25      0.98      0.40       150
    Repeater       1.00      0.72      0.84      1583

    accuracy                           0.74      1733
   macro avg       0.62      0.85      0.62      1733
weighted avg       0.93      0.74      0.80      1733

Confusion Matrix:
 [[ 147    3]
 [ 444 1139]]

=== Fold 5/5 ===
Validation Accuracy: 0.8811
Classification Report:
               precision    recall  f1-score   support

Non-Repeater       0.42      0.97      0.58       149
    Repeater       1.00      0.87      0.93      1583

    accuracy                           0.88      1732
   macro avg       0.71      0.92      0.76      1732
weighted avg       0.95      0.88      0.90      1732

Confusion Matrix:
 [[ 145    4]
 [ 202 1381]]


=== Summary ===
Total False Positives: 15
Total False Negatives: 1967
Total True Positives: 5949
Total True Negatives: 733

Confusion Matrix (with duplicates):
              Non-Repeater  Repeater
Non-Repeater         733.0      15.0
Repeater            1967.0    5949.0
accuracy_score
0.7712373037857803
Trial 1: hidden_dim=1488, latent_dim=31, beta=1.5164181661637837, gamma=0.14232717690254817, dropout_rate=0.12412988113881142, lr=0.0004436734763552198, scheduler_patience=7, class_weight=2.7949347037325283, activation=ReLU, classification_multiplier=14115.901554473296

=== Fold 1/5 ===
Validation Accuracy: 0.7051
Classification Report:
               precision    recall  f1-score   support

Non-Repeater       0.23      1.00      0.37       149
    Repeater       1.00      0.68      0.81      1584

    accuracy                           0.71      1733
   macro avg       0.61      0.84      0.59      1733
weighted avg       0.93      0.71      0.77      1733

Confusion Matrix:
 [[ 149    0]
 [ 511 1073]]

=== Fold 2/5 ===
Validation Accuracy: 0.6671
Classification Report:
               precision    recall  f1-score   support

Non-Repeater       0.21      0.99      0.34       150
    Repeater       1.00      0.64      0.78      1583

    accuracy                           0.67      1733
   macro avg       0.60      0.81      0.56      1733
weighted avg       0.93      0.67      0.74      1733

Confusion Matrix:
 [[ 149    1]
 [ 576 1007]]

=== Fold 3/5 ===
Validation Accuracy: 0.5574
Classification Report:
               precision    recall  f1-score   support

Non-Repeater       0.16      1.00      0.28       150
    Repeater       1.00      0.52      0.68      1583

    accuracy                           0.56      1733
   macro avg       0.58      0.76      0.48      1733
weighted avg       0.93      0.56      0.65      1733

Confusion Matrix:
 [[150   0]
 [767 816]]

=== Fold 4/5 ===
Validation Accuracy: 0.7553
Classification Report:
               precision    recall  f1-score   support

Non-Repeater       0.26      0.99      0.41       150
    Repeater       1.00      0.73      0.85      1583

    accuracy                           0.76      1733
   macro avg       0.63      0.86      0.63      1733
weighted avg       0.93      0.76      0.81      1733

Confusion Matrix:
 [[ 148    2]
 [ 422 1161]]

=== Fold 5/5 ===
Validation Accuracy: 0.7696
Classification Report:
 [I 2025-06-13 15:33:07,848] Trial 344 finished with value: 0.6909048938134811 and parameters: {'hidden_dim': 1543, 'latent_dim': 31, 'beta': 1.5236217036042805, 'gamma': 0.22914048856169741, 'dropout_rate': 0.12811917139415605, 'lr': 0.0007808516434701077, 'scheduler_patience': 7, 'class_weight': 2.8266239277014713, 'activation': 'ReLU', 'classification_multiplier': 14002.294205828199}. Best is trial 194 with value: 0.8103647276084949.
[I 2025-06-13 15:39:48,957] Trial 345 finished with value: 0.7272622345337026 and parameters: {'hidden_dim': 1518, 'latent_dim': 29, 'beta': 1.4622472769112613, 'gamma': 0.14070990344901968, 'dropout_rate': 0.14075749133156984, 'lr': 0.0005323417302508475, 'scheduler_patience': 5, 'class_weight': 2.8913178612941244, 'activation': 'ReLU', 'classification_multiplier': 14267.566687779317}. Best is trial 194 with value: 0.8103647276084949.
