[I 2025-06-13 13:58:17,542] Trial 329 finished with value: 0.7466528162511542 and parameters: {'hidden_dim': 1511, 'latent_dim': 35, 'beta': 1.3850108241603112, 'gamma': 0.13753541863730143, 'dropout_rate': 0.10445369097655316, 'lr': 0.0006936452718540102, 'scheduler_patience': 7, 'class_weight': 2.767626951588916, 'activation': 'ReLU', 'classification_multiplier': 13199.188792986759}. Best is trial 194 with value: 0.8103647276084949.
              precision    recall  f1-score   support

Non-Repeater       0.28      0.96      0.43       150
    Repeater       1.00      0.76      0.86      1583

    accuracy                           0.78      1733
   macro avg       0.64      0.86      0.65      1733
weighted avg       0.93      0.78      0.83      1733

Confusion Matrix:
 [[ 144    6]
 [ 374 1209]]

=== Fold 5/5 ===
Validation Accuracy: 0.7465
Classification Report:
               precision    recall  f1-score   support

Non-Repeater       0.25      0.97      0.40       149
    Repeater       1.00      0.73      0.84      1583

    accuracy                           0.75      1732
   macro avg       0.62      0.85      0.62      1732
weighted avg       0.93      0.75      0.80      1732

Confusion Matrix:
 [[ 145    4]
 [ 435 1148]]


=== Summary ===
Total False Positives: 14
Total False Negatives: 2115
Total True Positives: 5801
Total True Negatives: 734

Confusion Matrix (with duplicates):
              Non-Repeater  Repeater
Non-Repeater         734.0      14.0
Repeater            2115.0    5801.0
accuracy_score
0.7542705447830101
Trial 1: hidden_dim=1415, latent_dim=31, beta=1.3055332506661885, gamma=0.1523744724372827, dropout_rate=0.11441605687879448, lr=0.0009969039321924506, scheduler_patience=7, class_weight=2.729333612390072, activation=ReLU, classification_multiplier=13035.910097349737

=== Fold 1/5 ===
Validation Accuracy: 0.7680
Classification Report:
               precision    recall  f1-score   support

Non-Repeater       0.27      0.96      0.42       149
    Repeater       0.99      0.75      0.86      1584

    accuracy                           0.77      1733
   macro avg       0.63      0.85      0.64      1733
weighted avg       0.93      0.77      0.82      1733

Confusion Matrix:
 [[ 143    6]
 [ 396 1188]]

=== Fold 2/5 ===
Validation Accuracy: 0.8292
Classification Report:
               precision    recall  f1-score   support

Non-Repeater       0.33      0.99      0.50       150
    Repeater       1.00      0.81      0.90      1583

    accuracy                           0.83      1733
   macro avg       0.67      0.90      0.70      1733
weighted avg       0.94      0.83      0.86      1733

Confusion Matrix:
 [[ 148    2]
 [ 294 1289]]

=== Fold 3/5 ===
Validation Accuracy: 0.7634
Classification Report:
               precision    recall  f1-score   support

Non-Repeater       0.27      0.99      0.42       150
    Repeater       1.00      0.74      0.85      1583

    accuracy                           0.76      1733
   macro avg       0.63      0.87      0.64      1733
weighted avg       0.94      0.76      0.81      1733

Confusion Matrix:
 [[ 149    1]
 [ 409 1174]]

=== Fold 4/5 ===
Validation Accuracy: 0.7017
Classification Report:
               precision    recall  f1-score   support

Non-Repeater       0.22      0.98      0.36       150
    Repeater       1.00      0.68      0.81      1583

    accuracy                           0.70      1733
   macro avg       0.61      0.83      0.58      1733
weighted avg       0.93      0.70      0.77      1733

Confusion Matrix:
 [[ 147    3]
 [ 514 1069]]

=== Fold 5/5 ===
Validation Accuracy: 0.7633
Classification Report:
               precision    recall  f1-score   support

Non-Repeater       0.26      0.97      0.41       149
    Repeater       1.00      0.74      0.85      1583

    accuracy                           0.76      1732
   macro avg       0.63      0.86      0.63      1732
weighted avg       0.93      0.76      0.81      1732

Confusion Matrix:
 [[ 145    4]
 [ 406 1177]]


=== Summary ===
Total False Positives: 16
Total False Negatives: 2019
Total True Positives: 5897
Total True Negatives: 732

Confusion Matrix (with duplicates):
              Non-Repeater  Repeater
Non-Repeater         732.0      16.0
Repeater            2019.0    5897.0
accuracy_score
0.7651200369344414
Trial 1: hidden_dim=1364, latent_dim=35, beta=1.3374349356793827, gamma=0.18536866320826004, dropout_rate=0.1188595396585104, lr=0.00043096482090811854, scheduler_patience=7, class_weight=2.8010824816072963, activation=ReLU, classification_multiplier=12574.790760650125

=== Fold 1/5 ===
Validation Accuracy: 0.6694
Classification Report:
               precision    recall  f1-score   support

Non-Repeater       0.20      0.98      0.34       149
    Repeater       1.00      0.64      0.78      1584

    accuracy                           0.67      1733
   macro avg       0.60      0.81      0.56      1733
weighted avg       0.93      0.67      0.74      1733

Confusion Matrix:
 [[ 146    3]
 [ 570 1014]]

=== Fold 2/5 ===
Validation Accuracy: 0.7496
Classification Report:
               precision    recall  f1-score   support

Non-Repeater       0.26      0.99      0.41       150
    Repeater       1.00      0.73      0.84      1583

    accuracy                           0.75      1733
   macro avg       0.63      0.86      0.62      1733
weighted avg       0.93      0.75      0.80      1733

Confusion Matrix:
 [[ 149    1]
 [ 433 1150]]

=== Fold 3/5 ===
Validation Accuracy: 0.7478
Classification Report:
               precision    recall  f1-score   support

Non-Repeater       0.25      0.99      0.40       150
    Repeater       1.00      0.73      0.84      1583

    accuracy                           0.75      1733
   macro avg       0.63      0.86      0.62      1733
weighted avg       0.93      0.75      0.80      1733

Confusion Matrix:
 [[ 148    2]
 [ 435 1148]]

=== Fold 4/5 ===
Validation Accuracy: 0.6924
Classification Report:
               precision    recall  f1-score   support

Non-Repeater       0.22      0.99      0.36       150
    Repeater       1.00      0.66      0.80      1583

    accuracy                           0.69      1733
   macro avg       0.61      0.83      0.58      1733
weighted avg       0.93      0.69      0.76      1733

Confusion Matrix:
 [[ 148    2]
 [ 531 1052]]

=== Fold 5/5 ===
Validation Accuracy: 0.8741
Classification Report:
               precision    recall  f1-score   support

Non-Repeater       0.40      0.97      0.57       149
    Repeater       1.00      0.86      0.93      1583

    accuracy                           0.87      1732
   macro avg       0.70      0.92      0.75      1732
weighted avg       0.95      0.87      0.90      1732

Confusion Matrix:
 [[ 145    4]
 [ 214 1369]]


=== Summary ===
Total False Positives: 12
Total False Negatives: 2183
Total True Positives: 5733
Total True Negatives: 736

Confusion Matrix (with duplicates):
              Non-Repeater  Repeater
Non-Repeater         736.0      12.0
Repeater            2183.0    5733.0
accuracy_score
0.7466528162511542
Trial 1: hidden_dim=1511, latent_dim=35, beta=1.3850108241603112, gamma=0.13753541863730143, dropout_rate=0.10445369097655316, lr=0.0006936452718540102, scheduler_patience=7, class_weight=2.767626951588916, activation=ReLU, classification_multiplier=13199.188792986759

=== Fold 1/5 ===
Validation Accuracy: 0.7092
Classification Report:
               precision    recall  f1-score   support

Non-Repeater       0.23      0.99      0.37       149
    Repeater       1.00      0.68      0.81      1584

    accuracy                           0.71      1733
   macro avg       0.61      0.84      0.59      1733
weighted avg       0.93      0.71      0.77      1733

Confusion Matrix:
 [[ 148    1]
 [ 503 1081]]

=== Fold 2/5 ===
Validation Accuracy: 0.7865
Classification Report:
               precision    recall  f1-score   support

Non-Repeater       0.29      0.98      0.44       150
    Repeater       1.00      0.77      0.87      1583

    accuracy                           0.79      1733
   macro avg       0.64      0.87      0.66      1733
weighted avg       0.94      0.79      0.83      1733

Confusion Matrix:
 [[ 147    3]
 [ 367 1216]]

=== Fold 3/5 ===
Validation Accuracy: 0.7017
Classification Report:
 [I 2025-06-13 14:04:45,369] Trial 330 finished with value: 0.7233379501385041 and parameters: {'hidden_dim': 1420, 'latent_dim': 36, 'beta': 1.2968574487657885, 'gamma': 0.19907323581750092, 'dropout_rate': 0.11414118939764939, 'lr': 0.001109678175609345, 'scheduler_patience': 7, 'class_weight': 2.835331733021814, 'activation': 'ReLU', 'classification_multiplier': 12908.32540884807}. Best is trial 194 with value: 0.8103647276084949.
[I 2025-06-13 14:11:08,967] Trial 331 finished with value: 0.7482686980609419 and parameters: {'hidden_dim': 1355, 'latent_dim': 35, 'beta': 1.3619000681430156, 'gamma': 0.13585644882460168, 'dropout_rate': 0.12579755482175076, 'lr': 0.0004717614970109229, 'scheduler_patience': 7, 'class_weight': 2.6983884620413763, 'activation': 'ReLU', 'classification_multiplier': 12766.200485531064}. Best is trial 194 with value: 0.8103647276084949.
[I 2025-06-13 14:17:25,405] Trial 332 finished with value: 0.7658125577100646 and parameters: {'hidden_dim': 1288, 'latent_dim': 30, 'beta': 1.2613643084375337, 'gamma': 0.16917488146929935, 'dropout_rate': 0.12066789036691491, 'lr': 0.0006964289383232734, 'scheduler_patience': 7, 'class_weight': 2.8852319171203975, 'activation': 'ReLU', 'classification_multiplier': 14572.432454176644}. Best is trial 194 with value: 0.8103647276084949.
              precision    recall  f1-score   support

Non-Repeater       0.22      0.99      0.37       150
    Repeater       1.00      0.67      0.80      1583

    accuracy                           0.70      1733
   macro avg       0.61      0.83      0.59      1733
weighted avg       0.93      0.70      0.77      1733

Confusion Matrix:
 [[ 149    1]
 [ 516 1067]]

=== Fold 4/5 ===
Validation Accuracy: 0.6382
Classification Report:
               precision    recall  f1-score   support

Non-Repeater       0.19      0.97      0.32       150
    Repeater       0.99      0.61      0.75      1583

    accuracy                           0.64      1733
   macro avg       0.59      0.79      0.54      1733
weighted avg       0.93      0.64      0.72      1733

Confusion Matrix:
 [[145   5]
 [622 961]]

=== Fold 5/5 ===
Validation Accuracy: 0.7812
Classification Report:
               precision    recall  f1-score   support

Non-Repeater       0.28      0.97      0.43       149
    Repeater       1.00      0.76      0.86      1583

    accuracy                           0.78      1732
   macro avg       0.64      0.87      0.65      1732
weighted avg       0.93      0.78      0.83      1732

Confusion Matrix:
 [[ 145    4]
 [ 375 1208]]


=== Summary ===
Total False Positives: 14
Total False Negatives: 2383
Total True Positives: 5533
Total True Negatives: 734

Confusion Matrix (with duplicates):
              Non-Repeater  Repeater
Non-Repeater         734.0      14.0
Repeater            2383.0    5533.0
accuracy_score
0.7233379501385041
Trial 1: hidden_dim=1420, latent_dim=36, beta=1.2968574487657885, gamma=0.19907323581750092, dropout_rate=0.11414118939764939, lr=0.001109678175609345, scheduler_patience=7, class_weight=2.835331733021814, activation=ReLU, classification_multiplier=12908.32540884807

=== Fold 1/5 ===
Validation Accuracy: 0.7813
Classification Report:
               precision    recall  f1-score   support

Non-Repeater       0.28      0.97      0.43       149
    Repeater       1.00      0.76      0.86      1584

    accuracy                           0.78      1733
   macro avg       0.64      0.87      0.65      1733
weighted avg       0.93      0.78      0.83      1733

Confusion Matrix:
 [[ 145    4]
 [ 375 1209]]

=== Fold 2/5 ===
Validation Accuracy: 0.7201
Classification Report:
               precision    recall  f1-score   support

Non-Repeater       0.24      0.99      0.38       150
    Repeater       1.00      0.69      0.82      1583

    accuracy                           0.72      1733
   macro avg       0.62      0.84      0.60      1733
weighted avg       0.93      0.72      0.78      1733

Confusion Matrix:
 [[ 149    1]
 [ 484 1099]]

=== Fold 3/5 ===
Validation Accuracy: 0.6757
Classification Report:
               precision    recall  f1-score   support

Non-Repeater       0.21      0.99      0.35       150
    Repeater       1.00      0.65      0.78      1583

    accuracy                           0.68      1733
   macro avg       0.60      0.82      0.57      1733
weighted avg       0.93      0.68      0.75      1733

Confusion Matrix:
 [[ 149    1]
 [ 561 1022]]

=== Fold 4/5 ===
Validation Accuracy: 0.7011
Classification Report:
               precision    recall  f1-score   support

Non-Repeater       0.22      0.99      0.37       150
    Repeater       1.00      0.67      0.80      1583

    accuracy                           0.70      1733
   macro avg       0.61      0.83      0.58      1733
weighted avg       0.93      0.70      0.77      1733

Confusion Matrix:
 [[ 149    1]
 [ 517 1066]]

=== Fold 5/5 ===
Validation Accuracy: 0.8632
Classification Report:
               precision    recall  f1-score   support

Non-Repeater       0.38      0.97      0.55       149
    Repeater       1.00      0.85      0.92      1583

    accuracy                           0.86      1732
   macro avg       0.69      0.91      0.73      1732
weighted avg       0.94      0.86      0.89      1732

Confusion Matrix:
 [[ 145    4]
 [ 233 1350]]


=== Summary ===
Total False Positives: 11
Total False Negatives: 2170
Total True Positives: 5746
Total True Negatives: 737

Confusion Matrix (with duplicates):
              Non-Repeater  Repeater
Non-Repeater         737.0      11.0
Repeater            2170.0    5746.0
accuracy_score
0.7482686980609419
Trial 1: hidden_dim=1355, latent_dim=35, beta=1.3619000681430156, gamma=0.13585644882460168, dropout_rate=0.12579755482175076, lr=0.0004717614970109229, scheduler_patience=7, class_weight=2.6983884620413763, activation=ReLU, classification_multiplier=12766.200485531064

=== Fold 1/5 ===
Validation Accuracy: 0.7998
Classification Report:
               precision    recall  f1-score   support

Non-Repeater       0.30      0.98      0.46       149
    Repeater       1.00      0.78      0.88      1584

    accuracy                           0.80      1733
   macro avg       0.65      0.88      0.67      1733
weighted avg       0.94      0.80      0.84      1733

Confusion Matrix:
 [[ 146    3]
 [ 344 1240]]

=== Fold 2/5 ===
Validation Accuracy: 0.7017
Classification Report:
               precision    recall  f1-score   support

Non-Repeater       0.22      0.99      0.37       150
    Repeater       1.00      0.67      0.80      1583

    accuracy                           0.70      1733
   macro avg       0.61      0.83      0.59      1733
weighted avg       0.93      0.70      0.77      1733

Confusion Matrix:
 [[ 149    1]
 [ 516 1067]]

=== Fold 3/5 ===
Validation Accuracy: 0.7173
Classification Report:
               precision    recall  f1-score   support

Non-Repeater       0.23      0.99      0.38       150
    Repeater       1.00      0.69      0.82      1583

    accuracy                           0.72      1733
   macro avg       0.62      0.84      0.60      1733
weighted avg       0.93      0.72      0.78      1733

Confusion Matrix:
 [[ 148    2]
 [ 488 1095]]

=== Fold 4/5 ===
Validation Accuracy: 0.7790
Classification Report:
               precision    recall  f1-score   support

Non-Repeater       0.28      0.99      0.44       150
    Repeater       1.00      0.76      0.86      1583

    accuracy                           0.78      1733
   macro avg       0.64      0.87      0.65      1733
weighted avg       0.94      0.78      0.83      1733

Confusion Matrix:
 [[ 148    2]
 [ 381 1202]]

=== Fold 5/5 ===
Validation Accuracy: 0.8314
Classification Report:
               precision    recall  f1-score   support

Non-Repeater       0.34      0.99      0.50       149
    Repeater       1.00      0.82      0.90      1583

    accuracy                           0.83      1732
   macro avg       0.67      0.90      0.70      1732
weighted avg       0.94      0.83      0.86      1732

Confusion Matrix:
 [[ 147    2]
 [ 290 1293]]


=== Summary ===
Total False Positives: 10
Total False Negatives: 2019
Total True Positives: 5897
Total True Negatives: 738

Confusion Matrix (with duplicates):
              Non-Repeater  Repeater
Non-Repeater         738.0      10.0
Repeater            2019.0    5897.0
accuracy_score
0.7658125577100646
Trial 1: hidden_dim=1288, latent_dim=30, beta=1.2613643084375337, gamma=0.16917488146929935, dropout_rate=0.12066789036691491, lr=0.0006964289383232734, scheduler_patience=7, class_weight=2.8852319171203975, activation=ReLU, classification_multiplier=14572.432454176644

=== Fold 1/5 ===
Validation Accuracy: 0.6913
Classification Report:
               precision    recall  f1-score   support

Non-Repeater       0.22      0.99      0.36       149
    Repeater       1.00      0.66      0.80      1584

    accuracy                           0.69      1733
   macro avg       0.61      0.83      0.58      1733
weighted avg       0.93      0.69      0.76      1733

Confusion Matrix:
 [[ 148    1]
 [ 534 1050]]

=== Fold 2/5 ===
Validation Accuracy: 0.7513
Classification Report:
 [I 2025-06-13 14:23:49,956] Trial 333 finished with value: 0.7353416435826408 and parameters: {'hidden_dim': 1392, 'latent_dim': 32, 'beta': 1.337540579467403, 'gamma': 0.22664862788268453, 'dropout_rate': 0.10804153161474422, 'lr': 0.0008615301342674785, 'scheduler_patience': 7, 'class_weight': 2.997703354877465, 'activation': 'ReLU', 'classification_multiplier': 14983.702986829128}. Best is trial 194 with value: 0.8103647276084949.
[I 2025-06-13 14:29:21,380] Trial 334 finished with value: 0.7066020313942751 and parameters: {'hidden_dim': 283, 'latent_dim': 34, 'beta': 1.3838564086454272, 'gamma': 0.13479302128014178, 'dropout_rate': 0.12999797155235993, 'lr': 0.0003847734689576424, 'scheduler_patience': 7, 'class_weight': 2.8212809576388125, 'activation': 'ReLU', 'classification_multiplier': 12727.01340443089}. Best is trial 194 with value: 0.8103647276084949.
