[I 2025-06-13 02:46:28,719] Trial 225 finished with value: 0.30055401662049863 and parameters: {'hidden_dim': 1378, 'latent_dim': 32, 'beta': 1.2493868275618094, 'gamma': 0.2399227313021369, 'dropout_rate': 0.11230765004307798, 'lr': 0.0002883349369944305, 'scheduler_patience': 7, 'class_weight': 2.578275308713881, 'activation': 'SELU', 'classification_multiplier': 13830.266950537196}. Best is trial 194 with value: 0.8103647276084949.
              precision    recall  f1-score   support

Non-Repeater       0.28      0.98      0.44       149
    Repeater       1.00      0.77      0.87      1584

    accuracy                           0.79      1733
   macro avg       0.64      0.87      0.65      1733
weighted avg       0.94      0.79      0.83      1733

Confusion Matrix:
 [[ 146    3]
 [ 369 1215]]

=== Fold 2/5 ===
Validation Accuracy: 0.6947
Classification Report:
               precision    recall  f1-score   support

Non-Repeater       0.22      0.99      0.36       150
    Repeater       1.00      0.67      0.80      1583

    accuracy                           0.69      1733
   macro avg       0.61      0.83      0.58      1733
weighted avg       0.93      0.69      0.76      1733

Confusion Matrix:
 [[ 149    1]
 [ 528 1055]]

=== Fold 3/5 ===
Validation Accuracy: 0.7242
Classification Report:
               precision    recall  f1-score   support

Non-Repeater       0.24      0.99      0.38       150
    Repeater       1.00      0.70      0.82      1583

    accuracy                           0.72      1733
   macro avg       0.62      0.84      0.60      1733
weighted avg       0.93      0.72      0.78      1733

Confusion Matrix:
 [[ 148    2]
 [ 476 1107]]

=== Fold 4/5 ===
Validation Accuracy: 0.7905
Classification Report:
               precision    recall  f1-score   support

Non-Repeater       0.29      0.97      0.45       150
    Repeater       1.00      0.77      0.87      1583

    accuracy                           0.79      1733
   macro avg       0.64      0.87      0.66      1733
weighted avg       0.94      0.79      0.83      1733

Confusion Matrix:
 [[ 146    4]
 [ 359 1224]]

=== Fold 5/5 ===
Validation Accuracy: 0.7552
Classification Report:
               precision    recall  f1-score   support

Non-Repeater       0.26      0.98      0.41       149
    Repeater       1.00      0.73      0.85      1583

    accuracy                           0.76      1732
   macro avg       0.63      0.86      0.63      1732
weighted avg       0.93      0.76      0.81      1732

Confusion Matrix:
 [[ 146    3]
 [ 421 1162]]


=== Summary ===
Total False Positives: 13
Total False Negatives: 2153
Total True Positives: 5763
Total True Negatives: 735

Confusion Matrix (with duplicates):
              Non-Repeater  Repeater
Non-Repeater         735.0      13.0
Repeater            2153.0    5763.0
accuracy_score
0.75
Trial 1: hidden_dim=1304, latent_dim=30, beta=1.3109871182372757, gamma=0.16620483715973167, dropout_rate=0.12481309971178361, lr=0.0006166877631963648, scheduler_patience=7, class_weight=2.7340262791622214, activation=ReLU, classification_multiplier=13245.679986772466

=== Fold 1/5 ===
Validation Accuracy: 0.2187
Classification Report:
               precision    recall  f1-score   support

Non-Repeater       0.10      1.00      0.18       149
    Repeater       1.00      0.15      0.25      1584

    accuracy                           0.22      1733
   macro avg       0.55      0.57      0.22      1733
weighted avg       0.92      0.22      0.25      1733

Confusion Matrix:
 [[ 149    0]
 [1354  230]]

=== Fold 2/5 ===
Validation Accuracy: 0.3381
Classification Report:
               precision    recall  f1-score   support

Non-Repeater       0.12      0.99      0.21       150
    Repeater       1.00      0.28      0.43      1583

    accuracy                           0.34      1733
   macro avg       0.56      0.63      0.32      1733
weighted avg       0.92      0.34      0.41      1733

Confusion Matrix:
 [[ 149    1]
 [1146  437]]

=== Fold 3/5 ===
Validation Accuracy: 0.3976
Classification Report:
               precision    recall  f1-score   support

Non-Repeater       0.12      0.99      0.22       150
    Repeater       1.00      0.34      0.51      1583

    accuracy                           0.40      1733
   macro avg       0.56      0.67      0.37      1733
weighted avg       0.92      0.40      0.48      1733

Confusion Matrix:
 [[ 149    1]
 [1043  540]]

=== Fold 4/5 ===
Validation Accuracy: 0.2210
Classification Report:
               precision    recall  f1-score   support

Non-Repeater       0.10      0.99      0.18       150
    Repeater       1.00      0.15      0.26      1583

    accuracy                           0.22      1733
   macro avg       0.55      0.57      0.22      1733
weighted avg       0.92      0.22      0.25      1733

Confusion Matrix:
 [[ 149    1]
 [1349  234]]

=== Fold 5/5 ===
Validation Accuracy: 0.3274
Classification Report:
               precision    recall  f1-score   support

Non-Repeater       0.11      1.00      0.20       149
    Repeater       1.00      0.26      0.42      1583

    accuracy                           0.33      1732
   macro avg       0.56      0.63      0.31      1732
weighted avg       0.92      0.33      0.40      1732

Confusion Matrix:
 [[ 149    0]
 [1165  418]]


=== Summary ===
Total False Positives: 3
Total False Negatives: 6057
Total True Positives: 1859
Total True Negatives: 745

Confusion Matrix (with duplicates):
              Non-Repeater  Repeater
Non-Repeater         745.0       3.0
Repeater            6057.0    1859.0
accuracy_score
0.30055401662049863
Trial 1: hidden_dim=1378, latent_dim=32, beta=1.2493868275618094, gamma=0.2399227313021369, dropout_rate=0.11230765004307798, lr=0.0002883349369944305, scheduler_patience=7, class_weight=2.578275308713881, activation=SELU, classification_multiplier=13830.266950537196

=== Fold 1/5 ===
Validation Accuracy: 0.7992
Classification Report:
               precision    recall  f1-score   support

Non-Repeater       0.30      0.97      0.45       149
    Repeater       1.00      0.78      0.88      1584

    accuracy                           0.80      1733
   macro avg       0.65      0.87      0.66      1733
weighted avg       0.94      0.80      0.84      1733

Confusion Matrix:
 [[ 144    5]
 [ 343 1241]]

=== Fold 2/5 ===
Validation Accuracy: 0.4986
Classification Report:
               precision    recall  f1-score   support

Non-Repeater       0.15      0.99      0.26       150
    Repeater       1.00      0.45      0.62      1583

    accuracy                           0.50      1733
   macro avg       0.57      0.72      0.44      1733
weighted avg       0.92      0.50      0.59      1733

Confusion Matrix:
 [[149   1]
 [868 715]]

=== Fold 3/5 ===
Validation Accuracy: 0.7576
Classification Report:
               precision    recall  f1-score   support

Non-Repeater       0.26      0.99      0.41       150
    Repeater       1.00      0.74      0.85      1583

    accuracy                           0.76      1733
   macro avg       0.63      0.86      0.63      1733
weighted avg       0.93      0.76      0.81      1733

Confusion Matrix:
 [[ 148    2]
 [ 418 1165]]

=== Fold 4/5 ===
Validation Accuracy: 0.5961
Classification Report:
               precision    recall  f1-score   support

Non-Repeater       0.18      0.99      0.30       150
    Repeater       1.00      0.56      0.72      1583

    accuracy                           0.60      1733
   macro avg       0.59      0.78      0.51      1733
weighted avg       0.93      0.60      0.68      1733

Confusion Matrix:
 [[149   1]
 [699 884]]

=== Fold 5/5 ===
Validation Accuracy: 0.7789
Classification Report:
               precision    recall  f1-score   support

Non-Repeater       0.28      0.97      0.43       149
    Repeater       1.00      0.76      0.86      1583

    accuracy                           0.78      1732
   macro avg       0.64      0.87      0.65      1732
weighted avg       0.93      0.78      0.83      1732

Confusion Matrix:
 [[ 145    4]
 [ 379 1204]]


=== Summary ===
Total False Positives: 13
Total False Negatives: 2707
Total True Positives: 5209
Total True Negatives: 735

Confusion Matrix (with duplicates):
              Non-Repeater  Repeater
Non-Repeater         735.0      13.0
Repeater            2707.0    5209.0
accuracy_score
0.6860572483841182
[I 2025-06-13 02:53:07,996] Trial 226 finished with value: 0.6860572483841182 and parameters: {'hidden_dim': 1512, 'latent_dim': 33, 'beta': 1.4342106812941993, 'gamma': 0.13702384876733678, 'dropout_rate': 0.12041756857171788, 'lr': 0.0009555095458303388, 'scheduler_patience': 7, 'class_weight': 2.8874482007452746, 'activation': 'ReLU', 'classification_multiplier': 13498.807506629533}. Best is trial 194 with value: 0.8103647276084949.
[I 2025-06-13 02:59:41,242] Trial 227 finished with value: 0.6940212373037857 and parameters: {'hidden_dim': 1443, 'latent_dim': 34, 'beta': 1.3707693052688519, 'gamma': 0.2011262906950957, 'dropout_rate': 0.10702978359497989, 'lr': 0.0006772170675882904, 'scheduler_patience': 7, 'class_weight': 2.9892613649414237, 'activation': 'ReLU', 'classification_multiplier': 14528.971071819928}. Best is trial 194 with value: 0.8103647276084949.
[I 2025-06-13 03:05:50,151] Trial 228 finished with value: 0.7782779316712835 and parameters: {'hidden_dim': 1211, 'latent_dim': 32, 'beta': 1.3944147595405287, 'gamma': 0.1759564373036174, 'dropout_rate': 0.12908408355950962, 'lr': 0.000321309675221466, 'scheduler_patience': 7, 'class_weight': 2.7793265574992696, 'activation': 'ReLU', 'classification_multiplier': 14054.309095800043}. Best is trial 194 with value: 0.8103647276084949.
Trial 1: hidden_dim=1512, latent_dim=33, beta=1.4342106812941993, gamma=0.13702384876733678, dropout_rate=0.12041756857171788, lr=0.0009555095458303388, scheduler_patience=7, class_weight=2.8874482007452746, activation=ReLU, classification_multiplier=13498.807506629533

=== Fold 1/5 ===
Validation Accuracy: 0.5626
Classification Report:
               precision    recall  f1-score   support

Non-Repeater       0.16      0.99      0.28       149
    Repeater       1.00      0.52      0.69      1584

    accuracy                           0.56      1733
   macro avg       0.58      0.75      0.48      1733
weighted avg       0.93      0.56      0.65      1733

Confusion Matrix:
 [[147   2]
 [756 828]]

=== Fold 2/5 ===
Validation Accuracy: 0.6728
Classification Report:
               precision    recall  f1-score   support

Non-Repeater       0.21      0.99      0.34       150
    Repeater       1.00      0.64      0.78      1583

    accuracy                           0.67      1733
   macro avg       0.60      0.82      0.56      1733
weighted avg       0.93      0.67      0.74      1733

Confusion Matrix:
 [[ 149    1]
 [ 566 1017]]

=== Fold 3/5 ===
Validation Accuracy: 0.6849
Classification Report:
               precision    recall  f1-score   support

Non-Repeater       0.21      0.99      0.35       150
    Repeater       1.00      0.66      0.79      1583

    accuracy                           0.68      1733
   macro avg       0.61      0.82      0.57      1733
weighted avg       0.93      0.68      0.75      1733

Confusion Matrix:
 [[ 149    1]
 [ 545 1038]]

=== Fold 4/5 ===
Validation Accuracy: 0.7611
Classification Report:
               precision    recall  f1-score   support

Non-Repeater       0.26      0.99      0.42       150
    Repeater       1.00      0.74      0.85      1583

    accuracy                           0.76      1733
   macro avg       0.63      0.86      0.63      1733
weighted avg       0.93      0.76      0.81      1733

Confusion Matrix:
 [[ 148    2]
 [ 412 1171]]

=== Fold 5/5 ===
Validation Accuracy: 0.7887
Classification Report:
               precision    recall  f1-score   support

Non-Repeater       0.29      0.97      0.44       149
    Repeater       1.00      0.77      0.87      1583

    accuracy                           0.79      1732
   macro avg       0.64      0.87      0.66      1732
weighted avg       0.93      0.79      0.83      1732

Confusion Matrix:
 [[ 144    5]
 [ 361 1222]]


=== Summary ===
Total False Positives: 11
Total False Negatives: 2640
Total True Positives: 5276
Total True Negatives: 737

Confusion Matrix (with duplicates):
              Non-Repeater  Repeater
Non-Repeater         737.0      11.0
Repeater            2640.0    5276.0
accuracy_score
0.6940212373037857
Trial 1: hidden_dim=1443, latent_dim=34, beta=1.3707693052688519, gamma=0.2011262906950957, dropout_rate=0.10702978359497989, lr=0.0006772170675882904, scheduler_patience=7, class_weight=2.9892613649414237, activation=ReLU, classification_multiplier=14528.971071819928

=== Fold 1/5 ===
Validation Accuracy: 0.7778
Classification Report:
               precision    recall  f1-score   support

Non-Repeater       0.28      0.97      0.43       149
    Repeater       1.00      0.76      0.86      1584

    accuracy                           0.78      1733
   macro avg       0.64      0.87      0.65      1733
weighted avg       0.93      0.78      0.82      1733

Confusion Matrix:
 [[ 145    4]
 [ 381 1203]]

=== Fold 2/5 ===
Validation Accuracy: 0.7865
Classification Report:
               precision    recall  f1-score   support

Non-Repeater       0.29      0.99      0.45       150
    Repeater       1.00      0.77      0.87      1583

    accuracy                           0.79      1733
   macro avg       0.64      0.88      0.66      1733
weighted avg       0.94      0.79      0.83      1733

Confusion Matrix:
 [[ 149    1]
 [ 369 1214]]

=== Fold 3/5 ===
Validation Accuracy: 0.6826
Classification Report:
               precision    recall  f1-score   support

Non-Repeater       0.21      0.99      0.35       150
    Repeater       1.00      0.65      0.79      1583

    accuracy                           0.68      1733
   macro avg       0.61      0.82      0.57      1733
weighted avg       0.93      0.68      0.75      1733

Confusion Matrix:
 [[ 149    1]
 [ 549 1034]]

=== Fold 4/5 ===
Validation Accuracy: 0.7738
Classification Report:
               precision    recall  f1-score   support

Non-Repeater       0.27      0.98      0.43       150
    Repeater       1.00      0.75      0.86      1583

    accuracy                           0.77      1733
   macro avg       0.64      0.87      0.64      1733
weighted avg       0.93      0.77      0.82      1733

Confusion Matrix:
 [[ 147    3]
 [ 389 1194]]

=== Fold 5/5 ===
Validation Accuracy: 0.8707
Classification Report:
               precision    recall  f1-score   support

Non-Repeater       0.40      0.97      0.56       149
    Repeater       1.00      0.86      0.92      1583

    accuracy                           0.87      1732
   macro avg       0.70      0.92      0.74      1732
weighted avg       0.95      0.87      0.89      1732

Confusion Matrix:
 [[ 145    4]
 [ 220 1363]]


=== Summary ===
Total False Positives: 13
Total False Negatives: 1908
Total True Positives: 6008
Total True Negatives: 735

Confusion Matrix (with duplicates):
              Non-Repeater  Repeater
Non-Repeater         735.0      13.0
Repeater            1908.0    6008.0
accuracy_score
0.7782779316712835
Trial 1: hidden_dim=1211, latent_dim=32, beta=1.3944147595405287, gamma=0.1759564373036174, dropout_rate=0.12908408355950962, lr=0.000321309675221466, scheduler_patience=7, class_weight=2.7793265574992696, activation=ReLU, classification_multiplier=14054.309095800043

=== Fold 1/5 ===
Validation Accuracy: 0.7080
Classification Report:
               precision    recall  f1-score   support

Non-Repeater       0.23      0.99      0.37       149
    Repeater       1.00      0.68      0.81      1584

    accuracy                           0.71      1733
   macro avg       0.61      0.84      0.59      1733
weighted avg       0.93      0.71      0.77      1733

Confusion Matrix:
 [[ 148    1]
 [ 505 1079]]

=== Fold 2/5 ===
Validation Accuracy: 0.7392
Classification Report:
               precision    recall  f1-score   support

Non-Repeater       0.25      0.99      0.40       150
    Repeater       1.00      0.72      0.83      1583

    accuracy                           0.74      1733
   macro avg       0.62      0.85      0.62      1733
weighted avg       0.93      0.74      0.80      1733

Confusion Matrix:
 [[ 149    1]
 [ 451 1132]]

=== Fold 3/5 ===
Validation Accuracy: 0.7392
Classification Report:
               precision    recall  f1-score   support

Non-Repeater       0.25      0.99      0.40       150
    Repeater       1.00      0.72      0.83      1583

    accuracy                           0.74      1733
   macro avg       0.62      0.85      0.62      1733
weighted avg       0.93      0.74      0.80      1733

Confusion Matrix:
 [[ 149    1]
 [ 451 1132]]

=== Fold 4/5 ===
Validation Accuracy: 0.7046
Classification Report:
               precision    recall  f1-score   support

Non-Repeater       0.23      0.99      0.37       150
    Repeater       1.00      0.68      0.81      1583

    accuracy                           0.70      1733
   macro avg       0.61      0.84      0.59      1733
weighted avg       0.93      0.70      0.77      1733

Confusion Matrix:
 [[ 149    1]
 [ 511 1072]]

=== Fold 5/5 ===
Validation Accuracy: 0.7777
Classification Report:
               precision    recall  f1-score   support

Non-Repeater       0.28      0.97      0.43       149
    Repeater       1.00      0.76      0.86      1583

    accuracy                           0.78      1732
   macro avg       0.64      0.87      0.65      1732
weighted avg       0.93      0.78      0.82      1732

Confusion Matrix:
 [[ 145    4]
 [ 381 1202]]


=== Summary ===
Total False Positives: 8
Total False Negatives: 2299
Total True Positives: 5617
Total True Negatives: 740
[I 2025-06-13 03:11:58,753] Trial 229 finished with value: 0.7337257617728532 and parameters: {'hidden_dim': 1224, 'latent_dim': 31, 'beta': 1.3358373152383978, 'gamma': 0.2656457784172247, 'dropout_rate': 0.1268829424432717, 'lr': 0.00023622872636900043, 'scheduler_patience': 7, 'class_weight': 2.690272588749101, 'activation': 'ReLU', 'classification_multiplier': 14129.337098268321}. Best is trial 194 with value: 0.8103647276084949.
/home/ubuntu/frb-analysis/.frb-analysis/lib/python3.12/site-packages/sklearn/metrics/_classification.py:1565: UndefinedMetricWarning: Precision is ill-defined and being set to 0.0 in labels with no predicted samples. Use `zero_division` parameter to control this behavior.
  _warn_prf(average, modifier, f"{metric.capitalize()} is", len(result))
/home/ubuntu/frb-analysis/.frb-analysis/lib/python3.12/site-packages/sklearn/metrics/_classification.py:1565: UndefinedMetricWarning: Precision is ill-defined and being set to 0.0 in labels with no predicted samples. Use `zero_division` parameter to control this behavior.
  _warn_prf(average, modifier, f"{metric.capitalize()} is", len(result))
/home/ubuntu/frb-analysis/.frb-analysis/lib/python3.12/site-packages/sklearn/metrics/_classification.py:1565: UndefinedMetricWarning: Precision is ill-defined and being set to 0.0 in labels with no predicted samples. Use `zero_division` parameter to control this behavior.
  _warn_prf(average, modifier, f"{metric.capitalize()} is", len(result))
[I 2025-06-13 03:18:07,350] Trial 230 finished with value: 0.27435364727608497 and parameters: {'hidden_dim': 1197, 'latent_dim': 32, 'beta': 1.2530945747704936, 'gamma': 0.18633169027061666, 'dropout_rate': 0.11417383022803966, 'lr': 0.006708298369030294, 'scheduler_patience': 7, 'class_weight': 2.618776532053549, 'activation': 'ReLU', 'classification_multiplier': 13953.020055185008}. Best is trial 194 with value: 0.8103647276084949.
