[I 2025-06-12 19:56:26,763] Trial 162 finished with value: 0.7691597414589104 and parameters: {'hidden_dim': 1344, 'latent_dim': 32, 'beta': 1.3982975485335716, 'gamma': 0.17802271892871732, 'dropout_rate': 0.11807376174168228, 'lr': 0.0002899841683716012, 'scheduler_patience': 7, 'class_weight': 2.9927410212731793, 'activation': 'ReLU', 'classification_multiplier': 12917.253709006804}. Best is trial 142 with value: 0.7733148661126501.
Trial 1: hidden_dim=1270, latent_dim=31, beta=1.276240897475484, gamma=0.20903859653694626, dropout_rate=0.12330331759314654, lr=0.0003265301319897846, scheduler_patience=7, class_weight=2.5869196916745567, activation=ReLU, classification_multiplier=13585.734892314254

=== Fold 1/5 ===
Validation Accuracy: 0.7588
Classification Report:
               precision    recall  f1-score   support

Non-Repeater       0.26      1.00      0.42       149
    Repeater       1.00      0.74      0.85      1584

    accuracy                           0.76      1733
   macro avg       0.63      0.87      0.63      1733
weighted avg       0.94      0.76      0.81      1733

Confusion Matrix:
 [[ 149    0]
 [ 418 1166]]

=== Fold 2/5 ===
Validation Accuracy: 0.7657
Classification Report:
               precision    recall  f1-score   support

Non-Repeater       0.27      0.99      0.42       150
    Repeater       1.00      0.74      0.85      1583

    accuracy                           0.77      1733
   macro avg       0.63      0.87      0.64      1733
weighted avg       0.94      0.77      0.82      1733

Confusion Matrix:
 [[ 149    1]
 [ 405 1178]]

=== Fold 3/5 ===
Validation Accuracy: 0.7363
Classification Report:
               precision    recall  f1-score   support

Non-Repeater       0.25      0.99      0.39       150
    Repeater       1.00      0.71      0.83      1583

    accuracy                           0.74      1733
   macro avg       0.62      0.85      0.61      1733
weighted avg       0.93      0.74      0.79      1733

Confusion Matrix:
 [[ 149    1]
 [ 456 1127]]

=== Fold 4/5 ===
Validation Accuracy: 0.7426
Classification Report:
               precision    recall  f1-score   support

Non-Repeater       0.25      0.99      0.40       150
    Repeater       1.00      0.72      0.84      1583

    accuracy                           0.74      1733
   macro avg       0.62      0.85      0.62      1733
weighted avg       0.93      0.74      0.80      1733

Confusion Matrix:
 [[ 148    2]
 [ 444 1139]]

=== Fold 5/5 ===
Validation Accuracy: 0.7610
Classification Report:
               precision    recall  f1-score   support

Non-Repeater       0.26      0.98      0.41       149
    Repeater       1.00      0.74      0.85      1583

    accuracy                           0.76      1732
   macro avg       0.63      0.86      0.63      1732
weighted avg       0.93      0.76      0.81      1732

Confusion Matrix:
 [[ 146    3]
 [ 411 1172]]


=== Summary ===
Total False Positives: 7
Total False Negatives: 2134
Total True Positives: 5782
Total True Negatives: 741

Confusion Matrix (with duplicates):
              Non-Repeater  Repeater
Non-Repeater         741.0       7.0
Repeater            2134.0    5782.0
accuracy_score
0.7528855032317636
Trial 1: hidden_dim=1272, latent_dim=31, beta=1.271812680644501, gamma=0.21034177588369385, dropout_rate=0.1226553528193593, lr=0.00011320051210818893, scheduler_patience=7, class_weight=2.8858274407590363, activation=ReLU, classification_multiplier=13581.376756853797

=== Fold 1/5 ===
Validation Accuracy: 0.7288
Classification Report:
               precision    recall  f1-score   support

Non-Repeater       0.24      0.99      0.39       149
    Repeater       1.00      0.70      0.83      1584

    accuracy                           0.73      1733
   macro avg       0.62      0.85      0.61      1733
weighted avg       0.93      0.73      0.79      1733

Confusion Matrix:
 [[ 148    1]
 [ 469 1115]]

=== Fold 2/5 ===
Validation Accuracy: 0.7559
Classification Report:
               precision    recall  f1-score   support

Non-Repeater       0.26      0.99      0.41       150
    Repeater       1.00      0.73      0.85      1583

    accuracy                           0.76      1733
   macro avg       0.63      0.86      0.63      1733
weighted avg       0.94      0.76      0.81      1733

Confusion Matrix:
 [[ 149    1]
 [ 422 1161]]

=== Fold 3/5 ===
Validation Accuracy: 0.7409
Classification Report:
               precision    recall  f1-score   support

Non-Repeater       0.25      0.99      0.40       150
    Repeater       1.00      0.72      0.83      1583

    accuracy                           0.74      1733
   macro avg       0.62      0.85      0.62      1733
weighted avg       0.93      0.74      0.80      1733

Confusion Matrix:
 [[ 148    2]
 [ 447 1136]]

=== Fold 4/5 ===
Validation Accuracy: 0.7548
Classification Report:
               precision    recall  f1-score   support

Non-Repeater       0.26      0.97      0.41       150
    Repeater       1.00      0.73      0.85      1583

    accuracy                           0.75      1733
   macro avg       0.63      0.85      0.63      1733
weighted avg       0.93      0.75      0.81      1733

Confusion Matrix:
 [[ 146    4]
 [ 421 1162]]

=== Fold 5/5 ===
Validation Accuracy: 0.8655
Classification Report:
               precision    recall  f1-score   support

Non-Repeater       0.39      0.97      0.55       149
    Repeater       1.00      0.86      0.92      1583

    accuracy                           0.87      1732
   macro avg       0.69      0.91      0.74      1732
weighted avg       0.94      0.87      0.89      1732

Confusion Matrix:
 [[ 144    5]
 [ 228 1355]]


=== Summary ===
Total False Positives: 13
Total False Negatives: 1987
Total True Positives: 5929
Total True Negatives: 735

Confusion Matrix (with duplicates):
              Non-Repeater  Repeater
Non-Repeater         735.0      13.0
Repeater            1987.0    5929.0
accuracy_score
0.7691597414589104
Trial 1: hidden_dim=1344, latent_dim=32, beta=1.3982975485335716, gamma=0.17802271892871732, dropout_rate=0.11807376174168228, lr=0.0002899841683716012, scheduler_patience=7, class_weight=2.9927410212731793, activation=ReLU, classification_multiplier=12917.253709006804

=== Fold 1/5 ===
Validation Accuracy: 0.7628
Classification Report:
               precision    recall  f1-score   support

Non-Repeater       0.26      0.98      0.42       149
    Repeater       1.00      0.74      0.85      1584

    accuracy                           0.76      1733
   macro avg       0.63      0.86      0.63      1733
weighted avg       0.93      0.76      0.81      1733

Confusion Matrix:
 [[ 146    3]
 [ 408 1176]]

=== Fold 2/5 ===
Validation Accuracy: 0.7663
Classification Report:
               precision    recall  f1-score   support

Non-Repeater       0.27      0.99      0.42       150
    Repeater       1.00      0.74      0.85      1583

    accuracy                           0.77      1733
   macro avg       0.63      0.87      0.64      1733
weighted avg       0.94      0.77      0.82      1733

Confusion Matrix:
 [[ 149    1]
 [ 404 1179]]

=== Fold 3/5 ===
Validation Accuracy: 0.7525
Classification Report:
               precision    recall  f1-score   support

Non-Repeater       0.26      0.99      0.41       150
    Repeater       1.00      0.73      0.84      1583

    accuracy                           0.75      1733
   macro avg       0.63      0.86      0.63      1733
weighted avg       0.94      0.75      0.81      1733

Confusion Matrix:
 [[ 149    1]
 [ 428 1155]]

=== Fold 4/5 ===
Validation Accuracy: 0.7473
Classification Report:
               precision    recall  f1-score   support

Non-Repeater       0.25      0.99      0.40       150
    Repeater       1.00      0.72      0.84      1583

    accuracy                           0.75      1733
   macro avg       0.63      0.86      0.62      1733
weighted avg       0.93      0.75      0.80      1733

Confusion Matrix:
 [[ 149    1]
 [ 437 1146]]

=== Fold 5/5 ===
Validation Accuracy: 0.7396
Classification Report:
               precision    recall  f1-score   support

Non-Repeater       0.25      0.98      0.39       149
    Repeater       1.00      0.72      0.83      1583

    accuracy                           0.74      1732
   macro avg       0.62      0.85      0.61      1732
weighted avg       0.93      0.74      0.80      1732

Confusion Matrix:
 [[ 146    3]
 [ 448 1135]]


=== Summary ===
Total False Positives: 9
Total False Negatives: 2125
Total True Positives: 5791
Total True Negatives: 739
[I 2025-06-12 20:02:55,811] Trial 163 finished with value: 0.7536934441366574 and parameters: {'hidden_dim': 1325, 'latent_dim': 32, 'beta': 1.4018555775762052, 'gamma': 0.1703302067730072, 'dropout_rate': 0.13289826806767285, 'lr': 0.00010245306290917488, 'scheduler_patience': 7, 'class_weight': 2.995660462542907, 'activation': 'ReLU', 'classification_multiplier': 12979.702262658997}. Best is trial 142 with value: 0.7733148661126501.
[I 2025-06-12 20:09:18,630] Trial 164 finished with value: 0.7636195752539243 and parameters: {'hidden_dim': 1350, 'latent_dim': 31, 'beta': 1.4011001806357766, 'gamma': 0.17097564821521627, 'dropout_rate': 0.11289392101474564, 'lr': 0.0004996152958285918, 'scheduler_patience': 7, 'class_weight': 2.998336529924175, 'activation': 'ReLU', 'classification_multiplier': 12875.295554172993}. Best is trial 142 with value: 0.7733148661126501.
[I 2025-06-12 20:15:51,657] Trial 165 finished with value: 0.6842105263157895 and parameters: {'hidden_dim': 1456, 'latent_dim': 31, 'beta': 1.40683537493845, 'gamma': 0.17987209435894302, 'dropout_rate': 0.11372469786595615, 'lr': 0.0004917699213279653, 'scheduler_patience': 7, 'class_weight': 2.991998413304722, 'activation': 'ReLU', 'classification_multiplier': 14288.894128665239}. Best is trial 142 with value: 0.7733148661126501.

Confusion Matrix (with duplicates):
              Non-Repeater  Repeater
Non-Repeater         739.0       9.0
Repeater            2125.0    5791.0
accuracy_score
0.7536934441366574
Trial 1: hidden_dim=1325, latent_dim=32, beta=1.4018555775762052, gamma=0.1703302067730072, dropout_rate=0.13289826806767285, lr=0.00010245306290917488, scheduler_patience=7, class_weight=2.995660462542907, activation=ReLU, classification_multiplier=12979.702262658997

=== Fold 1/5 ===
Validation Accuracy: 0.7934
Classification Report:
               precision    recall  f1-score   support

Non-Repeater       0.29      0.97      0.45       149
    Repeater       1.00      0.78      0.87      1584

    accuracy                           0.79      1733
   macro avg       0.64      0.87      0.66      1733
weighted avg       0.94      0.79      0.84      1733

Confusion Matrix:
 [[ 145    4]
 [ 354 1230]]

=== Fold 2/5 ===
Validation Accuracy: 0.7721
Classification Report:
               precision    recall  f1-score   support

Non-Repeater       0.27      0.99      0.43       150
    Repeater       1.00      0.75      0.86      1583

    accuracy                           0.77      1733
   macro avg       0.64      0.87      0.64      1733
weighted avg       0.94      0.77      0.82      1733

Confusion Matrix:
 [[ 149    1]
 [ 394 1189]]

=== Fold 3/5 ===
Validation Accuracy: 0.7507
Classification Report:
               precision    recall  f1-score   support

Non-Repeater       0.26      0.99      0.41       150
    Repeater       1.00      0.73      0.84      1583

    accuracy                           0.75      1733
   macro avg       0.63      0.86      0.62      1733
weighted avg       0.93      0.75      0.80      1733

Confusion Matrix:
 [[ 148    2]
 [ 430 1153]]

=== Fold 4/5 ===
Validation Accuracy: 0.7092
Classification Report:
               precision    recall  f1-score   support

Non-Repeater       0.23      0.99      0.37       150
    Repeater       1.00      0.68      0.81      1583

    accuracy                           0.71      1733
   macro avg       0.61      0.83      0.59      1733
weighted avg       0.93      0.71      0.77      1733

Confusion Matrix:
 [[ 148    2]
 [ 502 1081]]

=== Fold 5/5 ===
Validation Accuracy: 0.7927
Classification Report:
               precision    recall  f1-score   support

Non-Repeater       0.29      0.97      0.45       149
    Repeater       1.00      0.78      0.87      1583

    accuracy                           0.79      1732
   macro avg       0.64      0.87      0.66      1732
weighted avg       0.94      0.79      0.84      1732

Confusion Matrix:
 [[ 144    5]
 [ 354 1229]]


=== Summary ===
Total False Positives: 14
Total False Negatives: 2034
Total True Positives: 5882
Total True Negatives: 734

Confusion Matrix (with duplicates):
              Non-Repeater  Repeater
Non-Repeater         734.0      14.0
Repeater            2034.0    5882.0
accuracy_score
0.7636195752539243
Trial 1: hidden_dim=1350, latent_dim=31, beta=1.4011001806357766, gamma=0.17097564821521627, dropout_rate=0.11289392101474564, lr=0.0004996152958285918, scheduler_patience=7, class_weight=2.998336529924175, activation=ReLU, classification_multiplier=12875.295554172993

=== Fold 1/5 ===
Validation Accuracy: 0.7796
Classification Report:
               precision    recall  f1-score   support

Non-Repeater       0.28      0.99      0.44       149
    Repeater       1.00      0.76      0.86      1584

    accuracy                           0.78      1733
   macro avg       0.64      0.88      0.65      1733
weighted avg       0.94      0.78      0.83      1733

Confusion Matrix:
 [[ 148    1]
 [ 381 1203]]

=== Fold 2/5 ===
Validation Accuracy: 0.5251
Classification Report:
               precision    recall  f1-score   support

Non-Repeater       0.15      1.00      0.27       150
    Repeater       1.00      0.48      0.65      1583

    accuracy                           0.53      1733
   macro avg       0.58      0.74      0.46      1733
weighted avg       0.93      0.53      0.62      1733

Confusion Matrix:
 [[150   0]
 [823 760]]

=== Fold 3/5 ===
Validation Accuracy: 0.6584
Classification Report:
               precision    recall  f1-score   support

Non-Repeater       0.20      0.98      0.33       150
    Repeater       1.00      0.63      0.77      1583

    accuracy                           0.66      1733
   macro avg       0.60      0.80      0.55      1733
weighted avg       0.93      0.66      0.73      1733

Confusion Matrix:
 [[147   3]
 [589 994]]

=== Fold 4/5 ===
Validation Accuracy: 0.6780
Classification Report:
               precision    recall  f1-score   support

Non-Repeater       0.21      0.99      0.35       150
    Repeater       1.00      0.65      0.79      1583

    accuracy                           0.68      1733
   macro avg       0.60      0.82      0.57      1733
weighted avg       0.93      0.68      0.75      1733

Confusion Matrix:
 [[ 148    2]
 [ 556 1027]]

=== Fold 5/5 ===
Validation Accuracy: 0.7800
Classification Report:
               precision    recall  f1-score   support

Non-Repeater       0.28      0.97      0.43       149
    Repeater       1.00      0.76      0.86      1583

    accuracy                           0.78      1732
   macro avg       0.64      0.87      0.65      1732
weighted avg       0.93      0.78      0.83      1732

Confusion Matrix:
 [[ 145    4]
 [ 377 1206]]


=== Summary ===
Total False Positives: 10
Total False Negatives: 2726
Total True Positives: 5190
Total True Negatives: 738

Confusion Matrix (with duplicates):
              Non-Repeater  Repeater
Non-Repeater         738.0      10.0
Repeater            2726.0    5190.0
accuracy_score
0.6842105263157895
Trial 1: hidden_dim=1456, latent_dim=31, beta=1.40683537493845, gamma=0.17987209435894302, dropout_rate=0.11372469786595615, lr=0.0004917699213279653, scheduler_patience=7, class_weight=2.991998413304722, activation=ReLU, classification_multiplier=14288.894128665239

=== Fold 1/5 ===
Validation Accuracy: 0.7715
Classification Report:
               precision    recall  f1-score   support

Non-Repeater       0.27      1.00      0.43       149
    Repeater       1.00      0.75      0.86      1584

    accuracy                           0.77      1733
   macro avg       0.64      0.88      0.64      1733
weighted avg       0.94      0.77      0.82      1733

Confusion Matrix:
 [[ 149    0]
 [ 396 1188]]

=== Fold 2/5 ===
Validation Accuracy: 0.7721
Classification Report:
               precision    recall  f1-score   support

Non-Repeater       0.27      0.99      0.43       150
    Repeater       1.00      0.75      0.86      1583

    accuracy                           0.77      1733
   macro avg       0.64      0.87      0.64      1733
weighted avg       0.94      0.77      0.82      1733

Confusion Matrix:
 [[ 149    1]
 [ 394 1189]]

=== Fold 3/5 ===
Validation Accuracy: 0.6694
Classification Report:
               precision    recall  f1-score   support

Non-Repeater       0.21      0.99      0.34       150
    Repeater       1.00      0.64      0.78      1583

    accuracy                           0.67      1733
   macro avg       0.60      0.82      0.56      1733
weighted avg       0.93      0.67      0.74      1733

Confusion Matrix:
 [[ 149    1]
 [ 572 1011]]

=== Fold 4/5 ===
Validation Accuracy: 0.7501
Classification Report:
               precision    recall  f1-score   support

Non-Repeater       0.26      0.99      0.41       150
    Repeater       1.00      0.73      0.84      1583

    accuracy                           0.75      1733
   macro avg       0.63      0.86      0.62      1733
weighted avg       0.93      0.75      0.80      1733

Confusion Matrix:
 [[ 148    2]
 [ 431 1152]]

=== Fold 5/5 ===
Validation Accuracy: 0.7708
Classification Report:
               precision    recall  f1-score   support

Non-Repeater       0.27      0.96      0.42       149
    Repeater       0.99      0.75      0.86      1583

    accuracy                           0.77      1732
   macro avg       0.63      0.86      0.64      1732
weighted avg       0.93      0.77      0.82      1732

[I 2025-06-12 20:22:13,630] Trial 166 finished with value: 0.7467682363804248 and parameters: {'hidden_dim': 1345, 'latent_dim': 31, 'beta': 1.369407235641231, 'gamma': 0.17385445225681465, 'dropout_rate': 0.10731441203643052, 'lr': 0.00016318417027166913, 'scheduler_patience': 7, 'class_weight': 2.897120100319916, 'activation': 'ReLU', 'classification_multiplier': 12905.308141170122}. Best is trial 142 with value: 0.7733148661126501.
[I 2025-06-12 20:28:39,612] Trial 167 finished with value: 0.7294552169898431 and parameters: {'hidden_dim': 1371, 'latent_dim': 30, 'beta': 1.4375594398136073, 'gamma': 0.1849900901426995, 'dropout_rate': 0.1019820757459343, 'lr': 0.0006516581891983116, 'scheduler_patience': 7, 'class_weight': 2.8983041767190882, 'activation': 'ReLU', 'classification_multiplier': 12896.730298642873}. Best is trial 142 with value: 0.7733148661126501.
