[I 2026-09-14 03:00:14,581] Trial 195 finished with value: 0.7242465137201979 and parameters: {'hidden_dim': 414, 'latent_dim': 19, 'beta': 0.29037352856850557, 'gamma': 1.8278475997706851, 'dropout_rate': 0.22045343988951602, 'lr': 0.009298265603539068, 'scheduler_patience': 7, 'class_weight': 0.8171722953490801, 'activation': 'LeakyReLU', 'classification_multiplier': 6812.630466995346}. Best is trial 162 with value: 0.7725144161925771.
[I 2026-09-14 03:00:31,962] Trial 196 finished with value: 0.7083164300202839 and parameters: {'hidden_dim': 899, 'latent_dim': 18, 'beta': 0.48804756570848207, 'gamma': 0.9944922243290679, 'dropout_rate': 0.25005610689505714, 'lr': 0.009660582482391997, 'scheduler_patience': 7, 'class_weight': 0.931720027372646, 'activation': 'SELU', 'classification_multiplier': 7973.173347460722}. Best is trial 162 with value: 0.7725144161925771.
[I 2026-09-14 03:00:49,073] Trial 197 finished with value: 0.7545041053812983 and parameters: {'hidden_dim': 306, 'latent_dim': 19, 'beta': 0.13294740864084442, 'gamma': 1.9273601695349973, 'dropout_rate': 0.22834467862665572, 'lr': 0.009984886690416138, 'scheduler_patience': 7, 'class_weight': 0.8897990363992289, 'activation': 'SELU', 'classification_multiplier': 6435.847676224594}. Best is trial 162 with value: 0.7725144161925771.
[I 2026-09-14 03:01:06,179] Trial 198 finished with value: 0.7469993582534328 and parameters: {'hidden_dim': 374, 'latent_dim': 16, 'beta': 0.35991676088080615, 'gamma': 1.854619348379861, 'dropout_rate': 0.17420485356275323, 'lr': 0.009067232610391336, 'scheduler_patience': 7, 'class_weight': 0.842563322780198, 'activation': 'SELU', 'classification_multiplier': 7757.93591802339}. Best is trial 162 with value: 0.7725144161925771.
[I 2026-09-14 03:01:23,241] Trial 199 finished with value: 0.7327071888475398 and parameters: {'hidden_dim': 238, 'latent_dim': 15, 'beta': 0.2268087762953176, 'gamma': 0.7026856002214097, 'dropout_rate': 0.23628619465754283, 'lr': 0.009547813168996961, 'scheduler_patience': 3, 'class_weight': 0.784808730708312, 'activation': 'ELU', 'classification_multiplier': 8167.509982072743}. Best is trial 162 with value: 0.7725144161925771.
[I 2026-09-14 03:01:40,347] Trial 200 finished with value: 0.7516199733180864 and parameters: {'hidden_dim': 328, 'latent_dim': 17, 'beta': 0.45699668894546086, 'gamma': 1.908452320856071, 'dropout_rate': 0.21066527175702554, 'lr': 0.005976781781609363, 'scheduler_patience': 7, 'class_weight': 0.7404032616758114, 'activation': 'SELU', 'classification_multiplier': 7243.47802759796}. Best is trial 162 with value: 0.7725144161925771.
[I 2026-09-14 03:01:57,397] Trial 201 finished with value: 0.752312395990557 and parameters: {'hidden_dim': 275, 'latent_dim': 14, 'beta': 1.574499336297539, 'gamma': 1.9666309647762827, 'dropout_rate': 0.2177031799222646, 'lr': 0.008545709747347245, 'scheduler_patience': 7, 'class_weight': 0.8359646865282657, 'activation': 'SELU', 'classification_multiplier': 8422.90083563756}. Best is trial 162 with value: 0.7725144161925771.
[I 2026-09-14 03:02:16,355] Trial 202 finished with value: 0.7126532455274203 and parameters: {'hidden_dim': 1883, 'latent_dim': 18, 'beta': 1.50558319665306, 'gamma': 1.7993694064340344, 'dropout_rate': 0.2212949283344666, 'lr': 0.008299947496150227, 'scheduler_patience': 7, 'class_weight': 0.8266948176159666, 'activation': 'SELU', 'classification_multiplier': 8311.075076410309}. Best is trial 162 with value: 0.7725144161925771.
[I 2026-09-14 03:02:33,386] Trial 203 finished with value: 0.7478230581678856 and parameters: {'hidden_dim': 282, 'latent_dim': 15, 'beta': 1.6158461873345205, 'gamma': 1.8823072599288133, 'dropout_rate': 0.19894675817389565, 'lr': 0.009803091298901993, 'scheduler_patience': 7, 'class_weight': 0.8683980427009214, 'activation': 'SELU', 'classification_multiplier': 6707.624341801799}. Best is trial 162 with value: 0.7725144161925771.
[I 2026-09-14 03:02:50,390] Trial 204 finished with value: 0.7606337781776378 and parameters: {'hidden_dim': 201, 'latent_dim': 35, 'beta': 1.5462608701143026, 'gamma': 1.919205790090313, 'dropout_rate': 0.24687969487713418, 'lr': 0.008809265369942476, 'scheduler_patience': 7, 'class_weight': 0.8000231548688725, 'activation': 'SELU', 'classification_multiplier': 10481.434227291002}. Best is trial 162 with value: 0.7725144161925771.
[I 2026-09-14 03:03:07,377] Trial 205 finished with value: 0.7567487742926339 and parameters: {'hidden_dim': 184, 'latent_dim': 35, 'beta': 1.5512725183487215, 'gamma': 1.943270163968081, 'dropout_rate': 0.24821230035500466, 'lr': 0.008734488914654651, 'scheduler_patience': 7, 'class_weight': 0.7982456656268269, 'activation': 'SELU', 'classification_multiplier': 10435.312992571655}. Best is trial 162 with value: 0.7725144161925771.
[I 2026-09-14 03:03:24,324] Trial 206 finished with value: 0.752312395990557 and parameters: {'hidden_dim': 183, 'latent_dim': 20, 'beta': 1.541296308072519, 'gamma': 1.6452805356421458, 'dropout_rate': 0.2538062656491019, 'lr': 0.00881460126615664, 'scheduler_patience': 7, 'class_weight': 0.8034283700220209, 'activation': 'SELU', 'classification_multiplier': 10625.73872974792}. Best is trial 162 with value: 0.7725144161925771.
[I 2026-09-14 03:03:41,284] Trial 207 finished with value: 0.7461479321146504 and parameters: {'hidden_dim': 162, 'latent_dim': 33, 'beta': 1.6528263683800852, 'gamma': 0.601475900148454, 'dropout_rate': 0.24399457201098246, 'lr': 0.00878727983423925, 'scheduler_patience': 7, 'class_weight': 0.7617749570316175, 'activation': 'SELU', 'classification_multiplier': 10404.12521276374}. Best is trial 162 with value: 0.7725144161925771.
[I 2026-09-14 03:03:58,323] Trial 208 finished with value: 0.7307745194750845 and parameters: {'hidden_dim': 226, 'latent_dim': 35, 'beta': 1.5891749954451906, 'gamma': 1.8413544314219914, 'dropout_rate': 0.26369406032827414, 'lr': 0.008686221734475095, 'scheduler_patience': 7, 'class_weight': 0.963900036245501, 'activation': 'SELU', 'classification_multiplier': 10175.55640275725}. Best is trial 162 with value: 0.7725144161925771.
[I 2026-09-14 03:04:15,336] Trial 209 finished with value: 0.738340115920582 and parameters: {'hidden_dim': 200, 'latent_dim': 37, 'beta': 1.554776826411948, 'gamma': 1.9377298318106098, 'dropout_rate': 0.1877780989914839, 'lr': 0.009115200395356474, 'scheduler_patience': 7, 'class_weight': 0.8988281037235425, 'activation': 'SELU', 'classification_multiplier': 10769.665845437872}. Best is trial 162 with value: 0.7725144161925771.
[I 2026-09-14 03:04:32,426] Trial 210 finished with value: 0.7532246176524784 and parameters: {'hidden_dim': 358, 'latent_dim': 38, 'beta': 1.6156325365086488, 'gamma': 1.7763727371486868, 'dropout_rate': 0.250706601667476, 'lr': 0.0012117413978526654, 'scheduler_patience': 7, 'class_weight': 0.7982007748366019, 'activation': 'SELU', 'classification_multiplier': 11222.687704751517}. Best is trial 162 with value: 0.7725144161925771.
[I 2026-09-14 03:04:49,381] Trial 211 finished with value: 0.748275300410355 and parameters: {'hidden_dim': 154, 'latent_dim': 33, 'beta': 0.3991300971306061, 'gamma': 1.8919257238640046, 'dropout_rate': 0.235244703218861, 'lr': 0.009345972037042145, 'scheduler_patience': 7, 'class_weight': 0.7670930858754701, 'activation': 'SELU', 'classification_multiplier': 10508.138317846428}. Best is trial 162 with value: 0.7725144161925771.
[I 2026-09-14 03:05:06,427] Trial 212 finished with value: 0.7629703188789584 and parameters: {'hidden_dim': 243, 'latent_dim': 35, 'beta': 1.5216557231052594, 'gamma': 1.9790511712900485, 'dropout_rate': 0.2450344996755434, 'lr': 0.009627865227426743, 'scheduler_patience': 7, 'class_weight': 0.789507954854677, 'activation': 'SELU', 'classification_multiplier': 10390.523963279906}. Best is trial 162 with value: 0.7725144161925771.
[I 2026-09-14 03:05:23,424] Trial 213 finished with value: 0.7482775303204711 and parameters: {'hidden_dim': 205, 'latent_dim': 35, 'beta': 1.5255775284312996, 'gamma': 1.9980758639253673, 'dropout_rate': 0.244415484377436, 'lr': 0.008934419622786207, 'scheduler_patience': 7, 'class_weight': 0.8152506324538363, 'activation': 'SELU', 'classification_multiplier': 10900.577227259675}. Best is trial 162 with value: 0.7725144161925771.
[I 2026-09-14 03:05:40,441] Trial 214 finished with value: 0.7564175384604792 and parameters: {'hidden_dim': 302, 'latent_dim': 5, 'beta': 1.4920528459991778, 'gamma': 1.9420398228311446, 'dropout_rate': 0.25699090574425243, 'lr': 0.0094123920265389, 'scheduler_patience': 7, 'class_weight': 0.7852115692301461, 'activation': 'SELU', 'classification_multiplier': 10274.098500315578}. Best is trial 162 with value: 0.7725144161925771.
[I 2026-09-14 03:05:57,607] Trial 215 finished with value: 0.7371329983047957 and parameters: {'hidden_dim': 393, 'latent_dim': 34, 'beta': 1.4689840441793145, 'gamma': 1.9475542428207513, 'dropout_rate': 0.22850211440460577, 'lr': 0.00956003880489072, 'scheduler_patience': 7, 'class_weight': 0.8517400620410019, 'activation': 'SELU', 'classification_multiplier': 10035.226341397562}. Best is trial 162 with value: 0.7725144161925771.
[I 2026-09-14 03:06:14,547] Trial 216 finished with value: 0.747058226820856 and parameters: {'hidden_dim': 259, 'latent_dim': 37, 'beta': 1.5646055211631882, 'gamma': 1.9043188241972555, 'dropout_rate': 0.2734663135589788, 'lr': 0.009270360475483802, 'scheduler_patience': 7, 'class_weight': 0.6111685345058349, 'activation': 'SELU', 'classification_multiplier': 7003.289814923712}. Best is trial 162 with value: 0.7725144161925771.
[I 2026-09-14 03:06:31,636] Trial 217 finished with value: 0.7480264033936349 and parameters: {'hidden_dim': 326, 'latent_dim': 35, 'beta': 1.6500531541575048, 'gamma': 1.861555928404204, 'dropout_rate': 0.23550023083943478, 'lr': 0.008617890304544261, 'scheduler_patience': 7, 'class_weight': 0.8815975193347939, 'activation': 'SELU', 'classification_multiplier': 10552.413751231506}. Best is trial 162 with value: 0.7725144161925771.
[I 2026-09-14 03:06:48,619] Trial 218 finished with value: 0.7309389292440139 and parameters: {'hidden_dim': 129, 'latent_dim': 36, 'beta': 1.5287726554221923, 'gamma': 1.8167350632912198, 'dropout_rate': 0.24981908824006563, 'lr': 0.00972339559190227, 'scheduler_patience': 7, 'class_weight': 0.7991981226695284, 'activation': 'ReLU', 'classification_multiplier': 7570.95277672086}. Best is trial 162 with value: 0.7725144161925771.
[I 2026-09-14 03:07:05,671] Trial 219 finished with value: 0.6905878132846738 and parameters: {'hidden_dim': 234, 'latent_dim': 36, 'beta': 1.6062505659235606, 'gamma': 1.9767211967939327, 'dropout_rate': 0.2057555700218304, 'lr': 0.009125095719096471, 'scheduler_patience': 7, 'class_weight': 0.9213407613872256, 'activation': 'GELU', 'classification_multiplier': 13963.8484159922}. Best is trial 162 with value: 0.7725144161925771.
[I 2026-09-14 03:07:23,813] Trial 220 finished with value: 0.6779208951340099 and parameters: {'hidden_dim': 1564, 'latent_dim': 18, 'beta': 1.5777398736070607, 'gamma': 1.7307070692839759, 'dropout_rate': 0.3041116603895756, 'lr': 0.008354251329690133, 'scheduler_patience': 7, 'class_weight': 0.8663176263993311, 'activation': 'SELU', 'classification_multiplier': 7984.670884207979}. Best is trial 162 with value: 0.7725144161925771.
[I 2026-09-14 03:07:40,900] Trial 221 finished with value: 0.7585339405768815 and parameters: {'hidden_dim': 268, 'latent_dim': 34, 'beta': 0.4265136723324812, 'gamma': 1.9223456044244478, 'dropout_rate': 0.24201487929049817, 'lr': 0.0098744148652295, 'scheduler_patience': 7, 'class_weight': 0.7488101903224956, 'activation': 'SELU', 'classification_multiplier': 11045.269354029344}. Best is trial 162 with value: 0.7725144161925771.
[I 2026-09-14 03:07:57,993] Trial 222 finished with value: 0.7642844484949748 and parameters: {'hidden_dim': 345, 'latent_dim': 36, 'beta': 0.42544312515523075, 'gamma': 1.9086917722709102, 'dropout_rate': 0.24248387772646385, 'lr': 0.009788351242408113, 'scheduler_patience': 7, 'class_weight': 0.7489178904635381, 'activation': 'SELU', 'classification_multiplier': 12265.468496937552}. Best is trial 162 with value: 0.7725144161925771.
[I 2026-09-14 03:08:15,101] Trial 223 finished with value: 0.7608539167625562 and parameters: {'hidden_dim': 344, 'latent_dim': 34, 'beta': 0.42957545405597697, 'gamma': 1.9139677628357272, 'dropout_rate': 0.24340912307310755, 'lr': 0.008129354843554896, 'scheduler_patience': 7, 'class_weight': 0.7461031346764041, 'activation': 'SELU', 'classification_multiplier': 12132.342259437468}. Best is trial 162 with value: 0.7725144161925771.
[I 2026-09-14 03:08:32,261] Trial 224 finished with value: 0.5579066856826848 and parameters: {'hidden_dim': 431, 'latent_dim': 35, 'beta': 0.3754374435896716, 'gamma': 1.8827970354394983, 'dropout_rate': 0.22936845752601648, 'lr': 0.009842721219449376, 'scheduler_patience': 7, 'class_weight': 0.1490575997907999, 'activation': 'SELU', 'classification_multiplier': 12425.100251211119}. Best is trial 162 with value: 0.7725144161925771.
[I 2026-09-14 03:08:49,348] Trial 225 finished with value: 0.7687737863176459 and parameters: {'hidden_dim': 362, 'latent_dim': 36, 'beta': 0.42523445544973754, 'gamma': 1.9125873742799493, 'dropout_rate': 0.23909444878741462, 'lr': 0.00781436084861917, 'scheduler_patience': 7, 'class_weight': 0.727763377262369, 'activation': 'SELU', 'classification_multiplier': 12067.871043048777}. Best is trial 162 with value: 0.7725144161925771.
[I 2026-09-14 03:09:06,439] Trial 226 finished with value: 0.7453194953194954 and parameters: {'hidden_dim': 356, 'latent_dim': 37, 'beta': 0.4298987088749338, 'gamma': 1.8565220397020044, 'dropout_rate': 0.24148989408587188, 'lr': 0.007682210867347675, 'scheduler_patience': 7, 'class_weight': 0.700820752580176, 'activation': 'SELU', 'classification_multiplier': 12102.603111506909}. Best is trial 162 with value: 0.7725144161925771.
[I 2026-09-14 03:09:23,713] Trial 227 finished with value: 0.7246737936393108 and parameters: {'hidden_dim': 836, 'latent_dim': 36, 'beta': 0.4708190975955636, 'gamma': 1.9063489351192748, 'dropout_rate': 0.2599644370446766, 'lr': 0.007949794536354145, 'scheduler_patience': 7, 'class_weight': 0.7202435573621201, 'activation': 'SELU', 'classification_multiplier': 12255.827997150805}. Best is trial 162 with value: 0.7725144161925771.
[I 2026-09-14 03:09:40,884] Trial 228 finished with value: 0.754368168341324 and parameters: {'hidden_dim': 398, 'latent_dim': 34, 'beta': 0.3916319223675736, 'gamma': 1.9533385388348241, 'dropout_rate': 0.24267758063592684, 'lr': 0.007877729865507678, 'scheduler_patience': 7, 'class_weight': 0.7428397311318882, 'activation': 'SELU', 'classification_multiplier': 11765.21955890762}. Best is trial 162 with value: 0.7725144161925771.
[I 2026-09-14 03:09:57,932] Trial 229 finished with value: 0.7418672739102147 and parameters: {'hidden_dim': 319, 'latent_dim': 34, 'beta': 0.5070214496671097, 'gamma': 1.9163665644847907, 'dropout_rate': 0.23797023904367348, 'lr': 0.008060276824944429, 'scheduler_patience': 7, 'class_weight': 0.7259877843731998, 'activation': 'SELU', 'classification_multiplier': 12090.556822529119}. Best is trial 162 with value: 0.7725144161925771.
[I 2026-09-14 03:10:15,019] Trial 230 finished with value: 0.7561444403549666 and parameters: {'hidden_dim': 358, 'latent_dim': 36, 'beta': 0.4353957368889979, 'gamma': 1.8191732008628505, 'dropout_rate': 0.3263746407936553, 'lr': 0.008180018899738196, 'scheduler_patience': 7, 'class_weight': 0.7446887066073454, 'activation': 'SELU', 'classification_multiplier': 11851.25405886747}. Best is trial 162 with value: 0.7725144161925771.
[I 2026-09-14 03:10:32,092] Trial 231 finished with value: 0.7544935365364772 and parameters: {'hidden_dim': 301, 'latent_dim': 36, 'beta': 0.5992689682888229, 'gamma': 1.8772048602981641, 'dropout_rate': 0.22608112848490663, 'lr': 0.009616853669585363, 'scheduler_patience': 7, 'class_weight': 0.7591902869194156, 'activation': 'SELU', 'classification_multiplier': 12467.191911496502}. Best is trial 162 with value: 0.7725144161925771.
[I 2026-09-14 03:10:49,253] Trial 232 finished with value: 0.7443925264354672 and parameters: {'hidden_dim': 386, 'latent_dim': 34, 'beta': 0.327581534081721, 'gamma': 1.9248541815252738, 'dropout_rate': 0.2336034897972076, 'lr': 0.009826175542459278, 'scheduler_patience': 7, 'class_weight': 0.7502126463082885, 'activation': 'SELU', 'classification_multiplier': 12633.03061063697}. Best is trial 162 with value: 0.7725144161925771.
[I 2026-09-14 03:11:06,354] Trial 233 finished with value: 0.7567487742926339 and parameters: {'hidden_dim': 338, 'latent_dim': 31, 'beta': 0.4199846649053721, 'gamma': 1.9995036017263452, 'dropout_rate': 0.253245181901021, 'lr': 0.009641047296686724, 'scheduler_patience': 7, 'class_weight': 0.7726237839593706, 'activation': 'SELU', 'classification_multiplier': 12385.96636775742}. Best is trial 162 with value: 0.7725144161925771.
[I 2026-09-14 03:11:23,398] Trial 234 finished with value: 0.7708901884340481 and parameters: {'hidden_dim': 288, 'latent_dim': 38, 'beta': 0.4646937188065283, 'gamma': 1.8478666375671033, 'dropout_rate': 0.24636590314679024, 'lr': 0.009460427919462378, 'scheduler_patience': 7, 'class_weight': 0.7262353551699317, 'activation': 'SELU', 'classification_multiplier': 11973.85557529902}. Best is trial 162 with value: 0.7725144161925771.
[I 2026-09-14 03:11:40,432] Trial 235 finished with value: 0.7482775303204711 and parameters: {'hidden_dim': 289, 'latent_dim': 39, 'beta': 0.5465920714945207, 'gamma': 1.8390443562855379, 'dropout_rate': 0.2477668505532697, 'lr': 0.009410132791676804, 'scheduler_patience': 7, 'class_weight': 0.7125067696319098, 'activation': 'SELU', 'classification_multiplier': 11955.18249347111}. Best is trial 162 with value: 0.7725144161925771.
[I 2026-09-14 03:11:57,603] Trial 236 finished with value: 0.7527139086225482 and parameters: {'hidden_dim': 439, 'latent_dim': 34, 'beta': 0.4621551794630673, 'gamma': 1.7632271721247246, 'dropout_rate': 0.2666604549566093, 'lr': 0.007688219048293105, 'scheduler_patience': 7, 'class_weight': 0.6894814188524564, 'activation': 'SELU', 'classification_multiplier': 13073.884545951114}. Best is trial 162 with value: 0.7725144161925771.
[I 2026-09-14 03:12:14,674] Trial 237 finished with value: 0.7508818342151674 and parameters: {'hidden_dim': 363, 'latent_dim': 40, 'beta': 0.3591133301652629, 'gamma': 1.8658090996861192, 'dropout_rate': 0.23975375970167204, 'lr': 0.008105212106216586, 'scheduler_patience': 7, 'class_weight': 0.7293387043102458, 'activation': 'SELU', 'classification_multiplier': 11482.022918705909}. Best is trial 162 with value: 0.7725144161925771.
[I 2026-09-14 03:12:31,774] Trial 238 finished with value: 0.7687737863176459 and parameters: {'hidden_dim': 324, 'latent_dim': 39, 'beta': 0.49149507974709605, 'gamma': 1.9701739956118933, 'dropout_rate': 0.288937822343912, 'lr': 0.009512403094047849, 'scheduler_patience': 7, 'class_weight': 0.7137473606706551, 'activation': 'SELU', 'classification_multiplier': 11655.427295214487}. Best is trial 162 with value: 0.7725144161925771.
[I 2026-09-14 03:12:48,796] Trial 239 finished with value: 0.7608539167625562 and parameters: {'hidden_dim': 273, 'latent_dim': 39, 'beta': 0.4964899610461665, 'gamma': 1.7944821848358112, 'dropout_rate': 0.29022127627111305, 'lr': 0.009512650687891661, 'scheduler_patience': 7, 'class_weight': 0.7250416890448564, 'activation': 'SELU', 'classification_multiplier': 12073.70943329978}. Best is trial 162 with value: 0.7725144161925771.
[I 2026-09-14 03:13:05,783] Trial 240 finished with value: 0.7544935365364772 and parameters: {'hidden_dim': 319, 'latent_dim': 39, 'beta': 0.5164386311066052, 'gamma': 1.6853371707661426, 'dropout_rate': 0.29161409926953136, 'lr': 0.00845243710228391, 'scheduler_patience': 7, 'class_weight': 0.7135210480064953, 'activation': 'SELU', 'classification_multiplier': 12220.347916746457}. Best is trial 162 with value: 0.7725144161925771.
[I 2026-09-14 03:13:22,854] Trial 241 finished with value: 0.7608539167625562 and parameters: {'hidden_dim': 267, 'latent_dim': 38, 'beta': 0.4723743222408203, 'gamma': 1.7994426583312986, 'dropout_rate': 0.28144211083666476, 'lr': 0.00948509121978769, 'scheduler_patience': 7, 'class_weight': 0.6960345757730395, 'activation': 'SELU', 'classification_multiplier': 11617.237769473806}. Best is trial 162 with value: 0.7725144161925771.
[I 2026-09-14 03:13:39,876] Trial 242 finished with value: 0.7484958389563653 and parameters: {'hidden_dim': 294, 'latent_dim': 38, 'beta': 0.4858950774596445, 'gamma': 1.7929826428695226, 'dropout_rate': 0.2853223461682878, 'lr': 0.009443500529683785, 'scheduler_patience': 7, 'class_weight': 0.697088085226142, 'activation': 'SELU', 'classification_multiplier': 11958.827400176477}. Best is trial 162 with value: 0.7725144161925771.
[I 2026-09-14 03:13:56,864] Trial 243 finished with value: 0.7461436884187309 and parameters: {'hidden_dim': 250, 'latent_dim': 38, 'beta': 0.48035730407172905, 'gamma': 1.7650340457721763, 'dropout_rate': 0.2992075099279444, 'lr': 0.009256113956090998, 'scheduler_patience': 7, 'class_weight': 0.665766597278561, 'activation': 'SELU', 'classification_multiplier': 11711.905052122644}. Best is trial 162 with value: 0.7725144161925771.
[I 2026-09-14 03:14:13,938] Trial 244 finished with value: 0.7687903508332917 and parameters: {'hidden_dim': 321, 'latent_dim': 39, 'beta': 0.5337112944712875, 'gamma': 1.8436529532116428, 'dropout_rate': 0.2870022868124515, 'lr': 0.007500956398742095, 'scheduler_patience': 7, 'class_weight': 0.7099205773272047, 'activation': 'SELU', 'classification_multiplier': 12121.817883340485}. Best is trial 162 with value: 0.7725144161925771.
