[I 2026-09-14 02:45:52,742] Trial 145 finished with value: 0.673637718177948 and parameters: {'hidden_dim': 260, 'latent_dim': 12, 'beta': 1.580619803319128, 'gamma': 0.756572914670067, 'dropout_rate': 0.15674248589659362, 'lr': 0.0022773840485908314, 'scheduler_patience': 6, 'class_weight': 0.2581930271416645, 'activation': 'GELU', 'classification_multiplier': 10792.871336816479}. Best is trial 67 with value: 0.762929989429073.
[I 2026-09-14 02:46:09,923] Trial 146 finished with value: 0.7585339405768815 and parameters: {'hidden_dim': 315, 'latent_dim': 18, 'beta': 0.6741545429280805, 'gamma': 0.24170387300553028, 'dropout_rate': 0.2111412070115059, 'lr': 0.009589977360628839, 'scheduler_patience': 7, 'class_weight': 0.7956069553519564, 'activation': 'SELU', 'classification_multiplier': 7157.8801398209325}. Best is trial 67 with value: 0.762929989429073.
[I 2026-09-14 02:46:27,137] Trial 147 finished with value: 0.7350838971066009 and parameters: {'hidden_dim': 311, 'latent_dim': 21, 'beta': 0.6410466812913035, 'gamma': 0.13090282525577804, 'dropout_rate': 0.21010516162441914, 'lr': 0.009604578682474512, 'scheduler_patience': 7, 'class_weight': 0.7879814714842686, 'activation': 'SELU', 'classification_multiplier': 6825.611306396885}. Best is trial 67 with value: 0.762929989429073.
[I 2026-09-14 02:46:44,353] Trial 148 finished with value: 0.7512345679012347 and parameters: {'hidden_dim': 312, 'latent_dim': 19, 'beta': 0.44436615066548574, 'gamma': 0.20334510224030428, 'dropout_rate': 0.2224190631417348, 'lr': 0.009227334425504547, 'scheduler_patience': 4, 'class_weight': 0.8044800205192221, 'activation': 'SELU', 'classification_multiplier': 7126.474988076353}. Best is trial 67 with value: 0.762929989429073.
[I 2026-09-14 02:47:01,702] Trial 149 finished with value: 0.7390095284832127 and parameters: {'hidden_dim': 457, 'latent_dim': 18, 'beta': 0.7402823400221814, 'gamma': 0.26766725309697825, 'dropout_rate': 0.2306504251254175, 'lr': 0.009961876148067412, 'scheduler_patience': 7, 'class_weight': 0.6485206197581588, 'activation': 'SELU', 'classification_multiplier': 7511.895919633126}. Best is trial 67 with value: 0.762929989429073.
[I 2026-09-14 02:47:18,890] Trial 150 finished with value: 0.7547458389563652 and parameters: {'hidden_dim': 353, 'latent_dim': 16, 'beta': 0.5299424645021905, 'gamma': 0.15120867732424492, 'dropout_rate': 0.16553540451161616, 'lr': 0.009343048755138498, 'scheduler_patience': 7, 'class_weight': 0.7159167946867924, 'activation': 'SELU', 'classification_multiplier': 13565.316352306525}. Best is trial 67 with value: 0.762929989429073.
[I 2026-09-14 02:47:35,995] Trial 151 finished with value: 0.7449845679012346 and parameters: {'hidden_dim': 212, 'latent_dim': 14, 'beta': 1.4013260507576977, 'gamma': 0.2501856149018578, 'dropout_rate': 0.4746270392671867, 'lr': 0.009585422430488828, 'scheduler_patience': 7, 'class_weight': 0.7446003180382651, 'activation': 'SELU', 'classification_multiplier': 8512.847929566513}. Best is trial 67 with value: 0.762929989429073.
[I 2026-09-14 02:47:53,160] Trial 152 finished with value: 0.7247554759608761 and parameters: {'hidden_dim': 283, 'latent_dim': 17, 'beta': 1.6253843469851341, 'gamma': 1.7063497586443939, 'dropout_rate': 0.17563980586697928, 'lr': 0.0017750127751463298, 'scheduler_patience': 7, 'class_weight': 0.4848111818689149, 'activation': 'SELU', 'classification_multiplier': 5506.258475197434}. Best is trial 67 with value: 0.762929989429073.
[I 2026-09-14 02:48:10,254] Trial 153 finished with value: 0.7412056924110927 and parameters: {'hidden_dim': 254, 'latent_dim': 15, 'beta': 1.5330120874085196, 'gamma': 1.8854047805051626, 'dropout_rate': 0.19854814405379898, 'lr': 0.008928909860859036, 'scheduler_patience': 7, 'class_weight': 0.41470021714337235, 'activation': 'SELU', 'classification_multiplier': 8271.357046556095}. Best is trial 67 with value: 0.762929989429073.
[I 2026-09-14 02:48:27,239] Trial 154 finished with value: 0.7257614995683808 and parameters: {'hidden_dim': 128, 'latent_dim': 20, 'beta': 1.7466402318285195, 'gamma': 0.4109553285826851, 'dropout_rate': 0.20854195420859056, 'lr': 0.00863304371895427, 'scheduler_patience': 7, 'class_weight': 0.9257580009342863, 'activation': 'SELU', 'classification_multiplier': 7942.266294938515}. Best is trial 67 with value: 0.762929989429073.
[I 2026-09-14 02:48:44,262] Trial 155 finished with value: 0.7193334549656388 and parameters: {'hidden_dim': 175, 'latent_dim': 16, 'beta': 0.6810806391041373, 'gamma': 1.5655858487085623, 'dropout_rate': 0.1916483866781135, 'lr': 0.008191453785390773, 'scheduler_patience': 7, 'class_weight': 0.8232577952061169, 'activation': 'LeakyReLU', 'classification_multiplier': 8139.777863139263}. Best is trial 67 with value: 0.762929989429073.
[I 2026-09-14 02:49:01,472] Trial 156 finished with value: 0.767136985545625 and parameters: {'hidden_dim': 390, 'latent_dim': 5, 'beta': 0.3724150366624442, 'gamma': 1.7902816823586194, 'dropout_rate': 0.23703343207107433, 'lr': 0.009769895427921354, 'scheduler_patience': 7, 'class_weight': 0.8753767994590309, 'activation': 'SELU', 'classification_multiplier': 6747.133440803351}. Best is trial 156 with value: 0.767136985545625.
[I 2026-09-14 02:49:18,709] Trial 157 finished with value: 0.7428081989485499 and parameters: {'hidden_dim': 414, 'latent_dim': 23, 'beta': 0.341503341486751, 'gamma': 0.29913870393254605, 'dropout_rate': 0.2603513097605394, 'lr': 0.009767273287637827, 'scheduler_patience': 7, 'class_weight': 0.8903373585455695, 'activation': 'SELU', 'classification_multiplier': 6664.813960152502}. Best is trial 156 with value: 0.767136985545625.
[I 2026-09-14 02:49:35,949] Trial 158 finished with value: 0.7619644723093 and parameters: {'hidden_dim': 483, 'latent_dim': 18, 'beta': 0.3946457372716574, 'gamma': 1.79506628471068, 'dropout_rate': 0.23816804056771573, 'lr': 0.009996507396762562, 'scheduler_patience': 7, 'class_weight': 0.866884618666263, 'activation': 'SELU', 'classification_multiplier': 7221.282189560742}. Best is trial 156 with value: 0.767136985545625.
[I 2026-09-14 02:49:53,085] Trial 159 finished with value: 0.7497182807074029 and parameters: {'hidden_dim': 384, 'latent_dim': 18, 'beta': 0.26350232568970744, 'gamma': 1.7877599285852521, 'dropout_rate': 0.23796181327286198, 'lr': 0.00978889585100711, 'scheduler_patience': 7, 'class_weight': 0.8667203070118072, 'activation': 'SELU', 'classification_multiplier': 6100.620747424591}. Best is trial 156 with value: 0.767136985545625.
[I 2026-09-14 02:50:10,341] Trial 160 finished with value: 0.7353862070843203 and parameters: {'hidden_dim': 512, 'latent_dim': 28, 'beta': 0.452390400214684, 'gamma': 1.7353639718705696, 'dropout_rate': 0.21790971799616196, 'lr': 0.00998378078434247, 'scheduler_patience': 7, 'class_weight': 0.8515979526354177, 'activation': 'ELU', 'classification_multiplier': 6489.969330070705}. Best is trial 156 with value: 0.767136985545625.
[I 2026-09-14 02:50:27,495] Trial 161 finished with value: 0.7708901884340481 and parameters: {'hidden_dim': 327, 'latent_dim': 19, 'beta': 0.3717757662608122, 'gamma': 1.8382771670015041, 'dropout_rate': 0.2503502417036766, 'lr': 0.009517358815025438, 'scheduler_patience': 7, 'class_weight': 0.872989616533291, 'activation': 'SELU', 'classification_multiplier': 7215.420813647368}. Best is trial 161 with value: 0.7708901884340481.
[I 2026-09-14 02:50:44,671] Trial 162 finished with value: 0.7725144161925771 and parameters: {'hidden_dim': 349, 'latent_dim': 19, 'beta': 0.3053531024775596, 'gamma': 1.8987470313875663, 'dropout_rate': 0.2501421590396109, 'lr': 0.009545529571555664, 'scheduler_patience': 7, 'class_weight': 0.9014673849878684, 'activation': 'SELU', 'classification_multiplier': 6712.837703519611}. Best is trial 162 with value: 0.7725144161925771.
[I 2026-09-14 02:51:03,053] Trial 163 finished with value: 0.707909604519774 and parameters: {'hidden_dim': 1670, 'latent_dim': 19, 'beta': 0.39447318858880265, 'gamma': 1.9052747318271372, 'dropout_rate': 0.24319437712556366, 'lr': 0.009414839792979732, 'scheduler_patience': 7, 'class_weight': 0.914792448674696, 'activation': 'SELU', 'classification_multiplier': 6839.395878834035}. Best is trial 162 with value: 0.7725144161925771.
[I 2026-09-14 02:51:20,250] Trial 164 finished with value: 0.750199766426947 and parameters: {'hidden_dim': 442, 'latent_dim': 18, 'beta': 0.3156434199924036, 'gamma': 1.854440638672424, 'dropout_rate': 0.23329611772677888, 'lr': 0.009546679830687998, 'scheduler_patience': 7, 'class_weight': 0.9469130595883086, 'activation': 'SELU', 'classification_multiplier': 7091.485617399091}. Best is trial 162 with value: 0.7725144161925771.
[I 2026-09-14 02:51:37,402] Trial 165 finished with value: 0.7386491939215577 and parameters: {'hidden_dim': 359, 'latent_dim': 20, 'beta': 0.3772500903282575, 'gamma': 1.7759541936855552, 'dropout_rate': 0.22952804713546962, 'lr': 0.009277067138725104, 'scheduler_patience': 7, 'class_weight': 0.8800306847730712, 'activation': 'SELU', 'classification_multiplier': 7281.287286141354}. Best is trial 162 with value: 0.7725144161925771.
[I 2026-09-14 02:51:54,673] Trial 166 finished with value: 0.7444485339222181 and parameters: {'hidden_dim': 489, 'latent_dim': 19, 'beta': 0.24315081350464257, 'gamma': 1.888803816455472, 'dropout_rate': 0.2532895871050257, 'lr': 0.009798401824822401, 'scheduler_patience': 7, 'class_weight': 0.9027605378230895, 'activation': 'SELU', 'classification_multiplier': 7493.312201618971}. Best is trial 162 with value: 0.7725144161925771.
[I 2026-09-14 02:52:11,809] Trial 167 finished with value: 0.7527850546426397 and parameters: {'hidden_dim': 333, 'latent_dim': 17, 'beta': 0.4204165712734531, 'gamma': 1.9952380844214725, 'dropout_rate': 0.2527343887114591, 'lr': 0.009453074457687036, 'scheduler_patience': 7, 'class_weight': 0.8405996786480645, 'activation': 'SELU', 'classification_multiplier': 6315.075330798484}. Best is trial 162 with value: 0.7725144161925771.
[I 2026-09-14 02:52:28,995] Trial 168 finished with value: 0.7469993582534328 and parameters: {'hidden_dim': 414, 'latent_dim': 20, 'beta': 0.2886384212512435, 'gamma': 1.8223509609189303, 'dropout_rate': 0.2470940275982015, 'lr': 0.009043484272472634, 'scheduler_patience': 7, 'class_weight': 0.8859002752202249, 'activation': 'SELU', 'classification_multiplier': 6819.537744198518}. Best is trial 162 with value: 0.7725144161925771.
[I 2026-09-14 02:52:46,228] Trial 169 finished with value: 0.7283331712391949 and parameters: {'hidden_dim': 561, 'latent_dim': 21, 'beta': 0.36112548955750473, 'gamma': 1.9385423698285154, 'dropout_rate': 0.2220867336410016, 'lr': 0.009983824978070903, 'scheduler_patience': 7, 'class_weight': 0.857865031933435, 'activation': 'SELU', 'classification_multiplier': 7715.261007692625}. Best is trial 162 with value: 0.7725144161925771.
[I 2026-09-14 02:53:03,311] Trial 170 finished with value: 0.7349327653286896 and parameters: {'hidden_dim': 367, 'latent_dim': 22, 'beta': 0.29405986318428895, 'gamma': 1.853877960682815, 'dropout_rate': 0.2377525006738047, 'lr': 0.009648507381719703, 'scheduler_patience': 5, 'class_weight': 0.939171181260713, 'activation': 'SELU', 'classification_multiplier': 7278.627021887543}. Best is trial 162 with value: 0.7725144161925771.
[I 2026-09-14 02:53:20,397] Trial 171 finished with value: 0.7350838971066009 and parameters: {'hidden_dim': 306, 'latent_dim': 18, 'beta': 0.4034244989581665, 'gamma': 0.10065115047778556, 'dropout_rate': 0.20305100030449902, 'lr': 0.009629617954271193, 'scheduler_patience': 7, 'class_weight': 0.7699284298782006, 'activation': 'SELU', 'classification_multiplier': 6626.986457383214}. Best is trial 162 with value: 0.7725144161925771.
[I 2026-09-14 02:53:37,492] Trial 172 finished with value: 0.7689294041203225 and parameters: {'hidden_dim': 328, 'latent_dim': 16, 'beta': 0.45659458924676916, 'gamma': 1.8910318341132941, 'dropout_rate': 0.21308314963922506, 'lr': 0.009795055348441186, 'scheduler_patience': 7, 'class_weight': 0.8710924280026112, 'activation': 'SELU', 'classification_multiplier': 6970.488824491684}. Best is trial 162 with value: 0.7725144161925771.
[I 2026-09-14 02:53:54,641] Trial 173 finished with value: 0.74831102967035 and parameters: {'hidden_dim': 388, 'latent_dim': 17, 'beta': 0.5078587229648122, 'gamma': 1.9129726664869053, 'dropout_rate': 0.21566621832386976, 'lr': 0.009787639824464931, 'scheduler_patience': 7, 'class_weight': 0.9009276169077438, 'activation': 'SELU', 'classification_multiplier': 6915.581248814909}. Best is trial 162 with value: 0.7725144161925771.
[I 2026-09-14 02:54:11,728] Trial 174 finished with value: 0.7556603773584906 and parameters: {'hidden_dim': 336, 'latent_dim': 16, 'beta': 0.49108620648723805, 'gamma': 1.8735711802639248, 'dropout_rate': 0.22488377443675012, 'lr': 0.009410437399216008, 'scheduler_patience': 7, 'class_weight': 0.8753537737003202, 'activation': 'SELU', 'classification_multiplier': 7146.578267852727}. Best is trial 162 with value: 0.7725144161925771.
[I 2026-09-14 02:54:28,742] Trial 175 finished with value: 0.7502719061805457 and parameters: {'hidden_dim': 242, 'latent_dim': 15, 'beta': 0.5713794471926897, 'gamma': 1.8139235605831394, 'dropout_rate': 0.21050810156584404, 'lr': 0.009174204533796682, 'scheduler_patience': 7, 'class_weight': 0.8374100805533645, 'activation': 'SELU', 'classification_multiplier': 7402.808644907655}. Best is trial 162 with value: 0.7725144161925771.
[I 2026-09-14 02:54:45,949] Trial 176 finished with value: 0.735574357147252 and parameters: {'hidden_dim': 457, 'latent_dim': 17, 'beta': 0.46335773016523485, 'gamma': 1.751201129012003, 'dropout_rate': 0.2777662479070513, 'lr': 0.008776535197482322, 'scheduler_patience': 7, 'class_weight': 0.9179675872082355, 'activation': 'ReLU', 'classification_multiplier': 6621.245867746991}. Best is trial 162 with value: 0.7725144161925771.
[I 2026-09-14 02:55:03,285] Trial 177 finished with value: 0.7664008506113769 and parameters: {'hidden_dim': 705, 'latent_dim': 19, 'beta': 0.35885228508448475, 'gamma': 1.9215603341484568, 'dropout_rate': 0.2581530382521629, 'lr': 0.009835127717688717, 'scheduler_patience': 7, 'class_weight': 0.8137344085214606, 'activation': 'SELU', 'classification_multiplier': 7721.365471296028}. Best is trial 162 with value: 0.7725144161925771.
[I 2026-09-14 02:55:20,467] Trial 178 finished with value: 0.7458355278784686 and parameters: {'hidden_dim': 403, 'latent_dim': 19, 'beta': 0.3657234467104325, 'gamma': 1.676431087360374, 'dropout_rate': 0.26040826173708065, 'lr': 0.00998444626072238, 'scheduler_patience': 7, 'class_weight': 0.8684490253919321, 'activation': 'SELU', 'classification_multiplier': 7822.997291377902}. Best is trial 162 with value: 0.7725144161925771.
[I 2026-09-14 02:55:37,713] Trial 179 finished with value: 0.7249708364784189 and parameters: {'hidden_dim': 656, 'latent_dim': 18, 'beta': 0.3307249971457852, 'gamma': 1.9628732324609157, 'dropout_rate': 0.24607539276043425, 'lr': 0.009534713092670214, 'scheduler_patience': 7, 'class_weight': 0.8076715754884403, 'activation': 'GELU', 'classification_multiplier': 7578.385243569858}. Best is trial 162 with value: 0.7725144161925771.
[I 2026-09-14 02:55:56,954] Trial 180 finished with value: 0.6588476744478861 and parameters: {'hidden_dim': 1975, 'latent_dim': 31, 'beta': 0.43443830254519655, 'gamma': 1.785713083737988, 'dropout_rate': 0.23248275773802035, 'lr': 0.009803469078091587, 'scheduler_patience': 6, 'class_weight': 0.7906304384894408, 'activation': 'SELU', 'classification_multiplier': 7257.274520472504}. Best is trial 162 with value: 0.7725144161925771.
[I 2026-09-14 02:56:14,026] Trial 181 finished with value: 0.7629703188789584 and parameters: {'hidden_dim': 320, 'latent_dim': 19, 'beta': 0.4021576405084512, 'gamma': 1.922834873649145, 'dropout_rate': 0.22572261697089693, 'lr': 0.009292404195465679, 'scheduler_patience': 7, 'class_weight': 0.8196934602333354, 'activation': 'SELU', 'classification_multiplier': 7822.76364050094}. Best is trial 162 with value: 0.7725144161925771.
[I 2026-09-14 02:56:31,093] Trial 182 finished with value: 0.7370931537598203 and parameters: {'hidden_dim': 321, 'latent_dim': 19, 'beta': 0.3518439293343692, 'gamma': 1.8945651251894524, 'dropout_rate': 0.24140009202920135, 'lr': 0.009324031507141447, 'scheduler_patience': 7, 'class_weight': 0.8951228496038287, 'activation': 'SELU', 'classification_multiplier': 6311.781722804956}. Best is trial 162 with value: 0.7725144161925771.
[I 2026-09-14 02:56:48,383] Trial 183 finished with value: 0.7449494949494949 and parameters: {'hidden_dim': 722, 'latent_dim': 20, 'beta': 0.4660558712160717, 'gamma': 1.847778862879128, 'dropout_rate': 0.2569370722382197, 'lr': 0.00965072816181519, 'scheduler_patience': 7, 'class_weight': 0.8534657493217217, 'activation': 'SELU', 'classification_multiplier': 7628.701989815954}. Best is trial 162 with value: 0.7725144161925771.
[I 2026-09-14 02:57:05,508] Trial 184 finished with value: 0.742457498366138 and parameters: {'hidden_dim': 356, 'latent_dim': 19, 'beta': 0.3793112904302433, 'gamma': 1.9553240607321172, 'dropout_rate': 0.2013828374620913, 'lr': 0.009087628368305557, 'scheduler_patience': 7, 'class_weight': 0.8198759532954031, 'activation': 'SELU', 'classification_multiplier': 7829.957281342512}. Best is trial 162 with value: 0.7725144161925771.
[I 2026-09-14 02:57:22,593] Trial 185 finished with value: 0.7541081311196254 and parameters: {'hidden_dim': 312, 'latent_dim': 16, 'beta': 0.5470711160586343, 'gamma': 1.9294285798740805, 'dropout_rate': 0.22858212166936456, 'lr': 0.00949650329209822, 'scheduler_patience': 7, 'class_weight': 0.7672761282229367, 'activation': 'SELU', 'classification_multiplier': 7098.998997343836}. Best is trial 162 with value: 0.7725144161925771.
[I 2026-09-14 02:57:39,774] Trial 186 finished with value: 0.7725144161925771 and parameters: {'hidden_dim': 432, 'latent_dim': 21, 'beta': 0.21599819955426725, 'gamma': 0.8603084543043853, 'dropout_rate': 0.1829689237160279, 'lr': 0.009698190856743718, 'scheduler_patience': 7, 'class_weight': 0.7891204102684373, 'activation': 'SELU', 'classification_multiplier': 7988.125712171952}. Best is trial 162 with value: 0.7725144161925771.
[I 2026-09-14 02:57:56,954] Trial 187 finished with value: 0.7319998009653181 and parameters: {'hidden_dim': 435, 'latent_dim': 21, 'beta': 0.2806729476067391, 'gamma': 0.9306258080272377, 'dropout_rate': 0.19394256924130202, 'lr': 0.009246462982342758, 'scheduler_patience': 7, 'class_weight': 0.8745963844598018, 'activation': 'SELU', 'classification_multiplier': 8051.500611701323}. Best is trial 162 with value: 0.7725144161925771.
[I 2026-09-14 02:58:14,187] Trial 188 finished with value: 0.7471941638608305 and parameters: {'hidden_dim': 476, 'latent_dim': 23, 'beta': 0.21423869415152824, 'gamma': 1.101471378875237, 'dropout_rate': 0.19139925739718877, 'lr': 0.009757303012296338, 'scheduler_patience': 7, 'class_weight': 0.8349254205260218, 'activation': 'SELU', 'classification_multiplier': 12748.315765015814}. Best is trial 162 with value: 0.7725144161925771.
[I 2026-09-14 02:58:31,301] Trial 189 finished with value: 0.7418672739102147 and parameters: {'hidden_dim': 379, 'latent_dim': 22, 'beta': 0.2407485314971323, 'gamma': 1.713656795828001, 'dropout_rate': 0.1791928917673151, 'lr': 0.008922951384081881, 'scheduler_patience': 7, 'class_weight': 0.8102398424048913, 'activation': 'SELU', 'classification_multiplier': 7669.434238563333}. Best is trial 162 with value: 0.7725144161925771.
[I 2026-09-14 02:58:48,608] Trial 190 finished with value: 0.6981098713493079 and parameters: {'hidden_dim': 767, 'latent_dim': 21, 'beta': 0.4167651613913967, 'gamma': 0.8285627559883679, 'dropout_rate': 0.18250826473820653, 'lr': 0.009444449745003667, 'scheduler_patience': 7, 'class_weight': 0.9126559153792172, 'activation': 'SELU', 'classification_multiplier': 7362.539566460597}. Best is trial 162 with value: 0.7725144161925771.
[I 2026-09-14 02:59:05,685] Trial 191 finished with value: 0.7395097065638568 and parameters: {'hidden_dim': 341, 'latent_dim': 18, 'beta': 0.3305154990163539, 'gamma': 0.4911120242267908, 'dropout_rate': 0.2131570618835615, 'lr': 0.009997436315767669, 'scheduler_patience': 7, 'class_weight': 0.7919535773854119, 'activation': 'SELU', 'classification_multiplier': 7914.683425819463}. Best is trial 162 with value: 0.7725144161925771.
[I 2026-09-14 02:59:23,227] Trial 192 finished with value: 0.6777128384960062 and parameters: {'hidden_dim': 1090, 'latent_dim': 20, 'beta': 0.17331894122389183, 'gamma': 1.9983264076718594, 'dropout_rate': 0.23937509342097266, 'lr': 0.0097213942247773, 'scheduler_patience': 7, 'class_weight': 0.7819086783921102, 'activation': 'SELU', 'classification_multiplier': 6971.062501965545}. Best is trial 162 with value: 0.7725144161925771.
[I 2026-09-14 02:59:40,258] Trial 193 finished with value: 0.7557144723092999 and parameters: {'hidden_dim': 218, 'latent_dim': 17, 'beta': 0.4027250490753751, 'gamma': 1.8846204362485517, 'dropout_rate': 0.20550511114793607, 'lr': 0.009818823179307363, 'scheduler_patience': 5, 'class_weight': 0.8587442588799091, 'activation': 'SELU', 'classification_multiplier': 8214.708800484166}. Best is trial 162 with value: 0.7725144161925771.
[I 2026-09-14 02:59:57,368] Trial 194 finished with value: 0.7332944832944833 and parameters: {'hidden_dim': 267, 'latent_dim': 25, 'beta': 0.33195690924671495, 'gamma': 1.2401396536961755, 'dropout_rate': 0.2642711479600339, 'lr': 0.00952552923958136, 'scheduler_patience': 4, 'class_weight': 0.7589236403168766, 'activation': 'SELU', 'classification_multiplier': 7480.437199724782}. Best is trial 162 with value: 0.7725144161925771.
