[I 2026-09-14 02:16:48,315] Trial 45 finished with value: 0.6606790864493947 and parameters: {'hidden_dim': 366, 'latent_dim': 21, 'beta': 1.466785273096818, 'gamma': 1.7019035051265057, 'dropout_rate': 0.25001519694251967, 'lr': 0.009653940244476862, 'scheduler_patience': 7, 'class_weight': 0.18838741047452628, 'activation': 'GELU', 'classification_multiplier': 8812.215383372037}. Best is trial 42 with value: 0.7623986748763983.
[I 2026-09-14 02:17:05,845] Trial 46 finished with value: 0.7457107843137255 and parameters: {'hidden_dim': 700, 'latent_dim': 24, 'beta': 1.8747085283429759, 'gamma': 1.4273412213869343, 'dropout_rate': 0.13690323155997755, 'lr': 0.008677088399694957, 'scheduler_patience': 7, 'class_weight': 0.5636685612854591, 'activation': 'SELU', 'classification_multiplier': 10377.672449415082}. Best is trial 42 with value: 0.7623986748763983.
[I 2026-09-14 02:17:23,083] Trial 47 finished with value: 0.7527139086225482 and parameters: {'hidden_dim': 240, 'latent_dim': 12, 'beta': 0.382173240252373, 'gamma': 1.8846207188083632, 'dropout_rate': 0.1752765166755404, 'lr': 0.009990195090879074, 'scheduler_patience': 6, 'class_weight': 0.7882066684885217, 'activation': 'SELU', 'classification_multiplier': 9568.556751673064}. Best is trial 42 with value: 0.7623986748763983.
[I 2026-09-14 02:17:40,273] Trial 48 finished with value: 0.7265843014321716 and parameters: {'hidden_dim': 128, 'latent_dim': 7, 'beta': 1.554532207583127, 'gamma': 1.178579664834386, 'dropout_rate': 0.10152377730865106, 'lr': 0.004940807666581353, 'scheduler_patience': 7, 'class_weight': 0.9656151311743296, 'activation': 'ELU', 'classification_multiplier': 6979.3806229957145}. Best is trial 42 with value: 0.7623986748763983.
[I 2026-09-14 02:17:57,858] Trial 49 finished with value: 0.7155202821869487 and parameters: {'hidden_dim': 636, 'latent_dim': 19, 'beta': 1.7156666014256496, 'gamma': 1.4593146199460088, 'dropout_rate': 0.39857303100276786, 'lr': 0.007698451144291888, 'scheduler_patience': 7, 'class_weight': 0.9097036799793792, 'activation': 'ReLU', 'classification_multiplier': 7822.692336777835}. Best is trial 42 with value: 0.7623986748763983.
[I 2026-09-14 02:18:15,431] Trial 50 finished with value: 0.7319116907615095 and parameters: {'hidden_dim': 823, 'latent_dim': 29, 'beta': 1.3723651534688568, 'gamma': 1.3177674274265505, 'dropout_rate': 0.33481226364647687, 'lr': 0.006699448247216598, 'scheduler_patience': 6, 'class_weight': 0.9988081269322245, 'activation': 'SELU', 'classification_multiplier': 8744.126125279812}. Best is trial 42 with value: 0.7623986748763983.
[I 2026-09-14 02:18:32,728] Trial 51 finished with value: 0.7477682811016143 and parameters: {'hidden_dim': 300, 'latent_dim': 16, 'beta': 1.5807464923713739, 'gamma': 1.8407791395491135, 'dropout_rate': 0.2162459873909668, 'lr': 0.008497669886284498, 'scheduler_patience': 7, 'class_weight': 0.8753262495503347, 'activation': 'SELU', 'classification_multiplier': 8239.143275358032}. Best is trial 42 with value: 0.7623986748763983.
[I 2026-09-14 02:18:50,211] Trial 52 finished with value: 0.7346553920536044 and parameters: {'hidden_dim': 456, 'latent_dim': 14, 'beta': 1.7877693102320746, 'gamma': 1.7853895614522197, 'dropout_rate': 0.21219850187967812, 'lr': 0.007053037619867542, 'scheduler_patience': 7, 'class_weight': 0.8389850250665095, 'activation': 'SELU', 'classification_multiplier': 7251.858918262361}. Best is trial 42 with value: 0.7623986748763983.
[I 2026-09-14 02:19:07,555] Trial 53 finished with value: 0.7480264033936349 and parameters: {'hidden_dim': 372, 'latent_dim': 13, 'beta': 1.6378962730220936, 'gamma': 1.7250729779273168, 'dropout_rate': 0.16285995943432152, 'lr': 0.009042197893567453, 'scheduler_patience': 7, 'class_weight': 0.9208979756184924, 'activation': 'SELU', 'classification_multiplier': 9153.321410088387}. Best is trial 42 with value: 0.7623986748763983.
[I 2026-09-14 02:19:24,828] Trial 54 finished with value: 0.7527139086225482 and parameters: {'hidden_dim': 245, 'latent_dim': 17, 'beta': 1.6679246259421847, 'gamma': 1.9439294290617224, 'dropout_rate': 0.23396207838014085, 'lr': 0.008175643833965842, 'scheduler_patience': 7, 'class_weight': 0.7825006382010636, 'activation': 'SELU', 'classification_multiplier': 6038.888437761993}. Best is trial 42 with value: 0.7623986748763983.
[I 2026-09-14 02:19:44,044] Trial 55 finished with value: 0.6761429928096595 and parameters: {'hidden_dim': 1909, 'latent_dim': 11, 'beta': 1.9344027451191486, 'gamma': 0.9280375258074771, 'dropout_rate': 0.17869814465257744, 'lr': 0.007651153956645734, 'scheduler_patience': 7, 'class_weight': 0.7168297774436279, 'activation': 'GELU', 'classification_multiplier': 10080.032123101442}. Best is trial 42 with value: 0.7623986748763983.
[I 2026-09-14 02:20:01,453] Trial 56 finished with value: 0.7149709466093647 and parameters: {'hidden_dim': 480, 'latent_dim': 15, 'beta': 1.456091235482144, 'gamma': 1.7385381699142626, 'dropout_rate': 0.4266420182979749, 'lr': 0.005627226597831084, 'scheduler_patience': 6, 'class_weight': 0.3777400869489984, 'activation': 'SELU', 'classification_multiplier': 8433.855348177116}. Best is trial 42 with value: 0.7623986748763983.
[I 2026-09-14 02:20:19,348] Trial 57 finished with value: 0.7421008110663282 and parameters: {'hidden_dim': 1252, 'latent_dim': 17, 'beta': 1.267187175446778, 'gamma': 1.5889534707844446, 'dropout_rate': 0.30038337389272257, 'lr': 0.005855333404388076, 'scheduler_patience': 7, 'class_weight': 0.9641944404356723, 'activation': 'SELU', 'classification_multiplier': 6502.67241765705}. Best is trial 42 with value: 0.7623986748763983.
[I 2026-09-14 02:20:37,661] Trial 58 finished with value: 0.18627450980392157 and parameters: {'hidden_dim': 1568, 'latent_dim': 10, 'beta': 1.476810286976479, 'gamma': 1.6007995335408798, 'dropout_rate': 0.20371783222083456, 'lr': 0.004403362740647547, 'scheduler_patience': 6, 'class_weight': 0.05293445610096903, 'activation': 'SELU', 'classification_multiplier': 7592.161347416163}. Best is trial 42 with value: 0.7623986748763983.
[I 2026-09-14 02:20:54,875] Trial 59 finished with value: 0.7366808055332644 and parameters: {'hidden_dim': 313, 'latent_dim': 19, 'beta': 1.7676301519932167, 'gamma': 0.3655666163529371, 'dropout_rate': 0.27249611193094897, 'lr': 0.008917172938764187, 'scheduler_patience': 7, 'class_weight': 0.46701480132541906, 'activation': 'SELU', 'classification_multiplier': 7008.851903379502}. Best is trial 42 with value: 0.7623986748763983.
[I 2026-09-14 02:21:12,130] Trial 60 finished with value: 0.7449845679012346 and parameters: {'hidden_dim': 204, 'latent_dim': 13, 'beta': 1.9068709243870003, 'gamma': 0.6413921311766198, 'dropout_rate': 0.3760846625830409, 'lr': 0.001037585380238679, 'scheduler_patience': 7, 'class_weight': 0.5662546964275801, 'activation': 'ELU', 'classification_multiplier': 8000.777280590099}. Best is trial 42 with value: 0.7623986748763983.
[I 2026-09-14 02:21:29,303] Trial 61 finished with value: 0.7567203188789584 and parameters: {'hidden_dim': 251, 'latent_dim': 15, 'beta': 0.4061598167981475, 'gamma': 1.9307922502122328, 'dropout_rate': 0.24054718659526195, 'lr': 0.009994119183826335, 'scheduler_patience': 5, 'class_weight': 0.7770776899020735, 'activation': 'SELU', 'classification_multiplier': 9653.990187112142}. Best is trial 42 with value: 0.7623986748763983.
[I 2026-09-14 02:21:46,708] Trial 62 finished with value: 0.7584936111269959 and parameters: {'hidden_dim': 394, 'latent_dim': 15, 'beta': 1.599072761971929, 'gamma': 1.9462293347450137, 'dropout_rate': 0.2392392184610179, 'lr': 0.009615770360935505, 'scheduler_patience': 4, 'class_weight': 0.8688650433777444, 'activation': 'SELU', 'classification_multiplier': 10576.32186714742}. Best is trial 42 with value: 0.7623986748763983.
[I 2026-09-14 02:22:04,179] Trial 63 finished with value: 0.7409361471861472 and parameters: {'hidden_dim': 605, 'latent_dim': 16, 'beta': 0.45487084856301474, 'gamma': 1.9487532755683068, 'dropout_rate': 0.24136225633204675, 'lr': 0.009591086804579643, 'scheduler_patience': 4, 'class_weight': 0.6582365097371887, 'activation': 'SELU', 'classification_multiplier': 10458.916867784978}. Best is trial 42 with value: 0.7623986748763983.
[I 2026-09-14 02:22:21,593] Trial 64 finished with value: 0.7448322231603965 and parameters: {'hidden_dim': 413, 'latent_dim': 19, 'beta': 0.7323379600797215, 'gamma': 1.9069024408667843, 'dropout_rate': 0.25983858325778897, 'lr': 0.00931485593035061, 'scheduler_patience': 4, 'class_weight': 0.8216310258808857, 'activation': 'SELU', 'classification_multiplier': 11539.608261199695}. Best is trial 42 with value: 0.7623986748763983.
[I 2026-09-14 02:22:38,724] Trial 65 finished with value: 0.7470396877033182 and parameters: {'hidden_dim': 180, 'latent_dim': 7, 'beta': 1.0057883529022773, 'gamma': 1.8167497476749415, 'dropout_rate': 0.2953320446491306, 'lr': 0.009527168557361371, 'scheduler_patience': 5, 'class_weight': 0.9413360227322514, 'activation': 'LeakyReLU', 'classification_multiplier': 11083.260596910743}. Best is trial 42 with value: 0.7623986748763983.
[I 2026-09-14 02:22:56,457] Trial 66 finished with value: 0.7002072734124741 and parameters: {'hidden_dim': 1058, 'latent_dim': 14, 'beta': 0.2933676299796891, 'gamma': 0.7971063929012969, 'dropout_rate': 0.26465967647908817, 'lr': 0.00988711370627077, 'scheduler_patience': 3, 'class_weight': 0.8602690415122684, 'activation': 'SELU', 'classification_multiplier': 9867.389800884646}. Best is trial 42 with value: 0.7623986748763983.
[I 2026-09-14 02:23:13,796] Trial 67 finished with value: 0.762929989429073 and parameters: {'hidden_dim': 341, 'latent_dim': 23, 'beta': 0.5526354988466, 'gamma': 1.662613604915258, 'dropout_rate': 0.20056972885101237, 'lr': 0.008914888908617658, 'scheduler_patience': 5, 'class_weight': 0.7620696480228919, 'activation': 'SELU', 'classification_multiplier': 11892.708400722946}. Best is trial 67 with value: 0.762929989429073.
[I 2026-09-14 02:23:31,193] Trial 68 finished with value: 0.7166666666666667 and parameters: {'hidden_dim': 497, 'latent_dim': 24, 'beta': 0.160924708278802, 'gamma': 1.671912952261387, 'dropout_rate': 0.1996371597427636, 'lr': 0.009744722903481808, 'scheduler_patience': 5, 'class_weight': 0.7659488889468817, 'activation': 'GELU', 'classification_multiplier': 11996.04962663775}. Best is trial 67 with value: 0.762929989429073.
[I 2026-09-14 02:23:49,309] Trial 69 finished with value: 0.728472464104648 and parameters: {'hidden_dim': 1414, 'latent_dim': 23, 'beta': 0.5830006420577044, 'gamma': 1.3590307768785395, 'dropout_rate': 0.3620367942333038, 'lr': 0.003767187862014461, 'scheduler_patience': 4, 'class_weight': 0.6433974626500536, 'activation': 'SELU', 'classification_multiplier': 10713.620345862457}. Best is trial 67 with value: 0.762929989429073.
[I 2026-09-14 02:24:06,760] Trial 70 finished with value: 0.7258001309545308 and parameters: {'hidden_dim': 384, 'latent_dim': 27, 'beta': 0.6068773129933771, 'gamma': 1.4853454415866187, 'dropout_rate': 0.4620205060536683, 'lr': 0.00015654551469409996, 'scheduler_patience': 3, 'class_weight': 0.7241579540507707, 'activation': 'ReLU', 'classification_multiplier': 12474.905846433501}. Best is trial 67 with value: 0.762929989429073.
[I 2026-09-14 02:24:24,124] Trial 71 finished with value: 0.7453194953194954 and parameters: {'hidden_dim': 326, 'latent_dim': 17, 'beta': 0.38045407175345924, 'gamma': 1.9933243892806685, 'dropout_rate': 0.1463966453229608, 'lr': 0.00916151405574455, 'scheduler_patience': 5, 'class_weight': 0.6943569131222692, 'activation': 'SELU', 'classification_multiplier': 11231.45648916131}. Best is trial 67 with value: 0.762929989429073.
[I 2026-09-14 02:24:41,359] Trial 72 finished with value: 0.738833746898263 and parameters: {'hidden_dim': 260, 'latent_dim': 21, 'beta': 0.49341390301481436, 'gamma': 1.7564757915524876, 'dropout_rate': 0.23132349958286064, 'lr': 0.008843696697927709, 'scheduler_patience': 3, 'class_weight': 0.5279065407518413, 'activation': 'SELU', 'classification_multiplier': 10926.308562159391}. Best is trial 67 with value: 0.762929989429073.
[I 2026-09-14 02:24:58,526] Trial 73 finished with value: 0.7401382243487507 and parameters: {'hidden_dim': 180, 'latent_dim': 33, 'beta': 0.2565375315976923, 'gamma': 1.8355031856526076, 'dropout_rate': 0.21996973203347753, 'lr': 0.008353393036549635, 'scheduler_patience': 4, 'class_weight': 0.8039872591234194, 'activation': 'SELU', 'classification_multiplier': 11887.55495581036}. Best is trial 67 with value: 0.762929989429073.
[I 2026-09-14 02:25:15,689] Trial 74 finished with value: 0.7082665767209152 and parameters: {'hidden_dim': 130, 'latent_dim': 18, 'beta': 0.10405875309198992, 'gamma': 1.5447024366384514, 'dropout_rate': 0.4836274991843674, 'lr': 0.009329380452650063, 'scheduler_patience': 5, 'class_weight': 0.8679273339095254, 'activation': 'SELU', 'classification_multiplier': 10506.155144048866}. Best is trial 67 with value: 0.762929989429073.
[I 2026-09-14 02:25:33,127] Trial 75 finished with value: 0.7418619395177283 and parameters: {'hidden_dim': 403, 'latent_dim': 21, 'beta': 1.5749685801126785, 'gamma': 1.6332962571461005, 'dropout_rate': 0.18948101141365184, 'lr': 0.0029617206568589224, 'scheduler_patience': 5, 'class_weight': 0.9027873889636178, 'activation': 'SELU', 'classification_multiplier': 10086.497093466933}. Best is trial 67 with value: 0.762929989429073.
[I 2026-09-14 02:25:50,632] Trial 76 finished with value: 0.7493215609830677 and parameters: {'hidden_dim': 591, 'latent_dim': 15, 'beta': 1.515792209989626, 'gamma': 1.256986048246764, 'dropout_rate': 0.16010179035408326, 'lr': 0.00997561539113593, 'scheduler_patience': 4, 'class_weight': 0.7731405337868379, 'activation': 'SELU', 'classification_multiplier': 13470.370149664608}. Best is trial 67 with value: 0.762929989429073.
[I 2026-09-14 02:26:09,126] Trial 77 finished with value: 0.7159078320593775 and parameters: {'hidden_dim': 1627, 'latent_dim': 10, 'beta': 1.7132801348865887, 'gamma': 1.9269665010514203, 'dropout_rate': 0.20711079617789308, 'lr': 0.002523210931514779, 'scheduler_patience': 5, 'class_weight': 0.8303003035001129, 'activation': 'LeakyReLU', 'classification_multiplier': 9060.195299918309}. Best is trial 67 with value: 0.762929989429073.
[I 2026-09-14 02:26:26,451] Trial 78 finished with value: 0.7092673992673992 and parameters: {'hidden_dim': 337, 'latent_dim': 13, 'beta': 0.7830364893836107, 'gamma': 1.0207280218196584, 'dropout_rate': 0.2378646563747044, 'lr': 0.008576343831359093, 'scheduler_patience': 2, 'class_weight': 0.3187386437305394, 'activation': 'SELU', 'classification_multiplier': 9563.694813310682}. Best is trial 67 with value: 0.762929989429073.
[I 2026-09-14 02:26:43,800] Trial 79 finished with value: 0.7361226344277192 and parameters: {'hidden_dim': 266, 'latent_dim': 20, 'beta': 0.5026869866732786, 'gamma': 1.6865784933476105, 'dropout_rate': 0.33486426866929353, 'lr': 0.006420610397932302, 'scheduler_patience': 6, 'class_weight': 0.9634772397766892, 'activation': 'ELU', 'classification_multiplier': 11340.436805814492}. Best is trial 67 with value: 0.762929989429073.
[I 2026-09-14 02:27:00,997] Trial 80 finished with value: 0.7370931537598203 and parameters: {'hidden_dim': 203, 'latent_dim': 17, 'beta': 1.6088894956600353, 'gamma': 1.8619690198163688, 'dropout_rate': 0.4112506752772829, 'lr': 0.0077576652497805335, 'scheduler_patience': 6, 'class_weight': 0.745928285691255, 'activation': 'SELU', 'classification_multiplier': 14729.167262935202}. Best is trial 67 with value: 0.762929989429073.
[I 2026-09-14 02:27:18,308] Trial 81 finished with value: 0.7541081311196254 and parameters: {'hidden_dim': 301, 'latent_dim': 15, 'beta': 1.6457399274953999, 'gamma': 1.8145215709781253, 'dropout_rate': 0.17555608669067915, 'lr': 0.007480491758294161, 'scheduler_patience': 7, 'class_weight': 0.8840406708827687, 'activation': 'SELU', 'classification_multiplier': 11715.046767712267}. Best is trial 67 with value: 0.762929989429073.
[I 2026-09-14 02:27:35,681] Trial 82 finished with value: 0.7421008110663282 and parameters: {'hidden_dim': 435, 'latent_dim': 14, 'beta': 1.6655084445353998, 'gamma': 1.7737791422430655, 'dropout_rate': 0.18149246317708168, 'lr': 0.007516489285345403, 'scheduler_patience': 7, 'class_weight': 0.9060507596849618, 'activation': 'SELU', 'classification_multiplier': 11769.969113996027}. Best is trial 67 with value: 0.762929989429073.
[I 2026-09-14 02:27:52,935] Trial 83 finished with value: 0.7484904028501829 and parameters: {'hidden_dim': 301, 'latent_dim': 12, 'beta': 0.6461791679779765, 'gamma': 1.8318967588924002, 'dropout_rate': 0.1723342429243839, 'lr': 0.009065999040798247, 'scheduler_patience': 7, 'class_weight': 0.9294147777642859, 'activation': 'SELU', 'classification_multiplier': 10694.04644735837}. Best is trial 67 with value: 0.762929989429073.
[I 2026-09-14 02:28:12,217] Trial 84 finished with value: 0.674055829228243 and parameters: {'hidden_dim': 1946, 'latent_dim': 16, 'beta': 1.5302160418336428, 'gamma': 1.5537532897037563, 'dropout_rate': 0.4468749521663411, 'lr': 0.008341273594804568, 'scheduler_patience': 7, 'class_weight': 0.8505927496490929, 'activation': 'SELU', 'classification_multiplier': 12556.449800982045}. Best is trial 67 with value: 0.762929989429073.
[I 2026-09-14 02:28:29,443] Trial 85 finished with value: 0.7426739926739927 and parameters: {'hidden_dim': 225, 'latent_dim': 15, 'beta': 1.428147742402356, 'gamma': 1.9544860116698213, 'dropout_rate': 0.19156864190313574, 'lr': 0.009653609368099848, 'scheduler_patience': 7, 'class_weight': 0.5919162263929326, 'activation': 'SELU', 'classification_multiplier': 12146.498655167205}. Best is trial 67 with value: 0.762929989429073.
[I 2026-09-14 02:28:46,780] Trial 86 finished with value: 0.7343843229900201 and parameters: {'hidden_dim': 353, 'latent_dim': 22, 'beta': 1.7800532769622546, 'gamma': 1.6295002683024913, 'dropout_rate': 0.16952017081998078, 'lr': 0.00884944350017885, 'scheduler_patience': 7, 'class_weight': 0.9766270451272641, 'activation': 'SELU', 'classification_multiplier': 8521.155976602517}. Best is trial 67 with value: 0.762929989429073.
[I 2026-09-14 02:29:04,236] Trial 87 finished with value: 0.7089050309389293 and parameters: {'hidden_dim': 505, 'latent_dim': 18, 'beta': 1.353929569027155, 'gamma': 1.7160609851498192, 'dropout_rate': 0.2865485186257733, 'lr': 0.007272902936707489, 'scheduler_patience': 6, 'class_weight': 0.8136499124614893, 'activation': 'ReLU', 'classification_multiplier': 11033.952732304506}. Best is trial 67 with value: 0.762929989429073.
[I 2026-09-14 02:29:21,351] Trial 88 finished with value: 0.739768031951184 and parameters: {'hidden_dim': 166, 'latent_dim': 24, 'beta': 1.6162842297751707, 'gamma': 1.8975551788314817, 'dropout_rate': 0.30897897929273505, 'lr': 0.007971555326797537, 'scheduler_patience': 7, 'class_weight': 0.9461247238375154, 'activation': 'SELU', 'classification_multiplier': 11669.228140571218}. Best is trial 67 with value: 0.762929989429073.
[I 2026-09-14 02:29:38,620] Trial 89 finished with value: 0.7375158781795087 and parameters: {'hidden_dim': 283, 'latent_dim': 19, 'beta': 1.681695460660181, 'gamma': 1.7893526912700275, 'dropout_rate': 0.25138987507373867, 'lr': 0.009445062962065995, 'scheduler_patience': 3, 'class_weight': 0.8718755988609267, 'activation': 'GELU', 'classification_multiplier': 10271.784772405483}. Best is trial 67 with value: 0.762929989429073.
[I 2026-09-14 02:29:56,071] Trial 90 finished with value: 0.7519640852974186 and parameters: {'hidden_dim': 418, 'latent_dim': 26, 'beta': 1.8356604212240561, 'gamma': 1.4281393741092692, 'dropout_rate': 0.13817983495068506, 'lr': 0.005019850704177344, 'scheduler_patience': 4, 'class_weight': 0.8910012045475313, 'activation': 'SELU', 'classification_multiplier': 11349.588599564884}. Best is trial 67 with value: 0.762929989429073.
[I 2026-09-14 02:30:13,411] Trial 91 finished with value: 0.7606337781776378 and parameters: {'hidden_dim': 344, 'latent_dim': 12, 'beta': 1.49708020383004, 'gamma': 1.7607291009573296, 'dropout_rate': 0.21354595373131022, 'lr': 0.008620868766929708, 'scheduler_patience': 7, 'class_weight': 0.8877360222298487, 'activation': 'SELU', 'classification_multiplier': 8089.436925338343}. Best is trial 67 with value: 0.762929989429073.
[I 2026-09-14 02:30:30,742] Trial 92 finished with value: 0.7467692346945284 and parameters: {'hidden_dim': 335, 'latent_dim': 12, 'beta': 1.5802948497423608, 'gamma': 1.750447639165891, 'dropout_rate': 0.2243663109388507, 'lr': 0.008773874922236233, 'scheduler_patience': 7, 'class_weight': 0.9191917998519884, 'activation': 'SELU', 'classification_multiplier': 7363.818355342224}. Best is trial 67 with value: 0.762929989429073.
[I 2026-09-14 02:30:47,991] Trial 93 finished with value: 0.7522594364699628 and parameters: {'hidden_dim': 234, 'latent_dim': 15, 'beta': 1.4736822747131368, 'gamma': 1.689711766720831, 'dropout_rate': 0.2037519275908246, 'lr': 0.008261436885234664, 'scheduler_patience': 7, 'class_weight': 0.8497578976028037, 'activation': 'SELU', 'classification_multiplier': 8031.830504985706}. Best is trial 67 with value: 0.762929989429073.
[I 2026-09-14 02:31:05,450] Trial 94 finished with value: 0.7506645401382244 and parameters: {'hidden_dim': 473, 'latent_dim': 5, 'beta': 1.4201211474330733, 'gamma': 1.8734848801415023, 'dropout_rate': 0.2106013765468528, 'lr': 0.00860395837907482, 'scheduler_patience': 7, 'class_weight': 0.9853550560367399, 'activation': 'SELU', 'classification_multiplier': 9293.79432856602}. Best is trial 67 with value: 0.762929989429073.
