[I 2026-09-14 03:43:04,208] Trial 345 finished with value: 0.7444894286999549 and parameters: {'hidden_dim': 505, 'latent_dim': 26, 'beta': 0.2369972456413778, 'gamma': 1.387828313038553, 'dropout_rate': 0.3625238247221858, 'lr': 0.006656420976947116, 'scheduler_patience': 7, 'class_weight': 0.8426685226683455, 'activation': 'ELU', 'classification_multiplier': 6349.275371439136}. Best is trial 269 with value: 0.7750568551007148.
[I 2026-09-14 03:43:21,379] Trial 346 finished with value: 0.7487095572584078 and parameters: {'hidden_dim': 400, 'latent_dim': 22, 'beta': 0.17805401276657226, 'gamma': 1.273337901889121, 'dropout_rate': 0.35042007278841186, 'lr': 0.009742325524522859, 'scheduler_patience': 7, 'class_weight': 0.874913076764783, 'activation': 'SELU', 'classification_multiplier': 6552.803323764128}. Best is trial 269 with value: 0.7750568551007148.
[I 2026-09-14 03:43:38,567] Trial 347 finished with value: 0.7395097065638568 and parameters: {'hidden_dim': 415, 'latent_dim': 21, 'beta': 0.1374686607266875, 'gamma': 1.840816886518446, 'dropout_rate': 0.31748789038673547, 'lr': 0.006777351907556679, 'scheduler_patience': 7, 'class_weight': 0.8369964456777339, 'activation': 'SELU', 'classification_multiplier': 5002.245726312079}. Best is trial 269 with value: 0.7750568551007148.
[I 2026-09-14 03:43:55,724] Trial 348 finished with value: 0.7750568551007148 and parameters: {'hidden_dim': 447, 'latent_dim': 22, 'beta': 0.19758405790580275, 'gamma': 1.8937313756555048, 'dropout_rate': 0.35389197448374154, 'lr': 0.006294261055081424, 'scheduler_patience': 7, 'class_weight': 0.8264280004956742, 'activation': 'SELU', 'classification_multiplier': 5575.434715414122}. Best is trial 269 with value: 0.7750568551007148.
[I 2026-09-14 03:44:12,885] Trial 349 finished with value: 0.762413406091567 and parameters: {'hidden_dim': 403, 'latent_dim': 21, 'beta': 0.25520728634218837, 'gamma': 1.864738148901647, 'dropout_rate': 0.3430008553493611, 'lr': 0.0063680007197943235, 'scheduler_patience': 7, 'class_weight': 0.8057927532283918, 'activation': 'SELU', 'classification_multiplier': 5578.662991200644}. Best is trial 269 with value: 0.7750568551007148.
