[I 2026-09-14 03:14:31,048] Trial 245 finished with value: 0.7193148381672971 and parameters: {'hidden_dim': 349, 'latent_dim': 39, 'beta': 0.4552509224608129, 'gamma': 1.7959693166391921, 'dropout_rate': 0.3133367358965183, 'lr': 0.007270482659357787, 'scheduler_patience': 7, 'class_weight': 0.6751039307188987, 'activation': 'LeakyReLU', 'classification_multiplier': 12110.907195642476}. Best is trial 162 with value: 0.7725144161925771.
[I 2026-09-14 03:14:48,082] Trial 246 finished with value: 0.7461436884187309 and parameters: {'hidden_dim': 277, 'latent_dim': 38, 'beta': 0.4357304107245744, 'gamma': 1.8316650304683662, 'dropout_rate': 0.279236018030428, 'lr': 0.00785397154950615, 'scheduler_patience': 7, 'class_weight': 0.7013404207743571, 'activation': 'SELU', 'classification_multiplier': 11662.424148500771}. Best is trial 162 with value: 0.7725144161925771.
[I 2026-09-14 03:15:05,168] Trial 247 finished with value: 0.7608539167625562 and parameters: {'hidden_dim': 352, 'latent_dim': 40, 'beta': 0.5524362817790958, 'gamma': 1.7256865322665043, 'dropout_rate': 0.2882470349930843, 'lr': 0.00741503807249187, 'scheduler_patience': 7, 'class_weight': 0.7236839733124449, 'activation': 'SELU', 'classification_multiplier': 11976.215044710014}. Best is trial 162 with value: 0.7725144161925771.
[I 2026-09-14 03:15:22,274] Trial 248 finished with value: 0.7567203188789584 and parameters: {'hidden_dim': 336, 'latent_dim': 40, 'beta': 0.5625284896787948, 'gamma': 1.7323291036965567, 'dropout_rate': 0.29133359458403824, 'lr': 0.007669218280240696, 'scheduler_patience': 7, 'class_weight': 0.6889183798673753, 'activation': 'SELU', 'classification_multiplier': 11928.73668714376}. Best is trial 162 with value: 0.7725144161925771.
[I 2026-09-14 03:15:39,424] Trial 249 finished with value: 0.7535439752420884 and parameters: {'hidden_dim': 380, 'latent_dim': 39, 'beta': 0.5334305672132347, 'gamma': 1.6974836415387582, 'dropout_rate': 0.30781884762587597, 'lr': 0.008271431481822472, 'scheduler_patience': 7, 'class_weight': 0.7432010835035519, 'activation': 'ELU', 'classification_multiplier': 12087.78632003178}. Best is trial 162 with value: 0.7725144161925771.
[I 2026-09-14 03:15:56,479] Trial 250 finished with value: 0.7522839405768814 and parameters: {'hidden_dim': 318, 'latent_dim': 40, 'beta': 0.581985980273023, 'gamma': 1.7404833768102803, 'dropout_rate': 0.28699847002410633, 'lr': 0.007196049694162567, 'scheduler_patience': 7, 'class_weight': 0.7128468780958902, 'activation': 'SELU', 'classification_multiplier': 12250.323119445418}. Best is trial 162 with value: 0.7725144161925771.
[I 2026-09-14 03:16:13,563] Trial 251 finished with value: 0.7608539167625562 and parameters: {'hidden_dim': 378, 'latent_dim': 38, 'beta': 0.5055578740421564, 'gamma': 1.7946946056846511, 'dropout_rate': 0.2988955707051871, 'lr': 0.009535935278784664, 'scheduler_patience': 7, 'class_weight': 0.7286185296370234, 'activation': 'SELU', 'classification_multiplier': 11568.643047317277}. Best is trial 162 with value: 0.7725144161925771.
[I 2026-09-14 03:16:30,704] Trial 252 finished with value: 0.7375812813132928 and parameters: {'hidden_dim': 409, 'latent_dim': 39, 'beta': 0.6236288683797735, 'gamma': 1.7964196147606126, 'dropout_rate': 0.2966897221750113, 'lr': 0.009541981855644588, 'scheduler_patience': 7, 'class_weight': 0.7265336442780238, 'activation': 'SELU', 'classification_multiplier': 11456.540405950753}. Best is trial 162 with value: 0.7725144161925771.
[I 2026-09-14 03:16:47,770] Trial 253 finished with value: 0.7537553974335583 and parameters: {'hidden_dim': 359, 'latent_dim': 39, 'beta': 0.5010342371141698, 'gamma': 1.7624206836084395, 'dropout_rate': 0.28120456288700035, 'lr': 0.007366704761617143, 'scheduler_patience': 7, 'class_weight': 0.7318456500874175, 'activation': 'SELU', 'classification_multiplier': 11656.316125958785}. Best is trial 162 with value: 0.7725144161925771.
[I 2026-09-14 03:17:04,914] Trial 254 finished with value: 0.7307692307692308 and parameters: {'hidden_dim': 447, 'latent_dim': 38, 'beta': 0.5321067368327429, 'gamma': 1.8125878601785357, 'dropout_rate': 0.3218981668405379, 'lr': 0.009455366333618938, 'scheduler_patience': 7, 'class_weight': 0.6998390946119588, 'activation': 'SELU', 'classification_multiplier': 11872.44345972907}. Best is trial 162 with value: 0.7725144161925771.
[I 2026-09-14 03:17:22,061] Trial 255 finished with value: 0.7482775303204711 and parameters: {'hidden_dim': 402, 'latent_dim': 37, 'beta': 0.48619850972802137, 'gamma': 1.8457584563627747, 'dropout_rate': 0.2722425257907758, 'lr': 0.0096976093435393, 'scheduler_patience': 7, 'class_weight': 0.7629960494729979, 'activation': 'SELU', 'classification_multiplier': 12382.878250909454}. Best is trial 162 with value: 0.7725144161925771.
[I 2026-09-14 03:17:39,135] Trial 256 finished with value: 0.7394452925082778 and parameters: {'hidden_dim': 352, 'latent_dim': 38, 'beta': 0.40984334273693823, 'gamma': 1.6454936638077984, 'dropout_rate': 0.29998104380899726, 'lr': 0.00689007768487939, 'scheduler_patience': 7, 'class_weight': 0.6755032000509177, 'activation': 'SELU', 'classification_multiplier': 11566.70652898425}. Best is trial 162 with value: 0.7725144161925771.
[I 2026-09-14 03:17:56,325] Trial 257 finished with value: 0.7544935365364772 and parameters: {'hidden_dim': 490, 'latent_dim': 38, 'beta': 0.5573885023181755, 'gamma': 1.713962847606695, 'dropout_rate': 0.29013947527796136, 'lr': 0.007534840583761382, 'scheduler_patience': 7, 'class_weight': 0.7488307002118434, 'activation': 'SELU', 'classification_multiplier': 11855.486679005842}. Best is trial 162 with value: 0.7725144161925771.
[I 2026-09-14 03:18:13,417] Trial 258 finished with value: 0.7608539167625562 and parameters: {'hidden_dim': 267, 'latent_dim': 39, 'beta': 0.5139060507281756, 'gamma': 1.7526262279477476, 'dropout_rate': 0.27919443495893487, 'lr': 0.009993074719143505, 'scheduler_patience': 7, 'class_weight': 0.7293714772603613, 'activation': 'SELU', 'classification_multiplier': 11327.35601372648}. Best is trial 162 with value: 0.7725144161925771.
[I 2026-09-14 03:18:30,411] Trial 259 finished with value: 0.7411858974358975 and parameters: {'hidden_dim': 258, 'latent_dim': 40, 'beta': 0.5146151602757365, 'gamma': 1.7575262145303354, 'dropout_rate': 0.2824961368617112, 'lr': 0.007478550067734006, 'scheduler_patience': 7, 'class_weight': 0.7154040227164211, 'activation': 'SELU', 'classification_multiplier': 11236.254804736542}. Best is trial 162 with value: 0.7725144161925771.
[I 2026-09-14 03:18:47,424] Trial 260 finished with value: 0.7461436884187309 and parameters: {'hidden_dim': 283, 'latent_dim': 39, 'beta': 0.4554989568937787, 'gamma': 1.6685908887316867, 'dropout_rate': 0.2773990219599181, 'lr': 0.00997077087545709, 'scheduler_patience': 7, 'class_weight': 0.6917027447167605, 'activation': 'SELU', 'classification_multiplier': 12034.61605467117}. Best is trial 162 with value: 0.7725144161925771.
[I 2026-09-14 03:19:04,577] Trial 261 finished with value: 0.6930320150659134 and parameters: {'hidden_dim': 370, 'latent_dim': 40, 'beta': 0.5884472671340457, 'gamma': 1.8077628063057058, 'dropout_rate': 0.29381711093682206, 'lr': 0.009762643982620044, 'scheduler_patience': 7, 'class_weight': 0.7325581042239341, 'activation': 'ReLU', 'classification_multiplier': 11700.35961128572}. Best is trial 162 with value: 0.7725144161925771.
[I 2026-09-14 03:19:21,729] Trial 262 finished with value: 0.7495013183537774 and parameters: {'hidden_dim': 419, 'latent_dim': 37, 'beta': 0.38821919785638476, 'gamma': 1.728496546860969, 'dropout_rate': 0.2700530766351675, 'lr': 0.009585860096009272, 'scheduler_patience': 7, 'class_weight': 0.7135932286264574, 'activation': 'GELU', 'classification_multiplier': 11375.717005410155}. Best is trial 162 with value: 0.7725144161925771.
[I 2026-09-14 03:19:39,009] Trial 263 finished with value: 0.7564281073053003 and parameters: {'hidden_dim': 531, 'latent_dim': 39, 'beta': 0.48712383651678937, 'gamma': 1.7815792708919782, 'dropout_rate': 0.3045923344153631, 'lr': 0.00998159104743734, 'scheduler_patience': 7, 'class_weight': 0.9026127957384943, 'activation': 'SELU', 'classification_multiplier': 12250.293628265928}. Best is trial 162 with value: 0.7725144161925771.
[I 2026-09-14 03:19:56,010] Trial 264 finished with value: 0.7444030952802883 and parameters: {'hidden_dim': 246, 'latent_dim': 38, 'beta': 0.5244725688800704, 'gamma': 1.843770977259652, 'dropout_rate': 0.3437169803878046, 'lr': 0.00922950472628214, 'scheduler_patience': 7, 'class_weight': 0.7422685762800807, 'activation': 'SELU', 'classification_multiplier': 12627.988918032755}. Best is trial 162 with value: 0.7725144161925771.
[I 2026-09-14 03:20:13,114] Trial 265 finished with value: 0.7608539167625562 and parameters: {'hidden_dim': 338, 'latent_dim': 38, 'beta': 0.43438206312768546, 'gamma': 1.5949129719649442, 'dropout_rate': 0.2857572643250564, 'lr': 0.007042556821590365, 'scheduler_patience': 7, 'class_weight': 0.76411414823118, 'activation': 'SELU', 'classification_multiplier': 11879.582024552337}. Best is trial 162 with value: 0.7725144161925771.
[I 2026-09-14 03:20:30,344] Trial 266 finished with value: 0.7418672739102147 and parameters: {'hidden_dim': 607, 'latent_dim': 37, 'beta': 0.45531483620317686, 'gamma': 1.569291217641919, 'dropout_rate': 0.28682062710558753, 'lr': 0.006677043780337648, 'scheduler_patience': 7, 'class_weight': 0.7681291125526077, 'activation': 'SELU', 'classification_multiplier': 11903.092756762639}. Best is trial 162 with value: 0.7725144161925771.
[I 2026-09-14 03:20:47,440] Trial 267 finished with value: 0.7515353497243705 and parameters: {'hidden_dim': 330, 'latent_dim': 38, 'beta': 0.36046255979576813, 'gamma': 1.9640307663954109, 'dropout_rate': 0.2793981184660885, 'lr': 0.007270252168099387, 'scheduler_patience': 7, 'class_weight': 0.7762549015487028, 'activation': 'SELU', 'classification_multiplier': 11536.645391790087}. Best is trial 162 with value: 0.7725144161925771.
[I 2026-09-14 03:21:04,506] Trial 268 finished with value: 0.7606337781776378 and parameters: {'hidden_dim': 292, 'latent_dim': 39, 'beta': 0.41131792336227874, 'gamma': 1.5268562091410347, 'dropout_rate': 0.29610476311199163, 'lr': 0.009715731143988377, 'scheduler_patience': 7, 'class_weight': 0.661961532653002, 'activation': 'SELU', 'classification_multiplier': 12110.419300019543}. Best is trial 162 with value: 0.7725144161925771.
[I 2026-09-14 03:21:21,628] Trial 269 finished with value: 0.7750568551007148 and parameters: {'hidden_dim': 368, 'latent_dim': 37, 'beta': 0.4353746481263296, 'gamma': 1.5850596208752155, 'dropout_rate': 0.2654384395355252, 'lr': 0.006970458449095354, 'scheduler_patience': 7, 'class_weight': 0.7525814398216569, 'activation': 'SELU', 'classification_multiplier': 12260.943328205802}. Best is trial 269 with value: 0.7750568551007148.
[I 2026-09-14 03:21:38,708] Trial 270 finished with value: 0.7623604465709729 and parameters: {'hidden_dim': 378, 'latent_dim': 37, 'beta': 0.301721379608386, 'gamma': 1.6146650713776654, 'dropout_rate': 0.2656032129574061, 'lr': 0.007036208582244249, 'scheduler_patience': 7, 'class_weight': 0.75557977567559, 'activation': 'SELU', 'classification_multiplier': 12853.811971260964}. Best is trial 269 with value: 0.7750568551007148.
[I 2026-09-14 03:21:55,898] Trial 271 finished with value: 0.7503773679212276 and parameters: {'hidden_dim': 468, 'latent_dim': 37, 'beta': 0.30217725095719933, 'gamma': 1.6032149308195984, 'dropout_rate': 0.26768356171669677, 'lr': 0.00704162195332881, 'scheduler_patience': 7, 'class_weight': 0.7489569173641056, 'activation': 'SELU', 'classification_multiplier': 13093.232021253758}. Best is trial 269 with value: 0.7750568551007148.
[I 2026-09-14 03:22:12,955] Trial 272 finished with value: 0.7522839405768814 and parameters: {'hidden_dim': 378, 'latent_dim': 36, 'beta': 0.3849181837927199, 'gamma': 1.4649815514599946, 'dropout_rate': 0.26284221631710397, 'lr': 0.007082255686092907, 'scheduler_patience': 7, 'class_weight': 0.7245786178751676, 'activation': 'SELU', 'classification_multiplier': 12339.898150733923}. Best is trial 269 with value: 0.7750568551007148.
[I 2026-09-14 03:22:30,092] Trial 273 finished with value: 0.7429619646600778 and parameters: {'hidden_dim': 428, 'latent_dim': 38, 'beta': 0.3217150023160412, 'gamma': 1.5794145820878085, 'dropout_rate': 0.2729865414213629, 'lr': 0.0065327723167523995, 'scheduler_patience': 7, 'class_weight': 0.7596119003848968, 'activation': 'SELU', 'classification_multiplier': 12974.069369302568}. Best is trial 269 with value: 0.7750568551007148.
[I 2026-09-14 03:22:47,275] Trial 274 finished with value: 0.7139482508382965 and parameters: {'hidden_dim': 393, 'latent_dim': 37, 'beta': 0.264811945315914, 'gamma': 1.6690623185550324, 'dropout_rate': 0.2771134902437091, 'lr': 0.007067421011827552, 'scheduler_patience': 7, 'class_weight': 0.7306771537775898, 'activation': 'LeakyReLU', 'classification_multiplier': 11780.635811219485}. Best is trial 269 with value: 0.7750568551007148.
[I 2026-09-14 03:23:04,358] Trial 275 finished with value: 0.7606337781776378 and parameters: {'hidden_dim': 340, 'latent_dim': 39, 'beta': 0.4355169454325387, 'gamma': 1.617168609367957, 'dropout_rate': 0.2599749456192848, 'lr': 0.006988992621331581, 'scheduler_patience': 7, 'class_weight': 0.7007580794436618, 'activation': 'SELU', 'classification_multiplier': 12859.108944730486}. Best is trial 269 with value: 0.7750568551007148.
[I 2026-09-14 03:23:21,434] Trial 276 finished with value: 0.7533238366571701 and parameters: {'hidden_dim': 384, 'latent_dim': 40, 'beta': 0.48325914440823514, 'gamma': 1.5299098442212427, 'dropout_rate': 0.28435826722695956, 'lr': 0.007384911448878935, 'scheduler_patience': 7, 'class_weight': 0.7534741206066309, 'activation': 'SELU', 'classification_multiplier': 12038.505841997658}. Best is trial 269 with value: 0.7750568551007148.
[I 2026-09-14 03:23:38,499] Trial 277 finished with value: 0.7608539167625562 and parameters: {'hidden_dim': 298, 'latent_dim': 38, 'beta': 0.34999918692723414, 'gamma': 1.6326580157795192, 'dropout_rate': 0.25799436198881787, 'lr': 0.006941373081944975, 'scheduler_patience': 7, 'class_weight': 0.7774665660060707, 'activation': 'SELU', 'classification_multiplier': 12595.022641922855}. Best is trial 269 with value: 0.7750568551007148.
[I 2026-09-14 03:23:55,658] Trial 278 finished with value: 0.7353910002466879 and parameters: {'hidden_dim': 428, 'latent_dim': 36, 'beta': 0.5603742479956985, 'gamma': 1.5771163676003268, 'dropout_rate': 0.26791203938413943, 'lr': 0.006756794736895283, 'scheduler_patience': 7, 'class_weight': 0.7299784299415395, 'activation': 'SELU', 'classification_multiplier': 12284.551668479711}. Best is trial 269 with value: 0.7750568551007148.
[I 2026-09-14 03:24:12,804] Trial 279 finished with value: 0.7426722619085755 and parameters: {'hidden_dim': 340, 'latent_dim': 37, 'beta': 0.4389045176904296, 'gamma': 1.6025494991530067, 'dropout_rate': 0.28538856179515826, 'lr': 0.007500278115567658, 'scheduler_patience': 7, 'class_weight': 0.6867641425064293, 'activation': 'ELU', 'classification_multiplier': 11618.312231566479}. Best is trial 269 with value: 0.7750568551007148.
[I 2026-09-14 03:24:29,895] Trial 280 finished with value: 0.7608539167625562 and parameters: {'hidden_dim': 377, 'latent_dim': 38, 'beta': 0.3976301349728524, 'gamma': 1.6927307454416263, 'dropout_rate': 0.29532950347852505, 'lr': 0.006268381333408137, 'scheduler_patience': 7, 'class_weight': 0.7096817314701677, 'activation': 'SELU', 'classification_multiplier': 11894.301859250922}. Best is trial 269 with value: 0.7750568551007148.
[I 2026-09-14 03:24:46,916] Trial 281 finished with value: 0.7497341839447103 and parameters: {'hidden_dim': 274, 'latent_dim': 39, 'beta': 0.5105341850608965, 'gamma': 1.8528302994181616, 'dropout_rate': 0.2766893719529621, 'lr': 0.006860293369741784, 'scheduler_patience': 7, 'class_weight': 0.746852092353897, 'activation': 'SELU', 'classification_multiplier': 12489.009374739206}. Best is trial 269 with value: 0.7750568551007148.
[I 2026-09-14 03:25:04,109] Trial 282 finished with value: 0.7544935365364772 and parameters: {'hidden_dim': 465, 'latent_dim': 37, 'beta': 0.19594050477515068, 'gamma': 1.3691506198499461, 'dropout_rate': 0.26088206981757556, 'lr': 0.007146532570354023, 'scheduler_patience': 7, 'class_weight': 0.7786279596653229, 'activation': 'SELU', 'classification_multiplier': 13308.286542425096}. Best is trial 269 with value: 0.7750568551007148.
[I 2026-09-14 03:25:21,159] Trial 283 finished with value: 0.7687737863176459 and parameters: {'hidden_dim': 317, 'latent_dim': 40, 'beta': 0.46637752788244874, 'gamma': 1.4961481967369465, 'dropout_rate': 0.30762959571225856, 'lr': 0.009437314009050268, 'scheduler_patience': 7, 'class_weight': 0.7374016402973113, 'activation': 'SELU', 'classification_multiplier': 12167.308061471358}. Best is trial 269 with value: 0.7750568551007148.
[I 2026-09-14 03:25:38,256] Trial 284 finished with value: 0.747058226820856 and parameters: {'hidden_dim': 310, 'latent_dim': 40, 'beta': 0.481364941574053, 'gamma': 1.8163384020593272, 'dropout_rate': 0.30780461314561586, 'lr': 0.00946917592165168, 'scheduler_patience': 7, 'class_weight': 0.7249186780563435, 'activation': 'SELU', 'classification_multiplier': 12706.730879845145}. Best is trial 269 with value: 0.7750568551007148.
[I 2026-09-14 03:25:55,229] Trial 285 finished with value: 0.7687737863176459 and parameters: {'hidden_dim': 254, 'latent_dim': 40, 'beta': 0.37905198740697077, 'gamma': 1.5062526173869595, 'dropout_rate': 0.30202905461209484, 'lr': 0.009836789909954189, 'scheduler_patience': 7, 'class_weight': 0.7383715482574169, 'activation': 'SELU', 'classification_multiplier': 12156.458504237038}. Best is trial 269 with value: 0.7750568551007148.
[I 2026-09-14 03:26:12,390] Trial 286 finished with value: 0.7608539167625562 and parameters: {'hidden_dim': 411, 'latent_dim': 40, 'beta': 0.30417289537938164, 'gamma': 1.504831552673741, 'dropout_rate': 0.311282273619831, 'lr': 0.009646318246677632, 'scheduler_patience': 7, 'class_weight': 0.7449958903971949, 'activation': 'SELU', 'classification_multiplier': 12127.372234565724}. Best is trial 269 with value: 0.7750568551007148.
[I 2026-09-14 03:26:29,442] Trial 287 finished with value: 0.7687737863176459 and parameters: {'hidden_dim': 232, 'latent_dim': 40, 'beta': 0.3610554190520561, 'gamma': 1.5572906763187964, 'dropout_rate': 0.2979460601426289, 'lr': 0.009395960997186821, 'scheduler_patience': 7, 'class_weight': 0.7040240128711959, 'activation': 'SELU', 'classification_multiplier': 12270.510688167606}. Best is trial 269 with value: 0.7750568551007148.
[I 2026-09-14 03:26:46,510] Trial 288 finished with value: 0.7608539167625562 and parameters: {'hidden_dim': 246, 'latent_dim': 40, 'beta': 0.36082269940192196, 'gamma': 1.455139772200112, 'dropout_rate': 0.3169618217338562, 'lr': 0.009342768292706258, 'scheduler_patience': 7, 'class_weight': 0.680340559702207, 'activation': 'SELU', 'classification_multiplier': 12407.04753089205}. Best is trial 269 with value: 0.7750568551007148.
[I 2026-09-14 03:27:03,584] Trial 289 finished with value: 0.7042706927575347 and parameters: {'hidden_dim': 223, 'latent_dim': 40, 'beta': 0.3298575827508923, 'gamma': 1.5210422396017675, 'dropout_rate': 0.2531885309305642, 'lr': 0.009784872155385274, 'scheduler_patience': 7, 'class_weight': 0.704485454532915, 'activation': 'ReLU', 'classification_multiplier': 12216.308555810812}. Best is trial 269 with value: 0.7750568551007148.
[I 2026-09-14 03:27:20,611] Trial 290 finished with value: 0.6776396641136565 and parameters: {'hidden_dim': 293, 'latent_dim': 29, 'beta': 0.3910543734723373, 'gamma': 1.5566227297474435, 'dropout_rate': 0.30259958545893495, 'lr': 0.009313130276802329, 'scheduler_patience': 7, 'class_weight': 0.7025470897279015, 'activation': 'GELU', 'classification_multiplier': 12524.943069931194}. Best is trial 269 with value: 0.7750568551007148.
[I 2026-09-14 03:27:37,637] Trial 291 finished with value: 0.749942358884068 and parameters: {'hidden_dim': 233, 'latent_dim': 40, 'beta': 0.37288418267667417, 'gamma': 1.5423342326084966, 'dropout_rate': 0.2925443163649894, 'lr': 0.009452294757432204, 'scheduler_patience': 7, 'class_weight': 0.7606453073703696, 'activation': 'SELU', 'classification_multiplier': 12261.822312010934}. Best is trial 269 with value: 0.7750568551007148.
[I 2026-09-14 03:27:54,863] Trial 292 finished with value: 0.742334921532208 and parameters: {'hidden_dim': 669, 'latent_dim': 39, 'beta': 0.25899682051917045, 'gamma': 1.4190115975776707, 'dropout_rate': 0.25013970575681393, 'lr': 0.009754115135619457, 'scheduler_patience': 7, 'class_weight': 0.7101190595932536, 'activation': 'SELU', 'classification_multiplier': 12115.202622598847}. Best is trial 269 with value: 0.7750568551007148.
[I 2026-09-14 03:28:12,345] Trial 293 finished with value: 0.6615275562643984 and parameters: {'hidden_dim': 976, 'latent_dim': 21, 'beta': 0.4103548709460418, 'gamma': 1.3131979683899877, 'dropout_rate': 0.30729447583220554, 'lr': 0.009194651965293614, 'scheduler_patience': 7, 'class_weight': 0.6476815608395733, 'activation': 'SELU', 'classification_multiplier': 12748.297804188147}. Best is trial 269 with value: 0.7750568551007148.
[I 2026-09-14 03:28:29,427] Trial 294 finished with value: 0.7608539167625562 and parameters: {'hidden_dim': 311, 'latent_dim': 27, 'beta': 0.29288970093370964, 'gamma': 1.5083219724584473, 'dropout_rate': 0.2562324083743024, 'lr': 0.009576932540035069, 'scheduler_patience': 7, 'class_weight': 0.6846476168951878, 'activation': 'SELU', 'classification_multiplier': 12005.479148971883}. Best is trial 269 with value: 0.7750568551007148.
