[I 2026-09-14 02:31:22,805] Trial 95 finished with value: 0.7505737415719063 and parameters: {'hidden_dim': 373, 'latent_dim': 13, 'beta': 1.5356118992852459, 'gamma': 1.575738914437993, 'dropout_rate': 0.19687124530611086, 'lr': 0.0068937825995465446, 'scheduler_patience': 7, 'class_weight': 0.8000569668806858, 'activation': 'SELU', 'classification_multiplier': 8852.976616263255}. Best is trial 67 with value: 0.762929989429073.
[I 2026-09-14 02:31:40,325] Trial 96 finished with value: 0.7432743688962594 and parameters: {'hidden_dim': 553, 'latent_dim': 16, 'beta': 1.7289433438351838, 'gamma': 1.6371010342637557, 'dropout_rate': 0.3878931693232956, 'lr': 0.001581916341952132, 'scheduler_patience': 7, 'class_weight': 0.8836808801186686, 'activation': 'SELU', 'classification_multiplier': 7817.50240362595}. Best is trial 67 with value: 0.762929989429073.
[I 2026-09-14 02:31:57,601] Trial 97 finished with value: 0.7555004135649298 and parameters: {'hidden_dim': 290, 'latent_dim': 10, 'beta': 1.1562651266253574, 'gamma': 1.8179749835490195, 'dropout_rate': 0.26939819851627717, 'lr': 0.009160436165779143, 'scheduler_patience': 7, 'class_weight': 0.4658133317258317, 'activation': 'SELU', 'classification_multiplier': 8576.846562180253}. Best is trial 67 with value: 0.762929989429073.
[I 2026-09-14 02:32:14,862] Trial 98 finished with value: 0.7105164470159648 and parameters: {'hidden_dim': 222, 'latent_dim': 10, 'beta': 1.150133980221168, 'gamma': 0.2552363022093356, 'dropout_rate': 0.27130466567487116, 'lr': 0.009336180819089834, 'scheduler_patience': 7, 'class_weight': 0.3922809607641354, 'activation': 'LeakyReLU', 'classification_multiplier': 9761.31469547234}. Best is trial 67 with value: 0.762929989429073.
[I 2026-09-14 02:32:32,233] Trial 99 finished with value: 0.740359830910403 and parameters: {'hidden_dim': 306, 'latent_dim': 8, 'beta': 1.3367415500477153, 'gamma': 1.9611790177813915, 'dropout_rate': 0.23901109842356752, 'lr': 0.009775531282417711, 'scheduler_patience': 5, 'class_weight': 0.46172661984461455, 'activation': 'SELU', 'classification_multiplier': 8647.19188748709}. Best is trial 67 with value: 0.762929989429073.
[I 2026-09-14 02:32:49,377] Trial 100 finished with value: 0.7526294368399631 and parameters: {'hidden_dim': 169, 'latent_dim': 11, 'beta': 1.2804165839033081, 'gamma': 1.8136128430255283, 'dropout_rate': 0.28353978217685627, 'lr': 0.009078907316853057, 'scheduler_patience': 6, 'class_weight': 0.5213847220006842, 'activation': 'SELU', 'classification_multiplier': 7371.212347255193}. Best is trial 67 with value: 0.762929989429073.
[I 2026-09-14 02:33:06,688] Trial 101 finished with value: 0.7561973998755608 and parameters: {'hidden_dim': 267, 'latent_dim': 13, 'beta': 1.4981181919649815, 'gamma': 1.9227190005778452, 'dropout_rate': 0.22024364827672752, 'lr': 0.008478377502882684, 'scheduler_patience': 7, 'class_weight': 0.8317894355517409, 'activation': 'SELU', 'classification_multiplier': 8971.69477874459}. Best is trial 67 with value: 0.762929989429073.
[I 2026-09-14 02:33:23,964] Trial 102 finished with value: 0.7507385088030251 and parameters: {'hidden_dim': 278, 'latent_dim': 13, 'beta': 1.3890017250140951, 'gamma': 1.917322966595804, 'dropout_rate': 0.2565658726524557, 'lr': 0.008480964482009383, 'scheduler_patience': 7, 'class_weight': 0.47741353757845295, 'activation': 'SELU', 'classification_multiplier': 8203.50564662312}. Best is trial 67 with value: 0.762929989429073.
[I 2026-09-14 02:33:41,307] Trial 103 finished with value: 0.7344477819859824 and parameters: {'hidden_dim': 350, 'latent_dim': 8, 'beta': 1.640869365249967, 'gamma': 1.9967219256212636, 'dropout_rate': 0.22464222327241434, 'lr': 0.009572481245167701, 'scheduler_patience': 7, 'class_weight': 0.8314316368415026, 'activation': 'SELU', 'classification_multiplier': 8952.815213647904}. Best is trial 67 with value: 0.762929989429073.
[I 2026-09-14 02:33:58,786] Trial 104 finished with value: 0.747058226820856 and parameters: {'hidden_dim': 406, 'latent_dim': 14, 'beta': 1.478972955272099, 'gamma': 1.8594485917532098, 'dropout_rate': 0.24483857050557117, 'lr': 0.008933781220001926, 'scheduler_patience': 7, 'class_weight': 0.43147358629909505, 'activation': 'SELU', 'classification_multiplier': 9309.143421156403}. Best is trial 67 with value: 0.762929989429073.
[I 2026-09-14 02:34:16,108] Trial 105 finished with value: 0.7366808055332644 and parameters: {'hidden_dim': 247, 'latent_dim': 9, 'beta': 0.9723571336695993, 'gamma': 1.7418238933801804, 'dropout_rate': 0.2674608083636475, 'lr': 0.009155346508228026, 'scheduler_patience': 7, 'class_weight': 0.5423747082380634, 'activation': 'ELU', 'classification_multiplier': 9776.831268456976}. Best is trial 67 with value: 0.762929989429073.
[I 2026-09-14 02:34:33,553] Trial 106 finished with value: 0.7499317900392469 and parameters: {'hidden_dim': 456, 'latent_dim': 11, 'beta': 1.5039470803134134, 'gamma': 1.1179452927412825, 'dropout_rate': 0.33178990960880195, 'lr': 0.007811437432421269, 'scheduler_patience': 7, 'class_weight': 0.7016049950227479, 'activation': 'SELU', 'classification_multiplier': 10549.453071858015}. Best is trial 67 with value: 0.762929989429073.
[I 2026-09-14 02:34:50,770] Trial 107 finished with value: 0.7377499295972965 and parameters: {'hidden_dim': 198, 'latent_dim': 6, 'beta': 1.2415554831353113, 'gamma': 1.5054055467550502, 'dropout_rate': 0.23084449909490024, 'lr': 0.0034542397269762735, 'scheduler_patience': 6, 'class_weight': 0.7542717474854644, 'activation': 'SELU', 'classification_multiplier': 8603.494148035557}. Best is trial 67 with value: 0.762929989429073.
[I 2026-09-14 02:35:07,969] Trial 108 finished with value: 0.7572242572242572 and parameters: {'hidden_dim': 154, 'latent_dim': 14, 'beta': 1.4458738292906566, 'gamma': 1.9018509574884508, 'dropout_rate': 0.2149270620178469, 'lr': 0.009800255429305372, 'scheduler_patience': 7, 'class_weight': 0.48870056903627046, 'activation': 'SELU', 'classification_multiplier': 7816.074088213123}. Best is trial 67 with value: 0.762929989429073.
[I 2026-09-14 02:35:25,162] Trial 109 finished with value: 0.7444894286999549 and parameters: {'hidden_dim': 145, 'latent_dim': 14, 'beta': 0.3249954412572206, 'gamma': 1.927004292615929, 'dropout_rate': 0.2188733581074614, 'lr': 0.009805310335021387, 'scheduler_patience': 7, 'class_weight': 0.4851575286332487, 'activation': 'SELU', 'classification_multiplier': 7639.756993796236}. Best is trial 67 with value: 0.762929989429073.
[I 2026-09-14 02:35:42,402] Trial 110 finished with value: 0.7034653043848446 and parameters: {'hidden_dim': 163, 'latent_dim': 17, 'beta': 1.437293217801857, 'gamma': 1.9044844372926364, 'dropout_rate': 0.2512019322967097, 'lr': 0.009364449469664046, 'scheduler_patience': 6, 'class_weight': 0.3664472849041886, 'activation': 'ReLU', 'classification_multiplier': 7883.724462367654}. Best is trial 67 with value: 0.762929989429073.
[I 2026-09-14 02:35:59,755] Trial 111 finished with value: 0.7307835300678501 and parameters: {'hidden_dim': 309, 'latent_dim': 13, 'beta': 1.3942130660469414, 'gamma': 1.8191527829029308, 'dropout_rate': 0.18642541986701566, 'lr': 0.008706382146717557, 'scheduler_patience': 7, 'class_weight': 0.40598900401870397, 'activation': 'SELU', 'classification_multiplier': 9997.80443586458}. Best is trial 67 with value: 0.762929989429073.
[I 2026-09-14 02:36:16,925] Trial 112 finished with value: 0.7466422466422467 and parameters: {'hidden_dim': 256, 'latent_dim': 14, 'beta': 1.5512153898287535, 'gamma': 1.9695317470947424, 'dropout_rate': 0.20311350849573293, 'lr': 0.009567057790911083, 'scheduler_patience': 7, 'class_weight': 0.4458898855824806, 'activation': 'SELU', 'classification_multiplier': 8306.52121825967}. Best is trial 67 with value: 0.762929989429073.
[I 2026-09-14 02:36:34,287] Trial 113 finished with value: 0.7399375487900078 and parameters: {'hidden_dim': 383, 'latent_dim': 16, 'beta': 0.8664158273656835, 'gamma': 1.845097243951125, 'dropout_rate': 0.2152098265252705, 'lr': 0.004644187740550654, 'scheduler_patience': 7, 'class_weight': 0.43015830753438394, 'activation': 'SELU', 'classification_multiplier': 11481.437928481668}. Best is trial 67 with value: 0.762929989429073.
[I 2026-09-14 02:36:51,492] Trial 114 finished with value: 0.7459137738300251 and parameters: {'hidden_dim': 206, 'latent_dim': 12, 'beta': 1.0523197198732281, 'gamma': 1.671640873446236, 'dropout_rate': 0.15480784985970553, 'lr': 0.005308952273729298, 'scheduler_patience': 7, 'class_weight': 0.8674318684164818, 'activation': 'SELU', 'classification_multiplier': 8155.277991647888}. Best is trial 67 with value: 0.762929989429073.
[I 2026-09-14 02:37:09,744] Trial 115 finished with value: 0.6827485380116958 and parameters: {'hidden_dim': 1462, 'latent_dim': 15, 'beta': 0.4191497970647623, 'gamma': 1.772851873360294, 'dropout_rate': 0.35380421346591895, 'lr': 0.008148937401262395, 'scheduler_patience': 7, 'class_weight': 0.6764331005684632, 'activation': 'GELU', 'classification_multiplier': 7065.702038116721}. Best is trial 67 with value: 0.762929989429073.
[I 2026-09-14 02:37:27,824] Trial 116 finished with value: 0.6036150983519405 and parameters: {'hidden_dim': 1311, 'latent_dim': 17, 'beta': 1.4964909848818932, 'gamma': 1.8685570368577593, 'dropout_rate': 0.4312766485029656, 'lr': 0.009915482117525487, 'scheduler_patience': 7, 'class_weight': 0.5882314465335337, 'activation': 'SELU', 'classification_multiplier': 9154.41731032522}. Best is trial 67 with value: 0.762929989429073.
[I 2026-09-14 02:37:46,792] Trial 117 finished with value: 0.6585931914425562 and parameters: {'hidden_dim': 1812, 'latent_dim': 12, 'beta': 1.5943661299178444, 'gamma': 1.71843589290531, 'dropout_rate': 0.1958478906698175, 'lr': 0.00922406351820153, 'scheduler_patience': 4, 'class_weight': 0.8439807546200422, 'activation': 'SELU', 'classification_multiplier': 7481.913916880119}. Best is trial 67 with value: 0.762929989429073.
[I 2026-09-14 02:38:04,421] Trial 118 finished with value: 0.7258623975605109 and parameters: {'hidden_dim': 838, 'latent_dim': 40, 'beta': 1.6510195669915189, 'gamma': 1.618036521171606, 'dropout_rate': 0.23478925412566298, 'lr': 0.008965066611819875, 'scheduler_patience': 7, 'class_weight': 0.543427719500192, 'activation': 'SELU', 'classification_multiplier': 7873.841583378457}. Best is trial 67 with value: 0.762929989429073.
[I 2026-09-14 02:38:21,768] Trial 119 finished with value: 0.7449052854558577 and parameters: {'hidden_dim': 356, 'latent_dim': 11, 'beta': 1.3021987813488298, 'gamma': 1.8015557125272494, 'dropout_rate': 0.16779581049005113, 'lr': 0.009762947396953112, 'scheduler_patience': 7, 'class_weight': 0.5007233108410525, 'activation': 'SELU', 'classification_multiplier': 10957.204465890542}. Best is trial 67 with value: 0.762929989429073.
[I 2026-09-14 02:38:39,052] Trial 120 finished with value: 0.7363375002187654 and parameters: {'hidden_dim': 262, 'latent_dim': 7, 'beta': 1.1822349822849971, 'gamma': 0.6032990661387176, 'dropout_rate': 0.20904926313697078, 'lr': 0.003925019555931742, 'scheduler_patience': 2, 'class_weight': 0.9045390310110218, 'activation': 'SELU', 'classification_multiplier': 9588.582910184596}. Best is trial 67 with value: 0.762929989429073.
[I 2026-09-14 02:38:56,418] Trial 121 finished with value: 0.7589299148385544 and parameters: {'hidden_dim': 311, 'latent_dim': 15, 'beta': 1.5645848570647776, 'gamma': 1.8885956127212566, 'dropout_rate': 0.18195806703058454, 'lr': 0.00854684917219113, 'scheduler_patience': 7, 'class_weight': 0.7866594657176184, 'activation': 'SELU', 'classification_multiplier': 8503.248502942297}. Best is trial 67 with value: 0.762929989429073.
[I 2026-09-14 02:39:13,816] Trial 122 finished with value: 0.7589299148385544 and parameters: {'hidden_dim': 312, 'latent_dim': 15, 'beta': 1.5465843009448939, 'gamma': 1.8887717957572354, 'dropout_rate': 0.18608784369761933, 'lr': 0.00843859364459276, 'scheduler_patience': 7, 'class_weight': 0.730002310591636, 'activation': 'SELU', 'classification_multiplier': 8383.345563154659}. Best is trial 67 with value: 0.762929989429073.
[I 2026-09-14 02:39:31,202] Trial 123 finished with value: 0.754636144729024 and parameters: {'hidden_dim': 336, 'latent_dim': 13, 'beta': 1.5570473076426916, 'gamma': 1.9520430299359877, 'dropout_rate': 0.1843725042205688, 'lr': 0.00846890480014618, 'scheduler_patience': 7, 'class_weight': 0.7772482355466661, 'activation': 'SELU', 'classification_multiplier': 8617.735389688807}. Best is trial 67 with value: 0.762929989429073.
[I 2026-09-14 02:39:48,655] Trial 124 finished with value: 0.7468486029889538 and parameters: {'hidden_dim': 433, 'latent_dim': 16, 'beta': 1.5061889605914178, 'gamma': 1.8824168610389649, 'dropout_rate': 0.22523229951491408, 'lr': 0.009452757829542047, 'scheduler_patience': 7, 'class_weight': 0.7979864983558911, 'activation': 'SELU', 'classification_multiplier': 8921.358077105624}. Best is trial 67 with value: 0.762929989429073.
[I 2026-09-14 02:40:06,005] Trial 125 finished with value: 0.721712899982256 and parameters: {'hidden_dim': 229, 'latent_dim': 14, 'beta': 1.3656854705539008, 'gamma': 1.905797307003717, 'dropout_rate': 0.1933588010239434, 'lr': 0.008783023304603678, 'scheduler_patience': 5, 'class_weight': 0.7301879125464331, 'activation': 'LeakyReLU', 'classification_multiplier': 8339.468523578147}. Best is trial 67 with value: 0.762929989429073.
[I 2026-09-14 02:40:23,334] Trial 126 finished with value: 0.7468486029889538 and parameters: {'hidden_dim': 280, 'latent_dim': 18, 'beta': 1.4442271580674533, 'gamma': 1.9245505712121065, 'dropout_rate': 0.1795707274867032, 'lr': 0.0005756495398118689, 'scheduler_patience': 7, 'class_weight': 0.757690107031362, 'activation': 'SELU', 'classification_multiplier': 8037.475755748306}. Best is trial 67 with value: 0.762929989429073.
[I 2026-09-14 02:40:40,562] Trial 127 finished with value: 0.7505843104167272 and parameters: {'hidden_dim': 130, 'latent_dim': 14, 'beta': 1.703945487336986, 'gamma': 0.8835140926290213, 'dropout_rate': 0.4007392844017885, 'lr': 0.00913767865315255, 'scheduler_patience': 7, 'class_weight': 0.8204119300481527, 'activation': 'SELU', 'classification_multiplier': 7721.645159900407}. Best is trial 67 with value: 0.762929989429073.
[I 2026-09-14 02:40:58,081] Trial 128 finished with value: 0.7482103005535751 and parameters: {'hidden_dim': 389, 'latent_dim': 10, 'beta': 1.6066963908481957, 'gamma': 1.9847730823591725, 'dropout_rate': 0.2032889591669924, 'lr': 0.008032585605094192, 'scheduler_patience': 7, 'class_weight': 0.6292153138154108, 'activation': 'ELU', 'classification_multiplier': 8455.814138787027}. Best is trial 67 with value: 0.762929989429073.
[I 2026-09-14 02:41:15,339] Trial 129 finished with value: 0.7371794871794872 and parameters: {'hidden_dim': 194, 'latent_dim': 16, 'beta': 1.5389265908553866, 'gamma': 1.7557250840194367, 'dropout_rate': 0.36716553646424993, 'lr': 0.008599962651177405, 'scheduler_patience': 7, 'class_weight': 0.6723700927325611, 'activation': 'SELU', 'classification_multiplier': 8771.092491651953}. Best is trial 67 with value: 0.762929989429073.
[I 2026-09-14 02:41:33,282] Trial 130 finished with value: 0.6619764900466655 and parameters: {'hidden_dim': 1194, 'latent_dim': 17, 'beta': 1.4725115748480027, 'gamma': 1.8563800027040738, 'dropout_rate': 0.21568383192922136, 'lr': 0.008942245231075245, 'scheduler_patience': 7, 'class_weight': 0.7667372737803702, 'activation': 'SELU', 'classification_multiplier': 8055.980044494897}. Best is trial 67 with value: 0.762929989429073.
[I 2026-09-14 02:41:50,703] Trial 131 finished with value: 0.7307615919333893 and parameters: {'hidden_dim': 332, 'latent_dim': 13, 'beta': 1.556609115788545, 'gamma': 1.9625320409547813, 'dropout_rate': 0.18514598860049342, 'lr': 0.008358242911686263, 'scheduler_patience': 7, 'class_weight': 0.775427672449214, 'activation': 'SELU', 'classification_multiplier': 8694.387943497934}. Best is trial 67 with value: 0.762929989429073.
[I 2026-09-14 02:42:08,092] Trial 132 finished with value: 0.7262103944296907 and parameters: {'hidden_dim': 332, 'latent_dim': 15, 'beta': 1.5832268580124031, 'gamma': 1.9378707162603108, 'dropout_rate': 0.187674535834417, 'lr': 0.008463741494788596, 'scheduler_patience': 7, 'class_weight': 0.7920193160077599, 'activation': 'SELU', 'classification_multiplier': 8390.752026964874}. Best is trial 67 with value: 0.762929989429073.
[I 2026-09-14 02:42:25,400] Trial 133 finished with value: 0.7556603773584906 and parameters: {'hidden_dim': 282, 'latent_dim': 13, 'beta': 1.6785674515153948, 'gamma': 0.13546988313935993, 'dropout_rate': 0.16572874794069037, 'lr': 0.00965734706340635, 'scheduler_patience': 7, 'class_weight': 0.73071568199099, 'activation': 'SELU', 'classification_multiplier': 9050.93543914223}. Best is trial 67 with value: 0.762929989429073.
[I 2026-09-14 02:42:42,645] Trial 134 finished with value: 0.7327935222672064 and parameters: {'hidden_dim': 247, 'latent_dim': 12, 'beta': 1.7621093710816822, 'gamma': 0.5091138324020666, 'dropout_rate': 0.14299140656586876, 'lr': 0.009999824971814775, 'scheduler_patience': 7, 'class_weight': 0.7370713698424539, 'activation': 'SELU', 'classification_multiplier': 9408.467206930462}. Best is trial 67 with value: 0.762929989429073.
[I 2026-09-14 02:42:59,965] Trial 135 finished with value: 0.7389937106918238 and parameters: {'hidden_dim': 290, 'latent_dim': 15, 'beta': 0.19141490557114837, 'gamma': 1.8338964342344262, 'dropout_rate': 0.1521004484004255, 'lr': 0.009707589203568439, 'scheduler_patience': 7, 'class_weight': 0.8104091729056834, 'activation': 'SELU', 'classification_multiplier': 9105.155857331865}. Best is trial 67 with value: 0.762929989429073.
[I 2026-09-14 02:43:17,247] Trial 136 finished with value: 0.7585339405768815 and parameters: {'hidden_dim': 205, 'latent_dim': 18, 'beta': 1.6877947285016712, 'gamma': 0.20694002502723785, 'dropout_rate': 0.1598397461870357, 'lr': 0.009311011461514331, 'scheduler_patience': 5, 'class_weight': 0.7178107506325969, 'activation': 'SELU', 'classification_multiplier': 10263.073010403179}. Best is trial 67 with value: 0.762929989429073.
[I 2026-09-14 02:43:34,502] Trial 137 finished with value: 0.744923285586916 and parameters: {'hidden_dim': 229, 'latent_dim': 18, 'beta': 1.675526742645672, 'gamma': 0.6718397061688601, 'dropout_rate': 0.12613586816384773, 'lr': 0.009334824680468085, 'scheduler_patience': 5, 'class_weight': 0.7050821869812003, 'activation': 'SELU', 'classification_multiplier': 9613.094810780625}. Best is trial 67 with value: 0.762929989429073.
[I 2026-09-14 02:43:51,673] Trial 138 finished with value: 0.731813910083266 and parameters: {'hidden_dim': 185, 'latent_dim': 20, 'beta': 1.7289686193540519, 'gamma': 0.36582451358422385, 'dropout_rate': 0.16508019888177392, 'lr': 0.009507752791068195, 'scheduler_patience': 5, 'class_weight': 0.7301029803925609, 'activation': 'SELU', 'classification_multiplier': 9204.603373666241}. Best is trial 67 with value: 0.762929989429073.
[I 2026-09-14 02:44:09,086] Trial 139 finished with value: 0.7547458389563652 and parameters: {'hidden_dim': 405, 'latent_dim': 19, 'beta': 1.8074096501975028, 'gamma': 0.19064646145932918, 'dropout_rate': 0.17431583104578444, 'lr': 0.009211908410005042, 'scheduler_patience': 5, 'class_weight': 0.71237703361775, 'activation': 'SELU', 'classification_multiplier': 10157.65750754212}. Best is trial 67 with value: 0.762929989429073.
[I 2026-09-14 02:44:26,422] Trial 140 finished with value: 0.7223080002287414 and parameters: {'hidden_dim': 282, 'latent_dim': 17, 'beta': 1.6268904495919594, 'gamma': 0.11676677477507685, 'dropout_rate': 0.24373573430268092, 'lr': 0.009699396573013518, 'scheduler_patience': 5, 'class_weight': 0.6879948076995018, 'activation': 'ReLU', 'classification_multiplier': 9944.451826169663}. Best is trial 67 with value: 0.762929989429073.
[I 2026-09-14 02:44:43,557] Trial 141 finished with value: 0.7527139086225482 and parameters: {'hidden_dim': 168, 'latent_dim': 16, 'beta': 1.6869505428885823, 'gamma': 0.17361111731144907, 'dropout_rate': 0.1976870224063531, 'lr': 0.00877018757265386, 'scheduler_patience': 5, 'class_weight': 0.8319502656015451, 'activation': 'SELU', 'classification_multiplier': 10337.3234623518}. Best is trial 67 with value: 0.762929989429073.
[I 2026-09-14 02:45:00,874] Trial 142 finished with value: 0.7293568013906997 and parameters: {'hidden_dim': 367, 'latent_dim': 15, 'beta': 1.5033985646431947, 'gamma': 0.16209657666185362, 'dropout_rate': 0.45651012518120787, 'lr': 0.009440896168532364, 'scheduler_patience': 7, 'class_weight': 0.4553664329436488, 'activation': 'SELU', 'classification_multiplier': 10638.737286036221}. Best is trial 67 with value: 0.762929989429073.
[I 2026-09-14 02:45:18,517] Trial 143 finished with value: 0.685823754789272 and parameters: {'hidden_dim': 1003, 'latent_dim': 14, 'beta': 0.5288867115505184, 'gamma': 0.34768107845977725, 'dropout_rate': 0.4875292391140259, 'lr': 0.009020259309295082, 'scheduler_patience': 3, 'class_weight': 0.7523111136383848, 'activation': 'SELU', 'classification_multiplier': 8960.710700442132}. Best is trial 67 with value: 0.762929989429073.
[I 2026-09-14 02:45:35,639] Trial 144 finished with value: 0.7394698620188817 and parameters: {'hidden_dim': 216, 'latent_dim': 13, 'beta': 1.4524817036043138, 'gamma': 0.2217972503924081, 'dropout_rate': 0.41525689647643, 'lr': 0.009858932799414282, 'scheduler_patience': 4, 'class_weight': 0.8554677537835137, 'activation': 'SELU', 'classification_multiplier': 10269.80176836269}. Best is trial 67 with value: 0.762929989429073.
