[I 2026-09-14 02:03:11,513] A new study created in RDB with name: chime_first_svae_opt_f1
[I 2026-09-14 02:03:30,204] Trial 0 finished with value: 0.658160552897395 and parameters: {'hidden_dim': 425, 'latent_dim': 25, 'beta': 1.689000528980444, 'gamma': 1.1986227033166514, 'dropout_rate': 0.29858199692644916, 'lr': 0.008654537451024935, 'scheduler_patience': 7, 'class_weight': 0.11872126847217947, 'activation': 'ReLU', 'classification_multiplier': 10811.261573129203}. Best is trial 0 with value: 0.658160552897395.
[I 2026-09-14 02:03:47,317] Trial 1 finished with value: 0.7548667265648398 and parameters: {'hidden_dim': 255, 'latent_dim': 5, 'beta': 1.3603833899852602, 'gamma': 1.5219301227911621, 'dropout_rate': 0.3906401707977847, 'lr': 0.004719575762647934, 'scheduler_patience': 7, 'class_weight': 0.4559174897594633, 'activation': 'SELU', 'classification_multiplier': 11055.238017343969}. Best is trial 1 with value: 0.7548667265648398.
[I 2026-09-14 02:04:05,648] Trial 2 finished with value: 0.6421448921448921 and parameters: {'hidden_dim': 1528, 'latent_dim': 23, 'beta': 0.11215663675147035, 'gamma': 0.6371238319614159, 'dropout_rate': 0.15044091519218275, 'lr': 0.008803899938089312, 'scheduler_patience': 4, 'class_weight': 0.40678066960900044, 'activation': 'ELU', 'classification_multiplier': 14981.313931039771}. Best is trial 1 with value: 0.7548667265648398.
[I 2026-09-14 02:04:23,116] Trial 3 finished with value: 0.7137450120500968 and parameters: {'hidden_dim': 458, 'latent_dim': 13, 'beta': 0.35233012509989636, 'gamma': 1.9218143584103713, 'dropout_rate': 0.25596813582330835, 'lr': 0.0031308273133310027, 'scheduler_patience': 3, 'class_weight': 0.7096719918997068, 'activation': 'ReLU', 'classification_multiplier': 13095.76065736522}. Best is trial 1 with value: 0.7548667265648398.
/home/ra0438/.conda/envs/frb_env/lib/python3.10/site-packages/sklearn/metrics/_classification.py:1731: UndefinedMetricWarning: Precision is ill-defined and being set to 0.0 in labels with no predicted samples. Use `zero_division` parameter to control this behavior.
  _warn_prf(average, modifier, f"{metric.capitalize()} is", result.shape[0])
/home/ra0438/.conda/envs/frb_env/lib/python3.10/site-packages/sklearn/metrics/_classification.py:1731: UndefinedMetricWarning: Precision is ill-defined and being set to 0.0 in labels with no predicted samples. Use `zero_division` parameter to control this behavior.
  _warn_prf(average, modifier, f"{metric.capitalize()} is", result.shape[0])
/home/ra0438/.conda/envs/frb_env/lib/python3.10/site-packages/sklearn/metrics/_classification.py:1731: UndefinedMetricWarning: Precision is ill-defined and being set to 0.0 in labels with no predicted samples. Use `zero_division` parameter to control this behavior.
  _warn_prf(average, modifier, f"{metric.capitalize()} is", result.shape[0])
[I 2026-09-14 02:04:41,426] Trial 4 finished with value: 0.020833333333333332 and parameters: {'hidden_dim': 1540, 'latent_dim': 25, 'beta': 0.8309190564143895, 'gamma': 0.1984391477726384, 'dropout_rate': 0.26373004941994915, 'lr': 0.009931547946571648, 'scheduler_patience': 7, 'class_weight': 0.12107491021769698, 'activation': 'SELU', 'classification_multiplier': 8793.586790873309}. Best is trial 1 with value: 0.7548667265648398.
[I 2026-09-14 02:04:58,688] Trial 5 finished with value: 0.6746480643539466 and parameters: {'hidden_dim': 318, 'latent_dim': 39, 'beta': 0.24536063093153196, 'gamma': 1.7769689208053119, 'dropout_rate': 0.25800912140997856, 'lr': 0.007421739434098419, 'scheduler_patience': 5, 'class_weight': 0.24316310826807108, 'activation': 'SELU', 'classification_multiplier': 9096.708987830258}. Best is trial 1 with value: 0.7548667265648398.
/home/ra0438/.conda/envs/frb_env/lib/python3.10/site-packages/sklearn/metrics/_classification.py:1731: UndefinedMetricWarning: Precision is ill-defined and being set to 0.0 in labels with no predicted samples. Use `zero_division` parameter to control this behavior.
  _warn_prf(average, modifier, f"{metric.capitalize()} is", result.shape[0])
/home/ra0438/.conda/envs/frb_env/lib/python3.10/site-packages/sklearn/metrics/_classification.py:1731: UndefinedMetricWarning: Precision is ill-defined and being set to 0.0 in labels with no predicted samples. Use `zero_division` parameter to control this behavior.
  _warn_prf(average, modifier, f"{metric.capitalize()} is", result.shape[0])
/home/ra0438/.conda/envs/frb_env/lib/python3.10/site-packages/sklearn/metrics/_classification.py:1731: UndefinedMetricWarning: Precision is ill-defined and being set to 0.0 in labels with no predicted samples. Use `zero_division` parameter to control this behavior.
  _warn_prf(average, modifier, f"{metric.capitalize()} is", result.shape[0])
[I 2026-09-14 02:05:16,178] Trial 6 finished with value: 0.109697933227345 and parameters: {'hidden_dim': 751, 'latent_dim': 30, 'beta': 1.2972498440592863, 'gamma': 0.3150811322646323, 'dropout_rate': 0.4488368101516875, 'lr': 0.009846235597947674, 'scheduler_patience': 4, 'class_weight': 0.1345571374793294, 'activation': 'SELU', 'classification_multiplier': 9010.8041993766}. Best is trial 1 with value: 0.7548667265648398.
[I 2026-09-14 02:05:33,800] Trial 7 finished with value: 0.7092352092352092 and parameters: {'hidden_dim': 781, 'latent_dim': 23, 'beta': 0.5710642337834035, 'gamma': 0.276299217368397, 'dropout_rate': 0.28265553976869306, 'lr': 0.001001921136484559, 'scheduler_patience': 4, 'class_weight': 0.512341848031568, 'activation': 'ReLU', 'classification_multiplier': 14536.677801570875}. Best is trial 1 with value: 0.7548667265648398.
[I 2026-09-14 02:05:53,402] Trial 8 finished with value: 0.6974527204160883 and parameters: {'hidden_dim': 2015, 'latent_dim': 26, 'beta': 0.1794664209909585, 'gamma': 0.3033582453756401, 'dropout_rate': 0.15167294929548378, 'lr': 0.008878092762869591, 'scheduler_patience': 5, 'class_weight': 0.9510748937607731, 'activation': 'ReLU', 'classification_multiplier': 10359.685786494123}. Best is trial 1 with value: 0.7548667265648398.
[I 2026-09-14 02:06:10,782] Trial 9 finished with value: 0.5706612611374516 and parameters: {'hidden_dim': 550, 'latent_dim': 25, 'beta': 0.21829247755376258, 'gamma': 1.8018816131313362, 'dropout_rate': 0.19418423513466787, 'lr': 0.00994308839236057, 'scheduler_patience': 3, 'class_weight': 0.27525059945672103, 'activation': 'GELU', 'classification_multiplier': 7295.0760481225425}. Best is trial 1 with value: 0.7548667265648398.
[I 2026-09-14 02:06:28,539] Trial 10 finished with value: 0.736783277446908 and parameters: {'hidden_dim': 1170, 'latent_dim': 6, 'beta': 1.9709335373107284, 'gamma': 1.2436667392644407, 'dropout_rate': 0.4734868557886941, 'lr': 0.005169154171990322, 'scheduler_patience': 2, 'class_weight': 0.6885898586602573, 'activation': 'LeakyReLU', 'classification_multiplier': 5288.964657522227}. Best is trial 1 with value: 0.7548667265648398.
[I 2026-09-14 02:06:46,418] Trial 11 finished with value: 0.7470396877033182 and parameters: {'hidden_dim': 1141, 'latent_dim': 6, 'beta': 1.9771378869731169, 'gamma': 1.3441538105922461, 'dropout_rate': 0.4684835481611168, 'lr': 0.005428217026916821, 'scheduler_patience': 2, 'class_weight': 0.6550213974795894, 'activation': 'LeakyReLU', 'classification_multiplier': 5396.844997548493}. Best is trial 1 with value: 0.7548667265648398.
[I 2026-09-14 02:07:04,194] Trial 12 finished with value: 0.7022215459525257 and parameters: {'hidden_dim': 1112, 'latent_dim': 5, 'beta': 1.2862582726115037, 'gamma': 1.3968978254936888, 'dropout_rate': 0.39028512724386455, 'lr': 0.005513284858882602, 'scheduler_patience': 6, 'class_weight': 0.6104493053099709, 'activation': 'LeakyReLU', 'classification_multiplier': 5177.138828138378}. Best is trial 1 with value: 0.7548667265648398.
[I 2026-09-14 02:07:23,729] Trial 13 finished with value: 0.7185956790123457 and parameters: {'hidden_dim': 2033, 'latent_dim': 12, 'beta': 1.406321817911951, 'gamma': 0.8998013311290471, 'dropout_rate': 0.3824137986574743, 'lr': 0.004707680800632532, 'scheduler_patience': 6, 'class_weight': 0.857828886241935, 'activation': 'LeakyReLU', 'classification_multiplier': 12238.066366668492}. Best is trial 1 with value: 0.7548667265648398.
[I 2026-09-14 02:07:41,564] Trial 14 finished with value: 0.7445492662473794 and parameters: {'hidden_dim': 1178, 'latent_dim': 11, 'beta': 0.9432812539307559, 'gamma': 1.5446278416260832, 'dropout_rate': 0.40568800855220155, 'lr': 0.0032743994253663315, 'scheduler_patience': 2, 'class_weight': 0.4433827018757491, 'activation': 'ELU', 'classification_multiplier': 6854.706042496987}. Best is trial 1 with value: 0.7548667265648398.
[I 2026-09-14 02:07:58,660] Trial 15 finished with value: 0.7220291294273419 and parameters: {'hidden_dim': 188, 'latent_dim': 17, 'beta': 1.9861121131508732, 'gamma': 0.9835006627230014, 'dropout_rate': 0.34503359804226225, 'lr': 0.0069143555148749964, 'scheduler_patience': 6, 'class_weight': 0.7569540603350245, 'activation': 'GELU', 'classification_multiplier': 7261.937525125619}. Best is trial 1 with value: 0.7548667265648398.
[I 2026-09-14 02:08:16,995] Trial 16 finished with value: 0.7175261072570073 and parameters: {'hidden_dim': 1523, 'latent_dim': 9, 'beta': 1.6218191325485622, 'gamma': 1.5078462399911579, 'dropout_rate': 0.48546665887584944, 'lr': 0.003426792868571368, 'scheduler_patience': 3, 'class_weight': 0.5619584316346581, 'activation': 'SELU', 'classification_multiplier': 11933.582846001758}. Best is trial 1 with value: 0.7548667265648398.
[I 2026-09-14 02:08:34,548] Trial 17 finished with value: 0.6959013867488445 and parameters: {'hidden_dim': 894, 'latent_dim': 16, 'beta': 1.0765480804348635, 'gamma': 1.6347479525440463, 'dropout_rate': 0.43808239761775286, 'lr': 0.0008586166140108088, 'scheduler_patience': 5, 'class_weight': 0.38123965273505067, 'activation': 'LeakyReLU', 'classification_multiplier': 6293.808319949567}. Best is trial 1 with value: 0.7548667265648398.
[I 2026-09-14 02:08:51,666] Trial 18 finished with value: 0.7144812177070241 and parameters: {'hidden_dim': 171, 'latent_dim': 8, 'beta': 1.730401498817353, 'gamma': 1.059262398215632, 'dropout_rate': 0.34693219961231714, 'lr': 0.0062166968426445755, 'scheduler_patience': 2, 'class_weight': 0.83071389517905, 'activation': 'LeakyReLU', 'classification_multiplier': 8228.818443590058}. Best is trial 1 with value: 0.7548667265648398.
[I 2026-09-14 02:09:10,618] Trial 19 finished with value: 0.7567203188789584 and parameters: {'hidden_dim': 1842, 'latent_dim': 17, 'beta': 1.5067383102109124, 'gamma': 0.742786468784004, 'dropout_rate': 0.4991790843522176, 'lr': 0.002345071512128375, 'scheduler_patience': 7, 'class_weight': 0.6199571859541785, 'activation': 'SELU', 'classification_multiplier': 10437.663875500202}. Best is trial 19 with value: 0.7567203188789584.
[I 2026-09-14 02:09:29,293] Trial 20 finished with value: 0.6666666666666666 and parameters: {'hidden_dim': 1711, 'latent_dim': 18, 'beta': 1.4657458900792395, 'gamma': 0.7211957729706406, 'dropout_rate': 0.4215314975625799, 'lr': 0.002077241398293133, 'scheduler_patience': 7, 'class_weight': 0.30097778052940466, 'activation': 'SELU', 'classification_multiplier': 10169.483253132674}. Best is trial 19 with value: 0.7567203188789584.
[I 2026-09-14 02:09:48,139] Trial 21 finished with value: 0.7223270440251571 and parameters: {'hidden_dim': 1796, 'latent_dim': 5, 'beta': 1.8299304336919913, 'gamma': 0.5605312542655203, 'dropout_rate': 0.49571324694257696, 'lr': 0.004210416580130173, 'scheduler_patience': 7, 'class_weight': 0.6221221419168412, 'activation': 'SELU', 'classification_multiplier': 11411.861968788873}. Best is trial 19 with value: 0.7567203188789584.
[I 2026-09-14 02:10:06,138] Trial 22 finished with value: 0.7262818462850441 and parameters: {'hidden_dim': 1319, 'latent_dim': 14, 'beta': 1.5232480047875643, 'gamma': 1.2917812618044073, 'dropout_rate': 0.44904938402318634, 'lr': 0.001875130213516095, 'scheduler_patience': 6, 'class_weight': 0.5054491227147822, 'activation': 'SELU', 'classification_multiplier': 13905.943459718039}. Best is trial 19 with value: 0.7567203188789584.
[I 2026-09-14 02:10:23,808] Trial 23 finished with value: 0.740359830910403 and parameters: {'hidden_dim': 999, 'latent_dim': 9, 'beta': 1.1011526229954434, 'gamma': 0.8040375254181363, 'dropout_rate': 0.35848195613874745, 'lr': 0.004217245957018005, 'scheduler_patience': 7, 'class_weight': 0.6792370965267841, 'activation': 'SELU', 'classification_multiplier': 9842.204315632871}. Best is trial 19 with value: 0.7567203188789584.
[I 2026-09-14 02:10:41,824] Trial 24 finished with value: 0.7193053859720525 and parameters: {'hidden_dim': 1398, 'latent_dim': 20, 'beta': 1.8510181377827741, 'gamma': 0.49793953943378055, 'dropout_rate': 0.4633967579583421, 'lr': 0.00014840581011333785, 'scheduler_patience': 6, 'class_weight': 0.5016092065128259, 'activation': 'GELU', 'classification_multiplier': 13125.147449267344}. Best is trial 19 with value: 0.7567203188789584.
[I 2026-09-14 02:11:00,746] Trial 25 finished with value: 0.7450244124462099 and parameters: {'hidden_dim': 1785, 'latent_dim': 32, 'beta': 1.148391324711728, 'gamma': 1.1147186758458307, 'dropout_rate': 0.49816535411478646, 'lr': 0.00603396961054849, 'scheduler_patience': 5, 'class_weight': 0.791346607091524, 'activation': 'ELU', 'classification_multiplier': 11163.5031828629}. Best is trial 19 with value: 0.7567203188789584.
[I 2026-09-14 02:11:18,147] Trial 26 finished with value: 0.7397053242246802 and parameters: {'hidden_dim': 639, 'latent_dim': 9, 'beta': 1.3125256801409377, 'gamma': 1.3956542868018524, 'dropout_rate': 0.42063980877068313, 'lr': 0.002327025358751572, 'scheduler_patience': 7, 'class_weight': 0.605377150683731, 'activation': 'LeakyReLU', 'classification_multiplier': 5943.611052252102}. Best is trial 19 with value: 0.7567203188789584.
[I 2026-09-14 02:11:35,745] Trial 27 finished with value: 0.74831102967035 and parameters: {'hidden_dim': 967, 'latent_dim': 14, 'beta': 1.5978983415683983, 'gamma': 1.9854088434337225, 'dropout_rate': 0.37180713042952274, 'lr': 0.007249985179553794, 'scheduler_patience': 6, 'class_weight': 0.929137697282708, 'activation': 'SELU', 'classification_multiplier': 8034.2369803997535}. Best is trial 19 with value: 0.7567203188789584.
[I 2026-09-14 02:11:53,542] Trial 28 finished with value: 0.7235662591984431 and parameters: {'hidden_dim': 906, 'latent_dim': 20, 'beta': 1.503917927921108, 'gamma': 1.9955202394584284, 'dropout_rate': 0.3187816348256612, 'lr': 0.007343846335847005, 'scheduler_patience': 6, 'class_weight': 0.9528150738202342, 'activation': 'SELU', 'classification_multiplier': 9784.584744111942}. Best is trial 19 with value: 0.7567203188789584.
[I 2026-09-14 02:12:10,856] Trial 29 finished with value: 0.7589299148385544 and parameters: {'hidden_dim': 332, 'latent_dim': 15, 'beta': 1.6533060608668266, 'gamma': 1.689076319678135, 'dropout_rate': 0.3202754174614209, 'lr': 0.00811976314844884, 'scheduler_patience': 7, 'class_weight': 0.8906697482616063, 'activation': 'SELU', 'classification_multiplier': 8091.053125994056}. Best is trial 29 with value: 0.7589299148385544.
[I 2026-09-14 02:12:28,145] Trial 30 finished with value: 0.7273166256217104 and parameters: {'hidden_dim': 341, 'latent_dim': 20, 'beta': 1.7502343598390953, 'gamma': 1.6633510835559289, 'dropout_rate': 0.31541379260555347, 'lr': 0.0027976439926355023, 'scheduler_patience': 7, 'class_weight': 0.3433711408265106, 'activation': 'SELU', 'classification_multiplier': 10714.834141808768}. Best is trial 29 with value: 0.7589299148385544.
[I 2026-09-14 02:12:45,368] Trial 31 finished with value: 0.7540042733043247 and parameters: {'hidden_dim': 283, 'latent_dim': 15, 'beta': 1.5922761455753491, 'gamma': 1.7964410178257044, 'dropout_rate': 0.21671153711865265, 'lr': 0.00825156307285731, 'scheduler_patience': 7, 'class_weight': 0.9983013194442601, 'activation': 'SELU', 'classification_multiplier': 8380.774425647793}. Best is trial 29 with value: 0.7589299148385544.
[I 2026-09-14 02:13:02,628] Trial 32 finished with value: 0.7540042733043247 and parameters: {'hidden_dim': 290, 'latent_dim': 15, 'beta': 1.6199311887945753, 'gamma': 1.7890088386101028, 'dropout_rate': 0.21293830315851858, 'lr': 0.008159278683364237, 'scheduler_patience': 7, 'class_weight': 0.8898520387691811, 'activation': 'SELU', 'classification_multiplier': 8203.930918162803}. Best is trial 29 with value: 0.7589299148385544.
[I 2026-09-14 02:13:20,017] Trial 33 finished with value: 0.7351432684447724 and parameters: {'hidden_dim': 430, 'latent_dim': 12, 'beta': 1.3958641867685393, 'gamma': 1.6585507490994102, 'dropout_rate': 0.22422702607429496, 'lr': 0.00804263082311536, 'scheduler_patience': 7, 'class_weight': 0.9941000441845388, 'activation': 'SELU', 'classification_multiplier': 9466.0456288323}. Best is trial 29 with value: 0.7589299148385544.
[I 2026-09-14 02:13:37,527] Trial 34 finished with value: 0.7494103773584905 and parameters: {'hidden_dim': 549, 'latent_dim': 18, 'beta': 1.2304698520109298, 'gamma': 1.4993306258336063, 'dropout_rate': 0.11365556206151077, 'lr': 0.00909246753429837, 'scheduler_patience': 7, 'class_weight': 0.7422761714922568, 'activation': 'SELU', 'classification_multiplier': 12279.153470998906}. Best is trial 29 with value: 0.7589299148385544.
[I 2026-09-14 02:13:54,722] Trial 35 finished with value: 0.7327071888475398 and parameters: {'hidden_dim': 145, 'latent_dim': 22, 'beta': 1.8208757079611928, 'gamma': 1.8712198404212672, 'dropout_rate': 0.29296543369104516, 'lr': 0.006536889904240961, 'scheduler_patience': 7, 'class_weight': 0.8114776507804099, 'activation': 'ELU', 'classification_multiplier': 7618.7976268151515}. Best is trial 29 with value: 0.7589299148385544.
[I 2026-09-14 02:14:11,991] Trial 36 finished with value: 0.740359830910403 and parameters: {'hidden_dim': 290, 'latent_dim': 29, 'beta': 0.8973819768137543, 'gamma': 1.7172479907873177, 'dropout_rate': 0.2272080186676096, 'lr': 0.008038882949151527, 'scheduler_patience': 6, 'class_weight': 0.4369494676819782, 'activation': 'SELU', 'classification_multiplier': 8742.530892785775}. Best is trial 29 with value: 0.7589299148385544.
[I 2026-09-14 02:14:29,549] Trial 37 finished with value: 0.6897152654805071 and parameters: {'hidden_dim': 537, 'latent_dim': 16, 'beta': 0.7332232927269926, 'gamma': 1.877200033315424, 'dropout_rate': 0.16082531839458059, 'lr': 0.003718460075237925, 'scheduler_patience': 7, 'class_weight': 0.8961580134469205, 'activation': 'ReLU', 'classification_multiplier': 10848.031234090337}. Best is trial 29 with value: 0.7589299148385544.
[I 2026-09-14 02:14:47,142] Trial 38 finished with value: 0.3562378167641325 and parameters: {'hidden_dim': 693, 'latent_dim': 37, 'beta': 1.648376644020022, 'gamma': 0.10002543732562419, 'dropout_rate': 0.27549512832637774, 'lr': 0.009251337923894463, 'scheduler_patience': 7, 'class_weight': 0.2082419688845955, 'activation': 'SELU', 'classification_multiplier': 9312.46866876549}. Best is trial 29 with value: 0.7589299148385544.
[I 2026-09-14 02:15:04,435] Trial 39 finished with value: 0.7430930651269634 and parameters: {'hidden_dim': 378, 'latent_dim': 11, 'beta': 1.4160762764437138, 'gamma': 0.444520964339936, 'dropout_rate': 0.3184636255074819, 'lr': 0.008382055967621253, 'scheduler_patience': 6, 'class_weight': 0.9852053666689241, 'activation': 'SELU', 'classification_multiplier': 11550.360098521083}. Best is trial 29 with value: 0.7589299148385544.
[I 2026-09-14 02:15:21,671] Trial 40 finished with value: 0.6992303283386555 and parameters: {'hidden_dim': 255, 'latent_dim': 22, 'beta': 1.549925740232727, 'gamma': 1.1898365923950323, 'dropout_rate': 0.24641540185067806, 'lr': 0.0015898239194512692, 'scheduler_patience': 7, 'class_weight': 0.7377024579859057, 'activation': 'ReLU', 'classification_multiplier': 12841.965835200275}. Best is trial 29 with value: 0.7589299148385544.
[I 2026-09-14 02:15:39,068] Trial 41 finished with value: 0.7386491939215577 and parameters: {'hidden_dim': 446, 'latent_dim': 15, 'beta': 1.694714662083154, 'gamma': 1.7787782581896054, 'dropout_rate': 0.19371771876929555, 'lr': 0.007922726129659899, 'scheduler_patience': 7, 'class_weight': 0.8827277639081134, 'activation': 'SELU', 'classification_multiplier': 8438.968263187155}. Best is trial 29 with value: 0.7589299148385544.
[I 2026-09-14 02:15:56,314] Trial 42 finished with value: 0.7623986748763983 and parameters: {'hidden_dim': 230, 'latent_dim': 19, 'beta': 1.5927616529153799, 'gamma': 1.5535709639361093, 'dropout_rate': 0.18486276683556502, 'lr': 0.009553493082175249, 'scheduler_patience': 7, 'class_weight': 0.9201520412077133, 'activation': 'SELU', 'classification_multiplier': 7847.272215912427}. Best is trial 42 with value: 0.7623986748763983.
[I 2026-09-14 02:16:13,499] Trial 43 finished with value: 0.7406771175568698 and parameters: {'hidden_dim': 217, 'latent_dim': 18, 'beta': 1.3414560497135206, 'gamma': 1.5382324767185183, 'dropout_rate': 0.12613011137864383, 'lr': 0.009448588964486665, 'scheduler_patience': 7, 'class_weight': 0.9333395845275136, 'activation': 'SELU', 'classification_multiplier': 7661.134753275763}. Best is trial 42 with value: 0.7623986748763983.
[I 2026-09-14 02:16:30,988] Trial 44 finished with value: 0.7312618416066692 and parameters: {'hidden_dim': 522, 'latent_dim': 26, 'beta': 1.2146961744850275, 'gamma': 1.5975291368340507, 'dropout_rate': 0.1857814532611359, 'lr': 0.0087046435789003, 'scheduler_patience': 6, 'class_weight': 0.849393173659131, 'activation': 'SELU', 'classification_multiplier': 6632.091350593206}. Best is trial 42 with value: 0.7623986748763983.
