[I 2026-09-14 03:28:46,451] Trial 295 finished with value: 0.7433142134412347 and parameters: {'hidden_dim': 281, 'latent_dim': 20, 'beta': 0.33863275350005967, 'gamma': 1.639048941010881, 'dropout_rate': 0.266569105946149, 'lr': 0.009852066021458484, 'scheduler_patience': 7, 'class_weight': 0.7818885774857566, 'activation': 'SELU', 'classification_multiplier': 13867.229183674543}. Best is trial 269 with value: 0.7750568551007148.
[I 2026-09-14 03:29:03,542] Trial 296 finished with value: 0.7573302469135802 and parameters: {'hidden_dim': 337, 'latent_dim': 40, 'beta': 0.45153401736109006, 'gamma': 1.4890736807194964, 'dropout_rate': 0.24574790572928945, 'lr': 0.009401298240416106, 'scheduler_patience': 7, 'class_weight': 0.7475778650457084, 'activation': 'SELU', 'classification_multiplier': 5817.302365550606}. Best is trial 269 with value: 0.7750568551007148.
[I 2026-09-14 03:29:20,844] Trial 297 finished with value: 0.6947331756769143 and parameters: {'hidden_dim': 796, 'latent_dim': 36, 'beta': 0.14440564574232723, 'gamma': 1.8771351896926776, 'dropout_rate': 0.29228269199502027, 'lr': 0.009654284055181355, 'scheduler_patience': 7, 'class_weight': 0.718607068490397, 'activation': 'SELU', 'classification_multiplier': 12387.379052188811}. Best is trial 269 with value: 0.7750568551007148.
[I 2026-09-14 03:29:38,188] Trial 298 finished with value: 0.7326256825846654 and parameters: {'hidden_dim': 728, 'latent_dim': 19, 'beta': 0.4111152054356462, 'gamma': 1.4665435280564152, 'dropout_rate': 0.2352785383356746, 'lr': 0.009035149451852478, 'scheduler_patience': 7, 'class_weight': 0.6672592242099015, 'activation': 'SELU', 'classification_multiplier': 6494.590332184434}. Best is trial 269 with value: 0.7750568551007148.
[I 2026-09-14 03:29:55,169] Trial 299 finished with value: 0.752312395990557 and parameters: {'hidden_dim': 252, 'latent_dim': 24, 'beta': 0.36874306206629326, 'gamma': 1.9701190058981368, 'dropout_rate': 0.30272308351646576, 'lr': 0.0075703346962235395, 'scheduler_patience': 7, 'class_weight': 0.7583676687106532, 'activation': 'SELU', 'classification_multiplier': 6925.761237865523}. Best is trial 269 with value: 0.7750568551007148.
[I 2026-09-14 03:30:12,346] Trial 300 finished with value: 0.7410180021897995 and parameters: {'hidden_dim': 358, 'latent_dim': 39, 'beta': 0.4599541450016936, 'gamma': 1.8997773620540792, 'dropout_rate': 0.2552932212234135, 'lr': 0.009833307823455513, 'scheduler_patience': 7, 'class_weight': 0.8212806489889982, 'activation': 'LeakyReLU', 'classification_multiplier': 12197.637992827662}. Best is trial 269 with value: 0.7750568551007148.
[I 2026-09-14 03:30:29,459] Trial 301 finished with value: 0.7522839405768814 and parameters: {'hidden_dim': 308, 'latent_dim': 20, 'beta': 0.31391004102759135, 'gamma': 1.5721595245415634, 'dropout_rate': 0.2657714943877191, 'lr': 0.009563302874880577, 'scheduler_patience': 7, 'class_weight': 0.7421186735112107, 'activation': 'SELU', 'classification_multiplier': 11990.991454358536}. Best is trial 269 with value: 0.7750568551007148.
[I 2026-09-14 03:30:46,418] Trial 302 finished with value: 0.7642844484949748 and parameters: {'hidden_dim': 263, 'latent_dim': 39, 'beta': 0.4214763523507642, 'gamma': 1.9634812450182182, 'dropout_rate': 0.24695111700228375, 'lr': 0.009180438962022716, 'scheduler_patience': 7, 'class_weight': 0.6959462936375473, 'activation': 'SELU', 'classification_multiplier': 6721.729204834412}. Best is trial 269 with value: 0.7750568551007148.
[I 2026-09-14 03:31:03,457] Trial 303 finished with value: 0.7411858974358975 and parameters: {'hidden_dim': 243, 'latent_dim': 39, 'beta': 0.41099708163076293, 'gamma': 1.9475085296027355, 'dropout_rate': 0.24506969449031102, 'lr': 0.009170138688858537, 'scheduler_patience': 2, 'class_weight': 0.6396897708572346, 'activation': 'SELU', 'classification_multiplier': 6994.5451947459505}. Best is trial 269 with value: 0.7750568551007148.
[I 2026-09-14 03:31:20,489] Trial 304 finished with value: 0.740359830910403 and parameters: {'hidden_dim': 212, 'latent_dim': 36, 'beta': 0.36382186813685136, 'gamma': 1.996493813105931, 'dropout_rate': 0.23442850012407623, 'lr': 0.009322986695699309, 'scheduler_patience': 7, 'class_weight': 0.6874039279791477, 'activation': 'ELU', 'classification_multiplier': 6629.561061950959}. Best is trial 269 with value: 0.7750568551007148.
[I 2026-09-14 03:31:37,577] Trial 305 finished with value: 0.7505737415719063 and parameters: {'hidden_dim': 265, 'latent_dim': 6, 'beta': 0.43044427642001565, 'gamma': 1.9242015231625036, 'dropout_rate': 0.2483424158074169, 'lr': 0.009448151242439336, 'scheduler_patience': 7, 'class_weight': 0.8470630672508885, 'activation': 'SELU', 'classification_multiplier': 6800.758859700567}. Best is trial 269 with value: 0.7750568551007148.
[I 2026-09-14 03:31:54,627] Trial 306 finished with value: 0.7423434252372724 and parameters: {'hidden_dim': 291, 'latent_dim': 19, 'beta': 0.3892471751793405, 'gamma': 1.9543201301642903, 'dropout_rate': 0.2544375134425847, 'lr': 0.00915897590391889, 'scheduler_patience': 7, 'class_weight': 0.8800028109449791, 'activation': 'SELU', 'classification_multiplier': 6305.168179041007}. Best is trial 269 with value: 0.7750568551007148.
[I 2026-09-14 03:32:11,672] Trial 307 finished with value: 0.7687737863176459 and parameters: {'hidden_dim': 212, 'latent_dim': 37, 'beta': 0.24357841912453732, 'gamma': 1.8780100707475396, 'dropout_rate': 0.22720379235986704, 'lr': 0.009682277292189737, 'scheduler_patience': 7, 'class_weight': 0.9299903753756561, 'activation': 'SELU', 'classification_multiplier': 12511.953247631924}. Best is trial 269 with value: 0.7750568551007148.
[I 2026-09-14 03:32:28,687] Trial 308 finished with value: 0.7517080620528896 and parameters: {'hidden_dim': 193, 'latent_dim': 37, 'beta': 0.2048887987398995, 'gamma': 1.8888128269259736, 'dropout_rate': 0.2260884563628226, 'lr': 0.009682214777472452, 'scheduler_patience': 7, 'class_weight': 0.9597792794313191, 'activation': 'SELU', 'classification_multiplier': 12742.206338469436}. Best is trial 269 with value: 0.7750568551007148.
[I 2026-09-14 03:32:45,781] Trial 309 finished with value: 0.743537065570964 and parameters: {'hidden_dim': 331, 'latent_dim': 36, 'beta': 0.248353642786105, 'gamma': 1.9684721005581403, 'dropout_rate': 0.23963127071969623, 'lr': 0.009999756185257027, 'scheduler_patience': 7, 'class_weight': 0.9121991672253077, 'activation': 'SELU', 'classification_multiplier': 12529.957833137496}. Best is trial 269 with value: 0.7750568551007148.
[I 2026-09-14 03:33:02,934] Trial 310 finished with value: 0.7440540245481059 and parameters: {'hidden_dim': 429, 'latent_dim': 22, 'beta': 0.2765922026365014, 'gamma': 1.9127425728770198, 'dropout_rate': 0.23163766493429958, 'lr': 0.009790984558120304, 'scheduler_patience': 7, 'class_weight': 0.9462827768240101, 'activation': 'SELU', 'classification_multiplier': 12820.46258847108}. Best is trial 269 with value: 0.7750568551007148.
[I 2026-09-14 03:33:19,932] Trial 311 finished with value: 0.7488289047375444 and parameters: {'hidden_dim': 222, 'latent_dim': 35, 'beta': 1.9999804794456653, 'gamma': 1.8687066637790923, 'dropout_rate': 0.3161697738770682, 'lr': 0.00962866361336622, 'scheduler_patience': 7, 'class_weight': 0.9447617101092093, 'activation': 'SELU', 'classification_multiplier': 12410.245884089716}. Best is trial 269 with value: 0.7750568551007148.
[I 2026-09-14 03:33:37,184] Trial 312 finished with value: 0.7541081311196254 and parameters: {'hidden_dim': 490, 'latent_dim': 37, 'beta': 0.21282813621005175, 'gamma': 1.5436655255444698, 'dropout_rate': 0.24401522230830422, 'lr': 0.009838992741897564, 'scheduler_patience': 7, 'class_weight': 0.927436883270465, 'activation': 'SELU', 'classification_multiplier': 12565.717844120383}. Best is trial 269 with value: 0.7750568551007148.
[I 2026-09-14 03:33:54,366] Trial 313 finished with value: 0.756063907044299 and parameters: {'hidden_dim': 394, 'latent_dim': 39, 'beta': 0.9117742056061626, 'gamma': 1.9333629806204125, 'dropout_rate': 0.2236262216229023, 'lr': 0.00931902203932541, 'scheduler_patience': 7, 'class_weight': 0.8987295801379277, 'activation': 'SELU', 'classification_multiplier': 6674.516902294158}. Best is trial 269 with value: 0.7750568551007148.
[I 2026-09-14 03:34:11,465] Trial 314 finished with value: 0.724827792752321 and parameters: {'hidden_dim': 229, 'latent_dim': 20, 'beta': 0.3408938980831214, 'gamma': 1.8823752803039833, 'dropout_rate': 0.23296496007370748, 'lr': 0.009577623269802969, 'scheduler_patience': 7, 'class_weight': 0.7852032012389445, 'activation': 'ReLU', 'classification_multiplier': 7257.077433382746}. Best is trial 269 with value: 0.7750568551007148.
[I 2026-09-14 03:34:28,592] Trial 315 finished with value: 0.7382928905917412 and parameters: {'hidden_dim': 305, 'latent_dim': 39, 'beta': 0.2763680446516923, 'gamma': 1.9802955228514576, 'dropout_rate': 0.25414864630042766, 'lr': 0.009019497935768854, 'scheduler_patience': 7, 'class_weight': 0.9214940728968408, 'activation': 'SELU', 'classification_multiplier': 12178.421256965947}. Best is trial 269 with value: 0.7750568551007148.
[I 2026-09-14 03:34:45,620] Trial 316 finished with value: 0.7564175384604792 and parameters: {'hidden_dim': 182, 'latent_dim': 37, 'beta': 0.30841269031769675, 'gamma': 1.9191680835989289, 'dropout_rate': 0.23801296933033705, 'lr': 0.009801480239647647, 'scheduler_patience': 7, 'class_weight': 0.8085306999854227, 'activation': 'SELU', 'classification_multiplier': 12326.300946905863}. Best is trial 269 with value: 0.7750568551007148.
[I 2026-09-14 03:35:02,631] Trial 317 finished with value: 0.7254425037118596 and parameters: {'hidden_dim': 261, 'latent_dim': 19, 'beta': 0.3588576730011953, 'gamma': 1.860045744648612, 'dropout_rate': 0.24869523430128862, 'lr': 0.009420910047955013, 'scheduler_patience': 7, 'class_weight': 0.8617428923977354, 'activation': 'GELU', 'classification_multiplier': 6847.978697355896}. Best is trial 269 with value: 0.7750568551007148.
[I 2026-09-14 03:35:19,746] Trial 318 finished with value: 0.4864858169205995 and parameters: {'hidden_dim': 365, 'latent_dim': 38, 'beta': 0.43032579297774975, 'gamma': 1.1444251269961265, 'dropout_rate': 0.2281568333791421, 'lr': 0.009188247111927042, 'scheduler_patience': 7, 'class_weight': 0.07686424416167031, 'activation': 'SELU', 'classification_multiplier': 12267.356946158876}. Best is trial 269 with value: 0.7750568551007148.
[I 2026-09-14 03:35:36,864] Trial 319 finished with value: 0.7717318059299192 and parameters: {'hidden_dim': 325, 'latent_dim': 21, 'beta': 0.16607713966089377, 'gamma': 1.9481617031902803, 'dropout_rate': 0.3266406988756713, 'lr': 0.009665730192761164, 'scheduler_patience': 7, 'class_weight': 0.7679394713300034, 'activation': 'SELU', 'classification_multiplier': 6029.284500460795}. Best is trial 269 with value: 0.7750568551007148.
[I 2026-09-14 03:35:54,102] Trial 320 finished with value: 0.7406234928156873 and parameters: {'hidden_dim': 406, 'latent_dim': 21, 'beta': 0.2280045235753689, 'gamma': 1.949993256760639, 'dropout_rate': 0.3259077235561502, 'lr': 0.009702060901537551, 'scheduler_patience': 6, 'class_weight': 0.7652620607613415, 'activation': 'SELU', 'classification_multiplier': 5559.17324776044}. Best is trial 269 with value: 0.7750568551007148.
[I 2026-09-14 03:36:11,175] Trial 321 finished with value: 0.7608539167625562 and parameters: {'hidden_dim': 313, 'latent_dim': 23, 'beta': 0.2003661909377526, 'gamma': 1.9727625798692565, 'dropout_rate': 0.35171666223669695, 'lr': 0.009886486746997568, 'scheduler_patience': 7, 'class_weight': 0.7789973437306219, 'activation': 'SELU', 'classification_multiplier': 6267.082786527598}. Best is trial 269 with value: 0.7750568551007148.
[I 2026-09-14 03:36:28,389] Trial 322 finished with value: 0.7668497843936439 and parameters: {'hidden_dim': 454, 'latent_dim': 25, 'beta': 0.11341960655687036, 'gamma': 1.903410629201526, 'dropout_rate': 0.3295799428602469, 'lr': 0.00965184882901108, 'scheduler_patience': 3, 'class_weight': 0.8352355893193042, 'activation': 'SELU', 'classification_multiplier': 6110.481291760366}. Best is trial 269 with value: 0.7750568551007148.
[I 2026-09-14 03:36:45,551] Trial 323 finished with value: 0.7330900687222526 and parameters: {'hidden_dim': 502, 'latent_dim': 23, 'beta': 0.1681526832183942, 'gamma': 1.897315402970558, 'dropout_rate': 0.3288073586973021, 'lr': 0.009630611815574511, 'scheduler_patience': 3, 'class_weight': 0.8384991462922526, 'activation': 'SELU', 'classification_multiplier': 5779.861830416423}. Best is trial 269 with value: 0.7750568551007148.
[I 2026-09-14 03:37:02,754] Trial 324 finished with value: 0.7367866306081409 and parameters: {'hidden_dim': 464, 'latent_dim': 22, 'beta': 0.12680926602648182, 'gamma': 1.602341358306423, 'dropout_rate': 0.34535180238081054, 'lr': 0.009954170042128433, 'scheduler_patience': 2, 'class_weight': 0.8133833354692005, 'activation': 'SELU', 'classification_multiplier': 6241.80087383228}. Best is trial 269 with value: 0.7750568551007148.
[I 2026-09-14 03:37:19,927] Trial 325 finished with value: 0.7555620775959758 and parameters: {'hidden_dim': 444, 'latent_dim': 25, 'beta': 0.1555696488194055, 'gamma': 1.043354583807173, 'dropout_rate': 0.3352223231514689, 'lr': 0.009358019597148865, 'scheduler_patience': 6, 'class_weight': 0.8769312032840382, 'activation': 'SELU', 'classification_multiplier': 5866.803477642916}. Best is trial 269 with value: 0.7750568551007148.
[I 2026-09-14 03:37:37,110] Trial 326 finished with value: 0.7643374080155688 and parameters: {'hidden_dim': 411, 'latent_dim': 21, 'beta': 0.11215739140972639, 'gamma': 1.9392912865518672, 'dropout_rate': 0.33871781306898774, 'lr': 0.009707478462167239, 'scheduler_patience': 7, 'class_weight': 0.829094047415253, 'activation': 'SELU', 'classification_multiplier': 6064.388685222964}. Best is trial 269 with value: 0.7750568551007148.
[I 2026-09-14 03:37:54,213] Trial 327 finished with value: 0.7535439752420884 and parameters: {'hidden_dim': 381, 'latent_dim': 22, 'beta': 0.1191683502101196, 'gamma': 1.9496425389952956, 'dropout_rate': 0.3356490035888049, 'lr': 0.009484520598052274, 'scheduler_patience': 7, 'class_weight': 0.8225702820466402, 'activation': 'SELU', 'classification_multiplier': 6168.52852127846}. Best is trial 269 with value: 0.7750568551007148.
[I 2026-09-14 03:38:11,450] Trial 328 finished with value: 0.7289381552277598 and parameters: {'hidden_dim': 587, 'latent_dim': 21, 'beta': 0.11023070692000476, 'gamma': 1.9812660795697004, 'dropout_rate': 0.3575163345183783, 'lr': 0.009681467895511482, 'scheduler_patience': 3, 'class_weight': 0.8351896424105798, 'activation': 'LeakyReLU', 'classification_multiplier': 5735.573890272585}. Best is trial 269 with value: 0.7750568551007148.
[I 2026-09-14 03:38:28,624] Trial 329 finished with value: 0.764640188434048 and parameters: {'hidden_dim': 410, 'latent_dim': 22, 'beta': 0.1430980220831382, 'gamma': 1.9157877605902338, 'dropout_rate': 0.3414501427839688, 'lr': 0.006603520386948873, 'scheduler_patience': 7, 'class_weight': 0.7972602591891352, 'activation': 'SELU', 'classification_multiplier': 5941.387496275749}. Best is trial 269 with value: 0.7750568551007148.
[I 2026-09-14 03:38:45,902] Trial 330 finished with value: 0.7467798035393495 and parameters: {'hidden_dim': 525, 'latent_dim': 22, 'beta': 0.15116126317812412, 'gamma': 1.9261004044117214, 'dropout_rate': 0.3457138670971119, 'lr': 0.006309598933998469, 'scheduler_patience': 7, 'class_weight': 0.7993658469826995, 'activation': 'SELU', 'classification_multiplier': 6095.287764155009}. Best is trial 269 with value: 0.7750568551007148.
[I 2026-09-14 03:39:03,057] Trial 331 finished with value: 0.767136985545625 and parameters: {'hidden_dim': 420, 'latent_dim': 24, 'beta': 0.11024237161961976, 'gamma': 1.8866101731209404, 'dropout_rate': 0.3231516473227523, 'lr': 0.009311823313338562, 'scheduler_patience': 7, 'class_weight': 0.8231757091241182, 'activation': 'SELU', 'classification_multiplier': 5251.319383023122}. Best is trial 269 with value: 0.7750568551007148.
[I 2026-09-14 03:39:20,182] Trial 332 finished with value: 0.7381288725401065 and parameters: {'hidden_dim': 432, 'latent_dim': 23, 'beta': 0.10323852953816756, 'gamma': 1.891939737396049, 'dropout_rate': 0.33857081203896194, 'lr': 0.006473533511835103, 'scheduler_patience': 4, 'class_weight': 0.819181510399513, 'activation': 'SELU', 'classification_multiplier': 5441.19625667947}. Best is trial 269 with value: 0.7750568551007148.
[I 2026-09-14 03:39:37,366] Trial 333 finished with value: 0.7385759997477971 and parameters: {'hidden_dim': 424, 'latent_dim': 23, 'beta': 0.1033051589426618, 'gamma': 1.859177844117498, 'dropout_rate': 0.3244787067004921, 'lr': 0.00904663114104381, 'scheduler_patience': 7, 'class_weight': 0.7952954096866465, 'activation': 'SELU', 'classification_multiplier': 5293.3786471941785}. Best is trial 269 with value: 0.7750568551007148.
[I 2026-09-14 03:39:54,598] Trial 334 finished with value: 0.7635802469135803 and parameters: {'hidden_dim': 450, 'latent_dim': 24, 'beta': 0.17922256056981486, 'gamma': 1.9369388491031405, 'dropout_rate': 0.32151419776227896, 'lr': 0.0066527165879206665, 'scheduler_patience': 7, 'class_weight': 0.8422355090941137, 'activation': 'ELU', 'classification_multiplier': 5012.08588572122}. Best is trial 269 with value: 0.7750568551007148.
[I 2026-09-14 03:40:11,845] Trial 335 finished with value: 0.7346077457795431 and parameters: {'hidden_dim': 461, 'latent_dim': 25, 'beta': 0.17075280432474885, 'gamma': 1.9914724328139835, 'dropout_rate': 0.3211131871307872, 'lr': 0.006128555735213017, 'scheduler_patience': 7, 'class_weight': 0.8511619206045465, 'activation': 'ELU', 'classification_multiplier': 5073.3916356530435}. Best is trial 269 with value: 0.7750568551007148.
[I 2026-09-14 03:40:29,074] Trial 336 finished with value: 0.7706204767986377 and parameters: {'hidden_dim': 486, 'latent_dim': 26, 'beta': 0.15766946756198513, 'gamma': 1.9383998584487412, 'dropout_rate': 0.3336789678775102, 'lr': 0.00930033306381233, 'scheduler_patience': 7, 'class_weight': 0.8267848067473517, 'activation': 'SELU', 'classification_multiplier': 5090.362817559327}. Best is trial 269 with value: 0.7750568551007148.
[I 2026-09-14 03:40:46,433] Trial 337 finished with value: 0.740359830910403 and parameters: {'hidden_dim': 540, 'latent_dim': 24, 'beta': 0.17846408305533146, 'gamma': 1.9314242517234077, 'dropout_rate': 0.3346648106727377, 'lr': 0.00923947930148451, 'scheduler_patience': 7, 'class_weight': 0.8308916496501098, 'activation': 'ELU', 'classification_multiplier': 5272.584666520445}. Best is trial 269 with value: 0.7750568551007148.
[I 2026-09-14 03:41:03,689] Trial 338 finished with value: 0.7333241201400406 and parameters: {'hidden_dim': 479, 'latent_dim': 27, 'beta': 0.15040678128390034, 'gamma': 1.8989140911722946, 'dropout_rate': 0.32879082750391264, 'lr': 0.00932116853524339, 'scheduler_patience': 7, 'class_weight': 0.8355628699048078, 'activation': 'ELU', 'classification_multiplier': 5638.496453442934}. Best is trial 269 with value: 0.7750568551007148.
[I 2026-09-14 03:41:20,906] Trial 339 finished with value: 0.7322727034944548 and parameters: {'hidden_dim': 467, 'latent_dim': 24, 'beta': 0.14250550866326747, 'gamma': 1.9380233301744163, 'dropout_rate': 0.31518018189962793, 'lr': 0.005862938583868346, 'scheduler_patience': 7, 'class_weight': 0.850142975177092, 'activation': 'ELU', 'classification_multiplier': 5029.104576885389}. Best is trial 269 with value: 0.7750568551007148.
[I 2026-09-14 03:41:38,125] Trial 340 finished with value: 0.7346077457795431 and parameters: {'hidden_dim': 510, 'latent_dim': 26, 'beta': 0.19221050017196253, 'gamma': 1.8702542988463011, 'dropout_rate': 0.3234579483498057, 'lr': 0.006450542625273416, 'scheduler_patience': 7, 'class_weight': 0.8182497047297864, 'activation': 'ELU', 'classification_multiplier': 5134.399277633086}. Best is trial 269 with value: 0.7750568551007148.
[I 2026-09-14 03:41:55,322] Trial 341 finished with value: 0.7346077457795431 and parameters: {'hidden_dim': 426, 'latent_dim': 24, 'beta': 0.10437760006599475, 'gamma': 1.905374044872678, 'dropout_rate': 0.3396698393613138, 'lr': 0.009438552451581355, 'scheduler_patience': 7, 'class_weight': 0.8573812445574802, 'activation': 'ELU', 'classification_multiplier': 5352.226001709858}. Best is trial 269 with value: 0.7750568551007148.
[I 2026-09-14 03:42:12,543] Trial 342 finished with value: 0.7414097184212126 and parameters: {'hidden_dim': 572, 'latent_dim': 25, 'beta': 0.16264867668832134, 'gamma': 1.9465680564908376, 'dropout_rate': 0.3305521825838149, 'lr': 0.00677102577734527, 'scheduler_patience': 7, 'class_weight': 0.8111680904785988, 'activation': 'SELU', 'classification_multiplier': 5965.316489938565}. Best is trial 269 with value: 0.7750568551007148.
[I 2026-09-14 03:42:29,686] Trial 343 finished with value: 0.764640188434048 and parameters: {'hidden_dim': 407, 'latent_dim': 21, 'beta': 0.22337211351932862, 'gamma': 1.8367404325269032, 'dropout_rate': 0.35070448475423854, 'lr': 0.006754546397103231, 'scheduler_patience': 7, 'class_weight': 0.8315210626244693, 'activation': 'SELU', 'classification_multiplier': 6431.295048397032}. Best is trial 269 with value: 0.7750568551007148.
[I 2026-09-14 03:42:46,954] Trial 344 finished with value: 0.7239886401401856 and parameters: {'hidden_dim': 444, 'latent_dim': 21, 'beta': 0.21484121121751645, 'gamma': 1.8495910738139514, 'dropout_rate': 0.3425507362205481, 'lr': 0.006540028530295645, 'scheduler_patience': 7, 'class_weight': 0.853187884228274, 'activation': 'ReLU', 'classification_multiplier': 6015.264210703696}. Best is trial 269 with value: 0.7750568551007148.
