[I 2025-08-31 16:53:01,981] Trial 336 finished with value: 0.9631578947368421 and parameters: {'hidden_dim': 1446, 'latent_dim': 15, 'beta': 1.8503012701045332, 'gamma': 1.4349602342810104, 'dropout_rate': 0.10846649863524768, 'lr': 0.00045798468564404874, 'scheduler_patience': 7, 'class_weight': 0.8592590940834061, 'activation': 'ReLU', 'classification_multiplier': 12493.209417924356}. Best is trial 332 with value: 0.9754385964912281.
[I 2025-08-31 16:53:27,596] Trial 337 finished with value: 0.9649122807017544 and parameters: {'hidden_dim': 1427, 'latent_dim': 17, 'beta': 1.8654946136679744, 'gamma': 1.1111508312499463, 'dropout_rate': 0.18542920044978634, 'lr': 0.0001054111639810621, 'scheduler_patience': 6, 'class_weight': 0.8883632533598453, 'activation': 'ReLU', 'classification_multiplier': 12088.140747368669}. Best is trial 332 with value: 0.9754385964912281.
[I 2025-08-31 16:53:54,027] Trial 338 finished with value: 0.968421052631579 and parameters: {'hidden_dim': 1487, 'latent_dim': 17, 'beta': 1.8935120189077894, 'gamma': 1.5416726236809732, 'dropout_rate': 0.1003299112662074, 'lr': 0.00010099794956424745, 'scheduler_patience': 7, 'class_weight': 0.855442078858515, 'activation': 'ReLU', 'classification_multiplier': 14810.561338645542}. Best is trial 332 with value: 0.9754385964912281.
              precision    recall  f1-score   support

Non-Repeater       0.99      0.99      0.99       158
    Repeater       0.94      0.94      0.94        32

    accuracy                           0.98       190
   macro avg       0.96      0.96      0.96       190
weighted avg       0.98      0.98      0.98       190

Trial 332 - Average Validation Accuracy: 0.9754
Fold 1/3 - Validation Accuracy: 0.9263
Classification Report:
              precision    recall  f1-score   support

Non-Repeater       0.96      0.96      0.96       159
    Repeater       0.77      0.77      0.77        31

    accuracy                           0.93       190
   macro avg       0.87      0.87      0.87       190
weighted avg       0.93      0.93      0.93       190

Fold 2/3 - Validation Accuracy: 0.9789
Classification Report:
              precision    recall  f1-score   support

Non-Repeater       0.98      0.99      0.99       159
    Repeater       0.97      0.90      0.93        31

    accuracy                           0.98       190
   macro avg       0.97      0.95      0.96       190
weighted avg       0.98      0.98      0.98       190

Fold 3/3 - Validation Accuracy: 0.9737
Classification Report:
              precision    recall  f1-score   support

Non-Repeater       0.98      0.99      0.98       158
    Repeater       0.94      0.91      0.92        32

    accuracy                           0.97       190
   macro avg       0.96      0.95      0.95       190
weighted avg       0.97      0.97      0.97       190

Trial 333 - Average Validation Accuracy: 0.9596
Fold 1/3 - Validation Accuracy: 0.9579
Classification Report:
              precision    recall  f1-score   support

Non-Repeater       0.97      0.98      0.97       159
    Repeater       0.90      0.84      0.87        31

    accuracy                           0.96       190
   macro avg       0.93      0.91      0.92       190
weighted avg       0.96      0.96      0.96       190

Fold 2/3 - Validation Accuracy: 0.9684
Classification Report:
              precision    recall  f1-score   support

Non-Repeater       0.97      0.99      0.98       159
    Repeater       0.96      0.84      0.90        31

    accuracy                           0.97       190
   macro avg       0.97      0.92      0.94       190
weighted avg       0.97      0.97      0.97       190

Fold 3/3 - Validation Accuracy: 0.9684
Classification Report:
              precision    recall  f1-score   support

Non-Repeater       0.97      0.99      0.98       158
    Repeater       0.93      0.88      0.90        32

    accuracy                           0.97       190
   macro avg       0.95      0.93      0.94       190
weighted avg       0.97      0.97      0.97       190

Trial 334 - Average Validation Accuracy: 0.9649
Fold 1/3 - Validation Accuracy: 0.9421
Classification Report:
              precision    recall  f1-score   support

Non-Repeater       0.96      0.97      0.97       159
    Repeater       0.86      0.77      0.81        31

    accuracy                           0.94       190
   macro avg       0.91      0.87      0.89       190
weighted avg       0.94      0.94      0.94       190

Fold 2/3 - Validation Accuracy: 0.9684
Classification Report:
              precision    recall  f1-score   support

Non-Repeater       0.97      0.99      0.98       159
    Repeater       0.96      0.84      0.90        31

    accuracy                           0.97       190
   macro avg       0.97      0.92      0.94       190
weighted avg       0.97      0.97      0.97       190

Fold 3/3 - Validation Accuracy: 0.9737
Classification Report:
              precision    recall  f1-score   support

Non-Repeater       0.98      0.99      0.98       158
    Repeater       0.94      0.91      0.92        32

    accuracy                           0.97       190
   macro avg       0.96      0.95      0.95       190
weighted avg       0.97      0.97      0.97       190

Trial 335 - Average Validation Accuracy: 0.9614
Fold 1/3 - Validation Accuracy: 0.9579
Classification Report:
              precision    recall  f1-score   support

Non-Repeater       0.97      0.97      0.97       159
    Repeater       0.87      0.87      0.87        31

    accuracy                           0.96       190
   macro avg       0.92      0.92      0.92       190
weighted avg       0.96      0.96      0.96       190

Fold 2/3 - Validation Accuracy: 0.9737
Classification Report:
              precision    recall  f1-score   support

Non-Repeater       0.98      0.99      0.98       159
    Repeater       0.96      0.87      0.92        31

    accuracy                           0.97       190
   macro avg       0.97      0.93      0.95       190
weighted avg       0.97      0.97      0.97       190

Fold 3/3 - Validation Accuracy: 0.9579
Classification Report:
              precision    recall  f1-score   support

Non-Repeater       0.97      0.98      0.97       158
    Repeater       0.90      0.84      0.87        32

    accuracy                           0.96       190
   macro avg       0.93      0.91      0.92       190
weighted avg       0.96      0.96      0.96       190

Trial 336 - Average Validation Accuracy: 0.9632
Fold 1/3 - Validation Accuracy: 0.9526
Classification Report:
              precision    recall  f1-score   support

Non-Repeater       0.96      0.98      0.97       159
    Repeater       0.89      0.81      0.85        31

    accuracy                           0.95       190
   macro avg       0.93      0.89      0.91       190
weighted avg       0.95      0.95      0.95       190

Fold 2/3 - Validation Accuracy: 0.9789
Classification Report:
              precision    recall  f1-score   support

Non-Repeater       0.98      0.99      0.99       159
    Repeater       0.97      0.90      0.93        31

    accuracy                           0.98       190
   macro avg       0.97      0.95      0.96       190
weighted avg       0.98      0.98      0.98       190

Fold 3/3 - Validation Accuracy: 0.9632
Classification Report:
              precision    recall  f1-score   support

Non-Repeater       0.99      0.97      0.98       158
    Repeater       0.86      0.94      0.90        32

    accuracy                           0.96       190
   macro avg       0.92      0.95      0.94       190
weighted avg       0.97      0.96      0.96       190

Trial 337 - Average Validation Accuracy: 0.9649
Fold 1/3 - Validation Accuracy: 0.9526
Classification Report:
              precision    recall  f1-score   support

Non-Repeater       0.97      0.97      0.97       159
    Repeater       0.84      0.87      0.86        31

    accuracy                           0.95       190
   macro avg       0.91      0.92      0.91       190
weighted avg       0.95      0.95      0.95       190

Fold 2/3 - Validation Accuracy: 0.9789
Classification Report:
              precision    recall  f1-score   support

Non-Repeater       0.98      0.99      0.99       159
    Repeater       0.97      0.90      0.93        31

    accuracy                           0.98       190
   macro avg       0.97      0.95      0.96       190
weighted avg       0.98      0.98      0.98       190

Fold 3/3 - Validation Accuracy: 0.9737
Classification Report:
              precision    recall  f1-score   support

Non-Repeater       0.98      0.99      0.98       158
    Repeater       0.97      0.88      0.92        32

    accuracy                           0.97       190
   macro avg       0.97      0.93      0.95       190
weighted avg       0.97      0.97      0.97       190

Trial 338 - Average Validation Accuracy: 0.9684
Fold 1/3 - Validation Accuracy: 0.9684
Classification Report:
              precision    recall  f1-score   support

Non-Repeater       0.98      0.99      0.98       159
    Repeater       0.93      0.87      0.90        31

    accuracy                           0.97       190
   macro avg       0.95      0.93      0.94       190
weighted avg       0.97      0.97      0.97       190

Fold 2/3 - Validation Accuracy: 0.9684
Classification Report:
[I 2025-08-31 16:54:20,375] Trial 339 finished with value: 0.9614035087719298 and parameters: {'hidden_dim': 1532, 'latent_dim': 15, 'beta': 1.8088003515852895, 'gamma': 1.6032488508431957, 'dropout_rate': 0.11322471780092784, 'lr': 0.00045506939944836035, 'scheduler_patience': 7, 'class_weight': 0.8782214948211703, 'activation': 'LeakyReLU', 'classification_multiplier': 11917.952722920087}. Best is trial 332 with value: 0.9754385964912281.
[I 2025-08-31 16:54:45,724] Trial 340 finished with value: 0.9614035087719298 and parameters: {'hidden_dim': 1393, 'latent_dim': 17, 'beta': 1.7732993960449244, 'gamma': 1.4845598032384233, 'dropout_rate': 0.11306485967100417, 'lr': 0.000761030372792136, 'scheduler_patience': 7, 'class_weight': 0.8733233980224392, 'activation': 'ReLU', 'classification_multiplier': 12318.04688520972}. Best is trial 332 with value: 0.9754385964912281.
[I 2025-08-31 16:55:11,781] Trial 341 finished with value: 0.9754385964912281 and parameters: {'hidden_dim': 1496, 'latent_dim': 18, 'beta': 1.8805836880620954, 'gamma': 1.3841381335760148, 'dropout_rate': 0.10771854916417353, 'lr': 0.00033325862425563304, 'scheduler_patience': 7, 'class_weight': 0.5692010696110051, 'activation': 'ReLU', 'classification_multiplier': 12780.868521106122}. Best is trial 332 with value: 0.9754385964912281.
[I 2025-08-31 16:55:38,074] Trial 342 finished with value: 0.9631578947368421 and parameters: {'hidden_dim': 1498, 'latent_dim': 16, 'beta': 1.887817371153424, 'gamma': 1.3867926658709764, 'dropout_rate': 0.10657020876467753, 'lr': 0.000564340212510505, 'scheduler_patience': 7, 'class_weight': 0.8064815525080347, 'activation': 'ReLU', 'classification_multiplier': 13051.582925664417}. Best is trial 332 with value: 0.9754385964912281.
[I 2025-08-31 16:56:04,193] Trial 343 finished with value: 0.9631578947368421 and parameters: {'hidden_dim': 1455, 'latent_dim': 16, 'beta': 1.9054118880523092, 'gamma': 1.1991002775973523, 'dropout_rate': 0.1062082805263875, 'lr': 0.0013457185688614827, 'scheduler_patience': 7, 'class_weight': 0.6485663663720432, 'activation': 'ReLU', 'classification_multiplier': 12855.189923814729}. Best is trial 332 with value: 0.9754385964912281.
[I 2025-08-31 16:56:30,637] Trial 344 finished with value: 0.9666666666666667 and parameters: {'hidden_dim': 1523, 'latent_dim': 18, 'beta': 1.8663649628293253, 'gamma': 1.9112902052339638, 'dropout_rate': 0.11368374299097232, 'lr': 0.00036569993051626727, 'scheduler_patience': 7, 'class_weight': 0.7508093588910852, 'activation': 'ReLU', 'classification_multiplier': 12646.7682293954}. Best is trial 332 with value: 0.9754385964912281.
[I 2025-08-31 16:56:56,222] Trial 345 finished with value: 0.9614035087719298 and parameters: {'hidden_dim': 1425, 'latent_dim': 18, 'beta': 1.9325001821617713, 'gamma': 1.3742116496261023, 'dropout_rate': 0.10031049783178873, 'lr': 0.0010759781391598922, 'scheduler_patience': 7, 'class_weight': 0.7872846003303293, 'activation': 'ReLU', 'classification_multiplier': 12789.0906397646}. Best is trial 332 with value: 0.9754385964912281.
              precision    recall  f1-score   support

Non-Repeater       0.97      0.99      0.98       159
    Repeater       0.96      0.84      0.90        31

    accuracy                           0.97       190
   macro avg       0.97      0.92      0.94       190
weighted avg       0.97      0.97      0.97       190

Fold 3/3 - Validation Accuracy: 0.9474
Classification Report:
              precision    recall  f1-score   support

Non-Repeater       0.96      0.98      0.97       158
    Repeater       0.89      0.78      0.83        32

    accuracy                           0.95       190
   macro avg       0.92      0.88      0.90       190
weighted avg       0.95      0.95      0.95       190

Trial 339 - Average Validation Accuracy: 0.9614
Fold 1/3 - Validation Accuracy: 0.9474
Classification Report:
              precision    recall  f1-score   support

Non-Repeater       0.96      0.98      0.97       159
    Repeater       0.89      0.77      0.83        31

    accuracy                           0.95       190
   macro avg       0.92      0.88      0.90       190
weighted avg       0.95      0.95      0.95       190

Fold 2/3 - Validation Accuracy: 0.9737
Classification Report:
              precision    recall  f1-score   support

Non-Repeater       0.98      0.99      0.98       159
    Repeater       0.93      0.90      0.92        31

    accuracy                           0.97       190
   macro avg       0.96      0.95      0.95       190
weighted avg       0.97      0.97      0.97       190

Fold 3/3 - Validation Accuracy: 0.9632
Classification Report:
              precision    recall  f1-score   support

Non-Repeater       0.97      0.99      0.98       158
    Repeater       0.93      0.84      0.89        32

    accuracy                           0.96       190
   macro avg       0.95      0.92      0.93       190
weighted avg       0.96      0.96      0.96       190

Trial 340 - Average Validation Accuracy: 0.9614
Fold 1/3 - Validation Accuracy: 0.9737
Classification Report:
              precision    recall  f1-score   support

Non-Repeater       0.98      0.99      0.98       159
    Repeater       0.96      0.87      0.92        31

    accuracy                           0.97       190
   macro avg       0.97      0.93      0.95       190
weighted avg       0.97      0.97      0.97       190

Fold 2/3 - Validation Accuracy: 0.9737
Classification Report:
              precision    recall  f1-score   support

Non-Repeater       0.98      0.99      0.98       159
    Repeater       0.96      0.87      0.92        31

    accuracy                           0.97       190
   macro avg       0.97      0.93      0.95       190
weighted avg       0.97      0.97      0.97       190

Fold 3/3 - Validation Accuracy: 0.9789
Classification Report:
              precision    recall  f1-score   support

Non-Repeater       0.98      1.00      0.99       158
    Repeater       1.00      0.88      0.93        32

    accuracy                           0.98       190
   macro avg       0.99      0.94      0.96       190
weighted avg       0.98      0.98      0.98       190

Trial 341 - Average Validation Accuracy: 0.9754
Fold 1/3 - Validation Accuracy: 0.9632
Classification Report:
              precision    recall  f1-score   support

Non-Repeater       0.97      0.99      0.98       159
    Repeater       0.93      0.84      0.88        31

    accuracy                           0.96       190
   macro avg       0.95      0.91      0.93       190
weighted avg       0.96      0.96      0.96       190

Fold 2/3 - Validation Accuracy: 0.9684
Classification Report:
              precision    recall  f1-score   support

Non-Repeater       0.97      0.99      0.98       159
    Repeater       0.96      0.84      0.90        31

    accuracy                           0.97       190
   macro avg       0.97      0.92      0.94       190
weighted avg       0.97      0.97      0.97       190

Fold 3/3 - Validation Accuracy: 0.9579
Classification Report:
              precision    recall  f1-score   support

Non-Repeater       0.97      0.98      0.97       158
    Repeater       0.90      0.84      0.87        32

    accuracy                           0.96       190
   macro avg       0.93      0.91      0.92       190
weighted avg       0.96      0.96      0.96       190

Trial 342 - Average Validation Accuracy: 0.9632
Fold 1/3 - Validation Accuracy: 0.9632
Classification Report:
              precision    recall  f1-score   support

Non-Repeater       0.97      0.99      0.98       159
    Repeater       0.93      0.84      0.88        31

    accuracy                           0.96       190
   macro avg       0.95      0.91      0.93       190
weighted avg       0.96      0.96      0.96       190

Fold 2/3 - Validation Accuracy: 0.9632
Classification Report:
              precision    recall  f1-score   support

Non-Repeater       0.96      0.99      0.98       159
    Repeater       0.96      0.81      0.88        31

    accuracy                           0.96       190
   macro avg       0.96      0.90      0.93       190
weighted avg       0.96      0.96      0.96       190

Fold 3/3 - Validation Accuracy: 0.9632
Classification Report:
              precision    recall  f1-score   support

Non-Repeater       0.96      0.99      0.98       158
    Repeater       0.96      0.81      0.88        32

    accuracy                           0.96       190
   macro avg       0.96      0.90      0.93       190
weighted avg       0.96      0.96      0.96       190

Trial 343 - Average Validation Accuracy: 0.9632
Fold 1/3 - Validation Accuracy: 0.9632
Classification Report:
              precision    recall  f1-score   support

Non-Repeater       0.98      0.97      0.98       159
    Repeater       0.88      0.90      0.89        31

    accuracy                           0.96       190
   macro avg       0.93      0.94      0.93       190
weighted avg       0.96      0.96      0.96       190

Fold 2/3 - Validation Accuracy: 0.9737
Classification Report:
              precision    recall  f1-score   support

Non-Repeater       0.98      0.99      0.98       159
    Repeater       0.96      0.87      0.92        31

    accuracy                           0.97       190
   macro avg       0.97      0.93      0.95       190
weighted avg       0.97      0.97      0.97       190

Fold 3/3 - Validation Accuracy: 0.9632
Classification Report:
              precision    recall  f1-score   support

Non-Repeater       0.98      0.97      0.98       158
    Repeater       0.88      0.91      0.89        32

    accuracy                           0.96       190
   macro avg       0.93      0.94      0.94       190
weighted avg       0.96      0.96      0.96       190

Trial 344 - Average Validation Accuracy: 0.9667
Fold 1/3 - Validation Accuracy: 0.9684
Classification Report:
              precision    recall  f1-score   support

Non-Repeater       0.98      0.99      0.98       159
    Repeater       0.93      0.87      0.90        31

    accuracy                           0.97       190
   macro avg       0.95      0.93      0.94       190
weighted avg       0.97      0.97      0.97       190

Fold 2/3 - Validation Accuracy: 0.9632
Classification Report:
              precision    recall  f1-score   support

Non-Repeater       0.97      0.99      0.98       159
    Repeater       0.93      0.84      0.88        31

    accuracy                           0.96       190
   macro avg       0.95      0.91      0.93       190
weighted avg       0.96      0.96      0.96       190

Fold 3/3 - Validation Accuracy: 0.9526
Classification Report:
              precision    recall  f1-score   support

Non-Repeater       0.97      0.97      0.97       158
    Repeater       0.85      0.88      0.86        32

    accuracy                           0.95       190
   macro avg       0.91      0.92      0.92       190
weighted avg       0.95      0.95      0.95       190

Trial 345 - Average Validation Accuracy: 0.9614
Fold 1/3 - Validation Accuracy: 0.9368
Classification Report:
[I 2025-08-31 16:57:22,258] Trial 346 finished with value: 0.9578947368421052 and parameters: {'hidden_dim': 1472, 'latent_dim': 19, 'beta': 1.9111877758413323, 'gamma': 1.3278554596958168, 'dropout_rate': 0.11885538927470705, 'lr': 0.0006064496415449482, 'scheduler_patience': 7, 'class_weight': 0.842930635595662, 'activation': 'ReLU', 'classification_multiplier': 12485.238469215366}. Best is trial 332 with value: 0.9754385964912281.
[I 2025-08-31 16:57:49,213] Trial 347 finished with value: 0.9614035087719298 and parameters: {'hidden_dim': 1600, 'latent_dim': 17, 'beta': 1.878595046929827, 'gamma': 1.4248757757001054, 'dropout_rate': 0.11005995518838979, 'lr': 0.0008259732503882594, 'scheduler_patience': 7, 'class_weight': 0.8995470222610618, 'activation': 'ReLU', 'classification_multiplier': 12124.818557120492}. Best is trial 332 with value: 0.9754385964912281.
[I 2025-08-31 16:58:16,049] Trial 348 finished with value: 0.9649122807017544 and parameters: {'hidden_dim': 1563, 'latent_dim': 18, 'beta': 1.998999009013672, 'gamma': 1.674019104728708, 'dropout_rate': 0.11813909477750695, 'lr': 0.0003369756219550038, 'scheduler_patience': 7, 'class_weight': 0.6954134470287117, 'activation': 'ReLU', 'classification_multiplier': 13198.802466842968}. Best is trial 332 with value: 0.9754385964912281.
