[I 2025-08-31 15:03:07,047] Trial 89 finished with value: 0.9596491228070175 and parameters: {'hidden_dim': 1657, 'latent_dim': 39, 'beta': 1.9738375971793443, 'gamma': 1.7986298100679203, 'dropout_rate': 0.13922586212746269, 'lr': 0.00010171298264501048, 'scheduler_patience': 7, 'class_weight': 0.9830656973049676, 'activation': 'GELU', 'classification_multiplier': 12327.825761291064}. Best is trial 62 with value: 0.9701754385964912.
[I 2025-08-31 15:03:34,781] Trial 90 finished with value: 0.9140350877192983 and parameters: {'hidden_dim': 1707, 'latent_dim': 40, 'beta': 1.9017314054120127, 'gamma': 1.7072621200358573, 'dropout_rate': 0.1276720940849646, 'lr': 0.008390205149304046, 'scheduler_patience': 7, 'class_weight': 0.9345399260862578, 'activation': 'ReLU', 'classification_multiplier': 11723.499333691569}. Best is trial 62 with value: 0.9701754385964912.
[I 2025-08-31 15:04:03,015] Trial 91 finished with value: 0.9578947368421052 and parameters: {'hidden_dim': 1810, 'latent_dim': 38, 'beta': 0.6704512111786027, 'gamma': 1.8384744770719965, 'dropout_rate': 0.16203497634601674, 'lr': 0.0011547271725750336, 'scheduler_patience': 7, 'class_weight': 0.8376811382061726, 'activation': 'ReLU', 'classification_multiplier': 14233.693500908868}. Best is trial 62 with value: 0.9701754385964912.
              precision    recall  f1-score   support

Non-Repeater       0.95      0.98      0.96       159
    Repeater       0.88      0.71      0.79        31

    accuracy                           0.94       190
   macro avg       0.91      0.85      0.87       190
weighted avg       0.93      0.94      0.93       190

Fold 2/3 - Validation Accuracy: 0.9211
Classification Report:
              precision    recall  f1-score   support

Non-Repeater       0.93      0.97      0.95       159
    Repeater       0.83      0.65      0.73        31

    accuracy                           0.92       190
   macro avg       0.88      0.81      0.84       190
weighted avg       0.92      0.92      0.92       190

Fold 3/3 - Validation Accuracy: 0.9474
Classification Report:
              precision    recall  f1-score   support

Non-Repeater       0.97      0.97      0.97       158
    Repeater       0.84      0.84      0.84        32

    accuracy                           0.95       190
   macro avg       0.91      0.91      0.91       190
weighted avg       0.95      0.95      0.95       190

Trial 86 - Average Validation Accuracy: 0.9351
Fold 1/3 - Validation Accuracy: 0.9632
Classification Report:
              precision    recall  f1-score   support

Non-Repeater       0.99      0.97      0.98       159
    Repeater       0.85      0.94      0.89        31

    accuracy                           0.96       190
   macro avg       0.92      0.95      0.94       190
weighted avg       0.97      0.96      0.96       190

Fold 2/3 - Validation Accuracy: 0.9684
Classification Report:
              precision    recall  f1-score   support

Non-Repeater       0.97      0.99      0.98       159
    Repeater       0.96      0.84      0.90        31

    accuracy                           0.97       190
   macro avg       0.97      0.92      0.94       190
weighted avg       0.97      0.97      0.97       190

Fold 3/3 - Validation Accuracy: 0.9684
Classification Report:
              precision    recall  f1-score   support

Non-Repeater       0.97      0.99      0.98       158
    Repeater       0.93      0.88      0.90        32

    accuracy                           0.97       190
   macro avg       0.95      0.93      0.94       190
weighted avg       0.97      0.97      0.97       190

Trial 87 - Average Validation Accuracy: 0.9667
Fold 1/3 - Validation Accuracy: 0.9632
Classification Report:
              precision    recall  f1-score   support

Non-Repeater       0.97      0.99      0.98       159
    Repeater       0.93      0.84      0.88        31

    accuracy                           0.96       190
   macro avg       0.95      0.91      0.93       190
weighted avg       0.96      0.96      0.96       190

Fold 2/3 - Validation Accuracy: 0.9737
Classification Report:
              precision    recall  f1-score   support

Non-Repeater       0.98      0.99      0.98       159
    Repeater       0.93      0.90      0.92        31

    accuracy                           0.97       190
   macro avg       0.96      0.95      0.95       190
weighted avg       0.97      0.97      0.97       190

Fold 3/3 - Validation Accuracy: 0.9632
Classification Report:
              precision    recall  f1-score   support

Non-Repeater       0.97      0.98      0.98       158
    Repeater       0.90      0.88      0.89        32

    accuracy                           0.96       190
   macro avg       0.94      0.93      0.93       190
weighted avg       0.96      0.96      0.96       190

Trial 88 - Average Validation Accuracy: 0.9667
Fold 1/3 - Validation Accuracy: 0.9316
Classification Report:
              precision    recall  f1-score   support

Non-Repeater       0.96      0.96      0.96       159
    Repeater       0.80      0.77      0.79        31

    accuracy                           0.93       190
   macro avg       0.88      0.87      0.87       190
weighted avg       0.93      0.93      0.93       190

Fold 2/3 - Validation Accuracy: 0.9684
Classification Report:
              precision    recall  f1-score   support

Non-Repeater       0.97      0.99      0.98       159
    Repeater       0.96      0.84      0.90        31

    accuracy                           0.97       190
   macro avg       0.97      0.92      0.94       190
weighted avg       0.97      0.97      0.97       190

Fold 3/3 - Validation Accuracy: 0.9789
Classification Report:
              precision    recall  f1-score   support

Non-Repeater       0.98      0.99      0.99       158
    Repeater       0.97      0.91      0.94        32

    accuracy                           0.98       190
   macro avg       0.97      0.95      0.96       190
weighted avg       0.98      0.98      0.98       190

Trial 89 - Average Validation Accuracy: 0.9596
Fold 1/3 - Validation Accuracy: 0.9105
Classification Report:
              precision    recall  f1-score   support

Non-Repeater       0.92      0.97      0.95       159
    Repeater       0.82      0.58      0.68        31

    accuracy                           0.91       190
   macro avg       0.87      0.78      0.81       190
weighted avg       0.91      0.91      0.90       190

Fold 2/3 - Validation Accuracy: 0.9053
Classification Report:
              precision    recall  f1-score   support

Non-Repeater       0.94      0.95      0.94       159
    Repeater       0.72      0.68      0.70        31

    accuracy                           0.91       190
   macro avg       0.83      0.81      0.82       190
weighted avg       0.90      0.91      0.90       190

Fold 3/3 - Validation Accuracy: 0.9263
Classification Report:
              precision    recall  f1-score   support

Non-Repeater       0.94      0.97      0.96       158
    Repeater       0.82      0.72      0.77        32

    accuracy                           0.93       190
   macro avg       0.88      0.84      0.86       190
weighted avg       0.92      0.93      0.92       190

Trial 90 - Average Validation Accuracy: 0.9140
Fold 1/3 - Validation Accuracy: 0.9579
Classification Report:
              precision    recall  f1-score   support

Non-Repeater       0.96      0.99      0.98       159
    Repeater       0.96      0.77      0.86        31

    accuracy                           0.96       190
   macro avg       0.96      0.88      0.92       190
weighted avg       0.96      0.96      0.96       190

Fold 2/3 - Validation Accuracy: 0.9632
Classification Report:
              precision    recall  f1-score   support

Non-Repeater       0.96      0.99      0.98       159
    Repeater       0.96      0.81      0.88        31

    accuracy                           0.96       190
   macro avg       0.96      0.90      0.93       190
weighted avg       0.96      0.96      0.96       190

Fold 3/3 - Validation Accuracy: 0.9526
Classification Report:
              precision    recall  f1-score   support

Non-Repeater       0.96      0.98      0.97       158
    Repeater       0.90      0.81      0.85        32

    accuracy                           0.95       190
   macro avg       0.93      0.90      0.91       190
weighted avg       0.95      0.95      0.95       190

Trial 91 - Average Validation Accuracy: 0.9579
Fold 1/3 - Validation Accuracy: 0.9421
Classification Report:
              precision    recall  f1-score   support

Non-Repeater       0.96      0.97      0.97       159
    Repeater       0.86      0.77      0.81        31

    accuracy                           0.94       190
   macro avg       0.91      0.87      0.89       190
weighted avg       0.94      0.94      0.94       190

Fold 2/3 - Validation Accuracy: 0.9632
Classification Report:
              precision    recall  f1-score   support

Non-Repeater       0.96      0.99      0.98       159
    Repeater       0.96      0.81      0.88        31

    accuracy                           0.96       190
   macro avg       0.96      0.90      0.93       190
weighted avg       0.96      0.96      0.96       190

Fold 3/3 - Validation Accuracy: 0.9526
Classification Report:
[I 2025-08-31 15:04:32,422] Trial 92 finished with value: 0.9526315789473685 and parameters: {'hidden_dim': 1928, 'latent_dim': 35, 'beta': 1.7851322351745211, 'gamma': 1.7581918349054135, 'dropout_rate': 0.1498272329247911, 'lr': 0.0008393618502515297, 'scheduler_patience': 7, 'class_weight': 0.8807579201945863, 'activation': 'ReLU', 'classification_multiplier': 11163.496547357321}. Best is trial 62 with value: 0.9701754385964912.
[I 2025-08-31 15:04:59,950] Trial 93 finished with value: 0.9315789473684211 and parameters: {'hidden_dim': 1712, 'latent_dim': 37, 'beta': 1.9931194414435995, 'gamma': 1.9375016679433952, 'dropout_rate': 0.18615492878247855, 'lr': 0.006333912607121129, 'scheduler_patience': 7, 'class_weight': 0.9698460656289397, 'activation': 'ReLU', 'classification_multiplier': 11451.141401997704}. Best is trial 62 with value: 0.9701754385964912.
[I 2025-08-31 15:05:27,218] Trial 94 finished with value: 0.9701754385964912 and parameters: {'hidden_dim': 1633, 'latent_dim': 39, 'beta': 1.8422903460642235, 'gamma': 1.4637489949119815, 'dropout_rate': 0.11477238590578881, 'lr': 0.0003498723620759236, 'scheduler_patience': 7, 'class_weight': 0.9015360642456064, 'activation': 'ReLU', 'classification_multiplier': 12080.22472242192}. Best is trial 62 with value: 0.9701754385964912.
[I 2025-08-31 15:05:53,827] Trial 95 finished with value: 0.9614035087719298 and parameters: {'hidden_dim': 1572, 'latent_dim': 38, 'beta': 1.8392924712801266, 'gamma': 1.6055446726956657, 'dropout_rate': 0.11237976810365452, 'lr': 0.0003987355804116639, 'scheduler_patience': 7, 'class_weight': 0.8957429465230375, 'activation': 'ReLU', 'classification_multiplier': 12018.4717339156}. Best is trial 62 with value: 0.9701754385964912.
[I 2025-08-31 15:06:21,142] Trial 96 finished with value: 0.9596491228070175 and parameters: {'hidden_dim': 1647, 'latent_dim': 39, 'beta': 1.7399609392642736, 'gamma': 1.4350391241182496, 'dropout_rate': 0.10228187967711921, 'lr': 0.0005987297330893604, 'scheduler_patience': 7, 'class_weight': 0.9424931576359182, 'activation': 'ReLU', 'classification_multiplier': 12622.481212427632}. Best is trial 62 with value: 0.9701754385964912.
[I 2025-08-31 15:06:49,714] Trial 97 finished with value: 0.9614035087719298 and parameters: {'hidden_dim': 1763, 'latent_dim': 40, 'beta': 1.910296766689852, 'gamma': 1.5201224485576836, 'dropout_rate': 0.12637051679029673, 'lr': 0.0012464045555399127, 'scheduler_patience': 7, 'class_weight': 0.917324227540282, 'activation': 'ReLU', 'classification_multiplier': 11674.844768485997}. Best is trial 62 with value: 0.9701754385964912.
[I 2025-08-31 15:07:16,543] Trial 98 finished with value: 0.9684210526315788 and parameters: {'hidden_dim': 1529, 'latent_dim': 38, 'beta': 1.8793610641424079, 'gamma': 1.6187222541071948, 'dropout_rate': 0.11642900122303158, 'lr': 0.00029646043602495, 'scheduler_patience': 7, 'class_weight': 0.9987042085386104, 'activation': 'ReLU', 'classification_multiplier': 12442.644688436474}. Best is trial 62 with value: 0.9701754385964912.
              precision    recall  f1-score   support

Non-Repeater       0.97      0.97      0.97       158
    Repeater       0.87      0.84      0.86        32

    accuracy                           0.95       190
   macro avg       0.92      0.91      0.91       190
weighted avg       0.95      0.95      0.95       190

Trial 92 - Average Validation Accuracy: 0.9526
Fold 1/3 - Validation Accuracy: 0.9368
Classification Report:
              precision    recall  f1-score   support

Non-Repeater       0.96      0.97      0.96       159
    Repeater       0.83      0.77      0.80        31

    accuracy                           0.94       190
   macro avg       0.89      0.87      0.88       190
weighted avg       0.94      0.94      0.94       190

Fold 2/3 - Validation Accuracy: 0.9263
Classification Report:
              precision    recall  f1-score   support

Non-Repeater       0.96      0.95      0.96       159
    Repeater       0.76      0.81      0.78        31

    accuracy                           0.93       190
   macro avg       0.86      0.88      0.87       190
weighted avg       0.93      0.93      0.93       190

Fold 3/3 - Validation Accuracy: 0.9316
Classification Report:
              precision    recall  f1-score   support

Non-Repeater       0.94      0.97      0.96       158
    Repeater       0.85      0.72      0.78        32

    accuracy                           0.93       190
   macro avg       0.90      0.85      0.87       190
weighted avg       0.93      0.93      0.93       190

Trial 93 - Average Validation Accuracy: 0.9316
Fold 1/3 - Validation Accuracy: 0.9737
Classification Report:
              precision    recall  f1-score   support

Non-Repeater       0.98      0.99      0.98       159
    Repeater       0.96      0.87      0.92        31

    accuracy                           0.97       190
   macro avg       0.97      0.93      0.95       190
weighted avg       0.97      0.97      0.97       190

Fold 2/3 - Validation Accuracy: 0.9737
Classification Report:
              precision    recall  f1-score   support

Non-Repeater       0.98      0.99      0.98       159
    Repeater       0.96      0.87      0.92        31

    accuracy                           0.97       190
   macro avg       0.97      0.93      0.95       190
weighted avg       0.97      0.97      0.97       190

Fold 3/3 - Validation Accuracy: 0.9632
Classification Report:
              precision    recall  f1-score   support

Non-Repeater       0.96      0.99      0.98       158
    Repeater       0.96      0.81      0.88        32

    accuracy                           0.96       190
   macro avg       0.96      0.90      0.93       190
weighted avg       0.96      0.96      0.96       190

Trial 94 - Average Validation Accuracy: 0.9702
Fold 1/3 - Validation Accuracy: 0.9474
Classification Report:
              precision    recall  f1-score   support

Non-Repeater       0.97      0.96      0.97       159
    Repeater       0.82      0.87      0.84        31

    accuracy                           0.95       190
   macro avg       0.90      0.92      0.91       190
weighted avg       0.95      0.95      0.95       190

Fold 2/3 - Validation Accuracy: 0.9789
Classification Report:
              precision    recall  f1-score   support

Non-Repeater       0.98      0.99      0.99       159
    Repeater       0.97      0.90      0.93        31

    accuracy                           0.98       190
   macro avg       0.97      0.95      0.96       190
weighted avg       0.98      0.98      0.98       190

Fold 3/3 - Validation Accuracy: 0.9579
Classification Report:
              precision    recall  f1-score   support

Non-Repeater       0.96      0.99      0.97       158
    Repeater       0.93      0.81      0.87        32

    accuracy                           0.96       190
   macro avg       0.95      0.90      0.92       190
weighted avg       0.96      0.96      0.96       190

Trial 95 - Average Validation Accuracy: 0.9614
Fold 1/3 - Validation Accuracy: 0.9421
Classification Report:
              precision    recall  f1-score   support

Non-Repeater       0.96      0.97      0.97       159
    Repeater       0.83      0.81      0.82        31

    accuracy                           0.94       190
   macro avg       0.90      0.89      0.89       190
weighted avg       0.94      0.94      0.94       190

Fold 2/3 - Validation Accuracy: 0.9789
Classification Report:
              precision    recall  f1-score   support

Non-Repeater       0.98      0.99      0.99       159
    Repeater       0.97      0.90      0.93        31

    accuracy                           0.98       190
   macro avg       0.97      0.95      0.96       190
weighted avg       0.98      0.98      0.98       190

Fold 3/3 - Validation Accuracy: 0.9579
Classification Report:
              precision    recall  f1-score   support

Non-Repeater       0.96      0.99      0.97       158
    Repeater       0.93      0.81      0.87        32

    accuracy                           0.96       190
   macro avg       0.95      0.90      0.92       190
weighted avg       0.96      0.96      0.96       190

Trial 96 - Average Validation Accuracy: 0.9596
Fold 1/3 - Validation Accuracy: 0.9579
Classification Report:
              precision    recall  f1-score   support

Non-Repeater       0.97      0.98      0.97       159
    Repeater       0.90      0.84      0.87        31

    accuracy                           0.96       190
   macro avg       0.93      0.91      0.92       190
weighted avg       0.96      0.96      0.96       190

Fold 2/3 - Validation Accuracy: 0.9737
Classification Report:
              precision    recall  f1-score   support

Non-Repeater       0.98      0.99      0.98       159
    Repeater       0.93      0.90      0.92        31

    accuracy                           0.97       190
   macro avg       0.96      0.95      0.95       190
weighted avg       0.97      0.97      0.97       190

Fold 3/3 - Validation Accuracy: 0.9526
Classification Report:
              precision    recall  f1-score   support

Non-Repeater       0.96      0.98      0.97       158
    Repeater       0.90      0.81      0.85        32

    accuracy                           0.95       190
   macro avg       0.93      0.90      0.91       190
weighted avg       0.95      0.95      0.95       190

Trial 97 - Average Validation Accuracy: 0.9614
Fold 1/3 - Validation Accuracy: 0.9526
Classification Report:
              precision    recall  f1-score   support

Non-Repeater       0.97      0.97      0.97       159
    Repeater       0.84      0.87      0.86        31

    accuracy                           0.95       190
   macro avg       0.91      0.92      0.91       190
weighted avg       0.95      0.95      0.95       190

Fold 2/3 - Validation Accuracy: 0.9842
Classification Report:
              precision    recall  f1-score   support

Non-Repeater       0.99      0.99      0.99       159
    Repeater       0.97      0.94      0.95        31

    accuracy                           0.98       190
   macro avg       0.98      0.96      0.97       190
weighted avg       0.98      0.98      0.98       190

Fold 3/3 - Validation Accuracy: 0.9684
Classification Report:
              precision    recall  f1-score   support

Non-Repeater       0.98      0.98      0.98       158
    Repeater       0.91      0.91      0.91        32

    accuracy                           0.97       190
   macro avg       0.94      0.94      0.94       190
weighted avg       0.97      0.97      0.97       190

Trial 98 - Average Validation Accuracy: 0.9684
Fold 1/3 - Validation Accuracy: 0.9474
Classification Report:
              precision    recall  f1-score   support

Non-Repeater       0.96      0.97      0.97       159
    Repeater       0.86      0.81      0.83        31

    accuracy                           0.95       190
   macro avg       0.91      0.89      0.90       190
weighted avg       0.95      0.95      0.95       190

Fold 2/3 - Validation Accuracy: 0.9632
Classification Report:
[I 2025-08-31 15:07:41,984] Trial 99 finished with value: 0.956140350877193 and parameters: {'hidden_dim': 1426, 'latent_dim': 37, 'beta': 1.9527988816141837, 'gamma': 1.6830778906245492, 'dropout_rate': 0.1405343779853558, 'lr': 0.0015504273477262944, 'scheduler_patience': 7, 'class_weight': 0.8693031678556495, 'activation': 'ReLU', 'classification_multiplier': 10762.765867501475}. Best is trial 62 with value: 0.9701754385964912.
[I 2025-08-31 15:08:09,243] Trial 100 finished with value: 0.9333333333333332 and parameters: {'hidden_dim': 1615, 'latent_dim': 36, 'beta': 1.994620588618414, 'gamma': 1.7412559554388864, 'dropout_rate': 0.10054709486780083, 'lr': 0.0008189794300697833, 'scheduler_patience': 3, 'class_weight': 0.9737354218330961, 'activation': 'ELU', 'classification_multiplier': 13899.457083001553}. Best is trial 62 with value: 0.9701754385964912.
[I 2025-08-31 15:08:35,530] Trial 101 finished with value: 0.9596491228070175 and parameters: {'hidden_dim': 1526, 'latent_dim': 38, 'beta': 1.8902495739371497, 'gamma': 1.608710034297558, 'dropout_rate': 0.11697784207508782, 'lr': 0.0003747797833183988, 'scheduler_patience': 7, 'class_weight': 0.994014981927212, 'activation': 'ReLU', 'classification_multiplier': 12415.691878121377}. Best is trial 62 with value: 0.9701754385964912.
