[I 2025-08-31 16:35:42,351] Trial 297 finished with value: 0.9631578947368421 and parameters: {'hidden_dim': 1691, 'latent_dim': 36, 'beta': 1.9233976224813727, 'gamma': 1.626156926754802, 'dropout_rate': 0.11571467337231994, 'lr': 0.0008054980195164628, 'scheduler_patience': 7, 'class_weight': 0.998583877442644, 'activation': 'ReLU', 'classification_multiplier': 11510.96155197749}. Best is trial 255 with value: 0.9736842105263158.
[I 2025-08-31 16:36:10,986] Trial 298 finished with value: 0.968421052631579 and parameters: {'hidden_dim': 1793, 'latent_dim': 18, 'beta': 1.882204746325946, 'gamma': 1.8249633495636441, 'dropout_rate': 0.14396517566853279, 'lr': 0.00010404910320549782, 'scheduler_patience': 3, 'class_weight': 0.9760823500813441, 'activation': 'ReLU', 'classification_multiplier': 12013.959786068532}. Best is trial 255 with value: 0.9736842105263158.
              precision    recall  f1-score   support

Non-Repeater       0.97      0.98      0.97       158
    Repeater       0.90      0.84      0.87        32

    accuracy                           0.96       190
   macro avg       0.93      0.91      0.92       190
weighted avg       0.96      0.96      0.96       190

Trial 292 - Average Validation Accuracy: 0.9649
Fold 1/3 - Validation Accuracy: 0.9632
Classification Report:
              precision    recall  f1-score   support

Non-Repeater       0.96      0.99      0.98       159
    Repeater       0.96      0.81      0.88        31

    accuracy                           0.96       190
   macro avg       0.96      0.90      0.93       190
weighted avg       0.96      0.96      0.96       190

Fold 2/3 - Validation Accuracy: 0.9632
Classification Report:
              precision    recall  f1-score   support

Non-Repeater       0.96      0.99      0.98       159
    Repeater       0.96      0.81      0.88        31

    accuracy                           0.96       190
   macro avg       0.96      0.90      0.93       190
weighted avg       0.96      0.96      0.96       190

Fold 3/3 - Validation Accuracy: 0.9579
Classification Report:
              precision    recall  f1-score   support

Non-Repeater       0.96      0.99      0.97       158
    Repeater       0.93      0.81      0.87        32

    accuracy                           0.96       190
   macro avg       0.95      0.90      0.92       190
weighted avg       0.96      0.96      0.96       190

Trial 293 - Average Validation Accuracy: 0.9614
Fold 1/3 - Validation Accuracy: 0.9632
Classification Report:
              precision    recall  f1-score   support

Non-Repeater       0.98      0.97      0.98       159
    Repeater       0.88      0.90      0.89        31

    accuracy                           0.96       190
   macro avg       0.93      0.94      0.93       190
weighted avg       0.96      0.96      0.96       190

Fold 2/3 - Validation Accuracy: 0.9737
Classification Report:
              precision    recall  f1-score   support

Non-Repeater       0.98      0.99      0.98       159
    Repeater       0.96      0.87      0.92        31

    accuracy                           0.97       190
   macro avg       0.97      0.93      0.95       190
weighted avg       0.97      0.97      0.97       190

Fold 3/3 - Validation Accuracy: 0.9684
Classification Report:
              precision    recall  f1-score   support

Non-Repeater       0.98      0.98      0.98       158
    Repeater       0.91      0.91      0.91        32

    accuracy                           0.97       190
   macro avg       0.94      0.94      0.94       190
weighted avg       0.97      0.97      0.97       190

Trial 294 - Average Validation Accuracy: 0.9684
Fold 1/3 - Validation Accuracy: 0.9474
Classification Report:
              precision    recall  f1-score   support

Non-Repeater       0.97      0.97      0.97       159
    Repeater       0.84      0.84      0.84        31

    accuracy                           0.95       190
   macro avg       0.90      0.90      0.90       190
weighted avg       0.95      0.95      0.95       190

Fold 2/3 - Validation Accuracy: 0.9842
Classification Report:
              precision    recall  f1-score   support

Non-Repeater       0.99      0.99      0.99       159
    Repeater       0.97      0.94      0.95        31

    accuracy                           0.98       190
   macro avg       0.98      0.96      0.97       190
weighted avg       0.98      0.98      0.98       190

Fold 3/3 - Validation Accuracy: 0.9737
Classification Report:
              precision    recall  f1-score   support

Non-Repeater       0.99      0.98      0.98       158
    Repeater       0.91      0.94      0.92        32

    accuracy                           0.97       190
   macro avg       0.95      0.96      0.95       190
weighted avg       0.97      0.97      0.97       190

Trial 295 - Average Validation Accuracy: 0.9684
Fold 1/3 - Validation Accuracy: 0.9316
Classification Report:
              precision    recall  f1-score   support

Non-Repeater       0.95      0.97      0.96       159
    Repeater       0.82      0.74      0.78        31

    accuracy                           0.93       190
   macro avg       0.89      0.86      0.87       190
weighted avg       0.93      0.93      0.93       190

Fold 2/3 - Validation Accuracy: 0.9421
Classification Report:
              precision    recall  f1-score   support

Non-Repeater       0.95      0.99      0.97       159
    Repeater       0.92      0.71      0.80        31

    accuracy                           0.94       190
   macro avg       0.93      0.85      0.88       190
weighted avg       0.94      0.94      0.94       190

Fold 3/3 - Validation Accuracy: 0.9421
Classification Report:
              precision    recall  f1-score   support

Non-Repeater       0.97      0.96      0.97       158
    Repeater       0.82      0.84      0.83        32

    accuracy                           0.94       190
   macro avg       0.89      0.90      0.90       190
weighted avg       0.94      0.94      0.94       190

Trial 296 - Average Validation Accuracy: 0.9386
Fold 1/3 - Validation Accuracy: 0.9579
Classification Report:
              precision    recall  f1-score   support

Non-Repeater       0.97      0.97      0.97       159
    Repeater       0.87      0.87      0.87        31

    accuracy                           0.96       190
   macro avg       0.92      0.92      0.92       190
weighted avg       0.96      0.96      0.96       190

Fold 2/3 - Validation Accuracy: 0.9737
Classification Report:
              precision    recall  f1-score   support

Non-Repeater       0.98      0.99      0.98       159
    Repeater       0.96      0.87      0.92        31

    accuracy                           0.97       190
   macro avg       0.97      0.93      0.95       190
weighted avg       0.97      0.97      0.97       190

Fold 3/3 - Validation Accuracy: 0.9579
Classification Report:
              precision    recall  f1-score   support

Non-Repeater       0.98      0.97      0.97       158
    Repeater       0.85      0.91      0.88        32

    accuracy                           0.96       190
   macro avg       0.92      0.94      0.93       190
weighted avg       0.96      0.96      0.96       190

Trial 297 - Average Validation Accuracy: 0.9632
Fold 1/3 - Validation Accuracy: 0.9474
Classification Report:
              precision    recall  f1-score   support

Non-Repeater       0.97      0.97      0.97       159
    Repeater       0.84      0.84      0.84        31

    accuracy                           0.95       190
   macro avg       0.90      0.90      0.90       190
weighted avg       0.95      0.95      0.95       190

Fold 2/3 - Validation Accuracy: 0.9789
Classification Report:
              precision    recall  f1-score   support

Non-Repeater       0.98      0.99      0.99       159
    Repeater       0.97      0.90      0.93        31

    accuracy                           0.98       190
   macro avg       0.97      0.95      0.96       190
weighted avg       0.98      0.98      0.98       190

Fold 3/3 - Validation Accuracy: 0.9789
Classification Report:
              precision    recall  f1-score   support

Non-Repeater       0.99      0.99      0.99       158
    Repeater       0.94      0.94      0.94        32

    accuracy                           0.98       190
   macro avg       0.96      0.96      0.96       190
weighted avg       0.98      0.98      0.98       190

Trial 298 - Average Validation Accuracy: 0.9684
Fold 1/3 - Validation Accuracy: 0.9421
Classification Report:
              precision    recall  f1-score   support

Non-Repeater       0.96      0.97      0.97       159
    Repeater       0.86      0.77      0.81        31

    accuracy                           0.94       190
   macro avg       0.91      0.87      0.89       190
weighted avg       0.94      0.94      0.94       190

Fold 2/3 - Validation Accuracy: 0.9789
Classification Report:
[I 2025-08-31 16:36:41,425] Trial 299 finished with value: 0.9596491228070175 and parameters: {'hidden_dim': 1963, 'latent_dim': 39, 'beta': 1.9585583903604336, 'gamma': 1.1528797920246214, 'dropout_rate': 0.11459674434467877, 'lr': 0.0004177687667477225, 'scheduler_patience': 7, 'class_weight': 0.9457558649865107, 'activation': 'ReLU', 'classification_multiplier': 13230.603124801151}. Best is trial 255 with value: 0.9736842105263158.
[I 2025-08-31 16:37:04,149] Trial 300 finished with value: 0.956140350877193 and parameters: {'hidden_dim': 989, 'latent_dim': 35, 'beta': 1.8009066476935522, 'gamma': 1.5895257654299482, 'dropout_rate': 0.12689629789573678, 'lr': 0.0003431643436879135, 'scheduler_patience': 4, 'class_weight': 0.9996390215868867, 'activation': 'ReLU', 'classification_multiplier': 11251.700074061406}. Best is trial 255 with value: 0.9736842105263158.
[I 2025-08-31 16:37:30,752] Trial 301 finished with value: 0.9649122807017544 and parameters: {'hidden_dim': 1568, 'latent_dim': 34, 'beta': 1.8498915089003873, 'gamma': 1.7181729239370416, 'dropout_rate': 0.1528402843610278, 'lr': 0.0005542473195890963, 'scheduler_patience': 7, 'class_weight': 0.9632607593070122, 'activation': 'ReLU', 'classification_multiplier': 12389.76677910436}. Best is trial 255 with value: 0.9736842105263158.
[I 2025-08-31 16:37:54,209] Trial 302 finished with value: 0.968421052631579 and parameters: {'hidden_dim': 1075, 'latent_dim': 38, 'beta': 1.929827343877249, 'gamma': 0.30659089829953445, 'dropout_rate': 0.10664740213494157, 'lr': 0.000266781874177735, 'scheduler_patience': 7, 'class_weight': 0.928549123478269, 'activation': 'ReLU', 'classification_multiplier': 12862.093570091947}. Best is trial 255 with value: 0.9736842105263158.
[I 2025-08-31 16:38:21,255] Trial 303 finished with value: 0.9333333333333332 and parameters: {'hidden_dim': 1625, 'latent_dim': 15, 'beta': 1.4647838675798206, 'gamma': 1.6755182337623102, 'dropout_rate': 0.12158936972479385, 'lr': 0.0009145638090455328, 'scheduler_patience': 7, 'class_weight': 0.9782996197023079, 'activation': 'SELU', 'classification_multiplier': 12104.152003579658}. Best is trial 255 with value: 0.9736842105263158.
[I 2025-08-31 16:38:49,301] Trial 304 finished with value: 0.9649122807017544 and parameters: {'hidden_dim': 1740, 'latent_dim': 40, 'beta': 1.963140038683914, 'gamma': 1.9237187044003026, 'dropout_rate': 0.13403855167893425, 'lr': 0.0005500334491565244, 'scheduler_patience': 7, 'class_weight': 0.8955214515764907, 'activation': 'ReLU', 'classification_multiplier': 11826.57335180216}. Best is trial 255 with value: 0.9736842105263158.
[I 2025-08-31 16:39:16,847] Trial 305 finished with value: 0.9421052631578947 and parameters: {'hidden_dim': 1664, 'latent_dim': 37, 'beta': 1.899049096251217, 'gamma': 1.7923988719815533, 'dropout_rate': 0.4381883092064626, 'lr': 0.0002681737060513897, 'scheduler_patience': 6, 'class_weight': 0.3642455432134487, 'activation': 'ReLU', 'classification_multiplier': 10375.091883926218}. Best is trial 255 with value: 0.9736842105263158.
              precision    recall  f1-score   support

Non-Repeater       0.98      0.99      0.99       159
    Repeater       0.97      0.90      0.93        31

    accuracy                           0.98       190
   macro avg       0.97      0.95      0.96       190
weighted avg       0.98      0.98      0.98       190

Fold 3/3 - Validation Accuracy: 0.9579
Classification Report:
              precision    recall  f1-score   support

Non-Repeater       0.98      0.97      0.97       158
    Repeater       0.85      0.91      0.88        32

    accuracy                           0.96       190
   macro avg       0.92      0.94      0.93       190
weighted avg       0.96      0.96      0.96       190

Trial 299 - Average Validation Accuracy: 0.9596
Fold 1/3 - Validation Accuracy: 0.9421
Classification Report:
              precision    recall  f1-score   support

Non-Repeater       0.97      0.96      0.97       159
    Repeater       0.81      0.84      0.83        31

    accuracy                           0.94       190
   macro avg       0.89      0.90      0.90       190
weighted avg       0.94      0.94      0.94       190

Fold 2/3 - Validation Accuracy: 0.9684
Classification Report:
              precision    recall  f1-score   support

Non-Repeater       0.98      0.99      0.98       159
    Repeater       0.93      0.87      0.90        31

    accuracy                           0.97       190
   macro avg       0.95      0.93      0.94       190
weighted avg       0.97      0.97      0.97       190

Fold 3/3 - Validation Accuracy: 0.9579
Classification Report:
              precision    recall  f1-score   support

Non-Repeater       0.99      0.96      0.97       158
    Repeater       0.83      0.94      0.88        32

    accuracy                           0.96       190
   macro avg       0.91      0.95      0.93       190
weighted avg       0.96      0.96      0.96       190

Trial 300 - Average Validation Accuracy: 0.9561
Fold 1/3 - Validation Accuracy: 0.9579
Classification Report:
              precision    recall  f1-score   support

Non-Repeater       0.96      0.99      0.98       159
    Repeater       0.93      0.81      0.86        31

    accuracy                           0.96       190
   macro avg       0.94      0.90      0.92       190
weighted avg       0.96      0.96      0.96       190

Fold 2/3 - Validation Accuracy: 0.9737
Classification Report:
              precision    recall  f1-score   support

Non-Repeater       0.98      0.99      0.98       159
    Repeater       0.93      0.90      0.92        31

    accuracy                           0.97       190
   macro avg       0.96      0.95      0.95       190
weighted avg       0.97      0.97      0.97       190

Fold 3/3 - Validation Accuracy: 0.9632
Classification Report:
              precision    recall  f1-score   support

Non-Repeater       0.99      0.97      0.98       158
    Repeater       0.86      0.94      0.90        32

    accuracy                           0.96       190
   macro avg       0.92      0.95      0.94       190
weighted avg       0.97      0.96      0.96       190

Trial 301 - Average Validation Accuracy: 0.9649
Fold 1/3 - Validation Accuracy: 0.9579
Classification Report:
              precision    recall  f1-score   support

Non-Repeater       0.98      0.97      0.97       159
    Repeater       0.85      0.90      0.88        31

    accuracy                           0.96       190
   macro avg       0.91      0.94      0.92       190
weighted avg       0.96      0.96      0.96       190

Fold 2/3 - Validation Accuracy: 0.9789
Classification Report:
              precision    recall  f1-score   support

Non-Repeater       0.98      0.99      0.99       159
    Repeater       0.97      0.90      0.93        31

    accuracy                           0.98       190
   macro avg       0.97      0.95      0.96       190
weighted avg       0.98      0.98      0.98       190

Fold 3/3 - Validation Accuracy: 0.9684
Classification Report:
              precision    recall  f1-score   support

Non-Repeater       0.98      0.98      0.98       158
    Repeater       0.91      0.91      0.91        32

    accuracy                           0.97       190
   macro avg       0.94      0.94      0.94       190
weighted avg       0.97      0.97      0.97       190

Trial 302 - Average Validation Accuracy: 0.9684
Fold 1/3 - Validation Accuracy: 0.9316
Classification Report:
              precision    recall  f1-score   support

Non-Repeater       0.95      0.97      0.96       159
    Repeater       0.82      0.74      0.78        31

    accuracy                           0.93       190
   macro avg       0.89      0.86      0.87       190
weighted avg       0.93      0.93      0.93       190

Fold 2/3 - Validation Accuracy: 0.9211
Classification Report:
              precision    recall  f1-score   support

Non-Repeater       0.93      0.97      0.95       159
    Repeater       0.83      0.65      0.73        31

    accuracy                           0.92       190
   macro avg       0.88      0.81      0.84       190
weighted avg       0.92      0.92      0.92       190

Fold 3/3 - Validation Accuracy: 0.9474
Classification Report:
              precision    recall  f1-score   support

Non-Repeater       0.97      0.96      0.97       158
    Repeater       0.82      0.88      0.85        32

    accuracy                           0.95       190
   macro avg       0.90      0.92      0.91       190
weighted avg       0.95      0.95      0.95       190

Trial 303 - Average Validation Accuracy: 0.9333
Fold 1/3 - Validation Accuracy: 0.9632
Classification Report:
              precision    recall  f1-score   support

Non-Repeater       0.97      0.99      0.98       159
    Repeater       0.93      0.84      0.88        31

    accuracy                           0.96       190
   macro avg       0.95      0.91      0.93       190
weighted avg       0.96      0.96      0.96       190

Fold 2/3 - Validation Accuracy: 0.9684
Classification Report:
              precision    recall  f1-score   support

Non-Repeater       0.97      0.99      0.98       159
    Repeater       0.96      0.84      0.90        31

    accuracy                           0.97       190
   macro avg       0.97      0.92      0.94       190
weighted avg       0.97      0.97      0.97       190

Fold 3/3 - Validation Accuracy: 0.9632
Classification Report:
              precision    recall  f1-score   support

Non-Repeater       0.98      0.97      0.98       158
    Repeater       0.88      0.91      0.89        32

    accuracy                           0.96       190
   macro avg       0.93      0.94      0.94       190
weighted avg       0.96      0.96      0.96       190

Trial 304 - Average Validation Accuracy: 0.9649
Fold 1/3 - Validation Accuracy: 0.9474
Classification Report:
              precision    recall  f1-score   support

Non-Repeater       0.95      0.99      0.97       159
    Repeater       0.96      0.71      0.81        31

    accuracy                           0.95       190
   macro avg       0.95      0.85      0.89       190
weighted avg       0.95      0.95      0.94       190

Fold 2/3 - Validation Accuracy: 0.9421
Classification Report:
              precision    recall  f1-score   support

Non-Repeater       0.94      0.99      0.97       159
    Repeater       0.95      0.68      0.79        31

    accuracy                           0.94       190
   macro avg       0.95      0.84      0.88       190
weighted avg       0.94      0.94      0.94       190

Fold 3/3 - Validation Accuracy: 0.9368
Classification Report:
              precision    recall  f1-score   support

Non-Repeater       0.94      0.99      0.96       158
    Repeater       0.92      0.69      0.79        32

    accuracy                           0.94       190
   macro avg       0.93      0.84      0.87       190
weighted avg       0.94      0.94      0.93       190

Trial 305 - Average Validation Accuracy: 0.9421
Fold 1/3 - Validation Accuracy: 0.9316
Classification Report:
[I 2025-08-31 16:39:43,430] Trial 306 finished with value: 0.9543859649122807 and parameters: {'hidden_dim': 1519, 'latent_dim': 39, 'beta': 1.9728994371105102, 'gamma': 1.5235111109373727, 'dropout_rate': 0.11255008485225998, 'lr': 0.0007038228246810184, 'scheduler_patience': 7, 'class_weight': 0.9483034912896209, 'activation': 'LeakyReLU', 'classification_multiplier': 12633.786099523508}. Best is trial 255 with value: 0.9736842105263158.
[I 2025-08-31 16:40:09,211] Trial 307 finished with value: 0.9666666666666667 and parameters: {'hidden_dim': 1440, 'latent_dim': 39, 'beta': 0.36446477254151444, 'gamma': 1.2824278617902176, 'dropout_rate': 0.1302439806782943, 'lr': 0.0004220687537889416, 'scheduler_patience': 7, 'class_weight': 0.8682053930572741, 'activation': 'ReLU', 'classification_multiplier': 11659.774086938702}. Best is trial 255 with value: 0.9736842105263158.
[I 2025-08-31 16:40:38,680] Trial 308 finished with value: 0.968421052631579 and parameters: {'hidden_dim': 1897, 'latent_dim': 38, 'beta': 1.9224397739096648, 'gamma': 1.8722324623585083, 'dropout_rate': 0.14142170717855593, 'lr': 0.00025152805731026054, 'scheduler_patience': 7, 'class_weight': 0.9812622825782673, 'activation': 'ReLU', 'classification_multiplier': 10990.849423247593}. Best is trial 255 with value: 0.9736842105263158.
[I 2025-08-31 16:41:07,356] Trial 309 finished with value: 0.968421052631579 and parameters: {'hidden_dim': 1838, 'latent_dim': 21, 'beta': 1.624109252464124, 'gamma': 0.46595710081256997, 'dropout_rate': 0.10658562823574311, 'lr': 0.00011202593781904809, 'scheduler_patience': 7, 'class_weight': 0.6679970517980028, 'activation': 'ReLU', 'classification_multiplier': 10642.517048766365}. Best is trial 255 with value: 0.9736842105263158.
