[I 2025-08-31 16:47:25,674] Trial 323 finished with value: 0.9666666666666667 and parameters: {'hidden_dim': 1857, 'latent_dim': 27, 'beta': 1.9044558893521477, 'gamma': 1.6023191182868228, 'dropout_rate': 0.10858072019275924, 'lr': 0.0004806417522664851, 'scheduler_patience': 7, 'class_weight': 0.9152740184719028, 'activation': 'ReLU', 'classification_multiplier': 12777.901258506306}. Best is trial 255 with value: 0.9736842105263158.
[I 2025-08-31 16:47:53,488] Trial 324 finished with value: 0.9421052631578948 and parameters: {'hidden_dim': 1726, 'latent_dim': 40, 'beta': 1.9637658017731086, 'gamma': 1.035380676567471, 'dropout_rate': 0.11734196368421815, 'lr': 0.0003965466418035211, 'scheduler_patience': 7, 'class_weight': 0.9055110144130358, 'activation': 'ELU', 'classification_multiplier': 5873.645746285705}. Best is trial 255 with value: 0.9736842105263158.
[I 2025-08-31 16:48:21,369] Trial 325 finished with value: 0.968421052631579 and parameters: {'hidden_dim': 1718, 'latent_dim': 36, 'beta': 1.8506068751149156, 'gamma': 1.7889474350561159, 'dropout_rate': 0.13383110293613912, 'lr': 0.0005990522205542724, 'scheduler_patience': 7, 'class_weight': 0.933829505600315, 'activation': 'ReLU', 'classification_multiplier': 9842.76270203493}. Best is trial 255 with value: 0.9736842105263158.
              precision    recall  f1-score   support

Non-Repeater       0.98      0.99      0.99       159
    Repeater       0.97      0.90      0.93        31

    accuracy                           0.98       190
   macro avg       0.97      0.95      0.96       190
weighted avg       0.98      0.98      0.98       190

Fold 3/3 - Validation Accuracy: 0.9632
Classification Report:
              precision    recall  f1-score   support

Non-Repeater       0.98      0.97      0.98       158
    Repeater       0.88      0.91      0.89        32

    accuracy                           0.96       190
   macro avg       0.93      0.94      0.94       190
weighted avg       0.96      0.96      0.96       190

Trial 319 - Average Validation Accuracy: 0.9649
Fold 1/3 - Validation Accuracy: 0.9263
Classification Report:
              precision    recall  f1-score   support

Non-Repeater       0.94      0.97      0.96       159
    Repeater       0.81      0.71      0.76        31

    accuracy                           0.93       190
   macro avg       0.88      0.84      0.86       190
weighted avg       0.92      0.93      0.92       190

Fold 2/3 - Validation Accuracy: 0.9474
Classification Report:
              precision    recall  f1-score   support

Non-Repeater       0.97      0.97      0.97       159
    Repeater       0.84      0.84      0.84        31

    accuracy                           0.95       190
   macro avg       0.90      0.90      0.90       190
weighted avg       0.95      0.95      0.95       190

Fold 3/3 - Validation Accuracy: 0.9368
Classification Report:
              precision    recall  f1-score   support

Non-Repeater       0.97      0.96      0.96       158
    Repeater       0.79      0.84      0.82        32

    accuracy                           0.94       190
   macro avg       0.88      0.90      0.89       190
weighted avg       0.94      0.94      0.94       190

Trial 320 - Average Validation Accuracy: 0.9368
Fold 1/3 - Validation Accuracy: 0.9632
Classification Report:
              precision    recall  f1-score   support

Non-Repeater       0.97      0.99      0.98       159
    Repeater       0.93      0.84      0.88        31

    accuracy                           0.96       190
   macro avg       0.95      0.91      0.93       190
weighted avg       0.96      0.96      0.96       190

Fold 2/3 - Validation Accuracy: 0.9789
Classification Report:
              precision    recall  f1-score   support

Non-Repeater       0.98      0.99      0.99       159
    Repeater       0.97      0.90      0.93        31

    accuracy                           0.98       190
   macro avg       0.97      0.95      0.96       190
weighted avg       0.98      0.98      0.98       190

Fold 3/3 - Validation Accuracy: 0.9737
Classification Report:
              precision    recall  f1-score   support

Non-Repeater       0.98      0.99      0.98       158
    Repeater       0.94      0.91      0.92        32

    accuracy                           0.97       190
   macro avg       0.96      0.95      0.95       190
weighted avg       0.97      0.97      0.97       190

Trial 321 - Average Validation Accuracy: 0.9719
Fold 1/3 - Validation Accuracy: 0.9684
Classification Report:
              precision    recall  f1-score   support

Non-Repeater       0.98      0.99      0.98       159
    Repeater       0.93      0.87      0.90        31

    accuracy                           0.97       190
   macro avg       0.95      0.93      0.94       190
weighted avg       0.97      0.97      0.97       190

Fold 2/3 - Validation Accuracy: 0.9737
Classification Report:
              precision    recall  f1-score   support

Non-Repeater       0.98      0.99      0.98       159
    Repeater       0.96      0.87      0.92        31

    accuracy                           0.97       190
   macro avg       0.97      0.93      0.95       190
weighted avg       0.97      0.97      0.97       190

Fold 3/3 - Validation Accuracy: 0.9526
Classification Report:
              precision    recall  f1-score   support

Non-Repeater       0.97      0.97      0.97       158
    Repeater       0.85      0.88      0.86        32

    accuracy                           0.95       190
   macro avg       0.91      0.92      0.92       190
weighted avg       0.95      0.95      0.95       190

Trial 322 - Average Validation Accuracy: 0.9649
Fold 1/3 - Validation Accuracy: 0.9579
Classification Report:
              precision    recall  f1-score   support

Non-Repeater       0.97      0.97      0.97       159
    Repeater       0.87      0.87      0.87        31

    accuracy                           0.96       190
   macro avg       0.92      0.92      0.92       190
weighted avg       0.96      0.96      0.96       190

Fold 2/3 - Validation Accuracy: 0.9737
Classification Report:
              precision    recall  f1-score   support

Non-Repeater       0.98      0.99      0.98       159
    Repeater       0.96      0.87      0.92        31

    accuracy                           0.97       190
   macro avg       0.97      0.93      0.95       190
weighted avg       0.97      0.97      0.97       190

Fold 3/3 - Validation Accuracy: 0.9684
Classification Report:
              precision    recall  f1-score   support

Non-Repeater       0.97      0.99      0.98       158
    Repeater       0.93      0.88      0.90        32

    accuracy                           0.97       190
   macro avg       0.95      0.93      0.94       190
weighted avg       0.97      0.97      0.97       190

Trial 323 - Average Validation Accuracy: 0.9667
Fold 1/3 - Validation Accuracy: 0.9368
Classification Report:
              precision    recall  f1-score   support

Non-Repeater       0.95      0.97      0.96       159
    Repeater       0.85      0.74      0.79        31

    accuracy                           0.94       190
   macro avg       0.90      0.86      0.88       190
weighted avg       0.93      0.94      0.94       190

Fold 2/3 - Validation Accuracy: 0.9421
Classification Report:
              precision    recall  f1-score   support

Non-Repeater       0.95      0.99      0.97       159
    Repeater       0.92      0.71      0.80        31

    accuracy                           0.94       190
   macro avg       0.93      0.85      0.88       190
weighted avg       0.94      0.94      0.94       190

Fold 3/3 - Validation Accuracy: 0.9474
Classification Report:
              precision    recall  f1-score   support

Non-Repeater       0.97      0.97      0.97       158
    Repeater       0.84      0.84      0.84        32

    accuracy                           0.95       190
   macro avg       0.91      0.91      0.91       190
weighted avg       0.95      0.95      0.95       190

Trial 324 - Average Validation Accuracy: 0.9421
Fold 1/3 - Validation Accuracy: 0.9632
Classification Report:
              precision    recall  f1-score   support

Non-Repeater       0.97      0.98      0.98       159
    Repeater       0.90      0.87      0.89        31

    accuracy                           0.96       190
   macro avg       0.94      0.93      0.93       190
weighted avg       0.96      0.96      0.96       190

Fold 2/3 - Validation Accuracy: 0.9737
Classification Report:
              precision    recall  f1-score   support

Non-Repeater       0.98      0.99      0.98       159
    Repeater       0.96      0.87      0.92        31

    accuracy                           0.97       190
   macro avg       0.97      0.93      0.95       190
weighted avg       0.97      0.97      0.97       190

Fold 3/3 - Validation Accuracy: 0.9684
Classification Report:
              precision    recall  f1-score   support

Non-Repeater       0.97      0.99      0.98       158
    Repeater       0.93      0.88      0.90        32

    accuracy                           0.97       190
   macro avg       0.95      0.93      0.94       190
weighted avg       0.97      0.97      0.97       190

Trial 325 - Average Validation Accuracy: 0.9684
Fold 1/3 - Validation Accuracy: 0.9368
Classification Report:
[I 2025-08-31 16:48:50,107] Trial 326 finished with value: 0.9578947368421052 and parameters: {'hidden_dim': 1801, 'latent_dim': 32, 'beta': 1.9349394284242174, 'gamma': 1.5748280882025703, 'dropout_rate': 0.24795753997881956, 'lr': 0.00028567572074498045, 'scheduler_patience': 7, 'class_weight': 0.8909782552653591, 'activation': 'ReLU', 'classification_multiplier': 13114.855388866128}. Best is trial 255 with value: 0.9736842105263158.
[I 2025-08-31 16:49:12,677] Trial 327 finished with value: 0.9666666666666667 and parameters: {'hidden_dim': 922, 'latent_dim': 38, 'beta': 1.9668755334779382, 'gamma': 1.8927003388844081, 'dropout_rate': 0.10117847778800085, 'lr': 0.0009682278382758514, 'scheduler_patience': 7, 'class_weight': 0.9213957927168237, 'activation': 'ReLU', 'classification_multiplier': 10182.544716236687}. Best is trial 255 with value: 0.9736842105263158.
[I 2025-08-31 16:49:40,968] Trial 328 finished with value: 0.9315789473684211 and parameters: {'hidden_dim': 1770, 'latent_dim': 39, 'beta': 1.907179776009227, 'gamma': 1.5290312271719426, 'dropout_rate': 0.15323257307969462, 'lr': 0.0006826377347554579, 'scheduler_patience': 7, 'class_weight': 0.9541596993849952, 'activation': 'SELU', 'classification_multiplier': 11335.2539003873}. Best is trial 255 with value: 0.9736842105263158.
[I 2025-08-31 16:50:06,466] Trial 329 finished with value: 0.9719298245614035 and parameters: {'hidden_dim': 1415, 'latent_dim': 17, 'beta': 1.880341484564073, 'gamma': 1.8123996432320661, 'dropout_rate': 0.1129924567243411, 'lr': 0.000440144897612676, 'scheduler_patience': 7, 'class_weight': 0.8655114646131519, 'activation': 'ReLU', 'classification_multiplier': 12238.47311208377}. Best is trial 255 with value: 0.9736842105263158.
[I 2025-08-31 16:50:31,893] Trial 330 finished with value: 0.9736842105263158 and parameters: {'hidden_dim': 1434, 'latent_dim': 17, 'beta': 1.8665865753585607, 'gamma': 1.416806643595685, 'dropout_rate': 0.11009552891335157, 'lr': 0.0001032564700716145, 'scheduler_patience': 7, 'class_weight': 0.8657180808345424, 'activation': 'ReLU', 'classification_multiplier': 12236.918788355179}. Best is trial 255 with value: 0.9736842105263158.
[I 2025-08-31 16:50:57,938] Trial 331 finished with value: 0.9543859649122807 and parameters: {'hidden_dim': 1413, 'latent_dim': 17, 'beta': 1.8297905887482817, 'gamma': 1.4122676019484193, 'dropout_rate': 0.3050070323335677, 'lr': 0.0002545431121727931, 'scheduler_patience': 7, 'class_weight': 0.8372105608377322, 'activation': 'ReLU', 'classification_multiplier': 12274.752134749491}. Best is trial 255 with value: 0.9736842105263158.
              precision    recall  f1-score   support

Non-Repeater       0.96      0.97      0.96       159
    Repeater       0.83      0.77      0.80        31

    accuracy                           0.94       190
   macro avg       0.89      0.87      0.88       190
weighted avg       0.94      0.94      0.94       190

Fold 2/3 - Validation Accuracy: 0.9684
Classification Report:
              precision    recall  f1-score   support

Non-Repeater       0.97      0.99      0.98       159
    Repeater       0.96      0.84      0.90        31

    accuracy                           0.97       190
   macro avg       0.97      0.92      0.94       190
weighted avg       0.97      0.97      0.97       190

Fold 3/3 - Validation Accuracy: 0.9684
Classification Report:
              precision    recall  f1-score   support

Non-Repeater       0.99      0.97      0.98       158
    Repeater       0.88      0.94      0.91        32

    accuracy                           0.97       190
   macro avg       0.93      0.96      0.94       190
weighted avg       0.97      0.97      0.97       190

Trial 326 - Average Validation Accuracy: 0.9579
Fold 1/3 - Validation Accuracy: 0.9632
Classification Report:
              precision    recall  f1-score   support

Non-Repeater       0.97      0.99      0.98       159
    Repeater       0.93      0.84      0.88        31

    accuracy                           0.96       190
   macro avg       0.95      0.91      0.93       190
weighted avg       0.96      0.96      0.96       190

Fold 2/3 - Validation Accuracy: 0.9737
Classification Report:
              precision    recall  f1-score   support

Non-Repeater       0.98      0.99      0.98       159
    Repeater       0.96      0.87      0.92        31

    accuracy                           0.97       190
   macro avg       0.97      0.93      0.95       190
weighted avg       0.97      0.97      0.97       190

Fold 3/3 - Validation Accuracy: 0.9632
Classification Report:
              precision    recall  f1-score   support

Non-Repeater       0.96      0.99      0.98       158
    Repeater       0.96      0.81      0.88        32

    accuracy                           0.96       190
   macro avg       0.96      0.90      0.93       190
weighted avg       0.96      0.96      0.96       190

Trial 327 - Average Validation Accuracy: 0.9667
Fold 1/3 - Validation Accuracy: 0.9263
Classification Report:
              precision    recall  f1-score   support

Non-Repeater       0.94      0.97      0.96       159
    Repeater       0.81      0.71      0.76        31

    accuracy                           0.93       190
   macro avg       0.88      0.84      0.86       190
weighted avg       0.92      0.93      0.92       190

Fold 2/3 - Validation Accuracy: 0.9263
Classification Report:
              precision    recall  f1-score   support

Non-Repeater       0.94      0.97      0.96       159
    Repeater       0.84      0.68      0.75        31

    accuracy                           0.93       190
   macro avg       0.89      0.83      0.85       190
weighted avg       0.92      0.93      0.92       190

Fold 3/3 - Validation Accuracy: 0.9421
Classification Report:
              precision    recall  f1-score   support

Non-Repeater       0.97      0.96      0.96       158
    Repeater       0.80      0.88      0.84        32

    accuracy                           0.94       190
   macro avg       0.89      0.92      0.90       190
weighted avg       0.94      0.94      0.94       190

Trial 328 - Average Validation Accuracy: 0.9316
Fold 1/3 - Validation Accuracy: 0.9684
Classification Report:
              precision    recall  f1-score   support

Non-Repeater       0.98      0.98      0.98       159
    Repeater       0.90      0.90      0.90        31

    accuracy                           0.97       190
   macro avg       0.94      0.94      0.94       190
weighted avg       0.97      0.97      0.97       190

Fold 2/3 - Validation Accuracy: 0.9789
Classification Report:
              precision    recall  f1-score   support

Non-Repeater       0.98      0.99      0.99       159
    Repeater       0.97      0.90      0.93        31

    accuracy                           0.98       190
   macro avg       0.97      0.95      0.96       190
weighted avg       0.98      0.98      0.98       190

Fold 3/3 - Validation Accuracy: 0.9684
Classification Report:
              precision    recall  f1-score   support

Non-Repeater       0.97      0.99      0.98       158
    Repeater       0.96      0.84      0.90        32

    accuracy                           0.97       190
   macro avg       0.97      0.92      0.94       190
weighted avg       0.97      0.97      0.97       190

Trial 329 - Average Validation Accuracy: 0.9719
Fold 1/3 - Validation Accuracy: 0.9579
Classification Report:
              precision    recall  f1-score   support

Non-Repeater       0.97      0.97      0.97       159
    Repeater       0.87      0.87      0.87        31

    accuracy                           0.96       190
   macro avg       0.92      0.92      0.92       190
weighted avg       0.96      0.96      0.96       190

Fold 2/3 - Validation Accuracy: 0.9842
Classification Report:
              precision    recall  f1-score   support

Non-Repeater       0.99      0.99      0.99       159
    Repeater       0.97      0.94      0.95        31

    accuracy                           0.98       190
   macro avg       0.98      0.96      0.97       190
weighted avg       0.98      0.98      0.98       190

Fold 3/3 - Validation Accuracy: 0.9789
Classification Report:
              precision    recall  f1-score   support

Non-Repeater       0.98      0.99      0.99       158
    Repeater       0.97      0.91      0.94        32

    accuracy                           0.98       190
   macro avg       0.97      0.95      0.96       190
weighted avg       0.98      0.98      0.98       190

Trial 330 - Average Validation Accuracy: 0.9737
Fold 1/3 - Validation Accuracy: 0.9421
Classification Report:
              precision    recall  f1-score   support

Non-Repeater       0.95      0.98      0.97       159
    Repeater       0.88      0.74      0.81        31

    accuracy                           0.94       190
   macro avg       0.92      0.86      0.89       190
weighted avg       0.94      0.94      0.94       190

Fold 2/3 - Validation Accuracy: 0.9579
Classification Report:
              precision    recall  f1-score   support

Non-Repeater       0.96      0.99      0.98       159
    Repeater       0.93      0.81      0.86        31

    accuracy                           0.96       190
   macro avg       0.94      0.90      0.92       190
weighted avg       0.96      0.96      0.96       190

Fold 3/3 - Validation Accuracy: 0.9632
Classification Report:
              precision    recall  f1-score   support

Non-Repeater       0.98      0.97      0.98       158
    Repeater       0.88      0.91      0.89        32

    accuracy                           0.96       190
   macro avg       0.93      0.94      0.94       190
weighted avg       0.96      0.96      0.96       190

Trial 331 - Average Validation Accuracy: 0.9544
Fold 1/3 - Validation Accuracy: 0.9684
Classification Report:
              precision    recall  f1-score   support

Non-Repeater       0.98      0.99      0.98       159
    Repeater       0.93      0.87      0.90        31

    accuracy                           0.97       190
   macro avg       0.95      0.93      0.94       190
weighted avg       0.97      0.97      0.97       190

Fold 2/3 - Validation Accuracy: 0.9789
Classification Report:
              precision    recall  f1-score   support

Non-Repeater       0.98      0.99      0.99       159
    Repeater       0.97      0.90      0.93        31

    accuracy                           0.98       190
   macro avg       0.97      0.95      0.96       190
weighted avg       0.98      0.98      0.98       190

Fold 3/3 - Validation Accuracy: 0.9789
Classification Report:
[I 2025-08-31 16:51:23,441] Trial 332 finished with value: 0.9754385964912281 and parameters: {'hidden_dim': 1444, 'latent_dim': 16, 'beta': 1.8730554103241046, 'gamma': 1.4481280485077974, 'dropout_rate': 0.10689151034257464, 'lr': 0.00011237260931706744, 'scheduler_patience': 7, 'class_weight': 0.8571344632996859, 'activation': 'ReLU', 'classification_multiplier': 12455.804301750832}. Best is trial 332 with value: 0.9754385964912281.
[I 2025-08-31 16:51:49,008] Trial 333 finished with value: 0.9596491228070176 and parameters: {'hidden_dim': 1448, 'latent_dim': 16, 'beta': 1.863399834415936, 'gamma': 1.4646262811300503, 'dropout_rate': 0.22880506599268377, 'lr': 0.00010404301484639524, 'scheduler_patience': 7, 'class_weight': 0.8593951083504843, 'activation': 'ReLU', 'classification_multiplier': 12560.30363718229}. Best is trial 332 with value: 0.9754385964912281.
[I 2025-08-31 16:52:10,430] Trial 334 finished with value: 0.9649122807017544 and parameters: {'hidden_dim': 522, 'latent_dim': 16, 'beta': 1.7934082349045743, 'gamma': 1.4996447298121085, 'dropout_rate': 0.1004340464020026, 'lr': 0.00028456984194224225, 'scheduler_patience': 7, 'class_weight': 0.8677895014954574, 'activation': 'ReLU', 'classification_multiplier': 12814.259493023526}. Best is trial 332 with value: 0.9754385964912281.
[I 2025-08-31 16:52:36,387] Trial 335 finished with value: 0.9614035087719298 and parameters: {'hidden_dim': 1483, 'latent_dim': 18, 'beta': 1.832556088058067, 'gamma': 1.4624726880162313, 'dropout_rate': 0.10833912051653671, 'lr': 0.000106480593635095, 'scheduler_patience': 7, 'class_weight': 0.8199270270208858, 'activation': 'GELU', 'classification_multiplier': 12222.537711758321}. Best is trial 332 with value: 0.9754385964912281.
