[I 2025-08-31 16:11:48,749] Trial 245 finished with value: 0.9596491228070175 and parameters: {'hidden_dim': 1663, 'latent_dim': 37, 'beta': 1.8528590720840974, 'gamma': 1.7535116053171373, 'dropout_rate': 0.11739134589058213, 'lr': 0.0003111326024940149, 'scheduler_patience': 7, 'class_weight': 0.9788308426305946, 'activation': 'ReLU', 'classification_multiplier': 11686.34277643722}. Best is trial 111 with value: 0.9719298245614035.
              precision    recall  f1-score   support

Non-Repeater       0.95      0.99      0.97       159
    Repeater       0.92      0.74      0.82        31

    accuracy                           0.95       190
   macro avg       0.94      0.86      0.90       190
weighted avg       0.95      0.95      0.95       190

Fold 3/3 - Validation Accuracy: 0.9474
Classification Report:
              precision    recall  f1-score   support

Non-Repeater       0.97      0.96      0.97       158
    Repeater       0.82      0.88      0.85        32

    accuracy                           0.95       190
   macro avg       0.90      0.92      0.91       190
weighted avg       0.95      0.95      0.95       190

Trial 239 - Average Validation Accuracy: 0.9421
Fold 1/3 - Validation Accuracy: 0.9632
Classification Report:
              precision    recall  f1-score   support

Non-Repeater       0.98      0.97      0.98       159
    Repeater       0.88      0.90      0.89        31

    accuracy                           0.96       190
   macro avg       0.93      0.94      0.93       190
weighted avg       0.96      0.96      0.96       190

Fold 2/3 - Validation Accuracy: 0.9737
Classification Report:
              precision    recall  f1-score   support

Non-Repeater       0.98      0.99      0.98       159
    Repeater       0.96      0.87      0.92        31

    accuracy                           0.97       190
   macro avg       0.97      0.93      0.95       190
weighted avg       0.97      0.97      0.97       190

Fold 3/3 - Validation Accuracy: 0.9632
Classification Report:
              precision    recall  f1-score   support

Non-Repeater       0.97      0.99      0.98       158
    Repeater       0.93      0.84      0.89        32

    accuracy                           0.96       190
   macro avg       0.95      0.92      0.93       190
weighted avg       0.96      0.96      0.96       190

Trial 240 - Average Validation Accuracy: 0.9667
Fold 1/3 - Validation Accuracy: 0.9579
Classification Report:
              precision    recall  f1-score   support

Non-Repeater       0.97      0.98      0.97       159
    Repeater       0.90      0.84      0.87        31

    accuracy                           0.96       190
   macro avg       0.93      0.91      0.92       190
weighted avg       0.96      0.96      0.96       190

Fold 2/3 - Validation Accuracy: 0.9737
Classification Report:
              precision    recall  f1-score   support

Non-Repeater       0.98      0.99      0.98       159
    Repeater       0.96      0.87      0.92        31

    accuracy                           0.97       190
   macro avg       0.97      0.93      0.95       190
weighted avg       0.97      0.97      0.97       190

Fold 3/3 - Validation Accuracy: 0.9684
Classification Report:
              precision    recall  f1-score   support

Non-Repeater       0.98      0.98      0.98       158
    Repeater       0.91      0.91      0.91        32

    accuracy                           0.97       190
   macro avg       0.94      0.94      0.94       190
weighted avg       0.97      0.97      0.97       190

Trial 241 - Average Validation Accuracy: 0.9667
Fold 1/3 - Validation Accuracy: 0.9474
Classification Report:
              precision    recall  f1-score   support

Non-Repeater       0.96      0.98      0.97       159
    Repeater       0.89      0.77      0.83        31

    accuracy                           0.95       190
   macro avg       0.92      0.88      0.90       190
weighted avg       0.95      0.95      0.95       190

Fold 2/3 - Validation Accuracy: 0.9737
Classification Report:
              precision    recall  f1-score   support

Non-Repeater       0.98      0.99      0.98       159
    Repeater       0.96      0.87      0.92        31

    accuracy                           0.97       190
   macro avg       0.97      0.93      0.95       190
weighted avg       0.97      0.97      0.97       190

Fold 3/3 - Validation Accuracy: 0.9632
Classification Report:
              precision    recall  f1-score   support

Non-Repeater       0.97      0.98      0.98       158
    Repeater       0.90      0.88      0.89        32

    accuracy                           0.96       190
   macro avg       0.94      0.93      0.93       190
weighted avg       0.96      0.96      0.96       190

Trial 242 - Average Validation Accuracy: 0.9614
Fold 1/3 - Validation Accuracy: 0.9579
Classification Report:
              precision    recall  f1-score   support

Non-Repeater       0.96      0.99      0.98       159
    Repeater       0.96      0.77      0.86        31

    accuracy                           0.96       190
   macro avg       0.96      0.88      0.92       190
weighted avg       0.96      0.96      0.96       190

Fold 2/3 - Validation Accuracy: 0.9684
Classification Report:
              precision    recall  f1-score   support

Non-Repeater       0.97      0.99      0.98       159
    Repeater       0.96      0.84      0.90        31

    accuracy                           0.97       190
   macro avg       0.97      0.92      0.94       190
weighted avg       0.97      0.97      0.97       190

Fold 3/3 - Validation Accuracy: 0.9737
Classification Report:
              precision    recall  f1-score   support

Non-Repeater       0.98      0.99      0.98       158
    Repeater       0.94      0.91      0.92        32

    accuracy                           0.97       190
   macro avg       0.96      0.95      0.95       190
weighted avg       0.97      0.97      0.97       190

Trial 243 - Average Validation Accuracy: 0.9667
Fold 1/3 - Validation Accuracy: 0.9474
Classification Report:
              precision    recall  f1-score   support

Non-Repeater       0.97      0.97      0.97       159
    Repeater       0.84      0.84      0.84        31

    accuracy                           0.95       190
   macro avg       0.90      0.90      0.90       190
weighted avg       0.95      0.95      0.95       190

Fold 2/3 - Validation Accuracy: 0.9789
Classification Report:
              precision    recall  f1-score   support

Non-Repeater       0.98      0.99      0.99       159
    Repeater       0.97      0.90      0.93        31

    accuracy                           0.98       190
   macro avg       0.97      0.95      0.96       190
weighted avg       0.98      0.98      0.98       190

Fold 3/3 - Validation Accuracy: 0.9789
Classification Report:
              precision    recall  f1-score   support

Non-Repeater       0.99      0.99      0.99       158
    Repeater       0.94      0.94      0.94        32

    accuracy                           0.98       190
   macro avg       0.96      0.96      0.96       190
weighted avg       0.98      0.98      0.98       190

Trial 244 - Average Validation Accuracy: 0.9684
Fold 1/3 - Validation Accuracy: 0.9474
Classification Report:
              precision    recall  f1-score   support

Non-Repeater       0.97      0.97      0.97       159
    Repeater       0.84      0.84      0.84        31

    accuracy                           0.95       190
   macro avg       0.90      0.90      0.90       190
weighted avg       0.95      0.95      0.95       190

Fold 2/3 - Validation Accuracy: 0.9632
Classification Report:
              precision    recall  f1-score   support

Non-Repeater       0.96      0.99      0.98       159
    Repeater       0.96      0.81      0.88        31

    accuracy                           0.96       190
   macro avg       0.96      0.90      0.93       190
weighted avg       0.96      0.96      0.96       190

Fold 3/3 - Validation Accuracy: 0.9684
Classification Report:
              precision    recall  f1-score   support

Non-Repeater       0.99      0.97      0.98       158
    Repeater       0.88      0.94      0.91        32

    accuracy                           0.97       190
   macro avg       0.93      0.96      0.94       190
weighted avg       0.97      0.97      0.97       190

Trial 245 - Average Validation Accuracy: 0.9596
Fold 1/3 - Validation Accuracy: 0.9474
Classification Report:
[I 2025-08-31 16:12:15,123] Trial 246 finished with value: 0.9649122807017544 and parameters: {'hidden_dim': 1513, 'latent_dim': 39, 'beta': 1.6048191967834657, 'gamma': 1.8119372280714525, 'dropout_rate': 0.10089722960998108, 'lr': 0.0005134909597812518, 'scheduler_patience': 7, 'class_weight': 0.9269135649035725, 'activation': 'ReLU', 'classification_multiplier': 11860.580590675014}. Best is trial 111 with value: 0.9719298245614035.
[I 2025-08-31 16:12:41,788] Trial 247 finished with value: 0.9666666666666667 and parameters: {'hidden_dim': 1564, 'latent_dim': 38, 'beta': 1.9028563911056178, 'gamma': 1.76986284009591, 'dropout_rate': 0.11515173409143117, 'lr': 0.0003066097903010931, 'scheduler_patience': 7, 'class_weight': 0.9498153021248277, 'activation': 'ReLU', 'classification_multiplier': 12265.64780749234}. Best is trial 111 with value: 0.9719298245614035.
[I 2025-08-31 16:13:09,362] Trial 248 finished with value: 0.9578947368421052 and parameters: {'hidden_dim': 1700, 'latent_dim': 34, 'beta': 1.7918764610544458, 'gamma': 1.8929362994580967, 'dropout_rate': 0.10023802385694817, 'lr': 0.0006773295848118062, 'scheduler_patience': 7, 'class_weight': 0.9860374215063857, 'activation': 'ReLU', 'classification_multiplier': 12577.493041789188}. Best is trial 111 with value: 0.9719298245614035.
[I 2025-08-31 16:13:37,761] Trial 249 finished with value: 0.9421052631578948 and parameters: {'hidden_dim': 1781, 'latent_dim': 40, 'beta': 1.1053296350509663, 'gamma': 1.676412378403099, 'dropout_rate': 0.122672720001238, 'lr': 0.00044731787883715715, 'scheduler_patience': 7, 'class_weight': 0.9994446580963333, 'activation': 'SELU', 'classification_multiplier': 12063.357349003876}. Best is trial 111 with value: 0.9719298245614035.
[I 2025-08-31 16:14:04,733] Trial 250 finished with value: 0.9666666666666667 and parameters: {'hidden_dim': 1630, 'latent_dim': 36, 'beta': 1.9307110252689532, 'gamma': 1.8155572051658604, 'dropout_rate': 0.1112923950894574, 'lr': 0.000286339993980179, 'scheduler_patience': 7, 'class_weight': 0.9660111721622606, 'activation': 'ReLU', 'classification_multiplier': 11527.42831864835}. Best is trial 111 with value: 0.9719298245614035.
[I 2025-08-31 16:14:31,499] Trial 251 finished with value: 0.9526315789473684 and parameters: {'hidden_dim': 1594, 'latent_dim': 37, 'beta': 1.7093003070863246, 'gamma': 1.8574673893924543, 'dropout_rate': 0.13075300723351693, 'lr': 0.0041217039665492955, 'scheduler_patience': 7, 'class_weight': 0.9110438038840815, 'activation': 'ReLU', 'classification_multiplier': 11743.49804027994}. Best is trial 111 with value: 0.9719298245614035.
              precision    recall  f1-score   support

Non-Repeater       0.97      0.97      0.97       159
    Repeater       0.84      0.84      0.84        31

    accuracy                           0.95       190
   macro avg       0.90      0.90      0.90       190
weighted avg       0.95      0.95      0.95       190

Fold 2/3 - Validation Accuracy: 0.9789
Classification Report:
              precision    recall  f1-score   support

Non-Repeater       0.98      0.99      0.99       159
    Repeater       0.97      0.90      0.93        31

    accuracy                           0.98       190
   macro avg       0.97      0.95      0.96       190
weighted avg       0.98      0.98      0.98       190

Fold 3/3 - Validation Accuracy: 0.9684
Classification Report:
              precision    recall  f1-score   support

Non-Repeater       0.98      0.98      0.98       158
    Repeater       0.91      0.91      0.91        32

    accuracy                           0.97       190
   macro avg       0.94      0.94      0.94       190
weighted avg       0.97      0.97      0.97       190

Trial 246 - Average Validation Accuracy: 0.9649
Fold 1/3 - Validation Accuracy: 0.9632
Classification Report:
              precision    recall  f1-score   support

Non-Repeater       0.97      0.98      0.98       159
    Repeater       0.90      0.87      0.89        31

    accuracy                           0.96       190
   macro avg       0.94      0.93      0.93       190
weighted avg       0.96      0.96      0.96       190

Fold 2/3 - Validation Accuracy: 0.9737
Classification Report:
              precision    recall  f1-score   support

Non-Repeater       0.98      0.99      0.98       159
    Repeater       0.96      0.87      0.92        31

    accuracy                           0.97       190
   macro avg       0.97      0.93      0.95       190
weighted avg       0.97      0.97      0.97       190

Fold 3/3 - Validation Accuracy: 0.9632
Classification Report:
              precision    recall  f1-score   support

Non-Repeater       0.99      0.97      0.98       158
    Repeater       0.86      0.94      0.90        32

    accuracy                           0.96       190
   macro avg       0.92      0.95      0.94       190
weighted avg       0.97      0.96      0.96       190

Trial 247 - Average Validation Accuracy: 0.9667
Fold 1/3 - Validation Accuracy: 0.9421
Classification Report:
              precision    recall  f1-score   support

Non-Repeater       0.96      0.97      0.97       159
    Repeater       0.86      0.77      0.81        31

    accuracy                           0.94       190
   macro avg       0.91      0.87      0.89       190
weighted avg       0.94      0.94      0.94       190

Fold 2/3 - Validation Accuracy: 0.9737
Classification Report:
              precision    recall  f1-score   support

Non-Repeater       0.98      0.99      0.98       159
    Repeater       0.96      0.87      0.92        31

    accuracy                           0.97       190
   macro avg       0.97      0.93      0.95       190
weighted avg       0.97      0.97      0.97       190

Fold 3/3 - Validation Accuracy: 0.9579
Classification Report:
              precision    recall  f1-score   support

Non-Repeater       0.97      0.97      0.97       158
    Repeater       0.88      0.88      0.88        32

    accuracy                           0.96       190
   macro avg       0.92      0.92      0.92       190
weighted avg       0.96      0.96      0.96       190

Trial 248 - Average Validation Accuracy: 0.9579
Fold 1/3 - Validation Accuracy: 0.9316
Classification Report:
              precision    recall  f1-score   support

Non-Repeater       0.95      0.97      0.96       159
    Repeater       0.82      0.74      0.78        31

    accuracy                           0.93       190
   macro avg       0.89      0.86      0.87       190
weighted avg       0.93      0.93      0.93       190

Fold 2/3 - Validation Accuracy: 0.9368
Classification Report:
              precision    recall  f1-score   support

Non-Repeater       0.95      0.98      0.96       159
    Repeater       0.88      0.71      0.79        31

    accuracy                           0.94       190
   macro avg       0.91      0.85      0.87       190
weighted avg       0.93      0.94      0.93       190

Fold 3/3 - Validation Accuracy: 0.9579
Classification Report:
              precision    recall  f1-score   support

Non-Repeater       0.97      0.98      0.97       158
    Repeater       0.90      0.84      0.87        32

    accuracy                           0.96       190
   macro avg       0.93      0.91      0.92       190
weighted avg       0.96      0.96      0.96       190

Trial 249 - Average Validation Accuracy: 0.9421
Fold 1/3 - Validation Accuracy: 0.9526
Classification Report:
              precision    recall  f1-score   support

Non-Repeater       0.97      0.97      0.97       159
    Repeater       0.87      0.84      0.85        31

    accuracy                           0.95       190
   macro avg       0.92      0.91      0.91       190
weighted avg       0.95      0.95      0.95       190

Fold 2/3 - Validation Accuracy: 0.9789
Classification Report:
              precision    recall  f1-score   support

Non-Repeater       0.98      0.99      0.99       159
    Repeater       0.97      0.90      0.93        31

    accuracy                           0.98       190
   macro avg       0.97      0.95      0.96       190
weighted avg       0.98      0.98      0.98       190

Fold 3/3 - Validation Accuracy: 0.9684
Classification Report:
              precision    recall  f1-score   support

Non-Repeater       0.99      0.97      0.98       158
    Repeater       0.88      0.94      0.91        32

    accuracy                           0.97       190
   macro avg       0.93      0.96      0.94       190
weighted avg       0.97      0.97      0.97       190

Trial 250 - Average Validation Accuracy: 0.9667
Fold 1/3 - Validation Accuracy: 0.9474
Classification Report:
              precision    recall  f1-score   support

Non-Repeater       0.96      0.97      0.97       159
    Repeater       0.86      0.81      0.83        31

    accuracy                           0.95       190
   macro avg       0.91      0.89      0.90       190
weighted avg       0.95      0.95      0.95       190

Fold 2/3 - Validation Accuracy: 0.9526
Classification Report:
              precision    recall  f1-score   support

Non-Repeater       0.96      0.99      0.97       159
    Repeater       0.92      0.77      0.84        31

    accuracy                           0.95       190
   macro avg       0.94      0.88      0.91       190
weighted avg       0.95      0.95      0.95       190

Fold 3/3 - Validation Accuracy: 0.9579
Classification Report:
              precision    recall  f1-score   support

Non-Repeater       0.97      0.97      0.97       158
    Repeater       0.88      0.88      0.88        32

    accuracy                           0.96       190
   macro avg       0.92      0.92      0.92       190
weighted avg       0.96      0.96      0.96       190

Trial 251 - Average Validation Accuracy: 0.9526
Fold 1/3 - Validation Accuracy: 0.9632
Classification Report:
              precision    recall  f1-score   support

Non-Repeater       0.97      0.99      0.98       159
    Repeater       0.93      0.84      0.88        31

    accuracy                           0.96       190
   macro avg       0.95      0.91      0.93       190
weighted avg       0.96      0.96      0.96       190

Fold 2/3 - Validation Accuracy: 0.9684
Classification Report:
              precision    recall  f1-score   support

Non-Repeater       0.97      0.99      0.98       159
    Repeater       0.96      0.84      0.90        31

    accuracy                           0.97       190
   macro avg       0.97      0.92      0.94       190
weighted avg       0.97      0.97      0.97       190

Fold 3/3 - Validation Accuracy: 0.9579
Classification Report:
[I 2025-08-31 16:14:58,465] Trial 252 finished with value: 0.9631578947368421 and parameters: {'hidden_dim': 1543, 'latent_dim': 38, 'beta': 1.8396551124679665, 'gamma': 1.7205868850976918, 'dropout_rate': 0.12238931842942832, 'lr': 0.0008122879274057198, 'scheduler_patience': 7, 'class_weight': 0.935725774579853, 'activation': 'LeakyReLU', 'classification_multiplier': 12410.292193711799}. Best is trial 111 with value: 0.9719298245614035.
[I 2025-08-31 16:15:31,617] Trial 253 finished with value: 0.9666666666666667 and parameters: {'hidden_dim': 1651, 'latent_dim': 39, 'beta': 1.9701875511069418, 'gamma': 1.7846667226177984, 'dropout_rate': 0.10799549548080514, 'lr': 0.0001001739798086318, 'scheduler_patience': 7, 'class_weight': 0.959337226226336, 'activation': 'ReLU', 'classification_multiplier': 10506.473220668791}. Best is trial 111 with value: 0.9719298245614035.
[I 2025-08-31 16:16:01,582] Trial 254 finished with value: 0.9649122807017544 and parameters: {'hidden_dim': 1728, 'latent_dim': 39, 'beta': 1.8894912400653552, 'gamma': 1.8979707729871558, 'dropout_rate': 0.13271362604328552, 'lr': 0.0006093141133393152, 'scheduler_patience': 7, 'class_weight': 0.8915639118755391, 'activation': 'ReLU', 'classification_multiplier': 12797.60991582697}. Best is trial 111 with value: 0.9719298245614035.
[I 2025-08-31 16:16:27,575] Trial 255 finished with value: 0.9736842105263158 and parameters: {'hidden_dim': 1460, 'latent_dim': 18, 'beta': 1.9331669634233397, 'gamma': 0.2927388668800649, 'dropout_rate': 0.11726414710491831, 'lr': 0.00029472022268268235, 'scheduler_patience': 7, 'class_weight': 0.9833040431793206, 'activation': 'ReLU', 'classification_multiplier': 12162.251447940816}. Best is trial 255 with value: 0.9736842105263158.
[I 2025-08-31 16:16:54,603] Trial 256 finished with value: 0.9578947368421052 and parameters: {'hidden_dim': 1485, 'latent_dim': 40, 'beta': 1.9224706880488105, 'gamma': 1.643345213703075, 'dropout_rate': 0.1171942778610352, 'lr': 0.00026366627907934196, 'scheduler_patience': 7, 'class_weight': 0.9458909348449726, 'activation': 'GELU', 'classification_multiplier': 12209.069484833122}. Best is trial 255 with value: 0.9736842105263158.
[I 2025-08-31 16:17:24,910] Trial 257 finished with value: 0.9666666666666667 and parameters: {'hidden_dim': 1453, 'latent_dim': 18, 'beta': 1.9660323113545162, 'gamma': 0.4100218056731072, 'dropout_rate': 0.12745615296683943, 'lr': 0.00010060627957319938, 'scheduler_patience': 7, 'class_weight': 0.9228929513606414, 'activation': 'ReLU', 'classification_multiplier': 11177.981013109253}. Best is trial 255 with value: 0.9736842105263158.
