[I 2025-08-31 16:41:32,514] Trial 310 finished with value: 0.9614035087719298 and parameters: {'hidden_dim': 1363, 'latent_dim': 19, 'beta': 1.8675604589506594, 'gamma': 1.454585799501987, 'dropout_rate': 0.17292738096995894, 'lr': 0.00010520047080466035, 'scheduler_patience': 7, 'class_weight': 0.9175775106726534, 'activation': 'ReLU', 'classification_multiplier': 12370.139732810663}. Best is trial 255 with value: 0.9736842105263158.
[I 2025-08-31 16:42:00,202] Trial 311 finished with value: 0.9543859649122807 and parameters: {'hidden_dim': 1702, 'latent_dim': 40, 'beta': 1.9963956622711754, 'gamma': 1.7358856872072337, 'dropout_rate': 0.12004282372381325, 'lr': 0.0012427077271630175, 'scheduler_patience': 7, 'class_weight': 0.9652273752816564, 'activation': 'GELU', 'classification_multiplier': 11432.771912488333}. Best is trial 255 with value: 0.9736842105263158.
              precision    recall  f1-score   support

Non-Repeater       0.96      0.96      0.96       159
    Repeater       0.80      0.77      0.79        31

    accuracy                           0.93       190
   macro avg       0.88      0.87      0.87       190
weighted avg       0.93      0.93      0.93       190

Fold 2/3 - Validation Accuracy: 0.9684
Classification Report:
              precision    recall  f1-score   support

Non-Repeater       0.98      0.99      0.98       159
    Repeater       0.93      0.87      0.90        31

    accuracy                           0.97       190
   macro avg       0.95      0.93      0.94       190
weighted avg       0.97      0.97      0.97       190

Fold 3/3 - Validation Accuracy: 0.9632
Classification Report:
              precision    recall  f1-score   support

Non-Repeater       0.97      0.98      0.98       158
    Repeater       0.90      0.88      0.89        32

    accuracy                           0.96       190
   macro avg       0.94      0.93      0.93       190
weighted avg       0.96      0.96      0.96       190

Trial 306 - Average Validation Accuracy: 0.9544
Fold 1/3 - Validation Accuracy: 0.9579
Classification Report:
              precision    recall  f1-score   support

Non-Repeater       0.96      0.99      0.98       159
    Repeater       0.93      0.81      0.86        31

    accuracy                           0.96       190
   macro avg       0.94      0.90      0.92       190
weighted avg       0.96      0.96      0.96       190

Fold 2/3 - Validation Accuracy: 0.9737
Classification Report:
              precision    recall  f1-score   support

Non-Repeater       0.98      0.99      0.98       159
    Repeater       0.96      0.87      0.92        31

    accuracy                           0.97       190
   macro avg       0.97      0.93      0.95       190
weighted avg       0.97      0.97      0.97       190

Fold 3/3 - Validation Accuracy: 0.9684
Classification Report:
              precision    recall  f1-score   support

Non-Repeater       0.97      0.99      0.98       158
    Repeater       0.93      0.88      0.90        32

    accuracy                           0.97       190
   macro avg       0.95      0.93      0.94       190
weighted avg       0.97      0.97      0.97       190

Trial 307 - Average Validation Accuracy: 0.9667
Fold 1/3 - Validation Accuracy: 0.9579
Classification Report:
              precision    recall  f1-score   support

Non-Repeater       0.97      0.97      0.97       159
    Repeater       0.87      0.87      0.87        31

    accuracy                           0.96       190
   macro avg       0.92      0.92      0.92       190
weighted avg       0.96      0.96      0.96       190

Fold 2/3 - Validation Accuracy: 0.9737
Classification Report:
              precision    recall  f1-score   support

Non-Repeater       0.98      0.99      0.98       159
    Repeater       0.96      0.87      0.92        31

    accuracy                           0.97       190
   macro avg       0.97      0.93      0.95       190
weighted avg       0.97      0.97      0.97       190

Fold 3/3 - Validation Accuracy: 0.9737
Classification Report:
              precision    recall  f1-score   support

Non-Repeater       0.99      0.98      0.98       158
    Repeater       0.91      0.94      0.92        32

    accuracy                           0.97       190
   macro avg       0.95      0.96      0.95       190
weighted avg       0.97      0.97      0.97       190

Trial 308 - Average Validation Accuracy: 0.9684
Fold 1/3 - Validation Accuracy: 0.9526
Classification Report:
              precision    recall  f1-score   support

Non-Repeater       0.97      0.97      0.97       159
    Repeater       0.87      0.84      0.85        31

    accuracy                           0.95       190
   macro avg       0.92      0.91      0.91       190
weighted avg       0.95      0.95      0.95       190

Fold 2/3 - Validation Accuracy: 0.9789
Classification Report:
              precision    recall  f1-score   support

Non-Repeater       0.98      0.99      0.99       159
    Repeater       0.97      0.90      0.93        31

    accuracy                           0.98       190
   macro avg       0.97      0.95      0.96       190
weighted avg       0.98      0.98      0.98       190

Fold 3/3 - Validation Accuracy: 0.9737
Classification Report:
              precision    recall  f1-score   support

Non-Repeater       0.98      0.99      0.98       158
    Repeater       0.97      0.88      0.92        32

    accuracy                           0.97       190
   macro avg       0.97      0.93      0.95       190
weighted avg       0.97      0.97      0.97       190

Trial 309 - Average Validation Accuracy: 0.9684
Fold 1/3 - Validation Accuracy: 0.9368
Classification Report:
              precision    recall  f1-score   support

Non-Repeater       0.96      0.97      0.96       159
    Repeater       0.83      0.77      0.80        31

    accuracy                           0.94       190
   macro avg       0.89      0.87      0.88       190
weighted avg       0.94      0.94      0.94       190

Fold 2/3 - Validation Accuracy: 0.9737
Classification Report:
              precision    recall  f1-score   support

Non-Repeater       0.98      0.99      0.98       159
    Repeater       0.96      0.87      0.92        31

    accuracy                           0.97       190
   macro avg       0.97      0.93      0.95       190
weighted avg       0.97      0.97      0.97       190

Fold 3/3 - Validation Accuracy: 0.9737
Classification Report:
              precision    recall  f1-score   support

Non-Repeater       0.99      0.98      0.98       158
    Repeater       0.91      0.94      0.92        32

    accuracy                           0.97       190
   macro avg       0.95      0.96      0.95       190
weighted avg       0.97      0.97      0.97       190

Trial 310 - Average Validation Accuracy: 0.9614
Fold 1/3 - Validation Accuracy: 0.9421
Classification Report:
              precision    recall  f1-score   support

Non-Repeater       0.96      0.97      0.97       159
    Repeater       0.86      0.77      0.81        31

    accuracy                           0.94       190
   macro avg       0.91      0.87      0.89       190
weighted avg       0.94      0.94      0.94       190

Fold 2/3 - Validation Accuracy: 0.9684
Classification Report:
              precision    recall  f1-score   support

Non-Repeater       0.98      0.99      0.98       159
    Repeater       0.93      0.87      0.90        31

    accuracy                           0.97       190
   macro avg       0.95      0.93      0.94       190
weighted avg       0.97      0.97      0.97       190

Fold 3/3 - Validation Accuracy: 0.9526
Classification Report:
              precision    recall  f1-score   support

Non-Repeater       0.96      0.98      0.97       158
    Repeater       0.90      0.81      0.85        32

    accuracy                           0.95       190
   macro avg       0.93      0.90      0.91       190
weighted avg       0.95      0.95      0.95       190

Trial 311 - Average Validation Accuracy: 0.9544
Fold 1/3 - Validation Accuracy: 0.9526
Classification Report:
              precision    recall  f1-score   support

Non-Repeater       0.97      0.97      0.97       159
    Repeater       0.87      0.84      0.85        31

    accuracy                           0.95       190
   macro avg       0.92      0.91      0.91       190
weighted avg       0.95      0.95      0.95       190

Fold 2/3 - Validation Accuracy: 0.9789
Classification Report:
              precision    recall  f1-score   support

Non-Repeater       0.98      0.99      0.99       159
    Repeater       0.97      0.90      0.93        31

    accuracy                           0.98       190
   macro avg       0.97      0.95      0.96       190
weighted avg       0.98      0.98      0.98       190

Fold 3/3 - Validation Accuracy: 0.9526
Classification Report:
[I 2025-08-31 16:42:24,795] Trial 312 finished with value: 0.9614035087719298 and parameters: {'hidden_dim': 1300, 'latent_dim': 38, 'beta': 1.9391334092246422, 'gamma': 1.8290433533300083, 'dropout_rate': 0.14805017810867777, 'lr': 0.0005033884939480547, 'scheduler_patience': 7, 'class_weight': 0.9386758393505019, 'activation': 'ReLU', 'classification_multiplier': 12115.482132211017}. Best is trial 255 with value: 0.9736842105263158.
[I 2025-08-31 16:42:51,896] Trial 313 finished with value: 0.9666666666666667 and parameters: {'hidden_dim': 1634, 'latent_dim': 29, 'beta': 1.0175447113731773, 'gamma': 1.3347173147631237, 'dropout_rate': 0.10053019915720766, 'lr': 0.0008575881889893472, 'scheduler_patience': 7, 'class_weight': 0.9848841200398233, 'activation': 'ReLU', 'classification_multiplier': 13003.339700670194}. Best is trial 255 with value: 0.9736842105263158.
[I 2025-08-31 16:43:18,481] Trial 314 finished with value: 0.9614035087719298 and parameters: {'hidden_dim': 1574, 'latent_dim': 16, 'beta': 1.8262811890286799, 'gamma': 1.6481391936519636, 'dropout_rate': 0.11546251409610304, 'lr': 0.0004046074183607832, 'scheduler_patience': 7, 'class_weight': 0.9548941943762872, 'activation': 'ReLU', 'classification_multiplier': 12597.901948174522}. Best is trial 255 with value: 0.9736842105263158.
[I 2025-08-31 16:43:46,801] Trial 315 finished with value: 0.9561403508771931 and parameters: {'hidden_dim': 1757, 'latent_dim': 37, 'beta': 0.17857377325154, 'gamma': 1.7512728755273614, 'dropout_rate': 0.16101100211721298, 'lr': 0.0006273088845089688, 'scheduler_patience': 7, 'class_weight': 0.9026238567628297, 'activation': 'ReLU', 'classification_multiplier': 11779.55639071411}. Best is trial 255 with value: 0.9736842105263158.
[I 2025-08-31 16:44:12,881] Trial 316 finished with value: 0.9614035087719298 and parameters: {'hidden_dim': 1470, 'latent_dim': 39, 'beta': 1.7455016003906136, 'gamma': 0.8739485570710948, 'dropout_rate': 0.12768816883136924, 'lr': 0.0002799696457076346, 'scheduler_patience': 7, 'class_weight': 0.9980338545778913, 'activation': 'ReLU', 'classification_multiplier': 11921.115951714071}. Best is trial 255 with value: 0.9736842105263158.
[I 2025-08-31 16:44:39,287] Trial 317 finished with value: 0.9666666666666667 and parameters: {'hidden_dim': 1521, 'latent_dim': 7, 'beta': 1.8886011853207976, 'gamma': 1.5570026820244103, 'dropout_rate': 0.13874435745686178, 'lr': 0.00011139358391185422, 'scheduler_patience': 7, 'class_weight': 0.929557167101545, 'activation': 'ReLU', 'classification_multiplier': 12378.964282879942}. Best is trial 255 with value: 0.9736842105263158.
[I 2025-08-31 16:45:04,797] Trial 318 finished with value: 0.9456140350877192 and parameters: {'hidden_dim': 1386, 'latent_dim': 40, 'beta': 1.9986528647569282, 'gamma': 1.7071278794008602, 'dropout_rate': 0.33889464764714156, 'lr': 0.0011191704737808434, 'scheduler_patience': 7, 'class_weight': 0.9680516490650486, 'activation': 'ReLU', 'classification_multiplier': 14384.772180024305}. Best is trial 255 with value: 0.9736842105263158.
              precision    recall  f1-score   support

Non-Repeater       0.97      0.97      0.97       158
    Repeater       0.87      0.84      0.86        32

    accuracy                           0.95       190
   macro avg       0.92      0.91      0.91       190
weighted avg       0.95      0.95      0.95       190

Trial 312 - Average Validation Accuracy: 0.9614
Fold 1/3 - Validation Accuracy: 0.9579
Classification Report:
              precision    recall  f1-score   support

Non-Repeater       0.96      0.99      0.98       159
    Repeater       0.96      0.77      0.86        31

    accuracy                           0.96       190
   macro avg       0.96      0.88      0.92       190
weighted avg       0.96      0.96      0.96       190

Fold 2/3 - Validation Accuracy: 0.9789
Classification Report:
              precision    recall  f1-score   support

Non-Repeater       0.98      0.99      0.99       159
    Repeater       0.97      0.90      0.93        31

    accuracy                           0.98       190
   macro avg       0.97      0.95      0.96       190
weighted avg       0.98      0.98      0.98       190

Fold 3/3 - Validation Accuracy: 0.9632
Classification Report:
              precision    recall  f1-score   support

Non-Repeater       0.99      0.97      0.98       158
    Repeater       0.86      0.94      0.90        32

    accuracy                           0.96       190
   macro avg       0.92      0.95      0.94       190
weighted avg       0.97      0.96      0.96       190

Trial 313 - Average Validation Accuracy: 0.9667
Fold 1/3 - Validation Accuracy: 0.9421
Classification Report:
              precision    recall  f1-score   support

Non-Repeater       0.97      0.96      0.97       159
    Repeater       0.81      0.84      0.83        31

    accuracy                           0.94       190
   macro avg       0.89      0.90      0.90       190
weighted avg       0.94      0.94      0.94       190

Fold 2/3 - Validation Accuracy: 0.9737
Classification Report:
              precision    recall  f1-score   support

Non-Repeater       0.98      0.99      0.98       159
    Repeater       0.96      0.87      0.92        31

    accuracy                           0.97       190
   macro avg       0.97      0.93      0.95       190
weighted avg       0.97      0.97      0.97       190

Fold 3/3 - Validation Accuracy: 0.9684
Classification Report:
              precision    recall  f1-score   support

Non-Repeater       0.99      0.97      0.98       158
    Repeater       0.88      0.94      0.91        32

    accuracy                           0.97       190
   macro avg       0.93      0.96      0.94       190
weighted avg       0.97      0.97      0.97       190

Trial 314 - Average Validation Accuracy: 0.9614
Fold 1/3 - Validation Accuracy: 0.9368
Classification Report:
              precision    recall  f1-score   support

Non-Repeater       0.96      0.97      0.96       159
    Repeater       0.83      0.77      0.80        31

    accuracy                           0.94       190
   macro avg       0.89      0.87      0.88       190
weighted avg       0.94      0.94      0.94       190

Fold 2/3 - Validation Accuracy: 0.9684
Classification Report:
              precision    recall  f1-score   support

Non-Repeater       0.97      0.99      0.98       159
    Repeater       0.96      0.84      0.90        31

    accuracy                           0.97       190
   macro avg       0.97      0.92      0.94       190
weighted avg       0.97      0.97      0.97       190

Fold 3/3 - Validation Accuracy: 0.9632
Classification Report:
              precision    recall  f1-score   support

Non-Repeater       0.98      0.97      0.98       158
    Repeater       0.88      0.91      0.89        32

    accuracy                           0.96       190
   macro avg       0.93      0.94      0.94       190
weighted avg       0.96      0.96      0.96       190

Trial 315 - Average Validation Accuracy: 0.9561
Fold 1/3 - Validation Accuracy: 0.9421
Classification Report:
              precision    recall  f1-score   support

Non-Repeater       0.97      0.96      0.97       159
    Repeater       0.81      0.84      0.83        31

    accuracy                           0.94       190
   macro avg       0.89      0.90      0.90       190
weighted avg       0.94      0.94      0.94       190

Fold 2/3 - Validation Accuracy: 0.9737
Classification Report:
              precision    recall  f1-score   support

Non-Repeater       0.98      0.99      0.98       159
    Repeater       0.96      0.87      0.92        31

    accuracy                           0.97       190
   macro avg       0.97      0.93      0.95       190
weighted avg       0.97      0.97      0.97       190

Fold 3/3 - Validation Accuracy: 0.9684
Classification Report:
              precision    recall  f1-score   support

Non-Repeater       0.99      0.97      0.98       158
    Repeater       0.88      0.94      0.91        32

    accuracy                           0.97       190
   macro avg       0.93      0.96      0.94       190
weighted avg       0.97      0.97      0.97       190

Trial 316 - Average Validation Accuracy: 0.9614
Fold 1/3 - Validation Accuracy: 0.9474
Classification Report:
              precision    recall  f1-score   support

Non-Repeater       0.97      0.97      0.97       159
    Repeater       0.84      0.84      0.84        31

    accuracy                           0.95       190
   macro avg       0.90      0.90      0.90       190
weighted avg       0.95      0.95      0.95       190

Fold 2/3 - Validation Accuracy: 0.9789
Classification Report:
              precision    recall  f1-score   support

Non-Repeater       0.98      0.99      0.99       159
    Repeater       0.97      0.90      0.93        31

    accuracy                           0.98       190
   macro avg       0.97      0.95      0.96       190
weighted avg       0.98      0.98      0.98       190

Fold 3/3 - Validation Accuracy: 0.9737
Classification Report:
              precision    recall  f1-score   support

Non-Repeater       0.99      0.98      0.98       158
    Repeater       0.91      0.94      0.92        32

    accuracy                           0.97       190
   macro avg       0.95      0.96      0.95       190
weighted avg       0.97      0.97      0.97       190

Trial 317 - Average Validation Accuracy: 0.9667
Fold 1/3 - Validation Accuracy: 0.9263
Classification Report:
              precision    recall  f1-score   support

Non-Repeater       0.96      0.96      0.96       159
    Repeater       0.77      0.77      0.77        31

    accuracy                           0.93       190
   macro avg       0.87      0.87      0.87       190
weighted avg       0.93      0.93      0.93       190

Fold 2/3 - Validation Accuracy: 0.9526
Classification Report:
              precision    recall  f1-score   support

Non-Repeater       0.96      0.99      0.97       159
    Repeater       0.92      0.77      0.84        31

    accuracy                           0.95       190
   macro avg       0.94      0.88      0.91       190
weighted avg       0.95      0.95      0.95       190

Fold 3/3 - Validation Accuracy: 0.9579
Classification Report:
              precision    recall  f1-score   support

Non-Repeater       0.97      0.98      0.97       158
    Repeater       0.90      0.84      0.87        32

    accuracy                           0.96       190
   macro avg       0.93      0.91      0.92       190
weighted avg       0.96      0.96      0.96       190

Trial 318 - Average Validation Accuracy: 0.9456
Fold 1/3 - Validation Accuracy: 0.9526
Classification Report:
              precision    recall  f1-score   support

Non-Repeater       0.97      0.97      0.97       159
    Repeater       0.84      0.87      0.86        31

    accuracy                           0.95       190
   macro avg       0.91      0.92      0.91       190
weighted avg       0.95      0.95      0.95       190

Fold 2/3 - Validation Accuracy: 0.9789
Classification Report:
[I 2025-08-31 16:45:32,452] Trial 319 finished with value: 0.9649122807017544 and parameters: {'hidden_dim': 1671, 'latent_dim': 38, 'beta': 0.6988154866842233, 'gamma': 1.8513738006696236, 'dropout_rate': 0.12230245189986849, 'lr': 0.0006985839644474588, 'scheduler_patience': 7, 'class_weight': 0.9486843480058532, 'activation': 'ReLU', 'classification_multiplier': 11573.47366256083}. Best is trial 255 with value: 0.9736842105263158.
[I 2025-08-31 16:45:59,410] Trial 320 finished with value: 0.936842105263158 and parameters: {'hidden_dim': 1590, 'latent_dim': 37, 'beta': 1.7904345552258796, 'gamma': 1.3731602377919778, 'dropout_rate': 0.1077652624268911, 'lr': 0.0056536849555683675, 'scheduler_patience': 6, 'class_weight': 0.9837054916627269, 'activation': 'ReLU', 'classification_multiplier': 13455.21669514272}. Best is trial 255 with value: 0.9736842105263158.
[I 2025-08-31 16:46:28,003] Trial 321 finished with value: 0.9719298245614035 and parameters: {'hidden_dim': 1785, 'latent_dim': 39, 'beta': 1.9423271511691511, 'gamma': 1.5970573995627257, 'dropout_rate': 0.11403485459989025, 'lr': 0.0004165402321917581, 'scheduler_patience': 7, 'class_weight': 0.9156886116114832, 'activation': 'ReLU', 'classification_multiplier': 12712.418608223325}. Best is trial 255 with value: 0.9736842105263158.
[I 2025-08-31 16:46:56,336] Trial 322 finished with value: 0.9649122807017544 and parameters: {'hidden_dim': 1796, 'latent_dim': 39, 'beta': 1.9389259374302625, 'gamma': 1.5023410864279556, 'dropout_rate': 0.11309615756168738, 'lr': 0.0008677280927683345, 'scheduler_patience': 7, 'class_weight': 0.8861698517704993, 'activation': 'ReLU', 'classification_multiplier': 12093.999928578556}. Best is trial 255 with value: 0.9736842105263158.
