nohup: ignoring input
[I 2025-08-31 14:24:00,200] A new study created in memory with name: no-name-3b9b051b-a855-4e81-8191-b9fd235083c1
/home/ubuntu/frb-analysis/.frb-analysis/lib/python3.12/site-packages/sklearn/metrics/_classification.py:1565: UndefinedMetricWarning: Precision is ill-defined and being set to 0.0 in labels with no predicted samples. Use `zero_division` parameter to control this behavior.
  _warn_prf(average, modifier, f"{metric.capitalize()} is", len(result))
/home/ubuntu/frb-analysis/.frb-analysis/lib/python3.12/site-packages/sklearn/metrics/_classification.py:1565: UndefinedMetricWarning: Precision is ill-defined and being set to 0.0 in labels with no predicted samples. Use `zero_division` parameter to control this behavior.
  _warn_prf(average, modifier, f"{metric.capitalize()} is", len(result))
/home/ubuntu/frb-analysis/.frb-analysis/lib/python3.12/site-packages/sklearn/metrics/_classification.py:1565: UndefinedMetricWarning: Precision is ill-defined and being set to 0.0 in labels with no predicted samples. Use `zero_division` parameter to control this behavior.
  _warn_prf(average, modifier, f"{metric.capitalize()} is", len(result))
/home/ubuntu/frb-analysis/.frb-analysis/lib/python3.12/site-packages/sklearn/metrics/_classification.py:1565: UndefinedMetricWarning: Precision is ill-defined and being set to 0.0 in labels with no predicted samples. Use `zero_division` parameter to control this behavior.
  _warn_prf(average, modifier, f"{metric.capitalize()} is", len(result))
/home/ubuntu/frb-analysis/.frb-analysis/lib/python3.12/site-packages/sklearn/metrics/_classification.py:1565: UndefinedMetricWarning: Precision is ill-defined and being set to 0.0 in labels with no predicted samples. Use `zero_division` parameter to control this behavior.
  _warn_prf(average, modifier, f"{metric.capitalize()} is", len(result))
/home/ubuntu/frb-analysis/.frb-analysis/lib/python3.12/site-packages/sklearn/metrics/_classification.py:1565: UndefinedMetricWarning: Precision is ill-defined and being set to 0.0 in labels with no predicted samples. Use `zero_division` parameter to control this behavior.
  _warn_prf(average, modifier, f"{metric.capitalize()} is", len(result))
/home/ubuntu/frb-analysis/.frb-analysis/lib/python3.12/site-packages/sklearn/metrics/_classification.py:1565: UndefinedMetricWarning: Precision is ill-defined and being set to 0.0 in labels with no predicted samples. Use `zero_division` parameter to control this behavior.
  _warn_prf(average, modifier, f"{metric.capitalize()} is", len(result))
/home/ubuntu/frb-analysis/.frb-analysis/lib/python3.12/site-packages/sklearn/metrics/_classification.py:1565: UndefinedMetricWarning: Precision is ill-defined and being set to 0.0 in labels with no predicted samples. Use `zero_division` parameter to control this behavior.
  _warn_prf(average, modifier, f"{metric.capitalize()} is", len(result))
/home/ubuntu/frb-analysis/.frb-analysis/lib/python3.12/site-packages/sklearn/metrics/_classification.py:1565: UndefinedMetricWarning: Precision is ill-defined and being set to 0.0 in labels with no predicted samples. Use `zero_division` parameter to control this behavior.
  _warn_prf(average, modifier, f"{metric.capitalize()} is", len(result))
[I 2025-08-31 14:24:23,351] Trial 0 finished with value: 0.8350877192982457 and parameters: {'hidden_dim': 747, 'latent_dim': 34, 'beta': 1.9954607133002142, 'gamma': 0.8295384657014413, 'dropout_rate': 0.4037703149384517, 'lr': 0.008656324727673002, 'scheduler_patience': 2, 'class_weight': 0.054596564931224716, 'activation': 'ReLU', 'classification_multiplier': 14526.01802066452}. Best is trial 0 with value: 0.8350877192982457.
[I 2025-08-31 14:24:44,318] Trial 1 finished with value: 0.8807017543859649 and parameters: {'hidden_dim': 209, 'latent_dim': 38, 'beta': 1.055828055251718, 'gamma': 1.6024317654558549, 'dropout_rate': 0.16734522767950505, 'lr': 0.006427965745810871, 'scheduler_patience': 7, 'class_weight': 0.08336845416308758, 'activation': 'ReLU', 'classification_multiplier': 13775.760657048148}. Best is trial 1 with value: 0.8807017543859649.
[I 2025-08-31 14:25:14,650] Trial 2 finished with value: 0.912280701754386 and parameters: {'hidden_dim': 1939, 'latent_dim': 28, 'beta': 1.5200008765191781, 'gamma': 1.9860235484385633, 'dropout_rate': 0.1760322375958225, 'lr': 0.006015215580765356, 'scheduler_patience': 7, 'class_weight': 0.33382835937877664, 'activation': 'ELU', 'classification_multiplier': 6348.9535763058375}. Best is trial 2 with value: 0.912280701754386.
[I 2025-08-31 14:25:39,197] Trial 3 finished with value: 0.9491228070175439 and parameters: {'hidden_dim': 1342, 'latent_dim': 18, 'beta': 1.6520914744307231, 'gamma': 1.0682417991268551, 'dropout_rate': 0.33089000017106573, 'lr': 0.0011544850607572406, 'scheduler_patience': 4, 'class_weight': 0.8802288595297827, 'activation': 'ReLU', 'classification_multiplier': 10852.189088095933}. Best is trial 3 with value: 0.9491228070175439.
/home/ubuntu/frb-analysis/.frb-analysis/lib/python3.12/site-packages/sklearn/metrics/_classification.py:1565: UndefinedMetricWarning: Precision is ill-defined and being set to 0.0 in labels with no predicted samples. Use `zero_division` parameter to control this behavior.
  _warn_prf(average, modifier, f"{metric.capitalize()} is", len(result))
/home/ubuntu/frb-analysis/.frb-analysis/lib/python3.12/site-packages/sklearn/metrics/_classification.py:1565: UndefinedMetricWarning: Precision is ill-defined and being set to 0.0 in labels with no predicted samples. Use `zero_division` parameter to control this behavior.
  _warn_prf(average, modifier, f"{metric.capitalize()} is", len(result))
/home/ubuntu/frb-analysis/.frb-analysis/lib/python3.12/site-packages/sklearn/metrics/_classification.py:1565: UndefinedMetricWarning: Precision is ill-defined and being set to 0.0 in labels with no predicted samples. Use `zero_division` parameter to control this behavior.
  _warn_prf(average, modifier, f"{metric.capitalize()} is", len(result))
[I 2025-08-31 14:26:07,946] Trial 4 finished with value: 0.8473684210526317 and parameters: {'hidden_dim': 1878, 'latent_dim': 20, 'beta': 1.4683349077014434, 'gamma': 1.9713683685541044, 'dropout_rate': 0.300364129689894, 'lr': 0.00775612440764936, 'scheduler_patience': 7, 'class_weight': 0.06348729891367727, 'activation': 'LeakyReLU', 'classification_multiplier': 13125.843045779202}. Best is trial 3 with value: 0.9491228070175439.
[I 2025-08-31 14:26:32,855] Trial 5 finished with value: 0.8701754385964913 and parameters: {'hidden_dim': 1420, 'latent_dim': 5, 'beta': 0.9393495014408928, 'gamma': 0.35207007070343055, 'dropout_rate': 0.2849627286596783, 'lr': 0.008794039486190385, 'scheduler_patience': 2, 'class_weight': 0.49498811220133826, 'activation': 'SELU', 'classification_multiplier': 6196.183764211506}. Best is trial 3 with value: 0.9491228070175439.
Index(['tns_name', 'previous_name', 'repeater_name', 'ra', 'ra_err',
       'ra_notes', 'dec', 'dec_err', 'dec_notes', 'gl', 'gb', 'exp_up',
       'exp_up_err', 'exp_up_notes', 'exp_low', 'exp_low_err', 'exp_low_notes',
       'bonsai_snr', 'bonsai_dm', 'low_ft_68', 'up_ft_68', 'low_ft_95',
       'up_ft_95', 'snr_fitb', 'dm_fitb', 'dm_fitb_err', 'dm_exc_ne2001',
       'dm_exc_ymw16', 'bc_width', 'scat_time', 'scat_time_err', 'flux',
       'flux_err', 'flux_notes', 'fluence', 'fluence_err', 'fluence_notes',
       'sub_num', 'mjd_400', 'mjd_400_err', 'mjd_inf', 'mjd_inf_err',
       'width_fitb', 'width_fitb_err', 'sp_idx', 'sp_idx_err', 'sp_run',
       'sp_run_err', 'high_freq', 'low_freq', 'peak_freq', 'chi_sq', 'dof',
       'flag_frac', 'excluded_flag', 'repeater'],
      dtype='object')
Fold 1/3 - Validation Accuracy: 0.8368
Classification Report:
              precision    recall  f1-score   support

Non-Repeater       0.84      1.00      0.91       159
    Repeater       0.00      0.00      0.00        31

    accuracy                           0.84       190
   macro avg       0.42      0.50      0.46       190
weighted avg       0.70      0.84      0.76       190

Fold 2/3 - Validation Accuracy: 0.8368
Classification Report:
              precision    recall  f1-score   support

Non-Repeater       0.84      1.00      0.91       159
    Repeater       0.00      0.00      0.00        31

    accuracy                           0.84       190
   macro avg       0.42      0.50      0.46       190
weighted avg       0.70      0.84      0.76       190

Fold 3/3 - Validation Accuracy: 0.8316
Classification Report:
              precision    recall  f1-score   support

Non-Repeater       0.83      1.00      0.91       158
    Repeater       0.00      0.00      0.00        32

    accuracy                           0.83       190
   macro avg       0.42      0.50      0.45       190
weighted avg       0.69      0.83      0.76       190

Trial 0 - Average Validation Accuracy: 0.8351
Fold 1/3 - Validation Accuracy: 0.9105
Classification Report:
              precision    recall  f1-score   support

Non-Repeater       0.90      1.00      0.95       159
    Repeater       1.00      0.45      0.62        31

    accuracy                           0.91       190
   macro avg       0.95      0.73      0.79       190
weighted avg       0.92      0.91      0.90       190

Fold 2/3 - Validation Accuracy: 0.8421
Classification Report:
              precision    recall  f1-score   support

Non-Repeater       0.84      1.00      0.91       159
    Repeater       1.00      0.03      0.06        31

    accuracy                           0.84       190
   macro avg       0.92      0.52      0.49       190
weighted avg       0.87      0.84      0.77       190

Fold 3/3 - Validation Accuracy: 0.8895
Classification Report:
              precision    recall  f1-score   support

Non-Repeater       0.88      1.00      0.94       158
    Repeater       1.00      0.34      0.51        32

    accuracy                           0.89       190
   macro avg       0.94      0.67      0.72       190
weighted avg       0.90      0.89      0.87       190

Trial 1 - Average Validation Accuracy: 0.8807
Fold 1/3 - Validation Accuracy: 0.9053
Classification Report:
              precision    recall  f1-score   support

Non-Repeater       0.91      0.99      0.95       159
    Repeater       0.88      0.48      0.62        31

    accuracy                           0.91       190
   macro avg       0.89      0.74      0.79       190
weighted avg       0.90      0.91      0.89       190

Fold 2/3 - Validation Accuracy: 0.9263
Classification Report:
              precision    recall  f1-score   support

Non-Repeater       0.92      0.99      0.96       159
    Repeater       0.95      0.58      0.72        31

    accuracy                           0.93       190
   macro avg       0.94      0.79      0.84       190
weighted avg       0.93      0.93      0.92       190

Fold 3/3 - Validation Accuracy: 0.9053
Classification Report:
              precision    recall  f1-score   support

Non-Repeater       0.90      0.99      0.95       158
    Repeater       0.94      0.47      0.62        32

    accuracy                           0.91       190
   macro avg       0.92      0.73      0.79       190
weighted avg       0.91      0.91      0.89       190

Trial 2 - Average Validation Accuracy: 0.9123
Fold 1/3 - Validation Accuracy: 0.9368
Classification Report:
              precision    recall  f1-score   support

Non-Repeater       0.96      0.96      0.96       159
    Repeater       0.81      0.81      0.81        31

    accuracy                           0.94       190
   macro avg       0.88      0.88      0.88       190
weighted avg       0.94      0.94      0.94       190

Fold 2/3 - Validation Accuracy: 0.9474
Classification Report:
              precision    recall  f1-score   support

Non-Repeater       0.95      0.99      0.97       159
    Repeater       0.92      0.74      0.82        31

    accuracy                           0.95       190
   macro avg       0.94      0.86      0.90       190
weighted avg       0.95      0.95      0.95       190

Fold 3/3 - Validation Accuracy: 0.9632
Classification Report:
              precision    recall  f1-score   support

Non-Repeater       0.99      0.97      0.98       158
    Repeater       0.86      0.94      0.90        32

    accuracy                           0.96       190
   macro avg       0.92      0.95      0.94       190
weighted avg       0.97      0.96      0.96       190

Trial 3 - Average Validation Accuracy: 0.9491
Fold 1/3 - Validation Accuracy: 0.8684
Classification Report:
              precision    recall  f1-score   support

Non-Repeater       0.86      1.00      0.93       159
    Repeater       1.00      0.19      0.32        31

    accuracy                           0.87       190
   macro avg       0.93      0.60      0.63       190
weighted avg       0.89      0.87      0.83       190

Fold 2/3 - Validation Accuracy: 0.8421
Classification Report:
              precision    recall  f1-score   support

Non-Repeater       0.84      1.00      0.91       159
    Repeater       1.00      0.03      0.06        31

    accuracy                           0.84       190
   macro avg       0.92      0.52      0.49       190
weighted avg       0.87      0.84      0.77       190

Fold 3/3 - Validation Accuracy: 0.8316
Classification Report:
              precision    recall  f1-score   support

Non-Repeater       0.83      1.00      0.91       158
    Repeater       0.00      0.00      0.00        32

    accuracy                           0.83       190
   macro avg       0.42      0.50      0.45       190
weighted avg       0.69      0.83      0.76       190

Trial 4 - Average Validation Accuracy: 0.8474
Fold 1/3 - Validation Accuracy: 0.9053
Classification Report:
              precision    recall  f1-score   support

Non-Repeater       0.92      0.97      0.95       159
    Repeater       0.81      0.55      0.65        31

    accuracy                           0.91       190
   macro avg       0.86      0.76      0.80       190
weighted avg       0.90      0.91      0.90       190

Fold 2/3 - Validation Accuracy: 0.8789
Classification Report:
              precision    recall  f1-score   support

Non-Repeater       0.89      0.98      0.93       159
    Repeater       0.79      0.35      0.49        31

    accuracy                           0.88       190
   macro avg       0.84      0.67      0.71       190
weighted avg       0.87      0.88      0.86       190

Fold 3/3 - Validation Accuracy: 0.8263
Classification Report:
              precision    recall  f1-score   support

Non-Repeater       0.83      0.99      0.90       158
    Repeater       0.00      0.00      0.00        32

    accuracy                           0.83       190
   macro avg       0.42      0.50      0.45       190
weighted avg       0.69      0.83      0.75       190

Trial 5 - Average Validation Accuracy: 0.8702
Fold 1/3 - Validation Accuracy: 0.8895
Classification Report:
[I 2025-08-31 14:26:54,465] Trial 6 finished with value: 0.9192982456140352 and parameters: {'hidden_dim': 362, 'latent_dim': 23, 'beta': 1.9005755876301493, 'gamma': 1.483801521826859, 'dropout_rate': 0.1373683373144329, 'lr': 0.008813057138935959, 'scheduler_patience': 2, 'class_weight': 0.2738219822253603, 'activation': 'ReLU', 'classification_multiplier': 6225.838527359672}. Best is trial 3 with value: 0.9491228070175439.
[I 2025-08-31 14:27:17,049] Trial 7 finished with value: 0.9421052631578948 and parameters: {'hidden_dim': 1009, 'latent_dim': 16, 'beta': 1.3654432131019218, 'gamma': 1.0626349547511629, 'dropout_rate': 0.4687833199717154, 'lr': 0.006273160845734746, 'scheduler_patience': 6, 'class_weight': 0.8057377126910215, 'activation': 'GELU', 'classification_multiplier': 8587.236399971987}. Best is trial 3 with value: 0.9491228070175439.
/home/ubuntu/frb-analysis/.frb-analysis/lib/python3.12/site-packages/sklearn/metrics/_classification.py:1565: UndefinedMetricWarning: Precision is ill-defined and being set to 0.0 in labels with no predicted samples. Use `zero_division` parameter to control this behavior.
  _warn_prf(average, modifier, f"{metric.capitalize()} is", len(result))
/home/ubuntu/frb-analysis/.frb-analysis/lib/python3.12/site-packages/sklearn/metrics/_classification.py:1565: UndefinedMetricWarning: Precision is ill-defined and being set to 0.0 in labels with no predicted samples. Use `zero_division` parameter to control this behavior.
  _warn_prf(average, modifier, f"{metric.capitalize()} is", len(result))
/home/ubuntu/frb-analysis/.frb-analysis/lib/python3.12/site-packages/sklearn/metrics/_classification.py:1565: UndefinedMetricWarning: Precision is ill-defined and being set to 0.0 in labels with no predicted samples. Use `zero_division` parameter to control this behavior.
  _warn_prf(average, modifier, f"{metric.capitalize()} is", len(result))
[I 2025-08-31 14:27:43,757] Trial 8 finished with value: 0.856140350877193 and parameters: {'hidden_dim': 1644, 'latent_dim': 24, 'beta': 1.2200726818124623, 'gamma': 1.820062837102768, 'dropout_rate': 0.2041647649294992, 'lr': 0.006806418359276287, 'scheduler_patience': 3, 'class_weight': 0.30526058980605547, 'activation': 'ReLU', 'classification_multiplier': 5885.979491221595}. Best is trial 3 with value: 0.9491228070175439.
[I 2025-08-31 14:28:12,368] Trial 9 finished with value: 0.9192982456140352 and parameters: {'hidden_dim': 1852, 'latent_dim': 28, 'beta': 1.4280927068228049, 'gamma': 0.6883975303235411, 'dropout_rate': 0.1830122417659494, 'lr': 0.004972380854837314, 'scheduler_patience': 4, 'class_weight': 0.8472039812367248, 'activation': 'ELU', 'classification_multiplier': 5698.571817123485}. Best is trial 3 with value: 0.9491228070175439.
[I 2025-08-31 14:28:36,767] Trial 10 finished with value: 0.943859649122807 and parameters: {'hidden_dim': 1323, 'latent_dim': 11, 'beta': 0.2630956214161896, 'gamma': 1.2152416323718058, 'dropout_rate': 0.34718256072598297, 'lr': 0.0004522653152746175, 'scheduler_patience': 5, 'class_weight': 0.987717632902533, 'activation': 'LeakyReLU', 'classification_multiplier': 11206.517959916404}. Best is trial 3 with value: 0.9491228070175439.
