[I 2025-08-31 15:26:08,484] Trial 141 finished with value: 0.9596491228070175 and parameters: {'hidden_dim': 1467, 'latent_dim': 25, 'beta': 1.8863060202428048, 'gamma': 1.232998683505937, 'dropout_rate': 0.10870272018773727, 'lr': 0.0007651942949520069, 'scheduler_patience': 7, 'class_weight': 0.9450545783639462, 'activation': 'ReLU', 'classification_multiplier': 13445.927929568184}. Best is trial 111 with value: 0.9719298245614035.
[I 2025-08-31 15:26:34,280] Trial 142 finished with value: 0.9719298245614034 and parameters: {'hidden_dim': 1441, 'latent_dim': 40, 'beta': 1.9533578795071371, 'gamma': 1.1946676250028356, 'dropout_rate': 0.10189357933842964, 'lr': 0.00011501582820622338, 'scheduler_patience': 7, 'class_weight': 0.9297510636260128, 'activation': 'ReLU', 'classification_multiplier': 13796.824178335124}. Best is trial 111 with value: 0.9719298245614035.
[I 2025-08-31 15:26:58,854] Trial 143 finished with value: 0.9649122807017544 and parameters: {'hidden_dim': 1296, 'latent_dim': 40, 'beta': 1.960019523790133, 'gamma': 1.1976256556267049, 'dropout_rate': 0.11673457691051162, 'lr': 0.00027429623218817433, 'scheduler_patience': 7, 'class_weight': 0.9059791085608425, 'activation': 'ReLU', 'classification_multiplier': 14096.51709122739}. Best is trial 111 with value: 0.9719298245614035.
[I 2025-08-31 15:27:25,387] Trial 144 finished with value: 0.9649122807017544 and parameters: {'hidden_dim': 1527, 'latent_dim': 40, 'beta': 1.9247340468662077, 'gamma': 1.060777307665674, 'dropout_rate': 0.10012061652301443, 'lr': 0.000125213971811114, 'scheduler_patience': 7, 'class_weight': 0.9741787311311997, 'activation': 'ReLU', 'classification_multiplier': 14974.293468289208}. Best is trial 111 with value: 0.9719298245614035.
[I 2025-08-31 15:27:53,625] Trial 145 finished with value: 0.968421052631579 and parameters: {'hidden_dim': 1739, 'latent_dim': 38, 'beta': 1.9672865393336567, 'gamma': 1.275222131084413, 'dropout_rate': 0.12561553097527198, 'lr': 0.0005152820500497762, 'scheduler_patience': 7, 'class_weight': 0.9588661885255024, 'activation': 'ReLU', 'classification_multiplier': 12285.879408875157}. Best is trial 111 with value: 0.9719298245614035.
              precision    recall  f1-score   support

Non-Repeater       0.96      0.99      0.98       159
    Repeater       0.96      0.77      0.86        31

    accuracy                           0.96       190
   macro avg       0.96      0.88      0.92       190
weighted avg       0.96      0.96      0.96       190

Fold 3/3 - Validation Accuracy: 0.9421
Classification Report:
              precision    recall  f1-score   support

Non-Repeater       0.95      0.99      0.97       158
    Repeater       0.92      0.72      0.81        32

    accuracy                           0.94       190
   macro avg       0.93      0.85      0.89       190
weighted avg       0.94      0.94      0.94       190

Trial 139 - Average Validation Accuracy: 0.9474
Fold 1/3 - Validation Accuracy: 0.9474
Classification Report:
              precision    recall  f1-score   support

Non-Repeater       0.97      0.97      0.97       159
    Repeater       0.84      0.84      0.84        31

    accuracy                           0.95       190
   macro avg       0.90      0.90      0.90       190
weighted avg       0.95      0.95      0.95       190

Fold 2/3 - Validation Accuracy: 0.9737
Classification Report:
              precision    recall  f1-score   support

Non-Repeater       0.98      0.99      0.98       159
    Repeater       0.96      0.87      0.92        31

    accuracy                           0.97       190
   macro avg       0.97      0.93      0.95       190
weighted avg       0.97      0.97      0.97       190

Fold 3/3 - Validation Accuracy: 0.9526
Classification Report:
              precision    recall  f1-score   support

Non-Repeater       0.97      0.97      0.97       158
    Repeater       0.87      0.84      0.86        32

    accuracy                           0.95       190
   macro avg       0.92      0.91      0.91       190
weighted avg       0.95      0.95      0.95       190

Trial 140 - Average Validation Accuracy: 0.9579
Fold 1/3 - Validation Accuracy: 0.9526
Classification Report:
              precision    recall  f1-score   support

Non-Repeater       0.97      0.97      0.97       159
    Repeater       0.84      0.87      0.86        31

    accuracy                           0.95       190
   macro avg       0.91      0.92      0.91       190
weighted avg       0.95      0.95      0.95       190

Fold 2/3 - Validation Accuracy: 0.9737
Classification Report:
              precision    recall  f1-score   support

Non-Repeater       0.98      0.99      0.98       159
    Repeater       0.96      0.87      0.92        31

    accuracy                           0.97       190
   macro avg       0.97      0.93      0.95       190
weighted avg       0.97      0.97      0.97       190

Fold 3/3 - Validation Accuracy: 0.9526
Classification Report:
              precision    recall  f1-score   support

Non-Repeater       0.97      0.97      0.97       158
    Repeater       0.87      0.84      0.86        32

    accuracy                           0.95       190
   macro avg       0.92      0.91      0.91       190
weighted avg       0.95      0.95      0.95       190

Trial 141 - Average Validation Accuracy: 0.9596
Fold 1/3 - Validation Accuracy: 0.9526
Classification Report:
              precision    recall  f1-score   support

Non-Repeater       0.98      0.96      0.97       159
    Repeater       0.82      0.90      0.86        31

    accuracy                           0.95       190
   macro avg       0.90      0.93      0.92       190
weighted avg       0.96      0.95      0.95       190

Fold 2/3 - Validation Accuracy: 0.9842
Classification Report:
              precision    recall  f1-score   support

Non-Repeater       0.99      0.99      0.99       159
    Repeater       0.97      0.94      0.95        31

    accuracy                           0.98       190
   macro avg       0.98      0.96      0.97       190
weighted avg       0.98      0.98      0.98       190

Fold 3/3 - Validation Accuracy: 0.9789
Classification Report:
              precision    recall  f1-score   support

Non-Repeater       0.99      0.99      0.99       158
    Repeater       0.94      0.94      0.94        32

    accuracy                           0.98       190
   macro avg       0.96      0.96      0.96       190
weighted avg       0.98      0.98      0.98       190

Trial 142 - Average Validation Accuracy: 0.9719
Fold 1/3 - Validation Accuracy: 0.9526
Classification Report:
              precision    recall  f1-score   support

Non-Repeater       0.97      0.97      0.97       159
    Repeater       0.87      0.84      0.85        31

    accuracy                           0.95       190
   macro avg       0.92      0.91      0.91       190
weighted avg       0.95      0.95      0.95       190

Fold 2/3 - Validation Accuracy: 0.9737
Classification Report:
              precision    recall  f1-score   support

Non-Repeater       0.98      0.99      0.98       159
    Repeater       0.96      0.87      0.92        31

    accuracy                           0.97       190
   macro avg       0.97      0.93      0.95       190
weighted avg       0.97      0.97      0.97       190

Fold 3/3 - Validation Accuracy: 0.9684
Classification Report:
              precision    recall  f1-score   support

Non-Repeater       0.98      0.98      0.98       158
    Repeater       0.91      0.91      0.91        32

    accuracy                           0.97       190
   macro avg       0.94      0.94      0.94       190
weighted avg       0.97      0.97      0.97       190

Trial 143 - Average Validation Accuracy: 0.9649
Fold 1/3 - Validation Accuracy: 0.9421
Classification Report:
              precision    recall  f1-score   support

Non-Repeater       0.97      0.96      0.97       159
    Repeater       0.81      0.84      0.83        31

    accuracy                           0.94       190
   macro avg       0.89      0.90      0.90       190
weighted avg       0.94      0.94      0.94       190

Fold 2/3 - Validation Accuracy: 0.9789
Classification Report:
              precision    recall  f1-score   support

Non-Repeater       0.98      0.99      0.99       159
    Repeater       0.97      0.90      0.93        31

    accuracy                           0.98       190
   macro avg       0.97      0.95      0.96       190
weighted avg       0.98      0.98      0.98       190

Fold 3/3 - Validation Accuracy: 0.9737
Classification Report:
              precision    recall  f1-score   support

Non-Repeater       0.98      0.99      0.98       158
    Repeater       0.97      0.88      0.92        32

    accuracy                           0.97       190
   macro avg       0.97      0.93      0.95       190
weighted avg       0.97      0.97      0.97       190

Trial 144 - Average Validation Accuracy: 0.9649
Fold 1/3 - Validation Accuracy: 0.9579
Classification Report:
              precision    recall  f1-score   support

Non-Repeater       0.97      0.98      0.97       159
    Repeater       0.90      0.84      0.87        31

    accuracy                           0.96       190
   macro avg       0.93      0.91      0.92       190
weighted avg       0.96      0.96      0.96       190

Fold 2/3 - Validation Accuracy: 0.9789
Classification Report:
              precision    recall  f1-score   support

Non-Repeater       0.98      0.99      0.99       159
    Repeater       0.97      0.90      0.93        31

    accuracy                           0.98       190
   macro avg       0.97      0.95      0.96       190
weighted avg       0.98      0.98      0.98       190

Fold 3/3 - Validation Accuracy: 0.9684
Classification Report:
              precision    recall  f1-score   support

Non-Repeater       0.98      0.98      0.98       158
    Repeater       0.91      0.91      0.91        32

    accuracy                           0.97       190
   macro avg       0.94      0.94      0.94       190
weighted avg       0.97      0.97      0.97       190

Trial 145 - Average Validation Accuracy: 0.9684
Fold 1/3 - Validation Accuracy: 0.9579
Classification Report:
[I 2025-08-31 15:28:18,764] Trial 146 finished with value: 0.9631578947368421 and parameters: {'hidden_dim': 1402, 'latent_dim': 38, 'beta': 1.8226882301701373, 'gamma': 1.4739936451112812, 'dropout_rate': 0.14509625185970237, 'lr': 0.0004242973442895035, 'scheduler_patience': 7, 'class_weight': 0.5386748630689072, 'activation': 'ReLU', 'classification_multiplier': 12649.377724045362}. Best is trial 111 with value: 0.9719298245614035.
[I 2025-08-31 15:28:46,994] Trial 147 finished with value: 0.9491228070175439 and parameters: {'hidden_dim': 1800, 'latent_dim': 39, 'beta': 1.9139069477930588, 'gamma': 1.9175512666796994, 'dropout_rate': 0.3699503890650013, 'lr': 0.0001064691861640009, 'scheduler_patience': 7, 'class_weight': 0.9285930841103658, 'activation': 'ReLU', 'classification_multiplier': 11806.044734292402}. Best is trial 111 with value: 0.9719298245614035.
[I 2025-08-31 15:29:13,732] Trial 148 finished with value: 0.968421052631579 and parameters: {'hidden_dim': 1559, 'latent_dim': 37, 'beta': 1.9991446967008348, 'gamma': 1.6349823206089178, 'dropout_rate': 0.28774667575275303, 'lr': 0.0010436589214026738, 'scheduler_patience': 7, 'class_weight': 0.859628132517793, 'activation': 'ReLU', 'classification_multiplier': 12911.270339489105}. Best is trial 111 with value: 0.9719298245614035.
[I 2025-08-31 15:29:40,156] Trial 149 finished with value: 0.9543859649122807 and parameters: {'hidden_dim': 1501, 'latent_dim': 39, 'beta': 0.32220311327118184, 'gamma': 1.7329606339717571, 'dropout_rate': 0.35343801434479405, 'lr': 0.0005841153307913452, 'scheduler_patience': 7, 'class_weight': 0.985676498480161, 'activation': 'ReLU', 'classification_multiplier': 11153.48517512036}. Best is trial 111 with value: 0.9719298245614035.
[I 2025-08-31 15:30:07,469] Trial 150 finished with value: 0.9578947368421052 and parameters: {'hidden_dim': 1654, 'latent_dim': 40, 'beta': 0.5610169016050065, 'gamma': 1.8497718043088782, 'dropout_rate': 0.25245628278580523, 'lr': 0.00035940008701438144, 'scheduler_patience': 7, 'class_weight': 0.9036288083483763, 'activation': 'ReLU', 'classification_multiplier': 9546.11542296658}. Best is trial 111 with value: 0.9719298245614035.
[I 2025-08-31 15:30:33,251] Trial 151 finished with value: 0.9614035087719298 and parameters: {'hidden_dim': 1433, 'latent_dim': 38, 'beta': 1.8645846536685704, 'gamma': 1.3156490661650821, 'dropout_rate': 0.11487427269714764, 'lr': 0.0008044540481660169, 'scheduler_patience': 7, 'class_weight': 0.9330006692018411, 'activation': 'ReLU', 'classification_multiplier': 13260.214186736348}. Best is trial 111 with value: 0.9719298245614035.
              precision    recall  f1-score   support

Non-Repeater       0.96      0.99      0.98       159
    Repeater       0.96      0.77      0.86        31

    accuracy                           0.96       190
   macro avg       0.96      0.88      0.92       190
weighted avg       0.96      0.96      0.96       190

Fold 2/3 - Validation Accuracy: 0.9632
Classification Report:
              precision    recall  f1-score   support

Non-Repeater       0.96      0.99      0.98       159
    Repeater       0.96      0.81      0.88        31

    accuracy                           0.96       190
   macro avg       0.96      0.90      0.93       190
weighted avg       0.96      0.96      0.96       190

Fold 3/3 - Validation Accuracy: 0.9684
Classification Report:
              precision    recall  f1-score   support

Non-Repeater       0.97      0.99      0.98       158
    Repeater       0.93      0.88      0.90        32

    accuracy                           0.97       190
   macro avg       0.95      0.93      0.94       190
weighted avg       0.97      0.97      0.97       190

Trial 146 - Average Validation Accuracy: 0.9632
Fold 1/3 - Validation Accuracy: 0.9316
Classification Report:
              precision    recall  f1-score   support

Non-Repeater       0.96      0.96      0.96       159
    Repeater       0.80      0.77      0.79        31

    accuracy                           0.93       190
   macro avg       0.88      0.87      0.87       190
weighted avg       0.93      0.93      0.93       190

Fold 2/3 - Validation Accuracy: 0.9526
Classification Report:
              precision    recall  f1-score   support

Non-Repeater       0.96      0.99      0.97       159
    Repeater       0.92      0.77      0.84        31

    accuracy                           0.95       190
   macro avg       0.94      0.88      0.91       190
weighted avg       0.95      0.95      0.95       190

Fold 3/3 - Validation Accuracy: 0.9632
Classification Report:
              precision    recall  f1-score   support

Non-Repeater       0.98      0.97      0.98       158
    Repeater       0.88      0.91      0.89        32

    accuracy                           0.96       190
   macro avg       0.93      0.94      0.94       190
weighted avg       0.96      0.96      0.96       190

Trial 147 - Average Validation Accuracy: 0.9491
Fold 1/3 - Validation Accuracy: 0.9526
Classification Report:
              precision    recall  f1-score   support

Non-Repeater       0.96      0.99      0.97       159
    Repeater       0.92      0.77      0.84        31

    accuracy                           0.95       190
   macro avg       0.94      0.88      0.91       190
weighted avg       0.95      0.95      0.95       190

Fold 2/3 - Validation Accuracy: 0.9737
Classification Report:
              precision    recall  f1-score   support

Non-Repeater       0.98      0.99      0.98       159
    Repeater       0.96      0.87      0.92        31

    accuracy                           0.97       190
   macro avg       0.97      0.93      0.95       190
weighted avg       0.97      0.97      0.97       190

Fold 3/3 - Validation Accuracy: 0.9789
Classification Report:
              precision    recall  f1-score   support

Non-Repeater       0.99      0.99      0.99       158
    Repeater       0.94      0.94      0.94        32

    accuracy                           0.98       190
   macro avg       0.96      0.96      0.96       190
weighted avg       0.98      0.98      0.98       190

Trial 148 - Average Validation Accuracy: 0.9684
Fold 1/3 - Validation Accuracy: 0.9316
Classification Report:
              precision    recall  f1-score   support

Non-Repeater       0.96      0.96      0.96       159
    Repeater       0.80      0.77      0.79        31

    accuracy                           0.93       190
   macro avg       0.88      0.87      0.87       190
weighted avg       0.93      0.93      0.93       190

Fold 2/3 - Validation Accuracy: 0.9632
Classification Report:
              precision    recall  f1-score   support

Non-Repeater       0.97      0.99      0.98       159
    Repeater       0.93      0.84      0.88        31

    accuracy                           0.96       190
   macro avg       0.95      0.91      0.93       190
weighted avg       0.96      0.96      0.96       190

Fold 3/3 - Validation Accuracy: 0.9684
Classification Report:
              precision    recall  f1-score   support

Non-Repeater       0.99      0.97      0.98       158
    Repeater       0.88      0.94      0.91        32

    accuracy                           0.97       190
   macro avg       0.93      0.96      0.94       190
weighted avg       0.97      0.97      0.97       190

Trial 149 - Average Validation Accuracy: 0.9544
Fold 1/3 - Validation Accuracy: 0.9421
Classification Report:
              precision    recall  f1-score   support

Non-Repeater       0.96      0.97      0.97       159
    Repeater       0.86      0.77      0.81        31

    accuracy                           0.94       190
   macro avg       0.91      0.87      0.89       190
weighted avg       0.94      0.94      0.94       190

Fold 2/3 - Validation Accuracy: 0.9684
Classification Report:
              precision    recall  f1-score   support

Non-Repeater       0.97      0.99      0.98       159
    Repeater       0.96      0.84      0.90        31

    accuracy                           0.97       190
   macro avg       0.97      0.92      0.94       190
weighted avg       0.97      0.97      0.97       190

Fold 3/3 - Validation Accuracy: 0.9632
Classification Report:
              precision    recall  f1-score   support

Non-Repeater       0.98      0.97      0.98       158
    Repeater       0.88      0.91      0.89        32

    accuracy                           0.96       190
   macro avg       0.93      0.94      0.94       190
weighted avg       0.96      0.96      0.96       190

Trial 150 - Average Validation Accuracy: 0.9579
Fold 1/3 - Validation Accuracy: 0.9579
Classification Report:
              precision    recall  f1-score   support

Non-Repeater       0.97      0.97      0.97       159
    Repeater       0.87      0.87      0.87        31

    accuracy                           0.96       190
   macro avg       0.92      0.92      0.92       190
weighted avg       0.96      0.96      0.96       190

Fold 2/3 - Validation Accuracy: 0.9737
Classification Report:
              precision    recall  f1-score   support

Non-Repeater       0.98      0.99      0.98       159
    Repeater       0.96      0.87      0.92        31

    accuracy                           0.97       190
   macro avg       0.97      0.93      0.95       190
weighted avg       0.97      0.97      0.97       190

Fold 3/3 - Validation Accuracy: 0.9526
Classification Report:
              precision    recall  f1-score   support

Non-Repeater       0.97      0.97      0.97       158
    Repeater       0.87      0.84      0.86        32

    accuracy                           0.95       190
   macro avg       0.92      0.91      0.91       190
weighted avg       0.95      0.95      0.95       190

Trial 151 - Average Validation Accuracy: 0.9614
Fold 1/3 - Validation Accuracy: 0.9526
Classification Report:
              precision    recall  f1-score   support

Non-Repeater       0.96      0.99      0.97       159
    Repeater       0.92      0.77      0.84        31

    accuracy                           0.95       190
   macro avg       0.94      0.88      0.91       190
weighted avg       0.95      0.95      0.95       190

Fold 2/3 - Validation Accuracy: 0.9684
Classification Report:
              precision    recall  f1-score   support

Non-Repeater       0.97      0.99      0.98       159
    Repeater       0.96      0.84      0.90        31

    accuracy                           0.97       190
   macro avg       0.97      0.92      0.94       190
weighted avg       0.97      0.97      0.97       190

Fold 3/3 - Validation Accuracy: 0.9579
Classification Report:
[I 2025-08-31 15:30:59,175] Trial 152 finished with value: 0.9596491228070175 and parameters: {'hidden_dim': 1455, 'latent_dim': 13, 'beta': 1.185564347694051, 'gamma': 1.131186737254342, 'dropout_rate': 0.11019257518360265, 'lr': 0.0006441811270457912, 'scheduler_patience': 7, 'class_weight': 0.9434792811177911, 'activation': 'ReLU', 'classification_multiplier': 13576.994050445546}. Best is trial 111 with value: 0.9719298245614035.
[I 2025-08-31 15:31:23,965] Trial 153 finished with value: 0.968421052631579 and parameters: {'hidden_dim': 1352, 'latent_dim': 22, 'beta': 1.862768326437219, 'gamma': 1.1900458056589769, 'dropout_rate': 0.1087031161223226, 'lr': 0.0009346797995249718, 'scheduler_patience': 7, 'class_weight': 0.968593227617571, 'activation': 'ReLU', 'classification_multiplier': 13831.063965222644}. Best is trial 111 with value: 0.9719298245614035.
