[I 2025-08-31 16:58:42,743] Trial 349 finished with value: 0.9701754385964912 and parameters: {'hidden_dim': 1541, 'latent_dim': 17, 'beta': 1.9501933638024975, 'gamma': 1.348880817509086, 'dropout_rate': 0.10723765593575188, 'lr': 0.00029465828228271277, 'scheduler_patience': 7, 'class_weight': 0.8868640091977166, 'activation': 'ReLU', 'classification_multiplier': 11827.351551933958}. Best is trial 332 with value: 0.9754385964912281.
              precision    recall  f1-score   support

Non-Repeater       0.96      0.96      0.96       159
    Repeater       0.81      0.81      0.81        31

    accuracy                           0.94       190
   macro avg       0.88      0.88      0.88       190
weighted avg       0.94      0.94      0.94       190

Fold 2/3 - Validation Accuracy: 0.9684
Classification Report:
              precision    recall  f1-score   support

Non-Repeater       0.97      0.99      0.98       159
    Repeater       0.96      0.84      0.90        31

    accuracy                           0.97       190
   macro avg       0.97      0.92      0.94       190
weighted avg       0.97      0.97      0.97       190

Fold 3/3 - Validation Accuracy: 0.9684
Classification Report:
              precision    recall  f1-score   support

Non-Repeater       0.97      0.99      0.98       158
    Repeater       0.93      0.88      0.90        32

    accuracy                           0.97       190
   macro avg       0.95      0.93      0.94       190
weighted avg       0.97      0.97      0.97       190

Trial 346 - Average Validation Accuracy: 0.9579
Fold 1/3 - Validation Accuracy: 0.9579
Classification Report:
              precision    recall  f1-score   support

Non-Repeater       0.97      0.97      0.97       159
    Repeater       0.87      0.87      0.87        31

    accuracy                           0.96       190
   macro avg       0.92      0.92      0.92       190
weighted avg       0.96      0.96      0.96       190

Fold 2/3 - Validation Accuracy: 0.9684
Classification Report:
              precision    recall  f1-score   support

Non-Repeater       0.97      0.99      0.98       159
    Repeater       0.96      0.84      0.90        31

    accuracy                           0.97       190
   macro avg       0.97      0.92      0.94       190
weighted avg       0.97      0.97      0.97       190

Fold 3/3 - Validation Accuracy: 0.9579
Classification Report:
              precision    recall  f1-score   support

Non-Repeater       0.97      0.97      0.97       158
    Repeater       0.88      0.88      0.88        32

    accuracy                           0.96       190
   macro avg       0.92      0.92      0.92       190
weighted avg       0.96      0.96      0.96       190

Trial 347 - Average Validation Accuracy: 0.9614
Fold 1/3 - Validation Accuracy: 0.9579
Classification Report:
              precision    recall  f1-score   support

Non-Repeater       0.97      0.98      0.97       159
    Repeater       0.90      0.84      0.87        31

    accuracy                           0.96       190
   macro avg       0.93      0.91      0.92       190
weighted avg       0.96      0.96      0.96       190

Fold 2/3 - Validation Accuracy: 0.9737
Classification Report:
              precision    recall  f1-score   support

Non-Repeater       0.98      0.99      0.98       159
    Repeater       0.96      0.87      0.92        31

    accuracy                           0.97       190
   macro avg       0.97      0.93      0.95       190
weighted avg       0.97      0.97      0.97       190

Fold 3/3 - Validation Accuracy: 0.9632
Classification Report:
              precision    recall  f1-score   support

Non-Repeater       0.97      0.99      0.98       158
    Repeater       0.93      0.84      0.89        32

    accuracy                           0.96       190
   macro avg       0.95      0.92      0.93       190
weighted avg       0.96      0.96      0.96       190

Trial 348 - Average Validation Accuracy: 0.9649
Fold 1/3 - Validation Accuracy: 0.9579
Classification Report:
              precision    recall  f1-score   support

Non-Repeater       0.97      0.98      0.97       159
    Repeater       0.90      0.84      0.87        31

    accuracy                           0.96       190
   macro avg       0.93      0.91      0.92       190
weighted avg       0.96      0.96      0.96       190

Fold 2/3 - Validation Accuracy: 0.9842
Classification Report:
              precision    recall  f1-score   support

Non-Repeater       0.99      0.99      0.99       159
    Repeater       0.97      0.94      0.95        31

    accuracy                           0.98       190
   macro avg       0.98      0.96      0.97       190
weighted avg       0.98      0.98      0.98       190

Fold 3/3 - Validation Accuracy: 0.9684
Classification Report:
              precision    recall  f1-score   support

Non-Repeater       0.97      0.99      0.98       158
    Repeater       0.93      0.88      0.90        32

    accuracy                           0.97       190
   macro avg       0.95      0.93      0.94       190
weighted avg       0.97      0.97      0.97       190

Trial 349 - Average Validation Accuracy: 0.9702
