[I 2025-08-31 14:57:08,763] Trial 76 finished with value: 0.9596491228070175 and parameters: {'hidden_dim': 1685, 'latent_dim': 40, 'beta': 1.930517452640501, 'gamma': 1.9735597741933584, 'dropout_rate': 0.12078482239694253, 'lr': 0.0007931363447512542, 'scheduler_patience': 7, 'class_weight': 0.9541193292789647, 'activation': 'ReLU', 'classification_multiplier': 13106.712951401074}. Best is trial 62 with value: 0.9701754385964912.
[I 2025-08-31 14:57:35,655] Trial 77 finished with value: 0.9666666666666667 and parameters: {'hidden_dim': 1616, 'latent_dim': 38, 'beta': 1.981740264852194, 'gamma': 1.728254370072268, 'dropout_rate': 0.13240724065098886, 'lr': 0.0010721706983426705, 'scheduler_patience': 7, 'class_weight': 0.9368308859763016, 'activation': 'ReLU', 'classification_multiplier': 12964.546606140178}. Best is trial 62 with value: 0.9701754385964912.
[I 2025-08-31 14:58:02,228] Trial 78 finished with value: 0.9333333333333332 and parameters: {'hidden_dim': 1576, 'latent_dim': 39, 'beta': 1.8579885680357404, 'gamma': 1.8657571291353023, 'dropout_rate': 0.4972686489478315, 'lr': 0.0006231812111986391, 'scheduler_patience': 7, 'class_weight': 0.9594024038268408, 'activation': 'ELU', 'classification_multiplier': 12709.88311349791}. Best is trial 62 with value: 0.9701754385964912.
              precision    recall  f1-score   support

Non-Repeater       0.99      0.97      0.98       158
    Repeater       0.86      0.94      0.90        32

    accuracy                           0.96       190
   macro avg       0.92      0.95      0.94       190
weighted avg       0.97      0.96      0.96       190

Trial 72 - Average Validation Accuracy: 0.9702
Fold 1/3 - Validation Accuracy: 0.9526
Classification Report:
              precision    recall  f1-score   support

Non-Repeater       0.97      0.97      0.97       159
    Repeater       0.87      0.84      0.85        31

    accuracy                           0.95       190
   macro avg       0.92      0.91      0.91       190
weighted avg       0.95      0.95      0.95       190

Fold 2/3 - Validation Accuracy: 0.9842
Classification Report:
              precision    recall  f1-score   support

Non-Repeater       0.99      0.99      0.99       159
    Repeater       0.97      0.94      0.95        31

    accuracy                           0.98       190
   macro avg       0.98      0.96      0.97       190
weighted avg       0.98      0.98      0.98       190

Fold 3/3 - Validation Accuracy: 0.9684
Classification Report:
              precision    recall  f1-score   support

Non-Repeater       0.99      0.97      0.98       158
    Repeater       0.88      0.94      0.91        32

    accuracy                           0.97       190
   macro avg       0.93      0.96      0.94       190
weighted avg       0.97      0.97      0.97       190

Trial 73 - Average Validation Accuracy: 0.9684
Fold 1/3 - Validation Accuracy: 0.9526
Classification Report:
              precision    recall  f1-score   support

Non-Repeater       0.97      0.97      0.97       159
    Repeater       0.87      0.84      0.85        31

    accuracy                           0.95       190
   macro avg       0.92      0.91      0.91       190
weighted avg       0.95      0.95      0.95       190

Fold 2/3 - Validation Accuracy: 0.9789
Classification Report:
              precision    recall  f1-score   support

Non-Repeater       0.98      0.99      0.99       159
    Repeater       0.97      0.90      0.93        31

    accuracy                           0.98       190
   macro avg       0.97      0.95      0.96       190
weighted avg       0.98      0.98      0.98       190

Fold 3/3 - Validation Accuracy: 0.9789
Classification Report:
              precision    recall  f1-score   support

Non-Repeater       0.99      0.99      0.99       158
    Repeater       0.94      0.94      0.94        32

    accuracy                           0.98       190
   macro avg       0.96      0.96      0.96       190
weighted avg       0.98      0.98      0.98       190

Trial 74 - Average Validation Accuracy: 0.9702
Fold 1/3 - Validation Accuracy: 0.9526
Classification Report:
              precision    recall  f1-score   support

Non-Repeater       0.97      0.97      0.97       159
    Repeater       0.84      0.87      0.86        31

    accuracy                           0.95       190
   macro avg       0.91      0.92      0.91       190
weighted avg       0.95      0.95      0.95       190

Fold 2/3 - Validation Accuracy: 0.9789
Classification Report:
              precision    recall  f1-score   support

Non-Repeater       0.98      0.99      0.99       159
    Repeater       0.97      0.90      0.93        31

    accuracy                           0.98       190
   macro avg       0.97      0.95      0.96       190
weighted avg       0.98      0.98      0.98       190

Fold 3/3 - Validation Accuracy: 0.9789
Classification Report:
              precision    recall  f1-score   support

Non-Repeater       0.99      0.99      0.99       158
    Repeater       0.94      0.94      0.94        32

    accuracy                           0.98       190
   macro avg       0.96      0.96      0.96       190
weighted avg       0.98      0.98      0.98       190

Trial 75 - Average Validation Accuracy: 0.9702
Fold 1/3 - Validation Accuracy: 0.9579
Classification Report:
              precision    recall  f1-score   support

Non-Repeater       0.97      0.98      0.97       159
    Repeater       0.90      0.84      0.87        31

    accuracy                           0.96       190
   macro avg       0.93      0.91      0.92       190
weighted avg       0.96      0.96      0.96       190

Fold 2/3 - Validation Accuracy: 0.9684
Classification Report:
              precision    recall  f1-score   support

Non-Repeater       0.98      0.99      0.98       159
    Repeater       0.93      0.87      0.90        31

    accuracy                           0.97       190
   macro avg       0.95      0.93      0.94       190
weighted avg       0.97      0.97      0.97       190

Fold 3/3 - Validation Accuracy: 0.9526
Classification Report:
              precision    recall  f1-score   support

Non-Repeater       0.97      0.97      0.97       158
    Repeater       0.87      0.84      0.86        32

    accuracy                           0.95       190
   macro avg       0.92      0.91      0.91       190
weighted avg       0.95      0.95      0.95       190

Trial 76 - Average Validation Accuracy: 0.9596
Fold 1/3 - Validation Accuracy: 0.9579
Classification Report:
              precision    recall  f1-score   support

Non-Repeater       0.97      0.97      0.97       159
    Repeater       0.87      0.87      0.87        31

    accuracy                           0.96       190
   macro avg       0.92      0.92      0.92       190
weighted avg       0.96      0.96      0.96       190

Fold 2/3 - Validation Accuracy: 0.9789
Classification Report:
              precision    recall  f1-score   support

Non-Repeater       0.98      0.99      0.99       159
    Repeater       0.97      0.90      0.93        31

    accuracy                           0.98       190
   macro avg       0.97      0.95      0.96       190
weighted avg       0.98      0.98      0.98       190

Fold 3/3 - Validation Accuracy: 0.9632
Classification Report:
              precision    recall  f1-score   support

Non-Repeater       0.98      0.97      0.98       158
    Repeater       0.88      0.91      0.89        32

    accuracy                           0.96       190
   macro avg       0.93      0.94      0.94       190
weighted avg       0.96      0.96      0.96       190

Trial 77 - Average Validation Accuracy: 0.9667
Fold 1/3 - Validation Accuracy: 0.9211
Classification Report:
              precision    recall  f1-score   support

Non-Repeater       0.94      0.96      0.95       159
    Repeater       0.79      0.71      0.75        31

    accuracy                           0.92       190
   macro avg       0.87      0.84      0.85       190
weighted avg       0.92      0.92      0.92       190

Fold 2/3 - Validation Accuracy: 0.9368
Classification Report:
              precision    recall  f1-score   support

Non-Repeater       0.95      0.98      0.96       159
    Repeater       0.88      0.71      0.79        31

    accuracy                           0.94       190
   macro avg       0.91      0.85      0.87       190
weighted avg       0.93      0.94      0.93       190

Fold 3/3 - Validation Accuracy: 0.9421
Classification Report:
              precision    recall  f1-score   support

Non-Repeater       0.97      0.96      0.96       158
    Repeater       0.80      0.88      0.84        32

    accuracy                           0.94       190
   macro avg       0.89      0.92      0.90       190
weighted avg       0.94      0.94      0.94       190

Trial 78 - Average Validation Accuracy: 0.9333
Fold 1/3 - Validation Accuracy: 0.9368
Classification Report:
              precision    recall  f1-score   support

Non-Repeater       0.96      0.97      0.96       159
    Repeater       0.83      0.77      0.80        31

    accuracy                           0.94       190
   macro avg       0.89      0.87      0.88       190
weighted avg       0.94      0.94      0.94       190

Fold 2/3 - Validation Accuracy: 0.9211
Classification Report:
[I 2025-08-31 14:58:29,763] Trial 79 finished with value: 0.9280701754385965 and parameters: {'hidden_dim': 1710, 'latent_dim': 21, 'beta': 1.941054943029426, 'gamma': 1.8183574477279585, 'dropout_rate': 0.14798692081223347, 'lr': 0.007179981390193653, 'scheduler_patience': 7, 'class_weight': 0.9085642086439539, 'activation': 'ReLU', 'classification_multiplier': 11920.546304734455}. Best is trial 62 with value: 0.9701754385964912.
[I 2025-08-31 14:58:58,081] Trial 80 finished with value: 0.9596491228070175 and parameters: {'hidden_dim': 1798, 'latent_dim': 34, 'beta': 1.8686093986436447, 'gamma': 1.5904219952308551, 'dropout_rate': 0.12226377652664905, 'lr': 0.0013391572925207996, 'scheduler_patience': 7, 'class_weight': 0.9846810965798217, 'activation': 'LeakyReLU', 'classification_multiplier': 13544.042899071515}. Best is trial 62 with value: 0.9701754385964912.
[I 2025-08-31 14:59:26,886] Trial 81 finished with value: 0.9649122807017544 and parameters: {'hidden_dim': 1821, 'latent_dim': 37, 'beta': 1.811601380325544, 'gamma': 1.914732180429875, 'dropout_rate': 0.17827376053855767, 'lr': 0.00010170435792716947, 'scheduler_patience': 7, 'class_weight': 0.8863057960264932, 'activation': 'ReLU', 'classification_multiplier': 11246.392992646954}. Best is trial 62 with value: 0.9701754385964912.
[I 2025-08-31 14:59:56,012] Trial 82 finished with value: 0.9649122807017544 and parameters: {'hidden_dim': 1892, 'latent_dim': 35, 'beta': 1.9370167038548123, 'gamma': 1.9928101356889665, 'dropout_rate': 0.10227272175093122, 'lr': 0.00025725537726982927, 'scheduler_patience': 6, 'class_weight': 0.8602663669631796, 'activation': 'ReLU', 'classification_multiplier': 12157.082309728381}. Best is trial 62 with value: 0.9701754385964912.
[I 2025-08-31 15:00:22,879] Trial 83 finished with value: 0.9701754385964912 and parameters: {'hidden_dim': 1573, 'latent_dim': 38, 'beta': 1.9982524964273856, 'gamma': 1.7713466898841506, 'dropout_rate': 0.13922443357812672, 'lr': 0.00010579742069389315, 'scheduler_patience': 7, 'class_weight': 0.9988286155070469, 'activation': 'ReLU', 'classification_multiplier': 12423.327506564168}. Best is trial 62 with value: 0.9701754385964912.
[I 2025-08-31 15:00:49,350] Trial 84 finished with value: 0.9596491228070175 and parameters: {'hidden_dim': 1554, 'latent_dim': 38, 'beta': 1.8814087866459694, 'gamma': 1.7604142167984802, 'dropout_rate': 0.13882307419931642, 'lr': 0.000978688455813245, 'scheduler_patience': 7, 'class_weight': 0.9995666047064429, 'activation': 'ReLU', 'classification_multiplier': 12471.876088749359}. Best is trial 62 with value: 0.9701754385964912.
[I 2025-08-31 15:01:16,829] Trial 85 finished with value: 0.9701754385964912 and parameters: {'hidden_dim': 1702, 'latent_dim': 40, 'beta': 1.9894919114147953, 'gamma': 1.6728337671981208, 'dropout_rate': 0.1272149925217202, 'lr': 0.0006594703659850685, 'scheduler_patience': 7, 'class_weight': 0.9614227283896991, 'activation': 'ReLU', 'classification_multiplier': 11808.056118648432}. Best is trial 62 with value: 0.9701754385964912.
              precision    recall  f1-score   support

Non-Repeater       0.94      0.97      0.95       159
    Repeater       0.81      0.68      0.74        31

    accuracy                           0.92       190
   macro avg       0.87      0.82      0.85       190
weighted avg       0.92      0.92      0.92       190

Fold 3/3 - Validation Accuracy: 0.9263
Classification Report:
              precision    recall  f1-score   support

Non-Repeater       0.94      0.97      0.96       158
    Repeater       0.85      0.69      0.76        32

    accuracy                           0.93       190
   macro avg       0.89      0.83      0.86       190
weighted avg       0.92      0.93      0.92       190

Trial 79 - Average Validation Accuracy: 0.9281
Fold 1/3 - Validation Accuracy: 0.9526
Classification Report:
              precision    recall  f1-score   support

Non-Repeater       0.96      0.99      0.97       159
    Repeater       0.92      0.77      0.84        31

    accuracy                           0.95       190
   macro avg       0.94      0.88      0.91       190
weighted avg       0.95      0.95      0.95       190

Fold 2/3 - Validation Accuracy: 0.9684
Classification Report:
              precision    recall  f1-score   support

Non-Repeater       0.98      0.99      0.98       159
    Repeater       0.93      0.87      0.90        31

    accuracy                           0.97       190
   macro avg       0.95      0.93      0.94       190
weighted avg       0.97      0.97      0.97       190

Fold 3/3 - Validation Accuracy: 0.9579
Classification Report:
              precision    recall  f1-score   support

Non-Repeater       0.97      0.98      0.97       158
    Repeater       0.90      0.84      0.87        32

    accuracy                           0.96       190
   macro avg       0.93      0.91      0.92       190
weighted avg       0.96      0.96      0.96       190

Trial 80 - Average Validation Accuracy: 0.9596
Fold 1/3 - Validation Accuracy: 0.9579
Classification Report:
              precision    recall  f1-score   support

Non-Repeater       0.96      0.99      0.98       159
    Repeater       0.93      0.81      0.86        31

    accuracy                           0.96       190
   macro avg       0.94      0.90      0.92       190
weighted avg       0.96      0.96      0.96       190

Fold 2/3 - Validation Accuracy: 0.9737
Classification Report:
              precision    recall  f1-score   support

Non-Repeater       0.98      0.99      0.98       159
    Repeater       0.96      0.87      0.92        31

    accuracy                           0.97       190
   macro avg       0.97      0.93      0.95       190
weighted avg       0.97      0.97      0.97       190

Fold 3/3 - Validation Accuracy: 0.9632
Classification Report:
              precision    recall  f1-score   support

Non-Repeater       0.97      0.99      0.98       158
    Repeater       0.93      0.84      0.89        32

    accuracy                           0.96       190
   macro avg       0.95      0.92      0.93       190
weighted avg       0.96      0.96      0.96       190

Trial 81 - Average Validation Accuracy: 0.9649
Fold 1/3 - Validation Accuracy: 0.9579
Classification Report:
              precision    recall  f1-score   support

Non-Repeater       0.98      0.97      0.97       159
    Repeater       0.85      0.90      0.88        31

    accuracy                           0.96       190
   macro avg       0.91      0.94      0.92       190
weighted avg       0.96      0.96      0.96       190

Fold 2/3 - Validation Accuracy: 0.9737
Classification Report:
              precision    recall  f1-score   support

Non-Repeater       0.98      0.99      0.98       159
    Repeater       0.96      0.87      0.92        31

    accuracy                           0.97       190
   macro avg       0.97      0.93      0.95       190
weighted avg       0.97      0.97      0.97       190

Fold 3/3 - Validation Accuracy: 0.9632
Classification Report:
              precision    recall  f1-score   support

Non-Repeater       0.97      0.98      0.98       158
    Repeater       0.90      0.88      0.89        32

    accuracy                           0.96       190
   macro avg       0.94      0.93      0.93       190
weighted avg       0.96      0.96      0.96       190

Trial 82 - Average Validation Accuracy: 0.9649
Fold 1/3 - Validation Accuracy: 0.9474
Classification Report:
              precision    recall  f1-score   support

Non-Repeater       0.97      0.97      0.97       159
    Repeater       0.84      0.84      0.84        31

    accuracy                           0.95       190
   macro avg       0.90      0.90      0.90       190
weighted avg       0.95      0.95      0.95       190

Fold 2/3 - Validation Accuracy: 0.9842
Classification Report:
              precision    recall  f1-score   support

Non-Repeater       0.99      0.99      0.99       159
    Repeater       0.97      0.94      0.95        31

    accuracy                           0.98       190
   macro avg       0.98      0.96      0.97       190
weighted avg       0.98      0.98      0.98       190

Fold 3/3 - Validation Accuracy: 0.9789
Classification Report:
              precision    recall  f1-score   support

Non-Repeater       0.99      0.99      0.99       158
    Repeater       0.94      0.94      0.94        32

    accuracy                           0.98       190
   macro avg       0.96      0.96      0.96       190
weighted avg       0.98      0.98      0.98       190

Trial 83 - Average Validation Accuracy: 0.9702
Fold 1/3 - Validation Accuracy: 0.9474
Classification Report:
              precision    recall  f1-score   support

Non-Repeater       0.96      0.98      0.97       159
    Repeater       0.89      0.77      0.83        31

    accuracy                           0.95       190
   macro avg       0.92      0.88      0.90       190
weighted avg       0.95      0.95      0.95       190

Fold 2/3 - Validation Accuracy: 0.9789
Classification Report:
              precision    recall  f1-score   support

Non-Repeater       0.98      0.99      0.99       159
    Repeater       0.97      0.90      0.93        31

    accuracy                           0.98       190
   macro avg       0.97      0.95      0.96       190
weighted avg       0.98      0.98      0.98       190

Fold 3/3 - Validation Accuracy: 0.9526
Classification Report:
              precision    recall  f1-score   support

Non-Repeater       0.96      0.99      0.97       158
    Repeater       0.93      0.78      0.85        32

    accuracy                           0.95       190
   macro avg       0.94      0.88      0.91       190
weighted avg       0.95      0.95      0.95       190

Trial 84 - Average Validation Accuracy: 0.9596
Fold 1/3 - Validation Accuracy: 0.9632
Classification Report:
              precision    recall  f1-score   support

Non-Repeater       0.97      0.99      0.98       159
    Repeater       0.93      0.84      0.88        31

    accuracy                           0.96       190
   macro avg       0.95      0.91      0.93       190
weighted avg       0.96      0.96      0.96       190

Fold 2/3 - Validation Accuracy: 0.9789
Classification Report:
              precision    recall  f1-score   support

Non-Repeater       0.98      0.99      0.99       159
    Repeater       0.97      0.90      0.93        31

    accuracy                           0.98       190
   macro avg       0.97      0.95      0.96       190
weighted avg       0.98      0.98      0.98       190

Fold 3/3 - Validation Accuracy: 0.9684
Classification Report:
              precision    recall  f1-score   support

Non-Repeater       0.97      0.99      0.98       158
    Repeater       0.96      0.84      0.90        32

    accuracy                           0.97       190
   macro avg       0.97      0.92      0.94       190
weighted avg       0.97      0.97      0.97       190

Trial 85 - Average Validation Accuracy: 0.9702
Fold 1/3 - Validation Accuracy: 0.9368
Classification Report:
[I 2025-08-31 15:01:44,367] Trial 86 finished with value: 0.9350877192982456 and parameters: {'hidden_dim': 1677, 'latent_dim': 40, 'beta': 1.9810252556913186, 'gamma': 1.6716131982039597, 'dropout_rate': 0.13088914065978052, 'lr': 0.0006849409060012616, 'scheduler_patience': 4, 'class_weight': 0.9498645911208092, 'activation': 'SELU', 'classification_multiplier': 11892.285413040536}. Best is trial 62 with value: 0.9701754385964912.
[I 2025-08-31 15:02:12,572] Trial 87 finished with value: 0.9666666666666667 and parameters: {'hidden_dim': 1770, 'latent_dim': 39, 'beta': 1.924788795473236, 'gamma': 1.8627754903179028, 'dropout_rate': 0.11722216198860204, 'lr': 0.00039802759812393766, 'scheduler_patience': 7, 'class_weight': 0.9699026479860346, 'activation': 'ReLU', 'classification_multiplier': 12812.765358937924}. Best is trial 62 with value: 0.9701754385964912.
[I 2025-08-31 15:02:39,575] Trial 88 finished with value: 0.9666666666666667 and parameters: {'hidden_dim': 1597, 'latent_dim': 37, 'beta': 1.8338151239125968, 'gamma': 1.5488293314635173, 'dropout_rate': 0.15208137370959413, 'lr': 0.0006304738191139843, 'scheduler_patience': 7, 'class_weight': 0.9240359420342396, 'activation': 'ReLU', 'classification_multiplier': 13340.46616985702}. Best is trial 62 with value: 0.9701754385964912.
