[I 2025-08-31 15:43:00,973] Trial 180 finished with value: 0.9596491228070175 and parameters: {'hidden_dim': 1275, 'latent_dim': 31, 'beta': 1.9609269625275574, 'gamma': 1.8912203075171825, 'dropout_rate': 0.13025563588133365, 'lr': 0.00012475007046057924, 'scheduler_patience': 7, 'class_weight': 0.5029544962486856, 'activation': 'ReLU', 'classification_multiplier': 10871.901177114823}. Best is trial 111 with value: 0.9719298245614035.
[I 2025-08-31 15:43:25,805] Trial 181 finished with value: 0.968421052631579 and parameters: {'hidden_dim': 1333, 'latent_dim': 39, 'beta': 1.9663935686361695, 'gamma': 1.6673448407383502, 'dropout_rate': 0.11827983921174917, 'lr': 0.0006491158203771056, 'scheduler_patience': 7, 'class_weight': 0.9615785299006984, 'activation': 'ReLU', 'classification_multiplier': 11662.14967383107}. Best is trial 111 with value: 0.9719298245614035.
[I 2025-08-31 15:43:50,762] Trial 182 finished with value: 0.9701754385964912 and parameters: {'hidden_dim': 1352, 'latent_dim': 38, 'beta': 1.9281720682079904, 'gamma': 1.8269372008023907, 'dropout_rate': 0.1246044655576473, 'lr': 0.0004710221389106246, 'scheduler_patience': 7, 'class_weight': 0.9407108731652534, 'activation': 'ReLU', 'classification_multiplier': 10197.050278570285}. Best is trial 111 with value: 0.9719298245614035.
[I 2025-08-31 15:44:18,930] Trial 183 finished with value: 0.9649122807017544 and parameters: {'hidden_dim': 1776, 'latent_dim': 39, 'beta': 1.9217298057011172, 'gamma': 1.837327463495858, 'dropout_rate': 0.1379768041491538, 'lr': 0.00044074240569491694, 'scheduler_patience': 7, 'class_weight': 0.9076265398623745, 'activation': 'ReLU', 'classification_multiplier': 10376.6332220747}. Best is trial 111 with value: 0.9719298245614035.
[I 2025-08-31 15:44:43,249] Trial 184 finished with value: 0.9666666666666667 and parameters: {'hidden_dim': 1233, 'latent_dim': 38, 'beta': 1.8242695233137578, 'gamma': 1.809716082557085, 'dropout_rate': 0.12223326992104493, 'lr': 0.00027138578162179823, 'scheduler_patience': 7, 'class_weight': 0.9798451605397877, 'activation': 'ReLU', 'classification_multiplier': 10122.231076929682}. Best is trial 111 with value: 0.9719298245614035.
[I 2025-08-31 15:45:08,397] Trial 185 finished with value: 0.9578947368421052 and parameters: {'hidden_dim': 1365, 'latent_dim': 37, 'beta': 1.8926043336692202, 'gamma': 1.7560910905382157, 'dropout_rate': 0.1557126400995774, 'lr': 0.0005297896083117109, 'scheduler_patience': 7, 'class_weight': 0.949801231660785, 'activation': 'ReLU', 'classification_multiplier': 9930.443886540244}. Best is trial 111 with value: 0.9719298245614035.
              precision    recall  f1-score   support

Non-Repeater       0.97      0.99      0.98       159
    Repeater       0.96      0.84      0.90        31

    accuracy                           0.97       190
   macro avg       0.97      0.92      0.94       190
weighted avg       0.97      0.97      0.97       190

Fold 3/3 - Validation Accuracy: 0.9632
Classification Report:
              precision    recall  f1-score   support

Non-Repeater       0.98      0.97      0.98       158
    Repeater       0.88      0.91      0.89        32

    accuracy                           0.96       190
   macro avg       0.93      0.94      0.94       190
weighted avg       0.96      0.96      0.96       190

Trial 179 - Average Validation Accuracy: 0.9614
Fold 1/3 - Validation Accuracy: 0.9421
Classification Report:
              precision    recall  f1-score   support

Non-Repeater       0.96      0.97      0.97       159
    Repeater       0.86      0.77      0.81        31

    accuracy                           0.94       190
   macro avg       0.91      0.87      0.89       190
weighted avg       0.94      0.94      0.94       190

Fold 2/3 - Validation Accuracy: 0.9684
Classification Report:
              precision    recall  f1-score   support

Non-Repeater       0.97      0.99      0.98       159
    Repeater       0.96      0.84      0.90        31

    accuracy                           0.97       190
   macro avg       0.97      0.92      0.94       190
weighted avg       0.97      0.97      0.97       190

Fold 3/3 - Validation Accuracy: 0.9684
Classification Report:
              precision    recall  f1-score   support

Non-Repeater       0.97      0.99      0.98       158
    Repeater       0.96      0.84      0.90        32

    accuracy                           0.97       190
   macro avg       0.97      0.92      0.94       190
weighted avg       0.97      0.97      0.97       190

Trial 180 - Average Validation Accuracy: 0.9596
Fold 1/3 - Validation Accuracy: 0.9579
Classification Report:
              precision    recall  f1-score   support

Non-Repeater       0.97      0.97      0.97       159
    Repeater       0.87      0.87      0.87        31

    accuracy                           0.96       190
   macro avg       0.92      0.92      0.92       190
weighted avg       0.96      0.96      0.96       190

Fold 2/3 - Validation Accuracy: 0.9789
Classification Report:
              precision    recall  f1-score   support

Non-Repeater       0.98      0.99      0.99       159
    Repeater       0.97      0.90      0.93        31

    accuracy                           0.98       190
   macro avg       0.97      0.95      0.96       190
weighted avg       0.98      0.98      0.98       190

Fold 3/3 - Validation Accuracy: 0.9684
Classification Report:
              precision    recall  f1-score   support

Non-Repeater       0.98      0.98      0.98       158
    Repeater       0.91      0.91      0.91        32

    accuracy                           0.97       190
   macro avg       0.94      0.94      0.94       190
weighted avg       0.97      0.97      0.97       190

Trial 181 - Average Validation Accuracy: 0.9684
Fold 1/3 - Validation Accuracy: 0.9526
Classification Report:
              precision    recall  f1-score   support

Non-Repeater       0.97      0.97      0.97       159
    Repeater       0.87      0.84      0.85        31

    accuracy                           0.95       190
   macro avg       0.92      0.91      0.91       190
weighted avg       0.95      0.95      0.95       190

Fold 2/3 - Validation Accuracy: 0.9789
Classification Report:
              precision    recall  f1-score   support

Non-Repeater       0.98      0.99      0.99       159
    Repeater       0.97      0.90      0.93        31

    accuracy                           0.98       190
   macro avg       0.97      0.95      0.96       190
weighted avg       0.98      0.98      0.98       190

Fold 3/3 - Validation Accuracy: 0.9789
Classification Report:
              precision    recall  f1-score   support

Non-Repeater       0.98      0.99      0.99       158
    Repeater       0.97      0.91      0.94        32

    accuracy                           0.98       190
   macro avg       0.97      0.95      0.96       190
weighted avg       0.98      0.98      0.98       190

Trial 182 - Average Validation Accuracy: 0.9702
Fold 1/3 - Validation Accuracy: 0.9526
Classification Report:
              precision    recall  f1-score   support

Non-Repeater       0.97      0.97      0.97       159
    Repeater       0.87      0.84      0.85        31

    accuracy                           0.95       190
   macro avg       0.92      0.91      0.91       190
weighted avg       0.95      0.95      0.95       190

Fold 2/3 - Validation Accuracy: 0.9789
Classification Report:
              precision    recall  f1-score   support

Non-Repeater       0.98      0.99      0.99       159
    Repeater       0.97      0.90      0.93        31

    accuracy                           0.98       190
   macro avg       0.97      0.95      0.96       190
weighted avg       0.98      0.98      0.98       190

Fold 3/3 - Validation Accuracy: 0.9632
Classification Report:
              precision    recall  f1-score   support

Non-Repeater       0.97      0.99      0.98       158
    Repeater       0.93      0.84      0.89        32

    accuracy                           0.96       190
   macro avg       0.95      0.92      0.93       190
weighted avg       0.96      0.96      0.96       190

Trial 183 - Average Validation Accuracy: 0.9649
Fold 1/3 - Validation Accuracy: 0.9526
Classification Report:
              precision    recall  f1-score   support

Non-Repeater       0.97      0.97      0.97       159
    Repeater       0.84      0.87      0.86        31

    accuracy                           0.95       190
   macro avg       0.91      0.92      0.91       190
weighted avg       0.95      0.95      0.95       190

Fold 2/3 - Validation Accuracy: 0.9789
Classification Report:
              precision    recall  f1-score   support

Non-Repeater       0.98      0.99      0.99       159
    Repeater       0.97      0.90      0.93        31

    accuracy                           0.98       190
   macro avg       0.97      0.95      0.96       190
weighted avg       0.98      0.98      0.98       190

Fold 3/3 - Validation Accuracy: 0.9684
Classification Report:
              precision    recall  f1-score   support

Non-Repeater       0.99      0.97      0.98       158
    Repeater       0.88      0.94      0.91        32

    accuracy                           0.97       190
   macro avg       0.93      0.96      0.94       190
weighted avg       0.97      0.97      0.97       190

Trial 184 - Average Validation Accuracy: 0.9667
Fold 1/3 - Validation Accuracy: 0.9474
Classification Report:
              precision    recall  f1-score   support

Non-Repeater       0.96      0.98      0.97       159
    Repeater       0.89      0.77      0.83        31

    accuracy                           0.95       190
   macro avg       0.92      0.88      0.90       190
weighted avg       0.95      0.95      0.95       190

Fold 2/3 - Validation Accuracy: 0.9632
Classification Report:
              precision    recall  f1-score   support

Non-Repeater       0.97      0.99      0.98       159
    Repeater       0.93      0.84      0.88        31

    accuracy                           0.96       190
   macro avg       0.95      0.91      0.93       190
weighted avg       0.96      0.96      0.96       190

Fold 3/3 - Validation Accuracy: 0.9632
Classification Report:
              precision    recall  f1-score   support

Non-Repeater       0.98      0.97      0.98       158
    Repeater       0.88      0.91      0.89        32

    accuracy                           0.96       190
   macro avg       0.93      0.94      0.94       190
weighted avg       0.96      0.96      0.96       190

Trial 185 - Average Validation Accuracy: 0.9579
Fold 1/3 - Validation Accuracy: 0.9421
Classification Report:
[I 2025-08-31 15:45:32,988] Trial 186 finished with value: 0.9614035087719298 and parameters: {'hidden_dim': 1300, 'latent_dim': 40, 'beta': 1.9410481985836865, 'gamma': 1.8876949980878168, 'dropout_rate': 0.13210694061625183, 'lr': 0.000274605040549791, 'scheduler_patience': 7, 'class_weight': 0.9199598229345706, 'activation': 'ReLU', 'classification_multiplier': 11239.956469291434}. Best is trial 111 with value: 0.9719298245614035.
[I 2025-08-31 15:45:59,902] Trial 187 finished with value: 0.9614035087719298 and parameters: {'hidden_dim': 1598, 'latent_dim': 38, 'beta': 1.9980213467403691, 'gamma': 1.7207999576448434, 'dropout_rate': 0.11196782790705632, 'lr': 0.0009444986554507022, 'scheduler_patience': 7, 'class_weight': 0.9646892474990287, 'activation': 'ReLU', 'classification_multiplier': 10702.528398094577}. Best is trial 111 with value: 0.9719298245614035.
[I 2025-08-31 15:46:23,399] Trial 188 finished with value: 0.9666666666666667 and parameters: {'hidden_dim': 1104, 'latent_dim': 39, 'beta': 1.859128528155281, 'gamma': 1.843723695870378, 'dropout_rate': 0.14148627695141658, 'lr': 0.0005739867308599592, 'scheduler_patience': 7, 'class_weight': 0.9361262201862566, 'activation': 'ReLU', 'classification_multiplier': 11917.615230585703}. Best is trial 111 with value: 0.9719298245614035.
[I 2025-08-31 15:46:52,298] Trial 189 finished with value: 0.9649122807017544 and parameters: {'hidden_dim': 1829, 'latent_dim': 39, 'beta': 1.9617101862288593, 'gamma': 1.922877312282279, 'dropout_rate': 0.12738548258983243, 'lr': 0.00011476482634659208, 'scheduler_patience': 7, 'class_weight': 0.9974002504006396, 'activation': 'ReLU', 'classification_multiplier': 9632.812029979828}. Best is trial 111 with value: 0.9719298245614035.
[I 2025-08-31 15:47:19,724] Trial 190 finished with value: 0.9614035087719298 and parameters: {'hidden_dim': 1654, 'latent_dim': 38, 'beta': 1.9034499219605605, 'gamma': 1.6110157149369528, 'dropout_rate': 0.10722295604200713, 'lr': 0.00039073940116019596, 'scheduler_patience': 7, 'class_weight': 0.8729027838930613, 'activation': 'ReLU', 'classification_multiplier': 11680.860989830173}. Best is trial 111 with value: 0.9719298245614035.
[I 2025-08-31 15:47:44,919] Trial 191 finished with value: 0.9666666666666667 and parameters: {'hidden_dim': 1378, 'latent_dim': 40, 'beta': 1.9987261347186556, 'gamma': 1.4703934778262322, 'dropout_rate': 0.12004697162259385, 'lr': 0.0007533568171017062, 'scheduler_patience': 7, 'class_weight': 0.9488315275979655, 'activation': 'ReLU', 'classification_multiplier': 12001.376495388957}. Best is trial 111 with value: 0.9719298245614035.
              precision    recall  f1-score   support

Non-Repeater       0.96      0.97      0.97       159
    Repeater       0.86      0.77      0.81        31

    accuracy                           0.94       190
   macro avg       0.91      0.87      0.89       190
weighted avg       0.94      0.94      0.94       190

Fold 2/3 - Validation Accuracy: 0.9789
Classification Report:
              precision    recall  f1-score   support

Non-Repeater       0.98      0.99      0.99       159
    Repeater       0.97      0.90      0.93        31

    accuracy                           0.98       190
   macro avg       0.97      0.95      0.96       190
weighted avg       0.98      0.98      0.98       190

Fold 3/3 - Validation Accuracy: 0.9632
Classification Report:
              precision    recall  f1-score   support

Non-Repeater       0.97      0.99      0.98       158
    Repeater       0.93      0.84      0.89        32

    accuracy                           0.96       190
   macro avg       0.95      0.92      0.93       190
weighted avg       0.96      0.96      0.96       190

Trial 186 - Average Validation Accuracy: 0.9614
Fold 1/3 - Validation Accuracy: 0.9474
Classification Report:
              precision    recall  f1-score   support

Non-Repeater       0.96      0.97      0.97       159
    Repeater       0.86      0.81      0.83        31

    accuracy                           0.95       190
   macro avg       0.91      0.89      0.90       190
weighted avg       0.95      0.95      0.95       190

Fold 2/3 - Validation Accuracy: 0.9842
Classification Report:
              precision    recall  f1-score   support

Non-Repeater       0.99      0.99      0.99       159
    Repeater       0.97      0.94      0.95        31

    accuracy                           0.98       190
   macro avg       0.98      0.96      0.97       190
weighted avg       0.98      0.98      0.98       190

Fold 3/3 - Validation Accuracy: 0.9526
Classification Report:
              precision    recall  f1-score   support

Non-Repeater       0.96      0.98      0.97       158
    Repeater       0.90      0.81      0.85        32

    accuracy                           0.95       190
   macro avg       0.93      0.90      0.91       190
weighted avg       0.95      0.95      0.95       190

Trial 187 - Average Validation Accuracy: 0.9614
Fold 1/3 - Validation Accuracy: 0.9632
Classification Report:
              precision    recall  f1-score   support

Non-Repeater       0.97      0.99      0.98       159
    Repeater       0.93      0.84      0.88        31

    accuracy                           0.96       190
   macro avg       0.95      0.91      0.93       190
weighted avg       0.96      0.96      0.96       190

Fold 2/3 - Validation Accuracy: 0.9789
Classification Report:
              precision    recall  f1-score   support

Non-Repeater       0.98      0.99      0.99       159
    Repeater       0.97      0.90      0.93        31

    accuracy                           0.98       190
   macro avg       0.97      0.95      0.96       190
weighted avg       0.98      0.98      0.98       190

Fold 3/3 - Validation Accuracy: 0.9579
Classification Report:
              precision    recall  f1-score   support

Non-Repeater       0.97      0.98      0.97       158
    Repeater       0.90      0.84      0.87        32

    accuracy                           0.96       190
   macro avg       0.93      0.91      0.92       190
weighted avg       0.96      0.96      0.96       190

Trial 188 - Average Validation Accuracy: 0.9667
Fold 1/3 - Validation Accuracy: 0.9474
Classification Report:
              precision    recall  f1-score   support

Non-Repeater       0.97      0.97      0.97       159
    Repeater       0.84      0.84      0.84        31

    accuracy                           0.95       190
   macro avg       0.90      0.90      0.90       190
weighted avg       0.95      0.95      0.95       190

Fold 2/3 - Validation Accuracy: 0.9789
Classification Report:
              precision    recall  f1-score   support

Non-Repeater       0.98      0.99      0.99       159
    Repeater       0.97      0.90      0.93        31

    accuracy                           0.98       190
   macro avg       0.97      0.95      0.96       190
weighted avg       0.98      0.98      0.98       190

Fold 3/3 - Validation Accuracy: 0.9684
Classification Report:
              precision    recall  f1-score   support

Non-Repeater       0.97      0.99      0.98       158
    Repeater       0.93      0.88      0.90        32

    accuracy                           0.97       190
   macro avg       0.95      0.93      0.94       190
weighted avg       0.97      0.97      0.97       190

Trial 189 - Average Validation Accuracy: 0.9649
Fold 1/3 - Validation Accuracy: 0.9579
Classification Report:
              precision    recall  f1-score   support

Non-Repeater       0.97      0.98      0.97       159
    Repeater       0.90      0.84      0.87        31

    accuracy                           0.96       190
   macro avg       0.93      0.91      0.92       190
weighted avg       0.96      0.96      0.96       190

Fold 2/3 - Validation Accuracy: 0.9737
Classification Report:
              precision    recall  f1-score   support

Non-Repeater       0.98      0.99      0.98       159
    Repeater       0.96      0.87      0.92        31

    accuracy                           0.97       190
   macro avg       0.97      0.93      0.95       190
weighted avg       0.97      0.97      0.97       190

Fold 3/3 - Validation Accuracy: 0.9526
Classification Report:
              precision    recall  f1-score   support

Non-Repeater       0.96      0.98      0.97       158
    Repeater       0.90      0.81      0.85        32

    accuracy                           0.95       190
   macro avg       0.93      0.90      0.91       190
weighted avg       0.95      0.95      0.95       190

Trial 190 - Average Validation Accuracy: 0.9614
Fold 1/3 - Validation Accuracy: 0.9579
Classification Report:
              precision    recall  f1-score   support

Non-Repeater       0.97      0.97      0.97       159
    Repeater       0.87      0.87      0.87        31

    accuracy                           0.96       190
   macro avg       0.92      0.92      0.92       190
weighted avg       0.96      0.96      0.96       190

Fold 2/3 - Validation Accuracy: 0.9737
Classification Report:
              precision    recall  f1-score   support

Non-Repeater       0.98      0.99      0.98       159
    Repeater       0.93      0.90      0.92        31

    accuracy                           0.97       190
   macro avg       0.96      0.95      0.95       190
weighted avg       0.97      0.97      0.97       190

Fold 3/3 - Validation Accuracy: 0.9684
Classification Report:
              precision    recall  f1-score   support

Non-Repeater       0.97      0.99      0.98       158
    Repeater       0.93      0.88      0.90        32

    accuracy                           0.97       190
   macro avg       0.95      0.93      0.94       190
weighted avg       0.97      0.97      0.97       190

Trial 191 - Average Validation Accuracy: 0.9667
Fold 1/3 - Validation Accuracy: 0.9579
Classification Report:
              precision    recall  f1-score   support

Non-Repeater       0.97      0.97      0.97       159
    Repeater       0.87      0.87      0.87        31

    accuracy                           0.96       190
   macro avg       0.92      0.92      0.92       190
weighted avg       0.96      0.96      0.96       190

Fold 2/3 - Validation Accuracy: 0.9632
Classification Report:
              precision    recall  f1-score   support

Non-Repeater       0.97      0.99      0.98       159
    Repeater       0.93      0.84      0.88        31

    accuracy                           0.96       190
   macro avg       0.95      0.91      0.93       190
weighted avg       0.96      0.96      0.96       190

Fold 3/3 - Validation Accuracy: 0.9684
Classification Report:
[I 2025-08-31 15:48:10,413] Trial 192 finished with value: 0.9631578947368421 and parameters: {'hidden_dim': 1413, 'latent_dim': 23, 'beta': 1.9625440592295302, 'gamma': 1.7785363296559136, 'dropout_rate': 0.1246702772230543, 'lr': 0.0008736267495331883, 'scheduler_patience': 7, 'class_weight': 0.8961811627176254, 'activation': 'ReLU', 'classification_multiplier': 11525.4459551537}. Best is trial 111 with value: 0.9719298245614035.
