[I 2025-08-31 14:39:22,629] Trial 37 finished with value: 0.9403508771929824 and parameters: {'hidden_dim': 137, 'latent_dim': 26, 'beta': 0.9055966446945645, 'gamma': 0.23046178257594863, 'dropout_rate': 0.21068254721763902, 'lr': 0.0010798606708339728, 'scheduler_patience': 7, 'class_weight': 0.5573078956832145, 'activation': 'ReLU', 'classification_multiplier': 8268.856585636848}. Best is trial 30 with value: 0.9666666666666667.
[I 2025-08-31 14:39:43,812] Trial 38 finished with value: 0.9315789473684211 and parameters: {'hidden_dim': 390, 'latent_dim': 34, 'beta': 1.4777458575414442, 'gamma': 0.8865628225826284, 'dropout_rate': 0.1580283074733576, 'lr': 0.0016088797532395154, 'scheduler_patience': 6, 'class_weight': 0.36236105627344817, 'activation': 'SELU', 'classification_multiplier': 6835.422517864357}. Best is trial 30 with value: 0.9666666666666667.
              precision    recall  f1-score   support

Non-Repeater       0.96      0.99      0.97       158
    Repeater       0.93      0.78      0.85        32

    accuracy                           0.95       190
   macro avg       0.94      0.88      0.91       190
weighted avg       0.95      0.95      0.95       190

Trial 32 - Average Validation Accuracy: 0.9544
Fold 1/3 - Validation Accuracy: 0.9316
Classification Report:
              precision    recall  f1-score   support

Non-Repeater       0.92      1.00      0.96       159
    Repeater       1.00      0.58      0.73        31

    accuracy                           0.93       190
   macro avg       0.96      0.79      0.85       190
weighted avg       0.94      0.93      0.92       190

Fold 2/3 - Validation Accuracy: 0.9368
Classification Report:
              precision    recall  f1-score   support

Non-Repeater       0.93      0.99      0.96       159
    Repeater       0.95      0.65      0.77        31

    accuracy                           0.94       190
   macro avg       0.94      0.82      0.87       190
weighted avg       0.94      0.94      0.93       190

Fold 3/3 - Validation Accuracy: 0.9368
Classification Report:
              precision    recall  f1-score   support

Non-Repeater       0.93      1.00      0.96       158
    Repeater       1.00      0.62      0.77        32

    accuracy                           0.94       190
   macro avg       0.96      0.81      0.87       190
weighted avg       0.94      0.94      0.93       190

Trial 33 - Average Validation Accuracy: 0.9351
Fold 1/3 - Validation Accuracy: 0.9526
Classification Report:
              precision    recall  f1-score   support

Non-Repeater       0.95      1.00      0.97       159
    Repeater       1.00      0.71      0.83        31

    accuracy                           0.95       190
   macro avg       0.97      0.85      0.90       190
weighted avg       0.96      0.95      0.95       190

Fold 2/3 - Validation Accuracy: 0.9737
Classification Report:
              precision    recall  f1-score   support

Non-Repeater       0.98      0.99      0.98       159
    Repeater       0.96      0.87      0.92        31

    accuracy                           0.97       190
   macro avg       0.97      0.93      0.95       190
weighted avg       0.97      0.97      0.97       190

Fold 3/3 - Validation Accuracy: 0.9632
Classification Report:
              precision    recall  f1-score   support

Non-Repeater       0.97      0.99      0.98       158
    Repeater       0.93      0.84      0.89        32

    accuracy                           0.96       190
   macro avg       0.95      0.92      0.93       190
weighted avg       0.96      0.96      0.96       190

Trial 34 - Average Validation Accuracy: 0.9632
Fold 1/3 - Validation Accuracy: 0.9579
Classification Report:
              precision    recall  f1-score   support

Non-Repeater       0.97      0.98      0.97       159
    Repeater       0.90      0.84      0.87        31

    accuracy                           0.96       190
   macro avg       0.93      0.91      0.92       190
weighted avg       0.96      0.96      0.96       190

Fold 2/3 - Validation Accuracy: 0.9579
Classification Report:
              precision    recall  f1-score   support

Non-Repeater       0.96      0.99      0.98       159
    Repeater       0.96      0.77      0.86        31

    accuracy                           0.96       190
   macro avg       0.96      0.88      0.92       190
weighted avg       0.96      0.96      0.96       190

Fold 3/3 - Validation Accuracy: 0.9368
Classification Report:
              precision    recall  f1-score   support

Non-Repeater       0.96      0.97      0.96       158
    Repeater       0.83      0.78      0.81        32

    accuracy                           0.94       190
   macro avg       0.89      0.87      0.88       190
weighted avg       0.94      0.94      0.94       190

Trial 35 - Average Validation Accuracy: 0.9509
Fold 1/3 - Validation Accuracy: 0.9316
Classification Report:
              precision    recall  f1-score   support

Non-Repeater       0.95      0.97      0.96       159
    Repeater       0.85      0.71      0.77        31

    accuracy                           0.93       190
   macro avg       0.90      0.84      0.87       190
weighted avg       0.93      0.93      0.93       190

Fold 2/3 - Validation Accuracy: 0.9211
Classification Report:
              precision    recall  f1-score   support

Non-Repeater       0.93      0.98      0.95       159
    Repeater       0.86      0.61      0.72        31

    accuracy                           0.92       190
   macro avg       0.90      0.80      0.84       190
weighted avg       0.92      0.92      0.92       190

Fold 3/3 - Validation Accuracy: 0.9474
Classification Report:
              precision    recall  f1-score   support

Non-Repeater       0.96      0.97      0.97       158
    Repeater       0.87      0.81      0.84        32

    accuracy                           0.95       190
   macro avg       0.91      0.89      0.90       190
weighted avg       0.95      0.95      0.95       190

Trial 36 - Average Validation Accuracy: 0.9333
Fold 1/3 - Validation Accuracy: 0.9421
Classification Report:
              precision    recall  f1-score   support

Non-Repeater       0.95      0.99      0.97       159
    Repeater       0.92      0.71      0.80        31

    accuracy                           0.94       190
   macro avg       0.93      0.85      0.88       190
weighted avg       0.94      0.94      0.94       190

Fold 2/3 - Validation Accuracy: 0.9368
Classification Report:
              precision    recall  f1-score   support

Non-Repeater       0.94      0.99      0.96       159
    Repeater       0.91      0.68      0.78        31

    accuracy                           0.94       190
   macro avg       0.93      0.83      0.87       190
weighted avg       0.94      0.94      0.93       190

Fold 3/3 - Validation Accuracy: 0.9421
Classification Report:
              precision    recall  f1-score   support

Non-Repeater       0.95      0.98      0.97       158
    Repeater       0.89      0.75      0.81        32

    accuracy                           0.94       190
   macro avg       0.92      0.87      0.89       190
weighted avg       0.94      0.94      0.94       190

Trial 37 - Average Validation Accuracy: 0.9404
Fold 1/3 - Validation Accuracy: 0.9474
Classification Report:
              precision    recall  f1-score   support

Non-Repeater       0.95      0.99      0.97       159
    Repeater       0.96      0.71      0.81        31

    accuracy                           0.95       190
   macro avg       0.95      0.85      0.89       190
weighted avg       0.95      0.95      0.94       190

Fold 2/3 - Validation Accuracy: 0.9263
Classification Report:
              precision    recall  f1-score   support

Non-Repeater       0.93      0.99      0.96       159
    Repeater       0.90      0.61      0.73        31

    accuracy                           0.93       190
   macro avg       0.92      0.80      0.84       190
weighted avg       0.93      0.93      0.92       190

Fold 3/3 - Validation Accuracy: 0.9211
Classification Report:
              precision    recall  f1-score   support

Non-Repeater       0.92      0.99      0.95       158
    Repeater       0.95      0.56      0.71        32

    accuracy                           0.92       190
   macro avg       0.93      0.78      0.83       190
weighted avg       0.92      0.92      0.91       190

Trial 38 - Average Validation Accuracy: 0.9316
Fold 1/3 - Validation Accuracy: 0.9474
Classification Report:
              precision    recall  f1-score   support

Non-Repeater       0.96      0.98      0.97       159
    Repeater       0.89      0.77      0.83        31

    accuracy                           0.95       190
   macro avg       0.92      0.88      0.90       190
weighted avg       0.95      0.95      0.95       190

Fold 2/3 - Validation Accuracy: 0.9579
Classification Report:
[I 2025-08-31 14:40:08,077] Trial 39 finished with value: 0.956140350877193 and parameters: {'hidden_dim': 1274, 'latent_dim': 28, 'beta': 1.5587039390928088, 'gamma': 0.6660672426855058, 'dropout_rate': 0.3142882253662572, 'lr': 0.0007848118956160284, 'scheduler_patience': 7, 'class_weight': 0.7400799778234142, 'activation': 'ReLU', 'classification_multiplier': 10539.702516411464}. Best is trial 30 with value: 0.9666666666666667.
[I 2025-08-31 14:40:30,128] Trial 40 finished with value: 0.9473684210526315 and parameters: {'hidden_dim': 910, 'latent_dim': 20, 'beta': 1.4285571188101058, 'gamma': 0.9631985216816188, 'dropout_rate': 0.19976123366780885, 'lr': 0.002840105674384505, 'scheduler_patience': 7, 'class_weight': 0.8421863678438128, 'activation': 'GELU', 'classification_multiplier': 9386.763880508972}. Best is trial 30 with value: 0.9666666666666667.
[I 2025-08-31 14:40:53,319] Trial 41 finished with value: 0.9614035087719298 and parameters: {'hidden_dim': 1081, 'latent_dim': 32, 'beta': 1.6354324720464342, 'gamma': 0.7925068290085686, 'dropout_rate': 0.19234090818098648, 'lr': 0.0018701256560557608, 'scheduler_patience': 7, 'class_weight': 0.638697486180017, 'activation': 'ReLU', 'classification_multiplier': 8153.171273986038}. Best is trial 30 with value: 0.9666666666666667.
[I 2025-08-31 14:41:17,108] Trial 42 finished with value: 0.9596491228070175 and parameters: {'hidden_dim': 1216, 'latent_dim': 35, 'beta': 1.7558049537193139, 'gamma': 0.7416346012240864, 'dropout_rate': 0.18171357651090123, 'lr': 0.001740555228612642, 'scheduler_patience': 7, 'class_weight': 0.6671547547471774, 'activation': 'ReLU', 'classification_multiplier': 8281.488202575261}. Best is trial 30 with value: 0.9666666666666667.
[I 2025-08-31 14:41:40,181] Trial 43 finished with value: 0.956140350877193 and parameters: {'hidden_dim': 1058, 'latent_dim': 35, 'beta': 1.9127033426471574, 'gamma': 0.7548208513506788, 'dropout_rate': 0.1464540246499164, 'lr': 0.001739457206795931, 'scheduler_patience': 7, 'class_weight': 0.6329999606736839, 'activation': 'ReLU', 'classification_multiplier': 8012.4521667212875}. Best is trial 30 with value: 0.9666666666666667.
[I 2025-08-31 14:42:04,132] Trial 44 finished with value: 0.968421052631579 and parameters: {'hidden_dim': 1232, 'latent_dim': 38, 'beta': 1.7655946657429795, 'gamma': 1.2367852519613258, 'dropout_rate': 0.12254917066047574, 'lr': 0.0009433618182533212, 'scheduler_patience': 7, 'class_weight': 0.48027441192239473, 'activation': 'ReLU', 'classification_multiplier': 8899.204126875804}. Best is trial 44 with value: 0.968421052631579.
[I 2025-08-31 14:42:31,005] Trial 45 finished with value: 0.9596491228070175 and parameters: {'hidden_dim': 1441, 'latent_dim': 37, 'beta': 1.5933602343169602, 'gamma': 1.168010259606957, 'dropout_rate': 0.10897652351428817, 'lr': 0.000909550759347551, 'scheduler_patience': 7, 'class_weight': 0.46588636619405527, 'activation': 'ReLU', 'classification_multiplier': 8789.032708012868}. Best is trial 44 with value: 0.968421052631579.
              precision    recall  f1-score   support

Non-Repeater       0.96      0.99      0.98       159
    Repeater       0.96      0.77      0.86        31

    accuracy                           0.96       190
   macro avg       0.96      0.88      0.92       190
weighted avg       0.96      0.96      0.96       190

Fold 3/3 - Validation Accuracy: 0.9632
Classification Report:
              precision    recall  f1-score   support

Non-Repeater       0.97      0.98      0.98       158
    Repeater       0.90      0.88      0.89        32

    accuracy                           0.96       190
   macro avg       0.94      0.93      0.93       190
weighted avg       0.96      0.96      0.96       190

Trial 39 - Average Validation Accuracy: 0.9561
Fold 1/3 - Validation Accuracy: 0.9474
Classification Report:
              precision    recall  f1-score   support

Non-Repeater       0.95      0.99      0.97       159
    Repeater       0.92      0.74      0.82        31

    accuracy                           0.95       190
   macro avg       0.94      0.86      0.90       190
weighted avg       0.95      0.95      0.95       190

Fold 2/3 - Validation Accuracy: 0.9421
Classification Report:
              precision    recall  f1-score   support

Non-Repeater       0.95      0.99      0.97       159
    Repeater       0.92      0.71      0.80        31

    accuracy                           0.94       190
   macro avg       0.93      0.85      0.88       190
weighted avg       0.94      0.94      0.94       190

Fold 3/3 - Validation Accuracy: 0.9526
Classification Report:
              precision    recall  f1-score   support

Non-Repeater       0.96      0.98      0.97       158
    Repeater       0.90      0.81      0.85        32

    accuracy                           0.95       190
   macro avg       0.93      0.90      0.91       190
weighted avg       0.95      0.95      0.95       190

Trial 40 - Average Validation Accuracy: 0.9474
Fold 1/3 - Validation Accuracy: 0.9579
Classification Report:
              precision    recall  f1-score   support

Non-Repeater       0.95      1.00      0.98       159
    Repeater       1.00      0.74      0.85        31

    accuracy                           0.96       190
   macro avg       0.98      0.87      0.91       190
weighted avg       0.96      0.96      0.96       190

Fold 2/3 - Validation Accuracy: 0.9789
Classification Report:
              precision    recall  f1-score   support

Non-Repeater       0.98      0.99      0.99       159
    Repeater       0.97      0.90      0.93        31

    accuracy                           0.98       190
   macro avg       0.97      0.95      0.96       190
weighted avg       0.98      0.98      0.98       190

Fold 3/3 - Validation Accuracy: 0.9474
Classification Report:
              precision    recall  f1-score   support

Non-Repeater       0.95      0.99      0.97       158
    Repeater       0.92      0.75      0.83        32

    accuracy                           0.95       190
   macro avg       0.94      0.87      0.90       190
weighted avg       0.95      0.95      0.95       190

Trial 41 - Average Validation Accuracy: 0.9614
Fold 1/3 - Validation Accuracy: 0.9632
Classification Report:
              precision    recall  f1-score   support

Non-Repeater       0.96      1.00      0.98       159
    Repeater       1.00      0.77      0.87        31

    accuracy                           0.96       190
   macro avg       0.98      0.89      0.93       190
weighted avg       0.96      0.96      0.96       190

Fold 2/3 - Validation Accuracy: 0.9579
Classification Report:
              precision    recall  f1-score   support

Non-Repeater       0.96      0.99      0.98       159
    Repeater       0.96      0.77      0.86        31

    accuracy                           0.96       190
   macro avg       0.96      0.88      0.92       190
weighted avg       0.96      0.96      0.96       190

Fold 3/3 - Validation Accuracy: 0.9579
Classification Report:
              precision    recall  f1-score   support

Non-Repeater       0.96      0.99      0.98       158
    Repeater       0.96      0.78      0.86        32

    accuracy                           0.96       190
   macro avg       0.96      0.89      0.92       190
weighted avg       0.96      0.96      0.96       190

Trial 42 - Average Validation Accuracy: 0.9596
Fold 1/3 - Validation Accuracy: 0.9526
Classification Report:
              precision    recall  f1-score   support

Non-Repeater       0.95      0.99      0.97       159
    Repeater       0.96      0.74      0.84        31

    accuracy                           0.95       190
   macro avg       0.96      0.87      0.90       190
weighted avg       0.95      0.95      0.95       190

Fold 2/3 - Validation Accuracy: 0.9684
Classification Report:
              precision    recall  f1-score   support

Non-Repeater       0.97      0.99      0.98       159
    Repeater       0.96      0.84      0.90        31

    accuracy                           0.97       190
   macro avg       0.97      0.92      0.94       190
weighted avg       0.97      0.97      0.97       190

Fold 3/3 - Validation Accuracy: 0.9474
Classification Report:
              precision    recall  f1-score   support

Non-Repeater       0.96      0.97      0.97       158
    Repeater       0.87      0.81      0.84        32

    accuracy                           0.95       190
   macro avg       0.91      0.89      0.90       190
weighted avg       0.95      0.95      0.95       190

Trial 43 - Average Validation Accuracy: 0.9561
Fold 1/3 - Validation Accuracy: 0.9737
Classification Report:
              precision    recall  f1-score   support

Non-Repeater       0.97      1.00      0.98       159
    Repeater       1.00      0.84      0.91        31

    accuracy                           0.97       190
   macro avg       0.98      0.92      0.95       190
weighted avg       0.97      0.97      0.97       190

Fold 2/3 - Validation Accuracy: 0.9684
Classification Report:
              precision    recall  f1-score   support

Non-Repeater       0.97      0.99      0.98       159
    Repeater       0.96      0.84      0.90        31

    accuracy                           0.97       190
   macro avg       0.97      0.92      0.94       190
weighted avg       0.97      0.97      0.97       190

Fold 3/3 - Validation Accuracy: 0.9632
Classification Report:
              precision    recall  f1-score   support

Non-Repeater       0.96      1.00      0.98       158
    Repeater       1.00      0.78      0.88        32

    accuracy                           0.96       190
   macro avg       0.98      0.89      0.93       190
weighted avg       0.96      0.96      0.96       190

Trial 44 - Average Validation Accuracy: 0.9684
Fold 1/3 - Validation Accuracy: 0.9632
Classification Report:
              precision    recall  f1-score   support

Non-Repeater       0.96      1.00      0.98       159
    Repeater       1.00      0.77      0.87        31

    accuracy                           0.96       190
   macro avg       0.98      0.89      0.93       190
weighted avg       0.96      0.96      0.96       190

Fold 2/3 - Validation Accuracy: 0.9684
Classification Report:
              precision    recall  f1-score   support

Non-Repeater       0.97      0.99      0.98       159
    Repeater       0.96      0.84      0.90        31

    accuracy                           0.97       190
   macro avg       0.97      0.92      0.94       190
weighted avg       0.97      0.97      0.97       190

Fold 3/3 - Validation Accuracy: 0.9474
Classification Report:
              precision    recall  f1-score   support

Non-Repeater       0.95      0.99      0.97       158
    Repeater       0.96      0.72      0.82        32

    accuracy                           0.95       190
   macro avg       0.95      0.86      0.90       190
weighted avg       0.95      0.95      0.94       190

Trial 45 - Average Validation Accuracy: 0.9596
Fold 1/3 - Validation Accuracy: 0.9421
Classification Report:
[I 2025-08-31 14:42:55,341] Trial 46 finished with value: 0.9403508771929824 and parameters: {'hidden_dim': 1219, 'latent_dim': 40, 'beta': 1.3360429367412519, 'gamma': 1.5446993222387346, 'dropout_rate': 0.1719588224700814, 'lr': 0.00014090751384706018, 'scheduler_patience': 7, 'class_weight': 0.5084444853187662, 'activation': 'ELU', 'classification_multiplier': 9224.504461296505}. Best is trial 44 with value: 0.968421052631579.
[I 2025-08-31 14:43:23,474] Trial 47 finished with value: 0.9456140350877194 and parameters: {'hidden_dim': 1387, 'latent_dim': 33, 'beta': 1.4828778734926358, 'gamma': 1.3737298067514685, 'dropout_rate': 0.13043480647492006, 'lr': 0.0008899335132646599, 'scheduler_patience': 7, 'class_weight': 0.246644914578186, 'activation': 'ReLU', 'classification_multiplier': 6818.9413491456635}. Best is trial 44 with value: 0.968421052631579.
[I 2025-08-31 14:43:52,639] Trial 48 finished with value: 0.9210526315789473 and parameters: {'hidden_dim': 1809, 'latent_dim': 38, 'beta': 1.767372889331047, 'gamma': 1.1541679867418893, 'dropout_rate': 0.1236979378951332, 'lr': 0.0013424550965689752, 'scheduler_patience': 3, 'class_weight': 0.39540230803727294, 'activation': 'SELU', 'classification_multiplier': 8217.287486555084}. Best is trial 44 with value: 0.968421052631579.
[I 2025-08-31 14:44:16,012] Trial 49 finished with value: 0.9473684210526315 and parameters: {'hidden_dim': 1095, 'latent_dim': 35, 'beta': 1.895702704400514, 'gamma': 1.6574200138225164, 'dropout_rate': 0.1888147200314547, 'lr': 0.0007015029690900947, 'scheduler_patience': 7, 'class_weight': 0.46185931471243746, 'activation': 'ReLU', 'classification_multiplier': 10516.394544589173}. Best is trial 44 with value: 0.968421052631579.
