[I 2025-08-31 15:14:59,753] Trial 115 finished with value: 0.9456140350877194 and parameters: {'hidden_dim': 1475, 'latent_dim': 17, 'beta': 1.914687998678186, 'gamma': 1.3180879272868653, 'dropout_rate': 0.10657550690827844, 'lr': 0.0009971599630073014, 'scheduler_patience': 7, 'class_weight': 0.9624702870526097, 'activation': 'GELU', 'classification_multiplier': 12767.403824459905}. Best is trial 111 with value: 0.9719298245614035.
[I 2025-08-31 15:15:24,467] Trial 116 finished with value: 0.9508771929824561 and parameters: {'hidden_dim': 1293, 'latent_dim': 17, 'beta': 1.8064118400270377, 'gamma': 1.456070578240083, 'dropout_rate': 0.42529896377387755, 'lr': 0.0012243799444086676, 'scheduler_patience': 7, 'class_weight': 0.9975320248486582, 'activation': 'ReLU', 'classification_multiplier': 12595.28862805845}. Best is trial 111 with value: 0.9719298245614035.
[I 2025-08-31 15:15:49,751] Trial 117 finished with value: 0.9578947368421052 and parameters: {'hidden_dim': 1403, 'latent_dim': 19, 'beta': 1.7566366396248145, 'gamma': 1.5580049199821737, 'dropout_rate': 0.11413449777723575, 'lr': 0.0005823666617620522, 'scheduler_patience': 7, 'class_weight': 0.8958563519582353, 'activation': 'ReLU', 'classification_multiplier': 13103.87405128875}. Best is trial 111 with value: 0.9719298245614035.
[I 2025-08-31 15:16:13,832] Trial 118 finished with value: 0.956140350877193 and parameters: {'hidden_dim': 1254, 'latent_dim': 15, 'beta': 1.8487306497496774, 'gamma': 1.644937007300035, 'dropout_rate': 0.12208616629532808, 'lr': 0.0019918165568458372, 'scheduler_patience': 2, 'class_weight': 0.8726039898207827, 'activation': 'ReLU', 'classification_multiplier': 12254.61843961254}. Best is trial 111 with value: 0.9719298245614035.
              precision    recall  f1-score   support

Non-Repeater       0.98      0.98      0.98       158
    Repeater       0.91      0.91      0.91        32

    accuracy                           0.97       190
   macro avg       0.94      0.94      0.94       190
weighted avg       0.97      0.97      0.97       190

Trial 112 - Average Validation Accuracy: 0.9667
Fold 1/3 - Validation Accuracy: 0.9632
Classification Report:
              precision    recall  f1-score   support

Non-Repeater       0.97      0.98      0.98       159
    Repeater       0.90      0.87      0.89        31

    accuracy                           0.96       190
   macro avg       0.94      0.93      0.93       190
weighted avg       0.96      0.96      0.96       190

Fold 2/3 - Validation Accuracy: 0.9789
Classification Report:
              precision    recall  f1-score   support

Non-Repeater       0.98      0.99      0.99       159
    Repeater       0.97      0.90      0.93        31

    accuracy                           0.98       190
   macro avg       0.97      0.95      0.96       190
weighted avg       0.98      0.98      0.98       190

Fold 3/3 - Validation Accuracy: 0.9632
Classification Report:
              precision    recall  f1-score   support

Non-Repeater       0.97      0.99      0.98       158
    Repeater       0.93      0.84      0.89        32

    accuracy                           0.96       190
   macro avg       0.95      0.92      0.93       190
weighted avg       0.96      0.96      0.96       190

Trial 113 - Average Validation Accuracy: 0.9684
Fold 1/3 - Validation Accuracy: 0.9632
Classification Report:
              precision    recall  f1-score   support

Non-Repeater       0.97      0.98      0.98       159
    Repeater       0.90      0.87      0.89        31

    accuracy                           0.96       190
   macro avg       0.94      0.93      0.93       190
weighted avg       0.96      0.96      0.96       190

Fold 2/3 - Validation Accuracy: 0.9842
Classification Report:
              precision    recall  f1-score   support

Non-Repeater       0.99      0.99      0.99       159
    Repeater       0.97      0.94      0.95        31

    accuracy                           0.98       190
   macro avg       0.98      0.96      0.97       190
weighted avg       0.98      0.98      0.98       190

Fold 3/3 - Validation Accuracy: 0.9684
Classification Report:
              precision    recall  f1-score   support

Non-Repeater       0.97      0.99      0.98       158
    Repeater       0.93      0.88      0.90        32

    accuracy                           0.97       190
   macro avg       0.95      0.93      0.94       190
weighted avg       0.97      0.97      0.97       190

Trial 114 - Average Validation Accuracy: 0.9719
Fold 1/3 - Validation Accuracy: 0.9368
Classification Report:
              precision    recall  f1-score   support

Non-Repeater       0.96      0.97      0.96       159
    Repeater       0.83      0.77      0.80        31

    accuracy                           0.94       190
   macro avg       0.89      0.87      0.88       190
weighted avg       0.94      0.94      0.94       190

Fold 2/3 - Validation Accuracy: 0.9474
Classification Report:
              precision    recall  f1-score   support

Non-Repeater       0.95      0.99      0.97       159
    Repeater       0.92      0.74      0.82        31

    accuracy                           0.95       190
   macro avg       0.94      0.86      0.90       190
weighted avg       0.95      0.95      0.95       190

Fold 3/3 - Validation Accuracy: 0.9526
Classification Report:
              precision    recall  f1-score   support

Non-Repeater       0.96      0.98      0.97       158
    Repeater       0.90      0.81      0.85        32

    accuracy                           0.95       190
   macro avg       0.93      0.90      0.91       190
weighted avg       0.95      0.95      0.95       190

Trial 115 - Average Validation Accuracy: 0.9456
Fold 1/3 - Validation Accuracy: 0.9526
Classification Report:
              precision    recall  f1-score   support

Non-Repeater       0.96      0.99      0.97       159
    Repeater       0.92      0.77      0.84        31

    accuracy                           0.95       190
   macro avg       0.94      0.88      0.91       190
weighted avg       0.95      0.95      0.95       190

Fold 2/3 - Validation Accuracy: 0.9526
Classification Report:
              precision    recall  f1-score   support

Non-Repeater       0.96      0.99      0.97       159
    Repeater       0.92      0.77      0.84        31

    accuracy                           0.95       190
   macro avg       0.94      0.88      0.91       190
weighted avg       0.95      0.95      0.95       190

Fold 3/3 - Validation Accuracy: 0.9474
Classification Report:
              precision    recall  f1-score   support

Non-Repeater       0.96      0.98      0.97       158
    Repeater       0.89      0.78      0.83        32

    accuracy                           0.95       190
   macro avg       0.92      0.88      0.90       190
weighted avg       0.95      0.95      0.95       190

Trial 116 - Average Validation Accuracy: 0.9509
Fold 1/3 - Validation Accuracy: 0.9474
Classification Report:
              precision    recall  f1-score   support

Non-Repeater       0.96      0.97      0.97       159
    Repeater       0.86      0.81      0.83        31

    accuracy                           0.95       190
   macro avg       0.91      0.89      0.90       190
weighted avg       0.95      0.95      0.95       190

Fold 2/3 - Validation Accuracy: 0.9737
Classification Report:
              precision    recall  f1-score   support

Non-Repeater       0.98      0.99      0.98       159
    Repeater       0.96      0.87      0.92        31

    accuracy                           0.97       190
   macro avg       0.97      0.93      0.95       190
weighted avg       0.97      0.97      0.97       190

Fold 3/3 - Validation Accuracy: 0.9526
Classification Report:
              precision    recall  f1-score   support

Non-Repeater       0.97      0.97      0.97       158
    Repeater       0.85      0.88      0.86        32

    accuracy                           0.95       190
   macro avg       0.91      0.92      0.92       190
weighted avg       0.95      0.95      0.95       190

Trial 117 - Average Validation Accuracy: 0.9579
Fold 1/3 - Validation Accuracy: 0.9421
Classification Report:
              precision    recall  f1-score   support

Non-Repeater       0.96      0.97      0.97       159
    Repeater       0.86      0.77      0.81        31

    accuracy                           0.94       190
   macro avg       0.91      0.87      0.89       190
weighted avg       0.94      0.94      0.94       190

Fold 2/3 - Validation Accuracy: 0.9684
Classification Report:
              precision    recall  f1-score   support

Non-Repeater       0.97      0.99      0.98       159
    Repeater       0.96      0.84      0.90        31

    accuracy                           0.97       190
   macro avg       0.97      0.92      0.94       190
weighted avg       0.97      0.97      0.97       190

Fold 3/3 - Validation Accuracy: 0.9579
Classification Report:
              precision    recall  f1-score   support

Non-Repeater       0.97      0.97      0.97       158
    Repeater       0.88      0.88      0.88        32

    accuracy                           0.96       190
   macro avg       0.92      0.92      0.92       190
weighted avg       0.96      0.96      0.96       190

Trial 118 - Average Validation Accuracy: 0.9561
Fold 1/3 - Validation Accuracy: 0.9421
Classification Report:
              precision    recall  f1-score   support

Non-Repeater       0.97      0.96      0.97       159
    Repeater       0.81      0.84      0.83        31

    accuracy                           0.94       190
   macro avg       0.89      0.90      0.90       190
weighted avg       0.94      0.94      0.94       190

Fold 2/3 - Validation Accuracy: 0.9684
Classification Report:
[I 2025-08-31 15:16:38,631] Trial 119 finished with value: 0.9578947368421052 and parameters: {'hidden_dim': 1334, 'latent_dim': 12, 'beta': 1.9368207001308135, 'gamma': 1.3934142559073865, 'dropout_rate': 0.13000132719788823, 'lr': 0.0004788689957565324, 'scheduler_patience': 6, 'class_weight': 0.9821702083016619, 'activation': 'ReLU', 'classification_multiplier': 13701.695954782845}. Best is trial 111 with value: 0.9719298245614035.
[I 2025-08-31 15:17:05,458] Trial 120 finished with value: 0.912280701754386 and parameters: {'hidden_dim': 1616, 'latent_dim': 17, 'beta': 1.9051031208356735, 'gamma': 1.3181215259052808, 'dropout_rate': 0.14358453016024125, 'lr': 0.00979392924663474, 'scheduler_patience': 7, 'class_weight': 0.9150957094419313, 'activation': 'ReLU', 'classification_multiplier': 11345.406428861015}. Best is trial 111 with value: 0.9719298245614035.
[I 2025-08-31 15:17:30,293] Trial 121 finished with value: 0.9578947368421052 and parameters: {'hidden_dim': 1353, 'latent_dim': 23, 'beta': 1.9573420279993998, 'gamma': 1.51216791363596, 'dropout_rate': 0.12126803171918056, 'lr': 0.0008159390003622637, 'scheduler_patience': 7, 'class_weight': 0.9543951520318674, 'activation': 'ReLU', 'classification_multiplier': 12171.284746397378}. Best is trial 111 with value: 0.9719298245614035.
[I 2025-08-31 15:17:56,216] Trial 122 finished with value: 0.968421052631579 and parameters: {'hidden_dim': 1459, 'latent_dim': 25, 'beta': 1.8706243507686653, 'gamma': 1.2169109341460351, 'dropout_rate': 0.10912689292810024, 'lr': 0.0007582778487367278, 'scheduler_patience': 7, 'class_weight': 0.9338784526513859, 'activation': 'ReLU', 'classification_multiplier': 13315.797504825096}. Best is trial 111 with value: 0.9719298245614035.
[I 2025-08-31 15:18:22,782] Trial 123 finished with value: 0.9631578947368421 and parameters: {'hidden_dim': 1549, 'latent_dim': 21, 'beta': 1.9992650422736098, 'gamma': 1.5240096399059093, 'dropout_rate': 0.1253008309643568, 'lr': 0.0014663097923579092, 'scheduler_patience': 7, 'class_weight': 0.9698071633123438, 'activation': 'ReLU', 'classification_multiplier': 12637.928028852302}. Best is trial 111 with value: 0.9719298245614035.
[I 2025-08-31 15:18:46,550] Trial 124 finished with value: 0.9614035087719298 and parameters: {'hidden_dim': 1202, 'latent_dim': 19, 'beta': 1.992233535762161, 'gamma': 1.782018387663045, 'dropout_rate': 0.10051619851635234, 'lr': 0.0010411359702888708, 'scheduler_patience': 7, 'class_weight': 0.944722996619891, 'activation': 'ReLU', 'classification_multiplier': 11888.674999338833}. Best is trial 111 with value: 0.9719298245614035.
[I 2025-08-31 15:19:10,053] Trial 125 finished with value: 0.9701754385964912 and parameters: {'hidden_dim': 1127, 'latent_dim': 22, 'beta': 0.4887998140924553, 'gamma': 1.4021163964751562, 'dropout_rate': 0.13574481407403588, 'lr': 0.00035540887024695114, 'scheduler_patience': 7, 'class_weight': 0.9992706915323472, 'activation': 'ReLU', 'classification_multiplier': 12377.294459217916}. Best is trial 111 with value: 0.9719298245614035.
              precision    recall  f1-score   support

Non-Repeater       0.97      0.99      0.98       159
    Repeater       0.96      0.84      0.90        31

    accuracy                           0.97       190
   macro avg       0.97      0.92      0.94       190
weighted avg       0.97      0.97      0.97       190

Fold 3/3 - Validation Accuracy: 0.9632
Classification Report:
              precision    recall  f1-score   support

Non-Repeater       0.99      0.97      0.98       158
    Repeater       0.86      0.94      0.90        32

    accuracy                           0.96       190
   macro avg       0.92      0.95      0.94       190
weighted avg       0.97      0.96      0.96       190

Trial 119 - Average Validation Accuracy: 0.9579
Fold 1/3 - Validation Accuracy: 0.9105
Classification Report:
              precision    recall  f1-score   support

Non-Repeater       0.93      0.97      0.95       159
    Repeater       0.79      0.61      0.69        31

    accuracy                           0.91       190
   macro avg       0.86      0.79      0.82       190
weighted avg       0.91      0.91      0.91       190

Fold 2/3 - Validation Accuracy: 0.9053
Classification Report:
              precision    recall  f1-score   support

Non-Repeater       0.93      0.96      0.94       159
    Repeater       0.74      0.65      0.69        31

    accuracy                           0.91       190
   macro avg       0.84      0.80      0.82       190
weighted avg       0.90      0.91      0.90       190

Fold 3/3 - Validation Accuracy: 0.9211
Classification Report:
              precision    recall  f1-score   support

Non-Repeater       0.93      0.97      0.95       158
    Repeater       0.84      0.66      0.74        32

    accuracy                           0.92       190
   macro avg       0.89      0.82      0.85       190
weighted avg       0.92      0.92      0.92       190

Trial 120 - Average Validation Accuracy: 0.9123
Fold 1/3 - Validation Accuracy: 0.9421
Classification Report:
              precision    recall  f1-score   support

Non-Repeater       0.96      0.97      0.97       159
    Repeater       0.86      0.77      0.81        31

    accuracy                           0.94       190
   macro avg       0.91      0.87      0.89       190
weighted avg       0.94      0.94      0.94       190

Fold 2/3 - Validation Accuracy: 0.9632
Classification Report:
              precision    recall  f1-score   support

Non-Repeater       0.96      0.99      0.98       159
    Repeater       0.96      0.81      0.88        31

    accuracy                           0.96       190
   macro avg       0.96      0.90      0.93       190
weighted avg       0.96      0.96      0.96       190

Fold 3/3 - Validation Accuracy: 0.9684
Classification Report:
              precision    recall  f1-score   support

Non-Repeater       0.98      0.98      0.98       158
    Repeater       0.91      0.91      0.91        32

    accuracy                           0.97       190
   macro avg       0.94      0.94      0.94       190
weighted avg       0.97      0.97      0.97       190

Trial 121 - Average Validation Accuracy: 0.9579
Fold 1/3 - Validation Accuracy: 0.9579
Classification Report:
              precision    recall  f1-score   support

Non-Repeater       0.97      0.98      0.97       159
    Repeater       0.90      0.84      0.87        31

    accuracy                           0.96       190
   macro avg       0.93      0.91      0.92       190
weighted avg       0.96      0.96      0.96       190

Fold 2/3 - Validation Accuracy: 0.9789
Classification Report:
              precision    recall  f1-score   support

Non-Repeater       0.98      0.99      0.99       159
    Repeater       0.97      0.90      0.93        31

    accuracy                           0.98       190
   macro avg       0.97      0.95      0.96       190
weighted avg       0.98      0.98      0.98       190

Fold 3/3 - Validation Accuracy: 0.9684
Classification Report:
              precision    recall  f1-score   support

Non-Repeater       0.96      1.00      0.98       158
    Repeater       1.00      0.81      0.90        32

    accuracy                           0.97       190
   macro avg       0.98      0.91      0.94       190
weighted avg       0.97      0.97      0.97       190

Trial 122 - Average Validation Accuracy: 0.9684
Fold 1/3 - Validation Accuracy: 0.9526
Classification Report:
              precision    recall  f1-score   support

Non-Repeater       0.96      0.99      0.97       159
    Repeater       0.92      0.77      0.84        31

    accuracy                           0.95       190
   macro avg       0.94      0.88      0.91       190
weighted avg       0.95      0.95      0.95       190

Fold 2/3 - Validation Accuracy: 0.9737
Classification Report:
              precision    recall  f1-score   support

Non-Repeater       0.98      0.99      0.98       159
    Repeater       0.93      0.90      0.92        31

    accuracy                           0.97       190
   macro avg       0.96      0.95      0.95       190
weighted avg       0.97      0.97      0.97       190

Fold 3/3 - Validation Accuracy: 0.9632
Classification Report:
              precision    recall  f1-score   support

Non-Repeater       0.97      0.98      0.98       158
    Repeater       0.90      0.88      0.89        32

    accuracy                           0.96       190
   macro avg       0.94      0.93      0.93       190
weighted avg       0.96      0.96      0.96       190

Trial 123 - Average Validation Accuracy: 0.9632
Fold 1/3 - Validation Accuracy: 0.9474
Classification Report:
              precision    recall  f1-score   support

Non-Repeater       0.96      0.98      0.97       159
    Repeater       0.89      0.77      0.83        31

    accuracy                           0.95       190
   macro avg       0.92      0.88      0.90       190
weighted avg       0.95      0.95      0.95       190

Fold 2/3 - Validation Accuracy: 0.9789
Classification Report:
              precision    recall  f1-score   support

Non-Repeater       0.98      0.99      0.99       159
    Repeater       0.97      0.90      0.93        31

    accuracy                           0.98       190
   macro avg       0.97      0.95      0.96       190
weighted avg       0.98      0.98      0.98       190

Fold 3/3 - Validation Accuracy: 0.9579
Classification Report:
              precision    recall  f1-score   support

Non-Repeater       0.96      0.99      0.97       158
    Repeater       0.93      0.81      0.87        32

    accuracy                           0.96       190
   macro avg       0.95      0.90      0.92       190
weighted avg       0.96      0.96      0.96       190

Trial 124 - Average Validation Accuracy: 0.9614
Fold 1/3 - Validation Accuracy: 0.9579
Classification Report:
              precision    recall  f1-score   support

Non-Repeater       0.98      0.97      0.97       159
    Repeater       0.85      0.90      0.88        31

    accuracy                           0.96       190
   macro avg       0.91      0.94      0.92       190
weighted avg       0.96      0.96      0.96       190

Fold 2/3 - Validation Accuracy: 0.9842
Classification Report:
              precision    recall  f1-score   support

Non-Repeater       0.99      0.99      0.99       159
    Repeater       0.97      0.94      0.95        31

    accuracy                           0.98       190
   macro avg       0.98      0.96      0.97       190
weighted avg       0.98      0.98      0.98       190

Fold 3/3 - Validation Accuracy: 0.9684
Classification Report:
              precision    recall  f1-score   support

Non-Repeater       0.99      0.97      0.98       158
    Repeater       0.88      0.94      0.91        32

    accuracy                           0.97       190
   macro avg       0.93      0.96      0.94       190
weighted avg       0.97      0.97      0.97       190

Trial 125 - Average Validation Accuracy: 0.9702
Fold 1/3 - Validation Accuracy: 0.9421
Classification Report:
[I 2025-08-31 15:19:33,420] Trial 126 finished with value: 0.9614035087719298 and parameters: {'hidden_dim': 1106, 'latent_dim': 20, 'beta': 0.4807527544674736, 'gamma': 1.4038306489432841, 'dropout_rate': 0.13913041045173366, 'lr': 0.0001394628147376509, 'scheduler_patience': 7, 'class_weight': 0.9824380172588291, 'activation': 'ReLU', 'classification_multiplier': 12513.928928174493}. Best is trial 111 with value: 0.9719298245614035.
[I 2025-08-31 15:19:56,963] Trial 127 finished with value: 0.9385964912280702 and parameters: {'hidden_dim': 1134, 'latent_dim': 39, 'beta': 0.7687251815727463, 'gamma': 1.167849420500205, 'dropout_rate': 0.163591113769004, 'lr': 0.0003608018498919986, 'scheduler_patience': 7, 'class_weight': 0.9978357102120194, 'activation': 'ELU', 'classification_multiplier': 11562.502528323683}. Best is trial 111 with value: 0.9719298245614035.
