[I 2025-08-31 15:20:24,590] Trial 128 finished with value: 0.9596491228070175 and parameters: {'hidden_dim': 1668, 'latent_dim': 16, 'beta': 0.9646450730294166, 'gamma': 1.7091826484504427, 'dropout_rate': 0.1506872219328062, 'lr': 0.00046817792265497007, 'scheduler_patience': 5, 'class_weight': 0.9590846975319686, 'activation': 'ReLU', 'classification_multiplier': 12961.850599221936}. Best is trial 111 with value: 0.9719298245614035.
[I 2025-08-31 15:20:54,819] Trial 129 finished with value: 0.956140350877193 and parameters: {'hidden_dim': 1977, 'latent_dim': 24, 'beta': 0.41485903462225726, 'gamma': 1.283240579598869, 'dropout_rate': 0.1354362654371709, 'lr': 0.0005860327356921412, 'scheduler_patience': 7, 'class_weight': 0.9162173761707866, 'activation': 'ReLU', 'classification_multiplier': 11044.886585196828}. Best is trial 111 with value: 0.9719298245614035.
[I 2025-08-31 15:21:19,206] Trial 130 finished with value: 0.943859649122807 and parameters: {'hidden_dim': 1239, 'latent_dim': 37, 'beta': 1.8346921335858248, 'gamma': 1.460267657546794, 'dropout_rate': 0.10906008493924811, 'lr': 0.0001022859518076489, 'scheduler_patience': 7, 'class_weight': 0.9735999206918214, 'activation': 'SELU', 'classification_multiplier': 12034.967329184594}. Best is trial 111 with value: 0.9719298245614035.
[I 2025-08-31 15:21:43,942] Trial 131 finished with value: 0.9614035087719298 and parameters: {'hidden_dim': 1319, 'latent_dim': 22, 'beta': 1.9392437548624009, 'gamma': 1.3360996386597523, 'dropout_rate': 0.12682909155611033, 'lr': 0.000728788161414805, 'scheduler_patience': 7, 'class_weight': 0.9328839778812522, 'activation': 'ReLU', 'classification_multiplier': 12324.19734879406}. Best is trial 111 with value: 0.9719298245614035.
              precision    recall  f1-score   support

Non-Repeater       0.97      0.96      0.97       159
    Repeater       0.81      0.84      0.83        31

    accuracy                           0.94       190
   macro avg       0.89      0.90      0.90       190
weighted avg       0.94      0.94      0.94       190

Fold 2/3 - Validation Accuracy: 0.9789
Classification Report:
              precision    recall  f1-score   support

Non-Repeater       0.98      0.99      0.99       159
    Repeater       0.97      0.90      0.93        31

    accuracy                           0.98       190
   macro avg       0.97      0.95      0.96       190
weighted avg       0.98      0.98      0.98       190

Fold 3/3 - Validation Accuracy: 0.9632
Classification Report:
              precision    recall  f1-score   support

Non-Repeater       0.97      0.99      0.98       158
    Repeater       0.93      0.84      0.89        32

    accuracy                           0.96       190
   macro avg       0.95      0.92      0.93       190
weighted avg       0.96      0.96      0.96       190

Trial 126 - Average Validation Accuracy: 0.9614
Fold 1/3 - Validation Accuracy: 0.9263
Classification Report:
              precision    recall  f1-score   support

Non-Repeater       0.95      0.96      0.96       159
    Repeater       0.79      0.74      0.77        31

    accuracy                           0.93       190
   macro avg       0.87      0.85      0.86       190
weighted avg       0.92      0.93      0.93       190

Fold 2/3 - Validation Accuracy: 0.9474
Classification Report:
              precision    recall  f1-score   support

Non-Repeater       0.95      0.99      0.97       159
    Repeater       0.92      0.74      0.82        31

    accuracy                           0.95       190
   macro avg       0.94      0.86      0.90       190
weighted avg       0.95      0.95      0.95       190

Fold 3/3 - Validation Accuracy: 0.9421
Classification Report:
              precision    recall  f1-score   support

Non-Repeater       0.97      0.96      0.96       158
    Repeater       0.80      0.88      0.84        32

    accuracy                           0.94       190
   macro avg       0.89      0.92      0.90       190
weighted avg       0.94      0.94      0.94       190

Trial 127 - Average Validation Accuracy: 0.9386
Fold 1/3 - Validation Accuracy: 0.9526
Classification Report:
              precision    recall  f1-score   support

Non-Repeater       0.97      0.97      0.97       159
    Repeater       0.87      0.84      0.85        31

    accuracy                           0.95       190
   macro avg       0.92      0.91      0.91       190
weighted avg       0.95      0.95      0.95       190

Fold 2/3 - Validation Accuracy: 0.9632
Classification Report:
              precision    recall  f1-score   support

Non-Repeater       0.97      0.99      0.98       159
    Repeater       0.93      0.84      0.88        31

    accuracy                           0.96       190
   macro avg       0.95      0.91      0.93       190
weighted avg       0.96      0.96      0.96       190

Fold 3/3 - Validation Accuracy: 0.9632
Classification Report:
              precision    recall  f1-score   support

Non-Repeater       0.97      0.99      0.98       158
    Repeater       0.93      0.84      0.89        32

    accuracy                           0.96       190
   macro avg       0.95      0.92      0.93       190
weighted avg       0.96      0.96      0.96       190

Trial 128 - Average Validation Accuracy: 0.9596
Fold 1/3 - Validation Accuracy: 0.9474
Classification Report:
              precision    recall  f1-score   support

Non-Repeater       0.96      0.97      0.97       159
    Repeater       0.86      0.81      0.83        31

    accuracy                           0.95       190
   macro avg       0.91      0.89      0.90       190
weighted avg       0.95      0.95      0.95       190

Fold 2/3 - Validation Accuracy: 0.9684
Classification Report:
              precision    recall  f1-score   support

Non-Repeater       0.97      0.99      0.98       159
    Repeater       0.96      0.84      0.90        31

    accuracy                           0.97       190
   macro avg       0.97      0.92      0.94       190
weighted avg       0.97      0.97      0.97       190

Fold 3/3 - Validation Accuracy: 0.9526
Classification Report:
              precision    recall  f1-score   support

Non-Repeater       0.97      0.97      0.97       158
    Repeater       0.87      0.84      0.86        32

    accuracy                           0.95       190
   macro avg       0.92      0.91      0.91       190
weighted avg       0.95      0.95      0.95       190

Trial 129 - Average Validation Accuracy: 0.9561
Fold 1/3 - Validation Accuracy: 0.9316
Classification Report:
              precision    recall  f1-score   support

Non-Repeater       0.95      0.97      0.96       159
    Repeater       0.82      0.74      0.78        31

    accuracy                           0.93       190
   macro avg       0.89      0.86      0.87       190
weighted avg       0.93      0.93      0.93       190

Fold 2/3 - Validation Accuracy: 0.9421
Classification Report:
              precision    recall  f1-score   support

Non-Repeater       0.95      0.99      0.97       159
    Repeater       0.92      0.71      0.80        31

    accuracy                           0.94       190
   macro avg       0.93      0.85      0.88       190
weighted avg       0.94      0.94      0.94       190

Fold 3/3 - Validation Accuracy: 0.9579
Classification Report:
              precision    recall  f1-score   support

Non-Repeater       0.98      0.97      0.97       158
    Repeater       0.85      0.91      0.88        32

    accuracy                           0.96       190
   macro avg       0.92      0.94      0.93       190
weighted avg       0.96      0.96      0.96       190

Trial 130 - Average Validation Accuracy: 0.9439
Fold 1/3 - Validation Accuracy: 0.9579
Classification Report:
              precision    recall  f1-score   support

Non-Repeater       0.96      0.99      0.98       159
    Repeater       0.93      0.81      0.86        31

    accuracy                           0.96       190
   macro avg       0.94      0.90      0.92       190
weighted avg       0.96      0.96      0.96       190

Fold 2/3 - Validation Accuracy: 0.9632
Classification Report:
              precision    recall  f1-score   support

Non-Repeater       0.97      0.99      0.98       159
    Repeater       0.93      0.84      0.88        31

    accuracy                           0.96       190
   macro avg       0.95      0.91      0.93       190
weighted avg       0.96      0.96      0.96       190

Fold 3/3 - Validation Accuracy: 0.9632
Classification Report:
              precision    recall  f1-score   support

Non-Repeater       0.99      0.97      0.98       158
    Repeater       0.86      0.94      0.90        32

    accuracy                           0.96       190
   macro avg       0.92      0.95      0.94       190
weighted avg       0.97      0.96      0.96       190

Trial 131 - Average Validation Accuracy: 0.9614
Fold 1/3 - Validation Accuracy: 0.9579
Classification Report:
              precision    recall  f1-score   support

Non-Repeater       0.97      0.98      0.97       159
    Repeater       0.90      0.84      0.87        31

    accuracy                           0.96       190
   macro avg       0.93      0.91      0.92       190
weighted avg       0.96      0.96      0.96       190

Fold 2/3 - Validation Accuracy: 0.9684
Classification Report:
              precision    recall  f1-score   support

Non-Repeater       0.98      0.99      0.98       159
    Repeater       0.93      0.87      0.90        31

    accuracy                           0.97       190
   macro avg       0.95      0.93      0.94       190
weighted avg       0.97      0.97      0.97       190

Fold 3/3 - Validation Accuracy: 0.9526
Classification Report:
[I 2025-08-31 15:22:12,140] Trial 132 finished with value: 0.9596491228070175 and parameters: {'hidden_dim': 1761, 'latent_dim': 23, 'beta': 1.999496522434721, 'gamma': 1.5920928611402514, 'dropout_rate': 0.1344183726253958, 'lr': 0.000941017985773373, 'scheduler_patience': 7, 'class_weight': 0.9475155265308373, 'activation': 'ReLU', 'classification_multiplier': 12341.84948779184}. Best is trial 111 with value: 0.9719298245614035.
[I 2025-08-31 15:22:35,694] Trial 133 finished with value: 0.9350877192982456 and parameters: {'hidden_dim': 1176, 'latent_dim': 22, 'beta': 0.21246174640049265, 'gamma': 1.4964854424593237, 'dropout_rate': 0.11939275657341361, 'lr': 0.00028331899786628, 'scheduler_patience': 7, 'class_weight': 0.09016411056033963, 'activation': 'ReLU', 'classification_multiplier': 12133.894880242704}. Best is trial 111 with value: 0.9719298245614035.
[I 2025-08-31 15:23:01,881] Trial 134 finished with value: 0.9614035087719298 and parameters: {'hidden_dim': 1487, 'latent_dim': 21, 'beta': 1.8953801384256634, 'gamma': 1.7501018984015033, 'dropout_rate': 0.15436111493779514, 'lr': 0.001204375761026373, 'scheduler_patience': 7, 'class_weight': 0.8962131932701316, 'activation': 'ReLU', 'classification_multiplier': 11817.02527310241}. Best is trial 111 with value: 0.9719298245614035.
[I 2025-08-31 15:23:28,946] Trial 135 finished with value: 0.968421052631579 and parameters: {'hidden_dim': 1628, 'latent_dim': 24, 'beta': 0.8366798118597014, 'gamma': 1.671825845383164, 'dropout_rate': 0.11356548167092291, 'lr': 0.0007075303227396753, 'scheduler_patience': 7, 'class_weight': 0.9861922544483929, 'activation': 'ReLU', 'classification_multiplier': 12747.299521738189}. Best is trial 111 with value: 0.9719298245614035.
[I 2025-08-31 15:23:56,629] Trial 136 finished with value: 0.9614035087719298 and parameters: {'hidden_dim': 1699, 'latent_dim': 19, 'beta': 1.7958114286427647, 'gamma': 1.4265494015178508, 'dropout_rate': 0.14386572072053644, 'lr': 0.000495211468034184, 'scheduler_patience': 7, 'class_weight': 0.9986825402475529, 'activation': 'ReLU', 'classification_multiplier': 12008.753632224145}. Best is trial 111 with value: 0.9719298245614035.
[I 2025-08-31 15:24:22,045] Trial 137 finished with value: 0.9614035087719298 and parameters: {'hidden_dim': 1423, 'latent_dim': 18, 'beta': 1.9516231839206024, 'gamma': 1.8786187088917496, 'dropout_rate': 0.12759259396657366, 'lr': 0.0003459812690473047, 'scheduler_patience': 7, 'class_weight': 0.963305236250981, 'activation': 'LeakyReLU', 'classification_multiplier': 12490.905701653295}. Best is trial 111 with value: 0.9719298245614035.
[I 2025-08-31 15:24:50,893] Trial 138 finished with value: 0.9649122807017544 and parameters: {'hidden_dim': 1850, 'latent_dim': 27, 'beta': 1.9001241554637542, 'gamma': 1.810712989075026, 'dropout_rate': 0.11889913706921351, 'lr': 0.0008884091415648432, 'scheduler_patience': 7, 'class_weight': 0.9253534104675779, 'activation': 'ReLU', 'classification_multiplier': 11549.940433604601}. Best is trial 111 with value: 0.9719298245614035.
              precision    recall  f1-score   support

Non-Repeater       0.96      0.99      0.97       158
    Repeater       0.93      0.78      0.85        32

    accuracy                           0.95       190
   macro avg       0.94      0.88      0.91       190
weighted avg       0.95      0.95      0.95       190

Trial 132 - Average Validation Accuracy: 0.9596
Fold 1/3 - Validation Accuracy: 0.9263
Classification Report:
              precision    recall  f1-score   support

Non-Repeater       0.92      1.00      0.96       159
    Repeater       1.00      0.55      0.71        31

    accuracy                           0.93       190
   macro avg       0.96      0.77      0.83       190
weighted avg       0.93      0.93      0.92       190

Fold 2/3 - Validation Accuracy: 0.9316
Classification Report:
              precision    recall  f1-score   support

Non-Repeater       0.93      0.99      0.96       159
    Repeater       0.95      0.61      0.75        31

    accuracy                           0.93       190
   macro avg       0.94      0.80      0.85       190
weighted avg       0.93      0.93      0.93       190

Fold 3/3 - Validation Accuracy: 0.9474
Classification Report:
              precision    recall  f1-score   support

Non-Repeater       0.94      1.00      0.97       158
    Repeater       1.00      0.69      0.81        32

    accuracy                           0.95       190
   macro avg       0.97      0.84      0.89       190
weighted avg       0.95      0.95      0.94       190

Trial 133 - Average Validation Accuracy: 0.9351
Fold 1/3 - Validation Accuracy: 0.9579
Classification Report:
              precision    recall  f1-score   support

Non-Repeater       0.96      0.99      0.98       159
    Repeater       0.96      0.77      0.86        31

    accuracy                           0.96       190
   macro avg       0.96      0.88      0.92       190
weighted avg       0.96      0.96      0.96       190

Fold 2/3 - Validation Accuracy: 0.9632
Classification Report:
              precision    recall  f1-score   support

Non-Repeater       0.97      0.99      0.98       159
    Repeater       0.93      0.84      0.88        31

    accuracy                           0.96       190
   macro avg       0.95      0.91      0.93       190
weighted avg       0.96      0.96      0.96       190

Fold 3/3 - Validation Accuracy: 0.9632
Classification Report:
              precision    recall  f1-score   support

Non-Repeater       0.97      0.98      0.98       158
    Repeater       0.90      0.88      0.89        32

    accuracy                           0.96       190
   macro avg       0.94      0.93      0.93       190
weighted avg       0.96      0.96      0.96       190

Trial 134 - Average Validation Accuracy: 0.9614
Fold 1/3 - Validation Accuracy: 0.9684
Classification Report:
              precision    recall  f1-score   support

Non-Repeater       0.98      0.98      0.98       159
    Repeater       0.90      0.90      0.90        31

    accuracy                           0.97       190
   macro avg       0.94      0.94      0.94       190
weighted avg       0.97      0.97      0.97       190

Fold 2/3 - Validation Accuracy: 0.9737
Classification Report:
              precision    recall  f1-score   support

Non-Repeater       0.98      0.99      0.98       159
    Repeater       0.96      0.87      0.92        31

    accuracy                           0.97       190
   macro avg       0.97      0.93      0.95       190
weighted avg       0.97      0.97      0.97       190

Fold 3/3 - Validation Accuracy: 0.9632
Classification Report:
              precision    recall  f1-score   support

Non-Repeater       0.97      0.99      0.98       158
    Repeater       0.93      0.84      0.89        32

    accuracy                           0.96       190
   macro avg       0.95      0.92      0.93       190
weighted avg       0.96      0.96      0.96       190

Trial 135 - Average Validation Accuracy: 0.9684
Fold 1/3 - Validation Accuracy: 0.9368
Classification Report:
              precision    recall  f1-score   support

Non-Repeater       0.96      0.97      0.96       159
    Repeater       0.83      0.77      0.80        31

    accuracy                           0.94       190
   macro avg       0.89      0.87      0.88       190
weighted avg       0.94      0.94      0.94       190

Fold 2/3 - Validation Accuracy: 0.9789
Classification Report:
              precision    recall  f1-score   support

Non-Repeater       0.98      0.99      0.99       159
    Repeater       0.97      0.90      0.93        31

    accuracy                           0.98       190
   macro avg       0.97      0.95      0.96       190
weighted avg       0.98      0.98      0.98       190

Fold 3/3 - Validation Accuracy: 0.9684
Classification Report:
              precision    recall  f1-score   support

Non-Repeater       0.98      0.98      0.98       158
    Repeater       0.91      0.91      0.91        32

    accuracy                           0.97       190
   macro avg       0.94      0.94      0.94       190
weighted avg       0.97      0.97      0.97       190

Trial 136 - Average Validation Accuracy: 0.9614
Fold 1/3 - Validation Accuracy: 0.9526
Classification Report:
              precision    recall  f1-score   support

Non-Repeater       0.97      0.97      0.97       159
    Repeater       0.87      0.84      0.85        31

    accuracy                           0.95       190
   macro avg       0.92      0.91      0.91       190
weighted avg       0.95      0.95      0.95       190

Fold 2/3 - Validation Accuracy: 0.9684
Classification Report:
              precision    recall  f1-score   support

Non-Repeater       0.97      0.99      0.98       159
    Repeater       0.96      0.84      0.90        31

    accuracy                           0.97       190
   macro avg       0.97      0.92      0.94       190
weighted avg       0.97      0.97      0.97       190

Fold 3/3 - Validation Accuracy: 0.9632
Classification Report:
              precision    recall  f1-score   support

Non-Repeater       0.99      0.97      0.98       158
    Repeater       0.86      0.94      0.90        32

    accuracy                           0.96       190
   macro avg       0.92      0.95      0.94       190
weighted avg       0.97      0.96      0.96       190

Trial 137 - Average Validation Accuracy: 0.9614
Fold 1/3 - Validation Accuracy: 0.9474
Classification Report:
              precision    recall  f1-score   support

Non-Repeater       0.96      0.98      0.97       159
    Repeater       0.89      0.77      0.83        31

    accuracy                           0.95       190
   macro avg       0.92      0.88      0.90       190
weighted avg       0.95      0.95      0.95       190

Fold 2/3 - Validation Accuracy: 0.9789
Classification Report:
              precision    recall  f1-score   support

Non-Repeater       0.98      0.99      0.99       159
    Repeater       0.97      0.90      0.93        31

    accuracy                           0.98       190
   macro avg       0.97      0.95      0.96       190
weighted avg       0.98      0.98      0.98       190

Fold 3/3 - Validation Accuracy: 0.9684
Classification Report:
              precision    recall  f1-score   support

Non-Repeater       0.97      0.99      0.98       158
    Repeater       0.93      0.88      0.90        32

    accuracy                           0.97       190
   macro avg       0.95      0.93      0.94       190
weighted avg       0.97      0.97      0.97       190

Trial 138 - Average Validation Accuracy: 0.9649
Fold 1/3 - Validation Accuracy: 0.9421
Classification Report:
              precision    recall  f1-score   support

Non-Repeater       0.95      0.98      0.97       159
    Repeater       0.88      0.74      0.81        31

    accuracy                           0.94       190
   macro avg       0.92      0.86      0.89       190
weighted avg       0.94      0.94      0.94       190

Fold 2/3 - Validation Accuracy: 0.9579
Classification Report:
[I 2025-08-31 15:25:17,516] Trial 139 finished with value: 0.9473684210526315 and parameters: {'hidden_dim': 1586, 'latent_dim': 39, 'beta': 1.8516879443529057, 'gamma': 1.3651833740524535, 'dropout_rate': 0.16777493155273873, 'lr': 0.00025553479976706255, 'scheduler_patience': 7, 'class_weight': 0.4871642388938856, 'activation': 'GELU', 'classification_multiplier': 10740.048196317937}. Best is trial 111 with value: 0.9719298245614035.
[I 2025-08-31 15:25:42,432] Trial 140 finished with value: 0.9578947368421052 and parameters: {'hidden_dim': 1364, 'latent_dim': 20, 'beta': 1.733801130554906, 'gamma': 1.560216075589121, 'dropout_rate': 0.13507333226970303, 'lr': 0.000635589798376053, 'scheduler_patience': 7, 'class_weight': 0.8842094551460841, 'activation': 'ReLU', 'classification_multiplier': 13178.64774489272}. Best is trial 111 with value: 0.9719298245614035.
