[I 2025-08-31 14:50:57,141] Trial 63 finished with value: 0.9631578947368421 and parameters: {'hidden_dim': 2032, 'latent_dim': 36, 'beta': 1.6737018491237987, 'gamma': 1.0127896701400831, 'dropout_rate': 0.16453648148983369, 'lr': 0.00045385219428798417, 'scheduler_patience': 7, 'class_weight': 0.752856101664456, 'activation': 'ReLU', 'classification_multiplier': 10373.256196097545}. Best is trial 62 with value: 0.9701754385964912.
[I 2025-08-31 14:51:28,740] Trial 64 finished with value: 0.9666666666666667 and parameters: {'hidden_dim': 1851, 'latent_dim': 36, 'beta': 1.6597020851323485, 'gamma': 1.8961842496976369, 'dropout_rate': 0.1693792436930597, 'lr': 0.00010119270494135432, 'scheduler_patience': 6, 'class_weight': 0.802650667444392, 'activation': 'ReLU', 'classification_multiplier': 10471.654878155194}. Best is trial 62 with value: 0.9701754385964912.
[I 2025-08-31 14:51:57,549] Trial 65 finished with value: 0.9596491228070176 and parameters: {'hidden_dim': 1862, 'latent_dim': 39, 'beta': 1.8743672066778316, 'gamma': 1.888052048951722, 'dropout_rate': 0.1664700298384591, 'lr': 0.0002651847403766387, 'scheduler_patience': 6, 'class_weight': 0.8115852145344971, 'activation': 'ReLU', 'classification_multiplier': 11505.865651723463}. Best is trial 62 with value: 0.9701754385964912.
              precision    recall  f1-score   support

Non-Repeater       0.96      0.99      0.97       159
    Repeater       0.92      0.77      0.84        31

    accuracy                           0.95       190
   macro avg       0.94      0.88      0.91       190
weighted avg       0.95      0.95      0.95       190

Fold 3/3 - Validation Accuracy: 0.9526
Classification Report:
              precision    recall  f1-score   support

Non-Repeater       0.96      0.99      0.97       158
    Repeater       0.93      0.78      0.85        32

    accuracy                           0.95       190
   macro avg       0.94      0.88      0.91       190
weighted avg       0.95      0.95      0.95       190

Trial 59 - Average Validation Accuracy: 0.9526
Fold 1/3 - Validation Accuracy: 0.9368
Classification Report:
              precision    recall  f1-score   support

Non-Repeater       0.95      0.97      0.96       159
    Repeater       0.85      0.74      0.79        31

    accuracy                           0.94       190
   macro avg       0.90      0.86      0.88       190
weighted avg       0.93      0.94      0.94       190

Fold 2/3 - Validation Accuracy: 0.9158
Classification Report:
              precision    recall  f1-score   support

Non-Repeater       0.93      0.97      0.95       159
    Repeater       0.80      0.65      0.71        31

    accuracy                           0.92       190
   macro avg       0.87      0.81      0.83       190
weighted avg       0.91      0.92      0.91       190

Fold 3/3 - Validation Accuracy: 0.9421
Classification Report:
              precision    recall  f1-score   support

Non-Repeater       0.97      0.96      0.97       158
    Repeater       0.82      0.84      0.83        32

    accuracy                           0.94       190
   macro avg       0.89      0.90      0.90       190
weighted avg       0.94      0.94      0.94       190

Trial 60 - Average Validation Accuracy: 0.9316
Fold 1/3 - Validation Accuracy: 0.9632
Classification Report:
              precision    recall  f1-score   support

Non-Repeater       0.96      0.99      0.98       159
    Repeater       0.96      0.81      0.88        31

    accuracy                           0.96       190
   macro avg       0.96      0.90      0.93       190
weighted avg       0.96      0.96      0.96       190

Fold 2/3 - Validation Accuracy: 0.9579
Classification Report:
              precision    recall  f1-score   support

Non-Repeater       0.96      0.99      0.98       159
    Repeater       0.96      0.77      0.86        31

    accuracy                           0.96       190
   macro avg       0.96      0.88      0.92       190
weighted avg       0.96      0.96      0.96       190

Fold 3/3 - Validation Accuracy: 0.9526
Classification Report:
              precision    recall  f1-score   support

Non-Repeater       0.96      0.98      0.97       158
    Repeater       0.90      0.81      0.85        32

    accuracy                           0.95       190
   macro avg       0.93      0.90      0.91       190
weighted avg       0.95      0.95      0.95       190

Trial 61 - Average Validation Accuracy: 0.9579
Fold 1/3 - Validation Accuracy: 0.9632
Classification Report:
              precision    recall  f1-score   support

Non-Repeater       0.97      0.99      0.98       159
    Repeater       0.93      0.84      0.88        31

    accuracy                           0.96       190
   macro avg       0.95      0.91      0.93       190
weighted avg       0.96      0.96      0.96       190

Fold 2/3 - Validation Accuracy: 0.9789
Classification Report:
              precision    recall  f1-score   support

Non-Repeater       0.98      0.99      0.99       159
    Repeater       0.97      0.90      0.93        31

    accuracy                           0.98       190
   macro avg       0.97      0.95      0.96       190
weighted avg       0.98      0.98      0.98       190

Fold 3/3 - Validation Accuracy: 0.9684
Classification Report:
              precision    recall  f1-score   support

Non-Repeater       0.97      0.99      0.98       158
    Repeater       0.93      0.88      0.90        32

    accuracy                           0.97       190
   macro avg       0.95      0.93      0.94       190
weighted avg       0.97      0.97      0.97       190

Trial 62 - Average Validation Accuracy: 0.9702
Fold 1/3 - Validation Accuracy: 0.9632
Classification Report:
              precision    recall  f1-score   support

Non-Repeater       0.97      0.98      0.98       159
    Repeater       0.90      0.87      0.89        31

    accuracy                           0.96       190
   macro avg       0.94      0.93      0.93       190
weighted avg       0.96      0.96      0.96       190

Fold 2/3 - Validation Accuracy: 0.9526
Classification Report:
              precision    recall  f1-score   support

Non-Repeater       0.95      0.99      0.97       159
    Repeater       0.96      0.74      0.84        31

    accuracy                           0.95       190
   macro avg       0.96      0.87      0.90       190
weighted avg       0.95      0.95      0.95       190

Fold 3/3 - Validation Accuracy: 0.9737
Classification Report:
              precision    recall  f1-score   support

Non-Repeater       0.98      0.99      0.98       158
    Repeater       0.97      0.88      0.92        32

    accuracy                           0.97       190
   macro avg       0.97      0.93      0.95       190
weighted avg       0.97      0.97      0.97       190

Trial 63 - Average Validation Accuracy: 0.9632
Fold 1/3 - Validation Accuracy: 0.9579
Classification Report:
              precision    recall  f1-score   support

Non-Repeater       0.97      0.98      0.97       159
    Repeater       0.90      0.84      0.87        31

    accuracy                           0.96       190
   macro avg       0.93      0.91      0.92       190
weighted avg       0.96      0.96      0.96       190

Fold 2/3 - Validation Accuracy: 0.9789
Classification Report:
              precision    recall  f1-score   support

Non-Repeater       0.98      0.99      0.99       159
    Repeater       0.97      0.90      0.93        31

    accuracy                           0.98       190
   macro avg       0.97      0.95      0.96       190
weighted avg       0.98      0.98      0.98       190

Fold 3/3 - Validation Accuracy: 0.9632
Classification Report:
              precision    recall  f1-score   support

Non-Repeater       0.97      0.99      0.98       158
    Repeater       0.93      0.84      0.89        32

    accuracy                           0.96       190
   macro avg       0.95      0.92      0.93       190
weighted avg       0.96      0.96      0.96       190

Trial 64 - Average Validation Accuracy: 0.9667
Fold 1/3 - Validation Accuracy: 0.9421
Classification Report:
              precision    recall  f1-score   support

Non-Repeater       0.96      0.97      0.97       159
    Repeater       0.86      0.77      0.81        31

    accuracy                           0.94       190
   macro avg       0.91      0.87      0.89       190
weighted avg       0.94      0.94      0.94       190

Fold 2/3 - Validation Accuracy: 0.9737
Classification Report:
              precision    recall  f1-score   support

Non-Repeater       0.98      0.99      0.98       159
    Repeater       0.96      0.87      0.92        31

    accuracy                           0.97       190
   macro avg       0.97      0.93      0.95       190
weighted avg       0.97      0.97      0.97       190

Fold 3/3 - Validation Accuracy: 0.9632
Classification Report:
              precision    recall  f1-score   support

Non-Repeater       0.97      0.99      0.98       158
    Repeater       0.93      0.84      0.89        32

    accuracy                           0.96       190
   macro avg       0.95      0.92      0.93       190
weighted avg       0.96      0.96      0.96       190

Trial 65 - Average Validation Accuracy: 0.9596
Fold 1/3 - Validation Accuracy: 0.9526
Classification Report:
[I 2025-08-31 14:52:28,192] Trial 66 finished with value: 0.9526315789473684 and parameters: {'hidden_dim': 2035, 'latent_dim': 36, 'beta': 1.7709810394920364, 'gamma': 1.7139205244725115, 'dropout_rate': 0.20449870323335959, 'lr': 0.0007320210576875336, 'scheduler_patience': 6, 'class_weight': 0.7640461577558149, 'activation': 'LeakyReLU', 'classification_multiplier': 10216.825425954743}. Best is trial 62 with value: 0.9701754385964912.
[I 2025-08-31 14:52:57,735] Trial 67 finished with value: 0.9526315789473684 and parameters: {'hidden_dim': 1903, 'latent_dim': 36, 'beta': 1.7030420164394209, 'gamma': 1.9340956692878022, 'dropout_rate': 0.17366580328967024, 'lr': 0.0014364151982669822, 'scheduler_patience': 6, 'class_weight': 0.896701892772517, 'activation': 'GELU', 'classification_multiplier': 10863.394761479927}. Best is trial 62 with value: 0.9701754385964912.
[I 2025-08-31 14:53:25,894] Trial 68 finished with value: 0.9596491228070175 and parameters: {'hidden_dim': 1749, 'latent_dim': 40, 'beta': 1.81022818199053, 'gamma': 1.7727664418960565, 'dropout_rate': 0.23530922000488821, 'lr': 0.0004799262755563656, 'scheduler_patience': 7, 'class_weight': 0.8103419290339257, 'activation': 'ReLU', 'classification_multiplier': 10597.705380738626}. Best is trial 62 with value: 0.9701754385964912.
[I 2025-08-31 14:53:55,949] Trial 69 finished with value: 0.9543859649122807 and parameters: {'hidden_dim': 1988, 'latent_dim': 34, 'beta': 1.525978873730659, 'gamma': 1.6445061455441707, 'dropout_rate': 0.2119511495460802, 'lr': 0.0008872148892250032, 'scheduler_patience': 6, 'class_weight': 0.7446737697773842, 'activation': 'ReLU', 'classification_multiplier': 10040.498244374947}. Best is trial 62 with value: 0.9701754385964912.
[I 2025-08-31 14:54:23,520] Trial 70 finished with value: 0.9666666666666667 and parameters: {'hidden_dim': 1736, 'latent_dim': 38, 'beta': 1.9825932261005412, 'gamma': 1.8138208744246547, 'dropout_rate': 0.15469400287173724, 'lr': 0.00022131823519969612, 'scheduler_patience': 7, 'class_weight': 0.858378528347758, 'activation': 'ReLU', 'classification_multiplier': 11686.967956782615}. Best is trial 62 with value: 0.9701754385964912.
[I 2025-08-31 14:54:50,910] Trial 71 finished with value: 0.968421052631579 and parameters: {'hidden_dim': 1676, 'latent_dim': 38, 'beta': 1.9855042775697433, 'gamma': 1.849007314325378, 'dropout_rate': 0.15578405343380403, 'lr': 0.00011631129033568338, 'scheduler_patience': 7, 'class_weight': 0.9344973435059853, 'activation': 'ReLU', 'classification_multiplier': 11602.174674862224}. Best is trial 62 with value: 0.9701754385964912.
              precision    recall  f1-score   support

Non-Repeater       0.96      0.99      0.97       159
    Repeater       0.92      0.77      0.84        31

    accuracy                           0.95       190
   macro avg       0.94      0.88      0.91       190
weighted avg       0.95      0.95      0.95       190

Fold 2/3 - Validation Accuracy: 0.9474
Classification Report:
              precision    recall  f1-score   support

Non-Repeater       0.95      0.99      0.97       159
    Repeater       0.92      0.74      0.82        31

    accuracy                           0.95       190
   macro avg       0.94      0.86      0.90       190
weighted avg       0.95      0.95      0.95       190

Fold 3/3 - Validation Accuracy: 0.9579
Classification Report:
              precision    recall  f1-score   support

Non-Repeater       0.96      0.99      0.97       158
    Repeater       0.93      0.81      0.87        32

    accuracy                           0.96       190
   macro avg       0.95      0.90      0.92       190
weighted avg       0.96      0.96      0.96       190

Trial 66 - Average Validation Accuracy: 0.9526
Fold 1/3 - Validation Accuracy: 0.9526
Classification Report:
              precision    recall  f1-score   support

Non-Repeater       0.95      0.99      0.97       159
    Repeater       0.96      0.74      0.84        31

    accuracy                           0.95       190
   macro avg       0.96      0.87      0.90       190
weighted avg       0.95      0.95      0.95       190

Fold 2/3 - Validation Accuracy: 0.9579
Classification Report:
              precision    recall  f1-score   support

Non-Repeater       0.96      0.99      0.98       159
    Repeater       0.93      0.81      0.86        31

    accuracy                           0.96       190
   macro avg       0.94      0.90      0.92       190
weighted avg       0.96      0.96      0.96       190

Fold 3/3 - Validation Accuracy: 0.9474
Classification Report:
              precision    recall  f1-score   support

Non-Repeater       0.96      0.97      0.97       158
    Repeater       0.87      0.81      0.84        32

    accuracy                           0.95       190
   macro avg       0.91      0.89      0.90       190
weighted avg       0.95      0.95      0.95       190

Trial 67 - Average Validation Accuracy: 0.9526
Fold 1/3 - Validation Accuracy: 0.9526
Classification Report:
              precision    recall  f1-score   support

Non-Repeater       0.97      0.97      0.97       159
    Repeater       0.87      0.84      0.85        31

    accuracy                           0.95       190
   macro avg       0.92      0.91      0.91       190
weighted avg       0.95      0.95      0.95       190

Fold 2/3 - Validation Accuracy: 0.9684
Classification Report:
              precision    recall  f1-score   support

Non-Repeater       0.97      0.99      0.98       159
    Repeater       0.96      0.84      0.90        31

    accuracy                           0.97       190
   macro avg       0.97      0.92      0.94       190
weighted avg       0.97      0.97      0.97       190

Fold 3/3 - Validation Accuracy: 0.9579
Classification Report:
              precision    recall  f1-score   support

Non-Repeater       0.97      0.98      0.97       158
    Repeater       0.90      0.84      0.87        32

    accuracy                           0.96       190
   macro avg       0.93      0.91      0.92       190
weighted avg       0.96      0.96      0.96       190

Trial 68 - Average Validation Accuracy: 0.9596
Fold 1/3 - Validation Accuracy: 0.9421
Classification Report:
              precision    recall  f1-score   support

Non-Repeater       0.96      0.97      0.97       159
    Repeater       0.86      0.77      0.81        31

    accuracy                           0.94       190
   macro avg       0.91      0.87      0.89       190
weighted avg       0.94      0.94      0.94       190

Fold 2/3 - Validation Accuracy: 0.9684
Classification Report:
              precision    recall  f1-score   support

Non-Repeater       0.97      0.99      0.98       159
    Repeater       0.96      0.84      0.90        31

    accuracy                           0.97       190
   macro avg       0.97      0.92      0.94       190
weighted avg       0.97      0.97      0.97       190

Fold 3/3 - Validation Accuracy: 0.9526
Classification Report:
              precision    recall  f1-score   support

Non-Repeater       0.97      0.97      0.97       158
    Repeater       0.87      0.84      0.86        32

    accuracy                           0.95       190
   macro avg       0.92      0.91      0.91       190
weighted avg       0.95      0.95      0.95       190

Trial 69 - Average Validation Accuracy: 0.9544
Fold 1/3 - Validation Accuracy: 0.9526
Classification Report:
              precision    recall  f1-score   support

Non-Repeater       0.98      0.96      0.97       159
    Repeater       0.82      0.90      0.86        31

    accuracy                           0.95       190
   macro avg       0.90      0.93      0.92       190
weighted avg       0.96      0.95      0.95       190

Fold 2/3 - Validation Accuracy: 0.9789
Classification Report:
              precision    recall  f1-score   support

Non-Repeater       0.98      0.99      0.99       159
    Repeater       0.97      0.90      0.93        31

    accuracy                           0.98       190
   macro avg       0.97      0.95      0.96       190
weighted avg       0.98      0.98      0.98       190

Fold 3/3 - Validation Accuracy: 0.9684
Classification Report:
              precision    recall  f1-score   support

Non-Repeater       0.98      0.98      0.98       158
    Repeater       0.91      0.91      0.91        32

    accuracy                           0.97       190
   macro avg       0.94      0.94      0.94       190
weighted avg       0.97      0.97      0.97       190

Trial 70 - Average Validation Accuracy: 0.9667
Fold 1/3 - Validation Accuracy: 0.9526
Classification Report:
              precision    recall  f1-score   support

Non-Repeater       0.97      0.97      0.97       159
    Repeater       0.84      0.87      0.86        31

    accuracy                           0.95       190
   macro avg       0.91      0.92      0.91       190
weighted avg       0.95      0.95      0.95       190

Fold 2/3 - Validation Accuracy: 0.9789
Classification Report:
              precision    recall  f1-score   support

Non-Repeater       0.98      0.99      0.99       159
    Repeater       0.97      0.90      0.93        31

    accuracy                           0.98       190
   macro avg       0.97      0.95      0.96       190
weighted avg       0.98      0.98      0.98       190

Fold 3/3 - Validation Accuracy: 0.9737
Classification Report:
              precision    recall  f1-score   support

Non-Repeater       0.99      0.98      0.98       158
    Repeater       0.91      0.94      0.92        32

    accuracy                           0.97       190
   macro avg       0.95      0.96      0.95       190
weighted avg       0.97      0.97      0.97       190

Trial 71 - Average Validation Accuracy: 0.9684
Fold 1/3 - Validation Accuracy: 0.9632
Classification Report:
              precision    recall  f1-score   support

Non-Repeater       0.97      0.98      0.98       159
    Repeater       0.90      0.87      0.89        31

    accuracy                           0.96       190
   macro avg       0.94      0.93      0.93       190
weighted avg       0.96      0.96      0.96       190

Fold 2/3 - Validation Accuracy: 0.9842
Classification Report:
              precision    recall  f1-score   support

Non-Repeater       0.99      0.99      0.99       159
    Repeater       0.97      0.94      0.95        31

    accuracy                           0.98       190
   macro avg       0.98      0.96      0.97       190
weighted avg       0.98      0.98      0.98       190

Fold 3/3 - Validation Accuracy: 0.9632
Classification Report:
[I 2025-08-31 14:55:18,411] Trial 72 finished with value: 0.9701754385964912 and parameters: {'hidden_dim': 1720, 'latent_dim': 38, 'beta': 1.9553238143901286, 'gamma': 1.8332179927966523, 'dropout_rate': 0.14921513520314458, 'lr': 0.00021640885190855408, 'scheduler_patience': 7, 'class_weight': 0.9624641932695843, 'activation': 'ReLU', 'classification_multiplier': 11609.575026261844}. Best is trial 62 with value: 0.9701754385964912.
[I 2025-08-31 14:55:45,779] Trial 73 finished with value: 0.9684210526315788 and parameters: {'hidden_dim': 1712, 'latent_dim': 38, 'beta': 1.9651331422278628, 'gamma': 1.8310460730756835, 'dropout_rate': 0.15023642080930566, 'lr': 0.00019050141088454547, 'scheduler_patience': 7, 'class_weight': 0.9361499765181974, 'activation': 'ReLU', 'classification_multiplier': 11895.626587235052}. Best is trial 62 with value: 0.9701754385964912.
[I 2025-08-31 14:56:13,577] Trial 74 finished with value: 0.9701754385964912 and parameters: {'hidden_dim': 1721, 'latent_dim': 38, 'beta': 1.9226351209913097, 'gamma': 1.8400644229266865, 'dropout_rate': 0.150505284786756, 'lr': 0.0001092635896732824, 'scheduler_patience': 7, 'class_weight': 0.9620153434677585, 'activation': 'ReLU', 'classification_multiplier': 11862.350269132838}. Best is trial 62 with value: 0.9701754385964912.
[I 2025-08-31 14:56:41,040] Trial 75 finished with value: 0.9701754385964912 and parameters: {'hidden_dim': 1692, 'latent_dim': 38, 'beta': 1.9451416587858765, 'gamma': 1.8827600758086946, 'dropout_rate': 0.12189920568066374, 'lr': 0.0001380664606968981, 'scheduler_patience': 7, 'class_weight': 0.9566551350747589, 'activation': 'ReLU', 'classification_multiplier': 12766.732982004112}. Best is trial 62 with value: 0.9701754385964912.
