[I 2025-08-31 15:09:02,757] Trial 102 finished with value: 0.9666666666666667 and parameters: {'hidden_dim': 1682, 'latent_dim': 38, 'beta': 1.8455453171589833, 'gamma': 1.785729538116053, 'dropout_rate': 0.1109745712578245, 'lr': 0.00031517863545599175, 'scheduler_patience': 7, 'class_weight': 0.9553257716786999, 'activation': 'ReLU', 'classification_multiplier': 12055.410287909222}. Best is trial 62 with value: 0.9701754385964912.
[I 2025-08-31 15:09:30,709] Trial 103 finished with value: 0.9614035087719298 and parameters: {'hidden_dim': 1729, 'latent_dim': 39, 'beta': 1.945201765257098, 'gamma': 1.847478955934329, 'dropout_rate': 0.15930296692042945, 'lr': 0.0006120001339483305, 'scheduler_patience': 7, 'class_weight': 0.9054189127950601, 'activation': 'ReLU', 'classification_multiplier': 12850.192746545556}. Best is trial 62 with value: 0.9701754385964912.
[I 2025-08-31 15:09:59,583] Trial 104 finished with value: 0.9701754385964912 and parameters: {'hidden_dim': 1856, 'latent_dim': 40, 'beta': 1.798147151624552, 'gamma': 1.496368899664959, 'dropout_rate': 0.13307190036317876, 'lr': 0.00010713923593586827, 'scheduler_patience': 7, 'class_weight': 0.9979604623753836, 'activation': 'ReLU', 'classification_multiplier': 12350.26243289432}. Best is trial 62 with value: 0.9701754385964912.
[I 2025-08-31 15:10:28,468] Trial 105 finished with value: 0.9631578947368421 and parameters: {'hidden_dim': 1835, 'latent_dim': 40, 'beta': 1.7854014057821612, 'gamma': 1.4369371156536663, 'dropout_rate': 0.12816851782112507, 'lr': 0.0009581650652737815, 'scheduler_patience': 7, 'class_weight': 0.9326096500458082, 'activation': 'ReLU', 'classification_multiplier': 11287.202027245477}. Best is trial 62 with value: 0.9701754385964912.
              precision    recall  f1-score   support

Non-Repeater       0.96      0.99      0.98       159
    Repeater       0.96      0.81      0.88        31

    accuracy                           0.96       190
   macro avg       0.96      0.90      0.93       190
weighted avg       0.96      0.96      0.96       190

Fold 3/3 - Validation Accuracy: 0.9579
Classification Report:
              precision    recall  f1-score   support

Non-Repeater       0.97      0.97      0.97       158
    Repeater       0.88      0.88      0.88        32

    accuracy                           0.96       190
   macro avg       0.92      0.92      0.92       190
weighted avg       0.96      0.96      0.96       190

Trial 99 - Average Validation Accuracy: 0.9561
Fold 1/3 - Validation Accuracy: 0.9158
Classification Report:
              precision    recall  f1-score   support

Non-Repeater       0.94      0.96      0.95       159
    Repeater       0.76      0.71      0.73        31

    accuracy                           0.92       190
   macro avg       0.85      0.83      0.84       190
weighted avg       0.91      0.92      0.91       190

Fold 2/3 - Validation Accuracy: 0.9421
Classification Report:
              precision    recall  f1-score   support

Non-Repeater       0.95      0.99      0.97       159
    Repeater       0.92      0.71      0.80        31

    accuracy                           0.94       190
   macro avg       0.93      0.85      0.88       190
weighted avg       0.94      0.94      0.94       190

Fold 3/3 - Validation Accuracy: 0.9421
Classification Report:
              precision    recall  f1-score   support

Non-Repeater       0.97      0.96      0.96       158
    Repeater       0.80      0.88      0.84        32

    accuracy                           0.94       190
   macro avg       0.89      0.92      0.90       190
weighted avg       0.94      0.94      0.94       190

Trial 100 - Average Validation Accuracy: 0.9333
Fold 1/3 - Validation Accuracy: 0.9474
Classification Report:
              precision    recall  f1-score   support

Non-Repeater       0.97      0.97      0.97       159
    Repeater       0.84      0.84      0.84        31

    accuracy                           0.95       190
   macro avg       0.90      0.90      0.90       190
weighted avg       0.95      0.95      0.95       190

Fold 2/3 - Validation Accuracy: 0.9737
Classification Report:
              precision    recall  f1-score   support

Non-Repeater       0.98      0.99      0.98       159
    Repeater       0.93      0.90      0.92        31

    accuracy                           0.97       190
   macro avg       0.96      0.95      0.95       190
weighted avg       0.97      0.97      0.97       190

Fold 3/3 - Validation Accuracy: 0.9579
Classification Report:
              precision    recall  f1-score   support

Non-Repeater       0.97      0.97      0.97       158
    Repeater       0.88      0.88      0.88        32

    accuracy                           0.96       190
   macro avg       0.92      0.92      0.92       190
weighted avg       0.96      0.96      0.96       190

Trial 101 - Average Validation Accuracy: 0.9596
Fold 1/3 - Validation Accuracy: 0.9526
Classification Report:
              precision    recall  f1-score   support

Non-Repeater       0.97      0.97      0.97       159
    Repeater       0.87      0.84      0.85        31

    accuracy                           0.95       190
   macro avg       0.92      0.91      0.91       190
weighted avg       0.95      0.95      0.95       190

Fold 2/3 - Validation Accuracy: 0.9842
Classification Report:
              precision    recall  f1-score   support

Non-Repeater       0.99      0.99      0.99       159
    Repeater       0.97      0.94      0.95        31

    accuracy                           0.98       190
   macro avg       0.98      0.96      0.97       190
weighted avg       0.98      0.98      0.98       190

Fold 3/3 - Validation Accuracy: 0.9632
Classification Report:
              precision    recall  f1-score   support

Non-Repeater       0.98      0.97      0.98       158
    Repeater       0.88      0.91      0.89        32

    accuracy                           0.96       190
   macro avg       0.93      0.94      0.94       190
weighted avg       0.96      0.96      0.96       190

Trial 102 - Average Validation Accuracy: 0.9667
Fold 1/3 - Validation Accuracy: 0.9526
Classification Report:
              precision    recall  f1-score   support

Non-Repeater       0.97      0.97      0.97       159
    Repeater       0.87      0.84      0.85        31

    accuracy                           0.95       190
   macro avg       0.92      0.91      0.91       190
weighted avg       0.95      0.95      0.95       190

Fold 2/3 - Validation Accuracy: 0.9632
Classification Report:
              precision    recall  f1-score   support

Non-Repeater       0.97      0.99      0.98       159
    Repeater       0.93      0.84      0.88        31

    accuracy                           0.96       190
   macro avg       0.95      0.91      0.93       190
weighted avg       0.96      0.96      0.96       190

Fold 3/3 - Validation Accuracy: 0.9684
Classification Report:
              precision    recall  f1-score   support

Non-Repeater       0.97      0.99      0.98       158
    Repeater       0.93      0.88      0.90        32

    accuracy                           0.97       190
   macro avg       0.95      0.93      0.94       190
weighted avg       0.97      0.97      0.97       190

Trial 103 - Average Validation Accuracy: 0.9614
Fold 1/3 - Validation Accuracy: 0.9579
Classification Report:
              precision    recall  f1-score   support

Non-Repeater       0.98      0.97      0.97       159
    Repeater       0.85      0.90      0.88        31

    accuracy                           0.96       190
   macro avg       0.91      0.94      0.92       190
weighted avg       0.96      0.96      0.96       190

Fold 2/3 - Validation Accuracy: 0.9789
Classification Report:
              precision    recall  f1-score   support

Non-Repeater       0.98      0.99      0.99       159
    Repeater       0.97      0.90      0.93        31

    accuracy                           0.98       190
   macro avg       0.97      0.95      0.96       190
weighted avg       0.98      0.98      0.98       190

Fold 3/3 - Validation Accuracy: 0.9737
Classification Report:
              precision    recall  f1-score   support

Non-Repeater       0.99      0.98      0.98       158
    Repeater       0.91      0.94      0.92        32

    accuracy                           0.97       190
   macro avg       0.95      0.96      0.95       190
weighted avg       0.97      0.97      0.97       190

Trial 104 - Average Validation Accuracy: 0.9702
Fold 1/3 - Validation Accuracy: 0.9684
Classification Report:
              precision    recall  f1-score   support

Non-Repeater       0.97      0.99      0.98       159
    Repeater       0.96      0.84      0.90        31

    accuracy                           0.97       190
   macro avg       0.97      0.92      0.94       190
weighted avg       0.97      0.97      0.97       190

Fold 2/3 - Validation Accuracy: 0.9684
Classification Report:
              precision    recall  f1-score   support

Non-Repeater       0.97      0.99      0.98       159
    Repeater       0.96      0.84      0.90        31

    accuracy                           0.97       190
   macro avg       0.97      0.92      0.94       190
weighted avg       0.97      0.97      0.97       190

Fold 3/3 - Validation Accuracy: 0.9526
Classification Report:
              precision    recall  f1-score   support

Non-Repeater       0.96      0.98      0.97       158
    Repeater       0.90      0.81      0.85        32

    accuracy                           0.95       190
   macro avg       0.93      0.90      0.91       190
weighted avg       0.95      0.95      0.95       190

Trial 105 - Average Validation Accuracy: 0.9632
Fold 1/3 - Validation Accuracy: 0.9526
Classification Report:
[I 2025-08-31 15:10:56,935] Trial 106 finished with value: 0.9666666666666667 and parameters: {'hidden_dim': 1798, 'latent_dim': 37, 'beta': 1.736025790240733, 'gamma': 1.4933620346795202, 'dropout_rate': 0.14296252009569518, 'lr': 0.00010761156939852357, 'scheduler_patience': 7, 'class_weight': 0.831798293317435, 'activation': 'ReLU', 'classification_multiplier': 10954.378905371768}. Best is trial 62 with value: 0.9701754385964912.
[I 2025-08-31 15:11:26,025] Trial 107 finished with value: 0.9403508771929824 and parameters: {'hidden_dim': 1876, 'latent_dim': 39, 'beta': 1.913155459101491, 'gamma': 1.946687620364734, 'dropout_rate': 0.13451133703799076, 'lr': 0.0006208606446519642, 'scheduler_patience': 7, 'class_weight': 0.9661079721912067, 'activation': 'SELU', 'classification_multiplier': 12214.579948807652}. Best is trial 62 with value: 0.9701754385964912.
[I 2025-08-31 15:11:54,200] Trial 108 finished with value: 0.9245614035087719 and parameters: {'hidden_dim': 1770, 'latent_dim': 35, 'beta': 1.8166977683016057, 'gamma': 1.7007569426705824, 'dropout_rate': 0.1737310659244189, 'lr': 0.005827240332370013, 'scheduler_patience': 7, 'class_weight': 0.4332450490670451, 'activation': 'ReLU', 'classification_multiplier': 11777.125889567038}. Best is trial 62 with value: 0.9701754385964912.
[I 2025-08-31 15:12:21,720] Trial 109 finished with value: 0.9491228070175438 and parameters: {'hidden_dim': 1651, 'latent_dim': 36, 'beta': 1.9530745438995167, 'gamma': 1.5691482604548646, 'dropout_rate': 0.15697818414477574, 'lr': 0.0049021916766523056, 'scheduler_patience': 7, 'class_weight': 0.9178577698793322, 'activation': 'LeakyReLU', 'classification_multiplier': 13305.106789299089}. Best is trial 62 with value: 0.9701754385964912.
[I 2025-08-31 15:12:51,524] Trial 110 finished with value: 0.9631578947368421 and parameters: {'hidden_dim': 1929, 'latent_dim': 40, 'beta': 0.10067977279974605, 'gamma': 1.8878629150384623, 'dropout_rate': 0.14748175018649726, 'lr': 0.00042320595670384566, 'scheduler_patience': 7, 'class_weight': 0.9471756104015172, 'activation': 'ReLU', 'classification_multiplier': 11602.809971376108}. Best is trial 62 with value: 0.9701754385964912.
[I 2025-08-31 15:13:17,691] Trial 111 finished with value: 0.9719298245614035 and parameters: {'hidden_dim': 1544, 'latent_dim': 16, 'beta': 1.8796283182149567, 'gamma': 1.6177421015528435, 'dropout_rate': 0.1174113700584991, 'lr': 0.00032753668342322824, 'scheduler_patience': 7, 'class_weight': 0.9962116894126274, 'activation': 'ReLU', 'classification_multiplier': 12561.12759062621}. Best is trial 111 with value: 0.9719298245614035.
              precision    recall  f1-score   support

Non-Repeater       0.96      0.98      0.97       159
    Repeater       0.89      0.81      0.85        31

    accuracy                           0.95       190
   macro avg       0.93      0.89      0.91       190
weighted avg       0.95      0.95      0.95       190

Fold 2/3 - Validation Accuracy: 0.9737
Classification Report:
              precision    recall  f1-score   support

Non-Repeater       0.98      0.99      0.98       159
    Repeater       0.96      0.87      0.92        31

    accuracy                           0.97       190
   macro avg       0.97      0.93      0.95       190
weighted avg       0.97      0.97      0.97       190

Fold 3/3 - Validation Accuracy: 0.9737
Classification Report:
              precision    recall  f1-score   support

Non-Repeater       0.98      0.99      0.98       158
    Repeater       0.94      0.91      0.92        32

    accuracy                           0.97       190
   macro avg       0.96      0.95      0.95       190
weighted avg       0.97      0.97      0.97       190

Trial 106 - Average Validation Accuracy: 0.9667
Fold 1/3 - Validation Accuracy: 0.9316
Classification Report:
              precision    recall  f1-score   support

Non-Repeater       0.96      0.96      0.96       159
    Repeater       0.80      0.77      0.79        31

    accuracy                           0.93       190
   macro avg       0.88      0.87      0.87       190
weighted avg       0.93      0.93      0.93       190

Fold 2/3 - Validation Accuracy: 0.9421
Classification Report:
              precision    recall  f1-score   support

Non-Repeater       0.95      0.99      0.97       159
    Repeater       0.92      0.71      0.80        31

    accuracy                           0.94       190
   macro avg       0.93      0.85      0.88       190
weighted avg       0.94      0.94      0.94       190

Fold 3/3 - Validation Accuracy: 0.9474
Classification Report:
              precision    recall  f1-score   support

Non-Repeater       0.97      0.97      0.97       158
    Repeater       0.84      0.84      0.84        32

    accuracy                           0.95       190
   macro avg       0.91      0.91      0.91       190
weighted avg       0.95      0.95      0.95       190

Trial 107 - Average Validation Accuracy: 0.9404
Fold 1/3 - Validation Accuracy: 0.9105
Classification Report:
              precision    recall  f1-score   support

Non-Repeater       0.91      0.99      0.95       159
    Repeater       0.94      0.48      0.64        31

    accuracy                           0.91       190
   macro avg       0.92      0.74      0.79       190
weighted avg       0.91      0.91      0.90       190

Fold 2/3 - Validation Accuracy: 0.9421
Classification Report:
              precision    recall  f1-score   support

Non-Repeater       0.94      0.99      0.97       159
    Repeater       0.95      0.68      0.79        31

    accuracy                           0.94       190
   macro avg       0.95      0.84      0.88       190
weighted avg       0.94      0.94      0.94       190

Fold 3/3 - Validation Accuracy: 0.9211
Classification Report:
              precision    recall  f1-score   support

Non-Repeater       0.92      0.99      0.95       158
    Repeater       0.90      0.59      0.72        32

    accuracy                           0.92       190
   macro avg       0.91      0.79      0.84       190
weighted avg       0.92      0.92      0.91       190

Trial 108 - Average Validation Accuracy: 0.9246
Fold 1/3 - Validation Accuracy: 0.9474
Classification Report:
              precision    recall  f1-score   support

Non-Repeater       0.96      0.98      0.97       159
    Repeater       0.89      0.77      0.83        31

    accuracy                           0.95       190
   macro avg       0.92      0.88      0.90       190
weighted avg       0.95      0.95      0.95       190

Fold 2/3 - Validation Accuracy: 0.9526
Classification Report:
              precision    recall  f1-score   support

Non-Repeater       0.96      0.99      0.97       159
    Repeater       0.92      0.77      0.84        31

    accuracy                           0.95       190
   macro avg       0.94      0.88      0.91       190
weighted avg       0.95      0.95      0.95       190

Fold 3/3 - Validation Accuracy: 0.9474
Classification Report:
              precision    recall  f1-score   support

Non-Repeater       0.96      0.98      0.97       158
    Repeater       0.89      0.78      0.83        32

    accuracy                           0.95       190
   macro avg       0.92      0.88      0.90       190
weighted avg       0.95      0.95      0.95       190

Trial 109 - Average Validation Accuracy: 0.9491
Fold 1/3 - Validation Accuracy: 0.9526
Classification Report:
              precision    recall  f1-score   support

Non-Repeater       0.96      0.99      0.97       159
    Repeater       0.92      0.77      0.84        31

    accuracy                           0.95       190
   macro avg       0.94      0.88      0.91       190
weighted avg       0.95      0.95      0.95       190

Fold 2/3 - Validation Accuracy: 0.9737
Classification Report:
              precision    recall  f1-score   support

Non-Repeater       0.98      0.99      0.98       159
    Repeater       0.96      0.87      0.92        31

    accuracy                           0.97       190
   macro avg       0.97      0.93      0.95       190
weighted avg       0.97      0.97      0.97       190

Fold 3/3 - Validation Accuracy: 0.9632
Classification Report:
              precision    recall  f1-score   support

Non-Repeater       0.98      0.97      0.98       158
    Repeater       0.88      0.91      0.89        32

    accuracy                           0.96       190
   macro avg       0.93      0.94      0.94       190
weighted avg       0.96      0.96      0.96       190

Trial 110 - Average Validation Accuracy: 0.9632
Fold 1/3 - Validation Accuracy: 0.9579
Classification Report:
              precision    recall  f1-score   support

Non-Repeater       0.97      0.98      0.97       159
    Repeater       0.90      0.84      0.87        31

    accuracy                           0.96       190
   macro avg       0.93      0.91      0.92       190
weighted avg       0.96      0.96      0.96       190

Fold 2/3 - Validation Accuracy: 0.9842
Classification Report:
              precision    recall  f1-score   support

Non-Repeater       0.99      0.99      0.99       159
    Repeater       0.97      0.94      0.95        31

    accuracy                           0.98       190
   macro avg       0.98      0.96      0.97       190
weighted avg       0.98      0.98      0.98       190

Fold 3/3 - Validation Accuracy: 0.9737
Classification Report:
              precision    recall  f1-score   support

Non-Repeater       0.98      0.99      0.98       158
    Repeater       0.94      0.91      0.92        32

    accuracy                           0.97       190
   macro avg       0.96      0.95      0.95       190
weighted avg       0.97      0.97      0.97       190

Trial 111 - Average Validation Accuracy: 0.9719
Fold 1/3 - Validation Accuracy: 0.9526
Classification Report:
              precision    recall  f1-score   support

Non-Repeater       0.97      0.97      0.97       159
    Repeater       0.87      0.84      0.85        31

    accuracy                           0.95       190
   macro avg       0.92      0.91      0.91       190
weighted avg       0.95      0.95      0.95       190

Fold 2/3 - Validation Accuracy: 0.9789
Classification Report:
              precision    recall  f1-score   support

Non-Repeater       0.98      0.99      0.99       159
    Repeater       0.97      0.90      0.93        31

    accuracy                           0.98       190
   macro avg       0.97      0.95      0.96       190
weighted avg       0.98      0.98      0.98       190

Fold 3/3 - Validation Accuracy: 0.9684
Classification Report:
[I 2025-08-31 15:13:44,154] Trial 112 finished with value: 0.9666666666666667 and parameters: {'hidden_dim': 1584, 'latent_dim': 15, 'beta': 1.8685920341905908, 'gamma': 1.6482700284428633, 'dropout_rate': 0.1363249901971512, 'lr': 0.0002967834169512739, 'scheduler_patience': 7, 'class_weight': 0.9779272715122411, 'activation': 'ReLU', 'classification_multiplier': 12976.043918847221}. Best is trial 111 with value: 0.9719298245614035.
[I 2025-08-31 15:14:08,921] Trial 113 finished with value: 0.968421052631579 and parameters: {'hidden_dim': 1356, 'latent_dim': 22, 'beta': 1.997693690986185, 'gamma': 1.5098211112583437, 'dropout_rate': 0.12382387849926263, 'lr': 0.0007734715038310785, 'scheduler_patience': 7, 'class_weight': 0.9373520052230391, 'activation': 'ReLU', 'classification_multiplier': 12208.591005014787}. Best is trial 111 with value: 0.9719298245614035.
[I 2025-08-31 15:14:33,991] Trial 114 finished with value: 0.9719298245614034 and parameters: {'hidden_dim': 1361, 'latent_dim': 19, 'beta': 1.994322274779102, 'gamma': 1.308044688455819, 'dropout_rate': 0.10671830913147111, 'lr': 0.0009722856076662568, 'scheduler_patience': 7, 'class_weight': 0.9618993881610282, 'activation': 'ReLU', 'classification_multiplier': 12610.017490658976}. Best is trial 111 with value: 0.9719298245614035.
