[I 2025-08-31 16:17:50,631] Trial 258 finished with value: 0.9631578947368421 and parameters: {'hidden_dim': 1380, 'latent_dim': 17, 'beta': 1.942298680567572, 'gamma': 0.1945247846400009, 'dropout_rate': 0.27577903684031146, 'lr': 0.00043546173000071715, 'scheduler_patience': 7, 'class_weight': 0.9690760546989159, 'activation': 'ReLU', 'classification_multiplier': 12581.083049744035}. Best is trial 255 with value: 0.9736842105263158.
              precision    recall  f1-score   support

Non-Repeater       0.99      0.96      0.97       158
    Repeater       0.83      0.94      0.88        32

    accuracy                           0.96       190
   macro avg       0.91      0.95      0.93       190
weighted avg       0.96      0.96      0.96       190

Trial 252 - Average Validation Accuracy: 0.9632
Fold 1/3 - Validation Accuracy: 0.9526
Classification Report:
              precision    recall  f1-score   support

Non-Repeater       0.97      0.97      0.97       159
    Repeater       0.87      0.84      0.85        31

    accuracy                           0.95       190
   macro avg       0.92      0.91      0.91       190
weighted avg       0.95      0.95      0.95       190

Fold 2/3 - Validation Accuracy: 0.9842
Classification Report:
              precision    recall  f1-score   support

Non-Repeater       0.99      0.99      0.99       159
    Repeater       0.97      0.94      0.95        31

    accuracy                           0.98       190
   macro avg       0.98      0.96      0.97       190
weighted avg       0.98      0.98      0.98       190

Fold 3/3 - Validation Accuracy: 0.9632
Classification Report:
              precision    recall  f1-score   support

Non-Repeater       0.97      0.99      0.98       158
    Repeater       0.93      0.84      0.89        32

    accuracy                           0.96       190
   macro avg       0.95      0.92      0.93       190
weighted avg       0.96      0.96      0.96       190

Trial 253 - Average Validation Accuracy: 0.9667
Fold 1/3 - Validation Accuracy: 0.9579
Classification Report:
              precision    recall  f1-score   support

Non-Repeater       0.98      0.97      0.97       159
    Repeater       0.85      0.90      0.88        31

    accuracy                           0.96       190
   macro avg       0.91      0.94      0.92       190
weighted avg       0.96      0.96      0.96       190

Fold 2/3 - Validation Accuracy: 0.9737
Classification Report:
              precision    recall  f1-score   support

Non-Repeater       0.98      0.99      0.98       159
    Repeater       0.96      0.87      0.92        31

    accuracy                           0.97       190
   macro avg       0.97      0.93      0.95       190
weighted avg       0.97      0.97      0.97       190

Fold 3/3 - Validation Accuracy: 0.9632
Classification Report:
              precision    recall  f1-score   support

Non-Repeater       0.97      0.98      0.98       158
    Repeater       0.90      0.88      0.89        32

    accuracy                           0.96       190
   macro avg       0.94      0.93      0.93       190
weighted avg       0.96      0.96      0.96       190

Trial 254 - Average Validation Accuracy: 0.9649
Fold 1/3 - Validation Accuracy: 0.9632
Classification Report:
              precision    recall  f1-score   support

Non-Repeater       0.97      0.98      0.98       159
    Repeater       0.90      0.87      0.89        31

    accuracy                           0.96       190
   macro avg       0.94      0.93      0.93       190
weighted avg       0.96      0.96      0.96       190

Fold 2/3 - Validation Accuracy: 0.9842
Classification Report:
              precision    recall  f1-score   support

Non-Repeater       0.99      0.99      0.99       159
    Repeater       0.97      0.94      0.95        31

    accuracy                           0.98       190
   macro avg       0.98      0.96      0.97       190
weighted avg       0.98      0.98      0.98       190

Fold 3/3 - Validation Accuracy: 0.9737
Classification Report:
              precision    recall  f1-score   support

Non-Repeater       0.99      0.98      0.98       158
    Repeater       0.91      0.94      0.92        32

    accuracy                           0.97       190
   macro avg       0.95      0.96      0.95       190
weighted avg       0.97      0.97      0.97       190

Trial 255 - Average Validation Accuracy: 0.9737
Fold 1/3 - Validation Accuracy: 0.9368
Classification Report:
              precision    recall  f1-score   support

Non-Repeater       0.96      0.97      0.96       159
    Repeater       0.83      0.77      0.80        31

    accuracy                           0.94       190
   macro avg       0.89      0.87      0.88       190
weighted avg       0.94      0.94      0.94       190

Fold 2/3 - Validation Accuracy: 0.9737
Classification Report:
              precision    recall  f1-score   support

Non-Repeater       0.98      0.99      0.98       159
    Repeater       0.96      0.87      0.92        31

    accuracy                           0.97       190
   macro avg       0.97      0.93      0.95       190
weighted avg       0.97      0.97      0.97       190

Fold 3/3 - Validation Accuracy: 0.9632
Classification Report:
              precision    recall  f1-score   support

Non-Repeater       0.97      0.99      0.98       158
    Repeater       0.93      0.84      0.89        32

    accuracy                           0.96       190
   macro avg       0.95      0.92      0.93       190
weighted avg       0.96      0.96      0.96       190

Trial 256 - Average Validation Accuracy: 0.9579
Fold 1/3 - Validation Accuracy: 0.9421
Classification Report:
              precision    recall  f1-score   support

Non-Repeater       0.96      0.97      0.97       159
    Repeater       0.83      0.81      0.82        31

    accuracy                           0.94       190
   macro avg       0.90      0.89      0.89       190
weighted avg       0.94      0.94      0.94       190

Fold 2/3 - Validation Accuracy: 0.9842
Classification Report:
              precision    recall  f1-score   support

Non-Repeater       0.99      0.99      0.99       159
    Repeater       0.97      0.94      0.95        31

    accuracy                           0.98       190
   macro avg       0.98      0.96      0.97       190
weighted avg       0.98      0.98      0.98       190

Fold 3/3 - Validation Accuracy: 0.9737
Classification Report:
              precision    recall  f1-score   support

Non-Repeater       0.99      0.98      0.98       158
    Repeater       0.91      0.94      0.92        32

    accuracy                           0.97       190
   macro avg       0.95      0.96      0.95       190
weighted avg       0.97      0.97      0.97       190

Trial 257 - Average Validation Accuracy: 0.9667
Fold 1/3 - Validation Accuracy: 0.9421
Classification Report:
              precision    recall  f1-score   support

Non-Repeater       0.97      0.96      0.97       159
    Repeater       0.81      0.84      0.83        31

    accuracy                           0.94       190
   macro avg       0.89      0.90      0.90       190
weighted avg       0.94      0.94      0.94       190

Fold 2/3 - Validation Accuracy: 0.9789
Classification Report:
              precision    recall  f1-score   support

Non-Repeater       0.98      0.99      0.99       159
    Repeater       0.97      0.90      0.93        31

    accuracy                           0.98       190
   macro avg       0.97      0.95      0.96       190
weighted avg       0.98      0.98      0.98       190

Fold 3/3 - Validation Accuracy: 0.9684
Classification Report:
              precision    recall  f1-score   support

Non-Repeater       0.99      0.97      0.98       158
    Repeater       0.88      0.94      0.91        32

    accuracy                           0.97       190
   macro avg       0.93      0.96      0.94       190
weighted avg       0.97      0.97      0.97       190

Trial 258 - Average Validation Accuracy: 0.9632
Fold 1/3 - Validation Accuracy: 0.9474
Classification Report:
              precision    recall  f1-score   support

Non-Repeater       0.97      0.97      0.97       159
    Repeater       0.84      0.84      0.84        31

    accuracy                           0.95       190
   macro avg       0.90      0.90      0.90       190
weighted avg       0.95      0.95      0.95       190

Fold 2/3 - Validation Accuracy: 0.9737
Classification Report:
[I 2025-08-31 16:18:12,452] Trial 259 finished with value: 0.9649122807017544 and parameters: {'hidden_dim': 660, 'latent_dim': 18, 'beta': 1.9979379489126154, 'gamma': 0.12003262150924585, 'dropout_rate': 0.14357433024027835, 'lr': 0.0006901998625961029, 'scheduler_patience': 7, 'class_weight': 0.9827024492900114, 'activation': 'ReLU', 'classification_multiplier': 12322.148429121466}. Best is trial 255 with value: 0.9736842105263158.
[I 2025-08-31 16:18:43,901] Trial 260 finished with value: 0.9666666666666667 and parameters: {'hidden_dim': 1997, 'latent_dim': 35, 'beta': 1.9023721635868465, 'gamma': 0.9242188015880541, 'dropout_rate': 0.13470734428010353, 'lr': 0.00028440329484468975, 'scheduler_patience': 7, 'class_weight': 0.9441437282655466, 'activation': 'ReLU', 'classification_multiplier': 12085.395222772744}. Best is trial 255 with value: 0.9736842105263158.
[I 2025-08-31 16:19:09,913] Trial 261 finished with value: 0.9614035087719298 and parameters: {'hidden_dim': 1431, 'latent_dim': 16, 'beta': 1.951737989829814, 'gamma': 1.383141133866459, 'dropout_rate': 0.11719032270224355, 'lr': 0.0008700131931567363, 'scheduler_patience': 7, 'class_weight': 0.9634491812466125, 'activation': 'ReLU', 'classification_multiplier': 10249.250243205375}. Best is trial 255 with value: 0.9736842105263158.
[I 2025-08-31 16:19:38,490] Trial 262 finished with value: 0.9614035087719298 and parameters: {'hidden_dim': 1504, 'latent_dim': 40, 'beta': 1.8643770620540272, 'gamma': 1.4471637820505248, 'dropout_rate': 0.1229092530863043, 'lr': 0.0005419169933658381, 'scheduler_patience': 5, 'class_weight': 0.9084818639127974, 'activation': 'ReLU', 'classification_multiplier': 12391.15422433139}. Best is trial 255 with value: 0.9736842105263158.
[I 2025-08-31 16:20:08,359] Trial 263 finished with value: 0.9140350877192983 and parameters: {'hidden_dim': 1470, 'latent_dim': 19, 'beta': 1.9180354310865033, 'gamma': 1.6019088027168902, 'dropout_rate': 0.14042299014200094, 'lr': 0.009357472347603207, 'scheduler_patience': 7, 'class_weight': 0.9997045097443896, 'activation': 'ReLU', 'classification_multiplier': 12026.745247802723}. Best is trial 255 with value: 0.9736842105263158.
[I 2025-08-31 16:20:40,298] Trial 264 finished with value: 0.968421052631579 and parameters: {'hidden_dim': 1676, 'latent_dim': 17, 'beta': 1.9984732216977026, 'gamma': 1.532344643054221, 'dropout_rate': 0.11129707915676354, 'lr': 0.0002614818951398827, 'scheduler_patience': 7, 'class_weight': 0.9274679569519172, 'activation': 'ReLU', 'classification_multiplier': 11428.90824681788}. Best is trial 255 with value: 0.9736842105263158.
[I 2025-08-31 16:21:10,123] Trial 265 finished with value: 0.9649122807017544 and parameters: {'hidden_dim': 1760, 'latent_dim': 39, 'beta': 1.9608147172566026, 'gamma': 1.9940234858212864, 'dropout_rate': 0.12895284453336095, 'lr': 0.00042635072499466015, 'scheduler_patience': 7, 'class_weight': 0.9659119056455773, 'activation': 'ReLU', 'classification_multiplier': 13067.260674982805}. Best is trial 255 with value: 0.9736842105263158.
              precision    recall  f1-score   support

Non-Repeater       0.98      0.99      0.98       159
    Repeater       0.96      0.87      0.92        31

    accuracy                           0.97       190
   macro avg       0.97      0.93      0.95       190
weighted avg       0.97      0.97      0.97       190

Fold 3/3 - Validation Accuracy: 0.9737
Classification Report:
              precision    recall  f1-score   support

Non-Repeater       0.99      0.98      0.98       158
    Repeater       0.91      0.94      0.92        32

    accuracy                           0.97       190
   macro avg       0.95      0.96      0.95       190
weighted avg       0.97      0.97      0.97       190

Trial 259 - Average Validation Accuracy: 0.9649
Fold 1/3 - Validation Accuracy: 0.9579
Classification Report:
              precision    recall  f1-score   support

Non-Repeater       0.97      0.98      0.97       159
    Repeater       0.90      0.84      0.87        31

    accuracy                           0.96       190
   macro avg       0.93      0.91      0.92       190
weighted avg       0.96      0.96      0.96       190

Fold 2/3 - Validation Accuracy: 0.9684
Classification Report:
              precision    recall  f1-score   support

Non-Repeater       0.97      0.99      0.98       159
    Repeater       0.96      0.84      0.90        31

    accuracy                           0.97       190
   macro avg       0.97      0.92      0.94       190
weighted avg       0.97      0.97      0.97       190

Fold 3/3 - Validation Accuracy: 0.9737
Classification Report:
              precision    recall  f1-score   support

Non-Repeater       0.98      0.99      0.98       158
    Repeater       0.94      0.91      0.92        32

    accuracy                           0.97       190
   macro avg       0.96      0.95      0.95       190
weighted avg       0.97      0.97      0.97       190

Trial 260 - Average Validation Accuracy: 0.9667
Fold 1/3 - Validation Accuracy: 0.9474
Classification Report:
              precision    recall  f1-score   support

Non-Repeater       0.96      0.97      0.97       159
    Repeater       0.86      0.81      0.83        31

    accuracy                           0.95       190
   macro avg       0.91      0.89      0.90       190
weighted avg       0.95      0.95      0.95       190

Fold 2/3 - Validation Accuracy: 0.9789
Classification Report:
              precision    recall  f1-score   support

Non-Repeater       0.98      0.99      0.99       159
    Repeater       0.97      0.90      0.93        31

    accuracy                           0.98       190
   macro avg       0.97      0.95      0.96       190
weighted avg       0.98      0.98      0.98       190

Fold 3/3 - Validation Accuracy: 0.9579
Classification Report:
              precision    recall  f1-score   support

Non-Repeater       0.97      0.97      0.97       158
    Repeater       0.88      0.88      0.88        32

    accuracy                           0.96       190
   macro avg       0.92      0.92      0.92       190
weighted avg       0.96      0.96      0.96       190

Trial 261 - Average Validation Accuracy: 0.9614
Fold 1/3 - Validation Accuracy: 0.9421
Classification Report:
              precision    recall  f1-score   support

Non-Repeater       0.96      0.97      0.97       159
    Repeater       0.86      0.77      0.81        31

    accuracy                           0.94       190
   macro avg       0.91      0.87      0.89       190
weighted avg       0.94      0.94      0.94       190

Fold 2/3 - Validation Accuracy: 0.9789
Classification Report:
              precision    recall  f1-score   support

Non-Repeater       0.98      0.99      0.99       159
    Repeater       0.97      0.90      0.93        31

    accuracy                           0.98       190
   macro avg       0.97      0.95      0.96       190
weighted avg       0.98      0.98      0.98       190

Fold 3/3 - Validation Accuracy: 0.9632
Classification Report:
              precision    recall  f1-score   support

Non-Repeater       0.99      0.97      0.98       158
    Repeater       0.86      0.94      0.90        32

    accuracy                           0.96       190
   macro avg       0.92      0.95      0.94       190
weighted avg       0.97      0.96      0.96       190

Trial 262 - Average Validation Accuracy: 0.9614
Fold 1/3 - Validation Accuracy: 0.8947
Classification Report:
              precision    recall  f1-score   support

Non-Repeater       0.92      0.96      0.94       159
    Repeater       0.72      0.58      0.64        31

    accuracy                           0.89       190
   macro avg       0.82      0.77      0.79       190
weighted avg       0.89      0.89      0.89       190

Fold 2/3 - Validation Accuracy: 0.9053
Classification Report:
              precision    recall  f1-score   support

Non-Repeater       0.93      0.96      0.94       159
    Repeater       0.74      0.65      0.69        31

    accuracy                           0.91       190
   macro avg       0.84      0.80      0.82       190
weighted avg       0.90      0.91      0.90       190

Fold 3/3 - Validation Accuracy: 0.9421
Classification Report:
              precision    recall  f1-score   support

Non-Repeater       0.96      0.97      0.97       158
    Repeater       0.86      0.78      0.82        32

    accuracy                           0.94       190
   macro avg       0.91      0.88      0.89       190
weighted avg       0.94      0.94      0.94       190

Trial 263 - Average Validation Accuracy: 0.9140
Fold 1/3 - Validation Accuracy: 0.9526
Classification Report:
              precision    recall  f1-score   support

Non-Repeater       0.97      0.97      0.97       159
    Repeater       0.84      0.87      0.86        31

    accuracy                           0.95       190
   macro avg       0.91      0.92      0.91       190
weighted avg       0.95      0.95      0.95       190

Fold 2/3 - Validation Accuracy: 0.9789
Classification Report:
              precision    recall  f1-score   support

Non-Repeater       0.98      0.99      0.99       159
    Repeater       0.97      0.90      0.93        31

    accuracy                           0.98       190
   macro avg       0.97      0.95      0.96       190
weighted avg       0.98      0.98      0.98       190

Fold 3/3 - Validation Accuracy: 0.9737
Classification Report:
              precision    recall  f1-score   support

Non-Repeater       0.98      0.99      0.98       158
    Repeater       0.94      0.91      0.92        32

    accuracy                           0.97       190
   macro avg       0.96      0.95      0.95       190
weighted avg       0.97      0.97      0.97       190

Trial 264 - Average Validation Accuracy: 0.9684
Fold 1/3 - Validation Accuracy: 0.9579
Classification Report:
              precision    recall  f1-score   support

Non-Repeater       0.98      0.97      0.97       159
    Repeater       0.85      0.90      0.88        31

    accuracy                           0.96       190
   macro avg       0.91      0.94      0.92       190
weighted avg       0.96      0.96      0.96       190

Fold 2/3 - Validation Accuracy: 0.9684
Classification Report:
              precision    recall  f1-score   support

Non-Repeater       0.97      0.99      0.98       159
    Repeater       0.96      0.84      0.90        31

    accuracy                           0.97       190
   macro avg       0.97      0.92      0.94       190
weighted avg       0.97      0.97      0.97       190

Fold 3/3 - Validation Accuracy: 0.9684
Classification Report:
              precision    recall  f1-score   support

Non-Repeater       0.98      0.98      0.98       158
    Repeater       0.91      0.91      0.91        32

    accuracy                           0.97       190
   macro avg       0.94      0.94      0.94       190
weighted avg       0.97      0.97      0.97       190

Trial 265 - Average Validation Accuracy: 0.9649
Fold 1/3 - Validation Accuracy: 0.9474
Classification Report:
[I 2025-08-31 16:21:37,087] Trial 266 finished with value: 0.9649122807017544 and parameters: {'hidden_dim': 1556, 'latent_dim': 14, 'beta': 1.8775905541299813, 'gamma': 0.3209981000103298, 'dropout_rate': 0.15058953677432338, 'lr': 0.000104163204591993, 'scheduler_patience': 7, 'class_weight': 0.9475595896283237, 'activation': 'ReLU', 'classification_multiplier': 12842.767818651462}. Best is trial 255 with value: 0.9736842105263158.
[I 2025-08-31 16:22:05,622] Trial 267 finished with value: 0.9719298245614035 and parameters: {'hidden_dim': 1834, 'latent_dim': 18, 'beta': 1.9170727884438237, 'gamma': 1.7139177495105955, 'dropout_rate': 0.11695571374184374, 'lr': 0.0006559337475464266, 'scheduler_patience': 7, 'class_weight': 0.9998994699602946, 'activation': 'ReLU', 'classification_multiplier': 12584.661890416019}. Best is trial 255 with value: 0.9736842105263158.
[I 2025-08-31 16:22:35,050] Trial 268 finished with value: 0.9403508771929824 and parameters: {'hidden_dim': 1870, 'latent_dim': 16, 'beta': 1.8350860881088042, 'gamma': 0.5769900005399973, 'dropout_rate': 0.1237932419569856, 'lr': 0.005059066305487631, 'scheduler_patience': 7, 'class_weight': 0.9859805640825523, 'activation': 'ReLU', 'classification_multiplier': 12645.906672217743}. Best is trial 255 with value: 0.9736842105263158.
[I 2025-08-31 16:23:04,377] Trial 269 finished with value: 0.9298245614035089 and parameters: {'hidden_dim': 1865, 'latent_dim': 18, 'beta': 1.9637186814522287, 'gamma': 1.6925750343977846, 'dropout_rate': 0.473141223384957, 'lr': 0.00029908302081839346, 'scheduler_patience': 7, 'class_weight': 0.9978735607329522, 'activation': 'ELU', 'classification_multiplier': 12483.265815377921}. Best is trial 255 with value: 0.9736842105263158.
[I 2025-08-31 16:23:32,642] Trial 270 finished with value: 0.9543859649122807 and parameters: {'hidden_dim': 1780, 'latent_dim': 19, 'beta': 1.8877946451454226, 'gamma': 1.747152255012407, 'dropout_rate': 0.13647430200998692, 'lr': 0.0009829498958246958, 'scheduler_patience': 7, 'class_weight': 0.9792980101673827, 'activation': 'ReLU', 'classification_multiplier': 12602.841454995141}. Best is trial 255 with value: 0.9736842105263158.
