[I 2025-08-31 15:59:51,754] Trial 219 finished with value: 0.9631578947368421 and parameters: {'hidden_dim': 1879, 'latent_dim': 27, 'beta': 1.818241947808633, 'gamma': 1.807613178673879, 'dropout_rate': 0.1470328866614085, 'lr': 0.00039928242220955686, 'scheduler_patience': 7, 'class_weight': 0.9626471008292593, 'activation': 'ReLU', 'classification_multiplier': 11504.221994568567}. Best is trial 111 with value: 0.9719298245614035.
[I 2025-08-31 16:00:19,280] Trial 220 finished with value: 0.9315789473684211 and parameters: {'hidden_dim': 1318, 'latent_dim': 14, 'beta': 1.9996614619847302, 'gamma': 1.9234714455791375, 'dropout_rate': 0.1061032577048285, 'lr': 0.008172787144058342, 'scheduler_patience': 7, 'class_weight': 0.9426105794495262, 'activation': 'ReLU', 'classification_multiplier': 13009.008639442223}. Best is trial 111 with value: 0.9719298245614035.
[I 2025-08-31 16:00:45,271] Trial 221 finished with value: 0.9508771929824561 and parameters: {'hidden_dim': 1376, 'latent_dim': 20, 'beta': 1.9991249519323735, 'gamma': 1.5629521411055072, 'dropout_rate': 0.12462570809811503, 'lr': 0.003107428651293263, 'scheduler_patience': 7, 'class_weight': 0.9327589633780318, 'activation': 'ReLU', 'classification_multiplier': 12222.59881498085}. Best is trial 111 with value: 0.9719298245614035.
[I 2025-08-31 16:01:11,908] Trial 222 finished with value: 0.968421052631579 and parameters: {'hidden_dim': 1500, 'latent_dim': 40, 'beta': 1.93265290658205, 'gamma': 1.4834327343468332, 'dropout_rate': 0.11884711539112906, 'lr': 0.0007679406998179132, 'scheduler_patience': 7, 'class_weight': 0.7193358469765889, 'activation': 'ReLU', 'classification_multiplier': 12043.369577463829}. Best is trial 111 with value: 0.9719298245614035.
[I 2025-08-31 16:01:37,686] Trial 223 finished with value: 0.9543859649122807 and parameters: {'hidden_dim': 1426, 'latent_dim': 38, 'beta': 1.9625141914259445, 'gamma': 1.5338782051734023, 'dropout_rate': 0.1383233171839448, 'lr': 0.0010813952224710283, 'scheduler_patience': 7, 'class_weight': 0.9758909644384387, 'activation': 'ReLU', 'classification_multiplier': 12278.09392409543}. Best is trial 111 with value: 0.9719298245614035.
[I 2025-08-31 16:02:02,797] Trial 224 finished with value: 0.9596491228070176 and parameters: {'hidden_dim': 1338, 'latent_dim': 39, 'beta': 1.9015520679279883, 'gamma': 1.491797245696998, 'dropout_rate': 0.12880426611952303, 'lr': 0.0005330525031755169, 'scheduler_patience': 7, 'class_weight': 0.9998703609205527, 'activation': 'ReLU', 'classification_multiplier': 14648.424706819469}. Best is trial 111 with value: 0.9719298245614035.
[I 2025-08-31 16:02:27,644] Trial 225 finished with value: 0.9631578947368421 and parameters: {'hidden_dim': 1290, 'latent_dim': 37, 'beta': 0.7469147998347907, 'gamma': 1.4260724210441622, 'dropout_rate': 0.11117701381725291, 'lr': 0.00025842093584850544, 'scheduler_patience': 7, 'class_weight': 0.8878447570538233, 'activation': 'ReLU', 'classification_multiplier': 12460.047941877534}. Best is trial 111 with value: 0.9719298245614035.
              precision    recall  f1-score   support

Non-Repeater       0.98      0.99      0.98       159
    Repeater       0.96      0.87      0.92        31

    accuracy                           0.97       190
   macro avg       0.97      0.93      0.95       190
weighted avg       0.97      0.97      0.97       190

Fold 3/3 - Validation Accuracy: 0.9632
Classification Report:
              precision    recall  f1-score   support

Non-Repeater       0.97      0.98      0.98       158
    Repeater       0.90      0.88      0.89        32

    accuracy                           0.96       190
   macro avg       0.94      0.93      0.93       190
weighted avg       0.96      0.96      0.96       190

Trial 219 - Average Validation Accuracy: 0.9632
Fold 1/3 - Validation Accuracy: 0.9263
Classification Report:
              precision    recall  f1-score   support

Non-Repeater       0.95      0.96      0.96       159
    Repeater       0.79      0.74      0.77        31

    accuracy                           0.93       190
   macro avg       0.87      0.85      0.86       190
weighted avg       0.92      0.93      0.93       190

Fold 2/3 - Validation Accuracy: 0.9158
Classification Report:
              precision    recall  f1-score   support

Non-Repeater       0.94      0.96      0.95       159
    Repeater       0.78      0.68      0.72        31

    accuracy                           0.92       190
   macro avg       0.86      0.82      0.84       190
weighted avg       0.91      0.92      0.91       190

Fold 3/3 - Validation Accuracy: 0.9526
Classification Report:
              precision    recall  f1-score   support

Non-Repeater       0.97      0.97      0.97       158
    Repeater       0.87      0.84      0.86        32

    accuracy                           0.95       190
   macro avg       0.92      0.91      0.91       190
weighted avg       0.95      0.95      0.95       190

Trial 220 - Average Validation Accuracy: 0.9316
Fold 1/3 - Validation Accuracy: 0.9474
Classification Report:
              precision    recall  f1-score   support

Non-Repeater       0.96      0.98      0.97       159
    Repeater       0.89      0.77      0.83        31

    accuracy                           0.95       190
   macro avg       0.92      0.88      0.90       190
weighted avg       0.95      0.95      0.95       190

Fold 2/3 - Validation Accuracy: 0.9526
Classification Report:
              precision    recall  f1-score   support

Non-Repeater       0.95      0.99      0.97       159
    Repeater       0.96      0.74      0.84        31

    accuracy                           0.95       190
   macro avg       0.96      0.87      0.90       190
weighted avg       0.95      0.95      0.95       190

Fold 3/3 - Validation Accuracy: 0.9526
Classification Report:
              precision    recall  f1-score   support

Non-Repeater       0.96      0.98      0.97       158
    Repeater       0.90      0.81      0.85        32

    accuracy                           0.95       190
   macro avg       0.93      0.90      0.91       190
weighted avg       0.95      0.95      0.95       190

Trial 221 - Average Validation Accuracy: 0.9509
Fold 1/3 - Validation Accuracy: 0.9684
Classification Report:
              precision    recall  f1-score   support

Non-Repeater       0.98      0.99      0.98       159
    Repeater       0.93      0.87      0.90        31

    accuracy                           0.97       190
   macro avg       0.95      0.93      0.94       190
weighted avg       0.97      0.97      0.97       190

Fold 2/3 - Validation Accuracy: 0.9737
Classification Report:
              precision    recall  f1-score   support

Non-Repeater       0.98      0.99      0.98       159
    Repeater       0.96      0.87      0.92        31

    accuracy                           0.97       190
   macro avg       0.97      0.93      0.95       190
weighted avg       0.97      0.97      0.97       190

Fold 3/3 - Validation Accuracy: 0.9632
Classification Report:
              precision    recall  f1-score   support

Non-Repeater       0.97      0.99      0.98       158
    Repeater       0.93      0.84      0.89        32

    accuracy                           0.96       190
   macro avg       0.95      0.92      0.93       190
weighted avg       0.96      0.96      0.96       190

Trial 222 - Average Validation Accuracy: 0.9684
Fold 1/3 - Validation Accuracy: 0.9316
Classification Report:
              precision    recall  f1-score   support

Non-Repeater       0.96      0.96      0.96       159
    Repeater       0.80      0.77      0.79        31

    accuracy                           0.93       190
   macro avg       0.88      0.87      0.87       190
weighted avg       0.93      0.93      0.93       190

Fold 2/3 - Validation Accuracy: 0.9684
Classification Report:
              precision    recall  f1-score   support

Non-Repeater       0.98      0.99      0.98       159
    Repeater       0.93      0.87      0.90        31

    accuracy                           0.97       190
   macro avg       0.95      0.93      0.94       190
weighted avg       0.97      0.97      0.97       190

Fold 3/3 - Validation Accuracy: 0.9632
Classification Report:
              precision    recall  f1-score   support

Non-Repeater       0.97      0.98      0.98       158
    Repeater       0.90      0.88      0.89        32

    accuracy                           0.96       190
   macro avg       0.94      0.93      0.93       190
weighted avg       0.96      0.96      0.96       190

Trial 223 - Average Validation Accuracy: 0.9544
Fold 1/3 - Validation Accuracy: 0.9421
Classification Report:
              precision    recall  f1-score   support

Non-Repeater       0.96      0.97      0.97       159
    Repeater       0.83      0.81      0.82        31

    accuracy                           0.94       190
   macro avg       0.90      0.89      0.89       190
weighted avg       0.94      0.94      0.94       190

Fold 2/3 - Validation Accuracy: 0.9737
Classification Report:
              precision    recall  f1-score   support

Non-Repeater       0.98      0.99      0.98       159
    Repeater       0.96      0.87      0.92        31

    accuracy                           0.97       190
   macro avg       0.97      0.93      0.95       190
weighted avg       0.97      0.97      0.97       190

Fold 3/3 - Validation Accuracy: 0.9632
Classification Report:
              precision    recall  f1-score   support

Non-Repeater       0.97      0.99      0.98       158
    Repeater       0.93      0.84      0.89        32

    accuracy                           0.96       190
   macro avg       0.95      0.92      0.93       190
weighted avg       0.96      0.96      0.96       190

Trial 224 - Average Validation Accuracy: 0.9596
Fold 1/3 - Validation Accuracy: 0.9632
Classification Report:
              precision    recall  f1-score   support

Non-Repeater       0.97      0.98      0.98       159
    Repeater       0.90      0.87      0.89        31

    accuracy                           0.96       190
   macro avg       0.94      0.93      0.93       190
weighted avg       0.96      0.96      0.96       190

Fold 2/3 - Validation Accuracy: 0.9684
Classification Report:
              precision    recall  f1-score   support

Non-Repeater       0.97      0.99      0.98       159
    Repeater       0.96      0.84      0.90        31

    accuracy                           0.97       190
   macro avg       0.97      0.92      0.94       190
weighted avg       0.97      0.97      0.97       190

Fold 3/3 - Validation Accuracy: 0.9579
Classification Report:
              precision    recall  f1-score   support

Non-Repeater       0.97      0.97      0.97       158
    Repeater       0.88      0.88      0.88        32

    accuracy                           0.96       190
   macro avg       0.92      0.92      0.92       190
weighted avg       0.96      0.96      0.96       190

Trial 225 - Average Validation Accuracy: 0.9632
Fold 1/3 - Validation Accuracy: 0.9579
Classification Report:
[I 2025-08-31 16:02:51,991] Trial 226 finished with value: 0.9666666666666667 and parameters: {'hidden_dim': 1259, 'latent_dim': 40, 'beta': 1.967700030674855, 'gamma': 1.6228816072060186, 'dropout_rate': 0.12214348965109934, 'lr': 0.00045355691165111157, 'scheduler_patience': 7, 'class_weight': 0.9471125969538934, 'activation': 'ReLU', 'classification_multiplier': 11972.324139820908}. Best is trial 111 with value: 0.9719298245614035.
[I 2025-08-31 16:03:20,217] Trial 227 finished with value: 0.9701754385964912 and parameters: {'hidden_dim': 1600, 'latent_dim': 38, 'beta': 1.9233274418238873, 'gamma': 1.8714751175815922, 'dropout_rate': 0.10023870606295532, 'lr': 0.0006809758335141135, 'scheduler_patience': 7, 'class_weight': 0.9194652286248418, 'activation': 'ReLU', 'classification_multiplier': 11791.247762751593}. Best is trial 111 with value: 0.9719298245614035.
[I 2025-08-31 16:03:47,542] Trial 228 finished with value: 0.9719298245614035 and parameters: {'hidden_dim': 1603, 'latent_dim': 38, 'beta': 1.8566007104595579, 'gamma': 1.8759293285406133, 'dropout_rate': 0.1014850477980929, 'lr': 0.00010683558827780475, 'scheduler_patience': 7, 'class_weight': 0.9055509095927596, 'activation': 'ReLU', 'classification_multiplier': 11590.817674913535}. Best is trial 111 with value: 0.9719298245614035.
[I 2025-08-31 16:04:14,613] Trial 229 finished with value: 0.9614035087719298 and parameters: {'hidden_dim': 1600, 'latent_dim': 38, 'beta': 1.8421363773573984, 'gamma': 1.9211365741481221, 'dropout_rate': 0.10248197709390594, 'lr': 0.00031840785079164286, 'scheduler_patience': 7, 'class_weight': 0.9133211078674107, 'activation': 'ReLU', 'classification_multiplier': 11828.082517002367}. Best is trial 111 with value: 0.9719298245614035.
[I 2025-08-31 16:04:42,490] Trial 230 finished with value: 0.968421052631579 and parameters: {'hidden_dim': 1535, 'latent_dim': 32, 'beta': 1.8822556422635626, 'gamma': 1.9675965963085404, 'dropout_rate': 0.10866157181642143, 'lr': 0.0006119257059774562, 'scheduler_patience': 7, 'class_weight': 0.8744648789981564, 'activation': 'ReLU', 'classification_multiplier': 11310.758181687539}. Best is trial 111 with value: 0.9719298245614035.
[I 2025-08-31 16:05:11,159] Trial 231 finished with value: 0.9649122807017544 and parameters: {'hidden_dim': 1643, 'latent_dim': 37, 'beta': 1.920599647431345, 'gamma': 1.8738611239166587, 'dropout_rate': 0.1002817116353109, 'lr': 0.0002546181311490176, 'scheduler_patience': 7, 'class_weight': 0.9016553285102225, 'activation': 'ReLU', 'classification_multiplier': 11656.64750036225}. Best is trial 111 with value: 0.9719298245614035.
              precision    recall  f1-score   support

Non-Repeater       0.97      0.97      0.97       159
    Repeater       0.87      0.87      0.87        31

    accuracy                           0.96       190
   macro avg       0.92      0.92      0.92       190
weighted avg       0.96      0.96      0.96       190

Fold 2/3 - Validation Accuracy: 0.9789
Classification Report:
              precision    recall  f1-score   support

Non-Repeater       0.98      0.99      0.99       159
    Repeater       0.97      0.90      0.93        31

    accuracy                           0.98       190
   macro avg       0.97      0.95      0.96       190
weighted avg       0.98      0.98      0.98       190

Fold 3/3 - Validation Accuracy: 0.9632
Classification Report:
              precision    recall  f1-score   support

Non-Repeater       0.97      0.99      0.98       158
    Repeater       0.93      0.84      0.89        32

    accuracy                           0.96       190
   macro avg       0.95      0.92      0.93       190
weighted avg       0.96      0.96      0.96       190

Trial 226 - Average Validation Accuracy: 0.9667
Fold 1/3 - Validation Accuracy: 0.9684
Classification Report:
              precision    recall  f1-score   support

Non-Repeater       0.98      0.98      0.98       159
    Repeater       0.90      0.90      0.90        31

    accuracy                           0.97       190
   macro avg       0.94      0.94      0.94       190
weighted avg       0.97      0.97      0.97       190

Fold 2/3 - Validation Accuracy: 0.9789
Classification Report:
              precision    recall  f1-score   support

Non-Repeater       0.98      0.99      0.99       159
    Repeater       0.97      0.90      0.93        31

    accuracy                           0.98       190
   macro avg       0.97      0.95      0.96       190
weighted avg       0.98      0.98      0.98       190

Fold 3/3 - Validation Accuracy: 0.9632
Classification Report:
              precision    recall  f1-score   support

Non-Repeater       0.97      0.99      0.98       158
    Repeater       0.93      0.84      0.89        32

    accuracy                           0.96       190
   macro avg       0.95      0.92      0.93       190
weighted avg       0.96      0.96      0.96       190

Trial 227 - Average Validation Accuracy: 0.9702
Fold 1/3 - Validation Accuracy: 0.9579
Classification Report:
              precision    recall  f1-score   support

Non-Repeater       0.97      0.98      0.97       159
    Repeater       0.90      0.84      0.87        31

    accuracy                           0.96       190
   macro avg       0.93      0.91      0.92       190
weighted avg       0.96      0.96      0.96       190

Fold 2/3 - Validation Accuracy: 0.9789
Classification Report:
              precision    recall  f1-score   support

Non-Repeater       0.98      0.99      0.99       159
    Repeater       0.97      0.90      0.93        31

    accuracy                           0.98       190
   macro avg       0.97      0.95      0.96       190
weighted avg       0.98      0.98      0.98       190

Fold 3/3 - Validation Accuracy: 0.9789
Classification Report:
              precision    recall  f1-score   support

Non-Repeater       0.98      0.99      0.99       158
    Repeater       0.97      0.91      0.94        32

    accuracy                           0.98       190
   macro avg       0.97      0.95      0.96       190
weighted avg       0.98      0.98      0.98       190

Trial 228 - Average Validation Accuracy: 0.9719
Fold 1/3 - Validation Accuracy: 0.9526
Classification Report:
              precision    recall  f1-score   support

Non-Repeater       0.97      0.97      0.97       159
    Repeater       0.87      0.84      0.85        31

    accuracy                           0.95       190
   macro avg       0.92      0.91      0.91       190
weighted avg       0.95      0.95      0.95       190

Fold 2/3 - Validation Accuracy: 0.9737
Classification Report:
              precision    recall  f1-score   support

Non-Repeater       0.98      0.99      0.98       159
    Repeater       0.96      0.87      0.92        31

    accuracy                           0.97       190
   macro avg       0.97      0.93      0.95       190
weighted avg       0.97      0.97      0.97       190

Fold 3/3 - Validation Accuracy: 0.9579
Classification Report:
              precision    recall  f1-score   support

Non-Repeater       0.96      0.99      0.97       158
    Repeater       0.93      0.81      0.87        32

    accuracy                           0.96       190
   macro avg       0.95      0.90      0.92       190
weighted avg       0.96      0.96      0.96       190

Trial 229 - Average Validation Accuracy: 0.9614
Fold 1/3 - Validation Accuracy: 0.9632
Classification Report:
              precision    recall  f1-score   support

Non-Repeater       0.97      0.99      0.98       159
    Repeater       0.93      0.84      0.88        31

    accuracy                           0.96       190
   macro avg       0.95      0.91      0.93       190
weighted avg       0.96      0.96      0.96       190

Fold 2/3 - Validation Accuracy: 0.9684
Classification Report:
              precision    recall  f1-score   support

Non-Repeater       0.97      0.99      0.98       159
    Repeater       0.96      0.84      0.90        31

    accuracy                           0.97       190
   macro avg       0.97      0.92      0.94       190
weighted avg       0.97      0.97      0.97       190

Fold 3/3 - Validation Accuracy: 0.9737
Classification Report:
              precision    recall  f1-score   support

Non-Repeater       0.98      0.99      0.98       158
    Repeater       0.94      0.91      0.92        32

    accuracy                           0.97       190
   macro avg       0.96      0.95      0.95       190
weighted avg       0.97      0.97      0.97       190

Trial 230 - Average Validation Accuracy: 0.9684
Fold 1/3 - Validation Accuracy: 0.9526
Classification Report:
              precision    recall  f1-score   support

Non-Repeater       0.97      0.97      0.97       159
    Repeater       0.87      0.84      0.85        31

    accuracy                           0.95       190
   macro avg       0.92      0.91      0.91       190
weighted avg       0.95      0.95      0.95       190

Fold 2/3 - Validation Accuracy: 0.9789
Classification Report:
              precision    recall  f1-score   support

Non-Repeater       0.98      0.99      0.99       159
    Repeater       0.97      0.90      0.93        31

    accuracy                           0.98       190
   macro avg       0.97      0.95      0.96       190
weighted avg       0.98      0.98      0.98       190

Fold 3/3 - Validation Accuracy: 0.9632
Classification Report:
              precision    recall  f1-score   support

Non-Repeater       0.98      0.97      0.98       158
    Repeater       0.88      0.91      0.89        32

    accuracy                           0.96       190
   macro avg       0.93      0.94      0.94       190
weighted avg       0.96      0.96      0.96       190

Trial 231 - Average Validation Accuracy: 0.9649
Fold 1/3 - Validation Accuracy: 0.9526
Classification Report:
              precision    recall  f1-score   support

Non-Repeater       0.97      0.97      0.97       159
    Repeater       0.84      0.87      0.86        31

    accuracy                           0.95       190
   macro avg       0.91      0.92      0.91       190
weighted avg       0.95      0.95      0.95       190

Fold 2/3 - Validation Accuracy: 0.9789
Classification Report:
              precision    recall  f1-score   support

Non-Repeater       0.98      0.99      0.99       159
    Repeater       0.97      0.90      0.93        31

    accuracy                           0.98       190
   macro avg       0.97      0.95      0.96       190
weighted avg       0.98      0.98      0.98       190

Fold 3/3 - Validation Accuracy: 0.9684
Classification Report:
