[I 2025-08-31 16:29:48,642] Trial 284 finished with value: 0.9666666666666667 and parameters: {'hidden_dim': 1532, 'latent_dim': 39, 'beta': 1.95619839205196, 'gamma': 1.6088629630871316, 'dropout_rate': 0.10866025621933592, 'lr': 0.00028734648305136194, 'scheduler_patience': 7, 'class_weight': 0.8616948096593713, 'activation': 'ReLU', 'classification_multiplier': 11226.751656716906}. Best is trial 255 with value: 0.9736842105263158.
[I 2025-08-31 16:30:16,350] Trial 285 finished with value: 0.9596491228070175 and parameters: {'hidden_dim': 1685, 'latent_dim': 38, 'beta': 1.8703406987229807, 'gamma': 1.6494909774213262, 'dropout_rate': 0.1178315391924303, 'lr': 0.000464458397146155, 'scheduler_patience': 7, 'class_weight': 0.9540440281845228, 'activation': 'ReLU', 'classification_multiplier': 11657.495080498718}. Best is trial 255 with value: 0.9736842105263158.
              precision    recall  f1-score   support

Non-Repeater       0.96      0.99      0.97       159
    Repeater       0.92      0.77      0.84        31

    accuracy                           0.95       190
   macro avg       0.94      0.88      0.91       190
weighted avg       0.95      0.95      0.95       190

Fold 3/3 - Validation Accuracy: 0.9684
Classification Report:
              precision    recall  f1-score   support

Non-Repeater       0.97      0.99      0.98       158
    Repeater       0.96      0.84      0.90        32

    accuracy                           0.97       190
   macro avg       0.97      0.92      0.94       190
weighted avg       0.97      0.97      0.97       190

Trial 279 - Average Validation Accuracy: 0.9614
Fold 1/3 - Validation Accuracy: 0.9526
Classification Report:
              precision    recall  f1-score   support

Non-Repeater       0.96      0.98      0.97       159
    Repeater       0.89      0.81      0.85        31

    accuracy                           0.95       190
   macro avg       0.93      0.89      0.91       190
weighted avg       0.95      0.95      0.95       190

Fold 2/3 - Validation Accuracy: 0.9737
Classification Report:
              precision    recall  f1-score   support

Non-Repeater       0.98      0.99      0.98       159
    Repeater       0.96      0.87      0.92        31

    accuracy                           0.97       190
   macro avg       0.97      0.93      0.95       190
weighted avg       0.97      0.97      0.97       190

Fold 3/3 - Validation Accuracy: 0.9579
Classification Report:
              precision    recall  f1-score   support

Non-Repeater       0.97      0.97      0.97       158
    Repeater       0.88      0.88      0.88        32

    accuracy                           0.96       190
   macro avg       0.92      0.92      0.92       190
weighted avg       0.96      0.96      0.96       190

Trial 280 - Average Validation Accuracy: 0.9614
Fold 1/3 - Validation Accuracy: 0.9579
Classification Report:
              precision    recall  f1-score   support

Non-Repeater       0.97      0.97      0.97       159
    Repeater       0.87      0.87      0.87        31

    accuracy                           0.96       190
   macro avg       0.92      0.92      0.92       190
weighted avg       0.96      0.96      0.96       190

Fold 2/3 - Validation Accuracy: 0.9579
Classification Report:
              precision    recall  f1-score   support

Non-Repeater       0.96      0.99      0.98       159
    Repeater       0.93      0.81      0.86        31

    accuracy                           0.96       190
   macro avg       0.94      0.90      0.92       190
weighted avg       0.96      0.96      0.96       190

Fold 3/3 - Validation Accuracy: 0.9579
Classification Report:
              precision    recall  f1-score   support

Non-Repeater       0.98      0.97      0.97       158
    Repeater       0.85      0.91      0.88        32

    accuracy                           0.96       190
   macro avg       0.92      0.94      0.93       190
weighted avg       0.96      0.96      0.96       190

Trial 281 - Average Validation Accuracy: 0.9579
Fold 1/3 - Validation Accuracy: 0.9368
Classification Report:
              precision    recall  f1-score   support

Non-Repeater       0.95      0.97      0.96       159
    Repeater       0.85      0.74      0.79        31

    accuracy                           0.94       190
   macro avg       0.90      0.86      0.88       190
weighted avg       0.93      0.94      0.94       190

Fold 2/3 - Validation Accuracy: 0.9526
Classification Report:
              precision    recall  f1-score   support

Non-Repeater       0.96      0.99      0.97       159
    Repeater       0.92      0.77      0.84        31

    accuracy                           0.95       190
   macro avg       0.94      0.88      0.91       190
weighted avg       0.95      0.95      0.95       190

Fold 3/3 - Validation Accuracy: 0.9526
Classification Report:
              precision    recall  f1-score   support

Non-Repeater       0.97      0.97      0.97       158
    Repeater       0.87      0.84      0.86        32

    accuracy                           0.95       190
   macro avg       0.92      0.91      0.91       190
weighted avg       0.95      0.95      0.95       190

Trial 282 - Average Validation Accuracy: 0.9474
Fold 1/3 - Validation Accuracy: 0.9368
Classification Report:
              precision    recall  f1-score   support

Non-Repeater       0.95      0.97      0.96       159
    Repeater       0.85      0.74      0.79        31

    accuracy                           0.94       190
   macro avg       0.90      0.86      0.88       190
weighted avg       0.93      0.94      0.94       190

Fold 2/3 - Validation Accuracy: 0.9421
Classification Report:
              precision    recall  f1-score   support

Non-Repeater       0.95      0.98      0.97       159
    Repeater       0.88      0.74      0.81        31

    accuracy                           0.94       190
   macro avg       0.92      0.86      0.89       190
weighted avg       0.94      0.94      0.94       190

Fold 3/3 - Validation Accuracy: 0.9316
Classification Report:
              precision    recall  f1-score   support

Non-Repeater       0.96      0.96      0.96       158
    Repeater       0.79      0.81      0.80        32

    accuracy                           0.93       190
   macro avg       0.87      0.88      0.88       190
weighted avg       0.93      0.93      0.93       190

Trial 283 - Average Validation Accuracy: 0.9368
Fold 1/3 - Validation Accuracy: 0.9526
Classification Report:
              precision    recall  f1-score   support

Non-Repeater       0.97      0.97      0.97       159
    Repeater       0.87      0.84      0.85        31

    accuracy                           0.95       190
   macro avg       0.92      0.91      0.91       190
weighted avg       0.95      0.95      0.95       190

Fold 2/3 - Validation Accuracy: 0.9789
Classification Report:
              precision    recall  f1-score   support

Non-Repeater       0.98      0.99      0.99       159
    Repeater       0.97      0.90      0.93        31

    accuracy                           0.98       190
   macro avg       0.97      0.95      0.96       190
weighted avg       0.98      0.98      0.98       190

Fold 3/3 - Validation Accuracy: 0.9684
Classification Report:
              precision    recall  f1-score   support

Non-Repeater       0.97      0.99      0.98       158
    Repeater       0.93      0.88      0.90        32

    accuracy                           0.97       190
   macro avg       0.95      0.93      0.94       190
weighted avg       0.97      0.97      0.97       190

Trial 284 - Average Validation Accuracy: 0.9667
Fold 1/3 - Validation Accuracy: 0.9474
Classification Report:
              precision    recall  f1-score   support

Non-Repeater       0.97      0.97      0.97       159
    Repeater       0.84      0.84      0.84        31

    accuracy                           0.95       190
   macro avg       0.90      0.90      0.90       190
weighted avg       0.95      0.95      0.95       190

Fold 2/3 - Validation Accuracy: 0.9737
Classification Report:
              precision    recall  f1-score   support

Non-Repeater       0.98      0.99      0.98       159
    Repeater       0.96      0.87      0.92        31

    accuracy                           0.97       190
   macro avg       0.97      0.93      0.95       190
weighted avg       0.97      0.97      0.97       190

Fold 3/3 - Validation Accuracy: 0.9579
Classification Report:
              precision    recall  f1-score   support

Non-Repeater       0.97      0.97      0.97       158
    Repeater       0.88      0.88      0.88        32

    accuracy                           0.96       190
   macro avg       0.92      0.92      0.92       190
weighted avg       0.96      0.96      0.96       190

Trial 285 - Average Validation Accuracy: 0.9596
Fold 1/3 - Validation Accuracy: 0.9684
Classification Report:
[I 2025-08-31 16:30:40,308] Trial 286 finished with value: 0.9701754385964912 and parameters: {'hidden_dim': 1172, 'latent_dim': 37, 'beta': 1.2247955542463709, 'gamma': 1.7393968665789168, 'dropout_rate': 0.12773503659950944, 'lr': 0.000786633779941604, 'scheduler_patience': 7, 'class_weight': 0.9806641555613111, 'activation': 'ReLU', 'classification_multiplier': 12279.529988999066}. Best is trial 255 with value: 0.9736842105263158.
[I 2025-08-31 16:31:08,608] Trial 287 finished with value: 0.9719298245614035 and parameters: {'hidden_dim': 1753, 'latent_dim': 38, 'beta': 1.9359182628801603, 'gamma': 1.5514948411733271, 'dropout_rate': 0.15033658405956038, 'lr': 0.00028405831294453775, 'scheduler_patience': 7, 'class_weight': 0.898849882289749, 'activation': 'ReLU', 'classification_multiplier': 12009.527422021596}. Best is trial 255 with value: 0.9736842105263158.
[I 2025-08-31 16:31:36,653] Trial 288 finished with value: 0.9543859649122807 and parameters: {'hidden_dim': 1748, 'latent_dim': 33, 'beta': 1.8948494844329546, 'gamma': 1.5720548175689466, 'dropout_rate': 0.1491407812157037, 'lr': 0.0015441059359787668, 'scheduler_patience': 7, 'class_weight': 0.8828014009293957, 'activation': 'ReLU', 'classification_multiplier': 11941.276220195825}. Best is trial 255 with value: 0.9736842105263158.
[I 2025-08-31 16:32:05,042] Trial 289 finished with value: 0.9614035087719298 and parameters: {'hidden_dim': 1757, 'latent_dim': 36, 'beta': 1.9535953211455037, 'gamma': 1.5516309421588925, 'dropout_rate': 0.15684558341789884, 'lr': 0.000617029152133694, 'scheduler_patience': 7, 'class_weight': 0.9062254832508443, 'activation': 'ReLU', 'classification_multiplier': 11657.95189161593}. Best is trial 255 with value: 0.9736842105263158.
[I 2025-08-31 16:32:32,713] Trial 290 finished with value: 0.9456140350877194 and parameters: {'hidden_dim': 1704, 'latent_dim': 38, 'beta': 1.8196044185718547, 'gamma': 1.8397706054834182, 'dropout_rate': 0.14850742420709998, 'lr': 0.005943256449522512, 'scheduler_patience': 7, 'class_weight': 0.8839790793451061, 'activation': 'ReLU', 'classification_multiplier': 11386.965077135555}. Best is trial 255 with value: 0.9736842105263158.
[I 2025-08-31 16:33:01,590] Trial 291 finished with value: 0.9666666666666667 and parameters: {'hidden_dim': 1805, 'latent_dim': 37, 'beta': 1.74802922631786, 'gamma': 1.6240656062251293, 'dropout_rate': 0.1676240962984159, 'lr': 0.00031881829546759593, 'scheduler_patience': 7, 'class_weight': 0.9021391839039199, 'activation': 'ReLU', 'classification_multiplier': 12196.595465423601}. Best is trial 255 with value: 0.9736842105263158.
              precision    recall  f1-score   support

Non-Repeater       0.98      0.99      0.98       159
    Repeater       0.93      0.87      0.90        31

    accuracy                           0.97       190
   macro avg       0.95      0.93      0.94       190
weighted avg       0.97      0.97      0.97       190

Fold 2/3 - Validation Accuracy: 0.9789
Classification Report:
              precision    recall  f1-score   support

Non-Repeater       0.98      0.99      0.99       159
    Repeater       0.97      0.90      0.93        31

    accuracy                           0.98       190
   macro avg       0.97      0.95      0.96       190
weighted avg       0.98      0.98      0.98       190

Fold 3/3 - Validation Accuracy: 0.9632
Classification Report:
              precision    recall  f1-score   support

Non-Repeater       0.97      0.99      0.98       158
    Repeater       0.93      0.84      0.89        32

    accuracy                           0.96       190
   macro avg       0.95      0.92      0.93       190
weighted avg       0.96      0.96      0.96       190

Trial 286 - Average Validation Accuracy: 0.9702
Fold 1/3 - Validation Accuracy: 0.9632
Classification Report:
              precision    recall  f1-score   support

Non-Repeater       0.97      0.98      0.98       159
    Repeater       0.90      0.87      0.89        31

    accuracy                           0.96       190
   macro avg       0.94      0.93      0.93       190
weighted avg       0.96      0.96      0.96       190

Fold 2/3 - Validation Accuracy: 0.9789
Classification Report:
              precision    recall  f1-score   support

Non-Repeater       0.98      0.99      0.99       159
    Repeater       0.97      0.90      0.93        31

    accuracy                           0.98       190
   macro avg       0.97      0.95      0.96       190
weighted avg       0.98      0.98      0.98       190

Fold 3/3 - Validation Accuracy: 0.9737
Classification Report:
              precision    recall  f1-score   support

Non-Repeater       0.99      0.98      0.98       158
    Repeater       0.91      0.94      0.92        32

    accuracy                           0.97       190
   macro avg       0.95      0.96      0.95       190
weighted avg       0.97      0.97      0.97       190

Trial 287 - Average Validation Accuracy: 0.9719
Fold 1/3 - Validation Accuracy: 0.9526
Classification Report:
              precision    recall  f1-score   support

Non-Repeater       0.96      0.99      0.97       159
    Repeater       0.92      0.77      0.84        31

    accuracy                           0.95       190
   macro avg       0.94      0.88      0.91       190
weighted avg       0.95      0.95      0.95       190

Fold 2/3 - Validation Accuracy: 0.9579
Classification Report:
              precision    recall  f1-score   support

Non-Repeater       0.96      0.99      0.98       159
    Repeater       0.96      0.77      0.86        31

    accuracy                           0.96       190
   macro avg       0.96      0.88      0.92       190
weighted avg       0.96      0.96      0.96       190

Fold 3/3 - Validation Accuracy: 0.9526
Classification Report:
              precision    recall  f1-score   support

Non-Repeater       0.97      0.97      0.97       158
    Repeater       0.85      0.88      0.86        32

    accuracy                           0.95       190
   macro avg       0.91      0.92      0.92       190
weighted avg       0.95      0.95      0.95       190

Trial 288 - Average Validation Accuracy: 0.9544
Fold 1/3 - Validation Accuracy: 0.9526
Classification Report:
              precision    recall  f1-score   support

Non-Repeater       0.96      0.98      0.97       159
    Repeater       0.89      0.81      0.85        31

    accuracy                           0.95       190
   macro avg       0.93      0.89      0.91       190
weighted avg       0.95      0.95      0.95       190

Fold 2/3 - Validation Accuracy: 0.9684
Classification Report:
              precision    recall  f1-score   support

Non-Repeater       0.97      0.99      0.98       159
    Repeater       0.96      0.84      0.90        31

    accuracy                           0.97       190
   macro avg       0.97      0.92      0.94       190
weighted avg       0.97      0.97      0.97       190

Fold 3/3 - Validation Accuracy: 0.9632
Classification Report:
              precision    recall  f1-score   support

Non-Repeater       0.98      0.97      0.98       158
    Repeater       0.88      0.91      0.89        32

    accuracy                           0.96       190
   macro avg       0.93      0.94      0.94       190
weighted avg       0.96      0.96      0.96       190

Trial 289 - Average Validation Accuracy: 0.9614
Fold 1/3 - Validation Accuracy: 0.9474
Classification Report:
              precision    recall  f1-score   support

Non-Repeater       0.95      0.99      0.97       159
    Repeater       0.92      0.74      0.82        31

    accuracy                           0.95       190
   macro avg       0.94      0.86      0.90       190
weighted avg       0.95      0.95      0.95       190

Fold 2/3 - Validation Accuracy: 0.9526
Classification Report:
              precision    recall  f1-score   support

Non-Repeater       0.97      0.97      0.97       159
    Repeater       0.87      0.84      0.85        31

    accuracy                           0.95       190
   macro avg       0.92      0.91      0.91       190
weighted avg       0.95      0.95      0.95       190

Fold 3/3 - Validation Accuracy: 0.9368
Classification Report:
              precision    recall  f1-score   support

Non-Repeater       0.96      0.96      0.96       158
    Repeater       0.81      0.81      0.81        32

    accuracy                           0.94       190
   macro avg       0.89      0.89      0.89       190
weighted avg       0.94      0.94      0.94       190

Trial 290 - Average Validation Accuracy: 0.9456
Fold 1/3 - Validation Accuracy: 0.9579
Classification Report:
              precision    recall  f1-score   support

Non-Repeater       0.97      0.98      0.97       159
    Repeater       0.90      0.84      0.87        31

    accuracy                           0.96       190
   macro avg       0.93      0.91      0.92       190
weighted avg       0.96      0.96      0.96       190

Fold 2/3 - Validation Accuracy: 0.9737
Classification Report:
              precision    recall  f1-score   support

Non-Repeater       0.98      0.99      0.98       159
    Repeater       0.96      0.87      0.92        31

    accuracy                           0.97       190
   macro avg       0.97      0.93      0.95       190
weighted avg       0.97      0.97      0.97       190

Fold 3/3 - Validation Accuracy: 0.9684
Classification Report:
              precision    recall  f1-score   support

Non-Repeater       0.98      0.98      0.98       158
    Repeater       0.91      0.91      0.91        32

    accuracy                           0.97       190
   macro avg       0.94      0.94      0.94       190
weighted avg       0.97      0.97      0.97       190

Trial 291 - Average Validation Accuracy: 0.9667
Fold 1/3 - Validation Accuracy: 0.9737
Classification Report:
              precision    recall  f1-score   support

Non-Repeater       0.98      0.99      0.98       159
    Repeater       0.96      0.87      0.92        31

    accuracy                           0.97       190
   macro avg       0.97      0.93      0.95       190
weighted avg       0.97      0.97      0.97       190

Fold 2/3 - Validation Accuracy: 0.9632
Classification Report:
              precision    recall  f1-score   support

Non-Repeater       0.96      0.99      0.98       159
    Repeater       0.96      0.81      0.88        31

    accuracy                           0.96       190
   macro avg       0.96      0.90      0.93       190
weighted avg       0.96      0.96      0.96       190

Fold 3/3 - Validation Accuracy: 0.9579
Classification Report:
[I 2025-08-31 16:33:29,499] Trial 292 finished with value: 0.9649122807017544 and parameters: {'hidden_dim': 1734, 'latent_dim': 40, 'beta': 1.8543919046627872, 'gamma': 1.7943593608447796, 'dropout_rate': 0.16425478900702437, 'lr': 0.0009857449018941956, 'scheduler_patience': 7, 'class_weight': 0.7964974094716217, 'activation': 'ReLU', 'classification_multiplier': 11971.574349666123}. Best is trial 255 with value: 0.9736842105263158.
[I 2025-08-31 16:33:56,586] Trial 293 finished with value: 0.9614035087719298 and parameters: {'hidden_dim': 1650, 'latent_dim': 17, 'beta': 1.9157830769998803, 'gamma': 1.685274421665092, 'dropout_rate': 0.13819286512033155, 'lr': 0.0024482519685645764, 'scheduler_patience': 7, 'class_weight': 0.8225984173511387, 'activation': 'ReLU', 'classification_multiplier': 11901.851138051312}. Best is trial 255 with value: 0.9736842105263158.
[I 2025-08-31 16:34:22,673] Trial 294 finished with value: 0.968421052631579 and parameters: {'hidden_dim': 1461, 'latent_dim': 26, 'beta': 1.6807003439734867, 'gamma': 1.5402270481464502, 'dropout_rate': 0.10811319634669202, 'lr': 0.0004891963956309291, 'scheduler_patience': 7, 'class_weight': 0.9642849050058565, 'activation': 'ReLU', 'classification_multiplier': 11699.739605791332}. Best is trial 255 with value: 0.9736842105263158.
[I 2025-08-31 16:34:48,220] Trial 295 finished with value: 0.968421052631579 and parameters: {'hidden_dim': 1395, 'latent_dim': 38, 'beta': 1.9716911642495016, 'gamma': 1.766424243228909, 'dropout_rate': 0.10002905614386397, 'lr': 0.00027818644753988876, 'scheduler_patience': 7, 'class_weight': 0.9224556164722665, 'activation': 'ReLU', 'classification_multiplier': 12205.664220771323}. Best is trial 255 with value: 0.9736842105263158.
[I 2025-08-31 16:35:14,352] Trial 296 finished with value: 0.9385964912280702 and parameters: {'hidden_dim': 1498, 'latent_dim': 20, 'beta': 1.9988407543185054, 'gamma': 1.9491163498236705, 'dropout_rate': 0.1338322652674913, 'lr': 0.0006558786076489947, 'scheduler_patience': 7, 'class_weight': 0.8458366120653477, 'activation': 'ELU', 'classification_multiplier': 13661.490561423318}. Best is trial 255 with value: 0.9736842105263158.
