[I 2025-08-31 15:53:54,711] Trial 206 finished with value: 0.9631578947368421 and parameters: {'hidden_dim': 1280, 'latent_dim': 40, 'beta': 1.933490384160173, 'gamma': 1.461803546736725, 'dropout_rate': 0.10991496003654294, 'lr': 0.0003522260479547586, 'scheduler_patience': 7, 'class_weight': 0.975637704443609, 'activation': 'ReLU', 'classification_multiplier': 12875.981204399988}. Best is trial 111 with value: 0.9719298245614035.
[I 2025-08-31 15:54:19,109] Trial 207 finished with value: 0.968421052631579 and parameters: {'hidden_dim': 1201, 'latent_dim': 38, 'beta': 1.3916469869259638, 'gamma': 1.77266691829003, 'dropout_rate': 0.12853019988953523, 'lr': 0.0001025743194480655, 'scheduler_patience': 5, 'class_weight': 0.9314154178081111, 'activation': 'ReLU', 'classification_multiplier': 9815.823728903939}. Best is trial 111 with value: 0.9719298245614035.
[I 2025-08-31 15:54:43,478] Trial 208 finished with value: 0.9403508771929824 and parameters: {'hidden_dim': 1235, 'latent_dim': 39, 'beta': 1.8806019651653654, 'gamma': 1.428685371339305, 'dropout_rate': 0.10112180964343588, 'lr': 0.00444559241154529, 'scheduler_patience': 3, 'class_weight': 0.9841061343680714, 'activation': 'LeakyReLU', 'classification_multiplier': 12371.06532393673}. Best is trial 111 with value: 0.9719298245614035.
[I 2025-08-31 15:55:07,285] Trial 209 finished with value: 0.9596491228070175 and parameters: {'hidden_dim': 1125, 'latent_dim': 37, 'beta': 1.6590189379972637, 'gamma': 1.607892680813892, 'dropout_rate': 0.12006399304429502, 'lr': 0.0005745861769519479, 'scheduler_patience': 7, 'class_weight': 0.9571165909153557, 'activation': 'ReLU', 'classification_multiplier': 12618.754120591288}. Best is trial 111 with value: 0.9719298245614035.
[I 2025-08-31 15:55:31,130] Trial 210 finished with value: 0.9649122807017544 and parameters: {'hidden_dim': 1160, 'latent_dim': 39, 'beta': 1.9395581176285734, 'gamma': 1.3499104435223332, 'dropout_rate': 0.13825084297211193, 'lr': 0.00040187903517532994, 'scheduler_patience': 7, 'class_weight': 0.9994674395969327, 'activation': 'ReLU', 'classification_multiplier': 12146.485531051954}. Best is trial 111 with value: 0.9719298245614035.
[I 2025-08-31 15:55:58,903] Trial 211 finished with value: 0.9666666666666667 and parameters: {'hidden_dim': 1713, 'latent_dim': 38, 'beta': 1.9985517869573795, 'gamma': 1.8331556449046582, 'dropout_rate': 0.1128622618645353, 'lr': 0.0002694827395819974, 'scheduler_patience': 7, 'class_weight': 0.473448505735329, 'activation': 'ReLU', 'classification_multiplier': 11673.105685827288}. Best is trial 111 with value: 0.9719298245614035.
              precision    recall  f1-score   support

Non-Repeater       0.97      0.97      0.97       159
    Repeater       0.87      0.87      0.87        31

    accuracy                           0.96       190
   macro avg       0.92      0.92      0.92       190
weighted avg       0.96      0.96      0.96       190

Fold 2/3 - Validation Accuracy: 0.9789
Classification Report:
              precision    recall  f1-score   support

Non-Repeater       0.98      0.99      0.99       159
    Repeater       0.97      0.90      0.93        31

    accuracy                           0.98       190
   macro avg       0.97      0.95      0.96       190
weighted avg       0.98      0.98      0.98       190

Fold 3/3 - Validation Accuracy: 0.9526
Classification Report:
              precision    recall  f1-score   support

Non-Repeater       0.97      0.97      0.97       158
    Repeater       0.87      0.84      0.86        32

    accuracy                           0.95       190
   macro avg       0.92      0.91      0.91       190
weighted avg       0.95      0.95      0.95       190

Trial 206 - Average Validation Accuracy: 0.9632
Fold 1/3 - Validation Accuracy: 0.9579
Classification Report:
              precision    recall  f1-score   support

Non-Repeater       0.97      0.98      0.97       159
    Repeater       0.90      0.84      0.87        31

    accuracy                           0.96       190
   macro avg       0.93      0.91      0.92       190
weighted avg       0.96      0.96      0.96       190

Fold 2/3 - Validation Accuracy: 0.9789
Classification Report:
              precision    recall  f1-score   support

Non-Repeater       0.98      0.99      0.99       159
    Repeater       0.97      0.90      0.93        31

    accuracy                           0.98       190
   macro avg       0.97      0.95      0.96       190
weighted avg       0.98      0.98      0.98       190

Fold 3/3 - Validation Accuracy: 0.9684
Classification Report:
              precision    recall  f1-score   support

Non-Repeater       0.97      0.99      0.98       158
    Repeater       0.93      0.88      0.90        32

    accuracy                           0.97       190
   macro avg       0.95      0.93      0.94       190
weighted avg       0.97      0.97      0.97       190

Trial 207 - Average Validation Accuracy: 0.9684
Fold 1/3 - Validation Accuracy: 0.9316
Classification Report:
              precision    recall  f1-score   support

Non-Repeater       0.95      0.97      0.96       159
    Repeater       0.82      0.74      0.78        31

    accuracy                           0.93       190
   macro avg       0.89      0.86      0.87       190
weighted avg       0.93      0.93      0.93       190

Fold 2/3 - Validation Accuracy: 0.9421
Classification Report:
              precision    recall  f1-score   support

Non-Repeater       0.95      0.98      0.97       159
    Repeater       0.88      0.74      0.81        31

    accuracy                           0.94       190
   macro avg       0.92      0.86      0.89       190
weighted avg       0.94      0.94      0.94       190

Fold 3/3 - Validation Accuracy: 0.9474
Classification Report:
              precision    recall  f1-score   support

Non-Repeater       0.97      0.97      0.97       158
    Repeater       0.84      0.84      0.84        32

    accuracy                           0.95       190
   macro avg       0.91      0.91      0.91       190
weighted avg       0.95      0.95      0.95       190

Trial 208 - Average Validation Accuracy: 0.9404
Fold 1/3 - Validation Accuracy: 0.9579
Classification Report:
              precision    recall  f1-score   support

Non-Repeater       0.97      0.97      0.97       159
    Repeater       0.87      0.87      0.87        31

    accuracy                           0.96       190
   macro avg       0.92      0.92      0.92       190
weighted avg       0.96      0.96      0.96       190

Fold 2/3 - Validation Accuracy: 0.9684
Classification Report:
              precision    recall  f1-score   support

Non-Repeater       0.97      0.99      0.98       159
    Repeater       0.96      0.84      0.90        31

    accuracy                           0.97       190
   macro avg       0.97      0.92      0.94       190
weighted avg       0.97      0.97      0.97       190

Fold 3/3 - Validation Accuracy: 0.9526
Classification Report:
              precision    recall  f1-score   support

Non-Repeater       0.97      0.97      0.97       158
    Repeater       0.87      0.84      0.86        32

    accuracy                           0.95       190
   macro avg       0.92      0.91      0.91       190
weighted avg       0.95      0.95      0.95       190

Trial 209 - Average Validation Accuracy: 0.9596
Fold 1/3 - Validation Accuracy: 0.9474
Classification Report:
              precision    recall  f1-score   support

Non-Repeater       0.97      0.96      0.97       159
    Repeater       0.82      0.87      0.84        31

    accuracy                           0.95       190
   macro avg       0.90      0.92      0.91       190
weighted avg       0.95      0.95      0.95       190

Fold 2/3 - Validation Accuracy: 0.9789
Classification Report:
              precision    recall  f1-score   support

Non-Repeater       0.98      0.99      0.99       159
    Repeater       0.97      0.90      0.93        31

    accuracy                           0.98       190
   macro avg       0.97      0.95      0.96       190
weighted avg       0.98      0.98      0.98       190

Fold 3/3 - Validation Accuracy: 0.9684
Classification Report:
              precision    recall  f1-score   support

Non-Repeater       0.98      0.98      0.98       158
    Repeater       0.91      0.91      0.91        32

    accuracy                           0.97       190
   macro avg       0.94      0.94      0.94       190
weighted avg       0.97      0.97      0.97       190

Trial 210 - Average Validation Accuracy: 0.9649
Fold 1/3 - Validation Accuracy: 0.9632
Classification Report:
              precision    recall  f1-score   support

Non-Repeater       0.97      0.99      0.98       159
    Repeater       0.93      0.84      0.88        31

    accuracy                           0.96       190
   macro avg       0.95      0.91      0.93       190
weighted avg       0.96      0.96      0.96       190

Fold 2/3 - Validation Accuracy: 0.9684
Classification Report:
              precision    recall  f1-score   support

Non-Repeater       0.97      0.99      0.98       159
    Repeater       0.96      0.84      0.90        31

    accuracy                           0.97       190
   macro avg       0.97      0.92      0.94       190
weighted avg       0.97      0.97      0.97       190

Fold 3/3 - Validation Accuracy: 0.9684
Classification Report:
              precision    recall  f1-score   support

Non-Repeater       0.96      1.00      0.98       158
    Repeater       1.00      0.81      0.90        32

    accuracy                           0.97       190
   macro avg       0.98      0.91      0.94       190
weighted avg       0.97      0.97      0.97       190

Trial 211 - Average Validation Accuracy: 0.9667
Fold 1/3 - Validation Accuracy: 0.9526
Classification Report:
              precision    recall  f1-score   support

Non-Repeater       0.97      0.97      0.97       159
    Repeater       0.84      0.87      0.86        31

    accuracy                           0.95       190
   macro avg       0.91      0.92      0.91       190
weighted avg       0.95      0.95      0.95       190

Fold 2/3 - Validation Accuracy: 0.9789
Classification Report:
              precision    recall  f1-score   support

Non-Repeater       0.98      0.99      0.99       159
    Repeater       0.97      0.90      0.93        31

    accuracy                           0.98       190
   macro avg       0.97      0.95      0.96       190
weighted avg       0.98      0.98      0.98       190

Fold 3/3 - Validation Accuracy: 0.9579
Classification Report:
[I 2025-08-31 15:56:22,220] Trial 212 finished with value: 0.9631578947368421 and parameters: {'hidden_dim': 1083, 'latent_dim': 38, 'beta': 1.2629144115449362, 'gamma': 1.7892418724180248, 'dropout_rate': 0.13140643344075847, 'lr': 0.00010688573219844866, 'scheduler_patience': 7, 'class_weight': 0.9380047558157605, 'activation': 'ReLU', 'classification_multiplier': 12365.133545801118}. Best is trial 111 with value: 0.9719298245614035.
[I 2025-08-31 15:56:52,960] Trial 213 finished with value: 0.9631578947368421 and parameters: {'hidden_dim': 1681, 'latent_dim': 40, 'beta': 1.9616291946201942, 'gamma': 1.8586887283246907, 'dropout_rate': 0.14393289248302021, 'lr': 0.000601451483723756, 'scheduler_patience': 7, 'class_weight': 0.9184585358772874, 'activation': 'ReLU', 'classification_multiplier': 11945.91701479135}. Best is trial 111 with value: 0.9719298245614035.
[I 2025-08-31 15:57:19,399] Trial 214 finished with value: 0.968421052631579 and parameters: {'hidden_dim': 1526, 'latent_dim': 39, 'beta': 1.5555866579113413, 'gamma': 1.5646064004734994, 'dropout_rate': 0.12112398896008678, 'lr': 0.0001034506118528528, 'scheduler_patience': 7, 'class_weight': 0.9601765150401333, 'activation': 'ReLU', 'classification_multiplier': 12844.71604327581}. Best is trial 111 with value: 0.9719298245614035.
[I 2025-08-31 15:57:49,374] Trial 215 finished with value: 0.9614035087719298 and parameters: {'hidden_dim': 1635, 'latent_dim': 37, 'beta': 1.9587069901035408, 'gamma': 1.7657409203369343, 'dropout_rate': 0.16071806763892993, 'lr': 0.0004189899836362035, 'scheduler_patience': 7, 'class_weight': 0.8992318614783629, 'activation': 'ReLU', 'classification_multiplier': 12583.814265080955}. Best is trial 111 with value: 0.9719298245614035.
[I 2025-08-31 15:58:16,483] Trial 216 finished with value: 0.9526315789473684 and parameters: {'hidden_dim': 1289, 'latent_dim': 38, 'beta': 1.8946665900538127, 'gamma': 1.5048630137752546, 'dropout_rate': 0.11471218621875261, 'lr': 0.00027150227235270215, 'scheduler_patience': 7, 'class_weight': 0.9447768849780089, 'activation': 'GELU', 'classification_multiplier': 11770.579442520186}. Best is trial 111 with value: 0.9719298245614035.
[I 2025-08-31 15:58:44,106] Trial 217 finished with value: 0.9614035087719298 and parameters: {'hidden_dim': 1579, 'latent_dim': 40, 'beta': 1.9291446899536366, 'gamma': 1.7092122478846743, 'dropout_rate': 0.13502535804105784, 'lr': 0.0009007667181047017, 'scheduler_patience': 7, 'class_weight': 0.9784813121261388, 'activation': 'ReLU', 'classification_multiplier': 9115.33468427453}. Best is trial 111 with value: 0.9719298245614035.
[I 2025-08-31 15:59:17,767] Trial 218 finished with value: 0.9596491228070175 and parameters: {'hidden_dim': 1948, 'latent_dim': 39, 'beta': 1.9626447503970375, 'gamma': 1.6503939409933233, 'dropout_rate': 0.1261655649514707, 'lr': 0.0006845466922996543, 'scheduler_patience': 7, 'class_weight': 0.9203995969709106, 'activation': 'ReLU', 'classification_multiplier': 11062.732899193947}. Best is trial 111 with value: 0.9719298245614035.
              precision    recall  f1-score   support

Non-Repeater       0.99      0.96      0.97       158
    Repeater       0.83      0.94      0.88        32

    accuracy                           0.96       190
   macro avg       0.91      0.95      0.93       190
weighted avg       0.96      0.96      0.96       190

Trial 212 - Average Validation Accuracy: 0.9632
Fold 1/3 - Validation Accuracy: 0.9526
Classification Report:
              precision    recall  f1-score   support

Non-Repeater       0.96      0.99      0.97       159
    Repeater       0.92      0.77      0.84        31

    accuracy                           0.95       190
   macro avg       0.94      0.88      0.91       190
weighted avg       0.95      0.95      0.95       190

Fold 2/3 - Validation Accuracy: 0.9789
Classification Report:
              precision    recall  f1-score   support

Non-Repeater       0.98      0.99      0.99       159
    Repeater       0.97      0.90      0.93        31

    accuracy                           0.98       190
   macro avg       0.97      0.95      0.96       190
weighted avg       0.98      0.98      0.98       190

Fold 3/3 - Validation Accuracy: 0.9579
Classification Report:
              precision    recall  f1-score   support

Non-Repeater       0.97      0.98      0.97       158
    Repeater       0.90      0.84      0.87        32

    accuracy                           0.96       190
   macro avg       0.93      0.91      0.92       190
weighted avg       0.96      0.96      0.96       190

Trial 213 - Average Validation Accuracy: 0.9632
Fold 1/3 - Validation Accuracy: 0.9474
Classification Report:
              precision    recall  f1-score   support

Non-Repeater       0.97      0.97      0.97       159
    Repeater       0.84      0.84      0.84        31

    accuracy                           0.95       190
   macro avg       0.90      0.90      0.90       190
weighted avg       0.95      0.95      0.95       190

Fold 2/3 - Validation Accuracy: 0.9842
Classification Report:
              precision    recall  f1-score   support

Non-Repeater       0.99      0.99      0.99       159
    Repeater       0.97      0.94      0.95        31

    accuracy                           0.98       190
   macro avg       0.98      0.96      0.97       190
weighted avg       0.98      0.98      0.98       190

Fold 3/3 - Validation Accuracy: 0.9737
Classification Report:
              precision    recall  f1-score   support

Non-Repeater       0.99      0.98      0.98       158
    Repeater       0.91      0.94      0.92        32

    accuracy                           0.97       190
   macro avg       0.95      0.96      0.95       190
weighted avg       0.97      0.97      0.97       190

Trial 214 - Average Validation Accuracy: 0.9684
Fold 1/3 - Validation Accuracy: 0.9368
Classification Report:
              precision    recall  f1-score   support

Non-Repeater       0.96      0.97      0.96       159
    Repeater       0.83      0.77      0.80        31

    accuracy                           0.94       190
   macro avg       0.89      0.87      0.88       190
weighted avg       0.94      0.94      0.94       190

Fold 2/3 - Validation Accuracy: 0.9789
Classification Report:
              precision    recall  f1-score   support

Non-Repeater       0.98      0.99      0.99       159
    Repeater       0.97      0.90      0.93        31

    accuracy                           0.98       190
   macro avg       0.97      0.95      0.96       190
weighted avg       0.98      0.98      0.98       190

Fold 3/3 - Validation Accuracy: 0.9684
Classification Report:
              precision    recall  f1-score   support

Non-Repeater       0.98      0.98      0.98       158
    Repeater       0.91      0.91      0.91        32

    accuracy                           0.97       190
   macro avg       0.94      0.94      0.94       190
weighted avg       0.97      0.97      0.97       190

Trial 215 - Average Validation Accuracy: 0.9614
Fold 1/3 - Validation Accuracy: 0.9421
Classification Report:
              precision    recall  f1-score   support

Non-Repeater       0.96      0.97      0.97       159
    Repeater       0.86      0.77      0.81        31

    accuracy                           0.94       190
   macro avg       0.91      0.87      0.89       190
weighted avg       0.94      0.94      0.94       190

Fold 2/3 - Validation Accuracy: 0.9579
Classification Report:
              precision    recall  f1-score   support

Non-Repeater       0.96      0.99      0.98       159
    Repeater       0.93      0.81      0.86        31

    accuracy                           0.96       190
   macro avg       0.94      0.90      0.92       190
weighted avg       0.96      0.96      0.96       190

Fold 3/3 - Validation Accuracy: 0.9579
Classification Report:
              precision    recall  f1-score   support

Non-Repeater       0.96      0.99      0.97       158
    Repeater       0.93      0.81      0.87        32

    accuracy                           0.96       190
   macro avg       0.95      0.90      0.92       190
weighted avg       0.96      0.96      0.96       190

Trial 216 - Average Validation Accuracy: 0.9526
Fold 1/3 - Validation Accuracy: 0.9526
Classification Report:
              precision    recall  f1-score   support

Non-Repeater       0.97      0.97      0.97       159
    Repeater       0.87      0.84      0.85        31

    accuracy                           0.95       190
   macro avg       0.92      0.91      0.91       190
weighted avg       0.95      0.95      0.95       190

Fold 2/3 - Validation Accuracy: 0.9684
Classification Report:
              precision    recall  f1-score   support

Non-Repeater       0.97      0.99      0.98       159
    Repeater       0.96      0.84      0.90        31

    accuracy                           0.97       190
   macro avg       0.97      0.92      0.94       190
weighted avg       0.97      0.97      0.97       190

Fold 3/3 - Validation Accuracy: 0.9632
Classification Report:
              precision    recall  f1-score   support

Non-Repeater       0.96      0.99      0.98       158
    Repeater       0.96      0.81      0.88        32

    accuracy                           0.96       190
   macro avg       0.96      0.90      0.93       190
weighted avg       0.96      0.96      0.96       190

Trial 217 - Average Validation Accuracy: 0.9614
Fold 1/3 - Validation Accuracy: 0.9579
Classification Report:
              precision    recall  f1-score   support

Non-Repeater       0.97      0.97      0.97       159
    Repeater       0.87      0.87      0.87        31

    accuracy                           0.96       190
   macro avg       0.92      0.92      0.92       190
weighted avg       0.96      0.96      0.96       190

Fold 2/3 - Validation Accuracy: 0.9632
Classification Report:
              precision    recall  f1-score   support

Non-Repeater       0.96      0.99      0.98       159
    Repeater       0.96      0.81      0.88        31

    accuracy                           0.96       190
   macro avg       0.96      0.90      0.93       190
weighted avg       0.96      0.96      0.96       190

Fold 3/3 - Validation Accuracy: 0.9579
Classification Report:
              precision    recall  f1-score   support

Non-Repeater       0.97      0.97      0.97       158
    Repeater       0.88      0.88      0.88        32

    accuracy                           0.96       190
   macro avg       0.92      0.92      0.92       190
weighted avg       0.96      0.96      0.96       190

Trial 218 - Average Validation Accuracy: 0.9596
Fold 1/3 - Validation Accuracy: 0.9526
Classification Report:
              precision    recall  f1-score   support

Non-Repeater       0.96      0.98      0.97       159
    Repeater       0.89      0.81      0.85        31

    accuracy                           0.95       190
   macro avg       0.93      0.89      0.91       190
weighted avg       0.95      0.95      0.95       190

Fold 2/3 - Validation Accuracy: 0.9737
Classification Report:
