[I 2025-08-31 15:48:35,320] Trial 193 finished with value: 0.968421052631579 and parameters: {'hidden_dim': 1340, 'latent_dim': 29, 'beta': 1.9356727303742853, 'gamma': 1.8744443925489993, 'dropout_rate': 0.1368226746424003, 'lr': 0.00010881032796603669, 'scheduler_patience': 7, 'class_weight': 0.9330630233319608, 'activation': 'ReLU', 'classification_multiplier': 12328.55627600089}. Best is trial 111 with value: 0.9719298245614035.
[I 2025-08-31 15:49:03,227] Trial 194 finished with value: 0.9649122807017544 and parameters: {'hidden_dim': 1733, 'latent_dim': 16, 'beta': 1.916441722641027, 'gamma': 1.8108955726992078, 'dropout_rate': 0.14627546161730515, 'lr': 0.0004917096393846754, 'scheduler_patience': 7, 'class_weight': 0.9787637035413792, 'activation': 'ReLU', 'classification_multiplier': 10242.099046227713}. Best is trial 111 with value: 0.9719298245614035.
[I 2025-08-31 15:49:27,603] Trial 195 finished with value: 0.936842105263158 and parameters: {'hidden_dim': 1266, 'latent_dim': 36, 'beta': 1.9719226761545243, 'gamma': 1.6918790697597654, 'dropout_rate': 0.11458880322232144, 'lr': 0.0007474309908988991, 'scheduler_patience': 7, 'class_weight': 0.9604820130876338, 'activation': 'ELU', 'classification_multiplier': 11849.143141987577}. Best is trial 111 with value: 0.9719298245614035.
[I 2025-08-31 15:49:52,364] Trial 196 finished with value: 0.9596491228070175 and parameters: {'hidden_dim': 1312, 'latent_dim': 37, 'beta': 1.786214003418341, 'gamma': 1.5465030475782373, 'dropout_rate': 0.17368738369849532, 'lr': 0.0036020845848487113, 'scheduler_patience': 7, 'class_weight': 0.9115707886092326, 'activation': 'ReLU', 'classification_multiplier': 12103.111723026035}. Best is trial 111 with value: 0.9719298245614035.
[I 2025-08-31 15:50:16,384] Trial 197 finished with value: 0.9701754385964912 and parameters: {'hidden_dim': 1195, 'latent_dim': 39, 'beta': 1.3739394676065113, 'gamma': 1.6457945551344106, 'dropout_rate': 0.12387243333692884, 'lr': 0.00028080293021549515, 'scheduler_patience': 7, 'class_weight': 0.9774384670377879, 'activation': 'ReLU', 'classification_multiplier': 12582.206709655298}. Best is trial 111 with value: 0.9719298245614035.
[I 2025-08-31 15:50:40,729] Trial 198 finished with value: 0.9684210526315788 and parameters: {'hidden_dim': 1168, 'latent_dim': 39, 'beta': 1.7271831084105103, 'gamma': 1.6583019091263933, 'dropout_rate': 0.132623448714466, 'lr': 0.0003068161517836984, 'scheduler_patience': 7, 'class_weight': 0.9841257681781621, 'activation': 'ReLU', 'classification_multiplier': 5418.177531452787}. Best is trial 111 with value: 0.9719298245614035.
              precision    recall  f1-score   support

Non-Repeater       0.97      0.99      0.98       158
    Repeater       0.93      0.88      0.90        32

    accuracy                           0.97       190
   macro avg       0.95      0.93      0.94       190
weighted avg       0.97      0.97      0.97       190

Trial 192 - Average Validation Accuracy: 0.9632
Fold 1/3 - Validation Accuracy: 0.9526
Classification Report:
              precision    recall  f1-score   support

Non-Repeater       0.97      0.97      0.97       159
    Repeater       0.87      0.84      0.85        31

    accuracy                           0.95       190
   macro avg       0.92      0.91      0.91       190
weighted avg       0.95      0.95      0.95       190

Fold 2/3 - Validation Accuracy: 0.9789
Classification Report:
              precision    recall  f1-score   support

Non-Repeater       0.98      0.99      0.99       159
    Repeater       0.97      0.90      0.93        31

    accuracy                           0.98       190
   macro avg       0.97      0.95      0.96       190
weighted avg       0.98      0.98      0.98       190

Fold 3/3 - Validation Accuracy: 0.9737
Classification Report:
              precision    recall  f1-score   support

Non-Repeater       0.98      0.99      0.98       158
    Repeater       0.94      0.91      0.92        32

    accuracy                           0.97       190
   macro avg       0.96      0.95      0.95       190
weighted avg       0.97      0.97      0.97       190

Trial 193 - Average Validation Accuracy: 0.9684
Fold 1/3 - Validation Accuracy: 0.9474
Classification Report:
              precision    recall  f1-score   support

Non-Repeater       0.97      0.97      0.97       159
    Repeater       0.84      0.84      0.84        31

    accuracy                           0.95       190
   macro avg       0.90      0.90      0.90       190
weighted avg       0.95      0.95      0.95       190

Fold 2/3 - Validation Accuracy: 0.9789
Classification Report:
              precision    recall  f1-score   support

Non-Repeater       0.98      0.99      0.99       159
    Repeater       0.97      0.90      0.93        31

    accuracy                           0.98       190
   macro avg       0.97      0.95      0.96       190
weighted avg       0.98      0.98      0.98       190

Fold 3/3 - Validation Accuracy: 0.9684
Classification Report:
              precision    recall  f1-score   support

Non-Repeater       0.98      0.98      0.98       158
    Repeater       0.91      0.91      0.91        32

    accuracy                           0.97       190
   macro avg       0.94      0.94      0.94       190
weighted avg       0.97      0.97      0.97       190

Trial 194 - Average Validation Accuracy: 0.9649
Fold 1/3 - Validation Accuracy: 0.9316
Classification Report:
              precision    recall  f1-score   support

Non-Repeater       0.95      0.97      0.96       159
    Repeater       0.82      0.74      0.78        31

    accuracy                           0.93       190
   macro avg       0.89      0.86      0.87       190
weighted avg       0.93      0.93      0.93       190

Fold 2/3 - Validation Accuracy: 0.9368
Classification Report:
              precision    recall  f1-score   support

Non-Repeater       0.95      0.97      0.96       159
    Repeater       0.85      0.74      0.79        31

    accuracy                           0.94       190
   macro avg       0.90      0.86      0.88       190
weighted avg       0.93      0.94      0.94       190

Fold 3/3 - Validation Accuracy: 0.9421
Classification Report:
              precision    recall  f1-score   support

Non-Repeater       0.96      0.97      0.97       158
    Repeater       0.84      0.81      0.83        32

    accuracy                           0.94       190
   macro avg       0.90      0.89      0.90       190
weighted avg       0.94      0.94      0.94       190

Trial 195 - Average Validation Accuracy: 0.9368
Fold 1/3 - Validation Accuracy: 0.9579
Classification Report:
              precision    recall  f1-score   support

Non-Repeater       0.96      0.99      0.98       159
    Repeater       0.96      0.77      0.86        31

    accuracy                           0.96       190
   macro avg       0.96      0.88      0.92       190
weighted avg       0.96      0.96      0.96       190

Fold 2/3 - Validation Accuracy: 0.9684
Classification Report:
              precision    recall  f1-score   support

Non-Repeater       0.98      0.99      0.98       159
    Repeater       0.93      0.87      0.90        31

    accuracy                           0.97       190
   macro avg       0.95      0.93      0.94       190
weighted avg       0.97      0.97      0.97       190

Fold 3/3 - Validation Accuracy: 0.9526
Classification Report:
              precision    recall  f1-score   support

Non-Repeater       0.97      0.97      0.97       158
    Repeater       0.87      0.84      0.86        32

    accuracy                           0.95       190
   macro avg       0.92      0.91      0.91       190
weighted avg       0.95      0.95      0.95       190

Trial 196 - Average Validation Accuracy: 0.9596
Fold 1/3 - Validation Accuracy: 0.9632
Classification Report:
              precision    recall  f1-score   support

Non-Repeater       0.97      0.98      0.98       159
    Repeater       0.90      0.87      0.89        31

    accuracy                           0.96       190
   macro avg       0.94      0.93      0.93       190
weighted avg       0.96      0.96      0.96       190

Fold 2/3 - Validation Accuracy: 0.9789
Classification Report:
              precision    recall  f1-score   support

Non-Repeater       0.98      0.99      0.99       159
    Repeater       0.97      0.90      0.93        31

    accuracy                           0.98       190
   macro avg       0.97      0.95      0.96       190
weighted avg       0.98      0.98      0.98       190

Fold 3/3 - Validation Accuracy: 0.9684
Classification Report:
              precision    recall  f1-score   support

Non-Repeater       0.99      0.97      0.98       158
    Repeater       0.88      0.94      0.91        32

    accuracy                           0.97       190
   macro avg       0.93      0.96      0.94       190
weighted avg       0.97      0.97      0.97       190

Trial 197 - Average Validation Accuracy: 0.9702
Fold 1/3 - Validation Accuracy: 0.9526
Classification Report:
              precision    recall  f1-score   support

Non-Repeater       0.97      0.97      0.97       159
    Repeater       0.87      0.84      0.85        31

    accuracy                           0.95       190
   macro avg       0.92      0.91      0.91       190
weighted avg       0.95      0.95      0.95       190

Fold 2/3 - Validation Accuracy: 0.9842
Classification Report:
              precision    recall  f1-score   support

Non-Repeater       0.99      0.99      0.99       159
    Repeater       0.97      0.94      0.95        31

    accuracy                           0.98       190
   macro avg       0.98      0.96      0.97       190
weighted avg       0.98      0.98      0.98       190

Fold 3/3 - Validation Accuracy: 0.9684
Classification Report:
              precision    recall  f1-score   support

Non-Repeater       0.97      0.99      0.98       158
    Repeater       0.93      0.88      0.90        32

    accuracy                           0.97       190
   macro avg       0.95      0.93      0.94       190
weighted avg       0.97      0.97      0.97       190

Trial 198 - Average Validation Accuracy: 0.9684
Fold 1/3 - Validation Accuracy: 0.9421
Classification Report:
              precision    recall  f1-score   support

Non-Repeater       0.96      0.97      0.97       159
    Repeater       0.86      0.77      0.81        31

    accuracy                           0.94       190
   macro avg       0.91      0.87      0.89       190
weighted avg       0.94      0.94      0.94       190

Fold 2/3 - Validation Accuracy: 0.9684
Classification Report:
[I 2025-08-31 15:51:04,573] Trial 199 finished with value: 0.9578947368421052 and parameters: {'hidden_dim': 1198, 'latent_dim': 40, 'beta': 1.4468944905579657, 'gamma': 1.6402448339739077, 'dropout_rate': 0.15252638047931116, 'lr': 0.000301413305366247, 'scheduler_patience': 7, 'class_weight': 0.9588260855439543, 'activation': 'ReLU', 'classification_multiplier': 12434.02368279087}. Best is trial 111 with value: 0.9719298245614035.
[I 2025-08-31 15:51:28,098] Trial 200 finished with value: 0.9350877192982456 and parameters: {'hidden_dim': 1128, 'latent_dim': 38, 'beta': 1.8731520637551955, 'gamma': 1.5927318361121152, 'dropout_rate': 0.1047721123116372, 'lr': 0.00046017931275781093, 'scheduler_patience': 7, 'class_weight': 0.9998324598920518, 'activation': 'SELU', 'classification_multiplier': 11365.970152065098}. Best is trial 111 with value: 0.9719298245614035.
[I 2025-08-31 15:51:52,320] Trial 201 finished with value: 0.9701754385964912 and parameters: {'hidden_dim': 1242, 'latent_dim': 39, 'beta': 1.940582158367434, 'gamma': 1.4876367144787883, 'dropout_rate': 0.1237135329482362, 'lr': 0.00010821813531456663, 'scheduler_patience': 7, 'class_weight': 0.9366464570019485, 'activation': 'ReLU', 'classification_multiplier': 12494.967304133188}. Best is trial 111 with value: 0.9719298245614035.
[I 2025-08-31 15:52:16,467] Trial 202 finished with value: 0.9719298245614035 and parameters: {'hidden_dim': 1228, 'latent_dim': 39, 'beta': 1.9373083127840138, 'gamma': 1.7370713692881374, 'dropout_rate': 0.1164919440760003, 'lr': 0.0001002479302808126, 'scheduler_patience': 7, 'class_weight': 0.9724669852599208, 'activation': 'ReLU', 'classification_multiplier': 12606.667555975682}. Best is trial 111 with value: 0.9719298245614035.
[I 2025-08-31 15:52:40,474] Trial 203 finished with value: 0.9456140350877194 and parameters: {'hidden_dim': 1224, 'latent_dim': 39, 'beta': 1.8414821634911274, 'gamma': 1.7222385536678824, 'dropout_rate': 0.3943427087878556, 'lr': 0.0002814374357064903, 'scheduler_patience': 7, 'class_weight': 0.9750990108483809, 'activation': 'ReLU', 'classification_multiplier': 12722.770565223127}. Best is trial 111 with value: 0.9719298245614035.
[I 2025-08-31 15:53:05,364] Trial 204 finished with value: 0.9666666666666667 and parameters: {'hidden_dim': 1194, 'latent_dim': 40, 'beta': 1.9068770841936968, 'gamma': 1.7380962584460873, 'dropout_rate': 0.11681378943510416, 'lr': 0.0001218072191648747, 'scheduler_patience': 7, 'class_weight': 0.9709925191248653, 'activation': 'ReLU', 'classification_multiplier': 12536.074411579539}. Best is trial 111 with value: 0.9719298245614035.
[I 2025-08-31 15:53:29,991] Trial 205 finished with value: 0.9649122807017544 and parameters: {'hidden_dim': 1246, 'latent_dim': 39, 'beta': 1.3204114768702104, 'gamma': 1.6841513370982237, 'dropout_rate': 0.12424615586339514, 'lr': 0.0005723011725049747, 'scheduler_patience': 7, 'class_weight': 0.9489469047318281, 'activation': 'ReLU', 'classification_multiplier': 12667.486149695704}. Best is trial 111 with value: 0.9719298245614035.
              precision    recall  f1-score   support

Non-Repeater       0.98      0.99      0.98       159
    Repeater       0.93      0.87      0.90        31

    accuracy                           0.97       190
   macro avg       0.95      0.93      0.94       190
weighted avg       0.97      0.97      0.97       190

Fold 3/3 - Validation Accuracy: 0.9632
Classification Report:
              precision    recall  f1-score   support

Non-Repeater       0.98      0.97      0.98       158
    Repeater       0.88      0.91      0.89        32

    accuracy                           0.96       190
   macro avg       0.93      0.94      0.94       190
weighted avg       0.96      0.96      0.96       190

Trial 199 - Average Validation Accuracy: 0.9579
Fold 1/3 - Validation Accuracy: 0.9263
Classification Report:
              precision    recall  f1-score   support

Non-Repeater       0.95      0.96      0.96       159
    Repeater       0.79      0.74      0.77        31

    accuracy                           0.93       190
   macro avg       0.87      0.85      0.86       190
weighted avg       0.92      0.93      0.93       190

Fold 2/3 - Validation Accuracy: 0.9421
Classification Report:
              precision    recall  f1-score   support

Non-Repeater       0.95      0.99      0.97       159
    Repeater       0.92      0.71      0.80        31

    accuracy                           0.94       190
   macro avg       0.93      0.85      0.88       190
weighted avg       0.94      0.94      0.94       190

Fold 3/3 - Validation Accuracy: 0.9368
Classification Report:
              precision    recall  f1-score   support

Non-Repeater       0.96      0.97      0.96       158
    Repeater       0.83      0.78      0.81        32

    accuracy                           0.94       190
   macro avg       0.89      0.87      0.88       190
weighted avg       0.94      0.94      0.94       190

Trial 200 - Average Validation Accuracy: 0.9351
Fold 1/3 - Validation Accuracy: 0.9579
Classification Report:
              precision    recall  f1-score   support

Non-Repeater       0.97      0.98      0.97       159
    Repeater       0.90      0.84      0.87        31

    accuracy                           0.96       190
   macro avg       0.93      0.91      0.92       190
weighted avg       0.96      0.96      0.96       190

Fold 2/3 - Validation Accuracy: 0.9842
Classification Report:
              precision    recall  f1-score   support

Non-Repeater       0.99      0.99      0.99       159
    Repeater       0.97      0.94      0.95        31

    accuracy                           0.98       190
   macro avg       0.98      0.96      0.97       190
weighted avg       0.98      0.98      0.98       190

Fold 3/3 - Validation Accuracy: 0.9684
Classification Report:
              precision    recall  f1-score   support

Non-Repeater       0.98      0.98      0.98       158
    Repeater       0.91      0.91      0.91        32

    accuracy                           0.97       190
   macro avg       0.94      0.94      0.94       190
weighted avg       0.97      0.97      0.97       190

Trial 201 - Average Validation Accuracy: 0.9702
Fold 1/3 - Validation Accuracy: 0.9579
Classification Report:
              precision    recall  f1-score   support

Non-Repeater       0.97      0.98      0.97       159
    Repeater       0.90      0.84      0.87        31

    accuracy                           0.96       190
   macro avg       0.93      0.91      0.92       190
weighted avg       0.96      0.96      0.96       190

Fold 2/3 - Validation Accuracy: 0.9789
Classification Report:
              precision    recall  f1-score   support

Non-Repeater       0.98      0.99      0.99       159
    Repeater       0.97      0.90      0.93        31

    accuracy                           0.98       190
   macro avg       0.97      0.95      0.96       190
weighted avg       0.98      0.98      0.98       190

Fold 3/3 - Validation Accuracy: 0.9789
Classification Report:
              precision    recall  f1-score   support

Non-Repeater       0.99      0.99      0.99       158
    Repeater       0.94      0.94      0.94        32

    accuracy                           0.98       190
   macro avg       0.96      0.96      0.96       190
weighted avg       0.98      0.98      0.98       190

Trial 202 - Average Validation Accuracy: 0.9719
Fold 1/3 - Validation Accuracy: 0.9263
Classification Report:
              precision    recall  f1-score   support

Non-Repeater       0.96      0.96      0.96       159
    Repeater       0.77      0.77      0.77        31

    accuracy                           0.93       190
   macro avg       0.87      0.87      0.87       190
weighted avg       0.93      0.93      0.93       190

Fold 2/3 - Validation Accuracy: 0.9579
Classification Report:
              precision    recall  f1-score   support

Non-Repeater       0.97      0.98      0.97       159
    Repeater       0.90      0.84      0.87        31

    accuracy                           0.96       190
   macro avg       0.93      0.91      0.92       190
weighted avg       0.96      0.96      0.96       190

Fold 3/3 - Validation Accuracy: 0.9526
Classification Report:
              precision    recall  f1-score   support

Non-Repeater       0.97      0.97      0.97       158
    Repeater       0.85      0.88      0.86        32

    accuracy                           0.95       190
   macro avg       0.91      0.92      0.92       190
weighted avg       0.95      0.95      0.95       190

Trial 203 - Average Validation Accuracy: 0.9456
Fold 1/3 - Validation Accuracy: 0.9526
Classification Report:
              precision    recall  f1-score   support

Non-Repeater       0.97      0.97      0.97       159
    Repeater       0.87      0.84      0.85        31

    accuracy                           0.95       190
   macro avg       0.92      0.91      0.91       190
weighted avg       0.95      0.95      0.95       190

Fold 2/3 - Validation Accuracy: 0.9789
Classification Report:
              precision    recall  f1-score   support

Non-Repeater       0.98      0.99      0.99       159
    Repeater       0.97      0.90      0.93        31

    accuracy                           0.98       190
   macro avg       0.97      0.95      0.96       190
weighted avg       0.98      0.98      0.98       190

Fold 3/3 - Validation Accuracy: 0.9684
Classification Report:
              precision    recall  f1-score   support

Non-Repeater       0.99      0.97      0.98       158
    Repeater       0.88      0.94      0.91        32

    accuracy                           0.97       190
   macro avg       0.93      0.96      0.94       190
weighted avg       0.97      0.97      0.97       190

Trial 204 - Average Validation Accuracy: 0.9667
Fold 1/3 - Validation Accuracy: 0.9579
Classification Report:
              precision    recall  f1-score   support

Non-Repeater       0.97      0.98      0.97       159
    Repeater       0.90      0.84      0.87        31

    accuracy                           0.96       190
   macro avg       0.93      0.91      0.92       190
weighted avg       0.96      0.96      0.96       190

Fold 2/3 - Validation Accuracy: 0.9684
Classification Report:
              precision    recall  f1-score   support

Non-Repeater       0.97      0.99      0.98       159
    Repeater       0.96      0.84      0.90        31

    accuracy                           0.97       190
   macro avg       0.97      0.92      0.94       190
weighted avg       0.97      0.97      0.97       190

Fold 3/3 - Validation Accuracy: 0.9684
Classification Report:
              precision    recall  f1-score   support

Non-Repeater       0.97      0.99      0.98       158
    Repeater       0.93      0.88      0.90        32

    accuracy                           0.97       190
   macro avg       0.95      0.93      0.94       190
weighted avg       0.97      0.97      0.97       190

Trial 205 - Average Validation Accuracy: 0.9649
Fold 1/3 - Validation Accuracy: 0.9579
Classification Report:
