[I 2025-08-31 14:29:01,056] Trial 11 finished with value: 0.9421052631578948 and parameters: {'hidden_dim': 1302, 'latent_dim': 11, 'beta': 0.3886704452563349, 'gamma': 1.2369449406470996, 'dropout_rate': 0.3372744426547491, 'lr': 0.00044869733868727816, 'scheduler_patience': 5, 'class_weight': 0.9983843235196911, 'activation': 'LeakyReLU', 'classification_multiplier': 11187.71783312288}. Best is trial 3 with value: 0.9491228070175439.
              precision    recall  f1-score   support

Non-Repeater       0.88      1.00      0.94       159
    Repeater       1.00      0.32      0.49        31

    accuracy                           0.89       190
   macro avg       0.94      0.66      0.71       190
weighted avg       0.90      0.89      0.86       190

Fold 2/3 - Validation Accuracy: 0.9368
Classification Report:
              precision    recall  f1-score   support

Non-Repeater       0.93      0.99      0.96       159
    Repeater       0.95      0.65      0.77        31

    accuracy                           0.94       190
   macro avg       0.94      0.82      0.87       190
weighted avg       0.94      0.94      0.93       190

Fold 3/3 - Validation Accuracy: 0.9316
Classification Report:
              precision    recall  f1-score   support

Non-Repeater       0.93      0.99      0.96       158
    Repeater       0.95      0.62      0.75        32

    accuracy                           0.93       190
   macro avg       0.94      0.81      0.86       190
weighted avg       0.93      0.93      0.93       190

Trial 6 - Average Validation Accuracy: 0.9193
Fold 1/3 - Validation Accuracy: 0.9421
Classification Report:
              precision    recall  f1-score   support

Non-Repeater       0.95      0.99      0.97       159
    Repeater       0.92      0.71      0.80        31

    accuracy                           0.94       190
   macro avg       0.93      0.85      0.88       190
weighted avg       0.94      0.94      0.94       190

Fold 2/3 - Validation Accuracy: 0.9421
Classification Report:
              precision    recall  f1-score   support

Non-Repeater       0.95      0.99      0.97       159
    Repeater       0.92      0.71      0.80        31

    accuracy                           0.94       190
   macro avg       0.93      0.85      0.88       190
weighted avg       0.94      0.94      0.94       190

Fold 3/3 - Validation Accuracy: 0.9421
Classification Report:
              precision    recall  f1-score   support

Non-Repeater       0.97      0.96      0.97       158
    Repeater       0.82      0.84      0.83        32

    accuracy                           0.94       190
   macro avg       0.89      0.90      0.90       190
weighted avg       0.94      0.94      0.94       190

Trial 7 - Average Validation Accuracy: 0.9421
Fold 1/3 - Validation Accuracy: 0.8842
Classification Report:
              precision    recall  f1-score   support

Non-Repeater       0.88      1.00      0.94       159
    Repeater       1.00      0.29      0.45        31

    accuracy                           0.88       190
   macro avg       0.94      0.65      0.69       190
weighted avg       0.90      0.88      0.86       190

Fold 2/3 - Validation Accuracy: 0.8368
Classification Report:
              precision    recall  f1-score   support

Non-Repeater       0.84      1.00      0.91       159
    Repeater       0.00      0.00      0.00        31

    accuracy                           0.84       190
   macro avg       0.42      0.50      0.46       190
weighted avg       0.70      0.84      0.76       190

Fold 3/3 - Validation Accuracy: 0.8474
Classification Report:
              precision    recall  f1-score   support

Non-Repeater       0.84      1.00      0.92       158
    Repeater       1.00      0.09      0.17        32

    accuracy                           0.85       190
   macro avg       0.92      0.55      0.54       190
weighted avg       0.87      0.85      0.79       190

Trial 8 - Average Validation Accuracy: 0.8561
Fold 1/3 - Validation Accuracy: 0.9368
Classification Report:
              precision    recall  f1-score   support

Non-Repeater       0.95      0.98      0.96       159
    Repeater       0.88      0.71      0.79        31

    accuracy                           0.94       190
   macro avg       0.91      0.85      0.87       190
weighted avg       0.93      0.94      0.93       190

Fold 2/3 - Validation Accuracy: 0.9000
Classification Report:
              precision    recall  f1-score   support

Non-Repeater       0.93      0.96      0.94       159
    Repeater       0.73      0.61      0.67        31

    accuracy                           0.90       190
   macro avg       0.83      0.78      0.80       190
weighted avg       0.89      0.90      0.90       190

Fold 3/3 - Validation Accuracy: 0.9211
Classification Report:
              precision    recall  f1-score   support

Non-Repeater       0.93      0.97      0.95       158
    Repeater       0.84      0.66      0.74        32

    accuracy                           0.92       190
   macro avg       0.89      0.82      0.85       190
weighted avg       0.92      0.92      0.92       190

Trial 9 - Average Validation Accuracy: 0.9193
Fold 1/3 - Validation Accuracy: 0.9316
Classification Report:
              precision    recall  f1-score   support

Non-Repeater       0.96      0.96      0.96       159
    Repeater       0.80      0.77      0.79        31

    accuracy                           0.93       190
   macro avg       0.88      0.87      0.87       190
weighted avg       0.93      0.93      0.93       190

Fold 2/3 - Validation Accuracy: 0.9474
Classification Report:
              precision    recall  f1-score   support

Non-Repeater       0.95      0.99      0.97       159
    Repeater       0.92      0.74      0.82        31

    accuracy                           0.95       190
   macro avg       0.94      0.86      0.90       190
weighted avg       0.95      0.95      0.95       190

Fold 3/3 - Validation Accuracy: 0.9526
Classification Report:
              precision    recall  f1-score   support

Non-Repeater       0.97      0.97      0.97       158
    Repeater       0.85      0.88      0.86        32

    accuracy                           0.95       190
   macro avg       0.91      0.92      0.92       190
weighted avg       0.95      0.95      0.95       190

Trial 10 - Average Validation Accuracy: 0.9439
Fold 1/3 - Validation Accuracy: 0.9316
Classification Report:
              precision    recall  f1-score   support

Non-Repeater       0.96      0.96      0.96       159
    Repeater       0.78      0.81      0.79        31

    accuracy                           0.93       190
   macro avg       0.87      0.88      0.88       190
weighted avg       0.93      0.93      0.93       190

Fold 2/3 - Validation Accuracy: 0.9421
Classification Report:
              precision    recall  f1-score   support

Non-Repeater       0.95      0.98      0.97       159
    Repeater       0.88      0.74      0.81        31

    accuracy                           0.94       190
   macro avg       0.92      0.86      0.89       190
weighted avg       0.94      0.94      0.94       190

Fold 3/3 - Validation Accuracy: 0.9526
Classification Report:
              precision    recall  f1-score   support

Non-Repeater       0.98      0.96      0.97       158
    Repeater       0.83      0.91      0.87        32

    accuracy                           0.95       190
   macro avg       0.90      0.93      0.92       190
weighted avg       0.96      0.95      0.95       190

Trial 11 - Average Validation Accuracy: 0.9421
Fold 1/3 - Validation Accuracy: 0.9263
Classification Report:
              precision    recall  f1-score   support

Non-Repeater       0.94      0.97      0.96       159
    Repeater       0.81      0.71      0.76        31

    accuracy                           0.93       190
   macro avg       0.88      0.84      0.86       190
weighted avg       0.92      0.93      0.92       190

Fold 2/3 - Validation Accuracy: 0.9421
Classification Report:
              precision    recall  f1-score   support

Non-Repeater       0.95      0.98      0.97       159
    Repeater       0.88      0.74      0.81        31

    accuracy                           0.94       190
   macro avg       0.92      0.86      0.89       190
weighted avg       0.94      0.94      0.94       190

Fold 3/3 - Validation Accuracy: 0.9421
Classification Report:
[I 2025-08-31 14:29:23,331] Trial 12 finished with value: 0.936842105263158 and parameters: {'hidden_dim': 975, 'latent_dim': 11, 'beta': 0.15303770865164062, 'gamma': 1.329054959962063, 'dropout_rate': 0.376500550021601, 'lr': 0.0002946308951482946, 'scheduler_patience': 4, 'class_weight': 0.7336560645423615, 'activation': 'LeakyReLU', 'classification_multiplier': 11053.76409026937}. Best is trial 3 with value: 0.9491228070175439.
[I 2025-08-31 14:29:47,904] Trial 13 finished with value: 0.9333333333333332 and parameters: {'hidden_dim': 1339, 'latent_dim': 14, 'beta': 0.6618512116371118, 'gamma': 0.7478782103773727, 'dropout_rate': 0.26086321643323457, 'lr': 0.0022453979533633792, 'scheduler_patience': 5, 'class_weight': 0.985546322657293, 'activation': 'SELU', 'classification_multiplier': 8911.330747984957}. Best is trial 3 with value: 0.9491228070175439.
[I 2025-08-31 14:30:09,320] Trial 14 finished with value: 0.9315789473684211 and parameters: {'hidden_dim': 723, 'latent_dim': 6, 'beta': 0.6185975641446146, 'gamma': 0.14474924787095134, 'dropout_rate': 0.46315716685725433, 'lr': 0.0024456293362614756, 'scheduler_patience': 5, 'class_weight': 0.615563910974311, 'activation': 'GELU', 'classification_multiplier': 12209.111959078757}. Best is trial 3 with value: 0.9491228070175439.
[I 2025-08-31 14:30:35,899] Trial 15 finished with value: 0.9368421052631578 and parameters: {'hidden_dim': 1569, 'latent_dim': 18, 'beta': 1.7962990082448211, 'gamma': 1.03111701351406, 'dropout_rate': 0.3986368950995922, 'lr': 0.0023104321105335964, 'scheduler_patience': 3, 'class_weight': 0.8811787667322984, 'activation': 'LeakyReLU', 'classification_multiplier': 9582.988416856717}. Best is trial 3 with value: 0.9491228070175439.
[I 2025-08-31 14:30:59,469] Trial 16 finished with value: 0.9508771929824561 and parameters: {'hidden_dim': 1164, 'latent_dim': 10, 'beta': 1.6813373292623488, 'gamma': 1.0653509276659647, 'dropout_rate': 0.23815199322429936, 'lr': 0.0039077961913194115, 'scheduler_patience': 6, 'class_weight': 0.6616992687333464, 'activation': 'LeakyReLU', 'classification_multiplier': 10974.801478832813}. Best is trial 16 with value: 0.9508771929824561.
[I 2025-08-31 14:31:22,570] Trial 17 finished with value: 0.956140350877193 and parameters: {'hidden_dim': 778, 'latent_dim': 8, 'beta': 1.6954595850365635, 'gamma': 0.4271988845343332, 'dropout_rate': 0.24647979261644212, 'lr': 0.004008274529242152, 'scheduler_patience': 6, 'class_weight': 0.686037873895441, 'activation': 'ReLU', 'classification_multiplier': 7614.376839056948}. Best is trial 17 with value: 0.956140350877193.
[I 2025-08-31 14:31:45,138] Trial 18 finished with value: 0.9333333333333332 and parameters: {'hidden_dim': 624, 'latent_dim': 8, 'beta': 1.7359394364205964, 'gamma': 0.4762939193352142, 'dropout_rate': 0.23084667666822417, 'lr': 0.004561216014708597, 'scheduler_patience': 6, 'class_weight': 0.5808916041289243, 'activation': 'ELU', 'classification_multiplier': 7520.506427994386}. Best is trial 17 with value: 0.956140350877193.
              precision    recall  f1-score   support

Non-Repeater       0.96      0.97      0.97       158
    Repeater       0.84      0.81      0.83        32

    accuracy                           0.94       190
   macro avg       0.90      0.89      0.90       190
weighted avg       0.94      0.94      0.94       190

Trial 12 - Average Validation Accuracy: 0.9368
Fold 1/3 - Validation Accuracy: 0.9263
Classification Report:
              precision    recall  f1-score   support

Non-Repeater       0.95      0.96      0.96       159
    Repeater       0.79      0.74      0.77        31

    accuracy                           0.93       190
   macro avg       0.87      0.85      0.86       190
weighted avg       0.92      0.93      0.93       190

Fold 2/3 - Validation Accuracy: 0.9211
Classification Report:
              precision    recall  f1-score   support

Non-Repeater       0.93      0.97      0.95       159
    Repeater       0.83      0.65      0.73        31

    accuracy                           0.92       190
   macro avg       0.88      0.81      0.84       190
weighted avg       0.92      0.92      0.92       190

Fold 3/3 - Validation Accuracy: 0.9526
Classification Report:
              precision    recall  f1-score   support

Non-Repeater       0.97      0.97      0.97       158
    Repeater       0.85      0.88      0.86        32

    accuracy                           0.95       190
   macro avg       0.91      0.92      0.92       190
weighted avg       0.95      0.95      0.95       190

Trial 13 - Average Validation Accuracy: 0.9333
Fold 1/3 - Validation Accuracy: 0.9263
Classification Report:
              precision    recall  f1-score   support

Non-Repeater       0.94      0.97      0.96       159
    Repeater       0.84      0.68      0.75        31

    accuracy                           0.93       190
   macro avg       0.89      0.83      0.85       190
weighted avg       0.92      0.93      0.92       190

Fold 2/3 - Validation Accuracy: 0.9263
Classification Report:
              precision    recall  f1-score   support

Non-Repeater       0.93      0.99      0.96       159
    Repeater       0.90      0.61      0.73        31

    accuracy                           0.93       190
   macro avg       0.92      0.80      0.84       190
weighted avg       0.93      0.93      0.92       190

Fold 3/3 - Validation Accuracy: 0.9421
Classification Report:
              precision    recall  f1-score   support

Non-Repeater       0.95      0.99      0.97       158
    Repeater       0.92      0.72      0.81        32

    accuracy                           0.94       190
   macro avg       0.93      0.85      0.89       190
weighted avg       0.94      0.94      0.94       190

Trial 14 - Average Validation Accuracy: 0.9316
Fold 1/3 - Validation Accuracy: 0.9263
Classification Report:
              precision    recall  f1-score   support

Non-Repeater       0.95      0.96      0.96       159
    Repeater       0.79      0.74      0.77        31

    accuracy                           0.93       190
   macro avg       0.87      0.85      0.86       190
weighted avg       0.92      0.93      0.93       190

Fold 2/3 - Validation Accuracy: 0.9316
Classification Report:
              precision    recall  f1-score   support

Non-Repeater       0.94      0.98      0.96       159
    Repeater       0.88      0.68      0.76        31

    accuracy                           0.93       190
   macro avg       0.91      0.83      0.86       190
weighted avg       0.93      0.93      0.93       190

Fold 3/3 - Validation Accuracy: 0.9526
Classification Report:
              precision    recall  f1-score   support

Non-Repeater       0.98      0.96      0.97       158
    Repeater       0.83      0.91      0.87        32

    accuracy                           0.95       190
   macro avg       0.90      0.93      0.92       190
weighted avg       0.96      0.95      0.95       190

Trial 15 - Average Validation Accuracy: 0.9368
Fold 1/3 - Validation Accuracy: 0.9526
Classification Report:
              precision    recall  f1-score   support

Non-Repeater       0.95      1.00      0.97       159
    Repeater       1.00      0.71      0.83        31

    accuracy                           0.95       190
   macro avg       0.97      0.85      0.90       190
weighted avg       0.96      0.95      0.95       190

Fold 2/3 - Validation Accuracy: 0.9474
Classification Report:
              precision    recall  f1-score   support

Non-Repeater       0.95      0.99      0.97       159
    Repeater       0.96      0.71      0.81        31

    accuracy                           0.95       190
   macro avg       0.95      0.85      0.89       190
weighted avg       0.95      0.95      0.94       190

Fold 3/3 - Validation Accuracy: 0.9526
Classification Report:
              precision    recall  f1-score   support

Non-Repeater       0.96      0.98      0.97       158
    Repeater       0.90      0.81      0.85        32

    accuracy                           0.95       190
   macro avg       0.93      0.90      0.91       190
weighted avg       0.95      0.95      0.95       190

Trial 16 - Average Validation Accuracy: 0.9509
Fold 1/3 - Validation Accuracy: 0.9474
Classification Report:
              precision    recall  f1-score   support

Non-Repeater       0.96      0.97      0.97       159
    Repeater       0.86      0.81      0.83        31

    accuracy                           0.95       190
   macro avg       0.91      0.89      0.90       190
weighted avg       0.95      0.95      0.95       190

Fold 2/3 - Validation Accuracy: 0.9684
Classification Report:
              precision    recall  f1-score   support

Non-Repeater       0.97      0.99      0.98       159
    Repeater       0.96      0.84      0.90        31

    accuracy                           0.97       190
   macro avg       0.97      0.92      0.94       190
weighted avg       0.97      0.97      0.97       190

Fold 3/3 - Validation Accuracy: 0.9526
Classification Report:
              precision    recall  f1-score   support

Non-Repeater       0.96      0.98      0.97       158
    Repeater       0.90      0.81      0.85        32

    accuracy                           0.95       190
   macro avg       0.93      0.90      0.91       190
weighted avg       0.95      0.95      0.95       190

Trial 17 - Average Validation Accuracy: 0.9561
Fold 1/3 - Validation Accuracy: 0.9368
Classification Report:
              precision    recall  f1-score   support

Non-Repeater       0.95      0.98      0.96       159
    Repeater       0.88      0.71      0.79        31

    accuracy                           0.94       190
   macro avg       0.91      0.85      0.87       190
weighted avg       0.93      0.94      0.93       190

Fold 2/3 - Validation Accuracy: 0.9316
Classification Report:
              precision    recall  f1-score   support

Non-Repeater       0.93      0.99      0.96       159
    Repeater       0.91      0.65      0.75        31

    accuracy                           0.93       190
   macro avg       0.92      0.82      0.86       190
weighted avg       0.93      0.93      0.93       190

Fold 3/3 - Validation Accuracy: 0.9316
Classification Report:
              precision    recall  f1-score   support

Non-Repeater       0.94      0.98      0.96       158
    Repeater       0.88      0.69      0.77        32

    accuracy                           0.93       190
   macro avg       0.91      0.83      0.87       190
weighted avg       0.93      0.93      0.93       190

Trial 18 - Average Validation Accuracy: 0.9333
Fold 1/3 - Validation Accuracy: 0.9474
Classification Report:
              precision    recall  f1-score   support

Non-Repeater       0.95      0.99      0.97       159
    Repeater       0.96      0.71      0.81        31

    accuracy                           0.95       190
   macro avg       0.95      0.85      0.89       190
weighted avg       0.95      0.95      0.94       190

Fold 2/3 - Validation Accuracy: 0.9263
Classification Report:
[I 2025-08-31 14:32:09,006] Trial 19 finished with value: 0.9421052631578948 and parameters: {'hidden_dim': 528, 'latent_dim': 13, 'beta': 1.2207760701684967, 'gamma': 0.5096078983732119, 'dropout_rate': 0.23673441205714246, 'lr': 0.003816302057661933, 'scheduler_patience': 6, 'class_weight': 0.6953296732037186, 'activation': 'SELU', 'classification_multiplier': 7585.438266100698}. Best is trial 17 with value: 0.956140350877193.
[I 2025-08-31 14:32:31,576] Trial 20 finished with value: 0.9350877192982456 and parameters: {'hidden_dim': 897, 'latent_dim': 8, 'beta': 1.6374427668670661, 'gamma': 0.2050356012751296, 'dropout_rate': 0.13287077714682205, 'lr': 0.0035838993949594156, 'scheduler_patience': 6, 'class_weight': 0.45357357797444703, 'activation': 'GELU', 'classification_multiplier': 7489.291391495939}. Best is trial 17 with value: 0.956140350877193.
[I 2025-08-31 14:32:57,782] Trial 21 finished with value: 0.9456140350877194 and parameters: {'hidden_dim': 1156, 'latent_dim': 18, 'beta': 1.6339528789168616, 'gamma': 0.9307561009583569, 'dropout_rate': 0.31405885415605556, 'lr': 0.0032977498640304834, 'scheduler_patience': 4, 'class_weight': 0.7191424198154308, 'activation': 'ReLU', 'classification_multiplier': 10224.446059983176}. Best is trial 17 with value: 0.956140350877193.
[I 2025-08-31 14:33:22,137] Trial 22 finished with value: 0.9578947368421052 and parameters: {'hidden_dim': 1194, 'latent_dim': 9, 'beta': 1.7890086306618982, 'gamma': 0.6349649210431458, 'dropout_rate': 0.26807502138536465, 'lr': 0.002121580033747965, 'scheduler_patience': 6, 'class_weight': 0.6125411306231694, 'activation': 'ReLU', 'classification_multiplier': 12495.659192686802}. Best is trial 22 with value: 0.9578947368421052.
[I 2025-08-31 14:33:47,256] Trial 23 finished with value: 0.9543859649122807 and parameters: {'hidden_dim': 1173, 'latent_dim': 8, 'beta': 1.8353891411519665, 'gamma': 0.5253003264408147, 'dropout_rate': 0.2687184495963538, 'lr': 0.0043263706511187305, 'scheduler_patience': 6, 'class_weight': 0.6002174351113757, 'activation': 'ReLU', 'classification_multiplier': 12218.924794279164}. Best is trial 22 with value: 0.9578947368421052.
