[I 2025-08-31 16:24:01,709] Trial 271 finished with value: 0.968421052631579 and parameters: {'hidden_dim': 1853, 'latent_dim': 15, 'beta': 1.9326821395049274, 'gamma': 1.722928838407684, 'dropout_rate': 0.11764470857946706, 'lr': 0.000529119431432271, 'scheduler_patience': 7, 'class_weight': 0.9668243586361618, 'activation': 'ReLU', 'classification_multiplier': 12172.869806658258}. Best is trial 255 with value: 0.9736842105263158.
              precision    recall  f1-score   support

Non-Repeater       0.97      0.96      0.97       159
    Repeater       0.82      0.87      0.84        31

    accuracy                           0.95       190
   macro avg       0.90      0.92      0.91       190
weighted avg       0.95      0.95      0.95       190

Fold 2/3 - Validation Accuracy: 0.9737
Classification Report:
              precision    recall  f1-score   support

Non-Repeater       0.98      0.99      0.98       159
    Repeater       0.96      0.87      0.92        31

    accuracy                           0.97       190
   macro avg       0.97      0.93      0.95       190
weighted avg       0.97      0.97      0.97       190

Fold 3/3 - Validation Accuracy: 0.9737
Classification Report:
              precision    recall  f1-score   support

Non-Repeater       0.99      0.98      0.98       158
    Repeater       0.91      0.94      0.92        32

    accuracy                           0.97       190
   macro avg       0.95      0.96      0.95       190
weighted avg       0.97      0.97      0.97       190

Trial 266 - Average Validation Accuracy: 0.9649
Fold 1/3 - Validation Accuracy: 0.9632
Classification Report:
              precision    recall  f1-score   support

Non-Repeater       0.97      0.99      0.98       159
    Repeater       0.93      0.84      0.88        31

    accuracy                           0.96       190
   macro avg       0.95      0.91      0.93       190
weighted avg       0.96      0.96      0.96       190

Fold 2/3 - Validation Accuracy: 0.9895
Classification Report:
              precision    recall  f1-score   support

Non-Repeater       0.99      0.99      0.99       159
    Repeater       0.97      0.97      0.97        31

    accuracy                           0.99       190
   macro avg       0.98      0.98      0.98       190
weighted avg       0.99      0.99      0.99       190

Fold 3/3 - Validation Accuracy: 0.9632
Classification Report:
              precision    recall  f1-score   support

Non-Repeater       0.98      0.97      0.98       158
    Repeater       0.88      0.91      0.89        32

    accuracy                           0.96       190
   macro avg       0.93      0.94      0.94       190
weighted avg       0.96      0.96      0.96       190

Trial 267 - Average Validation Accuracy: 0.9719
Fold 1/3 - Validation Accuracy: 0.9632
Classification Report:
              precision    recall  f1-score   support

Non-Repeater       0.97      0.99      0.98       159
    Repeater       0.93      0.84      0.88        31

    accuracy                           0.96       190
   macro avg       0.95      0.91      0.93       190
weighted avg       0.96      0.96      0.96       190

Fold 2/3 - Validation Accuracy: 0.9158
Classification Report:
              precision    recall  f1-score   support

Non-Repeater       0.94      0.96      0.95       159
    Repeater       0.76      0.71      0.73        31

    accuracy                           0.92       190
   macro avg       0.85      0.83      0.84       190
weighted avg       0.91      0.92      0.91       190

Fold 3/3 - Validation Accuracy: 0.9421
Classification Report:
              precision    recall  f1-score   support

Non-Repeater       0.97      0.96      0.97       158
    Repeater       0.82      0.84      0.83        32

    accuracy                           0.94       190
   macro avg       0.89      0.90      0.90       190
weighted avg       0.94      0.94      0.94       190

Trial 268 - Average Validation Accuracy: 0.9404
Fold 1/3 - Validation Accuracy: 0.9263
Classification Report:
              precision    recall  f1-score   support

Non-Repeater       0.95      0.96      0.96       159
    Repeater       0.79      0.74      0.77        31

    accuracy                           0.93       190
   macro avg       0.87      0.85      0.86       190
weighted avg       0.92      0.93      0.93       190

Fold 2/3 - Validation Accuracy: 0.9263
Classification Report:
              precision    recall  f1-score   support

Non-Repeater       0.94      0.97      0.96       159
    Repeater       0.81      0.71      0.76        31

    accuracy                           0.93       190
   macro avg       0.88      0.84      0.86       190
weighted avg       0.92      0.93      0.92       190

Fold 3/3 - Validation Accuracy: 0.9368
Classification Report:
              precision    recall  f1-score   support

Non-Repeater       0.96      0.96      0.96       158
    Repeater       0.81      0.81      0.81        32

    accuracy                           0.94       190
   macro avg       0.89      0.89      0.89       190
weighted avg       0.94      0.94      0.94       190

Trial 269 - Average Validation Accuracy: 0.9298
Fold 1/3 - Validation Accuracy: 0.9421
Classification Report:
              precision    recall  f1-score   support

Non-Repeater       0.96      0.97      0.97       159
    Repeater       0.83      0.81      0.82        31

    accuracy                           0.94       190
   macro avg       0.90      0.89      0.89       190
weighted avg       0.94      0.94      0.94       190

Fold 2/3 - Validation Accuracy: 0.9789
Classification Report:
              precision    recall  f1-score   support

Non-Repeater       0.98      0.99      0.99       159
    Repeater       0.97      0.90      0.93        31

    accuracy                           0.98       190
   macro avg       0.97      0.95      0.96       190
weighted avg       0.98      0.98      0.98       190

Fold 3/3 - Validation Accuracy: 0.9421
Classification Report:
              precision    recall  f1-score   support

Non-Repeater       0.97      0.96      0.97       158
    Repeater       0.82      0.84      0.83        32

    accuracy                           0.94       190
   macro avg       0.89      0.90      0.90       190
weighted avg       0.94      0.94      0.94       190

Trial 270 - Average Validation Accuracy: 0.9544
Fold 1/3 - Validation Accuracy: 0.9632
Classification Report:
              precision    recall  f1-score   support

Non-Repeater       0.98      0.97      0.98       159
    Repeater       0.88      0.90      0.89        31

    accuracy                           0.96       190
   macro avg       0.93      0.94      0.93       190
weighted avg       0.96      0.96      0.96       190

Fold 2/3 - Validation Accuracy: 0.9737
Classification Report:
              precision    recall  f1-score   support

Non-Repeater       0.98      0.99      0.98       159
    Repeater       0.96      0.87      0.92        31

    accuracy                           0.97       190
   macro avg       0.97      0.93      0.95       190
weighted avg       0.97      0.97      0.97       190

Fold 3/3 - Validation Accuracy: 0.9684
Classification Report:
              precision    recall  f1-score   support

Non-Repeater       0.98      0.98      0.98       158
    Repeater       0.91      0.91      0.91        32

    accuracy                           0.97       190
   macro avg       0.94      0.94      0.94       190
weighted avg       0.97      0.97      0.97       190

Trial 271 - Average Validation Accuracy: 0.9684
Fold 1/3 - Validation Accuracy: 0.9474
Classification Report:
              precision    recall  f1-score   support

Non-Repeater       0.97      0.97      0.97       159
    Repeater       0.84      0.84      0.84        31

    accuracy                           0.95       190
   macro avg       0.90      0.90      0.90       190
weighted avg       0.95      0.95      0.95       190

Fold 2/3 - Validation Accuracy: 0.9842
Classification Report:
              precision    recall  f1-score   support

Non-Repeater       0.99      0.99      0.99       159
    Repeater       0.97      0.94      0.95        31

    accuracy                           0.98       190
   macro avg       0.98      0.96      0.97       190
weighted avg       0.98      0.98      0.98       190

Fold 3/3 - Validation Accuracy: 0.9789
Classification Report:
[I 2025-08-31 16:24:30,988] Trial 272 finished with value: 0.9701754385964912 and parameters: {'hidden_dim': 1908, 'latent_dim': 17, 'beta': 1.9684451796752065, 'gamma': 1.0789505247203008, 'dropout_rate': 0.1286876090395961, 'lr': 0.00029840300108235755, 'scheduler_patience': 7, 'class_weight': 0.9814625306260517, 'activation': 'ReLU', 'classification_multiplier': 12728.537244361733}. Best is trial 255 with value: 0.9736842105263158.
[I 2025-08-31 16:24:59,474] Trial 273 finished with value: 0.943859649122807 and parameters: {'hidden_dim': 1802, 'latent_dim': 30, 'beta': 1.866864720090909, 'gamma': 1.654763434433977, 'dropout_rate': 0.11711831523321518, 'lr': 0.00010089570403117495, 'scheduler_patience': 7, 'class_weight': 0.21541025065074204, 'activation': 'ReLU', 'classification_multiplier': 12315.786024444507}. Best is trial 255 with value: 0.9736842105263158.
[I 2025-08-31 16:25:28,121] Trial 274 finished with value: 0.968421052631579 and parameters: {'hidden_dim': 1838, 'latent_dim': 19, 'beta': 0.9022576745870861, 'gamma': 1.6816393353602996, 'dropout_rate': 0.14442829756213268, 'lr': 0.0007720701063266865, 'scheduler_patience': 7, 'class_weight': 0.9563345275222197, 'activation': 'ReLU', 'classification_multiplier': 12994.247365436184}. Best is trial 255 with value: 0.9736842105263158.
[I 2025-08-31 16:25:57,873] Trial 275 finished with value: 0.9456140350877192 and parameters: {'hidden_dim': 1917, 'latent_dim': 20, 'beta': 0.27268236308868166, 'gamma': 1.5800303124187698, 'dropout_rate': 0.12470490823373016, 'lr': 0.0004324756457854171, 'scheduler_patience': 2, 'class_weight': 0.6122001221531302, 'activation': 'ReLU', 'classification_multiplier': 9995.997382761689}. Best is trial 255 with value: 0.9736842105263158.
[I 2025-08-31 16:26:21,863] Trial 276 finished with value: 0.9403508771929824 and parameters: {'hidden_dim': 1207, 'latent_dim': 40, 'beta': 1.906870160403289, 'gamma': 1.5043586599631702, 'dropout_rate': 0.1119009898050944, 'lr': 0.0005802430458257897, 'scheduler_patience': 7, 'class_weight': 0.998024716674425, 'activation': 'SELU', 'classification_multiplier': 12448.997730360712}. Best is trial 255 with value: 0.9736842105263158.
[I 2025-08-31 16:26:46,709] Trial 277 finished with value: 0.9666666666666667 and parameters: {'hidden_dim': 1326, 'latent_dim': 38, 'beta': 1.996670656706947, 'gamma': 0.7284541944719554, 'dropout_rate': 0.1364854657038815, 'lr': 0.0002833961714356802, 'scheduler_patience': 7, 'class_weight': 0.9390522457412419, 'activation': 'ReLU', 'classification_multiplier': 11996.276708922733}. Best is trial 255 with value: 0.9736842105263158.
[I 2025-08-31 16:27:14,307] Trial 278 finished with value: 0.9666666666666667 and parameters: {'hidden_dim': 1714, 'latent_dim': 40, 'beta': 1.8248955729044731, 'gamma': 1.7535735393967773, 'dropout_rate': 0.1590473254881975, 'lr': 0.00010225640756798123, 'scheduler_patience': 7, 'class_weight': 0.9738766185005294, 'activation': 'ReLU', 'classification_multiplier': 11547.545583838604}. Best is trial 255 with value: 0.9736842105263158.
              precision    recall  f1-score   support

Non-Repeater       0.99      0.99      0.99       158
    Repeater       0.94      0.94      0.94        32

    accuracy                           0.98       190
   macro avg       0.96      0.96      0.96       190
weighted avg       0.98      0.98      0.98       190

Trial 272 - Average Validation Accuracy: 0.9702
Fold 1/3 - Validation Accuracy: 0.9368
Classification Report:
              precision    recall  f1-score   support

Non-Repeater       0.93      0.99      0.96       159
    Repeater       0.95      0.65      0.77        31

    accuracy                           0.94       190
   macro avg       0.94      0.82      0.87       190
weighted avg       0.94      0.94      0.93       190

Fold 2/3 - Validation Accuracy: 0.9526
Classification Report:
              precision    recall  f1-score   support

Non-Repeater       0.95      0.99      0.97       159
    Repeater       0.96      0.74      0.84        31

    accuracy                           0.95       190
   macro avg       0.96      0.87      0.90       190
weighted avg       0.95      0.95      0.95       190

Fold 3/3 - Validation Accuracy: 0.9421
Classification Report:
              precision    recall  f1-score   support

Non-Repeater       0.93      1.00      0.97       158
    Repeater       1.00      0.66      0.79        32

    accuracy                           0.94       190
   macro avg       0.97      0.83      0.88       190
weighted avg       0.95      0.94      0.94       190

Trial 273 - Average Validation Accuracy: 0.9439
Fold 1/3 - Validation Accuracy: 0.9632
Classification Report:
              precision    recall  f1-score   support

Non-Repeater       0.97      0.99      0.98       159
    Repeater       0.93      0.84      0.88        31

    accuracy                           0.96       190
   macro avg       0.95      0.91      0.93       190
weighted avg       0.96      0.96      0.96       190

Fold 2/3 - Validation Accuracy: 0.9789
Classification Report:
              precision    recall  f1-score   support

Non-Repeater       0.98      0.99      0.99       159
    Repeater       0.97      0.90      0.93        31

    accuracy                           0.98       190
   macro avg       0.97      0.95      0.96       190
weighted avg       0.98      0.98      0.98       190

Fold 3/3 - Validation Accuracy: 0.9632
Classification Report:
              precision    recall  f1-score   support

Non-Repeater       0.99      0.97      0.98       158
    Repeater       0.86      0.94      0.90        32

    accuracy                           0.96       190
   macro avg       0.92      0.95      0.94       190
weighted avg       0.97      0.96      0.96       190

Trial 274 - Average Validation Accuracy: 0.9684
Fold 1/3 - Validation Accuracy: 0.9421
Classification Report:
              precision    recall  f1-score   support

Non-Repeater       0.95      0.98      0.97       159
    Repeater       0.88      0.74      0.81        31

    accuracy                           0.94       190
   macro avg       0.92      0.86      0.89       190
weighted avg       0.94      0.94      0.94       190

Fold 2/3 - Validation Accuracy: 0.9474
Classification Report:
              precision    recall  f1-score   support

Non-Repeater       0.95      0.99      0.97       159
    Repeater       0.96      0.71      0.81        31

    accuracy                           0.95       190
   macro avg       0.95      0.85      0.89       190
weighted avg       0.95      0.95      0.94       190

Fold 3/3 - Validation Accuracy: 0.9474
Classification Report:
              precision    recall  f1-score   support

Non-Repeater       0.96      0.98      0.97       158
    Repeater       0.89      0.78      0.83        32

    accuracy                           0.95       190
   macro avg       0.92      0.88      0.90       190
weighted avg       0.95      0.95      0.95       190

Trial 275 - Average Validation Accuracy: 0.9456
Fold 1/3 - Validation Accuracy: 0.9316
Classification Report:
              precision    recall  f1-score   support

Non-Repeater       0.95      0.97      0.96       159
    Repeater       0.82      0.74      0.78        31

    accuracy                           0.93       190
   macro avg       0.89      0.86      0.87       190
weighted avg       0.93      0.93      0.93       190

Fold 2/3 - Validation Accuracy: 0.9421
Classification Report:
              precision    recall  f1-score   support

Non-Repeater       0.95      0.99      0.97       159
    Repeater       0.92      0.71      0.80        31

    accuracy                           0.94       190
   macro avg       0.93      0.85      0.88       190
weighted avg       0.94      0.94      0.94       190

Fold 3/3 - Validation Accuracy: 0.9474
Classification Report:
              precision    recall  f1-score   support

Non-Repeater       0.97      0.96      0.97       158
    Repeater       0.82      0.88      0.85        32

    accuracy                           0.95       190
   macro avg       0.90      0.92      0.91       190
weighted avg       0.95      0.95      0.95       190

Trial 276 - Average Validation Accuracy: 0.9404
Fold 1/3 - Validation Accuracy: 0.9579
Classification Report:
              precision    recall  f1-score   support

Non-Repeater       0.98      0.97      0.97       159
    Repeater       0.85      0.90      0.88        31

    accuracy                           0.96       190
   macro avg       0.91      0.94      0.92       190
weighted avg       0.96      0.96      0.96       190

Fold 2/3 - Validation Accuracy: 0.9789
Classification Report:
              precision    recall  f1-score   support

Non-Repeater       0.98      0.99      0.99       159
    Repeater       0.97      0.90      0.93        31

    accuracy                           0.98       190
   macro avg       0.97      0.95      0.96       190
weighted avg       0.98      0.98      0.98       190

Fold 3/3 - Validation Accuracy: 0.9632
Classification Report:
              precision    recall  f1-score   support

Non-Repeater       0.97      0.99      0.98       158
    Repeater       0.93      0.84      0.89        32

    accuracy                           0.96       190
   macro avg       0.95      0.92      0.93       190
weighted avg       0.96      0.96      0.96       190

Trial 277 - Average Validation Accuracy: 0.9667
Fold 1/3 - Validation Accuracy: 0.9526
Classification Report:
              precision    recall  f1-score   support

Non-Repeater       0.97      0.97      0.97       159
    Repeater       0.87      0.84      0.85        31

    accuracy                           0.95       190
   macro avg       0.92      0.91      0.91       190
weighted avg       0.95      0.95      0.95       190

Fold 2/3 - Validation Accuracy: 0.9789
Classification Report:
              precision    recall  f1-score   support

Non-Repeater       0.98      0.99      0.99       159
    Repeater       0.97      0.90      0.93        31

    accuracy                           0.98       190
   macro avg       0.97      0.95      0.96       190
weighted avg       0.98      0.98      0.98       190

Fold 3/3 - Validation Accuracy: 0.9684
Classification Report:
              precision    recall  f1-score   support

Non-Repeater       0.99      0.97      0.98       158
    Repeater       0.88      0.94      0.91        32

    accuracy                           0.97       190
   macro avg       0.93      0.96      0.94       190
weighted avg       0.97      0.97      0.97       190

Trial 278 - Average Validation Accuracy: 0.9667
Fold 1/3 - Validation Accuracy: 0.9632
Classification Report:
              precision    recall  f1-score   support

Non-Repeater       0.97      0.99      0.98       159
    Repeater       0.93      0.84      0.88        31

    accuracy                           0.96       190
   macro avg       0.95      0.91      0.93       190
weighted avg       0.96      0.96      0.96       190

Fold 2/3 - Validation Accuracy: 0.9526
Classification Report:
[I 2025-08-31 16:27:39,684] Trial 279 finished with value: 0.9614035087719298 and parameters: {'hidden_dim': 1415, 'latent_dim': 18, 'beta': 1.9395815589907648, 'gamma': 0.9837149391814615, 'dropout_rate': 0.10970251378902007, 'lr': 0.0010703291114128257, 'scheduler_patience': 7, 'class_weight': 0.9528637451561426, 'activation': 'LeakyReLU', 'classification_multiplier': 10904.267231944736}. Best is trial 255 with value: 0.9736842105263158.
[I 2025-08-31 16:28:03,941] Trial 280 finished with value: 0.9614035087719298 and parameters: {'hidden_dim': 1241, 'latent_dim': 39, 'beta': 0.5467424080735848, 'gamma': 1.472057803552029, 'dropout_rate': 0.1310453211837147, 'lr': 0.00045607478597834913, 'scheduler_patience': 7, 'class_weight': 0.9862974096783451, 'activation': 'ReLU', 'classification_multiplier': 12202.245811408622}. Best is trial 255 with value: 0.9736842105263158.
[I 2025-08-31 16:28:33,002] Trial 281 finished with value: 0.9578947368421052 and parameters: {'hidden_dim': 1819, 'latent_dim': 39, 'beta': 1.9999072722544724, 'gamma': 1.7077437647234897, 'dropout_rate': 0.1539930891605461, 'lr': 0.0006831111605154257, 'scheduler_patience': 7, 'class_weight': 0.9342468403786303, 'activation': 'ReLU', 'classification_multiplier': 12777.896532957424}. Best is trial 255 with value: 0.9736842105263158.
[I 2025-08-31 16:28:58,203] Trial 282 finished with value: 0.9473684210526315 and parameters: {'hidden_dim': 1353, 'latent_dim': 37, 'beta': 1.9114287466708937, 'gamma': 1.4094151351059088, 'dropout_rate': 0.12096429877999171, 'lr': 0.0012479956362631511, 'scheduler_patience': 7, 'class_weight': 0.9682526009215575, 'activation': 'GELU', 'classification_multiplier': 11873.803285679374}. Best is trial 255 with value: 0.9736842105263158.
[I 2025-08-31 16:29:22,020] Trial 283 finished with value: 0.936842105263158 and parameters: {'hidden_dim': 1145, 'latent_dim': 40, 'beta': 1.3625840915926282, 'gamma': 1.7834781453212427, 'dropout_rate': 0.14104005476082834, 'lr': 0.007308358296037259, 'scheduler_patience': 7, 'class_weight': 0.9981761098245937, 'activation': 'ReLU', 'classification_multiplier': 12531.152674615272}. Best is trial 255 with value: 0.9736842105263158.
