[I 2025-08-31 15:37:29,946] Trial 167 finished with value: 0.9614035087719298 and parameters: {'hidden_dim': 1038, 'latent_dim': 40, 'beta': 1.9653259132104108, 'gamma': 1.6264004364796258, 'dropout_rate': 0.13615436117247648, 'lr': 0.0009210486524690607, 'scheduler_patience': 7, 'class_weight': 0.9790222073966248, 'activation': 'ReLU', 'classification_multiplier': 11662.98307141959}. Best is trial 111 with value: 0.9719298245614035.
[I 2025-08-31 15:37:56,288] Trial 168 finished with value: 0.9614035087719298 and parameters: {'hidden_dim': 1513, 'latent_dim': 36, 'beta': 1.9227928555648508, 'gamma': 1.684627273372521, 'dropout_rate': 0.16741816405092438, 'lr': 0.00027253852744785477, 'scheduler_patience': 7, 'class_weight': 0.8518915208426137, 'activation': 'ReLU', 'classification_multiplier': 12298.889091976107}. Best is trial 111 with value: 0.9719298245614035.
[I 2025-08-31 15:38:23,926] Trial 169 finished with value: 0.9614035087719298 and parameters: {'hidden_dim': 1689, 'latent_dim': 37, 'beta': 1.889481487368228, 'gamma': 1.5835728760074348, 'dropout_rate': 0.1518268779296528, 'lr': 0.0013584832130949102, 'scheduler_patience': 7, 'class_weight': 0.9171755543644854, 'activation': 'ReLU', 'classification_multiplier': 12022.552548042111}. Best is trial 111 with value: 0.9719298245614035.
[I 2025-08-31 15:38:51,135] Trial 170 finished with value: 0.9280701754385965 and parameters: {'hidden_dim': 1627, 'latent_dim': 39, 'beta': 1.8463274503645641, 'gamma': 1.3966395413590424, 'dropout_rate': 0.14100660996445635, 'lr': 0.000700675037786242, 'scheduler_patience': 7, 'class_weight': 0.2589021074416058, 'activation': 'GELU', 'classification_multiplier': 14340.514020457724}. Best is trial 111 with value: 0.9719298245614035.
[I 2025-08-31 15:39:16,723] Trial 171 finished with value: 0.968421052631579 and parameters: {'hidden_dim': 1448, 'latent_dim': 39, 'beta': 1.8676587657634194, 'gamma': 1.5098663939750818, 'dropout_rate': 0.11948568583409087, 'lr': 0.00010934279207257682, 'scheduler_patience': 7, 'class_weight': 0.930503808203627, 'activation': 'ReLU', 'classification_multiplier': 12490.958926060728}. Best is trial 111 with value: 0.9719298245614035.
              precision    recall  f1-score   support

Non-Repeater       0.95      0.98      0.97       159
    Repeater       0.88      0.74      0.81        31

    accuracy                           0.94       190
   macro avg       0.92      0.86      0.89       190
weighted avg       0.94      0.94      0.94       190

Fold 2/3 - Validation Accuracy: 0.9421
Classification Report:
              precision    recall  f1-score   support

Non-Repeater       0.95      0.99      0.97       159
    Repeater       0.92      0.71      0.80        31

    accuracy                           0.94       190
   macro avg       0.93      0.85      0.88       190
weighted avg       0.94      0.94      0.94       190

Fold 3/3 - Validation Accuracy: 0.9526
Classification Report:
              precision    recall  f1-score   support

Non-Repeater       0.97      0.97      0.97       158
    Repeater       0.87      0.84      0.86        32

    accuracy                           0.95       190
   macro avg       0.92      0.91      0.91       190
weighted avg       0.95      0.95      0.95       190

Trial 166 - Average Validation Accuracy: 0.9456
Fold 1/3 - Validation Accuracy: 0.9421
Classification Report:
              precision    recall  f1-score   support

Non-Repeater       0.96      0.97      0.97       159
    Repeater       0.86      0.77      0.81        31

    accuracy                           0.94       190
   macro avg       0.91      0.87      0.89       190
weighted avg       0.94      0.94      0.94       190

Fold 2/3 - Validation Accuracy: 0.9789
Classification Report:
              precision    recall  f1-score   support

Non-Repeater       0.98      0.99      0.99       159
    Repeater       0.97      0.90      0.93        31

    accuracy                           0.98       190
   macro avg       0.97      0.95      0.96       190
weighted avg       0.98      0.98      0.98       190

Fold 3/3 - Validation Accuracy: 0.9632
Classification Report:
              precision    recall  f1-score   support

Non-Repeater       0.98      0.97      0.98       158
    Repeater       0.88      0.91      0.89        32

    accuracy                           0.96       190
   macro avg       0.93      0.94      0.94       190
weighted avg       0.96      0.96      0.96       190

Trial 167 - Average Validation Accuracy: 0.9614
Fold 1/3 - Validation Accuracy: 0.9421
Classification Report:
              precision    recall  f1-score   support

Non-Repeater       0.96      0.97      0.97       159
    Repeater       0.83      0.81      0.82        31

    accuracy                           0.94       190
   macro avg       0.90      0.89      0.89       190
weighted avg       0.94      0.94      0.94       190

Fold 2/3 - Validation Accuracy: 0.9737
Classification Report:
              precision    recall  f1-score   support

Non-Repeater       0.98      0.99      0.98       159
    Repeater       0.96      0.87      0.92        31

    accuracy                           0.97       190
   macro avg       0.97      0.93      0.95       190
weighted avg       0.97      0.97      0.97       190

Fold 3/3 - Validation Accuracy: 0.9684
Classification Report:
              precision    recall  f1-score   support

Non-Repeater       0.97      0.99      0.98       158
    Repeater       0.93      0.88      0.90        32

    accuracy                           0.97       190
   macro avg       0.95      0.93      0.94       190
weighted avg       0.97      0.97      0.97       190

Trial 168 - Average Validation Accuracy: 0.9614
Fold 1/3 - Validation Accuracy: 0.9368
Classification Report:
              precision    recall  f1-score   support

Non-Repeater       0.96      0.97      0.96       159
    Repeater       0.83      0.77      0.80        31

    accuracy                           0.94       190
   macro avg       0.89      0.87      0.88       190
weighted avg       0.94      0.94      0.94       190

Fold 2/3 - Validation Accuracy: 0.9789
Classification Report:
              precision    recall  f1-score   support

Non-Repeater       0.98      0.99      0.99       159
    Repeater       0.97      0.90      0.93        31

    accuracy                           0.98       190
   macro avg       0.97      0.95      0.96       190
weighted avg       0.98      0.98      0.98       190

Fold 3/3 - Validation Accuracy: 0.9684
Classification Report:
              precision    recall  f1-score   support

Non-Repeater       0.97      0.99      0.98       158
    Repeater       0.96      0.84      0.90        32

    accuracy                           0.97       190
   macro avg       0.97      0.92      0.94       190
weighted avg       0.97      0.97      0.97       190

Trial 169 - Average Validation Accuracy: 0.9614
Fold 1/3 - Validation Accuracy: 0.9316
Classification Report:
              precision    recall  f1-score   support

Non-Repeater       0.92      1.00      0.96       159
    Repeater       1.00      0.58      0.73        31

    accuracy                           0.93       190
   macro avg       0.96      0.79      0.85       190
weighted avg       0.94      0.93      0.92       190

Fold 2/3 - Validation Accuracy: 0.9263
Classification Report:
              precision    recall  f1-score   support

Non-Repeater       0.92      0.99      0.96       159
    Repeater       0.95      0.58      0.72        31

    accuracy                           0.93       190
   macro avg       0.94      0.79      0.84       190
weighted avg       0.93      0.93      0.92       190

Fold 3/3 - Validation Accuracy: 0.9263
Classification Report:
              precision    recall  f1-score   support

Non-Repeater       0.92      1.00      0.96       158
    Repeater       1.00      0.56      0.72        32

    accuracy                           0.93       190
   macro avg       0.96      0.78      0.84       190
weighted avg       0.93      0.93      0.92       190

Trial 170 - Average Validation Accuracy: 0.9281
Fold 1/3 - Validation Accuracy: 0.9632
Classification Report:
              precision    recall  f1-score   support

Non-Repeater       0.99      0.97      0.98       159
    Repeater       0.85      0.94      0.89        31

    accuracy                           0.96       190
   macro avg       0.92      0.95      0.94       190
weighted avg       0.97      0.96      0.96       190

Fold 2/3 - Validation Accuracy: 0.9789
Classification Report:
              precision    recall  f1-score   support

Non-Repeater       0.98      0.99      0.99       159
    Repeater       0.97      0.90      0.93        31

    accuracy                           0.98       190
   macro avg       0.97      0.95      0.96       190
weighted avg       0.98      0.98      0.98       190

Fold 3/3 - Validation Accuracy: 0.9632
Classification Report:
              precision    recall  f1-score   support

Non-Repeater       0.98      0.97      0.98       158
    Repeater       0.88      0.91      0.89        32

    accuracy                           0.96       190
   macro avg       0.93      0.94      0.94       190
weighted avg       0.96      0.96      0.96       190

Trial 171 - Average Validation Accuracy: 0.9684
Fold 1/3 - Validation Accuracy: 0.9684
Classification Report:
              precision    recall  f1-score   support

Non-Repeater       0.97      0.99      0.98       159
    Repeater       0.96      0.84      0.90        31

    accuracy                           0.97       190
   macro avg       0.97      0.92      0.94       190
weighted avg       0.97      0.97      0.97       190

Fold 2/3 - Validation Accuracy: 0.9737
Classification Report:
              precision    recall  f1-score   support

Non-Repeater       0.98      0.99      0.98       159
    Repeater       0.93      0.90      0.92        31

    accuracy                           0.97       190
   macro avg       0.96      0.95      0.95       190
weighted avg       0.97      0.97      0.97       190

Fold 3/3 - Validation Accuracy: 0.9579
Classification Report:
[I 2025-08-31 15:39:42,936] Trial 172 finished with value: 0.9666666666666667 and parameters: {'hidden_dim': 1552, 'latent_dim': 21, 'beta': 1.9988082728816732, 'gamma': 1.5509959803858744, 'dropout_rate': 0.12626599809004063, 'lr': 0.0007165208271872019, 'scheduler_patience': 7, 'class_weight': 0.9487181849647796, 'activation': 'ReLU', 'classification_multiplier': 11802.936321003319}. Best is trial 111 with value: 0.9719298245614035.
[I 2025-08-31 15:40:08,838] Trial 173 finished with value: 0.9543859649122807 and parameters: {'hidden_dim': 1474, 'latent_dim': 37, 'beta': 1.9338696057954055, 'gamma': 1.837031545450132, 'dropout_rate': 0.10985388408888515, 'lr': 0.00044011074537368894, 'scheduler_patience': 7, 'class_weight': 0.4399229037725282, 'activation': 'LeakyReLU', 'classification_multiplier': 8446.92525208707}. Best is trial 111 with value: 0.9719298245614035.
[I 2025-08-31 15:40:34,398] Trial 174 finished with value: 0.9614035087719298 and parameters: {'hidden_dim': 1399, 'latent_dim': 25, 'beta': 1.8897940870756376, 'gamma': 1.307277750118977, 'dropout_rate': 0.1326919612423219, 'lr': 0.0011118086600307264, 'scheduler_patience': 7, 'class_weight': 0.9679766297199557, 'activation': 'ReLU', 'classification_multiplier': 12187.921501523457}. Best is trial 111 with value: 0.9719298245614035.
[I 2025-08-31 15:40:59,178] Trial 175 finished with value: 0.9719298245614035 and parameters: {'hidden_dim': 1320, 'latent_dim': 29, 'beta': 1.955963783766578, 'gamma': 1.771857394345818, 'dropout_rate': 0.1154169738906784, 'lr': 0.0005564915320516058, 'scheduler_patience': 7, 'class_weight': 0.9336097505330059, 'activation': 'ReLU', 'classification_multiplier': 11569.295857005125}. Best is trial 111 with value: 0.9719298245614035.
[I 2025-08-31 15:41:23,920] Trial 176 finished with value: 0.9701754385964912 and parameters: {'hidden_dim': 1307, 'latent_dim': 40, 'beta': 1.97277962812859, 'gamma': 1.7736465868968043, 'dropout_rate': 0.11799764347836916, 'lr': 0.0003079416134157522, 'scheduler_patience': 7, 'class_weight': 0.9993737376068639, 'activation': 'ReLU', 'classification_multiplier': 11265.124938275505}. Best is trial 111 with value: 0.9719298245614035.
[I 2025-08-31 15:41:48,022] Trial 177 finished with value: 0.9649122807017544 and parameters: {'hidden_dim': 1220, 'latent_dim': 40, 'beta': 1.9626495432858462, 'gamma': 1.7880175264851856, 'dropout_rate': 0.11524374215296146, 'lr': 0.0002882967820935094, 'scheduler_patience': 7, 'class_weight': 0.9965382027578599, 'activation': 'ReLU', 'classification_multiplier': 11092.987769122094}. Best is trial 111 with value: 0.9719298245614035.
[I 2025-08-31 15:42:12,862] Trial 178 finished with value: 0.9543859649122807 and parameters: {'hidden_dim': 1315, 'latent_dim': 38, 'beta': 1.9215513077074438, 'gamma': 1.7200046204552937, 'dropout_rate': 0.14624275951955515, 'lr': 0.0005299754428115222, 'scheduler_patience': 7, 'class_weight': 0.9762925627606149, 'activation': 'ReLU', 'classification_multiplier': 11313.40255540082}. Best is trial 111 with value: 0.9719298245614035.
              precision    recall  f1-score   support

Non-Repeater       0.97      0.97      0.97       158
    Repeater       0.88      0.88      0.88        32

    accuracy                           0.96       190
   macro avg       0.92      0.92      0.92       190
weighted avg       0.96      0.96      0.96       190

Trial 172 - Average Validation Accuracy: 0.9667
Fold 1/3 - Validation Accuracy: 0.9526
Classification Report:
              precision    recall  f1-score   support

Non-Repeater       0.95      0.99      0.97       159
    Repeater       0.96      0.74      0.84        31

    accuracy                           0.95       190
   macro avg       0.96      0.87      0.90       190
weighted avg       0.95      0.95      0.95       190

Fold 2/3 - Validation Accuracy: 0.9579
Classification Report:
              precision    recall  f1-score   support

Non-Repeater       0.96      0.99      0.98       159
    Repeater       0.96      0.77      0.86        31

    accuracy                           0.96       190
   macro avg       0.96      0.88      0.92       190
weighted avg       0.96      0.96      0.96       190

Fold 3/3 - Validation Accuracy: 0.9526
Classification Report:
              precision    recall  f1-score   support

Non-Repeater       0.95      0.99      0.97       158
    Repeater       0.96      0.75      0.84        32

    accuracy                           0.95       190
   macro avg       0.96      0.87      0.91       190
weighted avg       0.95      0.95      0.95       190

Trial 173 - Average Validation Accuracy: 0.9544
Fold 1/3 - Validation Accuracy: 0.9526
Classification Report:
              precision    recall  f1-score   support

Non-Repeater       0.97      0.97      0.97       159
    Repeater       0.87      0.84      0.85        31

    accuracy                           0.95       190
   macro avg       0.92      0.91      0.91       190
weighted avg       0.95      0.95      0.95       190

Fold 2/3 - Validation Accuracy: 0.9789
Classification Report:
              precision    recall  f1-score   support

Non-Repeater       0.98      0.99      0.99       159
    Repeater       0.97      0.90      0.93        31

    accuracy                           0.98       190
   macro avg       0.97      0.95      0.96       190
weighted avg       0.98      0.98      0.98       190

Fold 3/3 - Validation Accuracy: 0.9526
Classification Report:
              precision    recall  f1-score   support

Non-Repeater       0.96      0.98      0.97       158
    Repeater       0.90      0.81      0.85        32

    accuracy                           0.95       190
   macro avg       0.93      0.90      0.91       190
weighted avg       0.95      0.95      0.95       190

Trial 174 - Average Validation Accuracy: 0.9614
Fold 1/3 - Validation Accuracy: 0.9579
Classification Report:
              precision    recall  f1-score   support

Non-Repeater       0.97      0.98      0.97       159
    Repeater       0.90      0.84      0.87        31

    accuracy                           0.96       190
   macro avg       0.93      0.91      0.92       190
weighted avg       0.96      0.96      0.96       190

Fold 2/3 - Validation Accuracy: 0.9789
Classification Report:
              precision    recall  f1-score   support

Non-Repeater       0.98      0.99      0.99       159
    Repeater       0.97      0.90      0.93        31

    accuracy                           0.98       190
   macro avg       0.97      0.95      0.96       190
weighted avg       0.98      0.98      0.98       190

Fold 3/3 - Validation Accuracy: 0.9789
Classification Report:
              precision    recall  f1-score   support

Non-Repeater       0.98      0.99      0.99       158
    Repeater       0.97      0.91      0.94        32

    accuracy                           0.98       190
   macro avg       0.97      0.95      0.96       190
weighted avg       0.98      0.98      0.98       190

Trial 175 - Average Validation Accuracy: 0.9719
Fold 1/3 - Validation Accuracy: 0.9579
Classification Report:
              precision    recall  f1-score   support

Non-Repeater       0.97      0.97      0.97       159
    Repeater       0.87      0.87      0.87        31

    accuracy                           0.96       190
   macro avg       0.92      0.92      0.92       190
weighted avg       0.96      0.96      0.96       190

Fold 2/3 - Validation Accuracy: 0.9842
Classification Report:
              precision    recall  f1-score   support

Non-Repeater       0.99      0.99      0.99       159
    Repeater       0.97      0.94      0.95        31

    accuracy                           0.98       190
   macro avg       0.98      0.96      0.97       190
weighted avg       0.98      0.98      0.98       190

Fold 3/3 - Validation Accuracy: 0.9684
Classification Report:
              precision    recall  f1-score   support

Non-Repeater       0.99      0.97      0.98       158
    Repeater       0.88      0.94      0.91        32

    accuracy                           0.97       190
   macro avg       0.93      0.96      0.94       190
weighted avg       0.97      0.97      0.97       190

Trial 176 - Average Validation Accuracy: 0.9702
Fold 1/3 - Validation Accuracy: 0.9474
Classification Report:
              precision    recall  f1-score   support

Non-Repeater       0.97      0.97      0.97       159
    Repeater       0.84      0.84      0.84        31

    accuracy                           0.95       190
   macro avg       0.90      0.90      0.90       190
weighted avg       0.95      0.95      0.95       190

Fold 2/3 - Validation Accuracy: 0.9737
Classification Report:
              precision    recall  f1-score   support

Non-Repeater       0.98      0.99      0.98       159
    Repeater       0.96      0.87      0.92        31

    accuracy                           0.97       190
   macro avg       0.97      0.93      0.95       190
weighted avg       0.97      0.97      0.97       190

Fold 3/3 - Validation Accuracy: 0.9737
Classification Report:
              precision    recall  f1-score   support

Non-Repeater       0.98      0.99      0.98       158
    Repeater       0.94      0.91      0.92        32

    accuracy                           0.97       190
   macro avg       0.96      0.95      0.95       190
weighted avg       0.97      0.97      0.97       190

Trial 177 - Average Validation Accuracy: 0.9649
Fold 1/3 - Validation Accuracy: 0.9368
Classification Report:
              precision    recall  f1-score   support

Non-Repeater       0.96      0.97      0.96       159
    Repeater       0.83      0.77      0.80        31

    accuracy                           0.94       190
   macro avg       0.89      0.87      0.88       190
weighted avg       0.94      0.94      0.94       190

Fold 2/3 - Validation Accuracy: 0.9632
Classification Report:
              precision    recall  f1-score   support

Non-Repeater       0.97      0.99      0.98       159
    Repeater       0.93      0.84      0.88        31

    accuracy                           0.96       190
   macro avg       0.95      0.91      0.93       190
weighted avg       0.96      0.96      0.96       190

Fold 3/3 - Validation Accuracy: 0.9632
Classification Report:
              precision    recall  f1-score   support

Non-Repeater       0.98      0.97      0.98       158
    Repeater       0.88      0.91      0.89        32

    accuracy                           0.96       190
   macro avg       0.93      0.94      0.94       190
weighted avg       0.96      0.96      0.96       190

Trial 178 - Average Validation Accuracy: 0.9544
Fold 1/3 - Validation Accuracy: 0.9526
Classification Report:
              precision    recall  f1-score   support

Non-Repeater       0.97      0.97      0.97       159
    Repeater       0.84      0.87      0.86        31

    accuracy                           0.95       190
   macro avg       0.91      0.92      0.91       190
weighted avg       0.95      0.95      0.95       190

Fold 2/3 - Validation Accuracy: 0.9684
Classification Report:
[I 2025-08-31 15:42:36,638] Trial 179 finished with value: 0.9614035087719298 and parameters: {'hidden_dim': 1158, 'latent_dim': 40, 'beta': 1.0313070616731572, 'gamma': 1.7613049202857889, 'dropout_rate': 0.10053211218755036, 'lr': 0.0003704267558045596, 'scheduler_patience': 7, 'class_weight': 0.9986474612301319, 'activation': 'ReLU', 'classification_multiplier': 11529.283625372196}. Best is trial 111 with value: 0.9719298245614035.
