[I 2025-08-31 15:31:49,212] Trial 154 finished with value: 0.9456140350877192 and parameters: {'hidden_dim': 1396, 'latent_dim': 36, 'beta': 1.9451520199124988, 'gamma': 1.22064644818459, 'dropout_rate': 0.13169238671710215, 'lr': 0.006691401233869154, 'scheduler_patience': 7, 'class_weight': 0.9264664347708607, 'activation': 'ReLU', 'classification_multiplier': 12083.72525156114}. Best is trial 111 with value: 0.9719298245614035.
[I 2025-08-31 15:32:18,943] Trial 155 finished with value: 0.9614035087719298 and parameters: {'hidden_dim': 1903, 'latent_dim': 40, 'beta': 1.7758779752031297, 'gamma': 1.3590897199334906, 'dropout_rate': 0.12133782408898616, 'lr': 0.0013398569789723285, 'scheduler_patience': 7, 'class_weight': 0.9510185166236946, 'activation': 'ReLU', 'classification_multiplier': 13142.96160474452}. Best is trial 111 with value: 0.9719298245614035.
[I 2025-08-31 15:32:45,819] Trial 156 finished with value: 0.9578947368421052 and parameters: {'hidden_dim': 1597, 'latent_dim': 37, 'beta': 1.8899376778121333, 'gamma': 1.9607728332211292, 'dropout_rate': 0.10409154325506624, 'lr': 0.0003028339770540087, 'scheduler_patience': 4, 'class_weight': 0.9838479659409264, 'activation': 'ReLU', 'classification_multiplier': 12472.026620290548}. Best is trial 111 with value: 0.9719298245614035.
[I 2025-08-31 15:33:13,496] Trial 157 finished with value: 0.9403508771929824 and parameters: {'hidden_dim': 1677, 'latent_dim': 39, 'beta': 1.9649526954675511, 'gamma': 1.4105989645674564, 'dropout_rate': 0.1588963562449486, 'lr': 0.00010926858699849083, 'scheduler_patience': 7, 'class_weight': 0.9968609883577392, 'activation': 'ELU', 'classification_multiplier': 12733.81995976645}. Best is trial 111 with value: 0.9719298245614035.
[I 2025-08-31 15:33:37,919] Trial 158 finished with value: 0.9649122807017544 and parameters: {'hidden_dim': 1268, 'latent_dim': 38, 'beta': 1.9202270796328178, 'gamma': 1.7990461980605588, 'dropout_rate': 0.14028096360823042, 'lr': 0.000777484485353909, 'scheduler_patience': 7, 'class_weight': 0.8802104596726559, 'activation': 'ReLU', 'classification_multiplier': 14007.135189333701}. Best is trial 111 with value: 0.9719298245614035.
              precision    recall  f1-score   support

Non-Repeater       0.96      0.99      0.97       158
    Repeater       0.93      0.81      0.87        32

    accuracy                           0.96       190
   macro avg       0.95      0.90      0.92       190
weighted avg       0.96      0.96      0.96       190

Trial 152 - Average Validation Accuracy: 0.9596
Fold 1/3 - Validation Accuracy: 0.9579
Classification Report:
              precision    recall  f1-score   support

Non-Repeater       0.97      0.97      0.97       159
    Repeater       0.87      0.87      0.87        31

    accuracy                           0.96       190
   macro avg       0.92      0.92      0.92       190
weighted avg       0.96      0.96      0.96       190

Fold 2/3 - Validation Accuracy: 0.9789
Classification Report:
              precision    recall  f1-score   support

Non-Repeater       0.99      0.99      0.99       159
    Repeater       0.94      0.94      0.94        31

    accuracy                           0.98       190
   macro avg       0.96      0.96      0.96       190
weighted avg       0.98      0.98      0.98       190

Fold 3/3 - Validation Accuracy: 0.9684
Classification Report:
              precision    recall  f1-score   support

Non-Repeater       0.97      0.99      0.98       158
    Repeater       0.93      0.88      0.90        32

    accuracy                           0.97       190
   macro avg       0.95      0.93      0.94       190
weighted avg       0.97      0.97      0.97       190

Trial 153 - Average Validation Accuracy: 0.9684
Fold 1/3 - Validation Accuracy: 0.9158
Classification Report:
              precision    recall  f1-score   support

Non-Repeater       0.93      0.97      0.95       159
    Repeater       0.83      0.61      0.70        31

    accuracy                           0.92       190
   macro avg       0.88      0.79      0.83       190
weighted avg       0.91      0.92      0.91       190

Fold 2/3 - Validation Accuracy: 0.9737
Classification Report:
              precision    recall  f1-score   support

Non-Repeater       0.98      0.99      0.98       159
    Repeater       0.93      0.90      0.92        31

    accuracy                           0.97       190
   macro avg       0.96      0.95      0.95       190
weighted avg       0.97      0.97      0.97       190

Fold 3/3 - Validation Accuracy: 0.9474
Classification Report:
              precision    recall  f1-score   support

Non-Repeater       0.98      0.96      0.97       158
    Repeater       0.81      0.91      0.85        32

    accuracy                           0.95       190
   macro avg       0.89      0.93      0.91       190
weighted avg       0.95      0.95      0.95       190

Trial 154 - Average Validation Accuracy: 0.9456
Fold 1/3 - Validation Accuracy: 0.9421
Classification Report:
              precision    recall  f1-score   support

Non-Repeater       0.96      0.97      0.97       159
    Repeater       0.83      0.81      0.82        31

    accuracy                           0.94       190
   macro avg       0.90      0.89      0.89       190
weighted avg       0.94      0.94      0.94       190

Fold 2/3 - Validation Accuracy: 0.9737
Classification Report:
              precision    recall  f1-score   support

Non-Repeater       0.98      0.99      0.98       159
    Repeater       0.96      0.87      0.92        31

    accuracy                           0.97       190
   macro avg       0.97      0.93      0.95       190
weighted avg       0.97      0.97      0.97       190

Fold 3/3 - Validation Accuracy: 0.9684
Classification Report:
              precision    recall  f1-score   support

Non-Repeater       0.99      0.97      0.98       158
    Repeater       0.88      0.94      0.91        32

    accuracy                           0.97       190
   macro avg       0.93      0.96      0.94       190
weighted avg       0.97      0.97      0.97       190

Trial 155 - Average Validation Accuracy: 0.9614
Fold 1/3 - Validation Accuracy: 0.9421
Classification Report:
              precision    recall  f1-score   support

Non-Repeater       0.96      0.97      0.97       159
    Repeater       0.86      0.77      0.81        31

    accuracy                           0.94       190
   macro avg       0.91      0.87      0.89       190
weighted avg       0.94      0.94      0.94       190

Fold 2/3 - Validation Accuracy: 0.9684
Classification Report:
              precision    recall  f1-score   support

Non-Repeater       0.98      0.99      0.98       159
    Repeater       0.93      0.87      0.90        31

    accuracy                           0.97       190
   macro avg       0.95      0.93      0.94       190
weighted avg       0.97      0.97      0.97       190

Fold 3/3 - Validation Accuracy: 0.9632
Classification Report:
              precision    recall  f1-score   support

Non-Repeater       0.99      0.97      0.98       158
    Repeater       0.86      0.94      0.90        32

    accuracy                           0.96       190
   macro avg       0.92      0.95      0.94       190
weighted avg       0.97      0.96      0.96       190

Trial 156 - Average Validation Accuracy: 0.9579
Fold 1/3 - Validation Accuracy: 0.9316
Classification Report:
              precision    recall  f1-score   support

Non-Repeater       0.95      0.97      0.96       159
    Repeater       0.85      0.71      0.77        31

    accuracy                           0.93       190
   macro avg       0.90      0.84      0.87       190
weighted avg       0.93      0.93      0.93       190

Fold 2/3 - Validation Accuracy: 0.9421
Classification Report:
              precision    recall  f1-score   support

Non-Repeater       0.95      0.98      0.97       159
    Repeater       0.88      0.74      0.81        31

    accuracy                           0.94       190
   macro avg       0.92      0.86      0.89       190
weighted avg       0.94      0.94      0.94       190

Fold 3/3 - Validation Accuracy: 0.9474
Classification Report:
              precision    recall  f1-score   support

Non-Repeater       0.97      0.97      0.97       158
    Repeater       0.84      0.84      0.84        32

    accuracy                           0.95       190
   macro avg       0.91      0.91      0.91       190
weighted avg       0.95      0.95      0.95       190

Trial 157 - Average Validation Accuracy: 0.9404
Fold 1/3 - Validation Accuracy: 0.9421
Classification Report:
              precision    recall  f1-score   support

Non-Repeater       0.96      0.97      0.97       159
    Repeater       0.83      0.81      0.82        31

    accuracy                           0.94       190
   macro avg       0.90      0.89      0.89       190
weighted avg       0.94      0.94      0.94       190

Fold 2/3 - Validation Accuracy: 0.9842
Classification Report:
              precision    recall  f1-score   support

Non-Repeater       0.99      0.99      0.99       159
    Repeater       0.97      0.94      0.95        31

    accuracy                           0.98       190
   macro avg       0.98      0.96      0.97       190
weighted avg       0.98      0.98      0.98       190

Fold 3/3 - Validation Accuracy: 0.9684
Classification Report:
              precision    recall  f1-score   support

Non-Repeater       0.99      0.97      0.98       158
    Repeater       0.88      0.94      0.91        32

    accuracy                           0.97       190
   macro avg       0.93      0.96      0.94       190
weighted avg       0.97      0.97      0.97       190

Trial 158 - Average Validation Accuracy: 0.9649
Fold 1/3 - Validation Accuracy: 0.9368
Classification Report:
              precision    recall  f1-score   support

Non-Repeater       0.96      0.97      0.96       159
    Repeater       0.83      0.77      0.80        31

    accuracy                           0.94       190
   macro avg       0.89      0.87      0.88       190
weighted avg       0.94      0.94      0.94       190

Fold 2/3 - Validation Accuracy: 0.9737
Classification Report:
[I 2025-08-31 15:33:59,269] Trial 159 finished with value: 0.9578947368421052 and parameters: {'hidden_dim': 277, 'latent_dim': 24, 'beta': 1.8145522228183406, 'gamma': 1.2559410948980934, 'dropout_rate': 0.12761750516477538, 'lr': 0.0005027595332550494, 'scheduler_patience': 7, 'class_weight': 0.9651515174178742, 'activation': 'ReLU', 'classification_multiplier': 12933.696504275113}. Best is trial 111 with value: 0.9719298245614035.
[I 2025-08-31 15:34:25,680] Trial 160 finished with value: 0.9719298245614035 and parameters: {'hidden_dim': 1511, 'latent_dim': 39, 'beta': 1.9995892082128646, 'gamma': 1.5291355347548725, 'dropout_rate': 0.14758754903047203, 'lr': 0.0011683069832735054, 'scheduler_patience': 7, 'class_weight': 0.9104443501054827, 'activation': 'ReLU', 'classification_multiplier': 11707.933600518894}. Best is trial 111 with value: 0.9719298245614035.
[I 2025-08-31 15:34:52,275] Trial 161 finished with value: 0.9719298245614035 and parameters: {'hidden_dim': 1545, 'latent_dim': 39, 'beta': 1.995277962757337, 'gamma': 1.5380748840501166, 'dropout_rate': 0.15326899546287379, 'lr': 0.0011983690644448571, 'scheduler_patience': 7, 'class_weight': 0.9125862933323978, 'activation': 'ReLU', 'classification_multiplier': 11648.31694246983}. Best is trial 111 with value: 0.9719298245614035.
[I 2025-08-31 15:35:18,898] Trial 162 finished with value: 0.9596491228070175 and parameters: {'hidden_dim': 1544, 'latent_dim': 39, 'beta': 1.9991082474686863, 'gamma': 1.5287615774959158, 'dropout_rate': 0.14689428484441147, 'lr': 0.0010909916586017783, 'scheduler_patience': 7, 'class_weight': 0.9103641787543555, 'activation': 'ReLU', 'classification_multiplier': 11430.881394403421}. Best is trial 111 with value: 0.9719298245614035.
[I 2025-08-31 15:35:45,955] Trial 163 finished with value: 0.9526315789473685 and parameters: {'hidden_dim': 1624, 'latent_dim': 40, 'beta': 1.9470844798517817, 'gamma': 1.5804429446024424, 'dropout_rate': 0.1795323255681426, 'lr': 0.0016648236019710142, 'scheduler_patience': 7, 'class_weight': 0.8892567006352441, 'activation': 'ReLU', 'classification_multiplier': 11728.079287885726}. Best is trial 111 with value: 0.9719298245614035.
[I 2025-08-31 15:36:12,246] Trial 164 finished with value: 0.9631578947368421 and parameters: {'hidden_dim': 1497, 'latent_dim': 38, 'beta': 1.963508978208134, 'gamma': 1.485110953511044, 'dropout_rate': 0.1522707123538012, 'lr': 0.0012004037808899764, 'scheduler_patience': 7, 'class_weight': 0.9504797529315379, 'activation': 'ReLU', 'classification_multiplier': 11913.02937003456}. Best is trial 111 with value: 0.9719298245614035.
[I 2025-08-31 15:36:40,062] Trial 165 finished with value: 0.9596491228070175 and parameters: {'hidden_dim': 1724, 'latent_dim': 39, 'beta': 1.999123300866657, 'gamma': 1.5271541678077687, 'dropout_rate': 0.3180294627574711, 'lr': 0.00034859546564255267, 'scheduler_patience': 7, 'class_weight': 0.7833882344678004, 'activation': 'ReLU', 'classification_multiplier': 11411.20082637387}. Best is trial 111 with value: 0.9719298245614035.
              precision    recall  f1-score   support

Non-Repeater       0.98      0.99      0.98       159
    Repeater       0.96      0.87      0.92        31

    accuracy                           0.97       190
   macro avg       0.97      0.93      0.95       190
weighted avg       0.97      0.97      0.97       190

Fold 3/3 - Validation Accuracy: 0.9632
Classification Report:
              precision    recall  f1-score   support

Non-Repeater       0.98      0.97      0.98       158
    Repeater       0.88      0.91      0.89        32

    accuracy                           0.96       190
   macro avg       0.93      0.94      0.94       190
weighted avg       0.96      0.96      0.96       190

Trial 159 - Average Validation Accuracy: 0.9579
Fold 1/3 - Validation Accuracy: 0.9737
Classification Report:
              precision    recall  f1-score   support

Non-Repeater       0.98      0.99      0.98       159
    Repeater       0.96      0.87      0.92        31

    accuracy                           0.97       190
   macro avg       0.97      0.93      0.95       190
weighted avg       0.97      0.97      0.97       190

Fold 2/3 - Validation Accuracy: 0.9789
Classification Report:
              precision    recall  f1-score   support

Non-Repeater       0.98      0.99      0.99       159
    Repeater       0.97      0.90      0.93        31

    accuracy                           0.98       190
   macro avg       0.97      0.95      0.96       190
weighted avg       0.98      0.98      0.98       190

Fold 3/3 - Validation Accuracy: 0.9632
Classification Report:
              precision    recall  f1-score   support

Non-Repeater       0.98      0.97      0.98       158
    Repeater       0.88      0.91      0.89        32

    accuracy                           0.96       190
   macro avg       0.93      0.94      0.94       190
weighted avg       0.96      0.96      0.96       190

Trial 160 - Average Validation Accuracy: 0.9719
Fold 1/3 - Validation Accuracy: 0.9632
Classification Report:
              precision    recall  f1-score   support

Non-Repeater       0.97      0.98      0.98       159
    Repeater       0.90      0.87      0.89        31

    accuracy                           0.96       190
   macro avg       0.94      0.93      0.93       190
weighted avg       0.96      0.96      0.96       190

Fold 2/3 - Validation Accuracy: 0.9789
Classification Report:
              precision    recall  f1-score   support

Non-Repeater       0.98      0.99      0.99       159
    Repeater       0.97      0.90      0.93        31

    accuracy                           0.98       190
   macro avg       0.97      0.95      0.96       190
weighted avg       0.98      0.98      0.98       190

Fold 3/3 - Validation Accuracy: 0.9737
Classification Report:
              precision    recall  f1-score   support

Non-Repeater       0.97      1.00      0.98       158
    Repeater       1.00      0.84      0.92        32

    accuracy                           0.97       190
   macro avg       0.98      0.92      0.95       190
weighted avg       0.97      0.97      0.97       190

Trial 161 - Average Validation Accuracy: 0.9719
Fold 1/3 - Validation Accuracy: 0.9632
Classification Report:
              precision    recall  f1-score   support

Non-Repeater       0.97      0.99      0.98       159
    Repeater       0.93      0.84      0.88        31

    accuracy                           0.96       190
   macro avg       0.95      0.91      0.93       190
weighted avg       0.96      0.96      0.96       190

Fold 2/3 - Validation Accuracy: 0.9632
Classification Report:
              precision    recall  f1-score   support

Non-Repeater       0.96      0.99      0.98       159
    Repeater       0.96      0.81      0.88        31

    accuracy                           0.96       190
   macro avg       0.96      0.90      0.93       190
weighted avg       0.96      0.96      0.96       190

Fold 3/3 - Validation Accuracy: 0.9526
Classification Report:
              precision    recall  f1-score   support

Non-Repeater       0.96      0.98      0.97       158
    Repeater       0.90      0.81      0.85        32

    accuracy                           0.95       190
   macro avg       0.93      0.90      0.91       190
weighted avg       0.95      0.95      0.95       190

Trial 162 - Average Validation Accuracy: 0.9596
Fold 1/3 - Validation Accuracy: 0.9632
Classification Report:
              precision    recall  f1-score   support

Non-Repeater       0.96      1.00      0.98       159
    Repeater       1.00      0.77      0.87        31

    accuracy                           0.96       190
   macro avg       0.98      0.89      0.93       190
weighted avg       0.96      0.96      0.96       190

Fold 2/3 - Validation Accuracy: 0.9421
Classification Report:
              precision    recall  f1-score   support

Non-Repeater       0.94      0.99      0.97       159
    Repeater       0.95      0.68      0.79        31

    accuracy                           0.94       190
   macro avg       0.95      0.84      0.88       190
weighted avg       0.94      0.94      0.94       190

Fold 3/3 - Validation Accuracy: 0.9526
Classification Report:
              precision    recall  f1-score   support

Non-Repeater       0.96      0.99      0.97       158
    Repeater       0.93      0.78      0.85        32

    accuracy                           0.95       190
   macro avg       0.94      0.88      0.91       190
weighted avg       0.95      0.95      0.95       190

Trial 163 - Average Validation Accuracy: 0.9526
Fold 1/3 - Validation Accuracy: 0.9526
Classification Report:
              precision    recall  f1-score   support

Non-Repeater       0.96      0.98      0.97       159
    Repeater       0.89      0.81      0.85        31

    accuracy                           0.95       190
   macro avg       0.93      0.89      0.91       190
weighted avg       0.95      0.95      0.95       190

Fold 2/3 - Validation Accuracy: 0.9737
Classification Report:
              precision    recall  f1-score   support

Non-Repeater       0.98      0.99      0.98       159
    Repeater       0.96      0.87      0.92        31

    accuracy                           0.97       190
   macro avg       0.97      0.93      0.95       190
weighted avg       0.97      0.97      0.97       190

Fold 3/3 - Validation Accuracy: 0.9632
Classification Report:
              precision    recall  f1-score   support

Non-Repeater       0.97      0.99      0.98       158
    Repeater       0.93      0.84      0.89        32

    accuracy                           0.96       190
   macro avg       0.95      0.92      0.93       190
weighted avg       0.96      0.96      0.96       190

Trial 164 - Average Validation Accuracy: 0.9632
Fold 1/3 - Validation Accuracy: 0.9526
Classification Report:
              precision    recall  f1-score   support

Non-Repeater       0.96      0.99      0.97       159
    Repeater       0.92      0.77      0.84        31

    accuracy                           0.95       190
   macro avg       0.94      0.88      0.91       190
weighted avg       0.95      0.95      0.95       190

Fold 2/3 - Validation Accuracy: 0.9632
Classification Report:
              precision    recall  f1-score   support

Non-Repeater       0.96      0.99      0.98       159
    Repeater       0.96      0.81      0.88        31

    accuracy                           0.96       190
   macro avg       0.96      0.90      0.93       190
weighted avg       0.96      0.96      0.96       190

Fold 3/3 - Validation Accuracy: 0.9632
Classification Report:
              precision    recall  f1-score   support

Non-Repeater       0.98      0.97      0.98       158
    Repeater       0.88      0.91      0.89        32

    accuracy                           0.96       190
   macro avg       0.93      0.94      0.94       190
weighted avg       0.96      0.96      0.96       190

Trial 165 - Average Validation Accuracy: 0.9596
Fold 1/3 - Validation Accuracy: 0.9421
Classification Report:
[I 2025-08-31 15:37:06,951] Trial 166 finished with value: 0.9456140350877194 and parameters: {'hidden_dim': 1575, 'latent_dim': 38, 'beta': 1.921858930819067, 'gamma': 1.44485952025137, 'dropout_rate': 0.16018676113263527, 'lr': 0.0005236450176233294, 'scheduler_patience': 7, 'class_weight': 0.8331229718413061, 'activation': 'SELU', 'classification_multiplier': 12181.501433597892}. Best is trial 111 with value: 0.9719298245614035.
