[I 2025-08-31 14:34:09,425] Trial 24 finished with value: 0.9526315789473684 and parameters: {'hidden_dim': 864, 'latent_dim': 5, 'beta': 1.989357976435422, 'gamma': 0.5126748636196017, 'dropout_rate': 0.2727575193043313, 'lr': 0.0015343629306013077, 'scheduler_patience': 7, 'class_weight': 0.5486794143140061, 'activation': 'ReLU', 'classification_multiplier': 12536.325866576215}. Best is trial 22 with value: 0.9578947368421052.
[I 2025-08-31 14:34:35,885] Trial 25 finished with value: 0.9508771929824561 and parameters: {'hidden_dim': 1140, 'latent_dim': 14, 'beta': 1.827208618751386, 'gamma': 0.3429994184380049, 'dropout_rate': 0.21691060949050606, 'lr': 0.005561154835549892, 'scheduler_patience': 6, 'class_weight': 0.4147568777696202, 'activation': 'ReLU', 'classification_multiplier': 11987.099377160934}. Best is trial 22 with value: 0.9578947368421052.
              precision    recall  f1-score   support

Non-Repeater       0.93      0.98      0.96       159
    Repeater       0.87      0.65      0.74        31

    accuracy                           0.93       190
   macro avg       0.90      0.81      0.85       190
weighted avg       0.92      0.93      0.92       190

Fold 3/3 - Validation Accuracy: 0.9526
Classification Report:
              precision    recall  f1-score   support

Non-Repeater       0.97      0.97      0.97       158
    Repeater       0.87      0.84      0.86        32

    accuracy                           0.95       190
   macro avg       0.92      0.91      0.91       190
weighted avg       0.95      0.95      0.95       190

Trial 19 - Average Validation Accuracy: 0.9421
Fold 1/3 - Validation Accuracy: 0.9474
Classification Report:
              precision    recall  f1-score   support

Non-Repeater       0.94      1.00      0.97       159
    Repeater       1.00      0.68      0.81        31

    accuracy                           0.95       190
   macro avg       0.97      0.84      0.89       190
weighted avg       0.95      0.95      0.94       190

Fold 2/3 - Validation Accuracy: 0.9368
Classification Report:
              precision    recall  f1-score   support

Non-Repeater       0.93      0.99      0.96       159
    Repeater       0.95      0.65      0.77        31

    accuracy                           0.94       190
   macro avg       0.94      0.82      0.87       190
weighted avg       0.94      0.94      0.93       190

Fold 3/3 - Validation Accuracy: 0.9211
Classification Report:
              precision    recall  f1-score   support

Non-Repeater       0.92      0.99      0.95       158
    Repeater       0.95      0.56      0.71        32

    accuracy                           0.92       190
   macro avg       0.93      0.78      0.83       190
weighted avg       0.92      0.92      0.91       190

Trial 20 - Average Validation Accuracy: 0.9351
Fold 1/3 - Validation Accuracy: 0.9368
Classification Report:
              precision    recall  f1-score   support

Non-Repeater       0.95      0.97      0.96       159
    Repeater       0.85      0.74      0.79        31

    accuracy                           0.94       190
   macro avg       0.90      0.86      0.88       190
weighted avg       0.93      0.94      0.94       190

Fold 2/3 - Validation Accuracy: 0.9474
Classification Report:
              precision    recall  f1-score   support

Non-Repeater       0.95      0.99      0.97       159
    Repeater       0.92      0.74      0.82        31

    accuracy                           0.95       190
   macro avg       0.94      0.86      0.90       190
weighted avg       0.95      0.95      0.95       190

Fold 3/3 - Validation Accuracy: 0.9526
Classification Report:
              precision    recall  f1-score   support

Non-Repeater       0.96      0.98      0.97       158
    Repeater       0.90      0.81      0.85        32

    accuracy                           0.95       190
   macro avg       0.93      0.90      0.91       190
weighted avg       0.95      0.95      0.95       190

Trial 21 - Average Validation Accuracy: 0.9456
Fold 1/3 - Validation Accuracy: 0.9579
Classification Report:
              precision    recall  f1-score   support

Non-Repeater       0.96      0.99      0.98       159
    Repeater       0.96      0.77      0.86        31

    accuracy                           0.96       190
   macro avg       0.96      0.88      0.92       190
weighted avg       0.96      0.96      0.96       190

Fold 2/3 - Validation Accuracy: 0.9579
Classification Report:
              precision    recall  f1-score   support

Non-Repeater       0.96      0.99      0.98       159
    Repeater       0.96      0.77      0.86        31

    accuracy                           0.96       190
   macro avg       0.96      0.88      0.92       190
weighted avg       0.96      0.96      0.96       190

Fold 3/3 - Validation Accuracy: 0.9579
Classification Report:
              precision    recall  f1-score   support

Non-Repeater       0.96      0.99      0.98       158
    Repeater       0.96      0.78      0.86        32

    accuracy                           0.96       190
   macro avg       0.96      0.89      0.92       190
weighted avg       0.96      0.96      0.96       190

Trial 22 - Average Validation Accuracy: 0.9579
Fold 1/3 - Validation Accuracy: 0.9474
Classification Report:
              precision    recall  f1-score   support

Non-Repeater       0.95      0.99      0.97       159
    Repeater       0.92      0.74      0.82        31

    accuracy                           0.95       190
   macro avg       0.94      0.86      0.90       190
weighted avg       0.95      0.95      0.95       190

Fold 2/3 - Validation Accuracy: 0.9579
Classification Report:
              precision    recall  f1-score   support

Non-Repeater       0.96      0.99      0.98       159
    Repeater       0.93      0.81      0.86        31

    accuracy                           0.96       190
   macro avg       0.94      0.90      0.92       190
weighted avg       0.96      0.96      0.96       190

Fold 3/3 - Validation Accuracy: 0.9579
Classification Report:
              precision    recall  f1-score   support

Non-Repeater       0.97      0.98      0.97       158
    Repeater       0.90      0.84      0.87        32

    accuracy                           0.96       190
   macro avg       0.93      0.91      0.92       190
weighted avg       0.96      0.96      0.96       190

Trial 23 - Average Validation Accuracy: 0.9544
Fold 1/3 - Validation Accuracy: 0.9526
Classification Report:
              precision    recall  f1-score   support

Non-Repeater       0.96      0.99      0.97       159
    Repeater       0.92      0.77      0.84        31

    accuracy                           0.95       190
   macro avg       0.94      0.88      0.91       190
weighted avg       0.95      0.95      0.95       190

Fold 2/3 - Validation Accuracy: 0.9526
Classification Report:
              precision    recall  f1-score   support

Non-Repeater       0.95      0.99      0.97       159
    Repeater       0.96      0.74      0.84        31

    accuracy                           0.95       190
   macro avg       0.96      0.87      0.90       190
weighted avg       0.95      0.95      0.95       190

Fold 3/3 - Validation Accuracy: 0.9526
Classification Report:
              precision    recall  f1-score   support

Non-Repeater       0.96      0.99      0.97       158
    Repeater       0.93      0.78      0.85        32

    accuracy                           0.95       190
   macro avg       0.94      0.88      0.91       190
weighted avg       0.95      0.95      0.95       190

Trial 24 - Average Validation Accuracy: 0.9526
Fold 1/3 - Validation Accuracy: 0.9474
Classification Report:
              precision    recall  f1-score   support

Non-Repeater       0.94      1.00      0.97       159
    Repeater       1.00      0.68      0.81        31

    accuracy                           0.95       190
   macro avg       0.97      0.84      0.89       190
weighted avg       0.95      0.95      0.94       190

Fold 2/3 - Validation Accuracy: 0.9526
Classification Report:
              precision    recall  f1-score   support

Non-Repeater       0.95      0.99      0.97       159
    Repeater       0.96      0.74      0.84        31

    accuracy                           0.95       190
   macro avg       0.96      0.87      0.90       190
weighted avg       0.95      0.95      0.95       190

Fold 3/3 - Validation Accuracy: 0.9526
Classification Report:
              precision    recall  f1-score   support

Non-Repeater       0.96      0.99      0.97       158
    Repeater       0.93      0.78      0.85        32

    accuracy                           0.95       190
   macro avg       0.94      0.88      0.91       190
weighted avg       0.95      0.95      0.95       190

Trial 25 - Average Validation Accuracy: 0.9509
Fold 1/3 - Validation Accuracy: 0.9474
Classification Report:
[I 2025-08-31 14:35:05,631] Trial 26 finished with value: 0.9526315789473684 and parameters: {'hidden_dim': 1531, 'latent_dim': 8, 'beta': 1.283818011846909, 'gamma': 0.6208522869000852, 'dropout_rate': 0.2643225697677168, 'lr': 0.004286112237967853, 'scheduler_patience': 7, 'class_weight': 0.7812870406493566, 'activation': 'ReLU', 'classification_multiplier': 13544.228379522592}. Best is trial 22 with value: 0.9578947368421052.
[I 2025-08-31 14:35:26,815] Trial 27 finished with value: 0.9491228070175438 and parameters: {'hidden_dim': 466, 'latent_dim': 9, 'beta': 1.8488185242236492, 'gamma': 0.35656190990112735, 'dropout_rate': 0.29581778686076343, 'lr': 0.0029503985867194308, 'scheduler_patience': 5, 'class_weight': 0.6427411966723026, 'activation': 'ReLU', 'classification_multiplier': 14474.699432521413}. Best is trial 22 with value: 0.9578947368421052.
[I 2025-08-31 14:35:51,530] Trial 28 finished with value: 0.9473684210526315 and parameters: {'hidden_dim': 829, 'latent_dim': 13, 'beta': 1.0566837874550998, 'gamma': 0.8554913354927252, 'dropout_rate': 0.36472545907052323, 'lr': 0.005343232500851544, 'scheduler_patience': 6, 'class_weight': 0.5245931116103103, 'activation': 'ReLU', 'classification_multiplier': 5132.845579248072}. Best is trial 22 with value: 0.9578947368421052.
[I 2025-08-31 14:36:15,869] Trial 29 finished with value: 0.9263157894736841 and parameters: {'hidden_dim': 710, 'latent_dim': 36, 'beta': 1.9505845321040005, 'gamma': 0.5864911738932108, 'dropout_rate': 0.42021989617092337, 'lr': 0.007565724994543896, 'scheduler_patience': 6, 'class_weight': 0.41677350789251083, 'activation': 'ReLU', 'classification_multiplier': 14722.65992521876}. Best is trial 22 with value: 0.9578947368421052.
[I 2025-08-31 14:36:39,549] Trial 30 finished with value: 0.9666666666666667 and parameters: {'hidden_dim': 1025, 'latent_dim': 30, 'beta': 1.5304583083464682, 'gamma': 0.7847428197374934, 'dropout_rate': 0.19884614658909322, 'lr': 0.0016149844563863867, 'scheduler_patience': 7, 'class_weight': 0.5896537353728362, 'activation': 'ReLU', 'classification_multiplier': 9884.573226871711}. Best is trial 30 with value: 0.9666666666666667.
[I 2025-08-31 14:37:02,762] Trial 31 finished with value: 0.956140350877193 and parameters: {'hidden_dim': 1056, 'latent_dim': 31, 'beta': 1.5681116056301432, 'gamma': 0.7992633505169756, 'dropout_rate': 0.20164816362191368, 'lr': 0.0019674285594619987, 'scheduler_patience': 7, 'class_weight': 0.5912628278256148, 'activation': 'ReLU', 'classification_multiplier': 10059.601694152685}. Best is trial 30 with value: 0.9666666666666667.
              precision    recall  f1-score   support

Non-Repeater       0.96      0.98      0.97       159
    Repeater       0.89      0.77      0.83        31

    accuracy                           0.95       190
   macro avg       0.92      0.88      0.90       190
weighted avg       0.95      0.95      0.95       190

Fold 2/3 - Validation Accuracy: 0.9579
Classification Report:
              precision    recall  f1-score   support

Non-Repeater       0.96      0.99      0.98       159
    Repeater       0.96      0.77      0.86        31

    accuracy                           0.96       190
   macro avg       0.96      0.88      0.92       190
weighted avg       0.96      0.96      0.96       190

Fold 3/3 - Validation Accuracy: 0.9526
Classification Report:
              precision    recall  f1-score   support

Non-Repeater       0.96      0.99      0.97       158
    Repeater       0.93      0.78      0.85        32

    accuracy                           0.95       190
   macro avg       0.94      0.88      0.91       190
weighted avg       0.95      0.95      0.95       190

Trial 26 - Average Validation Accuracy: 0.9526
Fold 1/3 - Validation Accuracy: 0.9474
Classification Report:
              precision    recall  f1-score   support

Non-Repeater       0.95      0.99      0.97       159
    Repeater       0.92      0.74      0.82        31

    accuracy                           0.95       190
   macro avg       0.94      0.86      0.90       190
weighted avg       0.95      0.95      0.95       190

Fold 2/3 - Validation Accuracy: 0.9526
Classification Report:
              precision    recall  f1-score   support

Non-Repeater       0.95      0.99      0.97       159
    Repeater       0.96      0.74      0.84        31

    accuracy                           0.95       190
   macro avg       0.96      0.87      0.90       190
weighted avg       0.95      0.95      0.95       190

Fold 3/3 - Validation Accuracy: 0.9474
Classification Report:
              precision    recall  f1-score   support

Non-Repeater       0.95      0.99      0.97       158
    Repeater       0.92      0.75      0.83        32

    accuracy                           0.95       190
   macro avg       0.94      0.87      0.90       190
weighted avg       0.95      0.95      0.95       190

Trial 27 - Average Validation Accuracy: 0.9491
Fold 1/3 - Validation Accuracy: 0.9421
Classification Report:
              precision    recall  f1-score   support

Non-Repeater       0.95      0.99      0.97       159
    Repeater       0.92      0.71      0.80        31

    accuracy                           0.94       190
   macro avg       0.93      0.85      0.88       190
weighted avg       0.94      0.94      0.94       190

Fold 2/3 - Validation Accuracy: 0.9526
Classification Report:
              precision    recall  f1-score   support

Non-Repeater       0.95      0.99      0.97       159
    Repeater       0.96      0.74      0.84        31

    accuracy                           0.95       190
   macro avg       0.96      0.87      0.90       190
weighted avg       0.95      0.95      0.95       190

Fold 3/3 - Validation Accuracy: 0.9474
Classification Report:
              precision    recall  f1-score   support

Non-Repeater       0.95      0.99      0.97       158
    Repeater       0.92      0.75      0.83        32

    accuracy                           0.95       190
   macro avg       0.94      0.87      0.90       190
weighted avg       0.95      0.95      0.95       190

Trial 28 - Average Validation Accuracy: 0.9474
Fold 1/3 - Validation Accuracy: 0.9368
Classification Report:
              precision    recall  f1-score   support

Non-Repeater       0.93      0.99      0.96       159
    Repeater       0.95      0.65      0.77        31

    accuracy                           0.94       190
   macro avg       0.94      0.82      0.87       190
weighted avg       0.94      0.94      0.93       190

Fold 2/3 - Validation Accuracy: 0.9211
Classification Report:
              precision    recall  f1-score   support

Non-Repeater       0.93      0.98      0.95       159
    Repeater       0.86      0.61      0.72        31

    accuracy                           0.92       190
   macro avg       0.90      0.80      0.84       190
weighted avg       0.92      0.92      0.92       190

Fold 3/3 - Validation Accuracy: 0.9211
Classification Report:
              precision    recall  f1-score   support

Non-Repeater       0.93      0.98      0.95       158
    Repeater       0.87      0.62      0.73        32

    accuracy                           0.92       190
   macro avg       0.90      0.80      0.84       190
weighted avg       0.92      0.92      0.92       190

Trial 29 - Average Validation Accuracy: 0.9263
Fold 1/3 - Validation Accuracy: 0.9684
Classification Report:
              precision    recall  f1-score   support

Non-Repeater       0.97      0.99      0.98       159
    Repeater       0.96      0.84      0.90        31

    accuracy                           0.97       190
   macro avg       0.97      0.92      0.94       190
weighted avg       0.97      0.97      0.97       190

Fold 2/3 - Validation Accuracy: 0.9737
Classification Report:
              precision    recall  f1-score   support

Non-Repeater       0.98      0.99      0.98       159
    Repeater       0.96      0.87      0.92        31

    accuracy                           0.97       190
   macro avg       0.97      0.93      0.95       190
weighted avg       0.97      0.97      0.97       190

Fold 3/3 - Validation Accuracy: 0.9579
Classification Report:
              precision    recall  f1-score   support

Non-Repeater       0.96      0.99      0.97       158
    Repeater       0.93      0.81      0.87        32

    accuracy                           0.96       190
   macro avg       0.95      0.90      0.92       190
weighted avg       0.96      0.96      0.96       190

Trial 30 - Average Validation Accuracy: 0.9667
Fold 1/3 - Validation Accuracy: 0.9579
Classification Report:
              precision    recall  f1-score   support

Non-Repeater       0.95      1.00      0.98       159
    Repeater       1.00      0.74      0.85        31

    accuracy                           0.96       190
   macro avg       0.98      0.87      0.91       190
weighted avg       0.96      0.96      0.96       190

Fold 2/3 - Validation Accuracy: 0.9632
Classification Report:
              precision    recall  f1-score   support

Non-Repeater       0.96      0.99      0.98       159
    Repeater       0.96      0.81      0.88        31

    accuracy                           0.96       190
   macro avg       0.96      0.90      0.93       190
weighted avg       0.96      0.96      0.96       190

Fold 3/3 - Validation Accuracy: 0.9474
Classification Report:
              precision    recall  f1-score   support

Non-Repeater       0.95      0.99      0.97       158
    Repeater       0.92      0.75      0.83        32

    accuracy                           0.95       190
   macro avg       0.94      0.87      0.90       190
weighted avg       0.95      0.95      0.95       190

Trial 31 - Average Validation Accuracy: 0.9561
Fold 1/3 - Validation Accuracy: 0.9632
Classification Report:
              precision    recall  f1-score   support

Non-Repeater       0.96      1.00      0.98       159
    Repeater       1.00      0.77      0.87        31

    accuracy                           0.96       190
   macro avg       0.98      0.89      0.93       190
weighted avg       0.96      0.96      0.96       190

Fold 2/3 - Validation Accuracy: 0.9474
Classification Report:
              precision    recall  f1-score   support

Non-Repeater       0.95      0.99      0.97       159
    Repeater       0.96      0.71      0.81        31

    accuracy                           0.95       190
   macro avg       0.95      0.85      0.89       190
weighted avg       0.95      0.95      0.94       190

Fold 3/3 - Validation Accuracy: 0.9526
Classification Report:
[I 2025-08-31 14:37:28,559] Trial 32 finished with value: 0.9543859649122807 and parameters: {'hidden_dim': 1020, 'latent_dim': 32, 'beta': 1.535226160417748, 'gamma': 0.8033556037865479, 'dropout_rate': 0.15763195120395812, 'lr': 0.0013212636793948844, 'scheduler_patience': 7, 'class_weight': 0.49646054569020004, 'activation': 'ReLU', 'classification_multiplier': 8434.4752686509}. Best is trial 30 with value: 0.9666666666666667.
[I 2025-08-31 14:37:52,281] Trial 33 finished with value: 0.9350877192982456 and parameters: {'hidden_dim': 799, 'latent_dim': 31, 'beta': 1.3426097838279978, 'gamma': 0.6829512438517595, 'dropout_rate': 0.10277491713468867, 'lr': 0.002196012571842956, 'scheduler_patience': 7, 'class_weight': 0.1594356333942843, 'activation': 'ReLU', 'classification_multiplier': 9696.908301973877}. Best is trial 30 with value: 0.9666666666666667.
[I 2025-08-31 14:38:17,005] Trial 34 finished with value: 0.9631578947368421 and parameters: {'hidden_dim': 958, 'latent_dim': 39, 'beta': 1.5651114019181955, 'gamma': 0.8179115322777035, 'dropout_rate': 0.19963032762805047, 'lr': 0.001698894306437701, 'scheduler_patience': 7, 'class_weight': 0.6728132511719681, 'activation': 'ReLU', 'classification_multiplier': 9062.876275263969}. Best is trial 30 with value: 0.9666666666666667.
[I 2025-08-31 14:38:38,507] Trial 35 finished with value: 0.9508771929824561 and parameters: {'hidden_dim': 599, 'latent_dim': 38, 'beta': 1.7208582612148815, 'gamma': 0.9335549828950198, 'dropout_rate': 0.18190824453812543, 'lr': 0.002840632482121724, 'scheduler_patience': 7, 'class_weight': 0.7687770196400691, 'activation': 'ReLU', 'classification_multiplier': 6979.5032451477855}. Best is trial 30 with value: 0.9666666666666667.
[I 2025-08-31 14:39:01,373] Trial 36 finished with value: 0.9333333333333332 and parameters: {'hidden_dim': 968, 'latent_dim': 40, 'beta': 1.1012349606481975, 'gamma': 0.395341539778434, 'dropout_rate': 0.24630100261505564, 'lr': 0.009899894397188752, 'scheduler_patience': 7, 'class_weight': 0.6766246994280206, 'activation': 'ELU', 'classification_multiplier': 9075.279296854354}. Best is trial 30 with value: 0.9666666666666667.
