[I 2025-08-31 14:44:43,494] Trial 50 finished with value: 0.9456140350877194 and parameters: {'hidden_dim': 1264, 'latent_dim': 29, 'beta': 1.6476331593631628, 'gamma': 1.0057953083755973, 'dropout_rate': 0.15316813280759425, 'lr': 0.0027082983227749557, 'scheduler_patience': 2, 'class_weight': 0.5501526025214574, 'activation': 'GELU', 'classification_multiplier': 9769.766184283722}. Best is trial 44 with value: 0.968421052631579.
[I 2025-08-31 14:45:13,584] Trial 51 finished with value: 0.9614035087719298 and parameters: {'hidden_dim': 1515, 'latent_dim': 37, 'beta': 1.587090848075501, 'gamma': 1.1300902772978683, 'dropout_rate': 0.10856910053198925, 'lr': 0.0005083949861265438, 'scheduler_patience': 7, 'class_weight': 0.45754028553261467, 'activation': 'ReLU', 'classification_multiplier': 8937.451014856179}. Best is trial 44 with value: 0.968421052631579.
              precision    recall  f1-score   support

Non-Repeater       0.95      0.99      0.97       159
    Repeater       0.92      0.71      0.80        31

    accuracy                           0.94       190
   macro avg       0.93      0.85      0.88       190
weighted avg       0.94      0.94      0.94       190

Fold 2/3 - Validation Accuracy: 0.9368
Classification Report:
              precision    recall  f1-score   support

Non-Repeater       0.93      0.99      0.96       159
    Repeater       0.95      0.65      0.77        31

    accuracy                           0.94       190
   macro avg       0.94      0.82      0.87       190
weighted avg       0.94      0.94      0.93       190

Fold 3/3 - Validation Accuracy: 0.9421
Classification Report:
              precision    recall  f1-score   support

Non-Repeater       0.95      0.99      0.97       158
    Repeater       0.92      0.72      0.81        32

    accuracy                           0.94       190
   macro avg       0.93      0.85      0.89       190
weighted avg       0.94      0.94      0.94       190

Trial 46 - Average Validation Accuracy: 0.9404
Fold 1/3 - Validation Accuracy: 0.9526
Classification Report:
              precision    recall  f1-score   support

Non-Repeater       0.95      1.00      0.97       159
    Repeater       1.00      0.71      0.83        31

    accuracy                           0.95       190
   macro avg       0.97      0.85      0.90       190
weighted avg       0.96      0.95      0.95       190

Fold 2/3 - Validation Accuracy: 0.9316
Classification Report:
              precision    recall  f1-score   support

Non-Repeater       0.93      0.99      0.96       159
    Repeater       0.95      0.61      0.75        31

    accuracy                           0.93       190
   macro avg       0.94      0.80      0.85       190
weighted avg       0.93      0.93      0.93       190

Fold 3/3 - Validation Accuracy: 0.9526
Classification Report:
              precision    recall  f1-score   support

Non-Repeater       0.95      1.00      0.97       158
    Repeater       1.00      0.72      0.84        32

    accuracy                           0.95       190
   macro avg       0.97      0.86      0.90       190
weighted avg       0.96      0.95      0.95       190

Trial 47 - Average Validation Accuracy: 0.9456
Fold 1/3 - Validation Accuracy: 0.9211
Classification Report:
              precision    recall  f1-score   support

Non-Repeater       0.92      0.99      0.95       159
    Repeater       0.90      0.58      0.71        31

    accuracy                           0.92       190
   macro avg       0.91      0.78      0.83       190
weighted avg       0.92      0.92      0.91       190

Fold 2/3 - Validation Accuracy: 0.9263
Classification Report:
              precision    recall  f1-score   support

Non-Repeater       0.93      0.99      0.96       159
    Repeater       0.90      0.61      0.73        31

    accuracy                           0.93       190
   macro avg       0.92      0.80      0.84       190
weighted avg       0.93      0.93      0.92       190

Fold 3/3 - Validation Accuracy: 0.9158
Classification Report:
              precision    recall  f1-score   support

Non-Repeater       0.91      0.99      0.95       158
    Repeater       0.94      0.53      0.68        32

    accuracy                           0.92       190
   macro avg       0.93      0.76      0.82       190
weighted avg       0.92      0.92      0.91       190

Trial 48 - Average Validation Accuracy: 0.9211
Fold 1/3 - Validation Accuracy: 0.9368
Classification Report:
              precision    recall  f1-score   support

Non-Repeater       0.93      0.99      0.96       159
    Repeater       0.95      0.65      0.77        31

    accuracy                           0.94       190
   macro avg       0.94      0.82      0.87       190
weighted avg       0.94      0.94      0.93       190

Fold 2/3 - Validation Accuracy: 0.9526
Classification Report:
              precision    recall  f1-score   support

Non-Repeater       0.95      0.99      0.97       159
    Repeater       0.96      0.74      0.84        31

    accuracy                           0.95       190
   macro avg       0.96      0.87      0.90       190
weighted avg       0.95      0.95      0.95       190

Fold 3/3 - Validation Accuracy: 0.9526
Classification Report:
              precision    recall  f1-score   support

Non-Repeater       0.95      0.99      0.97       158
    Repeater       0.96      0.75      0.84        32

    accuracy                           0.95       190
   macro avg       0.96      0.87      0.91       190
weighted avg       0.95      0.95      0.95       190

Trial 49 - Average Validation Accuracy: 0.9474
Fold 1/3 - Validation Accuracy: 0.9421
Classification Report:
              precision    recall  f1-score   support

Non-Repeater       0.94      0.99      0.97       159
    Repeater       0.95      0.68      0.79        31

    accuracy                           0.94       190
   macro avg       0.95      0.84      0.88       190
weighted avg       0.94      0.94      0.94       190

Fold 2/3 - Validation Accuracy: 0.9526
Classification Report:
              precision    recall  f1-score   support

Non-Repeater       0.96      0.99      0.97       159
    Repeater       0.92      0.77      0.84        31

    accuracy                           0.95       190
   macro avg       0.94      0.88      0.91       190
weighted avg       0.95      0.95      0.95       190

Fold 3/3 - Validation Accuracy: 0.9421
Classification Report:
              precision    recall  f1-score   support

Non-Repeater       0.95      0.98      0.97       158
    Repeater       0.89      0.75      0.81        32

    accuracy                           0.94       190
   macro avg       0.92      0.87      0.89       190
weighted avg       0.94      0.94      0.94       190

Trial 50 - Average Validation Accuracy: 0.9456
Fold 1/3 - Validation Accuracy: 0.9526
Classification Report:
              precision    recall  f1-score   support

Non-Repeater       0.95      0.99      0.97       159
    Repeater       0.96      0.74      0.84        31

    accuracy                           0.95       190
   macro avg       0.96      0.87      0.90       190
weighted avg       0.95      0.95      0.95       190

Fold 2/3 - Validation Accuracy: 0.9684
Classification Report:
              precision    recall  f1-score   support

Non-Repeater       0.97      0.99      0.98       159
    Repeater       0.96      0.84      0.90        31

    accuracy                           0.97       190
   macro avg       0.97      0.92      0.94       190
weighted avg       0.97      0.97      0.97       190

Fold 3/3 - Validation Accuracy: 0.9632
Classification Report:
              precision    recall  f1-score   support

Non-Repeater       0.96      0.99      0.98       158
    Repeater       0.96      0.81      0.88        32

    accuracy                           0.96       190
   macro avg       0.96      0.90      0.93       190
weighted avg       0.96      0.96      0.96       190

Trial 51 - Average Validation Accuracy: 0.9614
Fold 1/3 - Validation Accuracy: 0.9368
Classification Report:
              precision    recall  f1-score   support

Non-Repeater       0.93      1.00      0.96       159
    Repeater       1.00      0.61      0.76        31

    accuracy                           0.94       190
   macro avg       0.96      0.81      0.86       190
weighted avg       0.94      0.94      0.93       190

Fold 2/3 - Validation Accuracy: 0.9421
Classification Report:
              precision    recall  f1-score   support

Non-Repeater       0.94      0.99      0.97       159
    Repeater       0.95      0.68      0.79        31

    accuracy                           0.94       190
   macro avg       0.95      0.84      0.88       190
weighted avg       0.94      0.94      0.94       190

Fold 3/3 - Validation Accuracy: 0.9526
Classification Report:
[I 2025-08-31 14:45:44,090] Trial 52 finished with value: 0.943859649122807 and parameters: {'hidden_dim': 1760, 'latent_dim': 39, 'beta': 1.407009940071274, 'gamma': 1.4051770547990592, 'dropout_rate': 0.11966104741184129, 'lr': 0.0018320234259078156, 'scheduler_patience': 7, 'class_weight': 0.3138524946767213, 'activation': 'ReLU', 'classification_multiplier': 8905.012244900494}. Best is trial 44 with value: 0.968421052631579.
[I 2025-08-31 14:46:16,604] Trial 53 finished with value: 0.9631578947368421 and parameters: {'hidden_dim': 1460, 'latent_dim': 36, 'beta': 1.6926744268651406, 'gamma': 1.2548374865448282, 'dropout_rate': 0.22174983794823266, 'lr': 0.0003656845157447952, 'scheduler_patience': 7, 'class_weight': 0.6471078174105201, 'activation': 'ReLU', 'classification_multiplier': 8045.136320233872}. Best is trial 44 with value: 0.968421052631579.
[I 2025-08-31 14:46:44,232] Trial 54 finished with value: 0.943859649122807 and parameters: {'hidden_dim': 1652, 'latent_dim': 37, 'beta': 1.5063864156181328, 'gamma': 1.2396142462113167, 'dropout_rate': 0.2251885824957875, 'lr': 0.0005064616595090886, 'scheduler_patience': 7, 'class_weight': 0.36162108297831536, 'activation': 'ReLU', 'classification_multiplier': 7982.177638291993}. Best is trial 44 with value: 0.968421052631579.
[I 2025-08-31 14:47:10,499] Trial 55 finished with value: 0.956140350877193 and parameters: {'hidden_dim': 1484, 'latent_dim': 30, 'beta': 1.1514363437278865, 'gamma': 1.112764934369229, 'dropout_rate': 0.16462268755125956, 'lr': 0.00016839824399163998, 'scheduler_patience': 6, 'class_weight': 0.5642973397406192, 'activation': 'LeakyReLU', 'classification_multiplier': 8663.208165188924}. Best is trial 44 with value: 0.968421052631579.
[I 2025-08-31 14:47:41,001] Trial 56 finished with value: 0.9614035087719298 and parameters: {'hidden_dim': 1981, 'latent_dim': 33, 'beta': 1.6111858362640539, 'gamma': 1.357036883951515, 'dropout_rate': 0.14181733334952004, 'lr': 0.0011031310787079276, 'scheduler_patience': 7, 'class_weight': 0.7056256085084162, 'activation': 'ReLU', 'classification_multiplier': 9345.932813504705}. Best is trial 44 with value: 0.968421052631579.
[I 2025-08-31 14:48:08,319] Trial 57 finished with value: 0.936842105263158 and parameters: {'hidden_dim': 1624, 'latent_dim': 37, 'beta': 1.7022113393748695, 'gamma': 1.2584285594277957, 'dropout_rate': 0.19199562968006706, 'lr': 0.0005000695372857349, 'scheduler_patience': 6, 'class_weight': 0.4803082890045748, 'activation': 'ELU', 'classification_multiplier': 7740.594868152635}. Best is trial 44 with value: 0.968421052631579.
[I 2025-08-31 14:48:33,809] Trial 58 finished with value: 0.9508771929824561 and parameters: {'hidden_dim': 1375, 'latent_dim': 39, 'beta': 1.281071556212102, 'gamma': 1.4747572705793563, 'dropout_rate': 0.11160725659073481, 'lr': 0.0013039471838224032, 'scheduler_patience': 7, 'class_weight': 0.6375077732805926, 'activation': 'ReLU', 'classification_multiplier': 7176.422757857446}. Best is trial 44 with value: 0.968421052631579.
              precision    recall  f1-score   support

Non-Repeater       0.95      1.00      0.97       158
    Repeater       1.00      0.72      0.84        32

    accuracy                           0.95       190
   macro avg       0.97      0.86      0.90       190
weighted avg       0.96      0.95      0.95       190

Trial 52 - Average Validation Accuracy: 0.9439
Fold 1/3 - Validation Accuracy: 0.9526
Classification Report:
              precision    recall  f1-score   support

Non-Repeater       0.96      0.99      0.97       159
    Repeater       0.92      0.77      0.84        31

    accuracy                           0.95       190
   macro avg       0.94      0.88      0.91       190
weighted avg       0.95      0.95      0.95       190

Fold 2/3 - Validation Accuracy: 0.9684
Classification Report:
              precision    recall  f1-score   support

Non-Repeater       0.97      0.99      0.98       159
    Repeater       0.96      0.84      0.90        31

    accuracy                           0.97       190
   macro avg       0.97      0.92      0.94       190
weighted avg       0.97      0.97      0.97       190

Fold 3/3 - Validation Accuracy: 0.9684
Classification Report:
              precision    recall  f1-score   support

Non-Repeater       0.97      0.99      0.98       158
    Repeater       0.93      0.88      0.90        32

    accuracy                           0.97       190
   macro avg       0.95      0.93      0.94       190
weighted avg       0.97      0.97      0.97       190

Trial 53 - Average Validation Accuracy: 0.9632
Fold 1/3 - Validation Accuracy: 0.9421
Classification Report:
              precision    recall  f1-score   support

Non-Repeater       0.94      0.99      0.97       159
    Repeater       0.95      0.68      0.79        31

    accuracy                           0.94       190
   macro avg       0.95      0.84      0.88       190
weighted avg       0.94      0.94      0.94       190

Fold 2/3 - Validation Accuracy: 0.9421
Classification Report:
              precision    recall  f1-score   support

Non-Repeater       0.94      0.99      0.97       159
    Repeater       0.95      0.68      0.79        31

    accuracy                           0.94       190
   macro avg       0.95      0.84      0.88       190
weighted avg       0.94      0.94      0.94       190

Fold 3/3 - Validation Accuracy: 0.9474
Classification Report:
              precision    recall  f1-score   support

Non-Repeater       0.95      0.99      0.97       158
    Repeater       0.96      0.72      0.82        32

    accuracy                           0.95       190
   macro avg       0.95      0.86      0.90       190
weighted avg       0.95      0.95      0.94       190

Trial 54 - Average Validation Accuracy: 0.9439
Fold 1/3 - Validation Accuracy: 0.9526
Classification Report:
              precision    recall  f1-score   support

Non-Repeater       0.96      0.99      0.97       159
    Repeater       0.92      0.77      0.84        31

    accuracy                           0.95       190
   macro avg       0.94      0.88      0.91       190
weighted avg       0.95      0.95      0.95       190

Fold 2/3 - Validation Accuracy: 0.9632
Classification Report:
              precision    recall  f1-score   support

Non-Repeater       0.96      0.99      0.98       159
    Repeater       0.96      0.81      0.88        31

    accuracy                           0.96       190
   macro avg       0.96      0.90      0.93       190
weighted avg       0.96      0.96      0.96       190

Fold 3/3 - Validation Accuracy: 0.9526
Classification Report:
              precision    recall  f1-score   support

Non-Repeater       0.96      0.99      0.97       158
    Repeater       0.93      0.78      0.85        32

    accuracy                           0.95       190
   macro avg       0.94      0.88      0.91       190
weighted avg       0.95      0.95      0.95       190

Trial 55 - Average Validation Accuracy: 0.9561
Fold 1/3 - Validation Accuracy: 0.9579
Classification Report:
              precision    recall  f1-score   support

Non-Repeater       0.97      0.98      0.97       159
    Repeater       0.90      0.84      0.87        31

    accuracy                           0.96       190
   macro avg       0.93      0.91      0.92       190
weighted avg       0.96      0.96      0.96       190

Fold 2/3 - Validation Accuracy: 0.9632
Classification Report:
              precision    recall  f1-score   support

Non-Repeater       0.96      0.99      0.98       159
    Repeater       0.96      0.81      0.88        31

    accuracy                           0.96       190
   macro avg       0.96      0.90      0.93       190
weighted avg       0.96      0.96      0.96       190

Fold 3/3 - Validation Accuracy: 0.9632
Classification Report:
              precision    recall  f1-score   support

Non-Repeater       0.97      0.99      0.98       158
    Repeater       0.93      0.84      0.89        32

    accuracy                           0.96       190
   macro avg       0.95      0.92      0.93       190
weighted avg       0.96      0.96      0.96       190

Trial 56 - Average Validation Accuracy: 0.9614
Fold 1/3 - Validation Accuracy: 0.9421
Classification Report:
              precision    recall  f1-score   support

Non-Repeater       0.94      0.99      0.97       159
    Repeater       0.95      0.68      0.79        31

    accuracy                           0.94       190
   macro avg       0.95      0.84      0.88       190
weighted avg       0.94      0.94      0.94       190

Fold 2/3 - Validation Accuracy: 0.9263
Classification Report:
              precision    recall  f1-score   support

Non-Repeater       0.93      0.99      0.96       159
    Repeater       0.90      0.61      0.73        31

    accuracy                           0.93       190
   macro avg       0.92      0.80      0.84       190
weighted avg       0.93      0.93      0.92       190

Fold 3/3 - Validation Accuracy: 0.9421
Classification Report:
              precision    recall  f1-score   support

Non-Repeater       0.95      0.98      0.97       158
    Repeater       0.89      0.75      0.81        32

    accuracy                           0.94       190
   macro avg       0.92      0.87      0.89       190
weighted avg       0.94      0.94      0.94       190

Trial 57 - Average Validation Accuracy: 0.9368
Fold 1/3 - Validation Accuracy: 0.9579
Classification Report:
              precision    recall  f1-score   support

Non-Repeater       0.96      0.99      0.98       159
    Repeater       0.93      0.81      0.86        31

    accuracy                           0.96       190
   macro avg       0.94      0.90      0.92       190
weighted avg       0.96      0.96      0.96       190

Fold 2/3 - Validation Accuracy: 0.9474
Classification Report:
              precision    recall  f1-score   support

Non-Repeater       0.95      0.99      0.97       159
    Repeater       0.96      0.71      0.81        31

    accuracy                           0.95       190
   macro avg       0.95      0.85      0.89       190
weighted avg       0.95      0.95      0.94       190

Fold 3/3 - Validation Accuracy: 0.9474
Classification Report:
              precision    recall  f1-score   support

Non-Repeater       0.95      0.99      0.97       158
    Repeater       0.92      0.75      0.83        32

    accuracy                           0.95       190
   macro avg       0.94      0.87      0.90       190
weighted avg       0.95      0.95      0.95       190

Trial 58 - Average Validation Accuracy: 0.9509
Fold 1/3 - Validation Accuracy: 0.9526
Classification Report:
              precision    recall  f1-score   support

Non-Repeater       0.95      1.00      0.97       159
    Repeater       1.00      0.71      0.83        31

    accuracy                           0.95       190
   macro avg       0.97      0.85      0.90       190
weighted avg       0.96      0.95      0.95       190

Fold 2/3 - Validation Accuracy: 0.9526
Classification Report:
[I 2025-08-31 14:48:56,644] Trial 59 finished with value: 0.9526315789473684 and parameters: {'hidden_dim': 952, 'latent_dim': 33, 'beta': 0.9499069322563718, 'gamma': 1.290145228087959, 'dropout_rate': 0.2198652162854822, 'lr': 0.0025836493924494336, 'scheduler_patience': 7, 'class_weight': 0.5171213023913357, 'activation': 'ReLU', 'classification_multiplier': 11425.041071071917}. Best is trial 44 with value: 0.968421052631579.
[I 2025-08-31 14:49:23,167] Trial 60 finished with value: 0.9315789473684211 and parameters: {'hidden_dim': 1506, 'latent_dim': 26, 'beta': 1.4394363630761629, 'gamma': 1.0955868303138514, 'dropout_rate': 0.14397303659622443, 'lr': 0.0033081417891979038, 'scheduler_patience': 5, 'class_weight': 0.9197885147648023, 'activation': 'SELU', 'classification_multiplier': 6475.209334231988}. Best is trial 44 with value: 0.968421052631579.
[I 2025-08-31 14:49:53,207] Trial 61 finished with value: 0.9578947368421052 and parameters: {'hidden_dim': 1951, 'latent_dim': 33, 'beta': 1.617975882596772, 'gamma': 1.3674022933813137, 'dropout_rate': 0.1352016934648599, 'lr': 0.0010889933955727643, 'scheduler_patience': 7, 'class_weight': 0.7035856125715192, 'activation': 'ReLU', 'classification_multiplier': 9401.61934312204}. Best is trial 44 with value: 0.968421052631579.
[I 2025-08-31 14:50:22,884] Trial 62 finished with value: 0.9701754385964912 and parameters: {'hidden_dim': 1900, 'latent_dim': 36, 'beta': 1.5842653187567342, 'gamma': 1.6415406648733024, 'dropout_rate': 0.17447873913621575, 'lr': 0.0006359712913214246, 'scheduler_patience': 7, 'class_weight': 0.7447788540858984, 'activation': 'ReLU', 'classification_multiplier': 10337.123680597248}. Best is trial 62 with value: 0.9701754385964912.
