[I 2025-08-31 16:05:39,683] Trial 232 finished with value: 0.9666666666666667 and parameters: {'hidden_dim': 1577, 'latent_dim': 39, 'beta': 1.8532406658930787, 'gamma': 1.8466155626341476, 'dropout_rate': 0.11434756965234762, 'lr': 0.0001169680465068001, 'scheduler_patience': 7, 'class_weight': 0.9221064668884056, 'activation': 'ReLU', 'classification_multiplier': 11497.3282343035}. Best is trial 111 with value: 0.9719298245614035.
[I 2025-08-31 16:06:11,117] Trial 233 finished with value: 0.9719298245614035 and parameters: {'hidden_dim': 1666, 'latent_dim': 38, 'beta': 1.7728283178486077, 'gamma': 1.8275022385473483, 'dropout_rate': 0.10736986029708834, 'lr': 0.00011382576507881183, 'scheduler_patience': 7, 'class_weight': 0.9626869297621006, 'activation': 'ReLU', 'classification_multiplier': 11793.127549864392}. Best is trial 111 with value: 0.9719298245614035.
[I 2025-08-31 16:06:39,098] Trial 234 finished with value: 0.9701754385964912 and parameters: {'hidden_dim': 1603, 'latent_dim': 38, 'beta': 1.7801696387611199, 'gamma': 1.8158494966955132, 'dropout_rate': 0.10548904676736087, 'lr': 0.0004389444035013528, 'scheduler_patience': 7, 'class_weight': 0.9816222472547196, 'activation': 'ReLU', 'classification_multiplier': 11824.651273070718}. Best is trial 111 with value: 0.9719298245614035.
[I 2025-08-31 16:07:05,817] Trial 235 finished with value: 0.9649122807017544 and parameters: {'hidden_dim': 1555, 'latent_dim': 38, 'beta': 1.7649343729857347, 'gamma': 1.8273260996846672, 'dropout_rate': 0.10683497583064905, 'lr': 0.0004226620501472936, 'scheduler_patience': 7, 'class_weight': 0.9858460985201808, 'activation': 'ReLU', 'classification_multiplier': 11838.763644840632}. Best is trial 111 with value: 0.9719298245614035.
[I 2025-08-31 16:07:34,532] Trial 236 finished with value: 0.9719298245614034 and parameters: {'hidden_dim': 1632, 'latent_dim': 36, 'beta': 1.7877420708700011, 'gamma': 1.7546917201411039, 'dropout_rate': 0.10114604393205688, 'lr': 0.00011187461971150295, 'scheduler_patience': 7, 'class_weight': 0.9607572914969101, 'activation': 'ReLU', 'classification_multiplier': 12072.295877810182}. Best is trial 111 with value: 0.9719298245614035.
[I 2025-08-31 16:08:02,795] Trial 237 finished with value: 0.9701754385964912 and parameters: {'hidden_dim': 1670, 'latent_dim': 39, 'beta': 1.7022031473143506, 'gamma': 1.7516281284603366, 'dropout_rate': 0.10016303333978736, 'lr': 0.0002480504817390703, 'scheduler_patience': 7, 'class_weight': 0.9629366472469246, 'activation': 'ReLU', 'classification_multiplier': 12175.483281267023}. Best is trial 111 with value: 0.9719298245614035.
[I 2025-08-31 16:08:32,443] Trial 238 finished with value: 0.9701754385964912 and parameters: {'hidden_dim': 1619, 'latent_dim': 36, 'beta': 1.8801687793527055, 'gamma': 1.8887378671129043, 'dropout_rate': 0.11248570727444467, 'lr': 0.0002582876450799463, 'scheduler_patience': 7, 'class_weight': 0.9583668008828774, 'activation': 'ReLU', 'classification_multiplier': 12016.976682998731}. Best is trial 111 with value: 0.9719298245614035.
              precision    recall  f1-score   support

Non-Repeater       0.98      0.98      0.98       158
    Repeater       0.91      0.91      0.91        32

    accuracy                           0.97       190
   macro avg       0.94      0.94      0.94       190
weighted avg       0.97      0.97      0.97       190

Trial 232 - Average Validation Accuracy: 0.9667
Fold 1/3 - Validation Accuracy: 0.9579
Classification Report:
              precision    recall  f1-score   support

Non-Repeater       0.97      0.97      0.97       159
    Repeater       0.87      0.87      0.87        31

    accuracy                           0.96       190
   macro avg       0.92      0.92      0.92       190
weighted avg       0.96      0.96      0.96       190

Fold 2/3 - Validation Accuracy: 0.9789
Classification Report:
              precision    recall  f1-score   support

Non-Repeater       0.98      0.99      0.99       159
    Repeater       0.97      0.90      0.93        31

    accuracy                           0.98       190
   macro avg       0.97      0.95      0.96       190
weighted avg       0.98      0.98      0.98       190

Fold 3/3 - Validation Accuracy: 0.9789
Classification Report:
              precision    recall  f1-score   support

Non-Repeater       0.98      0.99      0.99       158
    Repeater       0.97      0.91      0.94        32

    accuracy                           0.98       190
   macro avg       0.97      0.95      0.96       190
weighted avg       0.98      0.98      0.98       190

Trial 233 - Average Validation Accuracy: 0.9719
Fold 1/3 - Validation Accuracy: 0.9632
Classification Report:
              precision    recall  f1-score   support

Non-Repeater       0.97      0.98      0.98       159
    Repeater       0.90      0.87      0.89        31

    accuracy                           0.96       190
   macro avg       0.94      0.93      0.93       190
weighted avg       0.96      0.96      0.96       190

Fold 2/3 - Validation Accuracy: 0.9789
Classification Report:
              precision    recall  f1-score   support

Non-Repeater       0.98      0.99      0.99       159
    Repeater       0.97      0.90      0.93        31

    accuracy                           0.98       190
   macro avg       0.97      0.95      0.96       190
weighted avg       0.98      0.98      0.98       190

Fold 3/3 - Validation Accuracy: 0.9684
Classification Report:
              precision    recall  f1-score   support

Non-Repeater       0.97      0.99      0.98       158
    Repeater       0.93      0.88      0.90        32

    accuracy                           0.97       190
   macro avg       0.95      0.93      0.94       190
weighted avg       0.97      0.97      0.97       190

Trial 234 - Average Validation Accuracy: 0.9702
Fold 1/3 - Validation Accuracy: 0.9632
Classification Report:
              precision    recall  f1-score   support

Non-Repeater       0.97      0.99      0.98       159
    Repeater       0.93      0.84      0.88        31

    accuracy                           0.96       190
   macro avg       0.95      0.91      0.93       190
weighted avg       0.96      0.96      0.96       190

Fold 2/3 - Validation Accuracy: 0.9632
Classification Report:
              precision    recall  f1-score   support

Non-Repeater       0.96      0.99      0.98       159
    Repeater       0.96      0.81      0.88        31

    accuracy                           0.96       190
   macro avg       0.96      0.90      0.93       190
weighted avg       0.96      0.96      0.96       190

Fold 3/3 - Validation Accuracy: 0.9684
Classification Report:
              precision    recall  f1-score   support

Non-Repeater       0.98      0.98      0.98       158
    Repeater       0.91      0.91      0.91        32

    accuracy                           0.97       190
   macro avg       0.94      0.94      0.94       190
weighted avg       0.97      0.97      0.97       190

Trial 235 - Average Validation Accuracy: 0.9649
Fold 1/3 - Validation Accuracy: 0.9526
Classification Report:
              precision    recall  f1-score   support

Non-Repeater       0.97      0.97      0.97       159
    Repeater       0.84      0.87      0.86        31

    accuracy                           0.95       190
   macro avg       0.91      0.92      0.91       190
weighted avg       0.95      0.95      0.95       190

Fold 2/3 - Validation Accuracy: 0.9789
Classification Report:
              precision    recall  f1-score   support

Non-Repeater       0.98      0.99      0.99       159
    Repeater       0.97      0.90      0.93        31

    accuracy                           0.98       190
   macro avg       0.97      0.95      0.96       190
weighted avg       0.98      0.98      0.98       190

Fold 3/3 - Validation Accuracy: 0.9842
Classification Report:
              precision    recall  f1-score   support

Non-Repeater       0.99      0.99      0.99       158
    Repeater       0.97      0.94      0.95        32

    accuracy                           0.98       190
   macro avg       0.98      0.97      0.97       190
weighted avg       0.98      0.98      0.98       190

Trial 236 - Average Validation Accuracy: 0.9719
Fold 1/3 - Validation Accuracy: 0.9632
Classification Report:
              precision    recall  f1-score   support

Non-Repeater       0.97      0.98      0.98       159
    Repeater       0.90      0.87      0.89        31

    accuracy                           0.96       190
   macro avg       0.94      0.93      0.93       190
weighted avg       0.96      0.96      0.96       190

Fold 2/3 - Validation Accuracy: 0.9789
Classification Report:
              precision    recall  f1-score   support

Non-Repeater       0.98      0.99      0.99       159
    Repeater       0.97      0.90      0.93        31

    accuracy                           0.98       190
   macro avg       0.97      0.95      0.96       190
weighted avg       0.98      0.98      0.98       190

Fold 3/3 - Validation Accuracy: 0.9684
Classification Report:
              precision    recall  f1-score   support

Non-Repeater       0.97      0.99      0.98       158
    Repeater       0.93      0.88      0.90        32

    accuracy                           0.97       190
   macro avg       0.95      0.93      0.94       190
weighted avg       0.97      0.97      0.97       190

Trial 237 - Average Validation Accuracy: 0.9702
Fold 1/3 - Validation Accuracy: 0.9579
Classification Report:
              precision    recall  f1-score   support

Non-Repeater       0.97      0.97      0.97       159
    Repeater       0.87      0.87      0.87        31

    accuracy                           0.96       190
   macro avg       0.92      0.92      0.92       190
weighted avg       0.96      0.96      0.96       190

Fold 2/3 - Validation Accuracy: 0.9842
Classification Report:
              precision    recall  f1-score   support

Non-Repeater       0.99      0.99      0.99       159
    Repeater       0.97      0.94      0.95        31

    accuracy                           0.98       190
   macro avg       0.98      0.96      0.97       190
weighted avg       0.98      0.98      0.98       190

Fold 3/3 - Validation Accuracy: 0.9684
Classification Report:
              precision    recall  f1-score   support

Non-Repeater       0.99      0.97      0.98       158
    Repeater       0.88      0.94      0.91        32

    accuracy                           0.97       190
   macro avg       0.93      0.96      0.94       190
weighted avg       0.97      0.97      0.97       190

Trial 238 - Average Validation Accuracy: 0.9702
Fold 1/3 - Validation Accuracy: 0.9316
Classification Report:
              precision    recall  f1-score   support

Non-Repeater       0.96      0.96      0.96       159
    Repeater       0.80      0.77      0.79        31

    accuracy                           0.93       190
   macro avg       0.88      0.87      0.87       190
weighted avg       0.93      0.93      0.93       190

Fold 2/3 - Validation Accuracy: 0.9474
Classification Report:
[I 2025-08-31 16:09:00,606] Trial 239 finished with value: 0.9421052631578947 and parameters: {'hidden_dim': 1737, 'latent_dim': 35, 'beta': 1.8116266289177176, 'gamma': 1.7880910050985774, 'dropout_rate': 0.10055105178806717, 'lr': 0.00010711056002431956, 'scheduler_patience': 7, 'class_weight': 0.9400568720632857, 'activation': 'ELU', 'classification_multiplier': 12712.681632748468}. Best is trial 111 with value: 0.9719298245614035.
[I 2025-08-31 16:09:30,132] Trial 240 finished with value: 0.9666666666666667 and parameters: {'hidden_dim': 1702, 'latent_dim': 37, 'beta': 1.9393335315280613, 'gamma': 1.735983987784801, 'dropout_rate': 0.11312854639334873, 'lr': 0.00011371303047478559, 'scheduler_patience': 7, 'class_weight': 0.9999313465637373, 'activation': 'ReLU', 'classification_multiplier': 11595.387326764801}. Best is trial 111 with value: 0.9719298245614035.
[I 2025-08-31 16:09:57,024] Trial 241 finished with value: 0.9666666666666667 and parameters: {'hidden_dim': 1610, 'latent_dim': 39, 'beta': 1.7506974522223944, 'gamma': 1.8348239254730578, 'dropout_rate': 0.107683504313452, 'lr': 0.0004564180661840461, 'scheduler_patience': 7, 'class_weight': 0.9788843185391448, 'activation': 'ReLU', 'classification_multiplier': 11811.788754063227}. Best is trial 111 with value: 0.9719298245614035.
[I 2025-08-31 16:10:26,074] Trial 242 finished with value: 0.9614035087719298 and parameters: {'hidden_dim': 1649, 'latent_dim': 38, 'beta': 1.4965255988478898, 'gamma': 1.7981197572583025, 'dropout_rate': 0.10815317547753453, 'lr': 0.00039822336206759705, 'scheduler_patience': 7, 'class_weight': 0.9668932136049263, 'activation': 'ReLU', 'classification_multiplier': 12404.354298848133}. Best is trial 111 with value: 0.9719298245614035.
[I 2025-08-31 16:10:53,919] Trial 243 finished with value: 0.9666666666666667 and parameters: {'hidden_dim': 1579, 'latent_dim': 40, 'beta': 1.7787158248108543, 'gamma': 1.8651010396709413, 'dropout_rate': 0.11758901884721948, 'lr': 0.0005964318834915074, 'scheduler_patience': 7, 'class_weight': 0.9798525392603362, 'activation': 'ReLU', 'classification_multiplier': 12041.25176956264}. Best is trial 111 with value: 0.9719298245614035.
[I 2025-08-31 16:11:21,176] Trial 244 finished with value: 0.968421052631579 and parameters: {'hidden_dim': 1615, 'latent_dim': 39, 'beta': 1.805491879828922, 'gamma': 1.6950106571478802, 'dropout_rate': 0.10758501550638354, 'lr': 0.00010011184615127225, 'scheduler_patience': 7, 'class_weight': 0.9545037924672954, 'activation': 'ReLU', 'classification_multiplier': 11389.08922867876}. Best is trial 111 with value: 0.9719298245614035.
